sent_id,entity1,entity2,sent,processed_sent,label,hard_match
TRAIN_SENT_ID_255300,卫夫人,王羲之,钟繇 是 今天 流行 的 楷书 的 创始者 ， 书法 界 有 一种 说法 ， 说 “ 书圣 ” 王羲之 的 书 法学 自卫 夫人 ， 而 卫夫人 学自 钟繇 。,钟繇 今天 流行 楷书 创始者  书法 界 一种 说法  说  书圣  人物二 书 法学 自卫 夫人  人物一 学自 钟繇,1,0
TRAIN_SENT_ID_250421,赵飞燕,赵合德,话 说 到 这个 地步 ， 赵飞燕 不敢 再 接口 ， 赵合德 也 没法 继续 ， 姐妹俩 狠狠 地 盯 着 对方 ， 半晌 没有 做声 。,话 说 地步  人物一 不敢 接口  人物二 没法 继续  姐妹俩 狠狠 盯  半晌 没有 做声,-1,1
TRAIN_SENT_ID_275927,孙莹莹,孙芸芸,20121221 姐妹 掏心 话 — — 私生活 多 疯狂 揭开 台湾 第一名 媛 的 真面目 嘉宾 : 孙芸芸 孙莹莹 廖晓乔,姐妹 掏心 话   私生活 疯狂 揭开 台湾 第一名 媛 真面目 嘉宾  人物二 人物一 廖晓乔,-1,0
TRAIN_SENT_ID_257498,姜昆,马季,相声 ： 赵炎 、 马季 、 李文华 、 姜昆 、 侯耀文 、 石富宽 、 侯宝林 （ 已故 · 录像 ） 、 郭全宝 （ 已故 · 录像 ） 等 。,相声  赵炎  人物二  李文华  人物一  侯耀文  石富宽  侯宝林  已故  录像   郭全宝  已故  录像,1,0
TRAIN_SENT_ID_273627,马阔海,马青山,召唤 人 ： 马阔海 、 李子 、 马青山 、 柯胜,召唤  人物一  李子  人物二  柯胜,-1,0
TRAIN_SENT_ID_273366,杨锐,张之洞,五 、 张之洞 营救 杨锐 的 行动,五  人物二 营救 人物一 行动,1,0
TRAIN_SENT_ID_249240,皮皮鲁,鲁西西,皮皮鲁 、 鲁西西 、 大灰狼 罗克 、 舒克和贝塔 是 他 笔下 文学 形象 。,人物一  人物二  大灰狼 罗克  舒克和贝塔 笔下 文学 形象,-1,0
TRAIN_SENT_ID_275687,欧阳娣娣,欧阳妮妮,2014 / 01 / 18 萧煌奇 、 欧阳龙 、 傅娟 、 欧阳妮妮 、 欧阳娜娜 、 欧阳娣娣 、 曾心梅 、 林俊吉 、 马世莉 、 杨绣惠,萧煌奇  欧阳龙  傅娟  人物二  欧阳娜娜  人物一  曾心梅  林俊吉  马世莉  杨绣惠,-1,0
TRAIN_SENT_ID_259637,公孙胜,罗真人,第五十三回 戴宗 二取 公孙胜 李逵 斧劈 罗真人,第五十三回 戴宗 二取 人物一 李逵 斧劈 人物二,1,0
TRAIN_SENT_ID_260959,杨露禅,陈长兴,当 所有 矛头 都 指向 杨露禅 一人 的 时候 ， 深谋远虑 的 掌门人 陈长兴 亲手 拆穿 了 儿子 栽秧 的 诡计 ： 他 用 花样百出 的 科学 手法 伪装成 武功 高手 。,矛头 指向 人物一 一人  深谋远虑 掌门人 人物二 亲手 拆穿 儿子 栽秧 诡计  花样百出 科学 手法 伪装成 武功 高手,1,0
TRAIN_SENT_ID_248968,吕洞宾,韩湘子,东面 左边 是 韩湘子 、 何仙姑 ， 右边 是 张果老 、 吕洞宾 ， 西面 左边 是 铁拐李 、 曹国舅 ， 右边 是 兰采 和 、 汉 钟离 。,东面 左边 人物二  何仙姑  右边 张果老  人物一  西面 左边 铁拐李  曹国舅  右边 兰采  汉 钟离,1,0
TRAIN_SENT_ID_274311,习乾平,习近平,习乾平 ， 女 ， 是 无产阶级 革命家 、 政治家 、 原 党和国家 领导人 习仲勋 之女 ， 是 党和国家 最高 领导人 习近平 的 同父异母 的 姐姐 。,人物一  女  无产阶级 革命家  政治家  原 党和国家 领导人 习仲勋 之女  党和国家 最高 领导人 人物二 同父异母 姐姐,-1,0
TRAIN_SENT_ID_252713,颜回,孔子,◎ 颜回 将 西游 ， 问于 孔子 曰 ： 「 何以 为身 ？,◎ 人物一 西游  问于 人物二 曰   为身,1,0
TRAIN_SENT_ID_265731,李三思,李三省,李大娘 — — “ 铁掌 飞凤 ” 孙岚 、 李三思 孪生 弟弟 李三省 的 妻子 、 李逍遥 的 婶婶,李大娘    铁掌 飞凤  孙岚  人物一 孪生 弟弟 人物二 妻子  李逍遥 婶婶,-1,0
TRAIN_SENT_ID_275832,陆无双,李莫愁,以 这样 的 性格 ， 如 和 陆无双 掉换 境遇 ， 恐怕 她 绝 不肯 曲意 讨好 李莫愁 。,性格  人物一 掉换 境遇  恐怕 绝 不肯 曲意 讨好 人物二,1,0
TRAIN_SENT_ID_261666,程英,陆无双,8 陆无双 和 程英 / 80,人物二 人物一,-1,0
TRAIN_SENT_ID_275200,陈有汉,陈有庆,陈智思 的 祖父 陈弼臣 、 父亲 陈有庆 、 叔父 陈有汉 都 是 国际 著名 金融家 。,陈智思 祖父 陈弼臣  父亲 人物二  叔父 人物一 国际 著名 金融家,-1,0
TRAIN_SENT_ID_276991,樊迟,孔子,孔子 的 仁学 思想 最 基本 、 最 核心 的 宗旨 就是 “ 爱人 ” （ 《 论语 · 颜渊 》 ） ： “ 樊迟 问仁 ， 孔 曰 ： 爱人 。 ”,人物二 仁学 思想 基本  核心 宗旨  爱人    论语  颜渊     人物一 问仁  孔 曰  爱人,1,0
TRAIN_SENT_ID_259661,公孙胜,罗真人,5 、 明 施耐庵 《 水浒 》 第五十三回 《 戴宗 二取 公孙胜 李逵 独劈 罗真人 》 今番 教 戴宗 可去 绕 蓟州管 下 山川 去处 寻觅 一遭 ， 不 愁 不见 他 。,明 施耐庵  水浒  第五十三回  戴宗 二取 人物一 李逵 独劈 人物二  今番 教 戴宗 可去 绕 蓟州管 山川 去处 寻觅 一遭  愁 不见,1,0
TRAIN_SENT_ID_258138,刘星,夏雪,亲人 ： 夏祥 （ 父亲 ） 、 刘梅 （ 现任 老婆 ） 、 玛丽 （ 前妻 ） 、 刘星 、 夏雨 （ 儿子 ） 、 夏雪 （ 女儿 ）,亲人  夏祥  父亲   刘梅  现任 老婆   玛丽  前妻   人物一  夏雨  儿子   人物二  女儿,-1,0
TRAIN_SENT_ID_274182,田虎,田猛,在 烈山 堂堂 主 田猛 葬礼 上 随着 堂主 田虎 前来 吊唁 。,烈山 堂堂 主 人物二 葬礼 堂主 人物一 前来 吊唁,-1,0
TRAIN_SENT_ID_270803,伍天锡,伍云召,第十九回 太行山 伍天锡 鏖兵 关王庙 伍云召 寄子 第二十回 韩擒虎 收兵 复旨 程咬金 逢 赦 回家,第十九回 太行山 人物一 鏖兵 关王庙 人物二 寄子 第二十回 韩擒虎 收兵 复旨 程咬金 逢 赦 回家,-1,0
TRAIN_SENT_ID_268911,司徒静,司徒剑南,司徒剑南 第十六集 : 司徒静 见到 朱允 ， 晓以大义 ， 朱允 如梦方醒 。,人物二 第十六集  人物一 见到 朱允  晓以大义  朱允 如梦方醒,-1,0
TRAIN_SENT_ID_278784,万寿公主,广德公主,（ 唐宣宗 长女 ） : 万寿公主 ， 唐宣宗 长女 ， 母 元昭皇后 晁氏 ， 同 母弟 唐懿宗 ， 母妹 广德公主 。,唐宣宗 长女   人物一  唐宣宗 长女  母 元昭皇后 晁氏  母弟 唐懿宗  母妹 人物二,-1,0
TRAIN_SENT_ID_253020,颜回,孔子,孔子 圣人 也 ， 颜回 已下 十哲 ， 希 圣者 也 ， 更相 称赞 ， 为 党乎 ？,人物二 圣人  人物一 已下 十哲  希 圣者  更相 称赞  党乎,1,0
TRAIN_SENT_ID_257428,姜昆,马季,马季 、 姜昆 、 唐杰忠 、 李金斗 、 常贵田 、 笑林 等 相声 名家 均 将 登台 亮相 ， 评书 名家 单田芳 也 加盟 演出 。,人物二  人物一  唐杰忠  李金斗  常贵田  笑林 相声 名家 均 登台 亮相  评书 名家 单田芳 加盟 演出,1,0
TRAIN_SENT_ID_252574,颜回,孔子,《 索引 》 ： “ 苍蝇附骥 尾而致 千里 ， 以 譬 颜回 因 孔子 而 名彰 也 。 ”,索引    苍蝇附骥 尾而致 千里  譬 人物一 人物二 名彰,1,0
TRAIN_SENT_ID_252607,颜回,孔子,孝理 这 东西 可谓 博大精深 ， 只有 大贤 之 人才 能 懂得 其中 的 奥妙 ， 为什么 孔子 不 对 颜回 传授 ， 而 要 寄托 给 曾 参 呢 ？ ”,孝理 东西 可谓 博大精深  大贤 人才 懂得 奥妙  人物二 人物一 传授  寄托 参,1,0
TRAIN_SENT_ID_255316,卫夫人,王羲之,晋 王羲之 《 题 卫夫人 笔阵 图后 》 ： “ 每作 一波 ， 常三过 折笔 。 ”,晋 人物二  题 人物一 笔阵 图后    每作 一波  常三过 折笔,1,0
TRAIN_SENT_ID_266040,贾珍,贾惜春,贾惜春 ， 贾敬 的 女儿 ， 贾珍 的 胞妹 。,人物二  贾敬 女儿  人物一 胞妹,-1,0
TRAIN_SENT_ID_274115,欧阳娣娣,欧阳娜娜,2014 / 01 / 18 萧煌奇 、 欧阳龙 、 傅娟 、 欧阳妮妮 、 欧阳娜娜 、 欧阳娣娣 、 曾心梅 、 林俊吉 、 马世莉 、 杨绣惠,萧煌奇  欧阳龙  傅娟  欧阳妮妮  人物二  人物一  曾心梅  林俊吉  马世莉  杨绣惠,-1,0
TRAIN_SENT_ID_266302,马元中,马唯中,马英九 在 美国 留学 期间 和 周美 青 结婚 ， 后育 有 两位 女儿 ， 马唯中 、 马元中 ； 同时 ， 参加 了 由 国民党 组织 的 右派 的 反共 爱国 联盟 。,马英九 美国 留学 期间 周美 青 结婚  后育 两位 女儿  人物二  人物一   参加 国民党 组织 右派 反共 爱国 联盟,-1,0
TRAIN_SENT_ID_274114,欧阳娣娣,欧阳娜娜,2013 / 04 / 20 动力火车 、 欧阳龙 、 傅娟 、 欧阳娜娜 、 欧阳妮妮 、 欧阳娣娣 、 澎 恰恰 、 王予柔,动力火车  欧阳龙  傅娟  人物二  欧阳妮妮  人物一  澎 恰恰  王予柔,-1,-1
TRAIN_SENT_ID_253838,赵合德,赵飞燕,但 在 赵飞燕 、 赵合德 姐妹 入宫 后 而 受 排挤 失宠 ， 求 供养 太后 于 长信 宫 。,人物二  人物一 姐妹 入宫 受 排挤 失宠  求 供养 太后 长信 宫,-1,0
TRAIN_SENT_ID_251528,陈辅,陈靖仇,陈辅 是 陈靖仇 的 师傅 。,人物一 人物二 师傅,1,0
TRAIN_SENT_ID_268886,司徒静,司徒剑南,司徒静 和 司徒剑南 都 以为 是 对方 所射 。,人物一 人物二 所射,-1,0
TRAIN_SENT_ID_271294,吕祖俭,吕祖谦,吕夷简 家族 成员 : 吕夷简 的 儿子 吕公著 ， 亦 官至 宰相 ， 七 世孙 吕祖谦 、 吕祖俭 都 是 南宋 著名 大儒 。,吕夷简 家族 成员  吕夷简 儿子 吕公著  官至 宰相  七 世孙 人物二  人物一 南宋 著名 大儒,-1,0
TRAIN_SENT_ID_273616,宇文炎,宇文士,与此同时 ， 宇文 锦辰 的 三个 儿子 ： 宇文 任 、 宇文炎 、 宇文士 也 具备 了 独立 比赛 的 能力 。,宇文 锦辰 三个 儿子  宇文  人物一  人物二 具备 独立 比赛 能力,-1,0
TRAIN_SENT_ID_255423,罗成,秦琼,020 回 （ 秦琼 与 罗成 传枪 递锏 ）,回  人物二 人物一 传枪 递锏,-1,0
TRAIN_SENT_ID_262222,尤二姐,尤三姐,一个 叫 尤二姐 ， 一个 叫 尤三姐 。,一个 人物一  一个 人物二,-1,0
TRAIN_SENT_ID_250102,武敦儒,武修文,与 杨过 对比 ， 武敦儒 、 武修文 更显 脓包 、 废物 。,杨过  人物一  人物二 更显 脓包  废物,-1,0
TRAIN_SENT_ID_255313,卫夫人,王羲之,（ 词语 ） : 晋 王羲之 《 题 卫夫人 笔阵 图后 》 ： “ 每作 一点 ， 如 高峰 坠石 。 ”,词语   晋 人物二  题 人物一 笔阵 图后    每作 一点  高峰 坠石,1,0
TRAIN_SENT_ID_273619,马阔海,马青山,召唤 人 ： 萧风 （ 主要 铠甲 召唤 人 ） 、 端木燕 、 马青山 、 马阔海 （ 电影版 ）,召唤  萧风  主要 铠甲 召唤   端木燕  人物二  人物一  电影版,-1,0
TRAIN_SENT_ID_267519,裘千丈,裘千仞,248 【 裘千仞 ， 裘千丈 】,人物二  人物一,-1,0
TRAIN_SENT_ID_259358,葛玄,左慈,可见 ， 左慈 、 葛玄 、 郑隐 、 葛洪 、 葛巢甫 等 人 ， 并非 「 共同 尊尚 特定 的 道典 」 。,人物二  人物一  郑隐  葛洪  葛巢甫   共同 尊尚 特定 道典,1,0
TRAIN_SENT_ID_281965,梁经纶,何其沧,方步 亭 在 何其沧 家 见到 梁经纶 ， 告诉 他 谢木兰 已死 的 消息 ， 而 谢培东 和 方孟敖 都 是 共产党 。,方步 亭 人物二 家 见到 人物一  告诉 谢木兰 已死 消息  谢培东 方孟敖 共产党,1,0
TRAIN_SENT_ID_266698,龙幽,龙溟,对于 哥哥 龙溟 ， 龙幽 相当 依赖 。,哥哥 人物二  人物一 相当 依赖,-1,0
TRAIN_SENT_ID_273637,姜子牙,元始天尊,正一道 人死 后 ， 奉 元始天尊 命 代理 封神 ， 便 投生 转世 为 姜子牙 ， 辅助 周室 消灭 商纣 。,正一道 人死  奉 人物二 命 代理 封神  便 投生 转世 人物一  辅助 周室 消灭 商纣,1,0
TRAIN_SENT_ID_268457,单联全,冯一非,就 这样 ， 冯一非 2002 年 一 毕业 便 来到 大连 ， 成为 素以 严谨 著称 的 单联全 唯一 的 学生 。,人物二  年 毕业 便 来到 大连  成为 素以 严谨 著称 人物一 唯一 学生,1,0
TRAIN_SENT_ID_277639,方天翼,顾婷,随后 ， 几人 转战 上海 ， 廖思成 为 救 大岛 由美 不幸身亡 ， 方天翼 和 顾婷 加入 新四军 。,几人 转战 上海  廖思成 救 大岛 由美 不幸身亡  人物一 人物二 加入 新四军,-1,0
TRAIN_SENT_ID_273625,马阔海,马青山,召唤 人 ： 柯胜 （ 主要 铠甲 召唤 人 ） 、 小 李子 、 马青山 、 马阔海,召唤  柯胜  主要 铠甲 召唤   李子  人物二  人物一,-1,0
TRAIN_SENT_ID_284903,陆启铿,华罗庚,陆启铿 与 华罗庚 合作 发表 了 《 典型 域 的 调和函数 论 》 论文 ， 建立 了 典型 域 上 调和函数 的 系统 理论 。,人物一 人物二 合作 发表  典型 域 调和函数  论文  建立 典型 域 调和函数 系统 理论,1,0
TRAIN_SENT_ID_251867,曹薰铉,李昌镐,横纲 李昌镐 ( 韩国 ) 曹薰铉 ( 韩国 ),横纲 人物二  韩国  人物一  韩国,1,0
TRAIN_SENT_ID_268460,单联全,冯一非,编剧 ： 冯一非 、 单联全,编剧  人物二  人物一,1,0
TRAIN_SENT_ID_269401,刘伟,马季,《 数字 与 生活 》 表演者 ： 刘伟 、 马季,数字 生活  表演者  人物一  人物二,1,0
TRAIN_SENT_ID_282231,王辰,王岩,王辰 王岩 进入 洞府 ， 其他人 去 领悟 各自 机缘 。,人物一 人物二 进入 洞府  其他人 领悟 机缘,-1,0
TRAIN_SENT_ID_256901,仲由,孔子,仲 村镇 简介 : 仲村 是 一代 圣贤 孔子 的 得意门生 仲由 的 故里 ， 是 历史 上 的 四大 文明 古镇 之一 。,仲 村镇 简介  仲村 一代 圣贤 人物二 得意门生 人物一 故里  历史 四大 文明 古镇,1,0
TRAIN_SENT_ID_257236,艾欧里亚,艾俄洛斯,于是 ， 她 亲自 来到 艾欧里亚 岛 ， 命令 艾俄洛斯 放出 诸风 ， 使 埃涅阿斯 的 船队 彻底 倾覆 。,亲自 来到 人物一 岛  命令 人物二 放出 诸风  埃涅阿斯 船队 彻底 倾覆,-1,0
TRAIN_SENT_ID_267794,万剑一,林惊羽,2 武器 : 1 、 小说 《 诛仙 》 林惊羽 佩剑 ， 也 是 九天 神兵 ， 原 持有者 为 青云 不 出世 的 奇才 万剑一 。,武器    小说  诛仙  人物二 佩剑  九天 神兵  原 持有者 青云 出世 奇才 人物一,1,0
TRAIN_SENT_ID_269354,王中军,王中磊,企业 领袖 ： 柳传志 、 李彦宏 、 马化腾 、 牛根生 、 陈旭东 、 虞锋 、 王中军 、 王中磊 、 冯东明 、 于冬 、 邹其方 …,企业 领袖  柳传志  李彦宏  马化腾  牛根生  陈旭东  虞锋  人物一  人物二  冯东明  于冬  邹其方,-1,0
TRAIN_SENT_ID_275933,李华,寿昌公主,刘皇后 ， 结发 之妻 ， 正室 ； 生 嫡长子 李宪 （ 后 追 谥 让 皇帝 ） 、 寿昌公主 、 代国 公主 李华 婉 ， 被 武则天 勒令 处死 ， 追 谥 为 肃明 顺圣 皇后,刘皇后  结发 之妻  正室  生 嫡长子 李宪  追 谥 皇帝   人物二  代国 公主 人物一 婉  武则天 勒令 处死  追 谥 肃明 顺圣 皇后,-1,0
TRAIN_SENT_ID_259784,李偲菘,李伟菘,此张 专辑 是 由 李偲菘 、 李伟菘 ， 孙燕姿 ， 共同完成 整张 专辑 的 制作 。,此张 专辑 人物一  人物二  孙燕姿  共同完成 整张 专辑 制作,-1,0
TRAIN_SENT_ID_257469,姜昆,马季,姜昆 、 马季 、 刘晓庆 、 王景愚,人物一  人物二  刘晓庆  王景愚,1,0
TRAIN_SENT_ID_277755,宋玉华,宋玉致,第三 百 九十七 章 宋玉致 的 殇 ， 宋玉华 的 刀,第三 百 九十七 章 人物二 殇  人物一 刀,-1,0
TRAIN_SENT_ID_264933,贾元春,贾宝玉,3.2 . 贾政 生 贾珠 、 贾元春 、 贾宝玉 ( 王夫人 所 生 ) 、 贾探春 ( 赵姨娘 所 生 ) 、 贾环 ( 赵姨娘 所 生 ) ；,贾政 生 贾珠  人物一  人物二  王夫人 生   贾探春  赵姨娘 生   贾环  赵姨娘 生,-1,0
TRAIN_SENT_ID_250116,武敦儒,武修文,第一章 介绍 ： 那 摔破 额角 的 叫做 武敦儒 ， 是 哥哥 ， 弟弟 叫做 武修文 。,第一章 介绍  摔破 额角 叫做 人物一  哥哥  弟弟 叫做 人物二,-1,-1
TRAIN_SENT_ID_284526,易水寒,白非凡,儿子 ： 白非凡 、 易水寒,儿子  人物二  人物一,-1,0
TRAIN_SENT_ID_261625,宋小宝,赵本山,2012 - 02 - 19 ： 樱桃 （ 38 集 ） 「 沈春阳 ， 宋小宝 ， 赵本山 ， 小 沈阳 」,樱桃   集   沈春阳  人物一  人物二  沈阳,1,0
TRAIN_SENT_ID_249542,李蔡,李广,李广 死 第二年 ， 李蔡 因罪 自杀 。,人物二 死 第二年  人物一 因罪 自杀,-1,0
TRAIN_SENT_ID_252697,颜回,孔子,"他 一身 静气 、 湛然 似 水 , 不动 如山 、 从容 自 在 , 他 是 孔子 最 得意 的 门生 - 颜回 。",一身 静气  湛然 似 水  不动 如山  从容  人物二 得意 门生  人物一,1,0
TRAIN_SENT_ID_251426,李瀚章,李鸿章,有 一回 ， 大清早 ， 曾国藩 有 文件 要 写 ， 李鸿章 却 不巧 出去 了 ， 没奈何 只好 叫 李瀚章 写 。,一回  大清早  曾国藩 文件 写  人物二 不巧 出去  只好 人物一 写,-1,0
TRAIN_SENT_ID_252978,颜回,孔子,另外 ， 他 从前 与 平民 祢衡 在 一起 行为 放荡 ， 互相标榜 ， 祢衡 称赞 孔融 为 ‘ 孔子 不死 ’ ， 孔融 称赞 祢衡 是 ‘ 颜回 复生 ’ 。,从前 平民 祢衡 一起 行为 放荡  互相标榜  祢衡 称赞 孔融  人物二 不死   孔融 称赞 祢衡  人物一 复生,1,0
TRAIN_SENT_ID_271286,马季,侯宝林,张寿臣 小 蘑菇 常宝堃 侯宝林 侯一尘 孙玉奎 马季 马三立 老舍 改 相声 相声 作者 何迟,张寿臣 蘑菇 常宝堃 人物二 侯一尘 孙玉奎 人物一 马三立 老舍 改 相声 相声 作者 何迟,1,0
TRAIN_SENT_ID_273702,姜子牙,元始天尊,武王灭 商后 ， 姜子牙 奉命 太上老君 及 元始天尊 敕令 封神 。,武王灭 商后  人物一 奉命 太上老君 人物二 敕令 封神,1,0
TRAIN_SENT_ID_261668,程英,陆无双,陆无双 改为 陆展元 与 何沅君 之女 ， 且 与 程英 并非 表姊妹 。,人物二 改为 陆展元 何沅君 之女  人物一 表姊妹,-1,0
TRAIN_SENT_ID_283485,俞莲舟,张三丰,武当派 历来 高手如云 ， 前有 张三丰 ， 后 又 宋远桥 、 俞莲舟 、 俞岱岩 等 。,武当派 历来 高手如云  前有 人物二  宋远桥  人物一  俞岱岩,1,0
TRAIN_SENT_ID_264586,凌波,凌音,《 仙剑 奇侠传 五 》 凌音 、 凌波,仙剑 奇侠传 五  人物二  人物一,-1,0
TRAIN_SENT_ID_260587,金敬姬,金正日,小池 百合 子 写道 ： “ 金正日 对 唯一 胞妹 金敬姬 信任 有加 。,小池 百合 子 写道   人物二 唯一 胞妹 人物一 信任 有加,-1,0
TRAIN_SENT_ID_262197,陈靖仇,陈辅,捕 陈氏 遗族 ， 陈辅 以 自己 唯一 孙儿 当 代替品 ， 救出 襁褓 中 的 陈靖仇 ， 带 往 江南 隐姓埋名 ， 并 将 复国 重任 全 寄托 在 这位 小少主 的 身上 。,捕 陈氏 遗族  人物二 唯一 孙儿 代替品  救出 襁褓 中 人物一  带 江南 隐姓埋名  复国 重任 全 寄托 这位 小少主 身上,1,0
TRAIN_SENT_ID_250113,武敦儒,武修文,徒孙 ： 郭 芙 、 郭襄 、 郭破虏 、 武修文 、 武敦儒,徒孙  郭 芙  郭襄  郭破虏  人物二  人物一,-1,0
TRAIN_SENT_ID_282571,尹寿山,马德禄,马德禄 ― ― 高寿亭 、 高桂清 、 杨 闻华 、 尹寿山 、 郭荣起,人物二 ― ― 高寿亭  高桂清  杨 闻华  人物一  郭荣起,1,0
TRAIN_SENT_ID_264361,曾国潢,曾国藩,曾国藩 因与弟 曾国葆 有 隙 ， 想以 代为 建房 而弃 前嫌 ， 故令 四弟 曾国潢 寻宝 地 ， 故 曾家 以 三十卷 谷 与 王玉阶 兑得此 屋堂 地 各 三间 草房 。,人物二 因与弟 曾国葆 隙  想以 代为 建房 而弃 前嫌  故令 四弟 人物一 寻宝  曾家 三十卷 谷 王玉阶 兑得此 屋堂 三间 草房,-1,-1
TRAIN_SENT_ID_250712,鲁西西,皮皮鲁,老实 说 我 每次 念起来 就 觉得 好像 在 念 皮皮鲁 鲁西西 。,老实 说 每次 念起来 觉得 好像 念 人物二 人物一,-1,0
TRAIN_SENT_ID_252647,颜回,孔子,《 孔子 家语 . 颜回 》,人物二 家语  人物一,1,0
TRAIN_SENT_ID_274312,习乾平,习近平,习乾平 ， 是 无产阶级 革命家 、 政治家 、 原 党和国家 领导人 习仲勋 之女 ， 现任 党和国家 主要 领导人 习近平 的 同父异母 的 姐姐 。,人物一  无产阶级 革命家  政治家  原 党和国家 领导人 习仲勋 之女  现任 党和国家 主要 领导人 人物二 同父异母 姐姐,-1,0
TRAIN_SENT_ID_262594,郭芙蓉,郭蔷薇,电视剧 已知 招式 ： 排山倒海 （ 郭芙蓉 ） ， 惊涛骇浪 （ 郭蔷薇 、 吕青橙 ） ， 大浪淘沙 （ 吕青柠 ）,电视剧 已知 招式  排山倒海  人物一   惊涛骇浪  人物二  吕青橙   大浪淘沙  吕青柠,-1,0
TRAIN_SENT_ID_261659,程英,陆无双,"他 的 到来 , 会 给 杨过 、 小龙女 等 人 带来 怎样 的 改变 , 陆无双 、 程英 这些 薄命 红颜 的 命运 是否 会 因 他 而 改变 , 看 下去 就 知道 了 … …",到来  会 杨过  小龙女 带来 改变  人物二  人物一 薄命 红颜 命运 是否 会 改变  下去 知道,-1,0
TRAIN_SENT_ID_270778,徐若瑄,徐佩瑜,徐佩瑜 标准 的 鹅蛋脸 和 一双 美丽 的 眼睛 让 网友 惊艳 ， 就 连 徐若瑄 也 自叹不如 。,人物二 标准 鹅蛋脸 一双 美丽 眼睛 网友 惊艳  人物一 自叹不如,-1,0
TRAIN_SENT_ID_279413,王学明,龙俊杰,指导 教师 ： 王学明 副教授 、 李学通 教授 、 龙俊杰 教授 、 周艳霞 副教授 等 。,指导 教师  人物一 副教授  李学通 教授  人物二 教授  周艳霞 副教授,1,0
TRAIN_SENT_ID_282543,苗正,黄震,黄震 号召 弟妹们 帮 他 一起 ， 黄家 姊 弟们 决定 通过 斗武来 选出 五人 去 帮助 他 ， 苗正 轻松 地 脱颖而出 。,人物二 号召 弟妹们 帮 一起  黄家 姊 弟们 决定 斗武来 选出 五人 帮助  人物一 轻松 脱颖而出,-1,0
TRAIN_SENT_ID_279625,李德亭,李德宁,子女 ： 两个 女儿 （ 李德宁 、 李德亭 ）,子女  两个 女儿  人物二  人物一,-1,0
TRAIN_SENT_ID_250675,鲁西西,皮皮鲁,郑渊洁 的 经典作品 ， 有 《 皮皮鲁 奇遇记 》 和 《 鲁西西 奇遇记 》 两部 。,郑渊洁 经典作品   人物二 奇遇记   人物一 奇遇记  两部,-1,0
TRAIN_SENT_ID_282570,尹寿山,马德禄,马德禄 - - 高寿亭 、 高桂清 、 杨 闻华 、 尹寿山 、 郭荣起,人物二   高寿亭  高桂清  杨 闻华  人物一  郭荣起,1,0
TRAIN_SENT_ID_283851,侯耀文,赵佩茹,贾仑 师徒关系 : 师承 ： 师爷 ： 赵佩茹 师父 ： 侯耀文,贾仑 师徒关系  师承  师爷  人物二 师父  人物一,1,0
TRAIN_SENT_ID_281659,江玲,蒋三省,蒋荣 宗 来自 音乐 世家 ， 爸爸 是 知名 音乐 人 蒋三省 ， 姑姑 是 早期 的 玉女 歌手 江玲 ， ...,蒋荣 宗 音乐 世家  爸爸 知名 音乐 人物二  姑姑 早期 玉女 歌手 人物一,-1,0
TRAIN_SENT_ID_251544,楚碧痕,楚寒镜,同时 创造 梭罗树 仙 楚寒镜 和 楚碧痕 两姐妹 ， 得到 灸 炎石 就 可 使 树 结果 ， 并且 令一人 成仙 。,创造 梭罗树 仙 人物二 人物一 两姐妹  得到 灸 炎石 树  令一人 成仙,-1,0
TRAIN_SENT_ID_263376,武修文,武敦儒,武敦儒 、 武修文 与 杨过相 比 ， 只能 比 出 杨过 出类拔萃 、 超群绝伦 。,人物二  人物一 杨过相  只能 出 杨过 出类拔萃  超群绝伦,-1,0
TRAIN_SENT_ID_253824,赵合德,赵飞燕,他 与 蛇蝎美人 赵飞燕 、 赵合德 姐妹 的 故事 ， 几乎 家喻户晓 。,蛇蝎美人 人物二  人物一 姐妹 故事  几乎 家喻户晓,-1,0
TRAIN_SENT_ID_276934,樊迟,孔子,樊迟 问知 ， 孔子 曰 ： “ 务民之义 ， 敬鬼神而远之 ， 可谓 知矣 。 ”,人物一 问知  人物二 曰   务民之义  敬鬼神而远之  可谓 知矣,1,0
TRAIN_SENT_ID_273683,姜子牙,元始天尊,《 封神榜 》 亦 载 ： 姜子牙 奉 元始天尊 之命 封之为 “ 上 清正 一 龙虎 玄坛 真君 ” 。,封神榜  载  人物一 奉 人物二 之命 封之为  清正 龙虎 玄坛 真君,1,0
TRAIN_SENT_ID_284555,梁守忠,万籁声,万籁声 又 传洪正福 、 周铨 、 刘家 填 、 陈训 德 、 秦腊生 、 梁守忠 等 。,人物二 传洪正福  周铨  刘家 填  陈训 德  秦腊生  人物一,1,0
TRAIN_SENT_ID_269574,水笙,汪啸风,5 . 水笙 听得 汪啸风 惊呼 ， 当即 勒马 。,人物一 听得 人物二 惊呼  当即 勒马,-1,0
TRAIN_SENT_ID_278069,马枪月,谷本夏,《 史上 最强 弟子 兼 一 》 马枪月 （ 马剑星 的 亲哥哥 ， 也 是 第六 拳豪 谷本夏 的 师傅 ， TV27 客串 ）,史上 最强 弟子 兼  人物一  马剑星 亲哥哥  第六 拳豪 人物二 师傅   客串,1,-1
TRAIN_SENT_ID_257502,姜昆,马季,马季 巧喻 点拨 姜昆,人物二 巧喻 点拨 人物一,1,0
TRAIN_SENT_ID_274355,和政公主,宁国公主,和政公主 的 姊姊 叫 宁国公主 。,人物一 姊姊 人物二,-1,0
TRAIN_SENT_ID_250413,赵飞燕,赵合德,这 赵飞燕 也 大方 得 很 ， 不像 某些 女人 争风吃醋 ， 可能 是 有福同享 ， 可能 是 加强 阵营 ， 还 把 妹妹 赵合德 也 介绍 进来 供 成帝 享用 。,人物一 大方  不像 女人 争风吃醋  可能 有福同享  可能 加强 阵营  妹妹 人物二 介绍 进来 供 成帝 享用,-1,0
TRAIN_SENT_ID_252543,颜回,孔子,颜回 以 品德 操守 高尚 闻名 ， 孔子 称赞 他 仁爱 。,人物一 品德 操守 高尚 闻名  人物二 称赞 仁爱,1,0
