sent_id,entity1,entity2,sent,processed_sent,label,hard_match
TRAIN_SENT_ID_264526,岳云鹏,郭德纲,郭德纲 - - 何云伟 、 曹云 金 、 岳云鹏 、 孔云龙 、 朱云峰 、 栾云平 、 李云杰 、 刘云天,人物二   何云伟  曹云 金  人物一  孔云龙  朱云峰  栾云平  李云杰  刘云天,1,0
TRAIN_SENT_ID_252518,颜回,孔子,殿内 供奉 孔子 五代 先人 的 牌位 及 配享 的 颜回 、 孔伋 、 曾 参 、 孟轲 四位 先哲 之父 的 牌位 。,殿内 供奉 人物二 五代 先人 牌位 配享 人物一  孔伋  参  孟轲 四位 先哲 之父 牌位,1,0
TRAIN_SENT_ID_269930,沈春阳,赵本山,2012 - 02 - 19 ： 樱桃 （ 38 集 ） 「 沈春阳 ， 宋小宝 ， 赵本山 ， 小 沈阳 」,樱桃   集   人物一  宋小宝  人物二  沈阳,1,0
TRAIN_SENT_ID_252606,颜回,孔子,果然 ， 在 孔子 的 指点 下 ， 颜回 也 隐隐约约 地 看到 那匹 白马 。,人物二 指点  人物一 隐隐约约 看到 那匹 白马,1,0
TRAIN_SENT_ID_252868,颜回,孔子,孔子 与 颜回,人物二 人物一,1,0
TRAIN_SENT_ID_252446,颜回,孔子,颜回 至 匡 ， 见到 了 被 围困 的 孔子 等 人 。,人物一 匡  见到 围困 人物二,1,0
TRAIN_SENT_ID_276949,樊迟,孔子,孔子 教 樊迟 学信礼,人物二 教 人物一 学信礼,1,0
TRAIN_SENT_ID_276673,萧玉妃,萧墨月,知己 好友 ： 萧玉妃 ， 萧墨月 。,知己 好友  人物一  人物二,-1,0
TRAIN_SENT_ID_259379,葛玄,左慈,葛玄 ： 丹阳 郡 （ 今属 江苏省 句容 ） 人 ， 三国 吴 道士 ， 曾 从 左慈 学 道 ， 并入 深山 修道 。,人物一  丹阳 郡  今属 江苏省 句容   三国 吴 道士  人物二 学 道  并入 深山 修道,1,0
TRAIN_SENT_ID_251843,梅超风,黄药师,金庸 江湖 手册 内容提要 : 黄药师 凭 什么 爱上 梅超风 ？,金庸 江湖 手册 内容提要  人物二 爱上 人物一,1,0
TRAIN_SENT_ID_257592,毛泽民,毛泽东,第五次 反 围剿 失败 后 ， 毛泽东 率队 长征 ， 毛泽民 负责 转运 整个 红色 银行 的 财产 ， 毛泽覃 受命 转战 闽 赣 边界 。,第五次 反 围剿 失败  人物二 率队 长征  人物一 负责 转运 整个 红色 银行 财产  毛泽覃 受命 转战 闽 赣 边界,-1,0
TRAIN_SENT_ID_277144,高桥孝浩,高桥美咲,家人 ： 高桥孝浩 （ 丈夫 ） 、 高桥真 浩 （ 儿子 ） 、 高桥美咲 （ 小叔 ）,家人  人物一  丈夫   高桥真 浩  儿子   人物二  小叔,-1,0
TRAIN_SENT_ID_255380,罗成,秦琼,与 秦琼 交情 深厚 ， 而且 由于 相貌堂堂 ， 为 绿林 英雄 树立 了 形象 ， 多次 博得 对手 的 敬佩 ， 就 连 心高气傲 的 罗成 也 一 见面 就 和 他 套近乎 。,人物二 交情 深厚  相貌堂堂  绿林 英雄 树立 形象  多次 博得 对手 敬佩  心高气傲 人物一 见面 套近乎,-1,0
TRAIN_SENT_ID_252537,颜回,孔子,《 庄子 · 人间 世 》 ： “ 颜回 见 孔子 ， 请行 。,庄子  人间 世    人物一 见 人物二  请行,1,0
TRAIN_SENT_ID_273689,姜子牙,元始天尊,5 角色 详解 : 姜子牙 — — 在 昆仑山 师从 元始天尊 四十 载 ， 西歧 军师 ， 运筹帷幄 ， 是 周朝 军队 的 灵魂 人物 。,角色 详解  人物一   昆仑山 师从 人物二 四十 载  西歧 军师  运筹帷幄  周朝 军队 灵魂 人物,1,1
TRAIN_SENT_ID_263378,武修文,武敦儒,儿子 ： 武敦儒 、 武修文,儿子  人物二  人物一,-1,0
TRAIN_SENT_ID_283394,师戈,郑小山,郑小山 - - 罗健 、 王筱磊 、 徐力 、 刘宝安 、 郑宏伟 、 师戈 、 苗阜 、 曹磊 、 任海峰 、 刘凯,人物二   罗健  王筱磊  徐力  刘宝安  郑宏伟  人物一  苗阜  曹磊  任海峰  刘凯,1,0
TRAIN_SENT_ID_269434,刘伟,马季,《 风格 赞 》 表演者 ： 马季 、 赵炎 、 刘伟 、 姜昆 、 冯巩 等,风格 赞  表演者  人物二  赵炎  人物一  姜昆  冯巩,1,0
TRAIN_SENT_ID_251595,穆春,穆弘,穆春 穆弘 傻傻 分不清楚,人物一 人物二 傻傻 分不清楚,-1,0
TRAIN_SENT_ID_265399,薛谭,秦青,秦青 薛谭 两高人 ， 娄公 识才 用意 深 。,人物二 人物一 两高人  娄公 识才 用意 深,1,0
TRAIN_SENT_ID_259615,季布,季心,季姓 季心 : 季布 弟 ， 亦 以 任侠 名 。,季姓 人物二  人物一 弟  任侠 名,-1,0
TRAIN_SENT_ID_283764,陈寅衷,陈赤衷,《 鄞县 志 · 陈赤衷 》 载 ： 陈寅衷 “ 亦 复 佩服 六经 ， 质有 其文 ， 溯 蕺 山之学脉 ， 仰 证人 之 成规 ” 。,鄞县 志  人物二  载  人物一  复 佩服 六经  质有 其文  溯 蕺 山之学脉  仰 证人 成规,-1,0
TRAIN_SENT_ID_259758,李偲菘,李伟菘,参与 制作 : 李偲菘 李伟菘,参与 制作  人物一 人物二,-1,0
TRAIN_SENT_ID_265601,苗飞飞,苗蜜,苗蜜 ( 蜂族 ) 、 苗飞飞 ( 蜂族 ) 、 嘎库 喽契 、 哥库 喽 契人族 : 湛江云 、 浪 千山 、 岳驼 、 晏河 、 莫修 、 霍真 、 石 雷鸣 、 项 殷风,人物二  蜂族   人物一  蜂族   嘎库 喽契  哥库 契人族  湛江云  浪 千山  岳驼  晏河  莫修  霍真  石 雷鸣  项 殷风,-1,0
TRAIN_SENT_ID_253105,颜回,孔子,殿内 东西 两边 对 向 置 四木龛 ， 供奉 颜回 、 曾 参 、 孟轲 、 孔伋 （ 子思 ） 等 孔子 四大 贤弟 子及 传人 的 画像 ， 称为 四配 。,殿内 东西 两边 置 四木龛  供奉 人物一  参  孟轲  孔伋  子思  人物二 四大 贤弟 子及 传人 画像  称为 四配,1,0
TRAIN_SENT_ID_249119,皮皮鲁,鲁西西,其 笔下 的 皮皮鲁 、 鲁西西 、 舒克 、 贝塔 和 罗克 已 成为 注册商标 。,笔下 人物一  人物二  舒克  贝塔 罗克 成为 注册商标,-1,0
TRAIN_SENT_ID_272044,韩慕侠,周恩来,周恩来 曾 提笔 为 韩慕侠 的 武馆 ， 写下 “ 韩九师堂 ” 四字 。,人物二 提笔 人物一 武馆  写下  韩九师堂  四字,1,0
TRAIN_SENT_ID_262217,尤二姐,尤三姐,由 尤二姐 一 心想 重新做人 ， 而 尤三姐 认为 贾琏 不过 是 在 “ 花马 吊 嘴 ” 。,人物一 心想 重新做人  人物二 认为 贾琏  花马 吊 嘴,-1,0
TRAIN_SENT_ID_267449,唐继虞,唐继尧,王洁修 及习 自强 与 唐继虞 友好 甚笃 ， 三人 结为 金兰 ， 从而 成为 唐继尧 的 心腹 将领 。,王洁修 及习 自强 人物一 友好 甚笃  三人 结为 金兰  成为 人物二 心腹 将领,-1,0
TRAIN_SENT_ID_252655,颜回,孔子,不久 ， 颜回 又 随 孔子 赴 晋国 。,不久  人物一 人物二 赴 晋国,1,0
TRAIN_SENT_ID_261956,何冲,何超,"对此 , 跳水 三米板 全国冠军 、 跳水 世界冠军 何冲 的 弟弟 何超 在 自己 的 微博上 评论 : “ 电子竞技 也 算 体育 ?",对此  跳水 三米板 全国冠军  跳水 世界冠军 人物一 弟弟 人物二 微博上 评论   电子竞技 算 体育,-1,0
TRAIN_SENT_ID_259785,李偲菘,李伟菘,港台 ： 袁惟仁 、 李宗盛 、 李偲菘 、 李伟菘 、 涂惠源 、 季忠平 、 钟兴民 、 林迈可 、 屠颖 、 汪一平,港台  袁惟仁  李宗盛  人物一  人物二  涂惠源  季忠平  钟兴民  林迈可  屠颖  汪一平,-1,0
TRAIN_SENT_ID_249156,皮皮鲁,鲁西西,1 内容梗概 : 皮皮鲁 、 鲁西西 和 舒克 贝塔 打扑克 的 时候 发现 少 了 一张 红桃 K 。,内容梗概  人物一  人物二 舒克 贝塔 打扑克 发现 少 一张 红桃,-1,0
TRAIN_SENT_ID_259372,葛玄,左慈,《 长葛县 志 》 载 ： “ 昔 吴人 葛玄 ， 从 左慈 受九丹 金液 仙经 ， 世号 葛仙翁 。,长葛县 志  载   昔 吴人 人物一  人物二 受九丹 金液 仙经  世号 葛仙翁,1,0
TRAIN_SENT_ID_275227,李梅儿,上官兰心,封 上官兰心 为 敬贤妃 ， 封 金碧瑶 为 英德 妃 ， 李梅儿 为 李选侍 。,封 人物二 敬贤妃  封 金碧瑶 英德 妃  人物一 李选侍,-1,0
TRAIN_SENT_ID_285613,韩笑,韩少云,韩笑 嗓音 甜美 ， 颇具 韩少云 大师 风范 。,人物一 嗓音 甜美  颇具 人物二 大师 风范,1,0
TRAIN_SENT_ID_271498,孟优,孟获,新 角色 马超 孟起 、 孟获 、 孟优 登场 。,新 角色 马超 孟起  人物二  人物一 登场,-1,0
TRAIN_SENT_ID_267602,李沧海,李秋水,10 . 《 仙剑 奇侠传 五 - 前传 》 - 凌波 天龙八部 之 天山童姥 李沧海 李秋水 CN 行云,仙剑 奇侠传 五  前传   凌波 天龙八部 天山童姥 人物一 人物二  行云,-1,0
TRAIN_SENT_ID_262260,尤二姐,尤三姐,尤二姐 和 尤三姐 是 宁府 尤氏 继母 的 女儿 ， 因 贾敬 暴死 ． 尤氏 料理 丧事 ， 不能 回家 。,人物一 人物二 宁府 尤氏 继母 女儿  贾敬 暴死 ． 尤氏 料理 丧事  不能 回家,-1,0
TRAIN_SENT_ID_275535,王小虎,赵本山,[ 赵本山 、 蔡维利 、 王小虎 上场 ，,人物二  蔡维利  人物一 上场,1,0
TRAIN_SENT_ID_261650,宋小宝,赵本山,2013 - 03 - 02 ： 樱桃红 「 宋小宝 ， 沈春阳 ， 杨冰 ， 赵本山 」,樱桃红  人物一  沈春阳  杨冰  人物二,1,0
TRAIN_SENT_ID_267582,吴魏,吴狄,"伍媚 回国 结婚 了 , 她 的 丈夫 是 一个 和 吴魏 性格 相貌 略 相同 的 人 , 这 一点 , 吴狄 发现 了 !",伍媚 回国 结婚  丈夫 一个 人物一 性格 相貌 略 相同  一点  人物二 发现,-1,0
TRAIN_SENT_ID_249326,陆无双,程英,9 、 程英 含泪 不语 ， 陆无双 却 又 叫 了 出来 ： “ 傻蛋 ， 你 … …,人物二 含泪 不语  人物一   傻蛋,-1,0
TRAIN_SENT_ID_268891,司徒静,司徒剑南,顾一洲 、 静修 、 万人敌 欲 救 司徒静 ， 没有 成功 . 司徒剑南 第二十九 集 : 朱允 突然 临幸 文媚儿 ， 文媚儿 慌 了 神 。,顾一洲  静修  万人敌 欲 救 人物一  没有 成功  人物二 第二十九 集  朱允 突然 临幸 文媚儿  文媚儿 慌 神,-1,0
TRAIN_SENT_ID_263545,林逸,杨明,黄土 高派 土 青松 的 女儿 ， 杨明 的 干女儿 ， 林逸 的 青梅竹马 。,黄土 高派 土 青松 女儿  人物二 干女儿  人物一 青梅竹马,1,0
TRAIN_SENT_ID_266311,贾源,贾演,其中 贾府 就 占 了 2 个 - - 宁国公 贾演 、 荣国公 贾源 。,贾府 占    宁国公 人物二  荣国公 人物一,-1,0
TRAIN_SENT_ID_256862,仲由,孔子,仲由 以 政事 见称 ， 为 人 伉直 ， 好 勇力 ， 跟随 孔子 周游列国 ， 是 孔门 七十二 贤 之一 。,人物一 政事 见称  伉直  勇力  跟随 人物二 周游列国  孔门 七十二 贤,1,0
TRAIN_SENT_ID_252568,颜回,孔子,归鲁 之后 ， 颜回 除 讲学 外 ， 便是 帮助 孔子 整理 古代 典籍 。,归鲁 之后  人物一 讲学 外  便是 帮助 人物二 整理 古代 典籍,1,0
TRAIN_SENT_ID_257808,林平之,岳不群,林平之 很 清楚 ， 岳灵珊 如果 不死 在 自己 手里 必定会 被 别人 折磨 死 ， 岳不群 的 仇家 ， 青城派 ， 嵩山 派 都 虎视眈眈 着 呢 。,人物一 清楚  岳灵珊 不死 手里 必定会 折磨 死  人物二 仇家  青城派  嵩山 派 虎视眈眈,1,0
TRAIN_SENT_ID_271262,马季,侯宝林,扒 马褂 表演 版本 : 高德明 、 绪 得 贵 、 侯宝林 、 郭启儒 、 刘宝瑞 、 王长友 、 王世臣 、 马季 、 赵振铎 、 赵世忠 、 李金斗 等 都 擅长 演此 曲目 。,扒 马褂 表演 版本  高德明  绪 贵  人物二  郭启儒  刘宝瑞  王长友  王世臣  人物一  赵振铎  赵世忠  李金斗 擅长 演此 曲目,1,0
TRAIN_SENT_ID_249013,吕洞宾,韩湘子,仙人 韩湘子 、 吕洞宾 分别 化 变成 和尚 、 道士 ， 私下 凡尘 ， 肆意 戏弄 牡丹 ， 看其 是否 诚心 修炼 ， 谁知 讨个 没趣,仙人 人物二  人物一 化 变成 和尚  道士  私下 凡尘  肆意 戏弄 牡丹  看其 是否 诚心 修炼  讨个 没趣,1,0
TRAIN_SENT_ID_282520,欧阳零,欧阳坤,《 斗 龙战士 》 — — 欧阳零 、 欧阳坤 、 天蝎星 龙 、 双鱼 星龙 、 射手 星龙 、 米拉,斗 龙战士    人物一  人物二  天蝎星 龙  双鱼 星龙  射手 星龙  米拉,-1,0
TRAIN_SENT_ID_279040,张福龙,陈亿丰,张福龙 本名 ： 陈亿丰,人物一 本名  人物二,1,0
TRAIN_SENT_ID_284073,华传萍,尤彩云,女 加官 ， 由五旦 应工 ， “ 传 ” 宇辈为 尤彩云 所教 ， 跳者 有 华传萍 、 姚传芽 、 王传 渠 等 。,女 加官  由五旦 应工   传  宇辈为 人物二 所教  跳者 人物一  姚传芽  王传 渠,1,-1
TRAIN_SENT_ID_255476,罗成,秦琼,秦琼 、 尉迟恭 、 程咬金 、 罗成 等 率兵 扫平 了 十八 路 反王 。,人物二  尉迟恭  程咬金  人物一 率兵 扫平 十八 路 反王,-1,-1
TRAIN_SENT_ID_254296,张顺,张横,话 说 当下 张横 听得 道 没 了 他 兄弟 张顺 ， 烦恼 得 昏晕 了 半晌 ， 却 救 得 苏醒 。,话 说 当下 人物二 听得 道 没 兄弟 人物一  烦恼 昏晕 半晌  救 苏醒,-1,0
TRAIN_SENT_ID_265478,薛谭,秦青,⑶ 云不去 ： 典出 《 列子 · 汤问 》 ： “ 薛谭 学 讴于 秦青 ， 未穷 青之技 ， 自谓 尽 之 ， 遂 辞 归 。,⑶ 云不去  典出  列子  汤问    人物一 学 讴于 人物二  未穷 青之技  自谓  遂 辞,1,0
TRAIN_SENT_ID_276530,陈青云,陈青莲,陈青云 剧情简介 : 乾隆皇帝 微服 出巡 路过 十 全县 ， 在 荷花 塘 邂逅 陈青莲 ， 生下 一子 陈文杰 。,人物一 剧情简介  乾隆皇帝 微服 出巡 路过 十 全县  荷花 塘 邂逅 人物二  生下 一子 陈文杰,-1,0
TRAIN_SENT_ID_257476,姜昆,马季,调演 结束 后 ， 姜昆 如愿以偿 ， 投身 到 马季 麾下 ， 师胜杰 则 黯然 地 回到 了 北大荒 ， 继续 干 他 的 “ 农工 ” 。,调演 结束  人物一 如愿以偿  投身 人物二 麾下  师胜杰 黯然 回到 北大荒  继续 干  农工,1,0
TRAIN_SENT_ID_269921,沈春阳,赵本山,据 透露 ， 这次 的 作品 由 赵本山 亲自 操刀 ， 小 沈阳 、 沈春阳 、 丫蛋儿 、 王金龙 等 8 位 精英 全新 打造 。,透露  作品 人物二 亲自 操刀  沈阳  人物一  丫蛋儿  王金龙  位 精英 全新 打造,1,-1
TRAIN_SENT_ID_259676,公孙胜,罗真人,第五十三回 戴宗 智取 公孙胜 ， 李逵 斧劈 罗真人,第五十三回 戴宗 智取 人物一  李逵 斧劈 人物二,1,0
TRAIN_SENT_ID_259651,公孙胜,罗真人,第 15 回 ： 罗真人 ， 公孙胜,回  人物二  人物一,1,0
TRAIN_SENT_ID_274318,李迥,华阳公主,独孤 氏以 美丽 得幸 ， 九载 生韩王 李迥 ， 后生 华阳公主 。,独孤 氏以 美丽 得幸  九载 生韩王 人物一  后生 人物二,-1,0
TRAIN_SENT_ID_263021,钱婆婆,汤婆婆,然后 要千寻 交出 白龙 ， 因为 白龙奉 汤婆婆 的 命令 ， 偷取 了 钱婆婆 的 魔女 和约 印章 。,要千寻 交出 白龙  白龙奉 人物二 命令  偷取 人物一 魔女 和约 印章,-1,0
TRAIN_SENT_ID_257033,洪敬尧,洪荣宏,洪荣宏 、 洪敬尧,人物二  人物一,-1,0
TRAIN_SENT_ID_259753,李偲菘,李伟菘,萧敬腾 创作 背景 : 萧敬腾 专辑 由 李偲菘 、 李伟菘 、 陈伟 、 马玉 芬 、 五月天 阿信 、 阿沁 、 吴青峰 、 小宇 联手 打造 。,萧敬腾 创作 背景  萧敬腾 专辑 人物一  人物二  陈伟  马玉 芬  五月天 阿信  阿沁  吴青峰  小宇 联手 打造,-1,0
TRAIN_SENT_ID_277742,邵素雯,邵素云,婚后 ， 他们 育有 两子 两女 ， 长子 邵维铭 、 次女 邵素雯 、 三女 邵素云 及 幼子 邵维钟 。,婚后  育有 两子 两女  长子 邵维铭  次女 人物一  三女 人物二 幼子 邵维钟,-1,0
TRAIN_SENT_ID_254261,张顺,张横,张雄正 在 城楼 上 叫苦不迭 ， 被 张横 ， 张顺 从飞 江 上城 ， 手执 朴刀 ， 喊一声 ， 抢 上楼来 ， 一连 砍翻 了 十余个 军卒 ， 众人 乱窜 逃生 。,张雄正 城楼 叫苦不迭  人物二  人物一 从飞 江 上城  手执 朴刀  喊一声  抢 上楼来  一连 砍翻 十余个 军卒  众人 乱窜 逃生,-1,0
TRAIN_SENT_ID_252765,颜回,孔子,附人骥尾 释义 : 司马贞 索隐 ： “ 按 ： 苍蝇附骥 尾而致 千里 ， 以 譬 颜回 因 孔子 而 名彰 也 。 ”,附人骥尾 释义  司马贞 索隐    苍蝇附骥 尾而致 千里  譬 人物一 人物二 名彰,1,0
TRAIN_SENT_ID_268842,骆羽,骆赢,被 追至 6 平后 ， 骆羽 / 骆赢 再度 发力 ， 稳住 局面 连取 4 分 ， 逐渐 拉开 分差 ， 以 21 - 18 追回 一局 。,追至  平后  人物一  人物二 再度 发力  稳住 局面 连取  分  逐渐 拉开 分差     追回 一局,-1,0
TRAIN_SENT_ID_271739,朱聪,郭靖,朱聪 和 全金发 最先 上山 ， 见 郭靖 躺 在 地下 被 四人 夹击 ， 已 是 命 在 顷刻 ， 如何 不 急 ？,人物一 全金发 最先 上山  见 人物二 躺 地下 四人 夹击  命 顷刻  急,1,0
TRAIN_SENT_ID_251553,楚碧痕,楚寒镜,楚碧痕 ： 长久 居于 月 之 幽境 的 梭罗树 仙 ， 和 姐姐 楚寒镜 出于 同一 精魂 。,人物一  长久 居于 月 幽境 梭罗树 仙  姐姐 人物二 同一 精魂,-1,1
TRAIN_SENT_ID_259741,李偲菘,李伟菘,李偲菘 / 李伟菘 / 姚若龙 / 易家扬 / 徐世珍 / 彭学斌 / 严云农,人物一  人物二  姚若龙  易家扬  徐世珍  彭学斌  严云农,-1,0
TRAIN_SENT_ID_250419,赵飞燕,赵合德,古代 女人 的 发型 变化多端 ， 如直发 （ 张丽华 ） 、 短发 （ 梁 绿珠 ） 、 卷发 （ 赵合德 ） 、 束发 （ 赵飞燕 ） 、 盘发 （ 甄妃 ） 等 。,古代 女人 发型 变化多端  如直发  张丽华   短发  梁 绿珠   卷发  人物二   束发  人物一   盘发  甄妃,-1,-1
TRAIN_SENT_ID_275836,陆无双,李莫愁,去 程瑛 居 ， 打 李莫愁 ， 收 程瑛 、 陆无双 ， 得 五毒 秘传 、 玉 萧剑 谱 。,程瑛 居  人物二  收 程瑛  人物一  五毒 秘传  玉 萧剑 谱,1,0
TRAIN_SENT_ID_263371,武修文,武敦儒,在 郭靖 看来 ， 襄阳 的 未来 就 落 在 武敦儒 、 武修文 肩膀 上 。,郭靖 看来  襄阳 未来 落 人物二  人物一 肩膀,-1,0
TRAIN_SENT_ID_270157,宋师道,宋玉致,家庭 ： 长女 宋玉华 、 次子 宋师道 、 三女 宋玉致 、 二弟 “ 地剑 ” 宋智 、 三弟 “ 银龙 ” 宋鲁 、 长婿 解 文龙 、 次婿 “ 少帅 ” 寇仲,家庭  长女 宋玉华  次子 人物一  三女 人物二  二弟  地剑  宋智  三弟  银龙  宋鲁  长婿 解 文龙  次婿  少帅  寇仲,-1,0
TRAIN_SENT_ID_259958,叶家妤,白家绮,叶家妤 + 白家绮 、 殷琦 + Natasha,人物一  人物二  殷琦,-1,0
TRAIN_SENT_ID_250344,赵飞燕,赵合德,赵飞燕 如愿 成为 皇后 ， 赵合德 也 被 封为 昭仪 ， 位比 亲王 。,人物一 如愿 成为 皇后  人物二 封为 昭仪  位比 亲王,-1,0
TRAIN_SENT_ID_265405,薛谭,秦青,原文 : 薛谭 学 讴于 秦青 ， 未穷 青之技 ， 自谓 尽 之 ， 遂 辞 归 。,原文  人物一 学 讴于 人物二  未穷 青之技  自谓  遂 辞,1,0
TRAIN_SENT_ID_265499,薛蝌,薛蟠,她 是 薛姨妈 的 侄女 ， 薛蝌 的 胞妹 ， 薛蟠 ， 薛宝钗 的 堂妹 。,薛姨妈 侄女  人物一 胞妹  人物二  薛宝钗 堂妹,-1,0
TRAIN_SENT_ID_275840,陆无双,李莫愁,曾斗 之 人 ： 李莫愁 、 公孙止 、 陆无双 、 程英 、 洪凌波,曾斗  人物二  公孙止  人物一  程英  洪凌波,1,0
TRAIN_SENT_ID_249319,陆无双,程英,纯净 的 小龙女 、 刁蛮 无理 的 郭 芙 、 爽朗 活泼 的 郭襄 、 理智 优雅 的 程英 、 泼辣 的 陆无双 、 痴情 的 公孙绿萼 都 深恋 着 杨过 。,纯净 小龙女  刁蛮 无理 郭 芙  爽朗 活泼 郭襄  理智 优雅 人物二  泼辣 人物一  痴情 公孙绿萼 深恋 杨过,-1,0
TRAIN_SENT_ID_253874,赵合德,赵飞燕,- 前 7 ） 即 赵合德 ， 赵飞燕 妹 。,前   人物一  人物二 妹,-1,0
TRAIN_SENT_ID_251849,梅超风,黄药师,黄药师 VS 梅超风 ： 情感 与 形象,人物二  人物一  情感 形象,1,0
TRAIN_SENT_ID_269125,唐鉴军,赵本山,由 孟令宇 、 孙博 执导 ， 毕畅 、 贺树峰 、 唐鉴军 、 贺树峰 、 王小利 、 刘小光 、 赵本山 等 联合 主演 的 农村 题材 剧 。,孟令宇  孙博 执导  毕畅  贺树峰  人物一  贺树峰  王小利  刘小光  人物二 联合 主演 农村 题材 剧,1,0
TRAIN_SENT_ID_262233,尤二姐,尤三姐,尤氏 因 丧事 繁忙 ， 请 母亲 和 妹妹 尤二姐 、 尤三姐 来 帮忙 。,尤氏 丧事 繁忙  请 母亲 妹妹 人物一  人物二 帮忙,-1,0
TRAIN_SENT_ID_256924,仲由,孔子,孔子 不禁 叹 到 ： “ 神童 仲由 乃 吾师 也 ” 。,人物二 不禁 叹   神童 人物一 吾师,1,0
TRAIN_SENT_ID_259625,季布,季心,本传除 记述 季布 、 栾布 二人 的 生平事迹 外 ， 还 记载 了 季心 和 丁公 的 事迹 。,本传除 记述 人物一  栾布 二人 生平事迹 外  记载 人物二 丁公 事迹,-1,0
TRAIN_SENT_ID_253121,颜回,孔子,也就是说 ， 对于 孔子 、 颜回 这样 品德高尚 的 人 来说 ， 快乐 不 在于 物质享受 ， 而 在于 精神 情操 的 追求 。,也就是说  人物二  人物一 品德高尚  快乐 物质享受  精神 情操 追求,1,0
TRAIN_SENT_ID_275892,王子豪,王子杰,"1 / 2 帮 总分 582 分 3 帮 总分 573.2 相差 10.8 分 , 经 商议 淘汰 张祖铭 , 王子豪 , 王子杰 , 陈国靖",帮 总分  分  帮 总分  相差  分  商议 淘汰 张祖铭  人物一  人物二  陈国靖,-1,0
TRAIN_SENT_ID_277686,平阳君,赵惠文王,赵惠文王 ( 赵何 ) 安阳 君 ( 赵章 ) 平阳君 ( 赵豹 ) 平原君 ( 赵胜 ) … … … … … … … … … … …,人物二  赵何  安阳 君  赵章  人物一  赵豹  平原君  赵胜,-1,0
TRAIN_SENT_ID_263549,林逸,杨明,沈雨 昔 林逸 的 师娘 之一 ， 杨明 的 妻子 之一 。,沈雨 昔 人物一 师娘  人物二 妻子,1,0
TRAIN_SENT_ID_252527,颜回,孔子,④ “ 颜乐 ” 句 ， 赞扬 孔子 ， 颜回 安贫乐道 精神 。,④  颜乐  句  赞扬 人物二  人物一 安贫乐道 精神,1,0
TRAIN_SENT_ID_252748,颜回,孔子,我 虽然 讥笑 孔子 颜回 ， 但 这 等 圣贤 之 人 ， 贫贱不能 移 ， 富贵不能淫 ， 威武 不能 屈 ， 就算 一文不名 ， 也 是 百代 帝 王之师 。,讥笑 人物二 人物一  圣贤  贫贱不能 移  富贵不能淫  威武 不能 屈  一文不名  百代 帝 王之师,1,-1
TRAIN_SENT_ID_273630,马阔海,马青山,茨 纳米 铠甲 召唤 人 : 马阔海 / 李子 / 马青山,茨 纳米 铠甲 召唤  人物一  李子  人物二,-1,0
TRAIN_SENT_ID_250341,赵飞燕,赵合德,赵飞燕 · 赵合德,人物一  人物二,-1,0
TRAIN_SENT_ID_253899,赵合德,赵飞燕,（ 西汉 美女 赵飞燕 、 赵合德 的 合称 ） : 二赵 ， 典故 名 ， 典出 《 汉书 》 卷 九十七 下 〈 外戚 列传 下 · 孝成 赵 皇后 〉 。,西汉 美女 人物二  人物一 合称   二赵  典故 名  典出  汉书  卷 九十七  外戚 列传  孝成 赵 皇后,-1,0
TRAIN_SENT_ID_275652,上官梅儿,上官兰心,上官梅儿 （ 女一号 ） ： 上官兰心 的 结拜 姐妹 ， 聪明伶俐 乖巧 ， 外表美丽 ， 蕙质兰心 ， 琴艺 高超 。,人物一  女一号   人物二 结拜 姐妹  聪明伶俐 乖巧  外表美丽  蕙质兰心  琴艺 高超,-1,0
TRAIN_SENT_ID_273377,杨锐,张之洞,张之洞 、 杨锐 与 豁蒙楼,人物二  人物一 豁蒙楼,1,0
TRAIN_SENT_ID_259807,李偲菘,李伟菘,音乐 总监 ： 李偲菘 、 李伟菘 、 易家扬 、 小柯 、 张亚东,音乐 总监  人物一  人物二  易家扬  小柯  张亚东,-1,0
TRAIN_SENT_ID_264935,贾元春,贾宝玉,第九十七回 贾宝玉 奉命 出远门 贾元春 赐 诏 结姻 眷,第九十七回 人物二 奉命 出远门 人物一 赐 诏 结姻 眷,-1,0
TRAIN_SENT_ID_265418,薛谭,秦青,列子 · 汤问 第十一部分 : 列子 · 汤问 原文 : 薛谭 学 讴于 秦青 ① ， 未穷 青之技 ， 自谓 尽 之 ， 遂 辞 归 。,列子  汤问 第十一部分  列子  汤问 原文  人物一 学 讴于 人物二 ①  未穷 青之技  自谓  遂 辞,1,0
TRAIN_SENT_ID_281654,黄铁良,侯宝林,其 丈夫 黄铁良 师承 相声 名家 侯宝林 ， 目前 在 众友 相声 队 演出 ； 其婿 刘彤 亦 是 相声 演员 ， 曾 获 CCTV 相声 大赛 逗哏 一等奖 。,丈夫 人物一 师承 相声 名家 人物二  目前 众友 相声 队 演出  其婿 刘彤 相声 演员  获  相声 大赛 逗哏 一等奖,1,0
TRAIN_SENT_ID_270567,全真七子,王重阳,东游 至 山东 ， 王重阳 收 马丹阳 、 孙不二 ， 王玉 阳 、 丘 长春 ， 谭长真 ， 刘长生 、 郝 太古 等 人为 徒 ， 后称 “ 全真七子 ” 。,东游 山东  人物二 收 马丹阳  孙不二  王玉 阳  丘 长春  谭长真  刘长生  郝 太古 人为 徒  后称  人物一,1,0
TRAIN_SENT_ID_255449,罗成,秦琼,罗成 的 好 ， 秦琼 最 懂 。,人物一  人物二 懂,-1,0
TRAIN_SENT_ID_249193,皮皮鲁,鲁西西,郑渊洁 的 作品 创造 了 皮皮鲁 、 鲁西西 、 罗克 、 舒克和贝塔 这些 脍炙人口 、 家喻户晓 的 童话 人物 ， 影响 了 整整 一代人 。,郑渊洁 作品 创造 人物一  人物二  罗克  舒克和贝塔 脍炙人口  家喻户晓 童话 人物  影响 整整 一代人,-1,0
TRAIN_SENT_ID_272364,钱永刚,钱永真,儿子 钱永刚 、 女儿 钱永真 。,儿子 人物一  女儿 人物二,-1,0
TRAIN_SENT_ID_256549,周武,周文,周武 王封 叔叔 姬仲在 东 虢 ； 周文 王之弟 亦 封 在 虢 ， 周平 王 又 封 姬仲 后裔 在 此 虢 ， 故今 陕地 有北 虢 、 东虢 、 西虢 。,人物一 王封 叔叔 姬仲在 东 虢  人物二 王之弟 封 虢  周平 王 封 姬仲 后裔 虢  故今 陕地 有北 虢  东虢  西虢,-1,0
