sent_id,entity1,entity2,sent,processed_sent,label,hard_match
TRAIN_SENT_ID_269121,唐鉴军,赵本山,该剧 由 赵本山 率领 小 沈阳 ， 于月仙 ， 唐鉴军 等 赵家 班 成员 主演 ， 故事 取材于 本山 传媒 旗下 辽宁 民间艺术团 里 的 真人真事 。,该剧 人物二 率领 沈阳  于月仙  人物一 赵家 班 成员 主演  故事 取材于 本山 传媒 旗下 辽宁 民间艺术团 里 真人真事,1,-1
TRAIN_SENT_ID_265438,薛谭,秦青,薛谭 学 讴于 秦青 。,人物一 学 讴于 人物二,1,0
TRAIN_SENT_ID_266671,邓鸣贺,邓鸣璐,8 、 创意 儿童节目 《 剪花 花 》 邓鸣贺 、 邓鸣璐,创意 儿童节目  剪花 花  人物一  人物二,-1,0
TRAIN_SENT_ID_251897,曹薰铉,李昌镐,虽然 日本队 主帅 加藤 正夫 力克 曹薰铉 ， 但 还是 没能 闯过 最后 李昌镐 一关 。,日本队 主帅 加藤 正夫 力克 人物一  没能 闯过 最后 人物二 一关,1,-1
TRAIN_SENT_ID_252531,颜回,孔子,颜回 无以 应 ， 入告 孔子 。,人物一 无以 应  入告 人物二,1,0
TRAIN_SENT_ID_255326,卫夫人,王羲之,⑧ 《 法书 》 ： 王羲之 《 题 卫夫人 笔阵 图 》 ： “ 纸者 阵 也 ， 笔者 刀 稍 也 ， 墨者 鍪 甲 也 ， 砚者 城池 也 ， 本领 者 将军 也 ， 心意 者 副将 也 。 ”,⑧  法书   人物二  题 人物一 笔阵 图    纸者 阵  笔者 刀 稍  墨者 鍪 甲  砚者 城池  本领 将军  心意 副将,1,0
TRAIN_SENT_ID_260589,金敬姬,金正日,不过 ， 金敬姬 也 有 可能 在 暗地里 设计 自己 成为 金正日 接班人 的 计划 。 ”,人物一 可能 暗地里 设计 成为 人物二 接班人 计划,-1,0
TRAIN_SENT_ID_277567,袁承志,穆人清,【 接包 + 胜 袁承志 】 去 石梁派 ， 打 两场 ， 雁门关 得 10 级 破玉拳 ， 再 打 穆人清 ， 得 天外 飞龙 。,接包  胜 人物一  石梁派  两场  雁门关  级 破玉拳  人物二  天外 飞龙,1,0
TRAIN_SENT_ID_269920,沈春阳,赵本山,2010 喜迎 第七届 红荷节 《 刘老根 大 舞台 》 ： 赵本山 、 小 沈阳 、 沈春阳 、 于月仙 （ 谢大脚 ） 、 刘流 （ 刘大脑袋 ） 、 王小利 等,喜迎 第七届 红荷节  刘老根 舞台   人物二  沈阳  人物一  于月仙  谢大脚   刘流  刘大脑袋   王小利,1,-1
TRAIN_SENT_ID_252617,颜回,孔子,孔子 不疑 颜回 之廉信,人物二 不疑 人物一 之廉信,1,0
TRAIN_SENT_ID_277761,邵素雯,邵维钟,哥哥 邵维铭 、 姐姐 邵素雯 及 弟弟 邵维钟 。,哥哥 邵维铭  姐姐 人物一 弟弟 人物二,-1,0
TRAIN_SENT_ID_259934,周志文,周志康,巨声 队 ： 林师杰 、 许廷铿 、 刘 威煌 、 周志文 、 周志康 、 邓小巧 、 何晶晶 、 何雁诗,巨声 队  林师杰  许廷铿  刘 威煌  人物一  人物二  邓小巧  何晶晶  何雁诗,-1,0
TRAIN_SENT_ID_261647,宋小宝,赵本山,赵本山 为了 降服 抽风 的 精神病 小偷 宋小宝 ， 一秒钟 变 唐僧 ， 举起手来 就 念咒 ， 现场 掌声如雷 。,人物二 降服 抽风 精神病 小偷 人物一  一秒钟 变 唐僧  举起手来 念咒  现场 掌声如雷,1,0
TRAIN_SENT_ID_257032,洪敬尧,洪荣宏,江蕙 ． 洪荣宏 ． 洪敬尧 ． 王力宏 ． 周华健 ． 伍思凯,江蕙 ． 人物二 ． 人物一 ． 王力宏 ． 周华健 ． 伍思凯,-1,-1
TRAIN_SENT_ID_252673,颜回,孔子,《 吕氏春秋 · 任数 》 ： “ 孔子 穷乎 陈蔡 之间 ， 藜 羹 不 斟 ， 七日 不尝粒 ， 昼寝 ， 颜回 索米 ， 得 而 爨 之 。 ”,吕氏春秋  任数    人物二 穷乎 陈蔡 之间  藜 羹 斟  七日 不尝粒  昼寝  人物一 索米  爨,1,0
TRAIN_SENT_ID_256576,周武,周文,“ 丰镐 ” ， 是 周文 王和 周武 王 分别 修建 的 丰京 和 镐京 的 合称 。,丰镐   人物二 王和 人物一 王 修建 丰京 镐京 合称,-1,-1
TRAIN_SENT_ID_270799,文媚儿,文韬,文章 、 文媚儿 、 太后 兴师 质问 朱允 ， 朱允大怒 ， 欲 斩 文韬 ， 众人 只好 跪地 求情 。,文章  人物一  太后 兴师 质问 朱允  朱允大怒  欲 斩 人物二  众人 只好 跪地 求情,-1,0
TRAIN_SENT_ID_259363,葛玄,左慈,左慈 授予 葛玄 道家 真经 数部 。,人物二 授予 人物一 道家 真经 数部,1,0
TRAIN_SENT_ID_258144,刘星,夏雪,可是 ， 由于 刘星 越作 越 过分 ， 让 夏雪 终于 忍无可忍 。,人物一 越作 越 过分  人物二 终于 忍无可忍,-1,0
TRAIN_SENT_ID_275928,孙莹莹,孙芸芸,一 现身 ， 总是 闪光灯 焦点 ， 孙莹莹 与 孙芸芸 这 对 孙家 姊妹花 ， 美丽 身影 总能 攻占 媒体 版面 。,现身  总是 闪光灯 焦点  人物一 人物二 孙家 姊妹花  美丽 身影 总能 攻占 媒体 版面,-1,0
TRAIN_SENT_ID_260685,王重阳,全真七子,看来 【 全真 派 】 的 衰落 ， 不是 【 王重阳 】 不行 ， 而是 【 全真七子 】 太废 。,看来  全真 派  衰落   人物一  不行   人物二  太废,1,0
TRAIN_SENT_ID_250375,赵飞燕,赵合德,刘骜 不愿 去 招惹 赵飞燕 ， 便 向 赵合德 打听 原因 。,刘骜 不愿 招惹 人物一  便 人物二 打听 原因,-1,0
TRAIN_SENT_ID_249238,皮皮鲁,鲁西西,皮皮鲁 、 鲁西西 、 大灰狼 罗克 、 舒克和贝塔 是 他 笔下 的 文学 形象 ， 有 “ 童话 大王 ” 之称 。,人物一  人物二  大灰狼 罗克  舒克和贝塔 笔下 文学 形象   童话 大王  之称,-1,0
TRAIN_SENT_ID_249204,皮皮鲁,鲁西西,皮皮鲁 和 鲁西西 都 感受 到 了 从未有过 的 亲情 的 温暖 。,人物一 人物二 感受 从未有过 亲情 温暖,-1,0
TRAIN_SENT_ID_262269,尤二姐,尤三姐,乙 那 是 《 红楼梦 》 ， 尤三姐 、 尤二姐 ！,乙  红楼梦   人物二  人物一,-1,0
TRAIN_SENT_ID_285731,陈应德,杨虎,现在 已 无法 考证 ， 但是 反映 一个 问题 ， 陈应德 投师 多 ， 从 目前 的 资料 看 ， 陈从 李景 颜 ， 杨虎 ， 王赐信 等 获益 不少 。,现在 无法 考证  反映 一个 问题  人物一 投师  目前 资料  陈从 李景 颜  人物二  王赐信 获益 不少,1,0
TRAIN_SENT_ID_263015,龙俊杰,王学明,李艺科 主要 作品 : 李艺科 话剧 作品 : 《 风铃 》 （ 《 天堂 的 风铃 》 ， 导演 龙俊杰 、 王学明 ）,李艺科 主要 作品  李艺科 话剧 作品   风铃    天堂 风铃   导演 人物一  人物二,1,0
TRAIN_SENT_ID_252698,颜回,孔子,孔子 和 颜回 得知 ， 相视而笑 。,人物二 人物一 得知  相视而笑,1,0
TRAIN_SENT_ID_257511,姜昆,马季,现场 还 播放 了 马季 、 姜昆 、 李金斗 和 杨少华 等 打来 的 祝贺 电话 。,现场 播放 人物二  人物一  李金斗 杨少华 打来 祝贺 电话,1,0
TRAIN_SENT_ID_259381,葛玄,左慈,葛玄 ： 丹阳 （ 今属 江苏省 ） 人 ， 三国 吴 道士 ， 曾 从 左慈 学 道 ， 并入 深山 修道 。,人物一  丹阳  今属 江苏省   三国 吴 道士  人物二 学 道  并入 深山 修道,1,0
TRAIN_SENT_ID_272678,蓝兰,张晓,张晓 、 蓝兰 （ 刘诗 诗饰 ）,人物二  人物一  刘诗 诗饰,-1,0
TRAIN_SENT_ID_267427,陆展元,陆立鼎,杀 陆家满 门 ， 并 折磨 陆立鼎 （ 古天乐 版 ， 陈晓 版中 改为 陆展元 ） 之女 陆无双 。,杀 陆家满 门  折磨 人物二  古天乐 版  陈晓 版中 改为 人物一  之女 陆无双,-1,0
TRAIN_SENT_ID_255351,贾午,贾南风,郭槐 过世 后 ， 贾南风 不能 遵其 遗言 ， 不但 仍 与 赵粲 、 贾午 往来 ， 更 谋杀 司马遹 ， 终 於 导致 贾家 败亡 、 自身 被 废 的 下场 。,郭槐 过世  人物二 不能 遵其 遗言  赵粲  人物一 往来  更 谋杀 司马遹  终 於 导致 贾家 败亡  废 下场,-1,0
TRAIN_SENT_ID_252919,颜回,孔子,俊逸 绝 飞尘 ： 语出 《 庄子 · 田予 方 》 ： “ 夫子 （ 指 孔子 ） 奔逸绝尘 ， 而 回 （ 指 颜回 ） 瞠若乎 后 矣 。 ”,俊逸 绝 飞尘  语出  庄子  田予 方    夫子  指 人物二  奔逸绝尘  回  指 人物一  瞠若乎,1,0
TRAIN_SENT_ID_250351,赵飞燕,赵合德,赵昭仪 （ 赵合德 ） ， 原 与其 姐 赵飞燕 同封 婕妤 ， 后晋 为昭仪 。,赵昭仪  人物二   原 姐 人物一 同封 婕妤  后晋 为昭仪,-1,0
TRAIN_SENT_ID_250397,赵飞燕,赵合德,成帝 本来 宠爱 赵飞燕 ， 后来 移情别恋 于 赵合德 。,成帝 本来 宠爱 人物一  后来 移情别恋 人物二,-1,0
TRAIN_SENT_ID_266216,蓝提斯,谢加图,魔法 骑士 雷 阿斯 （ 谢加图 、 蓝提斯 ）,魔法 骑士 雷 阿斯  人物二  人物一,-1,0
TRAIN_SENT_ID_251858,曹薰铉,李昌镐,虽然 日本队 主将 加藤 正夫 力克 曹薰铉 ， 但 还是 没能 闯过 最后 李昌镐 一关 。,日本队 主将 加藤 正夫 力克 人物一  没能 闯过 最后 人物二 一关,1,-1
TRAIN_SENT_ID_278218,张恭庆,张怡,回去 后 ， 张恭庆 和 弟弟 张恭 慈 经过 认真 讨论 达成 共识 ， 又 得到 胞妹 张怡 的 同意 ， 太太 和 弟媳 也 支持 “ 无偿 捐赠 ” 这一 倡议 。,回去  人物一 弟弟 张恭 慈 认真 讨论 达成 共识  得到 胞妹 人物二 同意  太太 弟媳 支持  无偿 捐赠  这一 倡议,-1,0
TRAIN_SENT_ID_252961,颜回,孔子,主要 的 ， 是 这篇 里面 ， 孔子 教 颜回 的 两个 方法 ： “ 心斋 ” 和 “ 坐忘 ” 。,主要  这篇 里面  人物二 教 人物一 两个 方法   心斋   坐忘,1,0
TRAIN_SENT_ID_273684,姜子牙,元始天尊,元始天尊 叫 姜子牙 下山 辅助 明主 ， 清扫 妖邪 ， 拜 将 封神 。,人物二 人物一 下山 辅助 明主  清扫 妖邪  拜 封神,1,0
TRAIN_SENT_ID_269550,步鹰,燕双鹰,在 步鹰 的 严厉 训练 下 燕双鹰 的 本领 突飞猛进 。,人物一 严厉 训练 人物二 本领 突飞猛进,1,0
TRAIN_SENT_ID_257544,毛泽民,毛泽东,柳 克斯 饭店 ， 毛泽民 为 毛泽东 领导 的 陕甘宁边区 叫好 \ / 026,柳 克斯 饭店  人物一 人物二 领导 陕甘宁边区 叫好,-1,0
TRAIN_SENT_ID_258162,刘星,夏雪,《 青春 变奏曲 》 ： 夏雪 爱 打扮 了 ， 在 街上 遭到 小流氓 的 欺负 ， 刘星 拿 起 双节棍 去 与 小流氓 格斗 ， 为 姐姐 出气 ， 结果 被 打 得 鼻青脸肿 。,青春 变奏曲   人物二 爱 打扮  街上 遭到 小流氓 欺负  人物一 双节棍 小流氓 格斗  姐姐 出气  鼻青脸肿,-1,0
TRAIN_SENT_ID_249288,陆无双,程英,第十五章 程英 和 陆无双,第十五章 人物二 人物一,-1,0
TRAIN_SENT_ID_255293,卫夫人,王羲之,所以 王羲之 和 王舒 没事 就 在 桑落洲 远眺 南京 ， 看 长江 和 湖上 的 大雁 ， 卫夫人 有 一群 驯化 了 的 野生 大雁 ， 也 就是 家鹅 。,人物二 王舒 没事 桑落洲 远眺 南京  长江 湖上 大雁  人物一 一群 驯化 野生 大雁  家鹅,1,0
TRAIN_SENT_ID_282013,殷野王,殷素素,在 回 武当 的 路上 ， 被 殷野王 （ 张无忌 舅父 ） 用 计 劫走 ， 交由 殷素素 （ 张无忌 之母 ） 于 王盘山 扬刀立 威 。,回 武当 路上  人物一  张无忌 舅父  计 劫走  交由 人物二  张无忌 之母  王盘山 扬刀立 威,-1,0
TRAIN_SENT_ID_262237,尤二姐,尤三姐,第六十五回 贾二舍 偷 娶 尤二姐 / 尤三姐 思嫁 柳 二郎,第六十五回 贾二舍 偷 娶 人物一  人物二 思嫁 柳 二郎,-1,0
TRAIN_SENT_ID_268456,单联全,冯一非,《 我 的 丑 爹 》 是 由 单联全 执导 的 一部 家庭 伦理 剧 ， 由 严顺开 、 翁虹 、 江宏恩 、 李勤勤 、 冯一非 、 张海燕 等 主演 。,丑 爹  人物一 执导 一部 家庭 伦理 剧  严顺开  翁虹  江宏恩  李勤勤  人物二  张海燕 主演,1,0
TRAIN_SENT_ID_273675,姜子牙,元始天尊,封神演义 阐教 : 姜子牙 元始天尊 ： 阐教 教主 ， 居于 昆仑山 玉虚宫 。,封神演义 阐教  人物一 人物二  阐教 教主  居于 昆仑山 玉虚宫,1,0
TRAIN_SENT_ID_282416,赵公明,通天教主,截教 副 教主 内容简介 : 一个 地球 人 ， 穿越 到 洪荒世界 ， 通天教主 座下 ， 一个 叫 “ 赵公明 ” 的 人 身上 ， 神话 ， 从此 之后 开始 改变 … …,截教 副 教主 内容简介  一个 地球  穿越 洪荒世界  人物二 座下  一个  人物一  身上  神话  之后 改变,1,0
TRAIN_SENT_ID_266063,张学思,张学良,不久 东北局 决定 将 “ 东北 公学 ” 改名 为 “ 东北大学 ” ， 任命 张学良 将军 的 胞弟 、 东北 行政 委员会 副 主席 张学思 兼任 校长 ， 校址 设 于 本溪 。,不久 东北局 决定  东北 公学  改名  东北大学   任命 人物二 将军 胞弟  东北 行政 委员会 副 主席 人物一 兼任 校长  校址 设 本溪,-1,0
TRAIN_SENT_ID_266001,王恬,王洽,王恬 王悦 王洽 王协 王劭 王荟,人物一 王悦 人物二 王协 王劭 王荟,-1,0
TRAIN_SENT_ID_282822,松田翔太,松田龙平,可是 松田翔太 并 没有 哥哥 松田龙平 那么 幸运 ， 所以 这次 的 主演 机会 可谓 是 十分 难得 。,人物一 没有 哥哥 人物二 幸运  主演 机会 可谓 十分 难得,-1,-1
TRAIN_SENT_ID_257035,洪敬尧,洪荣宏,洪荣宏 ， 洪敬尧 ， 洪荣 良,人物二  人物一  洪荣 良,-1,0
TRAIN_SENT_ID_259930,周志文,周志康,周志文 和 周志康 ： 香港 艺员,人物一 人物二  香港 艺员,-1,0
TRAIN_SENT_ID_273704,姜子牙,元始天尊,玉虚宫 姜子牙 : 元始天尊 的 门人 。,玉虚宫 人物一  人物二 门人,1,0
TRAIN_SENT_ID_253892,赵合德,赵飞燕,"赵飞燕 赵合德 这 对 双胞 姐妹花 , 从 流落 街头 到 成为 歌女 , 再到 飞上 枝头 变凤凰 。",人物二 人物一 双胞 姐妹花  流落 街头 成为 歌女  再到 飞上 枝头 变凤凰,-1,0
TRAIN_SENT_ID_259005,张苞,张绍,子女 张苞 张绍 大张 氏 小张 氏,子女 人物一 人物二 大张 氏 小张 氏,-1,0
TRAIN_SENT_ID_265553,张崇基,张崇德,李大卫 与 著名 音乐 人 张崇基 张崇德 合影,李大卫 著名 音乐 人物一 人物二 合影,-1,0
TRAIN_SENT_ID_262252,尤二姐,尤三姐,尤二姐 吞金 自尽 ， 浪荡子 贾琏 痛心 流泪 ； 尤三姐 伏剑 自刎 ， 冷二郎 柳湘莲 遁入空门 ； 林黛玉 泪尽 自亡 ， 怡红 公子 贾宝玉 心属 情憎 。,人物一 吞金 自尽  浪荡子 贾琏 痛心 流泪  人物二 伏剑 自刎  冷二郎 柳湘莲 遁入空门  林黛玉 泪尽 自亡  怡红 公子 贾宝玉 心属 情憎,-1,0
TRAIN_SENT_ID_251616,穆春,穆弘,张横 引着 穆弘 、 穆春 、 薛永 ， 带 十数个 庄客 在 一只 船上 。,张横 引着 人物二  人物一  薛永  带 十数个 庄客 一只 船上,-1,0
TRAIN_SENT_ID_270987,严舆,严白虎,701 关兴 702 趜 义 703 趜 演 704 祢衡 705 严白虎 706 严 如意 707 严政 708 严畯 709 严纲 710 严舆,关兴  趜 义  趜 演  祢衡  人物二  严 如意  严政  严畯  严纲  人物一,-1,0
TRAIN_SENT_ID_264942,贾元春,贾宝玉,贾宝玉 、 林黛玉 、 薛宝钗 、 史湘云 、 王熙凤 、 贾元春 、 贾迎春 、 贾探春 、 贾惜春 、 妙玉 、 李纨 、 巧姐 、 秦可卿,人物二  林黛玉  薛宝钗  史湘云  王熙凤  人物一  贾迎春  贾探春  贾惜春  妙玉  李纨  巧姐  秦可卿,-1,0
TRAIN_SENT_ID_252643,颜回,孔子,孔子 对 曰 ： “ 夫其 所以 为 颜回 者 ， 此 之类 也 ， 岂足 多 哉 ？ ”,人物二 曰   夫其 人物一   岂足,1,0
TRAIN_SENT_ID_274691,冯国纶,冯国经,利丰 主席 冯国经 （ 左 ） 及 执行 副 主席 冯国纶,利丰 主席 人物二  左  执行 副 主席 人物一,-1,0
TRAIN_SENT_ID_263650,尹澄,尹夏沫,画展 之初 ， 前来 参观 的 人 并不多 ， 除了 尹夏沫 、 欧辰 和 珍恩 每天 都 在 ， 大多数 来 的 是 尹澄 生前 的 老师 、 好友 和 同学 。,画展 之初  前来 参观 并不多  人物二  欧辰 珍恩 每天  大多数 人物一 生前 老师  好友 同学,-1,0
TRAIN_SENT_ID_252975,颜回,孔子,其 《 送穷文 》 篇 末谓 “ 穷鬼 本出 有 穷氏 ， 尝 从 孔子 游陈 、 蔡间 ， 既 而 归鲁 ， 舍 於 颜回 、 原宪家 ” 云云 。,送穷文  篇 末谓  穷鬼 本出 穷氏  尝 人物二 游陈  蔡间  归鲁  舍 於 人物一  原宪家,1,0
TRAIN_SENT_ID_251836,梅超风,黄药师,"桃花 岛上 的 鸡毛蒜皮 , 让 梅超风 不再 那么 脑残 , 但是 不 保证 他们 真的 会 在 一起 , 因为 黄药师 才 是 主角 , 唯一 的 … …",桃花 岛上 鸡毛蒜皮  人物一 不再 脑残  保证 真的 会 一起  人物二 主角  唯一,1,0
TRAIN_SENT_ID_260579,金敬姬,金正日,朝鲜人民军 最高 司令官 金正日 27 日 下达 第 0051 号 命令 ， 任命 金敬姬 、 金正恩 、 崔龙海 等 6 人为 大将 。,朝鲜人民军 最高 司令官 人物二  日 下达  号 命令  任命 人物一  金正恩  崔龙海  人为 大将,-1,0
TRAIN_SENT_ID_256823,孙周,孙淳,倪以临 作品 : 倪以临 参演 电视剧 : 2006 相思树 饰演 : 惠兰 导演 : 孙周 合作 演员 : 吴秀波 浦蒲 孙淳 陈树,倪以临 作品  倪以临 参演 电视剧   相思树 饰演  惠兰 导演  人物一 合作 演员  吴秀波 浦蒲 人物二 陈树,-1,0
TRAIN_SENT_ID_263914,汤镇宗,汤镇业,伴 我 俪 人 演职员 表 : 伴 我 俪 人 演员表 : ◆ 主演 : 邱玉茹 汤镇宗 童玲 汤镇业 狄威 张国强 黄伟良 伴 我 俪 人 职员表 : ◆ 制片 : 赖汶星,伴 俪 演职员 表  伴 俪 演员表  ◆ 主演  邱玉茹 人物一 童玲 人物二 狄威 张国强 黄伟良 伴 俪 职员表  ◆ 制片  赖汶星,-1,0
TRAIN_SENT_ID_258173,李宏毅,李明霖,李宏毅 个人 生活 : 李弘毅 哥哥 李明霖 ， 音乐 制作 人 、 唱作 人 、 歌手 。,人物一 个人 生活  李弘毅 哥哥 人物二  音乐 制作  唱作  歌手,-1,-1
TRAIN_SENT_ID_261580,南宫敬叔,孟懿子,反自 祲 祥 ， 宿于 䓕 氏 ， 生 孟懿子 及 南宫敬叔 于泉 丘人 。,反自 祲 祥  宿于 䓕 氏  生 人物二 人物一 于泉 丘人,-1,0
TRAIN_SENT_ID_259678,公孙胜,罗真人,罗真人 惜 叹 公孙胜 董灵 清法 破无虚术,人物二 惜 叹 人物一 董灵 清法 破无虚术,1,0
TRAIN_SENT_ID_250606,鲁西西,皮皮鲁,皮皮鲁 、 鲁西西 、 大灰狼 罗克 、 舒克和贝塔 是 他 笔下 的 人物 。,人物二  人物一  大灰狼 罗克  舒克和贝塔 笔下 人物,-1,0
TRAIN_SENT_ID_275811,俞明颐,俞明诗,有 三子 一女 ， 长子 俞明震 ， 次子 俞明 观 ， 三子 俞明颐 ， 长女 俞明诗 。,三子 一女  长子 俞明震  次子 俞明 观  三子 人物一  长女 人物二,-1,0
TRAIN_SENT_ID_249529,李蔡,李广,而 他 的 堂兄弟 李蔡 才能 不如 他 却 官至 丞相 ， 古人 认为 奇数 不 吉利 ， 司马迁 评价 为 “ 李广 老 ， 数奇 。 ”,堂兄弟 人物一 官至 丞相  古人 认为 奇数 吉利  司马迁 评价  人物二 老  数奇,-1,0
TRAIN_SENT_ID_258130,刘星,夏雪,夏雪 帮助 刘星 把 怪客 “ 软禁 ” 在家 。,人物二 帮助 人物一 怪客  软禁  在家,-1,0
TRAIN_SENT_ID_250582,鲁西西,皮皮鲁,因为 他 的 《 舒克和贝塔 》 、 《 皮皮鲁 和 鲁西西 》 动画 都 是 当之无愧 的 NUMONE ！,舒克和贝塔    人物二 人物一  动画 当之无愧,-1,0
TRAIN_SENT_ID_273666,姜子牙,元始天尊,整个 故事 从 元始天尊 让 姜子牙 带 封神榜 下山 救世 开始 ， 并 随着 山上 的 各路 仙魔道 妖 的 各种 选择 ， 最终 展开 了 一场 震天撼地 的 神魔 大战 。,整个 故事 人物二 人物一 带 封神榜 下山 救世  山上 各路 仙魔道 妖 选择  最终 展开 一场 震天撼地 神魔 大战,1,0
TRAIN_SENT_ID_285629,李世熊,黄道周,李世熊 得知 黄道周 以身 殉节 后 ， 筑坛 遥祭 痛哭 ； 并且 奔赴 福州 ， 上 《 褒 恤孤 忠疏 》 ， 慰唁 遗属 。,人物一 得知 人物二 以身 殉节  筑坛 遥祭 痛哭  奔赴 福州   褒 恤孤 忠疏   慰唁 遗属,1,0
TRAIN_SENT_ID_256488,周武,周文,鲁国 的 开国 君主 是 周公旦 的 长 子伯禽 ， 周公旦 是 周武 王之弟 ， 那么 孟氏 应该 是 周文 王 的 姬姓 子孙 。,鲁国 开国 君主 周公旦 长 子伯禽  周公旦 人物一 王之弟  孟氏 应该 人物二 王 姬姓 子孙,-1,0
TRAIN_SENT_ID_269009,李如柏,李如松,李如松 、 李如柏 、 李如桢 、 李如樟 、 李如梅 都 是 总兵 官 ， 李如梓 、 李如 梧 、 李如桂 、 李如 楠亦官 至 参将 。,人物二  人物一  李如桢  李如樟  李如梅 总兵 官  李如梓  李如 梧  李如桂  李如 楠亦官 参将,-1,0
TRAIN_SENT_ID_269411,刘伟,马季,相声 《 五官 争功 》 ， 合作 演员 ： 马季 、 赵炎 、 刘伟 、 冯巩,相声  五官 争功   合作 演员  人物二  赵炎  人物一  冯巩,1,0
TRAIN_SENT_ID_269012,李如柏,李如松,人们 把 麻家 与 同样 是 武将 世家 的 李如松 、 李如柏 等 并 称为 “ 东 李西 麻 ” 。,麻家 同样 武将 世家 人物二  人物一 称为  东 李西 麻,-1,0
TRAIN_SENT_ID_252440,颜回,孔子,颜回 早逝 ， 颜无繇 因 家里 穷 ， 就 请求 孔子 把 车子 卖 了 来 帮 他 安葬 。,人物一 早逝  颜无繇 家里 穷  请求 人物二 车子 卖 帮 安葬,1,0
TRAIN_SENT_ID_249106,吕洞宾,韩湘子,据悉 ， 韩湘子 后来 又 从师 吕洞宾 ， 修道 成仙 ， 位列 仙班 。,据悉  人物二 后来 从师 人物一  修道 成仙  位列 仙班,1,0
TRAIN_SENT_ID_249127,皮皮鲁,鲁西西,皮皮鲁 和 鲁西西 演唱者 ：,人物一 人物二 演唱者,-1,0
TRAIN_SENT_ID_258816,张无忌,殷离,射雕 三部曲 电视 : 1978 ， 香港 无线 ， 郑少秋 饰 张无忌 ， 汪明荃 饰 赵敏 ， 赵雅芝 饰 周芷若 ， 陈玉莲 饰小昭 ， 庄文清 饰 殷离 （ 蛛儿 ）,射雕 三部曲 电视    香港 无线  郑少秋 饰 人物一  汪明荃 饰 赵敏  赵雅芝 饰 周芷若  陈玉莲 饰小昭  庄文清 饰 人物二  蛛儿,-1,0
TRAIN_SENT_ID_251866,曹薰铉,李昌镐,他 与 李昌镐 、 曹薰铉 、 刘昌赫 合称 “ 韩国 棋坛 四大 金刚 ” 。,人物二  人物一  刘昌赫 合称  韩国 棋坛 四大 金刚,1,0
TRAIN_SENT_ID_269420,刘伟,马季,表演者 ： 马季 、 赵炎 、 冯巩 、 刘伟 、 王金宝 、 王谦祥 、 李增瑞 、 戴志诚 、 郑健,表演者  人物二  赵炎  冯巩  人物一  王金宝  王谦祥  李增瑞  戴志诚  郑健,1,-1
TRAIN_SENT_ID_273369,杨锐,张之洞,六 君子 被捕 ， 张之洞 为何 独独 营救 杨锐 一人 ？,六 君子 被捕  人物二 独独 营救 人物一 一人,1,0
TRAIN_SENT_ID_286096,赵姝,孙悦,孙悦 首徒 赵姝 2009 向 梦想 启航 … …,人物二 首徒 人物一  梦想 启航,1,0
TRAIN_SENT_ID_267585,骆赢,骆羽,"女子双打 ： 于洋 / 王晓理 、 田卿 / 赵芸蕾 、 成淑 / 潘攀 、 包宜鑫 / 钟倩欣 、 马晋 / 汤金华 , 骆赢 、 骆羽",女子双打  于洋  王晓理  田卿  赵芸蕾  成淑  潘攀  包宜鑫  钟倩欣  马晋  汤金华  人物一  人物二,-1,0
TRAIN_SENT_ID_267703,柳承范,柳承莞,基本 信息 : 《 哭泣 的 拳头 》 是 由 柳承莞 编导 ， 崔岷植 、 柳承范 主演 的 动作 剧情片 。,基本 信息   哭泣 拳头  人物二 编导  崔岷植  人物一 主演 动作 剧情片,-1,-1
TRAIN_SENT_ID_268894,司徒静,司徒剑南,她 随后 想出 一计 ， 在 万人敌 司徒剑南 等 人 的 帮助 下 梁君卓 误以为 司徒静 有 在 夜间 咬人 喝血 的 臆病 ， 梁君卓 收回 了 求亲 的 请求 。,想出 一计  万人敌 人物二 帮助 梁君卓 误以为 人物一 夜间 咬人 喝血 臆病  梁君卓 收回 求亲 请求,-1,0
TRAIN_SENT_ID_255468,罗成,秦琼,第三十九回 秦琼 三锏 倒 铜旗 罗成 枪 挑孽 世雄,第三十九回 人物二 三锏 倒 铜旗 人物一 枪 挑孽 世雄,-1,0
TRAIN_SENT_ID_255294,卫夫人,王羲之,王羲之 《 题 卫夫人 ( 笔阵 图 ) 后 》,人物二  题 人物一  笔阵 图,1,0
TRAIN_SENT_ID_263375,武修文,武敦儒,师侄 ： 郭 芙 、 郭襄 、 郭破虏 、 武敦儒 、 武修文 。,师侄  郭 芙  郭襄  郭破虏  人物二  人物一,-1,0
TRAIN_SENT_ID_284307,郑好,王志涛,王志涛 — — 耿炎 、 刘江 舸 、 郑好,人物二   耿炎  刘江 舸  人物一,1,0
TRAIN_SENT_ID_265554,张崇基,张崇德,TakeItEasy （ 曲 / 编 ） ‖ 张崇基 / 张崇德 ‖ 【 TakeItEasy 】 ‖ 2009.04,曲  编  ‖ 人物一  人物二 ‖    ‖,-1,0
TRAIN_SENT_ID_263548,林逸,杨明,王笑 嫣 林逸 的 师娘 之一 ， 杨 七七 的 母亲 ， 杨明 的 妻子 之一 。,王笑 嫣 人物一 师娘  杨 七七 母亲  人物二 妻子,1,0
TRAIN_SENT_ID_260689,王重阳,全真七子,相关 传说 : 相传 王重阳 在 此 闭关 成功 ， 继而 发展 处 全真教 ， 出现 全真七子 。,相关 传说  相传 人物一 闭关 成功  发展 处 全真教  出现 人物二,1,0
TRAIN_SENT_ID_263929,汤镇宗,汤镇业,《 王者 清风 》 主演 ： 何晟铭 蒋梦婕 汤镇宗 汤镇业 导演 ： 何澍培,王者 清风  主演  何晟铭 蒋梦婕 人物一 人物二 导演  何澍培,-1,0
TRAIN_SENT_ID_257827,林平之,岳不群,此外 ， 林平之 虽然 憎恨 岳不群 ， 又 薄待 岳灵珊 ， 但 言语 上 仍然 对 她 不失 敬意 ， 亦 没有 对 她 做 过 什么 。,人物一 憎恨 人物二  薄待 岳灵珊  言语 仍然 不失 敬意  没有 做,1,1
