sent_id,sent_id,entity1,entity2,sent,processed_sent,label
TRAIN_SENT_ID_261653,,宋小宝,赵本山,不过 ， 对于 宋小宝 来说 ， 除了 师父 赵本山 的 提携 和 帮助 ， 他 过往 的 那些 经历 也 是 促使 他 成功 的 最 宝贝 财 宋小宝 ( 10 张 ),人物一  师父 人物二 提携 帮助  过往 经历 促使 成功 宝贝 财 人物一   张,1
TRAIN_SENT_ID_264530,,岳云鹏,郭德纲,2 ： 《 返场 》 郭德纲 于谦 岳云鹏,返场  人物二 于谦 人物一,1
TRAIN_SENT_ID_269730,,薛洋,薛之荔,看着 薛洋 和 楚牧 还 没 赶上来 ， 她俩 故意 放慢 速度 ， 薛之荔 对 齐齐 讲起 了 薛洋 的 故事 。,看着 人物一 楚牧 没 赶上来  她俩 故意 放慢 速度  人物二 齐齐 讲起 人物一 故事,-1
TRAIN_SENT_ID_263363,,武修文,武敦儒,第一篇 ， 写 武敦儒 、 武修文 。,第一篇  写 人物二  人物一,-1
TRAIN_SENT_ID_259362,,葛玄,左慈,左慈 （ 字元放 ） 、 葛玄 （ 字孝先 ） 最尊尚 的 也 可能 是 「 金丹 仙经 」 。,人物二  字元放   人物一  字孝先  最尊尚 可能  金丹 仙经,1
TRAIN_SENT_ID_261166,,王缙,王维,唐代宗 曾誉 之 为 “ 天下 文宗 ” （ 《 答 王缙 进 王维 集表 诏 》 ） 。,唐代宗 曾誉  天下 文宗    答 人物一 进 人物二 集表 诏,-1
TRAIN_SENT_ID_255202,,赵海燕,赵本山,《 有病 没病 》 （ 表演 ： 赵本山 、 赵海燕 、 李正春 ）,有病 没病   表演  人物二  人物一  李正春,1
TRAIN_SENT_ID_263407,,武修文,武敦儒,师兄 ： 武敦儒 、 武修文,师兄  人物二  人物一,-1
TRAIN_SENT_ID_252907,,颜回,孔子,颜回 之死 与 孔子 之生,人物一 之死 人物二 之生,1
TRAIN_SENT_ID_270823,,伍天锡,伍云召,李元霸 、 宇文成都 、 裴元庆 、 雄阔海 、 伍天锡 、 伍云召 、 罗成 、 杨林 、 魏文通,李元霸  宇文成都  裴元庆  雄阔海  人物一  人物二  罗成  杨林  魏文通,-1
TRAIN_SENT_ID_255318,,卫夫人,王羲之,这些 记载 ， 都 提到 卫夫人 是 王羲之 的 书法 老师 及 卫夫人 书 法学 钟繇 。,记载  提到 人物一 人物二 书法 老师 人物一 书 法学 钟繇,1
TRAIN_SENT_ID_259940,,周志文,周志康,刘威 煌 、 陈鸿硕 、 周志文 、 周志康,刘威 煌  陈鸿硕  人物一  人物二,-1
TRAIN_SENT_ID_279081,,夏林菲,夏翼,萌 侦探 纪事 内容简介 : 萌 侦探 纪事 《 萌 侦探 纪事 1 》 : 本季 主角 ： 莫海音 、 罗洛 、 夏林菲 、 夏翼 、 优优 。,萌 侦探 纪事 内容简介  萌 侦探 纪事  萌 侦探 纪事    本季 主角  莫海音  罗洛  人物一  人物二  优优,-1
TRAIN_SENT_ID_270566,,全真七子,王重阳,陈抟 、 王重阳 、 全真七子 、 张三丰 ， 都 是 武功 出神入化 之 人 。,陈抟  人物二  人物一  张三丰  武功 出神入化,1
TRAIN_SENT_ID_265117,,杨志刚,郭靖宇,6 月 同王 珞丹 、 杨志刚 共同 出演 郭靖宇 新剧 《 红娘子 》 ， 颠覆 了 以往 霸气 威严 的 形象 ， 饰演 了 一个 忍辱负重 的 “ 窝囊 ” 老爷 。,月 同王 珞丹  人物一 共同 出演 人物二 新剧  红娘子   颠覆 以往 霸气 威严 形象  饰演 一个 忍辱负重  窝囊  老爷,-1
TRAIN_SENT_ID_259936,,周志文,周志康,「 超级 巨声 队 」 由 孖 宝兄弟 周志文 、 周志康 上场 献唱 不了情 女曲 男唱 ， 可 有 不同 韵味 ？,超级 巨声 队  孖 宝兄弟 人物一  人物二 上场 献唱 不了情 女曲 男唱  不同 韵味,-1
TRAIN_SENT_ID_251410,,李瀚章,李鸿章,李鸿章 扶植 米市 是 事实 ， 但 具体 操作者 是 张樵 野 （ 张荫桓 ） ， 同治 年间 他 就 结识 了 广东 督粮道 李瀚章 （ 鸿章 之兄 ） 。,人物二 扶植 米市 事实  具体 操作者 张樵 野  张荫桓   同治 年间 结识 广东 督粮道 人物一  鸿章 之兄,-1
TRAIN_SENT_ID_252406,,颜回,孔子,孔子 信 颜回,人物二 信 人物一,1
TRAIN_SENT_ID_276236,,张阿生,郭靖,【 1207 年 】 江南七怪 北上 蒙古 寻 郭靖 ， 并斗 黑风双 煞 ， 陈玄风 死 ， 张阿生 死 ， 郭靖 拜 江南 六怪 为 师 。,年  江南七怪 北上 蒙古 寻 人物二  并斗 黑风双 煞  陈玄风 死  人物一 死  人物二 拜 江南 六怪 师,1
TRAIN_SENT_ID_268838,,骆羽,骆赢,混双 ： 何汉斌 / 包宜鑫 刘成 / 骆赢 李根 / 骆羽,混双  何汉斌  包宜鑫 刘成  人物二 李根  人物一,-1
TRAIN_SENT_ID_263361,,武修文,武敦儒,师兄 ： 武修文 、 武敦儒,师兄  人物一  人物二,-1
TRAIN_SENT_ID_250586,,鲁西西,皮皮鲁,皮皮鲁 和 鲁西西 演职员 表 : 皮皮鲁 和 鲁西西 演员表 : （ 资料 来源 ）,人物二 人物一 演职员 表  人物二 人物一 演员表   资料 来源,-1
TRAIN_SENT_ID_277018,,钟藜,钟馗,钟藜 电视剧 介绍 : 《 天师 钟馗 》 是 浙江 华策影视 公司出品 的 一部 古装 奇 《 天师 钟馗 》 ( 7 张 ),人物一 电视剧 介绍   天师 人物二  浙江 华策影视 公司出品 一部 古装 奇  天师 人物二    张,-1
TRAIN_SENT_ID_255304,,卫夫人,王羲之,卫夫人 的 启蒙 书教 ， 不仅 影响 了 王羲之 （ 羲 之 还有 一个 蒙师 ， 即 叔父 王廙 ） ， 也 造就 了 江夏 李氏 这一 书法 世家 。,人物一 启蒙 书教  影响 人物二  羲 一个 蒙师  叔父 王廙   造就 江夏 李氏 这一 书法 世家,1
TRAIN_SENT_ID_279084,,程英,黄药师,师父 ： 黄药师 赵韩樱子 版 程英 ( 9 张 ),师父  人物二 赵韩樱子 版 人物一   张,1
TRAIN_SENT_ID_285613,,韩笑,韩少云,韩笑 嗓音 甜美 ， 颇具 韩少云 大师 风范 。,人物一 嗓音 甜美  颇具 人物二 大师 风范,1
TRAIN_SENT_ID_264568,,胡青牛,张无忌,1351 胡青牛 、 纪晓芙 、 简捷 、 薛公远 卒 ， 张无忌 初遇 朱元璋 等 明教 教众 。,人物一  纪晓芙  简捷  薛公远 卒  人物二 初遇 朱元璋 明教 教众,1
TRAIN_SENT_ID_273675,,姜子牙,元始天尊,封神演义 阐教 : 姜子牙 元始天尊 ： 阐教 教主 ， 居于 昆仑山 玉虚宫 。,封神演义 阐教  人物一 人物二  阐教 教主  居于 昆仑山 玉虚宫,1
TRAIN_SENT_ID_261350,,何猷启,何超莲,吴克群 首先 献唱 《 为 你 写诗 》 及 《 追 》 筹得 50 万港元 ， 何超莲 与 胞弟 何猷启 坐在 观众席 第二排 欣赏 。,吴克群 献唱  写诗   追  筹得  万港元  人物二 胞弟 人物一 坐在 观众席 第二排 欣赏,-1
TRAIN_SENT_ID_254284,,张顺,张横,张顺 死后 ， 还 把 灵魂 附在 张横 身上 杀死 了 方天定 。,人物一 死后  灵魂 附在 人物二 身上 杀死 方天定,-1
TRAIN_SENT_ID_257460,,姜昆,马季,马季 、 姜昆 师徒俩 叶立中 — — 曹俊清 、 朱文正,人物二  人物一 师徒俩 叶立中   曹俊清  朱文正,1
TRAIN_SENT_ID_273371,,杨锐,张之洞,一 、 杨锐 是 张之洞 的 “ 坐京 ”,人物一 人物二  坐京,1
TRAIN_SENT_ID_259393,,温策,温慧,温策 煌 大仙 遭祸 : 南宫煌 ： 温慧 — — ！,人物一 煌 大仙 遭祸  南宫煌  人物二,-1
TRAIN_SENT_ID_255411,,罗成,秦琼,"走向 传奇 内容简介 : 传奇世界 无处 不 传奇 , 关公 秦琼 比 义气 , 赵云 罗成 赛 枪法 , 张翼德 尉迟恭 谁 脸 更 黑 , 李元霸 和 李存孝 谁 更 牛 。",走向 传奇 内容简介  传奇世界 无处 传奇  关公 人物二 义气  赵云 人物一 赛 枪法  张翼德 尉迟恭 脸 更 黑  李元霸 李存孝 更 牛,-1
TRAIN_SENT_ID_266004,,王恬,王洽,他 出身 于 书法 世家 ， 伯父 王翼 、 王导 ， 堂兄弟 王恬 、 王洽 等 都 是 当时 的 书法 名手 。,出身 书法 世家  伯父 王翼  王导  堂兄弟 人物一  人物二 当时 书法 名手,-1
TRAIN_SENT_ID_254269,,张顺,张横,张顺 人物 生平 : 张顺 登场 : 张顺 的 首次 出现 书中 是 由 其兄 张横 介绍 。,人物一 人物 生平  人物一 登场  人物一 首次 出现 书中 其兄 人物二 介绍,-1
TRAIN_SENT_ID_255417,,罗成,秦琼,36 专诸巷 罗成 认 舅母 贾柳店 秦琼 待 宾朋,专诸巷 人物一 认 舅母 贾柳店 人物二 宾朋,-1
TRAIN_SENT_ID_252868,,颜回,孔子,孔子 与 颜回,人物二 人物一,1
TRAIN_SENT_ID_264196,,陈真,霍元甲,另有 《 警察故事 》 系列 等 影片 及 电视剧 《 霍元甲 》 、 《 陈真 》 、 《 再 向 虎山行 》 等剧 至今 脍炙人口 。,另有  警察故事  系列 影片 电视剧  人物二    人物一    虎山行  等剧 脍炙人口,1
TRAIN_SENT_ID_274087,,南宫敬叔,孔子,相传 孔子 与 南宫敬叔 适周 问礼于 老聃 ， 问 乐于 苌 弘 。,相传 人物二 人物一 适周 问礼于 老聃  问 乐于 苌 弘,1
TRAIN_SENT_ID_271243,,马季,侯宝林,在此之前 ， 侯宝林 、 马季 曾 分别 应邀 出访 日本 。,在此之前  人物二  人物一 应邀 出访 日本,1
TRAIN_SENT_ID_262256,,尤二姐,尤三姐,当然 ， 尤三姐 与 逆来顺受 的 尤二姐 不同 。,人物二 逆来顺受 人物一 不同,-1
TRAIN_SENT_ID_261643,,宋小宝,赵本山,赵本山 也 曾多次 想带 爱徒 宋小宝 上 春晚 ， 但 都 因为 作品 不 理想 、 身体状况 不 允许 等 原因 半路 “ 夭折 ” 。,人物二 曾多次 想带 爱徒 人物一 春晚  作品 理想  身体状况 允许 原因 半路  夭折,1
TRAIN_SENT_ID_253886,,赵合德,赵飞燕,当然 ， 赵飞燕 和 赵合德 两 姊妹 还 不能 称其为 妓女 ， 但殊 归 同途 。,人物二 人物一 两 姊妹 不能 称其为 妓女  但殊 同途,-1
TRAIN_SENT_ID_266209,,范遥,赵敏,赵敏 将 六大 门派 门人 押 至 大都 万安 寺 ， 范遥 背叛 旧主 重返 明教 ， 救出 门派 众人 ； 灭绝师太 卒 ， 立 周芷若 为 新 峨嵋 掌门 。,人物二 六大 门派 门人 押 大都 万安 寺  人物一 背叛 旧主 重返 明教  救出 门派 众人  灭绝师太 卒  立 周芷若 新 峨嵋 掌门,1
TRAIN_SENT_ID_268972,,韩非,荀子,荀子 、 李斯 和 韩非,人物二  李斯 人物一,1
TRAIN_SENT_ID_261583,,南宫敬叔,孟懿子,孟懿子 和 南宫敬叔 学礼于 孔子 。,人物二 人物一 学礼于 孔子,-1
TRAIN_SENT_ID_264555,,胡青牛,张无忌,张无忌 悟性 : 胡青牛 见 他 悟性 奇高 … …,人物二 悟性  人物一 见 悟性 奇高,1
TRAIN_SENT_ID_265498,,薛蝌,薛蟠,薛蟠 案子 要 重判 ， 夏金桂 大吵大闹 ， 因为 调戏 薛蝌 被 香菱 撞见 ， 她 想 毒死 香菱 ， 不料 自己 误食 毒药 而 死 。,人物二 案子 重判  夏金桂 大吵大闹  调戏 人物一 香菱 撞见  想 毒死 香菱  误食 毒药 死,-1
TRAIN_SENT_ID_255490,,罗成,秦琼,李世民 、 罗成 、 程咬金 、 秦琼 等 众 英雄 最终 识破阴谋 ， 力战 突出重围 。,李世民  人物一  程咬金  人物二 众 英雄 最终 识破阴谋  力战 突出重围,-1
TRAIN_SENT_ID_252777,,颜回,孔子,— — — 颜廷 淦 （ 孔子 文化 研究 院长 ， 复圣 颜回 第 78 代 嫡孙 ） 我 对 三角洲 充满信心 ， 希望 张成志 在 太空 ， 路 在 脚下 ， 越走越远 。,颜廷 淦  人物二 文化 研究 院长  复圣 人物一  代 嫡孙  三角洲 充满信心  希望 张成志 太空  路 脚下  越走越远,1
TRAIN_SENT_ID_261650,,宋小宝,赵本山,2013 - 03 - 02 ： 樱桃红 「 宋小宝 ， 沈春阳 ， 杨冰 ， 赵本山 」,樱桃红  人物一  沈春阳  杨冰  人物二,1
TRAIN_SENT_ID_271246,,马季,侯宝林,“ 除了 铃不响 ， 上下 哪儿 都响 ” ； “ 逗你玩 儿 ” ； “ 宇宙 牌 香烟 ” ， 侯宝林 、 马三立 、 马季 等 人 的 著名 段子 至今 还 能 让 人乐 。,铃不响  都响    逗你玩    宇宙 牌 香烟   人物二  马三立  人物一 著名 段子 人乐,1
TRAIN_SENT_ID_259945,,周志文,周志康,胡鸿钧 、 周志文 、 周志康,胡鸿钧  人物一  人物二,-1
TRAIN_SENT_ID_275887,,王子豪,王子杰,暂时 以 王子豪 王子杰 、 陆霏霏 及 郑仲恒 3 组 分数 最低 。,暂时 人物一 人物二  陆霏霏 郑仲恒  组 分数 最低,-1
TRAIN_SENT_ID_252391,,颜回,孔子,曾 参以 他 的 建树 ， 终于 走进 大儒 殿堂 ， 与 孔子 、 孟子 、 颜子 （ 颜回 ） 、 子思 比肩 共 称为 五大 圣人 。,参以 建树  终于 走进 大儒 殿堂  人物二  孟子  颜子  人物一   子思 比肩 共 称为 五大 圣人,1
TRAIN_SENT_ID_259958,,叶家妤,白家绮,叶家妤 + 白家绮 、 殷琦 + Natasha,人物一  人物二  殷琦,-1
TRAIN_SENT_ID_274684,,冯国纶,冯国经,· 冯汉柱 ： 利丰 第二代 接班人 ， 知名 商人 冯国经 、 冯国纶 之 父 。,冯汉柱  利丰 第二代 接班人  知名 商人 人物二  人物一 父,-1
TRAIN_SENT_ID_268812,,洪凌波,李莫愁,洪凌波 角色 能力 : 洪凌波 得 李莫愁 真传 ， 而 李莫愁 的 古墓 剑法 精妙 无比 ， 故 洪凌波 的 剑法 也 是 凌厉 。,人物一 角色 能力  人物一 人物二 真传  人物二 古墓 剑法 精妙 无比  人物一 剑法 凌厉,1
TRAIN_SENT_ID_250625,,鲁西西,皮皮鲁,《 皮皮鲁 与 鲁西西 》 等等 !,人物二 人物一,-1
TRAIN_SENT_ID_276909,,吕青柠,吕青橙,电视剧 已知 招式 ： 排山倒海 （ 郭芙蓉 ） ， 惊涛骇浪 （ 郭蔷薇 、 吕青橙 ） ， 大浪淘沙 （ 吕青柠 ）,电视剧 已知 招式  排山倒海  郭芙蓉   惊涛骇浪  郭蔷薇  人物二   大浪淘沙  人物一,-1
TRAIN_SENT_ID_282924,,骆玉笙,韩永禄,西河 鼓书 曲种 名家 : 刘宝全 白云鹏 阎秋霞 骆玉笙 韩永禄 孙书 筠 王文禄 金万昌 籍薇,西河 鼓书 曲种 名家  刘宝全 白云鹏 阎秋霞 人物一 人物二 孙书 筠 王文禄 金万昌 籍薇,1
TRAIN_SENT_ID_252596,,颜回,孔子,颜回 随 孔子 重回 帝丘 ， 途经 蒲邑 ， 又 遭到 蒲人 的 拦截 。,人物一 人物二 重回 帝丘  途经 蒲邑  遭到 蒲人 拦截,1
TRAIN_SENT_ID_252446,,颜回,孔子,颜回 至 匡 ， 见到 了 被 围困 的 孔子 等 人 。,人物一 匡  见到 围困 人物二,1
TRAIN_SENT_ID_259745,,李偲菘,李伟菘,孙燕姿 孙燕姿 、 李伟菘 、 李偲菘 、 KenneC 《 是 时候 》,孙燕姿 孙燕姿  人物二  人物一,-1
TRAIN_SENT_ID_270557,,全真七子,王重阳,防御 路线 走 王重阳 ， 全真七子 相应 点灯 。,防御 路线 走 人物二  人物一 相应 点灯,1
TRAIN_SENT_ID_261724,,汤镇业,汤镇宗,张敏 、 汤镇宗 、 汤镇业 、 梁家仁 、 孙国明,张敏  人物二  人物一  梁家仁  孙国明,-1
TRAIN_SENT_ID_259672,,公孙胜,罗真人,罗真人 算到 了 公孙胜 吃亏 了 ， 便 派 道童 来 给 公孙胜 送宝 了 。,人物二 算到 人物一 吃亏  便 派 道童 人物一 送宝,1
TRAIN_SENT_ID_270803,,伍天锡,伍云召,第十九回 太行山 伍天锡 鏖兵 关王庙 伍云召 寄子 第二十回 韩擒虎 收兵 复旨 程咬金 逢 赦 回家,第十九回 太行山 人物一 鏖兵 关王庙 人物二 寄子 第二十回 韩擒虎 收兵 复旨 程咬金 逢 赦 回家,-1
TRAIN_SENT_ID_270555,,黎绍峰,黎雪竹,后 被 黎绍峰 所救 ， 经过 黎雪竹 （ 黎绍峰 姐姐 ） 的 残酷 训练 将 她 一步 一步 的 打 造成 了 青萍 的 影子 ， 杜允唐 的 定制 情人 。,人物一 所救  人物二  人物一 姐姐  残酷 训练 一步 一步 造成 青萍 影子  杜允唐 定制 情人,-1
TRAIN_SENT_ID_265460,,薛谭,秦青,读后感 : “ 薛谭 学 讴 ” 全文 的 重心 是 刻画 人物 秦青 和 薛谭 。,读后感   人物一 学 讴  全文 重心 刻画 人物 人物二 人物一,1
TRAIN_SENT_ID_254294,,张顺,张横,张横 立功 心切 ， 不顾 张顺 劝阻 ， 率 二三百 人去 劫 关胜 营寨 ， 结果 被 关胜 生擒 。,人物二 立功 心切  不顾 人物一 劝阻  率 二三百 人去 劫 关胜 营寨  关胜 生擒,-1
TRAIN_SENT_ID_282078,,陈长兴,陈秉旺,陈秉旺 与 陈长兴 168,人物二 人物一,1
TRAIN_SENT_ID_255188,,赵海燕,赵本山,《 出名 》 （ 表演 ： 赵本山 、 赵海燕 ）,出名   表演  人物二  人物一,1
TRAIN_SENT_ID_270990,,严舆,严白虎,严白虎 、 严舆 、 朱治 、 孙瑜 、 钟离牧,人物二  人物一  朱治  孙瑜  钟离牧,-1
TRAIN_SENT_ID_273358,,杨锐,张之洞,戊戌变法 失败 、 杨锐 等 “ 六 君子 ” 死难 后 ， 张之洞 在 鸡鸣寺 倡建 此楼 ， 以 杜甫 诗句 “ 忧来 豁 蒙蔽 ” 命名 ， 作为 纪念 。,戊戌变法 失败  人物一  六 君子  死难  人物二 鸡鸣寺 倡建 此楼  杜甫 诗句  忧来 豁 蒙蔽  命名  纪念,1
TRAIN_SENT_ID_262244,,尤二姐,尤三姐,此 回目 写 到 了 尤二姐 和 尤三姐 ；,回目 写 人物一 人物二,-1
TRAIN_SENT_ID_253144,,颜回,孔子,列子 · 仲尼 篇 第四 部分 : 列子 · 仲尼 篇 原文 : 子夏问 孔子 曰 ： “ 颜回 ① 之为 人 奚若 ？ ”,列子  仲尼 篇 第四 部分  列子  仲尼 篇 原文  子夏问 人物二 曰   人物一 ① 之为 奚若,1
TRAIN_SENT_ID_284536,,杨长在,杨志光,杨志光 - - 杨长在 、 张国庆,人物二   人物一  张国庆,1
TRAIN_SENT_ID_254271,,张顺,张横,张横 急救 张顺 ， 刘麟 一马 早到 ， 将 张顺 就 地 抓 去 。,人物二 急救 人物一  刘麟 一马 早到  人物一 抓,-1
TRAIN_SENT_ID_252984,,颜回,孔子,孔子 高徒 ， 在 孔门 中以 德行 与 颜回 并称 ， 为 七十二 贤人 之一 。,人物二 高徒  孔门 中以 德行 人物一 并称  七十二 贤人,1
TRAIN_SENT_ID_272007,,文姜,宣姜,9 . 从 宣姜 到 文姜,人物二 人物一,-1
TRAIN_SENT_ID_250603,,鲁西西,皮皮鲁,皮皮鲁 带 着 鲁西西 到 魔方 里面 去 寻找 鲁西西 的 笑容 ， 但是 魔方 里面 充满 了 未知 和 变幻 。,人物二 带 人物一 魔方 里面 寻找 人物一 笑容  魔方 里面 充满 未知 变幻,-1
TRAIN_SENT_ID_251912,,曹薰铉,李昌镐,执笔 撰写 了 《 李昌镐 新手 新型 》 、 《 曹薰铉 行棋 技巧 》 等 多种 围棋 图书 。,执笔 撰写  人物二 新手 新型    人物一 行棋 技巧  多种 围棋 图书,1
TRAIN_SENT_ID_276959,,樊迟,孔子,故 樊迟 请学稼圃 ， 孔子 讥为 小人 。,人物一 请学稼圃  人物二 讥为 小人,1
TRAIN_SENT_ID_270821,,伍天锡,伍云召,6 、 双镗 无敌 伍天锡 ， 伍云召 族弟 ， 胯下 青龙 马 ， 掌中 一对 短 把 凤翅 镏金 镗 ， 英勇 无比 ；,双镗 无敌 人物一  人物二 族弟  胯下 青龙 马  掌中 一对 短 凤翅 镏金 镗  英勇 无比,-1
TRAIN_SENT_ID_252834,,颜回,孔子,第十三回 孔子 重操旧业 颜回 见 （ 黑出 ） 荆妻,第十三回 人物二 重操旧业 人物一 见  黑出  荆妻,1
TRAIN_SENT_ID_264247,,陈真,霍元甲,“ 霍元甲 ” “ 陈真 ” 齐 上阵,人物二   人物一  齐 上阵,1
TRAIN_SENT_ID_271283,,马季,侯宝林,（ 十 ） 1 、 卖马 侯宝林 刘宝瑞 高凤山 2 、 福寿全 常贵田 常宝华 3 、 对 春联 马季 郭启儒 4 、 拆字 马季 刘宝瑞 郭启儒,十    卖马 人物二 刘宝瑞 高凤山   福寿全 常贵田 常宝华   春联 人物一 郭启儒   拆字 人物一 刘宝瑞 郭启儒,1
TRAIN_SENT_ID_259807,,李偲菘,李伟菘,音乐 总监 ： 李偲菘 、 李伟菘 、 易家扬 、 小柯 、 张亚东,音乐 总监  人物一  人物二  易家扬  小柯  张亚东,-1
TRAIN_SENT_ID_282528,,张钧,张善为,张钧 派 自己 的 胞弟 张善为 ( 又名 祖荣 ) 任 交通员 ， 经常 往返 于 黄坑 、 新历 、 塘头 与 大坡 之间 。,人物一 派 胞弟 人物二  又名 祖荣  交通员  经常 往返 黄坑  新历  塘头 大坡 之间,-1
TRAIN_SENT_ID_277564,,袁承志,穆人清,穆人清 描写 : 林家栋 版 穆人清 （ 谷峰 饰 ） 袁承志 心中 一动 ， 暗想 ： 「 师父 使 的 果然 都 是 十段 锦 身法 ， 但 他 怎能 如此 快法 ？,人物二 描写  林家栋 版 人物二  谷峰 饰  人物一 心中 一动  暗想   师父 十段 锦 身法  怎能 快法,1
TRAIN_SENT_ID_259678,,公孙胜,罗真人,罗真人 惜 叹 公孙胜 董灵 清法 破无虚术,人物二 惜 叹 人物一 董灵 清法 破无虚术,1
TRAIN_SENT_ID_266695,,龙幽,龙溟,龙溟 、 龙幽,人物二  人物一,-1
TRAIN_SENT_ID_273676,,姜子牙,元始天尊,封 神台 是 元始天尊 命 姜子牙 在 岐山 修建 ， 上 张挂 封神榜 。,封 神台 人物二 命 人物一 岐山 修建  张挂 封神榜,1
TRAIN_SENT_ID_267585,,骆赢,骆羽,"女子双打 ： 于洋 / 王晓理 、 田卿 / 赵芸蕾 、 成淑 / 潘攀 、 包宜鑫 / 钟倩欣 、 马晋 / 汤金华 , 骆赢 、 骆羽",女子双打  于洋  王晓理  田卿  赵芸蕾  成淑  潘攀  包宜鑫  钟倩欣  马晋  汤金华  人物一  人物二,-1
TRAIN_SENT_ID_252954,,颜回,孔子,"课文 中有 孔子 ， 颜回 谈 "" 志向 “ 的 对话 ， 谈谈 自己 的 看法 。",课文 中有 人物二  人物一 谈  志向  对话  谈谈 看法,1
TRAIN_SENT_ID_275351,,申公豹,元始天尊,玉虚宫 申公豹 : 元始天尊 的 门人 。,玉虚宫 人物一  人物二 门人,1
TRAIN_SENT_ID_268992,,韩非,荀子,《 诗经 》 《 史记 》 《 庄子 》 《 老子 》 《 论语 》 《 孟子 》 《 韩非 子 》 《 楚辞 》 《 左传 》 《 荀子 》,诗经   史记   庄子   老子   论语   孟子   人物一 子   楚辞   左传   人物二,1
TRAIN_SENT_ID_252479,,颜回,孔子,盗 跖 可以 长寿 ， 孔子 、 颜回 却 遭受 困厄 ， 这 都 是 上天 还 没有 表现 出来 他 的 真实 意愿 的 缘故 。,盗 跖 长寿  人物二  人物一 遭受 困厄  上天 没有 表现 真实 意愿 缘故,1
TRAIN_SENT_ID_249183,,皮皮鲁,鲁西西,《 皮皮鲁 》 画报 每期 有 《 皮皮鲁 的 故事 》 和 《 鲁西西 的 故事 》 系列 连环画 。,人物一  画报 每期  人物一 故事   人物二 故事  系列 连环画,-1
TRAIN_SENT_ID_255492,,罗成,秦琼,与 程咬金 欣赏 罗成 相反 ， 秦琼 对 罗成 更 多 的 是 一种 被迫 。,程咬金 欣赏 人物一 相反  人物二 人物一 更 一种 被迫,-1
TRAIN_SENT_ID_255390,,罗成,秦琼,单是 秦琼 的 恩人 ， 秦琼 是 罗成 的 表兄 ， 那么 单雄信 理所当然 的 就 应当 是 罗成 的 恩人 。,单是 人物二 恩人  人物二 人物一 表兄  单雄信 理所当然 应当 人物一 恩人,-1
TRAIN_SENT_ID_266164,,李昌镐,曹薰铉,曹薰铉 和 李昌镐 围棋 教室 ： 中级 篇 作者简介 : 作者 ： （ 韩国 ） 曹薰铉 { mljj },人物二 人物一 围棋 教室  中级 篇 作者简介  作者   韩国  人物二,1
TRAIN_SENT_ID_261563,,南宫敬叔,孟懿子,故 孟懿子 与 南宫敬叔 师事 仲尼 。 ）,人物二 人物一 师事 仲尼,-1
TRAIN_SENT_ID_253001,,颜回,孔子,殿 大成殿 外景 内 供奉 着 孔子 及 孟子 、 颜回 等 四配 十二 哲人 的 牌位 ， 显示 出 孔子 之学 后继有人 ， 学子 济济一堂 。,殿 大成殿 外景 供奉 人物二 孟子  人物一 四配 十二 哲人 牌位  显示 出 人物二 之学 后继有人  学子 济济一堂,1
TRAIN_SENT_ID_256901,,仲由,孔子,仲 村镇 简介 : 仲村 是 一代 圣贤 孔子 的 得意门生 仲由 的 故里 ， 是 历史 上 的 四大 文明 古镇 之一 。,仲 村镇 简介  仲村 一代 圣贤 人物二 得意门生 人物一 故里  历史 四大 文明 古镇,1
TRAIN_SENT_ID_257028,,洪敬尧,洪荣宏,我们 约 好 常常 喜乐 08 旧情绵绵 : 林慧萍 、 洪荣宏 、 洪敬尧,约 常常 喜乐  旧情绵绵  林慧萍  人物二  人物一,-1
TRAIN_SENT_ID_266666,,邓鸣贺,邓鸣璐,儿童节目 ： 邓鸣贺 、 邓鸣璐 。,儿童节目  人物一  人物二,-1
TRAIN_SENT_ID_252853,,颜回,孔子,」 颜回 无以 应 ， 入告 孔子 。,人物一 无以 应  入告 人物二,1
TRAIN_SENT_ID_270974,,李易霏,李昂融,她们 就是 被誉为 “ 最美 双胞胎 ” 的 济南 小 姐妹 、 济南 舜文 中学 小学部 三年级 学生 — — — “ 朵朵 ” 李易霏 、 “ 果果 ” 李昂融 。,被誉为  最美 双胞胎  济南 姐妹  济南 舜文 中学 小学部 三年级 学生     朵朵  人物一   果果  人物二,-1
TRAIN_SENT_ID_250692,,鲁西西,皮皮鲁,描述 一只 绒 玩具 熊猫 被 皮皮鲁 和 鲁西西 注射 了 桔子 汁 以后 变成 活 熊猫 的 事 。,描述 一只 绒 玩具 熊猫 人物二 人物一 注射 桔子 汁 以后 变成 活 熊猫 事,-1
TRAIN_SENT_ID_262593,,郭芙蓉,郭蔷薇,克星 ： 邢育森 、 七舅 姥爷 、 郭芙蓉 、 郭蔷薇 （ 郭芙蓉 的 堂妹 ）,克星  邢育森  七舅 姥爷  人物一  人物二  人物一 堂妹,-1
TRAIN_SENT_ID_273633,,马阔海,马青山,召唤 人 ： 端木燕 、 马青山 、 马阔海,召唤  端木燕  人物二  人物一,-1
TRAIN_SENT_ID_264829,,沈尊光,高占全,高占全 沈尊光 : 沈尊光 （ 1940 — ） ， 作曲家 、 音乐 评论家 。,人物二 人物一  人物一      作曲家  音乐 评论家,1
TRAIN_SENT_ID_255458,,罗成,秦琼,秦琼 的 好 ， 罗成 最 明白 。,人物二  人物一 明白,-1
TRAIN_SENT_ID_251602,,穆春,穆弘,穆弘 与 穆春 率 庄客 追赶 ， 一直 追到 浔 阳江 边 。,人物二 人物一 率 庄客 追赶  一直 追到 浔 阳江,-1
TRAIN_SENT_ID_269918,,沈春阳,赵本山,2013 - 03 - 02 ： 樱桃红 【 宋小宝 ， 沈春阳 ， 杨冰 ， 赵本山 】,樱桃红  宋小宝  人物一  杨冰  人物二,1
TRAIN_SENT_ID_267511,,裘千丈,裘千仞,裘千仞 / 裘千丈 ..........,人物二  人物一,-1
