sent_id,sent_id,entity1,entity2,sent,processed_sent,label
TRAIN_SENT_ID_253125,,颜回,孔子,66 、 颜冉 （ r ǎ n ） ： 颜回 与 冉雍 ， 孔子 的 弟子 。,颜冉   ǎ    人物一 冉雍  人物二 弟子,1
TRAIN_SENT_ID_252776,,颜回,孔子,颜渊 ： 即 颜回 ， 是 孔子 得意 的 学生 ， 孔子 常常 称赏 其 品质 。,颜渊  人物一  人物二 得意 学生  人物二 常常 称赏 品质,1
TRAIN_SENT_ID_275810,,白兔公子,彭祖,人物 简介 : 彭祖 有 8 大 弟子 ： 青衣 乌公 、 黑穴公 、 秀眉 公 、 白兔公子 、 离患公 、 太足君 、 高丘子 、 不肯 来 。,人物 简介  人物二  弟子  青衣 乌公  黑穴公  秀眉 公  人物一  离患公  太足君  高丘子  不肯,1
TRAIN_SENT_ID_251857,,曹薰铉,李昌镐,1983 年 ， 时年 八岁 的 李昌镐 开始 跟 爷爷 学习 围棋 ， 次年 即 被 曹薰铉 九段 收为 弟子 。,年  时年 八岁 人物二 爷爷 学习 围棋  次年 人物一 九段 收为 弟子,1
TRAIN_SENT_ID_284442,,马云龙,刘化龙,马云龙 从师 刘化龙 ， 学习 滑拳 。,人物一 从师 人物二  学习 滑拳,1
TRAIN_SENT_ID_284551,,廖立峨,鲁迅,廖立峨 是 鲁迅 的 学生 ， 最初 鲁迅 对 他 印象 不错 。,人物一 人物二 学生  最初 人物二 印象 不错,1
TRAIN_SENT_ID_253077,,颜回,孔子,颜回 ， 即 孔子 的 弟子 ， 又 指 「 面颜 的 真容 」 。,人物一  人物二 弟子  指  面颜 真容,1
TRAIN_SENT_ID_252967,,颜回,孔子,故事 ： 有 一天 ， 孔子 的 学生 颜回 ， 来 向 老师 辞行 。,故事  一天  人物二 学生 人物一  老师 辞行,1
TRAIN_SENT_ID_252423,,颜回,孔子,词语 解释 : 谓 孔子 培养 其 弟子 颜渊 ( 颜回 ) 成才 。,词语 解释  谓 人物二 培养 弟子 颜渊  人物一  成才,1
TRAIN_SENT_ID_252477,,颜回,孔子,“ 孔子 列国 行 ” 大型 铜雕 生动 再现 了 孔子 天命 之年 带 颜回 等 弟子 ， 纵马 驱车 ， 昂扬 奋进 的 情态 。,人物二 列国 行  大型 铜雕 生动 再现 人物二 天命 之年 带 人物一 弟子  纵马 驱车  昂扬 奋进 情态,1
TRAIN_SENT_ID_266720,,龙幽,龙溟,十字 妖 槊 因 在 游戏 中 寄托 着 龙溟 、 龙幽 两 兄弟 深厚 的 手足 情 ， 故而 有着 不同于 一般 武器 的 意义 。,十字 妖 槊 游戏 中 寄托 人物二  人物一 两 兄弟 深厚 手足 情  有着 不同于 武器 意义,-1
TRAIN_SENT_ID_255281,,卫夫人,王羲之,卫夫人 教 王羲之 书法 ， 还教 他 知道 天外有天 ， 人外有人 ， 不可 骄傲 懒散 。,人物一 教 人物二 书法  还教 知道 天外有天  人外有人  不可 骄傲 懒散,1
TRAIN_SENT_ID_252729,,颜回,孔子,纵观 《 论语 》 ， 孔子 表扬 得 最 多 的 弟子 非 颜回 莫属 。,纵观  论语   人物二 表扬 弟子 非 人物一 莫属,1
TRAIN_SENT_ID_268991,,韩非,荀子,后期 法家 韩非 和 李斯 同 是 荀子 的 学生 。,后期 法家 人物一 李斯 人物二 学生,1
TRAIN_SENT_ID_267786,,万剑一,林惊羽,万剑一 沦落 扫地 老头 ， 林惊羽 拜 其 师傅 ， 万剑一 便 将 四式 剑诀 尽数 传于 林惊羽 。,人物一 沦落 扫地 老头  人物二 拜 师傅  人物一 便 四式 剑诀 尽数 传于 人物二,1
TRAIN_SENT_ID_275496,,苏华仁,吴云青,吴云青 有个 徒弟 苏华仁 是 安阳 人 ， 1998 年 夏天 ， 吴老 提出 要 来 殷墟 发源地 安阳 清修 一段时间 ， 徒弟 顺应 师命 将 师傅 从 延安 接至 安阳 。,人物二 有个 徒弟 人物一 安阳   年 夏天  吴老 提出 殷墟 发源地 安阳 清修 一段时间  徒弟 顺应 师命 师傅 延安 接至 安阳,1
TRAIN_SENT_ID_268968,,韩非,荀子,《 史记 》 记载 ， 韩非 精于 “ 刑名 法术 之学 ” ， 与 秦相 李斯 都 是 荀子 的 学生 。,史记  记载  人物一 精于  刑名 法术 之学   秦相 李斯 人物二 学生,1
TRAIN_SENT_ID_260704,,王重阳,全真七子,七子 全真七子 : 全真七子 ： 指 马钰 、 谭处端 、 刘处玄 、 丘处机 、 王处一 、 郝大通 、 孙不二 ， 为 道教 全真道 创始人 王重阳 的 七位 嫡传 弟子 。,七子 人物二  人物二  指 马钰  谭处端  刘处玄  丘处机  王处一  郝大通  孙不二  道教 全真道 创始人 人物一 七位 嫡传 弟子,1
TRAIN_SENT_ID_260938,,杨露禅,陈长兴,杨氏 太极拳 发展 历史 : 杨氏 太极拳 杨露禅 偷师 : 杨露禅 杨福 魁 （ 1799 年 － 1872 年 ） ， 字露 禅 ， 河北 永年 人 ， 就学 于 陈长兴 。,杨氏 太极拳 发展 历史  杨氏 太极拳 人物一 偷师  人物一 杨福 魁   年   年   字露 禅  河北 永年  就学 人物二,1
TRAIN_SENT_ID_253083,,颜回,孔子,颜德馨 祖籍 山东 ， 系 孔子 的 弟子 颜回 的 后裔 。,颜德馨 祖籍 山东  系 人物二 弟子 人物一 后裔,1
TRAIN_SENT_ID_279223,,吕馨,吕禄,吕馨 跪 在 吕禄 面前 求 他 救 自己 一命 ， 吕禄 向 吕雉 说出 一些 计策 ， 吕雉 这才 答应 饶 了 吕馨 。,人物一 跪 人物二 面前 求 救 一命  人物二 吕雉 说出 计策  吕雉 这才 答应 饶 人物一,-1
TRAIN_SENT_ID_252908,,颜回,孔子,颜回 ： 即 颜渊 ， 孔子 大 弟子 ， 仅 三十二岁 去世 。,人物一  颜渊  人物二 弟子  仅 三十二岁 去世,1
TRAIN_SENT_ID_252815,,颜回,孔子,2 . 颜渊 ： 颜回 ， 孔子 的 学生 。,颜渊  人物一  人物二 学生,1
TRAIN_SENT_ID_252810,,颜回,孔子,“ 颜瓢 ” 指 孔子 弟子 颜回 箪瓢屡空 。,颜瓢  指 人物二 弟子 人物一 箪瓢屡空,1
TRAIN_SENT_ID_252894,,颜回,孔子,所以 孔子 常常 以 颜回 的 事例 来 教育 其他 学生 。,人物二 常常 人物一 事例 教育 学生,1
TRAIN_SENT_ID_279130,,范长利,朱绍文,范长利 人物 经历 : 1895 年 以后 ， 范长利 拜 朱绍文 为师 ， 正式 改 说 相声 。,人物一 人物 经历   年 以后  人物一 拜 人物二 为师  正式 改 说 相声,1
TRAIN_SENT_ID_283490,,俞莲舟,张三丰,武当七侠 ， 各有所长 ， 但 张三丰 却 独对 张翠山 另加 青眼 ， 寄予厚望 ， 其 原因 ， 俞莲舟 说 是因为 张翠山 悟性 最高 ， 可 作 张三丰 的 衣钵传人 。,武当七侠  各有所长  人物二 独对 张翠山 另加 青眼  寄予厚望  原因  人物一 说 是因为 张翠山 悟性 最高  作 人物二 衣钵传人,1
TRAIN_SENT_ID_286006,,冯难敌,黄真,冯难敌 的 师父 黄真 乃 穆人清 之 徒弟 ； 以 每代 二十年 计 ， 穆 当年 已 九十 高龄 了 。,人物一 师父 人物二 穆人清 徒弟  每代 二十年 计  穆 当年 九十 高龄,1
TRAIN_SENT_ID_252722,,颜回,孔子,孔子 颜氏 弟子 知名 的 有 八人 ， 是否 为 颜回 学派 ， 学界 存疑 ） 。,人物二 颜氏 弟子 知名 八人  是否 人物一 学派  学界 存疑,1
TRAIN_SENT_ID_275545,,王小虎,赵本山,李大国 饰演者 信息 : 王小虎 ， 二人转 演员 出身 ， 赵本山 的 第十个 徒弟 。,李大国 饰演者 信息  人物一  二人转 演员 出身  人物二 第十个 徒弟,1
TRAIN_SENT_ID_252610,,颜回,孔子,孔颜 [ 基本 信息 ] : 孔颜 ， 孔子 与其 弟子 颜回 的 并称 。,孔颜  基本 信息   孔颜  人物二 弟子 人物一 并称,1
TRAIN_SENT_ID_253078,,颜回,孔子,所以 在 少 正卯 与 孔子 争夺 弟子 时 ， 使 “ 孔子 之 门 三盈三虚 ” ， 唯有 颜回 未离 孔门 半步 ， 因而 后人 评价 说 ： “ 颜渊 独知 孔子 圣 也 。 ”,少 正卯 人物二 争夺 弟子 时   人物二 门 三盈三虚   人物一 未离 孔门 半步  后人 评价 说   颜渊 独知 人物二 圣,1
TRAIN_SENT_ID_255442,,罗成,秦琼,孙武 、 张良 、 秦琼 、 罗成 ， 各朝 名将 武魂 都 对 你 翘首以待 ， 甚至 传说 中 的 上古 诸神 ， 统统 有 可能 臣服于 你 ， 唯 你 马首是瞻 。,孙武  张良  人物二  人物一  各朝 名将 武魂 翘首以待  传说 中 上古 诸神  统统 可能 臣服于  唯 马首是瞻,-1
TRAIN_SENT_ID_276964,,樊迟,孔子,樊迟 是 春秋 末年 陶城人 ， 系 不 被 孔子 重视 的 72 弟子 之一 。,人物一 春秋 末年 陶城人  系 人物二 重视  弟子,1
TRAIN_SENT_ID_252989,,颜回,孔子,颜回 谓 孔子 独立 人格 、 直行 道业云 ： “ 夫子 之道 至 大 ， 故 天下 莫 能容 。,人物一 谓 人物二 独立 人格  直行 道业云   夫子 之道  天下 莫 能容,1
TRAIN_SENT_ID_264260,,陈真,霍元甲,很多 影视作品 都 把 陈真 塑造成 霍元甲 的 五 徒弟 ， 剧中 他 不但 身手 高超 ， 且 在 霍元甲 死后 ， 从 日本 回国 来 为 师父 申冤 正名 。,很多 影视作品 人物一 塑造成 人物二 五 徒弟  剧中 身手 高超  人物二 死后  日本 回国 师父 申冤 正名,1
TRAIN_SENT_ID_253008,,颜回,孔子,【 引证 解释 】 孔子 弟子 颜回 和 闵损 的 并称 。,引证 解释  人物二 弟子 人物一 闵损 并称,1
TRAIN_SENT_ID_252436,,颜回,孔子,颜回 和 子路 都 是 孔子 的 学生 。,人物一 子路 人物二 学生,1
TRAIN_SENT_ID_249056,,吕洞宾,韩湘子,道经 《 西山 群仙会 真记 》 将 曹国舅 和 陈真 君 ( 即 蓝采和 ) 、 韩湘子 、 何仙姑 列为 吕洞宾 弟子 ； 道经 《 玉溪 子丹经 指要 ?,道经  西山 群仙会 真记  曹国舅 陈真 君  蓝采和   人物二  何仙姑 列为 人物一 弟子  道经  玉溪 子丹经 指要,1
TRAIN_SENT_ID_255208,,赵海燕,赵本山,作为 赵本山 大力 提携 的 徒弟 ， 赵海燕 的 成名 道路 的确 令人羡慕 。,人物二 大力 提携 徒弟  人物一 成名 道路 令人羡慕,1
TRAIN_SENT_ID_275809,,白兔公子,彭祖,秀眉 公 人物 简介 : 彭祖 有 8 大 弟子 ： 青衣 乌公 、 黑穴公 、 秀眉 公 、 白兔公子 、 离患公 、 太足君 、 高丘子 、 不肯 来 。,秀眉 公 人物 简介  人物二  弟子  青衣 乌公  黑穴公  秀眉 公  人物一  离患公  太足君  高丘子  不肯,1
TRAIN_SENT_ID_276950,,樊迟,孔子,鱼台县 孔子 弟子 — — 樊迟 墓 174,鱼台县 人物二 弟子   人物一 墓,1
TRAIN_SENT_ID_252491,,颜回,孔子,5 . 颜回 ： 是 孔子 最 得意 的 学生 ， 姓颜 ， 名回 ， 字子渊 。,人物一  人物二 得意 学生  姓颜  名回  字子渊,1
TRAIN_SENT_ID_264262,,陈真,霍元甲,陈真 誓杀 霍元甲 为师 报仇 ！,人物一 誓杀 人物二 为师 报仇,1
TRAIN_SENT_ID_282414,,赵公明,通天教主,通天教主 在 碧游宫 分宝时 ， 将定 海珠 与 缚 龙索 赐给 了 赵公明 。,人物二 碧游宫 分宝时  将定 海珠 缚 龙索 赐给 人物一,1
TRAIN_SENT_ID_257488,,姜昆,马季,就 这样 费尽 了 周折 ， 姜昆 才 最终 被 马季 调到 了 中央广播说唱团 ， 并 被 马季 收为 弟子 。,费尽 周折  人物一 最终 人物二 调到 中央广播说唱团  人物二 收为 弟子,1
TRAIN_SENT_ID_283648,,元泰,于占元,元泰 为 于占元 得意门生 ， 与 元龙 、 元楼 、 元彪 、 元奎 、 元华 、 元武 并 称为 七小福 。,人物一 人物二 得意门生  元龙  元楼  元彪  元奎  元华  元武 称为 七小福,1
TRAIN_SENT_ID_275540,,王小虎,赵本山,赵家 班 王小虎 : 王小虎 ， 二人转 演员 出身 ， 赵本山 的 第十个 徒弟 。,赵家 班 人物一  人物一  二人转 演员 出身  人物二 第十个 徒弟,1
TRAIN_SENT_ID_252410,,颜回,孔子,孔子 弟子 中姓 颜 的 共有 八人 ， 他们 是 ： 颜无繇 、 颜回 、 颜幸 、 颜高 、 颜祖 、 颜之仆 、 颜哙 、 颜何 。,人物二 弟子 中姓 颜 共有 八人   颜无繇  人物一  颜幸  颜高  颜祖  颜之仆  颜哙  颜何,1
TRAIN_SENT_ID_282229,,上官博玉,吕洞宾,上官博玉 具体 介绍 : 上官博玉 是 吕洞宾 的 三 弟子 ， 道 号 “ 灵虚 子 ” ， 负责 在 纯阳 宫中 打理 炼丹房 。,人物一 具体 介绍  人物一 人物二 三 弟子  道 号  灵虚 子   负责 纯阳 宫中 打理 炼丹房,1
TRAIN_SENT_ID_255282,,卫夫人,王羲之,王羲之 少时 曾 从 其学书 ， 卫夫人 是 “ 书圣 ” 的 启蒙 老师 。,人物二 少时 其学书  人物一  书圣  启蒙 老师,1
TRAIN_SENT_ID_278337,,贾廷聚,唐喜成,贾廷聚 师徒 情深 : 1962 年 ， 贾廷聚 拜师 唐派 艺术 创始人 唐喜成 。,人物一 师徒 情深   年  人物一 拜师 唐派 艺术 创始人 人物二,1
TRAIN_SENT_ID_252454,,颜回,孔子,代相村 历史悠久 ， 以颜姓 为主 ， 相传 为 孔子 弟子 颜回 后代 。,代相村 历史悠久  以颜姓 为主  相传 人物二 弟子 人物一 后代,1
TRAIN_SENT_ID_285940,,崔振苏,王习三,崔振苏 师承 冀派 内画 创始人 王习三 第二代 弟子 王湘君 ， 擅长 书法 、 山水 、 肖像 、 人物 、 花鸟 等 题材 ， 作品 多为 国内外 名士 收藏 。,人物一 师承 冀派 内画 创始人 人物二 第二代 弟子 王湘君  擅长 书法  山水  肖像  人物  花鸟 题材  作品 多为 国内外 名士 收藏,1
TRAIN_SENT_ID_252501,,颜回,孔子,颜回 ， 孔子 的 学生 ， 以 德行 著称 。,人物一  人物二 学生  德行 著称,1
TRAIN_SENT_ID_276982,,樊迟,孔子,据 史籍 《 姓谱 》 记载 ， 孔子 弟子 樊须 ， 字子 迟 ， 世人 亦 称为 “ 樊迟 ” 。,史籍  姓谱  记载  人物二 弟子 樊须  字子 迟  世人 称为  人物一,1
TRAIN_SENT_ID_269573,,水笙,汪啸风,水笙 ， 金庸 武侠小说 《 连城诀 》 的 女主角 之一 ， 与 表哥 汪啸风 合称 “ 铃剑 双侠 ” 。,人物一  金庸 武侠小说  连城诀  女主角  表哥 人物二 合称  铃剑 双侠,-1
TRAIN_SENT_ID_256957,,仲由,孔子,3 作品 注释 : （ 1 ） 子路 ： 名 仲由 ， 孔子 的 学生 。,作品 注释     子路  名 人物一  人物二 学生,1
TRAIN_SENT_ID_252415,,颜回,孔子,其四 ， 孔子 赞叹 颜回 “ 三月 不 违仁 ” ， 至于 其他 的 弟子 只能 偶尔 一至 （ “ 其余 则 日月 至 焉 而已 矣 ” ）,其四  人物二 赞叹 人物一  三月 违仁   弟子 只能 偶尔 一至   日月,1
TRAIN_SENT_ID_261626,,宋小宝,赵本山,（ 赵本山 评价 ） 《 樱桃 》 主要 人物 : 赵本山 徒弟 : 宋小宝 排名第 67 :,人物二 评价   樱桃  主要 人物  人物二 徒弟  人物一 排名第,1
TRAIN_SENT_ID_268978,,韩非,荀子,韩非 是 荀子 的 大 弟子 ， 与 李斯 同学 ， 出身 于 韩国 的 贵族 家庭 。,人物一 人物二 弟子  李斯 同学  出身 韩国 贵族 家庭,1
TRAIN_SENT_ID_252828,,颜回,孔子,宋真宗 追封 孔子 弟子 颜回 等 十人 公爵 ， 曾 参等 62 人 侯爵 ， 封先儒 左丘明 等 19 人 伯爵 。,宋真宗 追封 人物二 弟子 人物一 十人 公爵  参等  侯爵  封先儒 左丘明  伯爵,1
TRAIN_SENT_ID_251429,,李瀚章,李鸿章,"清人 李鸿章 在 给 他 哥哥 李瀚章 的 家书 中说 "" 体气 多病 得名 人 文集 静心 读 之 亦 足以 养病 。 """,清人 人物二 哥哥 人物一 家书 中说  体气 多病 得名 文集 静心 读 足以 养病,-1
TRAIN_SENT_ID_261153,,王缙,王维,奉 和 王相公 早春 登 徐州 城 作品 注释 : （ 1 ） 王相公 ： 王缙 ， 字夏卿 ， 大 诗人 王维 弟 。,奉 王相公 早春 登 徐州 城 作品 注释     王相公  人物一  字夏卿  诗人 人物二 弟,-1
TRAIN_SENT_ID_252690,,颜回,孔子,陋巷 志 颜回 : 颜回 是 孔子 的 得意 弟子 ， 居 孔门 四科 之 首 ， 德行 第一 ， 天资 聪慧 ， 勤奋好学 ， 循礼 行仁 ， 尊师重道 。,陋巷 志 人物一  人物一 人物二 得意 弟子  居 孔门 四科 首  德行 第一  天资 聪慧  勤奋好学  循礼 行仁  尊师重道,1
TRAIN_SENT_ID_283486,,俞莲舟,张三丰,俞莲舟 （ 公元 1303 - - 1387 年 ） ， 张三丰 的 第二个 徒弟 ， 沉默寡言 ， 豪气 重义 。,人物一  公元     年   人物二 第二个 徒弟  沉默寡言  豪气 重义,1
TRAIN_SENT_ID_264250,,陈真,霍元甲,写 的 是 霍元甲 的 徒弟 陈真 九死一生 携带 霍元甲 的 儿子 霍东觉 流浪 江湖 ， 立志 不 忘 师傅 的 恩情 将 其 培养 成人 ， 以承 父志 … …,写 人物二 徒弟 人物一 九死一生 携带 人物二 儿子 霍东觉 流浪 江湖  立志 忘 师傅 恩情 培养 成人  以承 父志,1
TRAIN_SENT_ID_265466,,薛谭,秦青,秦青 相关 传说 : 薛谭 的 故事,人物二 相关 传说  人物一 故事,1
TRAIN_SENT_ID_253133,,颜回,孔子,下面 是 庄子 描写 有关 坐忘 的 故事 ： 有 一次 ， 颜回 告诉 孔子 说 他 的 功夫 大有 进步 ， 已 忘 了 仁义 ， 孔子 认为 他 还 不够 深刻 。,下面 庄子 描写 坐忘 故事  一次  人物一 告诉 人物二 说 功夫 大有 进步  忘 仁义  人物二 认为 不够 深刻,1
TRAIN_SENT_ID_277575,,袁承志,穆人清,碧血剑 剧情简介 : 明朝 末年 ， 忠臣 袁崇焕 被害 ， 其 幼子 袁承志 （ 郭追 饰 ） 由 哑仆 救出 ， 逃往 华山 拜 华山派 掌门人 穆人清 为师 。,碧血剑 剧情简介  明朝 末年  忠臣 袁崇焕 被害  幼子 人物一  郭追 饰  哑仆 救出  逃往 华山 拜 华山派 掌门人 人物二 为师,1
TRAIN_SENT_ID_269451,,毛岸龙,毛岸英,毛岸龙 生死 之谜 : 电视剧 《 毛岸英 》 情景 展示 的 是 后 一种 说法 。,人物一 生死 之谜  电视剧  人物二  情景 展示 一种 说法,-1
TRAIN_SENT_ID_249097,,吕洞宾,韩湘子,唐暗 八仙 纹 发簪 文物 介绍 : 暗 八仙 即用 韩湘子 的 花 、 汉 钟离 的 扇 、 蓝采和 的 箫 、 吕洞宾 的 剑 等 器物 来 代表 八位 神仙 的 形像 。,唐暗 八仙 纹 发簪 文物 介绍  暗 八仙 即用 人物二 花  汉 钟离 扇  蓝采和 箫  人物一 剑 器物 代表 八位 神仙 形像,1
TRAIN_SENT_ID_268828,,洪凌波,李莫愁,1 角色 设定 : 洪凌波 虽然 是 李莫愁 的 徒弟 ， 但 她 的 性格 心地 却 和 李莫愁 迥然不同 。,角色 设定  人物一 人物二 徒弟  性格 心地 人物二 迥然不同,1
TRAIN_SENT_ID_269569,,辛敞,辛宪英,186 辛敞 187 辛评 188 辛宪英 189 邢道荣 190 阮咸,人物一  辛评  人物二  邢道荣  阮咸,-1
TRAIN_SENT_ID_264527,,岳云鹏,郭德纲,喜欢 的 相声 艺人 ： 郭德纲 何云伟 曹云 金 岳云鹏 王自健,喜欢 相声 艺人  人物二 何云伟 曹云 金 人物一 王自健,1
TRAIN_SENT_ID_286137,,姚建威,黄祖洽,终于 功夫不负有心人 ， 在 大 一 上半 学期末 姚建威 即 成功 写出 一篇 关于 巨 磁阻 效应 的 物理学 论文 ， 得到 了 黄祖洽 老先生 的 赞赏 。,终于 功夫不负有心人  上半 学期末 人物一 成功 写出 一篇 巨 磁阻 效应 物理学 论文  得到 人物二 老先生 赞赏,1
TRAIN_SENT_ID_285183,,梅娜,高华,跟我学 棋 三年 后 ， 1995 年 ， 梅娜 被 选调 进 安徽省 棋院 ， 师从 高华 特级 大师 ， 成为 一名 专业 队员 。,跟我学 棋 三年   年  人物一 选调 进 安徽省 棋院  师从 人物二 特级 大师  成为 一名 专业 队员,1
TRAIN_SENT_ID_255405,,罗成,秦琼,秦琼 遂 率 程咬金 、 罗成 （ 张翰 饰 ） 投 于 李世民 麾下 ， 屡立 战功 ， 最终 助 李唐 王朝平 定 天下 。,人物二 遂 率 程咬金  人物一  张翰 饰  投 李世民 麾下  屡立 战功  最终 助 李唐 王朝平 定 天下,-1
TRAIN_SENT_ID_259368,,葛玄,左慈,葛洪 伯 祖父 葛玄 曾 师从 炼丹 家 左慈 学 道 ， 号 葛仙公 ， 以 炼丹 秘术 传于 弟子 郑隐 。,葛洪 伯 祖父 人物一 师从 炼丹 家 人物二 学 道  号 葛仙公  炼丹 秘术 传于 弟子 郑隐,1
TRAIN_SENT_ID_255305,,卫夫人,王羲之,王羲之 少时 学 卫夫人 书法 ， 后来 得到 叔父 王虞 的 指导 。,人物二 少时 学 人物一 书法  后来 得到 叔父 王虞 指导,1
TRAIN_SENT_ID_252424,,颜回,孔子,颜渊 ： 颜回 ， 字子渊 ， 亦 称 颜渊 ， 是 孔子 的 得意门生 。,颜渊  人物一  字子渊  称 颜渊  人物二 得意门生,1
TRAIN_SENT_ID_282202,,杨进明,李立山,李立山 - - 杨进明 、 王林 、 李洋,人物二   人物一  王林  李洋,1
TRAIN_SENT_ID_260944,,杨露禅,陈长兴,杨露禅 人生 履历 : 杨露禅 师从 河南 温县 陈家沟 陈长兴 ， 学成 后 回 永年县 ， 寓居 太和 堂 药店 ， 以授 拳 为生 。,人物一 人生 履历  人物一 师从 河南 温县 陈家沟 人物二  学成 回 永年县  寓居 太和 堂 药店  以授 拳 为生,1
TRAIN_SENT_ID_285936,,师冈岩间,师冈一羽,"师冈岩间 人物 简介 : 又名 岩间 熊之助 , 著名 剑客 师冈一羽 之徒",人物一 人物 简介  又名 岩间 熊之助  著名 剑客 人物二 之徒,1
TRAIN_SENT_ID_282201,,杨进明,李立山,李立山 — — 杨进明 、 王林 、 李洋,人物二   人物一  王林  李洋,1
TRAIN_SENT_ID_253055,,颜回,孔子,见 《 孔子 家语 ． 颜回 》 。,见  人物二 家语 ． 人物一,1
TRAIN_SENT_ID_252473,,颜回,孔子,《 孔子 家语 · 颜回 》 ： “ 公闻 之 ， 越席 而 起 ， 促驾 召 颜回 。 ”,人物二 家语  人物一    公闻  越席  促驾 召 人物一,1
TRAIN_SENT_ID_253091,,颜回,孔子,《 孔子 家语 · 颜回 》 ： “ 毁人 之善 以为 辩 ， 狡讦 怀诈 以为 智 。 ”,人物二 家语  人物一    毁人 之善 辩  狡讦 怀诈 智,1
TRAIN_SENT_ID_252886,,颜回,孔子,2 . 《 孔子 家语 ． 颜回 》 载 : 孔子 在 卫 ， 闻哭者 之声 甚哀 。,人物二 家语 ． 人物一  载  人物二 卫  闻哭者 之声 甚哀,1
TRAIN_SENT_ID_260952,,杨露禅,陈长兴,功夫 高手 名单 : 杨露禅 1799 — 1872 ， 河北 永年县 人 ， 杨氏 太极 创始 师从 陈长兴,功夫 高手 名单  人物一     河北 永年县  杨氏 太极 创始 师从 人物二,1
TRAIN_SENT_ID_249048,,吕洞宾,韩湘子,八仙 中 吕洞宾 排 第一 ， 张果老 次之 ， 韩湘子 与 汉 钟离 并列 ， 何仙姑 第五 ， 铁拐李 第六 ， 蓝采和 第七 ， 曹国舅 最后 。,八仙 中 人物一 排 第一  张果老 次之  人物二 汉 钟离 并列  何仙姑 第五  铁拐李 第六  蓝采和 第七  曹国舅 最后,1
TRAIN_SENT_ID_249001,,吕洞宾,韩湘子,内容 为 八仙 的 神话传说 ， 记叙 铁拐李 、 汉 钟离 、 吕洞宾 、 张果老 、 蓝采和 、 何仙姑 、 韩湘子 、 曹国舅 八位 神仙 修炼 得 道 的 过程 。,内容 八仙 神话传说  记叙 铁拐李  汉 钟离  人物一  张果老  蓝采和  何仙姑  人物二  曹国舅 八位 神仙 修炼 道 过程,1
TRAIN_SENT_ID_252852,,颜回,孔子,孔门十哲 人物 介绍 : 孔门十哲 德行 : 子渊 即 颜回 ， 姓 颜名 回 ， 字子渊 ， 亦 称 颜渊 ， 比 孔子 小 三十岁 ， 鲁国 人 。,孔门十哲 人物 介绍  孔门十哲 德行  子渊 人物一  姓 颜名 回  字子渊  称 颜渊  人物二 三十岁  鲁国,1
TRAIN_SENT_ID_259369,,葛玄,左慈,《 抱朴子 内 篇 ‧ 金丹 》 明言 葛玄 师从 左慈 受 金丹 仙经 ， 葛玄 的 道 法 也 没有 直接 得到 任何 一个 家族 子弟 的 传承 。,抱朴子 篇  金丹  明言 人物一 师从 人物二 受 金丹 仙经  人物一 道 法 没有 直接 得到 一个 家族 子弟 传承,1
TRAIN_SENT_ID_252928,,颜回,孔子,颜回 : 颜回 颜回 ， 姓 颜名 回 ， 字子渊 ， 亦 称 颜渊 ， 比 孔子 小 三十岁 ， 鲁国 人 。,人物一  人物一 人物一  姓 颜名 回  字子渊  称 颜渊  人物二 三十岁  鲁国,1
TRAIN_SENT_ID_252913,,颜回,孔子,七十二 弟子 解 第三十八 作品 原文 : 1 . 颜回 ， 鲁人 ， 字子渊 ， 少 孔子 三十岁 。,七十二 弟子 解 第三十八 作品 原文    人物一  鲁人  字子渊  少 人物二 三十岁,1
TRAIN_SENT_ID_259663,,公孙胜,罗真人,入云龙 公孙胜 人物 介绍 : 公孙胜 ， 罗真人 弟子 ， 道 号 一清 先生 ， 能 呼风唤雨 ， 江湖人称 入云龙 。,入云龙 人物一 人物 介绍  人物一  人物二 弟子  道 号 一清 先生  呼风唤雨  江湖人称 入云龙,1
TRAIN_SENT_ID_257494,,姜昆,马季,是 继 姜昆 和 赵炎 之后 马季 先生 的 第三个 徒弟 ， 成名 于 20 世纪 80 年代 。,继 人物一 赵炎 之后 人物二 先生 第三个 徒弟  成名  世纪  年代,1
TRAIN_SENT_ID_252939,,颜回,孔子,《 孔子 家语 · 弟子 行 》 ： “ 夫能 夙兴夜寐 ， 讽诵 崇礼 ， 行不贰过 ， 称言 不苟 ， 是 颜回 之行 也 。 ”,人物二 家语  弟子 行    夫能 夙兴夜寐  讽诵 崇礼  行不贰过  称言 不苟  人物一 之行,1
TRAIN_SENT_ID_249087,,吕洞宾,韩湘子,铁拐李 、 汉 钟离 、 吕洞宾 、 张果老 、 蓝采和 、 何仙姑 、 韩湘子 、 曹国舅 等 八仙 ， 历来 是 民间 年画 、 戏曲 中 的 主题 人物 。,铁拐李  汉 钟离  人物一  张果老  蓝采和  何仙姑  人物二  曹国舅 八仙  历来 民间 年画  戏曲 中 主题 人物,1
TRAIN_SENT_ID_265090,,杨志刚,郭靖宇,《 红娘子 》 是 郭靖宇 继 《 铁 梨花 》 《 将军 》 之后 又 一部 自编 自导 的 作品 ， 由王 珞丹 、 杨志刚 、 刘威 、 王绘春 、 史可 、 王超 等 主演 。,红娘子  人物二 继  铁 梨花   将军  之后 一部 自编 自导 作品  由王 珞丹  人物一  刘威  王绘春  史可  王超 主演,-1
