sent_id,sent_id,entity1,entity2,sent,processed_sent,label
TRAIN_SENT_ID_254266,,张顺,张横,张顺 . （ 渔家 ， 张横 之弟 ） 三十六 天罡 星天败星 : 天败星 …,人物一   渔家  人物二 之弟  三十六 天罡 星天败星  天败星,-1
TRAIN_SENT_ID_270811,,伍天锡,伍云召,李元霸 VS 雄阔海 、 伍云召 、 伍天锡 ： 元霸 一马 冲入 营来 ， 正撞 着 伍云召 、 雄阔海 、 伍天锡 ， 三个 围拢 来 战元霸 。,李元霸  雄阔海  人物二  人物一  元霸 一马 冲入 营来  正撞 人物二  雄阔海  人物一  三个 围拢 战元霸,-1
TRAIN_SENT_ID_254284,,张顺,张横,张顺 死后 ， 还 把 灵魂 附在 张横 身上 杀死 了 方天定 。,人物一 死后  灵魂 附在 人物二 身上 杀死 方天定,-1
TRAIN_SENT_ID_252846,,颜回,孔子,附骥 尾 释义 : 司马贞 索隐 ： “ 按 ： 苍蝇附骥 尾而致 千里 ， 以 譬 颜回 因 孔子 而 名彰 也 。 ”,附骥 尾 释义  司马贞 索隐    苍蝇附骥 尾而致 千里  譬 人物一 人物二 名彰,1
TRAIN_SENT_ID_255411,,罗成,秦琼,"走向 传奇 内容简介 : 传奇世界 无处 不 传奇 , 关公 秦琼 比 义气 , 赵云 罗成 赛 枪法 , 张翼德 尉迟恭 谁 脸 更 黑 , 李元霸 和 李存孝 谁 更 牛 。",走向 传奇 内容简介  传奇世界 无处 传奇  关公 人物二 义气  赵云 人物一 赛 枪法  张翼德 尉迟恭 脸 更 黑  李元霸 李存孝 更 牛,-1
TRAIN_SENT_ID_253886,,赵合德,赵飞燕,当然 ， 赵飞燕 和 赵合德 两 姊妹 还 不能 称其为 妓女 ， 但殊 归 同途 。,人物二 人物一 两 姊妹 不能 称其为 妓女  但殊 同途,-1
TRAIN_SENT_ID_266209,,范遥,赵敏,赵敏 将 六大 门派 门人 押 至 大都 万安 寺 ， 范遥 背叛 旧主 重返 明教 ， 救出 门派 众人 ； 灭绝师太 卒 ， 立 周芷若 为 新 峨嵋 掌门 。,人物二 六大 门派 门人 押 大都 万安 寺  人物一 背叛 旧主 重返 明教  救出 门派 众人  灭绝师太 卒  立 周芷若 新 峨嵋 掌门,1
TRAIN_SENT_ID_259520,,梅超风,杨康,梅超风 赵 王府 上 : 後 来 ， 梅超风 假扮 普通 妇人 到 了 金国王爷 完颜洪烈 王府 当 杂工 和 偷偷 练功 ， 并 传授 杨康 九阴 白骨 爪 。,人物一 赵 王府  後  人物一 假扮 普通 妇人 金国王爷 完颜洪烈 王府 杂工 偷偷 练功  传授 人物二 九阴 白骨 爪,1
TRAIN_SENT_ID_265498,,薛蝌,薛蟠,薛蟠 案子 要 重判 ， 夏金桂 大吵大闹 ， 因为 调戏 薛蝌 被 香菱 撞见 ， 她 想 毒死 香菱 ， 不料 自己 误食 毒药 而 死 。,人物二 案子 重判  夏金桂 大吵大闹  调戏 人物一 香菱 撞见  想 毒死 香菱  误食 毒药 死,-1
TRAIN_SENT_ID_279601,,司空星儿,苏蓉蓉,谁知 事后 ， 司空摘星 和 司空星儿 却 被 “ 天下第一 剑 ” 薛衣人 抓获 ， 薛衣人 胁迫 司空星儿 的 义妹 苏蓉蓉 一定 将 琥珀 观音 取回 。,事后  司空摘星 人物一  天下第一 剑  薛衣人 抓获  薛衣人 胁迫 人物一 义妹 人物二 一定 琥珀 观音 取回,-1
TRAIN_SENT_ID_255490,,罗成,秦琼,李世民 、 罗成 、 程咬金 、 秦琼 等 众 英雄 最终 识破阴谋 ， 力战 突出重围 。,李世民  人物一  程咬金  人物二 众 英雄 最终 识破阴谋  力战 突出重围,-1
TRAIN_SENT_ID_252777,,颜回,孔子,— — — 颜廷 淦 （ 孔子 文化 研究 院长 ， 复圣 颜回 第 78 代 嫡孙 ） 我 对 三角洲 充满信心 ， 希望 张成志 在 太空 ， 路 在 脚下 ， 越走越远 。,颜廷 淦  人物二 文化 研究 院长  复圣 人物一  代 嫡孙  三角洲 充满信心  希望 张成志 太空  路 脚下  越走越远,1
TRAIN_SENT_ID_268921,,司徒静,司徒剑南,司徒剑南 第九集 : 司徒静 气 了 安宁公主 一顿 ， 将 她 放回 。,人物二 第九集  人物一 气 安宁公主 一顿  放回,-1
TRAIN_SENT_ID_251517,,陈辅,陈靖仇,3 轩辕剑 叁 外传 ： 天之痕 : 相关 剧情 : 游戏 主角 陈靖仇 的 师父 陈辅 在 伏 魔 山上 被 饕餮 。,轩辕剑 叁 外传  天之痕  相关 剧情  游戏 主角 人物二 师父 人物一 伏 魔 山上 饕餮,1
TRAIN_SENT_ID_255286,,卫夫人,王羲之,崔瑗 张芝 张昶 锺 繇 锺 会 韦诞 皇象 嵇康 卫瓘 卫夫人 索靖 谢安 王导 王敦 王廙 王洽 王珉 王羲之 王献之,崔瑗 张芝 张昶 锺 繇 锺 会 韦诞 皇象 嵇康 卫瓘 人物一 索靖 谢安 王导 王敦 王廙 王洽 王珉 人物二 王献之,1
TRAIN_SENT_ID_256547,,周武,周文,周武 王封 叔叔 姬仲在 西 虢 ； 周文 王 季弟 虢 叔 封 在 东 虢 ， 历 、 宣之时 姬仲 后裔 迁封 陕虢 ， 故今 陕地 有北 虢 、 东虢 、 西虢 。,人物一 王封 叔叔 姬仲在 西 虢  人物二 王 季弟 虢 叔 封 东 虢  历  宣之时 姬仲 后裔 迁封 陕虢  故今 陕地 有北 虢  东虢  西虢,-1
TRAIN_SENT_ID_268812,,洪凌波,李莫愁,洪凌波 角色 能力 : 洪凌波 得 李莫愁 真传 ， 而 李莫愁 的 古墓 剑法 精妙 无比 ， 故 洪凌波 的 剑法 也 是 凌厉 。,人物一 角色 能力  人物一 人物二 真传  人物二 古墓 剑法 精妙 无比  人物一 剑法 凌厉,1
TRAIN_SENT_ID_264526,,岳云鹏,郭德纲,郭德纲 - - 何云伟 、 曹云 金 、 岳云鹏 、 孔云龙 、 朱云峰 、 栾云平 、 李云杰 、 刘云天,人物二   何云伟  曹云 金  人物一  孔云龙  朱云峰  栾云平  李云杰  刘云天,1
TRAIN_SENT_ID_276909,,吕青柠,吕青橙,电视剧 已知 招式 ： 排山倒海 （ 郭芙蓉 ） ， 惊涛骇浪 （ 郭蔷薇 、 吕青橙 ） ， 大浪淘沙 （ 吕青柠 ）,电视剧 已知 招式  排山倒海  郭芙蓉   惊涛骇浪  郭蔷薇  人物二   大浪淘沙  人物一,-1
TRAIN_SENT_ID_259624,,季布,季心,季心 简介 : 季布 弟 ， 亦 以 任侠 名 。,人物二 简介  人物一 弟  任侠 名,-1
TRAIN_SENT_ID_282924,,骆玉笙,韩永禄,西河 鼓书 曲种 名家 : 刘宝全 白云鹏 阎秋霞 骆玉笙 韩永禄 孙书 筠 王文禄 金万昌 籍薇,西河 鼓书 曲种 名家  刘宝全 白云鹏 阎秋霞 人物一 人物二 孙书 筠 王文禄 金万昌 籍薇,1
TRAIN_SENT_ID_252596,,颜回,孔子,颜回 随 孔子 重回 帝丘 ， 途经 蒲邑 ， 又 遭到 蒲人 的 拦截 。,人物一 人物二 重回 帝丘  途经 蒲邑  遭到 蒲人 拦截,1
TRAIN_SENT_ID_263025,,钱婆婆,汤婆婆,然后 钱婆婆 要千寻 交出 白龙 ， 因为 白龙奉 汤婆婆 的 命令 ， 偷取 了 钱婆婆 的 魔女 合约 印章 。,人物一 要千寻 交出 白龙  白龙奉 人物二 命令  偷取 人物一 魔女 合约 印章,-1
TRAIN_SENT_ID_270557,,全真七子,王重阳,防御 路线 走 王重阳 ， 全真七子 相应 点灯 。,防御 路线 走 人物二  人物一 相应 点灯,1
TRAIN_SENT_ID_270803,,伍天锡,伍云召,第十九回 太行山 伍天锡 鏖兵 关王庙 伍云召 寄子 第二十回 韩擒虎 收兵 复旨 程咬金 逢 赦 回家,第十九回 太行山 人物一 鏖兵 关王庙 人物二 寄子 第二十回 韩擒虎 收兵 复旨 程咬金 逢 赦 回家,-1
TRAIN_SENT_ID_265460,,薛谭,秦青,读后感 : “ 薛谭 学 讴 ” 全文 的 重心 是 刻画 人物 秦青 和 薛谭 。,读后感   人物一 学 讴  全文 重心 刻画 人物 人物二 人物一,1
TRAIN_SENT_ID_263347,,蔡夫人,蔡瑁,刘表 个 蔡夫人 打算 将 刘琮 立 为 继承人 ， 而 蔡瑁 、 张允 则 为 其 党羽 。,刘表 人物一 打算 刘琮 立 继承人  人物二  张允 党羽,-1
TRAIN_SENT_ID_254294,,张顺,张横,张横 立功 心切 ， 不顾 张顺 劝阻 ， 率 二三百 人去 劫 关胜 营寨 ， 结果 被 关胜 生擒 。,人物二 立功 心切  不顾 人物一 劝阻  率 二三百 人去 劫 关胜 营寨  关胜 生擒,-1
TRAIN_SENT_ID_271532,,孟优,孟获,【 蜀国 益州 酒馆 】 姜维 魏延 马良 糜竺 孟获 祝融 夫人 孟优 沙摩柯 大地 火焰 暴风,蜀国 益州 酒馆  姜维 魏延 马良 糜竺 人物二 祝融 夫人 人物一 沙摩柯 大地 火焰 暴风,-1
TRAIN_SENT_ID_265454,,薛谭,秦青,薛谭 讴 原文 : 薛谭 学 讴 原文 （ 1 ） 于 （ 2 ） 秦青 ， 未穷 （ 3 ） 青之技 ， 自谓 尽 之 ， 遂 辞 归 （ 4 ） 。,人物一 讴 原文  人物一 学 讴 原文       人物二  未穷    青之技  自谓  遂 辞,1
TRAIN_SENT_ID_273358,,杨锐,张之洞,戊戌变法 失败 、 杨锐 等 “ 六 君子 ” 死难 后 ， 张之洞 在 鸡鸣寺 倡建 此楼 ， 以 杜甫 诗句 “ 忧来 豁 蒙蔽 ” 命名 ， 作为 纪念 。,戊戌变法 失败  人物一  六 君子  死难  人物二 鸡鸣寺 倡建 此楼  杜甫 诗句  忧来 豁 蒙蔽  命名  纪念,1
TRAIN_SENT_ID_256884,,仲由,孔子,孔子 对 公冶长 、 南容 的 评论 ， 客观 、 实际 ， 对 仲由 的 赞许 ， 体现 一种 开放 精神 。,人物二 公冶长  南容 评论  客观  实际  人物一 赞许  体现 一种 开放 精神,1
TRAIN_SENT_ID_264542,,岳云鹏,郭德纲,郭德纲 ― ― 何云伟 、 曹云 金 、 岳云鹏 、 孔云龙 、 朱云峰 、 栾云平 、 李云杰 、 刘云天,人物二 ― ― 何云伟  曹云 金  人物一  孔云龙  朱云峰  栾云平  李云杰  刘云天,1
TRAIN_SENT_ID_253144,,颜回,孔子,列子 · 仲尼 篇 第四 部分 : 列子 · 仲尼 篇 原文 : 子夏问 孔子 曰 ： “ 颜回 ① 之为 人 奚若 ？ ”,列子  仲尼 篇 第四 部分  列子  仲尼 篇 原文  子夏问 人物二 曰   人物一 ① 之为 奚若,1
TRAIN_SENT_ID_265434,,薛谭,秦青,原文 ： 薛谭 学 讴于 秦青 ， 未穷 青之技 ， 自谓 尽 之 ； 遂 辞 归 。,原文  人物一 学 讴于 人物二  未穷 青之技  自谓  遂 辞,1
TRAIN_SENT_ID_251912,,曹薰铉,李昌镐,执笔 撰写 了 《 李昌镐 新手 新型 》 、 《 曹薰铉 行棋 技巧 》 等 多种 围棋 图书 。,执笔 撰写  人物二 新手 新型    人物一 行棋 技巧  多种 围棋 图书,1
TRAIN_SENT_ID_276921,,樊迟,孔子,樊迟 ， 是 孔子 七十二 贤弟 子内 的 重要 人物 ， 继承 孔子 兴办 私学 ， 在 儒家 学派 广受 推崇 的 各个 朝代 享有 较 高 礼遇 。,人物一  人物二 七十二 贤弟 子内 重要 人物  继承 人物二 兴办 私学  儒家 学派 广受 推崇 朝代 享有 高 礼遇,1
TRAIN_SENT_ID_278012,,干光豪,左子穆,金庸 小说 《 天龙八部 》 的 人物 ， 无量 剑 西宗掌 门 ， 无量 剑 东宗掌 门 左子穆 的 师 妺 ， 干光豪 、 葛光佩 的 师傅 。,金庸 小说  天龙八部  人物  无量 剑 西宗掌 门  无量 剑 东宗掌 门 人物二 师 妺  人物一  葛光佩 师傅,1
TRAIN_SENT_ID_270821,,伍天锡,伍云召,6 、 双镗 无敌 伍天锡 ， 伍云召 族弟 ， 胯下 青龙 马 ， 掌中 一对 短 把 凤翅 镏金 镗 ， 英勇 无比 ；,双镗 无敌 人物一  人物二 族弟  胯下 青龙 马  掌中 一对 短 凤翅 镏金 镗  英勇 无比,-1
TRAIN_SENT_ID_262264,,尤二姐,尤三姐,贾珍 处心积虑 地 调戏 尤三姐 ， 心知肚明 的 尤二姐 不能不 担心 三妹 了 。,贾珍 处心积虑 调戏 人物二  心知肚明 人物一 不能不 担心 三妹,-1
TRAIN_SENT_ID_262269,,尤二姐,尤三姐,乙 那 是 《 红楼梦 》 ， 尤三姐 、 尤二姐 ！,乙  红楼梦   人物二  人物一,-1
TRAIN_SENT_ID_282528,,张钧,张善为,张钧 派 自己 的 胞弟 张善为 ( 又名 祖荣 ) 任 交通员 ， 经常 往返 于 黄坑 、 新历 、 塘头 与 大坡 之间 。,人物一 派 胞弟 人物二  又名 祖荣  交通员  经常 往返 黄坑  新历  塘头 大坡 之间,-1
TRAIN_SENT_ID_277564,,袁承志,穆人清,穆人清 描写 : 林家栋 版 穆人清 （ 谷峰 饰 ） 袁承志 心中 一动 ， 暗想 ： 「 师父 使 的 果然 都 是 十段 锦 身法 ， 但 他 怎能 如此 快法 ？,人物二 描写  林家栋 版 人物二  谷峰 饰  人物一 心中 一动  暗想   师父 十段 锦 身法  怎能 快法,1
TRAIN_SENT_ID_273676,,姜子牙,元始天尊,封 神台 是 元始天尊 命 姜子牙 在 岐山 修建 ， 上 张挂 封神榜 。,封 神台 人物二 命 人物一 岐山 修建  张挂 封神榜,1
TRAIN_SENT_ID_267585,,骆赢,骆羽,"女子双打 ： 于洋 / 王晓理 、 田卿 / 赵芸蕾 、 成淑 / 潘攀 、 包宜鑫 / 钟倩欣 、 马晋 / 汤金华 , 骆赢 、 骆羽",女子双打  于洋  王晓理  田卿  赵芸蕾  成淑  潘攀  包宜鑫  钟倩欣  马晋  汤金华  人物一  人物二,-1
TRAIN_SENT_ID_252954,,颜回,孔子,"课文 中有 孔子 ， 颜回 谈 "" 志向 “ 的 对话 ， 谈谈 自己 的 看法 。",课文 中有 人物二  人物一 谈  志向  对话  谈谈 看法,1
TRAIN_SENT_ID_273649,,姜子牙,元始天尊,其间 元始天尊 赐 姜子牙 打神 鞭 ， 封神 完毕 之后 ， 奉还 此鞭 ， 元始天尊 念 其 封神 有功 ， 故而 不 收 。,其间 人物二 赐 人物一 打神 鞭  封神 完毕 之后  奉还 此鞭  人物二 念 封神 有功  收,1
TRAIN_SENT_ID_268992,,韩非,荀子,《 诗经 》 《 史记 》 《 庄子 》 《 老子 》 《 论语 》 《 孟子 》 《 韩非 子 》 《 楚辞 》 《 左传 》 《 荀子 》,诗经   史记   庄子   老子   论语   孟子   人物一 子   楚辞   左传   人物二,1
TRAIN_SENT_ID_252770,,颜回,孔子,所以 天下 这么 大 ， 愿意 为 他 效劳 的 只有 七十 人 ， 而 得 孔子 仁义 之心 要者 只有 颜回 一人 。,天下  愿意 效劳 七十  人物二 仁义 之心 要者 人物一 一人,1
TRAIN_SENT_ID_265463,,薛谭,秦青,“ 高云 不 动 ” 出自 《 列子 · 汤问 》 ： “ 薛谭 学 讴于 秦青 ， 未穷 青之技 ， 自谓 尽 之 ， 遂 辞 归 。,高云 动  出自  列子  汤问    人物一 学 讴于 人物二  未穷 青之技  自谓  遂 辞,1
TRAIN_SENT_ID_259744,,李偲菘,李伟菘,祁哲泉 作曲 人 : 李伟菘 李偲菘 纪利 男 随安 苏恒 RickyHo,祁哲泉 作曲  人物二 人物一 纪利 男 随安 苏恒,-1
TRAIN_SENT_ID_268889,,司徒静,司徒剑南,司徒剑南 第二集 : 司徒静 骗过 衙役 逃走 ， 朱允 和 白云飞 被 误认为 是 强盗 。,人物二 第二集  人物一 骗过 衙役 逃走  朱允 白云飞 误认为 强盗,-1
TRAIN_SENT_ID_255390,,罗成,秦琼,单是 秦琼 的 恩人 ， 秦琼 是 罗成 的 表兄 ， 那么 单雄信 理所当然 的 就 应当 是 罗成 的 恩人 。,单是 人物二 恩人  人物二 人物一 表兄  单雄信 理所当然 应当 人物一 恩人,-1
TRAIN_SENT_ID_275922,,钱学渠,钱学森,钱学渠 ， 他 是 钱学森 的 堂弟 。,人物一  人物二 堂弟,-1
TRAIN_SENT_ID_269555,,步鹰,燕双鹰,在 理惠 的 冒死 掩护 下 ， 燕双鹰 开枪 打死 了 步鹰 。,理惠 冒死 掩护  人物二 开枪 打死 人物一,1
TRAIN_SENT_ID_261150,,王缙,王维,及 元载 、 王缙 、 杜鸿 渐为 相 ， 皆 崇信 佛教 ， 而 王缙 （ 王维 弟 ） 尤甚 ， 不食 荤 血 ， 与鸿渐 造寺 无穷 。,元载  人物一  杜鸿 渐为 相  皆 崇信 佛教  人物一  人物二 弟  尤甚  不食 荤 血  与鸿渐 造寺 无穷,-1
TRAIN_SENT_ID_253001,,颜回,孔子,殿 大成殿 外景 内 供奉 着 孔子 及 孟子 、 颜回 等 四配 十二 哲人 的 牌位 ， 显示 出 孔子 之学 后继有人 ， 学子 济济一堂 。,殿 大成殿 外景 供奉 人物二 孟子  人物一 四配 十二 哲人 牌位  显示 出 人物二 之学 后继有人  学子 济济一堂,1
TRAIN_SENT_ID_249534,,李蔡,李广,《 史记 . 李将军 列传 》 《 李广 传 》 均 称 ： 其 从弟 李蔡 被 “ 封 为 乐安 侯 ” 。,史记  李将军 列传   人物二 传  均 称  从弟 人物一  封 乐安 侯,-1
TRAIN_SENT_ID_256901,,仲由,孔子,仲 村镇 简介 : 仲村 是 一代 圣贤 孔子 的 得意门生 仲由 的 故里 ， 是 历史 上 的 四大 文明 古镇 之一 。,仲 村镇 简介  仲村 一代 圣贤 人物二 得意门生 人物一 故里  历史 四大 文明 古镇,1
TRAIN_SENT_ID_250692,,鲁西西,皮皮鲁,描述 一只 绒 玩具 熊猫 被 皮皮鲁 和 鲁西西 注射 了 桔子 汁 以后 变成 活 熊猫 的 事 。,描述 一只 绒 玩具 熊猫 人物二 人物一 注射 桔子 汁 以后 变成 活 熊猫 事,-1
TRAIN_SENT_ID_252739,,颜回,孔子,其 遥想 和 赞美 的 是 贫而 好学 、 不事 稼穑 的 颜回 和 安贫乐道 的 孔子 ， 尤其 是 钦羡 古代 “ 耦而耕 ” 的 隐士 荷 蓧 翁 和 长 沮 、 桀溺 。,遥想 赞美 贫而 好学  不事 稼穑 人物一 安贫乐道 人物二  尤其 钦羡 古代  耦而耕  隐士 荷 蓧 翁 长 沮  桀溺,1
TRAIN_SENT_ID_266318,,贾源,贾演,贾代修 一解 ： : 第一代 ： 宁国公 贾演 ， 荣国公 贾源 — — 名字 串连 成 “ 演源 ” ， 判词 是 纲领 ， 曲演 是 简演 ， 假语 村言 是 详演 。,贾代修 一解   第一代  宁国公 人物二  荣国公 人物一   名字 串连 成  演源   判词 纲领  曲演 简演  假语 村言 详演,-1
TRAIN_SENT_ID_251602,,穆春,穆弘,穆弘 与 穆春 率 庄客 追赶 ， 一直 追到 浔 阳江 边 。,人物二 人物一 率 庄客 追赶  一直 追到 浔 阳江,-1
TRAIN_SENT_ID_285959,,谢天顺,郭荣起,郭荣起 ― ― 常宝霆 、 郭宝 明 、 杜 三宝 、 杨少华 、 谢天顺 、 张宝 如,人物二 ― ― 常宝霆  郭宝 明  杜 三宝  杨少华  人物一  张宝,1
TRAIN_SENT_ID_269572,,水笙,汪啸风,汪啸风 （ “ 铃剑 双侠 ” 之一 、 水笙 表哥 ） 【 天宁寺 中毒 而 死 】,人物二   铃剑 双侠   人物一 表哥   天宁寺 中毒 死,-1
TRAIN_SENT_ID_268995,,韩非,荀子,"《 外传 》 的 思想 ， 大致 以 荀子 思想 为主 ， 反复强调 隆礼 重法 ， 尊士 养民 , 也 间 采 孟子 及 韩非 有关 言论 。",外传  思想  大致 人物二 思想 为主  反复强调 隆礼 重法  尊士 养民  间 采 孟子 人物一 言论,1
TRAIN_SENT_ID_270812,,伍天锡,伍云召,雄阔海 、 伍云召 、 伍天锡 围拢 来 战元霸 ， 元霸 把 手中 锤 一 摆 ， 撞 着 三般 军器 ， 当啷 一响 ， 三人 虎口 震开 ， 大败 而 走 。,雄阔海  人物二  人物一 围拢 战元霸  元霸 手中 锤 摆  撞 三般 军器  当啷 一响  三人 虎口 震开  大败 走,-1
TRAIN_SENT_ID_259675,,公孙胜,罗真人,二 仙山 ， 二仙 者 ， 我们 可以 推测 ， 可能 就是指 罗真人 、 清 道人 （ 公孙胜 ） 两位 北方 的 活神仙 。,二 仙山  二仙  推测  可能 就是指 人物二  清 道人  人物一  两位 北方 活神仙,1
TRAIN_SENT_ID_264377,,曾国潢,曾国藩,过 了 一年 多 时间 ， 曾国藩 对 曾国潢 在 作诗 方面 的 长进 感到 非常高兴 ， 同时 又 告诫 他 ： “ 须 有志 有恒 ， 乃有 成就 耳 。 ”,一年 时间  人物二 人物一 作诗 方面 长进 感到 非常高兴  告诫   须 有志 有恒  乃有 成就 耳,-1
TRAIN_SENT_ID_271212,,张翠山,张三丰,得 承 张三丰 武术 及 为 人 处世之道 ， 思想 端正 不 歪 ； 加上 资质聪颖 廿来 岁 已练 得 一身 高强 武功 ， 江湖人称 银勾铁划 张翠山 张五侠 。,承 人物二 武术 处世之道  思想 端正 歪  加上 资质聪颖 廿来 岁 已练 一身 高强 武功  江湖人称 银勾铁划 人物一 张五侠,1
TRAIN_SENT_ID_249529,,李蔡,李广,而 他 的 堂兄弟 李蔡 才能 不如 他 却 官至 丞相 ， 古人 认为 奇数 不 吉利 ， 司马迁 评价 为 “ 李广 老 ， 数奇 。 ”,堂兄弟 人物一 官至 丞相  古人 认为 奇数 吉利  司马迁 评价  人物二 老  数奇,-1
TRAIN_SENT_ID_265398,,薛谭,秦青,② 《 列子 》 ： 薛谭 学 讴于 秦青 ， 未穷 青之技 ， 遂 辞 归 。,②  列子   人物一 学 讴于 人物二  未穷 青之技  遂 辞,1
TRAIN_SENT_ID_251843,,梅超风,黄药师,金庸 江湖 手册 内容提要 : 黄药师 凭 什么 爱上 梅超风 ？,金庸 江湖 手册 内容提要  人物二 爱上 人物一,1
TRAIN_SENT_ID_282146,,苏曼莎,令狐伤,龟兹 王大怒 ， 令 全境 追 拿 令狐伤 ， 数万 大军 布下 天罗地网 ， 却 被 他 苏曼莎 立绘 一一 化解 ， 绝尘 东 去 。,龟兹 王大怒  令 全境 追 人物二  数万 大军 布下 天罗地网  人物一 立绘 一一 化解  绝尘 东,1
TRAIN_SENT_ID_253090,,颜回,孔子,例如 ， 颜路 、 颜回 父子 同师于 孔子 ， 而 颜回 比 孔子 小 三十岁 ， 依 此 推算 ， 颜路 与 孔子 年岁 相仿 ， 且 有 可能 年 长于 孔子 。,颜路  人物一 父子 同师于 人物二  人物一 人物二 三十岁  推算  颜路 人物二 年岁 相仿  可能 年 长于 人物二,1
TRAIN_SENT_ID_252953,,颜回,孔子,姜全来 成就 及 荣誉 : 主要 作品 有 《 关公 辞 曹 》 、 《 豆叶 黄 》 、 《 张公 赶子 》 、 《 重泣 回 》 、 《 孔子 泣 颜回 》 等 ， 带徒 授艺 数名 。,姜全来 成就 荣誉  主要 作品  关公 辞 曹    豆叶 黄    张公 赶子    重泣 回    人物二 泣 人物一   带徒 授艺 数名,1
TRAIN_SENT_ID_270794,,文媚儿,文韬,司徒剑南 第二十六 集 : 文媚儿 对 司徒静 恼羞成怒 ， 她 命令 文韬 务必 杀掉 司徒静 。,司徒剑南 第二十六 集  人物一 司徒静 恼羞成怒  命令 人物二 务必 杀掉 司徒静,-1
TRAIN_SENT_ID_268918,,司徒静,司徒剑南,司徒剑南 第二十四集 : 朱允 亲自 出城 去 寻找 司徒静 ， 他 找到 了 那座 古刹 。,人物二 第二十四集  朱允 亲自 出城 寻找 人物一  找到 那座 古刹,-1
TRAIN_SENT_ID_253026,,颜回,孔子,以天 乙之武 也 ， 焦土 而烂石 ； 以 唐尧 之德 也 ， 襄陵 而 怀山 ； 以 颜回 之仁 也 ， 贫 居于 陋巷 ； 以 孔子 之圣 也 ， 情希乎 执鞭 。,以天 乙之武  焦土 而烂石  唐尧 之德  襄陵 怀山  人物一 之仁  贫 居于 陋巷  人物二 之圣  情希乎 执鞭,1
TRAIN_SENT_ID_255312,,卫夫人,王羲之,蔡邕 受于 神人 ， 而传 与 崔瑗 及 女 文姬 ， 文姬 传之 钟繇 ， 钟繇 传之 卫夫人 ， 卫夫人 传之 王羲之 ， 王羲之 传之 王献之 。,蔡邕 受于 神人  而传 崔瑗 女 文姬  文姬 传之 钟繇  钟繇 传之 人物一  人物一 传之 人物二  人物二 传之 王献之,1
TRAIN_SENT_ID_257044,,洪敬尧,洪荣宏,我们 约 好 常常 喜乐 恋花 08 旧情绵绵 : 林慧萍 、 洪荣宏 、 洪敬尧,约 常常 喜乐 恋花  旧情绵绵  林慧萍  人物二  人物一,-1
TRAIN_SENT_ID_267517,,裘千丈,裘千仞,2008 《 射雕 英雄传 》 饰 裘千仞 裘千丈,射雕 英雄传  饰 人物二 人物一,-1
TRAIN_SENT_ID_251874,,曹薰铉,李昌镐,第三轮 ： 李昌镐 1 : 0 钱宇平 曹薰铉 1 : 0 聂卫平 林海峰 1 : 0 淡路 修三 赵治勋 1 : 0 片冈聪,第三轮  人物二    钱宇平 人物一    聂卫平 林海峰    淡路 修三 赵治勋    片冈聪,1
TRAIN_SENT_ID_267457,,唐继虞,唐继尧,唐继尧 、 刘显世 联名 委任 唐继虞 为 贵州 军事 善后 督办 ， 刘显世 恢复 省长 名衔 。,人物二  刘显世 联名 委任 人物一 贵州 军事 善后 督办  刘显世 恢复 省长 名衔,-1
TRAIN_SENT_ID_263344,,蔡夫人,蔡瑁,刘表 待 刘备 甚厚 ， 可 他 的 妻子 蔡夫人 和 其兄 蔡瑁 总 怀疑 刘备 有 吞并 荆州 之心 ， 每每 提醒 刘表 ： “ 刘备 常居 荆州 ， 久 必为 患 ， 不可不 防 。 ”,刘表 刘备 甚厚  妻子 人物一 其兄 人物二 总 怀疑 刘备 吞并 荆州 之心  每每 提醒 刘表   刘备 常居 荆州  久 必为 患  不可不 防,-1
TRAIN_SENT_ID_254259,,张顺,张横,那 张横 、 张顺 逃出 南门 ， 身边 尚有 千余名 从 骑 ， 一抹 地奔 到 魏河 。,人物二  人物一 逃出 南门  身边 尚有 千余名 骑  一抹 地奔 魏河,-1
TRAIN_SENT_ID_259527,,梅超风,杨康,向右走 进入 药室 打败 守卫 田七 的 美女蛇 ， 得到 田七 等 四味 药后 到 后花园 ， 见到 蓉 儿 正 和 杨康 对 打 ， 此时 ， 梅超风 出现 ， 但 被 黄蓉吓 走 。,向右走 进入 药室 打败 守卫 田七 美女蛇  得到 田七 四味 药后 后花园  见到 蓉 正 人物二   人物一 出现  黄蓉吓 走,1
TRAIN_SENT_ID_252845,,颜回,孔子,县令 环视 大殿 ， 不光 殿宇 破败 不堪 ， 孔子 和 颜回 圣像 也 都 缺额 少肩 ， 实在 有损 尊严 ， 自觉 羞惭 。,县令 环视 大殿  殿宇 破败 不堪  人物二 人物一 圣像 缺额 少肩  实在 有损 尊严  自觉 羞惭,1
TRAIN_SENT_ID_260729,,薛丁山,薛金莲,薛金莲 影视作品 : 《 薛丁山 征西 》 杨盼盼 饰,人物二 影视作品   人物一 征西  杨盼盼 饰,-1
TRAIN_SENT_ID_251897,,曹薰铉,李昌镐,虽然 日本队 主帅 加藤 正夫 力克 曹薰铉 ， 但 还是 没能 闯过 最后 李昌镐 一关 。,日本队 主帅 加藤 正夫 力克 人物一  没能 闯过 最后 人物二 一关,1
TRAIN_SENT_ID_283395,,师戈,郑小山,郑小山 — — 罗健 、 王筱磊 、 徐力 、 刘宝安 、 郑宏伟 、 师戈 、 苗阜 、 曹磊,人物二   罗健  王筱磊  徐力  刘宝安  郑宏伟  人物一  苗阜  曹磊,1
TRAIN_SENT_ID_275353,,申公豹,元始天尊,申公豹 使出 断头 术 骗 姜子牙 的 封神榜 ， 被 元始天尊 阻止 。,人物一 使出 断头 术 骗 姜子牙 封神榜  人物二 阻止,1
