sent_id,sent_id,entity1,entity2,sent,processed_sent,label
TRAIN_SENT_ID_284900,,陆启铿,华罗庚,此外 ， 万哲元 、 陆启铿 、 王元 、 潘承洞 、 段学复 等 人 也 是 在 华罗庚 的 悉心 培育 下 成长 起来 的 。,万哲元  人物一  王元  潘承洞  段学复 人物二 悉心 培育 成长 起来,1
TRAIN_SENT_ID_265459,,薛谭,秦青,《 列子 · 汤问 》 ： “ 薛谭 学 讴于 秦青 … …,列子  汤问    人物一 学 讴于 人物二,1
TRAIN_SENT_ID_274065,,南宫敬叔,孔子,连鲁 大夫 孟僖子 其子 孟懿子 和 南宫敬叔 来学礼 ， 可见 孔子 办学 已 名闻遐迩 。,连鲁 大夫 孟僖子 其子 孟懿子 人物一 来学礼  人物二 办学 名闻遐迩,1
TRAIN_SENT_ID_252568,,颜回,孔子,归鲁 之后 ， 颜回 除 讲学 外 ， 便是 帮助 孔子 整理 古代 典籍 。,归鲁 之后  人物一 讲学 外  便是 帮助 人物二 整理 古代 典籍,1
TRAIN_SENT_ID_267789,,万剑一,林惊羽,真法 剑诀 四 式 剑诀 : 真法 剑诀 斩 鬼神 真诀 : 斩 鬼神 是 青云 门 掌门 道 玄 真人 的 师弟 万剑一 的 绝学 ， 后 林惊羽 在 祖师 斩 鬼神 精通 者 ( 2 张 ),真法 剑诀 四 式 剑诀  真法 剑诀 斩 鬼神 真诀  斩 鬼神 青云 门 掌门 道 玄 真人 师弟 人物一 绝学  人物二 祖师 斩 鬼神 精通   张,1
TRAIN_SENT_ID_265433,,薛谭,秦青,第十一部分 : 原文 : 薛谭 学 讴于 秦青 ① ， 未穷 青之技 ， 自谓 尽 之 ， 遂 辞 归 。,第十一部分  原文  人物一 学 讴于 人物二 ①  未穷 青之技  自谓  遂 辞,1
TRAIN_SENT_ID_265408,,薛谭,秦青,薜 谭学 讴 原文 : 薛谭 学 讴于 秦青 ， 未穷 青之技 ， 自谓 尽 之 ， 遂 辞 归 。,薜 谭学 讴 原文  人物一 学 讴于 人物二  未穷 青之技  自谓  遂 辞,1
TRAIN_SENT_ID_265447,,薛谭,秦青,薛谭 学 讴 原文 : 薛谭 学 讴于 秦青 ， 未穷 青之技 ， 自谓 尽 之 ， 遂 辞 归 。,人物一 学 讴 原文  人物一 学 讴于 人物二  未穷 青之技  自谓  遂 辞,1
TRAIN_SENT_ID_265441,,薛谭,秦青,绕梁三日 典源 : 《 列子 》 卷 五 〈 汤 问篇 〉 薛谭 学 讴于 秦青 ， 未穷 青之技 ， 自谓 尽 之 ； 遂 辞 归 。,绕梁三日 典源   列子  卷 五  汤 问篇  人物一 学 讴于 人物二  未穷 青之技  自谓  遂 辞,1
TRAIN_SENT_ID_258815,,张无忌,殷离,1349 张无忌 遇 胡青牛 并学 医术 ， 初遇 周芷若 、 殷离 、 金花婆婆 。,人物一 遇 胡青牛 并学 医术  初遇 周芷若  人物二  金花婆婆,-1
TRAIN_SENT_ID_286299,,赵秀春,宋锦春,赵秀春 教育 背景 : 1998 年 － 2002 年 ， 东北大学 ， 机械工程 与 自动化 学院 机械工程 及 自动化系 ， 本科 / 工学 学士学位 ， 导师 宋锦春,人物一 教育 背景   年   年  东北大学  机械工程 自动化 学院 机械工程 自动化系  本科  工学 学士学位  导师 人物二,1
TRAIN_SENT_ID_251884,,曹薰铉,李昌镐,曹薰铉 对 韩国 围棋 事业 的 另 一 贡献 是 ： 培养 了 一位 了不起 的 学生 李昌镐 。,人物一 韩国 围棋 事业 贡献  培养 一位 了不起 学生 人物二,1
TRAIN_SENT_ID_265434,,薛谭,秦青,原文 ： 薛谭 学 讴于 秦青 ， 未穷 青之技 ， 自谓 尽 之 ； 遂 辞 归 。,原文  人物一 学 讴于 人物二  未穷 青之技  自谓  遂 辞,1
TRAIN_SENT_ID_265412,,薛谭,秦青,薛谭 学 讴于 秦青,人物一 学 讴于 人物二,1
TRAIN_SENT_ID_268928,,韩非,荀子,韩非 与 李斯 为 同学 ， 同 师事 于 荀子 。,人物一 李斯 同学  师事 人物二,1
TRAIN_SENT_ID_274675,,马冬晗,马冬昕,"马冬晗 学生会 主席 : 马冬昕 , 马冬晗 ( 3 张 )",人物一 学生会 主席  人物二  人物一   张,-1
TRAIN_SENT_ID_265478,,薛谭,秦青,⑶ 云不去 ： 典出 《 列子 · 汤问 》 ： “ 薛谭 学 讴于 秦青 ， 未穷 青之技 ， 自谓 尽 之 ， 遂 辞 归 。,⑶ 云不去  典出  列子  汤问    人物一 学 讴于 人物二  未穷 青之技  自谓  遂 辞,1
TRAIN_SENT_ID_265404,,薛谭,秦青,歌梁 详细 释义 : 歌梁 典源 : 《 列子 古注 今译 》 卷 五 〈 汤 问篇 〉 薛谭 学 讴于 秦青 ， 未穷 青之技 ， 自谓 尽 之 ； 遂 辞 归 。,歌梁 详细 释义  歌梁 典源   列子 古注 今译  卷 五  汤 问篇  人物一 学 讴于 人物二  未穷 青之技  自谓  遂 辞,1
TRAIN_SENT_ID_260934,,杨露禅,陈长兴,"杨氏 家族 创始人 : 杨露禅 ( 1799 - - 1872 ) 河北 永年 人 , 就学 于 陈长兴 。",杨氏 家族 创始人  人物一       河北 永年  就学 人物二,1
TRAIN_SENT_ID_281966,,梁经纶,何其沧,燕大 进步 女 学生 谢木兰 、 经济系 教授 梁经纶 、 燕京大学 副校长 何其沧 之女 何孝钰 亦 在 其中 。,燕大 进步 女 学生 谢木兰  经济系 教授 人物一  燕京大学 副校长 人物二 之女 何孝钰,1
TRAIN_SENT_ID_279413,,王学明,龙俊杰,指导 教师 ： 王学明 副教授 、 李学通 教授 、 龙俊杰 教授 、 周艳霞 副教授 等 。,指导 教师  人物一 副教授  李学通 教授  人物二 教授  周艳霞 副教授,1
TRAIN_SENT_ID_274071,,南宫敬叔,孔子,鲁昭公 二十四年 （ 公元前 518 年 ） ， 孟懿子 和 南宫敬叔 学礼于 孔子 。,鲁昭公 二十四年  公元前  年   孟懿子 人物一 学礼于 人物二,1
TRAIN_SENT_ID_252593,,颜回,孔子,在 孔门 弟子 中 ， 颜回 最称 高足 ， 其 品德 与 学业 均 翘 居 群首 ， 是 孔子 多次 赞许 的 弟子 。,孔门 弟子 中  人物一 最称 高足  品德 学业 均 翘 居 群首  人物二 多次 赞许 弟子,1
TRAIN_SENT_ID_260961,,杨露禅,陈长兴,危急 时刻 ， 杨露禅 用学来 的 功夫 保护 了 陈家和 太极 的 秘籍 ， 感动 了 陈长兴 ， 终于 被 陈 师傅 收为 徒弟 。,危急 时刻  人物一 用学来 功夫 保护 陈家和 太极 秘籍  感动 人物二  终于 陈 师傅 收为 徒弟,1
TRAIN_SENT_ID_275531,,王小虎,赵本山,感情 : 王小虎 张可 婚礼 王小虎 和 张可 当年 一起 学 二人转 ， 2001 年 俩 人 同时 拜 赵本山 为师 。,感情  人物一 张可 婚礼 人物一 张可 当年 一起 学 二人转   年 俩 拜 人物二 为师,1
TRAIN_SENT_ID_275532,,王小虎,赵本山,张可 感情 : 王小虎 张可 婚礼 王小虎 和 张可 当年 一起 学 二人转 ， 2001 年 俩 人 同时 拜 赵本山 为师 。,张可 感情  人物一 张可 婚礼 人物一 张可 当年 一起 学 二人转   年 俩 拜 人物二 为师,1
TRAIN_SENT_ID_276973,,樊迟,孔子,37 孔子 反对 樊迟 学稼 、 学圃 ， 说明 孔子 轻视 农业 劳动 吗 ？,人物二 反对 人物一 学稼  学圃  说明 人物二 轻视 农业 劳动,1
TRAIN_SENT_ID_260940,,杨露禅,陈长兴,发展 历史 : 杨露禅 偷师 : 杨露禅 杨福 魁 （ 1799 年 － 1872 年 ） ， 字露 禅 ， 河北 永年 人 ， 就学 于 陈长兴 。,发展 历史  人物一 偷师  人物一 杨福 魁   年   年   字露 禅  河北 永年  就学 人物二,1
TRAIN_SENT_ID_284551,,廖立峨,鲁迅,廖立峨 是 鲁迅 的 学生 ， 最初 鲁迅 对 他 印象 不错 。,人物一 人物二 学生  最初 人物二 印象 不错,1
TRAIN_SENT_ID_286137,,姚建威,黄祖洽,终于 功夫不负有心人 ， 在 大 一 上半 学期末 姚建威 即 成功 写出 一篇 关于 巨 磁阻 效应 的 物理学 论文 ， 得到 了 黄祖洽 老先生 的 赞赏 。,终于 功夫不负有心人  上半 学期末 人物一 成功 写出 一篇 巨 磁阻 效应 物理学 论文  得到 人物二 老先生 赞赏,1
TRAIN_SENT_ID_282623,,茅于杭,茅于轼,茅于杭 ， 茅以新 的 二 儿子 ， 著名 经济学家 茅于轼 的 二弟 ， 茅以升 的 侄子 。,人物一  茅以新 二 儿子  著名 经济学家 人物二 二弟  茅以升 侄子,-1
TRAIN_SENT_ID_252795,,颜回,孔子,颜回 好学 问题 : 孔子 “ 哭 之 恸 ” 的 原因 是 什么 ?,人物一 好学 问题  人物二  哭 恸  原因,1
TRAIN_SENT_ID_286574,,谢虹雯,梅兰芳,早年 谢虹雯 为 生活 所迫 ， 十六七岁 时 高中 辍学 改学 京剧 青衣 ， 先后 受教于 王瑶卿 、 梅兰芳 ， 后 又 拜 梅兰芳 为师 。,早年 人物一 生活 所迫  十六七岁 时 高中 辍学 改学 京剧 青衣  先后 受教于 王瑶卿  人物二  拜 人物二 为师,1
TRAIN_SENT_ID_265402,,薛谭,秦青,1 译文 : 薛谭 向 秦青 学习 唱歌 ， 还 没有 学完 秦青 的 技艺 ， 就 以为 学尽 了 ， 于是 就 告辞 回家 。,译文  人物一 人物二 学习 唱歌  没有 学完 人物二 技艺  学尽  告辞 回家,1
TRAIN_SENT_ID_265458,,薛谭,秦青,列子 · 汤问 译文 : 薛谭 向 秦青 学习 唱歌 ， 还 未曾 学完 秦青 的 唱歌 技巧 ， 就 自 以为 已经 完全 学会 了 ， 便 告辞 回家 。,列子  汤问 译文  人物一 人物二 学习 唱歌  未曾 学完 人物二 唱歌 技巧  已经 完全 学会  便 告辞 回家,1
TRAIN_SENT_ID_259636,,公孙胜,罗真人,④ 明 施耐庵 《 水浒 》 第五十三回 《 戴宗 二取 公孙胜 李逵 独劈 罗真人 》 请 哥哥 便 可 行程 ， 以见 始终 成全 大义 之美 。,④ 明 施耐庵  水浒  第五十三回  戴宗 二取 人物一 李逵 独劈 人物二  请 哥哥 便 行程  以见 始终 成全 大义 之美,1
TRAIN_SENT_ID_259632,,公孙胜,罗真人,⑤ 明 施耐庵 《 水浒 》 第五十三回 《 戴宗 二取 公孙胜 李逵 独劈 罗真人 》 戴宗 又 苦苦 哀告 道 ： “ 若 是 哥哥 不肯 去 时 ， 宋公明 毕 被 高廉 捉 了 。 ”,⑤ 明 施耐庵  水浒  第五十三回  戴宗 二取 人物一 李逵 独劈 人物二  戴宗 苦苦 哀告 道   哥哥 不肯 时  宋公明 毕 高廉 捉,1
TRAIN_SENT_ID_259674,,公孙胜,罗真人,③ 明 施耐庵 《 水浒 》 第五十三回 《 戴宗 二取 公孙胜 李逵 独劈 罗真人 》 和 那 老人 一同 吃 了 ， 算 还 面钱 ， 同出 店肆 ， 问 了 路途 。,③ 明 施耐庵  水浒  第五十三回  戴宗 二取 人物一 李逵 独劈 人物二  老人 一同 吃  算 面钱  同出 店肆  问 路途,1
TRAIN_SENT_ID_259650,,公孙胜,罗真人,③ 明 施耐庵 《 水浒 》 第五十三回 《 戴宗 二取 公孙胜 李逵 独劈 罗真人 》 不济事 ！,③ 明 施耐庵  水浒  第五十三回  戴宗 二取 人物一 李逵 独劈 人物二  不济事,1
TRAIN_SENT_ID_252879,,颜回,孔子,《 索隐 》 ： “ 蚊蝇 附骥 尾而致 千里 ， 以 譬 颜回 因 孔子 而 名彰 。 ”,索隐    蚊蝇 附骥 尾而致 千里  譬 人物一 人物二 名彰,1
TRAIN_SENT_ID_276983,,樊迟,孔子,"孔子 去世 后 , 樊迟 同 闵子 ( 名损 , 字子 骞 ) 和 宓子 ( 名 不齐 , 字子 贱 ) 来棠 地 ( 今 鱼台县 境内 ) 办学 , 传道 于 济水 一带 。",人物二 去世  人物一 闵子  名损  字子 骞  宓子  名 不齐  字子 贱  来棠  鱼台县 境内  办学  传道 济水 一带,1
TRAIN_SENT_ID_265419,,薛谭,秦青,《 列子 · 汤问 》 ： “ 薛谭 学 讴于 秦青 ， 未穷 青之技 ， 自谓 尽 之 ， 遂 辞 归 ， 秦青 弗止 ， 饯于 郊衢 ， 抚节 悲歌 ， 声振林木 ， 响遏行云 。,列子  汤问    人物一 学 讴于 人物二  未穷 青之技  自谓  遂 辞  人物二 弗止  饯于 郊衢  抚节 悲歌  声振林木  响遏行云,1
TRAIN_SENT_ID_271293,,吕祖俭,吕祖谦,至 端平 年间 （ 1234 - 1236 ） ， 吕氏 门人 又 将丽泽 书院 内 的 吕祖谦 祀 室 改建 为 “ 吕成 公祠 ” ， 主祀 成公 吕祖谦 ， 配祀 忠公 吕祖俭 。,端平 年间       吕氏 门人 将丽泽 书院 人物二 祀 室 改建  吕成 公祠   主祀 成公 人物二  配祀 忠公 人物一,-1
TRAIN_SENT_ID_269556,,步鹰,燕双鹰,另外 ， 在 电视剧 《 英雄 》 中 ， 燕双鹰 的 师傅 步鹰 也 使用 这 把 刀 。,电视剧  英雄  中  人物二 师傅 人物一 使用 刀,1
TRAIN_SENT_ID_251838,,梅超风,黄药师,幸得 梅超风 舍身 护师 ， 替 黄药师 接 了 西毒 全力 一击 的 蛤蟆功 。,幸得 人物一 舍身 护师  人物二 接 西毒 全力 一击 蛤蟆功,1
TRAIN_SENT_ID_277642,,方天翼,顾婷,在 俞梅 牺牲 的 第二天 ， 方天翼 单枪匹马 闯进 南京城 ， 以 搏命 的 方式 杀 了 松下 健 ， 报 了 杀 妻之仇 ， 并 与 顾婷 加入 共产党 。,俞梅 牺牲 第二天  人物一 单枪匹马 闯进 南京城  搏命 方式 杀 松下 健  报 杀 妻之仇  人物二 加入 共产党,-1
TRAIN_SENT_ID_259929,,周志文,周志康,1 介绍 : 《 日月 》 — 周志文 周志康,介绍   日月   人物一 人物二,-1
TRAIN_SENT_ID_254263,,张顺,张横,水军 头领 张横 立功 心切 ， 不顾 张顺 劝阻 ， 率 二三百 人去 劫 关胜 营寨 ， 结果 被 关胜 部下 探知 。,水军 头领 人物二 立功 心切  不顾 人物一 劝阻  率 二三百 人去 劫 关胜 营寨  关胜 部下 探知,-1
TRAIN_SENT_ID_260740,,薛丁山,薛金莲,太子 李治 命 薛丁山 挂 二路 元帅 ， 程咬金 监军 ， 薛金莲 押 粮 ， 前往 救驾 。,太子 李治 命 人物一 挂 二路 元帅  程咬金 监军  人物二 押 粮  前往 救驾,-1
TRAIN_SENT_ID_253912,,赵合德,赵飞燕,《 飞燕 外传 》 其实 不能 称作 书 ， 它 只有 廖 廖 数千 字 ， 以 性行为 中心 ， 叙说 赵飞燕 、 赵合德 姊妹 与 汉成帝 之间 的 恩怨 纠葛 。,飞燕 外传  其实 不能 称作 书  廖 廖 数千 字  性行为 中心  叙说 人物二  人物一 姊妹 汉成帝 之间 恩怨 纠葛,-1
TRAIN_SENT_ID_271516,,孟优,孟获,孟获 派弟 孟优 赴汉军 处假 投降 ， 欲 内应 外合 ， 诸葛亮 将计就计 ， 埋伏 擒获 孟获 和 诸洞 酋长 ， 马忠 亦 于 此战 立下 战功 。,人物二 派弟 人物一 赴汉军 处假 投降  欲 内应 外合  诸葛亮 将计就计  埋伏 擒获 人物二 诸洞 酋长  马忠 此战 立下 战功,-1
TRAIN_SENT_ID_251545,,楚碧痕,楚寒镜,迷宫 搜索 关键词 ： 三寒器 、 炎帝 神农 、 梭罗树 、 梭罗 果 、 楚碧痕 、 楚寒镜 、 月 幽之境 、 熔岩 兽王 、 炙炎石,迷宫 搜索 关键词  三寒器  炎帝 神农  梭罗树  梭罗 果  人物一  人物二  月 幽之境  熔岩 兽王  炙炎石,-1
TRAIN_SENT_ID_252710,,颜回,孔子,孔子 与 颜回 的 这段 谈话 完全 出自 假托 。,人物二 人物一 这段 谈话 完全 出自 假托,1
TRAIN_SENT_ID_268945,,韩非,荀子,003 . 先秦 百家 《 道德经 》 《 庄子 》 《 墨子 》 《 荀子 》 《 鬼谷子 》 《 孙子兵法 》 《 韩非 子 》,先秦 百家  道德经   庄子   墨子   人物二   鬼谷子   孙子兵法   人物一 子,1
TRAIN_SENT_ID_252821,,颜回,孔子,颜回 走 了 ， 孔子 看着 颜回 的 背影 ， 心花怒放 地想 弹奏 一曲 。,人物一 走  人物二 看着 人物一 背影  心花怒放 地想 弹奏 一曲,1
TRAIN_SENT_ID_279136,,范长利,朱绍文,朱绍文 - - 春长隆 、 冯昆治 、 范长利 、 桂祯 、 徐长福 、 沈竹善,人物二   春长隆  冯昆治  人物一  桂祯  徐长福  沈竹善,1
TRAIN_SENT_ID_253099,,颜回,孔子,殿内 供奉 着 孔子 及 孟轲 、 颜回 等 四配 十二 哲人 的 牌位 ， 显示 出 孔子 之学 后继有人 ， 学子 济济一堂 。,殿内 供奉 人物二 孟轲  人物一 四配 十二 哲人 牌位  显示 出 人物二 之学 后继有人  学子 济济一堂,1
TRAIN_SENT_ID_260947,,杨露禅,陈长兴,昔日 杨露禅 从 陈长兴 习老架 而 成 杨 无敌 ； 武禹襄 从 陈清萍 习小架 而 技至 神化 之境 ， 即 是 明证 。,昔日 人物一 人物二 习老架 成 杨 无敌  武禹襄 陈清萍 习小架 技至 神化 之境  明证,1
TRAIN_SENT_ID_261149,,王缙,王维,2 成语 典故 : 【 出处 】 ： 《 新唐书 · 韦抗 传 》 ： “ 它 所辟举 ， 如 王维 、 王缙 、 崔殷 等 ， 皆 一时 选云 。 ”,成语 典故   出处    新唐书  韦抗 传    所辟举  人物二  人物一  崔殷  皆 一时 选云,-1
TRAIN_SENT_ID_265577,,张崇基,张崇德,"叱咤 乐坛 生力军 组合 ： 金奖 ： 风 火海 银奖 ： GirlFriends 铜奖 ： 张崇基 , 张崇德",叱咤 乐坛 生力军 组合  金奖  风 火海 银奖   铜奖  人物一  人物二,-1
TRAIN_SENT_ID_255380,,罗成,秦琼,与 秦琼 交情 深厚 ， 而且 由于 相貌堂堂 ， 为 绿林 英雄 树立 了 形象 ， 多次 博得 对手 的 敬佩 ， 就 连 心高气傲 的 罗成 也 一 见面 就 和 他 套近乎 。,人物二 交情 深厚  相貌堂堂  绿林 英雄 树立 形象  多次 博得 对手 敬佩  心高气傲 人物一 见面 套近乎,-1
TRAIN_SENT_ID_265397,,薛谭,秦青,《 列子 · 汤问 》 ： “ 薛谭 学 讴于 秦青 ， 未穷 青之技 ， 自谓 尽 之 ； 遂 辞 归 。,列子  汤问    人物一 学 讴于 人物二  未穷 青之技  自谓  遂 辞,1
TRAIN_SENT_ID_250370,,赵飞燕,赵合德,12 . 二个 舞姿 更是 优美 ， 喜 得 太宗笑 曰 ： “ 汝二人 真 乃 赵飞燕 、 赵合德 也 ！ ”,二个 舞姿 更是 优美  喜 太宗笑 曰   汝二人 真 人物一  人物二,-1
TRAIN_SENT_ID_249532,,李蔡,李广,班固 说 ： “ 山东 出相 ， 山西 出 将 ， 汉兴 ， 成纪 李广 、 李蔡 ， 上 邦 赵充国 ， 襄武 廉褒 ， 狄道 辛武贤 、 庆忌 ， 皆 以 勇武 显闻 。 ”,班固 说   山东 出相  山西 出  汉兴  成纪 人物二  人物一  邦 赵充国  襄武 廉褒  狄道 辛武贤  庆忌  皆 勇武 显闻,-1
TRAIN_SENT_ID_269010,,李如柏,李如松,主将 李如松 坐骑 被 击毙 ， 副将 李如柏 ( 李成梁 次子 ) 头盔 被 击中 ， 游击 吴惟忠 胸部 中弹 。,主将 人物二 坐骑 击毙  副将 人物一  李成梁 次子  头盔 击中  游击 吴惟忠 胸部 中弹,-1
TRAIN_SENT_ID_250654,,鲁西西,皮皮鲁,第 232 集 鲁西西 看着 皮皮鲁 出神 儿 ； 班干部 长大 后 的 名气 ； 人类 变小 后 不是 老鼠 的 对手 ； 鲁西西 承担重任,集 人物一 看着 人物二 出神  班干部 长大 名气  人类 变小 老鼠 对手  人物一 承担重任,-1
TRAIN_SENT_ID_252432,,颜回,孔子,考 颜回 一生 ， 大多 为 追随 孔子 奔走 于六国 ， 归鲁后 亦 未 入仕 ， 而是 穷居 陋巷 。,考 人物一 一生  大多 追随 人物二 奔走 于六国  归鲁后 未 入仕  穷居 陋巷,1
TRAIN_SENT_ID_250406,,赵飞燕,赵合德,"人物 : 亦念子 , 帝姬 , 刘骜 , 赵飞燕 , 赵合德 , 甄宓 , 曹丕 , 曹植 , 曹操 , 李隆基 , 杨玉环 … …",人物  亦念子  帝姬  刘骜  人物一  人物二  甄宓  曹丕  曹植  曹操  李隆基  杨玉环,-1
TRAIN_SENT_ID_252510,,颜回,孔子,2 柳下惠 人物 简介 : 孔子 为 至圣 ， 孟子为 亚圣 ， 颜回 为 复圣 ， 曾 参为 宗圣 ， 和 圣为 柳下惠,柳下惠 人物 简介  人物二 至圣  孟子为 亚圣  人物一 复圣  参为 宗圣  圣为 柳下惠,1
TRAIN_SENT_ID_249131,,皮皮鲁,鲁西西,蜘蛛 表是 皮皮鲁 送给 鲁西西 的 礼物 ， 戴着 这块 表 蚊子 都 不敢 靠近 鲁西西 了 。,蜘蛛 表是 人物一 送给 人物二 礼物  戴着 这块 表 蚊子 不敢 靠近 人物二,-1
TRAIN_SENT_ID_252396,,颜回,孔子,故 孔子 常 称赞 颜回 具有 君子 四德 ， 即 强于 行义 ， 弱于 受谏 ， 怵 于 待禄 ， 慎于 治身 。,人物二 常 称赞 人物一 具有 君子 四德  强于 行义  弱于 受谏  怵 待禄  慎于 治身,1
TRAIN_SENT_ID_279224,,吕馨,吕禄,吕馨 听到 后 ， 流着 眼泪 ， 求着 吕雉 饶 她 一命 ， 此时 吕馨 的 表哥 吕禄 来 了 。,人物一 听到  流着 眼泪  求着 吕雉 饶 一命  人物一 表哥 人物二,-1
TRAIN_SENT_ID_273655,,姜子牙,元始天尊,武王灭 商后 ， 姜子牙 奉命 太上老君 及 元始天尊 敕令 封神 ， 殷郊 被 封为 太岁 神 。,武王灭 商后  人物一 奉命 太上老君 人物二 敕令 封神  殷郊 封为 太岁 神,1
TRAIN_SENT_ID_257832,,林平之,岳不群,为 人 忠厚老实 ， 因 看见 师父 杀 林平之 感到 震惊 喊 了 一声 ， 也 因此 惊动 岳不群 引来 杀身之祸 。,忠厚老实  看见 师父 杀 人物一 感到 震惊 喊 一声  惊动 人物二 引来 杀身之祸,1
TRAIN_SENT_ID_282436,,蒋瑶嘉,周华健,⑤ 蒋瑶嘉 《 梦 的 堡垒 》 （ 周华健 ）,⑤ 人物一  梦 堡垒   人物二,1
TRAIN_SENT_ID_265601,,苗飞飞,苗蜜,苗蜜 ( 蜂族 ) 、 苗飞飞 ( 蜂族 ) 、 嘎库 喽契 、 哥库 喽 契人族 : 湛江云 、 浪 千山 、 岳驼 、 晏河 、 莫修 、 霍真 、 石 雷鸣 、 项 殷风,人物二  蜂族   人物一  蜂族   嘎库 喽契  哥库 契人族  湛江云  浪 千山  岳驼  晏河  莫修  霍真  石 雷鸣  项 殷风,-1
TRAIN_SENT_ID_277958,,杨少华,郭荣起,郭荣起 — — 常宝霆 、 郭宝 明 、 杜 三宝 、 杨少华 、 谢天顺 、 张宝 如,人物二   常宝霆  郭宝 明  杜 三宝  人物一  谢天顺  张宝,1
TRAIN_SENT_ID_251822,,梅超风,黄药师,黄药师 高举 梅超风 尸体 ， 浑 不 理会 六怪 的 兵刃 ， 直扑 过去 。,人物二 高举 人物一 尸体  浑 理会 六怪 兵刃  直扑 过去,1
TRAIN_SENT_ID_249006,,吕洞宾,韩湘子,两侧 分别 为汉 钟离 、 张果老 、 韩湘子 、 铁拐李 、 吕洞宾 、 曹国舅 、 蓝采和 、 何仙姑 的 “ 八仙 ” 泥塑 彩像 。,两侧 为汉 钟离  张果老  人物二  铁拐李  人物一  曹国舅  蓝采和  何仙姑  八仙  泥塑 彩像,1
TRAIN_SENT_ID_265566,,张崇基,张崇德,08 . 龙珠 ( 龙珠 Z ) - 张崇基 + 张崇德,龙珠  龙珠    人物一  人物二,-1
TRAIN_SENT_ID_282076,,陈长兴,陈秉旺,陈继夏 传 太极拳 于 陈秉旺 ， 陈秉旺 传 太极拳 于其子 陈长兴 。,陈继夏 传 太极拳 人物二  人物二 传 太极拳 于其子 人物一,1
TRAIN_SENT_ID_253005,,颜回,孔子,毛泽东 对此 篇 的 评论 与 运用 和 孔子 的 重心 相合 ， 也 推崇 颜回 ， 重视 中庸 。,毛泽东 对此 篇 评论 运用 人物二 重心 相合  推崇 人物一  重视 中庸,1
TRAIN_SENT_ID_265416,,薛谭,秦青,（ 元人 “ 燕南 芝庵 ” 《 论曲 》 ： “ 古善 唱者 五人 ： 秦青 、 薛谭 、 韩 秦娥 、 沈右 之 、 李存 符 。 ”,元人  燕南 芝庵   论曲    古善 唱者 五人  人物二  人物一  韩 秦娥  沈右  李存 符,1
TRAIN_SENT_ID_255377,,罗成,秦琼,泥人 多系 精美 的 脸谱 泥塑 创意作品 历史 人物 如 瓦岗寨 英雄 有 ： 徐 懋功 、 王伯当 、 秦琼 、 尉迟敬德 、 程咬金 、 罗成 等 。,泥人 多系 精美 脸谱 泥塑 创意作品 历史 人物 瓦岗寨 英雄  徐 懋功  王伯当  人物二  尉迟敬德  程咬金  人物一,-1
TRAIN_SENT_ID_253024,,颜回,孔子,3 历史 评价 : 鱼豢 曰 ： 昔 孔子 叹 颜回 ， 以为 三月 不违 仁者 ， 盖观 其 心耳 ， 孰如孙 、 祝 菜色 於 市里 ， 颠倒 於 牢狱 ， 据 有 实事 哉 ？,历史 评价  鱼豢 曰  昔 人物二 叹 人物一  三月 不违 仁者  盖观 心耳  孰如孙  祝 菜色 於 市里  颠倒 於 牢狱  实事,1
TRAIN_SENT_ID_268890,,司徒静,司徒剑南,司徒剑南 第二十三 集 : 司徒 家 几乎 全部 出动 去 寻找 司徒静 ， 朱允 、 白云飞 、 安宁公主 也 派 人 四处 查找 司徒静 的 下落 。,人物二 第二十三 集  司徒 家 几乎 出动 寻找 人物一  朱允  白云飞  安宁公主 派 四处 查找 人物一 下落,-1
TRAIN_SENT_ID_252765,,颜回,孔子,附人骥尾 释义 : 司马贞 索隐 ： “ 按 ： 苍蝇附骥 尾而致 千里 ， 以 譬 颜回 因 孔子 而 名彰 也 。 ”,附人骥尾 释义  司马贞 索隐    苍蝇附骥 尾而致 千里  譬 人物一 人物二 名彰,1
TRAIN_SENT_ID_274445,,方如沁,方兰生,方如沁 ， 女 ， 23 岁 ， 是 国产 RPG 游戏 《 古剑 奇谭 ： 琴心 剑魄 今何在 》 中 的 配角 ， 方兰生 的 二姐 。,人物一  女   岁  国产  游戏  古剑 奇谭  琴心 剑魄 今何在  中 配角  人物二 二姐,-1
TRAIN_SENT_ID_269501,,李国豪,李香凝,李海泉 与 何爱瑜 之孙计 有 ： 长孙 李国豪 、 次孙 李凯 豪 、 三孙 李伟 豪 、 四孙 李嘉 豪 、 孙女 李香凝 等 。,李海泉 何爱瑜 之孙计  长孙 人物一  次孙 李凯 豪  三孙 李伟 豪  四孙 李嘉 豪  孙女 人物二,-1
TRAIN_SENT_ID_251878,,曹薰铉,李昌镐,李昌镐 的 师傅 是 围棋 皇帝 曹薰铉 ， 朴永训 的 师傅 是 曾 被 罗洗河 挑落 擂台赛 的 崔圭丙 ！,人物二 师傅 围棋 皇帝 人物一  朴永训 师傅 罗洗河 挑落 擂台赛 崔圭丙,1
TRAIN_SENT_ID_249539,,李蔡,李广,李贤 ： “ 汉兴 ， 义渠 公孙贺 、 傅介子 ， 成纪 李广 、 李蔡 ， 上 邽 赵充国 ， 狄道 辛武贤 ， 皆 名将 也 。 ”,李贤   汉兴  义渠 公孙贺  傅介子  成纪 人物二  人物一  邽 赵充国  狄道 辛武贤  皆 名将,-1
TRAIN_SENT_ID_266134,,李昌镐,曹薰铉,双方 阵容 都 异常 鼎盛 ， 韩国队 以 李昌镐 领衔 ， 曹薰铉 、 李世石 、 安祚永 、 金东烨 、 洪性志 为 大将 。,双方 阵容 异常 鼎盛  韩国队 人物一 领衔  人物二  李世石  安祚永  金东烨  洪性志 大将,1
