sent_id,sent_id,entity1,entity2,sent,processed_sent,label
TRAIN_SENT_ID_271517,,孟优,孟获,三擒三纵 : 孟获 对 弟弟 孟优 说 ， 我们 已知 蜀军 军情 ， 你领 百余 精兵 去向 孔明 献宝 ， 借机 杀 了 孔明 。,三擒三纵  人物二 弟弟 人物一 说  已知 蜀军 军情  你领 百余 精兵 去向 孔明 献宝  借机 杀 孔明,-1
TRAIN_SENT_ID_267426,,陆展元,陆立鼎,象山 影视城 陆家庄 : 陆家庄 在 《 神雕 》 中是 陆展元 、 陆立鼎 两 兄弟 的 庄院 ， 小说 第一回 中 写道 的 故事情节 就是 在 这府院 发生 的 。,象山 影视城 陆家庄  陆家庄  神雕  中是 人物一  人物二 两 兄弟 庄院  小说 第一回 中 写道 故事情节 这府院 发生,-1
TRAIN_SENT_ID_261148,,王缙,王维,7 集评 : 唐宋 时期 : 唐 窦蒙 ： 时议 云 ： “ 论诗 则 曰 王维 、 崔颢 ； 论笔 则 王缙 李邕 端州 石室 记 、 李邕 ； 祖咏 、 张 说不得 预焉 。 ”,集评  唐宋 时期  唐 窦蒙  时议 云   论诗 曰 人物二  崔颢  论笔 人物一 李邕 端州 石室 记  李邕  祖咏  张 说不得 预焉,-1
TRAIN_SENT_ID_265430,,薛谭,秦青,蓝蓝的 天空 上 飘 着 几朵 白云 ， 野草 、 树林 一片 新绿 ， 宴席 间 ， 秦青 斟 了 一 杯酒 ， 对 薛谭 说道 ： “ 你 我 师徒 相处 感情 甚 好 ！,蓝蓝的 天空 飘 几朵 白云  野草  树林 一片 新绿  宴席 间  人物二 斟 杯酒  人物一 说道   师徒 相处 感情 甚,1
TRAIN_SENT_ID_274097,,南宫敬叔,孔子,孔子 对 南宫敬叔 说 ： “ 我 听说 老子 博古通今 ， 通晓 礼乐 的 起源 ， 明白 道德 的 归属 ， 那么 他 就是 我 的 老师 ， 现在 我要 到 他 那里 去 。 ”,人物二 人物一 说   听说 老子 博古通今  通晓 礼乐 起源  明白 道德 归属  老师  现在 我要,1
TRAIN_SENT_ID_254298,,张顺,张横,江州 揭阳 一带 有三霸 ， 揭阳 岭上 以 李俊 、 李立 为 一霸 ， 浔 阳江 中以 张横 、 张顺 为 一霸 ， 而 揭阳 镇上 则 以 穆弘 与 兄弟 穆春 为 一霸 。,江州 揭阳 一带 有三霸  揭阳 岭上 李俊  李立 一霸  浔 阳江 中以 人物二  人物一 一霸  揭阳 镇上 穆弘 兄弟 穆春 一霸,-1
TRAIN_SENT_ID_252409,,颜回,孔子,孔子 说 着 ， 将琴 推到 颜回 面前 ， 颜回 并 不 推辞 ， 他 调好 琴弦 ， 一边 弹 一边 唱 。,人物二 说  将琴 推到 人物一 面前  人物一 推辞  调好 琴弦  一边 弹 一边 唱,1
TRAIN_SENT_ID_251435,,李瀚章,李鸿章,王徒心 《 续 汉口 丝谈 》 上 记载 ： “ 光绪 初 ， 合肥 李瀚章 （ 李鸿章 之兄 ） 督 湖广 ， 酷 嗜 此品 （ 按 ： 指 洪山 菜苔 ） ， 觅 种植 于 乡 ， 则 远 不及 。,王徒心  续 汉口 丝谈  记载   光绪 初  合肥 人物一  人物二 之兄  督 湖广  酷 嗜 此品   指 洪山 菜苔   觅 种植 乡  远 不及,-1
TRAIN_SENT_ID_253830,,赵合德,赵飞燕,燕 啄 皇孙 : 《 汉书 》 里 记载 成帝 死后 ， 司隶 解光 对 赵合德 杀害 许美人 及 女官 曹宫 之子 的 奏疏 ， 其 动机 是 想 惩罚 赵飞燕 。,燕 啄 皇孙   汉书  里 记载 成帝 死后  司隶 解光 人物一 杀害 许美人 女官 曹宫 之子 奏疏  动机 想 惩罚 人物二,-1
TRAIN_SENT_ID_268832,,洪凌波,李莫愁,洪凌波 角色 设定 : 洪凌波 虽然 是 李莫愁 的 徒弟 ， 但 她 的 性格 心地 却 和 李莫愁 迥然不同 。,人物一 角色 设定  人物一 人物二 徒弟  性格 心地 人物二 迥然不同,1
TRAIN_SENT_ID_257555,,毛泽民,毛泽东,闻 毛泽民 陈潭秋 被害 作品 注释 : ① 毛泽民 ： （ 1896 — 1943 ） ， 湖南 湘潭人 ， 毛泽东 的 弟弟 。,闻 人物一 陈潭秋 被害 作品 注释  ① 人物一        湖南 湘潭人  人物二 弟弟,-1
TRAIN_SENT_ID_271530,,孟优,孟获,根据 史籍 记载 ， 巍 宝山 在 汉代 就 有 孟优 （ 孟获 之兄 ） 导师 在 山中 传教 。,史籍 记载  巍 宝山 汉代 人物一  人物二 之兄  导师 山中 传教,-1
TRAIN_SENT_ID_284969,,元孚,元昌,元孚 ， 字秀 和 ， 元昌 弟 。,人物一  字秀  人物二 弟,-1
TRAIN_SENT_ID_276958,,樊迟,孔子,结合 上述 孔子 告 樊迟 语 ， 可 看出 孔子 持 与 夏人 商人 不同 的 鬼神 观 ， 并教 樊迟 从 周道 。,结合 上述 人物二 告 人物一 语  看出 人物二 持 夏人 商人 不同 鬼神 观  并教 人物一 周道,1
TRAIN_SENT_ID_284830,,金正中,马小玲,在 第二部 中 姑姑 （ 马叮当 ） 死后 伤心 的 马小玲 又 迎来 亲手 杀死 徒弟 （ 金正中 ） 和 姑婆 （ 马丹娜 ） 魂飞魄散 。,第二部 中 姑姑  马叮当  死后 伤心 人物二 迎来 亲手 杀死 徒弟  人物一  姑婆  马丹娜  魂飞魄散,1
TRAIN_SENT_ID_273692,,姜子牙,元始天尊,姜太公 在 此 百无禁忌 民间传说 : 姜子牙 是 元始天尊 的 小 徒弟 ， 奉 师命 辅佐 周文王 、 武王 讨伐 商 纣王 。,姜太公 百无禁忌 民间传说  人物一 人物二 徒弟  奉 师命 辅佐 周文王  武王 讨伐 商 纣王,1
TRAIN_SENT_ID_265602,,苗飞飞,苗蜜,苗飞飞 角色 形象 : 苗蜜 的 小妹 ， 苗飞飞 个性 活泼 洒脱 ， 但 较为 任性 ， 且 说话 直接 、 言词 犀利 ， 擅长 回旋 刀法 ， 出手 凌厉 毫无保留 。,人物一 角色 形象  人物二 小妹  人物一 个性 活泼 洒脱  较为 任性  说话 直接  言词 犀利  擅长 回旋 刀法  出手 凌厉 毫无保留,-1
TRAIN_SENT_ID_250340,,赵飞燕,赵合德,大致 写 的 是 汉成帝 与 后妃 赵飞燕 赵合德 的 事情 。,大致 写 汉成帝 后妃 人物一 人物二 事情,-1
TRAIN_SENT_ID_264558,,胡青牛,张无忌,在 治疗 张无忌 的 过程 中 ， 胡青牛 自言自语 治疗 寒毒 的 原理 ， 张无忌 为了 显得 “ 我 武当派 这些 也 懂 ” ， 发出 谬论 与 胡青牛 胡搅蛮缠 。,治疗 人物二 过程 中  人物一 自言自语 治疗 寒毒 原理  人物二 显得  武当派 懂   发出 谬论 人物一 胡搅蛮缠,1
TRAIN_SENT_ID_253901,,赵合德,赵飞燕,赵飞燕 燕 啄 皇孙 : 《 汉书 》 里 记载 成帝 死后 ， 司隶 解光 对 赵合德 杀害 许美人 及 女官 曹宫 之子 的 奏疏 ， 其 动机 是 想 惩罚 赵飞燕 。,人物二 燕 啄 皇孙   汉书  里 记载 成帝 死后  司隶 解光 人物一 杀害 许美人 女官 曹宫 之子 奏疏  动机 想 惩罚 人物二,-1
TRAIN_SENT_ID_260736,,薛丁山,薛金莲,薛金莲 主要 剧情 : 在 说史 演义 《 薛丁山 征西 》 中 ， 金莲 随 哥嫂 薛丁山 与 樊梨花 一同 征西 。,人物二 主要 剧情  说史 演义  人物一 征西  中  金莲 哥嫂 人物一 樊梨花 一同 征西,-1
TRAIN_SENT_ID_282542,,苗正,黄震,苗正 ， 字 壮德 ， 山东 沂水 人 ， 是 黄震 的 表弟 ， 善使 青 釭 剑 ， 做 任何 事 都 尽心尽力 ， 舍死 拼命 。,人物一  字 壮德  山东 沂水  人物二 表弟  善使 青 釭 剑  做 事 尽心尽力  舍死 拼命,-1
TRAIN_SENT_ID_268884,,司徒静,司徒剑南,司徒剑南 第八集 : 司徒静 命悬 发丝 ， 陈林 将 她 救下 。,人物二 第八集  人物一 命悬 发丝  陈林 救下,-1
TRAIN_SENT_ID_249552,,李蔡,李广,其 裨将 及 校尉 侯者 九人 ， 为 特将者 十五 人 ， 李广 、 张骞 、 公孙贺 、 李蔡 、 曹襄 、 韩说 、 苏建 皆 自有 传 。 ”,裨将 校尉 侯者 九人  特将者 十五  人物二  张骞  公孙贺  人物一  曹襄  韩说  苏建 皆 自有 传,-1
TRAIN_SENT_ID_284935,,拓跋衍,拓跋安寿,拓跋衍 ， 字 安乐 ， 拓跋安寿 弟 ， 赐爵 广陵 侯 。,人物一  字 安乐  人物二 弟  赐爵 广陵 侯,-1
TRAIN_SENT_ID_252757,,颜回,孔子,③ 出自 春秋时期 孔子 弟子 颜回 ， 属于 以 先祖 名字 为氏 。,③ 出自 春秋时期 人物二 弟子 人物一  属于 先祖 名字 为氏,1
TRAIN_SENT_ID_275808,,白兔公子,彭祖,彭祖 有 8 大 弟子 ： 青衣 乌公 、 黑穴公 、 秀眉 公 、 白兔公子 、 离患公 、 太足君 、 高丘子 、 不肯 来 。,人物二  弟子  青衣 乌公  黑穴公  秀眉 公  人物一  离患公  太足君  高丘子  不肯,1
TRAIN_SENT_ID_252753,,颜回,孔子,女 与 回 也 孰 愈 翻译 : 孔子 对 子贡 说 ： “ 你 和 颜回 比 ， 谁 好些 ？ ”,女 回 孰 愈 翻译  人物二 子贡 说   人物一  好些,1
TRAIN_SENT_ID_259629,,公孙胜,罗真人,路新宇 与 沈涛 又 往 二 仙山 求 公孙胜 师父 罗真人 相帮 ， 罗真人 使 董浩 下山 ， 破 了 无虚 道人 的 法术 ， 杀 进 孙家庄 。,路新宇 沈涛 二 仙山 求 人物一 师父 人物二 相帮  人物二 董浩 下山  破 无虚 道人 法术  杀 进 孙家庄,1
TRAIN_SENT_ID_283647,,元泰,于占元,（ 于占元 徒弟 七小福 之一 ） : 元泰 为 于占元 得意门生 ， 与 元龙 、 元楼 、 元彪 、 元奎 、 元华 、 元武 并 称为 七小福 。,人物二 徒弟 七小福   人物一 人物二 得意门生  元龙  元楼  元彪  元奎  元华  元武 称为 七小福,1
TRAIN_SENT_ID_276992,,樊迟,孔子,的确 ， 樊迟 是 天资 不够 ， 因此 孔子 只 给 他 讲 最 基本 的 道理 ， 只教 他 “ 仁 ” 的 最 基本概念 — — “ 爱人 ” 。,人物一 天资 不够  人物二 讲 基本 道理  只教  仁  基本概念    爱人,1
TRAIN_SENT_ID_249546,,李蔡,李广,李妍 觉得 李敢 是 一步 好棋 ， 因为 “ 李氏家族 从 汉高祖 时代 就是 朝廷 重臣 ， 早有 名将 广武君 李左车 ， 今有 安乐 侯 李蔡 和 飞将军 李广 ” 。,李妍 觉得 李敢 一步 好棋   李氏家族 汉高祖 时代 朝廷 重臣  早有 名将 广武君 李左车  今有 安乐 侯 人物一 飞将军 人物二,-1
TRAIN_SENT_ID_271514,,孟优,孟获,孟优 说 ： “ 家兄 孟获 ， 感 丞相 活命之恩 ， 无可 奉献 ， 辄 具金珠 宝贝 若 ， 权为 赏军 之资 。,人物一 说   家兄 人物二  感 丞相 活命之恩  无可 奉献  辄 具金珠 宝贝  权为 赏军 之资,-1
TRAIN_SENT_ID_254285,,张顺,张横,姜鸿飞 的 《 水浒 中传 》 中 ， 张横 随征 方腊 ， 与 弟弟 张顺 一同 战死 于 杭州 涌 金门 。,姜鸿飞  水浒 中传  中  人物二 随征 方腊  弟弟 人物一 一同 战死 杭州 涌 金门,-1
TRAIN_SENT_ID_282412,,赵公明,通天教主,通天教主 在 碧游宫 分宝时 ， 将定 海珠 与 缚 龙索 赐给 了 赵公明,人物二 碧游宫 分宝时  将定 海珠 缚 龙索 赐给 人物一,1
TRAIN_SENT_ID_260955,,杨露禅,陈长兴,十四 世孙 陈长兴 还 打破 了 “ 太极拳 不传 异姓 ” 的 家规 ， 教出 了 第一个 异姓 弟子 — — 河北 永年县 人 杨露禅 。,十四 世孙 人物二 打破  太极拳 不传 异姓  家规  教出 第一个 异姓 弟子   河北 永年县 人物一,1
TRAIN_SENT_ID_271525,,孟优,孟获,对于 历史 小说 《 三国演义 》 记述 的 印证 见于 《 新纂 云南 通志 · 释道 传 》 ： “ 汉 孟优 ， 蒙化 人 ， 居巍 宝山 ， 土帅 孟获 兄 也 。,历史 小说  三国演义  记述 印证 见于  新纂 云南 通志  释道 传    汉 人物一  蒙化  居巍 宝山  土帅 人物二 兄,-1
TRAIN_SENT_ID_255289,,卫夫人,王羲之,《 笔阵 图 》 一篇 ， 旧题 卫夫人 撰 ， 后 众说纷纭 ， 或 疑为 王羲之 撰 ， 或 疑为 六朝 人 伪托 。,笔阵 图  一篇  旧题 人物一 撰  众说纷纭  疑为 人物二 撰  疑为 六朝 伪托,1
TRAIN_SENT_ID_261336,,罗松,罗成,他家 的 罗春 ， 在 《 说 唐 》 是 老家人 ， 在 曲艺 评书 《 兴唐 》 、 《 隋唐 》 、 《 瓦岗 英雄 》 罗春 与 罗松 都 是 罗成 的 兄弟 。,他家 罗春   说 唐  老家人  曲艺 评书  兴唐    隋唐    瓦岗 英雄  罗春 人物一 人物二 兄弟,-1
TRAIN_SENT_ID_261165,,王缙,王维,时议 云 ： 论诗 则 王维 、 崔颢 ， 论笔 则 王缙 、 李邕 ， 祖咏 、 张 说不得 与 焉 。,时议 云  论诗 人物二  崔颢  论笔 人物一  李邕  祖咏  张 说不得,-1
TRAIN_SENT_ID_275810,,白兔公子,彭祖,人物 简介 : 彭祖 有 8 大 弟子 ： 青衣 乌公 、 黑穴公 、 秀眉 公 、 白兔公子 、 离患公 、 太足君 、 高丘子 、 不肯 来 。,人物 简介  人物二  弟子  青衣 乌公  黑穴公  秀眉 公  人物一  离患公  太足君  高丘子  不肯,1
TRAIN_SENT_ID_249037,,吕洞宾,韩湘子,门扇 左右 雕有 四位 “ 八仙 ” 中 人物 ， 分别 是 吕洞宾 、 韩湘子 、 篮采 和 和 铁拐李 。,门扇 左右 雕有 四位  八仙  中 人物  人物一  人物二  篮采 铁拐李,1
TRAIN_SENT_ID_252477,,颜回,孔子,“ 孔子 列国 行 ” 大型 铜雕 生动 再现 了 孔子 天命 之年 带 颜回 等 弟子 ， 纵马 驱车 ， 昂扬 奋进 的 情态 。,人物二 列国 行  大型 铜雕 生动 再现 人物二 天命 之年 带 人物一 弟子  纵马 驱车  昂扬 奋进 情态,1
TRAIN_SENT_ID_252619,,颜回,孔子,这 境界 连 孔子 也 有所不知 ， 反问 颜回 ， 颜回 解释 说 ： “ 堕 肢体 ， 黜 聪明 ， 离形 去 知 ， 同 于 大通 ， 此谓 坐忘 ” 。,境界 人物二 有所不知  反问 人物一  人物一 解释 说   堕 肢体  黜 聪明  离形 知  大通  此谓 坐忘,1
TRAIN_SENT_ID_255281,,卫夫人,王羲之,卫夫人 教 王羲之 书法 ， 还教 他 知道 天外有天 ， 人外有人 ， 不可 骄傲 懒散 。,人物一 教 人物二 书法  还教 知道 天外有天  人外有人  不可 骄傲 懒散,1
TRAIN_SENT_ID_248991,,吕洞宾,韩湘子,据传 ， 因 吕洞宾 、 韩湘子 、 何仙姑 等 八位 神仙 在 练功 时 触发 灵感 所创 并 流传 下来 之 缘故 。,据传  人物一  人物二  何仙姑 八位 神仙 练功 时 触发 灵感 所创 流传 下来 缘故,1
TRAIN_SENT_ID_252422,,颜回,孔子,孔子 对 颜回 亦 引 以为 是 唯一 的 同道 ， 说 “ 用 之 则 行 ， 舍之则 藏 ， 唯 我 与 尔 有 是 夫 ！ ”,人物二 人物一 引 唯一 同道  说  行  舍之则 藏  唯 夫,1
TRAIN_SENT_ID_267786,,万剑一,林惊羽,万剑一 沦落 扫地 老头 ， 林惊羽 拜 其 师傅 ， 万剑一 便 将 四式 剑诀 尽数 传于 林惊羽 。,人物一 沦落 扫地 老头  人物二 拜 师傅  人物一 便 四式 剑诀 尽数 传于 人物二,1
TRAIN_SENT_ID_268968,,韩非,荀子,《 史记 》 记载 ， 韩非 精于 “ 刑名 法术 之学 ” ， 与 秦相 李斯 都 是 荀子 的 学生 。,史记  记载  人物一 精于  刑名 法术 之学   秦相 李斯 人物二 学生,1
TRAIN_SENT_ID_260704,,王重阳,全真七子,七子 全真七子 : 全真七子 ： 指 马钰 、 谭处端 、 刘处玄 、 丘处机 、 王处一 、 郝大通 、 孙不二 ， 为 道教 全真道 创始人 王重阳 的 七位 嫡传 弟子 。,七子 人物二  人物二  指 马钰  谭处端  刘处玄  丘处机  王处一  郝大通  孙不二  道教 全真道 创始人 人物一 七位 嫡传 弟子,1
TRAIN_SENT_ID_283490,,俞莲舟,张三丰,武当七侠 ， 各有所长 ， 但 张三丰 却 独对 张翠山 另加 青眼 ， 寄予厚望 ， 其 原因 ， 俞莲舟 说 是因为 张翠山 悟性 最高 ， 可 作 张三丰 的 衣钵传人 。,武当七侠  各有所长  人物二 独对 张翠山 另加 青眼  寄予厚望  原因  人物一 说 是因为 张翠山 悟性 最高  作 人物二 衣钵传人,1
TRAIN_SENT_ID_286006,,冯难敌,黄真,冯难敌 的 师父 黄真 乃 穆人清 之 徒弟 ； 以 每代 二十年 计 ， 穆 当年 已 九十 高龄 了 。,人物一 师父 人物二 穆人清 徒弟  每代 二十年 计  穆 当年 九十 高龄,1
TRAIN_SENT_ID_255442,,罗成,秦琼,孙武 、 张良 、 秦琼 、 罗成 ， 各朝 名将 武魂 都 对 你 翘首以待 ， 甚至 传说 中 的 上古 诸神 ， 统统 有 可能 臣服于 你 ， 唯 你 马首是瞻 。,孙武  张良  人物二  人物一  各朝 名将 武魂 翘首以待  传说 中 上古 诸神  统统 可能 臣服于  唯 马首是瞻,-1
TRAIN_SENT_ID_252989,,颜回,孔子,颜回 谓 孔子 独立 人格 、 直行 道业云 ： “ 夫子 之道 至 大 ， 故 天下 莫 能容 。,人物一 谓 人物二 独立 人格  直行 道业云   夫子 之道  天下 莫 能容,1
TRAIN_SENT_ID_249056,,吕洞宾,韩湘子,道经 《 西山 群仙会 真记 》 将 曹国舅 和 陈真 君 ( 即 蓝采和 ) 、 韩湘子 、 何仙姑 列为 吕洞宾 弟子 ； 道经 《 玉溪 子丹经 指要 ?,道经  西山 群仙会 真记  曹国舅 陈真 君  蓝采和   人物二  何仙姑 列为 人物一 弟子  道经  玉溪 子丹经 指要,1
TRAIN_SENT_ID_275809,,白兔公子,彭祖,秀眉 公 人物 简介 : 彭祖 有 8 大 弟子 ： 青衣 乌公 、 黑穴公 、 秀眉 公 、 白兔公子 、 离患公 、 太足君 、 高丘子 、 不肯 来 。,秀眉 公 人物 简介  人物二  弟子  青衣 乌公  黑穴公  秀眉 公  人物一  离患公  太足君  高丘子  不肯,1
TRAIN_SENT_ID_282414,,赵公明,通天教主,通天教主 在 碧游宫 分宝时 ， 将定 海珠 与 缚 龙索 赐给 了 赵公明 。,人物二 碧游宫 分宝时  将定 海珠 缚 龙索 赐给 人物一,1
TRAIN_SENT_ID_252410,,颜回,孔子,孔子 弟子 中姓 颜 的 共有 八人 ， 他们 是 ： 颜无繇 、 颜回 、 颜幸 、 颜高 、 颜祖 、 颜之仆 、 颜哙 、 颜何 。,人物二 弟子 中姓 颜 共有 八人   颜无繇  人物一  颜幸  颜高  颜祖  颜之仆  颜哙  颜何,1
TRAIN_SENT_ID_276982,,樊迟,孔子,据 史籍 《 姓谱 》 记载 ， 孔子 弟子 樊须 ， 字子 迟 ， 世人 亦 称为 “ 樊迟 ” 。,史籍  姓谱  记载  人物二 弟子 樊须  字子 迟  世人 称为  人物一,1
TRAIN_SENT_ID_269573,,水笙,汪啸风,水笙 ， 金庸 武侠小说 《 连城诀 》 的 女主角 之一 ， 与 表哥 汪啸风 合称 “ 铃剑 双侠 ” 。,人物一  金庸 武侠小说  连城诀  女主角  表哥 人物二 合称  铃剑 双侠,-1
TRAIN_SENT_ID_261153,,王缙,王维,奉 和 王相公 早春 登 徐州 城 作品 注释 : （ 1 ） 王相公 ： 王缙 ， 字夏卿 ， 大 诗人 王维 弟 。,奉 王相公 早春 登 徐州 城 作品 注释     王相公  人物一  字夏卿  诗人 人物二 弟,-1
TRAIN_SENT_ID_252690,,颜回,孔子,陋巷 志 颜回 : 颜回 是 孔子 的 得意 弟子 ， 居 孔门 四科 之 首 ， 德行 第一 ， 天资 聪慧 ， 勤奋好学 ， 循礼 行仁 ， 尊师重道 。,陋巷 志 人物一  人物一 人物二 得意 弟子  居 孔门 四科 首  德行 第一  天资 聪慧  勤奋好学  循礼 行仁  尊师重道,1
TRAIN_SENT_ID_250395,,赵飞燕,赵合德,— — 西 汉成帝 后 赵飞燕 、 昭仪 赵合德,西 汉成帝 人物一  昭仪 人物二,-1
TRAIN_SENT_ID_248971,,吕洞宾,韩湘子,八仙 韩湘子 : 韩湘子 唐 韩湘子 ， 字 清夫 ， 是 古代 汉族 民间传说 故事 中 的 八仙 之一 ， 擅吹 洞箫 ， 拜 吕洞宾 为 师学道 。,八仙 人物二  人物二 唐 人物二  字 清夫  古代 汉族 民间传说 故事 中 八仙  擅吹 洞箫  拜 人物一 师学道,1
TRAIN_SENT_ID_255460,,罗成,秦琼,罗成 入朝 面君 ， 具奏 前事 ， 又 去 拜望 表哥 秦琼 ， 线娘 、 又兰为 秦母 拜寿 ， 又 与 诸 夫人 相见 问候 。,人物一 入朝 面君  具奏 前事  拜望 表哥 人物二  线娘  又兰为 秦母 拜寿  夫人 相见 问候,-1
TRAIN_SENT_ID_285112,,高季式,高乾,高季式 ， 字子通 ， 高乾 第四 弟 ， 渤海 蓚 人 也 。,人物一  字子通  人物二 第四 弟  渤海 蓚,-1
TRAIN_SENT_ID_250402,,赵飞燕,赵合德,（ 西汉 美女 赵飞燕 、 赵合德 的 合称 ） : 二赵 ， 典故 名 ， 典出 《 汉书 》 卷 九十七 下 〈 外戚 列传 下 · 孝成 赵 皇后 〉 。,西汉 美女 人物一  人物二 合称   二赵  典故 名  典出  汉书  卷 九十七  外戚 列传  孝成 赵 皇后,-1
TRAIN_SENT_ID_253133,,颜回,孔子,下面 是 庄子 描写 有关 坐忘 的 故事 ： 有 一次 ， 颜回 告诉 孔子 说 他 的 功夫 大有 进步 ， 已 忘 了 仁义 ， 孔子 认为 他 还 不够 深刻 。,下面 庄子 描写 坐忘 故事  一次  人物一 告诉 人物二 说 功夫 大有 进步  忘 仁义  人物二 认为 不够 深刻,1
TRAIN_SENT_ID_269451,,毛岸龙,毛岸英,毛岸龙 生死 之谜 : 电视剧 《 毛岸英 》 情景 展示 的 是 后 一种 说法 。,人物一 生死 之谜  电视剧  人物二  情景 展示 一种 说法,-1
TRAIN_SENT_ID_270805,,伍天锡,伍云召,第六条 好汉 ： 伍天锡 ， 伍云召 的 族弟 。,第六条 好汉  人物一  人物二 族弟,-1
TRAIN_SENT_ID_249097,,吕洞宾,韩湘子,唐暗 八仙 纹 发簪 文物 介绍 : 暗 八仙 即用 韩湘子 的 花 、 汉 钟离 的 扇 、 蓝采和 的 箫 、 吕洞宾 的 剑 等 器物 来 代表 八位 神仙 的 形像 。,唐暗 八仙 纹 发簪 文物 介绍  暗 八仙 即用 人物二 花  汉 钟离 扇  蓝采和 箫  人物一 剑 器物 代表 八位 神仙 形像,1
TRAIN_SENT_ID_268828,,洪凌波,李莫愁,1 角色 设定 : 洪凌波 虽然 是 李莫愁 的 徒弟 ， 但 她 的 性格 心地 却 和 李莫愁 迥然不同 。,角色 设定  人物一 人物二 徒弟  性格 心地 人物二 迥然不同,1
TRAIN_SENT_ID_255405,,罗成,秦琼,秦琼 遂 率 程咬金 、 罗成 （ 张翰 饰 ） 投 于 李世民 麾下 ， 屡立 战功 ， 最终 助 李唐 王朝平 定 天下 。,人物二 遂 率 程咬金  人物一  张翰 饰  投 李世民 麾下  屡立 战功  最终 助 李唐 王朝平 定 天下,-1
TRAIN_SENT_ID_277921,,毛威,李金斗,李金斗 ― ― 刘颖 、 大兵 、 毛威 、 韩冰 、 刘畅 、 付强 、 方清平 、 王政,人物二 ― ― 刘颖  大兵  人物一  韩冰  刘畅  付强  方清平  王政,1
TRAIN_SENT_ID_248988,,吕洞宾,韩湘子,随后 ， 吕洞宾 、 张果老 、 曹国舅 、 铁拐李 、 韩湘子 、 蓝采和 也 纷纷 将 各自 宝物 抛人 水中 ， 借助 宝物 大显神通 ， 傲 游东 侮 。,人物一  张果老  曹国舅  铁拐李  人物二  蓝采和 纷纷 宝物 抛人 水中  借助 宝物 大显神通  傲 游东 侮,1
TRAIN_SENT_ID_260944,,杨露禅,陈长兴,杨露禅 人生 履历 : 杨露禅 师从 河南 温县 陈家沟 陈长兴 ， 学成 后 回 永年县 ， 寓居 太和 堂 药店 ， 以授 拳 为生 。,人物一 人生 履历  人物一 师从 河南 温县 陈家沟 人物二  学成 回 永年县  寓居 太和 堂 药店  以授 拳 为生,1
TRAIN_SENT_ID_285936,,师冈岩间,师冈一羽,"师冈岩间 人物 简介 : 又名 岩间 熊之助 , 著名 剑客 师冈一羽 之徒",人物一 人物 简介  又名 岩间 熊之助  著名 剑客 人物二 之徒,1
TRAIN_SENT_ID_252840,,颜回,孔子,《 孔子 家语 · 颜回 》 ： “ 回 以此 哭声 ， 非但 为 死 而已 ， 又 有生 别离 者 也 。 ”,人物二 家语  人物一    回 以此 哭声  死  有生 别离,1
TRAIN_SENT_ID_248977,,吕洞宾,韩湘子,至 铁拐李 汉 钟离 吕洞宾 何仙姑 蓝采和 韩湘子 曹国舅 张果老 八仙,铁拐李 汉 钟离 人物一 何仙姑 蓝采和 人物二 曹国舅 张果老 八仙,1
TRAIN_SENT_ID_249001,,吕洞宾,韩湘子,内容 为 八仙 的 神话传说 ， 记叙 铁拐李 、 汉 钟离 、 吕洞宾 、 张果老 、 蓝采和 、 何仙姑 、 韩湘子 、 曹国舅 八位 神仙 修炼 得 道 的 过程 。,内容 八仙 神话传说  记叙 铁拐李  汉 钟离  人物一  张果老  蓝采和  何仙姑  人物二  曹国舅 八位 神仙 修炼 道 过程,1
TRAIN_SENT_ID_259663,,公孙胜,罗真人,入云龙 公孙胜 人物 介绍 : 公孙胜 ， 罗真人 弟子 ， 道 号 一清 先生 ， 能 呼风唤雨 ， 江湖人称 入云龙 。,入云龙 人物一 人物 介绍  人物一  人物二 弟子  道 号 一清 先生  呼风唤雨  江湖人称 入云龙,1
TRAIN_SENT_ID_249087,,吕洞宾,韩湘子,铁拐李 、 汉 钟离 、 吕洞宾 、 张果老 、 蓝采和 、 何仙姑 、 韩湘子 、 曹国舅 等 八仙 ， 历来 是 民间 年画 、 戏曲 中 的 主题 人物 。,铁拐李  汉 钟离  人物一  张果老  蓝采和  何仙姑  人物二  曹国舅 八仙  历来 民间 年画  戏曲 中 主题 人物,1
TRAIN_SENT_ID_251593,,穆春,穆弘,穆春 是 《 水浒传 》 中 的 人物 ， 绰号 小 遮拦 ， 江州 人氏 ， 原 是 揭阳 镇 富户 ， 与 哥哥 穆弘 同 为 当地 一霸 。,人物一  水浒传  中 人物  绰号 遮拦  江州 人氏  原 揭阳 镇 富户  哥哥 人物二 一霸,-1
TRAIN_SENT_ID_256491,,周武,周文,传说 中 的 周文 王和 周武 王 的 陵墓 在 现在 陕西省 咸阳市 的 原坂上 。,传说 中 人物二 王和 人物一 王 陵墓 现在 陕西省 咸阳市 原坂上,-1
TRAIN_SENT_ID_255478,,罗成,秦琼,瓦岗寨 起义 失败 后 ， 单雄信 的 结义兄弟 秦琼 、 罗成 、 程咬金 等 人 归顺 了 大唐 李氏 ， 而 单雄信 投靠 了 郑王 王世充 。,瓦岗寨 起义 失败  单雄信 结义兄弟 人物二  人物一  程咬金 归顺 大唐 李氏  单雄信 投靠 郑王 王世充,-1
TRAIN_SENT_ID_256912,,仲由,孔子,仲由 师从 孔子 : 仲由 为 人 伉直 鲁莽 ， 敢于 对 孔子 提出批评 ， 勇于 改正错误 ， 深得 孔子 器重 。,人物一 师从 人物二  人物一 伉直 鲁莽  敢于 人物二 提出批评  勇于 改正错误  深得 人物二 器重,1
