sent_id,sent_id,entity1,entity2,sent,processed_sent,label
TRAIN_SENT_ID_258121,,孙少安,孙兰香,他 是 土壤 ， 是 铺路石 ， 是 泥土 里 的 根 ， 在 这块 土壤 上长 出 了 孙少安 、 孙少平 和 孙兰香 这 几株 大树 。,土壤  铺路石  泥土 里 根  这块 土壤 上长 出 人物一  孙少平 人物二 几株 大树,-1
TRAIN_SENT_ID_266317,,贾源,贾演,第一代 ： 宁荣二 公 （ 贾演 贾源 ） 马上 “ 得 天下 ” ， 建立 了 贾府 的 基业 。,第一代  宁荣二 公  人物二 人物一  马上  天下   建立 贾府 基业,-1
TRAIN_SENT_ID_271527,,孟优,孟获,孔明 正在 帐 中 与 马谡 、 吕凯 、 蒋琬 、 费祎 等 共议 平蛮 之 事 ， 忽 帐 下 一人 ， 报称 孟获 差弟 孟优 来进 宝贝 。,孔明 正在 帐 中 马谡  吕凯  蒋琬  费祎 共议 平蛮 事  忽 帐 一人  报称 人物二 差弟 人物一 来进 宝贝,-1
TRAIN_SENT_ID_273668,,姜子牙,元始天尊,真武 封神 封神 场景 : 元始天尊 命 姜子牙 在 岐山 修建 ， 上 张挂 封神榜 。,真武 封神 封神 场景  人物二 命 人物一 岐山 修建  张挂 封神榜,1
TRAIN_SENT_ID_249541,,李蔡,李广,’ 秦时 郿 白起 ， 频阳 王翦 ； 汉兴 ， 义渠 公孙贺 、 傅介子 ， 成纪 李广 、 李蔡 ， 上 邽 赵充国 ， 狄道 辛武贤 ： 皆 名将 也 。,秦时 郿 白起  频阳 王翦  汉兴  义渠 公孙贺  傅介子  成纪 人物二  人物一  邽 赵充国  狄道 辛武贤  皆 名将,-1
TRAIN_SENT_ID_275817,,程万牛,程铁牛,罗通 扫北 程万牛 和 程铁牛 同 为 先锋 ， 征东 又 参加 了 二路 讨伐 军 ， 一直 没有 立 什么 功劳 。,罗通 扫北 人物一 人物二 先锋  征东 参加 二路 讨伐 军  一直 没有 立 功劳,-1
TRAIN_SENT_ID_271518,,孟优,孟获,孟获 殿 正殿 塑有 孟获 、 孟优 、 摩铁 三尊 神像 。,人物二 殿 正殿 塑有 人物二  人物一  摩铁 三尊 神像,-1
TRAIN_SENT_ID_259617,,季布,季心,其中 《 季布 栾布 列传 》 记述 季布 、 栾布 二人 的 生平事迹 外 ， 还 记载 了 季心 和 丁公 的 事迹 。,人物一 栾布 列传  记述 人物一  栾布 二人 生平事迹 外  记载 人物二 丁公 事迹,-1
TRAIN_SENT_ID_259791,,李偲菘,李伟菘,作曲 人 : 李伟菘 李偲菘 纪利 男 随安 苏恒 RickyHo,作曲  人物二 人物一 纪利 男 随安 苏恒,-1
TRAIN_SENT_ID_274107,,南宫敬叔,孔子,8 . ( 孔于 入 周问 礼乐 ) 周敬王 时期 ， 孔子 得到 鲁君 的 支持 ， 与 南宫敬叔 来到 周朝 国 都洛邑 。,孔于 入 周问 礼乐  周敬王 时期  人物二 得到 鲁君 支持  人物一 来到 周朝 国 都洛邑,1
TRAIN_SENT_ID_255434,,罗成,秦琼,贾家楼 四十六 友 ， 最铁 的 三个 就 秦琼 、 程咬金 与 罗成 。,贾家楼 四十六 友  最铁 三个 人物二  程咬金 人物一,-1
TRAIN_SENT_ID_274281,,梅小青,梅小惠,"《 满堂红 》 （ 曾伟权 ， 蔡倩儿 , 潘铣 怡 ， 杨得时 , 梅小惠 ） 梅小青 监制",满堂红   曾伟权  蔡倩儿  潘铣 怡  杨得时  人物二  人物一 监制,-1
TRAIN_SENT_ID_255360,,贾午,贾南风,同日 逮捕 贾午 、 赵粲 等 贾南风 党羽 ， 送至 暴室 杖 毙 。,同日 逮捕 人物一  赵粲 人物二 党羽  送至 暴室 杖 毙,-1
TRAIN_SENT_ID_263546,,林逸,杨明,校花 的 贴身 高手 杨明 : 林逸 的 师父 ， 前作 《 很纯 很 暧昧 》 的 主角 。,校花 贴身 高手 人物二  人物一 师父  前作  很纯 暧昧  主角,1
TRAIN_SENT_ID_261167,,王缙,王维,二公 名望 ， 首冠 一时 ， 时 议论 诗则 曰 王维 、 崔颢 ， 论笔 则 曰 王缙 、 李邕 。,二公 名望  首冠 一时  时 议论 诗则 曰 人物二  崔颢  论笔 曰 人物一  李邕,-1
TRAIN_SENT_ID_252502,,颜回,孔子,颜回 随 孔子 在 郑国 考察 了 大夫 子产 的 政绩 ， 考察 了 乡校 ， 拜祭 了 子产 。,人物一 人物二 郑国 考察 大夫 子产 政绩  考察 乡校  拜祭 子产,1
TRAIN_SENT_ID_282544,,苗正,黄震,回到 华国 后 对抗 卫将 杨东 ， 子荣 救驾 沂蒙山 ， 搭救 黄震 ， 并 几次 接应 迟恒喆 、 苗正 ， 化险为夷 。,回到 华国 对抗 卫将 杨东  子荣 救驾 沂蒙山  搭救 人物二  几次 接应 迟恒喆  人物一  化险为夷,-1
TRAIN_SENT_ID_252697,,颜回,孔子,"他 一身 静气 、 湛然 似 水 , 不动 如山 、 从容 自 在 , 他 是 孔子 最 得意 的 门生 - 颜回 。",一身 静气  湛然 似 水  不动 如山  从容  人物二 得意 门生  人物一,1
TRAIN_SENT_ID_249550,,李蔡,李广,李蔡 是 李广 的 从弟 ， 才能 在 下品 之中 ， 以 九品 论人 属 第八 等 ， 没有 什么 能耐 ， 可 他 青云直上 ， 官运亨通 ， 爵封 乐安 侯 ， 官 一直 做到 宰相 。,人物一 人物二 从弟  下品 之中  九品 论人 属 第八  没有 能耐  青云直上  官运亨通  爵封 乐安 侯  官 一直 做到 宰相,-1
TRAIN_SENT_ID_268964,,韩非,荀子,性恶论 以 法家 韩非 为例 : 韩非 主张 人性 恶比 荀子 更加 鲜明 彻底 。,性恶论 法家 人物一 为例  人物一 主张 人性 恶比 人物二 更加 鲜明 彻底,1
TRAIN_SENT_ID_262245,,尤二姐,尤三姐,另 一 说 : 金陵 十二钗 副册 为 ： 香菱 、 薛宝琴 、 尤二姐 、 尤三姐 、 邢岫烟 、 李纹 、 李绮 、 夏金桂 、 秋桐 、 平儿 、 龄 官 、 娇杏 ；,说  金陵 十二钗 副册  香菱  薛宝琴  人物一  人物二  邢岫烟  李纹  李绮  夏金桂  秋桐  平儿  龄 官  娇杏,-1
TRAIN_SENT_ID_277931,,薛真度,薛安都,先是 ， 憕 【 薛憕 】 从祖 真度 【 薛真度 】 与族祖 （ 族 祖裹义 ） 安都 【 薛安都 】 拥徐 、 兖归魏 ， 其子 怀隽 【 薛怀 隽 】 见 憕 ， 甚相 亲善 。,先是  憕  薛憕  从祖 真度  人物一  与族祖  族 祖裹义  安都  人物二  拥徐  兖归魏  其子 怀隽  薛怀 隽  见 憕  甚相 亲善,-1
TRAIN_SENT_ID_264949,,云中子,雷震子,云中子 在 洞 中传 的 雷震子 精熟 ， 随将 雷震子 二翅 左边 用 一 “ 风 ” 字 ， 右边 用 一 “ 雷 ” 字 ， 又 将 咒语 诵 了 一遍 。,人物一 洞 中传 人物二 精熟  随将 人物二 二翅 左边  风  字  右边  雷  字  咒语 诵 一遍,1
TRAIN_SENT_ID_285366,,范静,张宝英,近两年来 ， 张宝英 曾 和 贾庭聚 、 范静 多次 合作 此剧 ， 张宝英 饰演 公主 ， 范静 饰演 詹 贵妃 ， 留有 录像 资料 。,近两年来  人物二 贾庭聚  人物一 多次 合作 此剧  人物二 饰演 公主  人物一 饰演 詹 贵妃  留有 录像 资料,1
TRAIN_SENT_ID_252927,,颜回,孔子,④ 对 先师 先圣 的 祭祀 : 汉魏 以后 ， 以 周公为 先圣 ， 孔子 为 先师 ; 唐代 尊 孔子 为 先圣 ， 颜回 为 先师 。,④ 先师 先圣 祭祀  汉魏 以后  周公为 先圣  人物二 先师  唐代 尊 人物二 先圣  人物一 先师,1
TRAIN_SENT_ID_265486,,薛蝌,薛蟠,大色 空四 薛 : ： 薛蟠 、 薛蝌 、 薛宝钗 、 薛宝琴 。,大色 空四 薛   人物二  人物一  薛宝钗  薛宝琴,-1
TRAIN_SENT_ID_262219,,尤二姐,尤三姐,统治者 二十几 人 （ 有人 算了 说 是 三十几 人 ） ， 其他 都 是 奴隶 ， 三百多个 ， 鸳鸯 、 司棋 、 尤二姐 、 尤三姐 等等 。,统治者 二十几  有人 算了 说 三十几   奴隶  三百多个  鸳鸯  司棋  人物一  人物二,-1
TRAIN_SENT_ID_268909,,司徒静,司徒剑南,万人敌 在 齐国 公暗 设 的 赌场 上大闹 被 擒 ， 司徒静 当 了 司徒剑南 的 玉佩 救出 了 万人敌 等 人 。,万人敌 齐国 公暗 设 赌场 上大闹 擒  人物一 人物二 玉佩 救出 万人敌,-1
TRAIN_SENT_ID_259360,,葛玄,左慈,葛洪 《 抱朴子 · 金丹 篇 》 载 “ 左慈 是 葛玄 之师 ， 传其 《 太清丹经 》 三卷 ， 及 《 九鼎 丹经 》 、 《 金液 丹经 》 各 一卷 。 ”,葛洪  抱朴子  金丹 篇  载  人物二 人物一 之师  传其  太清丹经  三卷   九鼎 丹经    金液 丹经  一卷,1
TRAIN_SENT_ID_274399,,贾演,贾源,注释 ： 贾演 、 贾源 之 父 ， 书中 未 交代 其名 ， 今以 “ 贾 太公 ” 代之 ， 不 称呼 他 为 “ 贾公 ” ， 是因为 贾母 的 丈夫 贾代善 世称 “ 贾公 ” 。,注释  人物一  人物二 父  书中 未 交代 其名  今以  贾 太公  代之  称呼  贾公   是因为 贾母 丈夫 贾代善 世称  贾公,-1
TRAIN_SENT_ID_253823,,赵合德,赵飞燕,基本 信息 : 汉 赵飞燕 妹合德 ， 为 薄眉 ， 号 “ 远山 黛 ” ， 见伶玄 《 赵飞燕 外传 》 赵合德 。,基本 信息  汉 人物二 妹合德  薄眉  号  远山 黛   见伶玄  人物二 外传  人物一,-1
TRAIN_SENT_ID_255389,,罗成,秦琼,于是 ， 秦琼 、 罗成 、 敬德 和 程咬金 翻身 上马 ， 追赶 而 去 。,人物二  人物一  敬德 程咬金 翻身 上马  追赶,-1
TRAIN_SENT_ID_273131,,包道乙,郑彪,方腊 派出 “ 灵应 天师 ” 包道乙 和 他 的 徒弟 “ 郑魔君 ” 郑彪 ， 以及 猎户 出身 的 将领 夏侯成 去 救应 。,方腊 派出  灵应 天师  人物一 徒弟  郑魔君  人物二  猎户 出身 将领 夏侯成 救应,1
TRAIN_SENT_ID_250339,,赵飞燕,赵合德,美轮美奂 两 芙蓉 — — 赵飞燕 赵合德,美轮美奂 两 芙蓉   人物一 人物二,-1
TRAIN_SENT_ID_275502,,庞林,庞统,习祯 《 三国志 庞统 传 》 : 庞林 妇 ， 同郡 习祯 妺 。,习祯  三国志 人物二 传   人物一 妇  同郡 习祯 妺,-1
TRAIN_SENT_ID_274169,,平和岛静雄,平和岛幽,岸田隆宏绘 角色 人设 图 （ 平和岛静雄 、 平和岛幽 、 圣边 琉璃 、 马克斯 · 桑德谢 尔特 、 田中汤姆 ）,岸田隆宏绘 角色 人设 图  人物一  人物二  圣边 琉璃  马克斯  桑德谢 尔特  田中汤姆,-1
TRAIN_SENT_ID_273662,,姜子牙,元始天尊,（ 《 封神演义 》 中 人物 ） : 玉鼎 真人 ， 《 封神演义 》 中玉鼎 真人 为 玉虚宫 元始天尊 门下 ， 姜子牙 的 同门 师兄 ， 为 阐教 “ 十二 金仙 ” 之一 。,封神演义  中 人物   玉鼎 真人   封神演义  中玉鼎 真人 玉虚宫 人物二 门下  人物一 同门 师兄  阐教  十二 金仙,1
TRAIN_SENT_ID_265482,,薛蝌,薛蟠,四 薛 ： 薛蟠 、 薛蝌 、 薛宝钗 、 薛宝琴 。,四 薛  人物二  人物一  薛宝钗  薛宝琴,-1
TRAIN_SENT_ID_275824,,陆无双,李莫愁,神 ： 小龙女 ， 程英 ， 陆无双 ， 李莫愁 ， 刘瑛 ， 公孙绿萼,神  小龙女  程英  人物一  人物二  刘瑛  公孙绿萼,1
TRAIN_SENT_ID_248976,,吕洞宾,韩湘子,一日 ， 游经 城北 玉屏 峰 ， 见 韩湘子 、 吕洞宾 、 张果老 等 八仙 从 东边 天际 乘 祥云 飘然而至 ， 坐在 石莲 峰山 上 吹拉弹唱 。,一日  游经 城北 玉屏 峰  见 人物二  人物一  张果老 八仙 东边 天际 祥云 飘然而至  坐在 石莲 峰山 吹拉弹唱,1
TRAIN_SENT_ID_268906,,司徒静,司徒剑南,朱允 闻听 很 不快 ， 他 亲往 司徒府 看 司徒静 和 司徒剑南 。,朱允 闻听 不快  亲往 司徒府 人物一 人物二,-1
TRAIN_SENT_ID_267424,,陆展元,陆立鼎,” 两 人均 想 ， 陆立鼎 虽然 籍 籍无名 ， 他 兄长 陆展元 、 何沅君 夫妇 却侠 名震于 江湖 ， 嘉兴 陆家庄 的 名头 在 武林中 向来 无人 小觑 。,两 人均 想  人物二 籍 籍无名  兄长 人物一  何沅君 夫妇 却侠 名震于 江湖  嘉兴 陆家庄 名头 武林中 向来 无人 小觑,-1
TRAIN_SENT_ID_264223,,陈真,霍元甲,在 梁小龙 版 《 陈真 》 中 ， 霍元甲 遇害 ， 赵倩 男 早逝 ， 陈真 收养 了 他们 的 孤儿 霍东觉 ， 带 着 东觉 浪迹江湖 。,梁小龙 版  人物一  中  人物二 遇害  赵倩 男 早逝  人物一 收养 孤儿 霍东觉  带 东觉 浪迹江湖,1
TRAIN_SENT_ID_266716,,龙幽,龙溟,《 仙剑 奇侠传 五前 传 》 龙溟 、 龙幽,仙剑 奇侠传 五前 传  人物二  人物一,-1
TRAIN_SENT_ID_252384,,颜回,孔子,皇太子 以 太牢 祀 孔子 ， 以 颜回 配享,皇太子 太牢 祀 人物二  人物一 配享,1
TRAIN_SENT_ID_265408,,薛谭,秦青,薜 谭学 讴 原文 : 薛谭 学 讴于 秦青 ， 未穷 青之技 ， 自谓 尽 之 ， 遂 辞 归 。,薜 谭学 讴 原文  人物一 学 讴于 人物二  未穷 青之技  自谓  遂 辞,1
TRAIN_SENT_ID_255275,,卫夫人,王羲之,王羲之 是 东晋 豪门 大族 子弟 ， 曾 跟学 钟繇 的 叔父 王廙 广学书 ， 后 又 从 卫夫人 学书 。,人物二 东晋 豪门 大族 子弟  跟学 钟繇 叔父 王廙 广学书  人物一 学书,1
TRAIN_SENT_ID_275148,,孙立荣,赵本山,赵本山 ： 坐下 吧 ， 坐 那儿 没事 ， 我 给 你 放 这 吧 行 不 （ 拿 起 孙立荣 的 衣服 ） ？,人物二  坐下  坐 没事  放 行  人物一 衣服,1
TRAIN_SENT_ID_252659,,颜回,孔子,于是 择地 官山 的 北面 ， 创立 了 燕 居来 供奉 先圣 孔子 ， 先师 颜回 享受 配祀 ， 春秋 持菜 祀 先师 。,择地 官山 北面  创立 燕 居来 供奉 先圣 人物二  先师 人物一 享受 配祀  春秋 持菜 祀 先师,1
TRAIN_SENT_ID_259934,,周志文,周志康,巨声 队 ： 林师杰 、 许廷铿 、 刘 威煌 、 周志文 、 周志康 、 邓小巧 、 何晶晶 、 何雁诗,巨声 队  林师杰  许廷铿  刘 威煌  人物一  人物二  邓小巧  何晶晶  何雁诗,-1
TRAIN_SENT_ID_255480,,罗成,秦琼,李元霸 、 秦琼 、 宇文化及 、 程咬金 、 单雄信 、 尉迟敬德 、 罗成 、 李靖 、 魏文通 、 梁士泰 ......,李元霸  人物二  宇文化及  程咬金  单雄信  尉迟敬德  人物一  李靖  魏文通  梁士泰,-1
TRAIN_SENT_ID_251818,,梅超风,黄药师,在 苏州 之北 三十里 的 一座 荒山 之中 捉住 穆念慈 ， 摆蛇阵 逼 梅超风 交出 九阴真经 ， 被 黄药师 以 箫声 退 之 。,苏州 之北 三十里 一座 荒山 之中 捉住 穆念慈  摆蛇阵 逼 人物一 交出 九阴真经  人物二 箫声 退,1
TRAIN_SENT_ID_248979,,吕洞宾,韩湘子,八仙 分别 为汉 钟离 、 张果老 、 韩湘子 、 铁拐李 、 吕洞宾 、 何仙姑 、 蓝采和 及 曹国舅 。,八仙 为汉 钟离  张果老  人物二  铁拐李  人物一  何仙姑  蓝采和 曹国舅,1
TRAIN_SENT_ID_255270,,卫夫人,王羲之,从此以后 ， 在 卫夫人 的 具体 辅导 下 ， 王羲之 练字 更加 努力 了 。,从此以后  人物一 具体 辅导  人物二 练字 更加 努力,1
TRAIN_SENT_ID_266710,,龙幽,龙溟,复 得 神农 鼎后 ， 魔翳 改派 龙溟 之弟 龙幽 前往 人界 继续 寻找 水灵 珠 和 女娲 后人 。,复 神农 鼎后  魔翳 改派 人物二 之弟 人物一 前往 人界 继续 寻找 水灵 珠 女娲 后人,-1
TRAIN_SENT_ID_262274,,尤二姐,尤三姐,金陵 十二钗 副册 ： 香菱 、 薛宝琴 、 尤二姐 、 尤三姐 、 邢岫烟 、 李纹 、 李绮 、 夏金桂 、 秋桐 、 小红 、 龄 官 、 娇杏 ；,金陵 十二钗 副册  香菱  薛宝琴  人物一  人物二  邢岫烟  李纹  李绮  夏金桂  秋桐  小红  龄 官  娇杏,-1
TRAIN_SENT_ID_252730,,颜回,孔子,孔子 犹 不敢 以圣 与 仁 自许 ， 颜回 对 孔子 仰之弥高 ， 钻 之 弥坚 ， 后 之 学者 只好 “ 虽 不能 至 ， 心向往之 ” 了 。,人物二 犹 不敢 以圣 仁 自许  人物一 人物二 仰之弥高  钻 弥坚  学者 只好  不能  心向往之,1
TRAIN_SENT_ID_255386,,罗成,秦琼,"本 段起 自 玉玺 换 萧妃 , 瓦岗 人心涣散 , 魏 徐留 诗 投唐 , 单通 雪夜 下瓦岗 , 秦琼 十里 相 送 , 因 伤心 受寒 致 病情 加重 , 罗成 心痛 不已 。",段起 玉玺 换 萧妃  瓦岗 人心涣散  魏 徐留 诗 投唐  单通 雪夜 下瓦岗  人物二 十里 相 送  伤心 受寒 病情 加重  人物一 心痛 不已,-1
TRAIN_SENT_ID_259364,,葛玄,左慈,左慈 人物 思想 : 左慈 、 葛玄 、 郑隐 尊奉 何神 ， 无 直接 材料 可 考 。,人物二 人物 思想  人物二  人物一  郑隐 尊奉 何神  直接 材料 考,1
TRAIN_SENT_ID_272408,,方兰生,方如沁,百里屠苏 、 方兰生 、 欧阳少恭 、 陵越 、 红玉 、 方如沁 、 孙月言 ： 晴雪,百里屠苏  人物一  欧阳少恭  陵越  红玉  人物二  孙月言  晴雪,-1
TRAIN_SENT_ID_252607,,颜回,孔子,孝理 这 东西 可谓 博大精深 ， 只有 大贤 之 人才 能 懂得 其中 的 奥妙 ， 为什么 孔子 不 对 颜回 传授 ， 而 要 寄托 给 曾 参 呢 ？ ”,孝理 东西 可谓 博大精深  大贤 人才 懂得 奥妙  人物二 人物一 传授  寄托 参,1
TRAIN_SENT_ID_252570,,颜回,孔子,4 第四 部分 : 原文 : 子夏问 孔子 曰 ： “ 颜回 ① 之为 人 奚若 ？ ”,第四 部分  原文  子夏问 人物二 曰   人物一 ① 之为 奚若,1
TRAIN_SENT_ID_282169,,韩起凤,韩起龙,钱彩 的 《 说岳 全传 》 中 ， 韩滔 有 孙子 韩起龙 、 韩起凤 ， 曾 收留 落难 的 岳雷 。,钱彩  说岳 全传  中  韩滔 孙子 人物二  人物一  收留 落难 岳雷,-1
TRAIN_SENT_ID_284529,,孙明瑞,何海霞,得 何海霞 大师 真传 后 ， 孙明瑞 又 得 长安 画派 石鲁 、 罗铭 、 方济众 、 赵 望去 等 名师 指点 ， 画艺大进 。,人物二 大师 真传  人物一 长安 画派 石鲁  罗铭  方济众  赵 望去 名师 指点  画艺大进,1
TRAIN_SENT_ID_259357,,葛玄,左慈,有 张陵 、 南华 、 于吉 传说 之仙 ; 有 左慈 、 葛玄 、 张鲁 、 道 中 挚友 。,张陵  南华  于吉 传说 之仙  人物二  人物一  张鲁  道 中 挚友,1
TRAIN_SENT_ID_267794,,万剑一,林惊羽,2 武器 : 1 、 小说 《 诛仙 》 林惊羽 佩剑 ， 也 是 九天 神兵 ， 原 持有者 为 青云 不 出世 的 奇才 万剑一 。,武器    小说  诛仙  人物二 佩剑  九天 神兵  原 持有者 青云 出世 奇才 人物一,1
TRAIN_SENT_ID_256515,,周武,周文,据 史籍 《 元 和 姓 纂 》 及 《 通志 · 氏族 略 》 等 所载 ， 周武 王灭 商后 ， 封其弟 （ 周文 王 幼子 ） 于康 邑 ， 世称 康叔封 。,史籍  元 姓 纂   通志  氏族 略  所载  人物一 王灭 商后  封其弟  人物二 王 幼子  于康 邑  世称 康叔封,-1
TRAIN_SENT_ID_250667,,鲁西西,皮皮鲁,（ 合 ） 皮皮鲁 恋着 鲁西西,合  人物二 恋着 人物一,-1
TRAIN_SENT_ID_259756,,李偲菘,李伟菘,作词 ： 李煜 作曲 ： 李伟菘 、 李偲菘 绝代 双雄 插曲 : 截图 ( 30 张 ),作词  李煜 作曲  人物二  人物一 绝代 双雄 插曲  截图   张,-1
TRAIN_SENT_ID_259942,,周志文,周志康,回乡 艺人 ： 王 祖蓝 、 胡枫 、 汤盈盈 、 许廷铿 、 杨思琦 、 陈伟 霆 、 关心妍 、 周志文 、 周志康 、 林欣彤,回乡 艺人  王 祖蓝  胡枫  汤盈盈  许廷铿  杨思琦  陈伟 霆  关心妍  人物一  人物二  林欣彤,-1
TRAIN_SENT_ID_285188,,韩小莹,韩宝驹,师父 ： 柯镇恶 、 朱聪 、 韩宝驹 、 南希仁 、 张阿生 、 全金发 、 韩小莹 、 北丐 洪七公 、 蒙古 神箭手 哲别,师父  柯镇恶  朱聪  人物二  南希仁  张阿生  全金发  人物一  北丐 洪七公  蒙古 神箭手 哲别,-1
TRAIN_SENT_ID_255346,,沈东篱,沈南枝,苏旷 存心 取笑 ， 伸手 去 捏 沈南枝 胖乎乎 的 脸蛋 ， 一 看见 沈东篱 冰冷 的 目光 ， 又 讪笑 着 收回 手来 。,苏旷 存心 取笑  伸手 捏 人物二 胖乎乎 脸蛋  看见 人物一 冰冷 目光  讪笑 收回 手来,-1
TRAIN_SENT_ID_264230,,陈真,霍元甲,曾 在 新版 电视剧 《 霍元甲 》 中 扮演 陈真 的 吴越 将 挑起 《 英雄 》 大梁 ， 而 他 的 “ 师父 ” 霍元甲 赵文卓 将 出任 该剧 的 武术指导 。,新版 电视剧  人物二  中 扮演 人物一 吴越 挑起  英雄  大梁   师父  人物二 赵文卓 出任 该剧 武术指导,1
TRAIN_SENT_ID_270604,,白水喜,白欢喜,电视剧 《 我家 有喜 》 人物 ， 是 夏茗 的 母亲 ， 也 是 白金 喜 、 白木喜 、 白水喜 、 白欢喜 的 姥姥 ， 为 人 乐观 搞笑 ， 由 方青卓 饰演 。,电视剧  我家 有喜  人物  夏茗 母亲  白金 喜  白木喜  人物一  人物二 姥姥  乐观 搞笑  方青卓 饰演,-1
TRAIN_SENT_ID_253107,,颜回,孔子,前面 为 卷 棚式 走廊 ， 启 圣殿 内 供奉 有 孔子 及四配 ， 分别 是 颜回 、 曾 参 、 子思 、 孟子 。,前面 卷 棚式 走廊  启 圣殿 供奉 人物二 及四配  人物一  参  子思  孟子,1
TRAIN_SENT_ID_251431,,李瀚章,李鸿章,一家 翰墨 不 分卷 （ 清 ） 李瀚章 李鸿章 书稿 本 … … … … … … … … … … … … … … … …,一家 翰墨 分卷  清  人物一 人物二 书稿,-1
TRAIN_SENT_ID_285798,,王中泉,黄四海,后继 承父业 掌罗 疃 张家 八式 房 ， 他 与 师兄 黄四海 共同 培养 了 王中泉 、 李书文 、 张毓 衡 、 韩化臣 、 马凤图 、 马英图 等 名徒 。,后继 承父业 掌罗 疃 张家 八式 房  师兄 人物二 共同 培养 人物一  李书文  张毓 衡  韩化臣  马凤图  马英图 名徒,1
TRAIN_SENT_ID_259656,,公孙胜,罗真人,古典名著 《 水浒传 》 的 人物 罗真人 ， 入云龙 公孙胜 的 师父 ， 是 个 法力 高强 的 道士 ， 曾 授予 公孙胜 天罡 五雷 正法 ， 才 使 其破 了 高廉 的 妖法 。,古典名著  水浒传  人物 人物二  入云龙 人物一 师父  法力 高强 道士  授予 人物一 天罡 五雷 正法  其破 高廉 妖法,1
TRAIN_SENT_ID_281463,,楚衡阳王,马希范,马 楚衡阳王 马希声 和 文昭 王 马希范 均 使用,马 人物一 马希声 文昭 王 人物二 均 使用,-1
TRAIN_SENT_ID_249013,,吕洞宾,韩湘子,仙人 韩湘子 、 吕洞宾 分别 化 变成 和尚 、 道士 ， 私下 凡尘 ， 肆意 戏弄 牡丹 ， 看其 是否 诚心 修炼 ， 谁知 讨个 没趣,仙人 人物二  人物一 化 变成 和尚  道士  私下 凡尘  肆意 戏弄 牡丹  看其 是否 诚心 修炼  讨个 没趣,1
TRAIN_SENT_ID_265490,,薛蝌,薛蟠,薛蟠 打死 人命 下到 牢里 ， 她 和 夏金桂 又 狼狈为奸 ， 合伙 勾引 薛蝌 ， 夏金桂 要 谋害 香菱 时 ， 是 宝 蟾 无意 中救 了 香菱 一命 。,人物二 打死 人命 下到 牢里  夏金桂 狼狈为奸  合伙 勾引 人物一  夏金桂 谋害 香菱 时  宝 蟾 无意 中救 香菱 一命,-1
TRAIN_SENT_ID_252837,,颜回,孔子,附骥 蝇 释义 : 司马贞 索隐 ： “ 按 ： 苍蝇附骥 尾而致 千里 ， 以 譬 颜回 因 孔子 而 名彰 也 。 ”,附骥 蝇 释义  司马贞 索隐    苍蝇附骥 尾而致 千里  譬 人物一 人物二 名彰,1
TRAIN_SENT_ID_252851,,颜回,孔子,列子 · 仲尼 第四 部分 : 列子 · 仲尼 原文 : 子夏问 孔子 曰 ( 1 ) ： “ 颜回 之为 人 奚若 ( 2 ) ？ ”,列子  仲尼 第四 部分  列子  仲尼 原文  子夏问 人物二 曰      人物一 之为 奚若,1
TRAIN_SENT_ID_265503,,薛蝌,薛蟠,金 桂和 宝蟾 要 勾引 薛蟠 堂弟 薛蝌 ， 其他 方面 倒 安静下来 。,金 桂和 宝蟾 勾引 人物二 堂弟 人物一  方面 倒 安静下来,-1
TRAIN_SENT_ID_266707,,龙幽,龙溟,在 神降 密境 中 ， 发现 被 钉死 在 地上 的 骨 蛇 ， 龙幽 认出 钉死 骨蛇 的 武器 是 龙溟 的 武器 ， 也 明白 了 龙溟 可能 是因为 和 这个 蛇 战斗 而 死 。,神降 密境 中  发现 钉死 地上 骨 蛇  人物一 认出 钉死 骨蛇 武器 人物二 武器  明白 人物二 可能 是因为 蛇 战斗 死,-1
TRAIN_SENT_ID_274077,,南宫敬叔,孔子,① 丁寅 生 《 孔子 演义 》 第 18 回 ： “ 南宫敬叔 和 夫子 最 契合 ， 请 他 先容 ， 最为 合宜 ， 打定主意 ， 便 一径 往 访敬叔 。 ”,① 丁寅 生  人物二 演义   回   人物一 夫子 契合  请 先容  最为 合宜  打定主意  便 一径 访敬叔,1
TRAIN_SENT_ID_255388,,罗成,秦琼,传说 ， 唐朝 名将 罗成 和 秦琼 曾 在 此 树上 拴 过 马 。,传说  唐朝 名将 人物一 人物二 树上 拴 马,-1
TRAIN_SENT_ID_253883,,赵合德,赵飞燕,汉 宫里 的 风流 荒淫 往事 — — 汉成帝 与 赵飞燕 、 赵合德 姐妹,汉 宫里 风流 荒淫 往事   汉成帝 人物二  人物一 姐妹,-1
TRAIN_SENT_ID_264209,,陈真,霍元甲,热门 连续剧 ： 《 猎人 笔记 之谜 》 、 《 霍元甲 》 、 《 精武 陈真 》 、 《 铁咀 银牙 》 、 《 鹿鼎记 》 等,热门 连续剧   猎人 笔记 之谜    人物二    精武 人物一    铁咀 银牙    鹿鼎记,1
TRAIN_SENT_ID_263380,,武修文,武敦儒,三流 奶 ： 瑛 姑 、 天竺 高僧 、 武敦儒 、 武修文 、 陆立鼎 。,三流 奶  瑛 姑  天竺 高僧  人物二  人物一  陆立鼎,-1
TRAIN_SENT_ID_266723,,龙幽,龙溟,出处 ： 国产 单机游戏 《 仙剑 奇侠传 五 》 中 龙幽 的 武器 之一 、 《 仙剑 奇侠传 五前 传 》 龙溟 的 武器 。,出处  国产 单机游戏  仙剑 奇侠传 五  中 人物一 武器   仙剑 奇侠传 五前 传  人物二 武器,-1
TRAIN_SENT_ID_251834,,梅超风,黄药师,黄药师 以此 暗器 惩治 偷窃 真经 、 叛离 师门 的 梅超风 。,人物二 以此 暗器 惩治 偷窃 真经  叛离 师门 人物一,1
TRAIN_SENT_ID_268900,,司徒静,司徒剑南,梁君卓 看上 了 文蔷 ， 调戏 文蔷 ， 被 司徒剑南 和 司徒静 很 揍 了 一顿 。,梁君卓 看上 文蔷  调戏 文蔷  人物二 人物一 揍 一顿,-1
