sent_id,sent_id,entity1,entity2,sent,processed_sent,human
TRAIN_SENT_ID_279516,,汪绿萍,汪紫菱,该剧 讲述 了 汪家 两姐妹 汪绿萍 和 汪紫菱 以及 她们 与 楚濂 和 费云帆 两个 男人 之间 爱情 纠葛 的 故事 ， 并于 1996 年 3 月 25 日 播出 。,该剧 讲述 汪家 两姐妹 人物一 人物二 楚濂 费云帆 两个 男人 之间 爱情 纠葛 故事  并于  年  月  日 播出,-1
TRAIN_SENT_ID_265570,,张崇基,张崇德,第 19 集 金刚 、 陈蕊蕊 、 小仪 、 单立文 、 吴业坤 、 崔建邦 、 阮兆祥 、 赵学而 、 车婉婉 、 郑俊弘 、 张崇德 、 张崇基,集 金刚  陈蕊蕊  小仪  单立文  吴业坤  崔建邦  阮兆祥  赵学而  车婉婉  郑俊弘  人物二  人物一,1
TRAIN_SENT_ID_251405,,李瀚章,李鸿章,⑥ 李瀚章 （ 李鸿章 长兄 ） （ 1821 年 - 1899 年 ） 1889 年 8 月 8 日 - 1895 年 4 月 13 日任 两广总督,⑥ 人物一  人物二 长兄    年   年   年  月  日   年  月  日任 两广总督,-1
TRAIN_SENT_ID_252762,,颜回,孔子,孔子 称 颜回 ： “ 一箪食 、 一瓢 饮 ， 人 不堪其忧 ， 回 也 不改其乐 。 ”,人物二 称 人物一   一箪食  一瓢 饮  不堪其忧  回 不改其乐,1
TRAIN_SENT_ID_257591,,毛泽民,毛泽东,毛泽民 辍学 、 劳动 、 结婚 ， 毛泽覃 订婚 、 上学 ， 毛泽东 求学 长沙 ， 积极探索 自己 和 中国 的 出路 。,人物一 辍学  劳动  结婚  毛泽覃 订婚  上学  人物二 求学 长沙  积极探索 中国 出路,-1
TRAIN_SENT_ID_257437,,姜昆,马季,马季 、 姜昆 、 张喻 、 朱苑宜 （ 台湾 ） 、 斑斑 （ 香港 ）,人物二  人物一  张喻  朱苑宜  台湾   斑斑  香港,-1
TRAIN_SENT_ID_253833,,赵合德,赵飞燕,远山 眉 基本 信息 : 汉 赵飞燕 妹合德 ， 为 薄眉 ， 号 “ 远山 黛 ” ， 见伶玄 《 赵飞燕 外传 》 赵合德 。,远山 眉 基本 信息  汉 人物二 妹合德  薄眉  号  远山 黛   见伶玄  人物二 外传  人物一,1
TRAIN_SENT_ID_248996,,吕洞宾,韩湘子,道观 建成 ， 同祀 吕洞宾 、 韩湘子 ， “ 其名 青羊 二仙 庵 ， 所以 辅翼 修行 ， 即 青羊宫 之 别馆 也 。,道观 建成  同祀 人物一  人物二   其名 青羊 二仙 庵  辅翼 修行  青羊宫 别馆,1
TRAIN_SENT_ID_251598,,穆春,穆弘,右军 寨 内 ： 第一位 呼延灼 ， 第二位 朱仝 ， 第三位 戴宗 ， 第四位 穆弘 ， 第五位 李逵 ， 第六位 欧鹏 ， 第七位 穆春 。,右军 寨  第一位 呼延灼  第二位 朱仝  第三位 戴宗  第四位 人物二  第五位 李逵  第六位 欧鹏  第七位 人物一,1
TRAIN_SENT_ID_286469,,高进军,党荣华,高进军 ， 书法 艺术家 ， 醉 墨轩 主人 ， 中华 毛体 创始人 ， 军人 世家 ， 山东 籍 ， 老师 党荣华 ， 导师 宋学伟 。,人物一  书法 艺术家  醉 墨轩 主人  中华 毛体 创始人  军人 世家  山东 籍  老师 人物二  导师 宋学伟,1
TRAIN_SENT_ID_249241,,皮皮鲁,鲁西西,2 月 10 日 — — 朱新建 ， 《 皮皮鲁 和 鲁西西 》 等 3 种 动画 的 人物造型 ， 著名画家 。,月  日   朱新建   人物一 人物二   种 动画 人物造型  著名画家,-1
TRAIN_SENT_ID_282802,,李翊,李威,李翊 演艺 经历 : 2003 年 ， 凭借 客串 李威 主演 的 电视剧 《 单身 宿舍 连环泡 》 而 正式 进入 演艺圈 。,人物一 演艺 经历   年  客串 人物二 主演 电视剧  单身 宿舍 连环泡  正式 进入 演艺圈,-1
TRAIN_SENT_ID_249127,,皮皮鲁,鲁西西,皮皮鲁 和 鲁西西 演唱者 ：,人物一 人物二 演唱者,-1
TRAIN_SENT_ID_284888,,王燕燕,王伦,王伦 ： 杨怀民 ； 王燕燕 ： 狄莺 ； 莫愁 ： 赵永馨 ； 荆无命 ： 谢屏楠 ； 仁宗 ： 施羽 ；,人物二  杨怀民  人物一  狄莺  莫愁  赵永馨  荆无命  谢屏楠  仁宗  施羽,1
TRAIN_SENT_ID_275890,,王子豪,王子杰,16 . 王子豪 及 王子杰 （ 火柴 天堂 ） 15 分,人物一 人物二  火柴 天堂   分,-1
TRAIN_SENT_ID_266144,,李昌镐,曹薰铉,虽然 日本队 主将 加藤 正夫 力克 曹薰铉 ， 但 还是 没能 闯过 最后 李昌镐 一关 。,日本队 主将 加藤 正夫 力克 人物二  没能 闯过 最后 人物一 一关,1
TRAIN_SENT_ID_257816,,林平之,岳不群,★ 东方不败 、 林平之 、 岳不群 手挽手 含泪 吐血 推荐 ：,★ 东方不败  人物一  人物二 手挽手 含泪 吐血 推荐,1
TRAIN_SENT_ID_252541,,颜回,孔子,见于 《 论语 》 中 的 孔门 弟子 与 孔子 的 问答 之 言 ， 属 他 最 多 ， 孔子 器重 他 次于 颜回 。,见于  论语  中 孔门 弟子 人物二 问答 言  属  人物二 器重 次于 人物一,1
TRAIN_SENT_ID_252829,,颜回,孔子,颜回 支持 孔子 不变 志向,人物一 支持 人物二 不变 志向,-1
TRAIN_SENT_ID_255285,,卫夫人,王羲之,王羲之 早年 又 从 卫夫人 学书 。,人物二 早年 人物一 学书,-1
TRAIN_SENT_ID_262228,,尤二姐,尤三姐,与 尤二姐 的 百依百顺 不同 ， 尤三姐 就 不是 逆来顺受 的 弱女子 了 。,人物一 百依百顺 不同  人物二 逆来顺受 弱女子,-1
TRAIN_SENT_ID_253995,,周恩寿,周恩来,王士琴 （ 1914 - 2002 ） ， 周恩来 胞弟 周恩寿 （ 周同 宇 ） 的 妻子 ， 满族 人 ， 1914 年 4 月 18 日 生于 吉林 。,王士琴       人物二 胞弟 人物一  周同 宇  妻子  满族   年  月  日 生于 吉林,-1
TRAIN_SENT_ID_276219,,姜丽文,姜文杰,名人 之后 队 ： 洪天明 、 原子鏸 、 黄宇诗 、 姜文杰 、 姜丽文,名人 之后 队  洪天明  原子鏸  黄宇诗  人物二  人物一,-1
TRAIN_SENT_ID_257783,,林平之,岳不群,林平之 与 左冷禅 结盟 后 组建 辟邪 门 ， 练习 耳力 ， 设 下 计策 ， 在 华山 思过 崖 的 秘洞 中 绝杀 五岳 剑 派 人士 ， 剪除 岳不群 的 党羽 ， 消灭 岳不群 。,人物一 左冷禅 结盟 组建 辟邪 门  练习 耳力  设 计策  华山 思过 崖 秘洞 中 绝杀 五岳 剑 派 人士  剪除 人物二 党羽  消灭 人物二,1
TRAIN_SENT_ID_275457,,李汉俊,李书城,李书城 支持 胞弟 : 李汉俊 是 李书城 的 胞弟 ， 是 中共 早期 的 主要 领袖 。,人物二 支持 胞弟  人物一 人物二 胞弟  中共 早期 主要 领袖,-1
TRAIN_SENT_ID_273636,,姜子牙,元始天尊,元始天尊 毕竟 还要 顾全 师尊 颜面 ， 所以 元始天尊 借 姜子牙 之口 在 封禅台 敕封 六御 。,人物二 毕竟 顾全 师尊 颜面  人物二 人物一 之口 封禅台 敕封 六御,-1
TRAIN_SENT_ID_286299,,赵秀春,宋锦春,赵秀春 教育 背景 : 1998 年 － 2002 年 ， 东北大学 ， 机械工程 与 自动化 学院 机械工程 及 自动化系 ， 本科 / 工学 学士学位 ， 导师 宋锦春,人物一 教育 背景   年   年  东北大学  机械工程 自动化 学院 机械工程 自动化系  本科  工学 学士学位  导师 人物二,-1
TRAIN_SENT_ID_255449,,罗成,秦琼,罗成 的 好 ， 秦琼 最 懂 。,人物一  人物二 懂,-1
TRAIN_SENT_ID_256862,,仲由,孔子,仲由 以 政事 见称 ， 为 人 伉直 ， 好 勇力 ， 跟随 孔子 周游列国 ， 是 孔门 七十二 贤 之一 。,人物一 政事 见称  伉直  勇力  跟随 人物二 周游列国  孔门 七十二 贤,1
TRAIN_SENT_ID_261647,,宋小宝,赵本山,赵本山 为了 降服 抽风 的 精神病 小偷 宋小宝 ， 一秒钟 变 唐僧 ， 举起手来 就 念咒 ， 现场 掌声如雷 。,人物二 降服 抽风 精神病 小偷 人物一  一秒钟 变 唐僧  举起手来 念咒  现场 掌声如雷,1
TRAIN_SENT_ID_253073,,颜回,孔子,孔子 问 颜回 ， 如何 不种 梅 ？,人物二 问 人物一  不种 梅,1
TRAIN_SENT_ID_273361,,杨锐,张之洞,杨锐 百日维新 : 光绪 二十四年 （ 1898 年 ） ， 张之洞 推荐 杨锐 应征 经济 特科 。,人物一 百日维新  光绪 二十四年   年   人物二 推荐 人物一 应征 经济 特科,-1
TRAIN_SENT_ID_281536,,于佑福,高德明,高德明 收徒 于佑福 ， 健在 。,人物二 收徒 人物一  健在,-1
TRAIN_SENT_ID_251412,,李瀚章,李鸿章,李瀚章 为 李鸿章 之 胞兄 ， 与 孙宝 喧皆系 至亲 。,人物一 人物二 胞兄  孙宝 喧皆系 至亲,-1
TRAIN_SENT_ID_255455,,罗成,秦琼,秦琼 就象 罗成 的 半师 ， 让 他 尊重 ， 也 让 他 亲近 。,人物二 就象 人物一 半师  尊重  亲近,-1
TRAIN_SENT_ID_257496,,姜昆,马季,1985 年 ： 马季 姜昆 张瑜 朱苑宜 （ 台湾 ） 斑斑 （ 香港 ）,年  人物二 人物一 张瑜 朱苑宜  台湾  斑斑  香港,-1
TRAIN_SENT_ID_261653,,宋小宝,赵本山,不过 ， 对于 宋小宝 来说 ， 除了 师父 赵本山 的 提携 和 帮助 ， 他 过往 的 那些 经历 也 是 促使 他 成功 的 最 宝贝 财 宋小宝 ( 10 张 ),人物一  师父 人物二 提携 帮助  过往 经历 促使 成功 宝贝 财 人物一   张,-1
TRAIN_SENT_ID_271543,,应天文,韩慕侠,加上 韩慕侠 自称 在 九华山 寻 到 董海川 的 师弟 应天文 ， 学 的 “ 反 八卦 （ 掌 ） ” 技巧 ， 引起 张占魁 的 不满 。,加上 人物二 自称 九华山 寻 董海川 师弟 人物一  学  反 八卦  掌   技巧  引起 张占魁 不满,1
TRAIN_SENT_ID_264530,,岳云鹏,郭德纲,2 ： 《 返场 》 郭德纲 于谦 岳云鹏,返场  人物二 于谦 人物一,-1
TRAIN_SENT_ID_263363,,武修文,武敦儒,第一篇 ， 写 武敦儒 、 武修文 。,第一篇  写 人物二  人物一,-1
TRAIN_SENT_ID_274679,,马冬晗,马冬昕,清华 学霸 “ 姐妹花 ” 马冬晗 与 马冬昕,清华 学霸  姐妹花  人物一 人物二,-1
TRAIN_SENT_ID_261444,,毛泽建,毛泽东,毛泽建 是 毛泽东 的 堂妹 ， 1905 年 10 月 出 生于 湖南 湘潭县 韶山冲 的 东茅塘 。,人物一 人物二 堂妹   年  月 出 生于 湖南 湘潭县 韶山冲 东茅塘,-1
TRAIN_SENT_ID_261166,,王缙,王维,唐代宗 曾誉 之 为 “ 天下 文宗 ” （ 《 答 王缙 进 王维 集表 诏 》 ） 。,唐代宗 曾誉  天下 文宗    答 人物一 进 人物二 集表 诏,1
TRAIN_SENT_ID_252907,,颜回,孔子,颜回 之死 与 孔子 之生,人物一 之死 人物二 之生,-1
TRAIN_SENT_ID_274355,,和政公主,宁国公主,和政公主 的 姊姊 叫 宁国公主 。,人物一 姊姊 人物二,-1
TRAIN_SENT_ID_255318,,卫夫人,王羲之,这些 记载 ， 都 提到 卫夫人 是 王羲之 的 书法 老师 及 卫夫人 书 法学 钟繇 。,记载  提到 人物一 人物二 书法 老师 人物一 书 法学 钟繇,1
TRAIN_SENT_ID_259940,,周志文,周志康,刘威 煌 、 陈鸿硕 、 周志文 、 周志康,刘威 煌  陈鸿硕  人物一  人物二,-1
TRAIN_SENT_ID_249019,,吕洞宾,韩湘子,韩湘子 羽化成仙 、 吕洞宾 卖 糍粑 、 张果老 和 他 的 纸 驴 、 蓝采和 收 妖 、 曹国舅 戏耍 绸缎 商 、 吕洞宾 戏 牡丹 、 八仙桌 的 由 来 … …,人物二 羽化成仙  人物一 卖 糍粑  张果老 纸 驴  蓝采和 收 妖  曹国舅 戏耍 绸缎 商  人物一 戏 牡丹  八仙桌,1
TRAIN_SENT_ID_281649,,黄铁良,侯宝林,侯宝林 — — 贾振良 、 黄铁良 、 杨紫阳 、 马季 、 胡必达 、 殷培田 、 贾冀光 、 丁广泉 、 康达夫 、 李如刚 、 吴兆南 、 师胜杰 、 郝爱民,人物二   贾振良  人物一  杨紫阳  马季  胡必达  殷培田  贾冀光  丁广泉  康达夫  李如刚  吴兆南  师胜杰  郝爱民,1
TRAIN_SENT_ID_255306,,卫夫人,王羲之,晋 王羲之 《 题 卫夫人 笔阵 图后 》 ： “ 每作 一点 ， 如 高峰 坠石 。 ”,晋 人物二  题 人物一 笔阵 图后    每作 一点  高峰 坠石,1
TRAIN_SENT_ID_251603,,穆春,穆弘,揭阳 镇 的 李俊 、 李立 、 穆弘 、 穆春 、 张横 、 张顺 、 童威 、 童猛 、 薛永 、 侯健 。,揭阳 镇 李俊  李立  人物二  人物一  张横  张顺  童威  童猛  薛永  侯健,1
TRAIN_SENT_ID_279081,,夏林菲,夏翼,萌 侦探 纪事 内容简介 : 萌 侦探 纪事 《 萌 侦探 纪事 1 》 : 本季 主角 ： 莫海音 、 罗洛 、 夏林菲 、 夏翼 、 优优 。,萌 侦探 纪事 内容简介  萌 侦探 纪事  萌 侦探 纪事    本季 主角  莫海音  罗洛  人物一  人物二  优优,1
TRAIN_SENT_ID_270566,,全真七子,王重阳,陈抟 、 王重阳 、 全真七子 、 张三丰 ， 都 是 武功 出神入化 之 人 。,陈抟  人物二  人物一  张三丰  武功 出神入化,1
TRAIN_SENT_ID_265117,,杨志刚,郭靖宇,6 月 同王 珞丹 、 杨志刚 共同 出演 郭靖宇 新剧 《 红娘子 》 ， 颠覆 了 以往 霸气 威严 的 形象 ， 饰演 了 一个 忍辱负重 的 “ 窝囊 ” 老爷 。,月 同王 珞丹  人物一 共同 出演 人物二 新剧  红娘子   颠覆 以往 霸气 威严 形象  饰演 一个 忍辱负重  窝囊  老爷,-1
TRAIN_SENT_ID_251410,,李瀚章,李鸿章,李鸿章 扶植 米市 是 事实 ， 但 具体 操作者 是 张樵 野 （ 张荫桓 ） ， 同治 年间 他 就 结识 了 广东 督粮道 李瀚章 （ 鸿章 之兄 ） 。,人物二 扶植 米市 事实  具体 操作者 张樵 野  张荫桓   同治 年间 结识 广东 督粮道 人物一  鸿章 之兄,-1
TRAIN_SENT_ID_252406,,颜回,孔子,孔子 信 颜回,人物二 信 人物一,-1
TRAIN_SENT_ID_282095,,周昂,周昕,周昕 、 周昂 之弟 。,人物二  人物一 之弟,-1
TRAIN_SENT_ID_268987,,韩非,荀子,◎ 第六章 制度 与 人性 人 是 靠不住 的 孟子 ： 人性 向善 荀子 ： 善能 胜恶 韩非 ： 人性本恶 德治 还是 法治 没有 结论 的 争鸣,◎ 第六章 制度 人性 靠不住 孟子  人性 向善 人物二  善能 胜恶 人物一  人性本恶 德治 法治 没有 结论 争鸣,1
TRAIN_SENT_ID_266698,,龙幽,龙溟,对于 哥哥 龙溟 ， 龙幽 相当 依赖 。,哥哥 人物二  人物一 相当 依赖,-1
TRAIN_SENT_ID_285613,,韩笑,韩少云,韩笑 嗓音 甜美 ， 颇具 韩少云 大师 风范 。,人物一 嗓音 甜美  颇具 人物二 大师 风范,1
TRAIN_SENT_ID_273675,,姜子牙,元始天尊,封神演义 阐教 : 姜子牙 元始天尊 ： 阐教 教主 ， 居于 昆仑山 玉虚宫 。,封神演义 阐教  人物一 人物二  阐教 教主  居于 昆仑山 玉虚宫,1
TRAIN_SENT_ID_261350,,何猷启,何超莲,吴克群 首先 献唱 《 为 你 写诗 》 及 《 追 》 筹得 50 万港元 ， 何超莲 与 胞弟 何猷启 坐在 观众席 第二排 欣赏 。,吴克群 献唱  写诗   追  筹得  万港元  人物二 胞弟 人物一 坐在 观众席 第二排 欣赏,-1
TRAIN_SENT_ID_252846,,颜回,孔子,附骥 尾 释义 : 司马贞 索隐 ： “ 按 ： 苍蝇附骥 尾而致 千里 ， 以 譬 颜回 因 孔子 而 名彰 也 。 ”,附骥 尾 释义  司马贞 索隐    苍蝇附骥 尾而致 千里  譬 人物一 人物二 名彰,1
TRAIN_SENT_ID_257460,,姜昆,马季,马季 、 姜昆 师徒俩 叶立中 — — 曹俊清 、 朱文正,人物二  人物一 师徒俩 叶立中   曹俊清  朱文正,-1
TRAIN_SENT_ID_273371,,杨锐,张之洞,一 、 杨锐 是 张之洞 的 “ 坐京 ”,人物一 人物二  坐京,-1
TRAIN_SENT_ID_259393,,温策,温慧,温策 煌 大仙 遭祸 : 南宫煌 ： 温慧 — — ！,人物一 煌 大仙 遭祸  南宫煌  人物二,-1
TRAIN_SENT_ID_255417,,罗成,秦琼,36 专诸巷 罗成 认 舅母 贾柳店 秦琼 待 宾朋,专诸巷 人物一 认 舅母 贾柳店 人物二 宾朋,1
TRAIN_SENT_ID_252868,,颜回,孔子,孔子 与 颜回,人物二 人物一,-1
TRAIN_SENT_ID_274087,,南宫敬叔,孔子,相传 孔子 与 南宫敬叔 适周 问礼于 老聃 ， 问 乐于 苌 弘 。,相传 人物二 人物一 适周 问礼于 老聃  问 乐于 苌 弘,1
TRAIN_SENT_ID_271243,,马季,侯宝林,在此之前 ， 侯宝林 、 马季 曾 分别 应邀 出访 日本 。,在此之前  人物二  人物一 应邀 出访 日本,-1
TRAIN_SENT_ID_262256,,尤二姐,尤三姐,当然 ， 尤三姐 与 逆来顺受 的 尤二姐 不同 。,人物二 逆来顺受 人物一 不同,-1
TRAIN_SENT_ID_261583,,南宫敬叔,孟懿子,孟懿子 和 南宫敬叔 学礼于 孔子 。,人物二 人物一 学礼于 孔子,-1
TRAIN_SENT_ID_274699,,张卫彝,张卫健,对于 张卫健 每个 月 给 他 3 万元 的 生活费 ， 张卫彝 表示 此举 令 他 “ 失去 尊严 ” 。,人物二 每个 月  万元 生活费  人物一 表示 此举 令  失去 尊严,-1
TRAIN_SENT_ID_264555,,胡青牛,张无忌,张无忌 悟性 : 胡青牛 见 他 悟性 奇高 … …,人物二 悟性  人物一 见 悟性 奇高,1
TRAIN_SENT_ID_252777,,颜回,孔子,— — — 颜廷 淦 （ 孔子 文化 研究 院长 ， 复圣 颜回 第 78 代 嫡孙 ） 我 对 三角洲 充满信心 ， 希望 张成志 在 太空 ， 路 在 脚下 ， 越走越远 。,颜廷 淦  人物二 文化 研究 院长  复圣 人物一  代 嫡孙  三角洲 充满信心  希望 张成志 太空  路 脚下  越走越远,1
TRAIN_SENT_ID_271246,,马季,侯宝林,“ 除了 铃不响 ， 上下 哪儿 都响 ” ； “ 逗你玩 儿 ” ； “ 宇宙 牌 香烟 ” ， 侯宝林 、 马三立 、 马季 等 人 的 著名 段子 至今 还 能 让 人乐 。,铃不响  都响    逗你玩    宇宙 牌 香烟   人物二  马三立  人物一 著名 段子 人乐,1
TRAIN_SENT_ID_259945,,周志文,周志康,胡鸿钧 、 周志文 、 周志康,胡鸿钧  人物一  人物二,-1
TRAIN_SENT_ID_259958,,叶家妤,白家绮,叶家妤 + 白家绮 、 殷琦 + Natasha,人物一  人物二  殷琦,-1
TRAIN_SENT_ID_269552,,步鹰,燕双鹰,在 步鹰 的 精心 调教 下 燕双鹰 的 本领 突飞猛进 而,人物一 精心 调教 人物二 本领 突飞猛进,-1
TRAIN_SENT_ID_264526,,岳云鹏,郭德纲,郭德纲 - - 何云伟 、 曹云 金 、 岳云鹏 、 孔云龙 、 朱云峰 、 栾云平 、 李云杰 、 刘云天,人物二   何云伟  曹云 金  人物一  孔云龙  朱云峰  栾云平  李云杰  刘云天,1
TRAIN_SENT_ID_250625,,鲁西西,皮皮鲁,《 皮皮鲁 与 鲁西西 》 等等 !,人物二 人物一,-1
TRAIN_SENT_ID_252814,,颜回,孔子,孔子 不 听 ， 让 颜回 驾车 ， 子贡 作 骖 乘 ， 前去 会见 盗 跖 。,人物二 听  人物一 驾车  子贡 作 骖  前去 会见 盗 跖,1
TRAIN_SENT_ID_282924,,骆玉笙,韩永禄,西河 鼓书 曲种 名家 : 刘宝全 白云鹏 阎秋霞 骆玉笙 韩永禄 孙书 筠 王文禄 金万昌 籍薇,西河 鼓书 曲种 名家  刘宝全 白云鹏 阎秋霞 人物一 人物二 孙书 筠 王文禄 金万昌 籍薇,1
TRAIN_SENT_ID_252596,,颜回,孔子,颜回 随 孔子 重回 帝丘 ， 途经 蒲邑 ， 又 遭到 蒲人 的 拦截 。,人物一 人物二 重回 帝丘  途经 蒲邑  遭到 蒲人 拦截,1
TRAIN_SENT_ID_259745,,李偲菘,李伟菘,孙燕姿 孙燕姿 、 李伟菘 、 李偲菘 、 KenneC 《 是 时候 》,孙燕姿 孙燕姿  人物二  人物一,-1
TRAIN_SENT_ID_270557,,全真七子,王重阳,防御 路线 走 王重阳 ， 全真七子 相应 点灯 。,防御 路线 走 人物二  人物一 相应 点灯,1
TRAIN_SENT_ID_261724,,汤镇业,汤镇宗,张敏 、 汤镇宗 、 汤镇业 、 梁家仁 、 孙国明,张敏  人物二  人物一  梁家仁  孙国明,-1
TRAIN_SENT_ID_265460,,薛谭,秦青,读后感 : “ 薛谭 学 讴 ” 全文 的 重心 是 刻画 人物 秦青 和 薛谭 。,读后感   人物一 学 讴  全文 重心 刻画 人物 人物二 人物一,1
TRAIN_SENT_ID_282078,,陈长兴,陈秉旺,陈秉旺 与 陈长兴 168,人物二 人物一,-1
TRAIN_SENT_ID_270990,,严舆,严白虎,严白虎 、 严舆 、 朱治 、 孙瑜 、 钟离牧,人物二  人物一  朱治  孙瑜  钟离牧,-1
TRAIN_SENT_ID_265454,,薛谭,秦青,薛谭 讴 原文 : 薛谭 学 讴 原文 （ 1 ） 于 （ 2 ） 秦青 ， 未穷 （ 3 ） 青之技 ， 自谓 尽 之 ， 遂 辞 归 （ 4 ） 。,人物一 讴 原文  人物一 学 讴 原文       人物二  未穷    青之技  自谓  遂 辞,1
TRAIN_SENT_ID_256884,,仲由,孔子,孔子 对 公冶长 、 南容 的 评论 ， 客观 、 实际 ， 对 仲由 的 赞许 ， 体现 一种 开放 精神 。,人物二 公冶长  南容 评论  客观  实际  人物一 赞许  体现 一种 开放 精神,1
TRAIN_SENT_ID_264542,,岳云鹏,郭德纲,郭德纲 ― ― 何云伟 、 曹云 金 、 岳云鹏 、 孔云龙 、 朱云峰 、 栾云平 、 李云杰 、 刘云天,人物二 ― ― 何云伟  曹云 金  人物一  孔云龙  朱云峰  栾云平  李云杰  刘云天,1
TRAIN_SENT_ID_253144,,颜回,孔子,列子 · 仲尼 篇 第四 部分 : 列子 · 仲尼 篇 原文 : 子夏问 孔子 曰 ： “ 颜回 ① 之为 人 奚若 ？ ”,列子  仲尼 篇 第四 部分  列子  仲尼 篇 原文  子夏问 人物二 曰   人物一 ① 之为 奚若,1
TRAIN_SENT_ID_251826,,梅超风,黄药师,黄药师 爱上 梅超风,人物二 爱上 人物一,-1
TRAIN_SENT_ID_284536,,杨长在,杨志光,杨志光 - - 杨长在 、 张国庆,人物二   人物一  张国庆,-1
TRAIN_SENT_ID_254271,,张顺,张横,张横 急救 张顺 ， 刘麟 一马 早到 ， 将 张顺 就 地 抓 去 。,人物二 急救 人物一  刘麟 一马 早到  人物一 抓,-1
TRAIN_SENT_ID_264392,,曾国潢,曾国藩,富厚 堂 是 曾国藩 的 第三 故居 ， 由弟 曾国荃 、 曾国潢 主持 修建 。,富厚 堂 人物二 第三 故居  由弟 曾国荃  人物一 主持 修建,-1
TRAIN_SENT_ID_264945,,贾元春,贾宝玉,贾元春 赏赐 端午节 礼 ， 贾宝玉 同 薛宝钗 的 一样 ， 宝黛 生疑 。,人物一 赏赐 端午节 礼  人物二 薛宝钗  宝黛 生疑,-1
TRAIN_SENT_ID_282641,,苏颖超,宁不凡,正统 十年 冬 ， 傅元 影带 琼芳 等 下 贵州 寻 宁不凡 ， 以解 苏颖超 战败 心结 。,正统 十年 冬  傅元 影带 琼芳 贵州 寻 人物二  以解 人物一 战败 心结,-1
TRAIN_SENT_ID_272007,,文姜,宣姜,9 . 从 宣姜 到 文姜,人物二 人物一,-1
TRAIN_SENT_ID_265434,,薛谭,秦青,原文 ： 薛谭 学 讴于 秦青 ， 未穷 青之技 ， 自谓 尽 之 ； 遂 辞 归 。,原文  人物一 学 讴于 人物二  未穷 青之技  自谓  遂 辞,1
TRAIN_SENT_ID_276959,,樊迟,孔子,故 樊迟 请学稼圃 ， 孔子 讥为 小人 。,人物一 请学稼圃  人物二 讥为 小人,-1
TRAIN_SENT_ID_278012,,干光豪,左子穆,金庸 小说 《 天龙八部 》 的 人物 ， 无量 剑 西宗掌 门 ， 无量 剑 东宗掌 门 左子穆 的 师 妺 ， 干光豪 、 葛光佩 的 师傅 。,金庸 小说  天龙八部  人物  无量 剑 西宗掌 门  无量 剑 东宗掌 门 人物二 师 妺  人物一  葛光佩 师傅,1
TRAIN_SENT_ID_252834,,颜回,孔子,第十三回 孔子 重操旧业 颜回 见 （ 黑出 ） 荆妻,第十三回 人物二 重操旧业 人物一 见  黑出  荆妻,1
TRAIN_SENT_ID_264247,,陈真,霍元甲,“ 霍元甲 ” “ 陈真 ” 齐 上阵,人物二   人物一  齐 上阵,-1
TRAIN_SENT_ID_262269,,尤二姐,尤三姐,乙 那 是 《 红楼梦 》 ， 尤三姐 、 尤二姐 ！,乙  红楼梦   人物二  人物一,-1
TRAIN_SENT_ID_259807,,李偲菘,李伟菘,音乐 总监 ： 李偲菘 、 李伟菘 、 易家扬 、 小柯 、 张亚东,音乐 总监  人物一  人物二  易家扬  小柯  张亚东,-1
TRAIN_SENT_ID_282528,,张钧,张善为,张钧 派 自己 的 胞弟 张善为 ( 又名 祖荣 ) 任 交通员 ， 经常 往返 于 黄坑 、 新历 、 塘头 与 大坡 之间 。,人物一 派 胞弟 人物二  又名 祖荣  交通员  经常 往返 黄坑  新历  塘头 大坡 之间,1
TRAIN_SENT_ID_266695,,龙幽,龙溟,龙溟 、 龙幽,人物二  人物一,-1
TRAIN_SENT_ID_273676,,姜子牙,元始天尊,封 神台 是 元始天尊 命 姜子牙 在 岐山 修建 ， 上 张挂 封神榜 。,封 神台 人物二 命 人物一 岐山 修建  张挂 封神榜,1
TRAIN_SENT_ID_267585,,骆赢,骆羽,"女子双打 ： 于洋 / 王晓理 、 田卿 / 赵芸蕾 、 成淑 / 潘攀 、 包宜鑫 / 钟倩欣 、 马晋 / 汤金华 , 骆赢 、 骆羽",女子双打  于洋  王晓理  田卿  赵芸蕾  成淑  潘攀  包宜鑫  钟倩欣  马晋  汤金华  人物一  人物二,1
TRAIN_SENT_ID_252954,,颜回,孔子,"课文 中有 孔子 ， 颜回 谈 "" 志向 “ 的 对话 ， 谈谈 自己 的 看法 。",课文 中有 人物二  人物一 谈  志向  对话  谈谈 看法,1
TRAIN_SENT_ID_250734,,鲁西西,皮皮鲁,2 生日 纪念 : 皮皮鲁 和 鲁西西 30 岁 生日 庆典 ( 17 张 ),生日 纪念  人物二 人物一  岁 生日 庆典   张,-1
TRAIN_SENT_ID_268992,,韩非,荀子,《 诗经 》 《 史记 》 《 庄子 》 《 老子 》 《 论语 》 《 孟子 》 《 韩非 子 》 《 楚辞 》 《 左传 》 《 荀子 》,诗经   史记   庄子   老子   论语   孟子   人物一 子   楚辞   左传   人物二,1
TRAIN_SENT_ID_252770,,颜回,孔子,所以 天下 这么 大 ， 愿意 为 他 效劳 的 只有 七十 人 ， 而 得 孔子 仁义 之心 要者 只有 颜回 一人 。,天下  愿意 效劳 七十  人物二 仁义 之心 要者 人物一 一人,1
TRAIN_SENT_ID_252933,,颜回,孔子,雍 也 评析 : 本章 中 ， 孔子 又 一次 称赞 颜回 ， 对 他 作 了 高度评价 。,雍 评析  本章 中  人物二 一次 称赞 人物一  作 高度评价,1
TRAIN_SENT_ID_265463,,薛谭,秦青,“ 高云 不 动 ” 出自 《 列子 · 汤问 》 ： “ 薛谭 学 讴于 秦青 ， 未穷 青之技 ， 自谓 尽 之 ， 遂 辞 归 。,高云 动  出自  列子  汤问    人物一 学 讴于 人物二  未穷 青之技  自谓  遂 辞,1
TRAIN_SENT_ID_259744,,李偲菘,李伟菘,祁哲泉 作曲 人 : 李伟菘 李偲菘 纪利 男 随安 苏恒 RickyHo,祁哲泉 作曲  人物二 人物一 纪利 男 随安 苏恒,-1
