sent_id,sent_id,entity1,entity2,sent,processed_sent,human
TRAIN_SENT_ID_255390,,罗成,秦琼,单是 秦琼 的 恩人 ， 秦琼 是 罗成 的 表兄 ， 那么 单雄信 理所当然 的 就 应当 是 罗成 的 恩人 。,单是 人物二 恩人  人物二 人物一 表兄  单雄信 理所当然 应当 人物一 恩人,-1
TRAIN_SENT_ID_285957,,谢天顺,郭荣起,郭荣起 - - 常宝霆 、 郭宝 明 、 杜 三宝 、 杨少华 、 谢天顺 、 张宝 如,人物二   常宝霆  郭宝 明  杜 三宝  杨少华  人物一  张宝,1
TRAIN_SENT_ID_275922,,钱学渠,钱学森,钱学渠 ， 他 是 钱学森 的 堂弟 。,人物一  人物二 堂弟,-1
TRAIN_SENT_ID_253001,,颜回,孔子,殿 大成殿 外景 内 供奉 着 孔子 及 孟子 、 颜回 等 四配 十二 哲人 的 牌位 ， 显示 出 孔子 之学 后继有人 ， 学子 济济一堂 。,殿 大成殿 外景 供奉 人物二 孟子  人物一 四配 十二 哲人 牌位  显示 出 人物二 之学 后继有人  学子 济济一堂,1
TRAIN_SENT_ID_257028,,洪敬尧,洪荣宏,我们 约 好 常常 喜乐 08 旧情绵绵 : 林慧萍 、 洪荣宏 、 洪敬尧,约 常常 喜乐  旧情绵绵  林慧萍  人物二  人物一,1
TRAIN_SENT_ID_266666,,邓鸣贺,邓鸣璐,儿童节目 ： 邓鸣贺 、 邓鸣璐 。,儿童节目  人物一  人物二,-1
TRAIN_SENT_ID_252853,,颜回,孔子,」 颜回 无以 应 ， 入告 孔子 。,人物一 无以 应  入告 人物二,-1
TRAIN_SENT_ID_281994,,陈宇风,陈熙锋,出生 在 高雄 ， 家里 有 四兄弟 — — 大哥 、 二哥 ， 陈熙锋 和 陈宇风 则 是 双胞胎 。,出生 高雄  家里 四兄弟   大哥  二哥  人物二 人物一 双胞胎,-1
TRAIN_SENT_ID_266045,,张学思,张学良,至此 ， 周恩来 和 张学铭 、 张学思 的 信 ， 才 辗转 送到 张学良 的 手里 。,至此  周恩来 张学铭  人物一 信  辗转 送到 人物二 手里,-1
TRAIN_SENT_ID_252739,,颜回,孔子,其 遥想 和 赞美 的 是 贫而 好学 、 不事 稼穑 的 颜回 和 安贫乐道 的 孔子 ， 尤其 是 钦羡 古代 “ 耦而耕 ” 的 隐士 荷 蓧 翁 和 长 沮 、 桀溺 。,遥想 赞美 贫而 好学  不事 稼穑 人物一 安贫乐道 人物二  尤其 钦羡 古代  耦而耕  隐士 荷 蓧 翁 长 沮  桀溺,1
TRAIN_SENT_ID_262593,,郭芙蓉,郭蔷薇,克星 ： 邢育森 、 七舅 姥爷 、 郭芙蓉 、 郭蔷薇 （ 郭芙蓉 的 堂妹 ）,克星  邢育森  七舅 姥爷  人物一  人物二  人物一 堂妹,-1
TRAIN_SENT_ID_273633,,马阔海,马青山,召唤 人 ： 端木燕 、 马青山 、 马阔海,召唤  端木燕  人物二  人物一,1
TRAIN_SENT_ID_264829,,沈尊光,高占全,高占全 沈尊光 : 沈尊光 （ 1940 — ） ， 作曲家 、 音乐 评论家 。,人物二 人物一  人物一      作曲家  音乐 评论家,-1
TRAIN_SENT_ID_251602,,穆春,穆弘,穆弘 与 穆春 率 庄客 追赶 ， 一直 追到 浔 阳江 边 。,人物二 人物一 率 庄客 追赶  一直 追到 浔 阳江,1
TRAIN_SENT_ID_285959,,谢天顺,郭荣起,郭荣起 ― ― 常宝霆 、 郭宝 明 、 杜 三宝 、 杨少华 、 谢天顺 、 张宝 如,人物二 ― ― 常宝霆  郭宝 明  杜 三宝  杨少华  人物一  张宝,1
TRAIN_SENT_ID_257215,,张子静,张爱玲,（ 张子静 ） 想起 张爱玲 ， 总是 想起 钻石 。,人物一  想起 人物二  总是 想起 钻石,1
TRAIN_SENT_ID_267511,,裘千丈,裘千仞,裘千仞 / 裘千丈 ..........,人物二  人物一,-1
TRAIN_SENT_ID_269572,,水笙,汪啸风,汪啸风 （ “ 铃剑 双侠 ” 之一 、 水笙 表哥 ） 【 天宁寺 中毒 而 死 】,人物二   铃剑 双侠   人物一 表哥   天宁寺 中毒 死,1
TRAIN_SENT_ID_268995,,韩非,荀子,"《 外传 》 的 思想 ， 大致 以 荀子 思想 为主 ， 反复强调 隆礼 重法 ， 尊士 养民 , 也 间 采 孟子 及 韩非 有关 言论 。",外传  思想  大致 人物二 思想 为主  反复强调 隆礼 重法  尊士 养民  间 采 孟子 人物一 言论,1
TRAIN_SENT_ID_259675,,公孙胜,罗真人,二 仙山 ， 二仙 者 ， 我们 可以 推测 ， 可能 就是指 罗真人 、 清 道人 （ 公孙胜 ） 两位 北方 的 活神仙 。,二 仙山  二仙  推测  可能 就是指 人物二  清 道人  人物一  两位 北方 活神仙,-1
TRAIN_SENT_ID_264377,,曾国潢,曾国藩,过 了 一年 多 时间 ， 曾国藩 对 曾国潢 在 作诗 方面 的 长进 感到 非常高兴 ， 同时 又 告诫 他 ： “ 须 有志 有恒 ， 乃有 成就 耳 。 ”,一年 时间  人物二 人物一 作诗 方面 长进 感到 非常高兴  告诫   须 有志 有恒  乃有 成就 耳,1
TRAIN_SENT_ID_276673,,萧玉妃,萧墨月,知己 好友 ： 萧玉妃 ， 萧墨月 。,知己 好友  人物一  人物二,-1
TRAIN_SENT_ID_252644,,颜回,孔子,"秦世隐 商山 〉 ， 老莱子 ， 孔子 ， 颜回 , 伯夷 ， 叔齐 ， 许由 , 竹林七贤 ， 卧龙 先生 ， 陶渊明 ， 唐伯虎 ， 林逋 ， 黄宗羲 等 。",秦世隐 商山   老莱子  人物二  人物一  伯夷  叔齐  许由  竹林七贤  卧龙 先生  陶渊明  唐伯虎  林逋  黄宗羲,1
TRAIN_SENT_ID_255440,,罗成,秦琼,第十四回 罗成 艺高 枪 挑 反叛 秦琼 马惊 认子 山林,第十四回 人物一 艺高 枪 挑 反叛 人物二 马惊 认子 山林,1
TRAIN_SENT_ID_274063,,南宫敬叔,孔子,义云 ： 《 史记 》 云 ： 孔子 与 南宫敬叔 适周 问礼 於 老子 ， 老子 曰 ： 子 之 所言 ， 其人骨 已朽 矣 ， 独其言 在 尔 。,义云   史记  云  人物二 人物一 适周 问礼 於 老子  老子 曰  子 所言  其人骨 已朽  独其言,1
TRAIN_SENT_ID_259751,,李偲菘,李伟菘,08 不爱 的 理由 词 ： 苏春 兴曲 ： 李偲菘 / 李伟菘,不爱 理由 词  苏春 兴曲  人物一  人物二,1
TRAIN_SENT_ID_271212,,张翠山,张三丰,得 承 张三丰 武术 及 为 人 处世之道 ， 思想 端正 不 歪 ； 加上 资质聪颖 廿来 岁 已练 得 一身 高强 武功 ， 江湖人称 银勾铁划 张翠山 张五侠 。,承 人物二 武术 处世之道  思想 端正 歪  加上 资质聪颖 廿来 岁 已练 一身 高强 武功  江湖人称 银勾铁划 人物一 张五侠,1
TRAIN_SENT_ID_249529,,李蔡,李广,而 他 的 堂兄弟 李蔡 才能 不如 他 却 官至 丞相 ， 古人 认为 奇数 不 吉利 ， 司马迁 评价 为 “ 李广 老 ， 数奇 。 ”,堂兄弟 人物一 官至 丞相  古人 认为 奇数 吉利  司马迁 评价  人物二 老  数奇,1
TRAIN_SENT_ID_265398,,薛谭,秦青,② 《 列子 》 ： 薛谭 学 讴于 秦青 ， 未穷 青之技 ， 遂 辞 归 。,②  列子   人物一 学 讴于 人物二  未穷 青之技  遂 辞,1
TRAIN_SENT_ID_255331,,卫夫人,王羲之,（ 王羲之 《 题 卫夫人 笔阵 图后 ( 传 ) 》 ”,人物二  题 人物一 笔阵 图后  传,1
TRAIN_SENT_ID_249326,,陆无双,程英,9 、 程英 含泪 不语 ， 陆无双 却 又 叫 了 出来 ： “ 傻蛋 ， 你 … …,人物二 含泪 不语  人物一   傻蛋,-1
TRAIN_SENT_ID_257525,,毛泽民,毛泽东,毛氏 3 兄弟 ， 毛泽东 居长 ， 二弟 毛泽民 ， 三弟 毛泽覃 。,毛氏  兄弟  人物二 居长  二弟 人物一  三弟 毛泽覃,-1
TRAIN_SENT_ID_255273,,卫夫人,王羲之,在 书法 方面 ， 与 王羲之 并称 “ 钟王 ” ， 其 书体 称为 “ 钟体 ” ， 卫夫人 、 王羲之 的 师承 。,书法 方面  人物二 并称  钟王   书体 称为  钟体   人物一  人物二 师承,1
TRAIN_SENT_ID_264276,,陈真,霍元甲,但 就 在 此时 ， 闻 霍元甲 病逝 ， 陈真 回国 ， 学业 半途而废 。,闻 人物二 病逝  人物一 回国  学业 半途而废,-1
TRAIN_SENT_ID_284039,,韩文举,康有为,时至 光绪 二十八年 （ 1902 年 ） ， 梁启超 与 康有为 ， 在 学术思想 和 政治 观点 上 产生 严重 分歧 ， 争论 之中 ， 韩文举 赞同 了 梁启超 的 政见 。,时至 光绪 二十八年   年   梁启超 人物二  学术思想 政治 观点 产生 严重 分歧  争论 之中  人物一 赞同 梁启超 政见,-1
TRAIN_SENT_ID_279088,,程英,黄药师,其实 追究 起来 ， 黄药师 收 程英 为徒 ， 还是 因为 她 服侍 得 体贴入微 ， 不似 黄蓉般 跳脱 顽皮 。,其实 追究 起来  人物二 收 人物一 为徒  服侍 体贴入微  不似 黄蓉般 跳脱 顽皮,1
TRAIN_SENT_ID_260596,,金敬姬,金正日,金正日 逝世 后 ， 金敬姬 被 看成 金正恩 “ 最 亲近 的 保护 人 ” 。,人物二 逝世  人物一 看成 金正恩  亲近 保护,-1
TRAIN_SENT_ID_253018,,颜回,孔子,6.8 孔子 要 跟 颜回 学 打坐,人物二 人物一 学 打坐,1
TRAIN_SENT_ID_253026,,颜回,孔子,以天 乙之武 也 ， 焦土 而烂石 ； 以 唐尧 之德 也 ， 襄陵 而 怀山 ； 以 颜回 之仁 也 ， 贫 居于 陋巷 ； 以 孔子 之圣 也 ， 情希乎 执鞭 。,以天 乙之武  焦土 而烂石  唐尧 之德  襄陵 怀山  人物一 之仁  贫 居于 陋巷  人物二 之圣  情希乎 执鞭,1
TRAIN_SENT_ID_268976,,韩非,荀子,韩非 又 修正 荀子 。,人物一 修正 人物二,-1
TRAIN_SENT_ID_273647,,姜子牙,元始天尊,封神 之 战时 ， 元始天尊 敕令 四不相为 姜子牙 的 坐骑 。,封神 战时  人物二 敕令 四不相为 人物一 坐骑,1
TRAIN_SENT_ID_265412,,薛谭,秦青,薛谭 学 讴于 秦青,人物一 学 讴于 人物二,1
TRAIN_SENT_ID_257044,,洪敬尧,洪荣宏,我们 约 好 常常 喜乐 恋花 08 旧情绵绵 : 林慧萍 、 洪荣宏 、 洪敬尧,约 常常 喜乐 恋花  旧情绵绵  林慧萍  人物二  人物一,1
TRAIN_SENT_ID_282271,,习桥桥,习近平,习桥桥 （ 现名 齐桥 桥 ） ， 1949 年 3 月 1 日 出生 ， 祖籍 陕西 富平县 ， 中共 元老 习仲勋 之女 ， 习近平 的 姐姐 。,人物一  现名 齐桥 桥    年  月  日 出生  祖籍 陕西 富平县  中共 元老 习仲勋 之女  人物二 姐姐,-1
TRAIN_SENT_ID_284552,,贾斯文,杨议,2008 年 ， 继续 与 杨议 、 韩兆 、 贾斯文 合作 《 杨光 的 快乐 生活 5 》 。,年  继续 人物二  韩兆  人物一 合作  杨光 快乐 生活,-1
TRAIN_SENT_ID_257223,,张子静,张爱玲,《 我 的 姊妹 张爱玲 》 是 2000 年 文汇出版社 出版 的 图书 ， 作者 是 张子静 、 季季 。,姊妹 人物二   年 文汇出版社 出版 图书  作者 人物一  季季,-1
TRAIN_SENT_ID_253841,,赵合德,赵飞燕,赵飞燕 · 赵合德,人物二  人物一,-1
TRAIN_SENT_ID_267577,,吴魏,吴狄,不是 疯子 ， 不是 吴狄 ， 而是 吴魏 。,疯子  人物二  人物一,-1
TRAIN_SENT_ID_251874,,曹薰铉,李昌镐,第三轮 ： 李昌镐 1 : 0 钱宇平 曹薰铉 1 : 0 聂卫平 林海峰 1 : 0 淡路 修三 赵治勋 1 : 0 片冈聪,第三轮  人物二    钱宇平 人物一    聂卫平 林海峰    淡路 修三 赵治勋    片冈聪,1
TRAIN_SENT_ID_252599,,颜回,孔子,孔子 信任 颜回,人物二 信任 人物一,-1
TRAIN_SENT_ID_278193,,王蕙芳,吴菱仙,王蕙芳 相关 信息 : 恩师 吴菱仙,人物一 相关 信息  恩师 人物二,-1
TRAIN_SENT_ID_251428,,李瀚章,李鸿章,这 与 李鸿章 的 大哥 李瀚章 有关 。,人物二 大哥 人物一,-1
TRAIN_SENT_ID_252531,,颜回,孔子,颜回 无以 应 ， 入告 孔子 。,人物一 无以 应  入告 人物二,-1
TRAIN_SENT_ID_252845,,颜回,孔子,县令 环视 大殿 ， 不光 殿宇 破败 不堪 ， 孔子 和 颜回 圣像 也 都 缺额 少肩 ， 实在 有损 尊严 ， 自觉 羞惭 。,县令 环视 大殿  殿宇 破败 不堪  人物二 人物一 圣像 缺额 少肩  实在 有损 尊严  自觉 羞惭,1
TRAIN_SENT_ID_251897,,曹薰铉,李昌镐,虽然 日本队 主帅 加藤 正夫 力克 曹薰铉 ， 但 还是 没能 闯过 最后 李昌镐 一关 。,日本队 主帅 加藤 正夫 力克 人物一  没能 闯过 最后 人物二 一关,1
TRAIN_SENT_ID_283395,,师戈,郑小山,郑小山 — — 罗健 、 王筱磊 、 徐力 、 刘宝安 、 郑宏伟 、 师戈 、 苗阜 、 曹磊,人物二   罗健  王筱磊  徐力  刘宝安  郑宏伟  人物一  苗阜  曹磊,1
TRAIN_SENT_ID_261327,,罗松,罗成,第 二百八十 五章 罗松 战 罗成,二百八十 五章 人物一 战 人物二,-1
TRAIN_SENT_ID_252992,,颜回,孔子,《 淮南子 · 人间 训 》 ： “ 人 或 问 孔子 曰 ： ‘ 颜回 何如 人 也 ？,淮南子  人间 训    问 人物二 曰   人物一 何如,1
TRAIN_SENT_ID_275353,,申公豹,元始天尊,申公豹 使出 断头 术 骗 姜子牙 的 封神榜 ， 被 元始天尊 阻止 。,人物一 使出 断头 术 骗 姜子牙 封神榜  人物二 阻止,1
TRAIN_SENT_ID_253045,,颜回,孔子,注 [ 四 ] 论语 颜回 慕 孔子 之言 也 。,注  四  论语 人物一 慕 人物二 之言,1
TRAIN_SENT_ID_269503,,李国豪,李香凝,演员 ： 王玫 / 李小龙 / 琳达 / 李国豪 / 李香凝,演员  王玫  李小龙  琳达  人物一  人物二,-1
TRAIN_SENT_ID_251413,,李瀚章,李鸿章,李国秦 （ 1902 － ） ， 民国 名媛 ， 是 李鸿章 的 侄孙女 ， 其父 是 李鸿章 大哥 李瀚章 的 第七 子 李经 沣 （ 1881 － 1941 ） 。,李国秦      民国 名媛  人物二 侄孙女  其父 人物二 大哥 人物一 第七 子 李经 沣,-1
TRAIN_SENT_ID_282572,,尹寿山,马德禄,马德禄 — — 高寿亭 、 高桂清 、 杨 闻华 、 尹寿山 、 郭荣起,人物二   高寿亭  高桂清  杨 闻华  人物一  郭荣起,-1
TRAIN_SENT_ID_253850,,赵合德,赵飞燕,燕赤凤 汉书 中 的 赵飞燕 与 赵合德 两姐妹 : 《 汉书 》 有云 ： “ 自鸿嘉后 ， 上 稍 隆于 内 宠 。,燕赤凤 汉书 中 人物二 人物一 两姐妹   汉书  有云   自鸿嘉后  稍 隆于 宠,1
TRAIN_SENT_ID_272011,,文姜,宣姜,堂姐妹 ： 宣姜 、 文姜,堂姐妹  人物二  人物一,-1
TRAIN_SENT_ID_252755,,颜回,孔子,昔 孔子 叹 颜回 ， 以为 三月 不违 仁者 ， 盖观 其 心耳 。,昔 人物二 叹 人物一  三月 不违 仁者  盖观 心耳,1
TRAIN_SENT_ID_264565,,胡青牛,张无忌,12 . 马景涛 版 《 倚天 屠龙记 》 ： （ 1993 年 ， 十五岁 ） 1993 年 拍摄 ， 黄坤玄 出演 青少年 时 跟 胡青牛 学医 的 张无忌 。,马景涛 版  倚天 屠龙记     年  十五岁   年 拍摄  黄坤玄 出演 青少年 时 人物一 学医 人物二,-1
TRAIN_SENT_ID_252588,,颜回,孔子,范仲淹 艰涩 的 生活 ， 有点像 孔子 的 贤徒 颜回 ： 一碗 饭 、 一瓢 水 ， 在 陋巷 ， 即使 别人 叫苦连天 ， 他 依然 乐在其中 。,范仲淹 艰涩 生活  有点像 人物二 贤徒 人物一  一碗 饭  一瓢 水  陋巷  叫苦连天  依然 乐在其中,1
TRAIN_SENT_ID_257232,,艾欧里亚,艾俄洛斯,第十六章 艾俄洛斯 和 艾欧里亚,第十六章 人物二 人物一,-1
TRAIN_SENT_ID_269401,,刘伟,马季,《 数字 与 生活 》 表演者 ： 刘伟 、 马季,数字 生活  表演者  人物一  人物二,-1
TRAIN_SENT_ID_257800,,林平之,岳不群,小说 中 东方不败 、 岳不群 、 林平之 无一不是 因为 这套 剑法 而 心理变态 、 人格 扭曲 。,小说 中 东方不败  人物二  人物一 无一不是 这套 剑法 心理变态  人格 扭曲,1
TRAIN_SENT_ID_277686,,平阳君,赵惠文王,赵惠文王 ( 赵何 ) 安阳 君 ( 赵章 ) 平阳君 ( 赵豹 ) 平原君 ( 赵胜 ) … … … … … … … … … … …,人物二  赵何  安阳 君  赵章  人物一  赵豹  平原君  赵胜,-1
TRAIN_SENT_ID_274675,,马冬晗,马冬昕,"马冬晗 学生会 主席 : 马冬昕 , 马冬晗 ( 3 张 )",人物一 学生会 主席  人物二  人物一   张,-1
TRAIN_SENT_ID_271511,,孟优,孟获,相传 ， 三国 时期 ， 孟获 之兄 孟优 得 异人授 以 仙术 ， 就 居于 魏宝 山中 ， 以 方术 济人 。,相传  三国 时期  人物二 之兄 人物一 异人授 仙术  居于 魏宝 山中  方术 济人,1
TRAIN_SENT_ID_252783,,颜回,孔子,颜回 之 于 孔子 也 ， 犹曾 参之事父 也 。,人物一 人物二  犹曾 参之事父,-1
TRAIN_SENT_ID_257780,,林平之,岳不群,东方不败 最先 练成 了 那种 邪恶 的 武功 （ 葵花宝典 与 辟邪 剑 谱 为 同 一种 武功 ） ， 只有 他 没 像 岳不群 和 林平之 一样 丧失理智 。,东方不败 最先 练成 那种 邪恶 武功  葵花宝典 辟邪 剑 谱 一种 武功   没 人物二 人物一 丧失理智,1
TRAIN_SENT_ID_252947,,颜回,孔子,而 《 孔子 游春 》 中 孔子 听 子路 、 颜回 谈论 志向 的 那 部分 也 具有 同样 的 效果 。,人物二 游春  中 人物二 听 子路  人物一 谈论 志向 部分 具有 同样 效果,1
TRAIN_SENT_ID_269351,,王中军,王中磊,王中磊 、 王中军,人物二  人物一,-1
TRAIN_SENT_ID_273634,,姜子牙,元始天尊,《 封神演义 》 中 ， 姜子牙 奉太上 元始天尊 敕命 ， 封屡树 战功 的 武将 黄飞虎 为 “ 东岳泰山 天 齐仁圣 大帝 ” ， 命 他 总管 天地 人间 的 吉凶祸福 。,封神演义  中  人物一 奉太上 人物二 敕命  封屡树 战功 武将 黄飞虎  东岳泰山 天 齐仁圣 大帝   命 总管 天地 人间 吉凶祸福,1
TRAIN_SENT_ID_254002,,周恩寿,周恩来,1936 年 夏天 ， 王士琴 结识 了 周恩来 在 哈尔滨 税捐 局 工作 的 胞弟 周恩寿 ， 后 两人 结了婚 。,年 夏天  王士琴 结识 人物二 哈尔滨 税捐 局 工作 胞弟 人物一  两人 结了婚,-1
TRAIN_SENT_ID_284549,,廖立峨,鲁迅,廖立峨 也 协助 过 鲁迅 一些 工作 ， 曾 介绍 何春 才 （ 广东 兴宁 人 ） 与 鲁迅 认识 。,人物一 协助 人物二 工作  介绍 何春  广东 兴宁  人物二 认识,-1
TRAIN_SENT_ID_265478,,薛谭,秦青,⑶ 云不去 ： 典出 《 列子 · 汤问 》 ： “ 薛谭 学 讴于 秦青 ， 未穷 青之技 ， 自谓 尽 之 ， 遂 辞 归 。,⑶ 云不去  典出  列子  汤问    人物一 学 讴于 人物二  未穷 青之技  自谓  遂 辞,1
TRAIN_SENT_ID_252991,,颜回,孔子,孔子 掷 金试 颜回,人物二 掷 金试 人物一,-1
TRAIN_SENT_ID_252673,,颜回,孔子,《 吕氏春秋 · 任数 》 ： “ 孔子 穷乎 陈蔡 之间 ， 藜 羹 不 斟 ， 七日 不尝粒 ， 昼寝 ， 颜回 索米 ， 得 而 爨 之 。 ”,吕氏春秋  任数    人物二 穷乎 陈蔡 之间  藜 羹 斟  七日 不尝粒  昼寝  人物一 索米  爨,1
TRAIN_SENT_ID_282570,,尹寿山,马德禄,马德禄 - - 高寿亭 、 高桂清 、 杨 闻华 、 尹寿山 、 郭荣起,人物二   高寿亭  高桂清  杨 闻华  人物一  郭荣起,-1
TRAIN_SENT_ID_284203,,陈子离,刘鉴,主要 人物 : 李青萝 刘珏 刘 绯 （ 陈子离 ） 刘鉴 成思 悦 （ 暗夜 ） 顾天翔 顾天琳 王燕 回 楚南,主要 人物  李青萝 刘珏 刘 绯  人物一  人物二 成思 悦  暗夜  顾天翔 顾天琳 王燕 回 楚南,1
TRAIN_SENT_ID_257499,,姜昆,马季,马季 、 赵世忠 、 姜昆,人物二  赵世忠  人物一,-1
TRAIN_SENT_ID_257214,,张子静,张爱玲,张志沂 （ 1896 年 — — 1953 年 ） ， 又名 张廷重 ， 河北 丰润 人 ， 清末 名臣 张佩纶 与 李鸿章 女 李菊 耦 的 独子 ， 张爱玲 与 张子静 父亲 。,张志沂   年    年   又名 张廷重  河北 丰润  清末 名臣 张佩纶 李鸿章 女 李菊 耦 独子  人物二 人物一 父亲,-1
TRAIN_SENT_ID_273659,,姜子牙,元始天尊,白鹤 童子 现身 ， 取回 阴阳 镜 ， 并 叫 姜子牙 去 见 元始天尊 。,白鹤 童子 现身  取回 阴阳 镜  人物一 见 人物二,1
TRAIN_SENT_ID_255424,,罗成,秦琼,第十五回 勇 秦琼 舞 简服 三军 小 罗成 射鹰助 一弩,第十五回 勇 人物二 舞 简服 三军 人物一 射鹰助 一弩,1
TRAIN_SENT_ID_249323,,陆无双,程英,1228 郭 芙 、 程英 、 陆无双 出生,郭 芙  人物二  人物一 出生,-1
TRAIN_SENT_ID_258157,,刘星,夏雪,心虚 的 刘星 和 夏雪 利诱 小雨 当 了 替罪羊 。,心虚 人物一 人物二 利诱 小雨 替罪羊,-1
TRAIN_SENT_ID_254296,,张顺,张横,话 说 当下 张横 听得 道 没 了 他 兄弟 张顺 ， 烦恼 得 昏晕 了 半晌 ， 却 救 得 苏醒 。,话 说 当下 人物二 听得 道 没 兄弟 人物一  烦恼 昏晕 半晌  救 苏醒,1
TRAIN_SENT_ID_249055,,吕洞宾,韩湘子,吕洞宾 化名 为 “ 官无上 ” ， 前来 传道 、 点化 韩湘 ， 使 韩湘子 很快 成仙 。,人物一 化名  官无上   前来 传道  点化 韩湘  人物二 很快 成仙,1
TRAIN_SENT_ID_270035,,楚寒镜,楚碧痕,楚寒镜 是 炎帝 神农 洞 月 幽之境 中 守护 梭罗 仙树 的 梭罗树 仙 之一 ， 楚碧痕 的 孪生 姐姐 。,人物一 炎帝 神农 洞 月 幽之境 中 守护 梭罗 仙树 梭罗树 仙  人物二 孪生 姐姐,-1
TRAIN_SENT_ID_252887,,颜回,孔子,《 史记 · 孔子 世家 》 ： “ 王之 辅相 有如 颜回 者 乎 ？ ”,史记  人物二 世家    王之 辅相 有如 人物一,1
TRAIN_SENT_ID_281390,,姜王后,姜文焕,姜桓楚 和 姜王后 被 纣王 无端 杀害 ， 姜文焕 悲愤交加 ， 自立 为 东伯侯 ， 竖起 反商 大旗 ， 是 八百 路 诸侯 中 第一个 造反 的 。,姜桓楚 人物一 纣王 无端 杀害  人物二 悲愤交加  自立 东伯侯  竖起 反商 大旗  八百 路 诸侯 中 第一个 造反,1
TRAIN_SENT_ID_271221,,和硕温恪公主,和硕敦恪公主,他们 是 ： 怡 亲王 胤 祥 、 和硕温恪公主 、 和硕敦恪公主 。,怡 亲王 胤 祥  人物一  人物二,-1
TRAIN_SENT_ID_252816,,颜回,孔子,④ 《 庄子 》 ： 孔子 见 老 聃 ， 出 ， 语 颜回 曰 ： “ 丘之道 ， 其 犹 醯 鸡乎 ？ ”,④  庄子   人物二 见 老 聃  出  语 人物一 曰   丘之道  犹 醯 鸡乎,1
TRAIN_SENT_ID_283764,,陈寅衷,陈赤衷,《 鄞县 志 · 陈赤衷 》 载 ： 陈寅衷 “ 亦 复 佩服 六经 ， 质有 其文 ， 溯 蕺 山之学脉 ， 仰 证人 之 成规 ” 。,鄞县 志  人物二  载  人物一  复 佩服 六经  质有 其文  溯 蕺 山之学脉  仰 证人 成规,1
TRAIN_SENT_ID_251528,,陈辅,陈靖仇,陈辅 是 陈靖仇 的 师傅 。,人物一 人物二 师傅,-1
TRAIN_SENT_ID_276113,,黄立成,黄立行,台语 （ 闽南语 ） Rap ， 1990 年初 ， 从 美国 洛杉矶 来到 台湾 的 黄立成 ， 黄立行 和 林智文 组成 了 LA 。,台语  闽南语     年初  美国 洛杉矶 来到 台湾 人物一  人物二 林智文 组成,-1
TRAIN_SENT_ID_261157,,王缙,王维,王缙 、 王维 手足情深,人物一  人物二 手足情深,-1
TRAIN_SENT_ID_259524,,梅超风,杨康,周星驰 还 在 第 7 集中 被 杨康 抓来 后 送给 梅超风 练功 。,周星驰  集中 人物二 抓来 送给 人物一 练功,-1
TRAIN_SENT_ID_277591,,袁世廉,袁世凯,袁世凯 的 三兄 袁世廉 因 病 辞去 徐州 兵备道 职 ， 袁世凯 将 其 接到 洹 上 村 同住 。,人物二 三兄 人物一 病 辞去 徐州 兵备道 职  人物二 接到 洹 村 同住,-1
TRAIN_SENT_ID_271739,,朱聪,郭靖,朱聪 和 全金发 最先 上山 ， 见 郭靖 躺 在 地下 被 四人 夹击 ， 已 是 命 在 顷刻 ， 如何 不 急 ？,人物一 全金发 最先 上山  见 人物二 躺 地下 四人 夹击  命 顷刻  急,1
TRAIN_SENT_ID_250681,,鲁西西,皮皮鲁,“ 皮皮鲁 总动员 · 鲁西西 系列 ” 是 其 新创 力作 。,人物二 总动员  人物一 系列  新创 力作,-1
TRAIN_SENT_ID_249545,,李蔡,李广,当初 ， 李广 的 堂弟 李蔡 和 李广一 起 侍奉 文帝 。,当初  人物二 堂弟 人物一 人物二一 侍奉 文帝,-1
TRAIN_SENT_ID_255468,,罗成,秦琼,第三十九回 秦琼 三锏 倒 铜旗 罗成 枪 挑孽 世雄,第三十九回 人物二 三锏 倒 铜旗 人物一 枪 挑孽 世雄,1
TRAIN_SENT_ID_276119,,黄立成,黄立行,演唱 : 黄立成 / 黄立行,演唱  人物一  人物二,-1
TRAIN_SENT_ID_253032,,颜回,孔子,"孔子 有 之 , 不必 束 攸 ， 颜回 逢 之 何用 箪瓢 , 於 陵元尔 三日 不食 , 首阳元尔 饿食 菜苗 。",人物二  不必 束 攸  人物一 逢 何用 箪瓢  於 陵元尔 三日 不食  首阳元尔 饿食 菜苗,1
TRAIN_SENT_ID_282801,,李翊,李威,李翊 ： 李翊 是 李威 的 堂弟 ， 曾经 和 蔡依林 传 过 绯闻 。,人物一  人物一 人物二 堂弟  曾经 蔡依林 传 绯闻,-1
TRAIN_SENT_ID_252936,,颜回,孔子,颜回 视 孔子 如父 ， 这 是 他 的 仁德 呵 。,人物一 视 人物二 如父  仁德,-1
TRAIN_SENT_ID_257603,,毛泽民,毛泽东,1922 年 ， 毛泽民 在 毛泽东 同志 创办 的 湖南 自修 大学 搞 庶务 工作 。,年  人物一 人物二 同志 创办 湖南 自修 大学 搞 庶务 工作,-1
TRAIN_SENT_ID_285187,,韩小莹,韩宝驹,师父 ： 江南七怪 （ 柯镇恶 、 朱聪 、 韩宝驹 、 南希仁 、 张阿生 、 全金发 、 韩小莹 ） 、 洪七公 、 哲别,师父  江南七怪  柯镇恶  朱聪  人物二  南希仁  张阿生  全金发  人物一   洪七公  哲别,1
TRAIN_SENT_ID_274275,,程曦,陈寅恪,1952 年 陈寅恪 因 程曦 “ 不辞而别 ” 之 事 ， 写 有 《 吕步舒 》 一 诗云 ： “ 证羊 见怪 借 粗奇 ， 生父 犹然 况 本身 。,年 人物二 人物一  不辞而别  事  写  吕步舒  诗云   证羊 见怪 粗奇  生父 犹然 况,-1
TRAIN_SENT_ID_252940,,颜回,孔子,《 孔子 泣 颜回 》 是 宋代 诗人 曹勋 创作 的 诗词 作品 。,人物二 泣 人物一  宋代 诗人 曹勋 创作 诗词 作品,1
TRAIN_SENT_ID_261163,,王缙,王维,又 王缙 《 进王 右 丞 集表 》 云 编次 王维 诗 文凡 10 卷 。,人物一  进王 右 丞 集表  云 编次 人物二 诗 文凡  卷,1
