sent_id,sent_id,entity1,entity2,sent,processed_sent,human
TRAIN_SENT_ID_249070,,吕洞宾,韩湘子, 三厘 宝地  ， 据传 是 王母娘娘 送给 吕洞宾 、 汉 钟离 、 韩湘子 三位 神仙 的 天宫 宝物 ， 铺开,三厘 宝地   据传 王母娘娘 送给 人物一  汉 钟离  人物二 三位 神仙 天宫 宝物  铺开,1
TRAIN_SENT_ID_257570,,毛泽民,毛泽东,"泽民 : 毛泽民 , 毛泽东 大 弟 , 1938 年 2 月 出任 新疆省 财政厅 、 民政厅 厅长 等 职 , 1943 年 9 月 27 日 与 陈潭秋 一起 被 杀害 。",泽民  人物一  人物二 弟   年  月 出任 新疆省 财政厅  民政厅 厅长 职   年  月  日 陈潭秋 一起 杀害,-1
TRAIN_SENT_ID_273678,,姜子牙,元始天尊,姜子牙 归国 封神 ， 太 上 无极 混元 教主 元始天尊 敕 曰 ： 呜呼 ！,人物一 归国 封神  太 无极 混元 教主 人物二 敕 曰,1
TRAIN_SENT_ID_276963,,樊迟,孔子,所以 孔子 回答 樊迟 问仁时 的 答案 是 “ 爱人 ” 。,人物二 回答 人物一 问仁时 答案  爱人,1
TRAIN_SENT_ID_265556,,张崇基,张崇德,许志安 跳槽 正东 ( 1997 年 ) ’ 张崇德 、 张崇基 跳槽 宝丽金 ( 1995 年 ),许志安 跳槽 正东   年   人物二  人物一 跳槽 宝丽金   年,-1
TRAIN_SENT_ID_271219,,和硕温恪公主,和硕敦恪公主,十三 爷党 胞妹 : 十三 公主 和硕温恪公主 （ 1687 年 ~ 1709 年 ） 和 十五 公主 和硕敦恪公主 （ 1691 年 ~ 1709 年 ） 。,十三 爷党 胞妹  十三 公主 人物一   年   年  十五 公主 人物二   年   年,-1
TRAIN_SENT_ID_263365,,武修文,武敦儒,与 杨过 对比 ， 武敦儒 、 武修文 更显 脓包 、 废物 。,杨过  人物二  人物一 更显 脓包  废物,1
TRAIN_SENT_ID_250675,,鲁西西,皮皮鲁,郑渊洁 的 经典作品 ， 有 《 皮皮鲁 奇遇记 》 和 《 鲁西西 奇遇记 》 两部 。,郑渊洁 经典作品   人物二 奇遇记   人物一 奇遇记  两部,-1
TRAIN_SENT_ID_264236,,陈真,霍元甲,霍元甲 爱徒 陈真 闻听 师父 死讯 ， 怀疑 其中 玄虚 ， 遂 与 龙一 决战 ， 谁料 龙一 不消 一刻 立即 败 倒 。,人物二 爱徒 人物一 闻听 师父 死讯  怀疑 玄虚  遂 龙一 决战  龙一 不消 一刻 立即 败 倒,1
TRAIN_SENT_ID_259620,,季布,季心,季心 史料 : 季布 弟 季心 ， 气盖 关中 ， 遇人 恭谨 ， 为 任侠 ， 方 数千里 ， 士皆争 为 之 死 。,人物二 史料  人物一 弟 人物二  气盖 关中  遇人 恭谨  任侠  方 数千里  士皆争 死,1
TRAIN_SENT_ID_265420,,薛谭,秦青,据 《 列子 · 汤问 》 记载 ， 秦青 具有 很 高 的 歌唱 技巧 ， 曾收 薛谭 为徒 。,列子  汤问  记载  人物二 具有 高 歌唱 技巧  曾收 人物一 为徒,1
TRAIN_SENT_ID_274358,,和政公主,宁国公主,唐 颜真卿 《 和政公主 神道碑 》 ： “ 姊 曰 宁国公主 ， 孀 嫠 屏居 。 ”,唐 颜真卿  人物一 神道碑    姊 曰 人物二  孀 嫠 屏居,1
TRAIN_SENT_ID_284899,,孙越,赵小林,赵小林 - - 孙越 、 于洪涛,人物二   人物一  于洪涛,-1
TRAIN_SENT_ID_265573,,张崇基,张崇德,张崇基 、 张崇德,人物一  人物二,-1
TRAIN_SENT_ID_281995,,陈宇风,陈熙锋,08 月 17 日 蔡小虎 、 罗时丰 、 陈宇风 、 陈熙锋 、 连 妈妈,月  日 蔡小虎  罗时丰  人物一  人物二  妈妈,-1
TRAIN_SENT_ID_268466,,单联全,冯一非,冯一非 与 老师 单联全 历经 3 年 时间 创作 出 《 我 的 丑娘 》 后 ， 老师 执导 时 安排 她 出 演剧 中女 二号 — — 丑娘 的 儿媳 赵晓旭 。,人物二 老师 人物一 历经  年 时间 创作 出  丑娘   老师 执导 时 安排 出 演剧 中女 二号   丑娘 儿媳 赵晓旭,-1
TRAIN_SENT_ID_279415,,王学明,龙俊杰,指导 教师 ： 龙俊杰 、 何雁 、 王学明 等 。,指导 教师  人物二  何雁  人物一,-1
TRAIN_SENT_ID_255345,,沈东篱,沈南枝,沈南枝 出场 章节 : 《 苏旷 传奇 》 沈南枝 第一卷 · 沽义 天下 : “ 东篱 把酒 黄昏 后 ” ， 天下第一 杀手 沈东篱 吟诗 漫步 ； “ 探著 南枝 开遍 未 ？ ”,人物二 出场 章节   苏旷 传奇  人物二 第一卷  沽义 天下   东篱 把酒 黄昏   天下第一 杀手 人物一 吟诗 漫步   探著 南枝 开遍 未,1
TRAIN_SENT_ID_255399,,罗成,秦琼,秦琼 的 重情 重义 就 象 太阳 一样 吸引 着 罗成 。,人物二 重情 重义 象 太阳 吸引 人物一,-1
TRAIN_SENT_ID_257807,,林平之,岳不群,准备 处理 林平之 的 时候 不 巧遇 上 岳不群 ， 与 之 相斗 而 不 敌 。,准备 处理 人物一 巧遇 人物二  相斗 敌,1
TRAIN_SENT_ID_268886,,司徒静,司徒剑南,司徒静 和 司徒剑南 都 以为 是 对方 所射 。,人物一 人物二 所射,-1
TRAIN_SENT_ID_255352,,贾午,贾南风,526 董袭 527 虞翻 528 贾午 529 贾充 530 贾南风,董袭  虞翻  人物一  贾充  人物二,-1
TRAIN_SENT_ID_252963,,颜回,孔子,过 了 一会 ， 肉 做 熟 了 ， 颜回 先给 孔子 端上 了 一碗 。,一会  肉 做 熟  人物一 先给 人物二 端上 一碗,1
TRAIN_SENT_ID_267595,,李沧海,李秋水,《 天龙八部 》 — — 李沧海 ； 李秋水,天龙八部    人物一  人物二,-1
TRAIN_SENT_ID_261448,,毛泽建,毛泽东,毛泽建 （ 1905 - 1929 ） ， 革命烈士 ， 毛泽东 堂妹 。,人物一       革命烈士  人物二 堂妹,-1
TRAIN_SENT_ID_252807,,颜回,孔子,大成殿 是 供奉 孔子 的 大殿 ， 正中 供祀 孔子像 ， 两侧 配祀 颜回 、 曾 参 、 孟轲 等 十二 哲像 。,大成殿 供奉 人物二 大殿  正中 供祀 人物二像  两侧 配祀 人物一  参  孟轲 十二 哲像,1
TRAIN_SENT_ID_252740,,颜回,孔子,殿内 供奉 有文 宣公 ( 孔子 ) 、 邹 国公 ( 孟子 ) 、 兖 国公 ( 颜回 ) 三像 。,殿内 供奉 有文 宣公  人物二   邹 国公  孟子   兖 国公  人物一  三像,1
TRAIN_SENT_ID_261573,,南宫敬叔,孟懿子,前 518 年 ， 孟僖子 临终 之前 ， 让 孟懿子 、 南宫敬叔 都 要 将 孔子 作为 老师 。,前  年  孟僖子 临终 之前  人物二  人物一 孔子 老师,-1
TRAIN_SENT_ID_279414,,王学明,龙俊杰,王学明 、 龙俊杰 、 范益松 、 周艳霞,人物一  人物二  范益松  周艳霞,-1
TRAIN_SENT_ID_252638,,颜回,孔子,唐开元 二十七 （ 739 ） 年 ， 诏 颜回 列 孔子 左侧 配享 后 ， 即升 曾 参入 “ 十哲 ” 。,唐开元 二十七    年  诏 人物一 列 人物二 左侧 配享  即升 参入  十哲,-1
TRAIN_SENT_ID_261442,,毛泽建,毛泽东,毛泽东 撰联 鼓励 堂妹 毛泽建,人物二 撰联 鼓励 堂妹 人物一,-1
TRAIN_SENT_ID_272359,,文殊广法天尊,金吒,王魔 追赶 逃亡 的 姜子牙 到 五龙山 云霄 洞 ， 被 文殊广法天尊 、 金吒 师徒 所杀 。,王魔 追赶 逃亡 姜子牙 五龙山 云霄 洞  人物一  人物二 师徒 所杀,1
TRAIN_SENT_ID_249054,,吕洞宾,韩湘子,汉族 民间 则 专以汉 钟离 、 张果老 、 铁拐李 、 韩湘子 、 曹国舅 、 吕洞宾 、 蓝采和 、 何仙姑 等 八仙 为 “ 八洞 神仙 ” 。,汉族 民间 专以汉 钟离  张果老  铁拐李  人物二  曹国舅  人物一  蓝采和  何仙姑 八仙  八洞 神仙,1
TRAIN_SENT_ID_260694,,王重阳,全真七子,东游 至 山东 ， 王重阳 收 马丹阳 、 孙不二 ， 王玉 阳 、 丘 长春 ， 谭长真 ， 刘长生 、 郝 太古 等 人为 徒 ， 后称 “ 全真七子 ” 。,东游 山东  人物一 收 马丹阳  孙不二  王玉 阳  丘 长春  谭长真  刘长生  郝 太古 人为 徒  后称  人物二,1
TRAIN_SENT_ID_252968,,颜回,孔子,颜回 随 孔子 在 陈 、 蔡 期间 绝粮 七天 ， 子贡 费 了 许多 周折 才 买 回 一石米 。,人物一 人物二 陈  蔡 期间 绝粮 七天  子贡 费 周折 买 回 一石米,1
TRAIN_SENT_ID_255301,,卫夫人,王羲之,王羲之 留下 的 书法 论文 有 《 题 卫夫人 ( 笔阵 图 ) 后 》 、 《 书论 》 、 《 笔势 论 十二章 》 、 《 用笔 赋 》 、 《 记 白云 先生 书诀 》 等 。,人物二 留下 书法 论文  题 人物一  笔阵 图     书论    笔势 十二章    用笔 赋    记 白云 先生 书诀,1
TRAIN_SENT_ID_252449,,颜回,孔子,颜回 偷食 原文 : 孔子 穷乎 陈 、 蔡 之间 ， 藜 羹 不 斟 ， 七日 不尝粒 ， 昼寝 。,人物一 偷食 原文  人物二 穷乎 陈  蔡 之间  藜 羹 斟  七日 不尝粒  昼寝,1
TRAIN_SENT_ID_265564,,张崇基,张崇德,元气 爆发 （ 6 月 22 日 ） （ 主题曲 ： 元气 爆发 主唱 ： 张崇基 、 张崇德 ） 闪电 传真机 1996 年 : 伙头 爸 B （ 7 月 8 日 ）,元气 爆发   月  日   主题曲  元气 爆发 主唱  人物一  人物二  闪电 传真机  年  伙头 爸    月  日,-1
TRAIN_SENT_ID_251423,,李瀚章,李鸿章,李瀚章 （ 右 ） 与其 弟 李鸿章,人物一  右  弟 人物二,-1
TRAIN_SENT_ID_269361,,王中军,王中磊,血色 谍恋 幕后 制作 : 出品人 ： 王中军 王中磊,血色 谍恋 幕后 制作  出品人  人物一 人物二,-1
TRAIN_SENT_ID_250719,,鲁西西,皮皮鲁,2005 年 ， 郑渊洁 的 儿子 郑亚旗 创办 《 皮皮鲁 》 漫画 杂志 ， 让 皮皮鲁 、 鲁西西 等 卡通人物 形象 再次 风靡 全国 。,年  郑渊洁 儿子 郑亚旗 创办  人物二  漫画 杂志  人物二  人物一 卡通人物 形象 再次 风靡 全国,-1
TRAIN_SENT_ID_282145,,苏曼莎,令狐伤,【 古风 BG 剧情 歌 】 《 相思 为题 》 记 令狐伤 苏曼莎 / / 念白 - 令狐伤 ： 风华 无双,古风  剧情 歌   相思 为题  记 人物二 人物一   念白  人物二  风华 无双,-1
TRAIN_SENT_ID_251542,,楚碧痕,楚寒镜,96 双胞胎 楚寒镜 楚碧痕,双胞胎 人物二 人物一,-1
TRAIN_SENT_ID_249141,,皮皮鲁,鲁西西,与 皮皮鲁 鲁西西 一起 长 大门 / 197,人物一 人物二 一起 长 大门,-1
TRAIN_SENT_ID_252789,,颜回,孔子,儒家 四圣 ： 至圣 孔子 ， 复圣 颜回 ， 宗圣曾子 ， 亚圣孟子 ；,儒家 四圣  至圣 人物二  复圣 人物一  宗圣曾子  亚圣孟子,1
TRAIN_SENT_ID_249560,,李蔡,李广,李广 的 堂弟 李蔡 ， 也 被 任为 中 郎 。,人物二 堂弟 人物一  任为 中 郎,1
TRAIN_SENT_ID_274068,,南宫敬叔,孔子,孔子 和 南宫敬叔 扬鞭 启程 ， 踏上 了 观周 之路 。,人物二 人物一 扬鞭 启程  踏上 观周 之路,-1
TRAIN_SENT_ID_252643,,颜回,孔子,孔子 对 曰 ： “ 夫其 所以 为 颜回 者 ， 此 之类 也 ， 岂足 多 哉 ？ ”,人物二 曰   夫其 人物一   岂足,1
TRAIN_SENT_ID_257549,,毛泽民,毛泽东,毛宁科 ， 毛泽民 （ 毛泽东 大 弟 ） 的 长孙 ， 也 就是 毛泽东 的 侄孙 。,毛宁科  人物一  人物二 弟  长孙  人物二 侄孙,-1
TRAIN_SENT_ID_268460,,单联全,冯一非,编剧 ： 冯一非 、 单联全,编剧  人物二  人物一,-1
TRAIN_SENT_ID_276999,,樊迟,孔子,敬鬼神而远之 成语 出处 : 春秋 · 鲁 · 孔子 《 论语 · 雍 也 》 ： 樊迟 问知 ， 子 曰 ： “ 务民之义 ， 敬鬼神而远之 ， 可谓 知矣 。 ”,敬鬼神而远之 成语 出处  春秋  鲁  人物二  论语  雍   人物一 问知  子 曰   务民之义  敬鬼神而远之  可谓 知矣,1
TRAIN_SENT_ID_260725,,王重阳,全真七子,吕 祖传 道 于 王重阳 — — 马丹阳 等 “ 全真七子 ” 一脉相承 ， 是 为 北宗 也 。,吕 祖传 道 人物一   马丹阳  人物二  一脉相承  北宗,1
TRAIN_SENT_ID_255356,,贾午,贾南风,257 年 ， 与 贾充 结婚 ， 生 贾南风 、 贾午 二女 。,年  贾充 结婚  生 人物二  人物一 二女,-1
TRAIN_SENT_ID_256834,,孙周,孙淳,孙周 、 孙淳 ( 上 ）,人物一  人物二,-1
TRAIN_SENT_ID_254272,,张顺,张横,与 梁山 军 交战 中 被 张横 一 朴刀 砍翻 ， 张顺 赶上去 剁 下头 。,梁山 军 交战 中 人物二 朴刀 砍翻  人物一 赶上去 剁 下头,1
TRAIN_SENT_ID_265433,,薛谭,秦青,第十一部分 : 原文 : 薛谭 学 讴于 秦青 ① ， 未穷 青之技 ， 自谓 尽 之 ， 遂 辞 归 。,第十一部分  原文  人物一 学 讴于 人物二 ①  未穷 青之技  自谓  遂 辞,1
TRAIN_SENT_ID_273668,,姜子牙,元始天尊,真武 封神 封神 场景 : 元始天尊 命 姜子牙 在 岐山 修建 ， 上 张挂 封神榜 。,真武 封神 封神 场景  人物二 命 人物一 岐山 修建  张挂 封神榜,1
TRAIN_SENT_ID_249541,,李蔡,李广,’ 秦时 郿 白起 ， 频阳 王翦 ； 汉兴 ， 义渠 公孙贺 、 傅介子 ， 成纪 李广 、 李蔡 ， 上 邽 赵充国 ， 狄道 辛武贤 ： 皆 名将 也 。,秦时 郿 白起  频阳 王翦  汉兴  义渠 公孙贺  傅介子  成纪 人物二  人物一  邽 赵充国  狄道 辛武贤  皆 名将,1
TRAIN_SENT_ID_271518,,孟优,孟获,孟获 殿 正殿 塑有 孟获 、 孟优 、 摩铁 三尊 神像 。,人物二 殿 正殿 塑有 人物二  人物一  摩铁 三尊 神像,1
TRAIN_SENT_ID_259791,,李偲菘,李伟菘,作曲 人 : 李伟菘 李偲菘 纪利 男 随安 苏恒 RickyHo,作曲  人物二 人物一 纪利 男 随安 苏恒,-1
TRAIN_SENT_ID_274318,,李迥,华阳公主,独孤 氏以 美丽 得幸 ， 九载 生韩王 李迥 ， 后生 华阳公主 。,独孤 氏以 美丽 得幸  九载 生韩王 人物一  后生 人物二,-1
TRAIN_SENT_ID_251599,,穆春,穆弘,土豪 恶霸 穆弘 穆春,土豪 恶霸 人物二 人物一,-1
TRAIN_SENT_ID_271220,,和硕温恪公主,和硕敦恪公主,胤 祥 胞妹 : 十三 格格 和硕温恪公主 （ 1687 年 ~ 1709 年 ） 和 十五 格格 和硕敦恪公主 （ 1691 年 ~ 1709 年 ） 。,胤 祥 胞妹  十三 格格 人物一   年   年  十五 格格 人物二   年   年,-1
TRAIN_SENT_ID_261684,,程英,陆无双,表姐 （ 陆无双 专用 ） 柴蔚版 程英 ( 6 张 ),表姐  人物二 专用  柴蔚版 人物一   张,-1
TRAIN_SENT_ID_274281,,梅小青,梅小惠,"《 满堂红 》 （ 曾伟权 ， 蔡倩儿 , 潘铣 怡 ， 杨得时 , 梅小惠 ） 梅小青 监制",满堂红   曾伟权  蔡倩儿  潘铣 怡  杨得时  人物二  人物一 监制,-1
TRAIN_SENT_ID_261591,,宋小宝,赵本山,《 那年 有匪 》 是 一部 赵本山 、 宋小宝 主演 的 电视剧 ， 2014 年 首播 。,那年 有匪  一部 人物二  人物一 主演 电视剧   年 首播,-1
TRAIN_SENT_ID_255360,,贾午,贾南风,同日 逮捕 贾午 、 赵粲 等 贾南风 党羽 ， 送至 暴室 杖 毙 。,同日 逮捕 人物一  赵粲 人物二 党羽  送至 暴室 杖 毙,1
TRAIN_SENT_ID_274508,,曾江,林翠,林翠 原名 曾懿 ， 1936 年 出生 广东 中山 ， 香港电影 红星 ， 著名 粤语 演员 曾江 之 胞妹 。,人物二 原名 曾懿   年 出生 广东 中山  香港电影 红星  著名 粤语 演员 人物一 胞妹,-1
TRAIN_SENT_ID_257509,,姜昆,马季,主持人 ： 王景愚 、 刘晓庆 、 姜昆 、 马季,主持人  王景愚  刘晓庆  人物一  人物二,-1
TRAIN_SENT_ID_263546,,林逸,杨明,校花 的 贴身 高手 杨明 : 林逸 的 师父 ， 前作 《 很纯 很 暧昧 》 的 主角 。,校花 贴身 高手 人物二  人物一 师父  前作  很纯 暧昧  主角,1
TRAIN_SENT_ID_261167,,王缙,王维,二公 名望 ， 首冠 一时 ， 时 议论 诗则 曰 王维 、 崔颢 ， 论笔 则 曰 王缙 、 李邕 。,二公 名望  首冠 一时  时 议论 诗则 曰 人物二  崔颢  论笔 曰 人物一  李邕,1
TRAIN_SENT_ID_274062,,南宫敬叔,孔子,孟懿子 基本 信息 : 鲁昭公 二十四年 （ 前 518 年 ） ， 孟僖子 临终 之前 ， 让 孟懿子 、 南宫敬叔 都 要 将 孔子 作为 老师 。,孟懿子 基本 信息  鲁昭公 二十四年  前  年   孟僖子 临终 之前  孟懿子  人物一 人物二 老师,-1
TRAIN_SENT_ID_279134,,范长利,朱绍文,朱绍文 ― ― 春长隆 、 冯昆治 、 范长利 、 桂祯 、 徐长福 、 沈竹善,人物二 ― ― 春长隆  冯昆治  人物一  桂祯  徐长福  沈竹善,1
TRAIN_SENT_ID_249255,,皮皮鲁,鲁西西,在 皮皮鲁 诞生 之后 ， 和 皮皮鲁 相对 的 鲁西西 也 随之 诞生 了 。,人物一 诞生 之后  人物一 相对 人物二 随之 诞生,-1
TRAIN_SENT_ID_252697,,颜回,孔子,"他 一身 静气 、 湛然 似 水 , 不动 如山 、 从容 自 在 , 他 是 孔子 最 得意 的 门生 - 颜回 。",一身 静气  湛然 似 水  不动 如山  从容  人物二 得意 门生  人物一,1
TRAIN_SENT_ID_282812,,陈俊凌,陈克忠,学大架 的 跟 陈照丕 ， 学小架 的 挑 了 陈伯祥 、 陈俊凌 、 陈启 亮 ， 跟着 陈克忠 学 。,学大架 陈照丕  学小架 挑 陈伯祥  人物一  陈启 亮  跟着 人物二 学,1
TRAIN_SENT_ID_252617,,颜回,孔子,孔子 不疑 颜回 之廉信,人物二 不疑 人物一 之廉信,-1
TRAIN_SENT_ID_272687,,蓝兰,张晓,2013 年 ： 《 步步 惊情 》 饰 张晓 / 蓝兰,年   步步 惊情  饰 人物二  人物一,-1
TRAIN_SENT_ID_255344,,沈东篱,沈南枝,沈东篱 与 沈南枝 正 额头 抵着 额头 ， 笑 得 一脸 阳光 。,人物一 人物二 正 额头 抵着 额头  笑 一脸 阳光,1
TRAIN_SENT_ID_284556,,陈莉莉,陈勇军,陈莉莉 原名 陈勇军 ， 1980 年 1 月 8 日 生于 四川省 南充市 的 仪陇县 一个 农民 家庭 。,人物一 原名 人物二   年  月  日 生于 四川省 南充市 仪陇县 一个 农民 家庭,-1
TRAIN_SENT_ID_263544,,林逸,杨明,杨明 林逸 的 师父 ， 《 很纯 很 暧昧 》 的 主角 。,人物二 人物一 师父   很纯 暧昧  主角,1
TRAIN_SENT_ID_268461,,单联全,冯一非,随后 ， 冯一非 与 单联全 推出 的 《 我 的 老爹 》 。,人物二 人物一 推出  老爹,-1
TRAIN_SENT_ID_255302,,卫夫人,王羲之,其 行书 妙处 ， 颇 得 王羲之 法 ， 少 加以 学 ， 亦 卫夫人 之流 也 。,行书 妙处  颇 人物二 法  少 学  人物一 之流,1
TRAIN_SENT_ID_273375,,杨锐,张之洞,1895 （ 光绪 二十一年 ） ， 两江 总督 张之洞 与 杨锐 游览 鸡鸣寺 ， 纵论 诸子百家 ， 指点 时蔽 。,光绪 二十一年   两江 总督 人物二 人物一 游览 鸡鸣寺  纵论 诸子百家  指点 时蔽,-1
TRAIN_SENT_ID_264949,,云中子,雷震子,云中子 在 洞 中传 的 雷震子 精熟 ， 随将 雷震子 二翅 左边 用 一 “ 风 ” 字 ， 右边 用 一 “ 雷 ” 字 ， 又 将 咒语 诵 了 一遍 。,人物一 洞 中传 人物二 精熟  随将 人物二 二翅 左边  风  字  右边  雷  字  咒语 诵 一遍,1
TRAIN_SENT_ID_263339,,蔡夫人,蔡瑁,4 、 明 罗贯中 《 三国演义 》 第三十四回 《 蔡夫人 隔屏 听 密语 刘皇叔 跃马 过檀溪 》 蔡瑁 已 引军 赶到 溪边 ， 大叫 ： “ 使君 何故 逃席 而 去 ？ ”,明 罗贯中  三国演义  第三十四回  人物一 隔屏 听 密语 刘皇叔 跃马 过檀溪  人物二 引军 赶到 溪边  大叫   使君 何故 逃席,1
TRAIN_SENT_ID_252927,,颜回,孔子,④ 对 先师 先圣 的 祭祀 : 汉魏 以后 ， 以 周公为 先圣 ， 孔子 为 先师 ; 唐代 尊 孔子 为 先圣 ， 颜回 为 先师 。,④ 先师 先圣 祭祀  汉魏 以后  周公为 先圣  人物二 先师  唐代 尊 人物二 先圣  人物一 先师,1
TRAIN_SENT_ID_277688,,平阳君,赵惠文王,赵惠文王 二十七年 （ 前 272 年 ） ， 赵惠文王 封 赵豹 为 平阳君 。,人物二 二十七年  前  年   人物二 封 赵豹 人物一,-1
TRAIN_SENT_ID_262219,,尤二姐,尤三姐,统治者 二十几 人 （ 有人 算了 说 是 三十几 人 ） ， 其他 都 是 奴隶 ， 三百多个 ， 鸳鸯 、 司棋 、 尤二姐 、 尤三姐 等等 。,统治者 二十几  有人 算了 说 三十几   奴隶  三百多个  鸳鸯  司棋  人物一  人物二,1
TRAIN_SENT_ID_281648,,黄铁良,侯宝林,师父 ： 侯宝林 师爷 ： 朱阔泉 师兄 ： 黄铁良 、 马季 、 殷培田 、 丁广泉 、 师胜杰 等 。,师父  人物二 师爷  朱阔泉 师兄  人物一  马季  殷培田  丁广泉  师胜杰,1
TRAIN_SENT_ID_259360,,葛玄,左慈,葛洪 《 抱朴子 · 金丹 篇 》 载 “ 左慈 是 葛玄 之师 ， 传其 《 太清丹经 》 三卷 ， 及 《 九鼎 丹经 》 、 《 金液 丹经 》 各 一卷 。 ”,葛洪  抱朴子  金丹 篇  载  人物二 人物一 之师  传其  太清丹经  三卷   九鼎 丹经    金液 丹经  一卷,1
TRAIN_SENT_ID_253110,,颜回,孔子,第 07 节晕 ， 颜回 是 孔子 的 娈童 ！,节晕  人物一 人物二 娈童,-1
TRAIN_SENT_ID_255280,,卫夫人,王羲之,二 、 玄 的 心灵 状态 ： 卫夫人 、 王羲之 书论,二  玄 心灵 状态  人物一  人物二 书论,-1
TRAIN_SENT_ID_279419,,李炎华,李星华,李炎华 李炎华 之 姊 李星华 : 李大钊 还有 长女 李星华 ， 1911 年 11 月 出 生于 乐亭县 大黑 坨 村 ， 与 母亲 赵纫兰 生活 在 一起 。,人物一 人物一 姊 人物二  李大钊 长女 人物二   年  月 出 生于 乐亭县 大黑 坨 村  母亲 赵纫兰 生活 一起,-1
TRAIN_SENT_ID_253823,,赵合德,赵飞燕,基本 信息 : 汉 赵飞燕 妹合德 ， 为 薄眉 ， 号 “ 远山 黛 ” ， 见伶玄 《 赵飞燕 外传 》 赵合德 。,基本 信息  汉 人物二 妹合德  薄眉  号  远山 黛   见伶玄  人物二 外传  人物一,1
TRAIN_SENT_ID_273685,,姜子牙,元始天尊,纣王 ， 断送 商汤 江山 ， 元始天尊 派 姜子牙 兴周 灭商 主持 封神榜 。,纣王  断送 商汤 江山  人物二 派 人物一 兴周 灭商 主持 封神榜,1
TRAIN_SENT_ID_255389,,罗成,秦琼,于是 ， 秦琼 、 罗成 、 敬德 和 程咬金 翻身 上马 ， 追赶 而 去 。,人物二  人物一  敬德 程咬金 翻身 上马  追赶,1
TRAIN_SENT_ID_273131,,包道乙,郑彪,方腊 派出 “ 灵应 天师 ” 包道乙 和 他 的 徒弟 “ 郑魔君 ” 郑彪 ， 以及 猎户 出身 的 将领 夏侯成 去 救应 。,方腊 派出  灵应 天师  人物一 徒弟  郑魔君  人物二  猎户 出身 将领 夏侯成 救应,1
TRAIN_SENT_ID_250339,,赵飞燕,赵合德,美轮美奂 两 芙蓉 — — 赵飞燕 赵合德,美轮美奂 两 芙蓉   人物一 人物二,-1
TRAIN_SENT_ID_260579,,金敬姬,金正日,朝鲜人民军 最高 司令官 金正日 27 日 下达 第 0051 号 命令 ， 任命 金敬姬 、 金正恩 、 崔龙海 等 6 人为 大将 。,朝鲜人民军 最高 司令官 人物二  日 下达  号 命令  任命 人物一  金正恩  崔龙海  人为 大将,-1
TRAIN_SENT_ID_255408,,罗成,秦琼,秦琼 和 程咬金 对 他 来说 ， 根本 比不上 罗成 的 “ 义 ” 重要 。,人物二 程咬金  根本 比不上 人物一  义  重要,1
TRAIN_SENT_ID_266722,,龙幽,龙溟,夜叉 族 摄政王 ， 龙溟 、 龙幽 的 舅舅 。,夜叉 族 摄政王  人物二  人物一 舅舅,-1
TRAIN_SENT_ID_257035,,洪敬尧,洪荣宏,洪荣宏 ， 洪敬尧 ， 洪荣 良,人物二  人物一  洪荣 良,-1
TRAIN_SENT_ID_274169,,平和岛静雄,平和岛幽,岸田隆宏绘 角色 人设 图 （ 平和岛静雄 、 平和岛幽 、 圣边 琉璃 、 马克斯 · 桑德谢 尔特 、 田中汤姆 ）,岸田隆宏绘 角色 人设 图  人物一  人物二  圣边 琉璃  马克斯  桑德谢 尔特  田中汤姆,1
TRAIN_SENT_ID_273662,,姜子牙,元始天尊,（ 《 封神演义 》 中 人物 ） : 玉鼎 真人 ， 《 封神演义 》 中玉鼎 真人 为 玉虚宫 元始天尊 门下 ， 姜子牙 的 同门 师兄 ， 为 阐教 “ 十二 金仙 ” 之一 。,封神演义  中 人物   玉鼎 真人   封神演义  中玉鼎 真人 玉虚宫 人物二 门下  人物一 同门 师兄  阐教  十二 金仙,1
TRAIN_SENT_ID_248976,,吕洞宾,韩湘子,一日 ， 游经 城北 玉屏 峰 ， 见 韩湘子 、 吕洞宾 、 张果老 等 八仙 从 东边 天际 乘 祥云 飘然而至 ， 坐在 石莲 峰山 上 吹拉弹唱 。,一日  游经 城北 玉屏 峰  见 人物二  人物一  张果老 八仙 东边 天际 祥云 飘然而至  坐在 石莲 峰山 吹拉弹唱,1
TRAIN_SENT_ID_268906,,司徒静,司徒剑南,朱允 闻听 很 不快 ， 他 亲往 司徒府 看 司徒静 和 司徒剑南 。,朱允 闻听 不快  亲往 司徒府 人物一 人物二,-1
TRAIN_SENT_ID_275677,,周厚安,周厚恩,育有 一男一女 ， 分别 是 周厚安 和 周厚恩 ， 。,育有 一男一女  人物一 人物二,-1
TRAIN_SENT_ID_264223,,陈真,霍元甲,在 梁小龙 版 《 陈真 》 中 ， 霍元甲 遇害 ， 赵倩 男 早逝 ， 陈真 收养 了 他们 的 孤儿 霍东觉 ， 带 着 东觉 浪迹江湖 。,梁小龙 版  人物一  中  人物二 遇害  赵倩 男 早逝  人物一 收养 孤儿 霍东觉  带 东觉 浪迹江湖,-1
TRAIN_SENT_ID_277577,,袁承志,穆人清,天外 飞龙 线 雁门关 袁承志 单挑 穆人清 天外 飞龙 1 级,天外 飞龙 线 雁门关 人物一 单挑 人物二 天外 飞龙  级,1
TRAIN_SENT_ID_251903,,曹薰铉,李昌镐,李昌镐 执黑 7 目半胜 曹薰铉,人物二 执黑  目半胜 人物一,-1
TRAIN_SENT_ID_252384,,颜回,孔子,皇太子 以 太牢 祀 孔子 ， 以 颜回 配享,皇太子 太牢 祀 人物二  人物一 配享,1
TRAIN_SENT_ID_265408,,薛谭,秦青,薜 谭学 讴 原文 : 薛谭 学 讴于 秦青 ， 未穷 青之技 ， 自谓 尽 之 ， 遂 辞 归 。,薜 谭学 讴 原文  人物一 学 讴于 人物二  未穷 青之技  自谓  遂 辞,1
TRAIN_SENT_ID_282928,,钱永真,钱永刚,那年 ， 钱永刚 7 岁 ， 钱永真 5 岁 。,那年  人物二  岁  人物一  岁,-1
TRAIN_SENT_ID_265562,,张崇基,张崇德,香港 版本 ： 龙珠 （ 主唱 ： 张崇基 张崇德 ）,香港 版本  龙珠  主唱  人物一 人物二,-1
