sent_id,sent_id,entity1,entity2,sent,processed_sent,label
TRAIN_SENT_ID_284358,,唐筼,陈寅恪,陈唐 结婚 甚晚 ， 于 1928 年 在 上海 结婚 ， 陈寅恪 时 年三十 有 八 ， 唐筼 亦 三十 。,陈唐 结婚 甚晚   年 上海 结婚  人物二 时 年三十 八  人物一 三十,1
TRAIN_SENT_ID_255128,,胡斐,胡一刀,红花 会 三 当家 赵半山 在 商家堡 路遇 胡一刀 遗孤 胡斐 ， 结为 忘年之交 。,红花 会 三 当家 赵半山 商家堡 路遇 人物二 遗孤 人物一  结为 忘年之交,-1
TRAIN_SENT_ID_271129,,彭丽媛,习近平,会见 前 ， 习近平 和 夫人 彭丽媛 在 卡莫 纳 总统 夫妇 陪同 下 ， 专门 会见 了 特多 中学生 代表 。,会见 前  人物二 夫人 人物一 卡莫 纳 总统 夫妇 陪同  专门 会见 特多 中学生 代表,1
TRAIN_SENT_ID_264790,,张欣,潘石屹,潘石屹 的 太太 、 SOHO 中国 CEO 张欣 发表 微博称 ， “ 王总 恋爱 了 ， 网上 一大堆 为 我 操心 的 网友 ， 让 我 一定 管好 老潘 。,人物二 太太   中国  人物一 发表 微博称   王总 恋爱  网上 一大堆 操心 网友  一定 管好 老潘,1
TRAIN_SENT_ID_286881,,陈珊珊,王光亚,王光亚 1975 年 回国 ， 1 年 多 后 ， 陈珊珊 的 3 个 哥哥 凑钱 为 最小 的 妹妹 张罗 了 婚礼 。,人物二  年 回国   年  人物一  哥哥 凑钱 最小 妹妹 张罗 婚礼,1
TRAIN_SENT_ID_271320,,何泽慧,钱三强,与 钱三强 结婚 后 ， 已 在 德国 做过 两年 核物理 研究 的 何泽慧 顺利 进入 巴黎大学 居里 实验室 ， 与 钱三强 成为 同事 。,人物二 结婚  德国 做过 两年 核物理 研究 人物一 顺利 进入 巴黎大学 居里 实验室  人物二 成为 同事,1
TRAIN_SENT_ID_283235,,鲍喜顺,夏淑娟,鲍喜顺 结婚 : 2007 年 7 月 12 日 ， 鲍喜顺 和 身高 1.68 米 的 夏淑娟 在 成吉思汗 陵 旅游区 天骄 大营 结婚 。,人物一 结婚   年  月  日  人物一 身高  米 人物二 成吉思汗 陵 旅游区 天骄 大营 结婚,1
TRAIN_SENT_ID_255612,,蒋介石,宋美龄,朱韵 珩 与 宋美龄 的 “ 太太 路线 ” 是 双向 的 ， 不但 朱韵 珩 利用 这个 关系 帮助 丈夫 接近 蒋介石 ， 宋美龄 也 以此 帮助 蒋介石 笼络 人才 。,朱韵 珩 人物二  太太 路线  双向  朱韵 珩 利用 关系 帮助 丈夫 接近 人物一  人物二 以此 帮助 人物一 笼络 人才,1
TRAIN_SENT_ID_281575,,赵雅倩,赵鑫鑫,赵鑫鑫 新婚 : 7 月 10 日 ， 24 岁 的 象棋 世界冠军 赵鑫鑫 在 家乡 浙江 温岭 登记 结婚 ， 新娘 是 天津 棋手 赵雅倩 。,人物二 新婚   月  日   岁 象棋 世界冠军 人物二 家乡 浙江 温岭 登记 结婚  新娘 天津 棋手 人物一,1
TRAIN_SENT_ID_261107,,胡一刀,胡斐,人物形象 : 《 雪山飞狐 》 主要 写 胡斐 与 苗人凤 和 胡一刀 夫妇 的 江湖 恩仇 。,人物形象   雪山飞狐  主要 写 人物二 苗人凤 人物一 夫妇 江湖 恩仇,-1
TRAIN_SENT_ID_252303,,文姜,鲁桓公,鲁桓公 觉得 没 必要 推托 ， 妻子 自 出嫁 离家 已经 十几年 了 ， 一直 还 没有 回娘家 ， 于是 就 偕同 文姜 ， 大张旗鼓 地 前往 齐 都 临淄 访问 。,人物二 觉得 没 必要 推托  妻子 出嫁 离家 已经 十几年  一直 没有 回娘家  偕同 人物一  大张旗鼓 前往 齐 临淄 访问,1
TRAIN_SENT_ID_286029,,蒋英,蒋百里,钱均夫 夫妇 希望 有个 女儿 ， 见 蒋百里 的 三 女儿 蒋英 长得 漂亮 ， 天真活泼 ， 便 恳求 蒋百里 夫妇 将 此 女 过继 给 他们 。,钱均夫 夫妇 希望 有个 女儿  见 人物二 三 女儿 人物一 长得 漂亮  天真活泼  便 恳求 人物二 夫妇 女 过继,-1
TRAIN_SENT_ID_265931,,杨绛,钱钟书,婚后 钱瑗 夫妇俩 的 婚姻生活 非常 幸福 ， 王德一 与 钱钟书 、 杨绛 夫妇 的 关系 也 非常 亲密 ， 杨绛 还 亲手 帮 王德一 理过 发 。,婚后 钱瑗 夫妇俩 婚姻生活 非常 幸福  王德一 人物二  人物一 夫妇 关系 非常 亲密  人物一 亲手 帮 王德一 理过 发,1
TRAIN_SENT_ID_284175,,水均益,杨迪,2010 年 ， 水均益 与 央视 体育频道 记者 杨迪 结婚 ， 水均益 比 杨迪 大 13 岁 。,年  人物一 央视 体育频道 记者 人物二 结婚  人物一 人物二  岁,1
TRAIN_SENT_ID_282065,,李度仑,李昌镐,婚礼 上 ， 李昌镐 和 李度仑 透露 ， 他们 将 去 日本 的 小松市 度过 新婚旅行 ， 时间 为 3 天 4 夜 。,婚礼  人物二 人物一 透露  日本 小松市 度过 新婚旅行  时间  天  夜,1
TRAIN_SENT_ID_284647,,李燃,郭涛,2014 年 1 月 15 日 ， 郭涛 携 妻子 李燃 、 儿子 郭子睿 出席 年度 网络 盛宴 “ 2013 新浪 微博之夜 ” 。,年  月  日  人物二 携 妻子 人物一  儿子 郭子睿 出席 年度 网络 盛宴   新浪 微博之夜,1
TRAIN_SENT_ID_284650,,李燃,郭涛,郭涛 个人 生活 : 2006 年 与 妻子 李燃 结婚 ， 2007 年 2 月 6 日 儿子 郭子睿 出生 ， 小名 ” 石头 “ 生活照 ( 10 张 ),人物二 个人 生活   年 妻子 人物一 结婚   年  月  日 儿子 郭子睿 出生  小名  石头  生活照   张,1
TRAIN_SENT_ID_282950,,王晓蓉,王中磊,补办 婚礼 : 2014 年 8 月 30 日 ， 娱乐圈 大佬 、 华谊 兄弟 总裁 王中磊 在 结婚 20 周年 纪念日 上 与 妻子 王晓蓉 补办 婚礼 。,补办 婚礼   年  月  日  娱乐圈 大佬  华谊 兄弟 总裁 人物二 结婚  周年 纪念日 妻子 人物一 补办 婚礼,1
TRAIN_SENT_ID_262136,,刘翔,葛天,2014 年 5 月 ， 葛天 与 刘翔 恋爱 ， 同年 9 月 8 日 ， 与 刘翔 在 上海市 民政局 婚姻登记 处 领取 了 结婚证 。,年  月  人物二 人物一 恋爱  同年  月  日  人物一 上海市 民政局 婚姻登记 处 领取 结婚证,1
TRAIN_SENT_ID_254102,,霍启刚,郭晶晶,霍启刚 举行 婚礼 : 2012 年 11 月 10 日 ， 霍启刚 和 郭晶晶 在 广州 南沙 举行 婚宴 。,人物一 举行 婚礼   年  月  日  人物一 人物二 广州 南沙 举行 婚宴,1
TRAIN_SENT_ID_286744,,孙国升,孙治强,2011 年 6 月 14 日 ， 上海市 侨办 副 主任 蔡建国 会见 了 孙中山 先生 的 孙媳妇 林伦 可 女士 ( 孙治强 夫人 ) 及其 子 孙国升 。,年  月  日  上海市 侨办 副 主任 蔡建国 会见 孙中山 先生 孙媳妇 林伦 女士  人物二 夫人  子 人物一,-1
TRAIN_SENT_ID_276620,,韩寒,金丽华,金丽华 韩寒 态度 : 2010 年 6 月 ， 韩寒 出席 某 活动 时 ， 曾 辟谣 过 一次 关于 “ 5 月 小 长假 结婚 ” 的 传闻 。,人物二 人物一 态度   年  月  人物一 出席 活动 时  辟谣 一次   月 长假 结婚  传闻,1
TRAIN_SENT_ID_265048,,李铭顺,范文芳,范文芳 个人 生活 : 2009 年 9 月 范文芳 与 演员 李铭顺 在 新加坡 香格里拉酒店 举行 婚礼 ； 2014 年 3 月 正式 宣布 怀孕 。,人物二 个人 生活   年  月 人物二 演员 人物一 新加坡 香格里拉酒店 举行 婚礼   年  月 正式 宣布 怀孕,1
TRAIN_SENT_ID_274434,,仲满,武宗文,仲 明说 他 特别 想念 儿子 ， 他 还 透露 说 今年 9 月 19 日 ， 将 是 儿子 仲满 和 儿媳 武宗文 举办 婚礼 的 大 好日子 。,仲 明说 特别 想念 儿子  透露 说 今年  月  日  儿子 人物一 儿媳 人物二 举办 婚礼 好日子,1
TRAIN_SENT_ID_285501,,刘明轩,王傲山,刘明轩 ， 女 ， 35 岁 ， 于 2013 年 1 月 7 日 与 34 岁 金融 才俊 王傲山 结婚 ， 在 九 刘明轩 结婚 ( 5 张 ),人物一  女   岁   年  月  日  岁 金融 才俊 人物二 结婚  九 人物一 结婚   张,1
TRAIN_SENT_ID_272807,,谢烨,顾城,英儿 内容摘要 : 1993 年 10 月 8 日 ， 新西兰 激流 岛 ， 诗人 顾城 的 妻子 谢烨 死 于 顾城 之手 ， 而后 ， 顾城 自缢身亡 。,英儿 内容摘要   年  月  日  新西兰 激流 岛  诗人 人物二 妻子 人物一 死 人物二 之手   人物二 自缢身亡,1
TRAIN_SENT_ID_255852,,蒋介石,宋美龄,"蒋介石 与 宋美龄 结婚 前 , 在 上海 的 住所 大多 是 临时 的 , 到 了 1927 年 蒋介石 与 宋美龄 结婚 , 才 在 上海 真正 安置 了 一个 家 。",人物一 人物二 结婚 前  上海 住所 大多 临时   年 人物一 人物二 结婚  上海 真正 安置 一个 家,1
TRAIN_SENT_ID_262038,,李纨,贾兰,李纨 — — 金陵 十二钗 之 十一 ， 贾珠 遗孀 ， 生子 贾兰 。,人物一   金陵 十二钗 十一  贾珠 遗孀  生子 人物二,-1
TRAIN_SENT_ID_272924,,王岳伦,王诗龄,王岳伦 父女 （ 王岳伦 ： 天秤座 ； 王诗龄 ： 天秤座 ）,人物一 父女  人物一  天秤座  人物二  天秤座,-1
TRAIN_SENT_ID_261548,,关兴,关羽,关羽 = 简雍 + 关索 + 关兴 ( 2 ),人物二  简雍  关索  人物一,-1
TRAIN_SENT_ID_265142,,尤二姐,贾琏,邢夫人 为了 维护 丈夫 的 颜面 ， 大骂 贾琏 ， 实际上 是 指桑骂槐 ， 等于 痛骂 了 尤二姐 。,邢夫人 维护 丈夫 颜面  大骂 人物二  实际上 指桑骂槐  等于 痛骂 人物一,1
TRAIN_SENT_ID_270502,,关平,关羽,后来 于临 沮 小路 生擒 关羽 、 关平 。,后来 于临 沮 小路 生擒 人物二  人物一,-1
TRAIN_SENT_ID_281905,,穆亮,穆崇,穆亮 是 穆崇 的 曾孙 。,人物一 人物二 曾孙,-1
TRAIN_SENT_ID_260822,,何超琼,许晋亨,再 问 他 许晋亨 与 李嘉欣 结婚 ， 何超琼 心情 如何 ？,问 人物二 李嘉欣 结婚  人物一 心情,1
TRAIN_SENT_ID_272334,,金正恩,金正日,该 媒体 转述 称 ， 司令部 安保 人员 接 金正恩 命令 ， 到 金敬姬 家接 她 参加 金正日 两周年 追悼 活动 。,媒体 转述 称  司令部 安保 人员 接 人物一 命令  金敬姬 家接 参加 人物二 两周年 追悼 活动,-1
TRAIN_SENT_ID_259451,,贾兰,李纨,李纨 的 “ 晚 韶华 ” 与 贾兰 的 “ 虚名 儿,人物二  晚 韶华  人物一  虚名,-1
TRAIN_SENT_ID_284025,,胡青牛,王难姑,这 对 夫妻 ， 就是 胡青牛 和 王难姑 。,夫妻  人物一 人物二,1
TRAIN_SENT_ID_260064,,齐良迟,齐白石,另据 齐良迟 介绍 ， 由 北京画院 筹办 的 “ 北京 齐白石 现代 艺术 中心 ” 受到 北京市委 领导 的 重视 和 支持 ， 目前 正在 长安街 上 选址 。,另据 人物一 介绍  北京画院 筹办  北京 人物二 现代 艺术 中心  北京市委 领导 重视 支持  目前 正在 长安街 选址,-1
TRAIN_SENT_ID_283043,,公孙敬声,公孙贺,太仆 ： 灌夫 、 公孙贺 、 公孙敬声,太仆  灌夫  人物二  人物一,-1
TRAIN_SENT_ID_263486,,梅葆玖,梅兰芳,还 得到 了 梅葆玖 授权 ， 把 《 梅兰芳 》 ( 看 专业 影评 ) 改编 成 了 漫画版 。,得到 人物一 授权   人物二   专业 影评  改编 成 漫画版,-1
TRAIN_SENT_ID_273875,,江冬秀,胡适,订婚 后 ， 胡适 到 上海 读书 ， 留学 美国 ， 一去 十多年 ， 直到 1917 年 回家 结婚 ， 从未见过 江冬秀 一面 。,订婚  人物二 上海 读书  留学 美国  一去 十多年   年 回家 结婚  从未见过 人物一 一面,1
TRAIN_SENT_ID_285637,,高尧,刘春卉,高尧 、 刘春卉 大婚,人物一  人物二 大婚,1
TRAIN_SENT_ID_268468,,梁静慈,甄子丹,梁静慈 喜 得 贵子 : 婚后 ， 甄子丹 说服 梁静慈 辞职 在家 。,人物一 喜 贵子  婚后  人物二 说服 人物一 辞职 在家,1
TRAIN_SENT_ID_287131,,慕容柔,慕容垂,慕容柔 家庭成员 : 生父 ： 慕容垂 。,人物一 家庭成员  生父  人物二,-1
TRAIN_SENT_ID_258076,,周海婴,鲁迅,周海婴 回忆 : “ 王冶秋 关于 由 何林 先生 担任 鲁迅 研究室 主任 的 建议 ， 我 是 十分 赞同 的 。,人物一 回忆   王冶秋 何林 先生 担任 人物二 研究室 主任 建议  十分 赞同,-1
TRAIN_SENT_ID_282476,,宇文成都,宇文化及,后 十八家 反王讨 宇文化及 ， 宇文成都 被 李元霸 打败 。,十八家 反王讨 人物二  人物一 李元霸 打败,-1
TRAIN_SENT_ID_253920,,况天涯,马小玲,出现 个体 ： 况天涯 、 马小玲 。,出现 个体  人物一  人物二,-1
TRAIN_SENT_ID_255364,,蓝齐儿,容妃,后 蓝齐儿 回到 北京 容妃 宫 ， 见 宫里 破败 不堪 ， 察觉出 了 问题 。,人物一 回到 北京 人物二 宫  见 宫里 破败 不堪  察觉出 问题,-1
TRAIN_SENT_ID_262544,,扶苏,秦始皇,扶苏 的 劝谏 触怒 了 秦始皇 。,人物一 劝谏 触怒 人物二,-1
TRAIN_SENT_ID_260882,,贾珍,贾蓉,也 就是 在 第二十九回 清虚观 打醮 一节 ， 贾珍 因为 贾蓉 躲懒 而 收拾 他 的 一段 ：,第二十九回 清虚观 打醮 一节  人物一 人物二 躲懒 收拾 一段,-1
TRAIN_SENT_ID_253515,,祝彪,扈三娘,扈家庄 比武招亲 ， 扈三娘 与 祝家庄 祝彪 一见钟情 ， 定下 婚约 。,扈家庄 比武招亲  人物二 祝家庄 人物一 一见钟情  定下 婚约,1
TRAIN_SENT_ID_256089,,蒋介石,宋美龄,二 、 蒋介石 向 宋美龄 求婚 的 历程,二  人物一 人物二 求婚 历程,1
TRAIN_SENT_ID_260897,,贾珍,贾蓉,这 就 告诉 我们 ， 尤三姐 不止 与 贾珍 有私 ， 而且 与 贾蓉 的 关系 也 是 不干不净 的 。,告诉  尤三姐 不止 人物一 有私  人物二 关系 不干不净,-1
TRAIN_SENT_ID_278816,,任盈盈,任我行,出寺 后 与 任盈盈 相救 囚 于梅 庄 的 任我行 。,出寺 人物一 相救 囚 于梅 庄 人物二,-1
TRAIN_SENT_ID_270925,,贾午,韩寿,其女 贾午 为 韩寿 先 戏弄 后 婚娶 。,其女 人物一 人物二 先 戏弄 婚娶,1
TRAIN_SENT_ID_274198,,岳雷,岳飞,岳飞 遇害 后 ， 与 岳雷 等 流放 岑南 二十年 。,人物二 遇害  人物一 流放 岑南 二十年,-1
TRAIN_SENT_ID_271672,,陆乘风,陆冠英,关海山 （ 陆乘风 ） ， 惠天赐 （ 陆冠英 ）,关海山  人物一   惠天赐  人物二,-1
TRAIN_SENT_ID_249365,,后稷,姜嫄,姜嫄 是 后稷 的 生母 。,人物二 人物一 生母,-1
TRAIN_SENT_ID_262479,,扶苏,秦始皇,《 秦始皇 》 扮演 小 扶苏,人物二  扮演 人物一,-1
TRAIN_SENT_ID_256755,,邵昕,黄玉婷,黄玉婷 事件 : 日前 邵昕 召开 记者会 ， 会上 驳斥 前妻 婷婷 拿 孩子 来 炒作 ， 直言 这种 行为 很 可耻 。,人物二 事件  日前 人物一 召开 记者会  会上 驳斥 前妻 婷婷 孩子 炒作  直言 这种 行为 可耻,1
TRAIN_SENT_ID_248869,,窦滔,苏蕙,司 洛阳 花仙子 ： 苏蕙 （ 窦滔 妻 ） 墟 里 烟,司 洛阳 花仙子  人物二  人物一 妻  墟 里 烟,1
TRAIN_SENT_ID_258276,,陈建斌,蒋勤勤,7 、 陈建斌 和 蒋勤勤 的 麦穗 婚戒,人物一 人物二 麦穗 婚戒,1
TRAIN_SENT_ID_278269,,王珂,刘涛,夫妻感情 : 王珂 感恩 刘涛 ： 我 幸拥 你 才 又 见 人间,夫妻感情  人物一 感恩 人物二  幸拥 见 人间,1
TRAIN_SENT_ID_278227,,萧玉婉,郗徽,萧玉婉 ， 南梁 永世 公主 ， 梁武帝 萧衍 和 武德皇后 郗徽 的 次女 。,人物一  南梁 永世 公主  梁武帝 萧衍 武德皇后 人物二 次女,-1
TRAIN_SENT_ID_271632,,毛岸青,毛泽东,毛泽东 和 毛岸青 、 邵华 合影 。,人物二 人物一  邵华 合影,-1
TRAIN_SENT_ID_255857,,蒋介石,宋美龄,1943 年 与 蒋纬国 在 西安 常 宁宫 结为 连理 ， 由 蒋介石 、 宋美龄 主婚 。,年 蒋纬国 西安 常 宁宫 结为 连理  人物一  人物二 主婚,1
TRAIN_SENT_ID_283434,,张月亮,张铁林,（ 第六名 ） 张铁林 张月亮,第六名  人物二 人物一,-1
TRAIN_SENT_ID_271669,,陆乘风,陆冠英,曹达华 （ 陆乘风 ） ， 张鸿昌 （ 陆冠英 ）,曹达华  人物一   张鸿昌  人物二,-1
TRAIN_SENT_ID_256387,,李天一,李双江,在 谷歌 搜索 “ 李双江 、 歌唱家 ” 的 关键字 有近 万条 新闻 ， 而 再次 搜索 “ 李双江 、 李天一 ” 则 出现 60000 多条 新闻 。,谷歌 搜索  人物二  歌唱家  关键字 有近 万条 新闻  再次 搜索  人物二  人物一  出现  多条 新闻,-1
TRAIN_SENT_ID_254198,,邢夫人,贾赦,伯母 ： 邢夫人 （ 贾赦 填房 ）,伯母  人物一  人物二 填房,1
TRAIN_SENT_ID_272906,,夏祖丽,林海音,《 夏祖丽 动笔 写 《 林海音 传 》 》,人物一 动笔 写  人物二 传,-1
TRAIN_SENT_ID_283884,,王小平,郑晓龙,1992 年 夏天 郑晓龙 与 王小平 在 美国 完婚 。,年 夏天 人物二 人物一 美国 完婚,1
TRAIN_SENT_ID_279282,,傅洁娴,欧阳震华,傅洁娴 求婚 : 欧阳震华 给 了 老婆 足够 尊严 ， 直到现在 ， 老婆 都 视 他 为 偶像 。,人物一 求婚  人物二 老婆 足够 尊严  直到现在  老婆 视 偶像,1
TRAIN_SENT_ID_277773,,何超欣,梁安琪,何超欣 （ 梁安琪 所 出 ）,人物一  人物二 出,-1
TRAIN_SENT_ID_281484,,吕牧石,马慧先,马腾蛟 马慧先 : 马慧先 （ 1929 — — ） ， 吕牧石 之妻 。,马腾蛟 人物二  人物二       人物一 之妻,1
TRAIN_SENT_ID_285400,,郑俊浩,李河静,李河静 与 郑俊浩 婚纱照 ( 6 张 ),人物二 人物一 婚纱照   张,1
TRAIN_SENT_ID_258084,,周海婴,鲁迅,爷爷 周海婴 为 她 选择 了 离家 很近 的 鲁迅 中学 。,爷爷 人物一 选择 离家 很近 人物二 中学,-1
TRAIN_SENT_ID_255141,,胡斐,胡一刀,平阿四 ： 因感 胡一刀 救命之恩 ， 抚养 胡斐 长大 。,平阿四  因感 人物二 救命之恩  抚养 人物一 长大,-1
TRAIN_SENT_ID_279362,,陈衡哲,任鸿隽,任鸿隽 传播 科学 : 任鸿隽 、 陈衡哲 订婚 日 与 胡适 合影 （ 1920 年 ） ( 2 张 ),人物二 传播 科学  人物二  人物一 订婚 日 胡适 合影   年    张,1
TRAIN_SENT_ID_274992,,李林妲,李旻果,李旻果 李林妲 - 家庭成员 :,人物二 人物一  家庭成员,-1
TRAIN_SENT_ID_272589,,贾蓉,秦可卿,秦可卿 ， 金陵 十二钗 之一 ， 贾蓉 之妻 。,人物二  金陵 十二钗  人物一 之妻,1
TRAIN_SENT_ID_278112,,马世嫒,马景涛,如今 马世嫒 已经 出 落得 婷婷玉立 ， 2008 年 更是 考上 了 中戏 表演系 ， 这 让 马景涛 感到 很 骄傲 。,如今 人物一 已经 出 落得 婷婷玉立   年 更是 考上 中戏 表演系  人物二 感到 骄傲,-1
TRAIN_SENT_ID_259444,,贾兰,李纨,这里 指 李纨 因 贾兰 长大 后 做 了 官 而 得到 封诰 。,指 人物二 人物一 长大 做 官 得到 封诰,-1
TRAIN_SENT_ID_286257,,徐夫人,徐琨,娶 徐琨 女 （ 徐夫人 ） 。,娶 人物二 女  人物一,-1
TRAIN_SENT_ID_273882,,江冬秀,胡适,胡适 十几岁 时 就 与 江冬秀 订 了 婚 ， 但 到 美国 之后 ， 邂逅 了 才情 超逸 的 韦莲司 并 为 之 倾倒 ， 两人 的 半世 情缘 从此 启幕 ， 现在 已 不是 秘密 了 。,人物二 十几岁 时 人物一 订 婚  美国 之后  邂逅 才情 超逸 韦莲司 倾倒  两人 半世 情缘 启幕  现在 秘密,1
TRAIN_SENT_ID_274147,,汤国梨,章太炎,怀念 太炎 先生 作者简介 : 汤国梨 （ 1881 ~ 1980 ） ， 章太炎 夫人 ， 浙江 湖州人 。,怀念 太炎 先生 作者简介  人物一       人物二 夫人  浙江 湖州人,1
TRAIN_SENT_ID_276167,,苏蕙,窦滔,窦滔 的 妻子 苏蕙 曾 织锦 为 回文 寄给 他 ， 后 因以 指 情书 。,人物二 妻子 人物一 织锦 回文 寄给  因以 指 情书,1
TRAIN_SENT_ID_274133,,汤国梨,章太炎,章太炎 的 夫人 汤国梨 曾 回忆 黄侃 骗婚 黄绍兰 一事 ， 致其 一生 流离失所 ， 直斥 黄为 “ 无耻之尤 的 衣冠禽兽 ” ， “ 小 有才 适足 以济 其奸 ” 。,人物二 夫人 人物一 回忆 黄侃 骗婚 黄绍兰 一事  致其 一生 流离失所  直斥 黄为  无耻之尤 衣冠禽兽    有才 适足 以济 其奸,1
TRAIN_SENT_ID_271129,,彭丽媛,习近平,会见 前 ， 习近平 和 夫人 彭丽媛 在 卡莫 纳 总统 夫妇 陪同 下 ， 专门 会见 了 特多 中学生 代表 。,会见 前  人物二 夫人 人物一 卡莫 纳 总统 夫妇 陪同  专门 会见 特多 中学生 代表,1
TRAIN_SENT_ID_255854,,蒋介石,宋美龄,活佛 寺 位于 鸡公山 上 的 蒋介石 夫人 宋美龄 舞厅 的 南边 。,活佛 寺 位于 鸡公山 人物一 夫人 人物二 舞厅 南边,1
TRAIN_SENT_ID_275221,,丁力,冯程程,许文强 怀着 一颗 复仇 之心 回到 上海 ， 在 曾经的爱 人 冯程程 和 好 兄弟 丁力 的 婚礼 现场 ， 他 只身 闯入 。,许文强 怀着 一颗 复仇 之心 回到 上海  曾经的爱 人物二 兄弟 人物一 婚礼 现场  只身 闯入,1
TRAIN_SENT_ID_257002,,李嫣,王菲,大张伟 搭档 天后 王菲 爱女 李嫣 合唱 ， 完美 演绎 爱心 公益 主题 ， 传播 传递 善 与 爱 的 概念 。,大张伟 搭档 天后 人物二 爱女 人物一 合唱  完美 演绎 爱心 公益 主题  传播 传递 善 爱 概念,-1
TRAIN_SENT_ID_259000,,王熙凤,贾琏,简介 ： 王熙凤 是 贾琏 之妻 ， 王夫人 的 内侄女 。,简介  人物一 人物二 之妻  王夫人 内侄女,1
TRAIN_SENT_ID_275749,,郭靖,李萍,李萍 流落 蒙古 ， 生 下 郭靖 。,人物二 流落 蒙古  生 人物一,-1
TRAIN_SENT_ID_277946,,杨文昌,杨威,[ 3 - 4 ] 同年 5 月 杨文昌 和 父亲 杨威 参与 湖南卫视 大型 亲子 真人秀 节目 《 爸爸 去 哪儿 》 第二季 的 录制 ， 引发 众多 网友 关注 。,同年  月 人物一 父亲 人物二 参与 湖南卫视 大型 亲子 真人秀 节目  爸爸  第二季 录制  引发 众多 网友 关注,-1
TRAIN_SENT_ID_274118,,郭晓如,曾馨莹,曾馨莹 与 女儿 妞妞 （ 郭晓如 ） 穿 母女 装,人物二 女儿 妞妞  人物一  穿 母女 装,-1
TRAIN_SENT_ID_258977,,王熙凤,贾琏,王熙凤 - - - - 贾琏 之妻 ， 王夫人 的 内侄女 。,人物一     人物二 之妻  王夫人 内侄女,1
TRAIN_SENT_ID_283773,,李静民,姜昆,为了 参加 黑龙江省 曲艺 调演 ， 兵团 要 组织 曲艺 学习班 ， 师胜杰 幸运地 搭上 了 这 班车 ， 这个 学习班 里 还有 姜昆 和 其 夫人 李静民 。,参加 黑龙江省 曲艺 调演  兵团 组织 曲艺 学习班  师胜杰 幸运地 搭上 班车  学习班 里 人物二 夫人 人物一,1
TRAIN_SENT_ID_286699,,秋道蝶蝶,秋道丁次,第四次 忍界 大战 中 忍者 联军 第二 部队 队员 ， 在此期间 曾经 中 了 无限 月 读 ， 大战 结束 后 数年 后 嫁 与 秋道丁次 为妻 ， 生一 女儿 秋道蝶蝶 。,第四次 忍界 大战 中 忍者 联军 第二 部队 队员  在此期间 曾经 中 无限 月 读  大战 结束 数年 嫁 人物二 为妻  生一 女儿 人物一,-1
TRAIN_SENT_ID_256298,,孙尚香,刘备,孙尚香 在 镇江 甘露寺 招亲 ， 许配给 蜀主 刘备 ， 人称 孙夫人 。,人物一 镇江 甘露寺 招亲  许配给 蜀主 人物二  人称 孙夫人,1
TRAIN_SENT_ID_260090,,齐良迟,齐白石,齐良迟 先生 是 齐白石 四子 ， 他积 70 余载 孜孜以求 ， 在 诗 、 书 、 画 、 印等 方面 成就 显著 。,人物一 先生 人物二 四子  他积  余载 孜孜以求  诗  书  画  印等 方面 成就 显著,-1
TRAIN_SENT_ID_283539,,高炜晟,高天峰,高炜晟 的 姑父 说 ， 高炜晟 是 高天峰 夫妻 超生 的 。,人物一 姑父 说  人物一 人物二 夫妻 超生,-1
TRAIN_SENT_ID_249957,,张无忌,赵敏,这 应该 符合 赵敏 和 张无忌 结婚 后 孩子 的 教育 情况 。,应该 符合 人物二 人物一 结婚 孩子 教育 情况,1
TRAIN_SENT_ID_277380,,樊姬,楚庄王,"画 楚庄王 夫人 樊姬 为 劝阻 庄王 沉溺于 狩猎 而 不食 鲜禽 的 故事 。 """,画 人物二 夫人 人物一 劝阻 庄王 沉溺于 狩猎 不食 鲜禽 故事,1
TRAIN_SENT_ID_276165,,苏蕙,窦滔,或云起 自 窦滔 妻 苏蕙 ， 于锦 上 织成 文 ， 顺读 与 倒 读皆成 诗句 。,或云起 人物二 妻 人物一  于锦 织成 文  顺读 倒 读皆成 诗句,1
TRAIN_SENT_ID_286376,,谢姬,孙权,谢姬 ， 三国 东 吴大帝 孙权 的 夫人 。,人物一  三国 东 吴大帝 人物二 夫人,1
TRAIN_SENT_ID_261985,,王明华,梅兰芳,这 篇文章 说 ， 梅兰芳 除 原配 夫人 王明华 、 继室 福芝芳 和梅 孟恋 主角 孟小冬 以外 ， 还 追求 过 刘喜奎 。,篇文章 说  人物二 原配 夫人 人物一  继室 福芝芳 和梅 孟恋 主角 孟小冬 以外  追求 刘喜奎,1
TRAIN_SENT_ID_272498,,韦丛,元稹,《 遣 悲怀 三首 》 是 唐代 诗人 元稹 怀念 原配 妻子 韦丛 的 作品 。,遣 悲怀 三首  唐代 诗人 人物二 怀念 原配 妻子 人物一 作品,1
TRAIN_SENT_ID_276565,,孔子,亓官氏,此殿 在 大成殿 之后 ， 是 祭祀 孔子 夫人 亓官氏 的 地方 。,此殿 大成殿 之后  祭祀 人物一 夫人 人物二 地方,1
TRAIN_SENT_ID_255871,,蒋介石,宋美龄,蒋介石 和 宋美龄 结婚 ， 谭延闿 为 介绍 人 。,人物一 人物二 结婚  谭延闿 介绍,1
TRAIN_SENT_ID_251403,,李安琪,李小鹏,（ 体操 世界冠军 李小鹏 妻子 ） : 李安琪 ， 1987 年出 生于 美国 。,体操 世界冠军 人物二 妻子   人物一   年出 生于 美国,1
TRAIN_SENT_ID_262006,,王明华,梅兰芳,梅兰芳 发妻 王明华 病故,人物二 发妻 人物一 病故,1
TRAIN_SENT_ID_277950,,杨文昌,杨威,2014 年 4 月 19 日 ， 杨威 与 儿子 杨文昌 （ 杨阳 洋 ） 参加 湖南卫视 综艺节目 《 快乐 大本营 》 。,年  月  日  人物二 儿子 人物一  杨阳 洋  参加 湖南卫视 综艺节目  快乐 大本营,-1
TRAIN_SENT_ID_248862,,窦滔,苏蕙,“ 锦字 ” 化 用 窦滔 、 苏蕙 夫妻 之典 。,锦字  化 人物一  人物二 夫妻 之典,1
