sent_id,sent_id,entity1,entity2,sent,processed_sent,label
TRAIN_SENT_ID_262000,,王明华,梅兰芳,梅兰芳 大师 的 原配 夫人 王 王明华 是 王毓楼 的 五妹 。,人物二 大师 原配 夫人 王 人物一 王毓楼 五妹,1
TRAIN_SENT_ID_282980,,徐潮生,陈世倌,陈世倌 家庭 （ 书剑 恩仇录 ） : 妻子 ， 徐潮生 。,人物二 家庭  书剑 恩仇录   妻子  人物一,1
TRAIN_SENT_ID_269210,,陆雪琪,张小凡,师 弟媳 ： 陆雪琪 （ 张小凡 之妻 ）,师 弟媳  人物一  人物二 之妻,1
TRAIN_SENT_ID_284816,,许晋亨,许世勋,据悉 ， 08 年 11 月 23 日 ， 许晋亨 在 父亲 许世勋 的 亿元 别墅 操办 奢华 豪 喜宴 ， 迎娶 李嘉欣 ， 不过 却是 闭门 谢 媒体 ， 显得 异常 神秘 。,据悉   年  月  日  人物一 父亲 人物二 亿元 别墅 操办 奢华 豪 喜宴  迎娶 李嘉欣  却是 闭门 谢 媒体  显得 异常 神秘,-1
TRAIN_SENT_ID_273931,,江冬秀,胡适,胡适 与 曹诚英 第一次 见面 是 在 他 与 江冬秀 的 婚礼 上 。,人物二 曹诚英 第一次 见面 人物一 婚礼,1
TRAIN_SENT_ID_264117,,刘备,孙尚香,结果 ： 刘备 与 孙尚香 结婚,人物一 人物二 结婚,1
TRAIN_SENT_ID_260843,,贾珍,贾蓉,秦可卿 是 宁国府 长孙 贾蓉 的 妻子 、 贾珍 的 儿媳 。,秦可卿 宁国府 长孙 人物二 妻子  人物一 儿媳,-1
TRAIN_SENT_ID_270290,,宣姜,卫宣公,宣姜 是 齐国 女子 ， 嫁 卫宣公 为 夫人 ， 子为 卫惠公 。,人物一 齐国 女子  嫁 人物二 夫人  子为 卫惠公,1
TRAIN_SENT_ID_255596,,蒋介石,宋美龄,1927 年 — — 蒋介石 与 宋美龄 结婚,年   人物一 人物二 结婚,1
TRAIN_SENT_ID_276771,,丁夫人,曹操,夏侯渊 ， 字妙 才 ， 夏侯惇 从弟 ， 曹操 连襟 ， 娶 丁夫人 之妹 。,夏侯渊  字妙  夏侯惇 从弟  人物二 连襟  娶 人物一 之妹,1
TRAIN_SENT_ID_275706,,韩岫岩,王近山,王近山 在 北京 的 结发 妻子 韩岫岩 听到 了 他 患 癌症 的 消息 ， 脸 “ 唰 ” 地白 了 。,人物二 北京 结发 妻子 人物一 听到 患 癌症 消息  脸  唰  地白,1
TRAIN_SENT_ID_276251,,西门吹雪,孙秀青,西门吹雪 的 夫人 正是 峨眉 四秀 之一 孙秀青 。,人物一 夫人 峨眉 四秀 人物二,1
TRAIN_SENT_ID_254057,,朱芳雨,胡美,胡美 亮相 抢镜 : 2013 年 3 月 27 日 ， 2012 - 2013 赛季 CBA 总决赛 第 3 场 ， 国手 朱芳雨 妻儿 领衔 宏远 亲属 团 现场 助阵 。,人物二 亮相 抢镜   年  月  日     赛季  总决赛  场  国手 人物一 妻儿 领衔 宏远 亲属 团 现场 助阵,1
TRAIN_SENT_ID_278639,,夏金桂,薛蟠,薛蟠 婚姻 不合 : 娶妻 夏金桂 后 ， 又 把 其 陪房 丫头 宝蟾 勾搭 上 手 。,人物二 婚姻 不合  娶妻 人物一  陪房 丫头 宝蟾 勾搭 手,1
TRAIN_SENT_ID_262004,,王明华,梅兰芳,姑母 王明华 是 梅兰芳 夫人 。,姑母 人物一 人物二 夫人,1
TRAIN_SENT_ID_283155,,班淑娴,何太冲,随后 何太冲 设宴款待 ， 但是 宴席 上 的 酒 却 被 何太冲 的 妻子 班淑娴 下 了 毒 并 逼迫 无忌 喝 下 。,人物二 设宴款待  宴席 酒 人物二 妻子 人物一 毒 逼迫 无忌 喝,1
TRAIN_SENT_ID_282647,,杜江,杜宇麒,2013 年 9 月 19 日 上午 9 点 ， 杜宇麒 降生 ， 体重 八斤 三两 ； 2015 年 和 爸爸 杜江 参加 《 爸爸 回来 了 第二季 》 。,年  月  日 上午  点  人物二 降生  体重 八斤 三两   年 爸爸 人物一 参加  爸爸 回来 第二季,-1
TRAIN_SENT_ID_257022,,李嫣,王菲,2006 年 ， 王菲 和 李亚鹏 的 女儿 李嫣 因 唇腭裂 再次 引起 媒体 关注 。,年  人物二 李亚鹏 女儿 人物一 唇腭裂 再次 引起 媒体 关注,-1
TRAIN_SENT_ID_286867,,马禀鐩,丁秉鐩,马禀鐩 ， 丁秉鐩 夫人 。,人物一  人物二 夫人,1
TRAIN_SENT_ID_274307,,刘嫖,陈午,越礼 之始 : 陈皇后 失位 后 第二年 ， 刘嫖 的 丈夫 陈午 方才 过世 。,越礼 之始  陈皇后 失位 第二年  人物一 丈夫 人物二 方才 过世,1
TRAIN_SENT_ID_279584,,马丽娟,赵本山,1992 年 ， 赵本山 与 马丽娟 结婚 。,年  人物二 人物一 结婚,1
TRAIN_SENT_ID_273938,,江冬秀,胡适,西部 是 胡适 与 江冬秀 结婚 房间 ， 房内 有 木床 、 桌 、 椅 、 橱 、 凳 等 。,西部 人物二 人物一 结婚 房间  房内 木床  桌  椅  橱  凳,1
TRAIN_SENT_ID_285103,,石磊,潘阳,据悉 ， 新郎 石磊 比 潘阳 大 两岁 ， 两人 自 曝 相亲 认识 的 时候 就是 奔 着 结婚 去 的 ， 所以 一切 也 就 顺其自然 ， 至于 什么 时候 要 孩子 ， 就 随 缘分 。,据悉  新郎 人物一 人物二 两岁  两人 曝 相亲 认识 奔 结婚  顺其自然  孩子  缘分,1
TRAIN_SENT_ID_283649,,卢淑仪,李克勤,卢淑仪 ， 丈夫 李克勤,人物一  丈夫 人物二,1
TRAIN_SENT_ID_278525,,李秀文,叶挺,1925 年 ， 叶挺 与 李秀文 结婚 。,年  人物二 人物一 结婚,1
TRAIN_SENT_ID_262403,,汪精卫,陈璧君,陈璧君 与 汪精卫 结婚 后 ， 暴露出 了 她 任性 、 跋扈 的 性格 ， 有时 完全 不 顾及 汪精卫 的 面子 。,人物二 人物一 结婚  暴露出 任性  跋扈 性格  完全 顾及 人物一 面子,1
TRAIN_SENT_ID_281809,,李蕙仙,梁启超,梁启超 夫人 李蕙仙 、 王桂荃 / 16,人物二 夫人 人物一  王桂荃,1
TRAIN_SENT_ID_255594,,蒋介石,宋美龄,在 学习 期间 ， 经 蒋介石 夫人 宋美龄 介绍 ， 结识 了 宋美龄 的 干女儿 四川 才女 张训 芳 。,学习 期间  人物一 夫人 人物二 介绍  结识 人物二 干女儿 四川 才女 张训 芳,1
TRAIN_SENT_ID_282388,,骆冰,文泰来,十一 当家 ： 「 鸳鸯刀 」 骆冰 ， 文泰来 妻子 ， 独行 大盗 「 神刀 」 骆元通 之女 ， 擅用 鸳鸯 双刀 和 飞刀 陈家洛,十一 当家   鸳鸯刀  人物一  人物二 妻子  独行 大盗  神刀  骆元通 之女  擅用 鸳鸯 双刀 飞刀 陈家洛,1
TRAIN_SENT_ID_286632,,胡晓凤,张劲夫,张劲夫 家庭成员 : 夫人 ： 胡晓凤,人物二 家庭成员  夫人  人物一,1
TRAIN_SENT_ID_268571,,潘金莲,武大郎,"2 内容简介 : 武大郎 天生 神力 , 潘金莲 是 模范 妻子 , 你 信 吗 ?",内容简介  人物二 天生 神力  人物一 模范 妻子  信,1
TRAIN_SENT_ID_285907,,赵一涵,赵本山,2011 年 5 月 ， 赵本山 十四岁 女儿 妞妞 自拍照 曝光 ， 妞妞 已经 十四岁 了 ， 赵一涵 即将 进入 高中 就读 。,年  月  人物二 十四岁 女儿 妞妞 自拍照 曝光  妞妞 已经 十四岁  人物一 即将 进入 高中 就读,-1
TRAIN_SENT_ID_274149,,汤国梨,章太炎,章太炎 与 汤国梨 · 国学大师 的 新式 婚礼,人物二 人物一  国学大师 新式 婚礼,1
TRAIN_SENT_ID_277382,,樊姬,楚庄王,楚妃 叹 l ； 烈女传 : 樊姬 者 ， 楚庄王 之 夫人 也 。,楚妃 叹   烈女传  人物一  人物二 夫人,1
TRAIN_SENT_ID_285006,,庄月明,李嘉诚,李嘉诚 全传 第七章 心心相印 亲上 结亲 喜叠喜 : 李嘉诚 的 妻子 是 表妹 庄月明 。,人物二 全传 第七章 心心相印 亲上 结亲 喜叠喜  人物二 妻子 表妹 人物一,1
TRAIN_SENT_ID_255671,,蒋介石,宋美龄,51 . 出色 的 外交家 、 蒋介石 夫人 — — 宋美龄 / 83,出色 外交家  人物一 夫人   人物二,1
TRAIN_SENT_ID_252270,,秦嘉,徐淑,秦嘉 辗转 托人 送给 徐淑 妆奁 之物 ， 《 重报 妻书 》 ：,人物一 辗转 托人 送给 人物二 妆奁 之物   重报 妻书,1
TRAIN_SENT_ID_287320,,李大娘,李三省,李大娘 — — “ 铁掌 飞凤 ” 孙岚 、 李三思 孪生 弟弟 李三省 的 妻子 、 李逍遥 的 婶婶,人物一    铁掌 飞凤  孙岚  李三思 孪生 弟弟 人物二 妻子  李逍遥 婶婶,1
TRAIN_SENT_ID_285049,,朱见深,朱祁镇,忻 穆王 朱见治 （ 1458 年 3 月 18 日 ― 1472 年 4 月 2 日 ） ， 母万宸 妃 ； 明英宗 朱祁镇 第八 子 ， 明宪宗 朱见深 异 母弟 ， 母宸 妃 万氏 。,忻 穆王 朱见治   年  月  日 ―  年  月  日   母万宸 妃  明英宗 人物二 第八 子  明宪宗 人物一 异 母弟  母宸 妃 万氏,-1
TRAIN_SENT_ID_255112,,鲁元公主,张敖,燕灵 王刘建 鲁元公主 丈夫 : 张敖 ， 初袭 赵王 位 。,燕灵 王刘建 人物一 丈夫  人物二  初袭 赵王 位,1
TRAIN_SENT_ID_281550,,李锐,蒋韵,蒋韵 家庭成员 : 丈夫 ： 李锐,人物二 家庭成员  丈夫  人物一,1
TRAIN_SENT_ID_263673,,陈文琦,王雪红,38 . 王雪红 和 第二个 丈夫 陈文琦,人物二 第二个 丈夫 人物一,1
TRAIN_SENT_ID_274306,,刘嫖,陈午,刘嫖 越礼 之始 : 陈皇后 失位 后 第二年 ， 刘嫖 的 丈夫 陈午 方才 过世 。,人物一 越礼 之始  陈皇后 失位 第二年  人物一 丈夫 人物二 方才 过世,1
TRAIN_SENT_ID_281887,,张静,黄茂如,张静 及其 丈夫 黄茂如 以 财富 185 亿元 排名 第七 。,人物一 丈夫 人物二 财富  亿元 排名 第七,1
TRAIN_SENT_ID_255934,,蒋介石,宋美龄,蒋介石 、 宋美龄 夫妻 相处,人物一  人物二 夫妻 相处,1
TRAIN_SENT_ID_281426,,万玉枝,高咏,到 了 万家 以后 ， 见过 万玉枝 的 丈夫 高咏 卧病在床 ， 昏迷不醒 。,万家 以后  见过 人物一 丈夫 人物二 卧病在床  昏迷不醒,1
TRAIN_SENT_ID_273354,,秦香莲,陈世美,为了 升官发财 ， 陈世美 更 抛弃 前妻 秦香莲 ， 当 上 千金小姐 的 驸马 。,升官发财  人物二 更 抛弃 前妻 人物一  千金小姐 驸马,1
TRAIN_SENT_ID_258957,,王熙凤,贾琏,在 第七回 上半 回里 ， 曹雪芹 特别 写 到 贾琏 、 王熙凤 和谐 的 夫妻生活 。,第七回 上半 回里  曹雪芹 特别 写 人物二  人物一 和谐 夫妻生活,1
TRAIN_SENT_ID_284361,,唐筼,陈寅恪,唐筼 （ 1898 — — 1969 ） ， 陈寅恪 的 夫人 ， 1898 年生 ， 广西 灌阳 人 。,人物一        人物二 夫人   年生  广西 灌阳,1
TRAIN_SENT_ID_273101,,谭蓓蓓,白云江,2012 年 8 月份 ， 白云江 和 谭蓓蓓 回 黑龙江省 桦南县 结婚 。,年  月份  人物二 人物一 回 黑龙江省 桦南县 结婚,1
TRAIN_SENT_ID_282848,,刘莳,翁虹,刘莳 ， 2007 年 10 月 12 日 出生 ， 当红 明星 翁虹 和 先生 刘冠廷 的 女儿 。,人物一   年  月  日 出生  当红 明星 人物二 先生 刘冠廷 女儿,-1
TRAIN_SENT_ID_267473,,宋霭龄,孔祥熙,宋霭龄 家庭成员 : 丈夫 ： 孔祥熙,人物一 家庭成员  丈夫  人物二,1
TRAIN_SENT_ID_274762,,韩淑秀,郭松龄,韩淑秀 冒死 搭救 心上人 : 郭松龄 的 夫人 韩淑秀 （ 1891 － 1925 ） ， 堪称 奉天 奇女子 。,人物一 冒死 搭救 心上人  人物二 夫人 人物一       堪称 奉天 奇女子,1
TRAIN_SENT_ID_267605,,金正恩,李雪主,金正恩 还 金正恩 与 夫人 李雪主 被选为 朝鲜人民军 党代表 。,人物一 人物一 夫人 人物二 被选为 朝鲜人民军 党代表,1
TRAIN_SENT_ID_273909,,江冬秀,胡适,妻子 ： 江冬秀 ， 由 胡适 其母 包办 ， 1917 年 成婚 。,妻子  人物一  人物二 其母 包办   年 成婚,1
TRAIN_SENT_ID_249458,,后稷,姜嫄,姜嫄 踏 巨人 足迹 而 怀孕 ， 生 下 后稷 。,人物二 踏 巨人 足迹 怀孕  生 人物一,-1
TRAIN_SENT_ID_285899,,赵一涵,赵本山,目前 赵本山 女儿 赵一涵 （ 妞妞 ） 大胆 晒出 了 一组 自己 的 海军 制服 露脐 写真 。,目前 人物二 女儿 人物一  妞妞  大胆 晒出 一组 海军 制服 露脐 写真,-1
TRAIN_SENT_ID_285015,,庄月明,李嘉诚,第七章 心心相印 亲上 结亲 喜叠喜 : 李嘉诚 的 妻子 是 表妹 庄月明 。,第七章 心心相印 亲上 结亲 喜叠喜  人物二 妻子 表妹 人物一,1
TRAIN_SENT_ID_257137,,胡金铨,钟玲,胡金铨 婚姻 : 胡金铨 ， 夫人 钟玲,人物一 婚姻  人物一  夫人 人物二,1
TRAIN_SENT_ID_282386,,骆冰,文泰来,“ 奔雷 手 ” 文泰来 — — 四 当家 ， 骆冰 的 丈夫 。,奔雷 手  人物二   四 当家  人物一 丈夫,1
TRAIN_SENT_ID_282401,,陈品亨,陈鸿烈,陈鸿烈 的 突然 离世 引起 舆论 的 普遍 关注 ， 作为 陈鸿烈 女儿 的 陈品亨 也 受到 了 较大 关注 。,人物二 突然 离世 引起 舆论 普遍 关注  人物二 女儿 人物一 较大 关注,-1
TRAIN_SENT_ID_272508,,韦丛,元稹,这是 元稹 在 元 和 四年 三月 的 最后 一天 ， 为 思念 妻子 韦丛 而作 。,这是 人物二 元 四年 三月 最后 一天  思念 妻子 人物一 而作,1
TRAIN_SENT_ID_274755,,韩淑秀,郭松龄,1925 年 12 月 ， 郭松龄 、 韩淑秀 夫妻 惨遭 “ 曝尸 ” 之辱 。,年  月  人物二  人物一 夫妻 惨遭  曝尸  之辱,1
TRAIN_SENT_ID_284737,,李春江,李京龙,李京龙 ， 男 ， 生于 1995 年 3 月 15 日 ， 中国篮球 运动员 ， 司职 得分 后卫 ， 著名 篮球 教练 李春江 的 儿子 。,人物二  男  生于  年  月  日  中国篮球 运动员  司职 得分 后卫  著名 篮球 教练 人物一 儿子,-1
TRAIN_SENT_ID_286834,,刘元,邓晨,"刘元 - - - - 刘秀 二姐 , 邓晨 之妻 。",人物一     刘秀 二姐  人物二 之妻,1
TRAIN_SENT_ID_285691,,李小林,刘亚洲,刘亚洲 的 夫人 是 李小林 。,人物二 夫人 人物一,1
TRAIN_SENT_ID_286384,,吕玲绮,吕布,吕布 、 文丑 、 祝融 夫人 、 吕玲绮 ...,人物二  文丑  祝融 夫人  人物一,-1
TRAIN_SENT_ID_274321,,方怡,韦小宝,方怡 也 是 韦小宝 七位 夫人 之一 。,人物一 人物二 七位 夫人,1
TRAIN_SENT_ID_283373,,李京实,崔明浩,李京实 1 月 23 日 与 企业家 崔明浩 在 婚 ， 目前 正以 DJ 的 身份 活动 着 。,人物一  月  日 企业家 人物二 婚  目前 正以  身份 活动,1
TRAIN_SENT_ID_284057,,赵力平,朱琦,赵力平 丈夫 病逝 : 朱琦 在 “ 文革 ” 中 受到 了 很大 的 牵连 。,人物一 丈夫 病逝  人物二  文革  中 很大 牵连,1
TRAIN_SENT_ID_286835,,刘元,邓晨,刘元 嫁 邓晨 为妻 。,人物一 嫁 人物二 为妻,1
TRAIN_SENT_ID_281486,,吕牧石,马慧先,吕牧石 马慧先 : 马慧先 ， 吕牧石 之妻 。,人物一 人物二  人物二  人物一 之妻,1
TRAIN_SENT_ID_287262,,张静,杨志刚,杨志刚 的 妻子 叫 张静 ， 是 一名 配音演员 。,人物二 妻子 人物一  一名 配音演员,1
TRAIN_SENT_ID_276170,,苏蕙,窦滔,晋 窦滔 妻 苏蕙 字若兰 ， 善属文 。,晋 人物二 妻 人物一 字若兰  善属文,1
TRAIN_SENT_ID_260655,,李莎,李立三,孙维熙 李立三 夫人 李莎 回首往事,孙维熙 人物二 夫人 人物一 回首往事,1
TRAIN_SENT_ID_283779,,李静民,姜昆,姜昆 的 妻子 ， 李静民 ， 是 一名 曲艺 说唱 大师 。,人物二 妻子  人物一  一名 曲艺 说唱 大师,1
TRAIN_SENT_ID_258009,,黄睿靓,陈致中,陈致中 （ 妻 黄睿靓 ）,人物二  妻 人物一,1
TRAIN_SENT_ID_279638,,窦仙童,薛丁山,下嫁 给 薛丁山 为妻 ， 与 樊梨花 、 窦仙童 同 为 薛丁山 的 正房 妻室 。,下嫁 人物二 为妻  樊梨花  人物一 人物二 正房 妻室,1
TRAIN_SENT_ID_273303,,秦香莲,陈世美,陈世美 家境贫寒 ， 与 妻子 秦香莲 （ 湖广 均州 人氏 ， 今 湖北 丹江口 人 ） 恩爱 和谐 。,人物二 家境贫寒  妻子 人物一  湖广 均州 人氏  湖北 丹江口  恩爱 和谐,1
TRAIN_SENT_ID_287165,,孙家碧,万剑锋,身份 背景 ： 孙家碧 是 唐宣宗 贤妃 之母 ， 将军 万剑锋 之妻 。,身份 背景  人物一 唐宣宗 贤妃 之母  将军 人物二 之妻,1
TRAIN_SENT_ID_276210,,苏蕙,窦滔,据 《 晋书 · 列女 · 窦滔 妻传 》 ： 普 窦滔 妻 苏蕙 ， 字若兰 ， 善属文 。,晋书  列女  人物二 妻传   普 人物二 妻 人物一  字若兰  善属文,1
TRAIN_SENT_ID_277372,,樊姬,楚庄王,⑨ 、 樊姬 ： 楚庄王 夫人 。,⑨  人物一  人物二 夫人,1
TRAIN_SENT_ID_287208,,李瑞英,张宇燕,而 张宇燕 的 妻子 是 中央电视台 著名 主持人 李瑞英 。,人物二 妻子 中央电视台 著名 主持人 人物一,1
TRAIN_SENT_ID_285917,,上官兰心,朱常洛,《 美人计 》 : 明光宗 朱常洛 即位 后 ， 他 梦想 与 深爱 的 妻子 上官兰心 双宿双飞 ， 白头到老 。,美人计   明光宗 人物二 即位  梦想 深爱 妻子 人物一 双宿双飞  白头到老,1
TRAIN_SENT_ID_284152,,王嘉莉,王力宏,王嘉莉 人物 生活 : 2014 年 7 月 10 日 下午 14 点 11 分 ， 王力宏 在 微博 报喜 ， 女儿 出生 。,人物一 人物 生活   年  月  日 下午  点  分  人物二 微博 报喜  女儿 出生,-1
TRAIN_SENT_ID_260662,,李莎,李立三,第二章 李立三 蒙冤 入狱 李莎 放弃 团证 救 丈夫,第二章 人物二 蒙冤 入狱 人物一 放弃 团证 救 丈夫,1
TRAIN_SENT_ID_260039,,严英云,徐良,后来 ， 她 又 拿 住 徐良 的 妻子 严英云 ， 逼 着 徐良 跟 她 练 剑 。,后来  住 人物二 妻子 人物一  逼 人物二 练 剑,1
TRAIN_SENT_ID_279311,,王逸宸,刘纯燕,刘纯燕 女儿 王逸宸 : 1999 年 夏天 ， 刘纯燕 生 下 一个 女儿 ， 取名为 王逸宸 ， 小名 娃娃 。,人物二 女儿 人物一   年 夏天  人物二 生 一个 女儿  取名为 人物一  小名 娃娃,-1
TRAIN_SENT_ID_266577,,许晋亨,李嘉欣,多次 与 男友 许晋亨 传婚 讯 的 大美人 李嘉欣 ， 终于 美梦成真 嫁入 豪门 ， 正式 成为 许家 媳妇 。,多次 男友 人物一 传婚 讯 大美人 人物二  终于 美梦成真 嫁入 豪门  正式 成为 许家 媳妇,1
TRAIN_SENT_ID_272738,,徐天宏,周绮,“ 武 诸葛 ” 徐天宏 — — 七 当家 ， 周绮 的 丈夫 ， 智谋 百出 。,武 诸葛  人物一   七 当家  人物二 丈夫  智谋 百出,1
TRAIN_SENT_ID_279605,,晏紫,李圣根,在 随后 的 接触 中 ， 李圣根 的 修养 、 浪漫 彻底 征服 了 晏紫 ， 两人 终于 在 2009 年 结束 之际 步入 婚姻 殿堂 。,接触 中  人物二 修养  浪漫 彻底 征服 人物一  两人 终于  年 结束 之际 步入 婚姻 殿堂,1
TRAIN_SENT_ID_271069,,彭丽媛,习近平,习近平 主席 和 夫人 彭丽媛 身着 中式服装 ， 出席 威廉 - 亚历山大 国王 举行 的 盛大 国宴 。,人物二 主席 夫人 人物一 身着 中式服装  出席 威廉  亚历山大 国王 举行 盛大 国宴,1
TRAIN_SENT_ID_267397,,许志安,郑秀文,婚礼 由 李静 、 戴军 主持 ， 证婚人 是 骄阳 影业 总裁 徐小明 ， 好友 郑秀文 、 许志安 、 拉姑 、 梁汉文 、 韩红 等 参加 婚礼 。,婚礼 李静  戴军 主持  证婚人 骄阳 影业 总裁 徐小明  好友 人物二  人物一  拉姑  梁汉文  韩红 参加 婚礼,1
TRAIN_SENT_ID_282963,,王晓蓉,王中磊,王中磊 在 婚礼 上 对 自己 的 发妻 王晓蓉 说 ， “ 20 年前 我 拎 着 一个包 娶 走 你 没 让 你 穿过 婚纱 ， 20 年 后 我 再 给 你 披上 婚纱 。 ”,人物二 婚礼 发妻 人物一 说    年前 拎 一个包 娶 走 没 穿过 婚纱   年 披上 婚纱,1
TRAIN_SENT_ID_270709,,赵宏博,申雪,2010 年 ， 申雪 、 赵宏博 在 温哥华 圆 奥运金牌 之梦后 ， 计划 以 一场 冰上 婚礼 见证 两人 牵手 18 年 的 深情 ， “ 冰上 雅姿 盛典 ” 正式 创立 。,年  人物二  人物一 温哥华 圆 奥运金牌 之梦后  计划 一场 冰上 婚礼 见证 两人 牵手  年 深情   冰上 雅姿 盛典  正式 创立,1
TRAIN_SENT_ID_272708,,毛岸青,杨开慧,1923 年 11 月 ， 毛泽东 的 妻子 杨开慧 又 生下 次子 毛岸青 。,年  月  毛泽东 妻子 人物二 生下 次子 人物一,-1
TRAIN_SENT_ID_272813,,谢烨,顾城,1993 年 ， 顾城 却 在 新西兰 的 激流 岛上 ， 与 妻子 谢烨 以 极端 惨烈 的 方式 告别 了 世界 。,年  人物二 新西兰 激流 岛上  妻子 人物一 极端 惨烈 方式 告别 世界,1
TRAIN_SENT_ID_258303,,陈建斌,蒋勤勤,《 乔家大院 》 让 陈建斌 和 蒋勤勤 走到 了 一起 并 闪电 般的 结婚 、 生子 ， 让 人 猝不及防 。,乔家大院  人物一 人物二 走到 一起 闪电 结婚  生子  猝不及防,1
TRAIN_SENT_ID_281382,,林姮怡,蒋友柏,2003 年 2 月 8 日 ， 蒋友柏 与 台湾 女星 林姮怡 （ 花莲 慈济 医院院长 林欣荣 的 爱女 ） 结婚 ， 育有 一对 子女 。,年  月  日  人物二 台湾 女星 人物一  花莲 慈济 医院院长 林欣荣 爱女  结婚  育有 一对 子女,1
TRAIN_SENT_ID_264766,,张欣,潘石屹,1995 年 ， 潘石屹 与 妻子 张欣 共同 创立 了 SOHO 中国 有限公司 。,年  人物二 妻子 人物一 共同 创立  中国 有限公司,1
TRAIN_SENT_ID_258387,,张兆和,沈从文,与 妻子 于立群 及 子女 1940 年 与 友人 沈从文 、 肖珊 、 张兆和 、 王树 藏 等 在 昆明 西山 。,妻子 于立群 子女  年 友人 人物二  肖珊  人物一  王树 藏 昆明 西山,1
TRAIN_SENT_ID_255859,,蒋介石,宋美龄,宋美龄 身后 重大事件 揭秘 内容简介 : 宋美龄 ， 蒋介石 的 夫人 及 外交 助手 。,人物二 身后 重大事件 揭秘 内容简介  人物二  人物一 夫人 外交 助手,1
TRAIN_SENT_ID_261313,,朱兆祥,胡静,比婚 胡静 : 胡静 的 婚礼 堪称 世纪 婚礼 ， 在 胡静 和 朱兆祥 大婚 期间 其婚 房选 在 半山 别墅 ， 别墅 价值 千万 ， 且 处于 吉隆坡 市中心 。,比婚 人物二  人物二 婚礼 堪称 世纪 婚礼  人物二 人物一 大婚 期间 其婚 房选 半山 别墅  别墅 价值 千万  处于 吉隆坡 市中心,1
TRAIN_SENT_ID_263725,,郭槐,贾充,贾充 也 因 畏惧 郭槐 ， 辞让 了 准置 两 夫人 的 诏书 。,人物二 畏惧 人物一  辞让 准置 两 夫人 诏书,1
TRAIN_SENT_ID_281642,,黄峨,杨慎,黄峨 与 杨慎 分别 达 三十年 之 久 ， 她 对 丈夫 的 苦苦 思念 ， 是 难以 用 语言表达 的 。,人物一 人物二 达 三十年 久  丈夫 苦苦 思念  难以 语言表达,1
TRAIN_SENT_ID_272315,,金正恩,金正日,在 其 母亲 2004 年 去世 之前 ， 金正恩 经常 身穿 军装 、 佩戴 手枪 ， 率先 到 金正日 即将 视察 的 军队 宣传 父亲 的 “ 先军 政治 ” 。,母亲  年 去世 之前  人物一 经常 身穿 军装  佩戴 手枪  率先 人物二 即将 视察 军队 宣传 父亲  先军 政治,-1
TRAIN_SENT_ID_252293,,文姜,鲁桓公,文姜 ， 嫁 鲁桓公 宣姜 丈夫 : 第一任 丈夫 ： 卫宣公,人物一  嫁 人物二 宣姜 丈夫  第一任 丈夫  卫宣公,1
TRAIN_SENT_ID_283061,,余克稷,张瑞芳,余克稷 ， 张瑞芳 的 第一任 丈夫 ， 在 重庆 电力公司 担任 工程师 。,人物一  人物二 第一任 丈夫  重庆 电力公司 担任 工程师,1
TRAIN_SENT_ID_263113,,毛福梅,蒋介石,蒋介石 和 毛福梅 的 《 协议 离婚 书 》,人物二 人物一  协议 离婚 书,1
TRAIN_SENT_ID_270308,,宣姜,卫宣公,据载 ， 卫宣公 曾纳 太子 伋 的 妻子 宣姜 为 妾 ， 后生 两子寿 和 朔 。,据载  人物二 曾纳 太子 伋 妻子 人物一 妾  后生 两子寿 朔,1
TRAIN_SENT_ID_282533,,蔡绿峰,陈娟娟,他 继承 了 父亲 的 船务 事业 ， 并 将 蔡绿峰 和 夫人 陈娟娟 产业 扩大 。,继承 父亲 船务 事业  人物一 夫人 人物二 产业 扩大,1
TRAIN_SENT_ID_272504,,韦丛,元稹,元稹 妻 韦丛 ， 字蕙 藂 ， 太子 宾客 （ 官名 ） 韦夏卿 之女 。,人物二 妻 人物一  字蕙 藂  太子 宾客  官名  韦夏卿 之女,1
TRAIN_SENT_ID_287139,,高城沙耶,高城壮一郎,人物 出处 : 高城百合子 ， 高城壮一郎 之妻 ， 高城沙耶 的 母亲 ， 曾 是 华尔街 无人不知 的 超级 商人 ， 休假 回国 时 与 壮一郎 认识 第二天 就 结婚 。,人物 出处  高城百合子  人物二 之妻  人物一 母亲  华尔街 无人不知 超级 商人  休假 回国 时 壮一郎 认识 第二天 结婚,-1
TRAIN_SENT_ID_272918,,王岳伦,王诗龄,2013 年 ， 王岳伦 携 女儿 王诗龄 一起 参加 湖南卫视 亲子 真人秀 节目 《 爸爸 去 哪儿 》 。,年  人物一 携 女儿 人物二 一起 参加 湖南卫视 亲子 真人秀 节目  爸爸,-1
TRAIN_SENT_ID_263571,,欧阳娣娣,傅娟,小女儿 ： 欧阳娣娣 （ 生日 ： 2004 年 7 月 30 日 ） 狮子座 欧阳龙 家庭 故事 : 欧阳龙 、 傅娟 — — 来之不易 的 三个 女儿,小女儿  人物一  生日   年  月  日  狮子座 欧阳龙 家庭 故事  欧阳龙  人物二   来之不易 三个 女儿,-1
TRAIN_SENT_ID_270219,,谭江柏,谭咏麟,3 月 16 日 ： 谭江柏 ， 谭咏麟 父亲,月  日  人物一  人物二 父亲,-1
TRAIN_SENT_ID_272307,,金正恩,金正日,2011 年 12 月 17 日 ， 金正日 去世 ， 金正恩 接任 朝鲜 最高 领导人 （ 朝鲜劳动党 总书记 ） 。,年  月  日  人物二 去世  人物一 接任 朝鲜 最高 领导人  朝鲜劳动党 总书记,-1
TRAIN_SENT_ID_254204,,邢夫人,贾赦,【 邢夫人 】 贾赦 之妻 ， 只知 一味 顺从 丈夫 ， 不明 事理 ， 耳根 软 ，,人物一  人物二 之妻  只知 一味 顺从 丈夫  不明 事理  耳根 软,1
TRAIN_SENT_ID_277777,,晋陵公主,谢混,谢混 死后 ， 其妻 晋陵公主 也 被迫 与 谢家 离婚 。,人物二 死后  其妻 人物一 被迫 谢家 离婚,1
TRAIN_SENT_ID_276184,,苏蕙,窦滔,⑹ 窦家妻 ： 指 窦滔 之妻 苏蕙 。,⑹ 窦家妻  指 人物二 之妻 人物一,1
TRAIN_SENT_ID_284406,,国仲凉子,向井理,个人 生活 : 2014 年 12 月 28 日 ， 向井理 与 女演员 国仲凉子 正式 登记 结婚 。,个人 生活   年  月  日  人物二 女演员 人物一 正式 登记 结婚,1
