sent_id,entity1,entity2,sent,processed_sent,label,hard_match
TRAIN_SENT_ID_275092,朱七七,沈浪,沈浪 、 金无望 追寻 黑影 而 去 ， 留下 朱七七 照看 白飞飞 。,人物二  金无望 追寻 黑影  留下 人物一 照看 白飞飞,1,0
TRAIN_SENT_ID_268179,樊梨花,薛丁山,5 . 薛丁山 三气 樊梨花 ( 1956 ),人物二 三气 人物一,1,0
TRAIN_SENT_ID_285083,焦娇,曾江,曾江 和 焦娇,人物二 人物一,1,0
TRAIN_SENT_ID_278204,江玉郎,江别鹤,虽然 生性 淫邪 阴毒 ， 可 平生 最 看不上 伪君子 ， 直指 江别鹤 与 江玉郎 都 非 善类 ， 乃 伪善 之 辈 。,生性 淫邪 阴毒  平生 看不上 伪君子  直指 人物二 人物一 非 善类  伪善 辈,-1,0
TRAIN_SENT_ID_262658,况天佑,马小玲,"马小玲 已死 , 况天佑 欲 使 她 复活 , 就 请求 人王 告知 永恒 国度 的 秘密 。",人物二 已死  人物一 欲 复活  请求 人王 告知 永恒 国度 秘密,1,-1
TRAIN_SENT_ID_268786,张翠山,张无忌,配音 角色 ： 张无忌 [ 梁朝伟 ] 、 张翠山 [ 任达华 ],配音 角色  人物二  梁朝伟   人物一  任达华,-1,1
TRAIN_SENT_ID_272778,谢烨,顾城,麦文 谢烨 顾城 是 在 火车 上 认识 的 … … … … … … … … …,麦文 人物一 人物二 火车 认识,1,0
TRAIN_SENT_ID_259206,刘备,刘禅,自称 是 刘备 — — 刘禅 — — 刘谌 — — 刘豪 之后 。,自称 人物一   人物二   刘谌   刘豪 之后,-1,1
TRAIN_SENT_ID_269223,陆雪琪,张小凡,第五十九章 陆雪琪 vs 田灵儿 new 酒剑仙 异 世传 第六十章 战 张小凡 new,第五十九章 人物一  田灵儿  酒剑仙 异 世传 第六十章 战 人物二,1,0
TRAIN_SENT_ID_276271,西门吹雪,孙秀青,可惜 ， 西门吹雪 只爱过 孙秀青 ， 试验 次数 太 少 ， 不 具有 普遍性 ， 不能 作为 实验 结论 。,可惜  人物一 只爱过 人物二  试验 次数 太 少  具有 普遍性  不能 实验 结论,1,0
TRAIN_SENT_ID_268863,夏雪,刘梅,不想 夏雪 在 毕业 晚会 上 把 胸针 丢 了 ， 她 非常 着急 ， 因为 刘梅 并不知道 此事 。,不想 人物一 毕业 晚会 胸针 丢  非常 着急  人物二 并不知道 此事,-1,1
TRAIN_SENT_ID_262826,熊美玲,林秋离,No.162 爱 你 太深 林秋离 熊美玲 刘德华,爱 太深 人物二 人物一 刘德华,1,0
TRAIN_SENT_ID_283008,孟扶摇,长孙无极,长孙无极 独一无二 : 良久 孟扶摇 闭 着眼 ， 把 了 把 他 的 肩骨 ， 埋怨 的 道 ： “ 这小 身板 怎么 搞 的 ， 好像 又 薄 了 ？,人物二 独一无二  良久 人物一 闭 着眼  肩骨  埋怨 道   这小 身板 搞  好像 薄,1,0
TRAIN_SENT_ID_262023,李纨,贾兰,089 、 梦 功名 贾兰 拾 青紫 博花 诰 李纨 负 虚名,梦 功名 人物二 拾 青紫 博花 诰 人物一 负 虚名,-1,0
TRAIN_SENT_ID_267353,许志安,郑秀文,4 、 问及 许志安 是否 会 邀请 老婆 郑秀文 来 支持 新 电影 ？,问及 人物一 是否 会 邀请 老婆 人物二 支持 新 电影,1,0
TRAIN_SENT_ID_259580,冯小刚,徐帆,《 一地 鸡毛 》 是 由 冯小刚 执导 ， 陈道明 、 徐帆 、 修宗迪 等 人 主演 的 一部 剧情片 。,一地 鸡毛  人物一 执导  陈道明  人物二  修宗迪 主演 一部 剧情片,1,0
TRAIN_SENT_ID_268015,樊梨花,薛丁山,1961 《 薛丁山 三请 樊梨花 》,人物二 三请 人物一,1,0
TRAIN_SENT_ID_262521,扶苏,秦始皇,秦始皇 的 本意 是 想要 扶苏 跟 蒙恬 处理 好 关系 ， 这 对 他 以后 亲临 大秦 帝国 有着 很 重要 的 作用 。,人物二 本意 想要 人物一 蒙恬 处理 关系  以后 亲临 大秦 帝国 有着 重要 作用,-1,1
TRAIN_SENT_ID_273195,黄苗子,郁风,不失 赤子之心 一一 写给 黄苗子 、 郁风 书画展,不失 赤子之心 一一 写给 人物一  人物二 书画展,1,0
TRAIN_SENT_ID_274825,丁玲,胡也频,还 写 了 《 记 丁玲 》 、 《 记 胡也频 》 、 《 从文 自传 》 等 长篇 传记 。,写  记 人物一    记 人物二    从文 自传  长篇 传记,1,0
TRAIN_SENT_ID_273759,范文芳,李铭顺,李铭顺 、 范文芳,人物二  人物一,1,0
TRAIN_SENT_ID_274817,丁玲,胡也频,丁玲 、 张天翼 、 柔石 、 胡也频 、 魏金枝 等 给 文坛 带来 了 新鲜 气息 的 作者 ， 正是 在 这种 情况 下 受到 了 重视 。,人物一  张天翼  柔石  人物二  魏金枝 文坛 带来 新鲜 气息 作者  这种 情况 重视,1,0
TRAIN_SENT_ID_285260,莫雪鸢,周亚夫,莫雪鸢 平安郡主 : 她 死 后 ， 与 周亚夫 冥婚 ， 赐 号 ， 平安郡主 。,人物一 平安郡主  死  人物二 冥婚  赐 号  平安郡主,1,0
TRAIN_SENT_ID_268523,潘金莲,武大郎,武大郎 并非 苦命 人 ， 潘金莲 实乃 名门 淑媛,人物二 苦命  人物一 实乃 名门 淑媛,1,0
TRAIN_SENT_ID_272796,谢烨,顾城,顾城 写 了 很多 献给 谢烨 的 诗 。,人物二 写 很多 献给 人物一 诗,1,0
TRAIN_SENT_ID_286264,黄琪翔,郭秀仪,黄琪翔 、 郭秀仪 旧藏 齐白石 作品选,人物一  人物二 旧藏 齐白石 作品选,1,0
TRAIN_SENT_ID_270904,贾午,韩寿,韩寿 与 贾午 ： 窥帘 偷香成 鸳鸯,人物二 人物一  窥帘 偷香成 鸳鸯,1,0
TRAIN_SENT_ID_259965,岳灵珊,宁中则,笑 ： 蓝凤凰 ， 任盈盈 ， 曲非烟 ， 岳灵珊 （ 或 宁中则 ） ， 仪琳 ， 东方不败,笑  蓝凤凰  任盈盈  曲非烟  人物一  人物二   仪琳  东方不败,-1,0
TRAIN_SENT_ID_270102,罗成,罗艺,第六十八回 穷 罗艺 练枪 闹 晋阳 小 罗成 认兄 在 东岭,第六十八回 穷 人物二 练枪 闹 晋阳 人物一 认兄 东岭,-1,0
TRAIN_SENT_ID_275796,邓英敏,邓上文,邓英敏 、 邓上文,人物一  人物二,-1,0
TRAIN_SENT_ID_264494,吴健雄,袁家骝,明德 学校 的 科技 楼 被 命名 为 “ 吴健雄 楼 ” ， 袁家骝 捐赠 25 万美元 作为 基建 费 。,明德 学校 科技 楼 命名  人物一 楼   人物二 捐赠  万美元 基建 费,1,0
TRAIN_SENT_ID_272118,张翠山,殷素素,机缘 所 凑 ， 张翠山 与 殷素素 有 一段 情缘 ， 且 以 悲剧 结束 。,机缘 凑  人物一 人物二 一段 情缘  悲剧 结束,1,0
TRAIN_SENT_ID_264300,贾环,赵姨娘,赵姨娘 也 大 骂 贾环 。,人物二 骂 人物一,-1,0
TRAIN_SENT_ID_271081,彭丽媛,习近平,为了 考验 对方 是不是 只重 外表 ， 彭丽媛 特意 穿 了 条 又 肥 又 大 的 军裤 ， 没想到 习近平 穿 得 比 她 还 土气 。,考验 是不是 只重 外表  人物一 特意 穿 条 肥 军裤  没想到 人物二 穿 土气,1,0
TRAIN_SENT_ID_254049,朱芳雨,胡美,参赛 队伍 回到 北京 以后 ， 朱芳雨 对 胡美 展开 了 猛烈 的 “ 攻势 ” 。,参赛 队伍 回到 北京 以后  人物一 人物二 展开 猛烈  攻势,1,0
TRAIN_SENT_ID_252226,秦嘉,徐淑,徐淑 历史 资料 : 秦嘉 是 东 汉桓帝 朝 陇西 郡 人 。,人物二 历史 资料  人物一 东 汉桓帝 陇西 郡,1,0
TRAIN_SENT_ID_270886,贾午,韩寿,每次 爸爸 主持会议 的 时候 ， 情窦初开 的 少女 贾午 就 透过 窗户 ， 偷偷地 向里 好奇 地 张望 ， 当 她 的 目光 落 在 韩寿 身上 。,每次 爸爸 主持会议  情窦初开 少女 人物一 透过 窗户  偷偷地 向里 好奇 张望  目光 落 人物二 身上,1,0
TRAIN_SENT_ID_273531,殷素素,张翠山,以 狮子吼 震败 王盘山 群雄 ， 抢夺 屠龙刀 ， 后 狂性 大发 ， 双目 被 殷素素 所毁 ， 与 她 和 张翠山 三人 流落 冰火 岛 。,狮子吼 震败 王盘山 群雄  抢夺 屠龙刀  狂性 大发  双目 人物一 所毁  人物二 三人 流落 冰火 岛,1,0
TRAIN_SENT_ID_263815,刘嘉玲,梁朝伟,梁朝伟 、 刘德华 、 刘嘉玲,人物二  刘德华  人物一,1,0
TRAIN_SENT_ID_260783,李格非,李清照,因为 同 是 朝廷 命官 ， 又 是 山东 乡党 ， 孔传 和 李格非 相交 甚厚 ， 又 和 李清照 之婿 赵明诚 相识 。,朝廷 命官  山东 乡党  孔传 人物一 相交 甚厚  人物二 之婿 赵明诚 相识,-1,0
TRAIN_SENT_ID_285650,秦开美,张贤华,家里 的 经济 支柱 是 开 货车 跑 运输 的 张贤华 ， 一次 能 挣 2000 元 ， 秦开美 的 收入 根本无法 支撑 家庭 。,家里 经济 支柱 开 货车 跑 运输 人物二  一次 挣  元  人物一 收入 根本无法 支撑 家庭,1,1
TRAIN_SENT_ID_282443,孙月言,方兰生,主角 ： 方兰生 、 孙月言 、 方沁儿,主角  人物二  人物一  方沁儿,1,0
TRAIN_SENT_ID_273498,殷素素,张翠山,谢逊 以 “ 狮子吼 ” 将 众人 震至 失聪 后 ， 掳走 武当派 张翠山 及 天鹰 教 殷素素 乘船 离岛 。,谢逊  狮子吼  众人 震至 失聪  掳走 武当派 人物二 天鹰 教 人物一 乘船 离岛,1,0
TRAIN_SENT_ID_265843,郭涛,郭子睿,四 、 歌曲 《 爸爸 去 哪儿 》 演唱 ： 田亮 、 田雨 橙 、 王岳伦 、 王诗龄 、 张亮 、 张悦轩 、 林志颖 、 小小 志 、 郭涛 、 郭子睿,四  歌曲  爸爸  演唱  田亮  田雨 橙  王岳伦  王诗龄  张亮  张悦轩  林志颖  小小 志  人物一  人物二,-1,0
TRAIN_SENT_ID_268632,潘金莲,武大郎,成语故事 ： 西门庆 窜通 王婆 勾引 潘金莲 ， 被 郓哥 看破 ， 武大郎 亲自 捉奸 ， 被 西门庆 一脚 踢倒 。,成语故事  西门庆 窜通 王婆 勾引 人物一  郓哥 看破  人物二 亲自 捉奸  西门庆 一脚 踢倒,1,1
TRAIN_SENT_ID_260346,穆桂英,杨宗保,亲哥 好比 杨宗保 ， 老妹 好比 穆桂英 。,亲哥 好比 人物二  老妹 好比 人物一,1,0
TRAIN_SENT_ID_265950,杨绛,钱钟书,★ 杨绛 《 写 〈 围城 〉 的 钱钟书 》,★ 人物一  写  围城  人物二,1,0
TRAIN_SENT_ID_260454,严嵩,严世蕃,严嵩 和 严世蕃 每陷 仇家 ， 就 把 仇家 的 男孩 夺 来 作为 娈童 ， 百般 侮辱 ， 进行 性虐待 。,人物一 人物二 每陷 仇家  仇家 男孩 夺 娈童  百般 侮辱  进行 性虐待,-1,0
TRAIN_SENT_ID_262914,熊美玲,林秋离,No.91 花落 染红 泥 林秋离 熊美玲 于千慧,花落 染红 泥 人物二 人物一 于千慧,1,0
TRAIN_SENT_ID_266402,蔡赟,王娜,虽然 蔡赟 看不懂 花游 比赛 ， 但是 王娜 却 对 羽毛球 比赛 越来越 精通 。,人物一 看不懂 花游 比赛  人物二 羽毛球 比赛 越来越 精通,1,0
TRAIN_SENT_ID_250014,张无忌,赵敏,殷姑娘 （ 周芷若 、 赵敏 、 小昭 、 张无忌 称 ）,殷姑娘  周芷若  人物二  小昭  人物一 称,1,0
TRAIN_SENT_ID_258070,周海婴,鲁迅,周海婴 ： 我 想要 做 的 就是 恢复 鲁迅 原来 的 真 面貌,人物一  想要 做 恢复 人物二 原来 真 面貌,-1,0
TRAIN_SENT_ID_276122,许仙,许仕林,但 法海 仍 不甘 罢休 ， 将 许仙 软禁 ， 白贞娘 逼 得 水浸 金山寺 ， 败 逃 至 断桥 产下 娇儿 取名 许仕林 ， 法海 借来 金 砵 收服 蛇 妖 被 压 雷峰塔 下 … …,法海 不甘 罢休  人物一 软禁  白贞娘 逼 水浸 金山寺  败 逃 断桥 产下 娇儿 取名 人物二  法海 借来 金 砵 收服 蛇 妖 压 雷峰塔,-1,-1
TRAIN_SENT_ID_279632,窦仙童,薛丁山,薛丁山 不负众望 ， 他 率领 罗章 、 窦一虎 、 秦汉 、 秦英 、 程千忠 、 窦仙童 等 后起之秀 又 一次 大败 苏宝同 。,人物二 不负众望  率领 罗章  窦一虎  秦汉  秦英  程千忠  人物一 后起之秀 一次 大败 苏宝同,1,0
TRAIN_SENT_ID_274888,晏几道,晏殊,本书 将 原编 钱惟演 、 晏殊 、 欧阳修 、 晏几道 、 严仁 、 刘克庄 等 所用 诸多 “ 木兰花 ” 词牌 ， 一律 按 《 钦定 词谱 》 称 “ 玉楼春 ”,本书 原编 钱惟演  人物二  欧阳修  人物一  严仁  刘克庄 所用 诸多  木兰花  词牌  一律  钦定 词谱  称  玉楼春,-1,0
TRAIN_SENT_ID_286461,齐良末,齐白石,一次 俩 人 一起 去 琉璃厂 玩 ， 齐良末 拿出 齐白石 一幅 画来 ， 往 柜台 上 一放 ， 不用 讲价 就 卖 了 八元 。,一次 俩 一起 琉璃厂 玩  人物一 拿出 人物二 一幅 画来  柜台 一放  不用 讲价 卖 八元,-1,0
TRAIN_SENT_ID_256809,朱军,谭梅,朱军 谭梅 的 三个 任务 是 滑翔伞 ， 背 法语 ， 开 飞机 。,人物一 人物二 三个 任务 滑翔伞  背 法语  开 飞机,1,0
TRAIN_SENT_ID_276723,刘梅,夏东海,《 妈妈 不 在家 》 刘梅 要 出差 七天 ， 夏东海 掌握 了 “ 财政 大权 ” 。,妈妈 在家  人物一 出差 七天  人物二 掌握  财政 大权,1,0
TRAIN_SENT_ID_282688,刘之冰,茹萍,2 . 刘之冰 在 拍摄 现场 只要 一有 空闲 就 会 为 茹萍 送上 热茶 。,人物一 拍摄 现场 一有 空闲 会 人物二 送上 热茶,1,0
TRAIN_SENT_ID_253573,沈浪,朱七七,沈浪 见 朱七七 垂危 ， 遂 应允 将 她 放在心里 。,人物一 见 人物二 垂危  遂 应允 放在心里,1,1
TRAIN_SENT_ID_262994,熊美玲,林秋离,No.167 爱 的 很爽 林秋离 熊美玲 林慧萍,爱 很爽 人物二 人物一 林慧萍,1,0
TRAIN_SENT_ID_285405,沈月英,杜月笙,沈月英 ： 杜月笙 采下 的 水蜜桃,人物一  人物二 采下 水蜜桃,1,0
TRAIN_SENT_ID_273485,殷素素,张翠山,张翠山 和 殷素素 的 结合 也 引发 了 正邪 两派 的 纷争 。,人物二 人物一 结合 引发 正邪 两派 纷争,1,0
TRAIN_SENT_ID_276098,陈三立,陈宝箴,清末 民初 ， 陈宝箴 、 陈三立 、 陈衡 恪 、 陈寅恪 四人 合称 陈门四杰 。,清末 民初  人物二  人物一  陈衡 恪  陈寅恪 四人 合称 陈门四杰,-1,0
TRAIN_SENT_ID_278924,汪涵,杨乐乐,1 主持 阵容 : 金晓琳 、 冯祺 、 郑慧琳 、 仇晓 、 汪涵 、 杨乐乐 。,主持 阵容  金晓琳  冯祺  郑慧琳  仇晓  人物一  人物二,1,0
TRAIN_SENT_ID_259971,岳灵珊,宁中则,剑招 繁复 ， 造诣 深者 可 用于 克制 任意 剑法 ， 后 宁中则 授予 岳灵珊 。,剑招 繁复  造诣 深者 用于 克制 任意 剑法  人物二 授予 人物一,-1,0
TRAIN_SENT_ID_265711,贾环,贾政,第十五回 贾环 谗言 进 贾政 宝玉 横祸 遭 毒打,第十五回 人物一 谗言 进 人物二 宝玉 横祸 遭 毒打,-1,0
TRAIN_SENT_ID_255582,江欣燕,吴积逊,第二集 20110130 嘉宾 ： 江欣燕 与 吴积逊 章志文 与 陈念君 洪天明 与 周家蔚,第二集  嘉宾  人物一 人物二 章志文 陈念君 洪天明 周家蔚,1,0
TRAIN_SENT_ID_262738,熊美玲,林秋离,12 宠物 词 ： 林秋离 曲 ： 熊美玲 制作 人 ： MartinTang,宠物 词  人物二 曲  人物一 制作,1,0
TRAIN_SENT_ID_249348,后稷,姜嫄,首章 追叙 周 的 始祖 姜嫄 和 后稷 ， 次章 叙周 的 兴起 由于 太王 、 文王 、 武王 。,首章 追叙 周 始祖 人物二 人物一  次章 叙周 兴起 太王  文王  武王,-1,0
TRAIN_SENT_ID_273085,杨铁心,包惜弱,杨铁心 挺 枪刺 倒 门边 一名 兵丁 ， 俯身 伸臂 ， 把 包惜弱 抱上 马背 ， 高声 叫 道 ： “ 大哥 ， 跟着 我来 ！ ”,人物一 挺 枪刺 倒 门边 一名 兵丁  俯身 伸臂  人物二 抱上 马背  高声 道   大哥  跟着 我来,1,-1
TRAIN_SENT_ID_274517,薛丁山,薛仁贵,但 薛仁贵 却 不满 于 薛丁山 阵上 招亲 ， 于是 将 之锁 人 天牢 ， 以示 惩戒 。,人物二 不满 人物一 阵上 招亲  之锁 天牢  以示 惩戒,-1,0
TRAIN_SENT_ID_253532,施南生,徐克,【 策划 】 ： 徐克 施南生,策划   人物二 人物一,1,0
TRAIN_SENT_ID_260927,贾珍,贾蓉,5 . 贾蓉 配 秦可卿 ， 秦可卿 与 公公 贾珍 关系暧昧 。,人物二 配 秦可卿  秦可卿 公公 人物一 关系暧昧,-1,1
TRAIN_SENT_ID_253579,沈浪,朱七七,风华 度 ： 朱七七 4 星 ， 沈浪 3 星半,风华 度  人物二  星  人物一  星半,1,0
TRAIN_SENT_ID_253929,况天涯,马小玲,紫 ： 马家 的 血 加上 僵尸 毒 将 变成 特殊 的 紫眼 僵尸 “ 况天涯 ” “ 马小玲 ” “ 汤金 宝 ” 。,紫  马家 血 加上 僵尸 毒 变成 特殊 紫眼 僵尸  人物一   人物二   汤金 宝,-1,0
TRAIN_SENT_ID_286911,白智英,郑锡元,白智英 郑锡元 の 姐弟恋,人物一 人物二 の 姐弟恋,1,0
TRAIN_SENT_ID_275083,朱七七,沈浪,沈浪 与 熊猫儿 看着 奄奄一息 的 朱七七 ， 无力回天 ， 只有 让 猫儿 求助于 快活 王 。,人物二 熊猫儿 看着 奄奄一息 人物一  无力回天  猫儿 求助于 快活 王,1,0
TRAIN_SENT_ID_285283,广德公主,于琮,广德公主 ， 母晃 皇后 ， 下嫁 于琮 。,人物一  母晃 皇后  下嫁 人物二,1,1
TRAIN_SENT_ID_251063,尤三姐,柳湘莲,柳湘莲 疑 尤三姐 入于 下流 ， 后悔 留剑 作为 定礼 。,人物二 疑 人物一 入于 下流  后悔 留剑 定礼,1,0
TRAIN_SENT_ID_264862,夏东海,夏雪,夏东海 的 剧本 《 角马 的 爱情 》 ， 由于 不 符合 制作方 的 要求 而 被 “ 枪毙 ” ， 后来 夏雪 把 汇演 节目 改成 《 角马 的 故事 》 ， 并 取得成功 。,人物一 剧本  角马 爱情   符合 制作方 要求  枪毙   后来 人物二 汇演 节目 改成  角马 故事   取得成功,-1,1
TRAIN_SENT_ID_271668,陆乘风,陆冠英,是 太湖 群雄 之 首 陆乘风 的 修身 之 所 ， 少 庄主 为 陆冠英 。,太湖 群雄 首 人物一 修身  少 庄主 人物二,-1,0
TRAIN_SENT_ID_277070,龙非离,年璇玑,“ 龙非离 ， 是不是 因为 每次 我 都 可以 为 你 为 你 身边 的 人 轻易 去 死 ， 你 便 觉得 我 年璇玑 下 ~ 贱到 可以 任 你 一次次 这样 对待 ？ ”,人物一  是不是 每次 身边 轻易 死  便 觉得 人物二  贱到 一次次,1,1
TRAIN_SENT_ID_270848,姜承,欧阳倩,姜承 看出 欧阳倩 的 心思 ， 所以 答应下来 。,人物一 看出 人物二 心思  答应下来,1,0
TRAIN_SENT_ID_266414,严世蕃,严嵩,嘉靖 帝看 后 震怒 ， 急召 严嵩 查问 此事 是否 与 严世蕃 有关 。,嘉靖 帝看 震怒  急召 人物二 查问 此事 是否 人物一,-1,0
TRAIN_SENT_ID_254192,邢夫人,贾赦,贾母 、 贾政 等 都 反对 这门 亲事 ， 碍于 贾赦 、 邢夫人 的 “ 父母之命 ” 管不了 。,贾母  贾政 反对 这门 亲事  碍于 人物二  人物一  父母之命  管不了,1,-1
TRAIN_SENT_ID_268869,夏雪,刘梅,夏雨 决心 找 淘淘 报仇 ， 夏雪 将 此事 告诉 了 夏东海 ， 夏东海 和 刘梅 连夜 商量 解决办法 。,夏雨 决心 找 淘淘 报仇  人物一 此事 告诉 夏东海  夏东海 人物二 连夜 商量 解决办法,-1,0
TRAIN_SENT_ID_258326,陈建斌,蒋勤勤,苏有朋 称 刘诗 诗 “ 嫂子 ” 陈建斌 二导 作品 不 排除 与 蒋勤勤 合作,苏有朋 称 刘诗 诗  嫂子  人物一 二导 作品 排除 人物二 合作,1,0
TRAIN_SENT_ID_250129,秦始皇,胡亥,我主 曾 记得 秦始皇 废 扶苏 ， 立 胡亥 之 故事 乎 ？,我主 记得 人物一 废 扶苏  立 人物二 故事,-1,1
TRAIN_SENT_ID_283457,张伯驹,潘素,琵琶 记 ： 张伯驹 与 潘素,琵琶 记  人物一 人物二,1,0
TRAIN_SENT_ID_277127,浦安修,彭德怀,沉默 好久 ， 彭德怀 才 开口 ： “ 我 有 预感 ， 浦安修 早有 准备 。,沉默 好久  人物二 开口   预感  人物一 早有 准备,1,0
TRAIN_SENT_ID_277182,张茜,张卫健,天下无双 片尾曲 逍遥 最好 张茜 关咏荷 影视剧 作品 : 张卫健 主要 作品 : 音乐 专辑 : 电影 作品 :,天下无双 片尾曲 逍遥 最好 人物一 关咏荷 影视剧 作品  人物二 主要 作品  音乐 专辑  电影 作品,1,0
TRAIN_SENT_ID_281667,孙朗,孙坚,孙坚 ： 孙策 ， 孙权 ， 孙朗 ， 孙娟 ， 孙 霓裳 ， 孙仁 ， 孙休,人物二  孙策  孙权  人物一  孙娟  孙 霓裳  孙仁  孙休,-1,0
TRAIN_SENT_ID_262809,熊美玲,林秋离,No.196 谢谢 你 的 爱 林秋离 熊美玲 刘德华,谢谢 爱 人物二 人物一 刘德华,1,0
TRAIN_SENT_ID_284942,丁秋星,蔡明,正在 紧张 拍戏 的 蔡明 ， 每天 都 能 收到 丁秋星 火辣辣 的 来信 ， 这 让 她 既 意外 又 惊喜 。,正在 紧张 拍戏 人物二  每天 收到 人物一 火辣辣 来信  意外 惊喜,1,0
TRAIN_SENT_ID_264075,刘备,孙尚香,刘备 、 孙尚香 、 赵云 、 林 向奕 、 诸葛亮 等,人物一  人物二  赵云  林 向奕  诸葛亮,1,-1
TRAIN_SENT_ID_263781,秦始皇,赵姬,邵平 基本 信息 : 秦始皇 之 父母 庄襄王 和 赵姬 ， 安葬 在 如今 距 邵平 店有 5 公里 的 临潼区 韩峪 秦东 陵 。,邵平 基本 信息  人物一 父母 庄襄王 人物二  安葬 如今 邵平 店有  公里 临潼区 韩峪 秦东 陵,-1,1
TRAIN_SENT_ID_259608,冯小刚,徐帆,2012 - 06 - 24 ： 美酒 一样 的 徐帆 叙述 与 冯小刚 结缘 ...,美酒 人物二 叙述 人物一 结缘,1,0
TRAIN_SENT_ID_263000,熊美玲,林秋离,如 那英 专辑 《 征服 》 的 制作 人 丁晓 安 ， 词曲创作 人 邰正宵 、 林利南 、 熊美玲 、 林秋离 ， 魔鬼 监制 李安修 、 陈耀川 。,那英 专辑  征服  制作 丁晓 安  词曲创作 邰正宵  林利南  人物一  人物二  魔鬼 监制 李安修  陈耀川,1,0
TRAIN_SENT_ID_277984,吴君如,陈可辛,吴君如 还 现场 打电话 给 自己 的 泰国 老公 陈可辛 ， 让 大导 验明 其 真身 。,人物一 现场 打电话 泰国 老公 人物二  大导 验明 真身,1,0
TRAIN_SENT_ID_249456,后稷,姜嫄,《 长安 志 》 于 武功 条 下载 ： “ 后稷 祠 在 县 西南 二十三 里 ， 姜嫄 祠 在 县 西南 二十二里 ” 。,长安 志  武功 条 下载   人物一 祠 县 西南 二十三 里  人物二 祠 县 西南 二十二里,-1,1
TRAIN_SENT_ID_278222,萧玉婉,郗徽,永世 公主 萧玉婉 ， 母 郗徽,永世 公主 人物一  母 人物二,-1,0
TRAIN_SENT_ID_262742,熊美玲,林秋离,缠绵 作词 ： 林秋离 作曲 ： 熊美玲,缠绵 作词  人物二 作曲  人物一,1,0
TRAIN_SENT_ID_253699,申雪,赵宏博,赵宏博 申雪 ， 获 双人滑 冠军 ； “ 巨无霸 ” 冰梯 ， 等 吉尼斯 记录 。,人物二 人物一  获 双人滑 冠军   巨无霸  冰梯  吉尼斯 记录,1,0
TRAIN_SENT_ID_262974,熊美玲,林秋离,No.92 依赖 林秋离 熊美玲 高胜美,依赖 人物二 人物一 高胜美,1,0
TRAIN_SENT_ID_257336,贾珍,尤氏,贾珍 听 了 的 尤氏 安排 ， “ 赞声不绝 。 ”,人物一 听 人物二 安排   赞声不绝,1,0
TRAIN_SENT_ID_253763,申雪,赵宏博,凭借 战胜 伤病 、 进军 冬奥 的 勇气 的 决心 ， 赵宏博 在 离开 冰场 后 的 第 88 天 ， 神奇 地 重新 站 在 冰场 上 ， 重新 与 申雪 拉上 了 手 。,战胜 伤病  进军 冬奥 勇气 决心  人物二 离开 冰场  天  神奇 重新 站 冰场  重新 人物一 拉上 手,1,0
TRAIN_SENT_ID_272190,马小玲,况天佑,歌曲名 ： 原来 只要 共 你 活 一天 （ 况天佑 、 马小玲 在 KTV 唱 的 那首歌 ）,歌曲名  原来 共 活 一天  人物二  人物一  唱 那首歌,1,0
TRAIN_SENT_ID_270925,贾午,韩寿,其女 贾午 为 韩寿 先 戏弄 后 婚娶 。,其女 人物一 人物二 先 戏弄 婚娶,1,0
TRAIN_SENT_ID_264093,刘备,孙尚香,照影桥 名称 由 来 : 刘备 西征 入川 ， 孙尚香 被 骗回 东吴 ， 想 与 夫君 团聚 而 不可 得 。,照影桥 名称  人物一 西征 入川  人物二 骗回 东吴  想 夫君 团聚 不可,1,0
TRAIN_SENT_ID_257013,李嫣,王菲,而 王菲 和 李亚鹏 身穿 李嫣 牌 T恤 现身 支持 。,人物二 李亚鹏 身穿 人物一 牌 恤 现身 支持,-1,0
TRAIN_SENT_ID_281588,王锦辉,王国强,集团 创办人 王锦辉 和 主席 王国强 的 热心 公益 ， 嘉惠後学 ， 实在 值得 表彰 。,集团 创办人 人物一 主席 人物二 热心 公益  嘉惠後学  实在 值得 表彰,-1,0
TRAIN_SENT_ID_249898,张无忌,赵敏,】 18 ， 张无忌 此时 更 无 怀疑 ， 情知 这 车 戏文 定 是 赵敏 命人 扮演 ， 料知 他 和 周芷若 要 到 大都 来 ， 是 以 这般 羞辱 周芷若 一番 。,人物一 更 怀疑  情知 车 戏文 定 人物二 命人 扮演  料知 周芷若 大都  羞辱 周芷若 一番,1,0
TRAIN_SENT_ID_277348,樊姬,楚庄王,樊姬 系 楚庄王 王后 。,人物一 系 人物二 王后,1,0
TRAIN_SENT_ID_273963,白素,卫斯理,2 . 地底 奇人 、 卫斯理 与 白素 （ 旧版 ： 纸猴 ）,地底 奇人  人物二 人物一  旧版  纸猴,1,0
TRAIN_SENT_ID_248931,阮星竹,段正淳,双目 璨 如星 : 可 慕容复 可 不管 阮星竹 表情 对 着 段正淳 叫 道 ： “ 我数 一 、 二 、 三 、 你 再 不 点头 ， 莫怪 慕容复 手下无情 。 ”,双目 璨 如星  慕容复 人物一 表情 人物二 道   我数  二  三  点头  莫怪 慕容复 手下无情,1,1
TRAIN_SENT_ID_253779,申雪,赵宏博,01 - 02 赛季 ， 申雪 和 赵宏博 的 表演 了 倾注 了 教练 姚滨 、 国外 专家 以及 小雪 、 宏博 本人 的 智慧 和 心血 的 《 图兰朵 》 。,赛季  人物一 人物二 表演 倾注 教练 姚滨  国外 专家 小雪  宏博 智慧 心血  图兰朵,1,0
TRAIN_SENT_ID_276302,岳灵珊,林平之,岳灵珊 和 林平之,人物一 人物二,1,0
TRAIN_SENT_ID_279233,长孙无极,孟扶摇,长孙无极 玄元 再见 : 咬 了 咬牙 ， 孟扶摇 发狠 ， 突然 一把 将 剩下 的 四根 药草 全部 塞进 自己 嘴里 ， 怒道 ， “ 叫 你 偷 ！,人物一 玄元 再见  咬 咬牙  人物二 发狠  突然 一把 剩下 四根 药草 塞进 嘴里  怒道   偷,1,1
TRAIN_SENT_ID_286869,张宗诲,张齐贤,张齐贤 因此 被贬 为 太常卿 、 分司 西京 ， 张宗诲 贬为 海州 别驾 。,人物二 被贬 太常卿  分司 西京  人物一 贬为 海州 别驾,-1,0
