sent_id,entity1,entity2,sent,processed_sent,label,hard_match
TRAIN_SENT_ID_278273,王珂,刘涛,王烁 案件 追踪 : 与 刘涛 老公 王珂 有 过节 故意 挑衅,王烁 案件 追踪  人物二 老公 人物一 过节 故意 挑衅,1,0
TRAIN_SENT_ID_271977,林丹,谢杏芳,关于 成绩 和 恋情 的 关系 ， 林丹 谢杏芳 有 案例 在 先 。,成绩 恋情 关系  人物一 人物二 案例 先,1,0
TRAIN_SENT_ID_265166,尤二姐,贾琏,贾琏 尤二姐,人物二 人物一,1,0
TRAIN_SENT_ID_279604,晏紫,李圣根,李圣根 恋爱 经过 : 博客 殷勤 回帖 征服 晏紫,人物二 恋爱  博客 殷勤 回帖 征服 人物一,1,0
TRAIN_SENT_ID_264647,夏徵舒,夏姬,夏姬 是 御叔 之妻 、 夏徵舒 之母 。,人物二 御叔 之妻  人物一 之母,-1,1
TRAIN_SENT_ID_282031,施绩,朱然,吕据 历史 评价 : 陈寿 ： “ 朱治 、 吕范以 旧臣 任用 ， 朱然 、 朱桓 以勇烈 著闻 ， 吕据 、 朱异 、 施绩 咸有 将领 之才 ， 克绍 堂构 。,吕据 历史 评价  陈寿   朱治  吕范以 旧臣 任用  人物二  朱桓 以勇烈 著闻  吕据  朱异  人物一 咸有 将领 之才  克绍 堂构,-1,0
TRAIN_SENT_ID_274594,薛丁山,薛仁贵,如 《 梁山伯 与 祝英台 》 、 《 曹 按 杀子 救 亲娘 》 、 《 薛仁贵 征东 》 、 《 薛丁山 征西 》 、 《 乾隆 皇下 江南 》 等 。,梁山伯 祝英台    曹 杀子 救 亲娘    人物二 征东    人物一 征西    乾隆 皇下 江南,-1,0
TRAIN_SENT_ID_286140,安庆公主,欧阳伦,安庆公主 下嫁 欧阳伦,人物一 下嫁 人物二,1,1
TRAIN_SENT_ID_262743,熊美玲,林秋离,No.1 CALLME 林秋离 熊美玲 邝美云,人物二 人物一 邝美云,1,0
TRAIN_SENT_ID_271921,阎婆惜,宋江,卖俏行奸 词语 辨析 : 【 举例 造句 】 ： 这 阎婆惜 被 那 张三 小意儿 百依百随 ， 轻怜重惜 ， 卖俏迎奸 ， 引乱 这 婆娘 的 心 ， 如何 肯恋 宋江 ？,卖俏行奸 词语 辨析   举例 造句   人物一 张三 小意儿 百依百随  轻怜重惜  卖俏迎奸  引乱 婆娘 心  肯恋 人物二,1,0
TRAIN_SENT_ID_262813,熊美玲,林秋离,No.151 黑夜 白天 林秋离 熊美玲 黄莺莺,黑夜 白天 人物二 人物一 黄莺莺,1,0
TRAIN_SENT_ID_260036,严英云,徐良,尽管如此 ， 严英云 还是 不愿 接受 徐良 。,人物一 不愿 接受 人物二,1,0
TRAIN_SENT_ID_275108,朱七七,沈浪,对决 一 ： 朱七七 + 沈浪 VS 仁义 山庄 + 七大 高手,对决  人物一  人物二  仁义 山庄  七大 高手,1,0
TRAIN_SENT_ID_259100,刘备,刘禅,刘备 死 ， 亮辅 后主 刘禅 ， 以 丞相 封 武乡侯 ， 谥 为 忠 武侯 。,人物一 死  亮辅 后主 人物二  丞相 封 武乡侯  谥 忠 武侯,-1,0
TRAIN_SENT_ID_286731,苏誉,苏珩,苏珩 之师 ， 苏誉 之母 。,人物二 之师  人物一 之母,-1,0
TRAIN_SENT_ID_278202,江玉郎,江别鹤,他 写 江别鹤 与 江玉郎 ， 是 为了 衬托 江枫 的 正直 、 燕南天 的 豪爽 勇武 、 江 鱼儿 的 机智 聪颖 ， 两 相对 比 ， 奸者 更奸 、 义者 更义 。,写 人物二 人物一  衬托 江枫 正直  燕南天 豪爽 勇武  江 鱼儿 机智 聪颖  两 相对  奸者 更奸  义者 更义,-1,1
TRAIN_SENT_ID_273309,秦香莲,陈世美,秦香莲 毫无 察觉 ， 倾力 伺候 一家老小 ， 艰难 筹钱 送 陈世美 赴京 赶考 。,人物一 毫无 察觉  倾力 伺候 一家老小  艰难 筹钱 送 人物二 赴京 赶考,1,0
TRAIN_SENT_ID_283217,李大仁,程又青,李大仁 和 程又青 又 合作 了 ， 这次 还有 仔仔 !,人物一 人物二 合作  仔仔,1,0
TRAIN_SENT_ID_258635,刘禅,刘备,"武侯 村 人文地理 : 相传 刘备 在 永安 驾崩 后 ， 后主 刘禅 接任 ， 丞相 诸葛亮 被 封为 "" 武乡侯 "" ， 领 益州牧 。",武侯 村 人文地理  相传 人物二 永安 驾崩  后主 人物一 接任  丞相 诸葛亮 封为  武乡侯   领 益州牧,-1,0
TRAIN_SENT_ID_272459,包惜弱,杨铁心,李清 饰 杨铁心 ， 梅绮 饰 包惜弱,李清 饰 人物二  梅绮 饰 人物一,1,1
TRAIN_SENT_ID_279071,公孙绿萼,裘千尺,第二百 一 十二章 裘千尺 和 公孙绿萼,第二百 十二章 人物二 人物一,-1,0
TRAIN_SENT_ID_263227,胡亥,秦始皇,秦始皇 为什么 宠爱 胡亥 ？,人物二 宠爱 人物一,-1,0
TRAIN_SENT_ID_250064,张无忌,赵敏,而且 最后 的 结局 赵敏 还是 会 和 张无忌 结合 。,最后 结局 人物二 会 人物一 结合,1,1
TRAIN_SENT_ID_265194,尤二姐,贾琏,多 情人 的 尤二姐 ， 遇到 的 是 “ 寡情 人 ” 贾琏 。,情人 人物一  遇到  寡情  人物二,1,0
TRAIN_SENT_ID_271456,杨云,杨威,杨威 的 出现 让 杨云 非常 意外 ， 更 非常 惊喜 。,人物二 出现 人物一 非常 意外  更 非常 惊喜,1,1
TRAIN_SENT_ID_278944,汪涵,杨乐乐,主持 ： 李湘 、 汪涵 、 杨乐乐 、 李响 、 夏颖,主持  李湘  人物一  人物二  李响  夏颖,1,0
TRAIN_SENT_ID_259093,刘备,刘禅,历位 两国 ， 侍奉 三帝 （ 刘备 、 刘禅 、 司马炎 ） 。,历位 两国  侍奉 三帝  人物一  人物二  司马炎,-1,0
TRAIN_SENT_ID_253748,申雪,赵宏博,邓亚萍 、 高敏 、 李玲蔚 、 谢军 、 张怡宁 、 王义夫 、 刘翔 、 罗雪娟 、 王军霞 、 郎平 、 申雪 、 赵宏博 - - - - -,邓亚萍  高敏  李玲蔚  谢军  张怡宁  王义夫  刘翔  罗雪娟  王军霞  郎平  人物一  人物二,1,0
TRAIN_SENT_ID_262405,汪精卫,陈璧君,可是 ， 因为 保密工作 没 做好 ， 汪精卫 、 陈璧君 等 人 这次 在 北京 的 活动 以 失败 告终 。,保密工作 没 做好  人物一  人物二 北京 活动 失败 告终,1,0
TRAIN_SENT_ID_265624,袁泉,夏雨,濮存昕 、 陈建斌 、 张国立 、 孙海英 、 陈明昊 、 冯宪珍 、 冯远征 、 雷恪生 、 梁冠华 、 石维坚 、 吴越 、 夏雨 、 谢君豪 、 徐帆 、 徐峥 、 袁泉 … …,濮存昕  陈建斌  张国立  孙海英  陈明昊  冯宪珍  冯远征  雷恪生  梁冠华  石维坚  吴越  人物二  谢君豪  徐帆  徐峥  人物一,1,0
TRAIN_SENT_ID_273818,萧远山,萧峰,萧远山 全 没想到 抵御 ， 眼见 那老僧 的 右掌 正要 碰到 他 脑门 ， 那老僧 突然 大声 一喝 ， 右掌 改向 萧峰 击去 。,人物一 全 没想到 抵御  眼见 那老僧 右掌 正要 碰到 脑门  那老僧 突然 大声 一喝  右掌 改向 人物二 击去,-1,0
TRAIN_SENT_ID_260335,穆桂英,杨宗保,杨宗保 — — 穆桂英,人物二   人物一,1,0
TRAIN_SENT_ID_258621,刘禅,刘备,南蛮 军 、 刘备 军 、 孙权 军 、 曹操 军 、 刘禅 军 、 孙皓 军 、 曹丕 军 、 司马昭 军 、 名 将军 。,南蛮 军  人物二 军  孙权 军  曹操 军  人物一 军  孙皓 军  曹丕 军  司马昭 军  名 将军,-1,0
TRAIN_SENT_ID_250167,秦始皇,胡亥,俗传 秦始皇 起 罪恶 ， 胡亥 极 ， 得 其理 矣 。,俗传 人物一 罪恶  人物二 极  其理,-1,0
TRAIN_SENT_ID_268209,王小利,李琳,王小利 、 李琳 、 小 沈阳 、 李咏 、 金琳琳 、 邓雯心 。,人物一  人物二  沈阳  李咏  金琳琳  邓雯心,1,0
TRAIN_SENT_ID_273575,陈建州,范玮琪,"范玮琪 , 陈建州",人物二  人物一,1,0
TRAIN_SENT_ID_271790,阎婆惜,宋江,阎婆惜 有 了 新欢 ， 便 对 宋江 冷淡 起来 。,人物一 新欢  便 人物二 冷淡 起来,1,1
TRAIN_SENT_ID_256311,孙尚香,刘备,赵云 用 诸葛 所付 锦囊 之计 ， 诈称 曹操 袭取 荆州 ， 刘备 求 孙尚香 同走 ， 孙允 ， 辞母 同 刘潜 逃 。,赵云 诸葛 所付 锦囊 之计  诈称 曹操 袭取 荆州  人物二 求 人物一 同走  孙允  辞母 刘潜 逃,1,0
TRAIN_SENT_ID_285706,翁家明,俞小凡,郑少秋 、 俞小凡 、 张庭 、 郑佩佩 、 陈鸿烈 、 张振寰 、 铁梦秋 、 翁家明,郑少秋  人物二  张庭  郑佩佩  陈鸿烈  张振寰  铁梦秋  人物一,1,0
TRAIN_SENT_ID_249996,张无忌,赵敏,张无忌 右手 袍袖 一 拂 ， 将 暗器 卷入 衣袖 ， 左袖 拂出 ， 攻 向 赵敏 。,人物一 右手 袍袖 拂  暗器 卷入 衣袖  左袖 拂出  攻 人物二,1,0
TRAIN_SENT_ID_256176,蒋介石,宋美龄,抗战 末期 宋美龄 赴美 后 ， 蒋经国 曾 在 此 居住 ， 更 多 的 时候 则 是 蒋介石 的 “ 国宾 招待所 ” 。,抗战 末期 人物二 赴美  蒋经国 居住  更 人物一  国宾 招待所,1,0
TRAIN_SENT_ID_273316,秦香莲,陈世美,这个 没有 多少 慷慨悲歌 、 愤怒 指责 的 “ 冷处理 ” ， 把 秦香莲 的 心理 动作 推向 更 高 的 层次 ， 所以 让 陈世美 不寒而栗 ， 这是 第三个 台阶 。,没有 慷慨悲歌  愤怒 指责  冷处理   人物一 心理 动作 推向 更 高 层次  人物二 不寒而栗  这是 第三个 台阶,1,0
TRAIN_SENT_ID_252256,秦嘉,徐淑,参与 创意 、 修建 了 龙源园 、 兰州 绿色 文化 博览园 、 通渭 秦嘉 徐淑 公园 等 ， 并 参与 指导 了 省内 一批 文化 园区 的 建设 论证 。,参与 创意  修建 龙源园  兰州 绿色 文化 博览园  通渭 人物一 人物二 公园  参与 指导 省内 一批 文化 园区 建设 论证,1,0
TRAIN_SENT_ID_285530,石井裕也,满岛光,满岛光 和 石井裕也,人物二 人物一,1,0
TRAIN_SENT_ID_284493,罗立如,焦宛儿,焦宛儿 恼恨 她 砍断 了 师兄 罗立如 一条 手臂 ， 竟 跟 她 赌 了 。,人物二 恼恨 砍断 师兄 人物一 一条 手臂  竟 赌,1,0
TRAIN_SENT_ID_252217,秦嘉,徐淑,夫妻 诗人 秦嘉 、 徐淑 / 65,夫妻 诗人 人物一  人物二,1,0
TRAIN_SENT_ID_270656,赵宏博,申雪,一身 红与黑 的 申雪 和 赵宏博 ， 昨天下午 在 首体 综合 滑冰馆 第一次 对 媒体 展示 了 《 宋氏 王朝 》 的 磅礴 气势 。,一身 红与黑 人物二 人物一  昨天下午 首体 综合 滑冰馆 第一次 媒体 展示  宋氏 王朝  磅礴 气势,1,0
TRAIN_SENT_ID_285698,金与正,金正日,韩国 情报部门 官员 认为 金正恩 会 重用 金与正 ， 金正日 让 金敬姬 担任 了 党 部长 和 党 政治局 委员 。,韩国 情报部门 官员 认为 金正恩 会 重用 人物一  人物二 金敬姬 担任 党 部长 党 政治局 委员,-1,0
TRAIN_SENT_ID_260299,穆桂英,杨宗保,康山 ： 杨宗保 大战 穆桂英 山寨 现场 ， 红袄 军 起义 地址,康山  人物二 大战 人物一 山寨 现场  红袄 军 起义 地址,1,0
TRAIN_SENT_ID_256763,许婧,陈赫,陈赫 、 许婧,人物二  人物一,1,0
TRAIN_SENT_ID_253727,申雪,赵宏博,冰上 情侣 申雪 和 赵宏博 是 他们 一直 以来 的 偶像 。,冰上 情侣 人物一 人物二 一直 偶像,1,0
TRAIN_SENT_ID_287238,宁安公主,李和,宁安公主 下嫁 李和,人物一 下嫁 人物二,1,1
TRAIN_SENT_ID_259059,刘备,刘禅,此时 孙权 闻知 刘备 西征 ， 于是 遣 周善 引领 舟船 以迎 孙尚香 ， 幸得 赵云 与 张飞 勒兵 截江 ， 方重 夺 刘禅 。,孙权 闻知 人物一 西征  遣 周善 引领 舟船 以迎 孙尚香  幸得 赵云 张飞 勒兵 截江  方重 夺 人物二,-1,0
TRAIN_SENT_ID_266421,严世蕃,严嵩,世蕃 至京后 ， 林润 等 又 上 一疏 ， 力陈 严世蕃 诸罪 ， 词连 严嵩 冤杀 杨继盛 、 沈 钅 东事 。,世蕃 至京后  林润 一疏  力陈 人物一 诸罪  词连 人物二 冤杀 杨继盛  沈 钅 东事,-1,0
TRAIN_SENT_ID_268271,秦始皇,扶苏,《 秦始皇 》 扮演 小 扶苏,人物一  扮演 人物二,-1,0
TRAIN_SENT_ID_282861,柳摇金,韩翃,47 ． 柳摇金 与 韩翃 — — 金童玉女 感 天地,． 人物一 人物二   金童玉女 感 天地,1,-1
TRAIN_SENT_ID_258519,刘禅,刘备,刘备 为了 报仇 ， 丞相 诸葛亮 辅佐 刘禅 治理 蜀国 。,人物二 报仇  丞相 诸葛亮 辅佐 人物一 治理 蜀国,-1,0
TRAIN_SENT_ID_278798,任盈盈,任我行,出寺 后 正式 结交 任盈盈 ， 两人 相救 幽禁 梅庄 的 任我行 。,出寺 正式 结交 人物一  两人 相救 幽禁 梅庄 人物二,-1,0
TRAIN_SENT_ID_283436,张月亮,张铁林,（ 第四名 ） 张铁林 张月亮 （ 路障 使用 直通 卡 ， 反超 至 第一 ， 但 因 迷路 ， 最后 跌至 第四 ）,第四名  人物二 人物一  路障 使用 直通 卡  反超 第一  迷路  最后 跌至 第四,-1,1
TRAIN_SENT_ID_285652,黄兆函,黄宏,编剧 ： 王宏 、 张振彬 、 黄兆函 、 黄宏,编剧  王宏  张振彬  人物一  人物二,-1,0
TRAIN_SENT_ID_256221,孙尚香,刘备,刘备 可以 放 孙尚香 。,人物二 放 人物一,1,0
TRAIN_SENT_ID_258717,刘禅,刘备,刘备 、 诸葛亮 、 刘禅,人物二  诸葛亮  人物一,-1,0
TRAIN_SENT_ID_259191,刘备,刘禅,刘备 为了 防止 诸葛亮 取 刘禅 而代 之 ， 同时 颁给 李严 一道 密诏 。,人物一 防止 诸葛亮 取 人物二 而代  颁给 李严 一道 密诏,-1,1
TRAIN_SENT_ID_262959,熊美玲,林秋离,作曲 : 熊美玲 歌词 : 林秋离 演唱 : 蔡琴,作曲  人物一 歌词  人物二 演唱  蔡琴,1,0
TRAIN_SENT_ID_258897,王熙凤,贾琏,连 王熙凤 都 要 让 她 三分 ， 贾琏 见到 她 都 要 叫 她 “ 好 姐姐 ” 。,人物一 三分  人物二 见到  姐姐,1,0
TRAIN_SENT_ID_277269,王惠,郭德纲,郭德纲 的 固执 让 王惠 无可奈何 ， 她 把 身上 所有 的 钱 都 留给 了 他 ， 含着泪 回到 了 天津 。,人物二 固执 人物一 无可奈何  身上 钱 留给  含着泪 回到 天津,1,0
TRAIN_SENT_ID_287192,封皇后,拓跋沙漠汗,代 文帝 拓跋沙漠汗 封皇后,代 文帝 人物二 人物一,1,0
TRAIN_SENT_ID_273189,黄苗子,郁风,两 公婆 对话 / 黄苗子 郁风,两 公婆 对话  人物一 人物二,1,0
TRAIN_SENT_ID_262737,熊美玲,林秋离,No.104 苦酒 的 探戈 （ 台语 ） 林秋离 熊美玲 江蕙,苦酒 探戈  台语  人物二 人物一 江蕙,1,0
TRAIN_SENT_ID_286950,曹帅,黄英,恋爱 期间 ， 曹帅 两次 向 黄英 求婚 ， 其中 第二次 是 在 凌晨 四点 半 的 时候 。,恋爱 期间  人物一 两次 人物二 求婚  第二次 凌晨 四点 半,1,0
TRAIN_SENT_ID_287264,段逸尘,段誉,在 大理 皇宫 两次 与 段誉 过招 ， 被 段逸尘 所救 。,大理 皇宫 两次 人物二 过招  人物一 所救,-1,0
TRAIN_SENT_ID_265689,贾环,贾政,大色空 十二 贾氏 : ： 贾敬 、 贾赦 、 贾政 、 贾宝玉 、 贾琏 、 贾珍 、 贾环 、 贾蓉 、 贾兰 、 贾芸 、 贾蔷 、 贾芹 。,大色空 十二 贾氏   贾敬  贾赦  人物二  贾宝玉  贾琏  贾珍  人物一  贾蓉  贾兰  贾芸  贾蔷  贾芹,-1,0
TRAIN_SENT_ID_278586,岳灵珊,岳不群,从华山 下来 ， 令狐冲 的 世界 里 就 不再 只是 岳不群 和 岳灵珊 了 。,从华山 下来  令狐冲 世界 里 不再 人物二 人物一,-1,1
TRAIN_SENT_ID_287267,阮明园,阮海林,主编 ： 阮海林 副主编 ： 阮明园,主编  人物二 副主编  人物一,-1,0
TRAIN_SENT_ID_282559,寇乃馨,黄国伦,美味 鉴定家 ： 唐立淇 、 黄国伦 、 寇乃馨 、 欧子 豪 金牌 厨师,美味 鉴定家  唐立淇  人物二  人物一  欧子 豪 金牌 厨师,1,-1
TRAIN_SENT_ID_258495,刘禅,刘备,刘璩 ， 又名 刘虔 ， 刘备 之孙 ， 蜀汉 后主 刘禅 的 第七 子 。,刘璩  又名 刘虔  人物二 之孙  蜀汉 后主 人物一 第七 子,-1,-1
TRAIN_SENT_ID_279530,李芳远,李成桂,经过 两次 变乱 ， 痛失 爱子 和 宠臣 的 李成桂 对 李芳远 极其 反感 ， “ 常 郁郁不乐 ， 游幸 稍数 ” 。,两次 变乱  痛失 爱子 宠臣 人物二 人物一 极其 反感   常 郁郁不乐  游幸 稍数,-1,0
TRAIN_SENT_ID_284319,薛葵,薛刚,（ 四 兵士 、 四 女兵 、 韩龙 、 韩虎 、 薛葵 、 纪鸾英 、 薛刚 同 上 。 ）,四 兵士  四 女兵  韩龙  韩虎  人物一  纪鸾英  人物二,-1,0
TRAIN_SENT_ID_253587,沈浪,朱七七,众人 叹 这 世间 也 就 你 沈浪 治得 住 这 令人 头大 的 朱七七 。,众人 叹 世间 人物一 治得 住 令人 头大 人物二,1,0
TRAIN_SENT_ID_260661,李莎,李立三,李立三 故居 开放 ， 李莎 第一次 回 婆家,人物二 故居 开放  人物一 第一次 回 婆家,1,0
TRAIN_SENT_ID_261476,莫绍谦,慕咏飞,结婚 当夜 ， 慕咏飞 尖酸刻薄 的 谩骂 逼 得 莫绍谦 与其 分居 。,结婚 当夜  人物二 尖酸刻薄 谩骂 逼 人物一 分居,1,0
TRAIN_SENT_ID_273216,秦香莲,陈世美,欧阳文慧 ， 影视剧 编剧 ， 参与 制作 过 电影 《 下一代 》 《 碎琴楼 》 《 陈世美 与 秦香莲 》 。,欧阳文慧  影视剧 编剧  参与 制作 电影  下一代   碎琴楼   人物二 人物一,1,0
TRAIN_SENT_ID_266128,齐姜,申生,( 11 ) 齐姜 ： 申生 的 亡母 。,人物一  人物二 亡母,-1,0
TRAIN_SENT_ID_269809,李讷,江青,江青 与 李讷,人物二 人物一,-1,0
TRAIN_SENT_ID_271183,李治,唐太宗李世民,唐太宗李世民 和 唐高宗 李治 两世六伐 高句丽 ， 长山 列岛 重 入 唐朝 版图 。,人物二 唐高宗 人物一 两世六伐 高句丽  长山 列岛 重 入 唐朝 版图,-1,0
TRAIN_SENT_ID_277480,余鱼同,李沅芷,群雄 决定 进京 ， 余鱼同 独取 水路 ， 被 关东 三魔 和 言伯乾 追杀 ， 幸 被 热恋 他 的 李沅芷 所救 。,群雄 决定 进京  人物一 独取 水路  关东 三魔 言伯乾 追杀  幸 热恋 人物二 所救,1,0
TRAIN_SENT_ID_259337,刘备,刘禅,刘弘 孙子 : 刘禅 ， 刘备 长子 ， 蜀汉 后主 。,刘弘 孙子  人物二  人物一 长子  蜀汉 后主,-1,-1
TRAIN_SENT_ID_268109,樊梨花,薛丁山,第二十六回 鲁国公 三赴 寒江关 薛丁山 三请 樊梨花,第二十六回 鲁国公 三赴 寒江关 人物二 三请 人物一,1,0
TRAIN_SENT_ID_258667,刘禅,刘备,刘备 逝世 于 白帝城 后 ， 丞相 诸葛亮 受 托孤 重任 辅助 后主 刘禅 ， 蜀汉 国力 慢慢 恢复 。,人物二 逝世 白帝城  丞相 诸葛亮 受 托孤 重任 辅助 后主 人物一  蜀汉 国力 慢慢 恢复,-1,0
TRAIN_SENT_ID_277253,王惠,郭德纲,王惠 在 医院 里 住 了 两天 ， 郭德纲 形影不离 地守护 了 两天 。,人物一 医院 里 住 两天  人物二 形影不离 地守护 两天,1,0
TRAIN_SENT_ID_278934,汪涵,杨乐乐,主持人 ： 汪涵 陈鲁豫 何炅 杨乐乐 。,主持人  人物一 陈鲁豫 何炅 人物二,1,0
TRAIN_SENT_ID_278656,唐雪见,景小楼,师母 ： 唐雪见 （ 见 仙 三 外传 景小楼 支线 ）,师母  人物一  见 仙 三 外传 人物二 支线,-1,0
TRAIN_SENT_ID_287062,伊丹十三,伊丹万作,本片 原由 伊丹万作 （ 伊丹十三 之 父 ） 执导 ， 根据 岩下俊作 的 《 富岛 松 五郎 传 》 改编 ， 后 因 伊丹 卧病 ， 改由 稻垣 浩 拍摄 完成 。,本片 原由 人物二  人物一 父  执导  岩下俊作  富岛 松 五郎 传  改编  伊丹 卧病  改由 稻垣 浩 拍摄 完成,-1,-1
TRAIN_SENT_ID_273109,谭蓓蓓,白云江,7 · 24 桦南 孕妇 猎艳 杀人 案二审 开庭 : 被告人 白云江 被判 死刑 、 谭蓓蓓 被判 无期 。,桦南 孕妇 猎艳 杀人 案二审 开庭  被告人 人物二 被判 死刑  人物一 被判 无期,1,-1
TRAIN_SENT_ID_281954,萧淑妃,李治,萧淑妃 唐高宗 李治 淑 妃,人物一 唐高宗 人物二 淑 妃,1,0
TRAIN_SENT_ID_272855,杨威,杨云,杨威 的 出现 让 杨云 非常 意外 ， 更 非常 惊喜 。,人物一 出现 人物二 非常 意外  更 非常 惊喜,1,1
TRAIN_SENT_ID_283808,余姚公主,王溥,余姚公主 和 王溥 的 婚姻 是 典型 的 政治婚姻 。,人物一 人物二 婚姻 典型 政治婚姻,1,1
TRAIN_SENT_ID_268363,秦始皇,扶苏,扶苏 史籍 记载 : 《 史记 · 卷 六 · 秦始皇 本纪 第六 》,人物二 史籍 记载   史记  卷 六  人物一 本纪 第六,-1,0
TRAIN_SENT_ID_284478,刘弘,刘雄,玄德祖 刘雄 ， 父 刘弘 。,玄德祖 人物二  父 人物一,-1,-1
TRAIN_SENT_ID_273411,杨乐乐,汪涵,照片 里 初为人 父母 的 汪涵 杨乐乐 幸福 满满 ， 彼此 深情 对 望 。,照片 里 初为人 父母 人物二 人物一 幸福 满满  深情,1,1
TRAIN_SENT_ID_262777,熊美玲,林秋离,No.175 当 你 的 女朋友 林秋离 熊美玲 桂侠,女朋友 人物二 人物一 桂侠,1,1
TRAIN_SENT_ID_282756,苏三,王景隆,苏三 暗助 王景隆 盘缠 ， 使 他 得以 还乡 学习 ， 自己 也 从此 不再 接客 ， 又 叫 街上 百姓 作证 ， 用 计 赎回 自由 身 ， 住 在 百花 楼上 。,人物一 暗助 人物二 盘缠  得以 还乡 学习  不再 接客  街上 百姓 作证  计 赎回 自由 身  住 百花 楼上,1,0
TRAIN_SENT_ID_284214,高阳公主,万安国,高阳公主 魏书 : 《 魏书 . 卷 三十四 列传 第二十二 王洛 儿 车路头 卢鲁元 陈建 万安国 》,人物一 魏书   魏书  卷 三十四 列传 第二十二 王洛 车路头 卢鲁元 陈建 人物二,-1,0
TRAIN_SENT_ID_255892,蒋介石,宋美龄,蒋介石 虽 明知 冯是 托病 ， 但 也 曾 两度 偕 宋美龄 亲往 探视 慰问 ， 以示 关切 。,人物一 明知 冯是 托病  两度 偕 人物二 亲往 探视 慰问  以示 关切,1,0
TRAIN_SENT_ID_285011,庄月明,李嘉诚,从此 ， 庄月明 就 成 了 李嘉诚 的 广东话 老师 。,人物一 成 人物二 广东话 老师,1,0
TRAIN_SENT_ID_278761,许广平,周海婴,周海婴 是 周树人 ( 鲁迅 ) 和 许广平 的 独子 。,人物二 周树人  鲁迅  人物一 独子,-1,-1
TRAIN_SENT_ID_259074,刘备,刘禅,刘备 逝世 于 白帝城 后 ， 丞相 诸葛亮 受 托孤 重任 辅助 后主 刘禅 ， 蜀汉 国力 慢慢 恢复 。,人物一 逝世 白帝城  丞相 诸葛亮 受 托孤 重任 辅助 后主 人物二  蜀汉 国力 慢慢 恢复,-1,0
TRAIN_SENT_ID_276484,尤氏,贾珍,若非 尤氏 患病 ， 贾珍 难于 相请 。,人物一 患病  人物二 难于 相请,1,0
TRAIN_SENT_ID_271580,毛岸青,毛泽东,王鹤滨 把 大 信封 拿 回 宿舍 ， 抽出来 一看 ， 是 毛岸青 写给 毛泽东 的 信 。,王鹤滨 信封 回 宿舍  抽出来 一看  人物一 写给 人物二 信,-1,0
TRAIN_SENT_ID_268636,潘金莲,武大郎,武大郎 （ 夜观 AV 的 小弟 ， 一直 迷恋 潘金莲 ， 但 却 始终 未得 伊人 芳心 ）,人物二  夜观  小弟  一直 迷恋 人物一  始终 未得 伊人 芳心,1,0
TRAIN_SENT_ID_273518,殷素素,张翠山,武功 ： 张翠山 和 殷素素 还有 谢逊 教 他 的 ， 名字 不明 。,武功  人物二 人物一 谢逊 教  名字 不明,1,0
TRAIN_SENT_ID_261320,朱兆祥,胡静,朱兆祥 当机立断 带 着 胡静 跳车 逃命 ， 等等 ， 怎么 一下 车 ， 暴徒 们 就 笑场 了 ？,人物一 当机立断 带 人物二 跳车 逃命   一下 车  暴徒 笑场,1,0
TRAIN_SENT_ID_269222,陆雪琪,张小凡,葩 葩 相思 引 : 陆雪琪 - 葩 葩 鬼厉 / 张小凡 - 洋葱头,葩 葩 相思 引  人物一  葩 葩 鬼厉  人物二  洋葱头,1,0
TRAIN_SENT_ID_251169,廖仲恺,何香凝,何时 始识 廖仲恺 、 何香凝,始识 人物一  人物二,1,0
TRAIN_SENT_ID_264409,杨天佑,杨婵,大 金乌 奉命 下令 诛杀 杨家 满门 ， 杀 了 杨天佑 和 杨蛟 ， 杨戬 和 杨婵 在 天 蓬元帅 的 相助 之下 幸免于难 。,金乌 奉命 下令 诛杀 杨家 满门  杀 人物一 杨蛟  杨戬 人物二 天 蓬元帅 相助 之下 幸免于难,-1,0
TRAIN_SENT_ID_258355,张兆和,沈从文,第六 封 沈从文 致 张兆和 （ 1934.1 . 13 ）,第六 封 人物二 人物一,1,0
TRAIN_SENT_ID_273102,谭蓓蓓,白云江,白云江 、 谭蓓蓓 当庭 表示 后悔 ， 并 对 遇害 家庭 表示 对不起 。,人物二  人物一 当庭 表示 后悔  遇害 家庭 表示 对不起,1,0
TRAIN_SENT_ID_277323,宁风致,宁荣荣,九 宝琉璃 （ 九彩 神女 ） ： 宁荣荣 宁风致 、 古榕 、 尘心 、 波塞 西 、 白沉香 、 小白 等 。,九 宝琉璃  九彩 神女   人物二 人物一  古榕  尘心  波塞 西  白沉香  小白,-1,1
TRAIN_SENT_ID_284461,张妃,张承,张妃 父母 : 张承 ， 字仲嗣 ， 官至 濡 须 都督 、 奋威 将军 ， 都 乡侯 ， 卒 谥号 定 。,人物一 父母  人物二  字仲嗣  官至 濡 须 都督  奋威 将军  乡侯  卒 谥号 定,-1,0
TRAIN_SENT_ID_274433,仲满,武宗文,即使 是 在 “ 数落 ” 丈夫 仲满 的 不是 ， 但 武宗文 的 脸上 始终 都 是 幸福 的 表情 。,数落  丈夫 人物一  人物二 脸上 始终 幸福 表情,1,0
TRAIN_SENT_ID_279402,张维,陆士嘉,20 伉俪 爱国情 深处 — — 张维 与 陆士嘉 故居,伉俪 爱国情 深处   人物一 人物二 故居,1,0
TRAIN_SENT_ID_274668,傅敏,傅雷,《 傅聪版 傅雷 家书 》 是 由 出版社 出版 的 一部 教育 作品 ， 作者 是 傅敏 。,傅聪版 人物二 家书  出版社 出版 一部 教育 作品  作者 人物一,-1,0
TRAIN_SENT_ID_275306,潘巧云,杨雄,杨雄 醉 骂 潘巧云,人物二 醉 骂 人物一,1,0
TRAIN_SENT_ID_272449,包惜弱,杨铁心,祖父母 ： 杨铁心 、 包惜弱,祖父母  人物二  人物一,1,0
TRAIN_SENT_ID_272376,夏紫薇,夏雨荷,夏紫薇 / 夏雨荷,人物一  人物二,-1,0
TRAIN_SENT_ID_266968,关索,关羽,关羽 像 左侧 为 关平 、 关兴 、 王甫 ， 右侧 为 周仓 、 关索 、 赵累 。,人物二 左侧 关平  关兴  王甫  右侧 周仓  人物一  赵累,-1,0
TRAIN_SENT_ID_264112,刘备,孙尚香,因为 不想 和 五虎将 及 孙尚香 分开 ， 所以 非常 害怕 真 刘备 治愈 的 那 一天 到来 。,不想 五虎将 人物二 分开  非常 害怕 真 人物一 治愈 一天 到来,1,0
