sent_id,entity1,entity2,sent,processed_sent,human
TRAIN_SENT_ID_259373,葛玄,左慈,三国 以后 ， 一些 著名 道士 相继 入 闽 修炼 ， 如 左慈 、 葛玄 、 介琰 等 ， 隐居 在 闽东 。,三国 以后  著名 道士 相继 入 闽 修炼  人物二  人物一  介琰  隐居 闽东,-1
TRAIN_SENT_ID_257486,姜昆,马季,主持人 有 马季 、 姜昆 、 张喻 、 朱苑宜 （ 台湾 ） 、 斑斑 （ 香港 ） 。,主持人 人物二  人物一  张喻  朱苑宜  台湾   斑斑  香港,-1
TRAIN_SENT_ID_285957,谢天顺,郭荣起,郭荣起 - - 常宝霆 、 郭宝 明 、 杜 三宝 、 杨少华 、 谢天顺 、 张宝 如,人物二   常宝霆  郭宝 明  杜 三宝  杨少华  人物一  张宝,-1
TRAIN_SENT_ID_255320,卫夫人,王羲之,绛 帖 选帖 范围 是 以 《 淳化阁 帖 》 为 基础 ， 所收佳 帖 有 李斯 、 诸葛亮 、 王羲之 、 王献之 、 卫夫人 、 张旭 、 怀素 、 李白 、 颜真卿 等 人 的 名作 。,绛 帖 选帖 范围  淳化阁 帖  基础  所收佳 帖 李斯  诸葛亮  人物二  王献之  人物一  张旭  怀素  李白  颜真卿 名作,-1
TRAIN_SENT_ID_273668,姜子牙,元始天尊,真武 封神 封神 场景 : 元始天尊 命 姜子牙 在 岐山 修建 ， 上 张挂 封神榜 。,真武 封神 封神 场景  人物二 命 人物一 岐山 修建  张挂 封神榜,-1
TRAIN_SENT_ID_253854,赵合德,赵飞燕,赵飞燕 、 赵合德 ， 那张 被 欲望 撑破 的 脸,人物二  人物一  那张 欲望 撑破 脸,-1
TRAIN_SENT_ID_249300,陆无双,程英,"小龙女 的 经历 是否 会 有 不同 , 程英 、 陆无双 是否 还会 孤独 一生 ?",小龙女 经历 是否 会 不同  人物二  人物一 是否 还会 孤独 一生,-1
TRAIN_SENT_ID_270566,全真七子,王重阳,陈抟 、 王重阳 、 全真七子 、 张三丰 ， 都 是 武功 出神入化 之 人 。,陈抟  人物二  人物一  张三丰  武功 出神入化,-1
TRAIN_SENT_ID_286374,于小飞,韩兰成,放驴 小子 于小飞 师从 韩兰成 ， 并 与 师父 一同 演绎 了 此 节目 ， 受到 广大 电视观众 的 好评 。,放驴 小子 人物一 师从 人物二  师父 一同 演绎 节目  广大 电视观众 好评,-1
TRAIN_SENT_ID_266060,张学思,张学良,一般而言 ， 以字定 辈分 者 ， 都 将 这些 辈分 字 置于 姓 之后 ， 如 张学良 、 张学思 、 张学铭 。,一般而言  以字定 辈分  辈分 字 置于 姓 之后  人物二  人物一  张学铭,-1
TRAIN_SENT_ID_277959,杨少华,郭荣起,郭荣起 ― ― 常宝霆 、 郭宝 明 、 杜 三宝 、 杨少华 、 谢天顺 、 张宝 如,人物二 ― ― 常宝霆  郭宝 明  杜 三宝  人物一  谢天顺  张宝,-1
TRAIN_SENT_ID_271212,张翠山,张三丰,得 承 张三丰 武术 及 为 人 处世之道 ， 思想 端正 不 歪 ； 加上 资质聪颖 廿来 岁 已练 得 一身 高强 武功 ， 江湖人称 银勾铁划 张翠山 张五侠 。,承 人物二 武术 处世之道  思想 端正 歪  加上 资质聪颖 廿来 岁 已练 一身 高强 武功  江湖人称 银勾铁划 人物一 张五侠,-1
TRAIN_SENT_ID_275843,陆无双,李莫愁,第四代 ： 洪凌波 、 陆无双 （ 两人 师从 李莫愁 ） 、 杨过 （ 师从 小龙女 ）,第四代  洪凌波  人物一  两人 师从 人物二   杨过  师从 小龙女,-1
TRAIN_SENT_ID_266193,李昌镐,曹薰铉,虽然 日本队 主帅 加藤 正夫 力克 曹薰铉 ， 但 还是 没能 闯过 最后 李昌镐 一关 。,日本队 主帅 加藤 正夫 力克 人物二  没能 闯过 最后 人物一 一关,-1
TRAIN_SENT_ID_252466,颜回,孔子,颜回 在 孔子 面前 ， 连屁 都 不敢 放 一个 ， 子路 可 没 那么 多 心眼 ， 经常 鼻子 不是 鼻子 脸 不是 脸 ， 让 老师 下不来台 。,人物一 人物二 面前  连屁 不敢 放 一个  子路 没 心眼  经常 鼻子 鼻子 脸 脸  老师 下不来台,-1
TRAIN_SENT_ID_257784,林平之,岳不群,与 岳不群 : 何宝生 版 林平之 ( 42 张 ),人物二  何宝生 版 人物一   张,-1
TRAIN_SENT_ID_266206,范遥,赵敏,汝阳王 爱女 赵敏 ， 自小 随 范遥 习武 ， 二人 情同 师徒 ， 直到 遇 教主 张无忌 才 恢复 身份 。,汝阳王 爱女 人物二  自小 人物一 习武  二人 情同 师徒  遇 教主 张无忌 恢复 身份,-1
TRAIN_SENT_ID_271574,赵敏,王保保,（ 王保保 还有 可能 是 “ 赵敏 ” 和 “ 张无忌 ” 的 孩子 ）,人物二 可能  人物一   张无忌  孩子,-1
TRAIN_SENT_ID_251909,曹薰铉,李昌镐,韩国 著名 高手 : 韩国 四老 天王 ： 李昌镐 、 曹薰铉 、 徐奉洙 、 刘昌赫,韩国 著名 高手  韩国 四老 天王  人物二  人物一  徐奉洙  刘昌赫,-1
TRAIN_SENT_ID_281538,于佑福,高德明,高德明 — — 于佑福 、 冯大荃 、 张松青,人物二   人物一  冯大荃  张松青,-1
TRAIN_SENT_ID_264598,凌波,凌音,凌音 找 凌波 ， 告诉 她 自己 是 第一次 代表 师门 出席 武林 盛事 ， 有些 紧张 。,人物二 找 人物一  告诉 第一次 代表 师门 出席 武林 盛事  紧张,-1
TRAIN_SENT_ID_268823,洪凌波,李莫愁,第四代 ： 洪凌波 、 陆无双 （ 两人 师从 李莫愁 ） 、 杨过 （ 师从 小龙女 ）,第四代  人物一  陆无双  两人 师从 人物二   杨过  师从 小龙女,-1
TRAIN_SENT_ID_277419,尹夏沫,尹澄,画展 之初 ， 前来 参观 的 人 并不多 ， 除了 尹夏沫 、 欧辰 和 珍恩 每天 都 在 ， 大多数 来 的 是 尹澄 生前 的 老师 、 好友 和 同学 。,画展 之初  前来 参观 并不多  人物一  欧辰 珍恩 每天  大多数 人物二 生前 老师  好友 同学,-1
TRAIN_SENT_ID_260594,金敬姬,金正日,金正恩 的 爷爷 金日成 有过 两任 妻子 ， 第一任 妻子 金正淑 ， 生有 两子 一女 ： 金正日 、 金 万一 、 金敬姬 。,金正恩 爷爷 金日成 有过 两任 妻子  第一任 妻子 金正淑  生有 两子 一女  人物二  金  人物一,-1
TRAIN_SENT_ID_271543,应天文,韩慕侠,加上 韩慕侠 自称 在 九华山 寻 到 董海川 的 师弟 应天文 ， 学 的 “ 反 八卦 （ 掌 ） ” 技巧 ， 引起 张占魁 的 不满 。,加上 人物二 自称 九华山 寻 董海川 师弟 人物一  学  反 八卦  掌   技巧  引起 张占魁 不满,-1
TRAIN_SENT_ID_255290,卫夫人,王羲之,③ 卫氏 夫人 ： 卫夫人 是 运城 夏县 人 ， 曾任 王羲之 的 老师 。,③ 卫氏 夫人  人物一 运城 夏县  曾任 人物二 老师,-1
TRAIN_SENT_ID_257450,姜昆,马季,与 著名 相声 演员 马季 ， 姜昆 ， 夏雨田 等 是 老友 。,著名 相声 演员 人物二  人物一  夏雨田 老友,-1
TRAIN_SENT_ID_260583,金敬姬,金正日,金日成 的 第一任 妻子 为 金正淑 ， 生有 两子 一女 ， 两子 分别 是 金正日 、 金 万一 和 女儿 金敬姬 。,金日成 第一任 妻子 金正淑  生有 两子 一女  两子 人物二  金 女儿 人物一,-1
TRAIN_SENT_ID_282232,王辰,王岩,王岩 王辰 大哥 ， 实力 极高 ， 十分 爱护 弟弟 。,人物二 人物一 大哥  实力 极高  十分 爱护 弟弟,-1
TRAIN_SENT_ID_261684,程英,陆无双,表姐 （ 陆无双 专用 ） 柴蔚版 程英 ( 6 张 ),表姐  人物二 专用  柴蔚版 人物一   张,-1
TRAIN_SENT_ID_248976,吕洞宾,韩湘子,一日 ， 游经 城北 玉屏 峰 ， 见 韩湘子 、 吕洞宾 、 张果老 等 八仙 从 东边 天际 乘 祥云 飘然而至 ， 坐在 石莲 峰山 上 吹拉弹唱 。,一日  游经 城北 玉屏 峰  见 人物二  人物一  张果老 八仙 东边 天际 祥云 飘然而至  坐在 石莲 峰山 吹拉弹唱,-1
TRAIN_SENT_ID_271287,马季,侯宝林,天津 著名 的 相声 演员 有 ： 马三立 、 侯宝林 、 常宝堃 、 高英培 、 马季 、 冯巩 、 牛群 、 郭德纲 、 于谦 等 。,天津 著名 相声 演员  马三立  人物二  常宝堃  高英培  人物一  冯巩  牛群  郭德纲  于谦,-1
TRAIN_SENT_ID_284536,杨长在,杨志光,杨志光 - - 杨长在 、 张国庆,人物二   人物一  张国庆,-1
TRAIN_SENT_ID_257437,姜昆,马季,马季 、 姜昆 、 张喻 、 朱苑宜 （ 台湾 ） 、 斑斑 （ 香港 ）,人物二  人物一  张喻  朱苑宜  台湾   斑斑  香港,-1
TRAIN_SENT_ID_275250,汤潮,赵本山,而 记者 昨日 又 从 本山 传媒 集团 获悉 ， 赵本山 计划 力推 “ 潮阳 兄弟 ” 组合 ， 汤潮 小 沈阳 有望 搭档 上 春晚 。,记者 昨日 本山 传媒 集团 获悉  人物二 计划 力推  潮阳 兄弟  组合  人物一 沈阳 有望 搭档 春晚,-1
TRAIN_SENT_ID_255223,赵海燕,赵本山,明星阵容 ： 赵本山 、 宋小宝 、 赵海燕 、 李宇春 、 萧敬腾 、 张柏芝 、 小 沈阳 、 后 街 男孩 、 SJ - M 等 。,明星阵容  人物二  宋小宝  人物一  李宇春  萧敬腾  张柏芝  沈阳  街 男孩,-1
TRAIN_SENT_ID_273676,姜子牙,元始天尊,封 神台 是 元始天尊 命 姜子牙 在 岐山 修建 ， 上 张挂 封神榜 。,封 神台 人物二 命 人物一 岐山 修建  张挂 封神榜,-1
TRAIN_SENT_ID_264532,岳云鹏,郭德纲,郭德纲 、 赵本山 、 岳云鹏 、 三侠五义 、 隋唐演义 、 千古 功臣 张学良 等 。,人物二  赵本山  人物一  三侠五义  隋唐演义  千古 功臣 张学良,-1
TRAIN_SENT_ID_272652,邢德全,邢夫人,《 红楼梦 》 第七 五 回 ： “ 近日 邢夫人 的 胞弟 邢德全 也 酷好 如此 ， 所以 也 在 其中 。 ”,红楼梦  第七 五 回   近日 人物二 胞弟 人物一 酷好,-1
TRAIN_SENT_ID_285959,谢天顺,郭荣起,郭荣起 ― ― 常宝霆 、 郭宝 明 、 杜 三宝 、 杨少华 、 谢天顺 、 张宝 如,人物二 ― ― 常宝霆  郭宝 明  杜 三宝  杨少华  人物一  张宝,-1
TRAIN_SENT_ID_271248,马季,侯宝林,著名 表演 大师 有 侯宝林 、 马三立 、 常宝堃 、 苏文茂 、 马季 等 多 人 ， 后起之秀 有 姜昆 、 郭德纲 等 人 。,著名 表演 大师 人物二  马三立  常宝堃  苏文茂  人物一  后起之秀 姜昆  郭德纲,-1
TRAIN_SENT_ID_251603,穆春,穆弘,揭阳 镇 的 李俊 、 李立 、 穆弘 、 穆春 、 张横 、 张顺 、 童威 、 童猛 、 薛永 、 侯健 。,揭阳 镇 李俊  李立  人物二  人物一  张横  张顺  童威  童猛  薛永  侯健,-1
TRAIN_SENT_ID_256457,周武,周文,周家 老四 ， 周文 、 周武 、 周双 的 弟弟 ， 周家 最小 的 儿子 。,周家 老四  人物二  人物一  周双 弟弟  周家 最小 儿子,-1
TRAIN_SENT_ID_259756,李偲菘,李伟菘,作词 ： 李煜 作曲 ： 李伟菘 、 李偲菘 绝代 双雄 插曲 : 截图 ( 30 张 ),作词  李煜 作曲  人物二  人物一 绝代 双雄 插曲  截图   张,-1
TRAIN_SENT_ID_250702,鲁西西,皮皮鲁,一般 童装 以 著名 形象 “ 皮皮鲁 ” 、 “ 鲁西西 ” 作为 商标 ， 高档 童装 则 以 另 两个 著名 形象 “ 舒克 ” 、 “ 贝塔 ” 作为 商标 。,童装 著名 形象  人物二    人物一  商标  高档 童装 两个 著名 形象  舒克    贝塔  商标,-1
TRAIN_SENT_ID_253843,赵合德,赵飞燕,后世 比较 著名 的 姊妹 同嫁 一夫 包括 ： 赵飞燕 与 赵合德 、 大 周后 与 小 周后 。,后世 比较 著名 姊妹 同嫁 一夫 包括  人物二 人物一  周后 周后,-1
TRAIN_SENT_ID_282104,白如海,李苦禅,（ 画家 ） : 白如海 ， 笔名 晓峰 ， 师从 李苦禅 大师 门生 申西岚 先生 。,画家   人物一  笔名 晓峰  师从 人物二 大师 门生 申西岚 先生,-1
TRAIN_SENT_ID_273680,姜子牙,元始天尊,1 简介 : 元始天尊 命 姜子牙 在 岐山 修建 ， 上 张挂 封神榜 。,简介  人物二 命 人物一 岐山 修建  张挂 封神榜,-1
TRAIN_SENT_ID_261709,汤镇业,汤镇宗,《 乾隆 那些 事 》 饰演 校尉 瑞察 导演 ： 李力安 合作 演员 ： 汤镇宗 汤镇业 军装 靓照 ( 6 张 ),乾隆 事  饰演 校尉 瑞察 导演  李力安 合作 演员  人物二 人物一 军装 靓照   张,-1
TRAIN_SENT_ID_258127,刘星,夏雪,可 夏雪 接二连三 地 吃 了 闭门羹 ， 最后 不得不 论落 为 向 刘星 小雨 借钱 的 地步 ， 可 两个 弟弟 却 还 缠 着 她 买 这 买 那 。,人物二 接二连三 吃 闭门羹  最后 不得不 论落 人物一 小雨 借钱 地步  两个 弟弟 缠 买 买,-1
TRAIN_SENT_ID_266144,李昌镐,曹薰铉,虽然 日本队 主将 加藤 正夫 力克 曹薰铉 ， 但 还是 没能 闯过 最后 李昌镐 一关 。,日本队 主将 加藤 正夫 力克 人物二  没能 闯过 最后 人物一 一关,-1
TRAIN_SENT_ID_251589,穆春,穆弘,穆弘 、 穆春 、 张横 这才 得知 宋江 的 身份 ， 都 是 纳头 便 拜 ， 请罪 不已 。,人物二  人物一  张横 这才 得知 宋江 身份  纳头 便 拜  请罪 不已,-1
TRAIN_SENT_ID_255411,罗成,秦琼,"走向 传奇 内容简介 : 传奇世界 无处 不 传奇 , 关公 秦琼 比 义气 , 赵云 罗成 赛 枪法 , 张翼德 尉迟恭 谁 脸 更 黑 , 李元霸 和 李存孝 谁 更 牛 。",走向 传奇 内容简介  传奇世界 无处 传奇  关公 人物二 义气  赵云 人物一 赛 枪法  张翼德 尉迟恭 脸 更 黑  李元霸 李存孝 更 牛,-1
TRAIN_SENT_ID_259682,蒋巍,高占全,其 多部 文学作品 被 著名 导演 、 作家 高占全 （ 蒋巍 高徒 ） 改编 为 影视剧 搬上 屏幕 。,多部 文学作品 著名 导演  作家 人物二  人物一 高徒  改编 影视剧 搬上 屏幕,-1
TRAIN_SENT_ID_273644,姜子牙,元始天尊,封 神台 建造 始末 : 元始天尊 命 姜子牙 在 岐山 修建 ， 上 张挂 封神榜 。,封 神台 建造 始末  人物二 命 人物一 岐山 修建  张挂 封神榜,-1
TRAIN_SENT_ID_268808,洪凌波,李莫愁,由此可见 洪凌波 虽 师从 于 李莫愁 ， 但 无 暴戾 之心 。,人物一 师从 人物二  暴戾 之心,-1
TRAIN_SENT_ID_248987,吕洞宾,韩湘子,于是 铁拐李 把 拐杖 投到 水里 ， 自己 立在 水面 过海 ； 韩湘子 以花 蓝技水 而 渡 ； 吕洞宾 、 蓝采和 、 张果老 、 汉 钟离 、 曹国舅 。,铁拐李 拐杖 投到 水里  立在 水面 过海  人物二 以花 蓝技水 渡  人物一  蓝采和  张果老  汉 钟离  曹国舅,-1
TRAIN_SENT_ID_250567,鲁西西,皮皮鲁,皮皮鲁 和 鲁西西 幕后 制作 : 花絮 ( 4 张 ),人物二 人物一 幕后 制作  花絮   张,-1
TRAIN_SENT_ID_269784,池田菜沙,池田华菜,咲日 和 （ 池田华菜 、 池田绯菜 、 池田城菜 、 池田菜沙 ） 森永 理科 游戏 : D → A ： WHITE （ ク ー ）,咲日  人物二  池田绯菜  池田城菜  人物一  森永 理科 游戏   →     ク ー,-1
