sent_id,entity1,entity2,sent,processed_sent,human
TRAIN_SENT_ID_252460,颜回,孔子,然 李光却 学习 古代 圣贤 孔子 、 颜回 安贫乐道 的 精神 以 之 自慰 ， 来 之 则安之 ； 又 以 战国 冯谖 叹 “ 食无鱼 ” 来 表示 对 朝廷 当道者 不满 。,然 李光却 学习 古代 圣贤 人物二  人物一 安贫乐道 精神 自慰  则安之  战国 冯谖 叹  食无鱼  表示 朝廷 当道者 不满,-1
TRAIN_SENT_ID_257031,洪敬尧,洪荣宏,其中 与 前妻 生 的 三个 儿子 洪荣宏 、 洪敬尧 以及 洪荣 良 ， 目前 皆 从事 音乐 以及 演艺 相关 工作 。,前妻 生 三个 儿子 人物二  人物一 洪荣 良  目前 皆 从事 音乐 演艺 相关 工作,-1
TRAIN_SENT_ID_275821,程万牛,程铁牛,程铁牛 、 程万牛 出场 ， 自然 是 当场出丑 。,人物二  人物一 出场  自然 当场出丑,-1
TRAIN_SENT_ID_279511,殷梨亭,张三丰,张三丰 百岁 生日 那天 ， 纪晓芙 一 露面 ， 殷梨亭 不但 脸红 ， 竟然 连 招呼 都 不敢 上去 打 一声 。,人物二 百岁 生日 那天  纪晓芙 露面  人物一 脸红  竟然 招呼 不敢 上去 一声,-1
TRAIN_SENT_ID_259946,周志文,周志康,汪明荃 、 郑嘉颖 、 周志文 、 周志康 、 廖碧儿 、 汤盈盈,汪明荃  郑嘉颖  人物一  人物二  廖碧儿  汤盈盈,-1
TRAIN_SENT_ID_261655,宋小宝,赵本山,2014 - 02 - 27 ： 老兵 「 赵本山 ， 小 沈阳 ， 宋小宝 ， 毕畅 」,老兵  人物二  沈阳  人物一  毕畅,-1
TRAIN_SENT_ID_259669,公孙胜,罗真人,罗真人 传授 公孙胜 五雷 天罡 正法 ， 让 他 下山 辅助 宋江 “ 保国安民 ， 替天行道 ” ， 又 送 八字 真言 ， 命 他 “ 逢 幽而止 ， 遇 汴 而 还 ” 。,人物二 传授 人物一 五雷 天罡 正法  下山 辅助 宋江  保国安民  替天行道   送 八字 真言  命  逢 幽而止  遇 汴,-1
TRAIN_SENT_ID_253890,赵合德,赵飞燕,赵飞燕 ， 赵合德 ： 几个 红颜 成 薄命,人物二  人物一  几个 红颜 成 薄命,-1
TRAIN_SENT_ID_264582,凌波,凌音,当 凌波 助 龙溟 盗鼎 一事 发生 后 ， 凌音 对 姐姐 的 行为 百思不解 ， 把 她 的 事 都 藏 在 心里 面 ， 不再 对人 提起 。,人物一 助 龙溟 盗鼎 一事 发生  人物二 姐姐 行为 百思不解  事 藏 心里 面  不再 对人 提起,-1
TRAIN_SENT_ID_277808,乌丫,丁铛,然而 ， 丁铛 的 械 力 、 乌丫 的 医道 、 寒信 的 智慧 以及 小镖 的 顽强 — — 坚信 胜利 的 心 与 心 之间 产生 的 羁绊 ， 将会 唤醒 奇迹 ！,人物二 械 力  人物一 医道  寒信 智慧 小镖 顽强   坚信 胜利 心 心 之间 产生 羁绊  将会 唤醒 奇迹,-1
TRAIN_SENT_ID_249265,皮皮鲁,鲁西西,皮皮鲁 和 鲁西西 有 许多 好玩 的 经历 ， 都 收集 在 30 卷 《 郑渊洁 童话 全集 》 里 .,人物一 人物二 好玩 经历  收集  卷  郑渊洁 童话 全集  里,-1
TRAIN_SENT_ID_250723,鲁西西,皮皮鲁,皮皮鲁 、 鲁西西 、 罗克 、 舒克和贝塔 是 他 笔下 塑造 的 形象 。,人物二  人物一  罗克  舒克和贝塔 笔下 塑造 形象,-1
