sent_id,entity1,entity2,sent,processed_sent,human
TRAIN_SENT_ID_286423,苏保衡,苏京,苏保衡 人物 生平 : 其父 苏京 ， 辽代 进士 ， 任 西京 留守 。,人物一 人物 生平  其父 人物二  辽代 进士  西京 留守,-1
TRAIN_SENT_ID_273021,黄月英,黄承彦,（ 汉末 三国 时期 荆襄 名士 ） : 黄承彦 ， 汉末 三国 时期 襄阳 名士 ， 诸葛亮 岳父 ， 黄月英 之 父 。,汉末 三国 时期 荆襄 名士   人物二  汉末 三国 时期 襄阳 名士  诸葛亮 岳父  人物一 父,-1
TRAIN_SENT_ID_272513,韦丛,元稹,元贞 十七年 春 ， 元稹 赴考 从政 ， 后 深受 当时 太子 少保 韦夏卿 赏识 ， 权势 之下 与 韦夏卿 之女 韦丛 婚配 。,元贞 十七年 春  人物二 赴考 从政  深受 当时 太子 少保 韦夏卿 赏识  权势 之下 韦夏卿 之女 人物一 婚配,1
TRAIN_SENT_ID_283396,张泉,张绣,（ 东汉 末年 张绣 之子 ） : 张泉 （ ？,东汉 末年 人物二 之子   人物一,-1
TRAIN_SENT_ID_264119,刘备,孙尚香,《 洞房 》 孙尚香 — — 李维康 、 刘备 — — 耿其昌 、 赵云 — — 王立军,洞房  人物二   李维康  人物一   耿其昌  赵云   王立军,1
TRAIN_SENT_ID_268760,孟明视,百里奚,周太王 5 世孙 虞仲 的 后人 百里奚 ， 生子 孟明视 。,周太王  世孙 虞仲 后人 人物二  生子 人物一,-1
TRAIN_SENT_ID_272300,金正恩,金正日,光 明星 节 2014 年 : 2014 年 2 月 16 日 ， 现 最高 领导人 金正恩 率 人民军 高级 指挥官 拜谒 安放 金正日 遗体 的 锦绣山 太阳宫 。,光 明星 节  年   年  月  日  现 最高 领导人 人物一 率 人民军 高级 指挥官 拜谒 安放 人物二 遗体 锦绣山 太阳宫,-1
TRAIN_SENT_ID_265512,周萍,周朴园,"周朴园 说 的话 与 周萍 说 的话 不相干 , 周朴园 的话 的 含义 是 : 你",人物二 说 人物一 说 不相干  人物二 含义,-1
TRAIN_SENT_ID_256792,朱军,谭梅,朱军 谭梅 将 在 法式 的 古老 庄园 度过 一天 ， 没有 历史 的 沧桑感 ， 反倒 盈溢 着 浪漫 的 气息 。,人物一 人物二 法式 古老 庄园 度过 一天  没有 历史 沧桑感  反倒 盈溢 浪漫 气息,1
TRAIN_SENT_ID_255917,蒋介石,宋美龄,蒋介石 夫人 宋美龄 也 拜 张大千 为师 学画 。,人物一 夫人 人物二 拜 张大千 为师 学画,1
TRAIN_SENT_ID_255174,熊狂,熊绎,熊丽 生 熊狂 ， 熊 狂生 熊绎 。 ”,熊丽 生 人物一  熊 狂生 人物二,-1
TRAIN_SENT_ID_266839,萧峰,萧远山,萧峰 的 经历 ， 事实上 有 一半 是 萧远山 所 造成 的 ， 萧峰 不能 怪责 父亲 ， 他 的 冤枉 ， 才 真真正正 的 是 有 冤无路诉 。,人物一 经历  事实上 一半 人物二 造成  人物一 不能 怪责 父亲  冤枉  真真正正 冤无路诉,-1
TRAIN_SENT_ID_253797,申雪,赵宏博,申雪 赵宏博 领衔 史上 最强 花滑 阵容 震撼 巡演,人物一 人物二 领衔 史上 最强 花滑 阵容 震撼 巡演,1
TRAIN_SENT_ID_275947,黄日华,黄芷晴,我 亦 十分 感激 黄日华 对 我们 的 信任 ， 愿意 让 其 掌上明珠 黄芷晴 在 这里 踏出 演艺事业 的 第一步 。,十分 感激 人物一 信任  愿意 掌上明珠 人物二 踏出 演艺事业 第一步,-1
TRAIN_SENT_ID_259451,贾兰,李纨,李纨 的 “ 晚 韶华 ” 与 贾兰 的 “ 虚名 儿,人物二  晚 韶华  人物一  虚名,-1
TRAIN_SENT_ID_278797,任盈盈,任我行,修炼 者 : 任我行 : 任我行 是 任盈盈 父亲 ， 也 是 日月神教 教主 ， 武功 非凡 ， 是 小说 中 数一数二 的 人物 。,修炼  人物二  人物二 人物一 父亲  日月神教 教主  武功 非凡  小说 中 数一数二 人物,-1
TRAIN_SENT_ID_273606,陈建州,范玮琪,LoveLife 是 由 台湾 艺人 陈建州 、 范玮琪 等 发起 的 一项 关于 关爱 弱势 病童 的 公益广告 。,台湾 艺人 人物一  人物二 发起 一项 关爱 弱势 病童 公益广告,1
TRAIN_SENT_ID_248943,王罕,桑昆,桑昆 创甚 ， 王罕 始 歙兵 而 退 。,人物二 创甚  人物一 始 歙兵 退,-1
TRAIN_SENT_ID_273807,萧远山,萧峰,公公 ： 萧远山 ， 乔三槐 ( 萧峰 养父 ),公公  人物一  乔三槐  人物二 养父,-1
TRAIN_SENT_ID_259583,冯小刚,徐帆,2000 年 冯小刚 《 一声 叹息 》 获 最佳影片 、 最佳 男主角 （ 张国立 ） 、 最佳 女主角 （ 徐帆 ）,年 人物一  一声 叹息  获 最佳影片  最佳 男主角  张国立   最佳 女主角  人物二,1
TRAIN_SENT_ID_248852,窦滔,苏蕙,晋代 窦滔 以罪 徙 流沙 ， 其妻 苏蕙 ， 因 思念 丈夫 ， 织绵 为 《 回文 旋图 诗 》 以 寄 ， 后世 常 以此 指 妻子 寄书 丈夫 ， 表达 相思 之情 。,晋代 人物一 以罪 徙 流沙  其妻 人物二  思念 丈夫  织绵  回文 旋图 诗  寄  后世 常 以此 指 妻子 寄书 丈夫  表达 相思 之情,1
TRAIN_SENT_ID_256284,孙尚香,刘备,赤壁大战 后 ， 刘备 借住 荆州 不 还 ， 孙权 以其妹 孙尚香 为 饵 ， 设 下 美人计 ， 诱 刘备 来京 口 联姻 招亲 。,赤壁大战  人物二 借住 荆州  孙权 以其妹 人物一 饵  设 美人计  诱 人物二 来京 口 联姻 招亲,1
TRAIN_SENT_ID_284951,段罴,段兰,段罴 ， 段兰 之子 ， 段龛 之弟 ， 骁勇 而 有 智谋 ， 后 被 段龛 所杀 。,人物一  人物二 之子  段龛 之弟  骁勇 智谋  段龛 所杀,-1
TRAIN_SENT_ID_255961,蒋介石,宋美龄,蒋介石 宋美龄 夫妇 走访 台湾 农家,人物一 人物二 夫妇 走访 台湾 农家,1
TRAIN_SENT_ID_260504,严嵩,严世蕃,戏里 的 严嵩 私造 九龙 冠 ， 与子 严世蕃 欲夺 大明 乾坤 可谓 昭然若揭 。,戏里 人物一 私造 九龙 冠  与子 人物二 欲夺 大明 乾坤 可谓 昭然若揭,-1
TRAIN_SENT_ID_283536,山东五胞胎,李翠红,山东五胞胎 家住 梁山县 拳铺 镇拳 西村 ， 2008 年 4 月 14 日 ， 5 个 孩子 的 母亲 李翠红 剖腹产 下 五胞胎 。,人物一 家住 梁山县 拳铺 镇拳 西村   年  月  日   孩子 母亲 人物二 剖腹产 五胞胎,-1
TRAIN_SENT_ID_261355,刘翔,吉粉花,以至 后来 其他 教练 看到 吉粉花 来 了 ， 就 对 孙海平 说 ： “ 刘翔 妈妈 来 了 ， 你 要 倒霉 了 。 ”,后来 教练 看到 人物二  孙海平 说   人物一 妈妈  倒霉,-1
TRAIN_SENT_ID_262871,熊美玲,林秋离,No.38 叫 阮 的 名 （ 台语 ） 林秋离 熊美玲 施文彬,阮 名  台语  人物二 人物一 施文彬,1
TRAIN_SENT_ID_260262,穆桂英,杨宗保,（ 温州 越剧团 演员 ） : 周莉 是 温州 越剧团 演员 ， 在 《 穆桂英 大破 天门 阵 》 中饰 杨宗保 。,温州 越剧团 演员   周莉 温州 越剧团 演员   人物一 大破 天门 阵  中饰 人物二,1
TRAIN_SENT_ID_267814,杨绛,钱瑗,杨绛 女士 在 仪式 上 谈到 ， 她 是 一个 人 代表 三个 人 ， 代表 她 自己 、 已经 去世 的 钱钟书 和 他们 的 女儿 钱瑗 向 母校 捐赠 的 。,人物一 女士 仪式 谈到  一个 代表 三个  代表  已经 去世 钱钟书 女儿 人物二 母校 捐赠,-1
TRAIN_SENT_ID_271369,罗成,罗通,经过 兵法 、 策论 考试 和 武科 比试 ， 并 在 程咬金 有意 促成 下 ， 文武双全 的 罗通 （ 罗成 之子 ） 夺得 二路 招讨印 。,兵法  策论 考试 武科 比试  程咬金 有意 促成  文武双全 人物二  人物一 之子  夺得 二路 招讨印,-1
TRAIN_SENT_ID_278819,任盈盈,任我行,首先 ， 风 太师 叔 的 面子 要 给 ， 其次 ， 令狐冲 的 情人 ， 任盈盈 的 江湖 关系 ， 再有 ， 任我行 。,风 太师 叔 面子   令狐冲 情人  人物一 江湖 关系   人物二,-1
TRAIN_SENT_ID_273083,杨铁心,包惜弱,杨铁心 和 包惜弱 的 儿子 ， 小王爷 完颜康 贪图 富贵 ， 也 来 欺骗 爹娘 ， 却 被 好心 的 穆念慈 揭穿 。,人物一 人物二 儿子  小王爷 完颜康 贪图 富贵  欺骗 爹娘  好心 穆念慈 揭穿,1
TRAIN_SENT_ID_283354,郑裕彤,郑家纯,2012 年 2 月 29 日 ， 新世界 大 掌门 郑裕彤 在 当天 突然 宣布 从 主席 之位 上 退下 ， 由 其 长子 郑家纯 接 主席 一职 。,年  月  日  新世界 掌门 人物一 当天 突然 宣布 主席 之位 退下  长子 人物二 接 主席 一职,-1
TRAIN_SENT_ID_270260,谭江柏,谭咏麟,失恋 通告 歌手 信息 : 谭咏麟 ， 1950 年 8 月 23 日 生于 香港 ， 籍贯 广东 新 会 ， 绰号 「 谭 校长 」 ， 为 已故 足球 名宿 谭江柏 之子 。,失恋 通告 歌手 信息  人物二   年  月  日 生于 香港  籍贯 广东 新 会  绰号  谭 校长   已故 足球 名宿 人物一 之子,-1
TRAIN_SENT_ID_264135,刘备,孙尚香,效果 ： a ： 孙尚香 加入 刘备 麾下,效果    人物二 加入 人物一 麾下,1
TRAIN_SENT_ID_258044,周海婴,鲁迅,祖父 鲁迅 ， 祖母 许广平 ， 父亲 周海婴 。,祖父 人物二  祖母 许广平  父亲 人物一,-1
TRAIN_SENT_ID_249434,后稷,姜嫄,兄弟 ： 弃 ， 即 后稷 ， 姜嫄 生 ， 被 周 族人 认作 是 其 始祖 ， 后人 尊 为 谷神 。,兄弟  弃  人物一  人物二 生  周 族人 认作 始祖  后人 尊 谷神,-1
TRAIN_SENT_ID_261994,王明华,梅兰芳,梅家和 王明华 对此 均表 同意 ， 于是 梅兰芳 与 福芝芳 结为 伉俪 。,梅家和 人物一 对此 均表 同意  人物二 福芝芳 结为 伉俪,1
TRAIN_SENT_ID_262534,扶苏,秦始皇,秦始皇 的 长子 扶苏 是 在 什么 情况 下 自杀 的 ？,人物二 长子 人物一 情况 自杀,-1
TRAIN_SENT_ID_262571,扶苏,秦始皇,想必 是 人们 将 西秦 太子 乞 伏炽磐 误以为 秦始皇 太子 扶苏 所致 。,想必 西秦 太子 乞 伏炽磐 误以为 人物二 太子 人物一 所致,-1
TRAIN_SENT_ID_261490,关兴,关羽,1969 年 又 有 道士 整修 殿宇 、 洞穴 ， 塑 山神 、 土地 关羽 、 关兴 、 周仓 神像 祀奉 。,年 道士 整修 殿宇  洞穴  塑 山神  土地 人物二  人物一  周仓 神像 祀奉,-1
TRAIN_SENT_ID_278144,赵姨娘,贾政,无奈 赵姨娘 不舍 ， 又 见 他 妹子 来 问 ， 是 晚 得空 ， 便 先求 了 贾政 。,无奈 人物一 不舍  见 妹子 问  晚 得空  便 先求 人物二,1
TRAIN_SENT_ID_278895,顾长卫,蒋雯丽,蒋雯丽 顾长卫 ： 立春 之后 第二次 度蜜月,人物二 人物一  立春 之后 第二次 度蜜月,1
TRAIN_SENT_ID_278271,王珂,刘涛,王珂 感恩 刘涛 ( 3 张 ),人物一 感恩 人物二   张,1
TRAIN_SENT_ID_273771,霍震霆,霍英东,后 嫁给 霍英东 之子 霍震霆 ， 开启 了 港姐 嫁入 豪门 的 先例 。,嫁给 人物二 之子 人物一  开启 港姐 嫁入 豪门 先例,-1
TRAIN_SENT_ID_268424,秦始皇,扶苏,秦始皇 死后 ， 他 与 赵高 定谋 ， 改 遗诏 ， 杀 始皇 长子 扶苏 ， 立少子 胡亥 为帝 。,人物一 死后  赵高 定谋  改 遗诏  杀 始皇 长子 人物二  立少子 胡亥 为帝,-1
TRAIN_SENT_ID_250012,张无忌,赵敏,"最终 张无忌 卸下 明教 教主 职务 后 , 结尾 时 携 最 爱 赵敏 归隐 蒙古 。",最终 人物一 卸下 明教 教主 职务  结尾 时 携 爱 人物二 归隐 蒙古,1
TRAIN_SENT_ID_275426,董祀,蔡文姬,蔡文姬 到 了 邺 城 ， 曹操 看 她 一个 人 孤苦伶仃 ， 又 把 她 再嫁 给 一个 屯田 都尉 （ 官名 ） 董祀 。,人物二 邺 城  曹操 一个 孤苦伶仃  再嫁 一个 屯田 都尉  官名  人物一,1
TRAIN_SENT_ID_272842,杨威,杨云,热气球 落地 后 ， 杨威 抱 下 杨云 ， 走进 搭建 在 沙滩 上 的 花房 ， 仪式 就 在 三亚 著名 的 天涯海角 进行 ， 婚礼 的 司仪 由 著名 主持人 鲁豫 担当 。,热气球 落地  人物一 抱 人物二  走进 搭建 沙滩 花房  仪式 三亚 著名 天涯海角 进行  婚礼 司仪 著名 主持人 鲁豫 担当,1
TRAIN_SENT_ID_266983,关索,关羽,鲍氏系 关羽 第三 子 关索 之妻 ， 武力 过 人 ， 随军 征战 ， 死后 葬 于 此地 。,鲍氏系 人物二 第三 子 人物一 之妻  武力  随军 征战  死后 葬,-1
TRAIN_SENT_ID_282936,诸葛果,诸葛亮,诸葛果 武将 分析 : 诸葛果 ： SP 武将 ， 诸葛亮 之女 ， 成都 西南 有朝 真观 ， 即 乘烟观 。,人物一 武将 分析  人物一   武将  人物二 之女  成都 西南 有朝 真观  乘烟观,-1
TRAIN_SENT_ID_269671,石清,闵柔,鬼 说 “ 这 不 对 呀 放走 了 石清 闵柔 夫妻 二人 帮主 什么 时候 能 回来 呀 。 ”,鬼 说  放走 人物一 人物二 夫妻 二人 帮主 回来,1
TRAIN_SENT_ID_272210,马小玲,况天佑,"爱恨 情欲 力量 毁灭 马小玲 况天佑 的 出现 改变 了 所有 的 一切 , 原本 的 灭 世计画 生生 夭折 , 那么 “ 他 ” 又 会 怎么 做 呢 ?",爱恨 情欲 力量 毁灭 人物一 人物二 出现 改变  原本 灭 世计画 生生 夭折    会 做,1
TRAIN_SENT_ID_283679,黎婉华,何鸿燊,人物 生平 : 何超英 ， 是 何鸿燊 和 原配 黎婉华 所生 的 长女 ， 曾 在 英国 修读 法律 。,人物 生平  何超英  人物二 原配 人物一 所生 长女  英国 修读 法律,1
TRAIN_SENT_ID_263699,郭槐,贾充,贾充 后妻 郭槐 奇妒 。,人物二 后妻 人物一 奇妒,1
TRAIN_SENT_ID_265580,陈纪,陈群,与 陈群 父亲 陈纪 （ 129 年 - 199 年 6 月 ） ， 字元方 。,人物二 父亲 人物一   年   年  月   字元方,-1
TRAIN_SENT_ID_262485,扶苏,秦始皇,秦 相国 赵高 逼迫 秦始皇 的 儿子 秦二世 自杀 ， 立 被 秦始皇 赐死 的 公子 扶苏 的 儿 子子婴 ， 贬号 秦王 ， 派 人 与 刘邦 谈判 ， “ 约分 关中 ” 。,秦 相国 赵高 逼迫 人物二 儿子 秦二世 自杀  立 人物二 赐死 公子 人物一 子子婴  贬号 秦王  派 刘邦 谈判   约分 关中,-1
TRAIN_SENT_ID_286795,冯润,冯熙,2 、 冯氏 （ 冯润 ） ， 冯熙 次女 ， 北魏 高祖 孝文帝 元宏 皇后 。,冯氏  人物一   人物二 次女  北魏 高祖 孝文帝 元宏 皇后,-1
TRAIN_SENT_ID_270533,关平,关羽,有趣 的 是 ， 听众 中 ， 还有 中国 的 历史 人物 关羽 、 关平 、 周全 及 布袋 和尚 等 。,有趣  听众 中  中国 历史 人物 人物二  人物一  周全 布袋 和尚,-1
TRAIN_SENT_ID_282614,宋青书,宋远桥,宋青书 人物 经历 : 宋青书 是 宋远桥 之子 ， 武当派 第三代 弟子 。,人物一 人物 经历  人物一 人物二 之子  武当派 第三代 弟子,-1
TRAIN_SENT_ID_286522,李小龙,李英儒,李小龙 的 父亲 是 《 野火 春风 斗 古城 》 的 作者 军旅 作家 李英儒 。,人物一 父亲  野火 春风 斗 古城  作者 军旅 作家 人物二,-1
TRAIN_SENT_ID_261542,关兴,关羽,* 飞 回 “ 成都 ” 和 「 刘备 」 说话 ， 「 关羽 」 「 张飞 」 会 离开 队伍 ， 飞 到 “ 长沙 ” 可 找到 「 关羽 」 「 关兴 」 但是 只有 「 关兴 」 会 加入 。,飞 回  成都   刘备  说话   人物二   张飞  会 离开 队伍  飞  长沙  找到  人物二   人物一   人物一  会 加入,-1
TRAIN_SENT_ID_279175,赵薇,黄有龙,2013 年 7 月 23 日 ， 赵薇 在 微博上 发布 一张 老公 黄有龙 和 女儿 黄新 的 背影 图 ， 并 附 文字 称 ： 齐步走 ！,年  月  日  人物一 微博上 发布 一张 老公 人物二 女儿 黄新 背影 图  附 文字 称  齐步走,1
TRAIN_SENT_ID_286791,郗恢,郗昙,郗恢 ， 字道 胤 ， 郗昙 子 ， 东晋 将领 ， 官至 征虏 将军 、 领秦 雍二州 刺史 。,人物一  字道 胤  人物二 子  东晋 将领  官至 征虏 将军  领秦 雍二州 刺史,-1
TRAIN_SENT_ID_284092,郝治平,罗瑞卿,郝治平 （ 罗瑞卿 夫人 ） 和 鲁艺 的 木刻 家 、 剧团 演员 也 都 纷纷 跳 了 下去 ， 有 的 碰伤 了 头 ， 有 的 摔坏 了 腿 。,人物一  人物二 夫人  鲁艺 木刻 家  剧团 演员 纷纷 跳 下去  碰伤 头  摔坏 腿,1
TRAIN_SENT_ID_281584,陈泰鸣,陈莉萍,主要演员 ： 叶素 梅 潘玲玲 曹国辉 陈莉萍 陈泰鸣,主要演员  叶素 梅 潘玲玲 曹国辉 人物二 人物一,1
TRAIN_SENT_ID_272813,谢烨,顾城,1993 年 ， 顾城 却 在 新西兰 的 激流 岛上 ， 与 妻子 谢烨 以 极端 惨烈 的 方式 告别 了 世界 。,年  人物二 新西兰 激流 岛上  妻子 人物一 极端 惨烈 方式 告别 世界,1
TRAIN_SENT_ID_250448,朱常洵,郑贵妃,当时 有 两派 分别 拥护 皇 长子 朱常洛 与 福王 朱常洵 （ 郑贵妃 所 生 ） 争夺 太子 之位 。,当时 两派 拥护 皇 长子 朱常洛 福王 人物一  人物二 生  争夺 太子 之位,-1
TRAIN_SENT_ID_285531,方瑞,曹禺,曾 与 朱琳 、 史可 一起 出演 话剧 《 寻找 剧作家 》 ， 因戏 中 饰演 曹禺 夫人 方瑞 一角 而 崭露头角 。,朱琳  史可 一起 出演 话剧  寻找 剧作家   因戏 中 饰演 人物二 夫人 人物一 一角 崭露头角,1
TRAIN_SENT_ID_286428,孙少安,孙玉厚,孙玉厚 角色 经历 : 《 平凡 的 世界 》 里 孙玉厚 老人 对 兄弟 、 对 子女 的 无私 付出 ， 孙少平 、 孙少安 、 姐姐 、 母亲 之间 的 情意 都 非常 真挚 。,人物二 角色 经历   平凡 世界  里 人物二 老人 兄弟  子女 无私 付出  孙少平  人物一  姐姐  母亲 之间 情意 非常 真挚,-1
TRAIN_SENT_ID_272808,谢烨,顾城,内容摘要 : 1993 年 10 月 8 日 ， 新西兰 激流 岛 ， 诗人 顾城 的 妻子 谢烨 死 于 顾城 之手 ， 而后 ， 顾城 自缢身亡 。,内容摘要   年  月  日  新西兰 激流 岛  诗人 人物二 妻子 人物一 死 人物二 之手   人物二 自缢身亡,1
TRAIN_SENT_ID_257402,袁克文,袁世凯,潭 的 北侧 有 巨石 ， 上书 袁世凯 少子 袁克文 的 题刻 “ 流水 音 ” 。,潭 北侧 巨石  上书 人物二 少子 人物一 题刻  流水 音,-1
TRAIN_SENT_ID_285223,李元轨,李渊,李绚 南昌 王 : 李绚 南昌 王 李绚 : 南昌 王 李绚 ， 高祖 李渊 孙 ， 霍王 李元轨 子 ， 嗣 彭思王 李元 则 ， 龙朔 中 ， 封 南昌 王 。,李绚 南昌 王  李绚 南昌 王 李绚  南昌 王 李绚  高祖 人物二 孙  霍王 人物一 子  嗣 彭思王 李元  龙朔 中  封 南昌 王,-1
TRAIN_SENT_ID_275045,朱七七,沈浪,花 神祠 相救 : 都 说 在 花 神祠 的 那次 是因为 朱七七 和 猫儿 的 坚持 沈浪 才 会 带上 白飞飞 ， 可是 请 看 他 当时 的 语言 和 表现 ：,花 神祠 相救  说 花 神祠 那次 是因为 人物一 猫儿 坚持 人物二 会 带上 白飞飞  请 当时 语言 表现,1
TRAIN_SENT_ID_274984,荆天明,荆轲,秦时 明月 荆天明 : 荆天明 ： 荆轲 、 丽姬 之子 。,秦时 明月 人物一  人物一  人物二  丽姬 之子,-1
TRAIN_SENT_ID_283528,郑樱桃,石虎,后来 石虎 又 娶 清河 崔氏 之 女 为 妻 ， 也 遭 郑樱桃 构陷 而 被 杀 。,后来 人物二 娶 清河 崔氏 女 妻  遭 人物一 构陷 杀,1
TRAIN_SENT_ID_261314,朱兆祥,胡静,受封 当日 胡静 与 朱兆祥 均 着 马来西亚 传统 服饰 进入 苏丹 皇宫 ， 在 一系列 的 隆重 环节 后 ， 胡静 和 朱兆祥 被 封 马来西亚 拿 汀 和 拿督 。,受封 当日 人物二 人物一 均 马来西亚 传统 服饰 进入 苏丹 皇宫  一系列 隆重 环节  人物二 人物一 封 马来西亚 汀 拿督,1
TRAIN_SENT_ID_283702,霍启仁,霍震霆,霍启仁 ， 1988 年 10 月 12 日 出生 ， 其父 霍震霆 为 香港特别行政区 立法会 议员 ， 霍英东 集团 执行 董事 。,人物一   年  月  日 出生  其父 人物二 香港特别行政区 立法会 议员  霍英东 集团 执行 董事,-1
TRAIN_SENT_ID_284422,陈尊佑,陈坤,根据 网上 资料 得知 ： 陈坤 儿子 大 名叫 陈尊佑 ， 小 名优 优 。,网上 资料 得知  人物二 儿子 名叫 人物一  名优 优,-1
TRAIN_SENT_ID_263786,秦始皇,赵姬,第一章 秦始皇 之母 — — 赵姬,第一章 人物一 之母   人物二,-1
TRAIN_SENT_ID_267606,金正恩,李雪主,而 2 月 16 日 播出 时 ， 金敬姬 的 身影 消失 ， 取而代之 的 是 金正恩 及其 妻子 李雪主 拜谒 的 镜头 。,月  日 播出 时  金敬姬 身影 消失  取而代之 人物一 妻子 人物二 拜谒 镜头,1
TRAIN_SENT_ID_252148,查美乐,韩以烈,查美乐 凭 的 就是 这种 不怕 打击 ， 绝不 后退 的 执着 精神 ， 最终 赢得 了 少爷 脾气 的 韩以烈 。 ”,人物一 这种 打击  绝不 后退 执着 精神  最终 赢得 少爷 脾气 人物二,1
TRAIN_SENT_ID_249862,张无忌,赵敏,1994 年 ， 制片方 ： 台湾 台视 ， 导演 ： 赖水清 ， 主演 ： 马景涛 饰 张无忌 ， 叶童 饰 赵敏 ， 周海媚 饰 周芷若,年  制片方  台湾 台视  导演  赖水清  主演  马景涛 饰 人物一  叶童 饰 人物二  周海媚 饰 周芷若,1
TRAIN_SENT_ID_274616,薛丁山,薛仁贵,中国 古典名著 百部 藏书 ： 薛仁贵 征东 · 薛丁山 征西 作者简介 : 作者 ： ( 清代 ) 佚名 张兴旺,中国 古典名著 百部 藏书  人物二 征东  人物一 征西 作者简介  作者   清代  佚名 张兴旺,-1
TRAIN_SENT_ID_248895,窦滔,苏蕙,“ 锦字 ” 典 出于 前秦 窦滔 之妻 苏蕙 ， 织锦 为 回文 《 璇玑 图 》 诗 ， 赠其夫 。,锦字  典 前秦 人物一 之妻 人物二  织锦 回文  璇玑 图  诗  赠其夫,1
TRAIN_SENT_ID_259044,刘备,刘禅,史实 部分 刘备 诸葛亮 关羽 张飞 赵云 魏延 刘禅 曹操 … …,史实 部分 人物一 诸葛亮 关羽 张飞 赵云 魏延 人物二 曹操,-1
TRAIN_SENT_ID_273541,殷素素,张翠山,武当 五侠 张翠山 （ 刘松仁 饰 ） 与 天鹰 教 妖女 殷素素 （ 米雪 饰 ） ， 因 争夺 屠龙刀 而 认识 ， 并且 情深 爱切 。,武当 五侠 人物二  刘松仁 饰  天鹰 教 妖女 人物一  米雪 饰   争夺 屠龙刀 认识  情深 爱切,1
TRAIN_SENT_ID_273177,黄苗子,郁风,两个 人 的 年龄 加 起来 已 是 180 多岁 了 ， 但是 ， 看上去 面容 红润 ， 耳聪目明 ， 黄苗子 不时 欢笑 ， 郁风 中 气 十足 。,两个 年龄 加 起来  多岁   看上去 面容 红润  耳聪目明  人物一 不时 欢笑  人物二 中 气 十足,1
TRAIN_SENT_ID_264479,吴健雄,袁家骝,吴健雄 想 参观 学校 的 物理系 ， 袁家骝 充当 向导 。,人物一 想 参观 学校 物理系  人物二 充当 向导,1
TRAIN_SENT_ID_253713,申雪,赵宏博,申雪 、 赵宏博 两人 本次 巡演 的 曲目 《 我们 的 20 年 》 ， 拉开 本次 比赛 压轴 之作 。,人物一  人物二 两人 本次 巡演 曲目   年   拉开 本次 比赛 压轴 之作,1
TRAIN_SENT_ID_273489,殷素素,张翠山,张翠山 和 殷素素 为存 忠义 ， 维护 谢逊 而 三缄其口 。,人物二 人物一 为存 忠义  维护 谢逊 三缄其口,1
TRAIN_SENT_ID_272380,夏紫薇,夏雨荷,十八年 前 ， 乾隆 在 济南 大明 湖畔 认识 了 夏紫薇 的 母亲 夏雨荷 ， 二人 相爱 。,十八年 前  乾隆 济南 大明 湖畔 认识 人物一 母亲 人物二  二人 相爱,-1
TRAIN_SENT_ID_256178,蒋介石,宋美龄,宋美龄 同 蒋介石 是 怎么 认识 的,人物二 人物一 认识,1
TRAIN_SENT_ID_277394,樊姬,楚庄王,楚庄王 贤妃 樊姬 : 楚庄王 即位 时 ， 贪恋 酒色 ， 不理 朝政 ， 终日 饮酒作乐 ， 通宵达旦 。,人物二 贤妃 人物一  人物二 即位 时  贪恋 酒色  不理 朝政  终日 饮酒作乐  通宵达旦,1
TRAIN_SENT_ID_281557,李锐,蒋韵,作家 ： 马锋 、 西戎 、 笛安 、 蒋韵 、 李锐,作家  马锋  西戎  笛安  人物二  人物一,1
TRAIN_SENT_ID_276066,陈三立,陈宝箴,陈宝箴 死得 悲壮 ， 陈三立 誓死 不当 亡国奴 ， 拒食 、 拒药 ， 以 八十五岁 高龄 殉国 ， 更教人 悲愤 难当 。,人物二 死得 悲壮  人物一 誓死 不当 亡国奴  拒食  拒药  八十五岁 高龄 殉国  更教人 悲愤 难当,-1
TRAIN_SENT_ID_279369,杨健侯,杨露禅,杨露禅 有 两子 ， 杨班侯 和 杨健侯 ， 各有所长 。,人物二 两子  杨班侯 人物一  各有所长,-1
TRAIN_SENT_ID_265143,尤二姐,贾琏,尤二姐 在 贾府 历尽磨难 ， 在 拿 着 定情 信物 九龙 佩 质问 贾琏 ， 遭到 贾琏 的 羞辱 后 恨 地 摔碎 九龙 佩 ， 在 绝望 中 吞金 自杀 。,人物一 贾府 历尽磨难  定情 信物 九龙 佩 质问 人物二  遭到 人物二 羞辱 恨 摔碎 九龙 佩  绝望 中 吞金 自杀,1
TRAIN_SENT_ID_282860,柳摇金,韩翃,在 同僚 们 眼热 的 贺 送 下 ， 韩翃 与 柳摇金 风风光光 地 又 来到 了 京城 长安 。,同僚 眼热 贺 送  人物二 人物一 风风光光 来到 京城 长安,1
TRAIN_SENT_ID_285565,文馨,陈笑飞,文馨 角色 设定 : 陈笑飞 的 初恋 ， 原名 王之 涵 ， 改名换姓 为 文馨 。,人物一 角色 设定  人物二 初恋  原名 王之 涵  改名换姓 人物一,1
TRAIN_SENT_ID_283478,李瓶儿,西门官哥,自从 小 产 之后 ， 几年 当中 月娘 不曾 再度 怀胎 ， 而 恰恰 此时 ， 六娘 李瓶儿 却 顺利 的 产下 西门庆 的 第一个 儿子 — — 西门官哥 。,产 之后  几年 当中 月娘 不曾 再度 怀胎  恰恰  六娘 人物一 顺利 产下 西门庆 第一个 儿子   人物二,-1
TRAIN_SENT_ID_271462,杨云,杨威,儿子 出生 时 ， 杨威 在 产房 一直 陪伴 在 杨云 身边 ， 亲手 剪断 脐带 ， 迎接 儿子 的 到来 。,儿子 出生 时  人物二 产房 一直 陪伴 人物一 身边  亲手 剪断 脐带  迎接 儿子 到来,1
