sent_id,entity1,entity2,sent,processed_sent,human
TRAIN_SENT_ID_272751,徐天宏,周绮,徐天宏 一听 ， 知是 店小二 ， 保镖 的 半夜里 要 他 送 酒 ， 因此 满肚子 不 高兴 ， 灵机一动 ， 对 周绮 道 ： “ 那 曹司朋 有 两包 药 给 你 拿来 啦 ， 是 吗 ？,人物一 一听  知是 店小二  保镖 半夜里 送 酒  满肚子 高兴  灵机一动  人物二 道   曹司朋 两包 药 拿来,1
TRAIN_SENT_ID_282367,张奎,高兰英,张奎 的 灵兽 ， 拥有 极高 的 速度 ， 称呼 高兰英 为 “ 大姊头 ” 。,人物一 灵兽  拥有 极高 速度  称呼 人物二  大姊头,1
TRAIN_SENT_ID_267332,赵本山,赵玉芳,赵玉芳 感人 之 处 : 著名 笑星 赵本山 的 女儿 赵玉芳 和 女婿 汪洋 在 铁岭 完婚 。,人物二 感人 处  著名 笑星 人物一 女儿 人物二 女婿 汪洋 铁岭 完婚,-1
TRAIN_SENT_ID_261175,赵本山,赵一涵,目前 赵本山 女儿 赵一涵 （ 妞妞 ） 大胆 晒出 了 一组 自己 的 海军 制服 露脐 写真 。,目前 人物一 女儿 人物二  妞妞  大胆 晒出 一组 海军 制服 露脐 写真,-1
TRAIN_SENT_ID_285347,周端妃,朱常浩,五 子 朱常浩 ， 瑞王 ， 母 周端妃 。,五 子 人物二  瑞王  母 人物一,-1
TRAIN_SENT_ID_258915,王熙凤,贾琏,贾琏 与 凤姐 : 虽是 个 外 当家 ， 但 许多 事情 上 ， 只是 王熙凤 说了算 。,人物二 凤姐  虽是 外 当家  事情  人物一 说了算,1
TRAIN_SENT_ID_279155,赵薇,黄有龙,2011 年 7 月 22 日 黄有龙 友人 发布 赵薇 女儿 “ 小 四月 ” 阅读 杂志 的 新照 ， 看来 小格格 对于 书本 杂志 特别 偏爱 。,年  月  日 人物二 友人 发布 人物一 女儿  四月  阅读 杂志 新照  看来 小格格 书本 杂志 特别 偏爱,1
TRAIN_SENT_ID_269188,陆雪琪,张小凡,2 法宝 : 噬血珠 : 噬血珠 是 作家 萧鼎 的 小说 《 诛仙 》 中 出现 的 张小凡 的 法宝 ， 与 陆雪琪 的 法宝 天 琊 有 宿命 的 纠葛 。,法宝  噬血珠  噬血珠 作家 萧鼎 小说  诛仙  中 出现 人物二 法宝  人物一 法宝 天 琊 宿命 纠葛,1
TRAIN_SENT_ID_264482,吴健雄,袁家骝,那年 春天 ， 吴健雄 原本 已 和 袁家骝 计划 好 ， 先到 瑞士 日内瓦 出席 一项 高能物理 会议 ， 然后 再 到 东亚地区 去 做 一趟 演讲 旅行 。,那年 春天  人物一 原本 人物二 计划  先到 瑞士 日内瓦 出席 一项 高能物理 会议  东亚地区 做 一趟 演讲 旅行,1
TRAIN_SENT_ID_262359,汪精卫,陈璧君,陈耀祖 是 汪精卫 妻弟 、 陈璧君 的 胞弟 ， 于 1938 年底 随汪 、 陈 叛国 投敌 。,陈耀祖 人物一 妻弟  人物二 胞弟   年底 随汪  陈 叛国 投敌,1
TRAIN_SENT_ID_256363,孙尚香,刘备,刘备 入川 后 与 刘璋 反目成仇 ， 交战 之中 ， 孙尚香 被 孙权 派 人 骗回 江东 ， 而 副 军师 庞统 也 死 于 落凤坡 。,人物二 入川 刘璋 反目成仇  交战 之中  人物一 孙权 派 骗回 江东  副 军师 庞统 死 落凤坡,1
TRAIN_SENT_ID_278698,叶一茜,田亮,蔡妍 与 田亮 叶一茜 夫妇 学习 中国 传统 民歌 《 蜗牛 与 黄鹂 鸟 》 。,蔡妍 人物二 人物一 夫妇 学习 中国 传统 民歌  蜗牛 黄鹂 鸟,1
TRAIN_SENT_ID_269073,刘德华,朱丽倩,同年 朱丽倩 找 相士 算得 和 刘德华 有缘 。,同年 人物二 找 相士 算得 人物一 有缘,1
TRAIN_SENT_ID_269976,姚明,叶莉,姚明 这辈子 只交过 一个 女朋友 叶莉 ， 连 追带 谈 ， 2007 年 终于 领了 证 ， 成 了 亲 。,人物一 这辈子 只交过 一个 女朋友 人物二  追带 谈   年 终于 领了 证  成 亲,1
TRAIN_SENT_ID_276436,祝大姑,祝有涯,父亲 在 祝有涯 年 幼时 因病 而 亡故 ； 母亲 是 擅长 蛊术 的 蛊娘 ， 在 搬 到 青木 居后 大家 尊称 她 为 祝大姑 。,父亲 人物二 年 幼时 因病 亡故  母亲 擅长 蛊术 蛊娘  搬 青木 居后 尊称 人物一,-1
TRAIN_SENT_ID_260305,穆桂英,杨宗保,2009 年 6 月 越女 争锋 第 2 季 复赛 《 穆桂英 挂帅 - 索粮 》 饰演 杨宗保,年  月 越女 争锋  季 复赛  人物一 挂帅  索粮  饰演 人物二,1
TRAIN_SENT_ID_281877,张静,黄茂如,44185 黄茂如 、 张静 夫妇 46 茂业 广东 深圳 地产 、 零售,人物二  人物一 夫妇  茂业 广东 深圳 地产  零售,1
TRAIN_SENT_ID_273820,萧远山,萧峰,后来 萧峰 被 萧远山 救 走 ， 阿朱 留在 庄上 ， 还是 给 薛 神医 救治 过来 。,后来 人物二 人物一 救 走  阿朱 留在 庄上  薛 神医 救治 过来,-1
TRAIN_SENT_ID_271918,阎婆惜,宋江,阎婆惜 为何 敲诈 宋江 ？,人物一 敲诈 人物二,1
TRAIN_SENT_ID_281873,张末,张艺谋,父亲 张艺谋 与 女儿 张末 张艺谋 传 导演 张艺谋 : 1983 年 《 一个 和 八个 》,父亲 人物二 女儿 人物一 人物二 传 导演 人物二   年  一个 八个,-1
TRAIN_SENT_ID_274500,潘汉年,董慧,"1955 年 4 月 突然 蒙冤 ， 潘汉年 、 董慧 被 指控 为 "" 内奸 "" 而 逮捕 ， 从此 开始 了 长达 二十年 的 冤狱 生涯 。",年  月 突然 蒙冤  人物一  人物二 指控  内奸  逮捕  长达 二十年 冤狱 生涯,1
TRAIN_SENT_ID_279032,张活海,张国荣,张活海 就是 亚洲 顶级 巨星 张国荣 的 父亲 。,人物一 亚洲 顶级 巨星 人物二 父亲,-1
TRAIN_SENT_ID_256242,孙尚香,刘备,孙尚香 自 荆州 回 吴后 ， 未能 还 蜀 ； 讹闻 刘备 死于 伐 吴兵 败之役 ， 痛不欲生 ， 乃入 宫 辞别 其母 ， 赴 江边 望西 哭 奠 ， 祭 罢 投江 而 死 。,人物一 荆州 回 吴后  未能 蜀  讹闻 人物二 死于 伐 吴兵 败之役  痛不欲生  乃入 宫 辞别 其母  赴 江边 望西 哭 奠  祭 罢 投江 死,1
TRAIN_SENT_ID_287001,齐懿公,齐桓公,齐懿公 ， 原名 姜 商人 ， 齐桓公 之子 。,人物一  原名 姜 商人  人物二 之子,-1
TRAIN_SENT_ID_262991,熊美玲,林秋离,No.111 拿开 你 的 手 林秋离 熊美玲,拿开 手 人物二 人物一,1
TRAIN_SENT_ID_285049,朱见深,朱祁镇,忻 穆王 朱见治 （ 1458 年 3 月 18 日 ― 1472 年 4 月 2 日 ） ， 母万宸 妃 ； 明英宗 朱祁镇 第八 子 ， 明宪宗 朱见深 异 母弟 ， 母宸 妃 万氏 。,忻 穆王 朱见治   年  月  日 ―  年  月  日   母万宸 妃  明英宗 人物二 第八 子  明宪宗 人物一 异 母弟  母宸 妃 万氏,-1
TRAIN_SENT_ID_275715,贾午,贾谧,贾谧 是 贾充 小女儿 贾午 （ 当时 差点 嫁给 惠帝 ） 的 儿子 ， 其 父亲 是 南阳人 韩寿 。,人物二 贾充 小女儿 人物一  当时 差点 嫁给 惠帝  儿子  父亲 南阳人 韩寿,-1
TRAIN_SENT_ID_274981,荆天明,荆轲,项少羽 第一部 : 苦战 无双 鬼 纵横家 “ 剑圣 ” 盖聂 叛逃 秦国 ， 携 故人 荆轲 之子 荆天明 亡命天涯 ， 在 连续 与 三百 秦兵 作战 后 ， 重伤 昏厥 。,项少羽 第一部  苦战 无双 鬼 纵横家  剑圣  盖聂 叛逃 秦国  携 故人 人物二 之子 人物一 亡命天涯  连续 三百 秦兵 作战  重伤 昏厥,-1
TRAIN_SENT_ID_279597,蒋友常,蒋孝勇,五 、 蒋孝勇 次子 蒋友常,五  人物二 次子 人物一,-1
TRAIN_SENT_ID_263326,胡亥,秦始皇,秦始皇 于是 命宫 人 剪出 人 的 形状 ， 不停 的 表演 ， 胡亥 不 哭 了 ， 影戏 也 由此 开始 流传 至 民间 。,人物二 命宫 剪出 形状  不停 表演  人物一 哭  影戏 流传 民间,-1
TRAIN_SENT_ID_274652,傅敏,傅雷,傅雷 家书 精选 注 译本 作者简介 : 许多 人 都 知道 著名 翻译家 傅雷 和 他 的 长子 、 著名 钢琴家 傅聪 ， 对 这个 家族 的 另 一个 成员 傅敏 却 知之甚少 。,人物二 家书 精选 注 译本 作者简介  知道 著名 翻译家 人物二 长子  著名 钢琴家 傅聪  家族 一个 成员 人物一 知之甚少,-1
TRAIN_SENT_ID_277531,柴绍,平阳公主,《 唐书 · 平阳公主 传 》 高祖 女 ， 柴绍 妻 。,唐书  人物二 传  高祖 女  人物一 妻,1
TRAIN_SENT_ID_281611,白岩松,朱宏钧,朱宏钧 人物 生活 : 朱宏钧 朱宏钧 ， 女 ， 央视 著名 主持人 白岩松 的 妻子 。,人物二 人物 生活  人物二 人物二  女  央视 著名 主持人 人物一 妻子,1
TRAIN_SENT_ID_257258,纪晓芙,殷梨亭,但 在 和 殷梨亭 相处 的 过程 中 ， 渐渐 的 被 殷梨亭 之 于 母亲 纪晓芙 的 感情 所 打动 ， 还债 的 心理 更加 严重 ， 终于 到 了 “ 以身 相换 ” 的 地步 。,人物二 相处 过程 中  渐渐 人物二 母亲 人物一 感情 打动  还债 心理 更加 严重  终于  以身 相换  地步,1
TRAIN_SENT_ID_271452,杨云,杨威,而 在 杨云 家里 的 几天 ， 杨威 每顿饭 都 会 陪 杨云 的 父亲 喝上 几杯 ， 几天 下来 ， 两人 竟然 有 了 感情 。,人物一 家里 几天  人物二 每顿饭 会 陪 人物一 父亲 喝上 几杯  几天 下来  两人 竟然 感情,1
TRAIN_SENT_ID_268619,潘金莲,武大郎,《 潘金莲 武大郎 新传 》 作者 大漠 驼铃 作品 类型 短篇小说 这个 故事 的 原型 发生 在 文革 年代 ， 山东 莱州 的 一个 农村 里面,人物一 人物二 新传  作者 大漠 驼铃 作品 类型 短篇小说 故事 原型 发生 文革 年代  山东 莱州 一个 农村 里面,1
TRAIN_SENT_ID_265844,郭涛,郭子睿,郭子睿 个人 生活 : 郭子睿 家庭 情况 : 郭子睿 的 父亲 郭涛 是 国家一级演员 ， 母亲 李燃 是 主持人 。,人物二 个人 生活  人物二 家庭 情况  人物二 父亲 人物一 国家一级演员  母亲 李燃 主持人,-1
TRAIN_SENT_ID_265205,尤二姐,贾琏,心狠手毒 成语故事 : 贾琏 决定 偷偷 把 尤二姐 娶 回家 ， 安置 在 大观园 外面 。,心狠手毒 成语故事  人物二 决定 偷偷 人物一 娶 回家  安置 大观园 外面,1
TRAIN_SENT_ID_262138,刘翔,葛天,葛天 否认 插足 刘翔 感情,人物二 否认 插足 人物一 感情,1
TRAIN_SENT_ID_276730,刘梅,夏东海,《 飞来 的 鲜花 》 ： 夏家 频频 有 女士 送来 鲜花 ， 刘梅 对 夏东海 起 了 疑心 。,飞来 鲜花   夏家 频频 女士 送来 鲜花  人物一 人物二 疑心,1
TRAIN_SENT_ID_268361,秦始皇,扶苏,公子 扶苏 之子 、 秦始皇 长孙 始祖 世系 : 华胥氏,公子 人物二 之子  人物一 长孙 始祖 世系  华胥氏,-1
TRAIN_SENT_ID_274651,傅敏,傅雷,傅敏 ， 傅雷 之子 ， 特级 英语 教师 北京外国语大学 商界 : 徐烈均 ， 中国 轻工业品 进出口 总公司 总裁,人物一  人物二 之子  特级 英语 教师 北京外国语大学 商界  徐烈均  中国 轻工业品 进出口 总公司 总裁,-1
TRAIN_SENT_ID_258038,周海婴,鲁迅,周海婴 人物 评价 : 上海 作家协会 副 主席 赵丽宏 获悉 周海婴 去世 的 消息 说 ： “ 鲁迅 之子 是 一个 很重 的 头衔 ， 但 他 承担 得 起 。 ”,人物一 人物 评价  上海 作家协会 副 主席 赵丽宏 获悉 人物一 去世 消息 说   人物二 之子 一个 很重 头衔  承担,-1
TRAIN_SENT_ID_266647,李国豪,李小龙,1965 年 — — 好莱坞 电影明星 （ 李小龙 之子 ） 李国豪 出生,年   好莱坞 电影明星  人物二 之子  人物一 出生,-1
TRAIN_SENT_ID_257189,孙秀青,西门吹雪,可惜 ， 西门吹雪 只爱过 孙秀青 ， 试验 次数 太 少 ， 不 具有 普遍性 ， 不能 作为 实验 结论 。,可惜  人物二 只爱过 人物一  试验 次数 太 少  具有 普遍性  不能 实验 结论,1
TRAIN_SENT_ID_264111,刘备,孙尚香,刘备 占领 了 荆州 ， 这 让 孙权 不可 小看 ， 于是 把 孙尚香 嫁给 了 刘备 。,人物一 占领 荆州  孙权 不可 小看  人物二 嫁给 人物一,1
TRAIN_SENT_ID_271365,罗成,罗通,程咬金 笑 道 ： “ 主公 ， 这个 就是 罗成 兄弟 的 尾巴 ， 叫做 罗通 。,程咬金 笑 道   主公  人物一 兄弟 尾巴  叫做 人物二,-1
TRAIN_SENT_ID_272086,张翠山,殷素素,张翠山 手中 没 了 兵刃 ， 忙 拉 了 殷素素 跃上 一株 大 松树 。,人物一 手中 没 兵刃  忙 拉 人物二 跃上 一株 松树,1
TRAIN_SENT_ID_283726,吴安持,吴充,其妻 为 王安石 外孙女 ， 宰相 吴充 孙女 ， 吴安持 女 。,其妻 王安石 外孙女  宰相 人物二 孙女  人物一 女,-1
TRAIN_SENT_ID_255998,蒋介石,宋美龄,1939 年 夏 ， 蒋介石 偕 夫人 宋美龄 曾来 此 参观 ， 赞 曰 ： “ 真 福地 也 ” 。,年 夏  人物一 偕 夫人 人物二 曾来 参观  赞 曰   真 福地,1
TRAIN_SENT_ID_265663,袁泉,夏雨,2005 年 袁泉 对 媒体 暗示 和 夏雨 的 感情 走 到 瓶颈 期 。,年 人物一 媒体 暗示 人物二 感情 走 瓶颈 期,1
TRAIN_SENT_ID_283892,管维立,喻宜萱,管维立 的 母亲 喻宜萱 （ 1909 ～ 2008 ） ， 中国 女高音 歌唱家 、 声乐 教育家 、 中央音乐学院 副 院长 、 教授 兼 声乐系 主任 。,人物一 母亲 人物二       中国 女高音 歌唱家  声乐 教育家  中央音乐学院 副 院长  教授 兼 声乐系 主任,-1
TRAIN_SENT_ID_252353,江别鹤,江玉郎,他 写 江别鹤 与 江玉郎 ， 是 为了 衬托 江枫 的 正直 、 燕南天 的 豪爽 勇武 、 江 鱼儿 的 机智 聪颖 ， 两 相对 比 ， 奸者 更奸 、 义者 更义 。,写 人物一 人物二  衬托 江枫 正直  燕南天 豪爽 勇武  江 鱼儿 机智 聪颖  两 相对  奸者 更奸  义者 更义,-1
TRAIN_SENT_ID_276750,丁夫人,曹操,后来 曹昂 在 宛城 战死 ， 丁夫人 悲痛欲绝 ， 常常 数落 曹操 ， 曹操 一怒之下 ， 将 她 打发 回 了 娘家 。,后来 曹昂 宛城 战死  人物一 悲痛欲绝  常常 数落 人物二  人物二 一怒之下  打发 回 娘家,1
TRAIN_SENT_ID_263512,梅葆玖,梅兰芳,梅葆玖 个人 生活 : 梅葆玖 的 夫人 名叫 林丽 源 ， 是 梅 梅兰芳 与 夫人 年轻 时 照片 兰芳 京剧团 艺术 顾问 ， 他们 二人 膝下 无 子女 。,人物一 个人 生活  人物一 夫人 名叫 林丽 源  梅 人物二 夫人 年轻 时 照片 兰芳 京剧团 艺术 顾问  二人 膝下 子女,-1
TRAIN_SENT_ID_282465,韦丛,韦夏卿,韦夏卿 出于 什么 原因 同意 这门 亲事 ， 已然 无从 考证 了 ， 但 出身 高门 的 韦丛 并 不 势利 贪婪 ， 没有 嫌弃 元稹 。,人物二 原因 同意 这门 亲事  已然 无从 考证  出身 高门 人物一 势利 贪婪  没有 嫌弃 元稹,-1
TRAIN_SENT_ID_283501,张美珠,赵忠祥,个人 生活 : 1968 年 赵忠祥 与 张美珠 结婚 。,个人 生活   年 人物二 人物一 结婚,1
TRAIN_SENT_ID_285544,方瑞,曹禺,自从 结识 了 方瑞 之后 ， 曹禺 感到 方瑞 最合 他 的 心意 ， 是 他 心目 中 理想 的 妻子 ； 而 方瑞 对 曹禺 也 很 中意 。,结识 人物一 之后  人物二 感到 人物一 最合 心意  心目 中 理想 妻子  人物一 人物二 中意,1
TRAIN_SENT_ID_262997,熊美玲,林秋离,No.201 悬崖 边缘 林秋离 熊美玲 叶欢,悬崖 边缘 人物二 人物一 叶欢,1
TRAIN_SENT_ID_278372,荀庚,荀林父,《 元 和 姓 纂 》 载 “ 晋有 荀林父 生庚裔 荀况 ” ， 荀氏 的 传承 为 荀息 生逝 遨 ， 遨生 荀林父 ， 林 父生 荀庚 ， 庚生 荀偃 ， 偃生 荀吴 ， 吴生 荀寅 。,元 姓 纂  载  晋有 人物二 生庚裔 荀况   荀氏 传承 荀息 生逝 遨  遨生 人物二  林 父生 人物一  庚生 荀偃  偃生 荀吴  吴生 荀寅,-1
TRAIN_SENT_ID_257732,桓雄,桓因,桓因 给 了 桓雄 三个 仙符 印 ， 作为 天上 神仙 的 标志 。,人物二 人物一 三个 仙符 印  天上 神仙 标志,-1
TRAIN_SENT_ID_265301,贾琏,贾赦,一方面 ， 是 贾赦 、 贾珍 、 贾琏 、 薛蟠 一流 权贵 ， 荒淫无度 ； 另一方面 ， 是 蒋玉菡 、 柳湘莲 ， 都 因为 是 戏子 或 票友 ， 被 人 当作 玩弄 对象 。,人物二  贾珍  人物一  薛蟠 一流 权贵  荒淫无度   蒋玉菡  柳湘莲  戏子 票友  当作 玩弄 对象,-1
TRAIN_SENT_ID_275371,谭嗣同,李闰,为 避开 妻子 李闰 （ 杨怡 饰 ） 而入 学堂 的 谭嗣同 在 学堂 里 遇上 了 卓兰 格格 （ 杨思琦 饰 ） ， 可惜 卓兰 只 喜欢 王五 。,避开 妻子 人物二  杨怡 饰  而入 学堂 人物一 学堂 里 遇上 卓兰 格格  杨思琦 饰   可惜 卓兰 喜欢 王五,1
TRAIN_SENT_ID_270432,关平,关羽,山西 会馆 关帝庙 : 关帝庙 正殿 中间 位置 供奉 着 关羽 的 塑像 ， 东侧 是 怀抱 宝剑 关羽 塑像 ， 手掌 印信 的 关平 ， 西侧 是 手扶 青龙 偃月 刀 的 周仓 。,山西 会馆 关帝庙  关帝庙 正殿 中间 位置 供奉 人物二 塑像  东侧 怀抱 宝剑 人物二 塑像  手掌 印信 人物一  西侧 手扶 青龙 偃月 刀 周仓,-1
TRAIN_SENT_ID_256054,蒋介石,宋美龄,1954 年 ， 蒋介石 偕 夫人 宋美龄 率 属僚 巡视 ， 在 甲午 岩 观景 处 ， 建有 “ 中正 亭 ” ， 後 来 因 年久失修 毁坏 了 。,年  人物一 偕 夫人 人物二 率 属僚 巡视  甲午 岩 观景 处  建有  中正 亭   後 年久失修 毁坏,1
TRAIN_SENT_ID_279194,安琪,齐远,众人 阴差阳错 地 促使 了 叶凡 与 海华 、 梦华 相认 ， 并 通过 视频 让 远 在 法国 的 齐远 、 安琪 目睹 这一 感人 的 重逢 。,众人 阴差阳错 促使 叶凡 海华  梦华 相认  视频 远 法国 人物二  人物一 目睹 这一 感人 重逢,1
TRAIN_SENT_ID_265801,王茜,徐庆东,《 无限 生机 》 是 由 徐庆东 执导 的 32 集 电视 连续剧 ， 由 王茜 ， 刘钧 ， 王挺 ， 隋兰 等 主演 。,无限 生机  人物二 执导  集 电视 连续剧  人物一  刘钧  王挺  隋兰 主演,1
TRAIN_SENT_ID_282467,韦丛,韦夏卿,元稹 妻 韦丛 ， 字蕙 藂 ， 太子 宾客 （ 官名 ） 韦夏卿 之女 。,元稹 妻 人物一  字蕙 藂  太子 宾客  官名  人物二 之女,-1
TRAIN_SENT_ID_248927,阮星竹,段正淳,三人 寻至 小镜湖 方竹林 ， 段正淳 正在 与 隐居 于 此 的 旧情 人 阮星竹 重温 鸳梦 。,三人 寻至 小镜湖 方竹林  人物二 正在 隐居 旧情 人物一 重温 鸳梦,1
TRAIN_SENT_ID_284993,王孟姜,王羲之,王孟姜 = 王羲之 、 郗璿 的 女儿 = 谢瑍 的 母亲 = 谢灵运 的 外祖母 = 南阳 刘畅 的 妻子,人物一  人物二  郗璿 女儿  谢瑍 母亲  谢灵运 外祖母  南阳 刘畅 妻子,-1
TRAIN_SENT_ID_268166,樊梨花,薛丁山,"大唐 高宗 皇帝 李治 亲自 西 上 劳军 拜 樊梨花 为 征西 大元帅 的 帅 , 封 了 薛丁山 一个 帅府 参将 的 官职 , 降旨 薛丁山 和 樊梨花 立即 成婚 。",大唐 高宗 皇帝 李治 亲自 西 劳军 拜 人物一 征西 大元帅 帅  封 人物二 一个 帅府 参将 官职  降旨 人物二 人物一 立即 成婚,1
TRAIN_SENT_ID_271184,李治,唐太宗李世民,贞观 二十三年 （ 649 年 ） ， 唐太宗李世民 去世 后 ， 太子 李治 继位 ， 他 授于 松赞干布 “ 驸马 都尉 ” 之职 ， 封爵 “ 西海郡 王 ” 。,贞观 二十三年   年   人物二 去世  太子 人物一 继位  授于 松赞干布  驸马 都尉  之职  封爵  西海郡 王,-1
TRAIN_SENT_ID_279091,高兰英,张奎,张奎 的 灵兽 ， 拥有 极高 的 速度 ， 称呼 高兰英 为 “ 大姊头 ” 。,人物二 灵兽  拥有 极高 速度  称呼 人物一  大姊头,1
TRAIN_SENT_ID_286110,聂慎儿,聂风,聂慎儿 角色 经历 : 聂慎儿 为 猎户 聂风 与 屏花 之 女 ， 后 聂风 与 屏花 因救 杜云汐 母女 而 死 ， 云汐 与 慎儿,人物一 角色 经历  人物一 猎户 人物二 屏花 女  人物二 屏花 因救 杜云汐 母女 死  云汐 慎儿,-1
TRAIN_SENT_ID_253661,沈浪,朱七七,★ 武林 外史 登场 的 经典 人物 ： 沈浪 、 朱七七 、 王怜花 、 熊猫儿 、 白飞飞 、 金无望 、 快活 王 、 “ 云梦仙子 ” 王夫人 。,★ 武林 外史 登场 经典 人物  人物一  人物二  王怜花  熊猫儿  白飞飞  金无望  快活 王   云梦仙子  王夫人,1
TRAIN_SENT_ID_270540,关平,关羽,对话 2 袁绍 送 5000 金 ， 战前 关羽 、 张飞 归队 ， 赵云 、 周仓 、 关平 加入 。,对话  袁绍 送  金  战前 人物二  张飞 归队  赵云  周仓  人物一 加入,-1
TRAIN_SENT_ID_258602,刘禅,刘备,三月 ， 刘备 诏命 丞相 诸葛亮 辅 太子 刘禅 ， 以 尚书令 李严 为 副 。,三月  人物二 诏命 丞相 诸葛亮 辅 太子 人物一  尚书令 李严 副,-1
TRAIN_SENT_ID_278209,江玉郎,江别鹤,江南 大侠 ： 田丰 ( 江别鹤 ) 、 郑平君 ( 江玉郎 / 江别鹤 之子 ),江南 大侠  田丰  人物二   郑平君  人物一  人物二 之子,-1
TRAIN_SENT_ID_264311,贾环,赵姨娘,凤姐 在 赵姨娘 面前 貌似 爱护 贾环 ， 其实 更是 恨之入骨 ， 说 贾环 “ 实在 令人 难疼 ， 要 依 我 的 性早 撵出去 了 ” 。,凤姐 人物二 面前 貌似 爱护 人物一  其实 更是 恨之入骨  说 人物一  实在 令人 难疼  性早 撵出去,-1
TRAIN_SENT_ID_261934,安雯,苏越,苏越 开始 有意无意 地 接近 她 ， 但 当 安雯 用 那 清澈 的 目光 注视 着 他 时 ， 他 又 会 慌乱 地 低下头 … …,人物二 有意无意 接近  人物一 清澈 目光 注视 时  会 慌乱 低下头,1
TRAIN_SENT_ID_260828,何超琼,许晋亨,两人 分手 后 不久 ， 社交界 便 传出 许晋亨 和 赌王 何鸿燊 的 女儿 何超琼 相恋 。,两人 分手 不久  社交界 便 传出 人物二 赌王 何鸿燊 女儿 人物一 相恋,1
TRAIN_SENT_ID_270929,梁思成,梁启超,1924 年 6 月 ， 林徽因 和 梁思成 在 梁启超 的 安排 下 ， 同时 赴美 攻读 建筑学 。,年  月  林徽因 人物一 人物二 安排  赴美 攻读 建筑学,-1
TRAIN_SENT_ID_284074,郝洛钒,贺毅,贺毅 不 但是 郝洛钒 的 大学 同班同学 ， 也 是 旅游 卫视 的 外景 主持人 ， 还 多次 拍摄 过 电影 。,人物二 人物一 大学 同班同学  旅游 卫视 外景 主持人  多次 拍摄 电影,1
TRAIN_SENT_ID_286094,吴恭,吴䜣,吴雄 ， 东汉 时 人 ， 字季 高 ， 河南 原 武人 ， 儿子 吴䜣 ， 孙子 吴恭 ， 三代 都 是 廷尉 ， 是 当时 的 明法 大家 。,吴雄  东汉 时  字季 高  河南 原 武人  儿子 人物二  孙子 人物一  三代 廷尉  当时 明法,-1
TRAIN_SENT_ID_257841,王安忆,茹志鹃,王安忆 上 小学 之后 ， 茹志鹃 特别 关心 她 的 算术 ， 经常 检查 她 的 数学 作业本 。,人物一 小学 之后  人物二 特别 关心 算术  经常 检查 数学 作业本,-1
TRAIN_SENT_ID_278321,方兰生,孙月言,自闲 山庄 ， 众人 在 幻境 中 看到 方兰生 前世 晋磊 的 一段 往事 ， 原来 孙月言 竟是 晋磊 的 恋人 贺文君 转世 。,自闲 山庄  众人 幻境 中 看到 人物一 前世 晋磊 一段 往事  原来 人物二 竟是 晋磊 恋人 贺文君 转世,1
TRAIN_SENT_ID_278856,富阳公主,褚灵媛,富阳公主 ， 晋恭帝 之女 ， 恭思 皇后 褚灵媛 所 生 ， 司马 茂英妹 。,人物一  晋恭帝 之女  恭思 皇后 人物二 生  司马 茂英妹,-1
TRAIN_SENT_ID_278038,李元霸,李渊,门派 描述 ： 李渊 为了 巩固 自己 的 势力 在 太原 附近 建起 一座 唐 王府 ， 广纳 贤士 ， 由四子 李元霸 负责管理 。,门派 描述  人物二 巩固 势力 太原 附近 建起 一座 唐 王府  广纳 贤士  由四子 人物一 负责管理,-1
TRAIN_SENT_ID_262558,扶苏,秦始皇,秦始皇 长子 扶苏 因 劝阻 始皇 镇压 方士 ， 被 派 到 上 郡 监督 蒙恬 修直 道 。,人物二 长子 人物一 劝阻 始皇 镇压 方士  派 郡 监督 蒙恬 修直 道,-1
TRAIN_SENT_ID_278381,荀庚,荀林父,前 594 年 ， 正卿 荀林父 退出 政坛 （ 或者 去世 ） ， 其子 荀庚 继父 为 中行 氏之主 ， 随 武子 士会 执政 ， 时六卿 将佐 如下 ：,前  年  正卿 人物二 退出 政坛  去世   其子 人物一 继父 中行 氏之主  武子 士会 执政  时六卿 将佐,-1
TRAIN_SENT_ID_255168,胡斐,胡一刀,1985 年 ， 与 赵雅芝 主演 电视剧 《 雪山飞狐 》 ， 分饰 胡一刀 和 胡斐 两个 角色 。,年  赵雅芝 主演 电视剧  雪山飞狐   分饰 人物二 人物一 两个 角色,-1
TRAIN_SENT_ID_265941,杨绛,钱钟书,（ 北师大 外语系 教授 ） : 钱瑗 ， 北京师范大学 英语系 教授 ， 钱钟书 和 杨绛 的 女儿 。,北师大 外语系 教授   钱瑗  北京师范大学 英语系 教授  人物二 人物一 女儿,1
TRAIN_SENT_ID_265192,尤二姐,贾琏,九龙 珮 剧情 介绍 : 贾琏 久闻 尤二姐 貌美 ， 治丧 期间 与 尤二姐 相识 ， 并 在 贾蓉 面前 夸赞 尤二姐 。,九龙 珮 剧情 介绍  人物二 久闻 人物一 貌美  治丧 期间 人物一 相识  贾蓉 面前 夸赞 人物一,1
TRAIN_SENT_ID_265272,贾琏,贾赦,等到 贾府 败势 一显 ， 外面 仇家 — 齐 纷起 ， 报复 的 报复 ， 趁火打劫 的 打劫 ， 最先 被 举告 的 不是 贾政 这边 ， 却是 贾赦 、 贾琏 父子 。,贾府 败势 一显  外面 仇家  齐 纷起  报复 报复  趁火打劫 打劫  最先 举告 贾政  却是 人物二  人物一 父子,-1
TRAIN_SENT_ID_251807,贾珠,贾兰,4.2 . 贾珠 配 李纨 ， 生 贾兰 。,人物一 配 李纨  生 人物二,-1
