sent_id,entity1,entity2,sent,processed_sent,human
TRAIN_SENT_ID_266007,韦春花,韦小宝,韦小宝 人物 关系 : 母亲 ： 韦春花,人物二 人物 关系  母亲  人物一,-1
TRAIN_SENT_ID_251214,廖仲恺,何香凝,廖仲恺 何香凝 墓 位于 钟山 南麓 天堡 城下 ， 明孝陵 以西 。,人物一 人物二 墓 位于 钟山 南麓 天堡 城下  明孝陵 以西,1
TRAIN_SENT_ID_274263,贾敬,贾珍,因给 贾敬 过生日 ， 贾珍 命来 升 预备 两日 的 筵席 。,因给 人物一 过生日  人物二 命来 升 预备 两日 筵席,-1
TRAIN_SENT_ID_253715,申雪,赵宏博,在 被 提名 成为 首批 火炬手 后 ， 申雪 、 赵宏博 表达 了 自己 的 愿望 ， 希望 能够 在 火炬 传递 时 ， 两人共擎 火炬 跑 完 火炬 接力 路程 。,提名 成为 首批 火炬手  人物一  人物二 表达 愿望  希望 能够 火炬 传递 时  两人共擎 火炬 跑 完 火炬 接力 路程,1
TRAIN_SENT_ID_262686,况天佑,马小玲,几经 波折 ， 况天涯 主动 承认 自己 是 况天佑 、 马小玲 在 未来 的 女儿 。,几经 波折  况天涯 主动 承认 人物一  人物二 未来 女儿,1
TRAIN_SENT_ID_266599,许晋亨,李嘉欣,晚餐 开始 前 ， 李嘉欣 与 许晋亨 还 将 在 亲友 及 家人 见证 下 ， 由 律师 主持 注册 仪式 。,晚餐 前  人物二 人物一 亲友 家人 见证  律师 主持 注册 仪式,1
TRAIN_SENT_ID_258736,刘禅,刘备,刘备 逝世 于 白帝城 后 ， 丞相 诸葛亮 受 托孤 辅助 后主 刘禅 ， 蜀汉 国力 慢慢 恢复 。,人物二 逝世 白帝城  丞相 诸葛亮 受 托孤 辅助 后主 人物一  蜀汉 国力 慢慢 恢复,-1
TRAIN_SENT_ID_286446,赵匡济,赵弘殷,为 赵弘殷 次子 ， 长兄 赵匡济 早夭 ， 母亲 为 杜氏 。,人物二 次子  长兄 人物一 早夭  母亲 杜氏,-1
TRAIN_SENT_ID_279314,白水喜,程舒航,▪ 白水喜 ( 海陆 饰 ) ▪ 程舒航 ( 高梓淇 饰 ),▪ 人物一  海陆 饰  ▪ 人物二  高梓淇 饰,1
TRAIN_SENT_ID_268370,秦始皇,扶苏,操劳过度 的 秦始皇 终于 病倒 在 巡 旅途 中 ， 扶苏 、 黎姜 赶来 侍奉 医药 ， 就 在 三人 其乐融融 时 ， 张良 买来 的 死士 向 始皇 车驾 投出 了 致命 一击 。,操劳过度 人物一 终于 病倒 巡 旅途 中  人物二  黎姜 赶来 侍奉 医药  三人 其乐融融 时  张良 买来 死士 始皇 车驾 投出 致命 一击,-1
TRAIN_SENT_ID_286412,陈慧珊,钟家鸿,2012 年 4 月 ， 陈慧珊 老公 钟家鸿 宣布 破产 ， 陈慧珊 全面 复出 。,年  月  人物一 老公 人物二 宣布 破产  人物一 全面 复出,1
TRAIN_SENT_ID_266964,关索,关羽,关索 ； 关羽 三子 。,人物一  人物二 三子,-1
TRAIN_SENT_ID_268717,秦可卿,贾蓉,秦可卿 和 贾蓉,人物一 人物二,1
TRAIN_SENT_ID_276015,贾午,贾充,“ 夜约 ” ， 用唐 元稹 《 会真记 》 崔莺莺 夜约 张生 故事 ； “ 遗香 ” ， 用晋 贾充 女 贾午 ， 遗 御赐 奇香 与 韩寿 ， 遂 结秦晋之 好 故事 。,夜约   用唐 元稹  会真记  崔莺莺 夜约 张生 故事   遗香   用晋 人物二 女 人物一  遗 御赐 奇香 韩寿  遂 结秦晋之 故事,-1
TRAIN_SENT_ID_286521,王皇后,曹芳,人物 生平 : 王皇后 ， 曹魏 废帝 曹芳 的 第三任 皇后 ， 奉 车都尉 王夔 的 女儿 。,人物 生平  人物一  曹魏 废帝 人物二 第三任 皇后  奉 车都尉 王夔 女儿,1
TRAIN_SENT_ID_271861,阎婆惜,宋江,第 020 回 虔婆 醉 打 唐牛儿 宋江 怒 杀 阎婆惜,回 虔婆 醉 唐牛儿 人物二 怒 杀 人物一,1
TRAIN_SENT_ID_282679,刘之冰,茹萍,4 . 扮演 芦苇 前夫 的 刘之冰 跟 芦苇 的 扮演者 茹萍 在 现实生活 中是 一对 货真价实 的 夫妻 。,扮演 芦苇 前夫 人物一 芦苇 扮演者 人物二 现实生活 中是 一对 货真价实 夫妻,1
TRAIN_SENT_ID_258389,张兆和,沈从文,而 沈从文 就是 一直 以 “ 三 三 ” 这样 来 称呼 张兆和 的 ， 张兆和 反过来 称呼 沈从文 作 “ 二哥 ” 。,人物二 一直  三 三  称呼 人物一  人物一 称呼 人物二 作  二哥,1
TRAIN_SENT_ID_262427,扶苏,秦始皇,秦始皇 的 儿子 ： 扶苏 之死 与 胡亥 之立,人物二 儿子  人物一 之死 胡亥 之立,-1
TRAIN_SENT_ID_268547,潘金莲,武大郎,2 剧情 : 婢女 潘金莲 遭 主人 奸污 ， 复 被迫 嫁予 卖 饼 郎 武大郎 。,剧情  婢女 人物一 遭 主人 奸污  复 被迫 嫁予 卖 饼 郎 人物二,1
TRAIN_SENT_ID_258700,刘禅,刘备,（ 刘备 、 刘禅 ）,人物二  人物一,-1
TRAIN_SENT_ID_259820,焦仁和,张悬,张悬 ， 台湾歌手 ， 本名 焦安溥 ， 海基会 前 副董事长 兼 秘书长 及 台湾 行政院 侨务 委员会 委员长 焦仁和 之女 。,人物二  台湾歌手  本名 焦安溥  海基会 前 副董事长 兼 秘书长 台湾 行政院 侨务 委员会 委员长 人物一 之女,-1
TRAIN_SENT_ID_279589,马丽娟,赵本山,坐在 一旁 的 师娘 马丽娟 语重心长 地说 ： “ 给 赵本山 当 徒弟 ， 不用 给 我们 送礼 ， 我们 什么 都 不缺 ， 只求 你们 能 有 出息 。,坐在 一旁 师娘 人物一 语重心长 地说   人物二 徒弟  不用 送礼  不缺  只求 出息,1
TRAIN_SENT_ID_270749,梁萧,花晓霜,花晓霜 第一次 出场 是 与 梁萧 偶遇 在 西湖 边 ， 那个 扎 着 两个 小 发髻 ， 一身 白衣 的 小女孩 ， 很 是 惹 人 怜爱 。,人物二 第一次 出场 人物一 偶遇 西湖  扎 两个 发髻  一身 白衣 小女孩  惹 怜爱,1
TRAIN_SENT_ID_281385,林姮怡,蒋友柏,2003 年 2 月 ， 林姮怡 与 蒋家 第四代 的 蒋友柏 结婚 。,年  月  人物一 蒋家 第四代 人物二 结婚,1
TRAIN_SENT_ID_283815,桓济,桓温,（ 9 ） 十一月 ， 东晋 封 桓温 为 南郡 公 ， 封 桓温 的 弟弟 桓冲 为 丰城 县公 ， 桓温 的 儿子 桓济 为临 贺县 公 。,十一月  东晋 封 人物二 南郡 公  封 人物二 弟弟 桓冲 丰城 县公  人物二 儿子 人物一 为临 贺县 公,-1
TRAIN_SENT_ID_286748,武顺,贺兰越石,贺兰越石 死后 ， 因 武则天 在 宫中 ， 武顺 也 经常 出入 宫禁 ， 与 唐高宗 李治 通奸 。,人物二 死后  武则天 宫中  人物一 经常 出入 宫禁  唐高宗 李治 通奸,1
TRAIN_SENT_ID_265996,杨绛,钱钟书,钱钟书 说 ， 那狗 也许 “ 早 变成 了 一堆 大粪 了 ” ， 杨绛 则 认为 ， “ 也许 变成 一只 老母 狗 ， 拣些 粪 吃 过日子 ， 还要 养活 一窝 又 一窝 的 小狗 。 ”,人物二 说  那狗 也许  早 变成 一堆 大粪   人物一 认为   也许 变成 一只 老母 狗  拣些 粪 吃 过日子  养活 一窝 一窝 小狗,1
TRAIN_SENT_ID_259901,花月奴,江枫,"1 故事 简介 : 移花宫 主邀 月 因 爱成 恨 , 追杀 江枫 花月奴 夫妇 。",故事 简介  移花宫 主邀 月 爱成 恨  追杀 人物二 人物一 夫妇,1
TRAIN_SENT_ID_272107,张翠山,殷素素,张翠山 、 殷素素 一家 与 金毛狮 王 谢逊 在 冰火 岛 生活 了 十几年 后 返回 中原 ， 与 此 开始 了 整部 剧 的 主要 内容 。,人物一  人物二 一家 金毛狮 王 谢逊 冰火 岛 生活 十几年 返回 中原  整部 剧 主要 内容,1
TRAIN_SENT_ID_277069,龙非离,年璇玑,“ 龙非离 ， 是不是 因为 每次 我 都 可以 为 你 为 你 身边 的 人 轻易 去 死 ， 你 便 觉得 我 年璇玑 下贱 到 可以 任 你 一次次 这样 对待 ？ ”,人物一  是不是 每次 身边 轻易 死  便 觉得 人物二 下贱 一次次,1
TRAIN_SENT_ID_258364,张兆和,沈从文,文革 十年 ， 长子 在 北京 ， 次子 在 四川 ， 沈从文 张兆和 夫妻 二人 虽同 在 湖北 也 多 天各一方 。,文革 十年  长子 北京  次子 四川  人物二 人物一 夫妻 二人 虽同 湖北 天各一方,1
TRAIN_SENT_ID_268487,曹襄,卫长公主,曹襄 娶 了 卫长公主 ， 生 儿子 曹宗 。,人物一 娶 人物二  生 儿子 曹宗,1
TRAIN_SENT_ID_262656,况天佑,马小玲,在 命运 的 挑拨 下 ， 人 王与 圣母 展开 决斗 ， 马小玲 、 况天佑 、 袁 不破 、 毛忧 还有 灵异 部队 剩下 的 成员 都 参加 了 这场 灭世之战 。,命运 挑拨  王与 圣母 展开 决斗  人物二  人物一  袁 不破  毛忧 灵异 部队 剩下 成员 参加 这场 灭世之战,1
TRAIN_SENT_ID_284198,谭俊彦,狄龙,作为 一代 影视明星 狄龙 之子 ， 谭俊彦 也 是 从小 受 父亲 的 熏陶 ， 严传 身教 ， 有 很 好 的 演戏 功底 。,一代 影视明星 人物二 之子  人物一 从小 受 父亲 熏陶  严传 身教  演戏 功底,-1
TRAIN_SENT_ID_269906,张默,张国立,张默 的 父亲 是 张国立 ， 母亲 是 妻 罗秀春 ， 继母 是 邓婕 。,人物一 父亲 人物二  母亲 妻 罗秀春  继母 邓婕,-1
TRAIN_SENT_ID_262302,汪精卫,陈璧君,1908 年 赴 缅甸 设 同盟会 仰光 分会 ， 3 月 汪精卫 在 马来亚 的 槟城 结识 了 华侨 巨富 陈耕 基的 女儿 陈璧君 。,年 赴 缅甸 设 同盟会 仰光 分会   月 人物一 马来亚 槟城 结识 华侨 巨富 陈耕 基的 女儿 人物二,1
TRAIN_SENT_ID_276535,孔子,亓官氏,孔子 夫人 亓官氏 卒 。,人物一 夫人 人物二 卒,1
TRAIN_SENT_ID_285010,庄月明,李嘉诚,李嘉诚 这位 小表妹 庄月明 ， 不但 聪明伶俐 和 心地善良 ， 而且 自幼 在 香港 的 高级 书院 读书 ， 后来 曾 赴 海 留学 精通 多种语言 文化 。,人物二 这位 小表妹 人物一  聪明伶俐 心地善良  自幼 香港 高级 书院 读书  后来 赴 海 留学 精通 多种语言 文化,1
TRAIN_SENT_ID_268357,秦始皇,扶苏,据 乾隆 《 枸邑 县志 》 记载 ， 秦始皇 之 长子 扶苏 ， 去 上 郡 蒙恬 屯军处 监军 时 ， 途中 两个 女儿 死去 ， 葬于 此 。,乾隆  枸邑 县志  记载  人物一 长子 人物二  郡 蒙恬 屯军处 监军 时  途中 两个 女儿 死去  葬于,-1
TRAIN_SENT_ID_278791,任盈盈,任我行,性行 高洁 的 任我行 之女 任盈盈 接任 教主 后 ， 与 情人 令狐冲 一道 化干戈为玉帛 ， 然后 卸职 完婚 。,性行 高洁 人物二 之女 人物一 接任 教主  情人 令狐冲 一道 化干戈为玉帛  卸职 完婚,-1
TRAIN_SENT_ID_286505,王润贞,沈必贵,那 便是 主官 之 — — — 沈必贵 的 女儿 王润贞 。,便是 主官    人物二 女儿 人物一,-1
TRAIN_SENT_ID_272166,马小玲,况天佑,"将臣 , 赢 勾 , 梦 天公 , 女娲 , 况天佑 , 马小玲 , 伏羲 , 易神 。",将臣  赢 勾  梦 天公  女娲  人物二  人物一  伏羲  易神,1
TRAIN_SENT_ID_262079,红邵可,红秀丽,"年初 , 红邵可 之女 红秀丽 奉霄 太师 之命 入宫 侍奉 君王 。",年初  人物一 之女 人物二 奉霄 太师 之命 入宫 侍奉 君王,-1
TRAIN_SENT_ID_271863,阎婆惜,宋江,7 、 明 施耐庵 《 水浒 》 第二十一回 《 虔婆 醉 打 唐牛儿 宋江 怒 杀 阎婆惜 》 我 吃 这 婆子 钉住 了 ， 脱身 不得 。,明 施耐庵  水浒  第二十一回  虔婆 醉 唐牛儿 人物二 怒 杀 人物一  吃 婆子 钉住  脱身,1
TRAIN_SENT_ID_285913,上官兰心,朱常洛,李梅儿 《 美人计 》 : 明光宗 朱常洛 即位 后 ， 他 梦想 与 深爱 的 妻子 上官兰心 双宿双飞 ， 白头到老 。,李梅儿  美人计   明光宗 人物二 即位  梦想 深爱 妻子 人物一 双宿双飞  白头到老,1
TRAIN_SENT_ID_261525,关兴,关羽,高大雄伟 的 刘备 庙 鹤立 正中 ， 庙 内塑 刘备 、 关羽 、 张飞 之座 像 及 关兴 、 张苞 的 站 像 ， 神情 逼真 、 栩栩如生 。,高大雄伟 刘备 庙 鹤立 正中  庙 内塑 刘备  人物二  张飞 之座 人物一  张苞 站  神情 逼真  栩栩如生,-1
TRAIN_SENT_ID_268855,夏雪,刘梅,《 双喜临门 》 ： 夏雪 比赛 获奖 ， 刘梅 领了 奖金 ， 夏家 可谓 双喜临门 。,双喜临门   人物一 比赛 获奖  人物二 领了 奖金  夏家 可谓 双喜临门,-1
TRAIN_SENT_ID_252339,文姜,鲁桓公,齐僖公 的 女儿 文姜 嫁给 鲁桓公 之后 还 与 自己 的 哥哥 ( 即 后来 的 齐襄公 ) 保持 着 情人 关系 ， 最后 ， 齐襄公 居然 派 杀手 暗杀 了 鲁桓公 。,齐僖公 女儿 人物一 嫁给 人物二 之后 哥哥  后来 齐襄公  保持 情人 关系  最后  齐襄公 居然 派 杀手 暗杀 人物二,1
TRAIN_SENT_ID_274525,薛丁山,薛仁贵,据 李氏 族人 回忆 ， 古人 讲 樊梨花 是 名将 薛礼 之子 薛丁山 之妻 ， 因为 本溪 地区 确实 有 很多 “ 薛仁贵 征东 ” 的 历史 遗迹 。,李氏 族人 回忆  古人 讲 樊梨花 名将 薛礼 之子 人物一 之妻  本溪 地区 确实 很多  人物二 征东  历史 遗迹,-1
TRAIN_SENT_ID_268695,孔子,颜徵在,颜徵在 后于 女陵 山生 孔子 ， 起名 孔丘 ， 字 仲尼 。,人物二 后于 女陵 山生 人物一  起名 孔丘  字 仲尼,-1
TRAIN_SENT_ID_269380,颜徵在,孔子,孔子 三岁时 ， 叔 梁纥 卒 ， 孔子 母子 也 不 为 叔 梁纥 的 正妻 施氏 所容 ， 孔母 颜徵在 只好 携 孔子 及 孟皮 移居 曲阜 阙里 ， 生活 艰难 。,人物二 三岁时  叔 梁纥 卒  人物二 母子 叔 梁纥 正妻 施氏 所容  孔母 人物一 只好 携 人物二 孟皮 移居 曲阜 阙里  生活 艰难,-1
TRAIN_SENT_ID_266384,蔡赟,王娜,2006 年 8 月 香港 公开赛 期间 ， 蔡赟 在 搭档 傅海峰 的 陪同 下 ， 为 自己 和 王娜 挑选 了 一对 戒指 。,年  月 香港 公开赛 期间  人物一 搭档 傅海峰 陪同  人物二 挑选 一对 戒指,1
TRAIN_SENT_ID_273794,萧远山,萧峰,】 萧峰 左掌 一回 ， 那老僧 的 右掌 立即 圈转 ， 波 的 一声 轻响 ， 已 击中 了 萧远山 的 顶门 。,人物二 左掌 一回  那老僧 右掌 立即 圈转  波 一声 轻响  击中 人物一 顶门,-1
TRAIN_SENT_ID_273943,江冬秀,胡适,胡适 为 国家 奔忙 ， 长子 思祖 经常 跟 在 身边 ， 幼子 思杜 经常 跟 在 江冬秀 身边 ， 但是 一般 父母 都 喜爱 最小 的 孩子 ， 胡适 也 一样 。,人物二 国家 奔忙  长子 思祖 经常 身边  幼子 思杜 经常 人物一 身边  父母 喜爱 最小 孩子  人物二,1
TRAIN_SENT_ID_276422,秦始皇,秦庄襄王,赵国 邯郸 人 ， 原 为 吕不韦 的 姬 妾 ， 后 成为 秦庄襄王 王后 ， 秦王 政 （ 未来 的 秦始皇 ） 的 生母 。,赵国 邯郸  原 吕不韦 姬 妾  成为 人物二 王后  秦王 政  未来 人物一  生母,-1
TRAIN_SENT_ID_283661,刘虎,刘海粟,1993 年 3 月 16 日 ， 刘虎 先生 带 着 在 美国 当 建筑师 的 儿子 刘璞 在 上海 为 父亲 刘海粟 祝寿 。,年  月  日  人物一 先生 带 美国 建筑师 儿子 刘璞 上海 父亲 人物二 祝寿,-1
TRAIN_SENT_ID_262500,扶苏,秦始皇,20 . 扶苏 ： 秦始皇 长子 ， 曾谏阻 秦始皇 坑杀 儒生 ， 始皇 怒 ， 使北监 蒙恬 军 。,人物一  人物二 长子  曾谏阻 人物二 坑杀 儒生  始皇 怒  使北监 蒙恬 军,-1
TRAIN_SENT_ID_266556,张无忌,殷素素,殷素素 与 张翠山 在 冰火 岛上 结为夫妇 ， 并 诞下 一子 张无忌 。,人物二 张翠山 冰火 岛上 结为夫妇  诞下 一子 人物一,-1
TRAIN_SENT_ID_267329,赵本山,赵玉芳,赵玉芳 人物 经历 : 1991 年 5 月 ， 赵本山 与 葛淑珍 和和气气 地 办理 了 离婚 手续 。,人物二 人物 经历   年  月  人物一 葛淑珍 和和气气 办理 离婚 手续,-1
TRAIN_SENT_ID_249438,后稷,姜嫄,姜嫄 河是 泾河 一级 支流 ， 即 渭河 二级 支流 ， 以 周朝 祖先 后稷 之母 姜嫄 为名 。,人物二 河是 泾河 一级 支流  渭河 二级 支流  周朝 祖先 人物一 之母 人物二 为名,-1
TRAIN_SENT_ID_258592,刘禅,刘备,热血 无 双星 彩 : 星彩 张飞 之女 ， 刘禅 之妻 、 与 关平 青梅竹马 ， 肩负着 守护 蜀国 未来 的 希望 — — 刘备 嫡长子 刘禅 的 使命 。,热血 双星 彩  星彩 张飞 之女  人物一 之妻  关平 青梅竹马  肩负着 守护 蜀国 未来 希望   人物二 嫡长子 人物一 使命,-1
TRAIN_SENT_ID_284010,金乡公主,何晏,安阳公主 ， 名 不详 ， 为 荀恽 之妻 ； 金乡公主 ， 名 不详 ， 何晏 之妻 ； 清河 长 公主 ， 名 不详 ， 夏侯楙 之妻,安阳公主  名 不详  荀恽 之妻  人物一  名 不详  人物二 之妻  清河 长 公主  名 不详  夏侯楙 之妻,1
TRAIN_SENT_ID_286212,萧之航,杜雪吟,杜雪吟 新旧 版 之 差别 : 在 旧版 之中 由 胡晓婷 扮演 ， 丈夫 是 方之航 ， 新版 则 由 秦岚 扮演 ， 丈夫 是 江南 第一 侠 萧之航 。,人物二 新旧 版 差别  旧版 之中 胡晓婷 扮演  丈夫 方之航  新版 秦岚 扮演  丈夫 江南 第一 侠 人物一,1
TRAIN_SENT_ID_261107,胡一刀,胡斐,人物形象 : 《 雪山飞狐 》 主要 写 胡斐 与 苗人凤 和 胡一刀 夫妇 的 江湖 恩仇 。,人物形象   雪山飞狐  主要 写 人物二 苗人凤 人物一 夫妇 江湖 恩仇,-1
TRAIN_SENT_ID_266399,蔡赟,王娜,蔡赟 对 王娜 绝对 称得上 是 一见钟情 。,人物一 人物二 绝对 称得上 一见钟情,1
TRAIN_SENT_ID_286068,诸葛婉,诸葛冲,诸葛婉 人物 生平 : 诸葛婉 是 诸葛冲 的 女儿 ， 诸葛冲 是 诸葛绪 的 儿子 。,人物一 人物 生平  人物一 人物二 女儿  人物二 诸葛绪 儿子,-1
TRAIN_SENT_ID_268748,孟明视,百里奚,百里奚 和 蹇 叔 劝谏 ， 秦穆公 不 听 ， 派 百里奚 的 儿子 孟明视 、 蹇 叔 的 儿子 西乞术 和 白乙丙 带兵 偷袭 郑国 。,人物二 蹇 叔 劝谏  秦穆公 听  派 人物二 儿子 人物一  蹇 叔 儿子 西乞术 白乙丙 带兵 偷袭 郑国,-1
TRAIN_SENT_ID_256164,蒋介石,宋美龄,漂亮 的 、 穿着 讲究 的 、 受过 美国 高等教育 的 宋美龄 ， 为 蒋介石 那个 与 上层社会 的 现实 格格不入 的 政权 装饰 了 门面 。,漂亮  穿着 讲究  受过 美国 高等教育 人物二  人物一 上层社会 现实 格格不入 政权 装饰 门面,1
TRAIN_SENT_ID_285134,王晶,王天林,作者简介 : 王晶 ， 原名 王日祥 ， 父 为名 导演 王天林 。,作者简介  人物一  原名 王日祥  父 为名 导演 人物二,-1
TRAIN_SENT_ID_279617,晏紫,李圣根,李圣根 恋情 回顾 : 李圣根 、 晏紫 两人 相识 与 网球 有关 ， 并且 结缘 于 广州 。,人物二 恋情 回顾  人物二  人物一 两人 相识 网球  结缘 广州,1
TRAIN_SENT_ID_255500,刘梅,夏雪,《 老妈 谢谢 你 》 ： 刘梅 为了 迎合 女儿 夏雪 的 喜好 ， 自己 恶补 猩猩 的 知识 。,老妈 谢谢   人物一 迎合 女儿 人物二 喜好  恶补 猩猩 知识,-1
TRAIN_SENT_ID_268712,秦可卿,贾蓉,全书 结尾处 ， 贾政 、 贾蓉 扶 贾母 、 秦可卿 、 凤姐 、 鸳鸯 、 黛玉 灵柩 回南 安葬 。,全书 结尾处  贾政  人物二 扶 贾母  人物一  凤姐  鸳鸯  黛玉 灵柩 回南 安葬,1
TRAIN_SENT_ID_279016,林诗音,龙啸云,[ 4 - 5 ] [ 6 - 7 ] 故园 旧怨 : 前往 见 昔日 好友 龙啸云 ， 于 「 兴云庄 」 中 遇到 林诗音 、 林仙儿 、 龙啸云 等 人 。,故园 旧怨  前往 见 昔日 好友 人物二   兴云庄  中 遇到 人物一  林仙儿  人物二,1
TRAIN_SENT_ID_278523,李秀文,叶挺,李秀文 当然 满心欢喜 ， 她 对 叶挺 已 是 以心 相许 ， 但 她 提出 还要 征求 父母 的 意见 才能 最后 决定 。,人物一 满心欢喜  人物二 以心 相许  提出 征求 父母 意见 最后 决定,1
TRAIN_SENT_ID_285934,常茂,常遇春,尽管 历史 上 的 常茂 功绩 远不如 其父 常遇春 ， 但 评书 《 明 英烈 》 中 对 常茂 评价 颇 高 ， 其 功绩 甚至 超过 了 他 的 父亲 。,历史 人物一 功绩 远不如 其父 人物二  评书  明 英烈  中 人物一 评价 颇 高  功绩 超过 父亲,-1
TRAIN_SENT_ID_265697,贾环,贾政,贾环 诬陷 贾宝玉 调戏 金钏儿 致其 被 撵 投井 ， 忠顺 王府 问罪 贾宝玉 “ 藏匿 ” 蒋玉 函 ， 两案 并发 ， 贾宝玉 被 贾政 一顿 毒打 。,人物一 诬陷 贾宝玉 调戏 金钏儿 致其 撵 投井  忠顺 王府 问罪 贾宝玉  藏匿  蒋玉 函  两案 并发  贾宝玉 人物二 一顿 毒打,-1
TRAIN_SENT_ID_251783,张洁,周立波,张洁 接受 某 网络媒体 的 采访 ， 回应 了 和 周立波 发生 情变 的 所有 细节 问题 。,人物一 接受 网络媒体 采访  回应 人物二 发生 情变 细节 问题,1
TRAIN_SENT_ID_278022,李元霸,李渊,八大 锤 李元霸 : 李元霸 （ 599 年 － 614 年 ） ， 字 大德 ， 李渊 第三 子 、 唐太宗 弟弟 ， 被 封为卫 怀王 。,八大 锤 人物一  人物一   年   年   字 大德  人物二 第三 子  唐太宗 弟弟  封为卫 怀王,-1
TRAIN_SENT_ID_262821,熊美玲,林秋离,No.47 如梦 一场 林秋离 熊美玲 玛丽亚 、 熊美玲,如梦 一场 人物二 人物一 玛丽亚  人物一,1
TRAIN_SENT_ID_269589,李思,黄秋燕,黄秋燕 人物 生活 : 黄秋燕 婚姻 结构 : 1987 年 6 月 与 师弟 李连杰 结婚 （ 生有 两女 ： 李思 、 李苔蜜 ） ， 于 1990 年 离异 。,人物二 人物 生活  人物二 婚姻 结构   年  月 师弟 李连杰 结婚  生有 两女  人物一  李苔蜜    年 离异,-1
TRAIN_SENT_ID_251469,谢贤,谢霆锋,成则为王 歌手 简介 : 谢霆锋 ， 著名 的 歌手 、 演员 ， 父亲 谢贤 ， 母亲 狄波拉 。,成则为王 歌手 简介  人物二  著名 歌手  演员  父亲 人物一  母亲 狄波拉,-1
TRAIN_SENT_ID_270217,谭江柏,谭咏麟,谭咏麟 （ 1950 年 8 年 23 日 － ） 绰号 「 谭 校长 」 ， 为 已故 足球 名宿 谭江柏 之子 ，,人物二   年  年  日   绰号  谭 校长   已故 足球 名宿 人物一 之子,-1
TRAIN_SENT_ID_286905,林华国,林梦飞,家庭 状况 ： 祖父 － 林梦飞 ， 父亲 － 林华国 ， 母亲 ， 弟弟 ， 妹妹,家庭 状况  祖父  人物二  父亲  人物一  母亲  弟弟  妹妹,-1
TRAIN_SENT_ID_270889,贾午,韩寿,可是 韩寿 的 妻子 贾午 与 贾后 都 不 同意 ， 却 为 司马遹 聘 了 王衍 的 小女儿 王惠风 。,人物二 妻子 人物一 贾后 同意  司马遹 聘 王衍 小女儿 王惠风,1
TRAIN_SENT_ID_265020,周天娜,周佳纳,和 周佳纳 的 母亲 周天娜 相比 ， 她 的 父亲 周英华 显然 低调 得 多 。,人物二 母亲 人物一 相比  父亲 周英华 显然 低调,-1
TRAIN_SENT_ID_266520,严世蕃,严嵩,另据 翟鹏 家谱 记载 ： 严嵩 的 儿子 、 吏部 尚书 严世蕃 到 山海卫 “ 阅边 ” 时 ， 途经 抚宁 鼓楼 东 的 “ 尚书府 ” 顺便 到 翟府 拜访 。,另据 翟鹏 家谱 记载  人物二 儿子  吏部 尚书 人物一 山海卫  阅边  时  途经 抚宁 鼓楼 东  尚书府  顺便 翟府 拜访,-1
TRAIN_SENT_ID_273162,黄苗子,郁风,《 黄苗子 与 郁风 》 是 2003 - 10 - 1 大象 出版 的 图书 ， 作者 是 李辉 。,人物一 人物二       大象 出版 图书  作者 李辉,1
TRAIN_SENT_ID_274920,晏几道,晏殊,晏殊 、 欧阳修 、 张先 ， 固雅负 盛名 ， 而 砥柱中流 ， 断非 晏几道 莫属 。,人物二  欧阳修  张先  固雅负 盛名  砥柱中流  断非 人物一 莫属,-1
TRAIN_SENT_ID_260276,穆桂英,杨宗保,1 . 杨宗保 大战 穆桂英,人物二 大战 人物一,1
TRAIN_SENT_ID_262488,扶苏,秦始皇,到 了 大一统 的 秦朝 ， 秦始皇 甫 死 ， 长子 扶苏 ， 将军 蒙恬 、 蒙毅 等 人 就 被 胡亥 、 赵高 、 李斯 矫 始皇 遗诏 赐死 。,大一统 秦朝  人物二 甫 死  长子 人物一  将军 蒙恬  蒙毅 胡亥  赵高  李斯 矫 始皇 遗诏 赐死,-1
TRAIN_SENT_ID_259609,冯小刚,徐帆,在 具有 冯氏 幽默 印记 的 电影 作品 中 ， 冯小刚 以 其 平民 视角 的 幽默 与 冯小刚 徐帆 合影 ( 13 张 ),具有 冯氏 幽默 印记 电影 作品 中  人物一 平民 视角 幽默 人物一 人物二 合影   张,1
TRAIN_SENT_ID_286422,苏保衡,苏京,苏京 不久 病死 ， 临终前 将 苏保衡 托付 于 完 颜宗翰 ， 后 在 完 颜宗翰 的 推荐 下 ， 苏保衡 被 授予 进士 出身 、 太子 洗马 。,人物二 不久 病死  临终前 人物一 托付 完 颜宗翰  完 颜宗翰 推荐  人物一 授予 进士 出身  太子 洗马,-1
TRAIN_SENT_ID_259192,刘备,刘禅,刘备 ： 遗诏 敕 刘禅,人物一  遗诏 敕 人物二,-1
TRAIN_SENT_ID_251211,廖仲恺,何香凝,1903 年 1 月 ， 廖仲恺 暂别 何香凝 ， 先行 赴 日 。,年  月  人物一 暂别 人物二  先行 赴 日,1
TRAIN_SENT_ID_266938,关索,关羽,我们 必须 注意 ， 这 不是 一般 的 用典 ， 赵匡胤 是 红生 ， 关索 是 关羽 之子 ， 也 当然 是 红生 ， 这 分明 是 以戏 比戏 。,必须 注意  用典  赵匡胤 红生  人物一 人物二 之子  红生  分明 以戏 比戏,-1
TRAIN_SENT_ID_256758,邵昕,黄玉婷,黄玉婷 偷 睡袍 : 2009 年 9 月 ， 邵昕 上 卫视 《 一袋 女皇 》 瞎 爆 妻子 婷婷 出国 偷 酒店 木雕 被 抓 包 ， 婷婷 为此 与 他 翻脸 。,人物二 偷 睡袍   年  月  人物一 卫视  一袋 女皇  瞎 爆 妻子 婷婷 出国 偷 酒店 木雕 抓 包  婷婷 翻脸,1
TRAIN_SENT_ID_267251,陆毅,鲍蕾,陆毅 和 鲍蕾,人物一 人物二,1
