sent_id,entity1,entity2,sent,processed_sent,human
TRAIN_SENT_ID_263545,林逸,杨明,黄土 高派 土 青松 的 女儿 ， 杨明 的 干女儿 ， 林逸 的 青梅竹马 。,黄土 高派 土 青松 女儿  人物二 干女儿  人物一 青梅竹马,-1
TRAIN_SENT_ID_250568,鲁西西,皮皮鲁,本剧 讲述 皮皮鲁 在 魔方 大厦 的 冒险 、 鲁西西 和 鲍尔 历险记 等 富有 科幻 色彩 、 充满 童真 童趣 的 小 故事 ， 向 孩子 们 传递 健康 向上 的 正 能量 。,本剧 讲述 人物二 魔方 大厦 冒险  人物一 鲍尔 历险记 富有 科幻 色彩  充满 童真 童趣 故事  孩子 传递 健康 向上 正 能量,-1
TRAIN_SENT_ID_265727,李三思,李三省,李三思 与 一 富家 小姐 相恋 ， 为求 师父 为 其 提亲 ， 四处 盗宝 ， 其弟 李三省 则 与 铁掌 门 的 铁掌 飞凤 孙岚 在 余杭 成婚 。,人物一 富家 小姐 相恋  为求 师父 提亲  四处 盗宝  其弟 人物二 铁掌 门 铁掌 飞凤 孙岚 余杭 成婚,-1
TRAIN_SENT_ID_265420,薛谭,秦青,据 《 列子 · 汤问 》 记载 ， 秦青 具有 很 高 的 歌唱 技巧 ， 曾收 薛谭 为徒 。,列子  汤问  记载  人物二 具有 高 歌唱 技巧  曾收 人物一 为徒,-1
TRAIN_SENT_ID_257773,林平之,岳不群,适逢 福州 福威 镖局 大难 ， 岳不群 收 福威 镖局 少镖头 林平之 为徒 。,适逢 福州 福威 镖局 大难  人物二 收 福威 镖局 少镖头 人物一 为徒,-1
TRAIN_SENT_ID_269586,张瑶萱,张瑶华,家庭成员 ： 爸 、 妈 、 一兄 、 一妹 、 太太 罗美薇 及 两个 女儿 （ 大 女儿 ： 张瑶华 、 二女儿 ： 张瑶萱 ）,家庭成员  爸  妈  一兄  一妹  太太 罗美薇 两个 女儿  女儿  人物二  二女儿  人物一,-1
TRAIN_SENT_ID_261432,毛泽建,毛泽东,毛泽建 之死 ， 毛泽东 十分 痛惜 。,人物一 之死  人物二 十分 痛惜,-1
TRAIN_SENT_ID_252899,颜回,孔子,有 一次 ， 孔子 和 颜回 一起 出游 ， 登上 鲁国 境内 的 泰山 后 ， 师生 二人 向 东南 方向 眺望 。,一次  人物二 人物一 一起 出游  登上 鲁国 境内 泰山  师生 二人 东南 方向 眺望,-1
TRAIN_SENT_ID_269721,薛洋,薛之荔,晚上 薛之荔 和 薛洋 聊 了 起来 ， 他们 一起 玩起 了 游戏 。,晚上 人物二 人物一 聊 起来  一起 玩起 游戏,-1
TRAIN_SENT_ID_250429,赵飞燕,赵合德,得宠 的 是 赵合德 ， 从小 与 赵飞燕 一起 长大 ， 对 姐姐 十分 尊敬 ， 在 成帝 面前 为 她 百般 回护 ， 因而 飞燕 的 地位 并未 因 皇帝 移宠 而 动摇 。,得宠 人物二  从小 人物一 一起 长大  姐姐 十分 尊敬  成帝 面前 百般 回护  飞燕 地位 并未 皇帝 移宠 动摇,-1
TRAIN_SENT_ID_252514,颜回,孔子,颜回 闻一以 知十 ， 我 只能 闻一知二 ” ， 于是 孔子 感叹 道 ： “ 弗如 也 ， 吾 与 汝弗如 也 ！ ”,人物一 闻一以 知十  只能 闻一知二   人物二 感叹 道   弗如  吾 汝弗如,-1
TRAIN_SENT_ID_256949,仲由,孔子,然而 读书无用 论 ， 由来已久 ， 最古 的 主张 者 也许 是 孔子 的 得意 门徒 仲由 ， 即 子路 ， 他 的 那句 “ 以 此言 之 ， 何学 之 有 ？ ”,读书无用  由来已久  最古 主张 也许 人物二 得意 门徒 人物一  子路  那句  此言  何学,-1
TRAIN_SENT_ID_259367,葛玄,左慈,葛洪 生 在 道教 世家 ， 叔祖 葛玄 随从 有名 的 术士 左慈 学 道 ， 被 后世 道徒 尊为 葛仙公 。,葛洪 生 道教 世家  叔祖 人物一 随从 有名 术士 人物二 学 道  后世 道徒 尊为 葛仙公,-1
TRAIN_SENT_ID_249025,吕洞宾,韩湘子,新 东游记 剧情 梗概 : 后 又 获知 韩湘子 、 吕洞宾 二人 的 下落 。,新 东游记 剧情 梗概  获知 人物二  人物一 二人 下落,-1
TRAIN_SENT_ID_270567,全真七子,王重阳,东游 至 山东 ， 王重阳 收 马丹阳 、 孙不二 ， 王玉 阳 、 丘 长春 ， 谭长真 ， 刘长生 、 郝 太古 等 人为 徒 ， 后称 “ 全真七子 ” 。,东游 山东  人物二 收 马丹阳  孙不二  王玉 阳  丘 长春  谭长真  刘长生  郝 太古 人为 徒  后称  人物一,-1
TRAIN_SENT_ID_259381,葛玄,左慈,葛玄 ： 丹阳 （ 今属 江苏省 ） 人 ， 三国 吴 道士 ， 曾 从 左慈 学 道 ， 并入 深山 修道 。,人物一  丹阳  今属 江苏省   三国 吴 道士  人物二 学 道  并入 深山 修道,-1
TRAIN_SENT_ID_251605,穆春,穆弘,因在 路上 打赏 了 使 棍棒 的 病 大虫 薛永 ， 宋江 得罪 了 当地 恶霸 没 遮拦 穆弘 、 小 遮拦 穆春 ， 二人 追 宋江 等 人 。,因在 路上 打赏 棍棒 病 大虫 薛永  宋江 得罪 恶霸 没 遮拦 人物二  遮拦 人物一  二人 追 宋江,-1
TRAIN_SENT_ID_281536,于佑福,高德明,高德明 收徒 于佑福 ， 健在 。,人物二 收徒 人物一  健在,-1
TRAIN_SENT_ID_265500,薛蝌,薛蟠,恰在此时 薛蟠 的 堂弟 薛蝌 到来 ， 给 “ 素性 为 人 毫无 闺阁 礼法 ” 的 夏金桂 、 宝蟾 主仆 二人 带来 一丝 “ 曙光 ” 。,恰在此时 人物二 堂弟 人物一 到来   素性 毫无 闺阁 礼法  夏金桂  宝蟾 主仆 二人 带来 一丝  曙光,-1
TRAIN_SENT_ID_250698,鲁西西,皮皮鲁,与 皮皮鲁 鲁西西 一起 长 大门 / 197,人物二 人物一 一起 长 大门,-1
TRAIN_SENT_ID_250644,鲁西西,皮皮鲁,罐头 小人 各有所长 ， 皮皮鲁 和 鲁西西 带 罐头 小人 一起 上学 ， 其 经历 让 人 忍俊不禁 。,罐头 小人 各有所长  人物二 人物一 带 罐头 小人 一起 上学  经历 忍俊不禁,-1
TRAIN_SENT_ID_262180,陈靖仇,陈辅,而 陈辅 误以为 陈靖仇 已经 投靠 “ 敌人 ” ， 十分 痛心 ， 听信 宁珂 的话 ， 服下 “ 撒旦 之果 ” ， 失去 理智 ， 和 宁 珂 一起 也 来到 赤贯星 。,人物二 误以为 人物一 已经 投靠  敌人   十分 痛心  听信 宁珂  服下  撒旦 之果   失去 理智  珂 一起 来到 赤贯星,-1
TRAIN_SENT_ID_274626,石破天,史小翠,随后 众人 离开 后 石破天 也 找 不到 史小翠 、 白阿绣 ， 便 也 乘船 离开 紫烟 岛 。,众人 离开 人物一 找 不到 人物二  白阿绣  便 乘船 离开 紫烟 岛,-1
TRAIN_SENT_ID_282517,红孩,赵本山,"赵本山 收徒 , 组建 “ 赵家 班 ” 红 、 董三毛 、 宋小宝 、 小 鹏飞 、 田娃 、 红孩 。",人物二 收徒  组建  赵家 班  红  董三毛  宋小宝  鹏飞  田娃  人物一,-1
TRAIN_SENT_ID_276992,樊迟,孔子,的确 ， 樊迟 是 天资 不够 ， 因此 孔子 只 给 他 讲 最 基本 的 道理 ， 只教 他 “ 仁 ” 的 最 基本概念 — — “ 爱人 ” 。,人物一 天资 不够  人物二 讲 基本 道理  只教  仁  基本概念    爱人,-1
TRAIN_SENT_ID_259659,公孙胜,罗真人,第 052 回 戴宗 二取 公孙胜 李逵 独劈 罗真人,回 戴宗 二取 人物一 李逵 独劈 人物二,-1
TRAIN_SENT_ID_274624,石破天,史小翠,三人 被 江水 冲到 了 紫烟 岛 ， 在 岛上 史小翠 收 石破天 为徒 ， 为了 胜过 雪山 派 便 并 让 他 改名 “ 史 亿刀 ” ， 随后 传授 “ 金乌 刀法 ” 。,三人 江水 冲到 紫烟 岛  岛上 人物二 收 人物一 为徒  胜过 雪山 派 便 改名  史 亿刀   传授  金乌 刀法,-1
TRAIN_SENT_ID_250652,鲁西西,皮皮鲁,每 扇门 里 都 有着 惊险 的 故事 ， 大家 和 皮皮鲁 、 鲁西西 一起 到 这 四扇 门里 去 探险 吧 。,扇门 里 有着 惊险 故事  人物二  人物一 一起 四扇 门里 探险,-1
TRAIN_SENT_ID_266867,尤二姐,尤氏,当 她 把 尤二姐 骗人 了 大观园 之后 ， 便 去 骂 尤氏 道 ： “ … …,人物一 骗人 大观园 之后  便 骂 人物二 道,-1
TRAIN_SENT_ID_249125,皮皮鲁,鲁西西,皮皮鲁 和 鲁西西 碰巧 发现 了 他们 教室 里 的 隐身人 ， 想 知道 隐身人 的 秘密 吗 ？,人物一 人物二 碰巧 发现 教室 里 隐身人  想 知道 隐身人 秘密,-1
TRAIN_SENT_ID_262728,周厚恩,周厚安,家庭成员 ： 华健 ， 太太 康粹兰 （ Constance ） ， 儿子 周厚安 （ Andrew ） ， 女儿 周厚恩 （ Anya ）,家庭成员  华健  太太 康粹兰     儿子 人物二     女儿 人物一,-1
TRAIN_SENT_ID_253824,赵合德,赵飞燕,他 与 蛇蝎美人 赵飞燕 、 赵合德 姐妹 的 故事 ， 几乎 家喻户晓 。,蛇蝎美人 人物二  人物一 姐妹 故事  几乎 家喻户晓,-1
TRAIN_SENT_ID_275836,陆无双,李莫愁,去 程瑛 居 ， 打 李莫愁 ， 收 程瑛 、 陆无双 ， 得 五毒 秘传 、 玉 萧剑 谱 。,程瑛 居  人物二  收 程瑛  人物一  五毒 秘传  玉 萧剑 谱,-1
TRAIN_SENT_ID_259379,葛玄,左慈,葛玄 ： 丹阳 郡 （ 今属 江苏省 句容 ） 人 ， 三国 吴 道士 ， 曾 从 左慈 学 道 ， 并入 深山 修道 。,人物一  丹阳 郡  今属 江苏省 句容   三国 吴 道士  人物二 学 道  并入 深山 修道,-1
TRAIN_SENT_ID_265726,李三思,李三省,李三思 与 一 富家 小姐 相恋 ， 为求 师父 为 其 提亲 ， 四处 盗宝 ， 其弟 李三省 与 铁掌 门 的 铁掌 飞凤 在 余杭 成婚 。,人物一 富家 小姐 相恋  为求 师父 提亲  四处 盗宝  其弟 人物二 铁掌 门 铁掌 飞凤 余杭 成婚,-1
TRAIN_SENT_ID_268929,韩非,荀子,韩非 发展 了 荀子 的 无神论 ， 在 否定 鬼神 存在 的 基础 上 ， 进一步 反对 “ 神道设教 ” 。,人物一 发展 人物二 无神论  否定 鬼神 存在 基础  进一步 反对  神道设教,-1
TRAIN_SENT_ID_257775,林平之,岳不群,不 ， 余沧海 和 木高峰 只是 对 林平之 进行 肉体上 的 折磨 ， 而 岳不群 却 毁掉 了 他 的 道德 信仰 。,余沧海 木高峰 人物一 进行 肉体上 折磨  人物二 毁掉 道德 信仰,-1
TRAIN_SENT_ID_270574,全真七子,王重阳,王重阳 在 陕西 修道 后 赴 山东 宁海 传道 ， 收 全真七子 。,人物二 陕西 修道 赴 山东 宁海 传道  收 人物一,-1
TRAIN_SENT_ID_269582,张瑶萱,张瑶华,两人育 有 13 岁 的 大 女儿 张瑶华 和 9 岁 的 小女儿 张瑶萱 。,两人育  岁 女儿 人物二  岁 小女儿 人物一,-1
TRAIN_SENT_ID_255281,卫夫人,王羲之,卫夫人 教 王羲之 书法 ， 还教 他 知道 天外有天 ， 人外有人 ， 不可 骄傲 懒散 。,人物一 教 人物二 书法  还教 知道 天外有天  人外有人  不可 骄傲 懒散,-1
TRAIN_SENT_ID_259676,公孙胜,罗真人,第五十三回 戴宗 智取 公孙胜 ， 李逵 斧劈 罗真人,第五十三回 戴宗 智取 人物一  李逵 斧劈 人物二,-1
TRAIN_SENT_ID_267155,靳月光,靳月华,他 的 两个 女儿 靳月光 、 靳月华 十分 美艳 。,两个 女儿 人物一  人物二 十分 美艳,-1
TRAIN_SENT_ID_252858,颜回,孔子,孔子 对 （ 11 ） 曰 ： “ 有 颜回 者 好学 ， 不 迁怒 （ 12 ） ， 不 贰 过 （ 13 ） 。,人物二    曰   人物一 好学  迁怒     贰,-1
TRAIN_SENT_ID_259671,公孙胜,罗真人,第五十二回 戴宗 二取 公孙胜 李逵 独劈 罗真人,第五十二回 戴宗 二取 人物一 李逵 独劈 人物二,-1
TRAIN_SENT_ID_282927,钱永真,钱永刚,儿子 钱永刚 、 女儿 钱永真 。,儿子 人物二  女儿 人物一,-1
TRAIN_SENT_ID_268815,洪凌波,李莫愁,洪凌波 的 结局 堪怜 ， 最后 竟然 是 为 自己 的 师父 李莫愁 所 杀害 。,人物一 结局 堪怜  最后 竟然 师父 人物二 杀害,-1
TRAIN_SENT_ID_257774,林平之,岳不群,林平之 的 家传之 宝 “ 辟邪 剑法 ” 遭 掌门 师父 岳不群 偷 去 。,人物一 家传之 宝  辟邪 剑法  遭 掌门 师父 人物二 偷,-1
TRAIN_SENT_ID_264213,陈真,霍元甲,而 “ 陈真 ” 的 师父 ， 新 “ 霍元甲 ” 赵文卓 将 是 该剧 的 武术指导 。,人物一  师父  新  人物二  赵文卓 该剧 武术指导,-1
TRAIN_SENT_ID_274185,田虎,田猛,烈山 堂堂 主 田猛 的 女儿 田言 也 是 因此 而 推断 她 定会 与 田虎 联手 。,烈山 堂堂 主 人物二 女儿 田言 推断 定会 人物一 联手,-1
TRAIN_SENT_ID_253115,颜回,孔子,为何 孔子 只 认为 颜回 是 好学 之 人 ？,人物二 认为 人物一 好学,-1
TRAIN_SENT_ID_258135,刘星,夏雪,在 父亲 的 教育 下 ， 夏雪 、 刘星 、 夏雨 一起 认真 给 母亲 刘梅 洗 了 一回 脚 。,父亲 教育  人物二  人物一  夏雨 一起 认真 母亲 刘梅 洗 一回 脚,-1
TRAIN_SENT_ID_252443,颜回,孔子,」 孔子 对 曰 ： 「 有 颜回 者 好学 ， 不 迁怒 ， 不 贰 过 。,人物二 曰   人物一 好学  迁怒  贰,-1
TRAIN_SENT_ID_273697,姜子牙,元始天尊,姜子牙 在 昆仑 洞奉 师父 元始天尊 之命 下山 ， 伺机 出侍 文王 ， 乃设 一 算命 馆 。,人物一 昆仑 洞奉 师父 人物二 之命 下山  伺机 出侍 文王  乃设 算命 馆,-1
TRAIN_SENT_ID_252702,颜回,孔子,李翱 认为 道统 自先 王传圣 人 ( 孔子 ) ， 再 经 颜回 、 子路 、 曾皙 三人 传子思 ， 子思传 孟子 ， 孟子 传 公孙丑 、 万章 等 。,李翱 认为 道统 自先 王传圣  人物二   人物一  子路  曾皙 三人 传子思  子思传 孟子  孟子 传 公孙丑  万章,-1
TRAIN_SENT_ID_252530,颜回,孔子,傅 教授 引用 孔子 、 颜回 、 子路 和 自己 的 人生 体悟 ， 认为 ， 儒家 的 人 知道 自己 为什么 而活 ， 自己 的 人生 使命 是 什么 ， 所以 很 快乐 。,傅 教授 引用 人物二  人物一  子路 人生 体悟  认为  儒家 知道 而活  人生 使命  快乐,-1
TRAIN_SENT_ID_261430,毛泽建,毛泽东,由于 毛泽东 的 父母 没有 女儿 ， 从此 便 收养 了 毛泽建 。,人物二 父母 没有 女儿  便 收养 人物一,-1
TRAIN_SENT_ID_264245,陈真,霍元甲,霍元甲 偕徒 陈真 、 刘振声 避走 天津 ， 与 赵倩 男 再度 重逢 ， 两人 亦 因 家族 仇恨 经已 化解 ， 遂 拨开 云雾 ， 相处 一起 。,人物二 偕徒 人物一  刘振声 避走 天津  赵倩 男 再度 重逢  两人 家族 仇恨 经已 化解  遂 拨开 云雾  相处 一起,-1
TRAIN_SENT_ID_259655,公孙胜,罗真人,第五十二回 戴宗 智取 公孙胜 李逵 斧劈 罗真人,第五十二回 戴宗 智取 人物一 李逵 斧劈 人物二,-1
TRAIN_SENT_ID_252986,颜回,孔子,’ 孔子 对 曰 ： ‘ 有 颜回 者 好学 ， 不 迁怒 。,人物二 曰   人物一 好学  迁怒,-1
TRAIN_SENT_ID_264954,云中子,雷震子,云中子 见 雷震子 来 ， 抚拿道 ； “ 奇哉 ！,人物一 见 人物二  抚拿道   奇哉,-1
TRAIN_SENT_ID_259657,公孙胜,罗真人,第五十三回 戴宗 智取 公孙胜 李逵 斧劈 罗真人,第五十三回 戴宗 智取 人物一 李逵 斧劈 人物二,-1
TRAIN_SENT_ID_268980,韩非,荀子,"孔子 作古 ， "" 儒 分为 八 "" （ 《 韩非 子 》 ） ， 其中 主要 有 两派 ， 一是 孟子 出子 思一系 传道 ， 二是 荀子 出子 夏一系 传经 ， 这 便是 先秦 儒学 … …",孔子 作古   儒 分为 八    人物一 子    主要 两派  一是 孟子 出子 思一系 传道  二是 人物二 出子 夏一系 传经  便是 先秦 儒学,-1
