sent_id,sent_id,entity1,entity2,sent,processed_sent,label
TRAIN_SENT_ID_251828,,梅超风,黄药师,苏州 之北 三十里 的 一座 荒山 之中 ， 捉住 穆念慈 ， 摆蛇阵 逼 梅超风 交出 九阴真经 ， 黄药师 扮作 青衣 怪人 以 箫声 退 之 。,苏州 之北 三十里 一座 荒山 之中  捉住 穆念慈  摆蛇阵 逼 人物一 交出 九阴真经  人物二 扮作 青衣 怪人 箫声 退,1
TRAIN_SENT_ID_282999,,卢宗道,卢怀道,卢宗道 ， 卢怀道 之弟 ， 范阳 涿人 也 。,人物一  人物二 之弟  范阳 涿人,-1
TRAIN_SENT_ID_257592,,毛泽民,毛泽东,第五次 反 围剿 失败 后 ， 毛泽东 率队 长征 ， 毛泽民 负责 转运 整个 红色 银行 的 财产 ， 毛泽覃 受命 转战 闽 赣 边界 。,第五次 反 围剿 失败  人物二 率队 长征  人物一 负责 转运 整个 红色 银行 财产  毛泽覃 受命 转战 闽 赣 边界,-1
TRAIN_SENT_ID_285215,,陈斌,刘欢,在 刘欢 战队 导师 考核 中 ， 陈斌 与 徐海星 合作 演唱 了 一首 《 美女 与 野兽 》 （ 《 爱在蔓延中 》 ） ， 被 徐海星 击败 ， 止步 于 此 。,人物二 战队 导师 考核 中  人物一 徐海星 合作 演唱 一首  美女 野兽    爱在蔓延中    徐海星 击败  止步,1
TRAIN_SENT_ID_259795,,李偲菘,李伟菘,夜光 航线 美丽 的 推荐 曲 : 【 夜光 航线 】 词 ： 易家扬 曲 ： 李偲菘 / 李伟菘,夜光 航线 美丽 推荐 曲   夜光 航线  词  易家扬 曲  人物一  人物二,-1
TRAIN_SENT_ID_276220,,姜丽文,姜文杰,姜丽文 姜文杰 秦沛,人物一 人物二 秦沛,-1
TRAIN_SENT_ID_261159,,王缙,王维,贵族 官僚 们 也 多 信佛教 ， 元载 、 杜鸿 渐 、 王维 、 王缙 等 ， 是 其 尤 著者 。,贵族 官僚 信佛教  元载  杜鸿 渐  人物二  人物一  尤 著者,-1
TRAIN_SENT_ID_259653,,公孙胜,罗真人,此后 公孙胜 以 罗真人 所教 “ 五雷 天罡 正法 ” ， 破 了 高廉 的 妖术 。,此后 人物一 人物二 所教  五雷 天罡 正法   破 高廉 妖术,1
TRAIN_SENT_ID_269783,,池田菜沙,池田华菜,咲日 和 （ 池田华菜 、 池田绯菜 、 池田城菜 、 池田菜沙 ） 游戏 : D → A ： WHITE （ ク ー ）,咲日  人物二  池田绯菜  池田城菜  人物一  游戏   →     ク ー,-1
TRAIN_SENT_ID_259786,,李偲菘,李伟菘,作词 ： 李煜 作曲 ： 李伟菘 、 李偲菘,作词  李煜 作曲  人物二  人物一,-1
TRAIN_SENT_ID_268465,,单联全,冯一非,单联全 、 冯一非 、 翁虹 、 江宏恩,人物一  人物二  翁虹  江宏恩,1
TRAIN_SENT_ID_264941,,贾元春,贾宝玉,因 贾元春 薨 逝 、 王子腾 被 药 死 、 贾政 赴任 在 即 ， 贾母 、 王夫人 只得 采纳 凤姐 掉包 计 ， 成全 贾宝玉 与 薛宝钗 的 金玉 姻缘 。,人物一 薨 逝  王子腾 药 死  贾政 赴任  贾母  王夫人 只得 采纳 凤姐 掉包 计  成全 人物二 薛宝钗 金玉 姻缘,-1
TRAIN_SENT_ID_272015,,文姜,宣姜,《 东周列国志 》 ： “ 齐僖公 二女 ， 长 宣姜 ， 次 文姜 ， 宣姜 淫于 舅 ， 文姜 淫于 兄 ， 人伦 天理 ， 至此 灭绝 矣 ！,东周列国志    齐僖公 二女  长 人物二  次 人物一  人物二 淫于 舅  人物一 淫于 兄  人伦 天理  至此 灭绝,-1
TRAIN_SENT_ID_252978,,颜回,孔子,另外 ， 他 从前 与 平民 祢衡 在 一起 行为 放荡 ， 互相标榜 ， 祢衡 称赞 孔融 为 ‘ 孔子 不死 ’ ， 孔融 称赞 祢衡 是 ‘ 颜回 复生 ’ 。,从前 平民 祢衡 一起 行为 放荡  互相标榜  祢衡 称赞 孔融  人物二 不死   孔融 称赞 祢衡  人物一 复生,1
TRAIN_SENT_ID_261144,,武元庆,武则天,但 武元庆 、 武元爽 对 杨氏 不孝 ， 所以 ， 武则天 取 韩国夫人 之子 贺兰敏之 “ 为士 获 获后 ， 赐氏武 ， 袭封 。,人物一  武元爽 杨氏 不孝   人物二 取 韩国夫人 之子 贺兰敏之  为士 获 获后  赐氏武  袭封,-1
TRAIN_SENT_ID_273136,,包道乙,郑彪,那包 天师 在 马上 见 武松 使 两口 戒刀 ， 步行 直取 郑彪 ， 包道乙 便 向 鞘 中 掣 出 那口 玄天 混元剑来 ， 从空 飞下 ， 正 砍 中 武松 左臂 ， 血 晕倒 了 。,那包 天师 马上 见 武松 两口 戒刀  步行 直取 人物二  人物一 便 鞘 中 掣 出 那口 玄天 混元剑来  从空 飞下  正 砍 中 武松 左臂  血 晕倒,1
TRAIN_SENT_ID_267787,,万剑一,林惊羽,林惊羽 则 偶然 得到 了 藏身 在 祖师 祠堂 中 的 上代 青云 最出色 的 人物 万剑一 的 教诲 ， 修为 也 大有 长进 。,人物二 偶然 得到 藏身 祖师 祠堂 中 上代 青云 最出色 人物 人物一 教诲  修为 大有 长进,1
TRAIN_SENT_ID_252695,,颜回,孔子,三国 魏 正始 （ 齐王 曹芳 年号 ， 公元 240 — 248 年 ） 以后 ， 规定 入学 行 祭礼 ， 以 孔子 为 先圣 ， 配 颜回 为 先师 。,三国 魏 正始  齐王 曹芳 年号  公元    年  以后  规定 入学 行 祭礼  人物二 先圣  配 人物一 先师,1
TRAIN_SENT_ID_267451,,唐继虞,唐继尧,原来 是 黄绍竑 从 梧州 打 来 急电 ， 告知 云南 唐继尧 令其弟 唐继虞 率 大军 围逼 柳州 ， 要 白崇禧 救援 。,原来 黄绍竑 梧州 急电  告知 云南 人物二 令其弟 人物一 率 大军 围逼 柳州  白崇禧 救援,-1
TRAIN_SENT_ID_252731,,颜回,孔子,和 圣 柳下惠 柳下惠 人物 简介 : 孔子 为 至圣 ， 孟子为 亚圣 ， 颜回 为 复圣 ， 曾 参为 宗圣 ， 和 圣为 柳下惠,圣 柳下惠 柳下惠 人物 简介  人物二 至圣  孟子为 亚圣  人物一 复圣  参为 宗圣  圣为 柳下惠,1
TRAIN_SENT_ID_263914,,汤镇宗,汤镇业,伴 我 俪 人 演职员 表 : 伴 我 俪 人 演员表 : ◆ 主演 : 邱玉茹 汤镇宗 童玲 汤镇业 狄威 张国强 黄伟良 伴 我 俪 人 职员表 : ◆ 制片 : 赖汶星,伴 俪 演职员 表  伴 俪 演员表  ◆ 主演  邱玉茹 人物一 童玲 人物二 狄威 张国强 黄伟良 伴 俪 职员表  ◆ 制片  赖汶星,-1
TRAIN_SENT_ID_255383,,罗成,秦琼,第八回 武奎 武亮 王府 访 凶手 罗艺 罗成 设计 护 秦琼,第八回 武奎 武亮 王府 访 凶手 罗艺 人物一 设计 护 人物二,-1
TRAIN_SENT_ID_257826,,林平之,岳不群,岳不群 在 妻子 宁中则 的 怀疑 和 逼迫 下 ， 将 写 有 辟邪 剑法 的 袈裟 扔下 悬崖 ， 恰好 被 林平之 用脚 勾住 。,人物二 妻子 宁中则 怀疑 逼迫  写 辟邪 剑法 袈裟 扔下 悬崖  恰好 人物一 用脚 勾住,1
TRAIN_SENT_ID_283924,,罗人杰,余沧海,代表 人物 ： 长青子 ， 余沧海 ， 侯人英 、 洪人雄 、 于人豪 、 罗人杰 （ ” 英雄豪杰 ， 青城 四秀 “ ） ， 贾人达 ， 方人智,代表 人物  长青子  人物二  侯人英  洪人雄  于人豪  人物一   英雄豪杰  青城 四秀    贾人达  方人智,1
TRAIN_SENT_ID_267602,,李沧海,李秋水,10 . 《 仙剑 奇侠传 五 - 前传 》 - 凌波 天龙八部 之 天山童姥 李沧海 李秋水 CN 行云,仙剑 奇侠传 五  前传   凌波 天龙八部 天山童姥 人物一 人物二  行云,-1
TRAIN_SENT_ID_259775,,李偲菘,李伟菘,李伟菘 、 李偲菘 、 黄韵玲 、 陈建宁 、 萧煌奇 联手 打造,人物二  人物一  黄韵玲  陈建宁  萧煌奇 联手 打造,-1
TRAIN_SENT_ID_255421,,罗成,秦琼,王伯当 送别 秦琼 、 罗成 、 程咬金 独自一人 留在 瓦岗 。,王伯当 送别 人物二  人物一  程咬金 独自一人 留在 瓦岗,-1
TRAIN_SENT_ID_271495,,孟优,孟获,它 坐落 在 金龟 岛上 ， 正殿 塑有 孟获 、 孟优 、 摩铁 三尊 神像 ， 中殿 塑有 孟获 之妻 祝融 夫人 像 ， 后 殿 观音菩萨 像 。,坐落 金龟 岛上  正殿 塑有 人物二  人物一  摩铁 三尊 神像  中殿 塑有 人物二 之妻 祝融 夫人  殿 观音菩萨,-1
TRAIN_SENT_ID_263927,,汤镇宗,汤镇业,父亲 经营 海味 铺 为生 ， 共有 八 兄弟姐妹 ， 汤镇宗 排 第四 ， 其弟 汤镇业 排 第五 。,父亲 经营 海味 铺 为生  共有 八 兄弟姐妹  人物一 排 第四  其弟 人物二 排 第五,-1
TRAIN_SENT_ID_273683,,姜子牙,元始天尊,《 封神榜 》 亦 载 ： 姜子牙 奉 元始天尊 之命 封之为 “ 上 清正 一 龙虎 玄坛 真君 ” 。,封神榜  载  人物一 奉 人物二 之命 封之为  清正 龙虎 玄坛 真君,1
TRAIN_SENT_ID_254254,,张顺,张横,张顺 聚义 : 张顺 聚义 将 : 张家 兄弟 ： 与 张横 上阵 ， 法术 攻击 增加 6% 。,人物一 聚义  人物一 聚义  张家 兄弟  人物二 上阵  法术 攻击 增加,-1
TRAIN_SENT_ID_252981,,颜回,孔子,汉魏 以后 ， 以 周公为 先圣 ， 孔子 为 先师 ; 唐代 尊 孔子 为 先圣 ， 颜回 为 先师 。,汉魏 以后  周公为 先圣  人物二 先师  唐代 尊 人物二 先圣  人物一 先师,1
TRAIN_SENT_ID_251521,,陈辅,陈靖仇,陈靖仇 是 南朝 陈国 皇族 唯一 血脉 ， 也 是 鬼 谷道 门主 陈辅 的 徒弟 ， 但 却是 百年 一见 的 超级 练武 庸材 。,人物二 南朝 陈国 皇族 唯一 血脉  鬼 谷道 门主 人物一 徒弟  却是 百年 一见 超级 练武 庸材,1
TRAIN_SENT_ID_285113,,高季式,高乾,高季式 ， 高乾 四弟 ， 官至 仪同 三司 ， 封乘氏 县子 ， 追赠 侍中 、 冀州 刺史 。,人物一  人物二 四弟  官至 仪同 三司  封乘氏 县子  追赠 侍中  冀州 刺史,-1
TRAIN_SENT_ID_249100,,吕洞宾,韩湘子,韩湘子 恋上 东海龙女 ， 为 爱 出走 不愿 成仙 ； 吕洞宾 则 与 青楼 花 妖 纠缠不清 ， 直到 红颜 为 之 牺牲 方才 顿悟 成仙 。,人物二 恋上 东海龙女  爱 出走 不愿 成仙  人物一 青楼 花 妖 纠缠不清  红颜 牺牲 方才 顿悟 成仙,1
TRAIN_SENT_ID_271526,,孟优,孟获,毒气 泉 历史 研究 : 毒气 泉 原著 场景 : 诸葛亮 四擒四放 孟获 后 ， 毒气 泉 孟获 与其 弟 孟优 逃 到 西洱河 畔 的 秃 龙洞 。,毒气 泉 历史 研究  毒气 泉 原著 场景  诸葛亮 四擒四放 人物二  毒气 泉 人物二 弟 人物一 逃 西洱河 畔 秃 龙洞,-1
TRAIN_SENT_ID_273137,,包道乙,郑彪,那包 天师 在 马上 ， 见 武松 使 两口 戒刀 ， 步行 直取 郑彪 ， 包道乙 便 向 鞘 中 掣 出 那口 玄元混 天剑来 ， 从空 飞下 ， 正 砍 中 武松 左臂 ， 血 晕倒 了 。,那包 天师 马上  见 武松 两口 戒刀  步行 直取 人物二  人物一 便 鞘 中 掣 出 那口 玄元混 天剑来  从空 飞下  正 砍 中 武松 左臂  血 晕倒,1
TRAIN_SENT_ID_277573,,袁承志,穆人清,穆人清 原文 描写 : 林家栋 版 穆人清 （ 谷峰 饰 ） 袁承志 心中 一动 ， 暗想 ： 「 师父 使 的 果然 都 是 十段 锦 身法 ， 但 他 怎能 如此 快法 ？,人物二 原文 描写  林家栋 版 人物二  谷峰 饰  人物一 心中 一动  暗想   师父 十段 锦 身法  怎能 快法,1
TRAIN_SENT_ID_278133,,裴元,孙思邈,医术 ： 略逊 于 裴元 ， 属于 孙思邈 徒辈中 排行 第二 的 神医,医术  略逊 人物一  属于 人物二 徒辈中 排行 第二 神医,1
TRAIN_SENT_ID_267584,,骆赢,骆羽,女双 ： 骆赢 / 骆羽 邓羽婷 / 包宜鑫,女双  人物一  人物二 邓羽婷  包宜鑫,-1
TRAIN_SENT_ID_249291,,陆无双,程英,性情 内敛 ， 武功 中 上 ， 表妹 陆无双 武功 低微 ， 牙 尖嘴利 ， 往往 因 自不量力 而 惹事生非 ， 得罪人 后 多 由 程英 替 她 收场 。,性情 内敛  武功 中  表妹 人物一 武功 低微  牙 尖嘴利  往往 自不量力 惹事生非  得罪人 人物二 收场,-1
TRAIN_SENT_ID_283878,,崔光伯,崔光韶,崔光伯 ， 崔光韶 弟 ， 清河 东武城 人 也 。,人物一  人物二 弟  清河 东武城,-1
TRAIN_SENT_ID_254268,,张顺,张横,天色已晚 ， 张顺送 了 鱼 ， 宋江 取出 张横 书 付与 张顺 ， 相 别去了 、 宋江 又 取出 五十两一锭 付与 李逵 ， 道 ： “ 兄弟 ， 你 将 去 使用 。 ”,天色已晚  人物一送 鱼  宋江 取出 人物二 书 付与 人物一  相 别去了  宋江 取出 五十两一锭 付与 李逵  道   兄弟  使用,-1
TRAIN_SENT_ID_252547,,颜回,孔子,“ 醯 （ xi ） 鸡 ” 见 《 庄子 · 田子方 》 篇 ， 写 孔子 求见 老聃 问道 后 ， 出来 告诉 颜回 说 ： “ 丘之于 道 也 ， 其 犹 醯 鸡 欤 !,醯    鸡  见  庄子  田子方  篇  写 人物二 求见 老聃 问道  告诉 人物一 说   丘之于 道  犹 醯 鸡,1
TRAIN_SENT_ID_259379,,葛玄,左慈,葛玄 ： 丹阳 郡 （ 今属 江苏省 句容 ） 人 ， 三国 吴 道士 ， 曾 从 左慈 学 道 ， 并入 深山 修道 。,人物一  丹阳 郡  今属 江苏省 句容   三国 吴 道士  人物二 学 道  并入 深山 修道,1
TRAIN_SENT_ID_267530,,扈成,扈三娘,曾 执导 过 《 杨家将 》 、 《 水浒传 》 、 《 三国演义 》 等 诸多 作品 ， 在 《 三国演义 》 中 扮演 司马师 ， 《 水浒传 》 中 扮演 扈三娘 的 哥哥 扈成 。,执导  杨家将    水浒传    三国演义  诸多 作品   三国演义  中 扮演 司马师   水浒传  中 扮演 人物二 哥哥 人物一,-1
TRAIN_SENT_ID_252832,,颜回,孔子,“ 大成殿 除 供奉 孔子像 外 ， 在 其他 地方 的 一些 孔庙 还会 附 祭 孔子 的 四大 弟子 ， 复圣 颜回 、 述 圣 孔伋 、 宗圣 曾 参 、 亚圣 孟轲 。 ”,大成殿 供奉 人物二像 外  地方 孔庙 还会 附 祭 人物二 四大 弟子  复圣 人物一  述 圣 孔伋  宗圣 参  亚圣 孟轲,1
TRAIN_SENT_ID_252470,,颜回,孔子,颜子 庙 曲阜市 颜子 庙 : 位于 曲阜 陋巷 街北首 的 颜庙 ， 又 叫 复 圣庙 ， 是 祭祀 孔子 弟子 颜回 的 庙宇 。,颜子 庙 曲阜市 颜子 庙  位于 曲阜 陋巷 街北首 颜庙  复 圣庙  祭祀 人物二 弟子 人物一 庙宇,1
TRAIN_SENT_ID_261155,,王缙,王维,李邕 集评 : 李邕 唐 宋时 期 : 唐 窦蒙 ： 时议 云 ： “ 论诗 则 曰 王维 、 崔颢 ； 论笔 则 王缙 李邕 端州 石室 记 、 李邕 ； 祖咏 、 张 说不得 预焉 。 ”,李邕 集评  李邕 唐 宋时 期  唐 窦蒙  时议 云   论诗 曰 人物二  崔颢  论笔 人物一 李邕 端州 石室 记  李邕  祖咏  张 说不得 预焉,-1
TRAIN_SENT_ID_253086,,颜回,孔子,⑤ 醯 （ xi ） 鸡句 ： 《 庄子 · 田子方 》 载 孔子 见 老 聃 问道 ， 出来 后 对 颜回 说 ： “ 丘之于 道 也 ， 其 犹 醯 鸡 欤 !,⑤ 醯    鸡句   庄子  田子方  载 人物二 见 老 聃 问道  人物一 说   丘之于 道  犹 醯 鸡,1
TRAIN_SENT_ID_262234,,尤二姐,尤三姐,香菱 、 薛宝琴 、 尤二姐 、 尤三姐 、 邢岫烟 、 李纹 、 李绮 、 夏金桂 、 秋桐 、 小红 （ 此人 有 争议 ， 另 一 说 为 平儿 ） 、 龄 官 、 娇杏 。,香菱  薛宝琴  人物一  人物二  邢岫烟  李纹  李绮  夏金桂  秋桐  小红  此人 争议  说 平儿   龄 官  娇杏,-1
TRAIN_SENT_ID_255376,,罗成,秦琼,秦琼 、 罗成 、 敬德 、 程咬金 四人 从 边关 回来 ， 听说 皇上 把 龙袍 赏给 了 孙思邈 ， 惊得 差点 跌 坐在 地上 。,人物二  人物一  敬德  程咬金 四人 边关 回来  听说 皇上 龙袍 赏给 孙思邈  惊得 差点 跌 坐在 地上,-1
TRAIN_SENT_ID_254248,,张顺,张横,江州 揭阳 一带 有三霸 ， 揭阳 岭上 以 李俊 、 李立 为 一霸 ， 浔 阳江 中以 张横 、 张顺 为 一霸 ， 而 揭阳 镇上 则 以 穆春 兄弟 为 一霸 。,江州 揭阳 一带 有三霸  揭阳 岭上 李俊  李立 一霸  浔 阳江 中以 人物二  人物一 一霸  揭阳 镇上 穆春 兄弟 一霸,-1
TRAIN_SENT_ID_282666,,张震,张翰,张震 讲故事 剧情简介 : 英俊 的 钟宇 （ 张翰 饰 ） 在 戏班 里 拜 杨贺 天 （ 张皓然 饰 ） ， 潜心 学习 唱念 做 打 。,人物一 讲故事 剧情简介  英俊 钟宇  人物二 饰  戏班 里 拜 杨贺 天  张皓然 饰   潜心 学习 唱念 做,-1
TRAIN_SENT_ID_250077,,武敦儒,武修文,武敦儒 、 武修文 兄弟 拜 大侠 郭靖 为师 ， 虽 也 学过 “ 一阳指 ” ， 但 武功 近于 九指 神丐 洪七公 一派 刚猛 的 路子 。,人物一  人物二 兄弟 拜 大侠 郭靖 为师  学过  一阳指   武功 近于 九指 神丐 洪七公 一派 刚猛 路子,-1
TRAIN_SENT_ID_271510,,孟优,孟获,孟获 对 弟弟 孟优 说 ， 我们 已知 蜀军 军情 ， 你领 百余 精兵 去向 孔明 献宝 ， 藉 机杀 了 孔明 。,人物二 弟弟 人物一 说  已知 蜀军 军情  你领 百余 精兵 去向 孔明 献宝  藉 机杀 孔明,-1
TRAIN_SENT_ID_252839,,颜回,孔子,⑤ 醯 〔 xi 〕 鸡句 ： 《 庄子 · 田子方 》 载 孔子 见 老 聃 问道 ， 出来 后 对 颜回 说 ： “ 丘之于 道 也 ， 其 犹 醯 鸡 欤 !,⑤ 醯    鸡句   庄子  田子方  载 人物二 见 老 聃 问道  人物一 说   丘之于 道  犹 醯 鸡,1
TRAIN_SENT_ID_256963,,仲由,孔子,看 《 史记 》 的 时候 ， 读 到 孔子 被困 在 陈 、 蔡 之间 而 弦歌 之声 没有 断绝 ， 颜渊 、 仲由 这样 的 弟子 还 在 与 他 来往 问答 。,史记   读 人物二 被困 陈  蔡 之间 弦歌 之声 没有 断绝  颜渊  人物一 弟子 来往 问答,1
TRAIN_SENT_ID_261162,,王缙,王维,唐 窦蒙 在 《 述书 赋注 》 中说 ： 时议 云 ： “ 论诗 则 曰 王维 、 崔颢 ； 论笔 则 王缙 、 李邕 ； 祖咏 、 张 说不得 预焉 。 ”,唐 窦蒙  述书 赋注  中说  时议 云   论诗 曰 人物二  崔颢  论笔 人物一  李邕  祖咏  张 说不得 预焉,-1
TRAIN_SENT_ID_277571,,袁承志,穆人清,袁承志 将 神行 百变 与 穆人清 所授 的 十段 锦 混合 使用 ， 并 兼 两家 所长 木桑道长 暗器 功夫 : 随手 掷 出 ， 十几颗 棋子 向天飞 去 。,人物一 神行 百变 人物二 所授 十段 锦 混合 使用  兼 两家 所长 木桑道长 暗器 功夫  随手 掷 出  十几颗 棋子 向天飞,1
TRAIN_SENT_ID_271517,,孟优,孟获,三擒三纵 : 孟获 对 弟弟 孟优 说 ， 我们 已知 蜀军 军情 ， 你领 百余 精兵 去向 孔明 献宝 ， 借机 杀 了 孔明 。,三擒三纵  人物二 弟弟 人物一 说  已知 蜀军 军情  你领 百余 精兵 去向 孔明 献宝  借机 杀 孔明,-1
TRAIN_SENT_ID_267426,,陆展元,陆立鼎,象山 影视城 陆家庄 : 陆家庄 在 《 神雕 》 中是 陆展元 、 陆立鼎 两 兄弟 的 庄院 ， 小说 第一回 中 写道 的 故事情节 就是 在 这府院 发生 的 。,象山 影视城 陆家庄  陆家庄  神雕  中是 人物一  人物二 两 兄弟 庄院  小说 第一回 中 写道 故事情节 这府院 发生,-1
TRAIN_SENT_ID_261148,,王缙,王维,7 集评 : 唐宋 时期 : 唐 窦蒙 ： 时议 云 ： “ 论诗 则 曰 王维 、 崔颢 ； 论笔 则 王缙 李邕 端州 石室 记 、 李邕 ； 祖咏 、 张 说不得 预焉 。 ”,集评  唐宋 时期  唐 窦蒙  时议 云   论诗 曰 人物二  崔颢  论笔 人物一 李邕 端州 石室 记  李邕  祖咏  张 说不得 预焉,-1
TRAIN_SENT_ID_255284,,卫夫人,王羲之,筱月 英饰 郗 文娟 、 刘丽华 饰 王羲之 、 魏梅照 饰郗 太尉 、 单 林英 饰 平儿 、 金采 凌饰 卫夫人 。,筱月 英饰 郗 文娟  刘丽华 饰 人物二  魏梅照 饰郗 太尉  单 林英 饰 平儿  金采 凌饰 人物一,1
TRAIN_SENT_ID_265430,,薛谭,秦青,蓝蓝的 天空 上 飘 着 几朵 白云 ， 野草 、 树林 一片 新绿 ， 宴席 间 ， 秦青 斟 了 一 杯酒 ， 对 薛谭 说道 ： “ 你 我 师徒 相处 感情 甚 好 ！,蓝蓝的 天空 飘 几朵 白云  野草  树林 一片 新绿  宴席 间  人物二 斟 杯酒  人物一 说道   师徒 相处 感情 甚,1
TRAIN_SENT_ID_252578,,颜回,孔子,五月 ， 乙卯 朔 ， 诏 追封 孔子 弟子 兖公 颜回 为 国公 ， 费侯 闵损 等 九 人为 郡公 ， 成伯 曾 参等 六十二 人为 列侯 ， 冥 相群 官分 撰赞 。,五月  乙卯 朔  诏 追封 人物二 弟子 兖公 人物一 国公  费侯 闵损 九 人为 郡公  成伯 参等 六十二 人为 列侯  冥 相群 官分 撰赞,1
TRAIN_SENT_ID_274097,,南宫敬叔,孔子,孔子 对 南宫敬叔 说 ： “ 我 听说 老子 博古通今 ， 通晓 礼乐 的 起源 ， 明白 道德 的 归属 ， 那么 他 就是 我 的 老师 ， 现在 我要 到 他 那里 去 。 ”,人物二 人物一 说   听说 老子 博古通今  通晓 礼乐 起源  明白 道德 归属  老师  现在 我要,1
TRAIN_SENT_ID_254298,,张顺,张横,江州 揭阳 一带 有三霸 ， 揭阳 岭上 以 李俊 、 李立 为 一霸 ， 浔 阳江 中以 张横 、 张顺 为 一霸 ， 而 揭阳 镇上 则 以 穆弘 与 兄弟 穆春 为 一霸 。,江州 揭阳 一带 有三霸  揭阳 岭上 李俊  李立 一霸  浔 阳江 中以 人物二  人物一 一霸  揭阳 镇上 穆弘 兄弟 穆春 一霸,-1
TRAIN_SENT_ID_259628,,公孙胜,罗真人,公孙胜 想起 罗真人 “ 遇 汴 而 还 ” 之语 ， 便 向 宋江 辞行 ， 返回 蓟州 二 仙山 ， “ 从师 学 道 ， 侍养 老母 ， 以终天年 ” 。,人物一 想起 人物二  遇 汴  之语  便 宋江 辞行  返回 蓟州 二 仙山   从师 学 道  侍养 老母  以终天年,1
TRAIN_SENT_ID_269451,,毛岸龙,毛岸英,毛岸龙 生死 之谜 : 电视剧 《 毛岸英 》 情景 展示 的 是 后 一种 说法 。,人物一 生死 之谜  电视剧  人物二  情景 展示 一种 说法,-1
TRAIN_SENT_ID_248971,,吕洞宾,韩湘子,八仙 韩湘子 : 韩湘子 唐 韩湘子 ， 字 清夫 ， 是 古代 汉族 民间传说 故事 中 的 八仙 之一 ， 擅吹 洞箫 ， 拜 吕洞宾 为 师学道 。,八仙 人物二  人物二 唐 人物二  字 清夫  古代 汉族 民间传说 故事 中 八仙  擅吹 洞箫  拜 人物一 师学道,1
TRAIN_SENT_ID_259629,,公孙胜,罗真人,路新宇 与 沈涛 又 往 二 仙山 求 公孙胜 师父 罗真人 相帮 ， 罗真人 使 董浩 下山 ， 破 了 无虚 道人 的 法术 ， 杀 进 孙家庄 。,路新宇 沈涛 二 仙山 求 人物一 师父 人物二 相帮  人物二 董浩 下山  破 无虚 道人 法术  杀 进 孙家庄,1
TRAIN_SENT_ID_249546,,李蔡,李广,李妍 觉得 李敢 是 一步 好棋 ， 因为 “ 李氏家族 从 汉高祖 时代 就是 朝廷 重臣 ， 早有 名将 广武君 李左车 ， 今有 安乐 侯 李蔡 和 飞将军 李广 ” 。,李妍 觉得 李敢 一步 好棋   李氏家族 汉高祖 时代 朝廷 重臣  早有 名将 广武君 李左车  今有 安乐 侯 人物一 飞将军 人物二,-1
TRAIN_SENT_ID_284969,,元孚,元昌,元孚 ， 字秀 和 ， 元昌 弟 。,人物一  字秀  人物二 弟,-1
TRAIN_SENT_ID_276958,,樊迟,孔子,结合 上述 孔子 告 樊迟 语 ， 可 看出 孔子 持 与 夏人 商人 不同 的 鬼神 观 ， 并教 樊迟 从 周道 。,结合 上述 人物二 告 人物一 语  看出 人物二 持 夏人 商人 不同 鬼神 观  并教 人物一 周道,1
TRAIN_SENT_ID_284830,,金正中,马小玲,在 第二部 中 姑姑 （ 马叮当 ） 死后 伤心 的 马小玲 又 迎来 亲手 杀死 徒弟 （ 金正中 ） 和 姑婆 （ 马丹娜 ） 魂飞魄散 。,第二部 中 姑姑  马叮当  死后 伤心 人物二 迎来 亲手 杀死 徒弟  人物一  姑婆  马丹娜  魂飞魄散,1
TRAIN_SENT_ID_261336,,罗松,罗成,他家 的 罗春 ， 在 《 说 唐 》 是 老家人 ， 在 曲艺 评书 《 兴唐 》 、 《 隋唐 》 、 《 瓦岗 英雄 》 罗春 与 罗松 都 是 罗成 的 兄弟 。,他家 罗春   说 唐  老家人  曲艺 评书  兴唐    隋唐    瓦岗 英雄  罗春 人物一 人物二 兄弟,-1
TRAIN_SENT_ID_273692,,姜子牙,元始天尊,姜太公 在 此 百无禁忌 民间传说 : 姜子牙 是 元始天尊 的 小 徒弟 ， 奉 师命 辅佐 周文王 、 武王 讨伐 商 纣王 。,姜太公 百无禁忌 民间传说  人物一 人物二 徒弟  奉 师命 辅佐 周文王  武王 讨伐 商 纣王,1
TRAIN_SENT_ID_250402,,赵飞燕,赵合德,（ 西汉 美女 赵飞燕 、 赵合德 的 合称 ） : 二赵 ， 典故 名 ， 典出 《 汉书 》 卷 九十七 下 〈 外戚 列传 下 · 孝成 赵 皇后 〉 。,西汉 美女 人物一  人物二 合称   二赵  典故 名  典出  汉书  卷 九十七  外戚 列传  孝成 赵 皇后,-1
TRAIN_SENT_ID_265602,,苗飞飞,苗蜜,苗飞飞 角色 形象 : 苗蜜 的 小妹 ， 苗飞飞 个性 活泼 洒脱 ， 但 较为 任性 ， 且 说话 直接 、 言词 犀利 ， 擅长 回旋 刀法 ， 出手 凌厉 毫无保留 。,人物一 角色 形象  人物二 小妹  人物一 个性 活泼 洒脱  较为 任性  说话 直接  言词 犀利  擅长 回旋 刀法  出手 凌厉 毫无保留,-1
TRAIN_SENT_ID_255210,,赵海燕,赵本山,赵海燕 ： ( 对 赵本山 ) 别 瞎说 奥,人物一   人物二  瞎说 奥,1
TRAIN_SENT_ID_250340,,赵飞燕,赵合德,大致 写 的 是 汉成帝 与 后妃 赵飞燕 赵合德 的 事情 。,大致 写 汉成帝 后妃 人物一 人物二 事情,-1
TRAIN_SENT_ID_264558,,胡青牛,张无忌,在 治疗 张无忌 的 过程 中 ， 胡青牛 自言自语 治疗 寒毒 的 原理 ， 张无忌 为了 显得 “ 我 武当派 这些 也 懂 ” ， 发出 谬论 与 胡青牛 胡搅蛮缠 。,治疗 人物二 过程 中  人物一 自言自语 治疗 寒毒 原理  人物二 显得  武当派 懂   发出 谬论 人物一 胡搅蛮缠,1
TRAIN_SENT_ID_269569,,辛敞,辛宪英,186 辛敞 187 辛评 188 辛宪英 189 邢道荣 190 阮咸,人物一  辛评  人物二  邢道荣  阮咸,-1
