sent_id,sent_id,entity1,entity2,sent,processed_sent,label
TRAIN_SENT_ID_272039,,韩慕侠,周恩来,这位 老人 不无 感慨 地 追忆 了 先父 当年 威服 康泰 尔 的 真实情况 ， 以及 韩慕侠 同 周恩来 同志 间 深 周恩来 厚 的 师徒 情谊 。,这位 老人 不无 感慨 追忆 先父 当年 威服 康泰 真实情况  人物一 人物二 同志 间 深 人物二 厚 师徒 情谊,1
TRAIN_SENT_ID_273670,,姜子牙,元始天尊,元始天尊 则 派遣 姜尚 — — 姜子牙 下册 ， 助周亡 纣 。,人物二 派遣 姜尚   人物一 下册  助周亡 纣,1
TRAIN_SENT_ID_270802,,伍天锡,伍云召,6 、 伍天锡 — — 雷部 诸神 之一 ： 绿林 人物 ， 伍云召 之 族弟 。,人物一   雷部 诸神  绿林 人物  人物二 族弟,-1
TRAIN_SENT_ID_268994,,韩非,荀子,一佛氏 ， 二 庄子 ， 三 老子 ， 四 孔子 ， 五告子 ， 六 孟子 ， 七 荀子 ， 八 韩非 ， 九 杨朱 ， 十墨 翟 。,一佛氏  二 庄子  三 老子  四 孔子  五告子  六 孟子  七 人物二  八 人物一  九 杨朱  十墨 翟,1
TRAIN_SENT_ID_264931,,贾元春,贾宝玉,由 李陆 龄 反串 贾宝玉 ， 赵永馨 演 林黛玉 ， 陈琪 演 薛宝钗 ， 李丽凤 演 王熙凤 ， 许佩蓉演 晴雯 ， 于珊 演 贾元春 ， 张复建 演 贾政 。,李陆 龄 反串 人物二  赵永馨 演 林黛玉  陈琪 演 薛宝钗  李丽凤 演 王熙凤  许佩蓉演 晴雯  于珊 演 人物一  张复建 演 贾政,-1
TRAIN_SENT_ID_269560,,步鹰,燕双鹰,燕双鹰 万分 悲痛 之下 ， 将 步鹰 乱枪 击毙 。,人物二 万分 悲痛 之下  人物一 乱枪 击毙,1
TRAIN_SENT_ID_268818,,洪凌波,李莫愁,洪凌波 人物 作用 : 1 、 跟随 师父 李莫愁 征战 四方 ， 有 时代 师父 出手 杀人 ， 客观 上 为 发扬 古墓派 威名 ， 起到 一定 的 作用 。,人物一 人物 作用    跟随 师父 人物二 征战 四方  时代 师父 出手 杀人  客观 发扬 古墓派 威名  起到 一定 作用,1
TRAIN_SENT_ID_256566,,周武,周文,周武 王姬 发出 兵 征伐 商纣 王后 ， 周文 王姬 昌有 子孙 留 居于 西岐 ， 其中 有以 原居 地名 称为 姓氏 者 ， 称岐氏 ， 是 为 周族 子孙 。,人物一 王姬 发出 兵 征伐 商纣 王后  人物二 王姬 昌有 子孙 留 居于 西岐  有以 原居 地名 称为 姓氏  称岐氏  周族 子孙,-1
TRAIN_SENT_ID_268819,,洪凌波,李莫愁,1244 杨过 断臂 ， 郭 芙 冰魄 银针 正中 杨龙 二人 ， 绝情谷 天竺 和尚 、 李莫愁 、 洪凌波 、 公孙止 、 裘千尺 卒 ， 小龙女 跳 下 断肠 崖 。,杨过 断臂  郭 芙 冰魄 银针 正中 杨龙 二人  绝情谷 天竺 和尚  人物二  人物一  公孙止  裘千尺 卒  小龙女 跳 断肠 崖,1
TRAIN_SENT_ID_285629,,李世熊,黄道周,李世熊 得知 黄道周 以身 殉节 后 ， 筑坛 遥祭 痛哭 ； 并且 奔赴 福州 ， 上 《 褒 恤孤 忠疏 》 ， 慰唁 遗属 。,人物一 得知 人物二 以身 殉节  筑坛 遥祭 痛哭  奔赴 福州   褒 恤孤 忠疏   慰唁 遗属,1
TRAIN_SENT_ID_285753,,闻人诠,王阳明,闻人诠 和 王阳明 有 亲族 关系 ， 是 同辈 ， 岁数 小于 王阳明 ， 然在 学业 上 是 师生 。,人物一 人物二 亲族 关系  同辈  岁数 小于 人物二  然在 学业 师生,1
TRAIN_SENT_ID_252458,,颜回,孔子,4.1 孔子 颜回 纵论 “ 心斋 ”,人物二 人物一 纵论  心斋,1
TRAIN_SENT_ID_283976,,唐昊,唐啸,封号 斗罗数 ： 8 名 （ 五位 长老 、 宗主 唐啸 · 啸 天斗罗 、 唐昊 · 昊天 斗罗 （ 已 恢复 ) 、 唐三 · 千手 斗罗 · 首席 长老 ）,封号 斗罗数   名  五位 长老  宗主 人物二  啸 天斗罗  人物一  昊天 斗罗  恢复   唐三  千手 斗罗  首席 长老,-1
TRAIN_SENT_ID_267440,,唐继虞,唐继尧,滇军 头目 唐继尧 乘 贵州 五 旅之乱 ， 派 唐继虞 统兵入 黔 ， 外假 护送 刘前 督回 黔 之名 ， 内行 侵占 贵州 地盘 之实 。,滇军 头目 人物二 贵州 五 旅之乱  派 人物一 统兵入 黔  外假 护送 刘前 督回 黔 之名  内行 侵占 贵州 地盘 之实,-1
TRAIN_SENT_ID_255272,,卫夫人,王羲之,其中 梁武帝 、 钟繇 、 卫夫人 、 王羲之 、 王献之 ， 柳公权 、 欧阳询 、 张旭 等 大 书法家 的 手迹 ， 仍 一一 可睹 。,梁武帝  钟繇  人物一  人物二  王献之  柳公权  欧阳询  张旭 书法家 手迹  一一 可睹,1
TRAIN_SENT_ID_265570,,张崇基,张崇德,第 19 集 金刚 、 陈蕊蕊 、 小仪 、 单立文 、 吴业坤 、 崔建邦 、 阮兆祥 、 赵学而 、 车婉婉 、 郑俊弘 、 张崇德 、 张崇基,集 金刚  陈蕊蕊  小仪  单立文  吴业坤  崔建邦  阮兆祥  赵学而  车婉婉  郑俊弘  人物二  人物一,-1
TRAIN_SENT_ID_267594,,李沧海,李秋水,1 、 天山童姥 ( 北冥 ) + 李秋水 + 李沧海 + 无崖子 + 钟灵 + 木婉清 ， 这个 阵营 很 明显 可以 看出 ， 就是 为了 上 天山 用 的 。,天山童姥  北冥   人物二  人物一  无崖子  钟灵  木婉清  阵营 明显 看出  天山,-1
TRAIN_SENT_ID_267783,,万剑一,林惊羽,林惊羽 有 绝世 天资 ， 为何 最后 只是 在 祖师 祠堂 前扫 一 扫地 ， 在 惊天动地 的 大战 中 为何 没有 他 ， 万剑一 指点 他 岂 不 变得 毫无意义 ？,人物二 绝世 天资  最后 祖师 祠堂 前扫 扫地  惊天动地 大战 中 没有  人物一 指点 岂 变得 毫无意义,1
TRAIN_SENT_ID_263351,,蔡夫人,蔡瑁,刘表 后妻 蔡夫人 忌恨 备 ， 命弟 蔡瑁 在 襄阳 设宴 ， 欲籍 机杀备 。,刘表 后妻 人物一 忌恨 备  命弟 人物二 襄阳 设宴  欲籍 机杀备,-1
TRAIN_SENT_ID_253833,,赵合德,赵飞燕,远山 眉 基本 信息 : 汉 赵飞燕 妹合德 ， 为 薄眉 ， 号 “ 远山 黛 ” ， 见伶玄 《 赵飞燕 外传 》 赵合德 。,远山 眉 基本 信息  汉 人物二 妹合德  薄眉  号  远山 黛   见伶玄  人物二 外传  人物一,-1
TRAIN_SENT_ID_255413,,罗成,秦琼,徐茂 公派 王伯党 ， 谢映 登 ， 任 警司 ， 铁子 健带 着 徐和 秦琼 的 书信 去 北平 府 请 罗成 。,徐茂 公派 王伯党  谢映 登  警司  铁子 健带 徐和 人物二 书信 北平 府 请 人物一,-1
TRAIN_SENT_ID_274393,,贾演,贾源,( 注释 ： 贾演 、 贾源 之 父 ， 书中 未 交代 其名 ， 今以 “ 贾 太公 ” 代之 ， 不 称呼 他 为 “ 贾公 ” ， 是因为 贾母 的 丈夫 贾代善 世称 “ 贾公 ” ),注释  人物一  人物二 父  书中 未 交代 其名  今以  贾 太公  代之  称呼  贾公   是因为 贾母 丈夫 贾代善 世称  贾公,-1
TRAIN_SENT_ID_271207,,张翠山,张三丰,"父亲 是 武当 张三丰 七大 门徒 中 老五 ， 人称 "" 银钩 铁划 "" 的 张五侠 “ 张翠山 ” ， 儿子 是 被 四个 女孩子 同时 所爱 的 “ 张无忌 ” 。",父亲 武当 人物二 七大 门徒 中 老五  人称  银钩 铁划  张五侠  人物一   儿子 四个 女孩子 所爱  张无忌,1
TRAIN_SENT_ID_267443,,唐继虞,唐继尧,唐继尧 急调 胡若愚 部入 桂 增援 ， 同时 令 唐继虞 自湘 粤 边境 南下 攻 柳州 ， 以 缓解 南宁 滇军 压力 。,人物二 急调 胡若愚 部入 桂 增援  令 人物一 自湘 粤 边境 南下 攻 柳州  缓解 南宁 滇军 压力,-1
TRAIN_SENT_ID_286469,,高进军,党荣华,高进军 ， 书法 艺术家 ， 醉 墨轩 主人 ， 中华 毛体 创始人 ， 军人 世家 ， 山东 籍 ， 老师 党荣华 ， 导师 宋学伟 。,人物一  书法 艺术家  醉 墨轩 主人  中华 毛体 创始人  军人 世家  山东 籍  老师 人物二  导师 宋学伟,1
TRAIN_SENT_ID_249127,,皮皮鲁,鲁西西,皮皮鲁 和 鲁西西 演唱者 ：,人物一 人物二 演唱者,-1
TRAIN_SENT_ID_284888,,王燕燕,王伦,王伦 ： 杨怀民 ； 王燕燕 ： 狄莺 ； 莫愁 ： 赵永馨 ； 荆无命 ： 谢屏楠 ； 仁宗 ： 施羽 ；,人物二  杨怀民  人物一  狄莺  莫愁  赵永馨  荆无命  谢屏楠  仁宗  施羽,-1
TRAIN_SENT_ID_252761,,颜回,孔子,曲谱 为 清末 民初 琴家 彭祉卿 得 其父 所传 的 乐曲 ， 原曲 好像 是 孔子 想念 颜回 所 做 ， 经 后人 多次 修改 转变成 对 亲友 的 思念 。,曲谱 清末 民初 琴家 彭祉卿 其父 所传 乐曲  原曲 好像 人物二 想念 人物一 做  后人 多次 修改 转变成 亲友 思念,1
TRAIN_SENT_ID_284933,,凤惊声,凤凰鸣,凤凰鸣 探查 灭境 邪源 ， 带回 被 魔化 的 恶海鲛祖 与 凤惊声 等 人 ， 并 委托 不二 做 寻 绯 羽怨 姬 救治 他们 。,人物二 探查 灭境 邪源  带回 魔化 恶海鲛祖 人物一  委托 不二 做 寻 绯 羽怨 姬 救治,1
TRAIN_SENT_ID_266706,,龙幽,龙溟,代表 人物 ： 魔 尊重 楼 （ 魔界 之 首 ） 、 孔璘 、 溪风 、 屠肆 、 魔翳 、 龙溟 、 龙幽 、 姜承 （ 姜世离 ）,代表 人物  魔 尊重 楼  魔界 首   孔璘  溪风  屠肆  魔翳  人物二  人物一  姜承  姜世离,-1
TRAIN_SENT_ID_265493,,薛蝌,薛蟠,薛蝌 自然 不是 薛家 最 正宗 的 一支 ， 但 婚事 由 薛姨妈 作主 ， 薛蟠 又 是 那么 个 霸王 ， 估计 族 里 对 薛蝌 此人 也 寄予 重 望 。,人物一 自然 薛家 正宗 一支  婚事 薛姨妈 作主  人物二 霸王  估计 族 里 人物一 此人 寄予 重,-1
TRAIN_SENT_ID_255391,,罗成,秦琼,"秦琼 , 罗成 , 李元霸 , 程咬金 , 这些 隋唐 的 好汉 , 在 风起云涌 中 扮演者 不同 的 角色 !",人物二  人物一  李元霸  程咬金  隋唐 好汉  风起云涌 中 扮演者 不同 角色,-1
TRAIN_SENT_ID_257783,,林平之,岳不群,林平之 与 左冷禅 结盟 后 组建 辟邪 门 ， 练习 耳力 ， 设 下 计策 ， 在 华山 思过 崖 的 秘洞 中 绝杀 五岳 剑 派 人士 ， 剪除 岳不群 的 党羽 ， 消灭 岳不群 。,人物一 左冷禅 结盟 组建 辟邪 门  练习 耳力  设 计策  华山 思过 崖 秘洞 中 绝杀 五岳 剑 派 人士  剪除 人物二 党羽  消灭 人物二,1
TRAIN_SENT_ID_267512,,裘千丈,裘千仞,舅父 ： 裘千丈 （ 想 抓 黄蓉 所 乘 之 雌雕 ， 失手 摔死 于 铁掌 峰下 ） 、 裘千仞 （ 铁掌 水上 飘 、 慈恩 ； 后 与 金轮法王 恶斗 ， 终于 伤 在 其 掌下 而 死 ）,舅父  人物一  想 抓 黄蓉 雌雕  失手 摔死 铁掌 峰下   人物二  铁掌 水上 飘  慈恩  金轮法王 恶斗  终于 伤 掌下 死,-1
TRAIN_SENT_ID_250597,,鲁西西,皮皮鲁,不过 ， 皮皮鲁 有 魔 筷 了 ， 他用 魔 筷 把 抢劫犯 变小 ， 救出 了 鲁西西 。,人物二 魔 筷  他用 魔 筷 抢劫犯 变小  救出 人物一,-1
TRAIN_SENT_ID_261647,,宋小宝,赵本山,赵本山 为了 降服 抽风 的 精神病 小偷 宋小宝 ， 一秒钟 变 唐僧 ， 举起手来 就 念咒 ， 现场 掌声如雷 。,人物二 降服 抽风 精神病 小偷 人物一  一秒钟 变 唐僧  举起手来 念咒  现场 掌声如雷,1
TRAIN_SENT_ID_255455,,罗成,秦琼,秦琼 就象 罗成 的 半师 ， 让 他 尊重 ， 也 让 他 亲近 。,人物二 就象 人物一 半师  尊重  亲近,-1
TRAIN_SENT_ID_264569,,胡青牛,张无忌,蝶 谷医仙 胡青牛 与 爱妻 毒仙 王难姑 斗法 ， 服下 此毒 ， 幸得 张无忌 救治 而 愈 。,蝶 谷医仙 人物一 爱妻 毒仙 王难姑 斗法  服下 此毒  幸得 人物二 救治 愈,1
TRAIN_SENT_ID_264584,,凌波,凌音,《 仙剑 奇侠传 五前 传 》 凌波 、 凌音 、 炎舞,仙剑 奇侠传 五前 传  人物一  人物二  炎舞,-1
TRAIN_SENT_ID_273686,,姜子牙,元始天尊,→ 昆仑山 （ 找 姜子牙 师父 元始天尊 ， 获得 老子 的 情报 ） → 玄都云 （ 在 空中 有朵 奇怪 的 云 就是 了 ， 找 老子 得到 太极图 ， 回落 魂台 破法 ，,→ 昆仑山  找 人物一 师父 人物二  获得 老子 情报  → 玄都云  空中 有朵 奇怪 云  找 老子 得到 太极图  回落 魂台 破法,1
TRAIN_SENT_ID_259529,,梅超风,杨康,念慈为 杨康 甜言蜜语 所骗 ， 往 找 杨康 师父 梅超风 求救 ， 恰超风 闯庄 寻仇 ， 郭靖 因 杀死 超风 之夫 陈玄风 而 与 超风 结怨 ， 遂助 乘风 败 超风 。,念慈为 人物二 甜言蜜语 所骗  找 人物二 师父 人物一 求救  恰超风 闯庄 寻仇  郭靖 杀死 超风 之夫 陈玄风 超风 结怨  遂助 乘风 败 超风,1
TRAIN_SENT_ID_269730,,薛洋,薛之荔,看着 薛洋 和 楚牧 还 没 赶上来 ， 她俩 故意 放慢 速度 ， 薛之荔 对 齐齐 讲起 了 薛洋 的 故事 。,看着 人物一 楚牧 没 赶上来  她俩 故意 放慢 速度  人物二 齐齐 讲起 人物一 故事,-1
TRAIN_SENT_ID_270823,,伍天锡,伍云召,李元霸 、 宇文成都 、 裴元庆 、 雄阔海 、 伍天锡 、 伍云召 、 罗成 、 杨林 、 魏文通,李元霸  宇文成都  裴元庆  雄阔海  人物一  人物二  罗成  杨林  魏文通,-1
TRAIN_SENT_ID_259940,,周志文,周志康,刘威 煌 、 陈鸿硕 、 周志文 、 周志康,刘威 煌  陈鸿硕  人物一  人物二,-1
TRAIN_SENT_ID_251603,,穆春,穆弘,揭阳 镇 的 李俊 、 李立 、 穆弘 、 穆春 、 张横 、 张顺 、 童威 、 童猛 、 薛永 、 侯健 。,揭阳 镇 李俊  李立  人物二  人物一  张横  张顺  童威  童猛  薛永  侯健,-1
TRAIN_SENT_ID_266053,,张学思,张学良,张学铭 、 张学思 给 张学良 的 信 ， 已托 朱五 送到 台湾 张学良 手中 ， 我 写 “ 为国 珍重 ， 善 自养 心 ； 前途 有望 ， 后会 可期 。 ”,张学铭  人物一 人物二 信  已托 朱五 送到 台湾 人物二 手中  写  为国 珍重  善 自养 心  前途 有望  后会 可期,-1
TRAIN_SENT_ID_279081,,夏林菲,夏翼,萌 侦探 纪事 内容简介 : 萌 侦探 纪事 《 萌 侦探 纪事 1 》 : 本季 主角 ： 莫海音 、 罗洛 、 夏林菲 、 夏翼 、 优优 。,萌 侦探 纪事 内容简介  萌 侦探 纪事  萌 侦探 纪事    本季 主角  莫海音  罗洛  人物一  人物二  优优,-1
TRAIN_SENT_ID_274397,,贾演,贾源,红楼 话 美食 序言 : 宁荣二 府 是 宁国公 贾演 和 荣国公 贾源 开创 的 基业 ， 至 贾宝玉 这 一代 已 历经 四世 。,红楼 话 美食 序言  宁荣二 府 宁国公 人物一 荣国公 人物二 开创 基业  贾宝玉 一代 历经 四世,-1
TRAIN_SENT_ID_251410,,李瀚章,李鸿章,李鸿章 扶植 米市 是 事实 ， 但 具体 操作者 是 张樵 野 （ 张荫桓 ） ， 同治 年间 他 就 结识 了 广东 督粮道 李瀚章 （ 鸿章 之兄 ） 。,人物二 扶植 米市 事实  具体 操作者 张樵 野  张荫桓   同治 年间 结识 广东 督粮道 人物一  鸿章 之兄,-1
TRAIN_SENT_ID_255433,,罗成,秦琼,5 、 炬 石 炼狱 ： 宇文成都 、 秦琼 、 罗成 、 伍云召 、 薛礼,炬 石 炼狱  宇文成都  人物二  人物一  伍云召  薛礼,-1
TRAIN_SENT_ID_255321,,卫夫人,王羲之,三 、 王羲之 《 题 卫夫人 （ 笔阵 图 ） 后 》 的 “ 意在笔前 ” / 118,三  人物二  题 人物一  笔阵 图    意在笔前,1
TRAIN_SENT_ID_254266,,张顺,张横,张顺 . （ 渔家 ， 张横 之弟 ） 三十六 天罡 星天败星 : 天败星 …,人物一   渔家  人物二 之弟  三十六 天罡 星天败星  天败星,-1
TRAIN_SENT_ID_270811,,伍天锡,伍云召,李元霸 VS 雄阔海 、 伍云召 、 伍天锡 ： 元霸 一马 冲入 营来 ， 正撞 着 伍云召 、 雄阔海 、 伍天锡 ， 三个 围拢 来 战元霸 。,李元霸  雄阔海  人物二  人物一  元霸 一马 冲入 营来  正撞 人物二  雄阔海  人物一  三个 围拢 战元霸,-1
TRAIN_SENT_ID_254284,,张顺,张横,张顺 死后 ， 还 把 灵魂 附在 张横 身上 杀死 了 方天定 。,人物一 死后  灵魂 附在 人物二 身上 杀死 方天定,-1
TRAIN_SENT_ID_252846,,颜回,孔子,附骥 尾 释义 : 司马贞 索隐 ： “ 按 ： 苍蝇附骥 尾而致 千里 ， 以 譬 颜回 因 孔子 而 名彰 也 。 ”,附骥 尾 释义  司马贞 索隐    苍蝇附骥 尾而致 千里  譬 人物一 人物二 名彰,1
TRAIN_SENT_ID_259393,,温策,温慧,温策 煌 大仙 遭祸 : 南宫煌 ： 温慧 — — ！,人物一 煌 大仙 遭祸  南宫煌  人物二,-1
TRAIN_SENT_ID_255411,,罗成,秦琼,"走向 传奇 内容简介 : 传奇世界 无处 不 传奇 , 关公 秦琼 比 义气 , 赵云 罗成 赛 枪法 , 张翼德 尉迟恭 谁 脸 更 黑 , 李元霸 和 李存孝 谁 更 牛 。",走向 传奇 内容简介  传奇世界 无处 传奇  关公 人物二 义气  赵云 人物一 赛 枪法  张翼德 尉迟恭 脸 更 黑  李元霸 李存孝 更 牛,-1
TRAIN_SENT_ID_264196,,陈真,霍元甲,另有 《 警察故事 》 系列 等 影片 及 电视剧 《 霍元甲 》 、 《 陈真 》 、 《 再 向 虎山行 》 等剧 至今 脍炙人口 。,另有  警察故事  系列 影片 电视剧  人物二    人物一    虎山行  等剧 脍炙人口,1
TRAIN_SENT_ID_253886,,赵合德,赵飞燕,当然 ， 赵飞燕 和 赵合德 两 姊妹 还 不能 称其为 妓女 ， 但殊 归 同途 。,人物二 人物一 两 姊妹 不能 称其为 妓女  但殊 同途,-1
TRAIN_SENT_ID_266209,,范遥,赵敏,赵敏 将 六大 门派 门人 押 至 大都 万安 寺 ， 范遥 背叛 旧主 重返 明教 ， 救出 门派 众人 ； 灭绝师太 卒 ， 立 周芷若 为 新 峨嵋 掌门 。,人物二 六大 门派 门人 押 大都 万安 寺  人物一 背叛 旧主 重返 明教  救出 门派 众人  灭绝师太 卒  立 周芷若 新 峨嵋 掌门,1
TRAIN_SENT_ID_259520,,梅超风,杨康,梅超风 赵 王府 上 : 後 来 ， 梅超风 假扮 普通 妇人 到 了 金国王爷 完颜洪烈 王府 当 杂工 和 偷偷 练功 ， 并 传授 杨康 九阴 白骨 爪 。,人物一 赵 王府  後  人物一 假扮 普通 妇人 金国王爷 完颜洪烈 王府 杂工 偷偷 练功  传授 人物二 九阴 白骨 爪,1
TRAIN_SENT_ID_265498,,薛蝌,薛蟠,薛蟠 案子 要 重判 ， 夏金桂 大吵大闹 ， 因为 调戏 薛蝌 被 香菱 撞见 ， 她 想 毒死 香菱 ， 不料 自己 误食 毒药 而 死 。,人物二 案子 重判  夏金桂 大吵大闹  调戏 人物一 香菱 撞见  想 毒死 香菱  误食 毒药 死,-1
TRAIN_SENT_ID_279601,,司空星儿,苏蓉蓉,谁知 事后 ， 司空摘星 和 司空星儿 却 被 “ 天下第一 剑 ” 薛衣人 抓获 ， 薛衣人 胁迫 司空星儿 的 义妹 苏蓉蓉 一定 将 琥珀 观音 取回 。,事后  司空摘星 人物一  天下第一 剑  薛衣人 抓获  薛衣人 胁迫 人物一 义妹 人物二 一定 琥珀 观音 取回,-1
TRAIN_SENT_ID_255490,,罗成,秦琼,李世民 、 罗成 、 程咬金 、 秦琼 等 众 英雄 最终 识破阴谋 ， 力战 突出重围 。,李世民  人物一  程咬金  人物二 众 英雄 最终 识破阴谋  力战 突出重围,-1
TRAIN_SENT_ID_268921,,司徒静,司徒剑南,司徒剑南 第九集 : 司徒静 气 了 安宁公主 一顿 ， 将 她 放回 。,人物二 第九集  人物一 气 安宁公主 一顿  放回,-1
TRAIN_SENT_ID_251517,,陈辅,陈靖仇,3 轩辕剑 叁 外传 ： 天之痕 : 相关 剧情 : 游戏 主角 陈靖仇 的 师父 陈辅 在 伏 魔 山上 被 饕餮 。,轩辕剑 叁 外传  天之痕  相关 剧情  游戏 主角 人物二 师父 人物一 伏 魔 山上 饕餮,1
TRAIN_SENT_ID_259945,,周志文,周志康,胡鸿钧 、 周志文 、 周志康,胡鸿钧  人物一  人物二,-1
TRAIN_SENT_ID_255286,,卫夫人,王羲之,崔瑗 张芝 张昶 锺 繇 锺 会 韦诞 皇象 嵇康 卫瓘 卫夫人 索靖 谢安 王导 王敦 王廙 王洽 王珉 王羲之 王献之,崔瑗 张芝 张昶 锺 繇 锺 会 韦诞 皇象 嵇康 卫瓘 人物一 索靖 谢安 王导 王敦 王廙 王洽 王珉 人物二 王献之,1
TRAIN_SENT_ID_256547,,周武,周文,周武 王封 叔叔 姬仲在 西 虢 ； 周文 王 季弟 虢 叔 封 在 东 虢 ， 历 、 宣之时 姬仲 后裔 迁封 陕虢 ， 故今 陕地 有北 虢 、 东虢 、 西虢 。,人物一 王封 叔叔 姬仲在 西 虢  人物二 王 季弟 虢 叔 封 东 虢  历  宣之时 姬仲 后裔 迁封 陕虢  故今 陕地 有北 虢  东虢  西虢,-1
TRAIN_SENT_ID_269552,,步鹰,燕双鹰,在 步鹰 的 精心 调教 下 燕双鹰 的 本领 突飞猛进 而,人物一 精心 调教 人物二 本领 突飞猛进,1
TRAIN_SENT_ID_268812,,洪凌波,李莫愁,洪凌波 角色 能力 : 洪凌波 得 李莫愁 真传 ， 而 李莫愁 的 古墓 剑法 精妙 无比 ， 故 洪凌波 的 剑法 也 是 凌厉 。,人物一 角色 能力  人物一 人物二 真传  人物二 古墓 剑法 精妙 无比  人物一 剑法 凌厉,1
TRAIN_SENT_ID_264526,,岳云鹏,郭德纲,郭德纲 - - 何云伟 、 曹云 金 、 岳云鹏 、 孔云龙 、 朱云峰 、 栾云平 、 李云杰 、 刘云天,人物二   何云伟  曹云 金  人物一  孔云龙  朱云峰  栾云平  李云杰  刘云天,1
TRAIN_SENT_ID_276909,,吕青柠,吕青橙,电视剧 已知 招式 ： 排山倒海 （ 郭芙蓉 ） ， 惊涛骇浪 （ 郭蔷薇 、 吕青橙 ） ， 大浪淘沙 （ 吕青柠 ）,电视剧 已知 招式  排山倒海  郭芙蓉   惊涛骇浪  郭蔷薇  人物二   大浪淘沙  人物一,-1
TRAIN_SENT_ID_259624,,季布,季心,季心 简介 : 季布 弟 ， 亦 以 任侠 名 。,人物二 简介  人物一 弟  任侠 名,-1
TRAIN_SENT_ID_252596,,颜回,孔子,颜回 随 孔子 重回 帝丘 ， 途经 蒲邑 ， 又 遭到 蒲人 的 拦截 。,人物一 人物二 重回 帝丘  途经 蒲邑  遭到 蒲人 拦截,1
TRAIN_SENT_ID_263025,,钱婆婆,汤婆婆,然后 钱婆婆 要千寻 交出 白龙 ， 因为 白龙奉 汤婆婆 的 命令 ， 偷取 了 钱婆婆 的 魔女 合约 印章 。,人物一 要千寻 交出 白龙  白龙奉 人物二 命令  偷取 人物一 魔女 合约 印章,-1
TRAIN_SENT_ID_270557,,全真七子,王重阳,防御 路线 走 王重阳 ， 全真七子 相应 点灯 。,防御 路线 走 人物二  人物一 相应 点灯,1
TRAIN_SENT_ID_261724,,汤镇业,汤镇宗,张敏 、 汤镇宗 、 汤镇业 、 梁家仁 、 孙国明,张敏  人物二  人物一  梁家仁  孙国明,-1
TRAIN_SENT_ID_270803,,伍天锡,伍云召,第十九回 太行山 伍天锡 鏖兵 关王庙 伍云召 寄子 第二十回 韩擒虎 收兵 复旨 程咬金 逢 赦 回家,第十九回 太行山 人物一 鏖兵 关王庙 人物二 寄子 第二十回 韩擒虎 收兵 复旨 程咬金 逢 赦 回家,-1
TRAIN_SENT_ID_255271,,卫夫人,王羲之,出处 晋 · 王羲之 《 题 卫夫人 笔 陈图 后 》 ： “ 时年 五十 有 三 ， 或恐 风烛 奄及 ， 聊 遗教 于 子孙 耳 。 ”,出处 晋  人物二  题 人物一 笔 陈图    时年 五十 三  或恐 风烛 奄及  聊 遗教 子孙 耳,1
TRAIN_SENT_ID_263347,,蔡夫人,蔡瑁,刘表 个 蔡夫人 打算 将 刘琮 立 为 继承人 ， 而 蔡瑁 、 张允 则 为 其 党羽 。,刘表 人物一 打算 刘琮 立 继承人  人物二  张允 党羽,-1
TRAIN_SENT_ID_254294,,张顺,张横,张横 立功 心切 ， 不顾 张顺 劝阻 ， 率 二三百 人去 劫 关胜 营寨 ， 结果 被 关胜 生擒 。,人物二 立功 心切  不顾 人物一 劝阻  率 二三百 人去 劫 关胜 营寨  关胜 生擒,-1
TRAIN_SENT_ID_270990,,严舆,严白虎,严白虎 、 严舆 、 朱治 、 孙瑜 、 钟离牧,人物二  人物一  朱治  孙瑜  钟离牧,-1
TRAIN_SENT_ID_271532,,孟优,孟获,【 蜀国 益州 酒馆 】 姜维 魏延 马良 糜竺 孟获 祝融 夫人 孟优 沙摩柯 大地 火焰 暴风,蜀国 益州 酒馆  姜维 魏延 马良 糜竺 人物二 祝融 夫人 人物一 沙摩柯 大地 火焰 暴风,-1
TRAIN_SENT_ID_265454,,薛谭,秦青,薛谭 讴 原文 : 薛谭 学 讴 原文 （ 1 ） 于 （ 2 ） 秦青 ， 未穷 （ 3 ） 青之技 ， 自谓 尽 之 ， 遂 辞 归 （ 4 ） 。,人物一 讴 原文  人物一 学 讴 原文       人物二  未穷    青之技  自谓  遂 辞,1
TRAIN_SENT_ID_271209,,张翠山,张三丰,张翠山 还是 少年 心性 ， 心中 搁 不得 事 ； 沉不住气 ， 比之其 师父 张三丰 的 厚重 沉稳 确实 差 了 太 多 。,人物一 少年 心性  心中 搁 事  沉不住气  比之其 师父 人物二 厚重 沉稳 确实 差 太,1
TRAIN_SENT_ID_253144,,颜回,孔子,列子 · 仲尼 篇 第四 部分 : 列子 · 仲尼 篇 原文 : 子夏问 孔子 曰 ： “ 颜回 ① 之为 人 奚若 ？ ”,列子  仲尼 篇 第四 部分  列子  仲尼 篇 原文  子夏问 人物二 曰   人物一 ① 之为 奚若,1
TRAIN_SENT_ID_264945,,贾元春,贾宝玉,贾元春 赏赐 端午节 礼 ， 贾宝玉 同 薛宝钗 的 一样 ， 宝黛 生疑 。,人物一 赏赐 端午节 礼  人物二 薛宝钗  宝黛 生疑,-1
TRAIN_SENT_ID_282641,,苏颖超,宁不凡,正统 十年 冬 ， 傅元 影带 琼芳 等 下 贵州 寻 宁不凡 ， 以解 苏颖超 战败 心结 。,正统 十年 冬  傅元 影带 琼芳 贵州 寻 人物二  以解 人物一 战败 心结,1
TRAIN_SENT_ID_265434,,薛谭,秦青,原文 ： 薛谭 学 讴于 秦青 ， 未穷 青之技 ， 自谓 尽 之 ； 遂 辞 归 。,原文  人物一 学 讴于 人物二  未穷 青之技  自谓  遂 辞,1
TRAIN_SENT_ID_276959,,樊迟,孔子,故 樊迟 请学稼圃 ， 孔子 讥为 小人 。,人物一 请学稼圃  人物二 讥为 小人,1
