sent_id,sent_id,entity1,entity2,sent,processed_sent,label
TRAIN_SENT_ID_258812,,张无忌,殷离,张无忌 右手 扶 着 殷离 ， 左手 东点 一指 ， 西拍 一掌 。,人物一 右手 扶 人物二  左手 东点 一指  西拍 一掌,-1
TRAIN_SENT_ID_262597,,蔡五熊,蔡云寒,在 金 时空 ， 蔡云寒 是 蔡五熊 的 姐姐 ， 中途 加入 终极 一班 ， 人称 [ 冷面 冰美人 ] ， 南区 高校 一狠 角色 ， 为 人 不苟言笑 ， 很难 亲近 。,金 时空  人物二 人物一 姐姐  中途 加入 终极 一班  人称  冷面 冰美人   南区 高校 一狠 角色  不苟言笑  很难 亲近,-1
TRAIN_SENT_ID_270586,,全真七子,王重阳,《 神雕侠侣 》 — 甄志丙 、 王重阳 、 全真七子 、 忽必烈 、 周伯通,神雕侠侣   甄志丙  人物二  人物一  忽必烈  周伯通,1
TRAIN_SENT_ID_273673,,姜子牙,元始天尊,"他原 是 四川 峨嵋山 的 道 仙 ， 姜子牙 奉 元始天尊 之命 ， 封为 他 为 "" 正一 龙虎 玄坛 真君 "" ， 职责 是 专司 金银财宝 ， 迎祥 纳福 。",他原 四川 峨嵋山 道 仙  人物一 奉 人物二 之命  封为  正一 龙虎 玄坛 真君   职责 专司 金银财宝  迎祥 纳福,1
TRAIN_SENT_ID_263912,,汤镇宗,汤镇业,《 乾隆 那些 事 》 饰演 蒋府 家人 （ 18 集 ） 狱卒 （ 27 集 ） 太和 楼 店小二 （ 21 集 ） 主要演员 ： 余少群 汤镇宗 汤镇业 郭珍霓 蒋林静 杨洋,乾隆 事  饰演 蒋府 家人   集  狱卒   集  太和 楼 店小二   集  主要演员  余少群 人物一 人物二 郭珍霓 蒋林静 杨洋,-1
TRAIN_SENT_ID_255493,,罗成,秦琼,"王世充 传旨 将 金亭馆 改为 三贤 馆 , 让 秦琼 、 罗成 、 程咬金 及其 家眷 住 下 , 每日 里 殷勤 招待 , 奉 为 贵宾 。",王世充 传旨 金亭馆 改为 三贤 馆  人物二  人物一  程咬金 家眷 住  每日 里 殷勤 招待  奉 贵宾,-1
TRAIN_SENT_ID_277016,,钟藜,钟馗,钟馗 回到 终南山 ， 得知 他 的 同村 知友 杜 钟藜 ( 50 张 ),人物二 回到 终南山  得知 同村 知友 杜 人物一   张,-1
TRAIN_SENT_ID_257234,,艾欧里亚,艾俄洛斯,圣域 志 狮子 列传 第八 : 艾欧里亚 ， 希腊人 也 ， 射手 县侯 艾俄洛斯 弟 。,圣域 志 狮子 列传 第八  人物一  希腊人  射手 县侯 人物二 弟,-1
TRAIN_SENT_ID_259736,,李偲菘,李伟菘,作曲 ： 李伟菘 、 李偲菘 演唱 ： 萧 骊珠 绝代 双雄 片尾曲 : 萧 孋 珠 - 独上 西楼,作曲  人物二  人物一 演唱  萧 骊珠 绝代 双雄 片尾曲  萧 孋 珠  独上 西楼,-1
TRAIN_SENT_ID_277759,,陈清,陈澄,陈澄 名著 《 西游记 》 中 的 人物 ， 车迟 国元 会县 陈家庄 人士 ， 有 一弟 陈清 。,人物二 名著  西游记  中 人物  车迟 国元 会县 陈家庄 人士  一弟 人物一,-1
TRAIN_SENT_ID_250351,,赵飞燕,赵合德,赵昭仪 （ 赵合德 ） ， 原 与其 姐 赵飞燕 同封 婕妤 ， 后晋 为昭仪 。,赵昭仪  人物二   原 姐 人物一 同封 婕妤  后晋 为昭仪,-1
TRAIN_SENT_ID_264236,,陈真,霍元甲,霍元甲 爱徒 陈真 闻听 师父 死讯 ， 怀疑 其中 玄虚 ， 遂 与 龙一 决战 ， 谁料 龙一 不消 一刻 立即 败 倒 。,人物二 爱徒 人物一 闻听 师父 死讯  怀疑 玄虚  遂 龙一 决战  龙一 不消 一刻 立即 败 倒,1
TRAIN_SENT_ID_259620,,季布,季心,季心 史料 : 季布 弟 季心 ， 气盖 关中 ， 遇人 恭谨 ， 为 任侠 ， 方 数千里 ， 士皆争 为 之 死 。,人物二 史料  人物一 弟 人物二  气盖 关中  遇人 恭谨  任侠  方 数千里  士皆争 死,-1
TRAIN_SENT_ID_274358,,和政公主,宁国公主,唐 颜真卿 《 和政公主 神道碑 》 ： “ 姊 曰 宁国公主 ， 孀 嫠 屏居 。 ”,唐 颜真卿  人物一 神道碑    姊 曰 人物二  孀 嫠 屏居,-1
TRAIN_SENT_ID_267429,,陆展元,陆立鼎,” 两 人均 想 ， 陆立鼎 虽然 藉藉无名 ， 他 兄长 陆展元 、 何沅君 夫妇 却侠 名震于 江湖 ， 嘉兴 陆家庄 的 名头 在 武林中 向来 无人 小觑 。,两 人均 想  人物二 藉藉无名  兄长 人物一  何沅君 夫妇 却侠 名震于 江湖  嘉兴 陆家庄 名头 武林中 向来 无人 小觑,-1
TRAIN_SENT_ID_265495,,薛蝌,薛蟠,程甲本 八十回 后 ， 薛蟠 打死 人命 被 下 在 牢里 ， 她 又 耐不住 寂寞 ， 勾引 薛蝌 。,程甲本 八十回  人物二 打死 人命 牢里  耐不住 寂寞  勾引 人物一,-1
TRAIN_SENT_ID_262217,,尤二姐,尤三姐,由 尤二姐 一 心想 重新做人 ， 而 尤三姐 认为 贾琏 不过 是 在 “ 花马 吊 嘴 ” 。,人物一 心想 重新做人  人物二 认为 贾琏  花马 吊 嘴,-1
TRAIN_SENT_ID_260721,,王重阳,全真七子,《 射雕 英雄传 》 — 王重阳 、 全真七子 、 哲别 、 窝阔台 、 拖雷 、 铁木真 、 完颜洪烈 、 周伯通,射雕 英雄传   人物一  人物二  哲别  窝阔台  拖雷  铁木真  完颜洪烈  周伯通,1
TRAIN_SENT_ID_269575,,水笙,汪啸风,第 12 集 水笙 带 狄云回 大理 ， 因 汪啸风 练 邪功 走火入魔 ， 需 金鲤 疗伤 ， 但 金鲤 已 被 狄云 吞食 ， 狄云 愿意 放血 医治 啸风 。,集 人物一 带 狄云回 大理  人物二 练 邪功 走火入魔  需 金鲤 疗伤  金鲤 狄云 吞食  狄云 愿意 放血 医治 啸风,-1
TRAIN_SENT_ID_260720,,王重阳,全真七子,全真七子 随 王重阳 一起 弘扬 道教 全真 派 ， 丘处机 在 王重阳 仙化 后入 磻溪 穴居 ， 历时 六年 ， 行携 蓑笠 ， 人称 “ 蓑笠 先生 ” 。,人物二 人物一 一起 弘扬 道教 全真 派  丘处机 人物一 仙化 后入 磻溪 穴居  历时 六年  行携 蓑笠  人称  蓑笠 先生,1
TRAIN_SENT_ID_255345,,沈东篱,沈南枝,沈南枝 出场 章节 : 《 苏旷 传奇 》 沈南枝 第一卷 · 沽义 天下 : “ 东篱 把酒 黄昏 后 ” ， 天下第一 杀手 沈东篱 吟诗 漫步 ； “ 探著 南枝 开遍 未 ？ ”,人物二 出场 章节   苏旷 传奇  人物二 第一卷  沽义 天下   东篱 把酒 黄昏   天下第一 杀手 人物一 吟诗 漫步   探著 南枝 开遍 未,-1
TRAIN_SENT_ID_255352,,贾午,贾南风,526 董袭 527 虞翻 528 贾午 529 贾充 530 贾南风,董袭  虞翻  人物一  贾充  人物二,-1
TRAIN_SENT_ID_267718,,裴元庆,裴翠云,第三十一回 裴元庆 怒 投 瓦岗寨 程咬金 喜纳 裴翠云 第三十二回 王世充 避祸 画 琼花 麻叔谋 开河 扰 百姓,第三十一回 人物一 怒 投 瓦岗寨 程咬金 喜纳 人物二 第三十二回 王世充 避祸 画 琼花 麻叔谋 开河 扰 百姓,-1
TRAIN_SENT_ID_264523,,岳云鹏,郭德纲,扒 马褂 版本 三 : 郭德纲 、 李菁 、 于谦 版 扒 马褂 版本 四 : 郭德纲 、 于谦 、 岳云鹏 版,扒 马褂 版本 三  人物二  李菁  于谦 版 扒 马褂 版本 四  人物二  于谦  人物一 版,1
TRAIN_SENT_ID_271496,,孟优,孟获,3 、 孟获 ： 因为 孟优 的 攻击力 与 时间 走动 大大 低于 他哥 ， 所以 用 获 是 最好 的 ， 孟家 拳 能否 展现 真正 的 实力 ， 这个 场景 是 实验场 ！,人物二  人物一 攻击力 时间 走动 大大 低于 他哥  获 最好  孟家 拳 展现 真正 实力  场景 实验场,-1
TRAIN_SENT_ID_276985,,樊迟,孔子,战国 《 论语 · 子路 》 记载 ， 有 一次 樊迟 向 孔子 请教 稼圃 之事 ， 待 樊迟 出 ， 孔子 便 讥讽 他 ： “ 小人 哉 ， 樊须 也 。 ”,战国  论语  子路  记载  一次 人物一 人物二 请教 稼圃 之事  人物一 出  人物二 便 讥讽   小人  樊须,1
TRAIN_SENT_ID_267595,,李沧海,李秋水,《 天龙八部 》 — — 李沧海 ； 李秋水,天龙八部    人物一  人物二,-1
TRAIN_SENT_ID_261448,,毛泽建,毛泽东,毛泽建 （ 1905 - 1929 ） ， 革命烈士 ， 毛泽东 堂妹 。,人物一       革命烈士  人物二 堂妹,-1
TRAIN_SENT_ID_255342,,沈东篱,沈南枝,又 一条 人影 缓缓 飘至 ， 看着 妹子 的 眼神 满是 宠 溺之色 ， 沈南枝 愤愤 住手 ， 拉着 沈东篱 的 胳膊 ： “ 哥 ， 明天 我 就 把 他 那 只 臭手 扔 了 喂狗 ！ ”,一条 人影 缓缓 飘至  看着 妹子 眼神 满是 宠 溺之色  人物二 愤愤 住手  拉着 人物一 胳膊   哥  明天 臭手 扔 喂狗,-1
TRAIN_SENT_ID_255430,,罗成,秦琼,此外 ， 李世民 、 秦琼 、 程咬金 、 窦建德 、 罗成 、 袁 紫烟 等 形象 ， 塑造 得 也 无不 有声有色 、 各具 风采 。,李世民  人物二  程咬金  窦建德  人物一  袁 紫烟 形象  塑造 无不 有声有色  各具 风采,-1
TRAIN_SENT_ID_268911,,司徒静,司徒剑南,司徒剑南 第十六集 : 司徒静 见到 朱允 ， 晓以大义 ， 朱允 如梦方醒 。,人物二 第十六集  人物一 见到 朱允  晓以大义  朱允 如梦方醒,-1
TRAIN_SENT_ID_255327,,卫夫人,王羲之,三国 高贵 公曹髦 后裔 ， 早年 学书 ， 师法 王羲之 、 卫夫人 等 ， 擅画 马 ， 尤精 鞍马 人物 。,三国 高贵 公曹髦 后裔  早年 学书  师法 人物二  人物一  擅画 马  尤精 鞍马 人物,1
TRAIN_SENT_ID_261442,,毛泽建,毛泽东,毛泽东 撰联 鼓励 堂妹 毛泽建,人物二 撰联 鼓励 堂妹 人物一,-1
TRAIN_SENT_ID_249054,,吕洞宾,韩湘子,汉族 民间 则 专以汉 钟离 、 张果老 、 铁拐李 、 韩湘子 、 曹国舅 、 吕洞宾 、 蓝采和 、 何仙姑 等 八仙 为 “ 八洞 神仙 ” 。,汉族 民间 专以汉 钟离  张果老  铁拐李  人物二  曹国舅  人物一  蓝采和  何仙姑 八仙  八洞 神仙,1
TRAIN_SENT_ID_260694,,王重阳,全真七子,东游 至 山东 ， 王重阳 收 马丹阳 、 孙不二 ， 王玉 阳 、 丘 长春 ， 谭长真 ， 刘长生 、 郝 太古 等 人为 徒 ， 后称 “ 全真七子 ” 。,东游 山东  人物一 收 马丹阳  孙不二  王玉 阳  丘 长春  谭长真  刘长生  郝 太古 人为 徒  后称  人物二,1
TRAIN_SENT_ID_258806,,张无忌,殷离,"张无忌 , 九阳 神功 是 你 的 , 明教 教主 也 是 你 的 , 小昭 殷离 周芷若 还是 你 的 , 但是 敏敏 , 只能 是 我 的 !",人物一  九阳 神功  明教 教主  小昭 人物二 周芷若  敏敏  只能,-1
TRAIN_SENT_ID_267789,,万剑一,林惊羽,真法 剑诀 四 式 剑诀 : 真法 剑诀 斩 鬼神 真诀 : 斩 鬼神 是 青云 门 掌门 道 玄 真人 的 师弟 万剑一 的 绝学 ， 后 林惊羽 在 祖师 斩 鬼神 精通 者 ( 2 张 ),真法 剑诀 四 式 剑诀  真法 剑诀 斩 鬼神 真诀  斩 鬼神 青云 门 掌门 道 玄 真人 师弟 人物一 绝学  人物二 祖师 斩 鬼神 精通   张,1
TRAIN_SENT_ID_259391,,温策,温慧,温策 为 寻找 温慧 之事带 大军 强 闯 蜀山 ， 欲 炮轰 锁 妖塔 ， 被 重楼 挡 下 ， 并 以 魔 血弹 瞬间 毁灭 温策 军队 。,人物一 寻找 人物二 之事带 大军 强 闯 蜀山  欲 炮轰 锁 妖塔  重楼 挡  魔 血弹 瞬间 毁灭 人物一 军队,-1
TRAIN_SENT_ID_251423,,李瀚章,李鸿章,李瀚章 （ 右 ） 与其 弟 李鸿章,人物一  右  弟 人物二,-1
TRAIN_SENT_ID_262224,,尤二姐,尤三姐,我们 也许 还 记得 小说 第 63 回 尤二姐 和 尤三姐 到 宁国府 的 情景 吧 ， 贾蓉 在 尤二姐 和 尤三姐 面前 的 “ 丑态 ” ：,也许 记得 小说  回 人物一 人物二 宁国府 情景  贾蓉 人物一 人物二 面前  丑态,-1
TRAIN_SENT_ID_273663,,姜子牙,元始天尊,小说 《 封神演义 》 中 ， 姜子牙 辅佐 周 武王伐纣 事毕 ， 奉 玉虚宫 元始天尊 之命 ， 敕封 八部 三百六十五 位正神 ， 是 为 “ 封神榜 ” 。,小说  封神演义  中  人物一 辅佐 周 武王伐纣 事毕  奉 玉虚宫 人物二 之命  敕封 八部 三百六十五 位正神   封神榜,1
TRAIN_SENT_ID_249560,,李蔡,李广,李广 的 堂弟 李蔡 ， 也 被 任为 中 郎 。,人物二 堂弟 人物一  任为 中 郎,-1
TRAIN_SENT_ID_271498,,孟优,孟获,新 角色 马超 孟起 、 孟获 、 孟优 登场 。,新 角色 马超 孟起  人物二  人物一 登场,-1
TRAIN_SENT_ID_259752,,李偲菘,李伟菘,作词 : 卡斯 作曲 : 李偲菘 李伟菘 编曲 : 戴维雄,作词  卡斯 作曲  人物一 人物二 编曲  戴维雄,-1
TRAIN_SENT_ID_268910,,司徒静,司徒剑南,司徒剑南 第二十二 集 : 朱允 更加 喜欢 司徒静 ， 他 决心 先纳 司徒静 为 妃 。,人物二 第二十二 集  朱允 更加 喜欢 人物一  决心 先纳 人物一 妃,-1
TRAIN_SENT_ID_254272,,张顺,张横,与 梁山 军 交战 中 被 张横 一 朴刀 砍翻 ， 张顺 赶上去 剁 下头 。,梁山 军 交战 中 人物二 朴刀 砍翻  人物一 赶上去 剁 下头,-1
TRAIN_SENT_ID_265433,,薛谭,秦青,第十一部分 : 原文 : 薛谭 学 讴于 秦青 ① ， 未穷 青之技 ， 自谓 尽 之 ， 遂 辞 归 。,第十一部分  原文  人物一 学 讴于 人物二 ①  未穷 青之技  自谓  遂 辞,1
TRAIN_SENT_ID_258121,,孙少安,孙兰香,他 是 土壤 ， 是 铺路石 ， 是 泥土 里 的 根 ， 在 这块 土壤 上长 出 了 孙少安 、 孙少平 和 孙兰香 这 几株 大树 。,土壤  铺路石  泥土 里 根  这块 土壤 上长 出 人物一  孙少平 人物二 几株 大树,-1
TRAIN_SENT_ID_266317,,贾源,贾演,第一代 ： 宁荣二 公 （ 贾演 贾源 ） 马上 “ 得 天下 ” ， 建立 了 贾府 的 基业 。,第一代  宁荣二 公  人物二 人物一  马上  天下   建立 贾府 基业,-1
TRAIN_SENT_ID_271527,,孟优,孟获,孔明 正在 帐 中 与 马谡 、 吕凯 、 蒋琬 、 费祎 等 共议 平蛮 之 事 ， 忽 帐 下 一人 ， 报称 孟获 差弟 孟优 来进 宝贝 。,孔明 正在 帐 中 马谡  吕凯  蒋琬  费祎 共议 平蛮 事  忽 帐 一人  报称 人物二 差弟 人物一 来进 宝贝,-1
TRAIN_SENT_ID_249541,,李蔡,李广,’ 秦时 郿 白起 ， 频阳 王翦 ； 汉兴 ， 义渠 公孙贺 、 傅介子 ， 成纪 李广 、 李蔡 ， 上 邽 赵充国 ， 狄道 辛武贤 ： 皆 名将 也 。,秦时 郿 白起  频阳 王翦  汉兴  义渠 公孙贺  傅介子  成纪 人物二  人物一  邽 赵充国  狄道 辛武贤  皆 名将,-1
TRAIN_SENT_ID_275817,,程万牛,程铁牛,罗通 扫北 程万牛 和 程铁牛 同 为 先锋 ， 征东 又 参加 了 二路 讨伐 军 ， 一直 没有 立 什么 功劳 。,罗通 扫北 人物一 人物二 先锋  征东 参加 二路 讨伐 军  一直 没有 立 功劳,-1
TRAIN_SENT_ID_271518,,孟优,孟获,孟获 殿 正殿 塑有 孟获 、 孟优 、 摩铁 三尊 神像 。,人物二 殿 正殿 塑有 人物二  人物一  摩铁 三尊 神像,-1
TRAIN_SENT_ID_259617,,季布,季心,其中 《 季布 栾布 列传 》 记述 季布 、 栾布 二人 的 生平事迹 外 ， 还 记载 了 季心 和 丁公 的 事迹 。,人物一 栾布 列传  记述 人物一  栾布 二人 生平事迹 外  记载 人物二 丁公 事迹,-1
TRAIN_SENT_ID_259791,,李偲菘,李伟菘,作曲 人 : 李伟菘 李偲菘 纪利 男 随安 苏恒 RickyHo,作曲  人物二 人物一 纪利 男 随安 苏恒,-1
TRAIN_SENT_ID_270816,,伍天锡,伍云召,后来 ， 在 江南 四明山 ， 与 雄阔海 、 伍云召 、 伍天锡 大战 ， 破 之 ； 再 与 裴元庆 大战 ， 因 力竭 而败 。,后来  江南 四明山  雄阔海  人物二  人物一 大战  破  裴元庆 大战  力竭 而败,-1
TRAIN_SENT_ID_274107,,南宫敬叔,孔子,8 . ( 孔于 入 周问 礼乐 ) 周敬王 时期 ， 孔子 得到 鲁君 的 支持 ， 与 南宫敬叔 来到 周朝 国 都洛邑 。,孔于 入 周问 礼乐  周敬王 时期  人物二 得到 鲁君 支持  人物一 来到 周朝 国 都洛邑,1
TRAIN_SENT_ID_274318,,李迥,华阳公主,独孤 氏以 美丽 得幸 ， 九载 生韩王 李迥 ， 后生 华阳公主 。,独孤 氏以 美丽 得幸  九载 生韩王 人物一  后生 人物二,-1
TRAIN_SENT_ID_251599,,穆春,穆弘,土豪 恶霸 穆弘 穆春,土豪 恶霸 人物二 人物一,-1
TRAIN_SENT_ID_259804,,李偲菘,李伟菘,作词 ： 卡斯 作曲 ： 李伟菘 、 李偲菘,作词  卡斯 作曲  人物二  人物一,-1
TRAIN_SENT_ID_255434,,罗成,秦琼,贾家楼 四十六 友 ， 最铁 的 三个 就 秦琼 、 程咬金 与 罗成 。,贾家楼 四十六 友  最铁 三个 人物二  程咬金 人物一,-1
TRAIN_SENT_ID_272653,,邢德全,邢夫人,邢大舅 第七十五回 : 在 宁府中 ， 邢大舅 与 薛蟠 、 贾珍 等 人夜 赌 ， 此 “ 邢大舅 ” 即 邢夫人 胞弟 邢德全 ， 当中 有 一段 介绍 邢家 内事 ：,邢大舅 第七十五回  宁府中  邢大舅 薛蟠  贾珍 人夜 赌   邢大舅  人物二 胞弟 人物一  当中 一段 介绍 邢家 内事,-1
TRAIN_SENT_ID_261684,,程英,陆无双,表姐 （ 陆无双 专用 ） 柴蔚版 程英 ( 6 张 ),表姐  人物二 专用  柴蔚版 人物一   张,-1
TRAIN_SENT_ID_274281,,梅小青,梅小惠,"《 满堂红 》 （ 曾伟权 ， 蔡倩儿 , 潘铣 怡 ， 杨得时 , 梅小惠 ） 梅小青 监制",满堂红   曾伟权  蔡倩儿  潘铣 怡  杨得时  人物二  人物一 监制,-1
TRAIN_SENT_ID_259615,,季布,季心,季姓 季心 : 季布 弟 ， 亦 以 任侠 名 。,季姓 人物二  人物一 弟  任侠 名,-1
TRAIN_SENT_ID_255360,,贾午,贾南风,同日 逮捕 贾午 、 赵粲 等 贾南风 党羽 ， 送至 暴室 杖 毙 。,同日 逮捕 人物一  赵粲 人物二 党羽  送至 暴室 杖 毙,-1
TRAIN_SENT_ID_261167,,王缙,王维,二公 名望 ， 首冠 一时 ， 时 议论 诗则 曰 王维 、 崔颢 ， 论笔 则 曰 王缙 、 李邕 。,二公 名望  首冠 一时  时 议论 诗则 曰 人物二  崔颢  论笔 曰 人物一  李邕,-1
TRAIN_SENT_ID_252502,,颜回,孔子,颜回 随 孔子 在 郑国 考察 了 大夫 子产 的 政绩 ， 考察 了 乡校 ， 拜祭 了 子产 。,人物一 人物二 郑国 考察 大夫 子产 政绩  考察 乡校  拜祭 子产,1
TRAIN_SENT_ID_282544,,苗正,黄震,回到 华国 后 对抗 卫将 杨东 ， 子荣 救驾 沂蒙山 ， 搭救 黄震 ， 并 几次 接应 迟恒喆 、 苗正 ， 化险为夷 。,回到 华国 对抗 卫将 杨东  子荣 救驾 沂蒙山  搭救 人物二  几次 接应 迟恒喆  人物一  化险为夷,-1
TRAIN_SENT_ID_252617,,颜回,孔子,孔子 不疑 颜回 之廉信,人物二 不疑 人物一 之廉信,1
TRAIN_SENT_ID_249550,,李蔡,李广,李蔡 是 李广 的 从弟 ， 才能 在 下品 之中 ， 以 九品 论人 属 第八 等 ， 没有 什么 能耐 ， 可 他 青云直上 ， 官运亨通 ， 爵封 乐安 侯 ， 官 一直 做到 宰相 。,人物一 人物二 从弟  下品 之中  九品 论人 属 第八  没有 能耐  青云直上  官运亨通  爵封 乐安 侯  官 一直 做到 宰相,-1
TRAIN_SENT_ID_262245,,尤二姐,尤三姐,另 一 说 : 金陵 十二钗 副册 为 ： 香菱 、 薛宝琴 、 尤二姐 、 尤三姐 、 邢岫烟 、 李纹 、 李绮 、 夏金桂 、 秋桐 、 平儿 、 龄 官 、 娇杏 ；,说  金陵 十二钗 副册  香菱  薛宝琴  人物一  人物二  邢岫烟  李纹  李绮  夏金桂  秋桐  平儿  龄 官  娇杏,-1
TRAIN_SENT_ID_273375,,杨锐,张之洞,1895 （ 光绪 二十一年 ） ， 两江 总督 张之洞 与 杨锐 游览 鸡鸣寺 ， 纵论 诸子百家 ， 指点 时蔽 。,光绪 二十一年   两江 总督 人物二 人物一 游览 鸡鸣寺  纵论 诸子百家  指点 时蔽,1
TRAIN_SENT_ID_277931,,薛真度,薛安都,先是 ， 憕 【 薛憕 】 从祖 真度 【 薛真度 】 与族祖 （ 族 祖裹义 ） 安都 【 薛安都 】 拥徐 、 兖归魏 ， 其子 怀隽 【 薛怀 隽 】 见 憕 ， 甚相 亲善 。,先是  憕  薛憕  从祖 真度  人物一  与族祖  族 祖裹义  安都  人物二  拥徐  兖归魏  其子 怀隽  薛怀 隽  见 憕  甚相 亲善,-1
TRAIN_SENT_ID_285366,,范静,张宝英,近两年来 ， 张宝英 曾 和 贾庭聚 、 范静 多次 合作 此剧 ， 张宝英 饰演 公主 ， 范静 饰演 詹 贵妃 ， 留有 录像 资料 。,近两年来  人物二 贾庭聚  人物一 多次 合作 此剧  人物二 饰演 公主  人物一 饰演 詹 贵妃  留有 录像 资料,1
TRAIN_SENT_ID_252927,,颜回,孔子,④ 对 先师 先圣 的 祭祀 : 汉魏 以后 ， 以 周公为 先圣 ， 孔子 为 先师 ; 唐代 尊 孔子 为 先圣 ， 颜回 为 先师 。,④ 先师 先圣 祭祀  汉魏 以后  周公为 先圣  人物二 先师  唐代 尊 人物二 先圣  人物一 先师,1
TRAIN_SENT_ID_265486,,薛蝌,薛蟠,大色 空四 薛 : ： 薛蟠 、 薛蝌 、 薛宝钗 、 薛宝琴 。,大色 空四 薛   人物二  人物一  薛宝钗  薛宝琴,-1
TRAIN_SENT_ID_268909,,司徒静,司徒剑南,万人敌 在 齐国 公暗 设 的 赌场 上大闹 被 擒 ， 司徒静 当 了 司徒剑南 的 玉佩 救出 了 万人敌 等 人 。,万人敌 齐国 公暗 设 赌场 上大闹 擒  人物一 人物二 玉佩 救出 万人敌,-1
TRAIN_SENT_ID_259360,,葛玄,左慈,葛洪 《 抱朴子 · 金丹 篇 》 载 “ 左慈 是 葛玄 之师 ， 传其 《 太清丹经 》 三卷 ， 及 《 九鼎 丹经 》 、 《 金液 丹经 》 各 一卷 。 ”,葛洪  抱朴子  金丹 篇  载  人物二 人物一 之师  传其  太清丹经  三卷   九鼎 丹经    金液 丹经  一卷,1
TRAIN_SENT_ID_253110,,颜回,孔子,第 07 节晕 ， 颜回 是 孔子 的 娈童 ！,节晕  人物一 人物二 娈童,1
TRAIN_SENT_ID_255280,,卫夫人,王羲之,二 、 玄 的 心灵 状态 ： 卫夫人 、 王羲之 书论,二  玄 心灵 状态  人物一  人物二 书论,1
TRAIN_SENT_ID_274399,,贾演,贾源,注释 ： 贾演 、 贾源 之 父 ， 书中 未 交代 其名 ， 今以 “ 贾 太公 ” 代之 ， 不 称呼 他 为 “ 贾公 ” ， 是因为 贾母 的 丈夫 贾代善 世称 “ 贾公 ” 。,注释  人物一  人物二 父  书中 未 交代 其名  今以  贾 太公  代之  称呼  贾公   是因为 贾母 丈夫 贾代善 世称  贾公,-1
TRAIN_SENT_ID_253823,,赵合德,赵飞燕,基本 信息 : 汉 赵飞燕 妹合德 ， 为 薄眉 ， 号 “ 远山 黛 ” ， 见伶玄 《 赵飞燕 外传 》 赵合德 。,基本 信息  汉 人物二 妹合德  薄眉  号  远山 黛   见伶玄  人物二 外传  人物一,-1
TRAIN_SENT_ID_283372,,刘义融,刘义庆,刘道怜 家族 成员 : 刘道怜 六子 ： 刘义欣 嗣 、 刘义庆 、 刘义融 、 刘义宗 、 义宾 、 义 綦 。,刘道怜 家族 成员  刘道怜 六子  刘义欣 嗣  人物二  人物一  刘义宗  义宾  义 綦,-1
TRAIN_SENT_ID_255389,,罗成,秦琼,于是 ， 秦琼 、 罗成 、 敬德 和 程咬金 翻身 上马 ， 追赶 而 去 。,人物二  人物一  敬德 程咬金 翻身 上马  追赶,-1
TRAIN_SENT_ID_250339,,赵飞燕,赵合德,美轮美奂 两 芙蓉 — — 赵飞燕 赵合德,美轮美奂 两 芙蓉   人物一 人物二,-1
TRAIN_SENT_ID_264219,,陈真,霍元甲,他 演唱 的 《 莫愁湖 》 、 《 济公 》 、 《 霍元甲 》 、 《 陈真 》 等 电视剧 插曲 和 流行曲 ， 可以 乱真 。,演唱  莫愁湖    济公    人物二    人物一  电视剧 插曲 流行曲  乱真,1
TRAIN_SENT_ID_266722,,龙幽,龙溟,夜叉 族 摄政王 ， 龙溟 、 龙幽 的 舅舅 。,夜叉 族 摄政王  人物二  人物一 舅舅,-1
TRAIN_SENT_ID_275502,,庞林,庞统,习祯 《 三国志 庞统 传 》 : 庞林 妇 ， 同郡 习祯 妺 。,习祯  三国志 人物二 传   人物一 妇  同郡 习祯 妺,-1
TRAIN_SENT_ID_274169,,平和岛静雄,平和岛幽,岸田隆宏绘 角色 人设 图 （ 平和岛静雄 、 平和岛幽 、 圣边 琉璃 、 马克斯 · 桑德谢 尔特 、 田中汤姆 ）,岸田隆宏绘 角色 人设 图  人物一  人物二  圣边 琉璃  马克斯  桑德谢 尔特  田中汤姆,-1
TRAIN_SENT_ID_273662,,姜子牙,元始天尊,（ 《 封神演义 》 中 人物 ） : 玉鼎 真人 ， 《 封神演义 》 中玉鼎 真人 为 玉虚宫 元始天尊 门下 ， 姜子牙 的 同门 师兄 ， 为 阐教 “ 十二 金仙 ” 之一 。,封神演义  中 人物   玉鼎 真人   封神演义  中玉鼎 真人 玉虚宫 人物二 门下  人物一 同门 师兄  阐教  十二 金仙,1
TRAIN_SENT_ID_265482,,薛蝌,薛蟠,四 薛 ： 薛蟠 、 薛蝌 、 薛宝钗 、 薛宝琴 。,四 薛  人物二  人物一  薛宝钗  薛宝琴,-1
TRAIN_SENT_ID_275824,,陆无双,李莫愁,神 ： 小龙女 ， 程英 ， 陆无双 ， 李莫愁 ， 刘瑛 ， 公孙绿萼,神  小龙女  程英  人物一  人物二  刘瑛  公孙绿萼,1
TRAIN_SENT_ID_268906,,司徒静,司徒剑南,朱允 闻听 很 不快 ， 他 亲往 司徒府 看 司徒静 和 司徒剑南 。,朱允 闻听 不快  亲往 司徒府 人物一 人物二,-1
TRAIN_SENT_ID_267424,,陆展元,陆立鼎,” 两 人均 想 ， 陆立鼎 虽然 籍 籍无名 ， 他 兄长 陆展元 、 何沅君 夫妇 却侠 名震于 江湖 ， 嘉兴 陆家庄 的 名头 在 武林中 向来 无人 小觑 。,两 人均 想  人物二 籍 籍无名  兄长 人物一  何沅君 夫妇 却侠 名震于 江湖  嘉兴 陆家庄 名头 武林中 向来 无人 小觑,-1
TRAIN_SENT_ID_264223,,陈真,霍元甲,在 梁小龙 版 《 陈真 》 中 ， 霍元甲 遇害 ， 赵倩 男 早逝 ， 陈真 收养 了 他们 的 孤儿 霍东觉 ， 带 着 东觉 浪迹江湖 。,梁小龙 版  人物一  中  人物二 遇害  赵倩 男 早逝  人物一 收养 孤儿 霍东觉  带 东觉 浪迹江湖,1
TRAIN_SENT_ID_266716,,龙幽,龙溟,《 仙剑 奇侠传 五前 传 》 龙溟 、 龙幽,仙剑 奇侠传 五前 传  人物二  人物一,-1
TRAIN_SENT_ID_251903,,曹薰铉,李昌镐,李昌镐 执黑 7 目半胜 曹薰铉,人物二 执黑  目半胜 人物一,1
