sent_id,sent_id,entity1,entity2,sent,processed_sent,label
TRAIN_SENT_ID_252495,,颜回,孔子,孔子 与 颜回 的 有趣 对话,人物二 人物一 有趣 对话,1
TRAIN_SENT_ID_264263,,陈真,霍元甲,武学 宗师 霍元甲 （ 高雄饰 ） 在 上海 设馆 授徒 ， 机缘巧合 下 解救 是 得 初入 黑帮 的 陈真 （ 甄子丹 饰 ）,武学 宗师 人物二  高雄饰  上海 设馆 授徒  机缘巧合 解救 初入 黑帮 人物一  甄子丹 饰,1
TRAIN_SENT_ID_257554,,毛泽民,毛泽东,毛泽民 （ 孙逊 饰 ） ， 二弟 泽民 的 个性 与 毛泽东 有 很大 的 反差 — — 善于 做 琐事 ， 甘于 做 小事 ， 持重 而 内敛 。,人物一  孙逊 饰   二弟 泽民 个性 人物二 很大 反差   善于 做 琐事  甘于 做 小事  持重 内敛,-1
TRAIN_SENT_ID_253118,,颜回,孔子,当即 ， 孔子 让 颜回 打开 书箱 ， 拿出 笔墨 ， 工工整整 地 记下 了 五月 初五 这个 值得纪念 的 日子 。,当即  人物二 人物一 打开 书箱  拿出 笔墨  工工整整 记下 五月 初五 值得纪念 日子,1
TRAIN_SENT_ID_257806,,林平之,岳不群,后 左冷禅 的 爪牙 劳德诺 出现 ， 邀请 林平之 加入 嵩山 左 盟主 的 阵营 ， 共同 反抗 岳不群 报仇 。,左冷禅 爪牙 劳德诺 出现  邀请 人物一 加入 嵩山 左 盟主 阵营  共同 反抗 人物二 报仇,1
TRAIN_SENT_ID_272039,,韩慕侠,周恩来,这位 老人 不无 感慨 地 追忆 了 先父 当年 威服 康泰 尔 的 真实情况 ， 以及 韩慕侠 同 周恩来 同志 间 深 周恩来 厚 的 师徒 情谊 。,这位 老人 不无 感慨 追忆 先父 当年 威服 康泰 真实情况  人物一 人物二 同志 间 深 人物二 厚 师徒 情谊,1
TRAIN_SENT_ID_264567,,胡青牛,张无忌,在 蝶 谷医仙 胡青牛 逝世 以后 ， 张无忌 堪称 当 世 第一 名医 。,蝶 谷医仙 人物一 逝世 以后  人物二 堪称 世 第一 名医,1
TRAIN_SENT_ID_252374,,颜回,孔子,四 颜回 传承 孔子 心法,四 人物一 传承 人物二 心法,1
TRAIN_SENT_ID_252871,,颜回,孔子,’ ” 邢昺 疏 ： “ 此章 亦 以 颜回 早卒 ， 孔子 痛惜 之 ， 为 之作 譬 也 。,邢昺 疏   此章 人物一 早卒  人物二 痛惜  之作 譬,1
TRAIN_SENT_ID_269560,,步鹰,燕双鹰,燕双鹰 万分 悲痛 之下 ， 将 步鹰 乱枪 击毙 。,人物二 万分 悲痛 之下  人物一 乱枪 击毙,1
TRAIN_SENT_ID_256566,,周武,周文,周武 王姬 发出 兵 征伐 商纣 王后 ， 周文 王姬 昌有 子孙 留 居于 西岐 ， 其中 有以 原居 地名 称为 姓氏 者 ， 称岐氏 ， 是 为 周族 子孙 。,人物一 王姬 发出 兵 征伐 商纣 王后  人物二 王姬 昌有 子孙 留 居于 西岐  有以 原居 地名 称为 姓氏  称岐氏  周族 子孙,-1
TRAIN_SENT_ID_250385,,赵飞燕,赵合德,赵飞燕 的 父亲 叫 冯 万金 ， 做 江都 王府 里 的 舍人 ， 与 江都王 的 孙女 姑苏 郡主 私通 ， 生下 了 赵飞燕 和 赵合德 两个 孪生姐妹 。,人物一 父亲 冯 万金  做 江都 王府 里 舍人  江都王 孙女 姑苏 郡主 私通  生下 人物一 人物二 两个 孪生姐妹,-1
TRAIN_SENT_ID_273704,,姜子牙,元始天尊,玉虚宫 姜子牙 : 元始天尊 的 门人 。,玉虚宫 人物一  人物二 门人,1
TRAIN_SENT_ID_264588,,凌波,凌音,凌波 、 凌音 、 铁笔 原 为 师侄 ， 后 凌波 、 谢沧行 亡故 ， 铁笔 和 凌音 因锁 妖塔 等 原因 成为 蜀山 七圣 ， 辈分 上 变为 青石 的 师弟妹 。,人物一  人物二  铁笔 原 师侄  人物一  谢沧行 亡故  铁笔 人物二 因锁 妖塔 原因 成为 蜀山 七圣  辈分 变为 青石 师弟妹,-1
TRAIN_SENT_ID_271256,,马季,侯宝林,改名 : 马季 原来 叫 马树槐 ， 改 这个 名 ， 还是 侯宝林 的 主意 。,改名  人物一 原来 马树槐  改 名  人物二 主意,1
TRAIN_SENT_ID_283485,,俞莲舟,张三丰,武当派 历来 高手如云 ， 前有 张三丰 ， 后 又 宋远桥 、 俞莲舟 、 俞岱岩 等 。,武当派 历来 高手如云  前有 人物二  宋远桥  人物一  俞岱岩,1
TRAIN_SENT_ID_272652,,邢德全,邢夫人,《 红楼梦 》 第七 五 回 ： “ 近日 邢夫人 的 胞弟 邢德全 也 酷好 如此 ， 所以 也 在 其中 。 ”,红楼梦  第七 五 回   近日 人物二 胞弟 人物一 酷好,-1
TRAIN_SENT_ID_263547,,林逸,杨明,曾 在 误会 之下 用 料理 “ 毒害 ” 林逸 两次 ， 因 林逸 之师 杨明 有恩 於 其父 ， 而 与 林逸 有 了 婚约 ， 已经 和 林逸 相亲 成功 。,误会 之下 料理  毒害  人物一 两次  人物一 之师 人物二 有恩 於 其父  人物一 婚约  已经 人物一 相亲 成功,1
TRAIN_SENT_ID_265446,,薛谭,秦青,秦青 高兴 地 将 薛谭 扶 起 ， 把 他 领回 。,人物二 高兴 人物一 扶  领回,1
TRAIN_SENT_ID_285629,,李世熊,黄道周,李世熊 得知 黄道周 以身 殉节 后 ， 筑坛 遥祭 痛哭 ； 并且 奔赴 福州 ， 上 《 褒 恤孤 忠疏 》 ， 慰唁 遗属 。,人物一 得知 人物二 以身 殉节  筑坛 遥祭 痛哭  奔赴 福州   褒 恤孤 忠疏   慰唁 遗属,1
TRAIN_SENT_ID_285753,,闻人诠,王阳明,闻人诠 和 王阳明 有 亲族 关系 ， 是 同辈 ， 岁数 小于 王阳明 ， 然在 学业 上 是 师生 。,人物一 人物二 亲族 关系  同辈  岁数 小于 人物二  然在 学业 师生,1
TRAIN_SENT_ID_252458,,颜回,孔子,4.1 孔子 颜回 纵论 “ 心斋 ”,人物二 人物一 纵论  心斋,1
TRAIN_SENT_ID_254291,,张顺,张横,后来 被 张顺 灵魂 附体 的 张横 杀死 。,后来 人物一 灵魂 附体 人物二 杀死,-1
TRAIN_SENT_ID_273651,,姜子牙,元始天尊,姜子牙 : 元始天尊 的 门人 。,人物一  人物二 门人,1
TRAIN_SENT_ID_250074,,武敦儒,武修文,武敦儒 、 武修文 被俘 之 时候 还 很 年轻 ， 武功 低微 是 很 正常 的 。,人物一  人物二 被俘 年轻  武功 低微 正常,-1
TRAIN_SENT_ID_283976,,唐昊,唐啸,封号 斗罗数 ： 8 名 （ 五位 长老 、 宗主 唐啸 · 啸 天斗罗 、 唐昊 · 昊天 斗罗 （ 已 恢复 ) 、 唐三 · 千手 斗罗 · 首席 长老 ）,封号 斗罗数   名  五位 长老  宗主 人物二  啸 天斗罗  人物一  昊天 斗罗  恢复   唐三  千手 斗罗  首席 长老,-1
TRAIN_SENT_ID_267430,,陆展元,陆立鼎,陆展元 夫妇 死后 ， 李莫愁 依然 找 陆家 的 麻烦 ， 要 追杀 其弟 陆立鼎 一家 。,人物一 夫妇 死后  李莫愁 依然 找 陆家 麻烦  追杀 其弟 人物二 一家,-1
TRAIN_SENT_ID_254287,,张顺,张横,张横 道 ： “ 小弟 是 张顺 。,人物二 道   小弟 人物一,-1
TRAIN_SENT_ID_265570,,张崇基,张崇德,第 19 集 金刚 、 陈蕊蕊 、 小仪 、 单立文 、 吴业坤 、 崔建邦 、 阮兆祥 、 赵学而 、 车婉婉 、 郑俊弘 、 张崇德 、 张崇基,集 金刚  陈蕊蕊  小仪  单立文  吴业坤  崔建邦  阮兆祥  赵学而  车婉婉  郑俊弘  人物二  人物一,-1
TRAIN_SENT_ID_263351,,蔡夫人,蔡瑁,刘表 后妻 蔡夫人 忌恨 备 ， 命弟 蔡瑁 在 襄阳 设宴 ， 欲籍 机杀备 。,刘表 后妻 人物一 忌恨 备  命弟 人物二 襄阳 设宴  欲籍 机杀备,-1
TRAIN_SENT_ID_253833,,赵合德,赵飞燕,远山 眉 基本 信息 : 汉 赵飞燕 妹合德 ， 为 薄眉 ， 号 “ 远山 黛 ” ， 见伶玄 《 赵飞燕 外传 》 赵合德 。,远山 眉 基本 信息  汉 人物二 妹合德  薄眉  号  远山 黛   见伶玄  人物二 外传  人物一,-1
TRAIN_SENT_ID_248996,,吕洞宾,韩湘子,道观 建成 ， 同祀 吕洞宾 、 韩湘子 ， “ 其名 青羊 二仙 庵 ， 所以 辅翼 修行 ， 即 青羊宫 之 别馆 也 。,道观 建成  同祀 人物一  人物二   其名 青羊 二仙 庵  辅翼 修行  青羊宫 别馆,1
TRAIN_SENT_ID_255413,,罗成,秦琼,徐茂 公派 王伯党 ， 谢映 登 ， 任 警司 ， 铁子 健带 着 徐和 秦琼 的 书信 去 北平 府 请 罗成 。,徐茂 公派 王伯党  谢映 登  警司  铁子 健带 徐和 人物二 书信 北平 府 请 人物一,-1
TRAIN_SENT_ID_271207,,张翠山,张三丰,"父亲 是 武当 张三丰 七大 门徒 中 老五 ， 人称 "" 银钩 铁划 "" 的 张五侠 “ 张翠山 ” ， 儿子 是 被 四个 女孩子 同时 所爱 的 “ 张无忌 ” 。",父亲 武当 人物二 七大 门徒 中 老五  人称  银钩 铁划  张五侠  人物一   儿子 四个 女孩子 所爱  张无忌,1
TRAIN_SENT_ID_267443,,唐继虞,唐继尧,唐继尧 急调 胡若愚 部入 桂 增援 ， 同时 令 唐继虞 自湘 粤 边境 南下 攻 柳州 ， 以 缓解 南宁 滇军 压力 。,人物二 急调 胡若愚 部入 桂 增援  令 人物一 自湘 粤 边境 南下 攻 柳州  缓解 南宁 滇军 压力,-1
TRAIN_SENT_ID_255457,,罗成,秦琼,此书 还 首次 给 罗艺 添加 了 一个 虚构 的 儿子 罗成 和 夫人 秦氏 ， 秦琼 成 了 罗艺 的 侄子 。,此书 首次 罗艺 添加 一个 虚构 儿子 人物一 夫人 秦氏  人物二 成 罗艺 侄子,-1
TRAIN_SENT_ID_275890,,王子豪,王子杰,16 . 王子豪 及 王子杰 （ 火柴 天堂 ） 15 分,人物一 人物二  火柴 天堂   分,-1
TRAIN_SENT_ID_252761,,颜回,孔子,曲谱 为 清末 民初 琴家 彭祉卿 得 其父 所传 的 乐曲 ， 原曲 好像 是 孔子 想念 颜回 所 做 ， 经 后人 多次 修改 转变成 对 亲友 的 思念 。,曲谱 清末 民初 琴家 彭祉卿 其父 所传 乐曲  原曲 好像 人物二 想念 人物一 做  后人 多次 修改 转变成 亲友 思念,1
TRAIN_SENT_ID_268821,,洪凌波,李莫愁,但久 在 李莫愁 的 熏陶 下 下手 有时 也 不免 狠 了 些 ， 但 从 一些 侧面 描写 中 可见 洪凌波 并 不 像 李莫愁 那样 在外 惹是生非 。,但久 人物二 熏陶 下手 不免 狠  侧面 描写 中 人物一 人物二 在外 惹是生非,1
TRAIN_SENT_ID_284933,,凤惊声,凤凰鸣,凤凰鸣 探查 灭境 邪源 ， 带回 被 魔化 的 恶海鲛祖 与 凤惊声 等 人 ， 并 委托 不二 做 寻 绯 羽怨 姬 救治 他们 。,人物二 探查 灭境 邪源  带回 魔化 恶海鲛祖 人物一  委托 不二 做 寻 绯 羽怨 姬 救治,1
TRAIN_SENT_ID_257816,,林平之,岳不群,★ 东方不败 、 林平之 、 岳不群 手挽手 含泪 吐血 推荐 ：,★ 东方不败  人物一  人物二 手挽手 含泪 吐血 推荐,1
TRAIN_SENT_ID_252829,,颜回,孔子,颜回 支持 孔子 不变 志向,人物一 支持 人物二 不变 志向,1
TRAIN_SENT_ID_262228,,尤二姐,尤三姐,与 尤二姐 的 百依百顺 不同 ， 尤三姐 就 不是 逆来顺受 的 弱女子 了 。,人物一 百依百顺 不同  人物二 逆来顺受 弱女子,-1
TRAIN_SENT_ID_255391,,罗成,秦琼,"秦琼 , 罗成 , 李元霸 , 程咬金 , 这些 隋唐 的 好汉 , 在 风起云涌 中 扮演者 不同 的 角色 !",人物二  人物一  李元霸  程咬金  隋唐 好汉  风起云涌 中 扮演者 不同 角色,-1
TRAIN_SENT_ID_275457,,李汉俊,李书城,李书城 支持 胞弟 : 李汉俊 是 李书城 的 胞弟 ， 是 中共 早期 的 主要 领袖 。,人物二 支持 胞弟  人物一 人物二 胞弟  中共 早期 主要 领袖,-1
TRAIN_SENT_ID_273636,,姜子牙,元始天尊,元始天尊 毕竟 还要 顾全 师尊 颜面 ， 所以 元始天尊 借 姜子牙 之口 在 封禅台 敕封 六御 。,人物二 毕竟 顾全 师尊 颜面  人物二 人物一 之口 封禅台 敕封 六御,1
TRAIN_SENT_ID_265553,,张崇基,张崇德,李大卫 与 著名 音乐 人 张崇基 张崇德 合影,李大卫 著名 音乐 人物一 人物二 合影,-1
TRAIN_SENT_ID_255449,,罗成,秦琼,罗成 的 好 ， 秦琼 最 懂 。,人物一  人物二 懂,-1
TRAIN_SENT_ID_264225,,陈真,霍元甲,剧情简介 : 民国初年 ， 一代 武 林宗 师 霍元甲 、 陈真 相继 蒙难 于 日本 人 的 毒手 后 ， 一时间 精武门 几乎 遭到 了 灭顶之灾 。,剧情简介  民国初年  一代 武 林宗 师 人物二  人物一 相继 蒙难 日本 毒手  一时间 精武门 几乎 遭到 灭顶之灾,1
TRAIN_SENT_ID_250597,,鲁西西,皮皮鲁,不过 ， 皮皮鲁 有 魔 筷 了 ， 他用 魔 筷 把 抢劫犯 变小 ， 救出 了 鲁西西 。,人物二 魔 筷  他用 魔 筷 抢劫犯 变小  救出 人物一,-1
TRAIN_SENT_ID_256862,,仲由,孔子,仲由 以 政事 见称 ， 为 人 伉直 ， 好 勇力 ， 跟随 孔子 周游列国 ， 是 孔门 七十二 贤 之一 。,人物一 政事 见称  伉直  勇力  跟随 人物二 周游列国  孔门 七十二 贤,1
TRAIN_SENT_ID_261647,,宋小宝,赵本山,赵本山 为了 降服 抽风 的 精神病 小偷 宋小宝 ， 一秒钟 变 唐僧 ， 举起手来 就 念咒 ， 现场 掌声如雷 。,人物二 降服 抽风 精神病 小偷 人物一  一秒钟 变 唐僧  举起手来 念咒  现场 掌声如雷,1
TRAIN_SENT_ID_253073,,颜回,孔子,孔子 问 颜回 ， 如何 不种 梅 ？,人物二 问 人物一  不种 梅,1
TRAIN_SENT_ID_273361,,杨锐,张之洞,杨锐 百日维新 : 光绪 二十四年 （ 1898 年 ） ， 张之洞 推荐 杨锐 应征 经济 特科 。,人物一 百日维新  光绪 二十四年   年   人物二 推荐 人物一 应征 经济 特科,1
TRAIN_SENT_ID_251412,,李瀚章,李鸿章,李瀚章 为 李鸿章 之 胞兄 ， 与 孙宝 喧皆系 至亲 。,人物一 人物二 胞兄  孙宝 喧皆系 至亲,-1
TRAIN_SENT_ID_264569,,胡青牛,张无忌,蝶 谷医仙 胡青牛 与 爱妻 毒仙 王难姑 斗法 ， 服下 此毒 ， 幸得 张无忌 救治 而 愈 。,蝶 谷医仙 人物一 爱妻 毒仙 王难姑 斗法  服下 此毒  幸得 人物二 救治 愈,1
TRAIN_SENT_ID_269441,,刘伟,马季,《 一仆二主 》 表演者 ： 马季 、 刘伟 、 赵炎,一仆二主  表演者  人物二  人物一  赵炎,1
TRAIN_SENT_ID_264530,,岳云鹏,郭德纲,2 ： 《 返场 》 郭德纲 于谦 岳云鹏,返场  人物二 于谦 人物一,1
TRAIN_SENT_ID_263363,,武修文,武敦儒,第一篇 ， 写 武敦儒 、 武修文 。,第一篇  写 人物二  人物一,-1
TRAIN_SENT_ID_252440,,颜回,孔子,颜回 早逝 ， 颜无繇 因 家里 穷 ， 就 请求 孔子 把 车子 卖 了 来 帮 他 安葬 。,人物一 早逝  颜无繇 家里 穷  请求 人物二 车子 卖 帮 安葬,1
TRAIN_SENT_ID_259362,,葛玄,左慈,左慈 （ 字元放 ） 、 葛玄 （ 字孝先 ） 最尊尚 的 也 可能 是 「 金丹 仙经 」 。,人物二  字元放   人物一  字孝先  最尊尚 可能  金丹 仙经,1
TRAIN_SENT_ID_255202,,赵海燕,赵本山,《 有病 没病 》 （ 表演 ： 赵本山 、 赵海燕 、 李正春 ）,有病 没病   表演  人物二  人物一  李正春,1
TRAIN_SENT_ID_274095,,南宫敬叔,孔子,"遣 一车 二 马一 童一御 , 由 南宫敬叔 陪 孔子 前往 。",遣 一车 二 马一 童一御  人物一 陪 人物二 前往,1
TRAIN_SENT_ID_263407,,武修文,武敦儒,师兄 ： 武敦儒 、 武修文,师兄  人物二  人物一,-1
TRAIN_SENT_ID_252907,,颜回,孔子,颜回 之死 与 孔子 之生,人物一 之死 人物二 之生,1
TRAIN_SENT_ID_270823,,伍天锡,伍云召,李元霸 、 宇文成都 、 裴元庆 、 雄阔海 、 伍天锡 、 伍云召 、 罗成 、 杨林 、 魏文通,李元霸  宇文成都  裴元庆  雄阔海  人物一  人物二  罗成  杨林  魏文通,-1
TRAIN_SENT_ID_279081,,夏林菲,夏翼,萌 侦探 纪事 内容简介 : 萌 侦探 纪事 《 萌 侦探 纪事 1 》 : 本季 主角 ： 莫海音 、 罗洛 、 夏林菲 、 夏翼 、 优优 。,萌 侦探 纪事 内容简介  萌 侦探 纪事  萌 侦探 纪事    本季 主角  莫海音  罗洛  人物一  人物二  优优,-1
TRAIN_SENT_ID_270566,,全真七子,王重阳,陈抟 、 王重阳 、 全真七子 、 张三丰 ， 都 是 武功 出神入化 之 人 。,陈抟  人物二  人物一  张三丰  武功 出神入化,1
TRAIN_SENT_ID_282638,,李未央,李敏之,受 李未央 救助 ， 帮忙 照顾 疯 了 的 李敏之 。,受 人物一 救助  帮忙 照顾 疯 人物二,-1
TRAIN_SENT_ID_263361,,武修文,武敦儒,师兄 ： 武修文 、 武敦儒,师兄  人物一  人物二,-1
TRAIN_SENT_ID_250586,,鲁西西,皮皮鲁,皮皮鲁 和 鲁西西 演职员 表 : 皮皮鲁 和 鲁西西 演员表 : （ 资料 来源 ）,人物二 人物一 演职员 表  人物二 人物一 演员表   资料 来源,-1
TRAIN_SENT_ID_279084,,程英,黄药师,师父 ： 黄药师 赵韩樱子 版 程英 ( 9 张 ),师父  人物二 赵韩樱子 版 人物一   张,1
TRAIN_SENT_ID_285613,,韩笑,韩少云,韩笑 嗓音 甜美 ， 颇具 韩少云 大师 风范 。,人物一 嗓音 甜美  颇具 人物二 大师 风范,1
TRAIN_SENT_ID_264568,,胡青牛,张无忌,1351 胡青牛 、 纪晓芙 、 简捷 、 薛公远 卒 ， 张无忌 初遇 朱元璋 等 明教 教众 。,人物一  纪晓芙  简捷  薛公远 卒  人物二 初遇 朱元璋 明教 教众,1
TRAIN_SENT_ID_273675,,姜子牙,元始天尊,封神演义 阐教 : 姜子牙 元始天尊 ： 阐教 教主 ， 居于 昆仑山 玉虚宫 。,封神演义 阐教  人物一 人物二  阐教 教主  居于 昆仑山 玉虚宫,1
TRAIN_SENT_ID_261350,,何猷启,何超莲,吴克群 首先 献唱 《 为 你 写诗 》 及 《 追 》 筹得 50 万港元 ， 何超莲 与 胞弟 何猷启 坐在 观众席 第二排 欣赏 。,吴克群 献唱  写诗   追  筹得  万港元  人物二 胞弟 人物一 坐在 观众席 第二排 欣赏,-1
TRAIN_SENT_ID_254284,,张顺,张横,张顺 死后 ， 还 把 灵魂 附在 张横 身上 杀死 了 方天定 。,人物一 死后  灵魂 附在 人物二 身上 杀死 方天定,-1
TRAIN_SENT_ID_257460,,姜昆,马季,马季 、 姜昆 师徒俩 叶立中 — — 曹俊清 、 朱文正,人物二  人物一 师徒俩 叶立中   曹俊清  朱文正,1
TRAIN_SENT_ID_261332,,罗松,罗成,隋唐 时期 罗艺 之孙 （ 祖母 姜桂芝 ） ， 罗松 之子 ， 罗成 的 侄子 ， 死 于 薛丁山 征西 ， 儿子 罗平 ， 女儿 罗盈 。,隋唐 时期 罗艺 之孙  祖母 姜桂芝   人物一 之子  人物二 侄子  死 薛丁山 征西  儿子 罗平  女儿 罗盈,-1
TRAIN_SENT_ID_255411,,罗成,秦琼,"走向 传奇 内容简介 : 传奇世界 无处 不 传奇 , 关公 秦琼 比 义气 , 赵云 罗成 赛 枪法 , 张翼德 尉迟恭 谁 脸 更 黑 , 李元霸 和 李存孝 谁 更 牛 。",走向 传奇 内容简介  传奇世界 无处 传奇  关公 人物二 义气  赵云 人物一 赛 枪法  张翼德 尉迟恭 脸 更 黑  李元霸 李存孝 更 牛,-1
TRAIN_SENT_ID_255417,,罗成,秦琼,36 专诸巷 罗成 认 舅母 贾柳店 秦琼 待 宾朋,专诸巷 人物一 认 舅母 贾柳店 人物二 宾朋,-1
TRAIN_SENT_ID_271243,,马季,侯宝林,在此之前 ， 侯宝林 、 马季 曾 分别 应邀 出访 日本 。,在此之前  人物二  人物一 应邀 出访 日本,1
TRAIN_SENT_ID_262256,,尤二姐,尤三姐,当然 ， 尤三姐 与 逆来顺受 的 尤二姐 不同 。,人物二 逆来顺受 人物一 不同,-1
TRAIN_SENT_ID_264255,,陈真,霍元甲,此外 ， 有 说 倪匡 在 亚洲 电视节目 《 今夜 不设防 》 之中 ， 说 过 陈 真是 真有 其人 ， 报纸 上 霍元甲 的 治丧 名单 上 有着 陈真 这 名字 。,说 倪匡 亚洲 电视节目  今夜 不设防  之中  说 陈 真是 真有 其人  报纸 人物二 治丧 名单 有着 人物一 名字,1
TRAIN_SENT_ID_261643,,宋小宝,赵本山,赵本山 也 曾多次 想带 爱徒 宋小宝 上 春晚 ， 但 都 因为 作品 不 理想 、 身体状况 不 允许 等 原因 半路 “ 夭折 ” 。,人物二 曾多次 想带 爱徒 人物一 春晚  作品 理想  身体状况 允许 原因 半路  夭折,1
TRAIN_SENT_ID_266209,,范遥,赵敏,赵敏 将 六大 门派 门人 押 至 大都 万安 寺 ， 范遥 背叛 旧主 重返 明教 ， 救出 门派 众人 ； 灭绝师太 卒 ， 立 周芷若 为 新 峨嵋 掌门 。,人物二 六大 门派 门人 押 大都 万安 寺  人物一 背叛 旧主 重返 明教  救出 门派 众人  灭绝师太 卒  立 周芷若 新 峨嵋 掌门,1
TRAIN_SENT_ID_249316,,陆无双,程英,黄蓉 一看 便 知 程英 “ 外 和 内刚 ” ， “ 外刚内柔 ” 的 陆无双 ， 有 了 这位 守护 天使 ， 以后 都 不会 受人 欺侮 了 。,黄蓉 一看 便 知 人物二  外 内刚    外刚内柔  人物一  这位 守护 天使  以后 不会 受人 欺侮,-1
TRAIN_SENT_ID_261583,,南宫敬叔,孟懿子,孟懿子 和 南宫敬叔 学礼于 孔子 。,人物二 人物一 学礼于 孔子,-1
TRAIN_SENT_ID_264555,,胡青牛,张无忌,张无忌 悟性 : 胡青牛 见 他 悟性 奇高 … …,人物二 悟性  人物一 见 悟性 奇高,1
TRAIN_SENT_ID_259520,,梅超风,杨康,梅超风 赵 王府 上 : 後 来 ， 梅超风 假扮 普通 妇人 到 了 金国王爷 完颜洪烈 王府 当 杂工 和 偷偷 练功 ， 并 传授 杨康 九阴 白骨 爪 。,人物一 赵 王府  後  人物一 假扮 普通 妇人 金国王爷 完颜洪烈 王府 杂工 偷偷 练功  传授 人物二 九阴 白骨 爪,1
TRAIN_SENT_ID_266676,,邓鸣贺,邓鸣璐,邓鸣贺 邓鸣璐 中国舞蹈家协会 南方 舞蹈 学校,人物一 人物二 中国舞蹈家协会 南方 舞蹈 学校,-1
TRAIN_SENT_ID_255490,,罗成,秦琼,李世民 、 罗成 、 程咬金 、 秦琼 等 众 英雄 最终 识破阴谋 ， 力战 突出重围 。,李世民  人物一  程咬金  人物二 众 英雄 最终 识破阴谋  力战 突出重围,-1
TRAIN_SENT_ID_261650,,宋小宝,赵本山,2013 - 03 - 02 ： 樱桃红 「 宋小宝 ， 沈春阳 ， 杨冰 ， 赵本山 」,樱桃红  人物一  沈春阳  杨冰  人物二,1
TRAIN_SENT_ID_251511,,陈辅,陈靖仇,经过 一连串 争夺 后 ， 因为 宇文拓 挟持 了 陈辅 为 人质 ， 陈靖仇 只好 而 交出 了 自己 拥有 的 所有 神器 。,一连串 争夺  宇文拓 挟持 人物一 人质  人物二 只好 交出 拥有 神器,1
TRAIN_SENT_ID_271246,,马季,侯宝林,“ 除了 铃不响 ， 上下 哪儿 都响 ” ； “ 逗你玩 儿 ” ； “ 宇宙 牌 香烟 ” ， 侯宝林 、 马三立 、 马季 等 人 的 著名 段子 至今 还 能 让 人乐 。,铃不响  都响    逗你玩    宇宙 牌 香烟   人物二  马三立  人物一 著名 段子 人乐,1
TRAIN_SENT_ID_259945,,周志文,周志康,胡鸿钧 、 周志文 、 周志康,胡鸿钧  人物一  人物二,-1
TRAIN_SENT_ID_251605,,穆春,穆弘,因在 路上 打赏 了 使 棍棒 的 病 大虫 薛永 ， 宋江 得罪 了 当地 恶霸 没 遮拦 穆弘 、 小 遮拦 穆春 ， 二人 追 宋江 等 人 。,因在 路上 打赏 棍棒 病 大虫 薛永  宋江 得罪 恶霸 没 遮拦 人物二  遮拦 人物一  二人 追 宋江,-1
TRAIN_SENT_ID_275887,,王子豪,王子杰,暂时 以 王子豪 王子杰 、 陆霏霏 及 郑仲恒 3 组 分数 最低 。,暂时 人物一 人物二  陆霏霏 郑仲恒  组 分数 最低,-1
TRAIN_SENT_ID_255286,,卫夫人,王羲之,崔瑗 张芝 张昶 锺 繇 锺 会 韦诞 皇象 嵇康 卫瓘 卫夫人 索靖 谢安 王导 王敦 王廙 王洽 王珉 王羲之 王献之,崔瑗 张芝 张昶 锺 繇 锺 会 韦诞 皇象 嵇康 卫瓘 人物一 索靖 谢安 王导 王敦 王廙 王洽 王珉 人物二 王献之,1
TRAIN_SENT_ID_256547,,周武,周文,周武 王封 叔叔 姬仲在 西 虢 ； 周文 王 季弟 虢 叔 封 在 东 虢 ， 历 、 宣之时 姬仲 后裔 迁封 陕虢 ， 故今 陕地 有北 虢 、 东虢 、 西虢 。,人物一 王封 叔叔 姬仲在 西 虢  人物二 王 季弟 虢 叔 封 东 虢  历  宣之时 姬仲 后裔 迁封 陕虢  故今 陕地 有北 虢  东虢  西虢,-1
TRAIN_SENT_ID_274684,,冯国纶,冯国经,· 冯汉柱 ： 利丰 第二代 接班人 ， 知名 商人 冯国经 、 冯国纶 之 父 。,冯汉柱  利丰 第二代 接班人  知名 商人 人物二  人物一 父,-1
TRAIN_SENT_ID_268812,,洪凌波,李莫愁,洪凌波 角色 能力 : 洪凌波 得 李莫愁 真传 ， 而 李莫愁 的 古墓 剑法 精妙 无比 ， 故 洪凌波 的 剑法 也 是 凌厉 。,人物一 角色 能力  人物一 人物二 真传  人物二 古墓 剑法 精妙 无比  人物一 剑法 凌厉,1
TRAIN_SENT_ID_252446,,颜回,孔子,颜回 至 匡 ， 见到 了 被 围困 的 孔子 等 人 。,人物一 匡  见到 围困 人物二,1
TRAIN_SENT_ID_270557,,全真七子,王重阳,防御 路线 走 王重阳 ， 全真七子 相应 点灯 。,防御 路线 走 人物二  人物一 相应 点灯,1
TRAIN_SENT_ID_270803,,伍天锡,伍云召,第十九回 太行山 伍天锡 鏖兵 关王庙 伍云召 寄子 第二十回 韩擒虎 收兵 复旨 程咬金 逢 赦 回家,第十九回 太行山 人物一 鏖兵 关王庙 人物二 寄子 第二十回 韩擒虎 收兵 复旨 程咬金 逢 赦 回家,-1
TRAIN_SENT_ID_270555,,黎绍峰,黎雪竹,后 被 黎绍峰 所救 ， 经过 黎雪竹 （ 黎绍峰 姐姐 ） 的 残酷 训练 将 她 一步 一步 的 打 造成 了 青萍 的 影子 ， 杜允唐 的 定制 情人 。,人物一 所救  人物二  人物一 姐姐  残酷 训练 一步 一步 造成 青萍 影子  杜允唐 定制 情人,-1
TRAIN_SENT_ID_263347,,蔡夫人,蔡瑁,刘表 个 蔡夫人 打算 将 刘琮 立 为 继承人 ， 而 蔡瑁 、 张允 则 为 其 党羽 。,刘表 人物一 打算 刘琮 立 继承人  人物二  张允 党羽,-1
TRAIN_SENT_ID_254294,,张顺,张横,张横 立功 心切 ， 不顾 张顺 劝阻 ， 率 二三百 人去 劫 关胜 营寨 ， 结果 被 关胜 生擒 。,人物二 立功 心切  不顾 人物一 劝阻  率 二三百 人去 劫 关胜 营寨  关胜 生擒,-1
TRAIN_SENT_ID_255188,,赵海燕,赵本山,《 出名 》 （ 表演 ： 赵本山 、 赵海燕 ）,出名   表演  人物二  人物一,1
