sent_id,sent_id,entity1,entity2,sent,processed_sent,label
TRAIN_SENT_ID_257488,,姜昆,马季,就 这样 费尽 了 周折 ， 姜昆 才 最终 被 马季 调到 了 中央广播说唱团 ， 并 被 马季 收为 弟子 。,费尽 周折  人物一 最终 人物二 调到 中央广播说唱团  人物二 收为 弟子,1
TRAIN_SENT_ID_283648,,元泰,于占元,元泰 为 于占元 得意门生 ， 与 元龙 、 元楼 、 元彪 、 元奎 、 元华 、 元武 并 称为 七小福 。,人物一 人物二 得意门生  元龙  元楼  元彪  元奎  元华  元武 称为 七小福,1
TRAIN_SENT_ID_275540,,王小虎,赵本山,赵家 班 王小虎 : 王小虎 ， 二人转 演员 出身 ， 赵本山 的 第十个 徒弟 。,赵家 班 人物一  人物一  二人转 演员 出身  人物二 第十个 徒弟,1
TRAIN_SENT_ID_282229,,上官博玉,吕洞宾,上官博玉 具体 介绍 : 上官博玉 是 吕洞宾 的 三 弟子 ， 道 号 “ 灵虚 子 ” ， 负责 在 纯阳 宫中 打理 炼丹房 。,人物一 具体 介绍  人物一 人物二 三 弟子  道 号  灵虚 子   负责 纯阳 宫中 打理 炼丹房,1
TRAIN_SENT_ID_255282,,卫夫人,王羲之,王羲之 少时 曾 从 其学书 ， 卫夫人 是 “ 书圣 ” 的 启蒙 老师 。,人物二 少时 其学书  人物一  书圣  启蒙 老师,1
TRAIN_SENT_ID_278337,,贾廷聚,唐喜成,贾廷聚 师徒 情深 : 1962 年 ， 贾廷聚 拜师 唐派 艺术 创始人 唐喜成 。,人物一 师徒 情深   年  人物一 拜师 唐派 艺术 创始人 人物二,1
TRAIN_SENT_ID_252454,,颜回,孔子,代相村 历史悠久 ， 以颜姓 为主 ， 相传 为 孔子 弟子 颜回 后代 。,代相村 历史悠久  以颜姓 为主  相传 人物二 弟子 人物一 后代,1
TRAIN_SENT_ID_253037,,颜回,孔子,颜回 不仕 : 孔子 对 颜回 说 ： “ 颜回 ， 你 过来 ！,人物一 不仕  人物二 人物一 说   人物一  过来,1
TRAIN_SENT_ID_252501,,颜回,孔子,颜回 ， 孔子 的 学生 ， 以 德行 著称 。,人物一  人物二 学生  德行 著称,1
TRAIN_SENT_ID_255460,,罗成,秦琼,罗成 入朝 面君 ， 具奏 前事 ， 又 去 拜望 表哥 秦琼 ， 线娘 、 又兰为 秦母 拜寿 ， 又 与 诸 夫人 相见 问候 。,人物一 入朝 面君  具奏 前事  拜望 表哥 人物二  线娘  又兰为 秦母 拜寿  夫人 相见 问候,-1
TRAIN_SENT_ID_268832,,洪凌波,李莫愁,洪凌波 角色 设定 : 洪凌波 虽然 是 李莫愁 的 徒弟 ， 但 她 的 性格 心地 却 和 李莫愁 迥然不同 。,人物一 角色 设定  人物一 人物二 徒弟  性格 心地 人物二 迥然不同,1
TRAIN_SENT_ID_249097,,吕洞宾,韩湘子,唐暗 八仙 纹 发簪 文物 介绍 : 暗 八仙 即用 韩湘子 的 花 、 汉 钟离 的 扇 、 蓝采和 的 箫 、 吕洞宾 的 剑 等 器物 来 代表 八位 神仙 的 形像 。,唐暗 八仙 纹 发簪 文物 介绍  暗 八仙 即用 人物二 花  汉 钟离 扇  蓝采和 箫  人物一 剑 器物 代表 八位 神仙 形像,1
TRAIN_SENT_ID_253830,,赵合德,赵飞燕,燕 啄 皇孙 : 《 汉书 》 里 记载 成帝 死后 ， 司隶 解光 对 赵合德 杀害 许美人 及 女官 曹宫 之子 的 奏疏 ， 其 动机 是 想 惩罚 赵飞燕 。,燕 啄 皇孙   汉书  里 记载 成帝 死后  司隶 解光 人物一 杀害 许美人 女官 曹宫 之子 奏疏  动机 想 惩罚 人物二,-1
TRAIN_SENT_ID_257494,,姜昆,马季,是 继 姜昆 和 赵炎 之后 马季 先生 的 第三个 徒弟 ， 成名 于 20 世纪 80 年代 。,继 人物一 赵炎 之后 人物二 先生 第三个 徒弟  成名  世纪  年代,1
TRAIN_SENT_ID_276968,,樊迟,孔子,樊迟 三次 问仁 ， 孔子 三次 回答 。,人物一 三次 问仁  人物二 三次 回答,1
TRAIN_SENT_ID_252852,,颜回,孔子,孔门十哲 人物 介绍 : 孔门十哲 德行 : 子渊 即 颜回 ， 姓 颜名 回 ， 字子渊 ， 亦 称 颜渊 ， 比 孔子 小 三十岁 ， 鲁国 人 。,孔门十哲 人物 介绍  孔门十哲 德行  子渊 人物一  姓 颜名 回  字子渊  称 颜渊  人物二 三十岁  鲁国,1
TRAIN_SENT_ID_253135,,颜回,孔子,颜回 ： 字子渊 ， 十四岁 拜 孔子 为师 ， 是 孔子 最 得意 的 门生 。,人物一  字子渊  十四岁 拜 人物二 为师  人物二 得意 门生,1
TRAIN_SENT_ID_259663,,公孙胜,罗真人,入云龙 公孙胜 人物 介绍 : 公孙胜 ， 罗真人 弟子 ， 道 号 一清 先生 ， 能 呼风唤雨 ， 江湖人称 入云龙 。,入云龙 人物一 人物 介绍  人物一  人物二 弟子  道 号 一清 先生  呼风唤雨  江湖人称 入云龙,1
TRAIN_SENT_ID_271572,,赵敏,王保保,后 在 夺取 大都 后西进 与 元 猛将 扩廓 帖 木儿 （ 就是 赵敏 的 哥哥 王保保 ） 军 进行 了 艰苦 的 搏战 ， 平定 山西 ， 陕西 。,夺取 大都 后西进 元 猛将 扩廓 帖 木儿  人物一 哥哥 人物二  军 进行 艰苦 搏战  平定 山西  陕西,-1
TRAIN_SENT_ID_261714,,汤镇业,汤镇宗,香港 无线 五虎将 汤镇业 ： 辉煌 不再 ， 处境 尴尬 : 汤镇业 胖多 了 ， 半秃 的 头顶 ， 看上去 比 他 哥哥 汤镇宗 还要 老 很多 。,香港 无线 五虎将 人物一  辉煌 不再  处境 尴尬  人物一 胖多  半秃 头顶  看上去 哥哥 人物二 老 很多,-1
TRAIN_SENT_ID_268925,,韩非,荀子,2 角色 经历 : 第三部 : 李斯 去 拜访 自己 的 先师 荀子 ， 但 荀子 不但 避而不见 ， 还 说 他 只有 韩非 这 一个 徒弟 。,角色 经历  第三部  李斯 拜访 先师 人物二  人物二 避而不见  说 人物一 一个 徒弟,1
TRAIN_SENT_ID_264950,,云中子,雷震子,战仙传 雷震子 : 雷震子 是 文王 姬昌 第一 百子 ， 阐教 门人 ， 云中子 的 弟子 。,战仙传 人物二  人物二 文王 姬昌 第一 百子  阐教 门人  人物一 弟子,1
TRAIN_SENT_ID_252928,,颜回,孔子,颜回 : 颜回 颜回 ， 姓 颜名 回 ， 字子渊 ， 亦 称 颜渊 ， 比 孔子 小 三十岁 ， 鲁国 人 。,人物一  人物一 人物一  姓 颜名 回  字子渊  称 颜渊  人物二 三十岁  鲁国,1
TRAIN_SENT_ID_252654,,颜回,孔子,子弟 录 : 颜回 鲁国 人 ， 字子渊 ， 小 孔子 三十岁 ， 最为 孔子 钟爱 ， 并 一再 褒奖 之 ： “ 贤哉 回 也 ！,子弟 录  人物一 鲁国  字子渊  人物二 三十岁  最为 人物二 钟爱  一再 褒奖   贤哉 回,1
TRAIN_SENT_ID_259645,,公孙胜,罗真人,戴宗 叫 李逵 去 屋里 打闹 ， 公孙胜 只好 出来 ， 以 老母 年迈 ， 罗真人 不放为 由 不 去 梁山 。,戴宗 李逵 屋里 打闹  人物一 只好  老母 年迈  人物二 不放为 梁山,1
TRAIN_SENT_ID_268823,,洪凌波,李莫愁,第四代 ： 洪凌波 、 陆无双 （ 两人 师从 李莫愁 ） 、 杨过 （ 师从 小龙女 ）,第四代  人物一  陆无双  两人 师从 人物二   杨过  师从 小龙女,1
TRAIN_SENT_ID_262220,,尤二姐,尤三姐,刚烈 的 尤三姐 因 柳湘莲 的 拒绝 引剑 自尽 ； 温柔 的 尤二姐 因 王熙凤 的 陷害 吞金 自杀 。,刚烈 人物二 柳湘莲 拒绝 引剑 自尽  温柔 人物一 王熙凤 陷害 吞金 自杀,-1
TRAIN_SENT_ID_255269,,卫夫人,王羲之,当年 为学 书法 你 先 拜师 卫夫人 ， 只恨 得 没有 超过 王羲之 右 将军 。,当年 为学 书法 先 拜师 人物一  只恨 没有 超过 人物二 右 将军,1
TRAIN_SENT_ID_261603,,宋小宝,赵本山,2013 - 03 - 03 ： 樱桃红 「 赵本山 ， 宋小宝 ， 沈春阳 ， 王天泽 」,樱桃红  人物二  人物一  沈春阳  王天泽,1
TRAIN_SENT_ID_286445,,张南垣,董其昌,张南垣 概况 : 张南垣 从小 有 绘画 天赋 ， 师从 董其昌 学画 ， 十分 刻苦 ， 每天 日夕 临摹 点染 ， 到 了 废寝忘食 的 地步 。,人物一 概况  人物一 从小 绘画 天赋  师从 人物二 学画  十分 刻苦  每天 日夕 临摹 点染  废寝忘食 地步,1
TRAIN_SENT_ID_255405,,罗成,秦琼,秦琼 遂 率 程咬金 、 罗成 （ 张翰 饰 ） 投 于 李世民 麾下 ， 屡立 战功 ， 最终 助 李唐 王朝平 定 天下 。,人物二 遂 率 程咬金  人物一  张翰 饰  投 李世民 麾下  屡立 战功  最终 助 李唐 王朝平 定 天下,-1
TRAIN_SENT_ID_259696,,游颖,游娴,这 一切 全给 游颖 看 在 眼内 ， 本着 逞强 的 心 ， 游颖 没有 将 误会 即时 澄清 ， 成为 她 与 亲 姊 游娴 之间 的 一道 刺 。,全给 人物一 眼内  逞强 心  人物一 没有 误会 即时 澄清  成为 亲 姊 人物二 之间 一道 刺,-1
TRAIN_SENT_ID_253014,,颜回,孔子,其三 ， 是 鲁哀公 问 孔子 弟子 中 哪位 好学 ， 孔子 说 ： “ 有 颜回 者 好学 ， 不 迁怒 ， 不 贰 过 ， 不幸 短命 死 矣 。,其三  鲁哀公 问 人物二 弟子 中 哪位 好学  人物二 说   人物一 好学  迁怒  贰  不幸 短命 死,1
TRAIN_SENT_ID_275258,,汤潮,赵本山,汤潮 是 赵本山 的 首位 音乐 弟子 ， 也 是 赵本山 重点 培养 的 徒弟 之一 。,人物一 人物二 首位 音乐 弟子  人物二 重点 培养 徒弟,1
TRAIN_SENT_ID_284639,,石冰,傅小石,"石冰 ， 石冰 自幼 酷爱 美术 , 师从 傅小石 先生 学习 国画 。",人物一  人物一 自幼 酷爱 美术  师从 人物二 先生 学习 国画,1
TRAIN_SENT_ID_282103,,白如海,李苦禅,白如海 人物 简介 : 笔名 晓峰 ， 师从 李苦禅 大师 门生 申西岚 先生 。,人物一 人物 简介  笔名 晓峰  师从 人物二 大师 门生 申西岚 先生,1
TRAIN_SENT_ID_263404,,武修文,武敦儒,主要 原因 与 郭靖 专心 守城 ， 而 无暇 教 武敦儒 、 武修文 练武 相关 。,主要 原因 郭靖 专心 守城  无暇 教 人物二  人物一 练武 相关,-1
TRAIN_SENT_ID_264578,,胡青牛,张无忌,胡青牛 恩怨 情仇 : 那 十四 人 的 病情 开始 反复无常 ， 时好时坏 ， 张无忌 不知就里 。,人物一 恩怨 情仇  十四 病情 反复无常  时好时坏  人物二 不知就里,1
TRAIN_SENT_ID_256912,,仲由,孔子,仲由 师从 孔子 : 仲由 为 人 伉直 鲁莽 ， 敢于 对 孔子 提出批评 ， 勇于 改正错误 ， 深得 孔子 器重 。,人物一 师从 人物二  人物一 伉直 鲁莽  敢于 人物二 提出批评  勇于 改正错误  深得 人物二 器重,1
TRAIN_SENT_ID_266005,,王恬,王洽,王恬 生于 西晋时期 ， 同 母弟 为 王导 三子 王洽 ； 生母 雷氏 。,人物一 生于 西晋时期  母弟 王导 三子 人物二  生母 雷氏,-1
TRAIN_SENT_ID_282202,,杨进明,李立山,李立山 - - 杨进明 、 王林 、 李洋,人物二   人物一  王林  李洋,1
TRAIN_SENT_ID_260944,,杨露禅,陈长兴,杨露禅 人生 履历 : 杨露禅 师从 河南 温县 陈家沟 陈长兴 ， 学成 后 回 永年县 ， 寓居 太和 堂 药店 ， 以授 拳 为生 。,人物一 人生 履历  人物一 师从 河南 温县 陈家沟 人物二  学成 回 永年县  寓居 太和 堂 药店  以授 拳 为生,1
TRAIN_SENT_ID_251916,,曹薰铉,李昌镐,1991 年 曹薰铉 向 弟子 挑战 ， 结果 以三比 二 战胜 了 李昌镐 。,年 人物一 弟子 挑战  以三比 二 战胜 人物二,1
TRAIN_SENT_ID_252870,,颜回,孔子,《 孔子 家语 · 颜回 》 ： “ 设虚器 ， 纵逆祀 ， 祠 海鸟 ： 三不智 。 ”,人物二 家语  人物一    设虚器  纵逆祀  祠 海鸟  三不智,1
TRAIN_SENT_ID_256979,,仲由,孔子,《 孔子 家语 · 致思 》 ： “ 由 （ 仲由 ） 也 事亲 ， 可谓 生事 尽力 ， 死事 尽思者 也 。 ”,人物二 家语  致思     人物一  事亲  可谓 生事 尽力  死事 尽思者,1
TRAIN_SENT_ID_252971,,颜回,孔子,【 出处 】 《 孔子 家语 · 颜回 》 ： “ 公闻 之 ， 越席 而 起 。 ”,出处   人物二 家语  人物一    公闻  越席,1
TRAIN_SENT_ID_268831,,洪凌波,李莫愁,第四代 ： 洪凌波 、 陆无双 （ 俩 人 师从 李莫愁 ） 、 杨过 （ 师从 小龙女 ）,第四代  人物一  陆无双  俩 师从 人物二   杨过  师从 小龙女,1
TRAIN_SENT_ID_252387,,颜回,孔子,随师 周游 : 起因 : 颜回 在 其 人生 的 第二个 阶段 ， 约 十四年 的 时间 是 随 孔子 周游列国 。,随师 周游  起因  人物一 人生 第二个 阶段  约 十四年 时间 人物二 周游列国,1
TRAIN_SENT_ID_252473,,颜回,孔子,《 孔子 家语 · 颜回 》 ： “ 公闻 之 ， 越席 而 起 ， 促驾 召 颜回 。 ”,人物二 家语  人物一    公闻  越席  促驾 召 人物一,1
TRAIN_SENT_ID_252909,,颜回,孔子,颜回 以 “ 豫 ” 、 “ 恕 ” 告之 （ 《 孔子 家语 · 颜回 》 ） 。,人物一  豫    恕  告之   人物二 家语  人物一,1
TRAIN_SENT_ID_253091,,颜回,孔子,《 孔子 家语 · 颜回 》 ： “ 毁人 之善 以为 辩 ， 狡讦 怀诈 以为 智 。 ”,人物二 家语  人物一    毁人 之善 辩  狡讦 怀诈 智,1
TRAIN_SENT_ID_273705,,姜子牙,元始天尊,姜子牙 字 飞熊 ， 师从 元始天尊 修道 。,人物一 字 飞熊  师从 人物二 修道,1
TRAIN_SENT_ID_283489,,俞莲舟,张三丰,在 俞莲舟 展示 给 张三丰 看时 ， 张三丰 低头不语 ； 俞莲舟 自觉 肯定 是 此 武功 还有 很大 缺陷 ， 因此 更加 潜心 思索 、 力求 精进 。,人物一 展示 人物二 看时  人物二 低头不语  人物一 自觉 肯定 武功 很大 缺陷  更加 潜心 思索  力求 精进,1
TRAIN_SENT_ID_255478,,罗成,秦琼,瓦岗寨 起义 失败 后 ， 单雄信 的 结义兄弟 秦琼 、 罗成 、 程咬金 等 人 归顺 了 大唐 李氏 ， 而 单雄信 投靠 了 郑王 王世充 。,瓦岗寨 起义 失败  单雄信 结义兄弟 人物二  人物一  程咬金 归顺 大唐 李氏  单雄信 投靠 郑王 王世充,-1
TRAIN_SENT_ID_254246,,张顺,张横,第二 拨 是 林冲 、 秦明 、 戴宗 、 张横 、 张顺 、 马麟 、 邓飞 、 王矮虎 、 白胜 。,第二 拨 林冲  秦明  戴宗  人物二  人物一  马麟  邓飞  王矮虎  白胜,-1
TRAIN_SENT_ID_250434,,赵飞燕,赵合德,奸妃 中国 历代 奸妃 : 夏 ： 妺 喜 ； 商 ： 妲 己 ； 周 ： 褒 姒 、 汉 ： 赵合德 、 赵飞燕 ； 三国 ： 郭女王,奸妃 中国 历代 奸妃  夏  妺 喜  商  妲  周  褒 姒  汉  人物二  人物一  三国  郭女王,-1
TRAIN_SENT_ID_255396,,罗成,秦琼,李世民 : 在 李世民 的 统帅 下 ， 徐茂 公 、 秦琼 、 尉迟恭 、 程咬金 、 罗成 等 率兵 扫平 了 十八 路 反王 。,李世民  李世民 统帅  徐茂 公  人物二  尉迟恭  程咬金  人物一 率兵 扫平 十八 路 反王,-1
TRAIN_SENT_ID_268808,,洪凌波,李莫愁,由此可见 洪凌波 虽 师从 于 李莫愁 ， 但 无 暴戾 之心 。,人物一 师从 人物二  暴戾 之心,1
TRAIN_SENT_ID_282222,,孔杰,刘小光,中国棋院 围棋 部 的 刘小光 ： 孔杰 在 这个 时候 2 ： 0 赢 了 韩国 的 新人王 ， 对 大家 是 个 鼓舞 。,中国棋院 围棋 部 人物二  人物一    赢 韩国 新人王  鼓舞,1
TRAIN_SENT_ID_257026,,洪敬尧,洪荣宏,"20101204 猪哥 会社 秀场 歌中剧 ： 真假 王爷 BB , 伍佰万 , 林灵 , 洪荣宏 , 洪敬尧 , 郑仲茵 , 宋逸民 , 王思佳",猪哥 会社 秀场 歌中剧  真假 王爷   伍佰万  林灵  人物二  人物一  郑仲茵  宋逸民  王思佳,-1
TRAIN_SENT_ID_252647,,颜回,孔子,《 孔子 家语 . 颜回 》,人物二 家语  人物一,1
TRAIN_SENT_ID_252463,,颜回,孔子,颜回 师从 孔子 : 颜庙 颜回 “ 年 十三 ， 入 孔子 之 门 ” 时 ， 孔子 聚徒 讲学 已达 十三年 之 久 。,人物一 师从 人物二  颜庙 人物一  年 十三  入 人物二 门  时  人物二 聚徒 讲学 已达 十三年 久,1
TRAIN_SENT_ID_252886,,颜回,孔子,2 . 《 孔子 家语 ． 颜回 》 载 : 孔子 在 卫 ， 闻哭者 之声 甚哀 。,人物二 家语 ． 人物一  载  人物二 卫  闻哭者 之声 甚哀,1
TRAIN_SENT_ID_255488,,罗成,秦琼,第三十九回 秦琼 三锏 倒 铜旗 罗成 枪 挑孽 世雄 第四十回 罗春 保眷 归金墉 杨林 设计 谋反 王,第三十九回 人物二 三锏 倒 铜旗 人物一 枪 挑孽 世雄 第四十回 罗春 保眷 归金墉 杨林 设计 谋反 王,-1
TRAIN_SENT_ID_283965,,贾伦,侯耀文,侯耀文 - - 贾伦 、 牛成志 、 单联丽 、 王荃 、 高玉庆 、 李炳杰 、 陈寒柏 、 李福盛 、 郭秋林 、,人物二   人物一  牛成志  单联丽  王荃  高玉庆  李炳杰  陈寒柏  李福盛  郭秋林,1
TRAIN_SENT_ID_256481,,周武,周文,周文 王和 周武 王 立誓 要 灭掉 商朝 ， 是 基于 政治 发展 与 私人 仇恨 所 产生 的 态度 ， 丑化 妲 己 只是 一种 政治 手段 。,人物二 王和 人物一 王 立誓 灭掉 商朝  政治 发展 私人 仇恨 产生 态度  丑化 妲 一种 政治 手段,-1
TRAIN_SENT_ID_282869,,李蟠,韩愈,（ 韩愈 的 文章 ） : 《 师说 》 作于 唐贞元 十八年 （ 公元 802 年 ） 韩愈 任 四门 博士 时 ， 这 篇文章 是 韩愈 写给 他 的 学生 李蟠 的 。,人物二 文章    师说  作于 唐贞元 十八年  公元  年  人物二 四门 博士 时  篇文章 人物二 写给 学生 人物一,1
TRAIN_SENT_ID_256517,,周武,周文,而 姬姓 源自 周朝 王族 ， （ 周文 王叫 姬昌 ， 周武 王叫 姬发 ） 于是 外人 称呼 叔仪 时 为 表示 尊敬 ， 就 称 他 太叔仪 。,姬姓 源自 周朝 王族   人物二 王叫 姬昌  人物一 王叫 姬发  外人 称呼 叔仪 时 表示 尊敬  称 太叔仪,-1
TRAIN_SENT_ID_286599,,花面郎,金威远,金威远 人际关系 : 妖 金威远 是 大明 国手 ， 也 是 西金 棋院 院主 ， 自己 的 弟子 有 雷凌云 、 花面郎 、 铁头 、 刀疤 ， 被 自己 的 终结者 妖刀 王 打败 。,人物二 人际关系  妖 人物二 大明 国手  西金 棋院 院主  弟子 雷凌云  人物一  铁头  刀疤  终结者 妖刀 王 打败,1
TRAIN_SENT_ID_273365,,杨锐,张之洞,杨锐 是 张之洞 的 弟子 和 幕僚 ， 到京后 ， 与 张之洞 保持 密切联系 。,人物一 人物二 弟子 幕僚  到京后  人物二 保持 密切联系,1
TRAIN_SENT_ID_256495,,周武,周文,薛仁贵 征东 ， 杀到 摩天岭 下 ， 薛仁贵 化装 成 樵夫 ， 混入 摩天岭 ， 策反 了 前山 守 将 周文 周武 兄弟 ， 呼 哪 大王 死 在 薛仁贵 之手 。,薛仁贵 征东  杀到 摩天岭  薛仁贵 化装 成 樵夫  混入 摩天岭  策反 前山 守 人物二 人物一 兄弟  呼 大王 死 薛仁贵 之手,-1
TRAIN_SENT_ID_282201,,杨进明,李立山,李立山 — — 杨进明 、 王林 、 李洋,人物二   人物一  王林  李洋,1
TRAIN_SENT_ID_252696,,颜回,孔子,据 《 孔子 家语 》 等 书 记载 ， 颜回 死时 年 仅 三十一 。,人物二 家语  书 记载  人物一 死时 年 仅 三十一,1
TRAIN_SENT_ID_252966,,颜回,孔子,诗人 借 动物 之 “ 有情 ” 反讽 故事 中 主人公 的 “ 无情 ” ， 《 孔子 家语 · 颜回 篇 》 ： “ 孔子 在 上 ， 闻哭者 之声 甚哀 。,诗人 动物  有情  反讽 故事 中 主人公  无情    人物二 家语  人物一 篇    人物二  闻哭者 之声 甚哀,1
TRAIN_SENT_ID_250386,,赵飞燕,赵合德,赵飞燕 有个 妹妹 叫 赵合德 ， 比 她 更 迷人 ， 也 被 召 进宫 。,人物一 有个 妹妹 人物二  更 迷人  召 进宫,-1
TRAIN_SENT_ID_258126,,刘星,夏雪,东海 为 了解 夏雪 反常 行为 ， “ 雇佣 ” 刘星 跟踪 夏雪 ， 而 刘梅 发现 刘星 行动诡秘 ， 则 “ 收买 ” 了 夏雨来 跟踪 刘星 。,东海 了解 人物二 反常 行为   雇佣  人物一 跟踪 人物二  刘梅 发现 人物一 行动诡秘   收买  夏雨来 跟踪 人物一,-1
TRAIN_SENT_ID_257773,,林平之,岳不群,适逢 福州 福威 镖局 大难 ， 岳不群 收 福威 镖局 少镖头 林平之 为徒 。,适逢 福州 福威 镖局 大难  人物二 收 福威 镖局 少镖头 人物一 为徒,1
TRAIN_SENT_ID_270991,,严舆,严白虎,严舆 人物传记 : 严舆 简明 历史 传记 : 严舆 ， 严白虎 之弟 ， 有 勇力 ， 受 兄长 派遣 与 孙策 讲 和 ， 在 席间 被 孙策 投掷 手戟 击中 而 死 。,人物一 人物传记  人物一 简明 历史 传记  人物一  人物二 之弟  勇力  受 兄长 派遣 孙策 讲  席间 孙策 投掷 手戟 击中 死,-1
TRAIN_SENT_ID_259631,,公孙胜,罗真人,山东 版 水浒 中 的 公孙胜 ② 观 公孙胜 二人 恳告 罗真人 ， 此尊 师之礼 当 如此 也 。,山东 版 水浒 中 人物一 ② 观 人物一 二人 恳告 人物二  此尊 师之礼,1
TRAIN_SENT_ID_259371,,葛玄,左慈,2 人物 成就 : 左慈 戏耍 诸侯 ， 以 方术 名闻 当 世 ， 收 葛玄 为徒 。,人物 成就  人物二 戏耍 诸侯  方术 名闻 世  收 人物一 为徒,1
TRAIN_SENT_ID_275836,,陆无双,李莫愁,去 程瑛 居 ， 打 李莫愁 ， 收 程瑛 、 陆无双 ， 得 五毒 秘传 、 玉 萧剑 谱 。,程瑛 居  人物二  收 程瑛  人物一  五毒 秘传  玉 萧剑 谱,1
TRAIN_SENT_ID_275140,,孙立荣,赵本山,拜师 困难 : 赵本山 一度 不收 女 徒弟 ， 孙立荣 拜师 难,拜师 困难  人物二 一度 不收 女 徒弟  人物一 拜师 难,1
TRAIN_SENT_ID_284207,,杨熙,叶凡,本书 主角 叶凡 、 无始 大帝 他 爸爸 、 人族古 路上 收 的 弟子 杨熙,本书 主角 人物二  无始 大帝 爸爸  人族古 路上 收 弟子 人物一,1
TRAIN_SENT_ID_249048,,吕洞宾,韩湘子,八仙 中 吕洞宾 排 第一 ， 张果老 次之 ， 韩湘子 与 汉 钟离 并列 ， 何仙姑 第五 ， 铁拐李 第六 ， 蓝采和 第七 ， 曹国舅 最后 。,八仙 中 人物一 排 第一  张果老 次之  人物二 汉 钟离 并列  何仙姑 第五  铁拐李 第六  蓝采和 第七  曹国舅 最后,1
TRAIN_SENT_ID_249189,,皮皮鲁,鲁西西,瞬时 ， 奥克 玛 冲过来 大声 喊 ， 皮皮鲁 ， 你 妹妹 鲁西西 被 外星人 绑架 啦 ~ ~ ~ ~ ~ ~ ~ ~ ~ ~ ~ ~ ~,瞬时  奥克 玛 冲过来 大声 喊  人物一  妹妹 人物二 外星人 绑架,-1
TRAIN_SENT_ID_256874,,仲由,孔子,例如 ， 孔子 的 弟子 仲由 ， 字 子路 ， 就是 卫国 大夫 孔 俚 的 家 宰 ， 因为 孔 俚 属于 季氏 家族 ， 因此 子路 的 官称 就是 “ 季氏 宰 ” 。,人物二 弟子 人物一  字 子路  卫国 大夫 孔 俚 家 宰  孔 俚 属于 季氏 家族  子路 官称  季氏 宰,1
TRAIN_SENT_ID_277575,,袁承志,穆人清,碧血剑 剧情简介 : 明朝 末年 ， 忠臣 袁崇焕 被害 ， 其 幼子 袁承志 （ 郭追 饰 ） 由 哑仆 救出 ， 逃往 华山 拜 华山派 掌门人 穆人清 为师 。,碧血剑 剧情简介  明朝 末年  忠臣 袁崇焕 被害  幼子 人物一  郭追 饰  哑仆 救出  逃往 华山 拜 华山派 掌门人 人物二 为师,1
TRAIN_SENT_ID_264361,,曾国潢,曾国藩,曾国藩 因与弟 曾国葆 有 隙 ， 想以 代为 建房 而弃 前嫌 ， 故令 四弟 曾国潢 寻宝 地 ， 故 曾家 以 三十卷 谷 与 王玉阶 兑得此 屋堂 地 各 三间 草房 。,人物二 因与弟 曾国葆 隙  想以 代为 建房 而弃 前嫌  故令 四弟 人物一 寻宝  曾家 三十卷 谷 王玉阶 兑得此 屋堂 三间 草房,-1
TRAIN_SENT_ID_272355,,文殊广法天尊,金吒,李靖 答 曰 ： “ 不才 有 三子 ： 长 曰 金吒 ， 拜 五龙山 云霄 洞 文殊广法天尊 为师 ； 次 曰 木吒 ， 拜 九宫山 白鹤 洞 普贤 真人 为师 。,李靖 答 曰   不才 三子  长 曰 人物二  拜 五龙山 云霄 洞 人物一 为师  次 曰 木吒  拜 九宫山 白鹤 洞 普贤 真人 为师,1
TRAIN_SENT_ID_263341,,蔡夫人,蔡瑁,蔡瑁 告其 姊 蔡夫人 曰 ： “ 刘备 遣 三 将 居外 ， 而 自居 荆州 ， 久 必为 患 。 ”,人物二 告其 姊 人物一 曰   刘备 遣 三 居外  自居 荆州  久 必为 患,-1
TRAIN_SENT_ID_252613,,颜回,孔子,《 孔子 家语 · 颜回 》 ： “ 孔子 曰 ： 君子 以行言 ， 小人 以舌言 。 ”,人物二 家语  人物一    人物二 曰  君子 以行言  小人 以舌言,1
TRAIN_SENT_ID_252568,,颜回,孔子,归鲁 之后 ， 颜回 除 讲学 外 ， 便是 帮助 孔子 整理 古代 典籍 。,归鲁 之后  人物一 讲学 外  便是 帮助 人物二 整理 古代 典籍,1
TRAIN_SENT_ID_255290,,卫夫人,王羲之,③ 卫氏 夫人 ： 卫夫人 是 运城 夏县 人 ， 曾任 王羲之 的 老师 。,③ 卫氏 夫人  人物一 运城 夏县  曾任 人物二 老师,1
TRAIN_SENT_ID_255278,,卫夫人,王羲之,一说 为 卫铄 ， 即 卫夫人 ， 王羲之 的 老师 。,一说 卫铄  人物一  人物二 老师,1
TRAIN_SENT_ID_252738,,颜回,孔子,天资聪颖 的 颜回 ， 一生 清贫 ， 但 求学 之心 甚坚 ， 很受 孔子 喜爱 。,天资聪颖 人物一  一生 清贫  求学 之心 甚坚  很受 人物二 喜爱,1
TRAIN_SENT_ID_268928,,韩非,荀子,韩非 与 李斯 为 同学 ， 同 师事 于 荀子 。,人物一 李斯 同学  师事 人物二,1
TRAIN_SENT_ID_260934,,杨露禅,陈长兴,"杨氏 家族 创始人 : 杨露禅 ( 1799 - - 1872 ) 河北 永年 人 , 就学 于 陈长兴 。",杨氏 家族 创始人  人物一       河北 永年  就学 人物二,1
TRAIN_SENT_ID_271541,,应天文,韩慕侠,应天文 是 韩慕侠 的 老师 ， 据说 是 他 在 华山 遇到 的 一名 道士 。,人物一 人物二 老师  据说 华山 遇到 一名 道士,1
