sent_id,sent_id,entity1,entity2,sent,processed_sent,label
TRAIN_SENT_ID_275466,,李汉俊,李书城,支持 胞弟 : 李汉俊 是 李书城 的 胞弟 ， 是 中共 早期 的 主要 领袖 。,支持 胞弟  人物一 人物二 胞弟  中共 早期 主要 领袖,-1
TRAIN_SENT_ID_259741,,李偲菘,李伟菘,李偲菘 / 李伟菘 / 姚若龙 / 易家扬 / 徐世珍 / 彭学斌 / 严云农,人物一  人物二  姚若龙  易家扬  徐世珍  彭学斌  严云农,-1
TRAIN_SENT_ID_253877,,赵合德,赵飞燕,红颜 祸水 — — 汉成帝 刘骜 皇后 赵飞燕 、 赵合德 姐妹,红颜 祸水   汉成帝 刘骜 皇后 人物二  人物一 姐妹,-1
TRAIN_SENT_ID_263338,,蔡夫人,蔡瑁,马跃 檀溪 蔡夫人 和 蔡瑁 早就 对 刘备 恨之入骨 ， 几次 图谋 加害 ， 都 未能 得手 。,马跃 檀溪 人物一 人物二 早就 刘备 恨之入骨  几次 图谋 加害  未能 得手,-1
TRAIN_SENT_ID_269002,,韩非,荀子,自道 以至 名 ， 由名 而 至法 ， 上 承 老子 ， 下启 荀子 、 韩非 。,自道 名  由名 至法  承 老子  下启 人物二  人物一,1
TRAIN_SENT_ID_259757,,李偲菘,李伟菘,港台 : 袁惟仁 、 李宗盛 、 李偲菘 、 李伟菘 、 何厚华 、 涂惠源 、 季忠平 、 伍冠谚 、 钟兴民 、 林迈可 、 屠颖,港台  袁惟仁  李宗盛  人物一  人物二  何厚华  涂惠源  季忠平  伍冠谚  钟兴民  林迈可  屠颖,-1
TRAIN_SENT_ID_252787,,颜回,孔子,其六 ， 孔子 赞叹 颜回 一 闻师 教 就 能 立刻 去 实行 。,其六  人物二 赞叹 人物一 闻师 教 立刻 实行,1
TRAIN_SENT_ID_252910,,颜回,孔子,孔子 见状 ， 大为 赞赏 ， 对 颜回 的 人品 看 的 一清二楚 ， 自此 谁 再 诬陷 颜回 偷盗 ， 便 严加 惩治 ， 并 把 这件 事情 讲 给 众人 听 。,人物二 见状  大为 赞赏  人物一 人品 一清二楚  自此 诬陷 人物一 偷盗  便 严加 惩治  这件 事情 讲 众人 听,1
TRAIN_SENT_ID_251873,,曹薰铉,李昌镐,半决赛 ： 李昌镐 2 : 0 赵治勋 马晓春 2 : 1 曹薰铉,半决赛  人物二    赵治勋 马晓春    人物一,1
TRAIN_SENT_ID_254261,,张顺,张横,张雄正 在 城楼 上 叫苦不迭 ， 被 张横 ， 张顺 从飞 江 上城 ， 手执 朴刀 ， 喊一声 ， 抢 上楼来 ， 一连 砍翻 了 十余个 军卒 ， 众人 乱窜 逃生 。,张雄正 城楼 叫苦不迭  人物二  人物一 从飞 江 上城  手执 朴刀  喊一声  抢 上楼来  一连 砍翻 十余个 军卒  众人 乱窜 逃生,-1
TRAIN_SENT_ID_252634,,颜回,孔子,虽然 子贡 这么 能干 ， 但 孔子 还是 认为 他 比 颜回 要 差 一些 。,子贡 能干  人物二 认为 人物一 差,1
TRAIN_SENT_ID_251839,,梅超风,黄药师,（ 黄药师 评价 梅超风 的 武功 高于 李莫愁 ）,人物二 评价 人物一 武功 高于 李莫愁,1
TRAIN_SENT_ID_254301,,张顺,张横,水煮 水浒 : 张横 是 梁山泊 的 水军 头目 ， 远 没有 他 兄弟 张顺 出名 。,水煮 水浒  人物二 梁山泊 水军 头目  远 没有 兄弟 人物一 出名,-1
TRAIN_SENT_ID_251438,,李瀚章,李鸿章,李瀚章 和 其弟 李鸿章 一样 ， 也 是 跟随 曾国藩 镇压 太平天国 起义 开始 发家 的 。,人物一 其弟 人物二  跟随 曾国藩 镇压 太平天国 起义 发家,-1
TRAIN_SENT_ID_262253,,尤二姐,尤三姐,甄 香菱 、 薛宝琴 、 尤二姐 、 尤三姐 、 邢岫烟 、 李纹 、 李绮 、 夏金桂 、 秋桐 、 林红玉 、 龄 官 、 娇杏 ；,甄 香菱  薛宝琴  人物一  人物二  邢岫烟  李纹  李绮  夏金桂  秋桐  林红玉  龄 官  娇杏,-1
TRAIN_SENT_ID_255451,,罗成,秦琼,传说 唐槐 上 秦琼 挂 过 锏 ， 罗成 拴 过 马 。,传说 唐槐 人物二 挂 锏  人物一 拴 马,-1
TRAIN_SENT_ID_263371,,武修文,武敦儒,在 郭靖 看来 ， 襄阳 的 未来 就 落 在 武敦儒 、 武修文 肩膀 上 。,郭靖 看来  襄阳 未来 落 人物二  人物一 肩膀,-1
TRAIN_SENT_ID_264943,,贾元春,贾宝玉,刘心武 ： 刘心武 揭秘 《 红楼梦 》 （ 秦可卿 、 贾元春 、 妙玉 、 林黛玉 、 薛宝钗 、 贾宝玉 、 史湘云 、 八十回 后 真 故事 ）,刘心武  刘心武 揭秘  红楼梦   秦可卿  人物一  妙玉  林黛玉  薛宝钗  人物二  史湘云  八十回 真 故事,-1
TRAIN_SENT_ID_259392,,温策,温慧,温策 温策 逼 蜀山 : 温慧 ： 啊 ！,人物一 人物一 逼 蜀山  人物二,-1
TRAIN_SENT_ID_259623,,季布,季心,在 那个 时候 ， 季心 因 勇敢 而出名 ， 季布 因重 诺言 而出名 ， 都 在 关中 名声 显著 。,人物二 勇敢 而出名  人物一 因重 诺言 而出名  关中 名声 显著,-1
TRAIN_SENT_ID_268924,,韩非,荀子,《 荀子 》 《 韩非 子 》 也 有 记载 。,人物二   人物一 子  记载,1
TRAIN_SENT_ID_274620,,常赫志,常伯志,五 、 六 当家 黑白 无常 常赫志 和 常伯志,五  六 当家 黑白 无常 人物一 人物二,-1
TRAIN_SENT_ID_263648,,尹澄,尹夏沫,（ 出自 泡沫 之夏 Ⅰ ） 喜欢 尹夏沫 泡沫 之夏 尹澄 : 姓名 ： 尹澄,出自 泡沫 之夏 Ⅰ  喜欢 人物二 泡沫 之夏 人物一  姓名  人物一,-1
TRAIN_SENT_ID_272655,,邢德全,邢夫人,【 邢德全 】 邢夫人 的 胞弟 ， 只知 吃喝嫖赌 ， 不务正业 ， 呆气 十,人物一  人物二 胞弟  只知 吃喝嫖赌  不务正业  呆气 十,-1
TRAIN_SENT_ID_267446,,唐继虞,唐继尧,唐继尧 大怒 ， 遣 唐继虞 、 张汝骥 伐 罪 ， 轻取 贵州 ， 驱 祖铭 入川 。,人物二 大怒  遣 人物一  张汝骥 伐 罪  轻取 贵州  驱 祖铭 入川,-1
TRAIN_SENT_ID_275972,,马光陆,高占全,马光陆 与 徒弟 高占全,人物一 徒弟 人物二,1
TRAIN_SENT_ID_259951,,周志文,周志康,（ 林峰 、 徐子珊 、 林欣彤 携 胡鸿钧 、 周志文 、 周志康 、 谢东闵 倾力 演出 ） 周志文 节目主持 : 2011 年 ： 《 西湖 》,林峰  徐子珊  林欣彤 携 胡鸿钧  人物一  人物二  谢东闵 倾力 演出  人物一 节目主持   年   西湖,-1
TRAIN_SENT_ID_253893,,赵合德,赵飞燕,又 据 《 汉书 》 记载 ， 是 汉成帝 皇后 赵飞燕 之妹 美女 赵合德 所创 的 一种 眉型 ， 眉如 远山 含翠 ， 因其美 ， 世人 争相 效仿 。,汉书  记载  汉成帝 皇后 人物二 之妹 美女 人物一 所创 一种 眉型  眉如 远山 含翠  因其美  世人 争相 效仿,-1
TRAIN_SENT_ID_268902,,司徒静,司徒剑南,司徒 青云 劝 司徒剑南 不要 再 想 文蔷 ， 司徒剑南 很 痛苦 ， 司徒静 主张 一定 要 把 文蔷 娶入 司徒 家 出口 恶气 。,司徒 青云 劝 人物二 不要 想 文蔷  人物二 痛苦  人物一 主张 一定 文蔷 娶入 司徒 家 出口 恶气,-1
TRAIN_SENT_ID_255422,,罗成,秦琼,如 秦琼 的 宽厚 善良 、 任侠 仗义 ， 罗成 的 年少气盛 ， 尉迟恭 的 威猛 果敢 ， 徐茂功 的 智谋 神算 等 ， 都 颇 有 特色 。,人物二 宽厚 善良  任侠 仗义  人物一 年少气盛  尉迟恭 威猛 果敢  徐茂功 智谋 神算  颇 特色,-1
TRAIN_SENT_ID_270986,,严舆,严白虎,严白虎 武将 技能 : 严白虎 技能 导读 : 严白虎 是 割据 江东 的 豪强 ， 原名 严虎 ， 与其 弟 严舆 以 勇武 出名 。,人物二 武将 技能  人物二 技能 导读  人物二 割据 江东 豪强  原名 严虎  弟 人物一 勇武 出名,-1
TRAIN_SENT_ID_277315,,刘至翰,刘致妤,一袋 女王 20101203 : 刘至翰 、 刘致妤 兄妹 大 爆料,一袋 女王   人物一  人物二 兄妹 爆料,-1
TRAIN_SENT_ID_284829,,金正中,马小玲,马小玲 ： 这个 物体 叫 金正中 ， 是 我 的 徒弟 。,人物二  物体 人物一  徒弟,1
TRAIN_SENT_ID_278219,,张恭庆,张怡,张恭庆 、 张恭 慈和 张怡 在 捐赠 仪式 上,人物一  张恭 慈和 人物二 捐赠 仪式,-1
TRAIN_SENT_ID_252804,,颜回,孔子,经过 一段时间 的 深入 观察 了解 ， 孔子 才 指出 颜回 并 不愚 。,一段时间 深入 观察 了解  人物二 指出 人物一 不愚,1
TRAIN_SENT_ID_266141,,李昌镐,曹薰铉,半决赛 ： 曹薰铉 1 : 0 金荣桓 小林觉 1 : 0 李昌镐 1997.3 . 9,半决赛  人物二    金荣桓 小林觉    人物一,1
TRAIN_SENT_ID_269352,,王中军,王中磊,王中军 、 王中磊 、 马云 、 江南春 、 鲁伟鼎 、 冯小刚 、 张纪中 、 李冰 冰 、 黄晓明 、 罗海琼 、 任泉,人物一  人物二  马云  江南春  鲁伟鼎  冯小刚  张纪中  李冰 冰  黄晓明  罗海琼  任泉,-1
TRAIN_SENT_ID_270825,,伍天锡,伍云召,伍云召 和 伍天锡 都 死 在 扬州 玉玺 会上 ， 留下 独生子 伍登 过继 给 朱灿 。,人物二 人物一 死 扬州 玉玺 会上  留下 独生子 伍登 过继 朱灿,-1
TRAIN_SENT_ID_249557,,李蔡,李广,李蔡 生平事迹 比较简单 ， 《 史记 》 、 《 汉书 》 均 附记 于 其 堂兄 汉 将军 李广 的 传记 之中 ：,人物一 生平事迹 比较简单   史记    汉书  均 附记 堂兄 汉 将军 人物二 传记 之中,-1
TRAIN_SENT_ID_275498,,西门雁,西门云,西门雁 到 咸阳 寻找 她 的 孪生 姐姐 西门云 ， 可 没想到 ， 被 册封 为 美人 的 姐姐 仅仅 因为 没有 按时 叫醒 秦始皇 就 被 赐死 。,人物一 咸阳 寻找 孪生 姐姐 人物二  没想到  册封 美人 姐姐 仅仅 没有 按时 叫醒 秦始皇 赐死,-1
TRAIN_SENT_ID_261700,,程英,陆无双,"杨过 , 小龙女 , 程英 , 陆无双 , 公孙绿萼 , 他们 又会有 什么 不 一样 的 境遇 呢 ?",杨过  小龙女  人物一  人物二  公孙绿萼  又会有 境遇,-1
TRAIN_SENT_ID_267719,,裴元庆,裴翠云,裴翠云 将 裴元庆 接到 瓦岗 ， 魏征 为 其 治病 ， 很快 痊愈 。,人物二 人物一 接到 瓦岗  魏征 治病  很快 痊愈,-1
TRAIN_SENT_ID_265567,,张崇基,张崇德,金奖 张崇基 张崇德,金奖 人物一 人物二,-1
TRAIN_SENT_ID_271499,,孟优,孟获,孟获 殿 坐落 在 金龟 岛上 ， 正殿 塑有 孟获 、 孟优 、 摩铁 三尊 神像 ， 孟获 殿 像 （ 中 ） 中殿 塑有 孟获 之妻 祝融 夫人 像 ， 后 殿 观音菩萨 像 。,人物二 殿 坐落 金龟 岛上  正殿 塑有 人物二  人物一  摩铁 三尊 神像  人物二 殿  中  中殿 塑有 人物二 之妻 祝融 夫人  殿 观音菩萨,-1
TRAIN_SENT_ID_257054,,洪敬尧,洪荣宏,8 . 绵绵 旧情 / 林慧萍 ． 洪荣宏 ． 洪敬尧 林慧萍 睽违 歌坛 2010 最新 录音 ， 再造 男女 对唱 隽永 代表作,绵绵 旧情  林慧萍 ． 人物二 ． 人物一 林慧萍 睽违 歌坛  最新 录音  再造 男女 对唱 隽永 代表作,-1
TRAIN_SENT_ID_269571,,水笙,汪啸风,花铁干 怕 水笙 揭露 真相 ， 反诬 水笙 与 狄云 苟且 ， 使 水笙 的 旧情 人 汪啸风 反情 为 仇 。,花铁干 怕 人物一 揭露 真相  反诬 人物一 狄云 苟且  人物一 旧情 人物二 反情 仇,-1
TRAIN_SENT_ID_258812,,张无忌,殷离,张无忌 右手 扶 着 殷离 ， 左手 东点 一指 ， 西拍 一掌 。,人物一 右手 扶 人物二  左手 东点 一指  西拍 一掌,-1
TRAIN_SENT_ID_259938,,周志文,周志康,活动 【 一视 瞳仁 ~ 视障 人士 的 手绘 世 周志文 周志康 界 计划 】 主题曲,活动  一视 瞳仁  视障 人士 手绘 世 人物一 人物二 界 计划  主题曲,-1
TRAIN_SENT_ID_273673,,姜子牙,元始天尊,"他原 是 四川 峨嵋山 的 道 仙 ， 姜子牙 奉 元始天尊 之命 ， 封为 他 为 "" 正一 龙虎 玄坛 真君 "" ， 职责 是 专司 金银财宝 ， 迎祥 纳福 。",他原 四川 峨嵋山 道 仙  人物一 奉 人物二 之命  封为  正一 龙虎 玄坛 真君   职责 专司 金银财宝  迎祥 纳福,1
TRAIN_SENT_ID_259407,,凌音,凌波,师侄 中有 凌波 、 凌音 、 希恒 。,师侄 中有 人物二  人物一  希恒,-1
TRAIN_SENT_ID_255493,,罗成,秦琼,"王世充 传旨 将 金亭馆 改为 三贤 馆 , 让 秦琼 、 罗成 、 程咬金 及其 家眷 住 下 , 每日 里 殷勤 招待 , 奉 为 贵宾 。",王世充 传旨 金亭馆 改为 三贤 馆  人物二  人物一  程咬金 家眷 住  每日 里 殷勤 招待  奉 贵宾,-1
TRAIN_SENT_ID_252536,,颜回,孔子,孔子 在 人前 多次 称赞 颜回 :,人物二 人前 多次 称赞 人物一,1
TRAIN_SENT_ID_264942,,贾元春,贾宝玉,贾宝玉 、 林黛玉 、 薛宝钗 、 史湘云 、 王熙凤 、 贾元春 、 贾迎春 、 贾探春 、 贾惜春 、 妙玉 、 李纨 、 巧姐 、 秦可卿,人物二  林黛玉  薛宝钗  史湘云  王熙凤  人物一  贾迎春  贾探春  贾惜春  妙玉  李纨  巧姐  秦可卿,-1
TRAIN_SENT_ID_252592,,颜回,孔子,孔子 望见 颜回 攫其 甑 （ z è ng ） 中而食 之 。,人物二 望见 人物一 攫其 甑   è   中而食,1
TRAIN_SENT_ID_257234,,艾欧里亚,艾俄洛斯,圣域 志 狮子 列传 第八 : 艾欧里亚 ， 希腊人 也 ， 射手 县侯 艾俄洛斯 弟 。,圣域 志 狮子 列传 第八  人物一  希腊人  射手 县侯 人物二 弟,-1
TRAIN_SENT_ID_273678,,姜子牙,元始天尊,姜子牙 归国 封神 ， 太 上 无极 混元 教主 元始天尊 敕 曰 ： 呜呼 ！,人物一 归国 封神  太 无极 混元 教主 人物二 敕 曰,1
TRAIN_SENT_ID_259736,,李偲菘,李伟菘,作曲 ： 李伟菘 、 李偲菘 演唱 ： 萧 骊珠 绝代 双雄 片尾曲 : 萧 孋 珠 - 独上 西楼,作曲  人物二  人物一 演唱  萧 骊珠 绝代 双雄 片尾曲  萧 孋 珠  独上 西楼,-1
TRAIN_SENT_ID_263365,,武修文,武敦儒,与 杨过 对比 ， 武敦儒 、 武修文 更显 脓包 、 废物 。,杨过  人物二  人物一 更显 脓包  废物,-1
TRAIN_SENT_ID_276031,,华莲青,华罗庚,华罗庚 倒 在 日本东京大学 的 讲坛 上后 ， 华莲青 不顾 自己 年迈体弱 ， 坚持 到 机场 迎接 胞弟 的 骨灰 。,人物二 倒 日本东京大学 讲坛 上后  人物一 不顾 年迈体弱  坚持 机场 迎接 胞弟 骨灰,-1
TRAIN_SENT_ID_269403,,刘伟,马季,《 找 名牌 》 表演者 ： 刘伟 、 马季,找 名牌  表演者  人物一  人物二,1
TRAIN_SENT_ID_252532,,颜回,孔子,A ． 鲁迅 ： 周作人 B ． 孔子 ： 颜回,． 鲁迅  周作人  ． 人物二  人物一,1
TRAIN_SENT_ID_259620,,季布,季心,季心 史料 : 季布 弟 季心 ， 气盖 关中 ， 遇人 恭谨 ， 为 任侠 ， 方 数千里 ， 士皆争 为 之 死 。,人物二 史料  人物一 弟 人物二  气盖 关中  遇人 恭谨  任侠  方 数千里  士皆争 死,-1
TRAIN_SENT_ID_275973,,马光陆,高占全,马光陆 徒弟 高占全 : 人物 简介,人物一 徒弟 人物二  人物 简介,1
TRAIN_SENT_ID_274358,,和政公主,宁国公主,唐 颜真卿 《 和政公主 神道碑 》 ： “ 姊 曰 宁国公主 ， 孀 嫠 屏居 。 ”,唐 颜真卿  人物一 神道碑    姊 曰 人物二  孀 嫠 屏居,-1
TRAIN_SENT_ID_267429,,陆展元,陆立鼎,” 两 人均 想 ， 陆立鼎 虽然 藉藉无名 ， 他 兄长 陆展元 、 何沅君 夫妇 却侠 名震于 江湖 ， 嘉兴 陆家庄 的 名头 在 武林中 向来 无人 小觑 。,两 人均 想  人物二 藉藉无名  兄长 人物一  何沅君 夫妇 却侠 名震于 江湖  嘉兴 陆家庄 名头 武林中 向来 无人 小觑,-1
TRAIN_SENT_ID_265495,,薛蝌,薛蟠,程甲本 八十回 后 ， 薛蟠 打死 人命 被 下 在 牢里 ， 她 又 耐不住 寂寞 ， 勾引 薛蝌 。,程甲本 八十回  人物二 打死 人命 牢里  耐不住 寂寞  勾引 人物一,-1
TRAIN_SENT_ID_262217,,尤二姐,尤三姐,由 尤二姐 一 心想 重新做人 ， 而 尤三姐 认为 贾琏 不过 是 在 “ 花马 吊 嘴 ” 。,人物一 心想 重新做人  人物二 认为 贾琏  花马 吊 嘴,-1
TRAIN_SENT_ID_260721,,王重阳,全真七子,《 射雕 英雄传 》 — 王重阳 、 全真七子 、 哲别 、 窝阔台 、 拖雷 、 铁木真 、 完颜洪烈 、 周伯通,射雕 英雄传   人物一  人物二  哲别  窝阔台  拖雷  铁木真  完颜洪烈  周伯通,1
TRAIN_SENT_ID_283593,,周晓方,孙钟秀,2.9 金志 权 ， 周晓方 ， 孙钟秀 ， “ 一种 分布式 数据处理 模型 ” ， 电子学 报 ， Vol .,金志 权  人物一  人物二   一种 分布式 数据处理 模型   电子学 报,1
TRAIN_SENT_ID_269575,,水笙,汪啸风,第 12 集 水笙 带 狄云回 大理 ， 因 汪啸风 练 邪功 走火入魔 ， 需 金鲤 疗伤 ， 但 金鲤 已 被 狄云 吞食 ， 狄云 愿意 放血 医治 啸风 。,集 人物一 带 狄云回 大理  人物二 练 邪功 走火入魔  需 金鲤 疗伤  金鲤 狄云 吞食  狄云 愿意 放血 医治 啸风,-1
TRAIN_SENT_ID_277020,,钟藜,钟馗,《 天师 钟馗 · 钟馗 嫁妹 》 钟藜 （ 姚芊羽 饰 ）,天师 人物二  人物二 嫁妹  人物一  姚芊羽 饰,-1
TRAIN_SENT_ID_249123,,皮皮鲁,鲁西西,皮皮鲁 能 找回 鲁西西 的 笑容 吗 ？,人物一 找回 人物二 笑容,-1
TRAIN_SENT_ID_279415,,王学明,龙俊杰,指导 教师 ： 龙俊杰 、 何雁 、 王学明 等 。,指导 教师  人物二  何雁  人物一,1
TRAIN_SENT_ID_255345,,沈东篱,沈南枝,沈南枝 出场 章节 : 《 苏旷 传奇 》 沈南枝 第一卷 · 沽义 天下 : “ 东篱 把酒 黄昏 后 ” ， 天下第一 杀手 沈东篱 吟诗 漫步 ； “ 探著 南枝 开遍 未 ？ ”,人物二 出场 章节   苏旷 传奇  人物二 第一卷  沽义 天下   东篱 把酒 黄昏   天下第一 杀手 人物一 吟诗 漫步   探著 南枝 开遍 未,-1
TRAIN_SENT_ID_255399,,罗成,秦琼,秦琼 的 重情 重义 就 象 太阳 一样 吸引 着 罗成 。,人物二 重情 重义 象 太阳 吸引 人物一,-1
TRAIN_SENT_ID_255217,,赵海燕,赵本山,表演者 是 赵本山 与 宋小宝 、 赵海燕 、 孙立荣 。,表演者 人物二 宋小宝  人物一  孙立荣,1
TRAIN_SENT_ID_257807,,林平之,岳不群,准备 处理 林平之 的 时候 不 巧遇 上 岳不群 ， 与 之 相斗 而 不 敌 。,准备 处理 人物一 巧遇 人物二  相斗 敌,1
TRAIN_SENT_ID_267718,,裴元庆,裴翠云,第三十一回 裴元庆 怒 投 瓦岗寨 程咬金 喜纳 裴翠云 第三十二回 王世充 避祸 画 琼花 麻叔谋 开河 扰 百姓,第三十一回 人物一 怒 投 瓦岗寨 程咬金 喜纳 人物二 第三十二回 王世充 避祸 画 琼花 麻叔谋 开河 扰 百姓,-1
TRAIN_SENT_ID_264523,,岳云鹏,郭德纲,扒 马褂 版本 三 : 郭德纲 、 李菁 、 于谦 版 扒 马褂 版本 四 : 郭德纲 、 于谦 、 岳云鹏 版,扒 马褂 版本 三  人物二  李菁  于谦 版 扒 马褂 版本 四  人物二  于谦  人物一 版,1
TRAIN_SENT_ID_255430,,罗成,秦琼,此外 ， 李世民 、 秦琼 、 程咬金 、 窦建德 、 罗成 、 袁 紫烟 等 形象 ， 塑造 得 也 无不 有声有色 、 各具 风采 。,李世民  人物二  程咬金  窦建德  人物一  袁 紫烟 形象  塑造 无不 有声有色  各具 风采,-1
TRAIN_SENT_ID_261589,,宋小宝,赵本山,赵本山 、 宋小宝 、 赵海燕,人物二  人物一  赵海燕,1
TRAIN_SENT_ID_259651,,公孙胜,罗真人,第 15 回 ： 罗真人 ， 公孙胜,回  人物二  人物一,1
TRAIN_SENT_ID_255401,,罗成,秦琼,那 段时间 ， 秦琼 终于 可以 放心大胆 的 和 罗成 醉酒 当歌 ， 终于 可以 和 罗成 、 程咬金 结成 西魏 铁三角 了 。,段时间  人物二 终于 放心大胆 人物一 醉酒 当歌  终于 人物一  程咬金 结成 西魏 铁三角,-1
TRAIN_SENT_ID_268911,,司徒静,司徒剑南,司徒剑南 第十六集 : 司徒静 见到 朱允 ， 晓以大义 ， 朱允 如梦方醒 。,人物二 第十六集  人物一 见到 朱允  晓以大义  朱允 如梦方醒,-1
TRAIN_SENT_ID_272359,,文殊广法天尊,金吒,王魔 追赶 逃亡 的 姜子牙 到 五龙山 云霄 洞 ， 被 文殊广法天尊 、 金吒 师徒 所杀 。,王魔 追赶 逃亡 姜子牙 五龙山 云霄 洞  人物一  人物二 师徒 所杀,1
TRAIN_SENT_ID_260694,,王重阳,全真七子,东游 至 山东 ， 王重阳 收 马丹阳 、 孙不二 ， 王玉 阳 、 丘 长春 ， 谭长真 ， 刘长生 、 郝 太古 等 人为 徒 ， 后称 “ 全真七子 ” 。,东游 山东  人物一 收 马丹阳  孙不二  王玉 阳  丘 长春  谭长真  刘长生  郝 太古 人为 徒  后称  人物二,1
TRAIN_SENT_ID_274391,,贾演,贾源,贾 太公 生二子 ： 长子 宁国公 贾演 、 次子 荣国公 贾源 。,贾 太公 生二子  长子 宁国公 人物一  次子 荣国公 人物二,-1
TRAIN_SENT_ID_275199,,陈有汉,陈有庆,塔帕 朗西 以及 李嘉诚 、 谢国民 、 马化腾 、 陈有汉 、 陈有庆 、 马介璋 等 一批 最 杰出 的 潮商 。,塔帕 朗西 李嘉诚  谢国民  马化腾  人物一  人物二  马介璋 一批 杰出 潮商,-1
TRAIN_SENT_ID_255190,,赵海燕,赵本山,赵本山 赵海燕 田娃 喜剧 短片 : 《 出奇制胜 》,人物二 人物一 田娃 喜剧 短片   出奇制胜,1
TRAIN_SENT_ID_263350,,蔡夫人,蔡瑁,蔡夫人 和 蔡瑁 早就 对 刘备 恨之入骨 ， 几次 图谋 加害 ， 都 未能 得手 。,人物一 人物二 早就 刘备 恨之入骨  几次 图谋 加害  未能 得手,-1
TRAIN_SENT_ID_273663,,姜子牙,元始天尊,小说 《 封神演义 》 中 ， 姜子牙 辅佐 周 武王伐纣 事毕 ， 奉 玉虚宫 元始天尊 之命 ， 敕封 八部 三百六十五 位正神 ， 是 为 “ 封神榜 ” 。,小说  封神演义  中  人物一 辅佐 周 武王伐纣 事毕  奉 玉虚宫 人物二 之命  敕封 八部 三百六十五 位正神   封神榜,1
TRAIN_SENT_ID_252789,,颜回,孔子,儒家 四圣 ： 至圣 孔子 ， 复圣 颜回 ， 宗圣曾子 ， 亚圣孟子 ；,儒家 四圣  至圣 人物二  复圣 人物一  宗圣曾子  亚圣孟子,1
TRAIN_SENT_ID_274068,,南宫敬叔,孔子,孔子 和 南宫敬叔 扬鞭 启程 ， 踏上 了 观周 之路 。,人物二 人物一 扬鞭 启程  踏上 观周 之路,1
TRAIN_SENT_ID_260689,,王重阳,全真七子,相关 传说 : 相传 王重阳 在 此 闭关 成功 ， 继而 发展 处 全真教 ， 出现 全真七子 。,相关 传说  相传 人物一 闭关 成功  发展 处 全真教  出现 人物二,1
TRAIN_SENT_ID_268988,,韩非,荀子,（ 注 ： 韩非 之死 与 李斯 有 或 荀子 ( 15 张 ),注  人物一 之死 李斯 人物二   张,1
TRAIN_SENT_ID_264602,,凌波,凌音,凌音 听从 凌波 的话 ， 并 与 要 下山 除妖 的 凌波 约定 ， 二人 再见 时要 互相 聊 路途 上 的 新鲜事 。,人物二 听从 人物一  下山 除妖 人物一 约定  二人 再见 时要 互相 聊 路途 新鲜事,-1
TRAIN_SENT_ID_260725,,王重阳,全真七子,吕 祖传 道 于 王重阳 — — 马丹阳 等 “ 全真七子 ” 一脉相承 ， 是 为 北宗 也 。,吕 祖传 道 人物一   马丹阳  人物二  一脉相承  北宗,1
TRAIN_SENT_ID_259752,,李偲菘,李伟菘,作词 : 卡斯 作曲 : 李偲菘 李伟菘 编曲 : 戴维雄,作词  卡斯 作曲  人物一 人物二 编曲  戴维雄,-1
TRAIN_SENT_ID_254272,,张顺,张横,与 梁山 军 交战 中 被 张横 一 朴刀 砍翻 ， 张顺 赶上去 剁 下头 。,梁山 军 交战 中 人物二 朴刀 砍翻  人物一 赶上去 剁 下头,-1
TRAIN_SENT_ID_258121,,孙少安,孙兰香,他 是 土壤 ， 是 铺路石 ， 是 泥土 里 的 根 ， 在 这块 土壤 上长 出 了 孙少安 、 孙少平 和 孙兰香 这 几株 大树 。,土壤  铺路石  泥土 里 根  这块 土壤 上长 出 人物一  孙少平 人物二 几株 大树,-1
TRAIN_SENT_ID_264224,,陈真,霍元甲,有 传说 霍元甲 被 日本 人下 毒药 害死 之后 ， 他 的 爱徒 陈真 替 他 报仇 。,传说 人物二 日本 人下 毒药 害死 之后  爱徒 人物一 报仇,1
TRAIN_SENT_ID_275817,,程万牛,程铁牛,罗通 扫北 程万牛 和 程铁牛 同 为 先锋 ， 征东 又 参加 了 二路 讨伐 军 ， 一直 没有 立 什么 功劳 。,罗通 扫北 人物一 人物二 先锋  征东 参加 二路 讨伐 军  一直 没有 立 功劳,-1
TRAIN_SENT_ID_257453,,姜昆,马季,甲 ： 马季 的 、 姜昆 的 、 常宝华 的 、 高英培 的 ， 我 都 听 过 。,甲  人物二  人物一  常宝华  高英培  听,1
TRAIN_SENT_ID_271518,,孟优,孟获,孟获 殿 正殿 塑有 孟获 、 孟优 、 摩铁 三尊 神像 。,人物二 殿 正殿 塑有 人物二  人物一  摩铁 三尊 神像,-1
TRAIN_SENT_ID_259617,,季布,季心,其中 《 季布 栾布 列传 》 记述 季布 、 栾布 二人 的 生平事迹 外 ， 还 记载 了 季心 和 丁公 的 事迹 。,人物一 栾布 列传  记述 人物一  栾布 二人 生平事迹 外  记载 人物二 丁公 事迹,-1
TRAIN_SENT_ID_257029,,洪敬尧,洪荣宏,」 而 洪一峰 刻意 栽培 长子 洪荣宏 ， 但 相较 之下 ， 次子 洪敬尧 有如 坐在 翘翘板 的 彼端 ， 从 名字 可以 看出 一些 端倪 。,洪一峰 刻意 栽培 长子 人物二  相较 之下  次子 人物一 有如 坐在 翘翘板 彼端  名字 看出 端倪,-1
TRAIN_SENT_ID_283893,,李晏,李纶,李晏 ， 李纶 之弟 ， 封 赵郡 公 ， 官至 开府 仪同 三司 、 大将军 。,人物一  人物二 之弟  封 赵郡 公  官至 开府 仪同 三司  大将军,-1
TRAIN_SENT_ID_257509,,姜昆,马季,主持人 ： 王景愚 、 刘晓庆 、 姜昆 、 马季,主持人  王景愚  刘晓庆  人物一  人物二,1
TRAIN_SENT_ID_284712,,刘文步,杨少奎,杨少奎 是 相声界 公认 的 太平 歌词 演唱 大家 ， 佟守本 和 刘文步 都 跟 杨少奎 有 渊源 ， 两个 人 决定 联袂 申报 非遗 。,人物二 相声界 公认 太平 歌词 演唱  佟守本 人物一 人物二 渊源  两个 决定 联袂 申报 非遗,1
