sent_id,sent_id,entity1,entity2,sent,processed_sent,label
TRAIN_SENT_ID_271516,,孟优,孟获,孟获 派弟 孟优 赴汉军 处假 投降 ， 欲 内应 外合 ， 诸葛亮 将计就计 ， 埋伏 擒获 孟获 和 诸洞 酋长 ， 马忠 亦 于 此战 立下 战功 。,人物二 派弟 人物一 赴汉军 处假 投降  欲 内应 外合  诸葛亮 将计就计  埋伏 擒获 人物二 诸洞 酋长  马忠 此战 立下 战功,-1
TRAIN_SENT_ID_249242,,皮皮鲁,鲁西西,魔方 大厦 剧集 背景 : 中国儿童艺术剧院 联手 “ 童话 大王 ” 郑渊洁 最新 推出 童话剧 《 皮皮鲁 鲁西西 》 系列 作品 之二 ， 根据 魔方 大厦 改编 。,魔方 大厦 剧集 背景  中国儿童艺术剧院 联手  童话 大王  郑渊洁 最新 推出 童话剧  人物一 人物二  系列 作品 之二  魔方 大厦 改编,-1
TRAIN_SENT_ID_250407,,赵飞燕,赵合德,有 说 将 麝香 放入 妓女 的 肚脐 可以 避孕 ， 比如 堪称 中国 “ 红颜 祸水 ” 之 最 的 赵飞燕 和 赵合德 两 姊妹 就 有 记载 采取 的 是 这样 的 避孕措施 。,说 麝香 放入 妓女 肚脐 避孕  堪称 中国  红颜 祸水  人物一 人物二 两 姊妹 记载 采取 避孕措施,-1
TRAIN_SENT_ID_252396,,颜回,孔子,故 孔子 常 称赞 颜回 具有 君子 四德 ， 即 强于 行义 ， 弱于 受谏 ， 怵 于 待禄 ， 慎于 治身 。,人物二 常 称赞 人物一 具有 君子 四德  强于 行义  弱于 受谏  怵 待禄  慎于 治身,1
TRAIN_SENT_ID_249557,,李蔡,李广,李蔡 生平事迹 比较简单 ， 《 史记 》 、 《 汉书 》 均 附记 于 其 堂兄 汉 将军 李广 的 传记 之中 ：,人物一 生平事迹 比较简单   史记    汉书  均 附记 堂兄 汉 将军 人物二 传记 之中,-1
TRAIN_SENT_ID_269726,,薛洋,薛之荔,楚牧 的 母亲 ， 薛洋 、 薛之荔 的 继母 ， 性格 大大咧咧 ， 是 一位 宽容 善良 的 女性 。,楚牧 母亲  人物一  人物二 继母  性格 大大咧咧  一位 宽容 善良 女性,-1
TRAIN_SENT_ID_274105,,南宫敬叔,孔子,《 史记 · 孔子 世家 》 云 ： “ 南宫敬叔 与 孔子 俱 适周 ， 问礼 ， 盖见 老子 云 。 ”,史记  人物二 世家  云   人物一 人物二 俱 适周  问礼  盖见 老子 云,1
TRAIN_SENT_ID_252536,,颜回,孔子,孔子 在 人前 多次 称赞 颜回 :,人物二 人前 多次 称赞 人物一,1
TRAIN_SENT_ID_249070,,吕洞宾,韩湘子, 三厘 宝地  ， 据传 是 王母娘娘 送给 吕洞宾 、 汉 钟离 、 韩湘子 三位 神仙 的 天宫 宝物 ， 铺开,三厘 宝地   据传 王母娘娘 送给 人物一  汉 钟离  人物二 三位 神仙 天宫 宝物  铺开,1
TRAIN_SENT_ID_264602,,凌波,凌音,凌音 听从 凌波 的话 ， 并 与 要 下山 除妖 的 凌波 约定 ， 二人 再见 时要 互相 聊 路途 上 的 新鲜事 。,人物二 听从 人物一  下山 除妖 人物一 约定  二人 再见 时要 互相 聊 路途 新鲜事,-1
TRAIN_SENT_ID_249225,,皮皮鲁,鲁西西,6 剧集 背景 : 中国儿童艺术剧院 联手 “ 童话 大王 ” 郑渊洁 最新 推出 童话剧 《 皮皮鲁 鲁西西 》 系列 作品 之二 ， 根据 魔方 大厦 改编 。,剧集 背景  中国儿童艺术剧院 联手  童话 大王  郑渊洁 最新 推出 童话剧  人物一 人物二  系列 作品 之二  魔方 大厦 改编,-1
TRAIN_SENT_ID_275355,,申公豹,元始天尊,阐教 弟子 ， 因为 元始天尊 偏袒 姜子牙 ， 申公豹 嫉妒 姜子牙 手掌 封神 大权 ， 故此 挑动 大批 高人 对付 姜子牙 ， 给 西岐 方面 造成 巨大 困难 。,阐教 弟子  人物二 偏袒 姜子牙  人物一 嫉妒 姜子牙 手掌 封神 大权  挑动 大批 高人 对付 姜子牙  西岐 方面 造成 巨大 困难,1
TRAIN_SENT_ID_249115,,皮皮鲁,鲁西西,在 中国 大陆 ， 35 岁 以下 的 人 不 知道 皮皮鲁 、 鲁西西 、 舒克和贝塔 的 已经 不 多 。,中国 大陆   岁 以下 知道 人物一  人物二  舒克和贝塔 已经,-1
TRAIN_SENT_ID_249198,,皮皮鲁,鲁西西,中国 儿艺 音乐剧 《 皮皮鲁 鲁西西 - 罐头 小人 》 作曲 作词,中国 儿艺 音乐剧  人物一 人物二  罐头 小人  作曲 作词,-1
TRAIN_SENT_ID_274087,,南宫敬叔,孔子,相传 孔子 与 南宫敬叔 适周 问礼于 老聃 ， 问 乐于 苌 弘 。,相传 人物二 人物一 适周 问礼于 老聃  问 乐于 苌 弘,1
TRAIN_SENT_ID_263026,,钱婆婆,汤婆婆,尽管 在 人物造型 上 钱婆婆 和 汤婆婆 没有 任何 区别 ， 但是 两人 在 性格 上 却 有着 极大 的 反差 。,人物造型 人物一 人物二 没有 区别  两人 性格 有着 极大 反差,-1
TRAIN_SENT_ID_269723,,薛洋,薛之荔,薛之荔 跟着 文姨 的 车 来到 薛洋 的 修理 工厂 ， 当 薛洋 听到 薛之荔 的 声音 里 ， 他 激动 地 跑 了 下去 ， 此时 薛洋 脸上 充满 了 快乐 的 笑容 。,人物二 跟着 文姨 车 来到 人物一 修理 工厂  人物一 听到 人物二 声音 里  激动 跑 下去  人物一 脸上 充满 快乐 笑容,-1
TRAIN_SENT_ID_275356,,申公豹,元始天尊,南极 仙翁 ： 阐教大 弟子 ， 随侍 元始天尊 ， 申公豹 迷惑 姜子牙 时 出手 解围,南极 仙翁  阐教大 弟子  随侍 人物二  人物一 迷惑 姜子牙 时 出手 解围,1
TRAIN_SENT_ID_256984,,仲由,孔子,仲由 政治 才干 : 孔子 设案 授徒 ， 辟 德行 、 政事 、 言语 、 文学 四科 ， 而 子路 是 政事 科之 优异者 。,人物一 政治 才干  人物二 设案 授徒  辟 德行  政事  言语  文学 四科  子路 政事 科之 优异者,1
TRAIN_SENT_ID_257772,,林平之,岳不群,身负 血海深仇 的 林平之 先后 投奔 木高峰 和 岳不群 ， 却 被 两人 利用 ， 苦闷 之中 性格 逐渐 阴暗 残忍 。,身负 血海深仇 人物一 先后 投奔 木高峰 人物二  两人 利用  苦闷 之中 性格 逐渐 阴暗 残忍,1
TRAIN_SENT_ID_252947,,颜回,孔子,而 《 孔子 游春 》 中 孔子 听 子路 、 颜回 谈论 志向 的 那 部分 也 具有 同样 的 效果 。,人物二 游春  中 人物二 听 子路  人物一 谈论 志向 部分 具有 同样 效果,1
TRAIN_SENT_ID_254296,,张顺,张横,话 说 当下 张横 听得 道 没 了 他 兄弟 张顺 ， 烦恼 得 昏晕 了 半晌 ， 却 救 得 苏醒 。,话 说 当下 人物二 听得 道 没 兄弟 人物一  烦恼 昏晕 半晌  救 苏醒,-1
TRAIN_SENT_ID_250095,,武敦儒,武修文,后 由 郭靖传 于 弟子 武修文 、 武敦儒 和 女儿 郭 芙 。,郭靖传 弟子 人物二  人物一 女儿 郭 芙,-1
TRAIN_SENT_ID_252978,,颜回,孔子,另外 ， 他 从前 与 平民 祢衡 在 一起 行为 放荡 ， 互相标榜 ， 祢衡 称赞 孔融 为 ‘ 孔子 不死 ’ ， 孔融 称赞 祢衡 是 ‘ 颜回 复生 ’ 。,从前 平民 祢衡 一起 行为 放荡  互相标榜  祢衡 称赞 孔融  人物二 不死   孔融 称赞 祢衡  人物一 复生,1
TRAIN_SENT_ID_267592,,骆赢,骆羽,2012 年 澳大利亚 黄金 大奖赛 女双 亚军 （ 与 简毓瑾 2 - 3 不敌 中国 组合 骆赢 / 骆羽 ） 、 混双 冠军 （ 与 陈宏麟 ）,年 澳大利亚 黄金 大奖赛 女双 亚军  简毓瑾    不敌 中国 组合 人物一  人物二   混双 冠军  陈宏麟,-1
TRAIN_SENT_ID_261570,,南宫敬叔,孟懿子,其 声望 远播 于 各 诸侯国 ， 其 弟子 子路 、 孟懿子 、 南宫敬叔 等 在 鲁国 已 小有名气 。,声望 远播 诸侯国  弟子 子路  人物二  人物一 鲁国 小有名气,-1
TRAIN_SENT_ID_250415,,赵飞燕,赵合德,二赵 释义 : “ 二赵 ” 是 中国 西汉时期 著名 的 美女 赵飞燕 、 赵合德 的 合称 。,二赵 释义   二赵  中国 西汉时期 著名 美女 人物一  人物二 合称,-1
TRAIN_SENT_ID_285734,,陈应德,杨虎,李景延 弟子 杨虎 ， 其 得意 弟子 有 谢功 吉 、 陈名标 、 陈应德 、 杨绍 舜 。,李景延 弟子 人物二  得意 弟子 谢功 吉  陈名标  人物一  杨绍 舜,1
TRAIN_SENT_ID_250593,,鲁西西,皮皮鲁,第 241 集 鲁西西 要求 参加 喜庆 婚宴 ； 皮皮鲁 说出 有史以来 最 伟大 的 结婚 祝辞 ； 新闻 和 垃圾 同时 播放 时 千万别 生育,集 人物一 要求 参加 喜庆 婚宴  人物二 说出 有史以来 伟大 结婚 祝辞  新闻 垃圾 播放 时 千万别 生育,-1
TRAIN_SENT_ID_256850,,仲由,孔子,孔子 说 ： “ 只 听 了 单方面 的 供词 就 可以 判决 案件 的 ， 大概 只有 仲由 吧 。 ”,人物二 说   听 单方面 供词 判决 案件  大概 人物一,1
TRAIN_SENT_ID_275147,,孙立荣,赵本山,不过 ， 如今 的 孙立荣 和 王小宝 因为 工作 原因 无法 继续 搭档 演出 ， 孙立荣 目前 的 搭档 是 苏小龙 ， 是 赵本山 新收 的 一位 弟子 。,如今 人物一 王小宝 工作 原因 无法 继续 搭档 演出  人物一 目前 搭档 苏小龙  人物二 新收 一位 弟子,1
TRAIN_SENT_ID_256963,,仲由,孔子,看 《 史记 》 的 时候 ， 读 到 孔子 被困 在 陈 、 蔡 之间 而 弦歌 之声 没有 断绝 ， 颜渊 、 仲由 这样 的 弟子 还 在 与 他 来往 问答 。,史记   读 人物二 被困 陈  蔡 之间 弦歌 之声 没有 断绝  颜渊  人物一 弟子 来往 问答,1
TRAIN_SENT_ID_252687,,颜回,孔子,孔子 听 了 深受感动 改变 面容 说 ： “ 实在 好 啊 ， 颜回 的 心愿 ！,人物二 听 深受感动 改变 面容 说   实在  人物一 心愿,1
TRAIN_SENT_ID_259628,,公孙胜,罗真人,公孙胜 想起 罗真人 “ 遇 汴 而 还 ” 之语 ， 便 向 宋江 辞行 ， 返回 蓟州 二 仙山 ， “ 从师 学 道 ， 侍养 老母 ， 以终天年 ” 。,人物一 想起 人物二  遇 汴  之语  便 宋江 辞行  返回 蓟州 二 仙山   从师 学 道  侍养 老母  以终天年,1
TRAIN_SENT_ID_256864,,仲由,孔子,【 译文 】 孔子 说 ： “ 穿着 破旧 的 丝 棉袍子 ， 与 穿着 狐 貉 皮袍 的 人 站 在 一起 而 不 认为 是 可耻 的 ， 大概 只有 仲由 吧 。,译文  人物二 说   穿着 破旧 丝 棉袍子  穿着 狐 貉 皮袍 站 一起 认为 可耻  大概 人物一,1
TRAIN_SENT_ID_256939,,仲由,孔子,孔子 说 ： “ 只 听 单方面 言辞 就 可以 决断 案子 的 ， 恐怕 只有 仲由 吧 ！ ”,人物二 说   听 单方面 言辞 决断 案子  恐怕 人物一,1
TRAIN_SENT_ID_268828,,洪凌波,李莫愁,1 角色 设定 : 洪凌波 虽然 是 李莫愁 的 徒弟 ， 但 她 的 性格 心地 却 和 李莫愁 迥然不同 。,角色 设定  人物一 人物二 徒弟  性格 心地 人物二 迥然不同,1
TRAIN_SENT_ID_283647,,元泰,于占元,（ 于占元 徒弟 七小福 之一 ） : 元泰 为 于占元 得意门生 ， 与 元龙 、 元楼 、 元彪 、 元奎 、 元华 、 元武 并 称为 七小福 。,人物二 徒弟 七小福   人物一 人物二 得意门生  元龙  元楼  元彪  元奎  元华  元武 称为 七小福,1
TRAIN_SENT_ID_252472,,颜回,孔子,人物 生平 : 颜回 像 颜回 是 孔子 最 得意 的 弟子 ， 极富 学问 。,人物 生平  人物一 人物一 人物二 得意 弟子  极富 学问,1
TRAIN_SENT_ID_253078,,颜回,孔子,所以 在 少 正卯 与 孔子 争夺 弟子 时 ， 使 “ 孔子 之 门 三盈三虚 ” ， 唯有 颜回 未离 孔门 半步 ， 因而 后人 评价 说 ： “ 颜渊 独知 孔子 圣 也 。 ”,少 正卯 人物二 争夺 弟子 时   人物二 门 三盈三虚   人物一 未离 孔门 半步  后人 评价 说   颜渊 独知 人物二 圣,1
TRAIN_SENT_ID_283648,,元泰,于占元,元泰 为 于占元 得意门生 ， 与 元龙 、 元楼 、 元彪 、 元奎 、 元华 、 元武 并 称为 七小福 。,人物一 人物二 得意门生  元龙  元楼  元彪  元奎  元华  元武 称为 七小福,1
TRAIN_SENT_ID_252501,,颜回,孔子,颜回 ， 孔子 的 学生 ， 以 德行 著称 。,人物一  人物二 学生  德行 著称,1
TRAIN_SENT_ID_252690,,颜回,孔子,陋巷 志 颜回 : 颜回 是 孔子 的 得意 弟子 ， 居 孔门 四科 之 首 ， 德行 第一 ， 天资 聪慧 ， 勤奋好学 ， 循礼 行仁 ， 尊师重道 。,陋巷 志 人物一  人物一 人物二 得意 弟子  居 孔门 四科 首  德行 第一  天资 聪慧  勤奋好学  循礼 行仁  尊师重道,1
TRAIN_SENT_ID_268832,,洪凌波,李莫愁,洪凌波 角色 设定 : 洪凌波 虽然 是 李莫愁 的 徒弟 ， 但 她 的 性格 心地 却 和 李莫愁 迥然不同 。,人物一 角色 设定  人物一 人物二 徒弟  性格 心地 人物二 迥然不同,1
TRAIN_SENT_ID_255355,,贾午,贾南风,郭槐 临终 ， 人之将死 ， 其言也善 ， 她 一直 谆谆嘱咐 女儿 贾南风 要 对 太子 慈爱 ， 不可 听从 贾午 、 贾谧 的话 。,郭槐 临终  人之将死  其言也善  一直 谆谆嘱咐 女儿 人物二 太子 慈爱  不可 听从 人物一  贾谧,-1
TRAIN_SENT_ID_260593,,金敬姬,金正日,据说 ， 金敬姬 从小 受到 哥哥 金正日 的 宠爱 ， 从小 性格 强硬 ， 脾气 很大 。,据说  人物一 从小 哥哥 人物二 宠爱  从小 性格 强硬  脾气 很大,-1
TRAIN_SENT_ID_276937,,樊迟,孔子,孔子 力倡 爱人 ： 樊迟 问 “ 仁 ” ， 孔子 回答 “ 爱人 ” （ 《 论语 · 颜渊 》 ） 。,人物二 力倡 爱人  人物一 问  仁   人物二 回答  爱人    论语  颜渊,1
TRAIN_SENT_ID_252424,,颜回,孔子,颜渊 ： 颜回 ， 字子渊 ， 亦 称 颜渊 ， 是 孔子 的 得意门生 。,颜渊  人物一  字子渊  称 颜渊  人物二 得意门生,1
TRAIN_SENT_ID_253135,,颜回,孔子,颜回 ： 字子渊 ， 十四岁 拜 孔子 为师 ， 是 孔子 最 得意 的 门生 。,人物一  字子渊  十四岁 拜 人物二 为师  人物二 得意 门生,1
TRAIN_SENT_ID_276989,,樊迟,孔子,孔子 的 弟子 樊迟 ， 问 孔子 怎样 叫作 仁 ？,人物二 弟子 人物一  问 人物二 叫作 仁,1
TRAIN_SENT_ID_252965,,颜回,孔子,颜 ： 颜回 ， 又名 颜渊 ， 字子渊 ， 孔子 得意 弟子 。,颜  人物一  又名 颜渊  字子渊  人物二 得意 弟子,1
TRAIN_SENT_ID_274510,,曾江,林翠,秦剑 一生 有 许多 弟子 ， 楚原 、 林翠 、 龙刚 、 谢贤 、 嘉玲 、 南红 、 江雪 、 曾江 、 姜中平 、 王伟 、 陈齐颂 、 胡燕妮 等,秦剑 一生 弟子  楚原  人物二  龙刚  谢贤  嘉玲  南红  江雪  人物一  姜中平  王伟  陈齐颂  胡燕妮,-1
TRAIN_SENT_ID_252987,,颜回,孔子,这里 ， 孔子 极为 称赞 他 的 得意门生 颜回 ， 认为 他 好学上进 ， 自 颜回 死后 ， 已经 没有 如此 好学 的 人 了 。,人物二 极为 称赞 得意门生 人物一  认为 好学上进  人物一 死后  已经 没有 好学,1
TRAIN_SENT_ID_252884,,颜回,孔子,颜回 不仅 是 孔子 最 得意 的 弟子 之一 ， 更是 公认 的 孔子 弟子 中 最 有 德行 的 人 。,人物一 人物二 得意 弟子  更是 公认 人物二 弟子 中 德行,1
TRAIN_SENT_ID_252918,,颜回,孔子,这时 ， 跟着 孔子 的 颜回 有点 纳闷 ， 就 问 ： “ 夫子 尚未 见到 子路 就 三次 称赞 其善 ， 不亦逾乎 ？ ”,跟着 人物二 人物一 有点 纳闷  问   夫子 尚未 见到 子路 三次 称赞 其善  不亦逾乎,1
TRAIN_SENT_ID_274402,,林丽娟,李多奎,新 中国 成立 后 ， 李多奎 接受 新 思想 ， 先后 收 赵鸣 华 、 李鸣岩 、 林丽娟 、 王梦云 、 王晓临 、 许爱华 等 一批 年轻 女演员 为徒 。,新 中国 成立  人物二 接受 新 思想  先后 收 赵鸣 华  李鸣岩  人物一  王梦云  王晓临  许爱华 一批 年轻 女演员 为徒,1
TRAIN_SENT_ID_257773,,林平之,岳不群,适逢 福州 福威 镖局 大难 ， 岳不群 收 福威 镖局 少镖头 林平之 为徒 。,适逢 福州 福威 镖局 大难  人物二 收 福威 镖局 少镖头 人物一 为徒,1
TRAIN_SENT_ID_274405,,林丽娟,李多奎,1 活动 年表 : 1959 年 10 月 ， 农历 己亥 年 ： 李多奎 收 林丽娟 为徒 李多奎 收 林丽娟 为徒 。,活动 年表   年  月  农历 己亥 年  人物二 收 人物一 为徒 人物二 收 人物一 为徒,1
TRAIN_SENT_ID_279088,,程英,黄药师,其实 追究 起来 ， 黄药师 收 程英 为徒 ， 还是 因为 她 服侍 得 体贴入微 ， 不似 黄蓉般 跳脱 顽皮 。,其实 追究 起来  人物二 收 人物一 为徒  服侍 体贴入微  不似 黄蓉般 跳脱 顽皮,1
TRAIN_SENT_ID_256855,,仲由,孔子,孔子 为 鲁 司寇 ， 摄行 相事 ， 有 喜色 ． 仲由 问 曰 ： “ 由闻 君子 祸至 不惧 ， 福至 不喜 ， 今 夫子 得位 而 喜 ， 何也 ？ ”,人物二 鲁 司寇  摄行 相事  喜色 ． 人物一 问 曰   由闻 君子 祸至 不惧  福至 不喜  夫子 得位 喜  何也,1
TRAIN_SENT_ID_276991,,樊迟,孔子,孔子 的 仁学 思想 最 基本 、 最 核心 的 宗旨 就是 “ 爱人 ” （ 《 论语 · 颜渊 》 ） ： “ 樊迟 问仁 ， 孔 曰 ： 爱人 。 ”,人物二 仁学 思想 基本  核心 宗旨  爱人    论语  颜渊     人物一 问仁  孔 曰  爱人,1
TRAIN_SENT_ID_274063,,南宫敬叔,孔子,义云 ： 《 史记 》 云 ： 孔子 与 南宫敬叔 适周 问礼 於 老子 ， 老子 曰 ： 子 之 所言 ， 其人骨 已朽 矣 ， 独其言 在 尔 。,义云   史记  云  人物二 人物一 适周 问礼 於 老子  老子 曰  子 所言  其人骨 已朽  独其言,1
TRAIN_SENT_ID_253004,,颜回,孔子,相传 孔子 有 三千个 弟子 ， 颜回 因为 刻苦 好学 ， 品德高尚 而 被 孔子 欣赏 。,相传 人物二 三千个 弟子  人物一 刻苦 好学  品德高尚 人物二 欣赏,1
TRAIN_SENT_ID_252545,,颜回,孔子,雁儿 落带 过 得胜 令 · 叹 光阴 似 水流 注释 译文 : 雁儿 落带 过 得胜 令 · 叹 光阴 似 水流 词语 注释 : ① 颜回 ： 孔子 弟子 ， 以 德行 著称 。,雁儿 落带 得胜 令  叹 光阴 似 水流 注释 译文  雁儿 落带 得胜 令  叹 光阴 似 水流 词语 注释  ① 人物一  人物二 弟子  德行 著称,1
TRAIN_SENT_ID_252428,,颜回,孔子,这 一章 ， 孔子 对 颜回 学问 道德 接近 于 完善 却 在生活上 常常 贫困 深感 遗憾 。,一章  人物二 人物一 学问 道德 接近 完善 在生活上 常常 贫困 深感 遗憾,1
TRAIN_SENT_ID_252380,,颜回,孔子,孔子 听到 了 琴声 ， 果然 把 颜回 叫 了 进去 ， 问道 ： “ 你 为什么 独自 快乐 ？ ”,人物二 听到 琴声  人物一 进去  问道   独自 快乐,1
TRAIN_SENT_ID_264579,,胡青牛,张无忌,后来 ， 张无忌 在 与 胡青牛 的 ” 问答 “ 中 ， 找到 了 救助 这群人 的 方法 ， 开始 救治 这些 人 ， 受伤 的 人 病情 开始 好转 。,后来  人物二 人物一  问答  中  找到 救助 这群人 方法  救治  受伤 病情 好转,1
TRAIN_SENT_ID_275494,,苏华仁,吴云青,1998 年 夏初 ， 吴云青 随 弟子 苏华仁 到 安阳 北郊 ； 1998 年 9 月 22 日 凌晨 ， 吴云青 仙逝 于北效 佛祖 寺 。,年 夏初  人物二 弟子 人物一 安阳 北郊   年  月  日 凌晨  人物二 仙逝 于北效 佛祖 寺,1
TRAIN_SENT_ID_253036,,颜回,孔子,孔子 说 ： “ 颜回 的 学问 道德 接近 于 完善 了 吧 ， 可是 他 常常 贫困 。,人物二 说   人物一 学问 道德 接近 完善  常常 贫困,1
TRAIN_SENT_ID_252392,,颜回,孔子,上联 典指 春秋 鲁 · 颜回 ， 孔子 弟子 中 最贤 ， 列 孔门 德行 科 。,上联 典指 春秋 鲁  人物一  人物二 弟子 中 最贤  列 孔门 德行 科,1
TRAIN_SENT_ID_252550,,颜回,孔子,译文 : 孔子 说 ： “ 颜回 的 学问 道德 接近 于 完善 了 吧 ， 可是 他 常常 贫困 。,译文  人物二 说   人物一 学问 道德 接近 完善  常常 贫困,1
TRAIN_SENT_ID_253140,,颜回,孔子,子路 看到 孔子 夸奖 颜回 ， 便 表现 出 一副 勇 不可 挡 的 架式 问 孔子 ： “ 您 若 统率 三军 ， 将 找 谁 来 共事 呢 ？ ”,子路 看到 人物二 夸奖 人物一  便 表现 出 一副 勇 不可 挡 架式 问 人物二   统率 三军  找 共事,1
TRAIN_SENT_ID_285418,,周云鹏,赵本山,周云鹏 ， 本名 周滨 ， 1982 年 4 月 20 日 出生 ， 辽宁省 辽中县 人 ， 赵本山 先生 39 号 弟子 。,人物一  本名 周滨   年  月  日 出生  辽宁省 辽中县  人物二 先生  号 弟子,1
TRAIN_SENT_ID_285417,,周云鹏,赵本山,（ 著名 二人转 演员 ） : 周云鹏 ， 本名 周滨 ， 1982 年 4 月 20 日 出生 ， 辽宁省 辽中县 人 ， 赵本山 先生 39 号 弟子 。,著名 二人转 演员   人物一  本名 周滨   年  月  日 出生  辽宁省 辽中县  人物二 先生  号 弟子,1
TRAIN_SENT_ID_282515,,红孩,赵本山,红孩 （ 1986 年 11 月 7 日 — ） ， 原名 陈昆仑 ， 著名 二人转 演员 ， 原籍 黑龙江省 鹤岗市 ， 为 赵本山 先生 的 第 35 位 弟子 。,人物一   年  月  日    原名 陈昆仑  著名 二人转 演员  原籍 黑龙江省 鹤岗市  人物二 先生  位 弟子,1
TRAIN_SENT_ID_256986,,仲由,孔子,上联 典指 春秋 时 ， 鲁国 有 仲由 ， 字 子路 ， 孔子 的 得意 弟子 ， 仕卫为 邑 宰 。,上联 典指 春秋 时  鲁国 人物一  字 子路  人物二 得意 弟子  仕卫为 邑 宰,1
TRAIN_SENT_ID_265444,,薛谭,秦青,薛谭 （ 听 了 后 ） 便 （ 向 秦青 ） 道歉 并 要求 能 返回 （ 继续 跟 秦青 学习 唱歌 ） ， （ 从此 ） 一辈子 也 不再 说辞 别的 事 了 。,人物一  听  便  人物二  道歉 要求 返回  继续 人物二 学习 唱歌     一辈子 不再 说辞 事,1
TRAIN_SENT_ID_256854,,仲由,孔子,仲由 ， 公元前 542 ～ 前 480 年 ， 字 子路 ， 又 字 季路 ， 鲁国 卞人 （ 今 山东 泗水 泉林 镇 卞 桥村 ） ， 孔子 的 得意门生 ， 以 政事 见称 。,人物一  公元前   前  年  字 子路  字 季路  鲁国 卞人  山东 泗水 泉林 镇 卞 桥村   人物二 得意门生  政事 见称,1
TRAIN_SENT_ID_256974,,仲由,孔子,仲由 ， 前 542 ～ 前 480 ， 字 子路 ， 又 字 季路 ， 鲁国 卞人 ， 孔子 得意门生 ， 以 政事 见称 。,人物一  前   前   字 子路  字 季路  鲁国 卞人  人物二 得意门生  政事 见称,1
TRAIN_SENT_ID_253071,,颜回,孔子,( 1 ) 颜生 ： 即 颜回 ， 字子渊 ， 春秋 时鲁国 人 ， 是 孔子 最 得意 的 弟子 。,颜生  人物一  字子渊  春秋 时鲁国  人物二 得意 弟子,1
TRAIN_SENT_ID_256978,,仲由,孔子,仲子 纪念馆 仲姓 仲由 : 春秋 时鲁国 人 ， 字 子路 ， 孔子 的 得意 弟子 ， 他 直率 勇敢 ， 仕卫为 邑 宰 。,仲子 纪念馆 仲姓 人物一  春秋 时鲁国  字 子路  人物二 得意 弟子  直率 勇敢  仕卫为 邑 宰,1
TRAIN_SENT_ID_256859,,仲由,孔子,百里 负米 : 仲由 ， 字 子路 、 季路 ， 春秋时期 鲁国 人 ， 孔子 的 得意 弟子 ， 性格 直率 勇敢 ， 十分 孝顺 。,百里 负米  人物一  字 子路  季路  春秋时期 鲁国  人物二 得意 弟子  性格 直率 勇敢  十分 孝顺,1
TRAIN_SENT_ID_256932,,仲由,孔子,中国 二十四孝 故事 石刻 百里 负米 : 仲由 ， 字 子路 、 季路 ， 春秋时期 鲁国 人 ， 孔子 的 得意 ， 性格 直率 勇敢 ， 十分 孝顺 。,中国 二十四孝 故事 石刻 百里 负米  人物一  字 子路  季路  春秋时期 鲁国  人物二 得意  性格 直率 勇敢  十分 孝顺,1
TRAIN_SENT_ID_256941,,仲由,孔子,孝顺 百里 负米 : 仲由 ， 字 子路 、 季路 ， 春秋时期 鲁国 人 ， 孔子 的 得意 弟子 ， 性格 直率 勇敢 ， 十分 孝顺 。,孝顺 百里 负米  人物一  字 子路  季路  春秋时期 鲁国  人物二 得意 弟子  性格 直率 勇敢  十分 孝顺,1
TRAIN_SENT_ID_256969,,仲由,孔子,百里 负米 图 ： 仲由 ， 字 子路 、 季路 ， 春秋时期 鲁国 人 ， 孔子 的 得意 弟子 ， 性格 直率 勇敢 ， 十分 孝顺 。,百里 负米 图  人物一  字 子路  季路  春秋时期 鲁国  人物二 得意 弟子  性格 直率 勇敢  十分 孝顺,1
TRAIN_SENT_ID_256906,,仲由,孔子,仲由 （ 公元前 542 年 － 公元前 480 年 ） ， 字 子路 ， 或称 季路 ， 鲁国 人 ， 是 孔子 的 著名 弟子 ， 孔门十哲 之一 。,人物一  公元前  年  公元前  年   字 子路  或称 季路  鲁国  人物二 著名 弟子  孔门十哲,1
TRAIN_SENT_ID_265402,,薛谭,秦青,1 译文 : 薛谭 向 秦青 学习 唱歌 ， 还 没有 学完 秦青 的 技艺 ， 就 以为 学尽 了 ， 于是 就 告辞 回家 。,译文  人物一 人物二 学习 唱歌  没有 学完 人物二 技艺  学尽  告辞 回家,1
TRAIN_SENT_ID_265457,,薛谭,秦青,」 绕梁三日 典源 译文 : 薛谭 向 秦青 学习 唱歌 ， 还 没有 把 秦青 的 本领 完全 学到 手 ， 自 以为 没有 什么 可学 的 了 ， 于是 告辞 回家 。,绕梁三日 典源 译文  人物一 人物二 学习 唱歌  没有 人物二 本领 完全 学到 手  没有 可学  告辞 回家,1
TRAIN_SENT_ID_265465,,薛谭,秦青,」 歌梁 典源 译文 : 薛谭 向 秦青 学习 唱歌 ， 还 没有 把 秦青 的 本领 完全 学到 手 ， 自 以为 没有 什么 可学 的 了 ， 于是 告辞 回家 。,歌梁 典源 译文  人物一 人物二 学习 唱歌  没有 人物二 本领 完全 学到 手  没有 可学  告辞 回家,1
