sent_id,entity1,entity2,sent,processed_sent,label
TRAIN_SENT_ID_255276,卫夫人,王羲之,最 根本 的 是 王羲之 的 反叛 精神 ， 这种 精神 不是 从 他 的 老师 卫夫人 那里 得来 的 ， 而是 从 他 夫人 肚皮 上 得来 的 。,根本 人物二 反叛 精神  这种 精神 老师 人物一 得来  夫人 肚皮 得来,-1
TRAIN_SENT_ID_250692,鲁西西,皮皮鲁,描述 一只 绒 玩具 熊猫 被 皮皮鲁 和 鲁西西 注射 了 桔子 汁 以后 变成 活 熊猫 的 事 。,描述 一只 绒 玩具 熊猫 人物二 人物一 注射 桔子 汁 以后 变成 活 熊猫 事,1
TRAIN_SENT_ID_250384,赵飞燕,赵合德,这里 的 赵后 ， 就是 赵飞燕 ， 昭仪 就是 赵合德 。,赵后  人物一  昭仪 人物二,1
TRAIN_SENT_ID_265488,薛蝌,薛蟠,▪ 薛姨妈 ▪ 薛蟠 ▪ 薛蝌 ▪ 薛宝钗 ▪ 薛宝琴,▪ 薛姨妈 ▪ 人物二 ▪ 人物一 ▪ 薛宝钗 ▪ 薛宝琴,1
TRAIN_SENT_ID_274397,贾演,贾源,红楼 话 美食 序言 : 宁荣二 府 是 宁国公 贾演 和 荣国公 贾源 开创 的 基业 ， 至 贾宝玉 这 一代 已 历经 四世 。,红楼 话 美食 序言  宁荣二 府 宁国公 人物一 荣国公 人物二 开创 基业  贾宝玉 一代 历经 四世,1
TRAIN_SENT_ID_272011,文姜,宣姜,堂姐妹 ： 宣姜 、 文姜,堂姐妹  人物二  人物一,1
TRAIN_SENT_ID_249264,皮皮鲁,鲁西西,皮皮鲁 分身 记 鲁西西 和 豆芽 兵,人物一 分身 记 人物二 豆芽 兵,1
TRAIN_SENT_ID_253045,颜回,孔子,注 [ 四 ] 论语 颜回 慕 孔子 之言 也 。,注  四  论语 人物一 慕 人物二 之言,-1
TRAIN_SENT_ID_261159,王缙,王维,贵族 官僚 们 也 多 信佛教 ， 元载 、 杜鸿 渐 、 王维 、 王缙 等 ， 是 其 尤 著者 。,贵族 官僚 信佛教  元载  杜鸿 渐  人物二  人物一  尤 著者,1
TRAIN_SENT_ID_251877,曹薰铉,李昌镐,半决赛 ： 曹薰铉 1 : 0 金荣桓 小林觉 1 : 0 李昌镐 1997.3 . 9,半决赛  人物一    金荣桓 小林觉    人物二,-1
TRAIN_SENT_ID_282999,卢宗道,卢怀道,卢宗道 ， 卢怀道 之弟 ， 范阳 涿人 也 。,人物一  人物二 之弟  范阳 涿人,1
TRAIN_SENT_ID_273618,马阔海,马青山,酷雷伏 铠甲 主要 召唤 人 : 召唤 者 ： 柯胜 / 李子 / 马青山 / 马阔海,酷雷伏 铠甲 主要 召唤  召唤  柯胜  李子  人物二  人物一,1
TRAIN_SENT_ID_252902,颜回,孔子,《 孔子 家语 · 颜回 》 ： “ 升马 执辔 ， 衔体 正 矣 。 ”,人物二 家语  人物一    升马 执辔  衔体 正,-1
TRAIN_SENT_ID_264213,陈真,霍元甲,而 “ 陈真 ” 的 师父 ， 新 “ 霍元甲 ” 赵文卓 将 是 该剧 的 武术指导 。,人物一  师父  新  人物二  赵文卓 该剧 武术指导,-1
TRAIN_SENT_ID_257771,林平之,岳不群,顶撞 岳不群 ， 点 瘸 林平之 ， 教训 小 师妹 ， 吓唬 陆大有 ， 等等等等 。,顶撞 人物二  点 瘸 人物一  教训 师妹  吓唬 陆大有  等等等等,-1
TRAIN_SENT_ID_275677,周厚安,周厚恩,育有 一男一女 ， 分别 是 周厚安 和 周厚恩 ， 。,育有 一男一女  人物一 人物二,1
TRAIN_SENT_ID_250721,鲁西西,皮皮鲁,其 代表作 有 《 童话 大王 》 《 舒克和贝塔 》 《 皮皮鲁 和 鲁西西 》 《 魔方 大厦 》,代表作  童话 大王   舒克和贝塔   人物二 人物一   魔方 大厦,1
TRAIN_SENT_ID_282635,胡和生,苏步青,苏步青 谷超豪 、 胡和生,人物二 谷超豪  人物一,-1
TRAIN_SENT_ID_277658,关彝,关统,关彝 ， 关兴 次子 ， 关统 死后 承袭 其位 。,人物一  关兴 次子  人物二 死后 承袭 其位,1
TRAIN_SENT_ID_249120,皮皮鲁,鲁西西,皮皮鲁 、 鲁西西 、 罗克 、 舒克和贝塔 是 他 笔下 的 人物 。,人物一  人物二  罗克  舒克和贝塔 笔下 人物,1
TRAIN_SENT_ID_270975,李易霏,李昂融,全运 朵朵 果果 会 耀眼 明星 : 她们 是 — — 李易霏 李昂融 。,全运 朵朵 果果 会 耀眼 明星    人物一 人物二,1
TRAIN_SENT_ID_277639,方天翼,顾婷,随后 ， 几人 转战 上海 ， 廖思成 为 救 大岛 由美 不幸身亡 ， 方天翼 和 顾婷 加入 新四军 。,几人 转战 上海  廖思成 救 大岛 由美 不幸身亡  人物一 人物二 加入 新四军,1
TRAIN_SENT_ID_251866,曹薰铉,李昌镐,他 与 李昌镐 、 曹薰铉 、 刘昌赫 合称 “ 韩国 棋坛 四大 金刚 ” 。,人物二  人物一  刘昌赫 合称  韩国 棋坛 四大 金刚,-1
TRAIN_SENT_ID_284903,陆启铿,华罗庚,陆启铿 与 华罗庚 合作 发表 了 《 典型 域 的 调和函数 论 》 论文 ， 建立 了 典型 域 上 调和函数 的 系统 理论 。,人物一 人物二 合作 发表  典型 域 调和函数  论文  建立 典型 域 调和函数 系统 理论,-1
TRAIN_SENT_ID_258164,刘星,夏雪,儿媳妇 搞清楚 这 阵势 后 ， 就 马上 说 老奶奶 的 脚肿 得 像 面包 ， 已经 送 医院 了 ， 刘梅 、 东海 始知 刘星 、 夏雪 的 祸 闯大 了 。,儿媳妇 搞清楚 阵势  马上 说 老奶奶 脚肿 面包  已经 送 医院  刘梅  东海 始知 人物一  人物二 祸 闯大,1
TRAIN_SENT_ID_252953,颜回,孔子,姜全来 成就 及 荣誉 : 主要 作品 有 《 关公 辞 曹 》 、 《 豆叶 黄 》 、 《 张公 赶子 》 、 《 重泣 回 》 、 《 孔子 泣 颜回 》 等 ， 带徒 授艺 数名 。,姜全来 成就 荣誉  主要 作品  关公 辞 曹    豆叶 黄    张公 赶子    重泣 回    人物二 泣 人物一   带徒 授艺 数名,-1
TRAIN_SENT_ID_249308,陆无双,程英,陆无双 改为 陆展元 与 何沅君 之女 ， 且 与 程英 并非 表姊妹 。,人物一 改为 陆展元 何沅君 之女  人物二 表姊妹,1
TRAIN_SENT_ID_269012,李如柏,李如松,人们 把 麻家 与 同样 是 武将 世家 的 李如松 、 李如柏 等 并 称为 “ 东 李西 麻 ” 。,麻家 同样 武将 世家 人物二  人物一 称为  东 李西 麻,1
TRAIN_SENT_ID_277738,王银钏,王宝钏,王 金钏 角色 资料 : 相府 大 小姐 ， 苏龙 妻子 ， 王宝钏 和 王银钏 的 大姐 。,王 金钏 角色 资料  相府 小姐  苏龙 妻子  人物二 人物一 大姐,1
TRAIN_SENT_ID_272647,卫少儿,卫青,主角 ： 霍去病 ┃ 配角 ： 绿阶 、 卫青 、 刘彻 、 卫少儿 、 卫子夫 … …,主角  霍去病 ┃ 配角  绿阶  人物二  刘彻  人物一  卫子夫,1
TRAIN_SENT_ID_261648,宋小宝,赵本山,宋小宝 ； 赵本山 ； 杨冰,人物一  人物二  杨冰,-1
TRAIN_SENT_ID_257055,洪敬尧,洪荣宏,紧返 来 我 身边 恋花 07 爱 常常 喜乐 : 江蕙 ． 洪荣宏 ． 洪敬尧 ． 王力宏 ． 周华健 ． 伍思凯,紧返 身边 恋花  爱 常常 喜乐  江蕙 ． 人物二 ． 人物一 ． 王力宏 ． 周华健 ． 伍思凯,1
TRAIN_SENT_ID_265420,薛谭,秦青,据 《 列子 · 汤问 》 记载 ， 秦青 具有 很 高 的 歌唱 技巧 ， 曾收 薛谭 为徒 。,列子  汤问  记载  人物二 具有 高 歌唱 技巧  曾收 人物一 为徒,-1
TRAIN_SENT_ID_258170,刘星,夏雪,刘星 自知 无法 和 夏雪 、 夏雨 竞争 ， 采取 了 将 对方 成绩 拉 下来 的 做法 。,人物一 自知 无法 人物二  夏雨 竞争  采取 成绩 拉 下来 做法,1
TRAIN_SENT_ID_262216,尤二姐,尤三姐,【 故事 】 ： 贾琏 听从 尤二姐 的 主张 及 尤三姐 的 意见 ， 在 外出 公干 的 路上 ， 遇到 薛蟠 与 柳湘莲 。,故事   贾琏 听从 人物一 主张 人物二 意见  外出 公干 路上  遇到 薛蟠 柳湘莲,1
TRAIN_SENT_ID_255297,卫夫人,王羲之,晋 王羲之 《 题 卫夫人 （ 笔阵 图 ） 后 》,晋 人物二  题 人物一  笔阵 图,-1
TRAIN_SENT_ID_268827,洪凌波,李莫愁,曾经 争斗 过 的 人 ： 李莫愁 ， 洪凌波 ， 公孙止 ， 耶律齐 ， 耶律燕 ， 蒙古 兵 等 。,曾经 争斗  人物二  人物一  公孙止  耶律齐  耶律燕  蒙古 兵,-1
TRAIN_SENT_ID_275922,钱学渠,钱学森,钱学渠 ， 他 是 钱学森 的 堂弟 。,人物一  人物二 堂弟,1
TRAIN_SENT_ID_253904,赵合德,赵飞燕,汉成帝 刘骜 与 赵飞燕 、 赵合德,汉成帝 刘骜 人物二  人物一,1
TRAIN_SENT_ID_254294,张顺,张横,张横 立功 心切 ， 不顾 张顺 劝阻 ， 率 二三百 人去 劫 关胜 营寨 ， 结果 被 关胜 生擒 。,人物二 立功 心切  不顾 人物一 劝阻  率 二三百 人去 劫 关胜 营寨  关胜 生擒,1
TRAIN_SENT_ID_251820,梅超风,黄药师,深入 描绘 了 黄药师 与 梅超风 之间 的 一段 若 有 似 无 的 暧昧 情愫 ；,深入 描绘 人物二 人物一 之间 一段 似 暧昧 情愫,-1
TRAIN_SENT_ID_250383,赵飞燕,赵合德,红颜 祸水 汉成帝 刘骜 皇后 赵飞燕 、 昭仪 赵合德 姐妹,红颜 祸水 汉成帝 刘骜 皇后 人物一  昭仪 人物二 姐妹,1
TRAIN_SENT_ID_266702,龙幽,龙溟,凌波 见到 龙幽 误认为 是 龙溟 ， 故而 现身 。,凌波 见到 人物一 误认为 人物二  现身,1
TRAIN_SENT_ID_259655,公孙胜,罗真人,第五十二回 戴宗 智取 公孙胜 李逵 斧劈 罗真人,第五十二回 戴宗 智取 人物一 李逵 斧劈 人物二,-1
TRAIN_SENT_ID_260587,金敬姬,金正日,小池 百合 子 写道 ： “ 金正日 对 唯一 胞妹 金敬姬 信任 有加 。,小池 百合 子 写道   人物二 唯一 胞妹 人物一 信任 有加,1
TRAIN_SENT_ID_252380,颜回,孔子,孔子 听到 了 琴声 ， 果然 把 颜回 叫 了 进去 ， 问道 ： “ 你 为什么 独自 快乐 ？ ”,人物二 听到 琴声  人物一 进去  问道   独自 快乐,-1
TRAIN_SENT_ID_261572,南宫敬叔,孟懿子,还有 少数 出身 于 贵族 的 ， 如 鲁国 的 孟懿子 和 南宫敬叔 ， 宋国 的 司马 牛 等 。,少数 出身 贵族  鲁国 人物二 人物一  宋国 司马 牛,1
TRAIN_SENT_ID_263925,汤镇宗,汤镇业,丹南 除了 与 众多 知名 影星 如 钟丽缇 、 汤灿 、 汤镇宗 、 汤镇业 等 合作 外 ， 也 同 众多 优秀 的 制片人 、 导演 如 刘桐生 、 蔡德成 有着 密切 的 合作 。,丹南 众多 知名 影星 钟丽缇  汤灿  人物一  人物二 合作 外  众多 优秀 制片人  导演 刘桐生  蔡德成 有着 密切 合作,1
TRAIN_SENT_ID_269110,唐鉴军,赵本山,主演 ： 赵本山 毕畅 贺树峰 于月仙 王小宝 唐鉴军,主演  人物二 毕畅 贺树峰 于月仙 王小宝 人物一,-1
TRAIN_SENT_ID_259642,公孙胜,罗真人,10 、 明 施耐庵 《 水浒 》 第五十三回 《 戴宗 二取 公孙胜 李逵 独劈 罗真人 》 小 可先来 蓟州寻 了 一遍 ， 并 无 打听 处 ， 只 纠合 得 一伙 弟兄 上山 。,明 施耐庵  水浒  第五十三回  戴宗 二取 人物一 李逵 独劈 人物二  可先来 蓟州寻 一遍  打听 处  纠合 一伙 弟兄 上山,-1
TRAIN_SENT_ID_273637,姜子牙,元始天尊,正一道 人死 后 ， 奉 元始天尊 命 代理 封神 ， 便 投生 转世 为 姜子牙 ， 辅助 周室 消灭 商纣 。,正一道 人死  奉 人物二 命 代理 封神  便 投生 转世 人物一  辅助 周室 消灭 商纣,-1
TRAIN_SENT_ID_259004,张苞,张绍,是 蜀汉 名将 张飞 之孙 ， 张苞 之子 ， 张绍 之 侄 。,蜀汉 名将 张飞 之孙  人物一 之子  人物二 侄,1
TRAIN_SENT_ID_266152,李昌镐,曹薰铉,最终 曹薰铉 胜 李昌镐 夺冠 。,最终 人物二 胜 人物一 夺冠,-1
TRAIN_SENT_ID_249108,吕洞宾,韩湘子,丽珠 与 韩湘子 订婚 之夜 ， 龙三 前来 抢人 ， 被 吕洞宾 赶退 。,丽珠 人物二 订婚 之夜  龙三 前来 抢人  人物一 赶退,-1
TRAIN_SENT_ID_272648,卫少儿,卫青,母亲 卫媪 是 平阳侯 家 的 女奴 ， 生有 四男 三女 ， 即 长子 卫长君 ， 长女 卫君孺 、 次女 卫少儿 、 三女 卫子夫 ， 次子 卫青 ， 三子 卫步 ， 四子 卫广 。,母亲 卫媪 平阳侯 家 女奴  生有 四男 三女  长子 卫长君  长女 卫君孺  次女 人物一  三女 卫子夫  次子 人物二  三子 卫步  四子 卫广,1
TRAIN_SENT_ID_257476,姜昆,马季,调演 结束 后 ， 姜昆 如愿以偿 ， 投身 到 马季 麾下 ， 师胜杰 则 黯然 地 回到 了 北大荒 ， 继续 干 他 的 “ 农工 ” 。,调演 结束  人物一 如愿以偿  投身 人物二 麾下  师胜杰 黯然 回到 北大荒  继续 干  农工,-1
TRAIN_SENT_ID_279103,沙条绫香,沙条爱歌,沙条 广树 （ 沙条爱歌 与 沙条绫香 的 父亲 ） ： 东地宏树,沙条 广树  人物二 人物一 父亲   东地宏树,1
TRAIN_SENT_ID_273630,马阔海,马青山,茨 纳米 铠甲 召唤 人 : 马阔海 / 李子 / 马青山,茨 纳米 铠甲 召唤  人物一  李子  人物二,1
TRAIN_SENT_ID_269398,刘伟,马季,33 . 相声 ： 《 五官 争功 》 表演者 ： 马季 赵炎 王金宝 冯巩 刘伟,相声   五官 争功  表演者  人物二 赵炎 王金宝 冯巩 人物一,-1
TRAIN_SENT_ID_271498,孟优,孟获,新 角色 马超 孟起 、 孟获 、 孟优 登场 。,新 角色 马超 孟起  人物二  人物一 登场,1
TRAIN_SENT_ID_249179,皮皮鲁,鲁西西,皮皮鲁 和 鲁西西 是 阿雅 、 曹轩宾 演唱 的 歌曲 ， 由苟庆 作词 ， 曹轩宾 作曲 。,人物一 人物二 阿雅  曹轩宾 演唱 歌曲  由苟庆 作词  曹轩宾 作曲,1
TRAIN_SENT_ID_255478,罗成,秦琼,瓦岗寨 起义 失败 后 ， 单雄信 的 结义兄弟 秦琼 、 罗成 、 程咬金 等 人 归顺 了 大唐 李氏 ， 而 单雄信 投靠 了 郑王 王世充 。,瓦岗寨 起义 失败  单雄信 结义兄弟 人物二  人物一  程咬金 归顺 大唐 李氏  单雄信 投靠 郑王 王世充,1
TRAIN_SENT_ID_285782,王朝式,沈国模,附记 列 沈国模 、 史孝咸 、 王朝式 、 薛 起风 、 罗有高 、 汪缙 、 彭绍升 、 程在 仁八人 ， 为 儒者 谈禅 各家 。,附记 列 人物二  史孝咸  人物一  薛 起风  罗有高  汪缙  彭绍升  程在 仁八人  儒者 谈禅 各家,-1
TRAIN_SENT_ID_264574,胡青牛,张无忌,随后 ， 张无忌 找来 了 胡青牛 ， 两人 当面 误会 解释 清楚 。,人物二 找来 人物一  两人 当面 误会 解释 清楚,-1
TRAIN_SENT_ID_249124,皮皮鲁,鲁西西,皮皮鲁 和 鲁西西 剧集 评价 : “ 这部 剧 最 吸引 我 的 是 从小 培养 善良 、 友爱 、 勇敢 、 诚实 等 优秀品质 的 正 能量 。 ”,人物一 人物二 剧集 评价   这部 剧 吸引 从小 培养 善良  友爱  勇敢  诚实 优秀品质 正 能量,1
TRAIN_SENT_ID_258819,张无忌,殷离,同时 ， 张无忌 对 刁蛮 可人 的 蒙古 公主 赵敏 、 青梅 竹骊 的 周芷若 、 表妹 殷离 、 明教 侍女 小昭 的 爱幕 却 很 是 不知所措 、 难以 取舍 。,人物一 刁蛮 可人 蒙古 公主 赵敏  青梅 竹骊 周芷若  表妹 人物二  明教 侍女 小昭 爱幕 不知所措  难以 取舍,1
TRAIN_SENT_ID_252555,颜回,孔子,解释 完 之后 ， 孔子 用手 挡住 了 颜回 的 眼睛 ， 不让 他 再 瞪 大 眼睛 远眺 。,解释 完 之后  人物二 用手 挡住 人物一 眼睛  不让 瞪 眼睛 远眺,-1
TRAIN_SENT_ID_273665,姜子牙,元始天尊,姜子牙 无奈 ， 只好 跑 到 昆仑山 玉虚宫 ， 去 请 他 的 师傅 元始天尊 。,人物一 无奈  只好 跑 昆仑山 玉虚宫  请 师傅 人物二,-1
TRAIN_SENT_ID_266137,李昌镐,曹薰铉,第三轮 ： 李昌镐 1 : 0 刘昌赫 曹薰铉 1 : 0 马晓春 赵治勋 1 : 0 金秀壮 聂卫平 1 : 0 林海峰,第三轮  人物一    刘昌赫 人物二    马晓春 赵治勋    金秀壮 聂卫平    林海峰,-1
TRAIN_SENT_ID_273648,姜子牙,元始天尊,姜子牙 ： 元始天尊 二郎神,人物一  人物二 二郎神,-1
TRAIN_SENT_ID_250401,赵飞燕,赵合德,汉成帝 与 赵飞燕 、 赵合德 姐妹 ： 姐妹 共 一夫 由 佳话 成 悲剧,汉成帝 人物一  人物二 姐妹  姐妹 共 一夫 佳话 成 悲剧,1
TRAIN_SENT_ID_261715,汤镇业,汤镇宗,父亲 经营 海味 铺 为生 ， 共有 八 兄弟姐妹 ， 汤镇宗 排 第四 ， 其弟 汤镇业 排 第五 。,父亲 经营 海味 铺 为生  共有 八 兄弟姐妹  人物二 排 第四  其弟 人物一 排 第五,1
TRAIN_SENT_ID_262218,尤二姐,尤三姐,贾珍 荒淫 : 贾珍 不仅 爬灰 ， 贾琏 偷 娶 了 尤二姐 之后 ， 贾珍 又 打 尤三姐 的 主意 。,贾珍 荒淫  贾珍 爬灰  贾琏 偷 娶 人物一 之后  贾珍 人物二 主意,1
TRAIN_SENT_ID_255448,罗成,秦琼,冷面 寒枪 俏 罗成 ， 本是 燕山 靖边 侯 （ 北平 王 ） 罗艺 之子 ， 出身高贵 ， 武艺高强 ， 生 得 面如冠玉 ， 却 不苟言笑 ， 为 秦琼 姑 表弟 。,冷面 寒枪 俏 人物一  本是 燕山 靖边 侯  北平 王  罗艺 之子  出身高贵  武艺高强  生 面如冠玉  不苟言笑  人物二 姑 表弟,1
TRAIN_SENT_ID_249319,陆无双,程英,纯净 的 小龙女 、 刁蛮 无理 的 郭 芙 、 爽朗 活泼 的 郭襄 、 理智 优雅 的 程英 、 泼辣 的 陆无双 、 痴情 的 公孙绿萼 都 深恋 着 杨过 。,纯净 小龙女  刁蛮 无理 郭 芙  爽朗 活泼 郭襄  理智 优雅 人物二  泼辣 人物一  痴情 公孙绿萼 深恋 杨过,1
TRAIN_SENT_ID_255493,罗成,秦琼,"王世充 传旨 将 金亭馆 改为 三贤 馆 , 让 秦琼 、 罗成 、 程咬金 及其 家眷 住 下 , 每日 里 殷勤 招待 , 奉 为 贵宾 。",王世充 传旨 金亭馆 改为 三贤 馆  人物二  人物一  程咬金 家眷 住  每日 里 殷勤 招待  奉 贵宾,1
TRAIN_SENT_ID_249002,吕洞宾,韩湘子,吕洞宾 介绍 韩湘子 到 学校 任教 ， 巧遇 离家出走 的 丽珠 ， 于是 带 她 回家 暂住 ， 与 荷 仙姑 合力 卖花 ， 自力更生 。,人物一 介绍 人物二 学校 任教  巧遇 离家出走 丽珠  带 回家 暂住  荷 仙姑 合力 卖花  自力更生,-1
TRAIN_SENT_ID_278136,裴元,孙思邈,在 裴元 心灰意冷 之际 ， 他 遇见 一个 足以 影响 他 一生 的 人 ， 就是 孙思邈 。,人物一 心灰意冷 之际  遇见 一个 足以 影响 一生  人物二,-1
TRAIN_SENT_ID_279517,汪绿萍,汪紫菱,汪紫菱 主要 成员名单 : 萧蔷 饰 汪绿萍 － － － 姐姐,人物二 主要 成员名单  萧蔷 饰 人物一    姐姐,1
TRAIN_SENT_ID_270557,全真七子,王重阳,防御 路线 走 王重阳 ， 全真七子 相应 点灯 。,防御 路线 走 人物二  人物一 相应 点灯,-1
TRAIN_SENT_ID_267534,扈成,扈三娘,60204 扈成 飞天 虎 697362 独 龙冈 扈家庄 的 长子 ， 扈三娘 之兄 ， 因其妹 被俘 ， 与 梁山泊 约定 退出 三庄 同盟 。,人物一 飞天 虎  独 龙冈 扈家庄 长子  人物二 之兄  因其妹 被俘  梁山泊 约定 退出 三庄 同盟,1
TRAIN_SENT_ID_271507,孟优,孟获,却说 孟获 与 祝融 夫人 并 孟优 、 带来 洞主 、 一切 宗党 在 别 帐 饮酒 。,却说 人物二 祝融 夫人 人物一  带来 洞主  宗党 帐 饮酒,1
TRAIN_SENT_ID_254265,张顺,张横,庄前 李俊 、 张横 、 张顺 ， 下水 过来 ， 被 庄上 乱箭 射 来 ， 不能 下手 ， 戴宗 、 白胜 ， 只 在 对岸 呐喊 。,庄前 李俊  人物二  人物一  下水 过来  庄上 乱箭 射  不能 下手  戴宗  白胜  对岸 呐喊,1
TRAIN_SENT_ID_268894,司徒静,司徒剑南,她 随后 想出 一计 ， 在 万人敌 司徒剑南 等 人 的 帮助 下 梁君卓 误以为 司徒静 有 在 夜间 咬人 喝血 的 臆病 ， 梁君卓 收回 了 求亲 的 请求 。,想出 一计  万人敌 人物二 帮助 梁君卓 误以为 人物一 夜间 咬人 喝血 臆病  梁君卓 收回 求亲 请求,1
TRAIN_SENT_ID_277763,邵素雯,邵维钟,婚后 ， 他们 育有 两子 两女 ， 长子 邵维铭 、 次女 邵素雯 、 三女 邵素云 及 幼子 邵维钟 。,婚后  育有 两子 两女  长子 邵维铭  次女 人物一  三女 邵素云 幼子 人物二,1
TRAIN_SENT_ID_275229,李梅儿,上官兰心,封 上官兰心 为 敬贤妃 ， 金碧瑶 为 英德 妃 ， 李梅儿 为 李选侍 ， 桦 儿兰心 “ 母子 ” 告别 。,封 人物二 敬贤妃  金碧瑶 英德 妃  人物一 李选侍  桦 儿兰心  母子  告别,1
TRAIN_SENT_ID_250357,赵飞燕,赵合德,赵飞燕 ， 赵合德 ： 几个 红颜 成 薄命,人物一  人物二  几个 红颜 成 薄命,1
TRAIN_SENT_ID_282924,骆玉笙,韩永禄,西河 鼓书 曲种 名家 : 刘宝全 白云鹏 阎秋霞 骆玉笙 韩永禄 孙书 筠 王文禄 金万昌 籍薇,西河 鼓书 曲种 名家  刘宝全 白云鹏 阎秋霞 人物一 人物二 孙书 筠 王文禄 金万昌 籍薇,-1
TRAIN_SENT_ID_252851,颜回,孔子,列子 · 仲尼 第四 部分 : 列子 · 仲尼 原文 : 子夏问 孔子 曰 ( 1 ) ： “ 颜回 之为 人 奚若 ( 2 ) ？ ”,列子  仲尼 第四 部分  列子  仲尼 原文  子夏问 人物二 曰      人物一 之为 奚若,-1
TRAIN_SENT_ID_259939,周志文,周志康,巨声 队 ： 林师杰 、 许廷坚 、 刘 威煌 、 周志文 、 周志康 、 邓小巧 、 何晶晶 、 何雁诗,巨声 队  林师杰  许廷坚  刘 威煌  人物一  人物二  邓小巧  何晶晶  何雁诗,1
TRAIN_SENT_ID_267588,骆赢,骆羽,第二局 骆羽 / 骆赢 展开 反击 ， 两人 加强 攻势 ， 开局 6 - 3 领先 。,第二局 人物二  人物一 展开 反击  两人 加强 攻势  开局    领先,1
TRAIN_SENT_ID_274693,张卫彝,张卫健,说 毕 张卫健 就 转身 返回 ICU ， 未几 胞弟 张卫彝 亦 到达 医院 ， 直接 进入 病房 。,说 毕 人物二 转身 返回   未几 胞弟 人物一 到达 医院  直接 进入 病房,1
TRAIN_SENT_ID_250623,鲁西西,皮皮鲁,郑渊洁 完全 以 一个 开放 的 态度 支持 “ 皮皮鲁 ” “ 鲁西西 ” 和 《 魔方 大厦 》 的 结合 。,郑渊洁 完全 一个 开放 态度 支持  人物二   人物一   魔方 大厦  结合,1
TRAIN_SENT_ID_251849,梅超风,黄药师,黄药师 VS 梅超风 ： 情感 与 形象,人物二  人物一  情感 形象,-1
TRAIN_SENT_ID_257231,张子静,张爱玲,寻访 张子静 ， 再见 张爱玲,寻访 人物一  再见 人物二,1
TRAIN_SENT_ID_264212,陈真,霍元甲,"龙象 迷踪 内容简介 : 燕氏 迷踪 拳 , 起于 宋代 卢俊义 、 传 与 燕青 , 待 燕青 归隐 后 方才 开派 流传 ; 后 又 兴于 津门 大侠 霍元甲 和 陈真 。",龙象 迷踪 内容简介  燕氏 迷踪 拳  起于 宋代 卢俊义  传 燕青  燕青 归隐 方才 开派 流传  兴于 津门 大侠 人物二 人物一,-1
TRAIN_SENT_ID_263355,蔡夫人,蔡瑁,刘表 死后 被 蔡夫人 、 蔡瑁 立 为 荆州 之主 ， 并 投降 南下 的 曹操 。,刘表 死后 人物一  人物二 立 荆州 之主  投降 南下 曹操,1
TRAIN_SENT_ID_251847,梅超风,黄药师,武眠风 出处 : （ 出自 《 射雕 英雄传 》 第 14 回 桃花 岛主 ， 黄药师 吩咐 梅超风 做 3 件 事 的 第 2 项 ） 。,武眠风 出处   出自  射雕 英雄传   回 桃花 岛主  人物二 吩咐 人物一 做  件 事  项,-1
TRAIN_SENT_ID_271504,孟优,孟获,761 兀突 骨 762 孟香 763 孟优 764 孟获 765 祝融 夫人 766 木鹿 大王 767 朵思 大王 768 沙摩柯 769 金环三结,兀突 骨  孟香  人物一  人物二  祝融 夫人  木鹿 大王  朵思 大王  沙摩柯  金环三结,1
TRAIN_SENT_ID_259766,李偲菘,李伟菘,李偲菘 、 李伟菘 的 《 眼泪 成诗 》 对 孙燕姿 很 有 默契 的 掌握 ， 展现 了 歌手 在 歌唱 上 的 音乐 才华 。,人物一  人物二  眼泪 成诗  孙燕姿 默契 掌握  展现 歌手 歌唱 音乐 才华,1
TRAIN_SENT_ID_266311,贾源,贾演,其中 贾府 就 占 了 2 个 - - 宁国公 贾演 、 荣国公 贾源 。,贾府 占    宁国公 人物二  荣国公 人物一,1
TRAIN_SENT_ID_251821,梅超风,黄药师,黄药师 出现 救 了 梅超风 ， 黄蓉 离开 。,人物二 出现 救 人物一  黄蓉 离开,-1
TRAIN_SENT_ID_276112,黄立成,黄立行,康熙 来 了 20070102 洛城 男孩 进化论 黄立成 黄立行 李玖哲,康熙  洛城 男孩 进化论 人物一 人物二 李玖哲,1
TRAIN_SENT_ID_250349,赵飞燕,赵合德,赵飞燕 姊娣 （ 含 赵合德 ）,人物一 姊娣  含 人物二,1
TRAIN_SENT_ID_261144,武元庆,武则天,但 武元庆 、 武元爽 对 杨氏 不孝 ， 所以 ， 武则天 取 韩国夫人 之子 贺兰敏之 “ 为士 获 获后 ， 赐氏武 ， 袭封 。,人物一  武元爽 杨氏 不孝   人物二 取 韩国夫人 之子 贺兰敏之  为士 获 获后  赐氏武  袭封,1
TRAIN_SENT_ID_271221,和硕温恪公主,和硕敦恪公主,他们 是 ： 怡 亲王 胤 祥 、 和硕温恪公主 、 和硕敦恪公主 。,怡 亲王 胤 祥  人物一  人物二,1
TRAIN_SENT_ID_256984,仲由,孔子,仲由 政治 才干 : 孔子 设案 授徒 ， 辟 德行 、 政事 、 言语 、 文学 四科 ， 而 子路 是 政事 科之 优异者 。,人物一 政治 才干  人物二 设案 授徒  辟 德行  政事  言语  文学 四科  子路 政事 科之 优异者,-1
TRAIN_SENT_ID_281652,黄铁良,侯宝林,文革 开始 后 ， 一天 黄铁良 在 劝业场 附近 买 了 张载 有 《 侯宝林 何许人也 》 的 《 红鹰 战报 》 寄给 了 师父 。,文革  一天 人物一 劝业场 附近 买 张载  人物二 何许人也   红鹰 战报  寄给 师父,-1
TRAIN_SENT_ID_261679,程英,陆无双,1 、 杨过 、 程英 、 陆无双 铲除 了 情花 ， 造成 ：,杨过  人物一  人物二 铲除 情花  造成,1
TRAIN_SENT_ID_264554,胡青牛,张无忌,在 被 张无忌 救活 以后 ， 胡青牛 夫妇 决定 驾车 离开 蝴蝶谷 。,人物二 救活 以后  人物一 夫妇 决定 驾车 离开 蝴蝶谷,-1
