sent_id,entity1,entity2,sent,processed_sent,label
TRAIN_SENT_ID_268930,韩非,荀子,老子 孔子 墨子 孟子 庄子 荀子 韩非 王充 范缜 李贽 黄宗羲 顾炎武 王夫之,老子 孔子 墨子 孟子 庄子 人物二 人物一 王充 范缜 李贽 黄宗羲 顾炎武 王夫之,-1
TRAIN_SENT_ID_250667,鲁西西,皮皮鲁,（ 合 ） 皮皮鲁 恋着 鲁西西,合  人物二 恋着 人物一,1
TRAIN_SENT_ID_262211,尤二姐,尤三姐,实际上 ， 小说 已经 写明 ， 像 尤二姐 、 尤三姐 等 确实 是 受到 了 贾府 贾珍 、 贾琏 、 贾蓉 等 花花公子 的 攻击 。,实际上  小说 已经 写明  人物一  人物二 确实 贾府 贾珍  贾琏  贾蓉 花花公子 攻击,1
TRAIN_SENT_ID_261561,南宫敬叔,孟懿子,孟僖于 卒 ， 孟懿子 与 南宫敬叔 拜 孔子 为师 。,孟僖于 卒  人物二 人物一 拜 孔子 为师,1
TRAIN_SENT_ID_251876,曹薰铉,李昌镐,第三轮 ： 李昌镐 1 : 0 刘小光 赵治勋 1 : 0 聂卫平 马晓春 1 : 0 小林觉 曹薰铉 1 : 0 片冈聪,第三轮  人物二    刘小光 赵治勋    聂卫平 马晓春    小林觉 人物一    片冈聪,-1
TRAIN_SENT_ID_257453,姜昆,马季,甲 ： 马季 的 、 姜昆 的 、 常宝华 的 、 高英培 的 ， 我 都 听 过 。,甲  人物二  人物一  常宝华  高英培  听,-1
TRAIN_SENT_ID_251843,梅超风,黄药师,金庸 江湖 手册 内容提要 : 黄药师 凭 什么 爱上 梅超风 ？,金庸 江湖 手册 内容提要  人物二 爱上 人物一,-1
TRAIN_SENT_ID_256998,蒋雯娟,蒋雯丽,蒋雯娟 是 蒋雯丽 的 姐姐 兼 经纪人 。,人物一 人物二 姐姐 兼 经纪人,1
TRAIN_SENT_ID_257232,艾欧里亚,艾俄洛斯,第十六章 艾俄洛斯 和 艾欧里亚,第十六章 人物二 人物一,1
TRAIN_SENT_ID_268917,司徒静,司徒剑南,司徒静 被 发现 藏 在 司徒府 ， 文章 文媚儿 联手 上 司徒府 要 人 ， 司徒剑南 出面 为 妹妹 顶罪 入狱 。,人物一 发现 藏 司徒府  文章 文媚儿 联手 司徒府  人物二 出面 妹妹 顶罪 入狱,1
TRAIN_SENT_ID_250609,鲁西西,皮皮鲁,比起 皮皮鲁 来说 ， 鲁西西 要 乖巧 许多 ， 但是 她 也 有 许多 惊奇 的 冒险 哦 ， 有些 还 背着 那个 古灵精怪 的 调皮 哥哥 偷偷地 进行 呢 。,比起 人物二  人物一 乖巧  惊奇 冒险  背着 古灵精怪 调皮 哥哥 偷偷地 进行,1
TRAIN_SENT_ID_255387,罗成,秦琼,其 讲述 了 北平 王之子 罗成 为 伸张正义 ， 率 罗家 军 与 秦琼 、 程咬金 等 聚义 瓦岗寨 。,讲述 北平 王之子 人物一 伸张正义  率 罗家 军 人物二  程咬金 聚义 瓦岗寨,1
TRAIN_SENT_ID_250080,武敦儒,武修文,主要 原因 与 郭靖 专心 守城 ， 而 无暇 教 武敦儒 、 武修文 练武 相关 。,主要 原因 郭靖 专心 守城  无暇 教 人物一  人物二 练武 相关,1
TRAIN_SENT_ID_259666,公孙胜,罗真人,% 仙风道骨 ： 公孙胜 、 罗真人 齐 上阵 ， 法术 攻击 增加 6,仙风道骨  人物一  人物二 齐 上阵  法术 攻击 增加,-1
TRAIN_SENT_ID_269501,李国豪,李香凝,李海泉 与 何爱瑜 之孙计 有 ： 长孙 李国豪 、 次孙 李凯 豪 、 三孙 李伟 豪 、 四孙 李嘉 豪 、 孙女 李香凝 等 。,李海泉 何爱瑜 之孙计  长孙 人物一  次孙 李凯 豪  三孙 李伟 豪  四孙 李嘉 豪  孙女 人物二,1
TRAIN_SENT_ID_253851,赵合德,赵飞燕,古代 女人 的 发型 变化多端 ， 如直发 （ 张丽华 ） 、 短发 （ 梁 绿珠 ） 、 卷发 （ 赵合德 ） 、 束发 （ 赵飞燕 ） 、 盘发 （ 甄妃 ） 等 。,古代 女人 发型 变化多端  如直发  张丽华   短发  梁 绿珠   卷发  人物一   束发  人物二   盘发  甄妃,1
TRAIN_SENT_ID_253821,赵合德,赵飞燕,当然 赵飞燕 、 赵合德 本人 也 有 责任 ， 本身 就是 坏 女人 ， 但是 主要 责任 还 在 君王 身上 。,人物二  人物一 责任  坏 女人  主要 责任 君王 身上,1
TRAIN_SENT_ID_251861,曹薰铉,李昌镐,曹薰铉 执白 4 目半胜 李昌镐,人物一 执白  目半胜 人物二,-1
TRAIN_SENT_ID_259736,李偲菘,李伟菘,作曲 ： 李伟菘 、 李偲菘 演唱 ： 萧 骊珠 绝代 双雄 片尾曲 : 萧 孋 珠 - 独上 西楼,作曲  人物二  人物一 演唱  萧 骊珠 绝代 双雄 片尾曲  萧 孋 珠  独上 西楼,1
TRAIN_SENT_ID_250089,武敦儒,武修文,师兄 ： 武修文 、 武敦儒,师兄  人物二  人物一,1
TRAIN_SENT_ID_259676,公孙胜,罗真人,第五十三回 戴宗 智取 公孙胜 ， 李逵 斧劈 罗真人,第五十三回 戴宗 智取 人物一  李逵 斧劈 人物二,-1
TRAIN_SENT_ID_263546,林逸,杨明,校花 的 贴身 高手 杨明 : 林逸 的 师父 ， 前作 《 很纯 很 暧昧 》 的 主角 。,校花 贴身 高手 人物二  人物一 师父  前作  很纯 暧昧  主角,-1
TRAIN_SENT_ID_252991,颜回,孔子,孔子 掷 金试 颜回,人物二 掷 金试 人物一,-1
TRAIN_SENT_ID_249315,陆无双,程英,表妹 ： 陆无双 程英,表妹  人物一 人物二,1
TRAIN_SENT_ID_273698,姜子牙,元始天尊,元始天尊 借 姜子牙 之口 敕封 诸天 正神 。,人物二 人物一 之口 敕封 诸天 正神,-1
TRAIN_SENT_ID_258138,刘星,夏雪,亲人 ： 夏祥 （ 父亲 ） 、 刘梅 （ 现任 老婆 ） 、 玛丽 （ 前妻 ） 、 刘星 、 夏雨 （ 儿子 ） 、 夏雪 （ 女儿 ）,亲人  夏祥  父亲   刘梅  现任 老婆   玛丽  前妻   人物一  夏雨  儿子   人物二  女儿,1
TRAIN_SENT_ID_257236,艾欧里亚,艾俄洛斯,于是 ， 她 亲自 来到 艾欧里亚 岛 ， 命令 艾俄洛斯 放出 诸风 ， 使 埃涅阿斯 的 船队 彻底 倾覆 。,亲自 来到 人物一 岛  命令 人物二 放出 诸风  埃涅阿斯 船队 彻底 倾覆,1
TRAIN_SENT_ID_275526,王小虎,赵本山,王小虎 ： （ 朝 赵本山 ） 师傅 ， 太 对不起 了 ， 你 那 忽悠 智商 太低 了 ， 跟 你 也 学不着 啥 玩意儿 ！,人物一   人物二  师傅  太 对不起  忽悠 智商 太低  学不着 玩意儿,-1
TRAIN_SENT_ID_279034,沙条爱歌,沙条绫香,沙条 广树 （ 沙条爱歌 与 沙条绫香 的 父亲 ） ： 东地宏树,沙条 广树  人物一 人物二 父亲   东地宏树,1
TRAIN_SENT_ID_256884,仲由,孔子,孔子 对 公冶长 、 南容 的 评论 ， 客观 、 实际 ， 对 仲由 的 赞许 ， 体现 一种 开放 精神 。,人物二 公冶长  南容 评论  客观  实际  人物一 赞许  体现 一种 开放 精神,-1
TRAIN_SENT_ID_257474,姜昆,马季,主持人 ： 姜昆 、 马季 、 刘晓庆 、 王景愚,主持人  人物一  人物二  刘晓庆  王景愚,-1
TRAIN_SENT_ID_256826,孙周,孙淳,孙周 、 孙淳 （ 下 ）,人物一  人物二,1
TRAIN_SENT_ID_253081,颜回,孔子,再 问 ： “ 孔子 和 颜回 的 快乐 在 什么 地方 ？ ”,问   人物二 人物一 快乐 地方,-1
TRAIN_SENT_ID_250341,赵飞燕,赵合德,赵飞燕 · 赵合德,人物一  人物二,1
TRAIN_SENT_ID_249286,陆无双,程英,郭襄 如此 ， 程英 如此 ， 陆无双 如此 ， 唯独 公孙绿萼 不敢 ， 她 不敢 用 她 的 后半生 去 思念 杨过 。,郭襄  人物二  人物一  唯独 公孙绿萼 不敢  不敢 后半生 思念 杨过,1
TRAIN_SENT_ID_253121,颜回,孔子,也就是说 ， 对于 孔子 、 颜回 这样 品德高尚 的 人 来说 ， 快乐 不 在于 物质享受 ， 而 在于 精神 情操 的 追求 。,也就是说  人物二  人物一 品德高尚  快乐 物质享受  精神 情操 追求,-1
TRAIN_SENT_ID_253890,赵合德,赵飞燕,赵飞燕 ， 赵合德 ： 几个 红颜 成 薄命,人物二  人物一  几个 红颜 成 薄命,1
TRAIN_SENT_ID_258120,孙少安,孙兰香,孙玉厚 在 路遥 的 《 平凡 的 世界 》 里 是 一个 伟大 的 父亲 ， 有 孙少安 、 孙少平 、 孙 兰花 和 孙兰香 四个 优秀 的 子女 。,孙玉厚 路遥  平凡 世界  里 一个 伟大 父亲  人物一  孙少平  孙 兰花 人物二 四个 优秀 子女,1
TRAIN_SENT_ID_262233,尤二姐,尤三姐,尤氏 因 丧事 繁忙 ， 请 母亲 和 妹妹 尤二姐 、 尤三姐 来 帮忙 。,尤氏 丧事 繁忙  请 母亲 妹妹 人物一  人物二 帮忙,1
TRAIN_SENT_ID_264566,胡青牛,张无忌,最后 ， 胡青牛 夫妇 被 金花婆婆 所杀 ， 张无忌 发现 两人 遗体 后 将 其 埋藏 。,最后  人物一 夫妇 金花婆婆 所杀  人物二 发现 两人 遗体 埋藏,-1
TRAIN_SENT_ID_251533,陈辅,陈靖仇,"陈靖仇 在 陈辅 的 督促 下 , 身不由己 的 开始 了 寻找 神器 的 旅程 … …",人物二 人物一 督促  身不由己 寻找 神器 旅程,-1
TRAIN_SENT_ID_275683,欧阳娣娣,欧阳妮妮,爸爸 回家 做 功课 作者简介 : 欧阳龙 ， 深情 顾家 的 天蝎座 ， 欧阳妮妮 ( 11 岁 ) 、 欧阳娜娜 ( 9 岁 ) 、 欧阳娣娣 ( 3 岁 ) 的 爸爸 。,爸爸 回家 做 功课 作者简介  欧阳龙  深情 顾家 天蝎座  人物二   岁   欧阳娜娜   岁   人物一   岁  爸爸,1
TRAIN_SENT_ID_253910,赵合德,赵飞燕,话 说 到 这个 地步 ， 赵飞燕 不敢 再 接口 ， 赵合德 也 没法 继续 ， 姐妹俩 狠狠 地 盯 着 对方 ， 半晌 没有 做声 。,话 说 地步  人物二 不敢 接口  人物一 没法 继续  姐妹俩 狠狠 盯  半晌 没有 做声,1
TRAIN_SENT_ID_273675,姜子牙,元始天尊,封神演义 阐教 : 姜子牙 元始天尊 ： 阐教 教主 ， 居于 昆仑山 玉虚宫 。,封神演义 阐教  人物一 人物二  阐教 教主  居于 昆仑山 玉虚宫,-1
TRAIN_SENT_ID_264681,柳承莞,柳承范,基本 信息 : 《 柏林 》 是 由 柳承莞 执导 ， 河正宇 、 韩石圭 、 柳承范 、 全智贤 主演 的 一部 韩国 谍战 动作片 。,基本 信息   柏林  人物一 执导  河正宇  韩石圭  人物二  全智贤 主演 一部 韩国 谍战 动作片,1
TRAIN_SENT_ID_264945,贾元春,贾宝玉,贾元春 赏赐 端午节 礼 ， 贾宝玉 同 薛宝钗 的 一样 ， 宝黛 生疑 。,人物一 赏赐 端午节 礼  人物二 薛宝钗  宝黛 生疑,1
TRAIN_SENT_ID_255302,卫夫人,王羲之,其 行书 妙处 ， 颇 得 王羲之 法 ， 少 加以 学 ， 亦 卫夫人 之流 也 。,行书 妙处  颇 人物二 法  少 学  人物一 之流,-1
TRAIN_SENT_ID_268446,和硕敦恪公主,和硕温恪公主,生一子 二女 ： 和硕 怡亲 王允祥 、 和硕温恪公主 、 和硕敦恪公主 。,生一子 二女  和硕 怡亲 王允祥  人物二  人物一,1
TRAIN_SENT_ID_257479,姜昆,马季,马季 、 姜昆 、 李金斗 、 侯耀文 、 牛群 、 冯巩 等 众多 相声 表演艺术家 和 部分 获奖 演员 为 观众们 表演 了 精彩 的 节目 。,人物二  人物一  李金斗  侯耀文  牛群  冯巩 众多 相声 表演艺术家 部分 获奖 演员 观众们 表演 精彩 节目,-1
TRAIN_SENT_ID_274626,石破天,史小翠,随后 众人 离开 后 石破天 也 找 不到 史小翠 、 白阿绣 ， 便 也 乘船 离开 紫烟 岛 。,众人 离开 人物一 找 不到 人物二  白阿绣  便 乘船 离开 紫烟 岛,-1
TRAIN_SENT_ID_259667,公孙胜,罗真人,② 明 施耐庵 《 水浒 》 第五十三回 《 戴宗 二取 公孙胜 李逵 独劈 罗真人 》 童子 答道 ： “ 真人 坐在 云 床上 养性 。 ”,② 明 施耐庵  水浒  第五十三回  戴宗 二取 人物一 李逵 独劈 人物二  童子 答道   真人 坐在 云 床上 养性,-1
TRAIN_SENT_ID_257462,姜昆,马季,唐杰忠 ， 汉族 ， 相声 名家 ， 长期 与 马季 、 姜昆 等 相声 名家 合作 ， 代表作品 有 《 虎口 遐想 》 、 《 新兵 小传 》 、 《 找 舅舅 》 等 。,唐杰忠  汉族  相声 名家  长期 人物二  人物一 相声 名家 合作  代表作品  虎口 遐想    新兵 小传    找 舅舅,-1
TRAIN_SENT_ID_277433,魏国夫人,柳奭,唐高宗 大怒 ， 有意 废后 ， 并 严禁 魏国夫人 入宫 ， 将 柳奭 贬为 遂 州 刺史 。,唐高宗 大怒  有意 废后  严禁 人物一 入宫  人物二 贬为 遂 州 刺史,1
TRAIN_SENT_ID_255438,罗成,秦琼,程咬金 和 秦琼 率先 高飞 ， 单单 罗成 留下来 了 。,程咬金 人物二 率先 高飞  单单 人物一 留下来,1
TRAIN_SENT_ID_259804,李偲菘,李伟菘,作词 ： 卡斯 作曲 ： 李伟菘 、 李偲菘,作词  卡斯 作曲  人物二  人物一,1
TRAIN_SENT_ID_253018,颜回,孔子,6.8 孔子 要 跟 颜回 学 打坐,人物二 人物一 学 打坐,-1
TRAIN_SENT_ID_256867,仲由,孔子,孔子 与 仲由,人物二 人物一,-1
TRAIN_SENT_ID_259692,游颖,游娴,游娴 与 游颖 相处 间 ， 虽然 经常 地 斗气 ， 但 始终 血脉相连 ， 姊妹 情不经 不觉 间 萌芽 起来 。,人物二 人物一 相处 间  经常 斗气  始终 血脉相连  姊妹 情不经 不觉 间 萌芽 起来,1
TRAIN_SENT_ID_284218,莫小贝,莫小宝,亲人 ： 师兄 莫小宝 （ 赵旭 饰 ） 师兄 周敦儒 （ 许可 饰 ） 师兄 陆一鸣 （ 易容 前 ， 王超 饰 易容 后 ， 于又川 ） 师妹 莫小贝 （ 王莎莎 饰 ）,亲人  师兄 人物二  赵旭 饰  师兄 周敦儒  许可 饰  师兄 陆一鸣  易容 前  王超 饰 易容  于又川  师妹 人物一  王莎莎 饰,1
TRAIN_SENT_ID_252968,颜回,孔子,颜回 随 孔子 在 陈 、 蔡 期间 绝粮 七天 ， 子贡 费 了 许多 周折 才 买 回 一石米 。,人物一 人物二 陈  蔡 期间 绝粮 七天  子贡 费 周折 买 回 一石米,-1
TRAIN_SENT_ID_259949,周志文,周志康,周志文 周志康,人物一 人物二,1
TRAIN_SENT_ID_250427,赵飞燕,赵合德,然而 ， 赵氏 姐妹 （ 赵飞燕 、 赵合德 ） 的 入宫 ， 改变 了 整个 后宫 的 局面 。,赵氏 姐妹  人物一  人物二  入宫  改变 整个 后宫 局面,1
TRAIN_SENT_ID_274064,南宫敬叔,孔子,遂 退而谓 南宫敬叔 ① 曰 ： “ 今 孔子 先圣 之嗣 ， 自弗父 何以 来 ， 世有 德 让 ， 天所祚 也 。,遂 退而谓 人物一 ① 曰   人物二 先圣 之嗣  自弗父  世有 德  天所祚,-1
TRAIN_SENT_ID_265116,杨志刚,郭靖宇,（ 导演 ： 郭靖宇 主演 ： 王 珞丹 ， 杨志刚 ， 刘威 ， 史可 ） 2012 - 2 - 23 上映,导演  人物二 主演  王 珞丹  人物一  刘威  史可       上映,1
TRAIN_SENT_ID_252682,颜回,孔子,孔子 听见 了 ， 果然 把 颜回 叫 进屋 去 ， 问道 ： “ 你 为什么 一人 快乐 ？ ”,人物二 听见  人物一 进屋  问道   一人 快乐,-1
TRAIN_SENT_ID_257802,林平之,岳不群,林平之 与 岳不群 反目 后 ， 劳德诺 出现 力邀 其往 嵩山 共谋 。,人物一 人物二 反目  劳德诺 出现 力邀 其往 嵩山 共谋,-1
TRAIN_SENT_ID_261646,宋小宝,赵本山,"赵本山 收徒 , 组建 “ 赵家 班 ” 红 、 董三毛 、 宋小宝 、 小 鹏飞 、 田娃 、 红孩 。",人物二 收徒  组建  赵家 班  红  董三毛  人物一  鹏飞  田娃  红孩,-1
TRAIN_SENT_ID_259803,李偲菘,李伟菘,《 蒲公英 》 是 李恭 在 李伟菘 ， 李偲菘 两位 恩师 指导 下 的 第一首 作品 。,蒲公英  李恭 人物二  人物一 两位 恩师 指导 第一首 作品,1
TRAIN_SENT_ID_273627,马阔海,马青山,召唤 人 ： 马阔海 、 李子 、 马青山 、 柯胜,召唤  人物一  李子  人物二  柯胜,1
TRAIN_SENT_ID_277737,王银钏,王宝钏,《 薛平贵 与 王宝钏 》 饰演 ； 王银钏,薛平贵 人物二  饰演  人物一,1
TRAIN_SENT_ID_253838,赵合德,赵飞燕,但 在 赵飞燕 、 赵合德 姐妹 入宫 后 而 受 排挤 失宠 ， 求 供养 太后 于 长信 宫 。,人物二  人物一 姐妹 入宫 受 排挤 失宠  求 供养 太后 长信 宫,1
TRAIN_SENT_ID_252449,颜回,孔子,颜回 偷食 原文 : 孔子 穷乎 陈 、 蔡 之间 ， 藜 羹 不 斟 ， 七日 不尝粒 ， 昼寝 。,人物一 偷食 原文  人物二 穷乎 陈  蔡 之间  藜 羹 斟  七日 不尝粒  昼寝,-1
TRAIN_SENT_ID_251838,梅超风,黄药师,幸得 梅超风 舍身 护师 ， 替 黄药师 接 了 西毒 全力 一击 的 蛤蟆功 。,幸得 人物一 舍身 护师  人物二 接 西毒 全力 一击 蛤蟆功,-1
TRAIN_SENT_ID_255445,罗成,秦琼,第五十七回 秦琼 建祠 报雄信 罗成 奋勇 擒五王,第五十七回 人物二 建祠 报雄信 人物一 奋勇 擒五王,1
TRAIN_SENT_ID_273622,马阔海,马青山,召唤 人 ： 马阔海 （ 主要 铠甲 召唤 人 ） 、 小 李子 、 马青山 、 柯胜 （ 电影版 ）,召唤  人物一  主要 铠甲 召唤   李子  人物二  柯胜  电影版,1
TRAIN_SENT_ID_278010,严贡生,严监生,王冕 周进 范进 严监生 和 严贡生 马二 先生 匡超 人 杜少卿 公祭 泰伯 祠 王玉辉 四贤,王冕 周进 范进 人物二 人物一 马二 先生 匡超 杜少卿 公祭 泰伯 祠 王玉辉 四贤,1
TRAIN_SENT_ID_262723,周厚恩,周厚安,育有 一男一女 ， 分别 是 周厚安 和 周厚恩 。,育有 一男一女  人物二 人物一,1
TRAIN_SENT_ID_262275,尤二姐,尤三姐,姓 贾 的 ， 你 跟 害死 秦可卿 的 贾珍 、 害死 尤二姐 的 贾琏 、 害死 贾迎春 的 孙绍祖 、 甚至 害死 尤三姐 的 柳湘莲 等 “ 皮肤 滥淫者 ” 有 什么 两样 ？,姓 贾  害死 秦可卿 贾珍  害死 人物一 贾琏  害死 贾迎春 孙绍祖  害死 人物二 柳湘莲  皮肤 滥淫者  两样,1
TRAIN_SENT_ID_269443,刘伟,马季,《 送别 》 表演者 ： 刘伟 、 马季,送别  表演者  人物一  人物二,-1
TRAIN_SENT_ID_277582,上官兰心,上官梅儿,上官梅儿 （ 女一号 ） ： 上官兰心 的 结拜 姐妹 ， 聪明伶俐 乖巧 ， 外表美丽 ， 蕙质兰心 ， 琴艺 高超 。,人物二  女一号   人物一 结拜 姐妹  聪明伶俐 乖巧  外表美丽  蕙质兰心  琴艺 高超,1
TRAIN_SENT_ID_255394,罗成,秦琼,监军 伍魁 的 儿子 伍胜 路过 砸 场子 ， 秦琼 和 罗成 帮忙 打败 了 伍胜 。,监军 伍魁 儿子 伍胜 路过 砸 场子  人物二 人物一 帮忙 打败 伍胜,1
TRAIN_SENT_ID_266131,李昌镐,曹薰铉,李昌镐 执白 1 又 1 / 4 子胜 曹薰铉,人物一 执白     子胜 人物二,-1
TRAIN_SENT_ID_269421,刘伟,马季,马季 赵炎 刘伟 冯巩 王金宝 演出 本,人物二 赵炎 人物一 冯巩 王金宝 演出,-1
TRAIN_SENT_ID_265100,杨志刚,郭靖宇,导演 ： 郭靖宇 主演 ： 李雪健 、 吴越 、 黄海波 、 杨志刚 、 杨梅,导演  人物二 主演  李雪健  吴越  黄海波  人物一  杨梅,1
TRAIN_SENT_ID_255407,罗成,秦琼,秦琼 、 罗成 。,人物二  人物一,1
TRAIN_SENT_ID_262203,陈靖仇,陈辅,陈靖仇 的 师伯 ， 陈辅 的 师兄 ， 鬼谷 道术 造诣 极高 。,人物一 师伯  人物二 师兄  鬼谷 道术 造诣 极高,-1
TRAIN_SENT_ID_251599,穆春,穆弘,土豪 恶霸 穆弘 穆春,土豪 恶霸 人物二 人物一,1
TRAIN_SENT_ID_252896,颜回,孔子,这一 奇迹 般的 发现 ， 将 孔子 的 游兴 振至 高潮 ， 忙呼 颜回 观望 。,这一 奇迹 发现  人物二 游兴 振至 高潮  忙呼 人物一 观望,-1
TRAIN_SENT_ID_272646,卫少儿,卫青,舅舅 卫青 没想到 . 母亲 卫少儿 更是 想 都 没敢 想 过 。,舅舅 人物二 没想到  母亲 人物一 更是 想 没敢 想,1
TRAIN_SENT_ID_256832,孙周,孙淳,《 智慧 风暴 》 由 王冀邢 执导 ， 孙周 、 孙淳 、 高惠彬 、 王卫国 、 赵小锐 、 智一桐 等 人 主演 的 电视 连续剧 。,智慧 风暴  王冀邢 执导  人物一  人物二  高惠彬  王卫国  赵小锐  智一桐 主演 电视 连续剧,1
TRAIN_SENT_ID_277825,傅清,傅恒,侄 ： 富察 · 广成 、 富察 · 傅文 、 富察 · 傅清 、 富察 · 傅恒 。,侄  富察  广成  富察  傅文  富察  人物一  富察  人物二,1
TRAIN_SENT_ID_253819,赵合德,赵飞燕,① 皇太后 前 与 女弟 昭仪 ： 成帝 皇后 赵飞燕 和 其 妹昭仪 赵合德 。,① 皇太后 前 女弟 昭仪  成帝 皇后 人物二 妹昭仪 人物一,1
TRAIN_SENT_ID_257791,林平之,岳不群,毕竟 就算 岳不群 真的 刺伤 过 林平之 ， 又 总 不会 故意 让 他 知道 来害 女儿 。,毕竟 人物二 真的 刺伤 人物一  总 不会 故意 知道 来害 女儿,-1
TRAIN_SENT_ID_270581,全真七子,王重阳,王重阳 与 全真七子 （ 长春 子 丘处机 、 玉阳子 王处一 、 广宁子 郝大通 、 清净 散人 孙不二 、 长生子 刘处玄 、 长真子 谭处端 、 丹阳 子 马钰 ）,人物二 人物一  长春 子 丘处机  玉阳子 王处一  广宁子 郝大通  清净 散人 孙不二  长生子 刘处玄  长真子 谭处端  丹阳 子 马钰,-1
TRAIN_SENT_ID_253886,赵合德,赵飞燕,当然 ， 赵飞燕 和 赵合德 两 姊妹 还 不能 称其为 妓女 ， 但殊 归 同途 。,人物二 人物一 两 姊妹 不能 称其为 妓女  但殊 同途,1
TRAIN_SENT_ID_270806,伍天锡,伍云召,伍天锡 ， 伍云召 族弟 ， 使 二百斤 短棒 混天 镋 。,人物一  人物二 族弟  二百斤 短棒 混天 镋,1
TRAIN_SENT_ID_262217,尤二姐,尤三姐,由 尤二姐 一 心想 重新做人 ， 而 尤三姐 认为 贾琏 不过 是 在 “ 花马 吊 嘴 ” 。,人物一 心想 重新做人  人物二 认为 贾琏  花马 吊 嘴,1
TRAIN_SENT_ID_260719,王重阳,全真七子,【 王重阳 】 肯定 把 这个 方法 告诉 了 【 全真七子 】 。,人物一  肯定 方法 告诉  人物二,-1
TRAIN_SENT_ID_267582,吴魏,吴狄,"伍媚 回国 结婚 了 , 她 的 丈夫 是 一个 和 吴魏 性格 相貌 略 相同 的 人 , 这 一点 , 吴狄 发现 了 !",伍媚 回国 结婚  丈夫 一个 人物一 性格 相貌 略 相同  一点  人物二 发现,1
TRAIN_SENT_ID_253897,赵合德,赵飞燕,赵昭仪 （ 赵合德 ） ， 原 与其 姐 赵飞燕 同封 婕妤 ， 后晋 为昭仪 。,赵昭仪  人物一   原 姐 人物二 同封 婕妤  后晋 为昭仪,1
TRAIN_SENT_ID_249054,吕洞宾,韩湘子,汉族 民间 则 专以汉 钟离 、 张果老 、 铁拐李 、 韩湘子 、 曹国舅 、 吕洞宾 、 蓝采和 、 何仙姑 等 八仙 为 “ 八洞 神仙 ” 。,汉族 民间 专以汉 钟离  张果老  铁拐李  人物二  曹国舅  人物一  蓝采和  何仙姑 八仙  八洞 神仙,-1
TRAIN_SENT_ID_273681,姜子牙,元始天尊,元始天尊 决定 借 商周 大战 完成 封神 大计 ， 他 的 三个 门徒 — — 姜子牙 、 申公豹 、 玉鼎 真人 ， 各领 师命 下山 。,人物二 决定 商周 大战 完成 封神 大计  三个 门徒   人物一  申公豹  玉鼎 真人  各领 师命 下山,-1
TRAIN_SENT_ID_259786,李偲菘,李伟菘,作词 ： 李煜 作曲 ： 李伟菘 、 李偲菘,作词  李煜 作曲  人物二  人物一,1
TRAIN_SENT_ID_269930,沈春阳,赵本山,2012 - 02 - 19 ： 樱桃 （ 38 集 ） 「 沈春阳 ， 宋小宝 ， 赵本山 ， 小 沈阳 」,樱桃   集   人物一  宋小宝  人物二  沈阳,-1
TRAIN_SENT_ID_271294,吕祖俭,吕祖谦,吕夷简 家族 成员 : 吕夷简 的 儿子 吕公著 ， 亦 官至 宰相 ， 七 世孙 吕祖谦 、 吕祖俭 都 是 南宋 著名 大儒 。,吕夷简 家族 成员  吕夷简 儿子 吕公著  官至 宰相  七 世孙 人物二  人物一 南宋 著名 大儒,1
TRAIN_SENT_ID_269404,刘伟,马季,马季 - - 姜昆 、 赵炎 、 刘伟 、 冯巩 、 笑林 、 王谦祥 、 李增瑞 、 韩兰成 、 刘喜尧 、 彭子,人物二   姜昆  赵炎  人物一  冯巩  笑林  王谦祥  李增瑞  韩兰成  刘喜尧  彭子,-1
TRAIN_SENT_ID_267456,唐继虞,唐继尧,唐继尧 的 堂弟 唐继虞 ， 看上 了 这匹 高头 黄马 ， 派 副官 向 欧阳 沂 要求 “ 割爱 价让 ” ， 遭到 欧阳 沂 的 拒绝 。,人物二 堂弟 人物一  看上 这匹 高头 黄马  派 副官 欧阳 沂 要求  割爱 价让   遭到 欧阳 沂 拒绝,1
TRAIN_SENT_ID_259673,公孙胜,罗真人,《 水浒传 》 第五 三回 ： “ 罗真人 问 公孙胜 道 ： ‘ 此 二位 何来 ？,水浒传  第五 三回   人物二 问 人物一 道   二位 何来,-1
TRAIN_SENT_ID_264519,岳云鹏,郭德纲,郭德纲 、 于谦 、 岳云鹏 、 高峰 、 孔云龙 、 孙越 等 德云社 演员 工作 生活 记录 。,人物二  于谦  人物一  高峰  孔云龙  孙越 德云社 演员 工作 生活 记录,-1
TRAIN_SENT_ID_254277,张顺,张横,西南 水寨 张横 ， 张顺 两个 也 顺着 三人 ， 十分 撺掇 ！,西南 水寨 人物二  人物一 两个 三人  十分 撺掇,1
TRAIN_SENT_ID_267449,唐继虞,唐继尧,王洁修 及习 自强 与 唐继虞 友好 甚笃 ， 三人 结为 金兰 ， 从而 成为 唐继尧 的 心腹 将领 。,王洁修 及习 自强 人物一 友好 甚笃  三人 结为 金兰  成为 人物二 心腹 将领,1
TRAIN_SENT_ID_262246,尤二姐,尤三姐,统治者 二十几 人 ( 有人 算了 说 是 三十三 人 ) ， 其他 都 是 奴隶 ， 三百多个 ， 鸳鸯 、 司棋 、 尤二姐 、 尤三姐 等等 。,统治者 二十几  有人 算了 说 三十三   奴隶  三百多个  鸳鸯  司棋  人物一  人物二,1
TRAIN_SENT_ID_273671,姜子牙,元始天尊,/ 昆仑 派 据说 是 师承 玉清 元始天尊 ， 世界 上 是 有 姜子牙 所 创 ， 是 凡间 除 天龙 教 以外 实力 最强 ， 历史 最 悠久 的 门派 之一 。,昆仑 派 据说 师承 玉清 人物二  世界 人物一 创  凡间 天龙 教 以外 实力 最强  历史 悠久 门派,-1
TRAIN_SENT_ID_266134,李昌镐,曹薰铉,双方 阵容 都 异常 鼎盛 ， 韩国队 以 李昌镐 领衔 ， 曹薰铉 、 李世石 、 安祚永 、 金东烨 、 洪性志 为 大将 。,双方 阵容 异常 鼎盛  韩国队 人物一 领衔  人物二  李世石  安祚永  金东烨  洪性志 大将,-1
