sent_id,entity1,entity2,sent,processed_sent,label
TRAIN_SENT_ID_256554,周武,周文,于是 ， 他 用 宝剑 猛 砍 宫柱 ， 直到 宝剑 折断 ， 才 长叹一声 说 ： “ 书烧 了 ， 剑 折 了 ， 周文 王和 周武 王 的 文武 治国 之道 ， 今天 夜里 全没 了 。 ”,宝剑 猛 砍 宫柱  宝剑 折断  长叹一声 说   书烧  剑 折  人物二 王和 人物一 王 文武 治国 之道  今天 夜里 全没,1
TRAIN_SENT_ID_268992,韩非,荀子,《 诗经 》 《 史记 》 《 庄子 》 《 老子 》 《 论语 》 《 孟子 》 《 韩非 子 》 《 楚辞 》 《 左传 》 《 荀子 》,诗经   史记   庄子   老子   论语   孟子   人物一 子   楚辞   左传   人物二,-1
TRAIN_SENT_ID_266666,邓鸣贺,邓鸣璐,儿童节目 ： 邓鸣贺 、 邓鸣璐 。,儿童节目  人物一  人物二,1
TRAIN_SENT_ID_264266,陈真,霍元甲,“ 洪熙官 、 方世玉 、 黄飞鸿 、 叶问 、 霍元甲 、 陈真 去 摆下 十八 铜 人阵 ! ”,洪熙官  方世玉  黄飞鸿  叶问  人物二  人物一 摆下 十八 铜 人阵,-1
TRAIN_SENT_ID_260690,王重阳,全真七子,孙不二 （ 1119 — 1182 ） 法名 不二 ， 号 清净 散人 ， 或 王重阳 与 全真七子 称 孙仙姑 。,孙不二      法名 不二  号 清净 散人  人物一 人物二 称 孙仙姑,-1
TRAIN_SENT_ID_251417,李瀚章,李鸿章,李瀚章 怂恿 张荫桓 出面 ， 打着 繁荣 芜湖 商埠 的 旗号 ， 向 李鸿章 献策 ， 依靠 朝廷 的 力量 ， 令 镇江 米市 迁至 芜湖 。,人物一 怂恿 张荫桓 出面  打着 繁荣 芜湖 商埠 旗号  人物二 献策  依靠 朝廷 力量  令 镇江 米市 迁至 芜湖,1
TRAIN_SENT_ID_255293,卫夫人,王羲之,所以 王羲之 和 王舒 没事 就 在 桑落洲 远眺 南京 ， 看 长江 和 湖上 的 大雁 ， 卫夫人 有 一群 驯化 了 的 野生 大雁 ， 也 就是 家鹅 。,人物二 王舒 没事 桑落洲 远眺 南京  长江 湖上 大雁  人物一 一群 驯化 野生 大雁  家鹅,-1
TRAIN_SENT_ID_250081,武敦儒,武修文,人们 往往 把 武敦儒 、 武修文 以及 耶律齐 与 杨过相 比 ， 因为 他们 是 同辈 的 。,往往 人物一  人物二 耶律齐 杨过相  同辈,1
TRAIN_SENT_ID_250374,赵飞燕,赵合德,汉成帝 刘骜 与 赵飞燕 、 赵合德,汉成帝 刘骜 人物一  人物二,1
TRAIN_SENT_ID_250396,赵飞燕,赵合德,皇帝 专宠 赵合德 后 ， 赵飞燕 就 在 后宫 找 男宠 。,皇帝 专宠 人物二  人物一 后宫 找 男宠,1
TRAIN_SENT_ID_254260,张顺,张横,主要 荡寇 功绩 ： 生擒 张横 张顺,主要 荡寇 功绩  生擒 人物二 人物一,1
TRAIN_SENT_ID_265561,张崇基,张崇德,首次 执导 的 MV 《 偿还 》 ， 由 香港 歌手 张崇基 、 张崇德 主唱 。,首次 执导   偿还   香港 歌手 人物一  人物二 主唱,1
TRAIN_SENT_ID_251867,曹薰铉,李昌镐,横纲 李昌镐 ( 韩国 ) 曹薰铉 ( 韩国 ),横纲 人物二  韩国  人物一  韩国,-1
TRAIN_SENT_ID_279082,程英,黄药师,后来 程英 、 杨过 、 陆无双 遭遇 李莫愁 ， 黄药师 便 帮助 解围 。,后来 人物一  杨过  陆无双 遭遇 李莫愁  人物二 便 帮助 解围,-1
TRAIN_SENT_ID_255202,赵海燕,赵本山,《 有病 没病 》 （ 表演 ： 赵本山 、 赵海燕 、 李正春 ）,有病 没病   表演  人物二  人物一  李正春,-1
TRAIN_SENT_ID_259953,周志文,周志康,"演出 嘉宾 ： 何紫慧 , 何雁诗 , 周志文 , 周志康 , 许廷铿 , 刘 威煌",演出 嘉宾  何紫慧  何雁诗  人物一  人物二  许廷铿  刘 威煌,1
TRAIN_SENT_ID_253865,赵合德,赵飞燕,大致 写 的 是 汉成帝 与 后妃 赵飞燕 赵合德 的 事情 。,大致 写 汉成帝 后妃 人物二 人物一 事情,1
TRAIN_SENT_ID_274068,南宫敬叔,孔子,孔子 和 南宫敬叔 扬鞭 启程 ， 踏上 了 观周 之路 。,人物二 人物一 扬鞭 启程  踏上 观周 之路,-1
TRAIN_SENT_ID_252627,颜回,孔子,孔子 为什么 很 欣赏 颜回,人物二 欣赏 人物一,-1
TRAIN_SENT_ID_250584,鲁西西,皮皮鲁,皮皮鲁 和 鲁西西 有 许多 好玩 的 经历 ， 都 收集 在 30 卷 《 郑渊洁 童话 全集 》 里 .,人物二 人物一 好玩 经历  收集  卷  郑渊洁 童话 全集  里,1
TRAIN_SENT_ID_266218,蓝提斯,谢加图,其 性格 沈默寡言 ， 相比 兄长 谢加图 的 稳重 ， 蓝提斯 显得 与世无争 。,性格 沈默寡言  相比 兄长 人物二 稳重  人物一 显得 与世无争,1
TRAIN_SENT_ID_275199,陈有汉,陈有庆,塔帕 朗西 以及 李嘉诚 、 谢国民 、 马化腾 、 陈有汉 、 陈有庆 、 马介璋 等 一批 最 杰出 的 潮商 。,塔帕 朗西 李嘉诚  谢国民  马化腾  人物一  人物二  马介璋 一批 杰出 潮商,1
TRAIN_SENT_ID_266147,李昌镐,曹薰铉,本届 杯赛 刘昌赫 第一个 出场 ， 先后 战胜 了 曹薰铉 、 李世石 等 高手 一路 连胜 ， 已 实现 了 13 连胜 ， 正在 向 李昌镐 的 纪录 逼近 。,本届 杯赛 刘昌赫 第一个 出场  先后 战胜 人物二  李世石 高手 一路 连胜  实现  连胜  正在 人物一 纪录 逼近,-1
TRAIN_SENT_ID_276220,姜丽文,姜文杰,姜丽文 姜文杰 秦沛,人物一 人物二 秦沛,1
TRAIN_SENT_ID_274173,牧野枣,牧野遥,女儿 （ 四姐妹 ） ： 牧野遥 、 牧野枣 、 牧野晶 、 牧野冬,女儿  四姐妹   人物二  人物一  牧野晶  牧野冬,1
TRAIN_SENT_ID_253103,颜回,孔子,《 庄子 · 让 王 》 ： “ 孔子 穷 於 陈 蔡 之间 ， 七日 不火食 ， 藜 羹 不 糁 ， 颜色 甚惫 ， 而 弦歌 於 室 ， 颜回 择菜 。 ”,庄子  王    人物二 穷 於 陈 蔡 之间  七日 不火食  藜 羹 糁  颜色 甚惫  弦歌 於 室  人物一 择菜,-1
TRAIN_SENT_ID_260686,王重阳,全真七子,防御 路线 走 王重阳 ， 全真七子 相应 点灯 。,防御 路线 走 人物一  人物二 相应 点灯,-1
TRAIN_SENT_ID_266157,李昌镐,曹薰铉,韩国队 李昌镐 领衔 ， 曹薰铉 、 刘昌赫 、 睦镇硕 、 崔圭丙 、 洪钟贤 、 郑寿铉 参赛 。,韩国队 人物一 领衔  人物二  刘昌赫  睦镇硕  崔圭丙  洪钟贤  郑寿铉 参赛,-1
TRAIN_SENT_ID_261641,宋小宝,赵本山,赵本山 宋小宝,人物二 人物一,-1
TRAIN_SENT_ID_261567,南宫敬叔,孟懿子,孔子 私学 的 学生 主要 是 由 平民 所 组成 的 ﹐ 据近 人 考证 ﹐ 孔子 学生 真正 来自 贵族 的 ﹐ 只有 南宫敬叔 ﹑ 司马 牛 和 孟懿子 等 少数几 人 。,孔子 私学 学生 主要 平民 组成 ﹐ 据近 考证 ﹐ 孔子 学生 真正 贵族 ﹐ 人物一  司马 牛 人物二 少数几,1
TRAIN_SENT_ID_255449,罗成,秦琼,罗成 的 好 ， 秦琼 最 懂 。,人物一  人物二 懂,1
TRAIN_SENT_ID_275840,陆无双,李莫愁,曾斗 之 人 ： 李莫愁 、 公孙止 、 陆无双 、 程英 、 洪凌波,曾斗  人物二  公孙止  人物一  程英  洪凌波,-1
TRAIN_SENT_ID_264217,陈真,霍元甲,陈真 不但 身手 高超 ， 且 在 师父 霍元甲 突然 被 人 害死 后 ， 从 日本 回国 来 为 师父 申冤 ， 为 精 武馆 血耻 正名 。,人物一 身手 高超  师父 人物二 突然 害死  日本 回国 师父 申冤  精 武馆 血耻 正名,-1
TRAIN_SENT_ID_261668,程英,陆无双,陆无双 改为 陆展元 与 何沅君 之女 ， 且 与 程英 并非 表姊妹 。,人物二 改为 陆展元 何沅君 之女  人物一 表姊妹,1
TRAIN_SENT_ID_258817,张无忌,殷离,除了 赵敏之 外 ， 张无忌 与 峨嵋派 周芷若 、 表妹 殷离 和 波斯 圣女 小昭 也 都 有 千丝万缕 的 爱意 。,赵敏之 外  人物一 峨嵋派 周芷若  表妹 人物二 波斯 圣女 小昭 千丝万缕 爱意,1
TRAIN_SENT_ID_270782,徐若瑄,徐佩瑜,徐佩瑜 关系 : 台湾 艺人 徐若瑄 的 姐姐 。,人物二 关系  台湾 艺人 人物一 姐姐,1
TRAIN_SENT_ID_263407,武修文,武敦儒,师兄 ： 武敦儒 、 武修文,师兄  人物二  人物一,1
TRAIN_SENT_ID_252499,颜回,孔子,朱裳 轶事 典故 : 朱裳 向往 尧舜 盛世 ， 佩服 孔子 、 颜回 间 的 纯真 情谊 ， 痛恨 邪恶 ， 正直 不 阿 。,朱裳 轶事 典故  朱裳 向往 尧舜 盛世  佩服 人物二  人物一 间 纯真 情谊  痛恨 邪恶  正直,-1
TRAIN_SENT_ID_275970,马光陆,高占全,豫西 风情 （ 于林青 、 高占全 、 马光陆 曲 ）,豫西 风情  于林青  人物二  人物一 曲,-1
TRAIN_SENT_ID_252413,颜回,孔子,本篇 里 有 数章 谈到 颜回 ， 孔子 对 他 的 评价 甚高 。,本篇 里 数章 谈到 人物一  人物二 评价 甚高,-1
TRAIN_SENT_ID_256951,仲由,孔子,及观 《 史 》 ， 见 孔子 厄于 陈 、 蔡 之间 ， 而 弦歌 之声 不绝 ， 颜渊 、 仲由 之徒 相与 问答 。,及观  史   见 人物二 厄于 陈  蔡 之间  弦歌 之声 不绝  颜渊  人物一 之徒 相与 问答,-1
TRAIN_SENT_ID_257031,洪敬尧,洪荣宏,其中 与 前妻 生 的 三个 儿子 洪荣宏 、 洪敬尧 以及 洪荣 良 ， 目前 皆 从事 音乐 以及 演艺 相关 工作 。,前妻 生 三个 儿子 人物二  人物一 洪荣 良  目前 皆 从事 音乐 演艺 相关 工作,1
TRAIN_SENT_ID_264873,田猛,田虎,在 烈山 堂堂 主 田猛 葬礼 上 随着 堂主 田虎 前来 吊唁 。,烈山 堂堂 主 人物一 葬礼 堂主 人物二 前来 吊唁,1
TRAIN_SENT_ID_252581,颜回,孔子,谢仁祖 答道 ： “ 坐 上 没有 孔子 ， 怎么 能 区别 出 颜回 呢 ？ ”,谢仁祖 答道   坐 没有 人物二  区别 出 人物一,-1
TRAIN_SENT_ID_275684,欧阳娣娣,欧阳妮妮,2013 / 04 / 20 动力火车 、 欧阳龙 、 傅娟 、 欧阳娜娜 、 欧阳妮妮 、 欧阳娣娣 、 澎 恰恰 、 王予柔,动力火车  欧阳龙  傅娟  欧阳娜娜  人物二  人物一  澎 恰恰  王予柔,1
TRAIN_SENT_ID_251826,梅超风,黄药师,黄药师 爱上 梅超风,人物二 爱上 人物一,-1
TRAIN_SENT_ID_274069,南宫敬叔,孔子,南宫敬叔 将 孔子 的 愿望 转告 国君 。,人物一 人物二 愿望 转告 国君,-1
TRAIN_SENT_ID_248967,吕洞宾,韩湘子,即汉 钟离 、 张果老 、 韩湘子 、 铁拐李 、 曹国舅 、 吕洞宾 、 蓝采和 及 何仙姑 。,即汉 钟离  张果老  人物二  铁拐李  曹国舅  人物一  蓝采和 何仙姑,-1
TRAIN_SENT_ID_261570,南宫敬叔,孟懿子,其 声望 远播 于 各 诸侯国 ， 其 弟子 子路 、 孟懿子 、 南宫敬叔 等 在 鲁国 已 小有名气 。,声望 远播 诸侯国  弟子 子路  人物二  人物一 鲁国 小有名气,1
TRAIN_SENT_ID_251816,梅超风,黄药师,在 梅超风 的 回忆 里 ， 黄药师 与 她 有 著 怎样 一段 若 有 似 无 的 情愫 ？,人物一 回忆 里  人物二 著 一段 似 情愫,-1
TRAIN_SENT_ID_269522,龚因心,龚如心,龚因心 是 香港 华懋 集团 主席 龚如心 胞妹 。,人物一 香港 华懋 集团 主席 人物二 胞妹,1
TRAIN_SENT_ID_272655,邢德全,邢夫人,【 邢德全 】 邢夫人 的 胞弟 ， 只知 吃喝嫖赌 ， 不务正业 ， 呆气 十,人物一  人物二 胞弟  只知 吃喝嫖赌  不务正业  呆气 十,1
TRAIN_SENT_ID_278137,裴元,孙思邈,只是 因为 跟随 孙思邈 的 缘故 ， 裴元 并未 入 医行 。,跟随 人物二 缘故  人物一 并未 入 医行,-1
TRAIN_SENT_ID_261689,程英,陆无双,杨过 为何 爱 小龙女 不爱 郭襄 、 郭 芙 、 程英 、 陆无双 、 公孙绿萼 、 耶律燕 ？,杨过 爱 小龙女 不爱 郭襄  郭 芙  人物一  人物二  公孙绿萼  耶律燕,1
TRAIN_SENT_ID_262182,陈靖仇,陈辅,陈辅 和 饕餮 同困伏 魔 山洞 ， 陈靖仇 月 河村 初遇 小雪 ， 6 月 （ 猜测 ） ， 黑 山镇 与 玉儿 相逢 。,人物二 饕餮 同困伏 魔 山洞  人物一 月 河村 初遇 小雪   月  猜测   黑 山镇 玉儿 相逢,-1
TRAIN_SENT_ID_253873,赵合德,赵飞燕,汉成帝 与 赵飞燕 、 赵合德 姐妹 ： 姐妹 共 一夫 由 佳话 成 悲剧,汉成帝 人物二  人物一 姐妹  姐妹 共 一夫 佳话 成 悲剧,1
TRAIN_SENT_ID_264555,胡青牛,张无忌,张无忌 悟性 : 胡青牛 见 他 悟性 奇高 … …,人物二 悟性  人物一 见 悟性 奇高,-1
TRAIN_SENT_ID_249321,陆无双,程英,1 、 杨过 、 程英 、 陆无双 铲除 了 情花 ， 造成 ：,杨过  人物二  人物一 铲除 情花  造成,1
TRAIN_SENT_ID_272040,韩慕侠,周恩来,周恩来 学习 之 余 ， 常穿 一件 长布 大褂 ， 去 韩慕侠 家里 学拳 练武 。,人物二 学习 余  常穿 一件 长布 大褂  人物一 家里 学拳 练武,-1
TRAIN_SENT_ID_255472,罗成,秦琼,只有 在 罗成 面前 ， 秦琼 才 不必 顾及 面子 ， 不必 强装 大度 ， 不必 犹豫 着 担心 得罪 对方 。,人物一 面前  人物二 不必 顾及 面子  不必 强装 大度  不必 犹豫 担心 得罪,1
TRAIN_SENT_ID_284542,范瑞亭,沈竹善,沈竹善 ― ― 冯振声 、 孙伯珍 、 卢德俊 、 张星 武 、 范瑞亭,人物二 ― ― 冯振声  孙伯珍  卢德俊  张星 武  人物一,-1
TRAIN_SENT_ID_250566,鲁西西,皮皮鲁,《 皮皮鲁 与 鲁西西 》 饰演 苏荀,人物二 人物一  饰演 苏荀,1
TRAIN_SENT_ID_253917,赵合德,赵飞燕,汉成帝 立 赵飞燕 为 皇后 ， 封 赵合德 为昭仪 。,汉成帝 立 人物二 皇后  封 人物一 为昭仪,1
TRAIN_SENT_ID_257451,姜昆,马季,她 在 相声 创作 上 尤为 突出 ， 马季 、 姜昆 、 李金斗 、 王谦祥 等 相声 名家 都 用 过 她 创作 的 段子 。,相声 创作 尤为 突出  人物二  人物一  李金斗  王谦祥 相声 名家 创作 段子,-1
TRAIN_SENT_ID_252844,颜回,孔子,人 或 问 孔子 曰 ： “ 颜回 何如 人 也 ？ ”,问 人物二 曰   人物一 何如,-1
TRAIN_SENT_ID_266209,范遥,赵敏,赵敏 将 六大 门派 门人 押 至 大都 万安 寺 ， 范遥 背叛 旧主 重返 明教 ， 救出 门派 众人 ； 灭绝师太 卒 ， 立 周芷若 为 新 峨嵋 掌门 。,人物二 六大 门派 门人 押 大都 万安 寺  人物一 背叛 旧主 重返 明教  救出 门派 众人  灭绝师太 卒  立 周芷若 新 峨嵋 掌门,-1
TRAIN_SENT_ID_259002,张苞,张绍,因 张飞 的 长子 张苞 早夭 ， 爵位 由 其次 子 张绍 继承 。,张飞 长子 人物一 早夭  爵位 子 人物二 继承,1
TRAIN_SENT_ID_279424,文媚儿,文蔷,司徒静 求 朱允 成全 司徒剑南 和 文蔷 ， 朱允 正要 赐婚 ， 遭 文媚儿 、 太后 、 文章 拼命 阻拦 。,司徒静 求 朱允 成全 司徒剑南 人物二  朱允 正要 赐婚  遭 人物一  太后  文章 拼命 阻拦,1
TRAIN_SENT_ID_276928,樊迟,孔子,孔子 毫不客气 地 指责 想学种 庄稼 和 种菜 的 樊迟 是 小人 ， 可以 清楚 地 看出 他 的 教育 思想 。,人物二 毫不客气 指责 想学种 庄稼 种菜 人物一 小人  清楚 看出 教育 思想,-1
TRAIN_SENT_ID_270825,伍天锡,伍云召,伍云召 和 伍天锡 都 死 在 扬州 玉玺 会上 ， 留下 独生子 伍登 过继 给 朱灿 。,人物二 人物一 死 扬州 玉玺 会上  留下 独生子 伍登 过继 朱灿,1
TRAIN_SENT_ID_268939,韩非,荀子,第六节 荀子 、 韩非 的 财政 思想,第六节 人物二  人物一 财政 思想,-1
TRAIN_SENT_ID_250625,鲁西西,皮皮鲁,《 皮皮鲁 与 鲁西西 》 等等 !,人物二 人物一,1
TRAIN_SENT_ID_277821,傅清,傅恒,傅清 ， 富察氏 ， 满洲 镶黄旗 人 ， 李荣保 次子 ， 傅恒 弟 也 。,人物一  富察氏  满洲 镶黄旗  李荣保 次子  人物二 弟,1
TRAIN_SENT_ID_255412,罗成,秦琼,只有 在 罗成 面前 ， 秦琼 不再 是 伪 ， 而是 轻轻松松 的 真 。,人物一 面前  人物二 不再 伪  轻轻松松 真,1
TRAIN_SENT_ID_253899,赵合德,赵飞燕,（ 西汉 美女 赵飞燕 、 赵合德 的 合称 ） : 二赵 ， 典故 名 ， 典出 《 汉书 》 卷 九十七 下 〈 外戚 列传 下 · 孝成 赵 皇后 〉 。,西汉 美女 人物二  人物一 合称   二赵  典故 名  典出  汉书  卷 九十七  外戚 列传  孝成 赵 皇后,1
TRAIN_SENT_ID_248979,吕洞宾,韩湘子,八仙 分别 为汉 钟离 、 张果老 、 韩湘子 、 铁拐李 、 吕洞宾 、 何仙姑 、 蓝采和 及 曹国舅 。,八仙 为汉 钟离  张果老  人物二  铁拐李  人物一  何仙姑  蓝采和 曹国舅,-1
TRAIN_SENT_ID_250371,赵飞燕,赵合德,红颜 祸水 — — 汉成帝 刘骜 皇后 赵飞燕 、 赵合德 姐妹,红颜 祸水   汉成帝 刘骜 皇后 人物一  人物二 姐妹,1
TRAIN_SENT_ID_250425,赵飞燕,赵合德,赵飞燕 和 赵合德 是 被 阳阿公主 收留 ， 并非 定陶 太后,人物一 人物二 阳阿公主 收留  定陶 太后,1
TRAIN_SENT_ID_265324,陈本,陈骞,这则 记载 同样 反映 出 陈骞 的 多谋 ， 陈本 的 无谋 。,这则 记载 同样 反映 出 人物二 多谋  人物一 无谋,1
TRAIN_SENT_ID_275890,王子豪,王子杰,16 . 王子豪 及 王子杰 （ 火柴 天堂 ） 15 分,人物一 人物二  火柴 天堂   分,1
TRAIN_SENT_ID_268462,单联全,冯一非,单联全 、 冯一非 、 江宏恩,人物一  人物二  江宏恩,-1
TRAIN_SENT_ID_274092,南宫敬叔,孔子,他 的 同学 兼 好友 南宫 元宸 出身 名门 ， 是 南宫敬叔 — — 那位 曾 与 孔子 一同 向 老子 问礼 之 人 — — 韵 后裔 ， 他 的 父母 均 在 政界 任重 职 。,同学 兼 好友 南宫 元宸 出身 名门  人物一   那位 人物二 一同 老子 问礼   韵 后裔  父母 均 政界 任重 职,-1
TRAIN_SENT_ID_282049,刘霓娜,刘诺一,（ 刘诺一 因 感冒 缺席 军训 部分 、 由 刘霓娜 代班 。 ）,人物二 感冒 缺席 军训 部分  人物一 代班,1
TRAIN_SENT_ID_274448,方如沁,方兰生,百里屠苏 、 方兰生 、 欧阳少恭 、 陵越 、 红玉 、 方如沁 、 孙月言 ： 晴雪,百里屠苏  人物二  欧阳少恭  陵越  红玉  人物一  孙月言  晴雪,1
TRAIN_SENT_ID_264593,凌波,凌音,草谷 觉得 没有 什么 不妥 ， 凌音 不用 为 凌波 承担 什么 。,草谷 觉得 没有 不妥  人物二 不用 人物一 承担,1
TRAIN_SENT_ID_276146,贾惜春,贾珍,简介 ： 贾惜春 是 贾珍 的 妹妹 ， 排行 为 贾府 四 小姐 。,简介  人物一 人物二 妹妹  排行 贾府 四 小姐,1
TRAIN_SENT_ID_252979,颜回,孔子,颜回 与 子贡 哪 一个 更 有福 ， 或许 孔子 也 会 偏向 子贡 吧 。,人物一 子贡 一个 更 有福  或许 人物二 会 偏向 子贡,-1
TRAIN_SENT_ID_252787,颜回,孔子,其六 ， 孔子 赞叹 颜回 一 闻师 教 就 能 立刻 去 实行 。,其六  人物二 赞叹 人物一 闻师 教 立刻 实行,-1
TRAIN_SENT_ID_272357,文殊广法天尊,金吒,李靖 ： “ 大儿子 叫 金吒 ， 拜 在 文殊广法天尊 门下 ； 二儿 名 木吒 ， 拜 普贤 真人 为师 。,李靖   大儿子 人物二  拜 人物一 门下  二儿 名 木吒  拜 普贤 真人 为师,-1
TRAIN_SENT_ID_252693,颜回,孔子,孔子 称 颜回 ： “ 用 之 则 行 ， 舍之则 藏 ， 惟 我 与 尔 有 是 夫 。 ”,人物二 称 人物一   行  舍之则 藏  惟 夫,-1
TRAIN_SENT_ID_274684,冯国纶,冯国经,· 冯汉柱 ： 利丰 第二代 接班人 ， 知名 商人 冯国经 、 冯国纶 之 父 。,冯汉柱  利丰 第二代 接班人  知名 商人 人物二  人物一 父,1
TRAIN_SENT_ID_275935,李华,寿昌公主,李华 同母 姐妹 : 寿昌公主 。,人物一 同母 姐妹  人物二,1
TRAIN_SENT_ID_270574,全真七子,王重阳,王重阳 在 陕西 修道 后 赴 山东 宁海 传道 ， 收 全真七子 。,人物二 陕西 修道 赴 山东 宁海 传道  收 人物一,-1
TRAIN_SENT_ID_251892,曹薰铉,李昌镐,韩国 代表 ： 曹薰铉 九段 、 徐奉洙 九段 、 徐能旭 九段 、 李昌镐 五段 、 刘昌赫 四段,韩国 代表  人物一 九段  徐奉洙 九段  徐能旭 九段  人物二 五段  刘昌赫 四段,-1
TRAIN_SENT_ID_264956,林一峰,林二汶,歌手 : 林一峰 林二汶,歌手  人物一 人物二,1
TRAIN_SENT_ID_283592,周晓方,孙钟秀,2.13 金志 权 ， 周晓方 ， 孙钟秀 ， “ 多项 选择 和 分布式 排序 ” ， 计算机 学报 ， 1989.4 ， PP241 - 248,金志 权  人物一  人物二   多项 选择 分布式 排序   计算机 学报,-1
TRAIN_SENT_ID_275831,陆无双,李莫愁,后来 程英 、 杨过 、 陆无双 遭遇 李莫愁 ， 黄药师 便 帮助 解围 。,后来 程英  杨过  人物一 遭遇 人物二  黄药师 便 帮助 解围,-1
TRAIN_SENT_ID_263347,蔡夫人,蔡瑁,刘表 个 蔡夫人 打算 将 刘琮 立 为 继承人 ， 而 蔡瑁 、 张允 则 为 其 党羽 。,刘表 人物一 打算 刘琮 立 继承人  人物二  张允 党羽,1
TRAIN_SENT_ID_249312,陆无双,程英,为 程英 陆无双 点 首歌,人物二 人物一 点 首歌,1
TRAIN_SENT_ID_273678,姜子牙,元始天尊,姜子牙 归国 封神 ， 太 上 无极 混元 教主 元始天尊 敕 曰 ： 呜呼 ！,人物一 归国 封神  太 无极 混元 教主 人物二 敕 曰,-1
TRAIN_SENT_ID_278784,万寿公主,广德公主,（ 唐宣宗 长女 ） : 万寿公主 ， 唐宣宗 长女 ， 母 元昭皇后 晁氏 ， 同 母弟 唐懿宗 ， 母妹 广德公主 。,唐宣宗 长女   人物一  唐宣宗 长女  母 元昭皇后 晁氏  母弟 唐懿宗  母妹 人物二,1
TRAIN_SENT_ID_257028,洪敬尧,洪荣宏,我们 约 好 常常 喜乐 08 旧情绵绵 : 林慧萍 、 洪荣宏 、 洪敬尧,约 常常 喜乐  旧情绵绵  林慧萍  人物二  人物一,1
TRAIN_SENT_ID_261695,程英,陆无双,洪凌波 得到 了 李莫愁 的 真传 ， 武艺 不 弱 ， 在 程英 、 陆无双 姊妹 之上 。,洪凌波 得到 李莫愁 真传  武艺 弱  人物一  人物二 姊妹 之上,1
TRAIN_SENT_ID_263357,蔡夫人,蔡瑁,刘表 和 蔡夫人 打算 立 刘琮 为 继承人 ， 而 蔡瑁 、 张允 则 为 其 党羽 。,刘表 人物一 打算 立 刘琮 继承人  人物二  张允 党羽,1
TRAIN_SENT_ID_252797,颜回,孔子,于是 真相大白 ， 颜回 又 得到 了 孔子 的 信任 ， 被誉为 “ 复圣 ” 。,真相大白  人物一 得到 人物二 信任  被誉为  复圣,-1
TRAIN_SENT_ID_249534,李蔡,李广,《 史记 . 李将军 列传 》 《 李广 传 》 均 称 ： 其 从弟 李蔡 被 “ 封 为 乐安 侯 ” 。,史记  李将军 列传   人物二 传  均 称  从弟 人物一  封 乐安 侯,1
TRAIN_SENT_ID_251873,曹薰铉,李昌镐,半决赛 ： 李昌镐 2 : 0 赵治勋 马晓春 2 : 1 曹薰铉,半决赛  人物二    赵治勋 马晓春    人物一,-1
TRAIN_SENT_ID_284535,杨长在,杨志光,杨志光 — — 杨长在,人物二   人物一,-1
TRAIN_SENT_ID_257044,洪敬尧,洪荣宏,我们 约 好 常常 喜乐 恋花 08 旧情绵绵 : 林慧萍 、 洪荣宏 、 洪敬尧,约 常常 喜乐 恋花  旧情绵绵  林慧萍  人物二  人物一,1
TRAIN_SENT_ID_252961,颜回,孔子,主要 的 ， 是 这篇 里面 ， 孔子 教 颜回 的 两个 方法 ： “ 心斋 ” 和 “ 坐忘 ” 。,主要  这篇 里面  人物二 教 人物一 两个 方法   心斋   坐忘,-1
TRAIN_SENT_ID_264550,胡青牛,张无忌,（ 2 ） 使用 谋略 ， 发动 胡青牛 的 “ 医仙 ” 、 张无忌 的 “ 医术 ” 或 天鹰 派 的 “ 疗伤 ” 均 可为 自己 或 另 一 玩家 解毒 ；,使用 谋略  发动 人物一  医仙   人物二  医术  天鹰 派  疗伤  均 可为 玩家 解毒,-1
TRAIN_SENT_ID_275723,赵一涵,赵一楠,小 名叫 牛牛 和 妞妞 ， 大 名叫 赵一楠 和 赵一涵 。,名叫 牛牛 妞妞  名叫 人物二 人物一,1
TRAIN_SENT_ID_257498,姜昆,马季,相声 ： 赵炎 、 马季 、 李文华 、 姜昆 、 侯耀文 、 石富宽 、 侯宝林 （ 已故 · 录像 ） 、 郭全宝 （ 已故 · 录像 ） 等 。,相声  赵炎  人物二  李文华  人物一  侯耀文  石富宽  侯宝林  已故  录像   郭全宝  已故  录像,-1
TRAIN_SENT_ID_274394,贾演,贾源,贾代修 一解 ： : 第一代 ： 宁国公 贾演 ， 荣国公 贾源 — — 名字 串连 成 “ 演源 ” ， 判词 是 纲领 ， 曲演 是 简演 ， 假语 村言 是 详演 。,贾代修 一解   第一代  宁国公 人物一  荣国公 人物二   名字 串连 成  演源   判词 纲领  曲演 简演  假语 村言 详演,1
TRAIN_SENT_ID_264369,曾国潢,曾国藩,满妹 （ 1830 — — 1839 ， 痘 殇 ） 曾国藩 家族 兄弟 后裔 : 曾国潢 系,满妹       痘 殇  人物二 家族 兄弟 后裔  人物一 系,1
TRAIN_SENT_ID_257816,林平之,岳不群,★ 东方不败 、 林平之 、 岳不群 手挽手 含泪 吐血 推荐 ：,★ 东方不败  人物一  人物二 手挽手 含泪 吐血 推荐,-1
TRAIN_SENT_ID_253848,赵合德,赵飞燕,这里 的 赵后 ， 就是 赵飞燕 ， 昭仪 就是 赵合德 。,赵后  人物二  昭仪 人物一,1
TRAIN_SENT_ID_259802,李偲菘,李伟菘,5.42009 《 潮流 盛典 》 与 林俊杰 羽泉 袁泉 李偲菘 李伟菘 王啸坤 一同 受邀 出席 并 压轴 出场 演唱 主题曲,潮流 盛典  林俊杰 羽泉 袁泉 人物一 人物二 王啸坤 一同 受邀 出席 压轴 出场 演唱 主题曲,1
TRAIN_SENT_ID_264826,陈永奎,陈永燊,周陈淑玲 — — 陈瑞 球 之 女儿 、 陈永奎 及 陈永燊 之妹,周陈淑玲   陈瑞 球 女儿  人物一 人物二 之妹,1
TRAIN_SENT_ID_264527,岳云鹏,郭德纲,喜欢 的 相声 艺人 ： 郭德纲 何云伟 曹云 金 岳云鹏 王自健,喜欢 相声 艺人  人物二 何云伟 曹云 金 人物一 王自健,-1
