sent_id,entity1,entity2,sent,processed_sent,label,sent_id.1,soft_match_score,soft_match
TRAIN_SENT_ID_259674,公孙胜,罗真人,③ 明 施耐庵 《 水浒 》 第五十三回 《 戴宗 二取 公孙胜 李逵 独劈 罗真人 》 和 那 老人 一同 吃 了 ， 算 还 面钱 ， 同出 店肆 ， 问 了 路途 。,③ 明 施耐庵  水浒  第五十三回  戴宗 二取 人物一 李逵 独劈 人物二  老人 一同 吃  算 面钱  同出 店肆  问 路途,1,,0.6801920774437132,0
TRAIN_SENT_ID_261166,王缙,王维,唐代宗 曾誉 之 为 “ 天下 文宗 ” （ 《 答 王缙 进 王维 集表 诏 》 ） 。,唐代宗 曾誉  天下 文宗    答 人物一 进 人物二 集表 诏,-1,,0.7054239312807719,-1
TRAIN_SENT_ID_255202,赵海燕,赵本山,《 有病 没病 》 （ 表演 ： 赵本山 、 赵海燕 、 李正春 ）,有病 没病   表演  人物二  人物一  李正春,1,,0.7551832681610471,1
TRAIN_SENT_ID_278053,郭麒麟,于谦,于谦 — — 郭麒麟 （ 郭德纲 之子 ） 、 冯阔洋 、 太 荣剑,人物二   人物一  郭德纲 之子   冯阔洋  太 荣剑,1,,0.706266971429189,-1
TRAIN_SENT_ID_274095,南宫敬叔,孔子,"遣 一车 二 马一 童一御 , 由 南宫敬叔 陪 孔子 前往 。",遣 一车 二 马一 童一御  人物一 陪 人物二 前往,1,,0.7344269993759337,1
TRAIN_SENT_ID_275989,朱竹云,朱竹清,2 人物 关系 : 星罗 帝国 皇子 未婚妻 是 朱竹云 （ 朱竹清 的 姐姐 ）,人物 关系  星罗 帝国 皇子 未婚妻 人物一  人物二 姐姐,-1,,0.7004032810529073,-1
TRAIN_SENT_ID_263407,武修文,武敦儒,师兄 ： 武敦儒 、 武修文,师兄  人物二  人物一,-1,,0.7123676339785258,-1
TRAIN_SENT_ID_264881,赵一楠,赵一涵,由于 这 一对 小宝贝 出生 在 牛 年 的 正月初一 ， 赵本山 就 给 他们 取小 名叫 牛牛 和 妞妞 ， 而 大名 就 叫 赵一楠 和 赵一涵 。,一对 小宝贝 出生 牛 年 正月初一  赵本山 取小 名叫 牛牛 妞妞  大名 人物一 人物二,-1,,0.6123108906405312,0
TRAIN_SENT_ID_252463,颜回,孔子,颜回 师从 孔子 : 颜庙 颜回 “ 年 十三 ， 入 孔子 之 门 ” 时 ， 孔子 聚徒 讲学 已达 十三年 之 久 。,人物一 师从 人物二  颜庙 人物一  年 十三  入 人物二 门  时  人物二 聚徒 讲学 已达 十三年 久,1,,0.7309900879859924,-1
TRAIN_SENT_ID_252907,颜回,孔子,颜回 之死 与 孔子 之生,人物一 之死 人物二 之生,1,,0.7459963877995809,-1
TRAIN_SENT_ID_278138,裴元,孙思邈,虽然 孙思邈 和 裴元 多方 努力 ， 但 当时 医术 之道 保密 的 也 有 不少 。,人物二 人物一 多方 努力  当时 医术 之道 保密 不少,1,,0.6865986472084409,0
TRAIN_SENT_ID_274355,和政公主,宁国公主,和政公主 的 姊姊 叫 宁国公主 。,人物一 姊姊 人物二,-1,,0.7766696969668071,-1
TRAIN_SENT_ID_270823,伍天锡,伍云召,李元霸 、 宇文成都 、 裴元庆 、 雄阔海 、 伍天锡 、 伍云召 、 罗成 、 杨林 、 魏文通,李元霸  宇文成都  裴元庆  雄阔海  人物一  人物二  罗成  杨林  魏文通,-1,,0.7580631006331671,1
TRAIN_SENT_ID_255318,卫夫人,王羲之,这些 记载 ， 都 提到 卫夫人 是 王羲之 的 书法 老师 及 卫夫人 书 法学 钟繇 。,记载  提到 人物一 人物二 书法 老师 人物一 书 法学 钟繇,1,,0.7153051455815633,-1
TRAIN_SENT_ID_259940,周志文,周志康,刘威 煌 、 陈鸿硕 、 周志文 、 周志康,刘威 煌  陈鸿硕  人物一  人物二,-1,,0.7688450256983439,-1
TRAIN_SENT_ID_249019,吕洞宾,韩湘子,韩湘子 羽化成仙 、 吕洞宾 卖 糍粑 、 张果老 和 他 的 纸 驴 、 蓝采和 收 妖 、 曹国舅 戏耍 绸缎 商 、 吕洞宾 戏 牡丹 、 八仙桌 的 由 来 … …,人物二 羽化成仙  人物一 卖 糍粑  张果老 纸 驴  蓝采和 收 妖  曹国舅 戏耍 绸缎 商  人物一 戏 牡丹  八仙桌,1,,0.8616104551724025,1
TRAIN_SENT_ID_281649,黄铁良,侯宝林,侯宝林 — — 贾振良 、 黄铁良 、 杨紫阳 、 马季 、 胡必达 、 殷培田 、 贾冀光 、 丁广泉 、 康达夫 、 李如刚 、 吴兆南 、 师胜杰 、 郝爱民,人物二   贾振良  人物一  杨紫阳  马季  胡必达  殷培田  贾冀光  丁广泉  康达夫  李如刚  吴兆南  师胜杰  郝爱民,1,,0.7003925343354543,1
TRAIN_SENT_ID_255306,卫夫人,王羲之,晋 王羲之 《 题 卫夫人 笔阵 图后 》 ： “ 每作 一点 ， 如 高峰 坠石 。 ”,晋 人物二  题 人物一 笔阵 图后    每作 一点  高峰 坠石,1,,0.7383767048517863,-1
TRAIN_SENT_ID_263385,武修文,武敦儒,武三娘 是 《 神雕侠侣 》 中 的 人物 ， 是 武三通 之妻 ， 武敦儒 和 武修文 的 母亲 ， 因为 替 武三通 吸毒 而 死 。,武三娘  神雕侠侣  中 人物  武三通 之妻  人物二 人物一 母亲  武三通 吸毒 死,-1,,0.6917938888072968,0
TRAIN_SENT_ID_274176,牧野枣,牧野遥,2 家庭 人物 : 女儿 （ 四姐妹 ） ： 牧野遥 、 牧野枣 、 牧野晶 、 牧野冬,家庭 人物  女儿  四姐妹   人物二  人物一  牧野晶  牧野冬,-1,,0.6577501509870801,0
TRAIN_SENT_ID_251603,穆春,穆弘,揭阳 镇 的 李俊 、 李立 、 穆弘 、 穆春 、 张横 、 张顺 、 童威 、 童猛 、 薛永 、 侯健 。,揭阳 镇 李俊  李立  人物二  人物一  张横  张顺  童威  童猛  薛永  侯健,-1,,0.6360224130607787,0
TRAIN_SENT_ID_266053,张学思,张学良,张学铭 、 张学思 给 张学良 的 信 ， 已托 朱五 送到 台湾 张学良 手中 ， 我 写 “ 为国 珍重 ， 善 自养 心 ； 前途 有望 ， 后会 可期 。 ”,张学铭  人物一 人物二 信  已托 朱五 送到 台湾 人物二 手中  写  为国 珍重  善 自养 心  前途 有望  后会 可期,-1,,0.7286248561881837,1
TRAIN_SENT_ID_279081,夏林菲,夏翼,萌 侦探 纪事 内容简介 : 萌 侦探 纪事 《 萌 侦探 纪事 1 》 : 本季 主角 ： 莫海音 、 罗洛 、 夏林菲 、 夏翼 、 优优 。,萌 侦探 纪事 内容简介  萌 侦探 纪事  萌 侦探 纪事    本季 主角  莫海音  罗洛  人物一  人物二  优优,-1,,0.7204578660783314,1
TRAIN_SENT_ID_283357,王力宏,王力德,王力德 ， 著名 音乐 人 王力宏 的 大哥 ， 曾 在 高中 阶段 一次 全美 联考 中 获得 第一 ， 因而 受到 老布什 的 接见 和 来信 。,人物二  著名 音乐 人物一 大哥  高中 阶段 一次 全美 联考 中 获得 第一  老布什 接见 来信,-1,,0.6783785436834607,0
TRAIN_SENT_ID_270566,全真七子,王重阳,陈抟 、 王重阳 、 全真七子 、 张三丰 ， 都 是 武功 出神入化 之 人 。,陈抟  人物二  人物一  张三丰  武功 出神入化,1,,0.7290651713098798,1
TRAIN_SENT_ID_262273,尤二姐,尤三姐,第六十五回 贾二舍 偷 娶 尤二姐 尤三姐 思嫁 柳 二郎 / 371,第六十五回 贾二舍 偷 娶 人物一 人物二 思嫁 柳 二郎,-1,,0.6415302753448486,0
TRAIN_SENT_ID_265117,杨志刚,郭靖宇,6 月 同王 珞丹 、 杨志刚 共同 出演 郭靖宇 新剧 《 红娘子 》 ， 颠覆 了 以往 霸气 威严 的 形象 ， 饰演 了 一个 忍辱负重 的 “ 窝囊 ” 老爷 。,月 同王 珞丹  人物一 共同 出演 人物二 新剧  红娘子   颠覆 以往 霸气 威严 形象  饰演 一个 忍辱负重  窝囊  老爷,-1,,0.7122014789354234,1
TRAIN_SENT_ID_274397,贾演,贾源,红楼 话 美食 序言 : 宁荣二 府 是 宁国公 贾演 和 荣国公 贾源 开创 的 基业 ， 至 贾宝玉 这 一代 已 历经 四世 。,红楼 话 美食 序言  宁荣二 府 宁国公 人物一 荣国公 人物二 开创 基业  贾宝玉 一代 历经 四世,-1,,0.7250132958094279,-1
TRAIN_SENT_ID_260723,王重阳,全真七子,王重阳 修道 十一年 ， 主要 在 山东 宁海 一带 传教 ， 共 收入 门 弟子 七位 ， 号 封 “ 全真七子 ” 。,人物一 修道 十一年  主要 山东 宁海 一带 传教  共 收入 门 弟子 七位  号 封  人物二,1,,0.6987421242963701,0
TRAIN_SENT_ID_266206,范遥,赵敏,汝阳王 爱女 赵敏 ， 自小 随 范遥 习武 ， 二人 情同 师徒 ， 直到 遇 教主 张无忌 才 恢复 身份 。,汝阳王 爱女 人物二  自小 人物一 习武  二人 情同 师徒  遇 教主 张无忌 恢复 身份,1,,0.6326384402456737,0
TRAIN_SENT_ID_282638,李未央,李敏之,受 李未央 救助 ， 帮忙 照顾 疯 了 的 李敏之 。,受 人物一 救助  帮忙 照顾 疯 人物二,-1,,0.6703689694404602,0
TRAIN_SENT_ID_259936,周志文,周志康,「 超级 巨声 队 」 由 孖 宝兄弟 周志文 、 周志康 上场 献唱 不了情 女曲 男唱 ， 可 有 不同 韵味 ？,超级 巨声 队  孖 宝兄弟 人物一  人物二 上场 献唱 不了情 女曲 男唱  不同 韵味,-1,,0.7183022782916114,1
TRAIN_SENT_ID_261639,宋小宝,赵本山,电视剧 《 爹妈 满院 》 由 艺术大师 赵本山 携 爱徒 小 沈阳 、 宋小宝 、 沈春阳 、 王小利 、 精美画册 ( 10 张 ),电视剧  爹妈 满院  艺术大师 人物二 携 爱徒 沈阳  人物一  沈春阳  王小利  精美画册   张,1,,0.6510271231333414,0
TRAIN_SENT_ID_275226,李梅儿,上官兰心,李梅儿 《 美人计 》 : 明光宗 朱常洛 即位 后 ， 他 梦想 与 深爱 的 妻子 上官兰心 双宿双飞 ， 白头到老 。,人物一  美人计   明光宗 朱常洛 即位  梦想 深爱 妻子 人物二 双宿双飞  白头到老,-1,,0.6117984964734032,0
TRAIN_SENT_ID_251410,李瀚章,李鸿章,李鸿章 扶植 米市 是 事实 ， 但 具体 操作者 是 张樵 野 （ 张荫桓 ） ， 同治 年间 他 就 结识 了 广东 督粮道 李瀚章 （ 鸿章 之兄 ） 。,人物二 扶植 米市 事实  具体 操作者 张樵 野  张荫桓   同治 年间 结识 广东 督粮道 人物一  鸿章 之兄,-1,,0.7138767639795939,-1
TRAIN_SENT_ID_255433,罗成,秦琼,5 、 炬 石 炼狱 ： 宇文成都 、 秦琼 、 罗成 、 伍云召 、 薛礼,炬 石 炼狱  宇文成都  人物二  人物一  伍云召  薛礼,-1,,0.7418016592661539,-1
TRAIN_SENT_ID_252406,颜回,孔子,孔子 信 颜回,人物二 信 人物一,1,,0.7595303853352865,-1
TRAIN_SENT_ID_276236,张阿生,郭靖,【 1207 年 】 江南七怪 北上 蒙古 寻 郭靖 ， 并斗 黑风双 煞 ， 陈玄风 死 ， 张阿生 死 ， 郭靖 拜 江南 六怪 为 师 。,年  江南七怪 北上 蒙古 寻 人物二  并斗 黑风双 煞  陈玄风 死  人物一 死  人物二 拜 江南 六怪 师,1,,0.688163697719574,0
TRAIN_SENT_ID_282095,周昂,周昕,周昕 、 周昂 之弟 。,人物二  人物一 之弟,-1,,0.7848464647928873,-1
TRAIN_SENT_ID_268838,骆羽,骆赢,混双 ： 何汉斌 / 包宜鑫 刘成 / 骆赢 李根 / 骆羽,混双  何汉斌  包宜鑫 刘成  人物二 李根  人物一,-1,,0.7396674116452535,-1
TRAIN_SENT_ID_268987,韩非,荀子,◎ 第六章 制度 与 人性 人 是 靠不住 的 孟子 ： 人性 向善 荀子 ： 善能 胜恶 韩非 ： 人性本恶 德治 还是 法治 没有 结论 的 争鸣,◎ 第六章 制度 人性 靠不住 孟子  人性 向善 人物二  善能 胜恶 人物一  人性本恶 德治 法治 没有 结论 争鸣,1,,0.7397833097548712,1
TRAIN_SENT_ID_256468,周武,周文,周文 王 访贤 遇到 姜太公 ， 遂 请 回拜 为 太师 ， 尊称 太公望 ， 周武 王继 位 又 尊称 师尚父 。,人物二 王 访贤 遇到 姜太公  遂 请 回拜 太师  尊称 太公望  人物一 王继 位 尊称 师尚父,-1,,0.7234090606371562,-1
TRAIN_SENT_ID_263361,武修文,武敦儒,师兄 ： 武修文 、 武敦儒,师兄  人物一  人物二,-1,,0.7123676339785258,-1
TRAIN_SENT_ID_266182,李昌镐,曹薰铉,第 12 届 LG 杯 第一轮 胜 李昌镐 ； 第二轮 胜 曹薰铉,届  杯 第一轮 胜 人物一  第二轮 胜 人物二,1,,0.6333725253740946,0
TRAIN_SENT_ID_273623,马阔海,马青山,召唤 人 ： 端木燕 （ 主要 铠甲 召唤 人 ） 、 马青山 、 马阔海 （ 电影版 ）,召唤  端木燕  主要 铠甲 召唤   人物二  人物一  电影版,-1,,0.701686544077737,1
TRAIN_SENT_ID_250586,鲁西西,皮皮鲁,皮皮鲁 和 鲁西西 演职员 表 : 皮皮鲁 和 鲁西西 演员表 : （ 资料 来源 ）,人物二 人物一 演职员 表  人物二 人物一 演员表   资料 来源,-1,,0.7484710852305094,-1
TRAIN_SENT_ID_255321,卫夫人,王羲之,三 、 王羲之 《 题 卫夫人 （ 笔阵 图 ） 后 》 的 “ 意在笔前 ” / 118,三  人物二  题 人物一  笔阵 图    意在笔前,1,,0.7636728644371032,-1
TRAIN_SENT_ID_277018,钟藜,钟馗,钟藜 电视剧 介绍 : 《 天师 钟馗 》 是 浙江 华策影视 公司出品 的 一部 古装 奇 《 天师 钟馗 》 ( 7 张 ),人物一 电视剧 介绍   天师 人物二  浙江 华策影视 公司出品 一部 古装 奇  天师 人物二    张,-1,,0.7156138448488145,1
TRAIN_SENT_ID_264875,田猛,田虎,烈山 堂堂 主 田猛 的 女儿 田言 也 是 因此 而 推断 她 定会 与 田虎 联手 。,烈山 堂堂 主 人物一 女儿 田言 推断 定会 人物二 联手,-1,,0.7078758804571061,1
TRAIN_SENT_ID_262237,尤二姐,尤三姐,第六十五回 贾二舍 偷 娶 尤二姐 / 尤三姐 思嫁 柳 二郎,第六十五回 贾二舍 偷 娶 人物一  人物二 思嫁 柳 二郎,-1,,0.6415302753448486,0
TRAIN_SENT_ID_275820,程万牛,程铁牛,娶 山 马关 总兵 裴仁基 之女 裴翠云 为妻 ， 后育 有 两子 ， 长子 程铁牛 ， 次子 程万牛 ， 一女 程美 环 。,娶 山 马关 总兵 裴仁基 之女 裴翠云 为妻  后育 两子  长子 人物二  次子 人物一  一女 程美 环,-1,,0.6291708137307849,0
TRAIN_SENT_ID_259681,蒋巍,高占全,蒋巍 徒弟 : 高占全 （ 1965 — ） ， 中国 导演 ， 笔名 柳弦梦 。,人物一 徒弟  人物二      中国 导演  笔名 柳弦梦,1,,0.6933594445387522,0
TRAIN_SENT_ID_264958,林一峰,林二汶,（ 林二汶 演唱 歌曲 ） : 《 至死不渝 》 是 由 林一峰 填词 ， 林二汶 谱曲 并 演唱 的 歌曲 。,人物二 演唱 歌曲    至死不渝  人物一 填词  人物二 谱曲 演唱 歌曲,-1,,0.6896441891079858,0
TRAIN_SENT_ID_255304,卫夫人,王羲之,卫夫人 的 启蒙 书教 ， 不仅 影响 了 王羲之 （ 羲 之 还有 一个 蒙师 ， 即 叔父 王廙 ） ， 也 造就 了 江夏 李氏 这一 书法 世家 。,人物一 启蒙 书教  影响 人物二  羲 一个 蒙师  叔父 王廙   造就 江夏 李氏 这一 书法 世家,1,,0.7028987067086356,1
TRAIN_SENT_ID_252387,颜回,孔子,随师 周游 : 起因 : 颜回 在 其 人生 的 第二个 阶段 ， 约 十四年 的 时间 是 随 孔子 周游列国 。,随师 周游  起因  人物一 人生 第二个 阶段  约 十四年 时间 人物二 周游列国,1,,0.7223444024721781,-1
TRAIN_SENT_ID_266698,龙幽,龙溟,对于 哥哥 龙溟 ， 龙幽 相当 依赖 。,哥哥 人物二  人物一 相当 依赖,-1,,0.7407427628835043,-1
TRAIN_SENT_ID_263649,尹澄,尹夏沫,尹夏沫 演艺 经历 : 与 尹澄 和 洛熙 参加 超级 巨星 ， 唱 《 黑猫 与 牛奶 》 彩虹 广场 上 唱 《 钻石 》,人物二 演艺 经历  人物一 洛熙 参加 超级 巨星  唱  黑猫 牛奶  彩虹 广场 唱  钻石,-1,,0.6366880550270989,0
TRAIN_SENT_ID_271262,马季,侯宝林,扒 马褂 表演 版本 : 高德明 、 绪 得 贵 、 侯宝林 、 郭启儒 、 刘宝瑞 、 王长友 、 王世臣 、 马季 、 赵振铎 、 赵世忠 、 李金斗 等 都 擅长 演此 曲目 。,扒 马褂 表演 版本  高德明  绪 贵  人物二  郭启儒  刘宝瑞  王长友  王世臣  人物一  赵振铎  赵世忠  李金斗 擅长 演此 曲目,1,,0.6940928853693462,0
TRAIN_SENT_ID_254266,张顺,张横,张顺 . （ 渔家 ， 张横 之弟 ） 三十六 天罡 星天败星 : 天败星 …,人物一   渔家  人物二 之弟  三十六 天罡 星天败星  天败星,-1,,0.765001404285431,-1
TRAIN_SENT_ID_272409,方兰生,方如沁,方如沁 和 孙月言 这边 正 担心 方兰生 ， 就 见 欧阳少恭 带 着 假巽芳 和 方兰生 回来 。,人物二 孙月言 正 担心 人物一  见 欧阳少恭 带 假巽芳 人物一 回来,-1,,0.6431959314005715,0
TRAIN_SENT_ID_279084,程英,黄药师,师父 ： 黄药师 赵韩樱子 版 程英 ( 9 张 ),师父  人物二 赵韩樱子 版 人物一   张,1,,0.7052390058835347,-1
TRAIN_SENT_ID_285613,韩笑,韩少云,韩笑 嗓音 甜美 ， 颇具 韩少云 大师 风范 。,人物一 嗓音 甜美  颇具 人物二 大师 风范,1,,0.7112218936284384,-1
TRAIN_SENT_ID_270811,伍天锡,伍云召,李元霸 VS 雄阔海 、 伍云召 、 伍天锡 ： 元霸 一马 冲入 营来 ， 正撞 着 伍云召 、 雄阔海 、 伍天锡 ， 三个 围拢 来 战元霸 。,李元霸  雄阔海  人物二  人物一  元霸 一马 冲入 营来  正撞 人物二  雄阔海  人物一  三个 围拢 战元霸,-1,,0.7155167063077291,-1
TRAIN_SENT_ID_264568,胡青牛,张无忌,1351 胡青牛 、 纪晓芙 、 简捷 、 薛公远 卒 ， 张无忌 初遇 朱元璋 等 明教 教众 。,人物一  纪晓芙  简捷  薛公远 卒  人物二 初遇 朱元璋 明教 教众,1,,0.7149384498596192,-1
TRAIN_SENT_ID_273675,姜子牙,元始天尊,封神演义 阐教 : 姜子牙 元始天尊 ： 阐教 教主 ， 居于 昆仑山 玉虚宫 。,封神演义 阐教  人物一 人物二  阐教 教主  居于 昆仑山 玉虚宫,1,,0.746601463783355,1
TRAIN_SENT_ID_261350,何猷启,何超莲,吴克群 首先 献唱 《 为 你 写诗 》 及 《 追 》 筹得 50 万港元 ， 何超莲 与 胞弟 何猷启 坐在 观众席 第二排 欣赏 。,吴克群 献唱  写诗   追  筹得  万港元  人物二 胞弟 人物一 坐在 观众席 第二排 欣赏,-1,,0.7429055415448689,1
TRAIN_SENT_ID_254284,张顺,张横,张顺 死后 ， 还 把 灵魂 附在 张横 身上 杀死 了 方天定 。,人物一 死后  灵魂 附在 人物二 身上 杀死 方天定,-1,,0.7006323507853917,1
TRAIN_SENT_ID_252846,颜回,孔子,附骥 尾 释义 : 司马贞 索隐 ： “ 按 ： 苍蝇附骥 尾而致 千里 ， 以 譬 颜回 因 孔子 而 名彰 也 。 ”,附骥 尾 释义  司马贞 索隐    苍蝇附骥 尾而致 千里  譬 人物一 人物二 名彰,1,,0.686806301275889,0
TRAIN_SENT_ID_263539,林逸,杨明,周 佳佳 林逸 的 师娘 之一 ， 杨明 的 妻子 之一 。,周 佳佳 人物一 师娘  人物二 妻子,1,,0.7251718242963155,-1
TRAIN_SENT_ID_255317,卫夫人,王羲之,卫夫人 给 鹅 点睛 : 一次 ， 王羲之 画鹅 ， 什么 都 画 好 了 ， 就是 眼睛 左 也 不成 右 不成 ， 总 感觉 画 的 不好 。,人物一 鹅 点睛  一次  人物二 画鹅  画  眼睛 左 右  总 感觉 画 不好,1,,0.7334945925644466,1
TRAIN_SENT_ID_275841,陆无双,李莫愁,"重生 之 我 是 杨过 内容简介 : 李莫愁 收 了 , 郭芙收 了 , 小龙女 收 了 , 陆无双 收 了 ...",重生 杨过 内容简介  人物二 收  郭芙收  小龙女 收  人物一 收,1,,0.7324306510743641,1
TRAIN_SENT_ID_257460,姜昆,马季,马季 、 姜昆 师徒俩 叶立中 — — 曹俊清 、 朱文正,人物二  人物一 师徒俩 叶立中   曹俊清  朱文正,1,,0.7767999092737834,-1
TRAIN_SENT_ID_273371,杨锐,张之洞,一 、 杨锐 是 张之洞 的 “ 坐京 ”,人物一 人物二  坐京,1,,0.7534875353177388,-1
TRAIN_SENT_ID_259393,温策,温慧,温策 煌 大仙 遭祸 : 南宫煌 ： 温慧 — — ！,人物一 煌 大仙 遭祸  南宫煌  人物二,-1,,0.7796671430269877,-1
TRAIN_SENT_ID_261332,罗松,罗成,隋唐 时期 罗艺 之孙 （ 祖母 姜桂芝 ） ， 罗松 之子 ， 罗成 的 侄子 ， 死 于 薛丁山 征西 ， 儿子 罗平 ， 女儿 罗盈 。,隋唐 时期 罗艺 之孙  祖母 姜桂芝   人物一 之子  人物二 侄子  死 薛丁山 征西  儿子 罗平  女儿 罗盈,-1,,0.7093069712320964,-1
TRAIN_SENT_ID_286445,张南垣,董其昌,张南垣 概况 : 张南垣 从小 有 绘画 天赋 ， 师从 董其昌 学画 ， 十分 刻苦 ， 每天 日夕 临摹 点染 ， 到 了 废寝忘食 的 地步 。,人物一 概况  人物一 从小 绘画 天赋  师从 人物二 学画  十分 刻苦  每天 日夕 临摹 点染  废寝忘食 地步,1,,0.7104952534039816,1
TRAIN_SENT_ID_255411,罗成,秦琼,"走向 传奇 内容简介 : 传奇世界 无处 不 传奇 , 关公 秦琼 比 义气 , 赵云 罗成 赛 枪法 , 张翼德 尉迟恭 谁 脸 更 黑 , 李元霸 和 李存孝 谁 更 牛 。",走向 传奇 内容简介  传奇世界 无处 传奇  关公 人物二 义气  赵云 人物一 赛 枪法  张翼德 尉迟恭 脸 更 黑  李元霸 李存孝 更 牛,-1,,0.7520387641021183,1
TRAIN_SENT_ID_266004,王恬,王洽,他 出身 于 书法 世家 ， 伯父 王翼 、 王导 ， 堂兄弟 王恬 、 王洽 等 都 是 当时 的 书法 名手 。,出身 书法 世家  伯父 王翼  王导  堂兄弟 人物一  人物二 当时 书法 名手,-1,,0.7038270394007365,-1
TRAIN_SENT_ID_254269,张顺,张横,张顺 人物 生平 : 张顺 登场 : 张顺 的 首次 出现 书中 是 由 其兄 张横 介绍 。,人物一 人物 生平  人物一 登场  人物一 首次 出现 书中 其兄 人物二 介绍,-1,,0.711411964893341,-1
TRAIN_SENT_ID_255300,卫夫人,王羲之,钟繇 是 今天 流行 的 楷书 的 创始者 ， 书法 界 有 一种 说法 ， 说 “ 书圣 ” 王羲之 的 书 法学 自卫 夫人 ， 而 卫夫人 学自 钟繇 。,钟繇 今天 流行 楷书 创始者  书法 界 一种 说法  说  书圣  人物二 书 法学 自卫 夫人  人物一 学自 钟繇,1,,0.7127714043571836,1
TRAIN_SENT_ID_255417,罗成,秦琼,36 专诸巷 罗成 认 舅母 贾柳店 秦琼 待 宾朋,专诸巷 人物一 认 舅母 贾柳店 人物二 宾朋,-1,,0.7095228274663289,-1
TRAIN_SENT_ID_264545,岳云鹏,郭德纲,2014 年 5 月 1 日 ， 参加 岳云鹏 在 北京 开展 的 “ 岳来 越 棒 ” 专场 ， 在 演出 中 表演 相声 ； 9 月 27 日 ， 参加 郭德纲 相声 巡演 南京站 。,年  月  日  参加 人物一 北京 开展  岳来 越 棒  专场  演出 中 表演 相声   月  日  参加 人物二 相声 巡演 南京站,1,,0.5495481193065643,0
TRAIN_SENT_ID_252868,颜回,孔子,孔子 与 颜回,人物二 人物一,1,,0.7374718109766643,-1
TRAIN_SENT_ID_264196,陈真,霍元甲,另有 《 警察故事 》 系列 等 影片 及 电视剧 《 霍元甲 》 、 《 陈真 》 、 《 再 向 虎山行 》 等剧 至今 脍炙人口 。,另有  警察故事  系列 影片 电视剧  人物二    人物一    虎山行  等剧 脍炙人口,1,,0.7291514660630908,1
TRAIN_SENT_ID_269397,刘伟,马季,老少 乐 相声 《 老少 乐 》 : 表演 ： 马季 、 刘伟,老少 乐 相声  老少 乐   表演  人物二  人物一,1,,0.6304134825865427,0
TRAIN_SENT_ID_252966,颜回,孔子,诗人 借 动物 之 “ 有情 ” 反讽 故事 中 主人公 的 “ 无情 ” ， 《 孔子 家语 · 颜回 篇 》 ： “ 孔子 在 上 ， 闻哭者 之声 甚哀 。,诗人 动物  有情  反讽 故事 中 主人公  无情    人物二 家语  人物一 篇    人物二  闻哭者 之声 甚哀,1,,0.7941022415955862,1
TRAIN_SENT_ID_274087,南宫敬叔,孔子,相传 孔子 与 南宫敬叔 适周 问礼于 老聃 ， 问 乐于 苌 弘 。,相传 人物二 人物一 适周 问礼于 老聃  问 乐于 苌 弘,1,,0.7512615635281518,1
TRAIN_SENT_ID_276032,华莲青,华罗庚,十年浩劫 一 结束 ， 这时 的 华莲青 不顾 年事已高 ， 又 一次 踏上 了 北上 的 列车 ， 从此 和 华罗庚 的 大儿子 华俊 东 夫妇 生活 在 一起 。,十年浩劫 结束  人物一 不顾 年事已高  一次 踏上 北上 列车  人物二 大儿子 华俊 东 夫妇 生活 一起,-1,,0.678084549449739,0
TRAIN_SENT_ID_253846,赵合德,赵飞燕,成帝 本来 宠爱 赵飞燕 ， 后来 移情别恋 于 赵合德 。,成帝 本来 宠爱 人物二  后来 移情别恋 人物一,-1,,0.6750855687118712,0
TRAIN_SENT_ID_277565,袁承志,穆人清,其子 袁承志 幸 被 部下 冒死 救出 ， 送往 华山 穆人清 门下 学艺 。,其子 人物一 幸 部下 冒死 救出  送往 华山 人物二 门下 学艺,1,,0.6832520493439266,0
TRAIN_SENT_ID_271243,马季,侯宝林,在此之前 ， 侯宝林 、 马季 曾 分别 应邀 出访 日本 。,在此之前  人物二  人物一 应邀 出访 日本,1,,0.7082287510236104,-1
TRAIN_SENT_ID_262256,尤二姐,尤三姐,当然 ， 尤三姐 与 逆来顺受 的 尤二姐 不同 。,人物二 逆来顺受 人物一 不同,-1,,0.7420382142066956,-1
TRAIN_SENT_ID_264255,陈真,霍元甲,此外 ， 有 说 倪匡 在 亚洲 电视节目 《 今夜 不设防 》 之中 ， 说 过 陈 真是 真有 其人 ， 报纸 上 霍元甲 的 治丧 名单 上 有着 陈真 这 名字 。,说 倪匡 亚洲 电视节目  今夜 不设防  之中  说 陈 真是 真有 其人  报纸 人物二 治丧 名单 有着 人物一 名字,1,,0.694246864035016,0
TRAIN_SENT_ID_261643,宋小宝,赵本山,赵本山 也 曾多次 想带 爱徒 宋小宝 上 春晚 ， 但 都 因为 作品 不 理想 、 身体状况 不 允许 等 原因 半路 “ 夭折 ” 。,人物二 曾多次 想带 爱徒 人物一 春晚  作品 理想  身体状况 允许 原因 半路  夭折,1,,0.727270367599669,1
TRAIN_SENT_ID_253886,赵合德,赵飞燕,当然 ， 赵飞燕 和 赵合德 两 姊妹 还 不能 称其为 妓女 ， 但殊 归 同途 。,人物二 人物一 两 姊妹 不能 称其为 妓女  但殊 同途,-1,,0.739925415742965,1
