sent_id,entity1,entity2,sent,processed_sent,label,sent_id.1,soft_match_score,soft_match
TRAIN_SENT_ID_261704,汤镇业,汤镇宗,2013 年 电视剧 《 乾隆 那些 事 》 任 导演 主演 余少群 郭珍霓 汤镇业 汤镇宗,年 电视剧  乾隆 事  导演 主演 余少群 郭珍霓 人物一 人物二,-1,,0.6426420140834082,0
TRAIN_SENT_ID_271518,孟优,孟获,孟获 殿 正殿 塑有 孟获 、 孟优 、 摩铁 三尊 神像 。,人物二 殿 正殿 塑有 人物二  人物一  摩铁 三尊 神像,-1,,0.7923516616934821,1
TRAIN_SENT_ID_252795,颜回,孔子,颜回 好学 问题 : 孔子 “ 哭 之 恸 ” 的 原因 是 什么 ?,人物一 好学 问题  人物二  哭 恸  原因,1,,0.6731756840433393,0
TRAIN_SENT_ID_259617,季布,季心,其中 《 季布 栾布 列传 》 记述 季布 、 栾布 二人 的 生平事迹 外 ， 还 记载 了 季心 和 丁公 的 事迹 。,人物一 栾布 列传  记述 人物一  栾布 二人 生平事迹 外  记载 人物二 丁公 事迹,-1,,0.7634411525158655,1
TRAIN_SENT_ID_259791,李偲菘,李伟菘,作曲 人 : 李伟菘 李偲菘 纪利 男 随安 苏恒 RickyHo,作曲  人物二 人物一 纪利 男 随安 苏恒,-1,,0.7398947517077128,-1
TRAIN_SENT_ID_249225,皮皮鲁,鲁西西,6 剧集 背景 : 中国儿童艺术剧院 联手 “ 童话 大王 ” 郑渊洁 最新 推出 童话剧 《 皮皮鲁 鲁西西 》 系列 作品 之二 ， 根据 魔方 大厦 改编 。,剧集 背景  中国儿童艺术剧院 联手  童话 大王  郑渊洁 最新 推出 童话剧  人物一 人物二  系列 作品 之二  魔方 大厦 改编,-1,,0.6709067637012118,0
TRAIN_SENT_ID_270816,伍天锡,伍云召,后来 ， 在 江南 四明山 ， 与 雄阔海 、 伍云召 、 伍天锡 大战 ， 破 之 ； 再 与 裴元庆 大战 ， 因 力竭 而败 。,后来  江南 四明山  雄阔海  人物二  人物一 大战  破  裴元庆 大战  力竭 而败,-1,,0.6972561592147464,0
TRAIN_SENT_ID_274107,南宫敬叔,孔子,8 . ( 孔于 入 周问 礼乐 ) 周敬王 时期 ， 孔子 得到 鲁君 的 支持 ， 与 南宫敬叔 来到 周朝 国 都洛邑 。,孔于 入 周问 礼乐  周敬王 时期  人物二 得到 鲁君 支持  人物一 来到 周朝 国 都洛邑,1,,0.7431427041689554,1
TRAIN_SENT_ID_274318,李迥,华阳公主,独孤 氏以 美丽 得幸 ， 九载 生韩王 李迥 ， 后生 华阳公主 。,独孤 氏以 美丽 得幸  九载 生韩王 人物一  后生 人物二,-1,,0.720751146475474,-1
TRAIN_SENT_ID_257532,毛泽民,毛泽东,随后 在 徐特立 部长 、 毛泽民 部长 的 陪同 下 ， 进行 了 一周 参观 ， 聆听 了 毛泽东 和 博古 主席 的 报告 。,徐特立 部长  人物一 部长 陪同  进行 一周 参观  聆听 人物二 博古 主席 报告,-1,,0.6157543304420653,0
TRAIN_SENT_ID_268893,司徒静,司徒剑南,司徒静 约 文蔷 在 酒楼 见面 ， 并 请 司徒剑南 前来 ， 司徒剑南 和 文蔷 互相 爱慕 。,人物一 约 文蔷 酒楼 见面  请 人物二 前来  人物二 文蔷 互相 爱慕,-1,,0.7125061963285718,1
TRAIN_SENT_ID_250337,赵飞燕,赵合德,公元前 45 年 赵飞燕 、 赵合德 出世 : 赵飞燕 、 赵合德 是 一对 双胞胎 的 姐妹花 ， 出 生于 公元前 45 年 。,公元前  年 人物一  人物二 出世  人物一  人物二 一对 双胞胎 姐妹花  出 生于 公元前  年,-1,,0.7273231784502665,-1
TRAIN_SENT_ID_251599,穆春,穆弘,土豪 恶霸 穆弘 穆春,土豪 恶霸 人物二 人物一,-1,,0.7705206751823426,-1
TRAIN_SENT_ID_260745,薛丁山,薛金莲,苏军 来 大营 偷袭 ， 薛仁贵 亲自 出手 ， 薛丁山 的 妹妹 薛金莲 来 和 苏凤 的 儿子 交手 ， 薛丁山 看到 父亲 这边 受敌 ， 只好 出手 。,苏军 大营 偷袭  薛仁贵 亲自 出手  人物一 妹妹 人物二 苏凤 儿子 交手  人物一 看到 父亲 受敌  只好 出手,-1,,0.6779723451251075,0
TRAIN_SENT_ID_275227,李梅儿,上官兰心,封 上官兰心 为 敬贤妃 ， 封 金碧瑶 为 英德 妃 ， 李梅儿 为 李选侍 。,封 人物二 敬贤妃  封 金碧瑶 英德 妃  人物一 李选侍,-1,,0.7100411415100097,-1
TRAIN_SENT_ID_257240,艾欧里亚,艾俄洛斯,艾俄洛斯 二 、 家庭 生活 ： : 艾俄洛斯 （ 一 ） 居所 ： : 艾欧里亚 群岛 共有 七座 岛屿 ， 风神 艾俄洛斯 居住 在 其中 一个 岛上 。,人物二 二  家庭 生活   人物二   居所   人物一 群岛 共有 七座 岛屿  风神 人物二 居住 一个 岛上,-1,,0.7015159050623576,-1
TRAIN_SENT_ID_270992,严舆,严白虎,人物传记 : 简明 历史 传记 : 严舆 ， 严白虎 之弟 ， 有 勇力 ， 受 兄长 派遣 与 孙策 讲 和 ， 在 席间 被 孙策 投掷 手戟 击中 而 死 。,人物传记  简明 历史 传记  人物一  人物二 之弟  勇力  受 兄长 派遣 孙策 讲  席间 孙策 投掷 手戟 击中 死,-1,,0.6571368944077265,0
TRAIN_SENT_ID_284904,陆启铿,华罗庚,数学 所 历任 所长 为 ： 华罗庚 、 陆启铿 （ 常务 副所长 ） 、 王元 、 杨乐 、 龙瑞 林 、 李炳仁 （ 代 所长 ） 、 王跃飞 。,数学 历任 所长  人物二  人物一  常务 副所长   王元  杨乐  龙瑞 林  李炳仁  代 所长   王跃飞,1,,0.7026284098625183,-1
TRAIN_SENT_ID_266067,张学思,张学良,张学铭 和 张学思 对 他们 阔别多年 的 兄长 张学良 的 怀念 之情 ， 更是 难以 用 语言表达 。,张学铭 人物一 阔别多年 兄长 人物二 怀念 之情  更是 难以 语言表达,-1,,0.7397718897887638,1
TRAIN_SENT_ID_261434,毛泽建,毛泽东,家境 窘迫 ， 生活 艰难 的 毛泽建 ， 9 岁 那年 得到 毛泽东 父母 的 关照 ， 从 东茅塘 搬 到 了 上屋 场 毛泽东 的 家里 。,家境 窘迫  生活 艰难 人物一   岁 那年 得到 人物二 父母 关照  东茅塘 搬 上屋 场 人物二 家里,-1,,0.6208484967549642,0
TRAIN_SENT_ID_259804,李偲菘,李伟菘,作词 ： 卡斯 作曲 ： 李伟菘 、 李偲菘,作词  卡斯 作曲  人物二  人物一,-1,,0.7654254223619189,1
TRAIN_SENT_ID_255434,罗成,秦琼,贾家楼 四十六 友 ， 最铁 的 三个 就 秦琼 、 程咬金 与 罗成 。,贾家楼 四十六 友  最铁 三个 人物二  程咬金 人物一,-1,,0.7037586132685344,-1
TRAIN_SENT_ID_265487,薛蝌,薛蟠,身份 ： 是 薛姨妈 的 侄女 ， 薛蝌 的 胞妹 ， 薛蟠 ， 薛宝钗 的 堂妹 。,身份  薛姨妈 侄女  人物一 胞妹  人物二  薛宝钗 堂妹,-1,,0.7479934652646383,-1
TRAIN_SENT_ID_253873,赵合德,赵飞燕,汉成帝 与 赵飞燕 、 赵合德 姐妹 ： 姐妹 共 一夫 由 佳话 成 悲剧,汉成帝 人物二  人物一 姐妹  姐妹 共 一夫 佳话 成 悲剧,-1,,0.7042834489118486,1
TRAIN_SENT_ID_266877,尤二姐,尤氏,尤二姐 : 人物 介绍 : 尤二姐 ， 贾珍 妻 尤氏 的 异母 妹 ， 是 尤老娘 前夫 所 生 ， 后 尤老娘 改嫁 尤家时 随来 。,人物一  人物 介绍  人物一  贾珍 妻 人物二 异母 妹  尤老娘 前夫 生  尤老娘 改嫁 尤家时 随来,-1,,0.6490800054300399,0
TRAIN_SENT_ID_251549,楚碧痕,楚寒镜,神农 与 伏羲 相争 ， 神农 离开 炎帝 神农 洞 前往 人间 ， 梭罗树 仙 楚寒镜 和 楚碧痕 、 熔岩 兽王 等 留于 洞 内 。,神农 伏羲 相争  神农 离开 炎帝 神农 洞 前往 人间  梭罗树 仙 人物二 人物一  熔岩 兽王 留于 洞,-1,,0.7078036524000622,1
TRAIN_SENT_ID_252696,颜回,孔子,据 《 孔子 家语 》 等 书 记载 ， 颜回 死时 年 仅 三十一 。,人物二 家语  书 记载  人物一 死时 年 仅 三十一,1,,0.7533402403195699,-1
TRAIN_SENT_ID_255445,罗成,秦琼,第五十七回 秦琼 建祠 报雄信 罗成 奋勇 擒五王,第五十七回 人物二 建祠 报雄信 人物一 奋勇 擒五王,-1,,0.7390348593393962,-1
TRAIN_SENT_ID_257029,洪敬尧,洪荣宏,」 而 洪一峰 刻意 栽培 长子 洪荣宏 ， 但 相较 之下 ， 次子 洪敬尧 有如 坐在 翘翘板 的 彼端 ， 从 名字 可以 看出 一些 端倪 。,洪一峰 刻意 栽培 长子 人物二  相较 之下  次子 人物一 有如 坐在 翘翘板 彼端  名字 看出 端倪,-1,,0.7360190465336754,1
TRAIN_SENT_ID_257836,吕素,吕雉,秦美人 吕素 : 吕素 是 吕雉 的 妹妹 ， 温柔 美丽 、 品性 善良 ， 与 姐姐 吕雉 完全 不同 。,秦美人 人物一  人物一 人物二 妹妹  温柔 美丽  品性 善良  姐姐 人物二 完全 不同,-1,,0.6866793575740996,0
TRAIN_SENT_ID_253007,颜回,孔子,出处 ： 《 孔子 家语 - 致思 》 ： “ （ 颜回 对 曰 ） 回闻 薰 犹 不同 器而藏 ， 若 桀 不共国 而治 ， 以 其 异类 也 。 ”,出处   人物二 家语  致思     人物一 曰  回闻 薰 犹 不同 器而藏  桀 不共国 而治  异类,1,,0.7630750707217625,1
TRAIN_SENT_ID_271220,和硕温恪公主,和硕敦恪公主,胤 祥 胞妹 : 十三 格格 和硕温恪公主 （ 1687 年 ~ 1709 年 ） 和 十五 格格 和硕敦恪公主 （ 1691 年 ~ 1709 年 ） 。,胤 祥 胞妹  十三 格格 人物一   年   年  十五 格格 人物二   年   年,-1,,0.616065502166748,0
TRAIN_SENT_ID_251916,曹薰铉,李昌镐,1991 年 曹薰铉 向 弟子 挑战 ， 结果 以三比 二 战胜 了 李昌镐 。,年 人物一 弟子 挑战  以三比 二 战胜 人物二,1,,0.7153255661328634,-1
TRAIN_SENT_ID_272653,邢德全,邢夫人,邢大舅 第七十五回 : 在 宁府中 ， 邢大舅 与 薛蟠 、 贾珍 等 人夜 赌 ， 此 “ 邢大舅 ” 即 邢夫人 胞弟 邢德全 ， 当中 有 一段 介绍 邢家 内事 ：,邢大舅 第七十五回  宁府中  邢大舅 薛蟠  贾珍 人夜 赌   邢大舅  人物二 胞弟 人物一  当中 一段 介绍 邢家 内事,-1,,0.7376032372315725,1
TRAIN_SENT_ID_250434,赵飞燕,赵合德,奸妃 中国 历代 奸妃 : 夏 ： 妺 喜 ； 商 ： 妲 己 ； 周 ： 褒 姒 、 汉 ： 赵合德 、 赵飞燕 ； 三国 ： 郭女王,奸妃 中国 历代 奸妃  夏  妺 喜  商  妲  周  褒 姒  汉  人物二  人物一  三国  郭女王,-1,,0.8090421060721079,1
TRAIN_SENT_ID_283893,李晏,李纶,李晏 ， 李纶 之弟 ， 封 赵郡 公 ， 官至 开府 仪同 三司 、 大将军 。,人物一  人物二 之弟  封 赵郡 公  官至 开府 仪同 三司  大将军,-1,,0.7113277991612752,-1
TRAIN_SENT_ID_261684,程英,陆无双,表姐 （ 陆无双 专用 ） 柴蔚版 程英 ( 6 张 ),表姐  人物二 专用  柴蔚版 人物一   张,-1,,0.7452928900718689,-1
TRAIN_SENT_ID_273672,姜子牙,元始天尊,姜子牙 无奈 ， 只好 跑 到 昆仑山 玉虚宫 ， 去 请 他 的 师傅 元始天尊 ， 搬来 了 三 教主 。,人物一 无奈  只好 跑 昆仑山 玉虚宫  请 师傅 人物二  搬来 三 教主,1,,0.6708668697448004,0
TRAIN_SENT_ID_250431,赵飞燕,赵合德,后来 成帝 听说 赵飞燕 的 妹妹 赵合德 长得 更 美 ， 于是 又 将 合德 召人 宫中 。,后来 成帝 听说 人物一 妹妹 人物二 长得 更 美  合德 召人 宫中,-1,,0.6597188469909486,0
TRAIN_SENT_ID_274281,梅小青,梅小惠,"《 满堂红 》 （ 曾伟权 ， 蔡倩儿 , 潘铣 怡 ， 杨得时 , 梅小惠 ） 梅小青 监制",满堂红   曾伟权  蔡倩儿  潘铣 怡  杨得时  人物二  人物一 监制,-1,,0.7612050890922546,-1
TRAIN_SENT_ID_259615,季布,季心,季姓 季心 : 季布 弟 ， 亦 以 任侠 名 。,季姓 人物二  人物一 弟  任侠 名,-1,,0.7766194343566895,-1
TRAIN_SENT_ID_271259,马季,侯宝林,也 就是 那个 时候 初步 知道 了 侯宝林 、 马季 、 姜昆 等等 相声 演员 。,初步 知道 人物二  人物一  姜昆 相声 演员,1,,0.6805128114564079,0
TRAIN_SENT_ID_261591,宋小宝,赵本山,《 那年 有匪 》 是 一部 赵本山 、 宋小宝 主演 的 电视剧 ， 2014 年 首播 。,那年 有匪  一部 人物二  人物一 主演 电视剧   年 首播,1,,0.6616018726712182,0
TRAIN_SENT_ID_255360,贾午,贾南风,同日 逮捕 贾午 、 赵粲 等 贾南风 党羽 ， 送至 暴室 杖 毙 。,同日 逮捕 人物一  赵粲 人物二 党羽  送至 暴室 杖 毙,-1,,0.7566394522076562,1
TRAIN_SENT_ID_277592,袁世廉,袁世凯,光绪 十一年 （ 1885 ） ， 袁世凯 任 “ 驻 朝鲜 总理 交涉 通商 事宜 大臣 ” 后 ， 让 袁世廉 到 朝鲜 “ 阅 时务 ， 知 交涉 事宜 。 ”,光绪 十一年     人物二  驻 朝鲜 总理 交涉 通商 事宜 大臣   人物一 朝鲜  阅 时务  知 交涉 事宜,-1,,0.7048102702413287,1
TRAIN_SENT_ID_274508,曾江,林翠,林翠 原名 曾懿 ， 1936 年 出生 广东 中山 ， 香港电影 红星 ， 著名 粤语 演员 曾江 之 胞妹 。,人物二 原名 曾懿   年 出生 广东 中山  香港电影 红星  著名 粤语 演员 人物一 胞妹,-1,,0.6716298716408866,0
TRAIN_SENT_ID_257509,姜昆,马季,主持人 ： 王景愚 、 刘晓庆 、 姜昆 、 马季,主持人  王景愚  刘晓庆  人物一  人物二,1,,0.6873411692324138,0
TRAIN_SENT_ID_263546,林逸,杨明,校花 的 贴身 高手 杨明 : 林逸 的 师父 ， 前作 《 很纯 很 暧昧 》 的 主角 。,校花 贴身 高手 人物二  人物一 师父  前作  很纯 暧昧  主角,1,,0.7352092947278704,1
TRAIN_SENT_ID_257504,姜昆,马季,值得一提的是 ， 姜昆 、 马季 等 著名演员 并非 小品 演员 而是 相声 演员 。,值得一提的是  人物一  人物二 著名演员 小品 演员 相声 演员,1,,0.6016431904974437,0
TRAIN_SENT_ID_252601,颜回,孔子,孔子 · 颜回 · 曾 参 · 孔伋 · 孟子,人物二  人物一  参  孔伋  孟子,1,,0.7364365415913718,1
TRAIN_SENT_ID_252608,颜回,孔子,有 一天 ， 孔子 与 颜回 、 子路 在 一起 交谈 。,一天  人物二 人物一  子路 一起 交谈,1,,0.7036178807417551,1
TRAIN_SENT_ID_261167,王缙,王维,二公 名望 ， 首冠 一时 ， 时 议论 诗则 曰 王维 、 崔颢 ， 论笔 则 曰 王缙 、 李邕 。,二公 名望  首冠 一时  时 议论 诗则 曰 人物二  崔颢  论笔 曰 人物一  李邕,-1,,0.6675573175861722,0
TRAIN_SENT_ID_284712,刘文步,杨少奎,杨少奎 是 相声界 公认 的 太平 歌词 演唱 大家 ， 佟守本 和 刘文步 都 跟 杨少奎 有 渊源 ， 两个 人 决定 联袂 申报 非遗 。,人物二 相声界 公认 太平 歌词 演唱  佟守本 人物一 人物二 渊源  两个 决定 联袂 申报 非遗,1,,0.760901805900392,1
TRAIN_SENT_ID_272650,卫少儿,卫青,二姐 卫少儿 因 与 陈掌 有私 ， 汉武帝 便 召来 陈掌 使 其 显贵 ， 弟弟 卫青 则 升为 大中 大夫 之职 。,二姐 人物一 陈掌 有私  汉武帝 便 召来 陈掌 显贵  弟弟 人物二 升为 大中 大夫 之职,-1,,0.6610758716151828,0
TRAIN_SENT_ID_274182,田虎,田猛,在 烈山 堂堂 主 田猛 葬礼 上 随着 堂主 田虎 前来 吊唁 。,烈山 堂堂 主 人物二 葬礼 堂主 人物一 前来 吊唁,-1,,0.7513898355620248,1
TRAIN_SENT_ID_264552,胡青牛,张无忌,后来 这伙 人想 寻求 胡青牛 为 他们 治病 ， 可 胡青牛 时 同样 不肯 救治 ， 却 暗地里 示意 让 他们 去 寻求 张无忌 的 帮助 。,后来 这伙 人想 寻求 人物一 治病  人物一 时 同样 不肯 救治  暗地里 示意 寻求 人物二 帮助,1,,0.6258679926395416,0
TRAIN_SENT_ID_261088,张豪龙,张柏文,跟 张仁勇 再 婚后 ， 育有 张柏芝 和 两个 弟弟 ： 张豪龙 与 张柏文 ， 之后 与 张仁勇 离婚 。,张仁勇 婚后  育有 张柏芝 两个 弟弟  人物一 人物二  之后 张仁勇 离婚,-1,,0.5733284283251989,0
TRAIN_SENT_ID_255395,罗成,秦琼,秦琼 并 不 喜欢 罗成 的 性格 与 为 人 。,人物二 喜欢 人物一 性格,-1,,0.6832662835007622,0
TRAIN_SENT_ID_259676,公孙胜,罗真人,第五十三回 戴宗 智取 公孙胜 ， 李逵 斧劈 罗真人,第五十三回 戴宗 智取 人物一  李逵 斧劈 人物二,1,,0.710194590545836,1
TRAIN_SENT_ID_273360,杨锐,张之洞,参加 院试 时 ， 张之洞 将 杨锐 与其 兄 杨聪 二人 比 为 蜀中 当代 的 苏轼 和 苏辙 。,参加 院试 时  人物二 人物一 兄 杨聪 二人 蜀中 当代 苏轼 苏辙,1,,0.6673652217501685,0
TRAIN_SENT_ID_252870,颜回,孔子,《 孔子 家语 · 颜回 》 ： “ 设虚器 ， 纵逆祀 ， 祠 海鸟 ： 三不智 。 ”,人物二 家语  人物一    设虚器  纵逆祀  祠 海鸟  三不智,1,,0.7179921428362529,-1
TRAIN_SENT_ID_258811,张无忌,殷离,而且 赵敏 抓住 六大 派 ， 从 峨嵋派 手中 夺得 倚天剑 ， 且 张无忌 与 小昭 、 赵敏 、 周芷若 、 殷离 一起 去 接 金毛狮 王 谢逊 回 中原 。,赵敏 抓住 六大 派  峨嵋派 手中 夺得 倚天剑  人物一 小昭  赵敏  周芷若  人物二 一起 接 金毛狮 王 谢逊 回 中原,-1,,0.6372809779076349,0
TRAIN_SENT_ID_253860,赵合德,赵飞燕,小说 人物 ： 汉成帝 ， 赵飞燕 ， 赵合德 ， 王太后 ， 班婕妤 ， 九 王爷,小说 人物  汉成帝  人物二  人物一  王太后  班婕妤  九 王爷,-1,,0.7101990302403768,-1
TRAIN_SENT_ID_269423,刘伟,马季,30 . 相声 ： 《 老少 乐 》 表演者 ： 马季 刘伟,相声   老少 乐  表演者  人物二 人物一,1,,0.6877088021664393,0
TRAIN_SENT_ID_274062,南宫敬叔,孔子,孟懿子 基本 信息 : 鲁昭公 二十四年 （ 前 518 年 ） ， 孟僖子 临终 之前 ， 让 孟懿子 、 南宫敬叔 都 要 将 孔子 作为 老师 。,孟懿子 基本 信息  鲁昭公 二十四年  前  年   孟僖子 临终 之前  孟懿子  人物一 人物二 老师,1,,0.6385481244041806,0
TRAIN_SENT_ID_252502,颜回,孔子,颜回 随 孔子 在 郑国 考察 了 大夫 子产 的 政绩 ， 考察 了 乡校 ， 拜祭 了 子产 。,人物一 人物二 郑国 考察 大夫 子产 政绩  考察 乡校  拜祭 子产,1,,0.7200183153152466,-1
TRAIN_SENT_ID_279134,范长利,朱绍文,朱绍文 ― ― 春长隆 、 冯昆治 、 范长利 、 桂祯 、 徐长福 、 沈竹善,人物二 ― ― 春长隆  冯昆治  人物一  桂祯  徐长福  沈竹善,1,,0.6677335841315133,0
TRAIN_SENT_ID_252459,颜回,孔子,一会儿 ， 饭熟 了 ， 颜回 请 孔子 吃饭 。,一会儿  饭熟  人物一 请 人物二 吃饭,1,,0.7048863314446949,1
TRAIN_SENT_ID_282544,苗正,黄震,回到 华国 后 对抗 卫将 杨东 ， 子荣 救驾 沂蒙山 ， 搭救 黄震 ， 并 几次 接应 迟恒喆 、 苗正 ， 化险为夷 。,回到 华国 对抗 卫将 杨东  子荣 救驾 沂蒙山  搭救 人物二  几次 接应 迟恒喆  人物一  化险为夷,-1,,0.6830394338993799,0
TRAIN_SENT_ID_262235,尤二姐,尤三姐,四 尤 ： 尤老娘 、 尤氏 、 尤二姐 、 尤三姐 。,四 尤  尤老娘  尤氏  人物一  人物二,-1,,0.7189146677652994,-1
TRAIN_SENT_ID_249255,皮皮鲁,鲁西西,在 皮皮鲁 诞生 之后 ， 和 皮皮鲁 相对 的 鲁西西 也 随之 诞生 了 。,人物一 诞生 之后  人物一 相对 人物二 随之 诞生,-1,,0.7078217546145121,-1
TRAIN_SENT_ID_274080,南宫敬叔,孔子,遣 一车 二 马一 童一御 ， 由 南宫敬叔 陪 孔子 前往 。,遣 一车 二 马一 童一御  人物一 陪 人物二 前往,1,,0.7344269993759337,1
TRAIN_SENT_ID_252697,颜回,孔子,"他 一身 静气 、 湛然 似 水 , 不动 如山 、 从容 自 在 , 他 是 孔子 最 得意 的 门生 - 颜回 。",一身 静气  湛然 似 水  不动 如山  从容  人物二 得意 门生  人物一,1,,0.765688819544656,1
TRAIN_SENT_ID_256535,周武,周文,周文 王四 子 周武 王弟 周成 王叔,人物二 王四 子 人物一 王弟 周成 王叔,-1,,0.8258604407310486,-1
TRAIN_SENT_ID_282812,陈俊凌,陈克忠,学大架 的 跟 陈照丕 ， 学小架 的 挑 了 陈伯祥 、 陈俊凌 、 陈启 亮 ， 跟着 陈克忠 学 。,学大架 陈照丕  学小架 挑 陈伯祥  人物一  陈启 亮  跟着 人物二 学,1,,0.7445443598997026,1
TRAIN_SENT_ID_253812,孟凡,孟芙,"= 孟凡 从 回 后宫 = 发现 有 女官 欺负 一对 双胞胎 , 回顾 自己 当年 与 孟芙 入宫 的 日子 。",人物一 回 后宫  发现 女官 欺负 一对 双胞胎  回顾 当年 人物二 入宫 日子,-1,,0.7336965231668382,1
TRAIN_SENT_ID_267458,唐继虞,唐继尧,因 与 唐继虞 交谊 深厚 ， 过从甚密 ， 逐渐 受到 唐继尧 的 器重 ， 成为 唐系 心腹 将领 之一 。,人物一 交谊 深厚  过从甚密  逐渐 人物二 器重  成为 唐系 心腹 将领,-1,,0.7102345653942653,1
TRAIN_SENT_ID_250651,鲁西西,皮皮鲁,2014 年 先后 拍摄 电视剧 《 蛋神 2 》 饰演 司想 、 《 皮皮鲁 与 鲁西西 》 饰演 皮皮鲁 。,年 先后 拍摄 电视剧  蛋神   饰演 司想   人物二 人物一  饰演 人物二,-1,,0.6343567208165214,0
TRAIN_SENT_ID_264198,陈真,霍元甲,民国初年 ， 一代 武 林宗 师 霍元甲 、 陈真 相继 蒙难 于 日本 人 的 毒手 后 ， 一时间 精武门 几乎 遭到 了 灭顶之灾 。,民国初年  一代 武 林宗 师 人物二  人物一 相继 蒙难 日本 毒手  一时间 精武门 几乎 遭到 灭顶之灾,1,,0.7179949241025108,1
TRAIN_SENT_ID_252617,颜回,孔子,孔子 不疑 颜回 之廉信,人物二 不疑 人物一 之廉信,1,,0.7736592491467794,-1
TRAIN_SENT_ID_278134,裴元,孙思邈,裴元 对此 领悟 之后 决意 追随 孙思邈 ， 发扬 医术 。,人物一 对此 领悟 之后 决意 追随 人物二  发扬 医术,1,,0.7068187381540026,1
TRAIN_SENT_ID_272687,蓝兰,张晓,2013 年 ： 《 步步 惊情 》 饰 张晓 / 蓝兰,年   步步 惊情  饰 人物二  人物一,-1,,0.6722764465070906,0
TRAIN_SENT_ID_282058,李长乐,李敏峰,锦绣 未央 李敏峰 : 李长乐 的 亲哥哥 ， 一直 追查 未央 身份 。,锦绣 未央 人物二  人物一 亲哥哥  一直 追查 未央 身份,-1,,0.7352796480769203,1
TRAIN_SENT_ID_249166,皮皮鲁,鲁西西,长影 集团 党委书记 兼 长影 世纪 城 董事长 刘丽娟 宣布 皮皮鲁 和 鲁西西 成为 长影 世纪 城 的 吉祥物 ， 并 与 郑渊洁 互赠 礼物 。,长影 集团 党委书记 兼 长影 世纪 城 董事长 刘丽娟 宣布 人物一 人物二 成为 长影 世纪 城 吉祥物  郑渊洁 互赠 礼物,-1,,0.5640804781800225,0
TRAIN_SENT_ID_270983,严舆,严白虎,三国群英 传 2 严舆 形象 严舆 简明 演义 传记 : 严舆 ， 严白虎 之弟 ， 三国演义 第 15 回 登场 。,三国群英 传  人物一 形象 人物一 简明 演义 传记  人物一  人物二 之弟  三国演义  回 登场,-1,,0.7132680932680766,-1
TRAIN_SENT_ID_274626,石破天,史小翠,随后 众人 离开 后 石破天 也 找 不到 史小翠 、 白阿绣 ， 便 也 乘船 离开 紫烟 岛 。,众人 离开 人物一 找 不到 人物二  白阿绣  便 乘船 离开 紫烟 岛,1,,0.5393202177115849,0
TRAIN_SENT_ID_255344,沈东篱,沈南枝,沈东篱 与 沈南枝 正 额头 抵着 额头 ， 笑 得 一脸 阳光 。,人物一 人物二 正 额头 抵着 额头  笑 一脸 阳光,-1,,0.7472459248134068,1
TRAIN_SENT_ID_269420,刘伟,马季,表演者 ： 马季 、 赵炎 、 冯巩 、 刘伟 、 王金宝 、 王谦祥 、 李增瑞 、 戴志诚 、 郑健,表演者  人物二  赵炎  冯巩  人物一  王金宝  王谦祥  李增瑞  戴志诚  郑健,1,,0.6478065848350525,0
TRAIN_SENT_ID_262249,尤二姐,尤三姐,贾珍 妻子 尤氏 见 无人 料理 宁府 事务 ， 将 继母 和 两个 妹妹 尤二姐 、 尤三姐 接到 府 中 。,贾珍 妻子 尤氏 见 无人 料理 宁府 事务  继母 两个 妹妹 人物一  人物二 接到 府 中,-1,,0.6452643402985164,0
TRAIN_SENT_ID_264553,胡青牛,张无忌,在 医德 方面 ， 以 “ 见死不救 ” 而 知名 的 胡青牛 就 设法 与 宅心仁厚 的 张无忌 相提并论 了 。,医德 方面   见死不救  知名 人物一 设法 宅心仁厚 人物二 相提并论,1,,0.7403619360356104,1
TRAIN_SENT_ID_260574,金敬姬,金正日,金敬姬 是 金正日 的 妹妹 ， 也 是 朝鲜 “ 二把手 ” 张成泽 的 夫人 。,人物一 人物二 妹妹  朝鲜  二把手  张成泽 夫人,-1,,0.6530912532692864,0
TRAIN_SENT_ID_259631,公孙胜,罗真人,山东 版 水浒 中 的 公孙胜 ② 观 公孙胜 二人 恳告 罗真人 ， 此尊 师之礼 当 如此 也 。,山东 版 水浒 中 人物一 ② 观 人物一 二人 恳告 人物二  此尊 师之礼,1,,0.7016974767049153,-1
TRAIN_SENT_ID_249214,皮皮鲁,鲁西西,他 笔下 的 皮皮鲁 、 鲁西西 和 罗克 ， 舒克 贝塔 影响 了 中国 三代 的 孩子 。,笔下 人物一  人物二 罗克  舒克 贝塔 影响 中国 三代 孩子,-1,,0.6453674378849211,0
TRAIN_SENT_ID_284556,陈莉莉,陈勇军,陈莉莉 原名 陈勇军 ， 1980 年 1 月 8 日 生于 四川省 南充市 的 仪陇县 一个 农民 家庭 。,人物一 原名 人物二   年  月  日 生于 四川省 南充市 仪陇县 一个 农民 家庭,-1,,0.6212053894996643,0
TRAIN_SENT_ID_263544,林逸,杨明,杨明 林逸 的 师父 ， 《 很纯 很 暧昧 》 的 主角 。,人物二 人物一 师父   很纯 暧昧  主角,1,,0.7453190755276453,1
TRAIN_SENT_ID_268461,单联全,冯一非,随后 ， 冯一非 与 单联全 推出 的 《 我 的 老爹 》 。,人物二 人物一 推出  老爹,1,,0.7543846249580384,-1
TRAIN_SENT_ID_252632,颜回,孔子,颜回 对待 孔子 如同 曾 参 侍奉 父亲 一样 。,人物一 人物二 参 侍奉 父亲,1,,0.6273179877372015,0
TRAIN_SENT_ID_254297,张顺,张横,梁山 排座次 时 ， 张横 排 第二十八 位 ， 星号 天竟 星 （ 一作 天平 星 ） ， 担任 水军 头领 ， 与 张顺 一同 镇守 西南 水寨 。,梁山 排座次 时  人物二 排 第二十八 位  星号 天竟 星  一作 天平 星   担任 水军 头领  人物一 一同 镇守 西南 水寨,-1,,0.6817569321110135,0
