sent_id,entity1,entity2,sent,processed_sent,label,sent_id.1,soft_match_score,soft_match
TRAIN_SENT_ID_256971,仲由,孔子,孔子 说 ： “ 冉求 总是 退缩 ， 所以 我 鼓励 他 ； 仲由 好勇 过 人 ， 所以 我 约束 他 。 ”,人物二 说   冉求 总是 退缩  鼓励  人物一 好勇  约束,1,,0.6436773666313717,0
TRAIN_SENT_ID_253085,颜回,孔子,颜丙燕 ， 1972 年 12 月 16 日 生于 中国 北京 ， 祖籍 山东 曲阜 ， 是 孔子 四大 弟子 之一 颜回 的 后裔 。,颜丙燕   年  月  日 生于 中国 北京  祖籍 山东 曲阜  人物二 四大 弟子 人物一 后裔,1,,0.627160329194296,0
TRAIN_SENT_ID_275547,王小虎,赵本山,婚礼 当天 ， 赵本山 并 没有 现身 ， 王小虎 解释 说 ： “ 师傅 和 师兄弟 都 太忙 了 。 ”,婚礼 当天  人物二 没有 现身  人物一 解释 说   师傅 师兄弟 太忙,1,,0.6311228615897042,0
TRAIN_SENT_ID_252547,颜回,孔子,“ 醯 （ xi ） 鸡 ” 见 《 庄子 · 田子方 》 篇 ， 写 孔子 求见 老聃 问道 后 ， 出来 告诉 颜回 说 ： “ 丘之于 道 也 ， 其 犹 醯 鸡 欤 !,醯    鸡  见  庄子  田子方  篇  写 人物二 求见 老聃 问道  告诉 人物一 说   丘之于 道  犹 醯 鸡,1,,0.6759390916143145,0
TRAIN_SENT_ID_266181,李昌镐,曹薰铉,第三轮 ： 曹薰铉 1 : 0 王磊 金荣桓 1 : 0 柳时熏 小林觉 1 : 0 赵治勋 李昌镐 1 : 0 马晓春,第三轮  人物二    王磊 金荣桓    柳时熏 小林觉    赵治勋 人物一    马晓春,1,,0.7000776217097328,1
TRAIN_SENT_ID_256948,仲由,孔子,由 : 仲由 字 ( 子路 ) （ 前 542 ～ 前 480 ） 春秋时期 鲁国 卞 （ 今 山东 泗水县 泉林 镇 卞 桥村 ） 人 ， 孔子 得意门生 ， 以 政事 见称 。,人物一 字  子路   前   前   春秋时期 鲁国 卞  山东 泗水县 泉林 镇 卞 桥村   人物二 得意门生  政事 见称,1,,0.6490437870933896,0
TRAIN_SENT_ID_255309,卫夫人,王羲之,卫夫人 看到 王羲之 着急 的 样子 ， 既 可爱 ， 又 可笑 ， 便 说 ： “ 孩子 ， 不要 太急 了 ， 我 先 给 你 讲个 墨池 的 故事 吧 ！,人物一 看到 人物二 着急 样子  可爱  可笑  便 说   孩子  不要 太急  先 讲个 墨池 故事,1,,0.6146179466020494,0
TRAIN_SENT_ID_253098,颜回,孔子,孔子 忍不住 喜动 笑颜 地说 ： “ 颜回 ， 如果 你 以后 富有 了 ， 我 就要 做 你 的 管家 。 ”,人物二 忍不住 喜动 笑颜 地说   人物一  以后 富有  做 管家,1,,0.6589964940434411,0
TRAIN_SENT_ID_255197,赵海燕,赵本山,（ 本山 艺术 学院 专职 教师 （ 赵本山 徒弟 ） ） : 赵海燕 ， 女 ， 1974 年出 生于 吉林省 。,本山 艺术 学院 专职 教师  人物二 徒弟    人物一  女   年出 生于 吉林省,1,,0.6287540537970406,0
TRAIN_SENT_ID_251427,李瀚章,李鸿章,当时 的 曾国藩 不过 是 个 普通 的 京官 ， 而 李文安 早早 就 安排 自己 的 两个 儿子 李瀚章 、 李鸿章 拜 曾国藩 为师 ， 向 他 学习 “ 义理 经世之 学 。 ”,当时 曾国藩 普通 京官  李文安 早早 安排 两个 儿子 人物一  人物二 拜 曾国藩 为师  学习  义理 经世之 学,-1,,0.6537341177463531,0
TRAIN_SENT_ID_255215,赵海燕,赵本山,相亲 简介 : 2011 年 辽视春 晚上 由 著名 笑星 赵本山 携 弟子 宋小宝 、 赵海燕 表演 的 小品 《 相亲 》 。,相亲 简介   年 辽视春 晚上 著名 笑星 人物二 携 弟子 宋小宝  人物一 表演 小品  相亲,1,,0.6547841316177732,0
TRAIN_SENT_ID_276976,樊迟,孔子,樊迟 问 孔子 怎样 才 算是 智 ， 孔子 说 ： “ 专心 致力于 （ 提倡 ） 老百姓 应该 遵从 的 道德 ， 尊敬 鬼神 但 要 远离 它 ， 就 可以 说 是 智 了 。 ”,人物一 问 人物二 算是 智  人物二 说   专心 致力于  提倡  老百姓 应该 遵从 道德  尊敬 鬼神 远离  说 智,1,,0.673208794423512,0
TRAIN_SENT_ID_253066,颜回,孔子,所以 人 的 学问 修养 ， 到 了 仁 的 境界 ， 才能 像 孔子 最 得意 的 学生 颜回 一样 ； 一箪食 ， 一瓢 饮 ， 可以 不改其乐 ， 不失 其节 。,学问 修养  仁 境界  人物二 得意 学生 人物一  一箪食  一瓢 饮  不改其乐  不失 其节,1,,0.6677309913294656,0
TRAIN_SENT_ID_279514,殷梨亭,张三丰,《 倚天 屠龙记 》 中 张三丰 的 七个 徒弟 从大到 小 顺序 分别 是 ： 宋远桥 、 俞莲舟 、 俞岱岩 、 张松溪 、 张翠山 、 殷梨亭 、 莫声谷 。,倚天 屠龙记  中 人物二 七个 徒弟 从大到 顺序  宋远桥  俞莲舟  俞岱岩  张松溪  张翠山  人物一  莫声谷,1,,0.6880556046962738,0
TRAIN_SENT_ID_265559,张崇基,张崇德,张崇基 及 张崇德 两 兄弟 在 2003 年 12 月 12 日至 15 日 在 香港 伊利 沙伯 体育馆 ， 举行 第二 之 演唱会 《 二人 之 重唱 演唱会 2003 》 。,人物一 人物二 两 兄弟  年  月  日至  日 香港 伊利 沙伯 体育馆  举行 第二 演唱会  二人 重唱 演唱会,-1,,0.6216367383797964,0
TRAIN_SENT_ID_264570,胡青牛,张无忌,胡青牛 说 这番话 时 ， 那 满脸 皱纹 、 泪光 莹莹 的 哀伤 情状 ， 曾令 张无忌 心中 大是 难过 。,人物一 说 这番话 时  满脸 皱纹  泪光 莹莹 哀伤 情状  曾令 人物二 心中 大是 难过,1,,0.6365418065161932,0
TRAIN_SENT_ID_268959,韩非,荀子,不过 荀子 对 “ 术 ” 的 论述 已 大大 超过 了 申不害 ， 有些 话 甚至 他 的 弟子 韩非 、 李斯 也 不敢 奉教 ， 这是 我们 要 明白 的 。,人物二  术  论述 大大 超过 申不害  话 弟子 人物一  李斯 不敢 奉教  这是 明白,1,,0.6648217184203011,0
TRAIN_SENT_ID_284779,言达平,梅念笙,言达平 （ “ 陆地 神龙 ” 、 梅念笙 二 弟子 ） 【 天宁寺 中 被 戚长发 杀死 】,人物一   陆地 神龙   人物二 二 弟子   天宁寺 中 戚长发 杀死,1,,0.6882443995702834,0
TRAIN_SENT_ID_252767,颜回,孔子,《 孔子 家语 · 七十二 弟子 解 》 ： “ 颜由 ， 颜回 父 ， 字 季路 。,人物二 家语  七十二 弟子 解    颜由  人物一 父  字 季路,1,,0.6880952517191569,0
TRAIN_SENT_ID_255189,赵海燕,赵本山,03 月 03 日 《 樱桃红 》 赵本山 ， 宋小宝 ， 沈春阳 ， 王天泽 ， 彭雨柔 ， 关婷娜 ， 赵海燕 ， 蔡维利 ， 杨议 ， 小 沈阳 ， 张可,月  日  樱桃红  人物二  宋小宝  沈春阳  王天泽  彭雨柔  关婷娜  人物一  蔡维利  杨议  沈阳  张可,1,,0.5883051313105083,0
TRAIN_SENT_ID_285892,班淑娴,白鹿子,白鹿子 ， 金庸 武侠小说 《 倚天 屠龙记 》 中 的 人物 ， 昆仑 派 掌门 ， 何足道 的 弟子 ， 何太冲 、 班淑娴 的 师父 ， 与 明教中 一个 高手 争斗 而 死 。,人物二  金庸 武侠小说  倚天 屠龙记  中 人物  昆仑 派 掌门  何足道 弟子  何太冲  人物一 师父  明教中 一个 高手 争斗 死,1,,0.6602236273742857,0
TRAIN_SENT_ID_259379,葛玄,左慈,葛玄 ： 丹阳 郡 （ 今属 江苏省 句容 ） 人 ， 三国 吴 道士 ， 曾 从 左慈 学 道 ， 并入 深山 修道 。,人物一  丹阳 郡  今属 江苏省 句容   三国 吴 道士  人物二 学 道  并入 深山 修道,1,,0.708953469991684,1
TRAIN_SENT_ID_263360,武修文,武敦儒,武修文 是 金庸 小说 《 神雕侠侣 》 中 的 人物 ， 是 一灯大师 四大 弟子 “ 渔樵 耕读 ” 之一 耕夫 武三通 之子 ， 母亲 是 武三娘 ， 兄长 是 武敦儒 。,人物一 金庸 小说  神雕侠侣  中 人物  一灯大师 四大 弟子  渔樵 耕读  耕夫 武三通 之子  母亲 武三娘  兄长 人物二,-1,,0.6942586813654218,0
TRAIN_SENT_ID_259004,张苞,张绍,是 蜀汉 名将 张飞 之孙 ， 张苞 之子 ， 张绍 之 侄 。,蜀汉 名将 张飞 之孙  人物一 之子  人物二 侄,-1,,0.7281344561349778,1
TRAIN_SENT_ID_256938,仲由,孔子,时 少年 仲由 被 孔子 谦虚 的 精神 所 打动 ， 应声 跪下 道 ： “ 学生 有罪 ， 受小徒 一拜 。 ”,时 少年 人物一 人物二 谦虚 精神 打动  应声 跪下 道   学生 有罪  受小徒 一拜,1,,0.6627959963821229,0
TRAIN_SENT_ID_256481,周武,周文,周文 王和 周武 王 立誓 要 灭掉 商朝 ， 是 基于 政治 发展 与 私人 仇恨 所 产生 的 态度 ， 丑化 妲 己 只是 一种 政治 手段 。,人物二 王和 人物一 王 立誓 灭掉 商朝  政治 发展 私人 仇恨 产生 态度  丑化 妲 一种 政治 手段,-1,,0.7152773766290574,1
TRAIN_SENT_ID_265444,薛谭,秦青,薛谭 （ 听 了 后 ） 便 （ 向 秦青 ） 道歉 并 要求 能 返回 （ 继续 跟 秦青 学习 唱歌 ） ， （ 从此 ） 一辈子 也 不再 说辞 别的 事 了 。,人物一  听  便  人物二  道歉 要求 返回  继续 人物二 学习 唱歌     一辈子 不再 说辞 事,1,,0.5438081309908912,0
TRAIN_SENT_ID_269583,张瑶萱,张瑶华,1 家庭成员 : 爸 、 妈 、 一兄 、 一妹 、 太太 罗美薇 及 两个 女儿 （ 大 女儿 ： 张瑶华 、 二女儿 ： 张瑶萱 ）,家庭成员  爸  妈  一兄  一妹  太太 罗美薇 两个 女儿  女儿  人物二  二女儿  人物一,-1,,0.5812592137427557,0
TRAIN_SENT_ID_271202,张翠山,张三丰,在 东海 王盘山 岛上 ， 江湖 人士 为争 屠龙刀 而 起 纷争 ， 武当 祖题 张三丰 五 弟子 张翠山 和 天鹰 教 的 段 素素 被 明教 金毛狮 王 谢逊 胁迫 至 冰火 岛 。,东海 王盘山 岛上  江湖 人士 为争 屠龙刀 纷争  武当 祖题 人物二 五 弟子 人物一 天鹰 教 段 素素 明教 金毛狮 王 谢逊 胁迫 冰火 岛,1,,0.6071804719311851,0
TRAIN_SENT_ID_253071,颜回,孔子,( 1 ) 颜生 ： 即 颜回 ， 字子渊 ， 春秋 时鲁国 人 ， 是 孔子 最 得意 的 弟子 。,颜生  人物一  字子渊  春秋 时鲁国  人物二 得意 弟子,1,,0.6799078427609944,0
TRAIN_SENT_ID_252411,颜回,孔子,颜子 身讽 作品 注释 : （ 1 ） 颜子 ： 孔子 弟子 颜回 ， 春秋 时鲁国 人 ， 字子渊 。,颜子 身讽 作品 注释     颜子  人物二 弟子 人物一  春秋 时鲁国  字子渊,1,,0.7024749659356617,1
TRAIN_SENT_ID_262242,尤二姐,尤三姐,金陵 十二 副钗 尤三姐 : 尤三姐 ， 十二 副钗 之一 ， 尤氏 继母 带来 的 女儿 ， 尤二姐 的 妹妹 。,金陵 十二 副钗 人物二  人物二  十二 副钗  尤氏 继母 带来 女儿  人物一 妹妹,-1,,0.6973181920392173,0
TRAIN_SENT_ID_275544,王小虎,赵本山,12 年 10 月 21 日 ， 赵本山 爱徒 王小虎 、 张可 在 北京 举行 了 婚礼 。,年  月  日  人物二 爱徒 人物一  张可 北京 举行 婚礼,1,,0.5225082777795338,0
TRAIN_SENT_ID_285734,陈应德,杨虎,李景延 弟子 杨虎 ， 其 得意 弟子 有 谢功 吉 、 陈名标 、 陈应德 、 杨绍 舜 。,李景延 弟子 人物二  得意 弟子 谢功 吉  陈名标  人物一  杨绍 舜,1,,0.6306335386775789,0
TRAIN_SENT_ID_265402,薛谭,秦青,1 译文 : 薛谭 向 秦青 学习 唱歌 ， 还 没有 学完 秦青 的 技艺 ， 就 以为 学尽 了 ， 于是 就 告辞 回家 。,译文  人物一 人物二 学习 唱歌  没有 学完 人物二 技艺  学尽  告辞 回家,1,,0.5737824255511874,0
TRAIN_SENT_ID_279089,程英,黄药师,不过 她 最 成功 的 应该 是 在 电视剧 领域 ， 比较 有 影响 的 角色 是 83 版 《 神雕侠侣 》 中 扮演 黄药师 的 女 徒弟 程英 。,成功 应该 电视剧 领域  比较 影响 角色  版  神雕侠侣  中 扮演 人物二 女 徒弟 人物一,1,,0.6655316679250627,0
TRAIN_SENT_ID_265469,薛谭,秦青,一天 ， 他 的 学生 薛谭 认为 学完 了 他 的 歌唱 技巧 ， 请求 回家 ， 秦青 没有 阻止 ， 为此 ， 秦青 便 在 郊外 设宴 给 学生 薛谭 送行 。,一天  学生 人物一 认为 学完 歌唱 技巧  请求 回家  人物二 没有 阻止   人物二 便 郊外 设宴 学生 人物一 送行,1,,0.6544813556330544,0
TRAIN_SENT_ID_275527,王小虎,赵本山,王小虎 个人 生活 : 恩爱 时刻 12 年 10 月 21 日 ， 赵本山 徒弟 王小虎 、 张可 在 结婚 12 年 后 补办 结婚仪式 。,人物一 个人 生活  恩爱 时刻  年  月  日  人物二 徒弟 人物一  张可 结婚  年 补办 结婚仪式,1,,0.5795223464568456,0
TRAIN_SENT_ID_256978,仲由,孔子,仲子 纪念馆 仲姓 仲由 : 春秋 时鲁国 人 ， 字 子路 ， 孔子 的 得意 弟子 ， 他 直率 勇敢 ， 仕卫为 邑 宰 。,仲子 纪念馆 仲姓 人物一  春秋 时鲁国  字 子路  人物二 得意 弟子  直率 勇敢  仕卫为 邑 宰,1,,0.6971857022671473,0
TRAIN_SENT_ID_275244,汤潮,赵本山,《 好男儿 》 ( 赵本山 导演 电视剧 《 关东 大 先生 》 主题曲 ) 小 沈阳 、 汤潮 演唱 ( 担任 ： 说唱 ),好男儿   人物二 导演 电视剧  关东 先生  主题曲  沈阳  人物一 演唱  担任  说唱,1,,0.6281711629458836,0
TRAIN_SENT_ID_252884,颜回,孔子,颜回 不仅 是 孔子 最 得意 的 弟子 之一 ， 更是 公认 的 孔子 弟子 中 最 有 德行 的 人 。,人物一 人物二 得意 弟子  更是 公认 人物二 弟子 中 德行,1,,0.6404461136886052,0
TRAIN_SENT_ID_282211,萧玦,萧琛,可是 于 萧琛 的 事 上 ， 难免 做 的 有些 偏颇 ， 是 她 用 了 那样 巧妙 又 决绝 的 方式 永远 的 隔开 了 他 和 萧玦 的 ， 唯一 的 ， 仅存 的 ， 兄弟 情谊 。,人物二 事  难免 做 偏颇  巧妙 决绝 方式 永远 隔开 人物一  唯一  仅存  兄弟 情谊,-1,,0.6531130203178951,0
TRAIN_SENT_ID_252496,颜回,孔子,春秋时期 ， 孔子 经常 教育 他 的 学生 向 颜回 学习 ， 不要 追慕 富贵 与 享受 ， 用心 读书 。,春秋时期  人物二 经常 教育 学生 人物一 学习  不要 追慕 富贵 享受  用心 读书,1,,0.6152174685682569,0
TRAIN_SENT_ID_250364,赵飞燕,赵合德,“ 二赵 ” 是 中国 西汉时期 著名 的 美女 赵飞燕 、 赵合德 的 合称 。,二赵  中国 西汉时期 著名 美女 人物一  人物二 合称,-1,,0.6976876869088128,0
TRAIN_SENT_ID_250725,鲁西西,皮皮鲁,皮皮鲁 和 鲁西西 剧情简介 : 皮皮鲁 家 最近 发生 了 一系列 怪事 ， 起因 是从 未来 的 41 世纪 来 剧照 ( 5 张 ),人物二 人物一 剧情简介  人物二 家 最近 发生 一系列 怪事  起因 是从 未来  世纪 剧照   张,-1,,0.6826394399007162,0
TRAIN_SENT_ID_283966,贾伦,侯耀文,2004 年 正式 拜 中国铁路文工团 著名 相声 演员 侯耀文 大 弟子 贾伦 为师,年 正式 拜 中国铁路文工团 著名 相声 演员 人物二 弟子 人物一 为师,1,,0.5965729057788849,0
TRAIN_SENT_ID_250641,鲁西西,皮皮鲁,鲁西西 和 大 侦探 乔 麦皮 人物 介绍 : 皮皮鲁 他 学习成绩 不高 ， 不是 学校 老师 喜欢 的 那种 乖孩子 ， 但 他 心地善良 、 正义 勇敢 ， 身上 有 故事 。,人物一 侦探 乔 麦皮 人物 介绍  人物二 学习成绩 不高  学校 老师 喜欢 那种 乖孩子  心地善良  正义 勇敢  身上 故事,-1,,0.643927758648282,0
TRAIN_SENT_ID_268915,司徒静,司徒剑南,二人 都 吃惊 ， 司徒静 谎称 是 司徒府 二 公子 ， 并 说明 文韬 强横 真相 ， 朱允 承诺 帮助 司徒剑南 。,二人 吃惊  人物一 谎称 司徒府 二 公子  说明 文韬 强横 真相  朱允 承诺 帮助 人物二,-1,,0.6664373675982157,0
TRAIN_SENT_ID_257478,姜昆,马季,著名 曲艺 表演艺术家 马季 、 刘兰芳 、 姜昆 、 李金斗 等 以及 济南 的 曲艺界 名家 纷纷 前来 捧场 、 献艺 。,著名 曲艺 表演艺术家 人物二  刘兰芳  人物一  李金斗 济南 曲艺界 名家 纷纷 前来 捧场  献艺,1,,0.6829232218719664,0
TRAIN_SENT_ID_264258,陈真,霍元甲,霍元甲 的 大 徒弟 陈真 （ 石天龙 饰 ） ， 为 师傅 报仇 ， 杀 了 日本 领事 ， 被 日本 浪人 追杀 。,人物二 徒弟 人物一  石天龙 饰   师傅 报仇  杀 日本 领事  日本 浪人 追杀,1,,0.6765208811987014,0
TRAIN_SENT_ID_250359,赵飞燕,赵合德,后 汉成帝 宠爱 赵飞燕 、 赵合德 姐妹 ， 许皇后 、 班婕妤 相继 失宠 ， 许皇后 废入 长定 宫 ， 班婕妤 前去 侍奉 太后 。,汉成帝 宠爱 人物一  人物二 姐妹  许皇后  班婕妤 相继 失宠  许皇后 废入 长定 宫  班婕妤 前去 侍奉 太后,-1,,0.6770701990241096,0
TRAIN_SENT_ID_265457,薛谭,秦青,」 绕梁三日 典源 译文 : 薛谭 向 秦青 学习 唱歌 ， 还 没有 把 秦青 的 本领 完全 学到 手 ， 自 以为 没有 什么 可学 的 了 ， 于是 告辞 回家 。,绕梁三日 典源 译文  人物一 人物二 学习 唱歌  没有 人物二 本领 完全 学到 手  没有 可学  告辞 回家,1,,0.5726246684789658,0
TRAIN_SENT_ID_255462,罗成,秦琼,再往 下 看 ， 两人 看 秦用 表演 锤 ， 又 出现 了 一句 话 ： “ 罗成 便 对 秦琼 说 ： “ 表哥 ， 你 看 这个 卖艺 的 ， 长得 多 威武 ， 真 把 我 爱 死 啦 ！ ”,再往  两人 秦用 表演 锤  出现 一句 话   人物一 便 人物二 说   表哥  卖艺  长得 威武  真 爱 死,-1,,0.6218780733290172,0
TRAIN_SENT_ID_256968,仲由,孔子,仲由 ： 字 子路 ， 孔子 弟子 。,人物一  字 子路  人物二 弟子,1,,0.6559088130791982,0
TRAIN_SENT_ID_269449,毛岸龙,毛岸英,1930 年 4 月 其妹 杨开慧 被捕 时 ， 毛岸英 只有 八岁 、 毛岸青 只有 七岁 、 毛岸龙 只有 三岁 。,年  月 其妹 杨开慧 被捕 时  人物二 八岁  毛岸青 七岁  人物一 三岁,-1,,0.5990108989533924,0
TRAIN_SENT_ID_256854,仲由,孔子,仲由 ， 公元前 542 ～ 前 480 年 ， 字 子路 ， 又 字 季路 ， 鲁国 卞人 （ 今 山东 泗水 泉林 镇 卞 桥村 ） ， 孔子 的 得意门生 ， 以 政事 见称 。,人物一  公元前   前  年  字 子路  字 季路  鲁国 卞人  山东 泗水 泉林 镇 卞 桥村   人物二 得意门生  政事 见称,1,,0.664654362769354,0
TRAIN_SENT_ID_267507,裘千丈,裘千仞,裘千丈 ， 金庸 武侠小说 《 射雕 英雄传 》 中 人物 ， 铁掌 帮 帮主 裘千仞 的 双胞胎 哥哥 。,人物一  金庸 武侠小说  射雕 英雄传  中 人物  铁掌 帮 帮主 人物二 双胞胎 哥哥,-1,,0.6882041607584272,0
TRAIN_SENT_ID_261623,宋小宝,赵本山,节目 结束 后 ， 赵本山 脱帽 谢幕 ， 并 携 赵家 班 弟子 赵海燕 、 宋小宝 、 小 沈阳 、 程野 给 全国 观众 拜年 ， 祝 大家 新年快乐 。,节目 结束  人物二 脱帽 谢幕  携 赵家 班 弟子 赵海燕  人物一  沈阳  程野 全国 观众 拜年  祝 新年快乐,1,,0.6120799510251909,0
TRAIN_SENT_ID_255456,罗成,秦琼,"后来 罗成 对 他 的 结拜 二哥 秦琼 说 ： 有 机会 我 一定 要 在 那 歇马 的 的 滩头 建个 亭子 叫 "" 白鹭 亭 "" ， 感谢 那些 救命 的 白鹭 。",后来 人物一 结拜 二哥 人物二 说  机会 一定 歇马 滩头 建个 亭子  白鹭 亭   感谢 救命 白鹭,-1,,0.6618234671297527,0
TRAIN_SENT_ID_252772,颜回,孔子,颜回 和 子路 是 孔子 最好 的 、 最 喜欢 的 两个 弟子 。,人物一 子路 人物二 最好  喜欢 两个 弟子,1,,0.6634718449342818,0
TRAIN_SENT_ID_257588,毛泽民,毛泽东,革命 与 爱 ： 毛泽东 毛泽民 兄弟 关系 作者简介 : 作者 之一 ： 耘 山,革命 爱  人物二 人物一 兄弟 关系 作者简介  作者  耘 山,-1,,0.697291632493337,0
TRAIN_SENT_ID_250624,鲁西西,皮皮鲁,1 内容梗概 : 皮皮鲁 、 鲁西西 和 舒克 贝塔 打扑克 的 时候 发现 少 了 一张 红桃 K 。,内容梗概  人物二  人物一 舒克 贝塔 打扑克 发现 少 一张 红桃,-1,,0.6801836178416297,0
TRAIN_SENT_ID_259696,游颖,游娴,这 一切 全给 游颖 看 在 眼内 ， 本着 逞强 的 心 ， 游颖 没有 将 误会 即时 澄清 ， 成为 她 与 亲 姊 游娴 之间 的 一道 刺 。,全给 人物一 眼内  逞强 心  人物一 没有 误会 即时 澄清  成为 亲 姊 人物二 之间 一道 刺,-1,,0.6791196621599651,0
TRAIN_SENT_ID_285418,周云鹏,赵本山,周云鹏 ， 本名 周滨 ， 1982 年 4 月 20 日 出生 ， 辽宁省 辽中县 人 ， 赵本山 先生 39 号 弟子 。,人物一  本名 周滨   年  月  日 出生  辽宁省 辽中县  人物二 先生  号 弟子,1,,0.6491526450429644,0
TRAIN_SENT_ID_275142,孙立荣,赵本山,孙立荣 主要 作品 : 《 刘老根 Ⅰ Ⅱ 》 《 乡村 爱情 1 - 7 》 《 乡村 名流 》 赵本山 徒弟 :,人物一 主要 作品   刘老根 Ⅰ Ⅱ   乡村 爱情      乡村 名流  人物二 徒弟,1,,0.688814693973178,0
TRAIN_SENT_ID_271287,马季,侯宝林,天津 著名 的 相声 演员 有 ： 马三立 、 侯宝林 、 常宝堃 、 高英培 、 马季 、 冯巩 、 牛群 、 郭德纲 、 于谦 等 。,天津 著名 相声 演员  马三立  人物二  常宝堃  高英培  人物一  冯巩  牛群  郭德纲  于谦,1,,0.6197626604920342,0
TRAIN_SENT_ID_257572,毛泽民,毛泽东,1925 年初 ， 毛泽东 与 妻子 杨开慧 、 弟弟 毛泽民 一同 从 长沙 回到 家乡 韶山冲 ， 开展 农民 运动 。,年初  人物二 妻子 杨开慧  弟弟 人物一 一同 长沙 回到 家乡 韶山冲  开展 农民 运动,-1,,0.6178916948182243,0
TRAIN_SENT_ID_283920,罗人杰,余沧海,罗人杰 ， 青城 余沧海 的 四大 得意 弟子 之一 。,人物一  青城 人物二 四大 得意 弟子,1,,0.6776960066386631,0
TRAIN_SENT_ID_252389,颜回,孔子,人们 能 很 清楚 地 发现 孔子 爱 学生 ， 爱 颜回 ， 爱子 路 ， 爱子 贡 。,清楚 发现 人物二 爱 学生  爱 人物一  爱子 路  爱子 贡,1,,0.662138724610919,0
TRAIN_SENT_ID_252905,颜回,孔子,孔子 说 ； “ 只有 颜回 最好 学 。,人物二 说   人物一 最好 学,1,,0.6450741007214501,0
TRAIN_SENT_ID_260954,杨露禅,陈长兴,杨露禅 才 得以 正式 拜 陈长兴 为师 。,人物一 得以 正式 拜 人物二 为师,1,,0.5945729208844048,0
TRAIN_SENT_ID_249017,吕洞宾,韩湘子,3 . 蓬莱 八仙 ： 张果老 、 汉 钟离 、 吕洞宾 、 蓝采和 、 韩湘子 、 何仙姑 、 曹国舅 、 铁拐李 。,蓬莱 八仙  张果老  汉 钟离  人物一  蓝采和  人物二  何仙姑  曹国舅  铁拐李,1,,0.8373038449457714,1
TRAIN_SENT_ID_267530,扈成,扈三娘,曾 执导 过 《 杨家将 》 、 《 水浒传 》 、 《 三国演义 》 等 诸多 作品 ， 在 《 三国演义 》 中 扮演 司马师 ， 《 水浒传 》 中 扮演 扈三娘 的 哥哥 扈成 。,执导  杨家将    水浒传    三国演义  诸多 作品   三国演义  中 扮演 司马师   水浒传  中 扮演 人物二 哥哥 人物一,-1,,0.6749331681501298,0
TRAIN_SENT_ID_271266,马季,侯宝林,他 随 老师 侯宝林 走南闯北 ， 巡回演出 ， 还 经常 到 中南海 表演 ， 当时 的 报纸 评论 他 是 继 马季 之后 又 一颗 新星 。,老师 人物二 走南闯北  巡回演出  经常 中南海 表演  当时 报纸 评论 继 人物一 之后 一颗 新星,1,,0.6311745870681036,0
TRAIN_SENT_ID_261615,宋小宝,赵本山,03 月 03 日 《 樱桃红 》 赵本山 宋小宝 沈春阳 王天泽 彭雨柔 关婷娜 赵海燕 蔡维利 杨议 小 沈阳 张可,月  日  樱桃红  人物二 人物一 沈春阳 王天泽 彭雨柔 关婷娜 赵海燕 蔡维利 杨议 沈阳 张可,1,,0.586011834087826,0
TRAIN_SENT_ID_249252,皮皮鲁,鲁西西,皮皮鲁 和 鲁西西 有 许多 好玩 的 经历 ， 都 收集 在 30 卷 《 郑渊洁 童话 全集 》 里 ， 你 以后 会 陆续 知道 。,人物一 人物二 好玩 经历  收集  卷  郑渊洁 童话 全集  里  以后 会 陆续 知道,-1,,0.6758023571400416,0
TRAIN_SENT_ID_252593,颜回,孔子,在 孔门 弟子 中 ， 颜回 最称 高足 ， 其 品德 与 学业 均 翘 居 群首 ， 是 孔子 多次 赞许 的 弟子 。,孔门 弟子 中  人物一 最称 高足  品德 学业 均 翘 居 群首  人物二 多次 赞许 弟子,1,,0.6581920371169135,0
TRAIN_SENT_ID_252980,颜回,孔子,1983 年 12 月 ， 洛阳市 举行 音乐舞蹈 调演 时 ， 西庞村 海神 社被 邀请 参加 演出 ， 演奏 了 《 孔子 哭 颜回 》 ， 博得 好评 。,年  月  洛阳市 举行 音乐舞蹈 调演 时  西庞村 海神 社被 邀请 参加 演出  演奏  人物二 哭 人物一   博得 好评,1,,0.5760405631292433,0
TRAIN_SENT_ID_275495,苏华仁,吴云青,1998 年 夏初 ， 吴青云 随 弟子 苏华仁 到 安阳 北郊 ； 1998 年 9 月 22 日 凌晨 ， 吴云青 仙逝 于北效 佛祖 寺 。,年 夏初  吴青云 弟子 人物一 安阳 北郊   年  月  日 凌晨  人物二 仙逝 于北效 佛祖 寺,1,,0.6097475432214283,0
TRAIN_SENT_ID_261718,汤镇业,汤镇宗,《 极致 情感 》 主演 丁宁 合作 演员 电视剧 《 福星 临门 》 饰演 虎子 剧照 韩会亮 汤镇宗 、 汤镇业 合作 导演 蒋少华,极致 情感  主演 丁宁 合作 演员 电视剧  福星 临门  饰演 虎子 剧照 韩会亮 人物二  人物一 合作 导演 蒋少华,-1,,0.5541666008177257,0
TRAIN_SENT_ID_275494,苏华仁,吴云青,1998 年 夏初 ， 吴云青 随 弟子 苏华仁 到 安阳 北郊 ； 1998 年 9 月 22 日 凌晨 ， 吴云青 仙逝 于北效 佛祖 寺 。,年 夏初  人物二 弟子 人物一 安阳 北郊   年  月  日 凌晨  人物二 仙逝 于北效 佛祖 寺,1,,0.6349921652248928,0
