sent_id,sent_id,entity1,entity2,sent,processed_sent,human
TRAIN_SENT_ID_252422,,颜回,孔子,孔子 对 颜回 亦 引 以为 是 唯一 的 同道 ， 说 “ 用 之 则 行 ， 舍之则 藏 ， 唯 我 与 尔 有 是 夫 ！ ”,人物二 人物一 引 唯一 同道  说  行  舍之则 藏  唯 夫,-1
TRAIN_SENT_ID_260959,,杨露禅,陈长兴,当 所有 矛头 都 指向 杨露禅 一人 的 时候 ， 深谋远虑 的 掌门人 陈长兴 亲手 拆穿 了 儿子 栽秧 的 诡计 ： 他 用 花样百出 的 科学 手法 伪装成 武功 高手 。,矛头 指向 人物一 一人  深谋远虑 掌门人 人物二 亲手 拆穿 儿子 栽秧 诡计  花样百出 科学 手法 伪装成 武功 高手,-1
TRAIN_SENT_ID_271218,,和硕温恪公主,和硕敦恪公主,怡贤 亲王 胤 祥 胞妹 : 十三 格格 和硕温恪公主 （ 1687 年 ~ 1709 年 ） 和 十五 格格 和硕敦恪公主 （ 1691 年 ~ 1709 年 ） 。,怡贤 亲王 胤 祥 胞妹  十三 格格 人物一   年   年  十五 格格 人物二   年   年,1
TRAIN_SENT_ID_261329,,罗松,罗成,1 人物 简介 : 隋唐 时期 罗艺 之孙 （ 祖母 姜桂芝 ） ， 罗松 之子 ， 罗成 的 侄子 。,人物 简介  隋唐 时期 罗艺 之孙  祖母 姜桂芝   人物一 之子  人物二 侄子,1
TRAIN_SENT_ID_273688,,姜子牙,元始天尊,"元始天尊 后 又 将 阐教 掌门 传于 姜子牙 , 导致 门下 内讧 不已 , 十二 金仙 所剩 八仙 破门 立教 , 自立门户 。",人物二 阐教 掌门 传于 人物一  导致 门下 内讧 不已  十二 金仙 所剩 八仙 破门 立教  自立门户,-1
TRAIN_SENT_ID_259630,,公孙胜,罗真人,罗真人 ， 是 古典名著 《 水浒传 》 中 的 人物 ， 罗真人 是 入云龙 公孙胜 的 师父 ， 是 个 法力 高强 的 道士 。,人物二  古典名著  水浒传  中 人物  人物二 入云龙 人物一 师父  法力 高强 道士,-1
TRAIN_SENT_ID_252557,,颜回,孔子,颜回 这种 注重 志气 、 追求真理 并 以 之 为 乐 的 精神 ， 与 孔子 本人 “ 饭 疏食 饮水 ， 曲肱而枕 之 ， 乐 亦 在 其中 ” （ 同 上 ） 实 同一 旨趣 。,人物一 这种 注重 志气  追求真理 乐 精神  人物二  饭 疏食 饮水  曲肱而枕  乐    实 同一 旨趣,-1
TRAIN_SENT_ID_270590,,全真七子,王重阳,14 、 想 检验 武功 的话 试试 王重阳 和 全真七子 的 天罡 北斗 阵 ， 多数 是 有去无回 。,想 检验 武功 试试 人物二 人物一 天罡 北斗 阵  多数 有去无回,-1
TRAIN_SENT_ID_252858,,颜回,孔子,孔子 对 （ 11 ） 曰 ： “ 有 颜回 者 好学 ， 不 迁怒 （ 12 ） ， 不 贰 过 （ 13 ） 。,人物二    曰   人物一 好学  迁怒     贰,-1
TRAIN_SENT_ID_253042,,颜回,孔子,孔子 对 颜回 说 ： “ 我 以前 的 那些 言行 ， 你 可以 忘掉 ； 你 向 我 学到 的 那些 言行 ， 我 也 要 忘掉 。,人物二 人物一 说   以前 言行  忘掉  学到 言行  忘掉,-1
TRAIN_SENT_ID_265414,,薛谭,秦青,秦青 善歌 ： 据 《 列子 ． 汤问 》 记载 ： 薛谭 随 秦青 学唱 ， 可能 是 觉得 自己 学得 差不多 了 的 时候 呢 ， 就 向 老师 告辞 回家 。,人物二 善歌   列子 ． 汤问  记载  人物一 人物二 学唱  可能 觉得 学得 差不多  老师 告辞 回家,-1
TRAIN_SENT_ID_264276,,陈真,霍元甲,但 就 在 此时 ， 闻 霍元甲 病逝 ， 陈真 回国 ， 学业 半途而废 。,闻 人物二 病逝  人物一 回国  学业 半途而废,-1
TRAIN_SENT_ID_283221,,薛慕华,苏星河,4 、 虚竹 成为 逍遥派 掌门人 ， 经 康广陵 向虚竹 说明 玄难 、 苏星河 被害 原因 ， 薛慕华 等 函 谷八友 重归 逍遥派 门下,虚竹 成为 逍遥派 掌门人  康广陵 向虚竹 说明 玄难  人物二 被害 原因  人物一 函 谷八友 重归 逍遥派 门下,-1
TRAIN_SENT_ID_248996,,吕洞宾,韩湘子,道观 建成 ， 同祀 吕洞宾 、 韩湘子 ， “ 其名 青羊 二仙 庵 ， 所以 辅翼 修行 ， 即 青羊宫 之 别馆 也 。,道观 建成  同祀 人物一  人物二   其名 青羊 二仙 庵  辅翼 修行  青羊宫 别馆,-1
TRAIN_SENT_ID_255325,,卫夫人,王羲之,王羲之 的 老师 卫夫人 说 ： “ 学书 有序 ， 必先能 执笔 ” 。,人物二 老师 人物一 说   学书 有序  必先能 执笔,-1
TRAIN_SENT_ID_259750,,李偲菘,李伟菘,杜德伟 － 情话 假假 李偲菘 1995 年 : AlanHo 与 李伟菘 开办 了 “ 李伟菘 音乐课 室 ” 教导 歌唱 训练班 及 作曲 入门 班 的 课程 。,杜德伟  情话 假假 人物一  年   人物二 开办  人物二 音乐课 室  教导 歌唱 训练班 作曲 入门 班 课程,-1
TRAIN_SENT_ID_259937,,周志文,周志康,周志文 、 周志康 亲身 来到 西湖 ， 感受 当地 的 恬静 ， 解构 西湖 如何 由 浅浅的 海湾 ， 孕育出 人间 胜景 。,人物一  人物二 亲身 来到 西湖  感受 恬静  解构 西湖 浅浅的 海湾  孕育出 人间 胜景,-1
TRAIN_SENT_ID_259360,,葛玄,左慈,葛洪 《 抱朴子 · 金丹 篇 》 载 “ 左慈 是 葛玄 之师 ， 传其 《 太清丹经 》 三卷 ， 及 《 九鼎 丹经 》 、 《 金液 丹经 》 各 一卷 。 ”,葛洪  抱朴子  金丹 篇  载  人物二 人物一 之师  传其  太清丹经  三卷   九鼎 丹经    金液 丹经  一卷,-1
TRAIN_SENT_ID_282977,,张洪顺,侯耀华,张洪顺 基本 资料 : 姓名 ： 张洪 与 师傅 侯耀华 合影 顺,人物一 基本 资料  姓名  张洪 师傅 人物二 合影,-1
TRAIN_SENT_ID_257477,,姜昆,马季,《 传谣 》 表演者 ： 马季 、 赵炎 、 刘伟 、 姜昆,传谣  表演者  人物二  赵炎  刘伟  人物一,-1
TRAIN_SENT_ID_250088,,武敦儒,武修文,很多 人 觉得 与 杨过 对比 ， 武敦儒 、 武修文 更显 脓包 、 废物 。,很多 觉得 杨过  人物一  人物二 更显 脓包  废物,-1
TRAIN_SENT_ID_256510,,周武,周文,武王发 ， 即 周武 王姬 发 ， 周文 王姬 昌 与 太 姒 的 嫡 次子 ， 其正 妻为 邑 姜 ， 西周 王朝 开国 君主 ， 在位 13 年 。,武王发  人物一 王姬 发  人物二 王姬 昌 太 姒 嫡 次子  其正 妻为 邑 姜  西周 王朝 开国 君主  在位  年,1
TRAIN_SENT_ID_261347,,何猷启,何超莲,何猷启 生于 1991 年 5 月 9 日 ， 是 赌王 何鸿燊 与 三 姨太 陈婉珍 的 儿子 ， 同胞 姐姐 为 何超莲 。,人物一 生于  年  月  日  赌王 何鸿燊 三 姨太 陈婉珍 儿子  同胞 姐姐 人物二,1
TRAIN_SENT_ID_261437,,毛泽建,毛泽东,毛泽建 烈士 生平 简介 1919 年 ， 毛泽东 的 母亲 病逝 ， 第二年 春 上 ， 毛泽东 的 父亲 也 去世 了 。,人物一 烈士 生平 简介  年  人物二 母亲 病逝  第二年 春  人物二 父亲 去世,1
TRAIN_SENT_ID_253858,,赵合德,赵飞燕,其 孪生 妹妹 赵合德 ， 在 姐姐 赵飞燕 得宠 后 ， 经由 姊姊 的 关系 ， 她 亦 入宫 随侍 汉成帝 ， 并 深得 皇帝 宠爱 。,孪生 妹妹 人物一  姐姐 人物二 得宠  经由 姊姊 关系  入宫 随侍 汉成帝  深得 皇帝 宠爱,1
TRAIN_SENT_ID_263400,,武修文,武敦儒,武敦儒 、 武修文 被俘 之 时候 还 很 年轻 ， 武功 低微 是 很 正常 的 。,人物二  人物一 被俘 年轻  武功 低微 正常,-1
TRAIN_SENT_ID_273370,,杨锐,张之洞,张之洞 急电 挽救 他 的 得意门生 杨锐 而 不得 ， 为此 ， 他 深感 痛惜 。,人物二 急电 挽救 得意门生 人物一   深感 痛惜,-1
TRAIN_SENT_ID_250570,,鲁西西,皮皮鲁,鲁西西 人物 来源 : 在 结束 了 新年 的 迎来送往 之后 ， 郑渊洁 决定 在 山西 的 家里 创造 一个 中国式 的 童话 人物 ： 皮皮鲁 。,人物一 人物 来源  结束 新年 迎来送往 之后  郑渊洁 决定 山西 家里 创造 一个 中国式 童话 人物  人物二,1
TRAIN_SENT_ID_252724,,颜回,孔子,"历代 王朝 曾 先后 规定 ， 孔子 、 颜回 、 孟子 的 后裔 都 世袭 了 “ 翰林院 五经 博士 ” , 专掌 祀 典祀 产 ， 而 曾子 后裔 确无 这一 礼遇 。",历代 王朝 先后 规定  人物二  人物一  孟子 后裔 世袭  翰林院 五经 博士   专掌 祀 典祀 产  曾子 后裔 确无 这一 礼遇,-1
TRAIN_SENT_ID_252834,,颜回,孔子,第十三回 孔子 重操旧业 颜回 见 （ 黑出 ） 荆妻,第十三回 人物二 重操旧业 人物一 见  黑出  荆妻,-1
TRAIN_SENT_ID_278137,,裴元,孙思邈,只是 因为 跟随 孙思邈 的 缘故 ， 裴元 并未 入 医行 。,跟随 人物二 缘故  人物一 并未 入 医行,-1
TRAIN_SENT_ID_252713,,颜回,孔子,◎ 颜回 将 西游 ， 问于 孔子 曰 ： 「 何以 为身 ？,◎ 人物一 西游  问于 人物二 曰   为身,-1
TRAIN_SENT_ID_271283,,马季,侯宝林,（ 十 ） 1 、 卖马 侯宝林 刘宝瑞 高凤山 2 、 福寿全 常贵田 常宝华 3 、 对 春联 马季 郭启儒 4 、 拆字 马季 刘宝瑞 郭启儒,十    卖马 人物二 刘宝瑞 高凤山   福寿全 常贵田 常宝华   春联 人物一 郭启儒   拆字 人物一 刘宝瑞 郭启儒,-1
TRAIN_SENT_ID_268998,,韩非,荀子,孔子 ﹑ 墨子 ﹑ 孟子 ﹑ 荀子 ﹑ 韩非 等 是 其中 的 佼佼者 。,孔子  墨子  孟子  人物二  人物一 佼佼者,-1
TRAIN_SENT_ID_251885,,曹薰铉,李昌镐,第 3 局 模仿 之战 黑方 曹薰铉 白方 李昌镐,局 模仿 之战 黑方 人物一 白方 人物二,-1
TRAIN_SENT_ID_285188,,韩小莹,韩宝驹,师父 ： 柯镇恶 、 朱聪 、 韩宝驹 、 南希仁 、 张阿生 、 全金发 、 韩小莹 、 北丐 洪七公 、 蒙古 神箭手 哲别,师父  柯镇恶  朱聪  人物二  南希仁  张阿生  全金发  人物一  北丐 洪七公  蒙古 神箭手 哲别,-1
TRAIN_SENT_ID_261643,,宋小宝,赵本山,赵本山 也 曾多次 想带 爱徒 宋小宝 上 春晚 ， 但 都 因为 作品 不 理想 、 身体状况 不 允许 等 原因 半路 “ 夭折 ” 。,人物二 曾多次 想带 爱徒 人物一 春晚  作品 理想  身体状况 允许 原因 半路  夭折,-1
TRAIN_SENT_ID_251905,,曹薰铉,李昌镐,在 李昌镐 、 曹薰铉 盛行于 世 的 今天 ， 胡耀宇 依然 保持 着 对 小林光一 的 偏好 。,人物二  人物一 盛行于 世 今天  胡耀宇 依然 保持 小林光一 偏好,-1
TRAIN_SENT_ID_259778,,李偲菘,李伟菘,李伟菘 与 李偲菘 制作 了 梁咏琪 的 第二张 专辑 的 五 首歌 ， 包括 ： “ 爱 不能 成 ” ， “ 我们 的 笑 很 相 ” 等 。,人物二 人物一 制作 梁咏琪 第二张 专辑 五 首歌  包括   爱 不能 成    笑 相,-1
TRAIN_SENT_ID_273678,,姜子牙,元始天尊,姜子牙 归国 封神 ， 太 上 无极 混元 教主 元始天尊 敕 曰 ： 呜呼 ！,人物一 归国 封神  太 无极 混元 教主 人物二 敕 曰,-1
TRAIN_SENT_ID_256896,,仲由,孔子,这场 政变 中 ， 孔子 著名 子弟 仲由 被 杀 。,这场 政变 中  人物二 著名 子弟 人物一 杀,-1
TRAIN_SENT_ID_268949,,韩非,荀子,荀子 ： 和 孔子 、 孟子 等 齐名 的 大 学问家 ， 韩非 和 李斯 的 师父 。,人物二  孔子  孟子 齐名 学问家  人物一 李斯 师父,-1
TRAIN_SENT_ID_259395,,凌音,凌波,凌音 凌波 姐妹 、 铁笔 拜入 蜀山 派 。,人物一 人物二 姐妹  铁笔 拜入 蜀山 派,-1
TRAIN_SENT_ID_267513,,裘千丈,裘千仞,而 他 最为 内地 观众 所 熟悉 的 形象 ， 当属 1983 年 《 射雕 英雄传 》 中 的 孪生兄弟 裘千仞 和 裘千丈 。,最为 内地 观众 熟悉 形象  当属  年  射雕 英雄传  中 孪生兄弟 人物二 人物一,1
TRAIN_SENT_ID_264873,,田猛,田虎,在 烈山 堂堂 主 田猛 葬礼 上 随着 堂主 田虎 前来 吊唁 。,烈山 堂堂 主 人物一 葬礼 堂主 人物二 前来 吊唁,-1
TRAIN_SENT_ID_249047,,吕洞宾,韩湘子,正式 定型 为汉 钟离 （ 或 钟离权 ） 、 张果老 、 韩湘子 、 铁拐李 、 吕洞宾 、 何仙姑 、 蓝采和 及 曹国舅 。,正式 定型 为汉 钟离  钟离权   张果老  人物二  铁拐李  人物一  何仙姑  蓝采和 曹国舅,-1
TRAIN_SENT_ID_257565,,毛泽民,毛泽东,毛远志 （ 1923 - 1990 ） ， 湖南 韶山 人 ， 是 毛泽民 和 王淑兰 的 女儿 ， 毛泽东 唯一 的 亲 侄女 。,毛远志       湖南 韶山  人物一 王淑兰 女儿  人物二 唯一 亲 侄女,1
TRAIN_SENT_ID_269403,,刘伟,马季,《 找 名牌 》 表演者 ： 刘伟 、 马季,找 名牌  表演者  人物一  人物二,-1
TRAIN_SENT_ID_251552,,楚碧痕,楚寒镜,楚寒镜 见 楚碧痕 的 决心 ， 于是 告诉 众人 线索 。,人物二 见 人物一 决心  告诉 众人 线索,-1
TRAIN_SENT_ID_271278,,马季,侯宝林,师父 ： 侯宝林 师爷 ： 朱阔泉 师兄 ： 黄铁良 、 马季 、 殷培田 、 丁广泉 、 师胜杰 等 。,师父  人物二 师爷  朱阔泉 师兄  黄铁良  人物一  殷培田  丁广泉  师胜杰,-1
TRAIN_SENT_ID_267793,,万剑一,林惊羽,在此期间 ， 掩护 道 玄 真人 前往 幻月 洞府 的 林惊羽 偶遇 万剑一 ， 为 二人 的 师徒 之缘 埋下 伏笔 。,在此期间  掩护 道 玄 真人 前往 幻月 洞府 人物二 偶遇 人物一  二人 师徒 之缘 埋下 伏笔,-1
TRAIN_SENT_ID_253017,,颜回,孔子,师从 孔子 : 颜庙 颜回 “ 年 十三 ， 入 孔子 之 门 ” 时 ， 孔子 聚徒 讲学 已达 十三年 之 久 。,师从 人物二  颜庙 人物一  年 十三  入 人物二 门  时  人物二 聚徒 讲学 已达 十三年 久,-1
TRAIN_SENT_ID_271527,,孟优,孟获,孔明 正在 帐 中 与 马谡 、 吕凯 、 蒋琬 、 费祎 等 共议 平蛮 之 事 ， 忽 帐 下 一人 ， 报称 孟获 差弟 孟优 来进 宝贝 。,孔明 正在 帐 中 马谡  吕凯  蒋琬  费祎 共议 平蛮 事  忽 帐 一人  报称 人物二 差弟 人物一 来进 宝贝,-1
TRAIN_SENT_ID_271235,,马季,侯宝林,侯宝林 、 郭启儒 、 刘宝瑞 、 郭全宝 、 李文华 、 马季 和 关学曾 等 人 的 家属 纷纷表示 要 加入 这样 的 团体 。,人物二  郭启儒  刘宝瑞  郭全宝  李文华  人物一 关学曾 家属 纷纷表示 加入 团体,-1
TRAIN_SENT_ID_268983,,韩非,荀子,《 尸子 》 的 “ 审 名分 ” 理论 ， 和 荀子 、 韩非 、 道家 的 一些 思想 也 是 息息相通 的 。,尸子   审 名分  理论  人物二  人物一  道家 思想 息息相通,-1
TRAIN_SENT_ID_253000,,颜回,孔子,孔子 回答 ： “ 颜回 的 仁爱 超过 我 。 ”,人物二 回答   人物一 仁爱 超过,-1
TRAIN_SENT_ID_275148,,孙立荣,赵本山,赵本山 ： 坐下 吧 ， 坐 那儿 没事 ， 我 给 你 放 这 吧 行 不 （ 拿 起 孙立荣 的 衣服 ） ？,人物二  坐下  坐 没事  放 行  人物一 衣服,-1
TRAIN_SENT_ID_285798,,王中泉,黄四海,后继 承父业 掌罗 疃 张家 八式 房 ， 他 与 师兄 黄四海 共同 培养 了 王中泉 、 李书文 、 张毓 衡 、 韩化臣 、 马凤图 、 马英图 等 名徒 。,后继 承父业 掌罗 疃 张家 八式 房  师兄 人物二 共同 培养 人物一  李书文  张毓 衡  韩化臣  马凤图  马英图 名徒,-1
TRAIN_SENT_ID_259410,,凌音,凌波,凌音 角色 关系 : 亲人 ： 父母 未知 ， 有 一 亲生 姐姐 凌波 。,人物一 角色 关系  亲人  父母 未知  亲生 姐姐 人物二,1
TRAIN_SENT_ID_257802,,林平之,岳不群,林平之 与 岳不群 反目 后 ， 劳德诺 出现 力邀 其往 嵩山 共谋 。,人物一 人物二 反目  劳德诺 出现 力邀 其往 嵩山 共谋,-1
TRAIN_SENT_ID_259672,,公孙胜,罗真人,罗真人 算到 了 公孙胜 吃亏 了 ， 便 派 道童 来 给 公孙胜 送宝 了 。,人物二 算到 人物一 吃亏  便 派 道童 人物一 送宝,-1
TRAIN_SENT_ID_252822,,颜回,孔子,孔子 不 听 ， 颜回 为 驭 ， 子贡 为 右 ， 往见 盗 跖 。,人物二 听  人物一 驭  子贡 右  往见 盗 跖,-1
TRAIN_SENT_ID_274177,,牧野枣,牧野遥,牧野晶 相关 人物 : 姐姐 ： 牧野遥 、 牧野枣,牧野晶 相关 人物  姐姐  人物二  人物一,1
TRAIN_SENT_ID_255423,,罗成,秦琼,020 回 （ 秦琼 与 罗成 传枪 递锏 ）,回  人物二 人物一 传枪 递锏,-1
TRAIN_SENT_ID_266220,,蓝提斯,谢加图,谢加图 之弟 蓝提斯 及其 好友 伊格尔 怀着 各自 的 目的 ， 探求 “ 支柱 之 路 ” 的 秘密 。,人物二 之弟 人物一 好友 伊格尔 怀着 目的  探求  支柱 路  秘密,-1
TRAIN_SENT_ID_269441,,刘伟,马季,《 一仆二主 》 表演者 ： 马季 、 刘伟 、 赵炎,一仆二主  表演者  人物二  人物一  赵炎,-1
TRAIN_SENT_ID_250584,,鲁西西,皮皮鲁,皮皮鲁 和 鲁西西 有 许多 好玩 的 经历 ， 都 收集 在 30 卷 《 郑渊洁 童话 全集 》 里 .,人物二 人物一 好玩 经历  收集  卷  郑渊洁 童话 全集  里,1
TRAIN_SENT_ID_266856,,尤二姐,尤氏,3 尤二姐 : 尤二姐 ， 尤氏 继母 带来 的 女儿 ， 《 红楼梦 》 中 一个 悲剧性 的 女性 人物 。,人物一  人物一  人物二 继母 带来 女儿   红楼梦  中 一个 悲剧性 女性 人物,1
TRAIN_SENT_ID_270037,,楚寒镜,楚碧痕,楚寒镜 ， 单机游戏 《 仙剑 奇侠传 四 》 主线 任务 重要 角色 ， 炎帝 神农 洞 月 幽之境 中 守护 梭罗 仙树 的 梭罗树 仙 之一 ， 楚碧痕 的 孪生 姐姐 。,人物一  单机游戏  仙剑 奇侠传 四  主线 任务 重要 角色  炎帝 神农 洞 月 幽之境 中 守护 梭罗 仙树 梭罗树 仙  人物二 孪生 姐姐,1
TRAIN_SENT_ID_257028,,洪敬尧,洪荣宏,我们 约 好 常常 喜乐 08 旧情绵绵 : 林慧萍 、 洪荣宏 、 洪敬尧,约 常常 喜乐  旧情绵绵  林慧萍  人物二  人物一,-1
TRAIN_SENT_ID_249075,,吕洞宾,韩湘子,早先 ， 道士 在 庙会 期间 弹唱 竹琴 《 韩湘子 》 、 《 吕洞宾 成仙 》 ， 是 为了 宣传 道教 教义 。,早先  道士 庙会 期间 弹唱 竹琴  人物二    人物一 成仙   宣传 道教 教义,-1
TRAIN_SENT_ID_270589,,全真七子,王重阳,然而 记者 近日 获悉 ， 由 曲江 影视 投拍 的 电影 《 全真七子 》 将 于 明年 开拍 ， 而 赵长军 将 出演 全真七子 的 师父 王重阳 。,记者 近日 获悉  曲江 影视 投拍 电影  人物一  明年 开拍  赵长军 出演 人物一 师父 人物二,-1
TRAIN_SENT_ID_256900,,仲由,孔子,雍 也 译文 : 季康子 问 孔子 ： “ 仲由 这个 人 ， 可以 让 他 管理 国家 政事 吗 ？ ”,雍 译文  季康子 问 人物二   人物一  管理 国家 政事,-1
TRAIN_SENT_ID_265560,,张崇基,张崇德,《 想 你 听 我 唱 》 - 张崇基 ， 张崇德,想 听 唱   人物一  人物二,-1
TRAIN_SENT_ID_252419,,颜回,孔子,司马贞 索隐 ： “ 苍蝇附骥 尾而致 千里 ， 以喻 颜回 因 孔子 而 名彰 。 ”,司马贞 索隐   苍蝇附骥 尾而致 千里  以喻 人物一 人物二 名彰,-1
TRAIN_SENT_ID_262219,,尤二姐,尤三姐,统治者 二十几 人 （ 有人 算了 说 是 三十几 人 ） ， 其他 都 是 奴隶 ， 三百多个 ， 鸳鸯 、 司棋 、 尤二姐 、 尤三姐 等等 。,统治者 二十几  有人 算了 说 三十几   奴隶  三百多个  鸳鸯  司棋  人物一  人物二,-1
TRAIN_SENT_ID_255301,,卫夫人,王羲之,王羲之 留下 的 书法 论文 有 《 题 卫夫人 ( 笔阵 图 ) 后 》 、 《 书论 》 、 《 笔势 论 十二章 》 、 《 用笔 赋 》 、 《 记 白云 先生 书诀 》 等 。,人物二 留下 书法 论文  题 人物一  笔阵 图     书论    笔势 十二章    用笔 赋    记 白云 先生 书诀,-1
TRAIN_SENT_ID_255344,,沈东篱,沈南枝,沈东篱 与 沈南枝 正 额头 抵着 额头 ， 笑 得 一脸 阳光 。,人物一 人物二 正 额头 抵着 额头  笑 一脸 阳光,-1
TRAIN_SENT_ID_261570,,南宫敬叔,孟懿子,其 声望 远播 于 各 诸侯国 ， 其 弟子 子路 、 孟懿子 、 南宫敬叔 等 在 鲁国 已 小有名气 。,声望 远播 诸侯国  弟子 子路  人物二  人物一 鲁国 小有名气,-1
TRAIN_SENT_ID_256839,,仲由,孔子,明代 吴宽 认为 其 书法 “ 猛厉 奇伟 ， 终 堕 一 偏之失 ” ； 《 宣和书 谱 》 谓 “ 其字 神峰 太峻 ， 有如 强弩射 三十里 ， 又 如 仲由 未见 孔子 时 风气 ” 。,明代 吴宽 认为 书法  猛厉 奇伟  终 堕 偏之失    宣和书 谱  谓  其字 神峰 太峻  有如 强弩射 三十里  人物一 未见 人物二 时 风气,-1
TRAIN_SENT_ID_266723,,龙幽,龙溟,出处 ： 国产 单机游戏 《 仙剑 奇侠传 五 》 中 龙幽 的 武器 之一 、 《 仙剑 奇侠传 五前 传 》 龙溟 的 武器 。,出处  国产 单机游戏  仙剑 奇侠传 五  中 人物一 武器   仙剑 奇侠传 五前 传  人物二 武器,1
TRAIN_SENT_ID_274097,,南宫敬叔,孔子,孔子 对 南宫敬叔 说 ： “ 我 听说 老子 博古通今 ， 通晓 礼乐 的 起源 ， 明白 道德 的 归属 ， 那么 他 就是 我 的 老师 ， 现在 我要 到 他 那里 去 。 ”,人物二 人物一 说   听说 老子 博古通今  通晓 礼乐 起源  明白 道德 归属  老师  现在 我要,-1
TRAIN_SENT_ID_253012,,颜回,孔子,历代 文人学士 对 颜回 推尊 有加 ， 自 汉高帝 以 颜回 配享 孔子 、 祀 以 太牢 ， 历代帝王 封赠 有加 。,历代 文人学士 人物一 推尊 有加  汉高帝 人物一 配享 人物二  祀 太牢  历代帝王 封赠 有加,-1
TRAIN_SENT_ID_253044,,颜回,孔子,入为 吏部 郎中 ， 言 孔子 庙 自 颜回 以降 ， 皆 爵命 于朝 ， 冠冕 居正 ， 而子 鲤 、 孙伋乃野 服幅巾 以 祭 ， 为 不称 。,入为 吏部 郎中  言 人物二 庙 人物一 以降  皆 爵命 于朝  冠冕 居正  而子 鲤  孙伋乃野 服幅巾 祭  不称,-1
TRAIN_SENT_ID_250573,,鲁西西,皮皮鲁,皮皮鲁 和 鲁西西 的 故事 作者简介 : 1955 年 郑渊洁 出生 在 河北省 石家庄市 ， 其父 原籍 山西 临汾 ， 其母 原籍 浙江 绍兴 。,人物二 人物一 故事 作者简介   年 郑渊洁 出生 河北省 石家庄市  其父 原籍 山西 临汾  其母 原籍 浙江 绍兴,1
TRAIN_SENT_ID_255192,,赵海燕,赵本山,《 送戏 》 （ 表演 ： 赵本山 、 刘流 、 赵海燕 、 刘小光 ）,送戏   表演  人物二  刘流  人物一  刘小光,-1
TRAIN_SENT_ID_248976,,吕洞宾,韩湘子,一日 ， 游经 城北 玉屏 峰 ， 见 韩湘子 、 吕洞宾 、 张果老 等 八仙 从 东边 天际 乘 祥云 飘然而至 ， 坐在 石莲 峰山 上 吹拉弹唱 。,一日  游经 城北 玉屏 峰  见 人物二  人物一  张果老 八仙 东边 天际 祥云 飘然而至  坐在 石莲 峰山 吹拉弹唱,-1
TRAIN_SENT_ID_253048,,颜回,孔子,这里 除 孔子 之外 还 安放 了 孔子 的 四位 高徒 （ 颜子 - 颜回 、 曾子 、 思子 - 子思 、 孟子 ） 的 塑像 加以 祭祀 。,人物二 之外 安放 人物二 四位 高徒  颜子  人物一  曾子  思子  子思  孟子  塑像 祭祀,-1
TRAIN_SENT_ID_267456,,唐继虞,唐继尧,唐继尧 的 堂弟 唐继虞 ， 看上 了 这匹 高头 黄马 ， 派 副官 向 欧阳 沂 要求 “ 割爱 价让 ” ， 遭到 欧阳 沂 的 拒绝 。,人物二 堂弟 人物一  看上 这匹 高头 黄马  派 副官 欧阳 沂 要求  割爱 价让   遭到 欧阳 沂 拒绝,-1
TRAIN_SENT_ID_252543,,颜回,孔子,颜回 以 品德 操守 高尚 闻名 ， 孔子 称赞 他 仁爱 。,人物一 品德 操守 高尚 闻名  人物二 称赞 仁爱,-1
TRAIN_SENT_ID_259364,,葛玄,左慈,左慈 人物 思想 : 左慈 、 葛玄 、 郑隐 尊奉 何神 ， 无 直接 材料 可 考 。,人物二 人物 思想  人物二  人物一  郑隐 尊奉 何神  直接 材料 考,-1
TRAIN_SENT_ID_252685,,颜回,孔子,书 中原 讲 孔子 门生 颜回 贫寒 ， 饮食 极为 简陋 的 状况 。,书 中原 讲 人物二 门生 人物一 贫寒  饮食 极为 简陋 状况,-1
TRAIN_SENT_ID_252567,,颜回,孔子,他 是 颜回 （ 颜渊 ） 的 父亲 ， 父子俩 曾 先后 在 孔子 门下 求学 。,人物一  颜渊  父亲  父子俩 先后 人物二 门下 求学,1
TRAIN_SENT_ID_253067,,颜回,孔子,颜回 死 ， 享年 四十一岁 ， 孔子 哭 之 恸 ， 曰 ： “ 噫 ！,人物一 死  享年 四十一岁  人物二 哭 恸  曰   噫,-1
TRAIN_SENT_ID_253138,,颜回,孔子,三楼 大成殿 ， 主奉 至圣 孔子 ， 复圣 颜回 、 宗圣曾子 、 述 圣子 思 、 亚圣孟子 ， 旁祀 魁星 爷 、 文昌帝君 及 七十二 先贤 、 先儒 。,三楼 大成殿  主奉 至圣 人物二  复圣 人物一  宗圣曾子  述 圣子 思  亚圣孟子  旁祀 魁星 爷  文昌帝君 七十二 先贤  先儒,-1
TRAIN_SENT_ID_256922,,仲由,孔子,仲由 孔子 评价 : 子 曰 ： “ 由 也好 勇过 我 ， 无 所 取材 。 ”,人物一 人物二 评价  子 曰   勇过  取材,-1
TRAIN_SENT_ID_257215,,张子静,张爱玲,（ 张子静 ） 想起 张爱玲 ， 总是 想起 钻石 。,人物一  想起 人物二  总是 想起 钻石,-1
TRAIN_SENT_ID_259743,,李偲菘,李伟菘,萧煌奇 、 李偲菘 、 李伟菘 、 姚若龙 、 崔惟楷 、 小安 、 马嵩 惟 、 吴易纬 、 徐世珍 、 小安,萧煌奇  人物一  人物二  姚若龙  崔惟楷  小安  马嵩 惟  吴易纬  徐世珍  小安,-1
TRAIN_SENT_ID_250432,,赵飞燕,赵合德,在 姐姐 赵飞燕 得宠 后 ， 经由 姊姊 的 关系 ， 赵合德 亦 入宫 随侍 汉成帝 ， 并 深得 皇帝 宠爱 。,姐姐 人物一 得宠  经由 姊姊 关系  人物二 入宫 随侍 汉成帝  深得 皇帝 宠爱,1
