sent_id,sent_id,entity1,entity2,sent,processed_sent,human
TRAIN_SENT_ID_252546,,颜回,孔子,孔子 回答 说 ： “ 有 一个 叫 颜回 的 学生 好学 ， 他 从不 迁怒于 别人 ， 也 从不 重犯 同样 的 过错 。,人物二 回答 说   一个 人物一 学生 好学  从不 迁怒于  从不 重犯 同样 过错,-1
TRAIN_SENT_ID_259642,,公孙胜,罗真人,10 、 明 施耐庵 《 水浒 》 第五十三回 《 戴宗 二取 公孙胜 李逵 独劈 罗真人 》 小 可先来 蓟州寻 了 一遍 ， 并 无 打听 处 ， 只 纠合 得 一伙 弟兄 上山 。,明 施耐庵  水浒  第五十三回  戴宗 二取 人物一 李逵 独劈 人物二  可先来 蓟州寻 一遍  打听 处  纠合 一伙 弟兄 上山,-1
TRAIN_SENT_ID_276932,,樊迟,孔子,樊迟 樊迟 墓 : 孔子 去世 后 ， 樊迟 同 闵子 ( 名损 ， 字子 骞 ) 和 宓子 ( 名 不齐 ， 字子 贱 ) 来棠 地 ( 今 鱼台县 境内 ) 办学 ， 传道 于 济水 一带 。,人物一 人物一 墓  人物二 去世  人物一 闵子  名损  字子 骞  宓子  名 不齐  字子 贱  来棠  鱼台县 境内  办学  传道 济水 一带,-1
TRAIN_SENT_ID_252505,,颜回,孔子,看着 这些 钱袋 ， 孔子 想起 刚才 称赞 颜回 ， 批评 子贡 的话 ， 感到 脸上 火辣辣 的 。,看着 钱袋  人物二 想起 刚才 称赞 人物一  批评 子贡  感到 脸上 火辣辣,-1
TRAIN_SENT_ID_249539,,李蔡,李广,李贤 ： “ 汉兴 ， 义渠 公孙贺 、 傅介子 ， 成纪 李广 、 李蔡 ， 上 邽 赵充国 ， 狄道 辛武贤 ， 皆 名将 也 。 ”,李贤   汉兴  义渠 公孙贺  傅介子  成纪 人物二  人物一  邽 赵充国  狄道 辛武贤  皆 名将,1
TRAIN_SENT_ID_249040,,吕洞宾,韩湘子,（ 神话 人物 ） : 韩湘子 ， 字 清夫 ， 是 古代 汉族 民间传说 故事 中 的 八仙 之一 ， 擅吹 洞箫 ， 拜 吕洞宾 为 师学道 。,神话 人物   人物二  字 清夫  古代 汉族 民间传说 故事 中 八仙  擅吹 洞箫  拜 人物一 师学道,-1
TRAIN_SENT_ID_249073,,吕洞宾,韩湘子,26 . 神话 八仙 ： 铁拐李 汉 钟离 张果老 何仙姑 蓝采和 吕洞宾 韩湘子 曹国舅,神话 八仙  铁拐李 汉 钟离 张果老 何仙姑 蓝采和 人物一 人物二 曹国舅,-1
TRAIN_SENT_ID_248975,,吕洞宾,韩湘子,八仙 是 张果老 、 吕洞宾 、 韩湘子 、 何仙姑 、 李铁拐 、 钟离 、 曹国舅 、 蓝采和 。,八仙 张果老  人物一  人物二  何仙姑  李铁拐  钟离  曹国舅  蓝采和,-1
TRAIN_SENT_ID_256577,,周武,周文,他 本来 是 个 在 昆仑山 上学 道 的 老头儿 ， 后来 下山 ， 帮助 周文 王和 周武 王 讨伐 昏庸无道 的 纣王 。,本来 昆仑山 上学 道 老头儿  后来 下山  帮助 人物二 王和 人物一 王 讨伐 昏庸无道 纣王,1
TRAIN_SENT_ID_249062,,吕洞宾,韩湘子,民间传说 中 的 “ 八仙 ” 即 “ 八仙过海 各显其能 ” 中 的 铁拐李 、 汉 钟离 、 张果老 、 何仙姑 、 蓝采和 、 吕洞宾 、 韩湘子 、 曹国舅 。,民间传说 中  八仙   八仙过海 各显其能  中 铁拐李  汉 钟离  张果老  何仙姑  蓝采和  人物一  人物二  曹国舅,-1
TRAIN_SENT_ID_282999,,卢宗道,卢怀道,卢宗道 ， 卢怀道 之弟 ， 范阳 涿人 也 。,人物一  人物二 之弟  范阳 涿人,1
TRAIN_SENT_ID_261565,,南宫敬叔,孟懿子,前 524 年 ， 孟僖子 将 死 ， 嘱咐 二 子 （ 孟懿子 与 南宫敬叔 ） 师侍 孔子 。,前  年  孟僖子 死  嘱咐 二 子  人物二 人物一  师侍 孔子,1
TRAIN_SENT_ID_255331,,卫夫人,王羲之,（ 王羲之 《 题 卫夫人 笔阵 图后 ( 传 ) 》 ”,人物二  题 人物一 笔阵 图后  传,-1
TRAIN_SENT_ID_264383,,曾国潢,曾国藩,曾国藩 咸丰 八年 九月 十二日 写给 曾国潢 和 曾国葆 的 家书,人物二 咸丰 八年 九月 十二日 写给 人物一 曾国葆 家书,1
TRAIN_SENT_ID_273673,,姜子牙,元始天尊,"他原 是 四川 峨嵋山 的 道 仙 ， 姜子牙 奉 元始天尊 之命 ， 封为 他 为 "" 正一 龙虎 玄坛 真君 "" ， 职责 是 专司 金银财宝 ， 迎祥 纳福 。",他原 四川 峨嵋山 道 仙  人物一 奉 人物二 之命  封为  正一 龙虎 玄坛 真君   职责 专司 金银财宝  迎祥 纳福,-1
TRAIN_SENT_ID_255407,,罗成,秦琼,秦琼 、 罗成 。,人物二  人物一,1
TRAIN_SENT_ID_277508,,杜纮,杜纯,到 贬 所 不久 ， 又 以 岳父 杜纯 弟 杜纮 知应 天府 兼 南京 留守 司 公事 ， 为 避亲 嫌 ， 改差 通判 亳州 （ 今 安徽 亳县 ） 。,贬 不久  岳父 人物二 弟 人物一 知应 天府 兼 南京 留守 司 公事  避亲 嫌  改差 通判 亳州  安徽 亳县,1
TRAIN_SENT_ID_261428,,毛泽建,毛泽东,1924 年 以 优异 的 成绩 考入 湖南省 立 第三 女子 师范学校 ， 同 毛泽东 堂妹 毛泽建 同班 读书 ， 结为 挚友 。,年 优异 成绩 考入 湖南省 立 第三 女子 师范学校  人物二 堂妹 人物一 同班 读书  结为 挚友,1
TRAIN_SENT_ID_264569,,胡青牛,张无忌,蝶 谷医仙 胡青牛 与 爱妻 毒仙 王难姑 斗法 ， 服下 此毒 ， 幸得 张无忌 救治 而 愈 。,蝶 谷医仙 人物一 爱妻 毒仙 王难姑 斗法  服下 此毒  幸得 人物二 救治 愈,-1
TRAIN_SENT_ID_251415,,李瀚章,李鸿章,光绪 五年 ( 1879 年 ) ， 传忠 书局 刻印 了 由 其 门人 李瀚章 、 李鸿章 编校 的 《 曾文正公 家书 》 ， 一直 流传 到 现在 。,光绪 五年   年   传忠 书局 刻印 门人 人物一  人物二 编校  曾文正公 家书   一直 流传 现在,1
TRAIN_SENT_ID_275892,,王子豪,王子杰,"1 / 2 帮 总分 582 分 3 帮 总分 573.2 相差 10.8 分 , 经 商议 淘汰 张祖铭 , 王子豪 , 王子杰 , 陈国靖",帮 总分  分  帮 总分  相差  分  商议 淘汰 张祖铭  人物一  人物二  陈国靖,1
TRAIN_SENT_ID_270983,,严舆,严白虎,三国群英 传 2 严舆 形象 严舆 简明 演义 传记 : 严舆 ， 严白虎 之弟 ， 三国演义 第 15 回 登场 。,三国群英 传  人物一 形象 人物一 简明 演义 传记  人物一  人物二 之弟  三国演义  回 登场,1
TRAIN_SENT_ID_268921,,司徒静,司徒剑南,司徒剑南 第九集 : 司徒静 气 了 安宁公主 一顿 ， 将 她 放回 。,人物二 第九集  人物一 气 安宁公主 一顿  放回,1
TRAIN_SENT_ID_254247,,张顺,张横,3 精彩 片段 : 生擒 张横 、 张顺,精彩 片段  生擒 人物二  人物一,1
TRAIN_SENT_ID_251903,,曹薰铉,李昌镐,李昌镐 执黑 7 目半胜 曹薰铉,人物二 执黑  目半胜 人物一,-1
TRAIN_SENT_ID_257782,,林平之,岳不群,从 思过 崖 去 华山派 大厅 ， 岳不群 已经 知道 林平之 的 家事 ， 为了 报 父母 的 仇 ， 拜 岳不群 为师 。,思过 崖 华山派 大厅  人物二 已经 知道 人物一 家事  报 父母 仇  拜 人物二 为师,-1
TRAIN_SENT_ID_254284,,张顺,张横,张顺 死后 ， 还 把 灵魂 附在 张横 身上 杀死 了 方天定 。,人物一 死后  灵魂 附在 人物二 身上 杀死 方天定,1
TRAIN_SENT_ID_256577,,周武,周文,他 本来 是 个 在 昆仑山 上学 道 的 老头儿 ， 后来 下山 ， 帮助 周文 王和 周武 王 讨伐 昏庸无道 的 纣王 。,本来 昆仑山 上学 道 老头儿  后来 下山  帮助 人物二 王和 人物一 王 讨伐 昏庸无道 纣王,1
TRAIN_SENT_ID_261693,,程英,陆无双,不 等 武三娘 答话 ， 黄影 闪动 ， 已 窜入 庄中 ， 前后 搜寻 ， 竟 无 程英 与 陆无双 的 人影 。,武三娘 答话  黄影 闪动  窜入 庄中  搜寻  竟 人物一 人物二 人影,1
TRAIN_SENT_ID_268460,,单联全,冯一非,编剧 ： 冯一非 、 单联全,编剧  人物二  人物一,-1
TRAIN_SENT_ID_268940,,韩非,荀子,《 荀子 》 《 韩非 子 》 之 各 一部分 。,人物二   人物一 子  一部分,-1
TRAIN_SENT_ID_259696,,游颖,游娴,这 一切 全给 游颖 看 在 眼内 ， 本着 逞强 的 心 ， 游颖 没有 将 误会 即时 澄清 ， 成为 她 与 亲 姊 游娴 之间 的 一道 刺 。,全给 人物一 眼内  逞强 心  人物一 没有 误会 即时 澄清  成为 亲 姊 人物二 之间 一道 刺,1
TRAIN_SENT_ID_257594,,毛泽民,毛泽东,1923 年春 ， 经 毛泽东 介绍 ， 随 毛泽民 去 安源 煤矿 ， 任 工人 俱乐部 消费 合作社 店员 。,年春  人物二 介绍  人物一 安源 煤矿  工人 俱乐部 消费 合作社 店员,1
TRAIN_SENT_ID_275467,,李汉俊,李书城,李汉俊 的 心思 ， 得到 了 李书城 的 全力支持 。,人物一 心思  得到 人物二 全力支持,1
TRAIN_SENT_ID_278070,,马枪月,谷本夏,其兄 是 擅长 八卦掌 的 马枪月 ， 所以 与 谷本夏 是 ” 师 叔侄 “ 的 关系 ；,其兄 擅长 八卦掌 人物一  人物二  师 叔侄  关系,-1
TRAIN_SENT_ID_249171,,皮皮鲁,鲁西西,皮皮鲁 和 鲁西西 用 肥皂 订书机 成功 改写 了 历史 。,人物一 人物二 肥皂 订书机 成功 改写 历史,1
TRAIN_SENT_ID_265569,,张崇基,张崇德,「 香港 版本 」 名字 ： 龙珠 主唱 ： 张崇基 张崇德,香港 版本  名字  龙珠 主唱  人物一 人物二,1
TRAIN_SENT_ID_255458,,罗成,秦琼,秦琼 的 好 ， 罗成 最 明白 。,人物二  人物一 明白,1
TRAIN_SENT_ID_279415,,王学明,龙俊杰,指导 教师 ： 龙俊杰 、 何雁 、 王学明 等 。,指导 教师  人物二  何雁  人物一,-1
TRAIN_SENT_ID_257033,,洪敬尧,洪荣宏,洪荣宏 、 洪敬尧,人物二  人物一,1
TRAIN_SENT_ID_272677,,蓝兰,张晓,他 的 亲生 叔叔 殷成 贵 也 是 他 跟 蓝兰 与 张晓 情感 发展 的 重要 线索 之一 ， 最后 殷正 情归何处 ？,亲生 叔叔 殷成 贵 人物一 人物二 情感 发展 重要 线索  最后 殷正 情归何处,1
TRAIN_SENT_ID_257583,,毛泽民,毛泽东,王淑兰 简介 : 王淑兰 ， 毛泽东 的 弟媳 ， 毛泽民 的 第一位 妻子,王淑兰 简介  王淑兰  人物二 弟媳  人物一 第一位 妻子,1
TRAIN_SENT_ID_250103,,武敦儒,武修文,靖 、 蓉 为 寻找 黄药师 ， 巧遇 武三通 之子 武敦儒 、 武修文 、 杨康之 子 杨过 。,靖  蓉 寻找 黄药师  巧遇 武三通 之子 人物一  人物二  杨康之 子 杨过,1
TRAIN_SENT_ID_252638,,颜回,孔子,唐开元 二十七 （ 739 ） 年 ， 诏 颜回 列 孔子 左侧 配享 后 ， 即升 曾 参入 “ 十哲 ” 。,唐开元 二十七    年  诏 人物一 列 人物二 左侧 配享  即升 参入  十哲,-1
TRAIN_SENT_ID_265426,,薛谭,秦青,则 愿 你 艺超 薛谭 ， 才 压 秦青 ， 那 时节 声价 超迁 迈夷 等 。,愿 艺超 人物一  压 人物二  时节 声价 超迁 迈夷,-1
TRAIN_SENT_ID_256579,,周武,周文,1 简介 : 泰伯 公是 周武 王 的 大伯 公 、 周文 王 大伯父 。,简介  泰伯 公是 人物一 王 大伯 公  人物二 王 大伯父,1
TRAIN_SENT_ID_255409,,罗成,秦琼,她 的 美丽 ， 智慧 与 古灵精怪 ， 不仅 征服 了 秦琼 ， 还 征服 了 隋唐 第三 好汉 裴元庆 ， 第七 好汉 罗成 和 未来 的 太宗皇帝 — — 秦王 李世民 。,美丽  智慧 古灵精怪  征服 人物二  征服 隋唐 第三 好汉 裴元庆  第七 好汉 人物一 未来 太宗皇帝   秦王 李世民,1
TRAIN_SENT_ID_259804,,李偲菘,李伟菘,作词 ： 卡斯 作曲 ： 李伟菘 、 李偲菘,作词  卡斯 作曲  人物二  人物一,1
TRAIN_SENT_ID_278396,,武文渊,武文密,武文渊 死后 ， 由其弟 武文密 （ V ũ V ă nM ậ t ） 继领 其众 ， 而 宣光镇 （ Tuy ê nQuangTr ấ n ） 则 长期 成为 武氏家族 的 封地 。,人物一 死后  由其弟 人物二   ũ  ă  ậ   继领 其众  宣光镇   ê  ấ   长期 成为 武氏家族 封地,1
TRAIN_SENT_ID_270811,,伍天锡,伍云召,李元霸 VS 雄阔海 、 伍云召 、 伍天锡 ： 元霸 一马 冲入 营来 ， 正撞 着 伍云召 、 雄阔海 、 伍天锡 ， 三个 围拢 来 战元霸 。,李元霸  雄阔海  人物二  人物一  元霸 一马 冲入 营来  正撞 人物二  雄阔海  人物一  三个 围拢 战元霸,1
TRAIN_SENT_ID_270805,,伍天锡,伍云召,第六条 好汉 ： 伍天锡 ， 伍云召 的 族弟 。,第六条 好汉  人物一  人物二 族弟,1
TRAIN_SENT_ID_282095,,周昂,周昕,周昕 、 周昂 之弟 。,人物二  人物一 之弟,1
TRAIN_SENT_ID_260578,,金敬姬,金正日,她 在 这篇 时评 中 主张 ： “ 金正日 很 可能 把 自己 的 妹妹 金敬姬 指 名为 第三代 权利 世袭 的 管理者 。,这篇 时评 中 主张   人物二 可能 妹妹 人物一 指 名为 第三代 权利 世袭 管理者,1
TRAIN_SENT_ID_252568,,颜回,孔子,归鲁 之后 ， 颜回 除 讲学 外 ， 便是 帮助 孔子 整理 古代 典籍 。,归鲁 之后  人物一 讲学 外  便是 帮助 人物二 整理 古代 典籍,-1
TRAIN_SENT_ID_252892,,颜回,孔子,卫灵公 调查 清楚 孔子 一行 到 卫国 来 并 不是 鲁国 派来 的 ， 于是 再次 接受 颜浊 邹 、 蘧 伯玉 等 人 的 劝谏 ， 请 颜回 传话 ， 恳请 孔子 回 帝丘 。,卫灵公 调查 清楚 人物二 一行 卫国 鲁国 派来  再次 接受 颜浊 邹  蘧 伯玉 劝谏  请 人物一 传话  恳请 人物二 回 帝丘,-1
TRAIN_SENT_ID_268838,,骆羽,骆赢,混双 ： 何汉斌 / 包宜鑫 刘成 / 骆赢 李根 / 骆羽,混双  何汉斌  包宜鑫 刘成  人物二 李根  人物一,1
TRAIN_SENT_ID_265092,,杨志刚,郭靖宇,（ 电视剧 改名 为 《 追 》 ； 导演 ： 郭靖宇 ， 柏杉 ； 主要演员 ： 黄海波 ， 杨志刚 ， 王媛可 ）,电视剧 改名  追   导演  人物二  柏杉  主要演员  黄海波  人物一  王媛可,1
TRAIN_SENT_ID_264247,,陈真,霍元甲,“ 霍元甲 ” “ 陈真 ” 齐 上阵,人物二   人物一  齐 上阵,-1
TRAIN_SENT_ID_255489,,罗成,秦琼,秦琼 、 程咬金 、 罗成 进入 洛阳 是 种 偶然 ， 偶然 的 因素 是 秦琼 、 程咬金 的 家人 留在 老家 ， 罗成 的 母亲 和 妻子 却 跟着 他 出来 旅游 。,人物二  程咬金  人物一 进入 洛阳 种 偶然  偶然 因素 人物二  程咬金 家人 留在 老家  人物一 母亲 妻子 跟着 旅游,1
TRAIN_SENT_ID_272680,,蓝兰,张晓,整容 后 的 蓝兰 、 张晓 的 亲姐姐 ， 原 跟 张晓 长得 一模一样 ， 后来 整容 。,整容 人物一  人物二 亲姐姐  原 人物二 长得 一模一样  后来 整容,1
TRAIN_SENT_ID_253102,,颜回,孔子,宣城县 文庙 奉祀 官 陈 蔡 ， 廉洁奉公 ， 清贫 自 守 ， 任职 多年 ， 家徒四壁 ， 病故 后 ， 包直 撰 挽联 云 ： “ 寿比 孔子 多 二岁 ， 家似 颜回 少 一瓢 。 ”,宣城县 文庙 奉祀 官 陈 蔡  廉洁奉公  清贫 守  任职 多年  家徒四壁  病故  包直 撰 挽联 云   寿比 人物二 二岁  家似 人物一 少 一瓢,-1
TRAIN_SENT_ID_270585,,全真七子,王重阳,( 4 ) 清静 家风 ： 王重阳 与 全真七子 的 丹法 关要 ， 宗教学 研究 ， 2009 年 03 月,清静 家风  人物二 人物一 丹法 关要  宗教学 研究   年  月,-1
TRAIN_SENT_ID_268907,,司徒静,司徒剑南,司徒剑南 和 文蔷 被 抓 回宫 ， 司徒 家 心急如焚 ， 陈林 向 司徒静 解释 朱允 暗中 已有 安排 ， 司徒静 心存 感激 。,人物二 文蔷 抓 回宫  司徒 家 心急如焚  陈林 人物一 解释 朱允 暗中 已有 安排  人物一 心存 感激,1
TRAIN_SENT_ID_266045,,张学思,张学良,至此 ， 周恩来 和 张学铭 、 张学思 的 信 ， 才 辗转 送到 张学良 的 手里 。,至此  周恩来 张学铭  人物一 信  辗转 送到 人物二 手里,1
TRAIN_SENT_ID_262221,,尤二姐,尤三姐,2 电影 剧情 : 清朝 康熙 、 乾隆年间 ， 宁国府 纨祷 子弟 贾珍 的 远房亲戚 尤二姐 、 尤三姐 ， 随 母亲 来到 贾府 拜寿 。,电影 剧情  清朝 康熙  乾隆年间  宁国府 纨祷 子弟 贾珍 远房亲戚 人物一  人物二  母亲 来到 贾府 拜寿,1
TRAIN_SENT_ID_268825,,洪凌波,李莫愁,在 绝情谷 中 ， 师父 李莫愁 想 借 其 作为 踏板 跳出 情 花丛 ， 结果 洪凌波 把 李莫愁 一起 拉入情 花丛 ， 客观 上 加速 了 李莫愁 的 死亡 。,绝情谷 中  师父 人物二 想 踏板 跳出 情 花丛  人物一 人物二 一起 拉入情 花丛  客观 加速 人物二 死亡,-1
TRAIN_SENT_ID_252708,,颜回,孔子,颜回 先 孔子 而 死 ， 当 孔子 回忆 到 他 好学 及 “ 三月 不 违仁 ” 及 与 自己 的 密切 的 关系 时 ， 更加 悲痛欲绝 。,人物一 先 人物二 死  人物二 回忆 好学  三月 违仁  密切 关系 时  更加 悲痛欲绝,-1
TRAIN_SENT_ID_260686,,王重阳,全真七子,防御 路线 走 王重阳 ， 全真七子 相应 点灯 。,防御 路线 走 人物一  人物二 相应 点灯,-1
TRAIN_SENT_ID_273650,,姜子牙,元始天尊,后来 ， 姜子牙 助周灭 纣 成功 ， 奉 元始天尊 的 法旨 封神 ， 比干 被 追封 为 北斗七星 中心 的 天权 宫 “ 文 曲星君 ” 。,后来  人物一 助周灭 纣 成功  奉 人物二 法旨 封神  比干 追封 北斗七星 中心 天权 宫  文 曲星君,-1
TRAIN_SENT_ID_255362,,贾午,贾南风,贾南风 最初 曾经 假装 有孕 ， 实则 取 来 贾午 与 韩寿 之子 韩慰 祖 ， 宣称 这 是 她 在 晋武帝 丧 期内 所 生之子 ， 不曾 公开 。,人物二 最初 曾经 假装 有孕  实则 取 人物一 韩寿 之子 韩慰 祖  宣称 晋武帝 丧 期内 生之子  不曾 公开,1
TRAIN_SENT_ID_273361,,杨锐,张之洞,杨锐 百日维新 : 光绪 二十四年 （ 1898 年 ） ， 张之洞 推荐 杨锐 应征 经济 特科 。,人物一 百日维新  光绪 二十四年   年   人物二 推荐 人物一 应征 经济 特科,-1
TRAIN_SENT_ID_274072,,南宫敬叔,孔子,于是 南宫敬叔 对 鲁国 国君 说 ： “ 我 接受 父亲 的 嘱咐 说 ： ‘ 孔子 是 圣人 的 后代 ， 他 的 先祖 在 宋国 消亡 了 。,人物一 鲁国 国君 说   接受 父亲 嘱咐 说   人物二 圣人 后代  先祖 宋国 消亡,-1
TRAIN_SENT_ID_264199,,陈真,霍元甲,陆 大安 ， 香港 电视 连续剧 《 大侠 霍元甲 》 、 《 陈真 》 、 《 霍东阁 》 中 的 人物 。,陆 大安  香港 电视 连续剧  大侠 人物二    人物一    霍东阁  中 人物,-1
TRAIN_SENT_ID_252495,,颜回,孔子,孔子 与 颜回 的 有趣 对话,人物二 人物一 有趣 对话,-1
TRAIN_SENT_ID_253880,,赵合德,赵飞燕,成帝 晚年 ， 又 沉溺 声色 ， 与 赵飞燕 、 赵合德 姐妹 纵情 淫乐 ， 将 政事,成帝 晚年  沉溺 声色  人物二  人物一 姐妹 纵情 淫乐  政事,1
TRAIN_SENT_ID_274077,,南宫敬叔,孔子,① 丁寅 生 《 孔子 演义 》 第 18 回 ： “ 南宫敬叔 和 夫子 最 契合 ， 请 他 先容 ， 最为 合宜 ， 打定主意 ， 便 一径 往 访敬叔 。 ”,① 丁寅 生  人物二 演义   回   人物一 夫子 契合  请 先容  最为 合宜  打定主意  便 一径 访敬叔,-1
TRAIN_SENT_ID_257045,,洪敬尧,洪荣宏,紧返 来 阮 身边 11 新 放浪 人生 : 洪荣宏 、 洪敬尧,紧返 阮 身边  新 放浪 人生  人物二  人物一,1
TRAIN_SENT_ID_261653,,宋小宝,赵本山,不过 ， 对于 宋小宝 来说 ， 除了 师父 赵本山 的 提携 和 帮助 ， 他 过往 的 那些 经历 也 是 促使 他 成功 的 最 宝贝 财 宋小宝 ( 10 张 ),人物一  师父 人物二 提携 帮助  过往 经历 促使 成功 宝贝 财 人物一   张,-1
TRAIN_SENT_ID_250386,,赵飞燕,赵合德,赵飞燕 有个 妹妹 叫 赵合德 ， 比 她 更 迷人 ， 也 被 召 进宫 。,人物一 有个 妹妹 人物二  更 迷人  召 进宫,1
TRAIN_SENT_ID_253824,,赵合德,赵飞燕,他 与 蛇蝎美人 赵飞燕 、 赵合德 姐妹 的 故事 ， 几乎 家喻户晓 。,蛇蝎美人 人物二  人物一 姐妹 故事  几乎 家喻户晓,1
TRAIN_SENT_ID_252617,,颜回,孔子,孔子 不疑 颜回 之廉信,人物二 不疑 人物一 之廉信,-1
TRAIN_SENT_ID_257837,,吕素,吕雉,吕素 : 吕素 是 吕雉 的 妹妹 ， 温柔 美丽 、 品性 善良 ， 与 姐姐 吕雉 完全 不同 。,人物一  人物一 人物二 妹妹  温柔 美丽  品性 善良  姐姐 人物二 完全 不同,1
TRAIN_SENT_ID_268452,,和硕敦恪公主,和硕温恪公主,他们 是 ： 怡 亲王 胤 祥 、 和硕温恪公主 、 和硕敦恪公主 。,怡 亲王 胤 祥  人物二  人物一,1
TRAIN_SENT_ID_259796,,李偲菘,李伟菘,- - - - - - 李偲菘 李伟菘,人物一 人物二,1
TRAIN_SENT_ID_270818,,伍天锡,伍云召,实力 在 伍天锡 之下 罗成 之上 ） ( 韩擒虎 能 挡 伍云召 十余 合 ， 与 魏文通 相当 ）,实力 人物一 之下 罗成 之上   韩擒虎 挡 人物二 十余 合  魏文通 相当,1
TRAIN_SENT_ID_265499,,薛蝌,薛蟠,她 是 薛姨妈 的 侄女 ， 薛蝌 的 胞妹 ， 薛蟠 ， 薛宝钗 的 堂妹 。,薛姨妈 侄女  人物一 胞妹  人物二  薛宝钗 堂妹,1
TRAIN_SENT_ID_283371,,刘义融,刘义庆,母亲 ： 长沙 妃 檀氏字 宪子 ， 谥 景定 ， 出自 高平 平阳 檀氏 刘义融 兄弟 : 刘义欣 、 刘义庆 、 刘义宗 、 刘义宾 、 刘义綦 。,母亲  长沙 妃 檀氏字 宪子  谥 景定  出自 高平 平阳 檀氏 人物一 兄弟  刘义欣  人物二  刘义宗  刘义宾  刘义綦,1
TRAIN_SENT_ID_262202,,陈靖仇,陈辅,3 轩辕剑 叁 外传 ： 天之痕 : 相关 剧情 : 游戏 主角 陈靖仇 的 师父 陈辅 在 伏 魔 山上 被 饕餮 。,轩辕剑 叁 外传  天之痕  相关 剧情  游戏 主角 人物一 师父 人物二 伏 魔 山上 饕餮,-1
TRAIN_SENT_ID_250716,,鲁西西,皮皮鲁,皮皮鲁 这个 “ 大侠 ” 成为 了 不 被 鲁西西 信任 的 “ 狗熊 ” 。,人物二  大侠  成为 人物一 信任  狗熊,1
TRAIN_SENT_ID_274686,,冯国纶,冯国经,冯国经 、 冯国纶 兄弟 / VictorWilliamFung,人物二  人物一 兄弟,1
TRAIN_SENT_ID_254293,,张顺,张横,张横 名人 点评 : 邵氏 《 荡寇 志 》 中 的 张横 金圣叹 ： 阮小二 、 阮小五 、 张横 、 张顺 ， 都 是 中 上 人物 。,人物二 名人 点评  邵氏  荡寇 志  中 人物二 金圣叹  阮小二  阮小五  人物二  人物一  中 人物,1
TRAIN_SENT_ID_268830,,洪凌波,李莫愁,曾斗 之 人 ： 李莫愁 、 公孙止 、 陆无双 、 程英 、 洪凌波,曾斗  人物二  公孙止  陆无双  程英  人物一,-1
TRAIN_SENT_ID_279086,,程英,黄药师,3 、 桃花岛 对话 黄药师 ， 对话 程英 后 答应 去 寻找 杨过 。,桃花岛 对话 人物二  对话 人物一 答应 寻找 杨过,-1
TRAIN_SENT_ID_268889,,司徒静,司徒剑南,司徒剑南 第二集 : 司徒静 骗过 衙役 逃走 ， 朱允 和 白云飞 被 误认为 是 强盗 。,人物二 第二集  人物一 骗过 衙役 逃走  朱允 白云飞 误认为 强盗,1
TRAIN_SENT_ID_255471,,罗成,秦琼,但 李密 因 心胸狭隘 等 因 把 瓦岗军 带 向 末路 ， （ 李密 后 被 杀害 ） 于是 楚 潇潇 和 罗成 、 秦琼 投奔 了 李世民 。,李密 心胸狭隘 瓦岗军 带 末路   李密 杀害  楚 潇潇 人物一  人物二 投奔 李世民,1
TRAIN_SENT_ID_261149,,王缙,王维,2 成语 典故 : 【 出处 】 ： 《 新唐书 · 韦抗 传 》 ： “ 它 所辟举 ， 如 王维 、 王缙 、 崔殷 等 ， 皆 一时 选云 。 ”,成语 典故   出处    新唐书  韦抗 传    所辟举  人物二  人物一  崔殷  皆 一时 选云,1
TRAIN_SENT_ID_258133,,刘星,夏雪,身份 ： 夏雪 和 夏雨 的 生父 ， 刘星 的 继父 。,身份  人物二 夏雨 生父  人物一 继父,1
TRAIN_SENT_ID_261156,,王缙,王维,王缙 家族 成员 : 哥哥 ： 王维,人物一 家族 成员  哥哥  人物二,1
TRAIN_SENT_ID_261448,,毛泽建,毛泽东,毛泽建 （ 1905 - 1929 ） ， 革命烈士 ， 毛泽东 堂妹 。,人物一       革命烈士  人物二 堂妹,1
TRAIN_SENT_ID_252695,,颜回,孔子,三国 魏 正始 （ 齐王 曹芳 年号 ， 公元 240 — 248 年 ） 以后 ， 规定 入学 行 祭礼 ， 以 孔子 为 先圣 ， 配 颜回 为 先师 。,三国 魏 正始  齐王 曹芳 年号  公元    年  以后  规定 入学 行 祭礼  人物二 先圣  配 人物一 先师,-1
TRAIN_SENT_ID_255449,,罗成,秦琼,罗成 的 好 ， 秦琼 最 懂 。,人物一  人物二 懂,1
TRAIN_SENT_ID_262262,,尤二姐,尤三姐,2 情节 概述 : 宁国府 纨绔子弟 贾珍 的 妻妹 尤二姐 、 尤三姐 ， 随 母亲 来到 贾府 拜寿 。,情节 概述  宁国府 纨绔子弟 贾珍 妻妹 人物一  人物二  母亲 来到 贾府 拜寿,1
TRAIN_SENT_ID_250643,,鲁西西,皮皮鲁,哪怕 你 的 眼里 我们 只是 皮皮鲁 与 鲁西西 。,眼里 人物二 人物一,1
TRAIN_SENT_ID_252863,,颜回,孔子,同样 ， 孔子 也 非常 赏识 和 信任 颜回 ， 当 子贡 怀疑 颜回 偷吃 米饭 时 ， 孔子 坚信 颜回 不会 这样 做 ， 并用 巧妙 的 方法 解除 了 别人 的 疑问 。,同样  人物二 非常 赏识 信任 人物一  子贡 怀疑 人物一 偷吃 米饭 时  人物二 坚信 人物一 不会 做  并用 巧妙 方法 解除 疑问,-1
TRAIN_SENT_ID_250388,,赵飞燕,赵合德,后来 姐姐 赵飞燕 因 无法 产下 皇子 ， 也 是 赵合德 为 赵飞燕 解围 ， 使 其 免遭 被 废 。,后来 姐姐 人物一 无法 产下 皇子  人物二 人物一 解围  免遭 废,1
TRAIN_SENT_ID_256475,,周武,周文,季连 的 后代 鬻 熊 很 有 学问 ， 曾 做 过 周文 王 姬昌 、 周武 王 姬发 父子 两代 人 的 教师 。,季连 后代 鬻 熊 学问  做 人物二 王 姬昌  人物一 王 姬发 父子 两代 教师,1
