sent_id,sent_id,entity1,entity2,sent,processed_sent,human
TRAIN_SENT_ID_273631,,马阔海,马青山,召唤 人 ： 萧风 （ 主要 ） 、 端木燕 （ 后期 ） 、 马青山 （ 大结局 ） 、 马阔海 （ 电影版 ）,召唤  萧风  主要   端木燕  后期   人物二  大结局   人物一  电影版,-1
TRAIN_SENT_ID_264246,,陈真,霍元甲,民国时期 ， 陈真 为师 霍元甲 报仇 ， 被 日本 人 抓 去 做 冰冻 实验 。,民国时期  人物一 为师 人物二 报仇  日本 抓 做 冰冻 实验,-1
TRAIN_SENT_ID_252804,,颜回,孔子,经过 一段时间 的 深入 观察 了解 ， 孔子 才 指出 颜回 并 不愚 。,一段时间 深入 观察 了解  人物二 指出 人物一 不愚,-1
TRAIN_SENT_ID_270605,,白水喜,白欢喜,电视剧 《 我家 有喜 》 人物 ， 是 白尚武 的 妻子 ， 是 白金 喜 、 白水喜 、 白欢喜 的 生母 和 白木喜 的 养母 ， 由 中国台湾 演员 刘瑞琪 饰演 。,电视剧  我家 有喜  人物  白尚武 妻子  白金 喜  人物一  人物二 生母 白木喜 养母  中国台湾 演员 刘瑞琪 饰演,1
TRAIN_SENT_ID_267447,,唐继虞,唐继尧,1923 年 （ 民国 12 年 ） 2 月 ， 唐继虞 奉 兄长 唐继尧 之命 ， 赴 贵州 救援 原 贵州 督军 刘显世 ， 駆 逐 黔 军 袁祖铭 。,年  民国  年   月  人物一 奉 兄长 人物二 之命  赴 贵州 救援 原 贵州 督军 刘显世  駆 逐 黔 军 袁祖铭,1
TRAIN_SENT_ID_249529,,李蔡,李广,而 他 的 堂兄弟 李蔡 才能 不如 他 却 官至 丞相 ， 古人 认为 奇数 不 吉利 ， 司马迁 评价 为 “ 李广 老 ， 数奇 。 ”,堂兄弟 人物一 官至 丞相  古人 认为 奇数 吉利  司马迁 评价  人物二 老  数奇,-1
TRAIN_SENT_ID_272359,,文殊广法天尊,金吒,王魔 追赶 逃亡 的 姜子牙 到 五龙山 云霄 洞 ， 被 文殊广法天尊 、 金吒 师徒 所杀 。,王魔 追赶 逃亡 姜子牙 五龙山 云霄 洞  人物一  人物二 师徒 所杀,-1
TRAIN_SENT_ID_278219,,张恭庆,张怡,张恭庆 、 张恭 慈和 张怡 在 捐赠 仪式 上,人物一  张恭 慈和 人物二 捐赠 仪式,-1
TRAIN_SENT_ID_277017,,钟藜,钟馗,钟藜 是 电视剧 《 天师 钟馗 》 中 《 钟馗 嫁妹 》 单元 人物 ， 由 姚芊羽 饰演 。,人物一 电视剧  天师 人物二  中  人物二 嫁妹  单元 人物  姚芊羽 饰演,1
TRAIN_SENT_ID_267433,,陆展元,陆立鼎,原著 明写 陆立鼎 缺乏 应变 之才 ， 而 陆展元 机智 过 人 ， 二者 互相 套用 实在 是 说 不通 、,原著 明写 人物二 缺乏 应变 之才  人物一 机智  二者 互相 套用 实在 说 不通,-1
TRAIN_SENT_ID_249108,,吕洞宾,韩湘子,丽珠 与 韩湘子 订婚 之夜 ， 龙三 前来 抢人 ， 被 吕洞宾 赶退 。,丽珠 人物二 订婚 之夜  龙三 前来 抢人  人物一 赶退,-1
TRAIN_SENT_ID_259951,,周志文,周志康,（ 林峰 、 徐子珊 、 林欣彤 携 胡鸿钧 、 周志文 、 周志康 、 谢东闵 倾力 演出 ） 周志文 节目主持 : 2011 年 ： 《 西湖 》,林峰  徐子珊  林欣彤 携 胡鸿钧  人物一  人物二  谢东闵 倾力 演出  人物一 节目主持   年   西湖,-1
TRAIN_SENT_ID_286052,,喻亢,甄子丹,喻亢 社会 评价 : 喻亢 跟随 甄子丹 学艺 十余年 。,人物一 社会 评价  人物一 跟随 人物二 学艺 十余年,-1
TRAIN_SENT_ID_269567,,辛敞,辛宪英,辛敞 畏惧 于 形势 ， 不知所措 ， 便 向 辛宪英 请教 。,人物一 畏惧 形势  不知所措  便 人物二 请教,-1
TRAIN_SENT_ID_264214,,陈真,霍元甲,霍元甲 被 日本 人 阴谋 陷害 致死 ， 陈真 誓为 师父 手刃仇人 ， 挑战 虹口 道馆 的 众位 日本 高手 ， 向 世人 证明 了 中国 人 不是 东亚 病夫 。,人物二 日本 阴谋 陷害 致死  人物一 誓为 师父 手刃仇人  挑战 虹口 道馆 众位 日本 高手  世人 证明 中国 东亚 病夫,-1
TRAIN_SENT_ID_249018,,吕洞宾,韩湘子,其 形态 特征 及 手中 所 持 道具 标明 了 各自 身份 ， 从 一到 八 分别 为 ： 何仙姑 、 张果老 、 篮采 和 、 韩湘子 、 曹国舅 、 吕洞宾 、 铁拐李 、 汉 钟离 。,形态 特征 手中 持 道具 标明 身份  一到 八  何仙姑  张果老  篮采  人物二  曹国舅  人物一  铁拐李  汉 钟离,-1
TRAIN_SENT_ID_262273,,尤二姐,尤三姐,第六十五回 贾二舍 偷 娶 尤二姐 尤三姐 思嫁 柳 二郎 / 371,第六十五回 贾二舍 偷 娶 人物一 人物二 思嫁 柳 二郎,1
TRAIN_SENT_ID_270576,,全真七子,王重阳,万寿宫 为 主体 建筑 ， 宫内 塑有 全真道 祖 王重阳 及 全真七子 像 。,万寿宫 主体 建筑  宫内 塑有 全真道 祖 人物二 人物一,-1
TRAIN_SENT_ID_253073,,颜回,孔子,孔子 问 颜回 ， 如何 不种 梅 ？,人物二 问 人物一  不种 梅,-1
TRAIN_SENT_ID_276238,,张阿生,郭靖,1211 哲别 跟随 成吉思汗 ， 郭靖 、 拖雷 结拜 安达 ， 陈玄风 、 张阿生 卒 。,哲别 跟随 成吉思汗  人物二  拖雷 结拜 安达  陈玄风  人物一 卒,-1
TRAIN_SENT_ID_261163,,王缙,王维,又 王缙 《 进王 右 丞 集表 》 云 编次 王维 诗 文凡 10 卷 。,人物一  进王 右 丞 集表  云 编次 人物二 诗 文凡  卷,-1
TRAIN_SENT_ID_279221,,吕馨,吕禄,她 以 可怜 地 表情 对 吕雉 说 她 还 不想 死 ， 此时 吕馨 的 表哥 吕禄 来 了 。,可怜 表情 吕雉 说 不想 死  人物一 表哥 人物二,-1
TRAIN_SENT_ID_270560,,全真七子,王重阳,吕 祖传 道 于 王重阳 — — 马丹阳 等 “ 全真七子 ” 一脉相承 ， 是 为 北宗 也 。,吕 祖传 道 人物二   马丹阳  人物一  一脉相承  北宗,-1
TRAIN_SENT_ID_264229,,陈真,霍元甲,小时候 ， 由于 陈真 身体虚弱 ， 霍元甲 认为 陈真 并 不是 练武 的 料 ， 就 没 教给 陈真 武功 之类 的 东西 。,小时候  人物一 身体虚弱  人物二 认为 人物一 练武 料  没 教给 人物一 武功 东西,-1
TRAIN_SENT_ID_255313,,卫夫人,王羲之,（ 词语 ） : 晋 王羲之 《 题 卫夫人 笔阵 图后 》 ： “ 每作 一点 ， 如 高峰 坠石 。 ”,词语   晋 人物二  题 人物一 笔阵 图后    每作 一点  高峰 坠石,-1
TRAIN_SENT_ID_256924,,仲由,孔子,孔子 不禁 叹 到 ： “ 神童 仲由 乃 吾师 也 ” 。,人物二 不禁 叹   神童 人物一 吾师,-1
TRAIN_SENT_ID_273366,,杨锐,张之洞,五 、 张之洞 营救 杨锐 的 行动,五  人物二 营救 人物一 行动,-1
TRAIN_SENT_ID_259936,,周志文,周志康,「 超级 巨声 队 」 由 孖 宝兄弟 周志文 、 周志康 上场 献唱 不了情 女曲 男唱 ， 可 有 不同 韵味 ？,超级 巨声 队  孖 宝兄弟 人物一  人物二 上场 献唱 不了情 女曲 男唱  不同 韵味,-1
TRAIN_SENT_ID_277577,,袁承志,穆人清,天外 飞龙 线 雁门关 袁承志 单挑 穆人清 天外 飞龙 1 级,天外 飞龙 线 雁门关 人物一 单挑 人物二 天外 飞龙  级,-1
TRAIN_SENT_ID_259357,,葛玄,左慈,有 张陵 、 南华 、 于吉 传说 之仙 ; 有 左慈 、 葛玄 、 张鲁 、 道 中 挚友 。,张陵  南华  于吉 传说 之仙  人物二  人物一  张鲁  道 中 挚友,-1
TRAIN_SENT_ID_279129,,范长利,朱绍文,沈竹善 相声 辈分 表 : 沈竹善 第一代 - - 第三代 : 张三禄 - - 朱绍文 - - 春长隆 、 冯昆治 、 范长利 、 桂祯 、 徐长福 、 沈竹善,沈竹善 相声 辈分 表  沈竹善 第一代   第三代  张三禄   人物二   春长隆  冯昆治  人物一  桂祯  徐长福  沈竹善,-1
TRAIN_SENT_ID_252659,,颜回,孔子,于是 择地 官山 的 北面 ， 创立 了 燕 居来 供奉 先圣 孔子 ， 先师 颜回 享受 配祀 ， 春秋 持菜 祀 先师 。,择地 官山 北面  创立 燕 居来 供奉 先圣 人物二  先师 人物一 享受 配祀  春秋 持菜 祀 先师,-1
TRAIN_SENT_ID_252596,,颜回,孔子,颜回 随 孔子 重回 帝丘 ， 途经 蒲邑 ， 又 遭到 蒲人 的 拦截 。,人物一 人物二 重回 帝丘  途经 蒲邑  遭到 蒲人 拦截,-1
TRAIN_SENT_ID_252689,,颜回,孔子,本章 用 孔子 赞赏 颜回 的话 来 说明 什么样 的 人才 是 真正 能 坚守 中庸之道 的 智者 。,本章 人物二 赞赏 人物一 说明 人才 真正 坚守 中庸之道 智者,-1
TRAIN_SENT_ID_273132,,包道乙,郑彪,[ 17 - 18 ] 王英 惨烈 结局 : 睦洲 之 战时 ， 方腊 派 包道乙 与 郑彪 、 夏侯成 前去 救援 。,王英 惨烈 结局  睦洲 战时  方腊 派 人物一 人物二  夏侯成 前去 救援,-1
TRAIN_SENT_ID_252787,,颜回,孔子,其六 ， 孔子 赞叹 颜回 一 闻师 教 就 能 立刻 去 实行 。,其六  人物二 赞叹 人物一 闻师 教 立刻 实行,-1
TRAIN_SENT_ID_250657,,鲁西西,皮皮鲁,皮皮鲁 和 鲁西西 有 许多 好玩 的 经历 ， 都 收集 在 30 卷 《 郑渊洁 童话 全集 》 里 。,人物二 人物一 好玩 经历  收集  卷  郑渊洁 童话 全集  里,1
TRAIN_SENT_ID_274174,,牧野枣,牧野遥,相关 人物 : 姐姐 ： 牧野遥 、 牧野枣,相关 人物  姐姐  人物二  人物一,1
TRAIN_SENT_ID_249533,,李蔡,李广,汉朝 时 ， 陇西 李氏 出 了 两位 重要 人物 ： 飞将军 李广 及其 从弟 李蔡 。,汉朝 时  陇西 李氏 出 两位 重要 人物  飞将军 人物二 从弟 人物一,-1
TRAIN_SENT_ID_252779,,颜回,孔子,祭祀 : 汉魏 以后 ， 以 周公为 先圣 ， 孔子 为 先师 ； 唐代 尊 孔子 为 先圣 ， 颜回 为 先师 。,祭祀  汉魏 以后  周公为 先圣  人物二 先师  唐代 尊 人物二 先圣  人物一 先师,-1
TRAIN_SENT_ID_271223,,和硕温恪公主,和硕敦恪公主,入宫 年岁 不详 ， 生一子 二女 ： 和硕 怡 亲王 胤 祥 、 和硕温恪公主 、 和硕敦恪公主 。,入宫 年岁 不详  生一子 二女  和硕 怡 亲王 胤 祥  人物一  人物二,1
TRAIN_SENT_ID_253024,,颜回,孔子,3 历史 评价 : 鱼豢 曰 ： 昔 孔子 叹 颜回 ， 以为 三月 不违 仁者 ， 盖观 其 心耳 ， 孰如孙 、 祝 菜色 於 市里 ， 颠倒 於 牢狱 ， 据 有 实事 哉 ？,历史 评价  鱼豢 曰  昔 人物二 叹 人物一  三月 不违 仁者  盖观 心耳  孰如孙  祝 菜色 於 市里  颠倒 於 牢狱  实事,-1
TRAIN_SENT_ID_254287,,张顺,张横,张横 道 ： “ 小弟 是 张顺 。,人物二 道   小弟 人物一,-1
TRAIN_SENT_ID_266675,,邓鸣贺,邓鸣璐,表演者 ： 邓鸣贺 、 邓鸣璐 、 中国舞蹈家协会 南方 舞蹈 学校,表演者  人物一  人物二  中国舞蹈家协会 南方 舞蹈 学校,-1
TRAIN_SENT_ID_252953,,颜回,孔子,姜全来 成就 及 荣誉 : 主要 作品 有 《 关公 辞 曹 》 、 《 豆叶 黄 》 、 《 张公 赶子 》 、 《 重泣 回 》 、 《 孔子 泣 颜回 》 等 ， 带徒 授艺 数名 。,姜全来 成就 荣誉  主要 作品  关公 辞 曹    豆叶 黄    张公 赶子    重泣 回    人物二 泣 人物一   带徒 授艺 数名,-1
TRAIN_SENT_ID_271526,,孟优,孟获,毒气 泉 历史 研究 : 毒气 泉 原著 场景 : 诸葛亮 四擒四放 孟获 后 ， 毒气 泉 孟获 与其 弟 孟优 逃 到 西洱河 畔 的 秃 龙洞 。,毒气 泉 历史 研究  毒气 泉 原著 场景  诸葛亮 四擒四放 人物二  毒气 泉 人物二 弟 人物一 逃 西洱河 畔 秃 龙洞,-1
TRAIN_SENT_ID_249093,,吕洞宾,韩湘子,韩湘子 吹玉 萧 ， 吕洞宾 击 云板 ( 简板 ) ， 钟离权 拍 渔鼓 应节 而歌 。,人物二 吹玉 萧  人物一 击 云板  简板   钟离权 拍 渔鼓 应节 而歌,-1
TRAIN_SENT_ID_252443,,颜回,孔子,」 孔子 对 曰 ： 「 有 颜回 者 好学 ， 不 迁怒 ， 不 贰 过 。,人物二 曰   人物一 好学  迁怒  贰,-1
TRAIN_SENT_ID_249161,,皮皮鲁,鲁西西,完形填空 Monday 皮皮鲁 和 鲁西西 之 父 — — 郑渊洁,完形填空  人物一 人物二 父   郑渊洁,-1
TRAIN_SENT_ID_252800,,颜回,孔子,颜回 虽然 对 老师 言听计从 ， 但 在 孔子 心目 中 ， 最 忠心耿耿 的 ， 却是 这个 一再 和 自己 过不去 的 子路 。,人物一 老师 言听计从  人物二 心目 中  忠心耿耿  却是 一再 过不去 子路,-1
TRAIN_SENT_ID_252468,,颜回,孔子,《 吕氏春秋 · 慎人 》 ： “ 孔子 弦歌 於 室 ， 颜回 择菜 於 外 。 ”,吕氏春秋  慎人    人物二 弦歌 於 室  人物一 择菜 於 外,-1
TRAIN_SENT_ID_269408,,刘伟,马季,由 马季 先生 和 他 的 搭档 刘伟 合说 一段 《 找 名牌 》 。,人物二 先生 搭档 人物一 合说 一段  找 名牌,-1
TRAIN_SENT_ID_266145,,李昌镐,曹薰铉,2002 年 第 3 届 农心杯 胜 曹薰铉 ； 负 李昌镐,年  届 农心杯 胜 人物二  负 人物一,-1
TRAIN_SENT_ID_257509,,姜昆,马季,主持人 ： 王景愚 、 刘晓庆 、 姜昆 、 马季,主持人  王景愚  刘晓庆  人物一  人物二,-1
TRAIN_SENT_ID_285113,,高季式,高乾,高季式 ， 高乾 四弟 ， 官至 仪同 三司 ， 封乘氏 县子 ， 追赠 侍中 、 冀州 刺史 。,人物一  人物二 四弟  官至 仪同 三司  封乘氏 县子  追赠 侍中  冀州 刺史,1
TRAIN_SENT_ID_276963,,樊迟,孔子,所以 孔子 回答 樊迟 问仁时 的 答案 是 “ 爱人 ” 。,人物二 回答 人物一 问仁时 答案  爱人,-1
TRAIN_SENT_ID_252643,,颜回,孔子,孔子 对 曰 ： “ 夫其 所以 为 颜回 者 ， 此 之类 也 ， 岂足 多 哉 ？ ”,人物二 曰   夫其 人物一   岂足,-1
TRAIN_SENT_ID_273360,,杨锐,张之洞,参加 院试 时 ， 张之洞 将 杨锐 与其 兄 杨聪 二人 比 为 蜀中 当代 的 苏轼 和 苏辙 。,参加 院试 时  人物二 人物一 兄 杨聪 二人 蜀中 当代 苏轼 苏辙,-1
TRAIN_SENT_ID_264239,,陈真,霍元甲,由于 霍元甲 和 黄旗 英都 有 强力 的 分身 和 高 伤害 的 法术 ， 因此 陈真 虽然 号称 “ 永动机 ” ， 黄飞鸿 尽管 有 驰名 的 “ 无影脚 ” ， 也 是 难 敌 父辈 。,人物二 黄旗 英都 强力 分身 高 伤害 法术  人物一 号称  永动机   黄飞鸿 驰名  无影脚   难 敌 父辈,-1
TRAIN_SENT_ID_253045,,颜回,孔子,注 [ 四 ] 论语 颜回 慕 孔子 之言 也 。,注  四  论语 人物一 慕 人物二 之言,-1
TRAIN_SENT_ID_264377,,曾国潢,曾国藩,过 了 一年 多 时间 ， 曾国藩 对 曾国潢 在 作诗 方面 的 长进 感到 非常高兴 ， 同时 又 告诫 他 ： “ 须 有志 有恒 ， 乃有 成就 耳 。 ”,一年 时间  人物二 人物一 作诗 方面 长进 感到 非常高兴  告诫   须 有志 有恒  乃有 成就 耳,-1
TRAIN_SENT_ID_256919,,仲由,孔子,盖 仲由 使 门人 为臣 ， 而 孔子 讥其 欺天 。,盖 人物一 门人 为臣  人物二 讥其 欺天,-1
TRAIN_SENT_ID_267788,,万剑一,林惊羽,但 斩 鬼神 ， 只 属于 斩 龙剑 的 主人 ， 先是 万剑一 ， 后 是 林惊羽 。,斩 鬼神  属于 斩 龙剑 主人  先是 人物一  人物二,-1
TRAIN_SENT_ID_273632,,马阔海,马青山,铠甲 召唤 人 ： 柯胜 ， 小 李子 ， 马青山 ， 马阔海,铠甲 召唤  柯胜  李子  人物二  人物一,-1
TRAIN_SENT_ID_256882,,仲由,孔子,仲村 是 一代 圣贤 孔子 的 得意门生 仲由 的 故里 ， 是 历史 上 的 文明 古镇 之一 。,仲村 一代 圣贤 人物二 得意门生 人物一 故里  历史 文明 古镇,-1
TRAIN_SENT_ID_249556,,李蔡,李广,《 史记 》 叙 李广 事 ， 曾以 其 堂弟 李蔡 作为 反衬 。,史记  叙 人物二 事  曾以 堂弟 人物一 反衬,-1
TRAIN_SENT_ID_252944,,颜回,孔子,《 吕氏春秋 · 审分览 · 任数 》 ： “ 孔子 望见 颜回 攫取 其 甑 中 而 食 之 。,吕氏春秋  审分览  任数    人物二 望见 人物一 攫取 甑 中 食,-1
TRAIN_SENT_ID_274062,,南宫敬叔,孔子,孟懿子 基本 信息 : 鲁昭公 二十四年 （ 前 518 年 ） ， 孟僖子 临终 之前 ， 让 孟懿子 、 南宫敬叔 都 要 将 孔子 作为 老师 。,孟懿子 基本 信息  鲁昭公 二十四年  前  年   孟僖子 临终 之前  孟懿子  人物一 人物二 老师,1
TRAIN_SENT_ID_253062,,颜回,孔子,生于 鲁国 萧邑 ， 孔子 高徒 ， 在 孔门 中以 德行 与 颜回 并称 ， 为 七十二 贤 之一 。,生于 鲁国 萧邑  人物二 高徒  孔门 中以 德行 人物一 并称  七十二 贤,-1
TRAIN_SENT_ID_266185,,李昌镐,曹薰铉,他 与 李昌镐 、 曹薰铉 、 刘昌赫 合称 “ 韩国 棋坛 四大 金刚 ” 。,人物一  人物二  刘昌赫 合称  韩国 棋坛 四大 金刚,-1
TRAIN_SENT_ID_282410,,赵公明,通天教主,通天教主 分宝后 ， 二十四颗 定 海珠 为 截教 隐仙 、 天皇 得道者 赵公明 所有 。,人物二 分宝后  二十四颗 定 海珠 截教 隐仙  天皇 得道者 人物一,-1
TRAIN_SENT_ID_255464,,罗成,秦琼,连 秦琼 也 怀疑 过 罗成 ， 罗成 要是 知道 表兄 怀疑 过 自己 ， 一定 会 很 伤心 。,人物二 怀疑 人物一  人物一 知道 表兄 怀疑  一定 会 伤心,-1
TRAIN_SENT_ID_252952,,颜回,孔子,子贡 把 颜回 吃饭 的 事 告诉 了 孔子 。,子贡 人物一 吃饭 事 告诉 人物二,-1
TRAIN_SENT_ID_259626,,季布,季心,史料 : 季布 弟 季心 ， 气盖 关中 ， 遇人 恭谨 ， 为 任侠 ， 方 数千里 ， 士皆争 为 之 死 。,史料  人物一 弟 人物二  气盖 关中  遇人 恭谨  任侠  方 数千里  士皆争 死,-1
TRAIN_SENT_ID_267787,,万剑一,林惊羽,林惊羽 则 偶然 得到 了 藏身 在 祖师 祠堂 中 的 上代 青云 最出色 的 人物 万剑一 的 教诲 ， 修为 也 大有 长进 。,人物二 偶然 得到 藏身 祖师 祠堂 中 上代 青云 最出色 人物 人物一 教诲  修为 大有 长进,1
TRAIN_SENT_ID_268814,,洪凌波,李莫愁,4 人物 武功 : 洪凌波 得 李莫愁 真传 ， 而 李莫愁 的 古墓 剑法 精妙 无比 ， 故 洪凌波 的 剑法 也 是 凌厉 。,人物 武功  人物一 人物二 真传  人物二 古墓 剑法 精妙 无比  人物一 剑法 凌厉,-1
TRAIN_SENT_ID_256862,,仲由,孔子,仲由 以 政事 见称 ， 为 人 伉直 ， 好 勇力 ， 跟随 孔子 周游列国 ， 是 孔门 七十二 贤 之一 。,人物一 政事 见称  伉直  勇力  跟随 人物二 周游列国  孔门 七十二 贤,-1
TRAIN_SENT_ID_252811,,颜回,孔子,不改其乐 成语 示例 : （ 孔子 ） 称赞 颜回 吃喝 不够 ， 不改其乐 。,不改其乐 成语 示例   人物二  称赞 人物一 吃喝 不够  不改其乐,-1
TRAIN_SENT_ID_250606,,鲁西西,皮皮鲁,皮皮鲁 、 鲁西西 、 大灰狼 罗克 、 舒克和贝塔 是 他 笔下 的 人物 。,人物二  人物一  大灰狼 罗克  舒克和贝塔 笔下 人物,1
TRAIN_SENT_ID_275528,,王小虎,赵本山,2005 小品 《 功夫 》 （ 赵本山 、 范伟 、 蔡维利 、 王小虎 ）,小品  功夫   人物二  范伟  蔡维利  人物一,-1
TRAIN_SENT_ID_253052,,颜回,孔子,他 是 颜回 ( 颜渊 ) 的 父亲 ， 父子俩 曾 先后 在 孔子 门下 求学 。,人物一  颜渊  父亲  父子俩 先后 人物二 门下 求学,1
TRAIN_SENT_ID_284829,,金正中,马小玲,马小玲 ： 这个 物体 叫 金正中 ， 是 我 的 徒弟 。,人物二  物体 人物一  徒弟,-1
TRAIN_SENT_ID_275526,,王小虎,赵本山,王小虎 ： （ 朝 赵本山 ） 师傅 ， 太 对不起 了 ， 你 那 忽悠 智商 太低 了 ， 跟 你 也 学不着 啥 玩意儿 ！,人物一   人物二  师傅  太 对不起  忽悠 智商 太低  学不着 玩意儿,-1
TRAIN_SENT_ID_275470,,李汉俊,李书城,在 现代史 上 ， 潜江 这块 饱含 灵气 的 土地 孕育 了 戏剧 大师 曹禺 以及 中共一大 代表 李汉俊 、 辛亥革命 元老 李书城 等 从 多 英才 。,现代史  潜江 这块 饱含 灵气 土地 孕育 戏剧 大师 曹禺 中共一大 代表 人物一  辛亥革命 元老 人物二 英才,-1
TRAIN_SENT_ID_252508,,颜回,孔子,曾 参以 他 的 建树 ， 终于 走进 大儒 殿堂 ， 与 孔子 、 孟子 、 颜子 （ 颜回 ） 、 子思子 比肩 共 称为 五大 圣人 。,参以 建树  终于 走进 大儒 殿堂  人物二  孟子  颜子  人物一   子思子 比肩 共 称为 五大 圣人,-1
TRAIN_SENT_ID_263396,,武修文,武敦儒,话说回来 ， 武敦儒 、 武修文 虽然 不是 什么 大 英雄 ， 但 无愧于 对 国家 对 人民 有用 之材 的 称号 。,话说回来  人物二  人物一 英雄  无愧于 国家 人民 有用 之材 称号,-1
TRAIN_SENT_ID_270973,,李易霏,李昂融,（ 现代 美 ） 李易霏 全运会 上 最 耀眼 的 小 明星 : 她们 是 — — 李易霏 李昂融 。,现代 美  人物一 全运会 耀眼 明星    人物一 人物二,-1
TRAIN_SENT_ID_255327,,卫夫人,王羲之,三国 高贵 公曹髦 后裔 ， 早年 学书 ， 师法 王羲之 、 卫夫人 等 ， 擅画 马 ， 尤精 鞍马 人物 。,三国 高贵 公曹髦 后裔  早年 学书  师法 人物二  人物一  擅画 马  尤精 鞍马 人物,-1
TRAIN_SENT_ID_261583,,南宫敬叔,孟懿子,孟懿子 和 南宫敬叔 学礼于 孔子 。,人物二 人物一 学礼于 孔子,-1
TRAIN_SENT_ID_252754,,颜回,孔子,颜回 卒 ， 孔子 十分 悲伤 。,人物一 卒  人物二 十分 悲伤,-1
TRAIN_SENT_ID_286469,,高进军,党荣华,高进军 ， 书法 艺术家 ， 醉 墨轩 主人 ， 中华 毛体 创始人 ， 军人 世家 ， 山东 籍 ， 老师 党荣华 ， 导师 宋学伟 。,人物一  书法 艺术家  醉 墨轩 主人  中华 毛体 创始人  军人 世家  山东 籍  老师 人物二  导师 宋学伟,-1
TRAIN_SENT_ID_261168,,王缙,王维,诗人 王维 、 钱起 、 卢纶 、 王缙 、 苏舜钦 等 也 均 有 赞誉 悟 真寺 的 诗篇 。,诗人 人物二  钱起  卢纶  人物一  苏舜钦 均 赞誉 悟 真寺 诗篇,-1
TRAIN_SENT_ID_271257,,马季,侯宝林,随团 学习 期间 ， 深受 侯宝林 、 郭启儒 、 刘宝瑞 等 前辈 的 教益 ， 始用 艺名 “ 紫阳 ” ， 并 与 马季 （ 原名 ： 马树槐 ） 搭档 ， 互为 捧 逗 。,随团 学习 期间  深受 人物二  郭启儒  刘宝瑞 前辈 教益  始用 艺名  紫阳   人物一  原名  马树槐  搭档  互为 捧 逗,-1
TRAIN_SENT_ID_269012,,李如柏,李如松,人们 把 麻家 与 同样 是 武将 世家 的 李如松 、 李如柏 等 并 称为 “ 东 李西 麻 ” 。,麻家 同样 武将 世家 人物二  人物一 称为  东 李西 麻,-1
TRAIN_SENT_ID_255202,,赵海燕,赵本山,《 有病 没病 》 （ 表演 ： 赵本山 、 赵海燕 、 李正春 ）,有病 没病   表演  人物二  人物一  李正春,-1
TRAIN_SENT_ID_275246,,汤潮,赵本山,《 狼爱 上阳 》 取自 汤潮 成名曲 ， 歌名 是 师傅 赵本山 最后 亲自 定 的 ， “ 小 沈阳 就是 狼 ， 春阳 这 不 就是 阳 么 ， 狼爱 上阳 ， 很 形象 。 ”,狼爱 上阳  取自 人物一 成名曲  歌名 师傅 人物二 最后 亲自 定   沈阳 狼  春阳 阳  狼爱 上阳  形象,-1
TRAIN_SENT_ID_252968,,颜回,孔子,颜回 随 孔子 在 陈 、 蔡 期间 绝粮 七天 ， 子贡 费 了 许多 周折 才 买 回 一石米 。,人物一 人物二 陈  蔡 期间 绝粮 七天  子贡 费 周折 买 回 一石米,-1
TRAIN_SENT_ID_251424,,李瀚章,李鸿章,"曾文正公 家书 出版 信息 : 作者 ： （ 清 ） 曾国藩 著 , （ 清 ） 李瀚章 编撰 , （ 清 ） 李鸿章 校刊",曾文正公 家书 出版 信息  作者   清  曾国藩 著   清  人物一 编撰   清  人物二 校刊,1
TRAIN_SENT_ID_255295,,卫夫人,王羲之,除 卫夫人 是 王羲之 的 书法 启蒙 师 以外 ， 卫夫人 还 可能 是 王羲之 的 姨母 。,人物一 人物二 书法 启蒙 师 以外  人物一 可能 人物二 姨母,-1
TRAIN_SENT_ID_252459,,颜回,孔子,一会儿 ， 饭熟 了 ， 颜回 请 孔子 吃饭 。,一会儿  饭熟  人物一 请 人物二 吃饭,-1
TRAIN_SENT_ID_258119,,孙少安,孙兰香,（ 小说 《 平凡 的 世界 》 中 人物 ） : 孙兰香 ， 女 ， 1962 年生 ， 路遥 《 平凡 的 世界 》 中 的 人物 ， 是 主人公 孙少安 、 孙少平 的 妹妹 。,小说  平凡 世界  中 人物   人物二  女   年生  路遥  平凡 世界  中 人物  主人公 人物一  孙少平 妹妹,1
TRAIN_SENT_ID_253141,,颜回,孔子,殿内 迎门 原来 供奉 着 大成 至圣先师 孔于 的 画像 ， 旁侧 侍立 着 孔子 得意 弟子 颜回 、 子思 、 曾子 和 大名鼎鼎 的 “ 亚圣 ” 孟子 的 牌位 。,殿内 迎门 原来 供奉 大成 至圣先师 孔于 画像  旁侧 侍立 人物二 得意 弟子 人物一  子思  曾子 大名鼎鼎  亚圣  孟子 牌位,-1
TRAIN_SENT_ID_283921,,罗人杰,余沧海,是 青城派 余沧海 四大 弟子 之一 ， 与 侯人英 、 于人豪 、 罗人杰 合称 “ 英雄豪杰 ， 青城 四秀 ” 。,青城派 人物二 四大 弟子  侯人英  于人豪  人物一 合称  英雄豪杰  青城 四秀,-1
TRAIN_SENT_ID_283222,,薛慕华,苏星河,江湖外传 之 天龙八部 薛慕华 : 外号 “ 阎王 敌 ” ， 函 谷八友 中 的 老五 ， 原 为 逍遥派 苏星河 弟子 ， 医术 高明 ， 胡子 半黑 半白 。,江湖外传 天龙八部 人物一  外号  阎王 敌   函 谷八友 中 老五  原 逍遥派 人物二 弟子  医术 高明  胡子 半黑 半白,-1
TRAIN_SENT_ID_256905,,仲由,孔子,孔子 教育 弟子 知 德行 仁 ， 恰当 地 指出 颜回 及 仲由 的 优缺点 ， 为了 令 他 更好 的 前进 。,人物二 教育 弟子 知 德行 仁  恰当 指出 颜回 人物一 优缺点  令 更好 前进,-1
