sent_id,sent_id,entity1,entity2,sent,processed_sent,human
TRAIN_SENT_ID_250659,,鲁西西,皮皮鲁,他 笔下 的 皮皮鲁 、 鲁西西 、 罗克 、 舒克和贝塔 影响 了 两代 中国 孩子 。,笔下 人物二  人物一  罗克  舒克和贝塔 影响 两代 中国 孩子,1
TRAIN_SENT_ID_250594,,鲁西西,皮皮鲁,他 的 童话 作品 以 全新 独特 的 面貌 征服 了 全国 亿万 小 读者 ， 他 笔下 的 皮皮鲁 、 鲁西西 和 舒克 、 贝塔 ， 在 中国 孩子 中 无人不晓 。,童话 作品 全新 独特 面貌 征服 全国 亿万 读者  笔下 人物二  人物一 舒克  贝塔  中国 孩子 中 无人不晓,1
TRAIN_SENT_ID_275926,,孙莹莹,孙芸芸,孙莹莹 个人 生活 : 孙莹莹 ， 父亲 为 太平洋 电线电缆 集团 前 董事长 孙道存 ， 母亲 是 元 大 证券 副董事长 何念慈 ， 名媛 孙芸芸 的 姐姐 。,人物一 个人 生活  人物一  父亲 太平洋 电线电缆 集团 前 董事长 孙道存  母亲 元 证券 副董事长 何念慈  名媛 人物二 姐姐,1
TRAIN_SENT_ID_255491,,罗成,秦琼,后来 惹 上 官司 被 发配 到 北平 府 ， 而 北平 王 罗艺 却是 秦琼 的 姑父 ， 秦琼 得以 在 罗艺 帐下 任职 ， 并 和 罗艺 的 儿子 罗成 钻研 武艺 ， 传枪 递锏 。,后来 惹 官司 发配 北平 府  北平 王 罗艺 却是 人物二 姑父  人物二 得以 罗艺 帐下 任职  罗艺 儿子 人物一 钻研 武艺  传枪 递锏,1
TRAIN_SENT_ID_277418,,尹夏沫,尹澄,尹夏沫 演艺 经历 : 与 尹澄 和 洛熙 参加 超级 巨星 ， 唱 《 黑猫 与 牛奶 》 彩虹 广场 上 唱 《 钻石 》,人物一 演艺 经历  人物二 洛熙 参加 超级 巨星  唱  黑猫 牛奶  彩虹 广场 唱  钻石,1
TRAIN_SENT_ID_282802,,李翊,李威,李翊 演艺 经历 : 2003 年 ， 凭借 客串 李威 主演 的 电视剧 《 单身 宿舍 连环泡 》 而 正式 进入 演艺圈 。,人物一 演艺 经历   年  客串 人物二 主演 电视剧  单身 宿舍 连环泡  正式 进入 演艺圈,1
TRAIN_SENT_ID_254266,,张顺,张横,张顺 . （ 渔家 ， 张横 之弟 ） 三十六 天罡 星天败星 : 天败星 …,人物一   渔家  人物二 之弟  三十六 天罡 星天败星  天败星,1
TRAIN_SENT_ID_283893,,李晏,李纶,李晏 ， 李纶 之弟 ， 封 赵郡 公 ， 官至 开府 仪同 三司 、 大将军 。,人物一  人物二 之弟  封 赵郡 公  官至 开府 仪同 三司  大将军,1
TRAIN_SENT_ID_250431,,赵飞燕,赵合德,后来 成帝 听说 赵飞燕 的 妹妹 赵合德 长得 更 美 ， 于是 又 将 合德 召人 宫中 。,后来 成帝 听说 人物一 妹妹 人物二 长得 更 美  合德 召人 宫中,1
TRAIN_SENT_ID_250333,,赵飞燕,赵合德,赵飞燕 成为 了 皇后 ， 虽然 获得 了 作为 女人 的 最 显赫 地位 ， 但 成帝 对 她 的 宠爱 却 渐渐 不如 以往 ， 成帝 更为 宠爱 她 的 妹妹 赵合德 。,人物一 成为 皇后  获得 女人 显赫 地位  成帝 宠爱 渐渐 以往  成帝 更为 宠爱 妹妹 人物二,1
TRAIN_SENT_ID_272686,,蓝兰,张晓,后 殷 发现 他 最初 在 博物馆 遇见 的 人 不是 蓝兰 ， 而是 与 蓝兰 长得 一模一样 的 孪生 妹妹 张晓 … …,殷 发现 最初 博物馆 遇见 人物一  人物一 长得 一模一样 孪生 妹妹 人物二,1
TRAIN_SENT_ID_249256,,皮皮鲁,鲁西西,鲁西西 的 故事 内容 介绍 : 皮皮鲁 和 鲁西西 是 双胞胎 兄妹 ， 他们 在 中国 的 孩子 中是 几乎 无人不晓 的 传奇人物 。,人物二 故事 内容 介绍  人物一 人物二 双胞胎 兄妹  中国 孩子 中是 几乎 无人不晓 传奇人物,1
TRAIN_SENT_ID_266679,,邓鸣贺,邓鸣璐,为 2012 龙年 春晚 的 开场 和 零点 报时 的 开门 娃娃 ， 而 邓鸣贺 更是 携手 妹妹 邓鸣璐 再次 登上 2013 年 蛇 年 春晚 。,龙年 春晚 开场 零点 报时 开门 娃娃  人物一 更是 携手 妹妹 人物二 再次 登上  年 蛇 年 春晚,1
TRAIN_SENT_ID_250589,,鲁西西,皮皮鲁,他 笔下 的 皮皮鲁 、 鲁西西 和 罗克 ， 舒克 贝塔 影响 了 中国 三代 的 孩子 。,笔下 人物二  人物一 罗克  舒克 贝塔 影响 中国 三代 孩子,1
TRAIN_SENT_ID_268197,,章子男,章子怡,章子男 与 章子怡 从小 一起 长大 ， 很多 事情 他们 都 会 互相 听取 对方 的 意见 。,人物一 人物二 从小 一起 长大  很多 事情 会 互相 听取 意见,1
TRAIN_SENT_ID_253815,,孟凡,孟芙,"= 孟凡 心机 小马 子 远离 孟凡 = 孟凡 将 妹妹 坟墓 移入 皇宫 , 请 唐玄宗 封 孟芙 为兰妃 。",人物一 心机 小马 子 远离 人物一  人物一 妹妹 坟墓 移入 皇宫  请 唐玄宗 封 人物二 为兰妃,1
TRAIN_SENT_ID_259781,,李偲菘,李伟菘,其中 李偲菘 、 李伟菘 还同 郭亮 一起 担任 了 专辑 的 制作 人一职 。,人物一  人物二 还同 郭亮 一起 担任 专辑 制作 人一职,1
TRAIN_SENT_ID_272680,,蓝兰,张晓,整容 后 的 蓝兰 、 张晓 的 亲姐姐 ， 原 跟 张晓 长得 一模一样 ， 后来 整容 。,整容 人物一  人物二 亲姐姐  原 人物二 长得 一模一样  后来 整容,1
TRAIN_SENT_ID_277659,,关彝,关统,关统 死 了 之后 没有 儿子 继承 ， 遂 找 了 关兴 的 庶子 关彝 继承 。,人物二 死 之后 没有 儿子 继承  遂 找 关兴 庶子 人物一 继承,1
TRAIN_SENT_ID_249141,,皮皮鲁,鲁西西,与 皮皮鲁 鲁西西 一起 长 大门 / 197,人物一 人物二 一起 长 大门,1
TRAIN_SENT_ID_259410,,凌音,凌波,凌音 角色 关系 : 亲人 ： 父母 未知 ， 有 一 亲生 姐姐 凌波 。,人物一 角色 关系  亲人  父母 未知  亲生 姐姐 人物二,1
TRAIN_SENT_ID_265604,,刘秀融,刘鸣炜,他 与 前妻 宝咏琴 在 1977 年 结婚 ， 婚后 育有 一对 儿女 ， 儿子 刘鸣炜 （ 35 岁 ） ， 女儿 刘秀融 （ 19 岁 ） 。,前妻 宝咏琴  年 结婚  婚后 育有 一对 儿女  儿子 人物二   岁   女儿 人物一   岁,1
TRAIN_SENT_ID_270037,,楚寒镜,楚碧痕,楚寒镜 ， 单机游戏 《 仙剑 奇侠传 四 》 主线 任务 重要 角色 ， 炎帝 神农 洞 月 幽之境 中 守护 梭罗 仙树 的 梭罗树 仙 之一 ， 楚碧痕 的 孪生 姐姐 。,人物一  单机游戏  仙剑 奇侠传 四  主线 任务 重要 角色  炎帝 神农 洞 月 幽之境 中 守护 梭罗 仙树 梭罗树 仙  人物二 孪生 姐姐,1
TRAIN_SENT_ID_250343,,赵飞燕,赵合德,四 、 赵飞燕 为 什麼 要 向 成帝 引荐 孪生 妹妹 赵合德 ？,四  人物一 什麼 成帝 引荐 孪生 妹妹 人物二,1
TRAIN_SENT_ID_265606,,刘秀融,刘鸣炜,1992 年底 离婚 ， 跟 前妻 宝咏琴 有 儿子 刘鸣炜 ， 以及 女儿 刘秀融 。,年底 离婚  前妻 宝咏琴 儿子 人物二  女儿 人物一,1
TRAIN_SENT_ID_260583,,金敬姬,金正日,金日成 的 第一任 妻子 为 金正淑 ， 生有 两子 一女 ， 两子 分别 是 金正日 、 金 万一 和 女儿 金敬姬 。,金日成 第一任 妻子 金正淑  生有 两子 一女  两子 人物二  金 女儿 人物一,1
TRAIN_SENT_ID_266670,,邓鸣贺,邓鸣璐,2012 年 ， 邓鸣贺 不仅 自己 来 了 ， 还 带来 了 同样 萌翻 全场 的 妹妹 邓鸣璐 。,年  人物一  带来 同样 萌翻 全场 妹妹 人物二,1
TRAIN_SENT_ID_251832,,梅超风,黄药师,黄药师 为了 找寻 女儿 打破 誓言 离开 桃花岛 ， 在 太湖 归云庄 发现 了 黄蓉 、 郭靖 及 为 救 杨康 而来 的 梅超风 。,人物二 找寻 女儿 打破 誓言 离开 桃花岛  太湖 归云庄 发现 黄蓉  郭靖 救 杨康 而来 人物一,1
TRAIN_SENT_ID_250685,,鲁西西,皮皮鲁,皮皮鲁 和 鲁西西 新 奇遇记 ： 写给 爸爸妈妈 看 的 童话 作者 介绍 : 郑渊洁 ， 中国 文坛 传奇人物 。,人物二 人物一 新 奇遇记  写给 爸爸妈妈 童话 作者 介绍  郑渊洁  中国 文坛 传奇人物,1
TRAIN_SENT_ID_266059,,张学思,张学良,张学思 ， 原籍 辽宁 海城 县 ， 1916 年 生于 奉天 ( 今 沈阳 ) ， 系 张作霖 之子 ， 张学良 之弟 。,人物一  原籍 辽宁 海城 县   年 生于 奉天  沈阳   系 张作霖 之子  人物二 之弟,1
TRAIN_SENT_ID_250662,,鲁西西,皮皮鲁,皮皮鲁 和 鲁西西 的 故事 内容简介 : 皮皮鲁 和 鲁西西 是 双胞胎 兄妹 ， 他们 在 中国 的 孩子 中是 几乎 无人不晓 的 传奇人物 。,人物二 人物一 故事 内容简介  人物二 人物一 双胞胎 兄妹  中国 孩子 中是 几乎 无人不晓 传奇人物,1
TRAIN_SENT_ID_250386,,赵飞燕,赵合德,赵飞燕 有个 妹妹 叫 赵合德 ， 比 她 更 迷人 ， 也 被 召 进宫 。,人物一 有个 妹妹 人物二  更 迷人  召 进宫,1
TRAIN_SENT_ID_265729,,李三思,李三省,特请 景天 名 之 ， 景天 以 “ 三思而后行 ” 名 长子 李三思 ， 以 “ 吾 日 三 省吾身 ” 名次 子 李三省 ， 以 “ 三 ” 字以 纪念 早夭 之弟 。,特请 景天 名  景天  三思而后行  名 长子 人物一   吾 日 三 省吾身  名次 子 人物二   三  字以 纪念 早夭 之弟,1
TRAIN_SENT_ID_273133,,包道乙,郑彪,梁山 军 攻打 睦州时 ， 夏侯成 与 包道乙 、 郑彪 一起 迎战 ， 被 梁山 军 击败 。,梁山 军 攻打 睦州时  夏侯成 人物一  人物二 一起 迎战  梁山 军 击败,1
TRAIN_SENT_ID_250413,,赵飞燕,赵合德,这 赵飞燕 也 大方 得 很 ， 不像 某些 女人 争风吃醋 ， 可能 是 有福同享 ， 可能 是 加强 阵营 ， 还 把 妹妹 赵合德 也 介绍 进来 供 成帝 享用 。,人物一 大方  不像 女人 争风吃醋  可能 有福同享  可能 加强 阵营  妹妹 人物二 介绍 进来 供 成帝 享用,1
TRAIN_SENT_ID_257491,,姜昆,马季,姜昆 演艺 经历 : 1983 年 与 王景愚 、 刘晓庆 、 马季 担任 央视春晚 主持人 并 与 王景愚 表演 喜剧 小品 《 吃 鸡 》 等 。,人物一 演艺 经历   年 王景愚  刘晓庆  人物二 担任 央视春晚 主持人 王景愚 表演 喜剧 小品  吃 鸡,1
TRAIN_SENT_ID_257427,,姜昆,马季,主持人 ： 马季 、 姜昆 、 张喻 、 朱苑宜 （ 中国台湾 ） 、 斑斑 （ 中国香港 ）,主持人  人物二  人物一  张喻  朱苑宜  中国台湾   斑斑  中国香港,1
TRAIN_SENT_ID_250588,,鲁西西,皮皮鲁,2 内容简介 : 皮皮鲁 和 鲁西西 是 双胞胎 兄妹 ， 他们 在 中国 的 孩子 中是 几乎 无人不晓 的 传奇人物 。,内容简介  人物二 人物一 双胞胎 兄妹  中国 孩子 中是 几乎 无人不晓 传奇人物,1
TRAIN_SENT_ID_263019,,钱婆婆,汤婆婆,钱婆婆 是 日本 动画 《 千与千寻 》 中 的 人物 ， 是 “ 汤屋 ” 的 主管 汤婆婆 的 双胞胎 姐姐 。,人物一 日本 动画  千与千寻  中 人物   汤屋  主管 人物二 双胞胎 姐姐,1
TRAIN_SENT_ID_278071,,马枪月,谷本夏,马枪月 角色 介绍 : 有 长期 流浪 的 僻 好 ， 收 了 谷本夏 为徒 。,人物一 角色 介绍  长期 流浪 僻  收 人物二 为徒,1
TRAIN_SENT_ID_274086,,南宫敬叔,孔子,南宫敬叔 和 孔子 一起 到 了 周国 。,人物一 人物二 一起 周国,1
TRAIN_SENT_ID_274312,,习乾平,习近平,习乾平 ， 是 无产阶级 革命家 、 政治家 、 原 党和国家 领导人 习仲勋 之女 ， 现任 党和国家 主要 领导人 习近平 的 同父异母 的 姐姐 。,人物一  无产阶级 革命家  政治家  原 党和国家 领导人 习仲勋 之女  现任 党和国家 主要 领导人 人物二 同父异母 姐姐,1
TRAIN_SENT_ID_270035,,楚寒镜,楚碧痕,楚寒镜 是 炎帝 神农 洞 月 幽之境 中 守护 梭罗 仙树 的 梭罗树 仙 之一 ， 楚碧痕 的 孪生 姐姐 。,人物一 炎帝 神农 洞 月 幽之境 中 守护 梭罗 仙树 梭罗树 仙  人物二 孪生 姐姐,1
TRAIN_SENT_ID_272654,,邢德全,邢夫人,邢德全 人物 经历 : 邢大舅 投奔 邢夫人 后 ， 只 知以 吃酒 赌钱 、 眠花宿柳 为乐 ， 手中 滥漫 使 钱 ， 待人 无心 ， 呆气 十足 ， 人称 “ 傻 大舅 ” 。,人物一 人物 经历  邢大舅 投奔 人物二  知以 吃酒 赌钱  眠花宿柳 为乐  手中 滥漫 钱  待人 无心  呆气 十足  人称  傻 大舅,1
TRAIN_SENT_ID_270983,,严舆,严白虎,三国群英 传 2 严舆 形象 严舆 简明 演义 传记 : 严舆 ， 严白虎 之弟 ， 三国演义 第 15 回 登场 。,三国群英 传  人物一 形象 人物一 简明 演义 传记  人物一  人物二 之弟  三国演义  回 登场,1
TRAIN_SENT_ID_256993,,蒋雯娟,蒋雯丽,蒋雯娟 从小 就 看好 妹妹 的 表演 天赋 ， 还 曾 带 着 蒋雯丽 去 解放军 艺术团 “ 毛遂自荐 ” 。,人物一 从小 看好 妹妹 表演 天赋  带 人物二 解放军 艺术团  毛遂自荐,1
TRAIN_SENT_ID_267586,,骆赢,骆羽,女 骆赢 与 双胞胎 妹妹 骆羽 团队 : 中国 女子 羽毛球队,女 人物一 双胞胎 妹妹 人物二 团队  中国 女子 羽毛球队,1
TRAIN_SENT_ID_284013,,田神玉,田神功,田神玉 ， 唐将 田神功 之弟 ， 自曹州 刺史 权 汴州 留后 。,人物一  唐将 人物二 之弟  自曹州 刺史 权 汴州 留后,1
TRAIN_SENT_ID_270982,,严舆,严白虎,三国群英 传 2 严舆 形象 简明 演义 传记 : 严舆 ， 严白虎 之弟 ， 三国演义 第 15 回 登场 。,三国群英 传  人物一 形象 简明 演义 传记  人物一  人物二 之弟  三国演义  回 登场,1
TRAIN_SENT_ID_270978,,李易霏,李昂融,姐姐 ： 李易霏 （ 朵朵 ） 妹妹 ： 李昂融 （ 果果 ）,姐姐  人物一  朵朵  妹妹  人物二  果果,1
TRAIN_SENT_ID_268812,,洪凌波,李莫愁,洪凌波 角色 能力 : 洪凌波 得 李莫愁 真传 ， 而 李莫愁 的 古墓 剑法 精妙 无比 ， 故 洪凌波 的 剑法 也 是 凌厉 。,人物一 角色 能力  人物一 人物二 真传  人物二 古墓 剑法 精妙 无比  人物一 剑法 凌厉,1
TRAIN_SENT_ID_267435,,陆展元,陆立鼎,电视剧 版 的 陆展元 前期 经历 纯属虚构 ， 后期 经历 、 武功 等 都 是 按照 原著 中其弟 陆立鼎 来 改编 的 ， 并且 此处 严重 不 符合 逻辑 。,电视剧 版 人物一 前期 经历 纯属虚构  后期 经历  武功 原著 中其弟 人物二 改编  严重 符合 逻辑,1
TRAIN_SENT_ID_275988,,朱竹云,朱竹清,朱竹云 人物 设定 : 朱竹清 的 姐姐 ， 比 她 大 了 七岁 。,人物一 人物 设定  人物二 姐姐  七岁,1
TRAIN_SENT_ID_250372,,赵飞燕,赵合德,1996 年 执导 古装 宫斗剧 《 汉宫 飞燕 》 ， 该剧 描述 西汉时期 美女 赵飞燕 及其 妹妹 赵合德 传奇一生 故事 。,年 执导 古装 宫斗剧  汉宫 飞燕   该剧 描述 西汉时期 美女 人物一 妹妹 人物二 传奇一生 故事,1
TRAIN_SENT_ID_249218,,皮皮鲁,鲁西西,罐头 小人 各有所长 ， 皮皮鲁 和 鲁西西 带 罐头 小人 一起 上学 ， 发生 了 一连串 让 人 忍俊不禁 的 故事 。,罐头 小人 各有所长  人物一 人物二 带 罐头 小人 一起 上学  发生 一连串 忍俊不禁 故事,1
TRAIN_SENT_ID_258149,,刘星,夏雪,刘星 身份 ： 刘梅 的 儿子 ， 夏雨 之兄 ， 夏雪 之弟 。,人物一 身份  刘梅 儿子  夏雨 之兄  人物二 之弟,1
TRAIN_SENT_ID_262240,,尤二姐,尤三姐,尤二姐 吓 得 逃到 花厅 向 妹妹 求救 ， 尤三姐 痛骂 贾珍 的 无耻 行为 ， 要 把 他 赶出去 。,人物一 逃到 花厅 妹妹 求救  人物二 痛骂 贾珍 无耻 行为  赶出去,1
TRAIN_SENT_ID_264244,,陈真,霍元甲,陈真 自此 与 霍元甲 之子 霍东阁 隐姓埋名 过活 ， 最终 陈真 与 日本 人 佐藤 同归于尽 ， 这部 香港 电视剧 在 当时 中国 大陆 亦 相当 受欢迎 。,人物一 自此 人物二 之子 霍东阁 隐姓埋名 过活  最终 人物一 日本 佐藤 同归于尽  这部 香港 电视剧 当时 中国 大陆 相当 受欢迎,1
TRAIN_SENT_ID_282999,,卢宗道,卢怀道,卢宗道 ， 卢怀道 之弟 ， 范阳 涿人 也 。,人物一  人物二 之弟  范阳 涿人,1
TRAIN_SENT_ID_264824,,陈永奎,陈永燊,陈永燊 — — 陈瑞 球 之 儿子 、 陈永奎 之弟 及 陈淑玲 之兄,人物二   陈瑞 球 儿子  人物一 之弟 陈淑玲 之兄,1
TRAIN_SENT_ID_275644,,邢一诚,邢大业,业一 阿一 （ 邢一诚 ） — — 炎亚纶 饰 : 和 堂哥 邢大业 一起 搬进 小风家 楼上 ， 在 学校 和 小风 同班 。,业一 阿一  人物一    炎亚纶 饰  堂哥 人物二 一起 搬进 小风家 楼上  学校 小风 同班,1
TRAIN_SENT_ID_249147,,皮皮鲁,鲁西西,皮皮鲁 和 鲁西西 带 罐头 小人 一起 上学 ， 其 经历 让 人 忍俊不禁 。,人物一 人物二 带 罐头 小人 一起 上学  经历 忍俊不禁,1
TRAIN_SENT_ID_250430,,赵飞燕,赵合德,该剧 描述 西汉时期 著名 美女 赵飞燕 及其 妹妹 赵合德 传奇一生 故事 的 古装 电视剧 ， 于 1998 年 正式 发行 。,该剧 描述 西汉时期 著名 美女 人物一 妹妹 人物二 传奇一生 故事 古装 电视剧   年 正式 发行,1
TRAIN_SENT_ID_279220,,吕馨,吕禄,吕馨 连忙 磕头 以示 感谢 ， 然后 和 吕禄 一起 离开 ， 这时 她 的 心里 一定 很 高兴 ， 因为 免过 了 一死 ， 但 她 意料不到 的 是 ， 死神 依然 在 向 她 招手 。,人物一 连忙 磕头 以示 感谢  人物二 一起 离开  心里 一定 高兴  免过 一死  意料不到  死神 依然 招手,1
TRAIN_SENT_ID_249138,,皮皮鲁,鲁西西,皮皮鲁 赞许 道 ， 我 妹妹 鲁西西 呢 ？,人物一 赞许 道  妹妹 人物二,1
TRAIN_SENT_ID_270555,,黎绍峰,黎雪竹,后 被 黎绍峰 所救 ， 经过 黎雪竹 （ 黎绍峰 姐姐 ） 的 残酷 训练 将 她 一步 一步 的 打 造成 了 青萍 的 影子 ， 杜允唐 的 定制 情人 。,人物一 所救  人物二  人物一 姐姐  残酷 训练 一步 一步 造成 青萍 影子  杜允唐 定制 情人,1
TRAIN_SENT_ID_257570,,毛泽民,毛泽东,"泽民 : 毛泽民 , 毛泽东 大 弟 , 1938 年 2 月 出任 新疆省 财政厅 、 民政厅 厅长 等 职 , 1943 年 9 月 27 日 与 陈潭秋 一起 被 杀害 。",泽民  人物一  人物二 弟   年  月 出任 新疆省 财政厅  民政厅 厅长 职   年  月  日 陈潭秋 一起 杀害,1
TRAIN_SENT_ID_276032,,华莲青,华罗庚,十年浩劫 一 结束 ， 这时 的 华莲青 不顾 年事已高 ， 又 一次 踏上 了 北上 的 列车 ， 从此 和 华罗庚 的 大儿子 华俊 东 夫妇 生活 在 一起 。,十年浩劫 结束  人物一 不顾 年事已高  一次 踏上 北上 列车  人物二 大儿子 华俊 东 夫妇 生活 一起,1
TRAIN_SENT_ID_270041,,楚寒镜,楚碧痕,楚寒镜 ： 长久 居于 月 之 幽境 的 梭罗树 仙 ， 和 妹妹 楚碧痕 出于 同一 精魂 。,人物一  长久 居于 月 幽境 梭罗树 仙  妹妹 人物二 同一 精魂,1
TRAIN_SENT_ID_250428,,赵飞燕,赵合德,赵飞燕 的 妹妹 赵合德 随后 也 进入 汉宫 ， 也 被 封为 昭仪 ， 两人 的 显贵 程度 超过 整个 后宫 。,人物一 妹妹 人物二 进入 汉宫  封为 昭仪  两人 显贵 程度 超过 整个 后宫,1
TRAIN_SENT_ID_270977,,李易霏,李昂融,姐姐 李易霏 ， 妹妹 李昂融 ， 她们 出 生于 山东半岛 ( 2003 年 6 月 11 日 ) ， 中国 国籍 ， 天性 快乐 。,姐姐 人物一  妹妹 人物二  出 生于 山东半岛   年  月  日   中国 国籍  天性 快乐,1
TRAIN_SENT_ID_261139,,武元庆,武则天,武则天 的 母亲 便 把 两个 儿子 武元庆 、 武元爽 领 出让 袁天罡 相面 ， 可是 袁天罡 一看 说 可以 官至 三品 ， 只不过 是 能 保家 的 主儿 ， 还 不算 大贵 。,人物二 母亲 便 两个 儿子 人物一  武元爽 领 出让 袁天罡 相面  袁天罡 一看 说 官至 三品  只不过 保家 主儿  不算 大贵,1
TRAIN_SENT_ID_256565,,周武,周文,周武 王十三 年 ， 周武 王姬 发伐纣克 商后 ， 封 周文 王之弟 虢叔于 颛顼 后裔 祝融 之墟 ， 历史 上 叫 东虢国 ( 今 河南 荥阳市 广武 一带 ) 。,人物一 王十三 年  人物一 王姬 发伐纣克 商后  封 人物二 王之弟 虢叔于 颛顼 后裔 祝融 之墟  历史 东虢国  河南 荥阳市 广武 一带,1
TRAIN_SENT_ID_257524,,毛泽民,毛泽东,同年 冬 ， 受 毛泽东 派遣 到 江西 安源 路矿 和 毛泽民 一起 从事 工人运动 ， 并 加入 中国共产党 。,同年 冬  受 人物二 派遣 江西 安源 路矿 人物一 一起 从事 工人运动  加入 中国共产党,1
TRAIN_SENT_ID_276223,,姜丽文,姜文杰,女儿 叫 姜丽文 ， 她 与 哥哥 姜文杰 在 2014 年 一起 参加 了 浙江 卫视 真人秀 节目 《 我 不是 明星 》 。,女儿 人物一  哥哥 人物二  年 一起 参加 浙江 卫视 真人秀 节目  明星,1
TRAIN_SENT_ID_270587,,全真七子,王重阳,全真七子 随 王重阳 一起 创立 道教 全真 派 。,人物一 人物二 一起 创立 道教 全真 派,1
TRAIN_SENT_ID_257461,,姜昆,马季,看好 方 : 从 解放初期 直至 上 世纪末 ， 经过 侯宝林 、 马季 、 姜昆 等 相声 演员 积极 改编 、 创新 传统 相声 题材 后 ， 中国 相声 艺术 进入 鼎盛 时代 。,看好 方  解放初期 直至 世纪末  侯宝林  人物二  人物一 相声 演员 积极 改编  创新 传统 相声 题材  中国 相声 艺术 进入 鼎盛 时代,1
TRAIN_SENT_ID_275896,,王子豪,王子杰,王子豪 演艺 经历 : 2011 年 ， 与 双胞胎 弟弟 王子杰 参加 香港 TVB 《 超级 巨声 3 》 进入 十强 ， 并 获得 “ 最佳 巨声 组合 奖 ” 。,人物一 演艺 经历   年  双胞胎 弟弟 人物二 参加 香港   超级 巨声   进入 十强  获得  最佳 巨声 组合 奖,1
TRAIN_SENT_ID_262214,,尤二姐,尤三姐,金陵 十二钗 副册 尤三姐 （ 情刚 ） : 尤三姐 ， 尤氏 继母 带来 的 女儿 ， 尤二姐 的 妹妹 。,金陵 十二钗 副册 人物二  情刚   人物二  尤氏 继母 带来 女儿  人物一 妹妹,1
TRAIN_SENT_ID_266873,,尤二姐,尤氏,4 尤三姐 : 尤三姐 ， 尤氏 继母 带来 的 女儿 ， 尤二姐 的 妹妹 。,尤三姐  尤三姐  人物二 继母 带来 女儿  人物一 妹妹,1
TRAIN_SENT_ID_262213,,尤二姐,尤三姐,尤三姐 : 尤三姐 ， 十二 副钗 之一 ， 尤氏 继母 带来 的 女儿 ， 尤二姐 的 妹妹 。,人物二  人物二  十二 副钗  尤氏 继母 带来 女儿  人物一 妹妹,1
TRAIN_SENT_ID_249293,,陆无双,程英,陆无双 要 陪 杨过 等 小龙女 ， 郭 芙 出言 讥讽 ， 程英 轻描淡写 为 她 全 挡回去 ； 她 说 她 也 跟 杨过 一起 等 。,人物一 陪 杨过 小龙女  郭 芙 出言 讥讽  人物二 轻描淡写 全 挡回去  说 杨过 一起,1
TRAIN_SENT_ID_264825,,陈永奎,陈永燊,彼为 陈瑞 球 先生 之 公子 ； 亦 为 陈永奎 先生 ， 陈永燊 先生 及 周陈淑玲 女士 之弟 。,彼为 陈瑞 球 先生 公子  人物一 先生  人物二 先生 周陈淑玲 女士 之弟,1
TRAIN_SENT_ID_282015,,殷野王,殷素素,殷素素 是 殷天正 的 女儿 ， 殷野王 的 妹妹 。,人物二 殷天正 女儿  人物一 妹妹,1
TRAIN_SENT_ID_257598,,毛泽民,毛泽东,《 革命 与 爱 毛泽东 毛泽民 兄弟 关系 》 是 2011 年 中国青年出版社 出版 的 图书 ， 作者 是 耘 山 ， 周燕 。,革命 爱 人物二 人物一 兄弟 关系   年 中国青年出版社 出版 图书  作者 耘 山  周燕,1
TRAIN_SENT_ID_262242,,尤二姐,尤三姐,金陵 十二 副钗 尤三姐 : 尤三姐 ， 十二 副钗 之一 ， 尤氏 继母 带来 的 女儿 ， 尤二姐 的 妹妹 。,金陵 十二 副钗 人物二  人物二  十二 副钗  尤氏 继母 带来 女儿  人物一 妹妹,1
TRAIN_SENT_ID_284783,,陈文镜,陈文贵,1927 年 八一 南昌起义 ， 叶挺 率部 参加 ， 陈文镜 跟着 哥哥 陈文贵 一起 在 部队 中 担任 军医 。,年 八一 南昌起义  叶挺 率部 参加  人物一 跟着 哥哥 人物二 一起 部队 中 担任 军医,1
TRAIN_SENT_ID_264937,,贾元春,贾宝玉,贾元春 ， 中国 古典小说 《 红楼梦 》 中 的 人物 ， 金陵 十二钗 之一 ， 贾政 与 王夫人 所生 的 长女 ， 贾宝玉 的 姐姐 ， 贾府 通称 娘娘 。,人物一  中国 古典小说  红楼梦  中 人物  金陵 十二钗  贾政 王夫人 所生 长女  人物二 姐姐  贾府 通称 娘娘,1
TRAIN_SENT_ID_267575,,吴魏,吴狄,吴狄 出身 平民 家庭 ， 在 一个 重组 家庭 里 长大 ， 十四岁 时 母亲 和 继父 遇 车祸 去世 ， 只有 继父 的 儿子 吴魏 勉强 可以 算作 一个 亲人 。,人物二 出身 平民 家庭  一个 重组 家庭 里 长大  十四岁 时 母亲 继父 遇 车祸 去世  继父 儿子 人物一 勉强 算作 一个 亲人,1
TRAIN_SENT_ID_269494,,李国豪,李香凝,李国豪 是 家里 的 长子 ， 家里 有 一位 妹妹 （ 李香凝 ） ， 在 家中 排行 老大 ， 其父 是 截拳道 宗师 李小龙 ， 其母 是 琳 达 · 埃 莫瑞 。,人物一 家里 长子  家里 一位 妹妹  人物二   家中 排行 老大  其父 截拳道 宗师 李小龙  其母 琳 达  埃 莫瑞,1
TRAIN_SENT_ID_270601,,全真七子,王重阳,全真七子 随 王重阳 一起 创立 道教 全真 派 ， 丘处机 在 王重阳 去世 后入 磻溪 穴居 ， 历时 六年 ， 行携 蓑笠 ， 人称 “ 蓑笠 先生 ” 。,人物一 人物二 一起 创立 道教 全真 派  丘处机 人物二 去世 后入 磻溪 穴居  历时 六年  行携 蓑笠  人称  蓑笠 先生,1
