sent_id,entity1,entity2,sent,processed_sent,human
TRAIN_SENT_ID_279264,徐佩瑶,徐天德,徐佩瑶 是 徐天德 的 妹妹 ， 美丽 、 善良 的 女孩 ， 和 朱重八 青梅竹马 ， 彼此 相爱 。,人物一 人物二 妹妹  美丽  善良 女孩  朱重八 青梅竹马  相爱,1
TRAIN_SENT_ID_252856,颜回,孔子,"孔子 回答 ： “ 我 有 叫 颜回 的 学生 爱好 学习 ， 他 从来 都 不 把 自己 的 怒气 转移 到 别人 的 身上 , 不 重复 犯 同样 的 过错 。",人物二 回答   人物一 学生 爱好 学习  从来 怒气 转移 身上  重复 犯 同样 过错,1
TRAIN_SENT_ID_250424,赵飞燕,赵合德,赵飞燕 听 了 妹妹 的 诉说 ， 也 感动 得 眼泪 直流 ， 将 自己 头上 的 紫玉九雏钗 取下 ， 簪 在 赵合德 的 发髻 上 。,人物一 听 妹妹 诉说  感动 眼泪 直流  头上 紫玉九雏钗 取下  簪 人物二 发髻,1
TRAIN_SENT_ID_272471,李家杰,李家诚,李博士 为 李达 民 先生 及 冯 李焕 琼 女士 之 胞兄 、 李佩雯 小姐 、 李家杰 先生 及 李家诚 先生 之 父亲 及 李宁 先生 之 岳父 。,李博士 李达 民 先生 冯 李焕 琼 女士 胞兄  李佩雯 小姐  人物一 先生 人物二 先生 父亲 李宁 先生 岳父,1
TRAIN_SENT_ID_252824,颜回,孔子,孔子 的 高足 颜回 、 子贡 ， 真正 有 出息 ， 不 枉费 老师 一番 心血 的 还是 子贡 。,人物二 高足 人物一  子贡  真正 出息  枉费 老师 一番 心血 子贡,1
TRAIN_SENT_ID_277418,尹夏沫,尹澄,尹夏沫 演艺 经历 : 与 尹澄 和 洛熙 参加 超级 巨星 ， 唱 《 黑猫 与 牛奶 》 彩虹 广场 上 唱 《 钻石 》,人物一 演艺 经历  人物二 洛熙 参加 超级 巨星  唱  黑猫 牛奶  彩虹 广场 唱  钻石,1
TRAIN_SENT_ID_258815,张无忌,殷离,1349 张无忌 遇 胡青牛 并学 医术 ， 初遇 周芷若 、 殷离 、 金花婆婆 。,人物一 遇 胡青牛 并学 医术  初遇 周芷若  人物二  金花婆婆,1
TRAIN_SENT_ID_264217,陈真,霍元甲,陈真 不但 身手 高超 ， 且 在 师父 霍元甲 突然 被 人 害死 后 ， 从 日本 回国 来 为 师父 申冤 ， 为 精 武馆 血耻 正名 。,人物一 身手 高超  师父 人物二 突然 害死  日本 回国 师父 申冤  精 武馆 血耻 正名,1
TRAIN_SENT_ID_262188,陈靖仇,陈辅,然后 主角 随 陈靖仇 一同 前往 伏魔山 救出 了 陈辅 后 除掉 凶兽 饕餮 ， 得到 了 第二把 兵器 。,主角 人物一 一同 前往 伏魔山 救出 人物二 除掉 凶兽 饕餮  得到 第二把 兵器,1
TRAIN_SENT_ID_250691,鲁西西,皮皮鲁,鲁西西 说 ， 如果 刚才 真是 你 皮皮鲁 唱 的 ， 我 肯定 要享 给 歌星 当 妹妹 的 福 了 。,人物一 说  刚才 真是 人物二 唱  肯定 要享 歌星 妹妹 福,1
TRAIN_SENT_ID_252681,颜回,孔子,孔子 对 曰 ： “ 有 颜回 者 好学 ， 不 迁怒 ， 不 贰 过 ， 不幸 短命 死 矣 。,人物二 曰   人物一 好学  迁怒  贰  不幸 短命 死,1
TRAIN_SENT_ID_252738,颜回,孔子,天资聪颖 的 颜回 ， 一生 清贫 ， 但 求学 之心 甚坚 ， 很受 孔子 喜爱 。,天资聪颖 人物一  一生 清贫  求学 之心 甚坚  很受 人物二 喜爱,1
TRAIN_SENT_ID_268979,韩非,荀子,此时 ， 秦国 日益 强大 ， 并 向 天下 招募 人才 ， 李斯 投奔 了 秦国 ， 韩非 回到 韩国 ， 陈嚣 则 随 荀子 回到 赵国 。,秦国 日益 强大  天下 招募 人才  李斯 投奔 秦国  人物一 回到 韩国  陈嚣 人物二 回到 赵国,1
TRAIN_SENT_ID_268929,韩非,荀子,韩非 发展 了 荀子 的 无神论 ， 在 否定 鬼神 存在 的 基础 上 ， 进一步 反对 “ 神道设教 ” 。,人物一 发展 人物二 无神论  否定 鬼神 存在 基础  进一步 反对  神道设教,1
TRAIN_SENT_ID_276146,贾惜春,贾珍,简介 ： 贾惜春 是 贾珍 的 妹妹 ， 排行 为 贾府 四 小姐 。,简介  人物一 人物二 妹妹  排行 贾府 四 小姐,1
TRAIN_SENT_ID_265476,薛谭,秦青,薛谭 学 讴于 秦青 ， 未穷 青之技 ， 自谓 尽 之 ； 遂 辞 归 。,人物一 学 讴于 人物二  未穷 青之技  自谓  遂 辞,1
TRAIN_SENT_ID_258135,刘星,夏雪,在 父亲 的 教育 下 ， 夏雪 、 刘星 、 夏雨 一起 认真 给 母亲 刘梅 洗 了 一回 脚 。,父亲 教育  人物二  人物一  夏雨 一起 认真 母亲 刘梅 洗 一回 脚,1
TRAIN_SENT_ID_270798,文媚儿,文韬,家人 ： 父亲 文章 ， 姐姐 文媚儿 ， 弟弟 文韬,家人  父亲 文章  姐姐 人物一  弟弟 人物二,1
TRAIN_SENT_ID_264872,田猛,田虎,蚩尤 堂堂 主 田虎 为 人 冲动 ， 一 见到 田猛 尸身 便 断定 是 出现 在 现场 又 急忙 逃走 的 盖聂 、 卫庄 所 为 ， 欲集 农家 上下 之力 杀死 二人 。,蚩尤 堂堂 主 人物二 冲动  见到 人物一 尸身 便 断定 出现 现场 急忙 逃走 盖聂  卫庄  欲集 农家 之力 杀死 二人,1
TRAIN_SENT_ID_261149,王缙,王维,2 成语 典故 : 【 出处 】 ： 《 新唐书 · 韦抗 传 》 ： “ 它 所辟举 ， 如 王维 、 王缙 、 崔殷 等 ， 皆 一时 选云 。 ”,成语 典故   出处    新唐书  韦抗 传    所辟举  人物二  人物一  崔殷  皆 一时 选云,1
TRAIN_SENT_ID_266705,龙幽,龙溟,龙溟 持 十字 妖槊图 枪 身上 有 浓重 煞气 ， 龙幽 幼时 曾 因 偷偷 把玩 而 被 煞气 所 伤 ， 并 因此 遭到 兄长 痛斥 。,人物二 持 十字 妖槊图 枪 身上 浓重 煞气  人物一 幼时 偷偷 把玩 煞气 伤  遭到 兄长 痛斥,1
TRAIN_SENT_ID_266867,尤二姐,尤氏,当 她 把 尤二姐 骗人 了 大观园 之后 ， 便 去 骂 尤氏 道 ： “ … …,人物一 骗人 大观园 之后  便 骂 人物二 道,1
TRAIN_SENT_ID_272012,文姜,宣姜,文姜 是 宣姜 的 妹妹 ， “ 文 ” 字 是 后世 史家 因 她 文采 命 的 名 。,人物一 人物二 妹妹   文  字 后世 史家 文采 命 名,1
TRAIN_SENT_ID_268989,韩非,荀子,椐 《 景宁 续志 》 考证 ： 浮丘伯 与 李斯 、 韩非 同学 于 荀子 。,椐  景宁 续志  考证  浮丘伯 李斯  人物一 同学 人物二,1
TRAIN_SENT_ID_268928,韩非,荀子,韩非 与 李斯 为 同学 ， 同 师事 于 荀子 。,人物一 李斯 同学  师事 人物二,1
TRAIN_SENT_ID_253065,颜回,孔子,颜回 敏而好学 ， 能 闻一知十 ， 注重 仁德 修养 ， 深得 孔子 欣赏 和 喜爱 。,人物一 敏而好学  闻一知十  注重 仁德 修养  深得 人物二 欣赏 喜爱,1
TRAIN_SENT_ID_265471,薛谭,秦青,列子 · 汤 问篇 第十一部分 : 列子 · 汤 问篇 原文 : 薛谭 学 讴于 秦青 ① ， 未穷 青之技 ， 自谓 尽 之 ， 遂 辞 归 。,列子  汤 问篇 第十一部分  列子  汤 问篇 原文  人物一 学 讴于 人物二 ①  未穷 青之技  自谓  遂 辞,1
TRAIN_SENT_ID_274086,南宫敬叔,孔子,南宫敬叔 和 孔子 一起 到 了 周国 。,人物一 人物二 一起 周国,1
TRAIN_SENT_ID_265404,薛谭,秦青,歌梁 详细 释义 : 歌梁 典源 : 《 列子 古注 今译 》 卷 五 〈 汤 问篇 〉 薛谭 学 讴于 秦青 ， 未穷 青之技 ， 自谓 尽 之 ； 遂 辞 归 。,歌梁 详细 释义  歌梁 典源   列子 古注 今译  卷 五  汤 问篇  人物一 学 讴于 人物二  未穷 青之技  自谓  遂 辞,1
TRAIN_SENT_ID_257452,姜昆,马季,面对 这位 “ 中国 新 相声 的 开路人 ” ， 马季 、 姜昆 、 冯巩 、 牛群 等 众多 相声 名家 无不 为之动容 。,面对 这位  中国 新 相声 开路人   人物二  人物一  冯巩  牛群 众多 相声 名家 无不 为之动容,1
TRAIN_SENT_ID_269356,王中军,王中磊,哥哥 王中军 是 游走 于 艺术 与 生活 之间 的 商业 大亨 ， 弟弟 王中磊 则 是 一个 温柔 懂得 品味 生活 的 顾家 男人 。,哥哥 人物一 游走 艺术 生活 之间 商业 大亨  弟弟 人物二 一个 温柔 懂得 品味 生活 顾家 男人,1
TRAIN_SENT_ID_264878,田猛,田虎,蚩尤 堂堂 主 田虎 为 人 冲动 ， 一 见到 兄长 田猛 的 尸身 便 断定 是 出现 在 现场 又 急忙 逃走 的 盖聂 、 卫庄 所 为 ， 欲集 农家 上下 之力 杀死 二人 。,蚩尤 堂堂 主 人物二 冲动  见到 兄长 人物一 尸身 便 断定 出现 现场 急忙 逃走 盖聂  卫庄  欲集 农家 之力 杀死 二人,1
TRAIN_SENT_ID_252989,颜回,孔子,颜回 谓 孔子 独立 人格 、 直行 道业云 ： “ 夫子 之道 至 大 ， 故 天下 莫 能容 。,人物一 谓 人物二 独立 人格  直行 道业云   夫子 之道  天下 莫 能容,1
TRAIN_SENT_ID_255443,罗成,秦琼,暗笔 里 却 有 秦琼 、 程咬金 、 罗成 游 洛阳 时 ， 前面 两位 的 妻子 都 留在 老家 ， 后面 一位 则 带 着 母亲 、 妻子 、 丫鬟 一大堆 出游 。,暗笔 里 人物二  程咬金  人物一 游 洛阳 时  前面 两位 妻子 留在 老家  后面 一位 带 母亲  妻子  丫鬟 一大堆 出游,1
TRAIN_SENT_ID_265412,薛谭,秦青,薛谭 学 讴于 秦青,人物一 学 讴于 人物二,1
TRAIN_SENT_ID_262260,尤二姐,尤三姐,尤二姐 和 尤三姐 是 宁府 尤氏 继母 的 女儿 ， 因 贾敬 暴死 ． 尤氏 料理 丧事 ， 不能 回家 。,人物一 人物二 宁府 尤氏 继母 女儿  贾敬 暴死 ． 尤氏 料理 丧事  不能 回家,1
TRAIN_SENT_ID_278135,裴元,孙思邈,后来 孙思邈 不怎么 医治 他人 ， 全心投入 在 了 编写 医书 上面 ， 裴元 则 负责 去 找 同行 的 医生 查问 资料 。,后来 人物二 不怎么 医治  全心投入 编写 医书 上面  人物一 负责 找 同行 医生 查问 资料,1
TRAIN_SENT_ID_274183,田虎,田猛,蚩尤 堂堂 主 田虎 为 人 冲动 ， 一 见到 兄长 田猛 的 尸身 便 断定 是 出现 在 现场 又 急忙 逃走 的 盖聂 、 卫庄 所 为 ， 欲集 农家 上下 之力 杀死 二人 。,蚩尤 堂堂 主 人物一 冲动  见到 兄长 人物二 尸身 便 断定 出现 现场 急忙 逃走 盖聂  卫庄  欲集 农家 之力 杀死 二人,1
TRAIN_SENT_ID_259667,公孙胜,罗真人,② 明 施耐庵 《 水浒 》 第五十三回 《 戴宗 二取 公孙胜 李逵 独劈 罗真人 》 童子 答道 ： “ 真人 坐在 云 床上 养性 。 ”,② 明 施耐庵  水浒  第五十三回  戴宗 二取 人物一 李逵 独劈 人物二  童子 答道   真人 坐在 云 床上 养性,1
TRAIN_SENT_ID_275831,陆无双,李莫愁,后来 程英 、 杨过 、 陆无双 遭遇 李莫愁 ， 黄药师 便 帮助 解围 。,后来 程英  杨过  人物一 遭遇 人物二  黄药师 便 帮助 解围,1
TRAIN_SENT_ID_275795,郑益龙,郑锦城,在 梁伟发 身后 是 一众 武警官兵 ， 其中 就 有 郑益龙 的 弟弟 郑锦城 。,梁伟发 身后 一众 武警官兵  人物一 弟弟 人物二,1
TRAIN_SENT_ID_251853,曹薰铉,李昌镐,李昌镐 现象 的 深思 （ 代序 ） 第一章 师 出名门 ― ― 师徒 大战 第一节 谢师礼 ― ― 第一个 冠军 第二节 冲击 曹薰铉 时代 … …,人物二 现象 深思  代序  第一章 师 出名门 ― ― 师徒 大战 第一节 谢师礼 ― ― 第一个 冠军 第二节 冲击 人物一 时代,1
TRAIN_SENT_ID_253863,赵合德,赵飞燕,从 野史 记载 的 ， 赵飞燕 赵合德 姐妹俩 争 燕赤凤 最后 三个 人 一起 玩 双飞 ， 我 的 推断 应该 没错 。,野史 记载  人物二 人物一 姐妹俩 争 燕赤凤 最后 三个 一起 玩 双飞  推断 应该 没错,1
TRAIN_SENT_ID_285891,班淑娴,白鹿子,班淑娴 和 何太冲 两人 的 师父 白鹿子 死 在 明教 人 的 手里 ， 真凶 是 谁 虽 不 确知 ， 但 昆仑 派众 同门 一向 都 猜想 就是 杨逍 。,人物一 何太冲 两人 师父 人物二 死 明教 手里  真凶 确知  昆仑 派众 同门 一向 猜想 杨逍,1
TRAIN_SENT_ID_254291,张顺,张横,后来 被 张顺 灵魂 附体 的 张横 杀死 。,后来 人物一 灵魂 附体 人物二 杀死,1
TRAIN_SENT_ID_250574,鲁西西,皮皮鲁,今天 ， 在 中国 大陆 ， 20 岁 上下 的 人 很少 有 不 知道 他 笔下 的 皮皮鲁 、 鲁西西 、 舒克和贝塔 的 。,今天  中国 大陆   岁 很少 知道 笔下 人物二  人物一  舒克和贝塔,1
TRAIN_SENT_ID_261956,何冲,何超,"对此 , 跳水 三米板 全国冠军 、 跳水 世界冠军 何冲 的 弟弟 何超 在 自己 的 微博上 评论 : “ 电子竞技 也 算 体育 ?",对此  跳水 三米板 全国冠军  跳水 世界冠军 人物一 弟弟 人物二 微博上 评论   电子竞技 算 体育,1
