sent_id,entity1,entity2,sent,processed_sent,human
TRAIN_SENT_ID_282703,冯审,冯宿,冯审 ， 冯宿 从弟 ， 东阳 人 。,人物一  人物二 从弟  东阳,1
TRAIN_SENT_ID_257444,姜昆,马季,那时 收音机 里 播放 的 都 是 马季 、 姜昆 、 侯耀文 的 相声 ， 什么 《 如此 照相 》 、 《 诗歌 与 爱情 》 、 《 下象棋 》 … …,收音机 里 播放 人物二  人物一  侯耀文 相声   照相    诗歌 爱情    下象棋,1
TRAIN_SENT_ID_271297,吕祖俭,吕祖谦,吕祖谦 去世 后 ， 弟 吕祖俭 承兄志 传道 讲学 。,人物二 去世  弟 人物一 承兄志 传道 讲学,1
TRAIN_SENT_ID_262219,尤二姐,尤三姐,统治者 二十几 人 （ 有人 算了 说 是 三十几 人 ） ， 其他 都 是 奴隶 ， 三百多个 ， 鸳鸯 、 司棋 、 尤二姐 、 尤三姐 等等 。,统治者 二十几  有人 算了 说 三十几   奴隶  三百多个  鸳鸯  司棋  人物一  人物二,1
TRAIN_SENT_ID_259673,公孙胜,罗真人,《 水浒传 》 第五 三回 ： “ 罗真人 问 公孙胜 道 ： ‘ 此 二位 何来 ？,水浒传  第五 三回   人物二 问 人物一 道   二位 何来,1
TRAIN_SENT_ID_259637,公孙胜,罗真人,第五十三回 戴宗 二取 公孙胜 李逵 斧劈 罗真人,第五十三回 戴宗 二取 人物一 李逵 斧劈 人物二,1
TRAIN_SENT_ID_275987,朱竹云,朱竹清,嫂子 ： 朱竹云 （ 朱竹清 的 姐姐 ）,嫂子  人物一  人物二 姐姐,1
TRAIN_SENT_ID_257226,张子静,张爱玲,《 我 的 姐姐 张爱玲 》 是 由 张子静 编写 ， 吉林 出版 集团 有限责任 公司 出版 的 一本 书籍 。,姐姐 人物二  人物一 编写  吉林 出版 集团 有限责任 公司 出版 一本 书籍,1
TRAIN_SENT_ID_274073,南宫敬叔,孔子,孔子 谓 南宫敬叔 ① 曰 ： “ 吾 闻 老 聃 博古 知今 ， 通 礼乐 之原 ， 明 道德 之归 ， 则 吾师 也 ， 今 将 往 矣 。 ”,人物二 谓 人物一 ① 曰   吾 闻 老 聃 博古 知今  通 礼乐 之原  明 道德 之归  吾师,1
TRAIN_SENT_ID_263014,龙俊杰,王学明,指导 教师 ： 龙俊杰 、 何雁 、 王学明 等 。,指导 教师  人物一  何雁  人物二,1
TRAIN_SENT_ID_259646,公孙胜,罗真人,483 第五十三回 戴宗 智取 公孙胜 李逵 斧劈 罗真人,第五十三回 戴宗 智取 人物一 李逵 斧劈 人物二,1
TRAIN_SENT_ID_279129,范长利,朱绍文,沈竹善 相声 辈分 表 : 沈竹善 第一代 - - 第三代 : 张三禄 - - 朱绍文 - - 春长隆 、 冯昆治 、 范长利 、 桂祯 、 徐长福 、 沈竹善,沈竹善 相声 辈分 表  沈竹善 第一代   第三代  张三禄   人物二   春长隆  冯昆治  人物一  桂祯  徐长福  沈竹善,1
TRAIN_SENT_ID_250110,武敦儒,武修文,大武 是 指 武敦儒 ， 小武 是 指 武修文 。,大武 指 人物一  小武 指 人物二,1
TRAIN_SENT_ID_252515,颜回,孔子,孔子 最 欣赏 颜回 的 地方 ， 就是 “ 不 迁怒 ” 与 “ 不 贰 过 ” 。,人物二 欣赏 人物一 地方   迁怒   贰,1
TRAIN_SENT_ID_262278,尤二姐,尤三姐,红楼 二 尤即 指 尤二姐 和 尤三姐 两个 人 。,红楼 二 尤即 指 人物一 人物二 两个,1
TRAIN_SENT_ID_253856,赵合德,赵飞燕,刘骜 不愿 去 招惹 赵飞燕 ， 便 向 赵合德 打听 原因 。,刘骜 不愿 招惹 人物二  便 人物一 打听 原因,1
TRAIN_SENT_ID_249013,吕洞宾,韩湘子,仙人 韩湘子 、 吕洞宾 分别 化 变成 和尚 、 道士 ， 私下 凡尘 ， 肆意 戏弄 牡丹 ， 看其 是否 诚心 修炼 ， 谁知 讨个 没趣,仙人 人物二  人物一 化 变成 和尚  道士  私下 凡尘  肆意 戏弄 牡丹  看其 是否 诚心 修炼  讨个 没趣,1
TRAIN_SENT_ID_258128,刘星,夏雪,夏雪 在 体育课 上 扭伤 了 脚 ， 刘星 不 愿意 道歉 。,人物二 体育课 扭伤 脚  人物一 愿意 道歉,1
TRAIN_SENT_ID_277808,乌丫,丁铛,然而 ， 丁铛 的 械 力 、 乌丫 的 医道 、 寒信 的 智慧 以及 小镖 的 顽强 — — 坚信 胜利 的 心 与 心 之间 产生 的 羁绊 ， 将会 唤醒 奇迹 ！,人物二 械 力  人物一 医道  寒信 智慧 小镖 顽强   坚信 胜利 心 心 之间 产生 羁绊  将会 唤醒 奇迹,1
TRAIN_SENT_ID_284596,郑辑之,郑伯猷,郑辑之 ， 郑伯猷 弟 ， 荥阳 开封人 ， 解褐奉 朝 请 ， 领 侍御史 ， 以 军功 赐爵 城皋 男 。,人物一  人物二 弟  荥阳 开封人  解褐奉 请  领 侍御史  军功 赐爵 城皋 男,1
TRAIN_SENT_ID_252582,颜回,孔子,颜回 攫 甑 释意 : 孔子 在 陈国和 蔡国 之间 的 地方 （ 缺粮 ） 受困 ， 饭菜 全无 ， 七天 没 吃 上 米饭 了 。,人物一 攫 甑 释意  人物二 陈国和 蔡国 之间 地方  缺粮  受困  饭菜 全无  七天 没 吃 米饭,1
TRAIN_SENT_ID_273637,姜子牙,元始天尊,正一道 人死 后 ， 奉 元始天尊 命 代理 封神 ， 便 投生 转世 为 姜子牙 ， 辅助 周室 消灭 商纣 。,正一道 人死  奉 人物二 命 代理 封神  便 投生 转世 人物一  辅助 周室 消灭 商纣,1
TRAIN_SENT_ID_282999,卢宗道,卢怀道,卢宗道 ， 卢怀道 之弟 ， 范阳 涿人 也 。,人物一  人物二 之弟  范阳 涿人,1
TRAIN_SENT_ID_257791,林平之,岳不群,毕竟 就算 岳不群 真的 刺伤 过 林平之 ， 又 总 不会 故意 让 他 知道 来害 女儿 。,毕竟 人物二 真的 刺伤 人物一  总 不会 故意 知道 来害 女儿,1
TRAIN_SENT_ID_271259,马季,侯宝林,也 就是 那个 时候 初步 知道 了 侯宝林 、 马季 、 姜昆 等等 相声 演员 。,初步 知道 人物二  人物一  姜昆 相声 演员,1
TRAIN_SENT_ID_273666,姜子牙,元始天尊,整个 故事 从 元始天尊 让 姜子牙 带 封神榜 下山 救世 开始 ， 并 随着 山上 的 各路 仙魔道 妖 的 各种 选择 ， 最终 展开 了 一场 震天撼地 的 神魔 大战 。,整个 故事 人物二 人物一 带 封神榜 下山 救世  山上 各路 仙魔道 妖 选择  最终 展开 一场 震天撼地 神魔 大战,1
TRAIN_SENT_ID_249106,吕洞宾,韩湘子,据悉 ， 韩湘子 后来 又 从师 吕洞宾 ， 修道 成仙 ， 位列 仙班 。,据悉  人物二 后来 从师 人物一  修道 成仙  位列 仙班,1
TRAIN_SENT_ID_252814,颜回,孔子,孔子 不 听 ， 让 颜回 驾车 ， 子贡 作 骖 乘 ， 前去 会见 盗 跖 。,人物二 听  人物一 驾车  子贡 作 骖  前去 会见 盗 跖,1
TRAIN_SENT_ID_250583,鲁西西,皮皮鲁,郑渊洁 的 作品 创造 了 皮皮鲁 、 鲁西西 、 罗克 、 舒克和贝塔 这些 脍炙人口 、 家喻户晓 的 童话 人物 ， 影响 了 整整 一代人 。,郑渊洁 作品 创造 人物二  人物一  罗克  舒克和贝塔 脍炙人口  家喻户晓 童话 人物  影响 整整 一代人,1
TRAIN_SENT_ID_257801,林平之,岳不群,贪图 辟邪 剑法 的 伪君子 岳不群 在 福州 阴错阳差 地 得到 了 《 辟邪 剑谱 》 ， 便 欲 杀害 林平之 灭口 。,贪图 辟邪 剑法 伪君子 人物二 福州 阴错阳差 得到  辟邪 剑谱   便 欲 杀害 人物一 灭口,1
TRAIN_SENT_ID_248983,吕洞宾,韩湘子,2 文物 介绍 : 暗 八仙 即用 韩湘子 的 花 、 汉 钟离 的 扇 、 蓝采和 的 箫 、 吕洞宾 的 剑 等 器物 来 代表 八位 神仙 的 形像 。,文物 介绍  暗 八仙 即用 人物二 花  汉 钟离 扇  蓝采和 箫  人物一 剑 器物 代表 八位 神仙 形像,1
TRAIN_SENT_ID_252816,颜回,孔子,④ 《 庄子 》 ： 孔子 见 老 聃 ， 出 ， 语 颜回 曰 ： “ 丘之道 ， 其 犹 醯 鸡乎 ？ ”,④  庄子   人物二 见 老 聃  出  语 人物一 曰   丘之道  犹 醯 鸡乎,1
TRAIN_SENT_ID_262263,尤二姐,尤三姐,金陵 十二 副钗 另 一 说 : 金陵 十二钗 副册 为 ： 香菱 、 薛宝琴 、 尤二姐 、 尤三姐 、 邢岫烟 、 李纹 、 李绮 、 夏金桂 、 秋桐 、 平儿 、 龄 官 、 娇杏 ；,金陵 十二 副钗 说  金陵 十二钗 副册  香菱  薛宝琴  人物一  人物二  邢岫烟  李纹  李绮  夏金桂  秋桐  平儿  龄 官  娇杏,1
TRAIN_SENT_ID_249538,李蔡,李广,李贤 ： 汉兴 ， 义渠 公孙贺 、 傅介子 ， 成纪 李广 、 李蔡 ， 上 邽 赵充国 ， 狄道 辛武贤 ， 皆 名将 也 。,李贤  汉兴  义渠 公孙贺  傅介子  成纪 人物二  人物一  邽 赵充国  狄道 辛武贤  皆 名将,1
TRAIN_SENT_ID_270157,宋师道,宋玉致,家庭 ： 长女 宋玉华 、 次子 宋师道 、 三女 宋玉致 、 二弟 “ 地剑 ” 宋智 、 三弟 “ 银龙 ” 宋鲁 、 长婿 解 文龙 、 次婿 “ 少帅 ” 寇仲,家庭  长女 宋玉华  次子 人物一  三女 人物二  二弟  地剑  宋智  三弟  银龙  宋鲁  长婿 解 文龙  次婿  少帅  寇仲,1
TRAIN_SENT_ID_275811,俞明颐,俞明诗,有 三子 一女 ， 长子 俞明震 ， 次子 俞明 观 ， 三子 俞明颐 ， 长女 俞明诗 。,三子 一女  长子 俞明震  次子 俞明 观  三子 人物一  长女 人物二,1
TRAIN_SENT_ID_249558,李蔡,李广,李蔡 是 李广 堂弟 。,人物一 人物二 堂弟,1
TRAIN_SENT_ID_279221,吕馨,吕禄,她 以 可怜 地 表情 对 吕雉 说 她 还 不想 死 ， 此时 吕馨 的 表哥 吕禄 来 了 。,可怜 表情 吕雉 说 不想 死  人物一 表哥 人物二,1
TRAIN_SENT_ID_257428,姜昆,马季,马季 、 姜昆 、 唐杰忠 、 李金斗 、 常贵田 、 笑林 等 相声 名家 均 将 登台 亮相 ， 评书 名家 单田芳 也 加盟 演出 。,人物二  人物一  唐杰忠  李金斗  常贵田  笑林 相声 名家 均 登台 亮相  评书 名家 单田芳 加盟 演出,1
TRAIN_SENT_ID_286258,康昕,王羲之,南朝 王僧虔 的 《 论书 》 中 就 指出 王羲之 书法 曾 有 同时 人 张翼 的 仿书 ， 和 其后 康昕 、 南州石 道人 的 作伪 。,南朝 王僧虔  论书  中 指出 人物二 书法 张翼 仿书  其后 人物一  南州石 道人 作伪,1
TRAIN_SENT_ID_257484,姜昆,马季,《 爆笑 哈哈镜 》 藏有 马季 、 姜昆 、 冯巩 的 精品 相声 作品 。,爆笑 哈哈镜  藏有 人物二  人物一  冯巩 精品 相声 作品,1
TRAIN_SENT_ID_279135,范长利,朱绍文,相声 谱系 第一代 — — 第二代 : 朱绍文 - - 春长隆 、 冯昆治 、 范长利 、 桂祯 、 徐长福 、 沈竹善,相声 谱系 第一代   第二代  人物二   春长隆  冯昆治  人物一  桂祯  徐长福  沈竹善,1
TRAIN_SENT_ID_259358,葛玄,左慈,可见 ， 左慈 、 葛玄 、 郑隐 、 葛洪 、 葛巢甫 等 人 ， 并非 「 共同 尊尚 特定 的 道典 」 。,人物二  人物一  郑隐  葛洪  葛巢甫   共同 尊尚 特定 道典,1
TRAIN_SENT_ID_250355,赵飞燕,赵合德,在 这样 的 理论指导 下 ， 他 长期 与 外戚 集团 王氏 对立 ， 也 曾 进言 阻止 赵飞燕 、 赵合德 姐妹 晋封 。,理论指导  长期 外戚 集团 王氏 对立  进言 阻止 人物一  人物二 姐妹 晋封,1
TRAIN_SENT_ID_249075,吕洞宾,韩湘子,早先 ， 道士 在 庙会 期间 弹唱 竹琴 《 韩湘子 》 、 《 吕洞宾 成仙 》 ， 是 为了 宣传 道教 教义 。,早先  道士 庙会 期间 弹唱 竹琴  人物二    人物一 成仙   宣传 道教 教义,1
TRAIN_SENT_ID_252951,颜回,孔子,论语 · 子路 对待 老师 方面 : 子路 一方面 忠贞不二 ， 极其 尊重 ， 但 另一方面 又 不 像 颜回 那样 于 孔子 之 言 “ 无 所 不悦 ” ， 总取 “ 不违 ” 态度 。,论语  子路 老师 方面  子路 忠贞不二  极其 尊重  人物一 人物二 言  不悦   总取  不违  态度,1
TRAIN_SENT_ID_272655,邢德全,邢夫人,【 邢德全 】 邢夫人 的 胞弟 ， 只知 吃喝嫖赌 ， 不务正业 ， 呆气 十,人物一  人物二 胞弟  只知 吃喝嫖赌  不务正业  呆气 十,1
TRAIN_SENT_ID_270801,伍天锡,伍云召,6 伍天锡 伍云召 族弟,人物一 人物二 族弟,1
TRAIN_SENT_ID_257466,姜昆,马季,相声 ： 赵炎 、 马季 （ 已故 ） 、 李文华 （ 已故 ） 、 姜昆 、 侯耀文 （ 已故 ） 、 石富宽 、 侯宝林 （ 已故 ） 、 郭全宝 （ 已故 ） 。,相声  赵炎  人物二  已故   李文华  已故   人物一  侯耀文  已故   石富宽  侯宝林  已故   郭全宝  已故,1
TRAIN_SENT_ID_252505,颜回,孔子,看着 这些 钱袋 ， 孔子 想起 刚才 称赞 颜回 ， 批评 子贡 的话 ， 感到 脸上 火辣辣 的 。,看着 钱袋  人物二 想起 刚才 称赞 人物一  批评 子贡  感到 脸上 火辣辣,1
TRAIN_SENT_ID_251538,陈辅,陈靖仇,陈靖仇 的 师伯 ， 陈辅 的 师兄 ， 鬼谷 道术 造诣 极高 。,人物二 师伯  人物一 师兄  鬼谷 道术 造诣 极高,1
TRAIN_SENT_ID_250105,武敦儒,武修文,话说回来 ， 武敦儒 、 武修文 虽然 不是 什么 大 英雄 ， 但 无愧于 对 国家 对 人民 有用 之材 的 称号 。,话说回来  人物一  人物二 英雄  无愧于 国家 人民 有用 之材 称号,1
TRAIN_SENT_ID_277930,薛真度,薛安都,薛真度 ， 薛安都 从祖弟 ， 河东 汾阴人 也 。,人物一  人物二 从祖弟  河东 汾阴人,1
TRAIN_SENT_ID_259946,周志文,周志康,汪明荃 、 郑嘉颖 、 周志文 、 周志康 、 廖碧儿 、 汤盈盈,汪明荃  郑嘉颖  人物一  人物二  廖碧儿  汤盈盈,1
TRAIN_SENT_ID_251931,张豪龙,张柏芝,据说 张豪龙 的 正职 是 打理 服装店 ， 拍戏 多少 是 导演 想 借借 他 和 张柏芝 的 名声 来 多拉 几个 影迷 。,据说 人物一 正职 打理 服装店  拍戏 导演 想 借借 人物二 名声 多拉 几个 影迷,1
TRAIN_SENT_ID_261604,宋小宝,赵本山,2014 - 02 - 27 ： 老兵 （ 66 集 ） 「 赵本山 ， 宋小宝 ， 小 沈阳 ， 李立群 」,老兵   集   人物二  人物一  沈阳  李立群,1
TRAIN_SENT_ID_277821,傅清,傅恒,傅清 ， 富察氏 ， 满洲 镶黄旗 人 ， 李荣保 次子 ， 傅恒 弟 也 。,人物一  富察氏  满洲 镶黄旗  李荣保 次子  人物二 弟,1
TRAIN_SENT_ID_252755,颜回,孔子,昔 孔子 叹 颜回 ， 以为 三月 不违 仁者 ， 盖观 其 心耳 。,昔 人物二 叹 人物一  三月 不违 仁者  盖观 心耳,1
TRAIN_SENT_ID_283978,柳云飞,柳云龙,柳 大山 带 着 三个 他 收养 来 的 孤儿 柳云龙 （ 焦恩俊 饰 ） 、 柳云飞 和 柳 如 月 一直 是 靠 卖艺 为生 ， 后 因 生计 艰难 ， 便 回老家 去 了 。,柳 大山 带 三个 收养 孤儿 人物二  焦恩俊 饰   人物一 柳 月 一直 卖艺 为生  生计 艰难  便 回老家,1
TRAIN_SENT_ID_251588,穆春,穆弘,小 遮拦 穆春 （ 揭阳 镇 一霸 ， 穆弘 之弟 ）,遮拦 人物一  揭阳 镇 一霸  人物二 之弟,1
TRAIN_SENT_ID_260735,薛丁山,薛金莲,根据 民间传说 描述 ： 薛丁山 与 胞妹 薛金莲 为 双胞胎 ， 为 薛仁贵 元配 柳 金花 亲生 。,民间传说 描述  人物一 胞妹 人物二 双胞胎  薛仁贵 元配 柳 金花 亲生,1
TRAIN_SENT_ID_269397,刘伟,马季,老少 乐 相声 《 老少 乐 》 : 表演 ： 马季 、 刘伟,老少 乐 相声  老少 乐   表演  人物二  人物一,1
TRAIN_SENT_ID_259657,公孙胜,罗真人,第五十三回 戴宗 智取 公孙胜 李逵 斧劈 罗真人,第五十三回 戴宗 智取 人物一 李逵 斧劈 人物二,1
TRAIN_SENT_ID_265484,薛蝌,薛蟠,冷子兴 当 了 官 ， 和 薛蟠 、 薛蝌 、 邢岫烟 外出 做生意 ， 又 参与 贩卖 官盐 （ 邢岫烟 并不知道 情况 ， 只是 跟 从 ） 。,冷子兴 官  人物二  人物一  邢岫烟 外出 做生意  参与 贩卖 官盐  邢岫烟 并不知道 情况,1
TRAIN_SENT_ID_252628,颜回,孔子,孔子 出 ， 以告 颜回 曰 ： “ 丘之于 道 也 ， 其 犹 醯 鸡 与 ( 27 ) ！,人物二 出  以告 人物一 曰   丘之于 道  犹 醯 鸡,1
TRAIN_SENT_ID_261567,南宫敬叔,孟懿子,孔子 私学 的 学生 主要 是 由 平民 所 组成 的 ﹐ 据近 人 考证 ﹐ 孔子 学生 真正 来自 贵族 的 ﹐ 只有 南宫敬叔 ﹑ 司马 牛 和 孟懿子 等 少数几 人 。,孔子 私学 学生 主要 平民 组成 ﹐ 据近 考证 ﹐ 孔子 学生 真正 贵族 ﹐ 人物一  司马 牛 人物二 少数几,1
TRAIN_SENT_ID_254288,张顺,张横,李俊 等 都 笑 起来 ， 张横 又 道 ： “ 如今 我 弟兄 两个 都 改了业 ； 我 便 只 在 这 浔 阳江 里 做 私商 ； 兄弟 张顺 ， 他 却 如今 自 在 江州 做 卖 鱼 牙子 。,李俊 笑 起来  人物二 道   如今 弟兄 两个 改了业  便 浔 阳江 里 做 私商  兄弟 人物一  如今 江州 做 卖 鱼 牙子,1
TRAIN_SENT_ID_254266,张顺,张横,张顺 . （ 渔家 ， 张横 之弟 ） 三十六 天罡 星天败星 : 天败星 …,人物一   渔家  人物二 之弟  三十六 天罡 星天败星  天败星,1
TRAIN_SENT_ID_267532,扈成,扈三娘,小说 作者 将 扈成 与 “ 一丈 青 ” 扯 上 了 关系 ， 因此 才 有 了 “ 扈三娘 ” 的 名字 。,小说 作者 人物一  一丈 青  扯 关系   人物二  名字,1
TRAIN_SENT_ID_274448,方如沁,方兰生,百里屠苏 、 方兰生 、 欧阳少恭 、 陵越 、 红玉 、 方如沁 、 孙月言 ： 晴雪,百里屠苏  人物二  欧阳少恭  陵越  红玉  人物一  孙月言  晴雪,1
TRAIN_SENT_ID_257445,姜昆,马季,相声 ： 赵炎 、 马季 （ 已故 ） 、 李文华 （ 已故 ） 、 姜昆 、 侯耀文 （ 已故 ） 、 石富宽 、 侯宝林 （ 已故 · 录像 ） 、 郭全宝 （ 已故 · 录像 ） 。,相声  赵炎  人物二  已故   李文华  已故   人物一  侯耀文  已故   石富宽  侯宝林  已故  录像   郭全宝  已故  录像,1
TRAIN_SENT_ID_249299,陆无双,程英,谁知 ， 程英 听 了 这话 虽然 不禁 有些 生气 ， 但 挂念 杨过 ， “ 无意 争 这些 闲气 ” ， 只 示意 陆无双 ： 还是 去 找 杨过 吧 。,人物二 听 这话 不禁 生气  挂念 杨过   无意 争 闲气   示意 人物一  找 杨过,1
TRAIN_SENT_ID_252478,颜回,孔子,屡空 作品 赏析 : 这 一章 ， 孔子 对 颜回 学问 道德 接近 于 完善 却 在生活上 常常 贫困 深感 遗憾 。,屡空 作品 赏析  一章  人物二 人物一 学问 道德 接近 完善 在生活上 常常 贫困 深感 遗憾,1
