sent_id,entity1,entity2,sent,processed_sent,human
TRAIN_SENT_ID_274093,南宫敬叔,孔子,排遣 一辆 二 马拉 的 马车 ， 一个 书童 ， 一个 车夫 ， 由 南宫敬叔 陪 孔子 前往 东周 。,排遣 一辆 二 马拉 马车  一个 书童  一个 车夫  人物一 陪 人物二 前往 东周,1
TRAIN_SENT_ID_250655,鲁西西,皮皮鲁,为 上海 美术电影 厂 、 中央电视台 设计 动画片 《 老鼠 嫁女 》 ， 《 金元国 历险记 》 ， 《 皮皮鲁 和 鲁西西 》 的 人物造型 。,上海 美术电影 厂  中央电视台 设计 动画片  老鼠 嫁女    金元国 历险记    人物二 人物一  人物造型,1
TRAIN_SENT_ID_249187,皮皮鲁,鲁西西,第 237 集 伊丽莎白 在 稿件 上 签字 ； 鲁西西 叫醒 皮皮鲁 ； 歌唱家 喊 贝塔 万岁 ； 舒克 骂 贝塔 贝塔 不 生气,集 伊丽莎白 稿件 签字  人物二 叫醒 人物一  歌唱家 喊 贝塔 万岁  舒克 骂 贝塔 贝塔 生气,1
TRAIN_SENT_ID_251847,梅超风,黄药师,武眠风 出处 : （ 出自 《 射雕 英雄传 》 第 14 回 桃花 岛主 ， 黄药师 吩咐 梅超风 做 3 件 事 的 第 2 项 ） 。,武眠风 出处   出自  射雕 英雄传   回 桃花 岛主  人物二 吩咐 人物一 做  件 事  项,1
TRAIN_SENT_ID_267578,吴魏,吴狄,吴狄 在 夜店 偶遇 的 一个 女人 给 他 留下 了 深刻 的 印象 ， 后来 得知 这个 女人 竟是 吴魏 的 前女友 伍媚 （ 莫小棋 饰演 ） 。,人物二 夜店 偶遇 一个 女人 留下 深刻 印象  后来 得知 女人 竟是 人物一 前女友 伍媚  莫小棋 饰演,1
TRAIN_SENT_ID_279326,陈玄风,黄药师,陈玄风 、 梅超风 互生 爱慕 ， 恐 黄药师 性格 怪癖 不予 应允 ， 决定 窃取 了 师父 的 《 九阴真经 》 下卷 。,人物一  梅超风 互生 爱慕  恐 人物二 性格 怪癖 不予 应允  决定 窃取 师父  九阴真经  下卷,1
TRAIN_SENT_ID_257577,毛泽民,毛泽东,毛泽东 三 兄弟 内容 : 红色 政府 的 “ 大管家 ” 毛泽民 ； 骁勇 机智 、 临危 显 大义 的 毛泽覃 。,人物二 三 兄弟 内容  红色 政府  大管家  人物一  骁勇 机智  临危 显 大义 毛泽覃,1
TRAIN_SENT_ID_262237,尤二姐,尤三姐,第六十五回 贾二舍 偷 娶 尤二姐 / 尤三姐 思嫁 柳 二郎,第六十五回 贾二舍 偷 娶 人物一  人物二 思嫁 柳 二郎,1
TRAIN_SENT_ID_249272,皮皮鲁,鲁西西,皮皮鲁 和红 沙发 音乐 城 内容梗概 : 鲁西西 用 听诊器 听到 家里 的 沙发 里 传出 了 音乐声 ， 音乐 非常 好听 。,人物一 和红 沙发 音乐 城 内容梗概  人物二 听诊器 听到 家里 沙发 里 传出 音乐声  音乐 非常 好听,1
TRAIN_SENT_ID_254301,张顺,张横,水煮 水浒 : 张横 是 梁山泊 的 水军 头目 ， 远 没有 他 兄弟 张顺 出名 。,水煮 水浒  人物二 梁山泊 水军 头目  远 没有 兄弟 人物一 出名,1
TRAIN_SENT_ID_253096,颜回,孔子,《 庄子 》 杂篇 · 卷九下 《 让 王 》 孔子 谓 颜回 曰 ： “ 回 ， 来 ！,庄子  杂篇  卷九下  王  人物二 谓 人物一 曰   回,1
TRAIN_SENT_ID_276991,樊迟,孔子,孔子 的 仁学 思想 最 基本 、 最 核心 的 宗旨 就是 “ 爱人 ” （ 《 论语 · 颜渊 》 ） ： “ 樊迟 问仁 ， 孔 曰 ： 爱人 。 ”,人物二 仁学 思想 基本  核心 宗旨  爱人    论语  颜渊     人物一 问仁  孔 曰  爱人,1
TRAIN_SENT_ID_252874,颜回,孔子,﹝ 孔子 ﹞ 召 颜回 曰 : ' 畴昔 予 梦见 先人 ﹐ 岂 或 启佑 我 哉 !,﹝ 人物二 ﹞ 召 人物一 曰   畴昔 予 梦见 先人 ﹐ 岂 启佑,1
TRAIN_SENT_ID_252761,颜回,孔子,曲谱 为 清末 民初 琴家 彭祉卿 得 其父 所传 的 乐曲 ， 原曲 好像 是 孔子 想念 颜回 所 做 ， 经 后人 多次 修改 转变成 对 亲友 的 思念 。,曲谱 清末 民初 琴家 彭祉卿 其父 所传 乐曲  原曲 好像 人物二 想念 人物一 做  后人 多次 修改 转变成 亲友 思念,1
TRAIN_SENT_ID_269007,韩非,荀子,在 稷下 学宫 “ 三为 祭酒 ” 、 深受 齐 文化 熏陶 的 荀子 ， 还 培养 出 韩非 和 李斯 两位 法家 代表 人物 。,稷下 学宫  三为 祭酒   深受 齐 文化 熏陶 人物二  培养 出 人物一 李斯 两位 法家 代表 人物,1
TRAIN_SENT_ID_271521,孟优,孟获,孟获 又 被 生擒活捉 ， 其弟 孟优 及众 首领 也 做 了 蜀 军 俘虏 。,人物二 生擒活捉  其弟 人物一 及众 首领 做 蜀 军 俘虏,1
TRAIN_SENT_ID_263378,武修文,武敦儒,儿子 ： 武敦儒 、 武修文,儿子  人物二  人物一,1
TRAIN_SENT_ID_277642,方天翼,顾婷,在 俞梅 牺牲 的 第二天 ， 方天翼 单枪匹马 闯进 南京城 ， 以 搏命 的 方式 杀 了 松下 健 ， 报 了 杀 妻之仇 ， 并 与 顾婷 加入 共产党 。,俞梅 牺牲 第二天  人物一 单枪匹马 闯进 南京城  搏命 方式 杀 松下 健  报 杀 妻之仇  人物二 加入 共产党,1
TRAIN_SENT_ID_253023,颜回,孔子,孔子 谓 颜回 曰 ： “ 回 ， 来 ！,人物二 谓 人物一 曰   回,1
TRAIN_SENT_ID_261140,武元庆,武则天,武则天 武元庆 儿子 : 武三思,人物二 人物一 儿子  武三思,1
TRAIN_SENT_ID_262274,尤二姐,尤三姐,金陵 十二钗 副册 ： 香菱 、 薛宝琴 、 尤二姐 、 尤三姐 、 邢岫烟 、 李纹 、 李绮 、 夏金桂 、 秋桐 、 小红 、 龄 官 、 娇杏 ；,金陵 十二钗 副册  香菱  薛宝琴  人物一  人物二  邢岫烟  李纹  李绮  夏金桂  秋桐  小红  龄 官  娇杏,1
TRAIN_SENT_ID_257037,洪敬尧,洪荣宏,其中 与 前妻 生 的 三个 儿子 洪荣宏 、 洪敬尧 以及 洪荣 良 ， 皆 从事 音乐 以及 演艺 相关 工作 。,前妻 生 三个 儿子 人物二  人物一 洪荣 良  皆 从事 音乐 演艺 相关 工作,1
TRAIN_SENT_ID_266045,张学思,张学良,至此 ， 周恩来 和 张学铭 、 张学思 的 信 ， 才 辗转 送到 张学良 的 手里 。,至此  周恩来 张学铭  人物一 信  辗转 送到 人物二 手里,1
TRAIN_SENT_ID_252377,颜回,孔子,孔子 谓 颜回 曰 ( 28 ) ： “ 回 ， 来 ！,人物二 谓 人物一 曰      回,1
TRAIN_SENT_ID_249052,吕洞宾,韩湘子,吕洞宾 为 给 人们 造福 ， 和 韩湘子 合议 作法 ， 在 石狗 的 耳朵 里 ， 一个 滴进 了 水 ， 一个 吹进 了 风 。,人物一 造福  人物二 合议 作法  石狗 耳朵 里  一个 滴进 水  一个 吹进 风,1
TRAIN_SENT_ID_257813,林平之,岳不群,令狐冲 遭到 岳不群 冷落 的 另 一个 原因 是 林平之 和 《 辟邪 剑谱 》 。,令狐冲 遭到 人物二 冷落 一个 原因 人物一  辟邪 剑谱,1
TRAIN_SENT_ID_252697,颜回,孔子,"他 一身 静气 、 湛然 似 水 , 不动 如山 、 从容 自 在 , 他 是 孔子 最 得意 的 门生 - 颜回 。",一身 静气  湛然 似 水  不动 如山  从容  人物二 得意 门生  人物一,1
TRAIN_SENT_ID_261327,罗松,罗成,第 二百八十 五章 罗松 战 罗成,二百八十 五章 人物一 战 人物二,1
TRAIN_SENT_ID_276999,樊迟,孔子,敬鬼神而远之 成语 出处 : 春秋 · 鲁 · 孔子 《 论语 · 雍 也 》 ： 樊迟 问知 ， 子 曰 ： “ 务民之义 ， 敬鬼神而远之 ， 可谓 知矣 。 ”,敬鬼神而远之 成语 出处  春秋  鲁  人物二  论语  雍   人物一 问知  子 曰   务民之义  敬鬼神而远之  可谓 知矣,1
TRAIN_SENT_ID_284526,易水寒,白非凡,儿子 ： 白非凡 、 易水寒,儿子  人物二  人物一,1
TRAIN_SENT_ID_250677,鲁西西,皮皮鲁,的 作品 中 的 5 位 主人公 皮皮鲁 、 鲁西西 、 舒克 、 贝塔 和 大,作品 中  位 主人公 人物二  人物一  舒克  贝塔,1
TRAIN_SENT_ID_284933,凤惊声,凤凰鸣,凤凰鸣 探查 灭境 邪源 ， 带回 被 魔化 的 恶海鲛祖 与 凤惊声 等 人 ， 并 委托 不二 做 寻 绯 羽怨 姬 救治 他们 。,人物二 探查 灭境 邪源  带回 魔化 恶海鲛祖 人物一  委托 不二 做 寻 绯 羽怨 姬 救治,1
TRAIN_SENT_ID_262241,尤二姐,尤三姐,第六十五回 贾二舍 偷 娶 尤二姐 尤三姐 思嫁 柳 二郎,第六十五回 贾二舍 偷 娶 人物一 人物二 思嫁 柳 二郎,1
TRAIN_SENT_ID_250723,鲁西西,皮皮鲁,皮皮鲁 、 鲁西西 、 罗克 、 舒克和贝塔 是 他 笔下 塑造 的 形象 。,人物二  人物一  罗克  舒克和贝塔 笔下 塑造 形象,1
TRAIN_SENT_ID_264679,柳承莞,柳承范,柳承范 会 出现 在 主演 名单 里 当然 不需 讶异 ， 作为 导演 的 兄弟 ， 他 已 是 柳承莞 作品 的 固定 班底 。,人物二 会 出现 主演 名单 里 不需 讶异  导演 兄弟  人物一 作品 固定 班底,1
TRAIN_SENT_ID_269726,薛洋,薛之荔,楚牧 的 母亲 ， 薛洋 、 薛之荔 的 继母 ， 性格 大大咧咧 ， 是 一位 宽容 善良 的 女性 。,楚牧 母亲  人物一  人物二 继母  性格 大大咧咧  一位 宽容 善良 女性,1
TRAIN_SENT_ID_262251,尤二姐,尤三姐,六十五 回 贾二舍 偷 娶 尤二姐 尤三姐 思嫁 柳 二郎,六十五 回 贾二舍 偷 娶 人物一 人物二 思嫁 柳 二郎,1
TRAIN_SENT_ID_252714,颜回,孔子,孔子 谓 颜回 曰 ： “ 吾 服 汝 也 忘 ， 而汝服 于 我 也 亦 忘 。,人物二 谓 人物一 曰   吾 服 汝 忘  而汝服 忘,1
TRAIN_SENT_ID_264591,凌波,凌音,面对 归还 神农 鼎 的 夏侯瑾轩 等 ， 凌音 询问 他们 是否 真的 没有 见到 姐姐 凌波 ， 瑕 觉得 很 抱歉 。,面对 归还 神农 鼎 夏侯瑾轩  人物二 询问 是否 真的 没有 见到 姐姐 人物一  瑕 觉得 抱歉,1
TRAIN_SENT_ID_270779,徐若瑄,徐佩瑜,徐若瑄 把 自己 和 姐姐 徐佩瑜 的 合照 放 上 网站 ， 引起 网友 的 热烈 讨论 。,人物一 姐姐 人物二 合照 放 网站  引起 网友 热烈 讨论,1
TRAIN_SENT_ID_265483,薛蝌,薛蟠,冷子兴 当 了 官 ， 和 薛蟠 、 薛蝌 外出 做生意 。,冷子兴 官  人物二  人物一 外出 做生意,1
TRAIN_SENT_ID_250117,武敦儒,武修文,有二子 武敦儒 、 武修文 ， 妻子 武三娘 ， 义女 何沅君 。,有二子 人物一  人物二  妻子 武三娘  义女 何沅君,1
TRAIN_SENT_ID_261440,毛泽建,毛泽东,毛泽东 没有 让 毛泽建 失望 ， 带 着 她 来到 长沙 ， 送 她 到 建本 和 崇实 女子 职业 学校 读书 。,人物二 没有 人物一 失望  带 来到 长沙  送 建本 崇实 女子 职业 学校 读书,1
TRAIN_SENT_ID_264259,陈真,霍元甲,霍东阁 自小 由 精武门 的 陈真 抚养 长大 ， 霍东阁 是 已故 英雄 霍元甲 的 儿子 。,霍东阁 自小 精武门 人物一 抚养 长大  霍东阁 已故 英雄 人物二 儿子,1
TRAIN_SENT_ID_257789,林平之,岳不群,殊不知 ， 岳不群 挖 了 一个 非常 大 的 坑 等 着 他 跳 呢 ， 从此 ， 林平之 接下来 的 一生 ， 不是 自己 所 能 掌控 得 了 的 。,殊不知  人物二 挖 一个 非常 坑 跳   人物一 接下来 一生  掌控,1
TRAIN_SENT_ID_258150,刘星,夏雪,从 医院 回来 ， 夏雪 和 刘星 还 嘴硬 不肯 服输 ， 装做 一切 都 很 好 的 样子 。,医院 回来  人物二 人物一 嘴硬 不肯 服输  装做 样子,1
TRAIN_SENT_ID_259410,凌音,凌波,凌音 角色 关系 : 亲人 ： 父母 未知 ， 有 一 亲生 姐姐 凌波 。,人物一 角色 关系  亲人  父母 未知  亲生 姐姐 人物二,1
TRAIN_SENT_ID_256918,仲由,孔子,孔子 为 避鲁乱 曾 到 此 讲学 ， 亲见 仲由 率 百姓 负米 筑堤 盛况 ， 叹 曰 ： “ 由 也 ， 事亲 可谓 生 ， 事 尽力 矣 。 ”,人物二 避鲁乱 讲学  亲见 人物一 率 百姓 负米 筑堤 盛况  叹 曰    事亲 可谓 生  事 尽力,1
TRAIN_SENT_ID_250616,鲁西西,皮皮鲁,他 的 作品 中 的 5 位 主人公 皮皮鲁 、 鲁西西 、 舒克 、 贝塔 和 大灰狼 罗克,作品 中  位 主人公 人物二  人物一  舒克  贝塔 大灰狼 罗克,1
TRAIN_SENT_ID_269724,薛洋,薛之荔,薛洋 、 薛之荔 的 父亲 ， 富商 ， 性格内向 ， 沉稳 ， 手下 对 他 都 很 忠心 。,人物一  人物二 父亲  富商  性格内向  沉稳  手下 忠心,1
TRAIN_SENT_ID_250623,鲁西西,皮皮鲁,郑渊洁 完全 以 一个 开放 的 态度 支持 “ 皮皮鲁 ” “ 鲁西西 ” 和 《 魔方 大厦 》 的 结合 。,郑渊洁 完全 一个 开放 态度 支持  人物二   人物一   魔方 大厦  结合,1
