sent_id,entity1,entity2,sent,processed_sent,label
TRAIN_SENT_ID_266227,钱学森,蒋英,有时 钱学森 工作 忙 ， 蒋英 就 亲自 录制 下来 ， 放给 他 听 。,人物一 工作 忙  人物二 亲自 录制 下来  放给 听,1
TRAIN_SENT_ID_270000,姚明,叶莉,姚明 与 叶莉 ： 体坛 伉俪 ， 财富 新秀,人物一 人物二  体坛 伉俪  财富 新秀,1
TRAIN_SENT_ID_278703,叶一茜,田亮,此情此景 ， 田亮 借机 深情 告白 ， 将 所有 荣耀 与 叶一茜 分享 。,此情此景  人物二 借机 深情 告白  荣耀 人物一 分享,1
TRAIN_SENT_ID_258359,张兆和,沈从文,万般 痛苦 的 沈从文 又 接二连三 给 张兆和 写 了 多封 情书 ， 均 石沉大海 杳无音讯 。,万般 痛苦 人物二 接二连三 人物一 写 多封 情书  均 石沉大海 杳无音讯,1
TRAIN_SENT_ID_283043,公孙敬声,公孙贺,太仆 ： 灌夫 、 公孙贺 、 公孙敬声,太仆  灌夫  人物二  人物一,-1
TRAIN_SENT_ID_258064,周海婴,鲁迅,最高人民法院 关于 周海婴 诉 绍兴 越王 珠宝 金行 侵犯 鲁迅 肖像权 一案 应否 受理 的 答复 意见 ( 2000 ． 6 ． 26 ) ( 495 ),最高人民法院 人物一 诉 绍兴 越王 珠宝 金行 侵犯 人物二 肖像权 一案 应否 受理 答复 意见   ．  ．,-1
TRAIN_SENT_ID_256380,孙尚香,刘备,刘备 孙尚香 华丽 转身 ?,人物二 人物一 华丽 转身,1
TRAIN_SENT_ID_273770,霍震霆,霍英东,邓小平 南巡 ， 霍英东 与 霍震霆 迎接 邓小平 。,邓小平 南巡  人物二 人物一 迎接 邓小平,-1
TRAIN_SENT_ID_272847,杨威,杨云,杨威 、 杨云,人物一  人物二,1
TRAIN_SENT_ID_262812,熊美玲,林秋离,No.52 你 在 我心 最深 的 地方 林秋离 熊美玲 蔡幸娟,我心 最深 地方 人物二 人物一 蔡幸娟,1
TRAIN_SENT_ID_257358,贾珍,尤氏,宝玉 下车 ， 来到 灵堂 大哭 一场 ， 见过 尤氏 ， 再见 贾珍 。,宝玉 下车  来到 灵堂 大哭 一场  见过 人物二  再见 人物一,1
TRAIN_SENT_ID_267415,许志安,郑秀文,那时 的 郑秀文 和 许志安 ， 是 一对 公开 的 “ 好 朋友 ” 。,人物二 人物一  一对 公开  朋友,1
TRAIN_SENT_ID_267729,马小玲,况天涯,马小玲 : 况天涯 。,人物一  人物二,-1
TRAIN_SENT_ID_262806,熊美玲,林秋离,No.11 小花猫 的 等待 林秋离 熊美玲,小花猫 等待 人物二 人物一,1
TRAIN_SENT_ID_263481,梅葆玖,梅兰芳,柳 迎春 — — 梅兰芳 （ 录音 ） / 梅葆玖 （ 配像 ）,柳 迎春   人物二  录音   人物一  配像,-1
TRAIN_SENT_ID_285796,章有渭,章简,据 《 松江 府续志 》 著录 ， 章有 淑 、 章有湘 、 章有渭 、 章有 闲 、 章有 澄 、 章有弘 ， 是 节 愍 章简 公的 “ 六朵 金花 ” 。,松江 府续志  著录  章有 淑  章有湘  人物一  章有 闲  章有 澄  章有弘  节 愍 人物二 公的  六朵 金花,-1
TRAIN_SENT_ID_276546,孔子,亓官氏,"绥 曰 ： "" 孔子 妇姓 亓官氏 。",绥 曰   人物一 妇姓 人物二,1
TRAIN_SENT_ID_265718,贾环,贾政,▪ 贾赦 ▪ 贾政 ▪ 贾敏 ▪ 贾珍 ▪ 贾琏 ▪ 贾珠 ▪ 贾环 ▪ 贾瑞,▪ 贾赦 ▪ 人物二 ▪ 贾敏 ▪ 贾珍 ▪ 贾琏 ▪ 贾珠 ▪ 人物一 ▪ 贾瑞,-1
TRAIN_SENT_ID_255518,刘梅,夏雪,夏东海 和 刘梅 得知 这个 消息 ， 内心 暗自 焦虑 ， 因为 希望 越大 失望 也 就 越 大 ， 他们 担心 夏雪 承受 不了 失败 的 打击 。,夏东海 人物一 得知 消息  内心 暗自 焦虑  希望 越大 失望 越  担心 人物二 承受 不了 失败 打击,-1
TRAIN_SENT_ID_272216,马小玲,况天佑,马小玲 遇到 了 况天佑 … …,人物一 遇到 人物二,1
TRAIN_SENT_ID_272659,段延庆,段誉,第一百 一 十五章 段延庆 VS 段誉,第一百 十五章 人物一  人物二,-1
TRAIN_SENT_ID_279405,张维,陆士嘉,11 . 深切 怀念 老师 陆士嘉 教授 和 张维 院士 · · · · · · · · · · · · · · · · · · · · · · 忻鼎定 188,深切 怀念 老师 人物二 教授 人物一 院士                       忻鼎定,1
TRAIN_SENT_ID_276260,西门吹雪,孙秀青,西门吹雪 和 孙秀青 （ 黄元申 版 ）,人物一 人物二  黄元申 版,1
TRAIN_SENT_ID_253735,申雪,赵宏博,29 申雪 和 赵宏博 瞄准 了 最高 领奖台,人物一 人物二 瞄准 最高 领奖台,1
TRAIN_SENT_ID_275796,邓英敏,邓上文,邓英敏 、 邓上文,人物一  人物二,-1
TRAIN_SENT_ID_257740,桓雄,桓因,得到 桓因 的 同意 后 ， 桓雄 率领 3000 人 降临到 太白山 ， 建立 了 “ 神市 ” 。,得到 人物二 同意  人物一 率领  降临到 太白山  建立  神市,-1
TRAIN_SENT_ID_251092,尤三姐,柳湘莲,第二十一回 悲情 自刎 尤三姐 悔婚 悔意 柳湘莲,第二十一回 悲情 自刎 人物一 悔婚 悔意 人物二,1
TRAIN_SENT_ID_265968,杨绛,钱钟书,写 《 围城 》 的 钱钟书 ( 杨绛 ),写  围城  人物二  人物一,1
TRAIN_SENT_ID_274640,傅敏,傅雷,《 解读 傅雷 一家 》 作者 采访 了 傅聪 以及 他 的 弟弟 傅敏 。,解读 人物二 一家  作者 采访 傅聪 弟弟 人物一,-1
TRAIN_SENT_ID_258266,陈建斌,蒋勤勤,代言人 ： 陈建斌 蒋勤勤 （ 曾 ）,代言人  人物一 人物二,1
TRAIN_SENT_ID_260651,李莎,李立三,东北 战火 又 起 ， 李立三 写信 劝 李莎 尽早 启程,东北 战火  人物二 写信 劝 人物一 尽早 启程,1
TRAIN_SENT_ID_273040,黄月英,黄承彦,诸葛亮 决定 让 黄月英 照顾 貂蝉 ， 自己 回城 向 师傅 黄承彦 禀告 一切 。,诸葛亮 决定 人物一 照顾 貂蝉  回城 师傅 人物二 禀告,-1
TRAIN_SENT_ID_271332,何泽慧,钱三强,《 铀 核四 分裂 的 实验 证明 》 ， 钱三强 、 何泽慧,铀 核四 分裂 实验 证明   人物二  人物一,1
TRAIN_SENT_ID_271913,阎婆惜,宋江,阎婆惜 是 宋江 什么 人 ？,人物一 人物二,1
TRAIN_SENT_ID_262825,熊美玲,林秋离,No.98 流泪 林秋离 熊美玲 关之琳,流泪 人物二 人物一 关之琳,1
TRAIN_SENT_ID_274151,汤国梨,章太炎,7 点 45 分 ， 章太炎 病逝 ， 汤国梨 哭 得 撕心裂肺 ， 伤心欲绝 。,点  分  人物二 病逝  人物一 哭 撕心裂肺  伤心欲绝,1
TRAIN_SENT_ID_255604,蒋介石,宋美龄,第八章 蒋介石 逝世 前后 的 宋美龄,第八章 人物一 逝世 人物二,1
TRAIN_SENT_ID_274271,贾敬,贾珍,第 53 回 祭祖 ， 由 “ 贾敬 主祭 ， 贾赦 陪祭 ， 贾珍 献爵 ， 贾琏贾 琮 献 帛 ， 宝玉 捧 香 ， 贾菖 ， 贾菱 展 拜垫 ， 守 焚池 。 ”,回 祭祖   人物一 主祭  贾赦 陪祭  人物二 献爵  贾琏贾 琮 献 帛  宝玉 捧 香  贾菖  贾菱 展 拜垫  守 焚池,-1
TRAIN_SENT_ID_283934,杨洋,熊天平,夫妻 强弱 关系 大 破解 来宾 ： 王婉霏 、 刘畊宏 、 杨洋 、 熊天平 、 婷婷 、 林秀琴 、 何戎 、 吴若权 、 林萃芬,夫妻 强弱 关系 破解 来宾  王婉霏  刘畊宏  人物一  人物二  婷婷  林秀琴  何戎  吴若权  林萃芬,1
TRAIN_SENT_ID_278723,叶一茜,田亮,"演唱 ： 田雨 橙 , 叶一茜 , 田亮",演唱  田雨 橙  人物一  人物二,1
TRAIN_SENT_ID_279282,傅洁娴,欧阳震华,傅洁娴 求婚 : 欧阳震华 给 了 老婆 足够 尊严 ， 直到现在 ， 老婆 都 视 他 为 偶像 。,人物一 求婚  人物二 老婆 足够 尊严  直到现在  老婆 视 偶像,1
TRAIN_SENT_ID_262991,熊美玲,林秋离,No.111 拿开 你 的 手 林秋离 熊美玲,拿开 手 人物二 人物一,1
TRAIN_SENT_ID_273507,殷素素,张翠山,张翠山 与 殷素素 还 活着 ！,人物二 人物一 活着,1
TRAIN_SENT_ID_281560,陈二狗,曹蒹葭,曹蒹葭 略微 倾斜 脑袋 ， 笑望 向 陈二狗 。,人物二 略微 倾斜 脑袋  笑望 人物一,1
TRAIN_SENT_ID_262058,李纨,贾兰,李纨 和 贾兰,人物一 人物二,-1
TRAIN_SENT_ID_254359,金友庄,高凌风,20101227 徐乃麟 队 ： 金友庄 高凌风 ； 黄镫辉 队 ： 阿 Ben 徐 小可,徐乃麟 队  人物一 人物二  黄镫辉 队   徐 小可,1
TRAIN_SENT_ID_279632,窦仙童,薛丁山,薛丁山 不负众望 ， 他 率领 罗章 、 窦一虎 、 秦汉 、 秦英 、 程千忠 、 窦仙童 等 后起之秀 又 一次 大败 苏宝同 。,人物二 不负众望  率领 罗章  窦一虎  秦汉  秦英  程千忠  人物一 后起之秀 一次 大败 苏宝同,1
TRAIN_SENT_ID_273317,秦香莲,陈世美,陈世美 与 秦香莲 （ 1955 ）,人物二 人物一,1
TRAIN_SENT_ID_256060,蒋介石,宋美龄,《 宋美龄 与 蒋介石 》,人物二 人物一,1
TRAIN_SENT_ID_262964,熊美玲,林秋离,No.189 蝴蝶 的 故乡 林秋离 熊美玲 蔡幸娟 、 邰正宵,蝴蝶 故乡 人物二 人物一 蔡幸娟  邰正宵,1
TRAIN_SENT_ID_278996,林诗音,龙啸云,从 林诗音 处 ， 你 得知 了 龙啸云 的 阴谋 。,人物一 处  得知 人物二 阴谋,1
TRAIN_SENT_ID_283219,李大仁,程又青,程又青 与 李大仁 的 友情 ， 也 是 依晨 与 柏霖 友情 的 延续 。,人物二 人物一 友情  依晨 柏霖 友情 延续,1
TRAIN_SENT_ID_255728,蒋介石,宋美龄,宋美龄 陪 蒋介石 返回 南京 后 ， 发表 了 回忆录 ， 不 点名 地 批评 了 戴季陶 。,人物二 陪 人物一 返回 南京  发表 回忆录  点名 批评 戴季陶,1
TRAIN_SENT_ID_253729,申雪,赵宏博,上届 冬奥会 ， 申雪 、 赵宏博 夺得 铜牌 。,上届 冬奥会  人物一  人物二 夺得 铜牌,1
TRAIN_SENT_ID_279451,郭啸天,李萍,郭啸天 ― 李萍 黄药师 ― 冯衡,人物一 ― 人物二 黄药师 ― 冯衡,1
TRAIN_SENT_ID_286682,杨雨婷,房子斌,演员 ： 王志刚 、 房子斌 、 李峰 、 杨雨婷 、 李峰,演员  王志刚  人物二  李峰  人物一  李峰,1
TRAIN_SENT_ID_250187,秦始皇,胡亥,秦始皇 驾崩 沙丘 : 参加 ： 始皇 驾崩 、 沙丘 之变 、 李斯 、 赵高 、 胡亥,人物一 驾崩 沙丘  参加  始皇 驾崩  沙丘 之变  李斯  赵高  人物二,-1
TRAIN_SENT_ID_262784,熊美玲,林秋离,No.106 风 怎么 不 来 林秋离 熊美玲 范怡文,风 人物二 人物一 范怡文,1
TRAIN_SENT_ID_272537,宋江,宋太公,宋江 因此 商议 暗害 扈三娘 ， 后 被 宋太公 阻止 。,人物一 商议 暗害 扈三娘  人物二 阻止,-1
TRAIN_SENT_ID_287081,毕文静,王鹏,北京 朝阳 公园 低调 结婚 ， 新郎 是 毕文静 在 李宁 公司 的 同事 、 山西 小伙 王鹏 。,北京 朝阳 公园 低调 结婚  新郎 人物一 李宁 公司 同事  山西 小伙 人物二,1
TRAIN_SENT_ID_271580,毛岸青,毛泽东,王鹤滨 把 大 信封 拿 回 宿舍 ， 抽出来 一看 ， 是 毛岸青 写给 毛泽东 的 信 。,王鹤滨 信封 回 宿舍  抽出来 一看  人物一 写给 人物二 信,-1
TRAIN_SENT_ID_259574,冯小刚,徐帆,2012 - 07 - 08 ： 徐帆 爱 对 冯导 发脾气 感动 冯小刚 的 ...,人物二 爱 冯导 发脾气 感动 人物一,1
TRAIN_SENT_ID_281822,李蕙仙,梁启超,对于 李蕙仙 ， 梁启超 信任 、 体贴 、 关怀 。,人物一  人物二 信任  体贴  关怀,1
TRAIN_SENT_ID_273759,范文芳,李铭顺,李铭顺 、 范文芳,人物二  人物一,1
TRAIN_SENT_ID_282150,汪寒梅,吴克峰,吴家 父母 开通 ， 愿意 施恩 收容 ， 吴克峰 却 深感 汪寒梅 与 姬 少康 有染 ， 政治面目 模糊 ， 左右为难 。,吴家 父母 开通  愿意 施恩 收容  人物二 深感 人物一 姬 少康 有染  政治面目 模糊  左右为难,1
TRAIN_SENT_ID_259250,刘备,刘禅,A ： 只要 发动 “ 淑慎 ” ， 无论 是否 找到 【 刘备 】 或 【 刘禅 。,发动  淑慎   是否 找到  人物一   人物二,-1
TRAIN_SENT_ID_258331,张兆和,沈从文,此 为 名媛 卷 ， 写 了 沈从文 与 张兆和 、 徐志摩 与 陆小曼 等 五 对 民国 伉俪 。,名媛 卷  写 人物二 人物一  徐志摩 陆小曼 五 民国 伉俪,1
TRAIN_SENT_ID_261945,安雯,苏越,在 法院 审理 期间 ， 苏越 的 爱人 安雯 主动 代其 退赔 人民币 100 万元 。,法院 审理 期间  人物二 爱人 人物一 主动 代其 退赔 人民币  万元,1
TRAIN_SENT_ID_258611,刘禅,刘备,A ： 只要 发动 “ 淑慎 ” ， 无论 是否 找到 【 刘备 】 或 【 刘禅 。,发动  淑慎   是否 找到  人物二   人物一,-1
TRAIN_SENT_ID_265041,李铭顺,范文芳,演唱 ： 范文芳 、 李铭顺 、 孙燕姿 、 蔡健雅 欧菁 仙 、 郑秀珍 、 郑惠玉 、 郑斌辉 李南星 、 葛米星,演唱  人物二  人物一  孙燕姿  蔡健雅 欧菁 仙  郑秀珍  郑惠玉  郑斌辉 李南星  葛米星,1
TRAIN_SENT_ID_279250,长孙无极,孟扶摇,孟扶摇 摇着 默然 趺坐 的 长孙无极 的 肩 ， 指甲 直 掐 入 他 衣内 ， “ 哭 出来 ， 哭 出来 … … ”,人物二 摇着 默然 趺坐 人物一 肩  指甲 直 掐 入 衣内   哭  哭,1
TRAIN_SENT_ID_268523,潘金莲,武大郎,武大郎 并非 苦命 人 ， 潘金莲 实乃 名门 淑媛,人物二 苦命  人物一 实乃 名门 淑媛,1
TRAIN_SENT_ID_257264,纪晓芙,殷梨亭,殷梨亭 之所以 对 纪晓芙 念念不忘 ， 绝大部分 原因 是 出于 要报 “ 夺妻 之 恨 ” 。,人物二 人物一 念念不忘  绝大部分 原因 要报  夺妻 恨,1
TRAIN_SENT_ID_269751,任我行,任盈盈,任家 阵容 是 任盈盈 、 令狐冲 、 任我行 和 东方不败 。,任家 阵容 人物二  令狐冲  人物一 东方不败,-1
TRAIN_SENT_ID_274892,晏几道,晏殊,代表 词人 有 柳永 、 张先 、 欧阳修 、 晏殊 、 晏几道 等 。,代表 词人 柳永  张先  欧阳修  人物二  人物一,-1
TRAIN_SENT_ID_264162,刘备,孙尚香,孙尚香 哭 祭 刘备 的 那座 山 ， 后人 把 它 称为 望夫山 ， 并 在 山上 修庙塑 像 。,人物二 哭 祭 人物一 那座 山  后人 称为 望夫山  山上 修庙塑,1
TRAIN_SENT_ID_262944,熊美玲,林秋离,词 ： 林秋离 曲 ： 熊美玲,词  人物二 曲  人物一,1
TRAIN_SENT_ID_283175,梁廷灿,梁启超,梁启超 藏 、 梁廷灿 、 吴其 昌编 饮冰 室藏 书目 初编 三十一卷 （ 卷 十八 至 二十八 ） 饮冰 室 民国 抄本,人物二 藏  人物一  吴其 昌编 饮冰 室藏 书目 初编 三十一卷  卷 十八 二十八  饮冰 室 民国 抄本,-1
TRAIN_SENT_ID_260421,穆桂英,杨宗保,穆桂英 、 杨宗保,人物一  人物二,1
TRAIN_SENT_ID_266532,严世蕃,严嵩,严嵩 当即 表态 ， 真如 郑泌昌 、 何茂才 所言 ， 是 严世蕃 他们 叫 浙江 毁堤 淹田 ， 还敢 通倭 ， 就 应该 满门抄斩 ！,人物二 当即 表态  真如 郑泌昌  何茂才 所言  人物一 浙江 毁堤 淹田  还敢 通倭  应该 满门抄斩,-1
TRAIN_SENT_ID_257363,贾珍,尤氏,若非 尤氏 患病 ， 贾珍 难于 相请 。,人物二 患病  人物一 难于 相请,1
TRAIN_SENT_ID_286121,郭子睿,郭涛,张亮 、 郭涛 、 张悦轩 、 郭子睿,张亮  人物二  张悦轩  人物一,-1
TRAIN_SENT_ID_249906,张无忌,赵敏,深悟 武林 真谛 的 张无忌 在 解 了 元军 对 少林寺 的 围困 后 ， 辞去 教主 之位 ， 与 赵敏 归隐 山林 。,深悟 武林 真谛 人物一 解 元军 少林寺 围困  辞去 教主 之位  人物二 归隐 山林,1
TRAIN_SENT_ID_278532,李秀文,叶挺,李秀文 只得 赶紧 拍电报 通知 叶挺 。,人物一 只得 赶紧 拍电报 通知 人物二,1
TRAIN_SENT_ID_277026,阎维文,刘卫星,原来 ， 阎维文 和 刘卫星 都 是 山西人 ， 在 山西省 歌舞团 相识 ， 算是 青梅竹马 。,原来  人物一 人物二 山西人  山西省 歌舞团 相识  算是 青梅竹马,1
TRAIN_SENT_ID_267120,公子羽,明月心,明月心 监视 一切 ， 并 向 公子羽 回报 。,人物二 监视  人物一 回报,1
TRAIN_SENT_ID_281820,李蕙仙,梁启超,梁启超 致 李蕙仙,人物二 人物一,1
TRAIN_SENT_ID_283007,孟扶摇,长孙无极,孟扶摇 经典语录 : 请放 长孙无极 。,人物一 经典语录  请放 人物二,1
TRAIN_SENT_ID_271480,钱基博,钱钟书,现代 有 钱基博 ， 钱穆 ， 钱钟书 ， 钱学森 、 钱伟长 、 钱三强 ， 钱正英 ， 钱其琛 ， 钱永健 ， 钱文忠 。,现代 人物一  钱穆  人物二  钱学森  钱伟长  钱三强  钱正英  钱其琛  钱永健  钱文忠,-1
TRAIN_SENT_ID_265725,贾环,贾政,贾政 与 众 幕友 谈及 恒王 与 林四娘 故事 ， 称其 “ 风流 隽逸 ， 忠义 感慨 ” ， “ 最是 千古 佳谈 ” ， 命 贾兰 、 贾环 和 宝玉 各吊 一首 。,人物二 众 幕友 谈及 恒王 林四娘 故事  称其  风流 隽逸  忠义 感慨    最是 千古 佳谈   命 贾兰  人物一 宝玉 各吊 一首,-1
TRAIN_SENT_ID_260304,穆桂英,杨宗保,编剧 穆桂英 杨宗保 大破 天门 阵 ( 1957 ) ....,编剧 人物一 人物二 大破 天门 阵,1
TRAIN_SENT_ID_277927,梁从诫,梁思成,作者 ： 梁思成 英文 原著 ， 费慰梅 编 ， 梁从诫 译,作者  人物二 英文 原著  费慰梅 编  人物一 译,-1
TRAIN_SENT_ID_269242,陆雪琪,张小凡,师侄 ： 齐昊 、 宋大仁 、 文敏 、 楚誉宏 、 曾书书 、 林惊羽 、 田灵儿 、 陆雪琪 、 张小凡,师侄  齐昊  宋大仁  文敏  楚誉宏  曾书书  林惊羽  田灵儿  人物一  人物二,1
TRAIN_SENT_ID_260507,严嵩,严世蕃,严嵩 只好 派 人 飞马 向 严世蕃 求教 。,人物一 只好 派 飞马 人物二 求教,-1
TRAIN_SENT_ID_286134,郭子睿,郭涛,"石头 队 ( D , C2 , E3 ) ： 郭涛 、 郭子睿 （ 石头 ） 、 孙坚 、 黄艺馨",石头 队         人物二  人物一  石头   孙坚  黄艺馨,-1
TRAIN_SENT_ID_255670,蒋介石,宋美龄,“ 平民 教育 之 父 ” 晏阳初 的 启蒙 老师 ， 蒋介石 与 宋美龄 的 证婚人 。,平民 教育 父  晏阳初 启蒙 老师  人物一 人物二 证婚人,1
TRAIN_SENT_ID_269802,李讷,江青,第四章 我 与 毛泽东 、 江青 和 李讷,第四章 毛泽东  人物二 人物一,-1
TRAIN_SENT_ID_282026,施绩,朱然,陈寿 ： “ 朱治 、 吕范以 旧臣 任用 ， 朱然 、 朱桓 以勇烈 著闻 ， 吕据 、 朱异 、 施绩 咸有 将领 之才 ， 克绍 堂构 。,陈寿   朱治  吕范以 旧臣 任用  人物二  朱桓 以勇烈 著闻  吕据  朱异  人物一 咸有 将领 之才  克绍 堂构,-1
TRAIN_SENT_ID_275434,董祀,蔡文姬,蔡文姬 、 曹操 、 董祀 等,人物二  曹操  人物一,1
TRAIN_SENT_ID_265200,尤二姐,贾琏,贾琏 从 平安 州 回来 ， 得知 尤二姐 已 被 凤姐 骗入 荣国府 ， 并 无 二话 。,人物二 平安 州 回来  得知 人物一 凤姐 骗入 荣国府  二话,1
TRAIN_SENT_ID_258506,刘禅,刘备,历位 两国 ， 侍奉 三帝 （ 刘备 、 刘禅 、 司马炎 ） 。,历位 两国  侍奉 三帝  人物二  人物一  司马炎,-1
TRAIN_SENT_ID_275216,丁力,冯程程,吕良伟 、 周润发 和 赵雅芝 的 精彩演出 让 观众们 记住 了 “ 丁力 ” 、 “ 许文强 ” 和 “ 冯程程 ” 的 经典 形象 。,吕良伟  周润发 赵雅芝 精彩演出 观众们 记住  人物一    许文强   人物二  经典 形象,1
TRAIN_SENT_ID_268721,秦可卿,贾蓉,⒊ 贾蓉 — — 秦可卿 ： 瑞珠 、 宝珠 。,⒊ 人物二   人物一  瑞珠  宝珠,1
TRAIN_SENT_ID_257199,孙秀青,西门吹雪,西门吹雪 赶赴 楼兰 去 救 孙秀青 。,人物二 赶赴 楼兰 救 人物一,1
TRAIN_SENT_ID_251779,张洁,周立波,由于 张母 喜欢 上海 地方戏 ， “ 张洁 ” 也 和 周立波 有 了 一些 接触 。,张母 喜欢 上海 地方戏   人物一  人物二 接触,1
TRAIN_SENT_ID_271482,钱基博,钱钟书,钱钟书 为 钱基博 “ 代笔 ” 考,人物二 人物一  代笔  考,-1
TRAIN_SENT_ID_278794,任盈盈,任我行,攻击 阵营 可以 选择 笑傲 路线 ： 独孤 ， 风清扬 ， 令狐冲 ， 任盈盈 ， 岳不群 ， 任我行 ， 左冷禅 ， 向问天 等 相互 点灯 的 。,攻击 阵营 选择 笑傲 路线  独孤  风清扬  令狐冲  人物一  岳不群  人物二  左冷禅  向问天 相互 点灯,-1
TRAIN_SENT_ID_251364,李安琪,李小鹏,2 、 李小鹏 李安琪,人物二 人物一,1
TRAIN_SENT_ID_255521,刘梅,夏雪,《 猫鼠 之争 》 ： 夏雪 为了 写 一篇 作文 ， 开始 研究 小老鼠 ， 怕 老鼠 的 刘梅 ， 抱 了 一只 猫 镇定 自己 ， 结果 小老鼠 意外 身亡 … …,猫鼠 之争   人物二 写 一篇 作文  研究 小老鼠  怕 老鼠 人物一  抱 一只 猫 镇定  小老鼠 意外 身亡,-1
TRAIN_SENT_ID_271043,江枫,花月奴,可 江枫 放弃 花月奴 是 怎样 ？,人物一 放弃 人物二,1
TRAIN_SENT_ID_287192,封皇后,拓跋沙漠汗,代 文帝 拓跋沙漠汗 封皇后,代 文帝 人物二 人物一,1
TRAIN_SENT_ID_276229,韩寒,韩小野,韩小野 太 “ 犀利 ” 韩寒 “ 吐槽 ” 驾驭 不了 。,人物二 太  犀利  人物一  吐槽  驾驭 不了,-1
TRAIN_SENT_ID_255911,蒋介石,宋美龄,蒋介石 选择 了 宋美龄 。,人物一 选择 人物二,1
TRAIN_SENT_ID_273433,杨乐乐,汪涵,1 主持 阵容 : 金晓琳 、 冯祺 、 郑慧琳 、 仇晓 、 汪涵 、 杨乐乐 。,主持 阵容  金晓琳  冯祺  郑慧琳  仇晓  人物二  人物一,1
TRAIN_SENT_ID_268753,孟明视,百里奚,秦穆公 非常重视 人才 ， 其 任内 获得 百里奚 、 蹇 叔 、 由余 、 孟明视 、 西乞术 、 白乙丙 等 贤臣 良将 的 辅佐 。,秦穆公 非常重视 人才  任内 获得 人物二  蹇 叔  由余  人物一  西乞术  白乙丙 贤臣 良将 辅佐,-1
TRAIN_SENT_ID_267399,许志安,郑秀文,3 . 用爱造 世界 / 反正 经 / 霓虹 光管 高高挂 / 爱着 你 . 绑 着 你 / 翻腾 / 不倦 的 蝴蝶 / 奇奇怪怪 / 烈火 （ 许志安 ; 郑秀文 ）,用爱造 世界  反正  霓虹 光管 高高挂  爱着  绑  翻腾  不倦 蝴蝶  奇奇怪怪  烈火  人物一  人物二,1
TRAIN_SENT_ID_252364,江别鹤,江玉郎,江玉郎 趁着 江别鹤 去 拿 酒菜 给 小鱼儿 的 时候 ， 进来 对 小鱼儿 下毒 。,人物二 人物一 酒菜 小鱼儿  进来 小鱼儿 下毒,-1
TRAIN_SENT_ID_264484,吴健雄,袁家骝,顾问 ： 雷洁琼 费孝通 卢嘉锡 吴健雄 袁家骝 桥 口 隆吉,顾问  雷洁琼 费孝通 卢嘉锡 人物一 人物二 桥 口 隆吉,1
TRAIN_SENT_ID_260027,严英云,徐良,因此 ， 王顺 也 想 用 严英云 作 诱饵 ， 吸引 徐良 同 他 决斗 。,王顺 想 人物一 作 诱饵  吸引 人物二 决斗,1
TRAIN_SENT_ID_285563,文馨,陈笑飞,"一连串 的 意外 , 把 陈笑飞 和 林多美 往 错误 的 道路 上越 推越 远 , 他们 不断 犯下 过错 , 令 文馨 及其 家人 陷入 危机 。",一连串 意外  人物二 林多美 错误 道路 上越 推越 远  不断 犯下 过错  令 人物一 家人 陷入 危机,1
TRAIN_SENT_ID_258399,张兆和,沈从文,第四 封 沈从文 致 张兆和 （ 1934.1 . 12 ）,第四 封 人物二 人物一,1
TRAIN_SENT_ID_253587,沈浪,朱七七,众人 叹 这 世间 也 就 你 沈浪 治得 住 这 令人 头大 的 朱七七 。,众人 叹 世间 人物一 治得 住 令人 头大 人物二,1
TRAIN_SENT_ID_281683,蒋韵,李锐,李锐 蒋韵 用 方块字 深刻 表达 臼己,人物二 人物一 方块字 深刻 表达 臼己,1
TRAIN_SENT_ID_259156,刘备,刘禅,刘备 ： 糜贞 ， 甘倩 ， 刘禅 ， 刘理 ， 刘莹,人物一  糜贞  甘倩  人物二  刘理  刘莹,-1
TRAIN_SENT_ID_253579,沈浪,朱七七,风华 度 ： 朱七七 4 星 ， 沈浪 3 星半,风华 度  人物二  星  人物一  星半,1
TRAIN_SENT_ID_277467,贾演,贾代化,▪ 贾演 ▪ 贾源 ▪ 贾代化 ▪ 贾代善 ▪ 贾代儒 ▪ 贾代修 ▪ 贾敷 ▪ 贾敬,▪ 人物一 ▪ 贾源 ▪ 人物二 ▪ 贾代善 ▪ 贾代儒 ▪ 贾代修 ▪ 贾敷 ▪ 贾敬,-1
TRAIN_SENT_ID_268047,樊梨花,薛丁山,诸如 薛仁贵 征东 、 薛丁山 征西 、 薛刚反唐 ， 乃至 薛家 媳妇 樊梨花 移山倒海 的 神通 等等 。,薛仁贵 征东  人物二 征西  薛刚反唐  薛家 媳妇 人物一 移山倒海 神通,1
TRAIN_SENT_ID_278579,岳灵珊,岳不群,岳灵珊 （ 师姐 ） 仇敌 : 余沧海 / 青城派 ， 木高峰 ， 岳不群 盟友 : 左冷禅,人物一  师姐  仇敌  余沧海  青城派  木高峰  人物二 盟友  左冷禅,-1
TRAIN_SENT_ID_256221,孙尚香,刘备,刘备 可以 放 孙尚香 。,人物二 放 人物一,1
TRAIN_SENT_ID_274585,薛丁山,薛仁贵,还 编导 演出 《 薛仁贵 征东 》 、 《 薛丁山 征西 》 、 《 突破 江防 》 、 《 平原 游击队 》 、 《 金田 怒火 》 等 。,编导 演出  人物二 征东    人物一 征西    突破 江防    平原 游击队    金田 怒火,-1
TRAIN_SENT_ID_249372,后稷,姜嫄,有 后稷 祠及 姜嫄 祠 ” 。,人物一 祠及 人物二 祠,-1
TRAIN_SENT_ID_277371,樊姬,楚庄王,所以 ， 樊姬 就 多次 去 劝阻 他 ， 而 楚庄王 始终 不 听 。,人物一 多次 劝阻  人物二 始终 听,1
TRAIN_SENT_ID_272823,谢烨,顾城,顾城 与 谢烨,人物二 人物一,1
TRAIN_SENT_ID_287055,夏侯夬,夏侯道迁,《 北史 · 夏侯道迁 传 》 ： “ ﹝ 夏侯夬 ﹞ 不胜 楚痛 ， 大叫 。 ”,北史  人物二 传    ﹝ 人物一 ﹞ 不胜 楚痛  大叫,-1
TRAIN_SENT_ID_269756,任我行,任盈盈,小 人民币 玩家 或者 非 人民币 玩家 ， 攻击 路线 走 桃谷六仙 和 令狐冲 ， 任盈盈 ， 任我行 ， 岳不群 等 相互 点灯 。,人民币 玩家 非 人民币 玩家  攻击 路线 走 桃谷六仙 令狐冲  人物二  人物一  岳不群 相互 点灯,-1
TRAIN_SENT_ID_256809,朱军,谭梅,朱军 谭梅 的 三个 任务 是 滑翔伞 ， 背 法语 ， 开 飞机 。,人物一 人物二 三个 任务 滑翔伞  背 法语  开 飞机,1
