sent_id,sent_id,entity1,entity2,sent,processed_sent,human
TRAIN_SENT_ID_283754,,慕容顺,伏允,唐高祖 李渊 时 ， 慕容顺 自 江都 来 归 ， 高祖 遣使 与 伏允 通 和 ， 并令 其 出兵 进讨 割据 凉州 ( 今 甘肃 武威 ) 的 李轨 ， 伏允 兴兵 击 之 ， 战于 库门 。,唐高祖 李渊 时  人物一 江都  高祖 遣使 人物二 通  并令 出兵 进讨 割据 凉州  甘肃 武威  李轨  人物二 兴兵 击  战于 库门,-1
TRAIN_SENT_ID_272732,,徐天宏,周绮,正 所谓 不是 怨家 不 聚头 ， 周绮 谁 都 不 去 找 ， 偏偏 要 去 找 徐天宏 的 麻烦 。,正 所谓 怨家 聚头  人物二 找  偏偏 找 人物一 麻烦,1
TRAIN_SENT_ID_274367,,上官虹,李文秀,李文秀 人物 经历 : 吕梁 三杰 霍元龙 、 史仲俊 、 陈达海 为 抢夺 一幅 埋藏 宝物 的 高昌 迷宫 图 ， 带人 与 师妹 上官虹 及其 夫 白马 李三 交手 。,人物二 人物 经历  吕梁 三杰 霍元龙  史仲俊  陈达海 抢夺 一幅 埋藏 宝物 高昌 迷宫 图  带人 师妹 人物一 夫 白马 李三 交手,-1
TRAIN_SENT_ID_272252,,金正恩,金正日,翌年 12 月 ， 最高 领导人 金正日 离世 ， 安正洙 被 继任人 金正恩 列为 治丧 委员会 的 成员 之一 。,翌年  月  最高 领导人 人物二 离世  安正洙 继任人 人物一 列为 治丧 委员会 成员,-1
TRAIN_SENT_ID_276753,,丁夫人,曹操,曹操 听到 丁夫人 病故 的 消息 ， 痛心疾首 ， 觉得 愧对 于 她 。,人物二 听到 人物一 病故 消息  痛心疾首  觉得 愧对,1
TRAIN_SENT_ID_270009,,张耳,张敖,张敖 ： 本书 卷三二 《 张耳 传 》 附其传 。,人物二  本书 卷三二  人物一 传  附其传,-1
TRAIN_SENT_ID_262692,,杨不悔,纪晓芙,但是 ， 自古 男女授受不亲 ， 纪晓芙 如此 珍重 的 把 杨不悔 付托 给 张无忌 ， 是否 也 有 托付 其 终身 的 想法 在 其中 ， 不得而知 。,自古 男女授受不亲  人物二 珍重 人物一 付托 张无忌  是否 托付 终身 想法  不得而知,1
TRAIN_SENT_ID_272530,,宋江,宋太公,后 前去 投靠 宋江 不能 ， 宋太公 托其 给 宋江 送信 ， 石勇 在 对 影山 和 宋江 、 燕顺 相遇 ， 投奔 了 梁山 。,前去 投靠 人物一 不能  人物二 托其 人物一 送信  石勇 影山 人物一  燕顺 相遇  投奔 梁山,1
TRAIN_SENT_ID_282860,,柳摇金,韩翃,在 同僚 们 眼热 的 贺 送 下 ， 韩翃 与 柳摇金 风风光光 地 又 来到 了 京城 长安 。,同僚 眼热 贺 送  人物二 人物一 风风光光 来到 京城 长安,1
TRAIN_SENT_ID_265224,,尤二姐,贾琏,贾珍 馋涎 妻妹 的 美貌 ， 对 尤二姐 无所不至 ， 当 他 玩腻 后 ， 就 把 她 让给 了 贾琏 。,贾珍 馋涎 妻妹 美貌  人物一 无所不至  玩腻  让给 人物二,1
TRAIN_SENT_ID_271869,,阎婆惜,宋江,第十回 宋江 怒 杀 阎婆惜 武松 独闯 景阳冈,第十回 人物二 怒 杀 人物一 武松 独闯 景阳冈,1
TRAIN_SENT_ID_273066,,杨铁心,包惜弱,杨铁心 、 包惜弱 最后 时辰 已到 ， 不能不 死 。,人物一  人物二 最后 时辰 已到  不能不 死,1
TRAIN_SENT_ID_267089,,宁不空,宁凝,陆渐 再 看 宁凝 ， 见 她 呆 望 宁不空 ， 神色 茫然 。,陆渐 人物二  见 呆 人物一  神色 茫然,1
TRAIN_SENT_ID_271169,,李治,唐太宗李世民,《 薛丁山 与 樊梨花 》 饰 唐太宗李世民 、 李治 殿下,薛丁山 樊梨花  饰 人物二  人物一 殿下,1
TRAIN_SENT_ID_266962,,关索,关羽,关索 ， 关羽 三子 ， 演义 虚构 ， 关羽 失 荆州 后 在 鲍 家庄 养伤 ， 诸葛亮 南伐 孟获 时才 归军 ， 作 先锋 。,人物一  人物二 三子  演义 虚构  人物二 失 荆州 鲍 家庄 养伤  诸葛亮 南伐 孟获 时才 归军  作 先锋,-1
TRAIN_SENT_ID_283947,,王难姑,胡青牛,胡青牛 一气之下 ， 从 王难姑 那里 夺来 了 三虫 三草 剧毒 也 吃 了 下去 ， 那知 胡青牛 。,人物二 一气之下  人物一 夺来 三虫 三草 剧毒 吃 下去  那知 人物二,1
TRAIN_SENT_ID_268011,,樊梨花,薛丁山,樊梨花 斩夫 : 派生 剧目 ， 不见 三传 ， 樊梨花 挂 圝 帅 征西 ， 其夫 薛丁山 为 先锋 违反 将令 ， 樊梨花 斩夫 ， 最后 唐王 求情 才 饶 过 。,人物一 斩夫  派生 剧目  不见 三传  人物一 挂 圝 帅 征西  其夫 人物二 先锋 违反 将令  人物一 斩夫  最后 唐王 求情 饶,-1
TRAIN_SENT_ID_263107,,毛福梅,蒋介石,毛福梅 在 新婚之夜 闹 了 个 洞房 空守 ， 对 蒋介石 怨 一阵 ， 恨 一阵 ， 到头来 还是 谅解 了 他 。,人物一 新婚之夜 闹 洞房 空守  人物二 怨 一阵  恨 一阵  到头来 谅解,1
TRAIN_SENT_ID_276318,,岳灵珊,林平之,后来 林平之 因 杀害 了 岳灵珊 ， 被 令狐冲 囚于 西湖 牢底 。,后来 人物二 杀害 人物一  令狐冲 囚于 西湖 牢底,1
TRAIN_SENT_ID_260870,,贾珍,贾蓉,假寐 用例 : 1 . 贾珍 贾蓉 此时 为 礼法 所拘 ， 不免 在 灵旁 藉 草 枕块 ， 恨苦 居丧 。,假寐 用例    人物一 人物二 礼法 所拘  不免 灵旁 藉 草 枕块  恨苦 居丧,1
TRAIN_SENT_ID_277402,,樊姬,楚庄王,樊姬 的 意志 和 行动 最终 感化 楚庄王 ， 使 楚庄王 觉悟 过来 ， 并 改过自新 。,人物一 意志 行动 最终 感化 人物二  人物二 觉悟 过来  改过自新,1
TRAIN_SENT_ID_285151,,刘梦,刘云,唐 刘梦 得 、 白乐天 元日 举酒 赋诗 ， 刘云 ： “ 与 君同 甲子 ， 寿酒 让 先杯 。 ”,唐 人物一  白乐天 元日 举酒 赋诗  人物二   君同 甲子  寿酒 先杯,-1
TRAIN_SENT_ID_268123,,樊梨花,薛丁山,薛丁山 和 樊梨花 的 关系 也 越来越 好 了 ， 而 金定 的 心理 面 也 不 知道 是 什么 滋味 。,人物二 人物一 关系 越来越  金定 心理 面 知道 滋味,1
TRAIN_SENT_ID_276460,,尤氏,贾珍,贾珍 说 请 凤姐儿 代 尤氏 料理 内务 。,人物二 说 请 凤姐儿 代 人物一 料理 内务,1
TRAIN_SENT_ID_269331,,陆雪琪,张小凡,张小凡 一看 不 对 ， 虽然 有心 对敌 ， 但 敌我 悬殊 太 大 ， 只得 扶著 陆雪琪 向 後 退去 。,人物二 一看  有心 对敌  敌我 悬殊 太  只得 扶著 人物一 後 退去,1
TRAIN_SENT_ID_278116,,慕容秋荻,谢晓峰,慕容秋荻 没有 朝朝暮暮 的 相伴 ， 但 谢晓峰 的 心 始终 是 属于 慕容秋荻 的 。,人物一 没有 朝朝暮暮 相伴  人物二 心 始终 属于 人物一,1
TRAIN_SENT_ID_278929,,汪涵,杨乐乐,5 明星阵容 : 主持 团队 : 《 越 淘越 开心 》 先后 由 汪涵 、 杨乐乐 、 李斯 羽 、 李慧玲 、 柯豆 等 担任 主持人 ， 现任 主持人 为 魏巍 、 潘丹 。,明星阵容  主持 团队   越 淘越 开心  先后 人物一  人物二  李斯 羽  李慧玲  柯豆 担任 主持人  现任 主持人 魏巍  潘丹,-1
TRAIN_SENT_ID_279610,,晏紫,李圣根,2006 年 11 月 ， 李圣根 特地 飞 到 北京 ， 订 了 一家 法国 餐厅 的 包间 请 晏紫 吃饭 ， 期间 还 表白 希望 晏紫 能 做 自己 的 女友 。,年  月  人物二 特地 飞 北京  订 一家 法国 餐厅 包间 请 人物一 吃饭  期间 表白 希望 人物一 做 女友,-1
TRAIN_SENT_ID_266966,,关索,关羽,关索 ： 关羽 三子 。,人物一  人物二 三子,-1
TRAIN_SENT_ID_285421,,宇文广,宇文导,后来 他 的 父亲 宇文导 追封 豳 国公 ， 下 诏 宇文广 袭 豳 国 公爵 。,后来 父亲 人物二 追封 豳 国公  诏 人物一 袭 豳 国 公爵,-1
TRAIN_SENT_ID_284936,,丁秋星,蔡明,丁秋星 急于 想 认识 蔡明 ， 准备 写张 纸条 给 她 。,人物一 急于 想 认识 人物二  准备 写张 纸条,1
TRAIN_SENT_ID_270475,,关平,关羽,关平 兵败 ， 逃回 大寨 告诉 关羽 ， 荆州 已失 ， 关羽 却 不 相信 。,人物一 兵败  逃回 大寨 告诉 人物二  荆州 已失  人物二 相信,1
TRAIN_SENT_ID_271172,,李治,唐太宗李世民,唐朝 皇帝 墨宝 内容 介绍 : 唐太宗李世民 ； 唐高宗 李治 ； 唐 武则天 ； 唐中 宗李显 ； 唐睿宗 李旦 ； 唐玄宗 李隆基 ； 龙角山纪 圣铭,唐朝 皇帝 墨宝 内容 介绍  人物二  唐高宗 人物一  唐 武则天  唐中 宗李显  唐睿宗 李旦  唐玄宗 李隆基  龙角山纪 圣铭,-1
TRAIN_SENT_ID_266306,,何猷启,陈婉珍,何猷启 先生 （ 陈婉珍 女士 所 出 ）,人物一 先生  人物二 女士 出,-1
TRAIN_SENT_ID_250299,,秦始皇,胡亥,秦二世 胡亥 从 继位 到 灭亡 仅 存续 了 短短的 三年 时间 ， 由 秦始皇 创建 的 大 秦 帝国 就 断送 在 了 短命 的 二世 胡亥 之手 。,秦二世 人物二 继位 灭亡 仅 存续 短短的 三年 时间  人物一 创建 秦 帝国 断送 短命 二世 人物二 之手,-1
TRAIN_SENT_ID_253496,,祝彪,扈三娘,100181 祝彪 847522 祝家庄 的 三子 ， 和 扈三娘 有 婚约 ， 三 兄弟 中 武艺 最高 。,人物一  祝家庄 三子  人物二 婚约  三 兄弟 中 武艺 最高,-1
TRAIN_SENT_ID_264185,,刘备,孙尚香,在 刘备 、 孙尚香 的 主持 下 ， 赵云 与 樊氏 完婚 。,人物一  人物二 主持  赵云 樊氏 完婚,-1
TRAIN_SENT_ID_276426,,秦始皇,秦庄襄王,"来 也 内容简介 : 秦始皇 帝者 , 秦庄襄王 子 也 。",内容简介  人物一 帝者  人物二 子,-1
TRAIN_SENT_ID_251060,,尤三姐,柳湘莲,尤三姐 暗恋 柳湘莲 五年 ， 却 并 不敢 追求 ， 等到 身陷 贾珍 等 一干人 的 污水 中 时 方才 觉醒 。,人物一 暗恋 人物二 五年  不敢 追求  身陷 贾珍 一干人 污水 中 时 方才 觉醒,1
TRAIN_SENT_ID_274025,,白素,卫斯理,然而 ， 卫斯理 和 白素 深知 蓝丝 对 “ 长老 ” 极为 崇拜 ， 一定 会 坚持 到 “ 宝地 ” 。,人物二 人物一 深知 蓝丝  长老  极为 崇拜  一定 会 坚持  宝地,1
TRAIN_SENT_ID_272741,,徐天宏,周绮,陈家洛 分配 六路 人马 ， 前去 营救 文泰来 ， 最 好看 处 是 周绮 与 徐天宏 的 对 戏 。,陈家洛 分配 六路 人马  前去 营救 文泰来  好看 处 人物二 人物一 戏,1
TRAIN_SENT_ID_275035,,朱七七,沈浪,三天 期限 将 至 ， 沈浪 为 解救 仁义 山庄 ， 精心设计 ， 但 白飞飞 却 劫走 朱七七 。,三天 期限  人物二 解救 仁义 山庄  精心设计  白飞飞 劫走 人物一,1
TRAIN_SENT_ID_264112,,刘备,孙尚香,因为 不想 和 五虎将 及 孙尚香 分开 ， 所以 非常 害怕 真 刘备 治愈 的 那 一天 到来 。,不想 五虎将 人物二 分开  非常 害怕 真 人物一 治愈 一天 到来,1
TRAIN_SENT_ID_271628,,毛岸青,毛泽东,2003 年 在 全国 纪念 毛泽东 主席 诞辰 110 周年纪念 活动 中 ， 毛岸青 、 邵华 、 毛新宇 联名 来函 邀请 书画 纪念 。,年 全国 纪念 人物二 主席 诞辰  周年纪念 活动 中  人物一  邵华  毛新宇 联名 来函 邀请 书画 纪念,-1
TRAIN_SENT_ID_257288,,金蛇郎君,温仪,当 袁承志 帮 夏雪宜 报仇雪恨 后 努力 撮合 他 和 温仪 想 让 他 最 爱 的 青弟 早点 出生 却 发现 金蛇郎君 兴趣 好像 有 哪里 不 对 的 地方 … …,袁承志 帮 夏雪宜 报仇雪恨 努力 撮合 人物二 想 爱 青弟 早点 出生 发现 人物一 兴趣 好像 地方,1
TRAIN_SENT_ID_263712,,郭槐,贾充,从此 每当 贾充 外出 ， 郭槐 便 派 人 寻找 ， 深怕 贾充 前去 与 李婉 相会 。,人物二 外出  人物一 便 派 寻找  深怕 人物二 前去 李婉 相会,1
TRAIN_SENT_ID_281706,,高亚麟,时玮,得知 时玮 要 来 ， 高亚麟 决定 给 她 个 惊喜 。,得知 人物二  人物一 决定 惊喜,1
TRAIN_SENT_ID_273946,,江冬秀,胡适,江冬秀 二老 后世 : 一九六二年 二月 二十四日 晚 ， 胡适 心脏病 复发 ， 在 台北 南港 中央研究院 蔡元培 馆 逝世 。,人物一 二老 后世  一九六二年 二月 二十四日 晚  人物二 心脏病 复发  台北 南港 中央研究院 蔡元培 馆 逝世,-1
TRAIN_SENT_ID_274914,,晏几道,晏殊,字叔原 ， 号 小山 ， 抚州 临 晏几道 川 （ 今属 江西 ） 人 ， 晏殊 第七 子 。,字叔原  号 小山  抚州 人物一 川  今属 江西   人物二 第七 子,-1
TRAIN_SENT_ID_251096,,尤三姐,柳湘莲,后 柳湘莲 闻知 尤三姐 住 宁国府 ， 疑其 清白 ， 欲 退婚 。,人物二 闻知 人物一 住 宁国府  疑其 清白  欲 退婚,1
TRAIN_SENT_ID_283309,,李俐,满文军,有 了 李俐 的 理解 和 支持 ， 满文军 在 事业 上 的 发展 越来越 顺利 。,人物一 理解 支持  人物二 事业 发展 越来越 顺利,1
TRAIN_SENT_ID_282501,,钟灵,段正淳,延年益寿 ： 丁春秋 、 段正淳 、 南海 鳄神 、 游坦之 、 钟灵 、 木婉清 、 扫地 神僧 、 元元 大师 、 乔峰 、 玄慈 、 慕容复 、 鸠摩智,延年益寿  丁春秋  人物二  南海 鳄神  游坦之  人物一  木婉清  扫地 神僧  元元 大师  乔峰  玄慈  慕容复  鸠摩智,-1
TRAIN_SENT_ID_285307,,李凤娘,赵惇,光宗 赵惇 皇后 李凤娘,光宗 人物二 皇后 人物一,-1
TRAIN_SENT_ID_262579,,扶苏,秦始皇,作为 长子 ， 秦始皇 对 扶苏 显然 寄托 了 太 多 希望 。,长子  人物二 人物一 显然 寄托 太 希望,-1
TRAIN_SENT_ID_273170,,黄苗子,郁风,当 黄苗子 向 郁风 求婚 时 ， 以 革命者 自居 的 郁风 觉得 难以 抉择 ， 因为 黄苗子 这时 依然 在 国民党 政府 任职 。,人物一 人物二 求婚 时  革命者 自居 人物二 觉得 难以 抉择  人物一 依然 国民党 政府 任职,1
TRAIN_SENT_ID_286099,,王柳,王猷,王猷 ， 王柳 子 ， 南朝 宋官 至 侍中 、 光禄 大夫 。,人物二  人物一 子  南朝 宋官 侍中  光禄 大夫,-1
TRAIN_SENT_ID_285259,,莫雪鸢,周亚夫,2 、 你 干嘛 对 我 这么 好 ， 我 只是 一个 长得 丑 又 什么 都 不会 的 普通 周亚夫 与 莫雪鸢 ( 8 张 ),干嘛  一个 长得 丑 不会 普通 人物二 人物一   张,1
TRAIN_SENT_ID_276128,,许仙,许仕林,媚娘 曾 企图 勾引 出家 后 的 许仙 未果 ， 又 企图 勾引 许仕林 却 被 小青 揭穿 而 未果 。,媚娘 企图 勾引 出家 人物一 未果  企图 勾引 人物二 小青 揭穿 未果,1
TRAIN_SENT_ID_252361,,江别鹤,江玉郎,同时 小鱼儿 也 对 江别鹤 告密 江玉郎 私吞 镖银 的 事情 ！,小鱼儿 人物一 告密 人物二 私吞 镖银 事情,1
TRAIN_SENT_ID_262988,,熊美玲,林秋离,No.77 找 什么 理由 走 林秋离 熊美玲 彭伟华,找 理由 走 人物二 人物一 彭伟华,1
TRAIN_SENT_ID_284882,,柳原爱子,明治天皇,1943 年 — — 柳原爱子 ， 明治天皇 的 典侍 ， 大 正 天皇 的 生母 。,年   人物一  人物二 典侍  正 天皇 生母,-1
TRAIN_SENT_ID_276325,,岳灵珊,林平之,岳灵珊 与 师弟 林平之 相恋 ， 令狐冲 伤心 至极 ， 但 无可奈何 。,人物一 师弟 人物二 相恋  令狐冲 伤心 至极  无可奈何,1
TRAIN_SENT_ID_276770,,丁夫人,曹操,可 丁夫人 默不作声 ， 曹操 走 到 门前 问 ， 跟 我 回去 ， 行不行 ？,人物一 默不作声  人物二 走 门前 问  回去  行不行,1
TRAIN_SENT_ID_269187,,陆雪琪,张小凡,认识 ： 张小凡 、 陆雪琪 、 小白 、 鬼王 、 道 玄,认识  人物二  人物一  小白  鬼王  道 玄,1
TRAIN_SENT_ID_283467,,张伯驹,潘素,张伯驹 和 潘素 潘素 : 女 ， ( 1915 - - 1992 ) ， 字慧素 ， 著名 山水画 家 。,人物一 人物二 人物二  女         字慧素  著名 山水画 家,-1
TRAIN_SENT_ID_253508,,祝彪,扈三娘,被 祝龙 、 扈三娘 追赶 ， 这时 ， 梁山 的 其余 几队 人马 也 到 了 ， 扈三娘 的 未婚夫 祝彪 也 加入 战斗 ， 双方 陷入 混战 。,祝龙  人物二 追赶   梁山 几队 人马  人物二 未婚夫 人物一 加入 战斗  双方 陷入 混战,1
TRAIN_SENT_ID_284673,,洪安通,苏荃,教主 洪安通 勉强 将志灵 杀死 ， 高轩 指使 小宝 杀 安通 与 苏荃 。,教主 人物一 勉强 将志灵 杀死  高轩 指使 小宝 杀 安通 人物二,1
TRAIN_SENT_ID_249994,,张无忌,赵敏,剧情 主线 在于 张无忌 、 周芷若 与 赵敏 的 三角恋 ， 以及 倚天剑 屠龙刀 秘密 的 最后 答案 。,剧情 主线 人物一  周芷若 人物二 三角恋  倚天剑 屠龙刀 秘密 最后 答案,1
TRAIN_SENT_ID_253571,,沈浪,朱七七,对决 一 ： 朱七七 + 沈浪 VS 仁义 山庄 + 七大 高手,对决  人物二  人物一  仁义 山庄  七大 高手,1
TRAIN_SENT_ID_261319,,朱兆祥,胡静,这 简直 是 一项 不 可能 完成 的 任务 ， 十指 不 沾 阳春 水 的 胡静 和 朱兆祥 ， 与 皇家 夏威夷 酒店 的 主厨 PK 做饭 ？,简直 一项 可能 完成 任务  十指 沾 阳春 水 人物二 人物一  皇家 夏威夷 酒店 主厨  做饭,1
TRAIN_SENT_ID_270348,,关平,关羽,（ 关羽 、 周仓 、 关平 同 下山 ， 关羽 归座 。,人物二  周仓  人物一 下山  人物二 归座,-1
TRAIN_SENT_ID_275756,,李沅芷,余鱼同,李沅芷 几次 与 余鱼同 交往 ， 对 他 一往情深 ， 岂料 余鱼同 暗恋 骆冰 ， 对 她 毫不 理睬 。,人物一 几次 人物二 交往  一往情深  岂料 人物二 暗恋 骆冰  毫不 理睬,1
TRAIN_SENT_ID_270509,,关平,关羽,主公 我要 黄将 : 关平 : 关羽 的 并 女 ， 一直 跟随 关羽 出征 . 东吴 趁 关羽 攻奥城时 ， 突然 背弃 吴蜀 同盟 ， 愉袭 荆州 。,主公 我要 黄将  人物一  人物二 女  一直 跟随 人物二 出征  东吴 人物二 攻奥城时  突然 背弃 吴蜀 同盟  愉袭 荆州,-1
TRAIN_SENT_ID_251744,,顾倩兮,卢云,其女 顾倩兮 先 喜欢 卢云 后来 又 嫁给 杨肃 观 .,其女 人物一 先 喜欢 人物二 后来 嫁给 杨肃 观,1
TRAIN_SENT_ID_285698,,金与正,金正日,韩国 情报部门 官员 认为 金正恩 会 重用 金与正 ， 金正日 让 金敬姬 担任 了 党 部长 和 党 政治局 委员 。,韩国 情报部门 官员 认为 金正恩 会 重用 人物一  人物二 金敬姬 担任 党 部长 党 政治局 委员,-1
TRAIN_SENT_ID_249408,,后稷,姜嫄,后稷 母为 姜嫄 ， 出见 大 人迹 而 履践 之 ， 知于 身 ， 则 生 后稷 。,人物一 母为 人物二  出见 人迹 履践  知于 身  生 人物一,-1
TRAIN_SENT_ID_276311,,岳灵珊,林平之,令狐冲 一直 暗恋 小 师妹 岳灵珊 ， 无奈 灵珊爱 上 了 新 加入 本门 的 林平之 。,令狐冲 一直 暗恋 师妹 人物一  无奈 灵珊爱 新 加入 本门 人物二,1
TRAIN_SENT_ID_286463,,张龙,张麟,张麟 ， 张龙 子,人物二  人物一 子,-1
TRAIN_SENT_ID_273451,,凌操,凌统,凌统 激发 斗气 是 在 杀死 凌操 之后 。,人物二 激发 斗气 杀死 人物一 之后,1
TRAIN_SENT_ID_268482,,曹襄,卫长公主,卫长公主 与 曹襄 的 后嗣 到 东汉 还享 着 侯位 ， 可谓 是 风光 的 百年 侯爵 。,人物二 人物一 后嗣 东汉 还享 侯位  可谓 风光 百年 侯爵,-1
TRAIN_SENT_ID_265267,,贾琏,贾赦,观点 四 : 有 说 贾赦 是 宁府 过继 给 荣府 的 ， 所以 贾琏 从 贾珍 ， 称 二爷 。,观点 四  说 人物二 宁府 过继 荣府  人物一 贾珍  称 二爷,1
TRAIN_SENT_ID_278538,,李秀文,叶挺,李秀文 为了 孩子 ， 不得不 与 叶挺 分手 了 。,人物一 孩子  不得不 人物二 分手,1
TRAIN_SENT_ID_271710,,石厚,石碏,石碏 却说 ： “ 石厚 与州吁 沆瀣一气 ， 不 杀掉 他 ， 我 在 朝歌 无脸 见 人 。 ”,人物二 却说   人物一 与州吁 沆瀣一气  杀掉  朝歌 无脸 见,1
TRAIN_SENT_ID_264313,,贾环,赵姨娘,贾探春 是 中国 古典小说 《 红楼梦 》 主要 的 人物 ， 是 故事 主人公 贾宝玉 的 庶出 妹妹 ， 为 赵姨娘 所 生 ， 与 贾环 同母 。,贾探春 中国 古典小说  红楼梦  主要 人物  故事 主人公 贾宝玉 庶出 妹妹  人物二 生  人物一 同母,-1
TRAIN_SENT_ID_254092,,霍启刚,郭晶晶,霍启刚 表示 也 有 陪 太太 郭晶晶 进产房 ， 但 没有 为 宝宝 剪 脐带 。,人物一 表示 陪 太太 人物二 进产房  没有 宝宝 剪 脐带,1
TRAIN_SENT_ID_258915,,王熙凤,贾琏,贾琏 与 凤姐 : 虽是 个 外 当家 ， 但 许多 事情 上 ， 只是 王熙凤 说了算 。,人物二 凤姐  虽是 外 当家  事情  人物一 说了算,1
TRAIN_SENT_ID_273854,,范柳原,白流苏,本来 我们 都 以为 ， 她 和 范柳原 之间 就 再也不会 有 交点 了 ， 而 出人意料 的 是 ， 范柳原 暗地里 就 给 了 白流苏 一个 平台 。,本来  人物一 之间 再也不会 交点  出人意料  人物一 暗地里 人物二 一个 平台,1
TRAIN_SENT_ID_256110,,蒋介石,宋美龄,2013.06 . 24 蒋介石 背后 的 女人 宋美龄,人物一 背后 女人 人物二,1
TRAIN_SENT_ID_277127,,浦安修,彭德怀,沉默 好久 ， 彭德怀 才 开口 ： “ 我 有 预感 ， 浦安修 早有 准备 。,沉默 好久  人物二 开口   预感  人物一 早有 准备,1
TRAIN_SENT_ID_258641,,刘禅,刘备,而且 姜维 和 刘禅 的 CP 感觉 就是 在 延续 刘备 和 诸葛亮 呢 ！,姜维 人物一  感觉 延续 人物二 诸葛亮,-1
TRAIN_SENT_ID_276814,,唐姬,刘发,定王 ， 汉景帝 第十 子 刘发 ， 唐姬 所 生 ， 微无宠 ， 故封 王于 卑湿 贫国 长沙 ， 卒 谥定 。,定王  汉景帝 第十 子 人物二  人物一 生  微无宠  故封 王于 卑湿 贫国 长沙  卒 谥定,-1
TRAIN_SENT_ID_275025,,朱七七,沈浪,众人 叹 这 世间 也 就 你 沈浪 治得 住 这 令人 头大 的 朱七七 。,众人 叹 世间 人物二 治得 住 令人 头大 人物一,1
TRAIN_SENT_ID_281935,,贺捷生,贺龙,贺捷生 将军 ， 一切 皆 因 她 是 贺龙 的 女儿 文 / 苏容,人物一 将军  皆 人物二 女儿 文  苏容,-1
TRAIN_SENT_ID_266569,,许晋亨,李嘉欣,外界 曾 传言 ， 许晋亨 及其 家人 对于 李嘉欣 的 这种 表现 ， 嘴上 不 说 ， 但 心里 却 累积 了 不满 ， 造成 李嘉欣 嫁入 豪门 一波三折 。,外界 传言  人物一 家人 人物二 这种 表现  嘴上 说  心里 累积 不满  造成 人物二 嫁入 豪门 一波三折,1
TRAIN_SENT_ID_255159,,胡斐,胡一刀,二十六 ， 胡一刀 夫妇 遇难 ， 平阿四 救 走 胡斐 。,二十六  人物二 夫妇 遇难  平阿四 救 走 人物一,1
TRAIN_SENT_ID_275525,,杨炳莲,张平,逃跑 数月 后 ， 张平 让 杨炳莲 带 着 孩子 回娘家 或 张家 坨 。,逃跑 数月  人物二 人物一 带 孩子 回娘家 张家 坨,1
TRAIN_SENT_ID_278101,,乐安公主,巩永固,巩永固 是 崇祯 皇帝 的 妹夫 ， 乐安公主 的 驸马 。,人物二 崇祯 皇帝 妹夫  人物一 驸马,-1
TRAIN_SENT_ID_270881,,姜承,欧阳倩,在 姜承 离开 折剑 山庄 时 ， 欧阳倩 将 姜承 的 衣物 和 细软 打包 ， 让 浣 雪 偷偷 带给 姜承 。,人物一 离开 折剑 山庄 时  人物二 人物一 衣物 细软 打包  浣 雪 偷偷 带给 人物一,1
TRAIN_SENT_ID_274237,,岳雷,岳飞,牛通 人物 经历 : 岳飞 被害 后 ， 岳家 被 查抄 ， 牛通 前往 搭救 岳家 ， 在 七宝 镇 偶遇 岳雷 ， 结为 兄弟 。,牛通 人物 经历  人物二 被害  岳家 查抄  牛通 前往 搭救 岳家  七宝 镇 偶遇 人物一  结为 兄弟,-1
TRAIN_SENT_ID_268236,,王小利,李琳,《 幸福 的 我们 俩 》 是 王小利 、 李琳 演唱 的 一首 歌曲 。,幸福 俩  人物一  人物二 演唱 一首 歌曲,1
TRAIN_SENT_ID_283142,,班淑娴,何太冲,这么一来 ， 班淑娴 和 何太冲 才 知 他 已 在 不知不觉 间 被 张无忌 点 了 穴道 ， 心下 暗自 骇然 。,这么一来  人物一 人物二 知 不知不觉 间 张无忌 点 穴道  心下 暗自 骇然,1
TRAIN_SENT_ID_261464,,莫绍谦,慕咏飞,终于 ， 莫绍谦 发现 当年 莫家 危难 是 慕咏飞 一手 策划 ， 反击 慕家 。,终于  人物一 发现 当年 莫家 危难 人物二 一手 策划  反击 慕家,1
TRAIN_SENT_ID_271815,,阎婆惜,宋江,剧本 还 把 宋江 写成 一个 “ 混 ” 衙门 的 土豪 ， 阎婆惜 对 他 厌恶 ， 遂 和 张文远 有私 。,剧本 人物二 写成 一个  混  衙门 土豪  人物一 厌恶  遂 张文远 有私,1
TRAIN_SENT_ID_266098,,金正恩,高英姬,金正恩 有 一个 姨妈 ， 是 金正恩 生母 高英姬 的 妹妹 ， 名叫 高英淑 。,人物一 一个 姨妈  人物一 生母 人物二 妹妹  名叫 高英淑,-1
TRAIN_SENT_ID_252357,,江别鹤,江玉郎,江玉郎 角色 分析 : 别人 说 ， “ 你 要 明白 世间 的 奸诈 ， 去 结交 江别鹤 ； 你 要 懂得 可怕 的 忍耐 ， 去 认识 江玉郎 。 ”,人物二 角色 分析  说   明白 世间 奸诈  结交 人物一  懂得 可怕 忍耐  认识 人物二,1
TRAIN_SENT_ID_270769,,梁萧,花晓霜,此时 ， 柳莺莺 却 决定 成全 梁萧 、 花晓霜 ， 独自 黯然 离去 … …,柳莺莺 决定 成全 人物一  人物二  独自 黯然 离去,1
TRAIN_SENT_ID_275342,,潘巧云,杨雄,杨雄 醉 归 ， 潘巧云 及婢 迎儿 反诬 石秀 戏己 。,人物二 醉  人物一 及婢 迎儿 反诬 石秀 戏己,1
TRAIN_SENT_ID_275306,,潘巧云,杨雄,杨雄 醉 骂 潘巧云,人物二 醉 骂 人物一,1
