sent_id,sent_id,entity1,entity2,sent,processed_sent,human
TRAIN_SENT_ID_286982,,邹明皓,邹市明,邹明皓 ： 冉莹颖 与 邹市明 的 小儿子 ， 2013 年 8 月 18 日 出生 。,人物一  冉莹颖 人物二 小儿子   年  月  日 出生,-1
TRAIN_SENT_ID_260338,,穆桂英,杨宗保,张冬兰 州市 秦 剧团 《 穆桂英 大破 洪州 》 中饰 杨宗保,张冬兰 州市 秦 剧团  人物一 大破 洪州  中饰 人物二,-1
TRAIN_SENT_ID_272570,,秦沛,红薇,出身 电影 世家 ， 父亲 严化 是 著名 影星 ， 曾 和 周璇 、 李丽华 合演 影片 ； 母亲 红薇 也 是 著名演员 ； 兄弟 秦沛 、 尔 东升 皆 为 颇 有 成就 的 电影 人 。,出身 电影 世家  父亲 严化 著名 影星  周璇  李丽华 合演 影片  母亲 人物二 著名演员  兄弟 人物一  东升 皆 颇 成就 电影,-1
TRAIN_SENT_ID_284318,,薛葵,薛刚,（ 电视剧 《 隋唐 英雄 之 薛刚反唐 》 角色 ） : 薛刚 之妻 ， 薛葵 之母 。,电视剧  隋唐 英雄 人物二反唐  角色   人物二 之妻  人物一 之母,-1
TRAIN_SENT_ID_271850,,阎婆惜,宋江,宋江 对 女色 没有 多大 兴趣 ， 这 一点 在 宋江 对 阎婆惜 的 态度 上 可以 看得出 。,人物二 女色 没有 多大 兴趣  一点 人物二 人物一 态度 看得出,1
TRAIN_SENT_ID_282107,,黄现璠,刘丽华,（ 现代 学者 ） : 刘丽华 出 生于 名门 ， 系 中国 现代 民族学 奠基人 黄现璠 之妻 。,现代 学者   人物二 出 生于 名门  系 中国 现代 民族学 奠基人 人物一 之妻,-1
TRAIN_SENT_ID_284919,,邹兰芳,吴宓,是 邹兰芳 利用 了 他 的 性格 弱点 ， 利用 了 吴宓 多情善感 ， 喜欢 自己 女 学生 的 心理 ， 亦 或是 邹兰芳 设套 布阵 ， 捉弄 了 吴宓 ？,人物一 利用 性格 弱点  利用 人物二 多情善感  喜欢 女 学生 心理  人物一 设套 布阵  捉弄 人物二,1
TRAIN_SENT_ID_283956,,王难姑,胡青牛,蝶 谷医仙 胡青牛 与 爱妻 毒仙 王难姑 斗法 ， 服下 此毒 ， 幸得 张无忌 救治 而 愈 。,蝶 谷医仙 人物二 爱妻 毒仙 人物一 斗法  服下 此毒  幸得 张无忌 救治 愈,1
TRAIN_SENT_ID_262822,,熊美玲,林秋离,回到 家后 ， 林秋离 和 熊美玲 说 了 这件 事 ， 熊美玲 也 兴奋 地 答应 ， 然后 就 把 这件 事 搁置 起来 ， 等待 正式 约稿 了 就 写 。,回到 家后  人物二 人物一 说 这件 事  人物一 兴奋 答应  这件 事 搁置 起来  等待 正式 约稿 写,1
TRAIN_SENT_ID_278243,,武三通,武三娘,武三娘 人际关系 : 丈夫 ： 武三通 ， 南 丁岚 帝 （ 应该 是 南僧 ） 一灯大师 四大 弟子 之三 ， 渔樵 耕读 中 的 农夫 ， 原 是 大理 国 的 御林军 总管 。,人物二 人际关系  丈夫  人物一  南 丁岚 帝  应该 南僧  一灯大师 四大 弟子 之三  渔樵 耕读 中 农夫  原 大理 国 御林军 总管,-1
TRAIN_SENT_ID_282108,,黄现璠,刘丽华,刘丽华 出 生于 名门 ， 系 中国 现代 民族学 奠基人 黄现璠 之妻 。,人物二 出 生于 名门  系 中国 现代 民族学 奠基人 人物一 之妻,-1
TRAIN_SENT_ID_249383,,后稷,姜嫄,姜氏 宗族 家族 名人 : 姜嫄 传为 有 邰氏 之 女 ， 「 帝喾 」 妃 ， 周 始祖 后稷 之母 。,姜氏 宗族 家族 名人  人物二 传为 邰氏 女   帝喾  妃  周 始祖 人物一 之母,-1
TRAIN_SENT_ID_260067,,齐良迟,齐白石,继承 了 父亲 画 、 书 、 印 、 诗 ， 现年 80 高龄 的 齐良迟 ， 担任 着 北京市 齐白石 艺术 研究会 会长 、 辅仁 书画 研究会 会长 等 社会 职务 。,继承 父亲 画  书  印  诗  现年  高龄 人物一  担任 北京市 人物二 艺术 研究会 会长  辅仁 书画 研究会 会长 社会 职务,-1
TRAIN_SENT_ID_276873,,罗启锐,张婉婷,陈国新 、 刘伟强 、 张婉婷 、 罗启锐 、 黎应就 、 李百龄 、 林伟 伦 、 柳瑞雄 、 王日平 、 文隽 、 王晶 、 许鞍华 第 06 届 执委会 : 吴思远 、 陈欣健,陈国新  刘伟强  人物二  人物一  黎应就  李百龄  林伟 伦  柳瑞雄  王日平  文隽  王晶  许鞍华  届 执委会  吴思远  陈欣健,-1
TRAIN_SENT_ID_265147,,尤二姐,贾琏,贾琏 的 仆人 兴儿 对 尤二姐 介绍 自己 的 女主人 时 ， 哪怕 是 半句话 听 进去 了 ， 尤二姐 也 不会 死得 那么 惨 。,人物二 仆人 兴儿 人物一 介绍 女主人 时  半句话 听 进去  人物一 不会 死得 惨,1
TRAIN_SENT_ID_270325,,关平,关羽,树侧 曾建 关帝庙 ， 设 大殿 和 前殿 ， 供奉 关羽 、 周仓 、 关平 塑像 及其 战马 ， 每年 6 月 24 日为 香火 会 。,树侧 曾建 关帝庙  设 大殿 前殿  供奉 人物二  周仓  人物一 塑像 战马  每年  月  日为 香火 会,-1
TRAIN_SENT_ID_275673,,梁济,梁漱溟,他 出身 于 “ 世代 诗礼 仁宦 ” 家庭 ， 父亲 梁济 是 一位 颇 有 学问 的 儒家 之士 ， 梁漱溟 早年 深受 其 影响 。,出身  世代 诗礼 仁宦  家庭  父亲 人物一 一位 颇 学问 儒家 之士  人物二 早年 深受 影响,-1
TRAIN_SENT_ID_283119,,李英宰,韩智恩,在 《 浪漫 满屋 》 中 男主角 李英宰 ， 虽然 经常 呵斥 韩智恩 ， 但 发火 只是 为了 欲盖弥彰 、 掩饰 谎言 和 自己 的 不 恰当 之 处 ， 是 威而 不怒 的 类型 。,浪漫 满屋  中 男主角 人物一  经常 呵斥 人物二  发火 欲盖弥彰  掩饰 谎言 恰当 处  威而 不怒 类型,1
TRAIN_SENT_ID_271823,,阎婆惜,宋江,宋江 不 重 女色 ， 勉强 在 她 家中 留宿 一夜 ， 谁知 招文袋 中 的 书信 被 阎婆惜 发现 ， 她 一口咬定 宋江 暗通 梁山泊 ， 要 报官 。,人物二 重 女色  勉强 家中 留宿 一夜  招文袋 中 书信 人物一 发现  一口咬定 人物二 暗通 梁山泊  报官,1
TRAIN_SENT_ID_260072,,齐良迟,齐白石,"齐良迟 曾任 北京 文史 研究 馆 副馆长 , 北京 齐白石 艺术 研究会 会长 ， 中国 北京 湖社 画会 艺术 顾问 。",人物一 曾任 北京 文史 研究 馆 副馆长  北京 人物二 艺术 研究会 会长  中国 北京 湖社 画会 艺术 顾问,-1
TRAIN_SENT_ID_275335,,潘巧云,杨雄,杨雄 完完全全 是 个 正常 男人 ， 潘巧云 不光 勾搭 和尚 裴如海 成奸 ， 平日 还 风言风语 挑逗 石秀 这个 帅哥 。,人物二 完完全全 正常 男人  人物一 勾搭 和尚 裴如海 成奸  平日 风言风语 挑逗 石秀 帅哥,1
TRAIN_SENT_ID_258027,,黄睿靓,陈致中,吴淑真 家庭 情况 : 父亲 ： 吴昆 池 母亲 ： 吴王霞 长女 ： 陈幸妤 （ 夫 赵建铭 ） 次子 ： 陈致中 （ 妻 黄睿靓 ）,吴淑真 家庭 情况  父亲  吴昆 池 母亲  吴王霞 长女  陈幸妤  夫 赵建铭  次子  人物二  妻 人物一,-1
TRAIN_SENT_ID_253342,,姚明,姚沁蕾,姚沁蕾 是 著名 篮球 明星 姚明 和 叶莉 的 女儿 。,人物二 著名 篮球 明星 人物一 叶莉 女儿,-1
TRAIN_SENT_ID_276648,,陆展元,何沅君,显然 李莫愁 作恶 是 陆展元 、 何沅君 成亲 之后 的 事情 ， 和 电视剧 正好 相反 。,显然 李莫愁 作恶 人物一  人物二 成亲 之后 事情  电视剧 正好 相反,1
TRAIN_SENT_ID_271479,,钱基博,钱钟书,《 无锡 时期 的 钱基博 与 钱钟书 》 是 2004 年 上海 社会科学院 出版社 出版 的 图书 ， 作者 是 刘桂秋,无锡 时期 人物一 人物二   年 上海 社会科学院 出版社 出版 图书  作者 刘桂秋,-1
TRAIN_SENT_ID_253805,,申雪,赵宏博,赵宏博 更是 在 舞台 上 首度 开 嗓 ， 与 台湾 实力 唱 将 黄小琥 合作 ， 为 爱妻 申雪 献上 一曲 《 月亮代表 我 的 心 》 。,人物二 更是 舞台 首度 开 嗓  台湾 实力 唱 黄小琥 合作  爱妻 人物一 献上 一曲  月亮代表 心,1
TRAIN_SENT_ID_274346,,许夫人,许汉青,南宋 抗元 女将 南宋 兴化 籍 闽 广 招抚 使 陈文龙 之女 ， 南宋 后期 科举 进士 许汉青 之妻 ， 故 被 称为 许夫人 。,南宋 抗元 女将 南宋 兴化 籍 闽 广 招抚 陈文龙 之女  南宋 后期 科举 进士 人物二 之妻  称为 人物一,-1
TRAIN_SENT_ID_248888,,窦滔,苏蕙,据 现有 史料 ， 较具 规模 的 回文诗 作 ， 创始者 是 北朝 十六 国 初期 前秦 的 苏蕙 ， 因 怀念 其 被 流 贬 的 丈夫 窦滔 ， 特 作 “ 回文 旋图 诗 ” ， 《 晋书 ?,现有 史料  较具 规模 回文诗 作  创始者 北朝 十六 国 初期 前秦 人物二  怀念 流 贬 丈夫 人物一  特 作  回文 旋图 诗    晋书,-1
TRAIN_SENT_ID_282873,,王家仪,杜安伦,杜安伦 找到 自己 最 心仪 的 女孩 王家仪 ， 并 与 众人 和解 。,人物二 找到 心仪 女孩 人物一  众人 和解,1
TRAIN_SENT_ID_260024,,严英云,徐良,徐良 与 严英云 小两口子 厌倦 了 在 官府 和 江湖 中 那种 出生入死 的 生活 ， 就 准备 回老家 过 安稳 的 日子 。,人物二 人物一 小两口子 厌倦 官府 江湖 中 那种 出生入死 生活  准备 回老家 安稳 日子,1
TRAIN_SENT_ID_257286,,金蛇郎君,温仪,温仪 ─ ─ 石梁温 方山 独女 、 金蛇郎君 夏雪宜 未婚妻 、 青青 之母 ， 后 死 于 四叔 温方施 飞刀 之下 。,人物二 ─ ─ 石梁温 方山 独女  人物一 夏雪宜 未婚妻  青青 之母  死 四叔 温方施 飞刀 之下,-1
TRAIN_SENT_ID_276130,,许仙,许仕林,《 青蛇 外传 》 许仙 / 许仕林 （ 李铭顺 饰 ）,青蛇 外传  人物一  人物二  李铭顺 饰,1
TRAIN_SENT_ID_262406,,汪精卫,陈璧君,这次 ， 汪精卫 一反常态 ， 对 陈璧君 大 发脾气 ： “ 当年 你 逼死 了 方君瑛 ， 现在 又 想 逼死 施 小姐 ， 你 如果 再 这样 同 我 闹 ， 我 就 与 你 离婚 ！ ”,人物一 一反常态  人物二 发脾气   当年 逼死 方君瑛  现在 想 逼死 施 小姐  闹  离婚,1
TRAIN_SENT_ID_270742,,梁萧,花晓霜,儿孙 ： 花清渊 （ 孙 ） ， 凌霜君 （ 孙媳妇 ） ， 花 慕容 （ 孙女 ） ， 云殊 （ 孙女婿 ） ， 花晓霜 （ 曾孙女 ） ， 梁萧 （ 曾 孙女婿 ） ， 花镜圆 （ 曾孙 ）,儿孙  花清渊  孙   凌霜君  孙媳妇   花 慕容  孙女   云殊  孙女婿   人物二  曾孙女   人物一  孙女婿   花镜圆  曾孙,-1
TRAIN_SENT_ID_259536,,陆危楼,陆烟儿,陆烟儿 ， 是 由 金山 开发 运营 的 3D 武侠 角色扮演 网游 《 剑侠情缘 网络版 3 》 中一 NPC ， 系 来自 明教 的 圣女 ， 明教 教主 陆危楼 的 女儿 。,人物二  金山 开发 运营  武侠 角色扮演 网游  剑侠情缘 网络版   中一   系 明教 圣女  明教 教主 人物一 女儿,-1
TRAIN_SENT_ID_285383,,苏樱,江小鱼,3 剧情 设定 : 女主角 的 结局 : 和 江小鱼 与 花无缺 可能 有 结局 的 女主角 分别 有三人 ， 小鱼儿 是 苏樱 、 张菁 和 铁心兰 。,剧情 设定  女主角 结局  人物二 花无缺 可能 结局 女主角 有三人  小鱼儿 人物一  张菁 铁心兰,1
TRAIN_SENT_ID_264495,,吴健雄,袁家骝,朋友 评论 袁家骝 一贯 以 太太 为荣 ， 说 ： “ 不管 吴健雄 去 什么 场合 ， 拎 照相机 的 人 总是 袁先生 ！ ”,朋友 评论 人物二 一贯 太太 为荣  说   人物一 场合  拎 照相机 总是 袁先生,1
TRAIN_SENT_ID_276291,,岳灵珊,林平之,’ 令狐冲 一 怔 ， 万 想不到 林平之 毒手 杀妻 ， 岳灵珊 命 在 垂危 ， 竟然 还是 不能 忘情 于 他 。,令狐冲 怔  万 想不到 人物二 毒手 杀妻  人物一 命 垂危  竟然 不能 忘情,1
TRAIN_SENT_ID_283986,,杨意柳,石无忌,冷刚 告诉 石无忌 幻儿 其实 是 苏光 平 的 私生女 ， 是 不 受欢迎 的 烧火 丫头 杨意柳 。,冷刚 告诉 人物二 幻儿 其实 苏光 平 私生女  受欢迎 烧火 丫头 人物一,1
TRAIN_SENT_ID_274871,,晏几道,晏殊,二晏词 笺注 基本 信息 : 作者 : [ 宋 ] 晏殊 晏几道 / 张草纫 笺注,二晏词 笺注 基本 信息  作者   宋  人物二 人物一  张草纫 笺注,-1
TRAIN_SENT_ID_268505,,潘金莲,武大郎,武松 的 哥哥 武大郎 为人忠厚 ， 其妻 潘金莲 与 恶霸 西门庆 私通 将 武大 毒死 。,武松 哥哥 人物二 为人忠厚  其妻 人物一 恶霸 西门庆 私通 武大 毒死,1
TRAIN_SENT_ID_261999,,王明华,梅兰芳,随着 梅兰芳 渐渐 走红 收入 日增 ， 又 见 王明华 如此 能干 ， 梅雨田 便 放心 地 将 家里 银钱 往来 、 日常 用度 的 账目 交由 王明华 。,人物二 渐渐 走红 收入 日增  见 人物一 能干  梅雨田 便 放心 家里 银钱 往来  日常 用度 账目 交由 人物一,1
TRAIN_SENT_ID_268133,,樊梨花,薛丁山,最后 ， 樊梨花 率军出 寒江关 ， 与 薛丁山 的 唐军 汇合 ， 夫妻 一同 进军 西域 。,最后  人物一 率军出 寒江关  人物二 唐军 汇合  夫妻 一同 进军 西域,1
TRAIN_SENT_ID_279434,,琴清,项少龙,大结局 的 时候 ， 项少龙 一手 揽 着 琴清 ， 一手 揽 着 乌廷芳 ， 一道 彩虹 落 在 他们 手上 ， 正是 当日 项少龙 送给 善柔 的 那块 水晶 折射出 的 彩虹 。,大结局  人物二 一手 揽 人物一  一手 揽 乌廷芳  一道 彩虹 落 手上  当日 人物二 送给 善柔 那块 水晶 折射出 彩虹,1
TRAIN_SENT_ID_268086,,樊梨花,薛丁山,当年 ， 唐朝 大将 薛丁山 路经 寒江 关时 ， 被 樊梨花 率 大军 3 次 围困 ， 逼迫 成亲 ， 薛丁山 表面 应许 ， 继而 又 3 次 休婚 。,当年  唐朝 大将 人物二 路经 寒江 关时  人物一 率 大军  次 围困  逼迫 成亲  人物二 表面 应许   次 休婚,-1
TRAIN_SENT_ID_286368,,吴荷妮,白胜祖,该剧 讲述 了 IQ200 的 天才 白胜祖 和 喜欢 他 的 高中生 吴荷妮 不得已 变为 同居 关系 ， 从而 发生 在 他们 身上 的 浪漫爱情 故事 。,该剧 讲述  天才 人物二 喜欢 高中生 人物一 不得已 变为 同居 关系  发生 身上 浪漫爱情 故事,1
TRAIN_SENT_ID_282946,,诸葛果,诸葛亮,千钧一发 之际 ， 诸葛亮 之女 诸葛果 自 仙界 降临 ， 以 奇门 遁法 逆 天地 阴阳 ， 历史 被 重新 回溯 至 黄巾 乱起 之时 。,千钧一发 之际  人物二 之女 人物一 仙界 降临  奇门 遁法 逆 天地 阴阳  历史 重新 回溯 黄巾 乱起 之时,-1
TRAIN_SENT_ID_264690,,福伦,福尔康,3 剧情 介绍 : 昏倒 在 地 ， 被 大学士 福伦 之子 福尔康 （ 周杰 饰 ） 所救 。,剧情 介绍  昏倒  大学士 人物一 之子 人物二  周杰 饰  所救,-1
TRAIN_SENT_ID_266387,,蔡赟,王娜,而 在 王娜 送 的 生日礼物 里 ， 蔡赟 独爱 去年 生日 时 收到 的 一副 毛 线手套 。,人物二 送 生日礼物 里  人物一 独爱 去年 生日 时 收到 一副 毛 线手套,1
TRAIN_SENT_ID_283892,,管维立,喻宜萱,管维立 的 母亲 喻宜萱 （ 1909 ～ 2008 ） ， 中国 女高音 歌唱家 、 声乐 教育家 、 中央音乐学院 副 院长 、 教授 兼 声乐系 主任 。,人物一 母亲 人物二       中国 女高音 歌唱家  声乐 教育家  中央音乐学院 副 院长  教授 兼 声乐系 主任,-1
TRAIN_SENT_ID_266940,,关索,关羽,4 民间传说 : 在 澄江 的 民间 ， 流传 着 李恢 的 儿子 李遗 迎娶 了 关索 之妹 、 关羽 之女 关银屏 的 传说 。,民间传说  澄江 民间  流传 李恢 儿子 李遗 迎娶 人物一 之妹  人物二 之女 关银屏 传说,-1
TRAIN_SENT_ID_248908,,阮星竹,段正淳,张译木 饰演 的 “ 阮星竹 ” 因为 情郎 段正淳 而 死 在 慕容复 的 长剑 之下 。,张译木 饰演  人物一  情郎 人物二 死 慕容复 长剑 之下,1
TRAIN_SENT_ID_265744,,孙元,孙二娘,几年 后 ， 孙元 病故 ， 张青 、 孙二娘 夫妻 二人 重回 光明 寺 居住 。,几年  人物一 病故  张青  人物二 夫妻 二人 重回 光明 寺 居住,1
TRAIN_SENT_ID_270968,,梁思成,梁启超,然而 ， 她 最终 成 了 维新派 首领 梁启超 大 公子 梁思成 的 夫人 。,最终 成 维新派 首领 人物二 公子 人物一 夫人,1
TRAIN_SENT_ID_286597,,王龙,蒋依杉,蒋依杉 与 王龙 在 戏里 为 爱 赴死 ， 却 在 平淡 现实 中将 爱情 进行 到底 。,人物二 人物一 戏里 爱 赴死  平淡 现实 中将 爱情 进行 到底,1
TRAIN_SENT_ID_281922,,贺捷生,贺龙,贺龙 的 女儿 贺捷生 将军 、 著名 学者 于丹 、 中央 著名 电视 主持人 石琼璘 等 对 黑玫瑰 赞赏 有加 。,人物二 女儿 人物一 将军  著名 学者 于丹  中央 著名 电视 主持人 石琼璘 黑玫瑰 赞赏 有加,-1
TRAIN_SENT_ID_274670,,傅敏,傅雷,许多 人 都 知道 著名 翻译家 傅雷 和 他 的 长子 、 著名 钢琴家 傅聪 ， 对 这个 家族 的 另 一个 成员 傅敏 却 知之甚少 。,知道 著名 翻译家 人物二 长子  著名 钢琴家 傅聪  家族 一个 成员 人物一 知之甚少,-1
TRAIN_SENT_ID_283556,,何启佳,何仕文,施娣 为 何仕文 生下 1 女 4 子 从 长幼 顺序排列 ： 何 柏颜 ( 女 ) 、 何 启东 、 何启福 、 何启 满 、 何启佳 ( 第 6 子 ) 。,施娣 人物二 生下  女  子 长幼 顺序排列  柏颜  女   启东  何启福  何启 满  人物一   子,-1
TRAIN_SENT_ID_255626,,蒋介石,宋美龄,最后 的 皇后 ： 蒋介石 夫人 与 现代 中国 的 诞生 内容简介 : 宋美龄 这个 名字 可谓 家喻户晓 ， 她 在 中国 历史 上 ， 堪称 是 位 传奇 的 女性 。,最后 皇后  人物一 夫人 现代 中国 诞生 内容简介  人物二 名字 可谓 家喻户晓  中国 历史  堪称 位 传奇 女性,-1
TRAIN_SENT_ID_263528,,梅葆玖,梅兰芳,2013 年 9 月 19 日拜 著名 京剧 大师 梅兰芳 先生 之子 梅葆玖 先生 为师 ， 成为 梅葆玖 先生 第 38 位 弟子 ， 传承 梅派 。,年  月  日拜 著名 京剧 大师 人物二 先生 之子 人物一 先生 为师  成为 人物一 先生  位 弟子  传承 梅派,-1
TRAIN_SENT_ID_268679,,孔子,颜徵在,夫子 洞 ， 又名 坤 灵洞 ， 天然 石室 ， 位于 尼山 孔庙 东南 崖 下 ， 相传 孔子 的 母亲 颜徵在 曾 祈祷 于尼丘 山而生 孔子 。,夫子 洞  又名 坤 灵洞  天然 石室  位于 尼山 孔庙 东南 崖  相传 人物一 母亲 人物二 祈祷 于尼丘 山而生 人物一,-1
TRAIN_SENT_ID_258980,,王熙凤,贾琏,2 成语故事 : 贾琏 的 女儿 生病 ， 他 离开 王熙凤 独居 ， 但 寂寞 难奈 。,成语故事  人物二 女儿 生病  离开 人物一 独居  寂寞 难奈,1
TRAIN_SENT_ID_286588,,诸葛京,诸葛瞻,诸葛瞻 ， 妻 待考 ， 生 三子 ： 长子 诸葛尚 、 次子 诸葛京 、 三子 诸葛质 。,人物二  妻 待考  生 三子  长子 诸葛尚  次子 人物一  三子 诸葛质,-1
TRAIN_SENT_ID_269328,,陆雪琪,张小凡,而 在 青云山 上 ， 还有 一直 苦恋 张小凡 的 青云 女弟子 陆雪琪 ， 承受 着 师门 的 压力 。,青云山  一直 苦恋 人物二 青云 女弟子 人物一  承受 师门 压力,1
TRAIN_SENT_ID_259219,,刘备,刘禅,"蜀国 大帝 内容简介 : 以 三国演义 为 背景 , 现代人 穿越 三国 时空 , 以 刘备 之子 刘禅 的 角度 改变 三国 进程 , 强大 蜀国 统一 中国 … …",蜀国 大帝 内容简介  三国演义 背景  现代人 穿越 三国 时空  人物一 之子 人物二 角度 改变 三国 进程  强大 蜀国 统一 中国,-1
TRAIN_SENT_ID_276298,,岳灵珊,林平之,是 性情 相近 还是 林平之 长得 英俊 ， 不必 深究 ， 但 岳灵珊 对 林平之 的 爱情 却是 始终如一 、 坚贞 不悔 。,性情 相近 人物二 长得 英俊  不必 深究  人物一 人物二 爱情 却是 始终如一  坚贞 不悔,1
TRAIN_SENT_ID_272463,,包惜弱,杨铁心,不料 丘处机 为 两家 人 招来 杀身之祸 ， 郭啸天 身亡 ， 杨铁心 重伤 ， 妻子 包惜弱 被 掳走 。,丘处机 两家 招来 杀身之祸  郭啸天 身亡  人物二 重伤  妻子 人物一 掳走,1
TRAIN_SENT_ID_283155,,班淑娴,何太冲,随后 何太冲 设宴款待 ， 但是 宴席 上 的 酒 却 被 何太冲 的 妻子 班淑娴 下 了 毒 并 逼迫 无忌 喝 下 。,人物二 设宴款待  宴席 酒 人物二 妻子 人物一 毒 逼迫 无忌 喝,1
TRAIN_SENT_ID_258601,,刘禅,刘备,刘源明 刘永 （ 刘氏 回 河南 始祖 ） : 刘永 ， 字公寿 ， 涿郡 涿县 （ 今 河北 涿州 ） 人 ， 蜀 汉昭烈 帝 刘备 之子 ， 蜀汉 后主 刘禅 之弟 。,刘源明 刘永  刘氏 回 河南 始祖   刘永  字公寿  涿郡 涿县  河北 涿州   蜀 汉昭烈 帝 人物二 之子  蜀汉 后主 人物一 之弟,-1
TRAIN_SENT_ID_261185,,赵本山,赵一涵,又 出新 消息 ， 赵本山 的 女儿 赵一涵 已 报名 日本 女子 天团 AKB48 的 中国 姐妹 团 SNH48 招募 活动 。,出新 消息  人物一 女儿 人物二 报名 日本 女子 天团  中国 姐妹 团  招募 活动,-1
TRAIN_SENT_ID_261457,,莫绍谦,慕咏飞,"慕咏飞 被 莫绍谦 对 童雪 的 真爱 刺激 得 精神 崩溃 , 绝望 地 在 离婚 协议书 上 签 了 字 。",人物二 人物一 童雪 真爱 刺激 精神 崩溃  绝望 离婚 协议书 签 字,1
TRAIN_SENT_ID_271402,,杨云,杨威,当时 杨威 确实 做 了 “ 蓄谋已久 ” 的 准备 ， 他 的 想法 是 两人先 接触 ， 先 培养感情 ， 等 杨云 长大 后 再说 爱情 。,当时 人物二 确实 做  蓄谋已久  准备  想法 两人先 接触  先 培养感情  人物一 长大 爱情,1
TRAIN_SENT_ID_272434,,包惜弱,杨铁心,后来 杨铁心 妻子 包惜弱 救 下 奄奄一息 的 完颜洪烈 。,后来 人物二 妻子 人物一 救 奄奄一息 完颜洪烈,1
TRAIN_SENT_ID_276103,,陈三立,陈宝箴,近现代 陈宝箴 一门 四杰 （ 长子 陈三立 、 三立 长子 三子 陈衡 恪 、 陈寅恪 ） 蜚声 海内外 。,近现代 人物二 一门 四杰  长子 人物一  三立 长子 三子 陈衡 恪  陈寅恪  蜚声 海内外,-1
TRAIN_SENT_ID_278376,,荀庚,荀林父,在 荀林父 死后 ， 其子 荀庚 直接 将 下军 ， 其余 诸卿 地位 依次 提升 ， 惟独 栾书 稳居 下军佐 一职 ， 就 这样 栾书 再度 被 当权派 “ 遗忘 ” 。,人物二 死后  其子 人物一 直接 下军  诸卿 地位 依次 提升  惟独 栾书 稳居 下军佐 一职  栾书 再度 当权派  遗忘,-1
TRAIN_SENT_ID_286268,,黄琪翔,郭秀仪,相关 消息 : 《 流金岁月 — — 黄琪翔 、 郭秀仪 夫妇 生平 专题 展 》 、 《 纪念 邱哲 — — 邱哲 生平 专题 展 》 在 中国 民主党派 历史 展会 现场 ( 2 张 ),相关 消息   流金岁月   人物一  人物二 夫妇 生平 专题 展    纪念 邱哲   邱哲 生平 专题 展  中国 民主党派 历史 展会 现场   张,-1
TRAIN_SENT_ID_283552,,何启佳,何仕文,施娣 为 何仕文 生下 1 女 4 子 （ 长幼 顺序排列 ） ： 何 柏颜 ( 女 ) 、 何 启东 、 何启福 、 何启 满 、 何启佳 ( 施娣 第 6 个 孩子 ) 。,施娣 人物二 生下  女  子  长幼 顺序排列   柏颜  女   启东  何启福  何启 满  人物一  施娣  孩子,-1
TRAIN_SENT_ID_286073,,金敬姬,金日成,金正恩 的 爷爷 金日成 有过 两任 妻子 ， 第一任 妻子 金正淑 ， 生有 两子 一女 ： 金正日 、 金 万一 、 金敬姬 。,金正恩 爷爷 人物二 有过 两任 妻子  第一任 妻子 金正淑  生有 两子 一女  金正日  金  人物一,-1
TRAIN_SENT_ID_282805,,黄兰次,洪升,洪升 小 的 时候 常 和 自己 的 表妹 、 黄机 的 孙女 黄蕙 （ 黄兰次 ） 一同 游戏 ， 两人 青梅竹马 ， 彼此 非常 融洽 。,人物二 常 表妹  黄机 孙女 黄蕙  人物一  一同 游戏  两人 青梅竹马  非常 融洽,1
TRAIN_SENT_ID_259042,,刘备,刘禅,刘禅 ： 三国 时 蜀 后主 ， 小名 阿斗 ， 刘备 之子 ， 公元 223 年 至 263 年 在位 。,人物二  三国 时 蜀 后主  小名 阿斗  人物一 之子  公元  年  年 在位,-1
TRAIN_SENT_ID_253572,,沈浪,朱七七,有人 说 ， 沈浪 的 情人 朱七七 是 古龙 笔下 最受 宠爱 的 女子 ， 但 我 却 认为 沈浪 才 是 古龙 赋予 最 多 心血 与 情感 的 人物 。,有人 说  人物一 情人 人物二 古龙 笔下 最受 宠爱 女子  认为 人物一 古龙 赋予 心血 情感 人物,-1
TRAIN_SENT_ID_258951,,王熙凤,贾琏,3 成语故事 : 贾琏 的 女儿 生病 ， 他 离开 王熙凤 独居 寂寞 难奈 。,成语故事  人物二 女儿 生病  离开 人物一 独居 寂寞 难奈,1
TRAIN_SENT_ID_272644,,白先勇,白崇禧,白崇禧 之子 、 台湾 著名作家 白先勇 米粉 ， 几年 前 回到 桂林 故乡 ， 也 是 特别 喜欢 吃 米粉 ， 当 他 即将 离开 桂林 时 ， 一餐 竟 连 吃 了 三碗 … …,人物二 之子  台湾 著名作家 人物一 米粉  几年 前 回到 桂林 故乡  特别 喜欢 吃 米粉  即将 离开 桂林 时  一餐 竟 吃 三碗,-1
TRAIN_SENT_ID_279602,,晏紫,李圣根,李圣根 ： 信义 玻璃 控股 有限公司 执行 董事 、 李贤义 之子 、 中国 女子 职业 网球员 晏紫 之 丈夫,人物二  信义 玻璃 控股 有限公司 执行 董事  李贤义 之子  中国 女子 职业 网球员 人物一 丈夫,-1
