sent_id,sent_id,entity1,entity2,sent,processed_sent,human
TRAIN_SENT_ID_251747,,顾倩兮,卢云,景泰 三十一年 早春 ， 顾倩兮 重遇 卢云 。,景泰 三十一年 早春  人物一 重遇 人物二,1
TRAIN_SENT_ID_286745,,孙国升,孙治强,孙治强 离婚 后 ， 与 林伦 可 结婚 ， 连得 两子 孙国元 、 孙国升 。,人物二 离婚  林伦 结婚  连得 两子 孙国元  人物一,-1
TRAIN_SENT_ID_271064,,彭丽媛,习近平,3 月 24 日 ， 习近平 主席 与 夫人 彭丽媛 抵达 坦桑尼亚 达累斯萨拉姆 市 国际 机场 。,月  日  人物二 主席 夫人 人物一 抵达 坦桑尼亚 达累斯萨拉姆 市 国际 机场,1
TRAIN_SENT_ID_273462,,凌操,凌统,6 凌操 ， 凌统 登场 （ 孙策 军 ）,人物一  人物二 登场  孙策 军,-1
TRAIN_SENT_ID_260646,,李莎,李立三,异国 奇情 坎坷路 — — 李莎 · 李立三,异国 奇情 坎坷路   人物一  人物二,1
TRAIN_SENT_ID_278714,,叶一茜,田亮,精灵 奇缘 乐曲 内容 : 田亮 叶一茜 田雨 橙 《 精灵 奇缘 》 歌词 ( 电影 《 捉妖 记 》 宣传 曲 ),精灵 奇缘 乐曲 内容  人物二 人物一 田雨 橙  精灵 奇缘  歌词  电影  捉妖 记  宣传 曲,1
TRAIN_SENT_ID_272725,,徐天宏,周绮,武 诸葛 变成 了 傻 女婿 ， 又 是 一桩 徐天宏 和 周绮 2 美事 趣事 。,武 诸葛 变成 傻 女婿  一桩 人物一 人物二  美事 趣事,1
TRAIN_SENT_ID_254074,,林黛羽,俞佩玉,后 林黛羽 击退 了 几个 追杀 俞佩玉 的 黑衣人 ， 救 了 俞佩玉 并 叫 他 不要 再 叫 俞佩玉 。,人物一 击退 几个 追杀 人物二 黑衣人  救 人物二 不要 人物二,1
TRAIN_SENT_ID_252268,,秦嘉,徐淑,答 秦嘉 诗 作者简介 : 徐淑 ， 东汉 女诗人 。,答 人物一 诗 作者简介  人物二  东汉 女诗人,1
TRAIN_SENT_ID_270486,,关平,关羽,后 因 荆州 失守 ， 关羽 与 长子 关平 败走麦城 ， 关银屏 怀着 为父 报仇 、 为国 雪恨 的 宿愿 逃 到 成都 ， 留在 刘备 身边 。,荆州 失守  人物二 长子 人物一 败走麦城  关银屏 怀着 为父 报仇  为国 雪恨 宿愿 逃 成都  留在 刘备 身边,-1
TRAIN_SENT_ID_258329,,陈建斌,蒋勤勤,陈建斌 与 蒋勤勤 ， 将 老夫老妻 一词 诠释 得 淋漓尽致 。,人物一 人物二  老夫老妻 一词 诠释 淋漓尽致,1
TRAIN_SENT_ID_254328,,左蓝,余则成,左蓝 是 余则成 真正 的 恋人 。,人物一 人物二 真正 恋人,1
TRAIN_SENT_ID_270883,,贾午,韩寿,赵粲 、 贾午 、 韩寿 、 董猛 等 皆 伏诛 。,赵粲  人物一  人物二  董猛 皆 伏诛,1
TRAIN_SENT_ID_275331,,潘巧云,杨雄,无斋 主人 以为 杨雄 的 老婆 潘巧云 应该 算是 水浒 上 第一 大 淫妇 。,无斋 主人 人物二 老婆 人物一 应该 算是 水浒 第一 淫妇,1
TRAIN_SENT_ID_253785,,申雪,赵宏博,申雪 、 赵宏博 这 对 新婚 不久 的 冰上 情侣 ， 为 奥运 梦想 整整 奋斗 了 15 年 。,人物一  人物二 新婚 不久 冰上 情侣  奥运 梦想 整整 奋斗  年,1
TRAIN_SENT_ID_275995,,贾午,贾充,贾午 ， 贾充 幼女 ， 嫁 韩寿 。,人物一  人物二 幼女  嫁 韩寿,-1
TRAIN_SENT_ID_263008,,熊美玲,林秋离,No.93 挺 我 的 那个 人 （ 台语 ） 林秋离 熊美玲 萧 博文,挺  台语  人物二 人物一 萧 博文,1
TRAIN_SENT_ID_267030,,浦在廷,卓琳,浦 琼英 （ 卓琳 ） ： （ 1916 - 2009 ） ， 著名 的 民族 实业家 浦在廷 之女 ， 邓小平 夫人 。,浦 琼英  人物二         著名 民族 实业家 人物一 之女  邓小平 夫人,-1
TRAIN_SENT_ID_256150,,蒋介石,宋美龄,文昌阁 一楼 为 会客室 ， 二楼 是 蒋介石 、 宋美龄 的 卧室 和 起居室 。,文昌阁 一楼 会客室  二楼 人物一  人物二 卧室 起居室,1
TRAIN_SENT_ID_270643,,赵宏博,申雪,个人资料 : 赵宏博 与 申雪 最 喜欢 的 电影 ： 《 逃跑 的 新娘 》 、 《 绝世 天劫 》,个人资料  人物一 人物二 喜欢 电影   逃跑 新娘    绝世 天劫,1
TRAIN_SENT_ID_278679,,叶一茜,田亮,20110528 “ 金童玉女 ” 田亮 、 叶一茜,金童玉女  人物二  人物一,1
TRAIN_SENT_ID_283839,,连丽如,连阔如,连丽如 女士 亲临现场 签名 售书 ， 并 加盖 连阔如 生前 所用 印章 ， 以作 纪念 。,人物一 女士 亲临现场 签名 售书  加盖 人物二 生前 所用 印章  以作 纪念,-1
TRAIN_SENT_ID_260033,,严英云,徐良,由于 严英云 年轻漂亮 ， 没过多久 ， 莲花 观 下院 观主 郭善 达 又 企图 强暴 严英云 ， 徐良 又 救 了 她 。,人物一 年轻漂亮  没过多久  莲花 观 下院 观主 郭善 达 企图 强暴 人物一  人物二 救,1
TRAIN_SENT_ID_263297,,胡亥,秦始皇,秦始皇 死后 ， 秦二世 胡亥 昏庸无道 。,人物二 死后  秦二世 人物一 昏庸无道,-1
TRAIN_SENT_ID_281680,,蒋韵,李锐,作家 ： 马锋 、 西戎 、 笛安 、 蒋韵 、 李锐,作家  马锋  西戎  笛安  人物一  人物二,1
TRAIN_SENT_ID_265619,,袁泉,夏雨,《 上海 伦巴 》 情人节 起舞 明星 情侣 夏雨 袁泉 联袂,上海 伦巴  情人节 起舞 明星 情侣 人物二 人物一 联袂,1
TRAIN_SENT_ID_283132,,曹克让,赵金香,曹克让 人物 家族 : 镇西 侯 曹克让 ； 妻子 ： 赵金香 ( 双花 公主 ) ， 曹克让 兄 ： 曹克恭 ；,人物一 人物 家族  镇西 侯 人物一  妻子  人物二  双花 公主   人物一 兄  曹克恭,1
TRAIN_SENT_ID_251291,,廖仲恺,何香凝,廖仲恺 在 早稻田大学 预科 政治 科 学习 ， 何香凝 则 就读于 东京 目白 女子 大学 。,人物一 早稻田大学 预科 政治 科 学习  人物二 就读于 东京 目白 女子 大学,1
TRAIN_SENT_ID_286891,,司马三娘,燕赤霞,于是 燕赤霞 和 司马三娘 绝迹 江湖 ， 不知去向 。,人物二 人物一 绝迹 江湖  不知去向,1
TRAIN_SENT_ID_283602,,艾慧,冯巩,艾慧 婚姻家庭 : 冯巩 与 老婆 艾慧 资料 图,人物一 婚姻家庭  人物二 老婆 人物一 资料 图,1
TRAIN_SENT_ID_276541,,孔子,亓官氏,亓官氏 ， 又 作 丌 官氏 ， 礼器 碑作 并 官氏 ， 春秋时期 宋国 （ 今 河南 商丘 ） 人 ， 孔子 夫人 。,人物二  作 丌 官氏  礼器 碑作 官氏  春秋时期 宋国  河南 商丘   人物一 夫人,1
TRAIN_SENT_ID_279073,,公孙绿萼,裘千尺,公孙绿萼 半枚 灵丹 : 绝情谷 大厅 被 慈恩 误认为 裘千尺 。,人物一 半枚 灵丹  绝情谷 大厅 慈恩 误认为 人物二,-1
TRAIN_SENT_ID_262714,,杨不悔,纪晓芙,纪晓芙 惨死 灭绝 手下 ， 临终前 将 杨不悔 托付 于 张无忌 ， 恳请 他 送 杨不悔 去 昆仑山 找 她 的 父亲 杨逍 。,人物二 惨死 灭绝 手下  临终前 人物一 托付 张无忌  恳请 送 人物一 昆仑山 找 父亲 杨逍,-1
TRAIN_SENT_ID_279539,,李芳远,李成桂,李成桂 的 五子 李芳远 在 帮助 李成桂 登基 中 贡献 是 最大 的 。,人物二 五子 人物一 帮助 人物二 登基 中 贡献 最大,-1
TRAIN_SENT_ID_264464,,吴健雄,袁家骝,周恩来 的 广博 见识 和 一流 政治家 气度 ， 使 吴健雄 和 袁家骝 一直 津津乐道 ， 钦佩 不已 。,周恩来 广博 见识 一流 政治家 气度  人物一 人物二 一直 津津乐道  钦佩 不已,1
TRAIN_SENT_ID_255980,,蒋介石,宋美龄,蒋介石 和 宋美龄 当然 是 日本 人早 欲 除掉 的 人物 了 。,人物一 人物二 日本 人早 欲 除掉 人物,1
TRAIN_SENT_ID_263816,,刘嘉玲,梁朝伟,新郎 ： 1984 年 TVB 版 鹿鼎记 韦小宝 － 梁朝伟 新娘 ： 1984 年 TVB 版 鹿鼎记 方怡 － － 刘嘉玲,新郎   年  版 鹿鼎记 韦小宝  人物二 新娘   年  版 鹿鼎记 方怡   人物一,1
TRAIN_SENT_ID_284312,,薛葵,薛刚,（ 薛葵 取 镜子 和 薛刚 同照 。 ）,人物一 取 镜子 人物二 同照,-1
TRAIN_SENT_ID_255940,,蒋介石,宋美龄,第 29 节 ： 抗日战争 ： 从 蒋介石 宋美龄 的 联姻 开始 ( 1 ),节  抗日战争  人物一 人物二 联姻,1
TRAIN_SENT_ID_263615,,叶莉,姚明,绝望 时 ， 姚明 给 了 她 力量 ， 他 一边 鼓励 叶莉 ， 一边 找到 东方 女篮 俱乐部 的 领导 ， 请求 让 叶莉 去 美国 疗伤 。,绝望 时  人物二 力量  一边 鼓励 人物一  一边 找到 东方 女篮 俱乐部 领导  请求 人物一 美国 疗伤,1
TRAIN_SENT_ID_257845,,王安忆,茹志鹃,走向 盛年 — — 《 茹志鹃 日记 》 序 — — 王安忆,走向 盛年    人物二 日记  序   人物一,-1
TRAIN_SENT_ID_287129,,慕容柔,慕容垂,慕容垂 的 一些 爱姬 生子 有 慕容麟 、 慕容农 、 慕容隆 、 慕容柔 、 慕容熙 等 ， 慕容隆 就是 其中 之一 。,人物二 爱姬 生子 慕容麟  慕容农  慕容隆  人物一  慕容熙  慕容隆,-1
TRAIN_SENT_ID_255795,,蒋介石,宋美龄,蒋介石 宋美龄,人物一 人物二,1
TRAIN_SENT_ID_260231,,穆桂英,杨宗保,木阁 寨 寨主 的 女儿 穆桂英 武功 高强 ， 见 杨宗保 要 降龙木 ， 大战 几十回 合并 活捉 他 ， 顿时 爱上 这个 少年 ， 觉得 他们 才 是 真正 的 天生一对 。,木阁 寨 寨主 女儿 人物一 武功 高强  见 人物二 降龙木  大战 几十回 合并 活捉  顿时 爱上 少年  觉得 真正 天生一对,1
TRAIN_SENT_ID_262349,,汪精卫,陈璧君,这 以后 ， 陈璧君 提议 在 汪精卫 办公室 设 机要秘书 数 人 ， 由 她 的 侄子 和 五弟 负责 ， 监视 汪精卫 的 私生活 。,以后  人物二 提议 人物一 办公室 设 机要秘书 数  侄子 五弟 负责  监视 人物一 私生活,1
TRAIN_SENT_ID_258326,,陈建斌,蒋勤勤,苏有朋 称 刘诗 诗 “ 嫂子 ” 陈建斌 二导 作品 不 排除 与 蒋勤勤 合作,苏有朋 称 刘诗 诗  嫂子  人物一 二导 作品 排除 人物二 合作,1
TRAIN_SENT_ID_268644,,潘金莲,武大郎,非但 如此 ， 就 连 武大郎 的 老婆 潘金莲 也 遭受 被辱 之 株连 。,人物二 老婆 人物一 遭受 被辱 株连,1
TRAIN_SENT_ID_258387,,张兆和,沈从文,与 妻子 于立群 及 子女 1940 年 与 友人 沈从文 、 肖珊 、 张兆和 、 王树 藏 等 在 昆明 西山 。,妻子 于立群 子女  年 友人 人物二  肖珊  人物一  王树 藏 昆明 西山,1
TRAIN_SENT_ID_274045,,白素,卫斯理,三 、 卫斯理 . 白素 . 其他 四 、 寻梦 五 、 眼睛 六 、 无名 髮 七 、 第二种 人八 、 连锁 后记,三  人物二  人物一  四  寻梦 五  眼睛 六  无名 髮 七  第二种 人八  连锁 后记,1
TRAIN_SENT_ID_262961,,熊美玲,林秋离,No.80 卸妆 林秋离 熊美玲 熊美玲,卸妆 人物二 人物一 人物一,1
TRAIN_SENT_ID_278713,,叶一茜,田亮,奥运冠军 田亮 献出 MV 处子秀 ， 与 娇妻 叶一茜 厨房 内 亲密 相拥 ， 除此之外 更 有 宝贝女儿 特别 献声 ， 让 整支 MV 可看性 十足 。,奥运冠军 人物二 献出  处子秀  娇妻 人物一 厨房 亲密 相拥  更 宝贝女儿 特别 献声  整支  可看性 十足,1
TRAIN_SENT_ID_268104,,樊梨花,薛丁山,第十七回 痴情女 沉浸 新婚夜 薛丁山 一打 樊梨花,第十七回 痴情女 沉浸 新婚夜 人物二 一打 人物一,1
TRAIN_SENT_ID_276170,,苏蕙,窦滔,晋 窦滔 妻 苏蕙 字若兰 ， 善属文 。,晋 人物二 妻 人物一 字若兰  善属文,1
TRAIN_SENT_ID_277066,,龙非离,年璇玑,年璇玑 与 龙非离,人物二 人物一,1
TRAIN_SENT_ID_274820,,丁玲,胡也频,第二章 丁玲 Vs 胡也频 ： “ 过家家 ” 似的 小 夫妻,第二章 人物一  人物二   过家家  夫妻,1
TRAIN_SENT_ID_278263,,王珂,刘涛,王珂 家庭 关系 : 王珂 妻子 刘涛 : 刘涛 ， 内地 著名 女演员 。,人物一 家庭 关系  人物一 妻子 人物二  人物二  内地 著名 女演员,1
TRAIN_SENT_ID_283880,,王小平,郑晓龙,王小平 ， 中国 著名作家 ， 著名 导演 郑晓龙 之妻 。,人物一  中国 著名作家  著名 导演 人物二 之妻,1
TRAIN_SENT_ID_249441,,后稷,姜嫄,由于 来历不明 ， 姜嫄 一度 想 把 他 抛弃 ， 所以 后稷 最早 的 名字 叫做 “ 弃 ” 。,来历不明  人物二 一度 想 抛弃  人物一 最早 名字 叫做  弃,-1
TRAIN_SENT_ID_285548,,武青婴,武烈,后代 ： 武烈 ， 武青婴,后代  人物二  人物一,-1
TRAIN_SENT_ID_260058,,齐良迟,齐白石,著名 书画 篆刻家 ， 齐派 艺术 代表 人物 之一 ， 为 齐白石 四子 齐良迟 入室弟子 。,著名 书画 篆刻家  齐派 艺术 代表 人物  人物二 四子 人物一 入室弟子,-1
TRAIN_SENT_ID_256809,,朱军,谭梅,朱军 谭梅 的 三个 任务 是 滑翔伞 ， 背 法语 ， 开 飞机 。,人物一 人物二 三个 任务 滑翔伞  背 法语  开 飞机,1
TRAIN_SENT_ID_264983,,刘星,刘梅,晚上 ， 刘梅 以为 刘星 的 明星 梦 总算 醒 了 ， 这时 ， 鼠标 的 妈妈 找上门来 ， 鼠标 刚买 的 一件 白色 T恤衫 ， 上面 横七竖八 全是 刘星 的 签名 。,晚上  人物二 人物一 明星 梦 总算 醒   鼠标 妈妈 找上门来  鼠标 刚买 一件 白色 恤衫  上面 横七竖八 全是 人物一 签名,-1
TRAIN_SENT_ID_276605,,韩寒,金丽华,韩寒 与 金丽华 的 女儿 出生 后 ， 果然 叫 韩小野 。,人物一 人物二 女儿 出生  韩小野,1
TRAIN_SENT_ID_270871,,姜承,欧阳倩,萧 长风 ： 欧阳 世家 的 大 弟子 ， 喜欢 二 小姐 欧阳倩 ， 与 姜承 素有 嫌隙 。,萧 长风  欧阳 世家 弟子  喜欢 二 小姐 人物二  人物一 素有 嫌隙,1
TRAIN_SENT_ID_270900,,贾午,韩寿,韩寿 劲捷 过 人 ， 夜半三更 ， 就 越墙 来到 贾午 的 闺房 相会 。,人物二 劲捷  夜半三更  越墙 来到 人物一 闺房 相会,1
TRAIN_SENT_ID_274767,,韩淑秀,郭松龄,他 将 此 想法 向 郭松龄 夫人 韩淑秀 讲 了 ， 韩淑秀 很 是 赞成 ， 应允 为 之 赞助 。,想法 人物二 夫人 人物一 讲  人物一 赞成  应允 赞助,1
TRAIN_SENT_ID_253601,,沈浪,朱七七,在 快活 王 的 行宫 附近 ， 面对 相见 时 朱七七 的 冷漠 ， 沈浪 心神恍惚 险为 龙 四海 所害 。,快活 王 行宫 附近  面对 相见 时 人物二 冷漠  人物一 心神恍惚 险为 龙 四海 所害,1
TRAIN_SENT_ID_285843,,张信儿,张晋,张信儿 ， 蔡少芬 和 张晋 的 二女儿 。,人物一  蔡少芬 人物二 二女儿,-1
TRAIN_SENT_ID_269987,,姚明,叶莉,1999 年 是 属于 姚明 和 叶莉 的 年份 。,年 属于 人物一 人物二 年份,1
TRAIN_SENT_ID_256128,,蒋介石,宋美龄,汽车 可 直抵 宫门 ， 楼 底层 为 接待室 、 秘书 办公室 等 ， 二楼 西边 是 会客室 、 起居室 ， 东边 是 蒋介石 、 宋美龄 夫妇 卧室 。,汽车 直抵 宫门  楼 底层 接待室  秘书 办公室  二楼 西边 会客室  起居室  东边 人物一  人物二 夫妇 卧室,1
TRAIN_SENT_ID_258361,,张兆和,沈从文,不知 为什么 我 忽然 爱上你 内容 介绍 : ◆ 沈从文 、 张兆和 情书 精选,不知 忽然 爱上你 内容 介绍  ◆ 人物二  人物一 情书 精选,1
TRAIN_SENT_ID_271355,,何泽慧,钱三强,那时 ， 于光远 就 称 钱三强 与 何泽慧 是 郎才女貌 天生 的 一对 。,于光远 称 人物二 人物一 郎才女貌 天生 一对,1
TRAIN_SENT_ID_250032,,张无忌,赵敏,59 、 张无忌 携 赵敏 隐退 江湖 — — 创业者 的 激流勇退,人物一 携 人物二 隐退 江湖   创业者 激流勇退,1
TRAIN_SENT_ID_255781,,蒋介石,宋美龄,这里 是 1909 年 的 万国 禁烟 会 的 举办地 ， 蒋介石 和 宋美龄 也 在 这里 举行 了 订婚 仪式 。,年 万国 禁烟 会 举办地  人物一 人物二 举行 订婚 仪式,1
TRAIN_SENT_ID_270543,,关平,关羽,"也就是说 , 关平 是 关羽 的 亲子 。",也就是说  人物一 人物二 亲子,-1
TRAIN_SENT_ID_286668,,武之内空,石田大和,八神 太一 、 石田大和 、 武之内空 、 城户丈 、 泉 光子 郎 、 太刀川 美美 、 高石岳 、 八 神光 八个 孩子 。,八神 太一  人物二  人物一  城户丈  泉 光子 郎  太刀川 美美  高石岳  八 神光 八个 孩子,1
TRAIN_SENT_ID_252109,,黄毅清,黄奕,黄奕 更 贴 出 她 满脸 殴伤 照片 、 验伤单 、 就医 纪录 、 报案 单及 老公 黄毅清 的 悔过书 。,人物二 更 贴 出 满脸 殴伤 照片  验伤单  就医 纪录  报案 单及 老公 人物一 悔过书,1
TRAIN_SENT_ID_268250,,王小利,李琳,有 一天 ， 王小利 带 着 “ 儿子 ” 小 沈阳 去 看 同学 李琳 ， 事情 由 一封 情书 “ 引起 ” ， 不过 ， 当中 却 闹 了 很多 误会 。,一天  人物一 带  儿子  沈阳 同学 人物二  事情 一封 情书  引起    当中 闹 很多 误会,1
TRAIN_SENT_ID_281444,,曾雅兰,侯昌明,20091012 来宾 ： 贺一航 、 高凌风 、 曾雅兰 、 侯昌明 周冠军 争霸赛,来宾  贺一航  高凌风  人物一  人物二 周冠军 争霸赛,1
TRAIN_SENT_ID_267299,,陆毅,鲍蕾,4 历届 名单 : 鲍蕾 、 陆毅 、 罗海琼 、 王一楠 、 薛佳凝 、 朱泳腾,历届 名单  人物二  人物一  罗海琼  王一楠  薛佳凝  朱泳腾,1
TRAIN_SENT_ID_274004,,白素,卫斯理,喜欢 的 书籍 ： 《 卫斯理 与 白素 》 、 《 三毛 流浪记 》,喜欢 书籍   人物二 人物一    三毛 流浪记,1
TRAIN_SENT_ID_282114,,吴子尤,柳红,2012 年 ， 吴子尤 未 发表 作品 经子 尤 母亲 柳红 女士 整理 为书 ， 定名 为 《 英芝 芬芳 华蓉 》 ， 由 广西师范大学 出版社 出版发行 。,年  人物一 未 发表 作品 经子 尤 母亲 人物二 女士 整理 为书  定名  英芝 芬芳 华蓉   广西师范大学 出版社 出版发行,-1
TRAIN_SENT_ID_276590,,韩寒,金丽华,更 有 韩寒 曾经 的 绯闻 女友 揭秘 ， 涉及 女性 有金莎 、 徐静蕾 、 韩雪 、 范冰冰 、 王 珞丹 、 金丽华 等 及其 中 。,更 人物一 曾经 绯闻 女友 揭秘  涉及 女性 有金莎  徐静蕾  韩雪  范冰冰  王 珞丹  人物二 中,1
TRAIN_SENT_ID_284340,,唐筼,陈寅恪,史学家 陈寅恪 的 妻子 唐筼 实话实说 ： “ 妇女 为 家庭 作出贡献 也 很 重要 … … ”,史学家 人物二 妻子 人物一 实话实说   妇女 家庭 作出贡献 重要,1
TRAIN_SENT_ID_248869,,窦滔,苏蕙,司 洛阳 花仙子 ： 苏蕙 （ 窦滔 妻 ） 墟 里 烟,司 洛阳 花仙子  人物二  人物一 妻  墟 里 烟,1
TRAIN_SENT_ID_257838,,王安忆,茹志鹃,茹志鹃 和 她 的 二女儿 王安忆 被 称为 中国 文坛 柔美 的 母女 花 。,人物二 二女儿 人物一 称为 中国 文坛 柔美 母女 花,-1
TRAIN_SENT_ID_279347,,石青璇,徐子陵,诚如 徐子陵 所说 ， 石青璇 是 上天 对 他 徐子陵 最大 的 眷 宠 。,人物二 所说  人物一 上天 人物二 最大 眷 宠,1
TRAIN_SENT_ID_271596,,毛岸青,毛泽东,著 有 《 功盖 大禹 》 一书 ， 该书 是 《 中国 出 了 个 毛泽东 》 丛书 之一 ， 毛岸青 、 邵华 主编 ， 江泽民 为 本套 丛书 题词 ， 杨尚昆 作序 。,著  功盖 大禹  一书  该书  中国 出 人物二  丛书  人物一  邵华 主编  江泽民 本套 丛书 题词  杨尚昆 作序,-1
TRAIN_SENT_ID_284052,,赵力平,朱琦,（ 以下 为 朱琦 妻子 赵力平 口述 ）,以下 人物二 妻子 人物一 口述,1
TRAIN_SENT_ID_263088,,毛福梅,蒋介石,经过 一番 比较 ， 才 认准 了 通家 世交 毛鼎和家 ， 要 他 把 二女儿 毛福梅 嫁给 蒋介石 。,一番 比较  认准 通家 世交 毛鼎和家  二女儿 人物一 嫁给 人物二,1
TRAIN_SENT_ID_258284,,陈建斌,蒋勤勤,2005 年 《 乔家大院 》 友情 出演 合作 演员 ： 陈建斌 蒋勤勤 雷恪生 王绘春,年  乔家大院  友情 出演 合作 演员  人物一 人物二 雷恪生 王绘春,1
TRAIN_SENT_ID_254228,,成龙,房祖名,赵文瑄 成龙 李冰冰 胡歌 孙淳 姜武 陈冲 宁静 房祖名,赵文瑄 人物一 李冰冰 胡歌 孙淳 姜武 陈冲 宁静 人物二,-1
TRAIN_SENT_ID_255948,,蒋介石,宋美龄,蒋介石 家庭 传记 历史 权威 ， 著 有 《 我 在 蒋介石 父子 身边 的 日子 》 、 《 宋美龄 的 美丽 与 哀愁 》 、 《 蒋经国 情爱 档案 》 等 15 本 作品 。,人物一 家庭 传记 历史 权威  著  人物一 父子 身边 日子    人物二 美丽 哀愁    蒋经国 情爱 档案   作品,1
TRAIN_SENT_ID_282055,,李敬爱,李暠,沮渠牧 犍 后妃 : 皇后 李敬爱 ， 西凉 武 昭王 李暠 之女 。,沮渠牧 犍 后妃  皇后 人物一  西凉 武 昭王 人物二 之女,-1
TRAIN_SENT_ID_268575,,潘金莲,武大郎,在 西安 主演 了 《 武大郎 之死 》 ， 在 舞台 上 塑造 了 潘金莲 新 形象 而 一鸣惊人 ， 被誉为 “ 陕北 梅兰芳 ” 。,西安 主演  人物二 之死   舞台 塑造 人物一 新 形象 一鸣惊人  被誉为  陕北 梅兰芳,1
TRAIN_SENT_ID_273601,,陈建州,范玮琪,圈中 好友 ： 王子 （ 邱胜翊 ） 、 炎亚纶 、 黄鸿升 （ 小鬼 ） 、 范玮琪 （ 范范 ） 、 陈建州 （ 黑人 ） 、 蔡玓彤 （ 彤彤 ） 胡宇 崴 、 棒棒 堂 。,圈中 好友  王子  邱胜翊   炎亚纶  黄鸿升  小鬼   人物二  范范   人物一  黑人   蔡玓彤  彤彤  胡宇 崴  棒棒 堂,1
TRAIN_SENT_ID_249423,,后稷,姜嫄,后稷 ： 《 诗经 · 生民 》 篇 说 ： “ 厥 初生 民 ， 时维 姜嫄 。,人物一   诗经  生民  篇 说   厥 初生 民  时维 人物二,-1
TRAIN_SENT_ID_272590,,贾蓉,秦可卿,秦可卿 和 贾蓉,人物二 人物一,1
TRAIN_SENT_ID_256057,,蒋介石,宋美龄,1927 年底 ， 蒋介石 回到 上海 ， 与 宋美龄 完婚 ， 通过 江浙 财阀 确立 了 与 美 、 英 的 关系 。,年底  人物一 回到 上海  人物二 完婚  江浙 财阀 确立 美  英 关系,1
TRAIN_SENT_ID_262999,,熊美玲,林秋离,No.199 镜子 空瓶 三十年 林秋离 熊美玲 张镐哲,镜子 空瓶 三十年 人物二 人物一 张镐哲,1
TRAIN_SENT_ID_272309,,金正恩,金正日,本书 是 《 东京 新闻 》 记者 五味 洋治 对 金正日 的 长子 金正男 （ 金正恩 异母兄弟 ） 的 世界 首次 独家 采访 。,本书  东京 新闻  记者 五味 洋治 人物二 长子 金正男  人物一 异母兄弟  世界 首次 独家 采访,-1
TRAIN_SENT_ID_270101,,罗成,罗艺,乱世 之 罗成 传奇 内容简介 : 次日 中午 时分 ， 北平 王府 的 前方 大院里 ， 罗艺 仍然 是 身着 锦袍 ， 手持 闪亮 银枪 ， 正襟危坐 而立 在 中央 。,乱世 人物一 传奇 内容简介  次日 中午 时分  北平 王府 前方 大院里  人物二 仍然 身着 锦袍  手持 闪亮 银枪  正襟危坐 而立 中央,-1
TRAIN_SENT_ID_284273,,宁致远,安乐颜,安逸尘 是 从小 被安 秋声 捉 走 的 文家 大少爷 ， 安 秋声 为了 报 当年 的 仇 ， 让 安逸尘 故意 接近 安乐颜 与 宁致远 借机 搞垮 宁家 和 文家 。,安逸尘 从小 被安 秋声 捉 走 文家 大少爷  安 秋声 报 当年 仇  安逸尘 故意 接近 人物二 人物一 借机 搞垮 宁家 文家,1
TRAIN_SENT_ID_268639,,潘金莲,武大郎,"重生 之 武大郎 内容简介 : 武大郎 天生 神力 , 潘金莲 是 模范 妻子 , 你 信 吗 ?",重生 人物二 内容简介  人物二 天生 神力  人物一 模范 妻子  信,1
TRAIN_SENT_ID_262902,,熊美玲,林秋离,No.97 昨夜 的 心 林秋离 熊美玲 洪亚薇,昨夜 心 人物二 人物一 洪亚薇,1
TRAIN_SENT_ID_260340,,穆桂英,杨宗保,龙头 上 还要 扎制 108 将 ， 有 桃园 三 结义 的 刘 、 关 、 张 ， 有 杨宗保 、 穆桂英 、 樊梨花 等 民间 传奇 的 英雄人物 。,龙头 扎制   桃园 三 结义 刘  关  张  人物二  人物一  樊梨花 民间 传奇 英雄人物,1
TRAIN_SENT_ID_278283,,王珂,刘涛,银行 起诉 : 演员 刘涛 的 富豪 丈夫 王珂 ， 因 拖欠 信用卡 260 万余元 ， 被 广发 银行 北京分行 告上 了 东城 法院 。,银行 起诉  演员 人物二 富豪 丈夫 人物一  拖欠 信用卡  万余元  广发 银行 北京分行 告上 东城 法院,1
TRAIN_SENT_ID_278350,,周韵,姜文,蕾 蒙威 将 与 姜文 先生 和 周韵 小姐 一起 ， 共书 品牌 传奇 。,蕾 蒙威 人物二 先生 人物一 小姐 一起  共书 品牌 传奇,1
TRAIN_SENT_ID_281585,,陈泰鸣,陈莉萍,1994 年 《 鹤啸 九天 》 合作 演员 ： 叶素 梅 、 潘玲玲 、 曹国辉 、 陈莉萍 、 陈泰鸣,年  鹤啸 九天  合作 演员  叶素 梅  潘玲玲  曹国辉  人物二  人物一,1
TRAIN_SENT_ID_276895,,罗启锐,张婉婷,罗启锐 、 张婉婷 《 玻璃 之 城 》,人物一  人物二  玻璃 城,1
TRAIN_SENT_ID_278720,,叶一茜,田亮,6 、 《 小小的 美好 》 演唱 ： 夏 克立 、 黄嘉千 、 夏天 、 田亮 、 叶一茜 、 田雨 橙,小小的 美好  演唱  夏 克立  黄嘉千  夏天  人物二  人物一  田雨 橙,1
TRAIN_SENT_ID_262842,,熊美玲,林秋离,No.169 爱 开始 都 像 一首歌 林秋离 熊美玲 欧阳菲菲,爱 一首歌 人物二 人物一 欧阳菲菲,1
TRAIN_SENT_ID_255756,,蒋介石,宋美龄,美龄宫 系 蒋介石 及其 夫人 宋美龄 下榻 的 别墅 ， 正式 名称 是 “ 国民政府 主席 官邸 ” 。,美龄宫 系 人物一 夫人 人物二 下榻 别墅  正式 名称  国民政府 主席 官邸,1
TRAIN_SENT_ID_274456,,钱亦石,钱韵玲,钱韵玲 与 冼星海 : 1938 年 1 月 29 日 ， 钱亦石 不幸 在 沪 病逝 。,人物二 冼星海   年  月  日  人物一 不幸 沪 病逝,-1
TRAIN_SENT_ID_287246,,吴琼,阮巡,吴琼 阮巡 の 姐弟恋,人物一 人物二 の 姐弟恋,1
