sent_id,sent_id,entity1,entity2,sent,processed_sent,human
TRAIN_SENT_ID_261549,,关兴,关羽,崇宁 殿 供奉 关羽 像 ， 配殿 有关 平 、 关兴 塑像 。,崇宁 殿 供奉 人物二  配殿 平  人物一 塑像,-1
TRAIN_SENT_ID_257752,,桓雄,桓因,青鹤洞 村帝 有 三圣宫 ， 这里 供奉 着 桓因 、 桓雄 、 檀君 ， 是 一处 圣殿 ， 也 是 修道 场所 。,青鹤洞 村帝 三圣宫  供奉 人物二  人物一  檀君  一处 圣殿  修道 场所,-1
TRAIN_SENT_ID_282993,,李永,王德妃,鲁王 → 皇太子 → 庄恪 太子 李永 ， 王德妃 所 生 。,鲁王 → 皇太子 → 庄恪 太子 人物一  人物二 生,-1
TRAIN_SENT_ID_285877,,殷琰,殷道鸾,殷道鸾 史书 记载 : 殷道鸾 宋书 记载 : 《 宋书 · 卷 八十七 · 列传 第四十七 》 ： 殷琰 ， 陈郡长 平人 也 。,人物二 史书 记载  人物二 宋书 记载   宋书  卷 八十七  列传 第四十七   人物一  陈郡长 平人,-1
TRAIN_SENT_ID_263319,,胡亥,秦始皇,陵园 工程 修造 了 39 年 ， 一直 至 秦始皇 临死 之际 尚未 竣工 ， 二世 皇帝 胡亥 继位 ， 接着 又 修建 了 一年 多才 基本 完工 。,陵园 工程 修造  年  一直 人物二 临死 之际 尚未 竣工  二世 皇帝 人物一 继位  修建 一年 多才 基本 完工,-1
TRAIN_SENT_ID_274387,,钱学森,钱均夫,钱学森 的 降生 ， 给 钱均夫 的 一家 带来 了 欢乐 ， 也 带来 了 希望 。,人物一 降生  人物二 一家 带来 欢乐  带来 希望,-1
TRAIN_SENT_ID_249350,,后稷,姜嫄,上阁 寺 历史 记载 : 《 水经注 》 卷 十八 载 ： 邰 （ 武功 ） “ 城 东北 有 姜嫄 祠 ， 城 西南 百步 有 后稷 祠 ， 眉 之 邰亭 地 ” 。,上阁 寺 历史 记载   水经注  卷 十八 载  邰  武功   城 东北 人物二 祠  城 西南 百步 人物一 祠  眉 邰亭,-1
TRAIN_SENT_ID_286074,,金敬姬,金日成,金日成 的 第一任 妻子 为 金正淑 ， 生有 两子 一女 ， 两子 分别 是 金正日 、 金 万一 和 女儿 金敬姬 。,人物二 第一任 妻子 金正淑  生有 两子 一女  两子 金正日  金 女儿 人物一,-1
TRAIN_SENT_ID_281896,,赵统,赵云,正史 《 三国志 》 记载 赵云 去世 后 ， 赵统 袭爵 永昌 亭 侯 ， 官至 虎贲 中郎督 ， 加 行 领军 。,正史  三国志  记载 人物二 去世  人物一 袭爵 永昌 亭 侯  官至 虎贲 中郎督  加 行 领军,-1
TRAIN_SENT_ID_287190,,封皇后,拓跋沙漠汗,北 魏道武 帝 拓跋 圭 称帝 时 ， 追 谥 拓跋沙漠汗 为文 皇帝 ， 封 夫人 为文 皇后 ， 即 封皇后 。,北 魏道武 帝 拓跋 圭 称帝 时  追 谥 人物二 为文 皇帝  封 夫人 为文 皇后  人物一,-1
TRAIN_SENT_ID_261998,,王明华,梅兰芳,在 程和果 素瑛 定亲 时 ， 荣蝶仙 的 夫人 与 梅兰芳 的 夫人 王明华 代表 男方 去 下定 。,程和果 素瑛 定亲 时  荣蝶仙 夫人 人物二 夫人 人物一 代表 男方 下定,-1
TRAIN_SENT_ID_256279,,孙尚香,刘备,尚香牌 风干 鸡为 荆门 传统 腌腊 制品 ， 其 源流 可追溯 到 屈原 《 招魂 》 中 的 “ 露鸡 ” ， 以 三国 时 刘备 夫人 孙尚香 制作 而出名 。,尚香牌 风干 鸡为 荆门 传统 腌腊 制品  源流 可追溯 屈原  招魂  中  露鸡   三国 时 人物二 夫人 人物一 制作 而出名,-1
TRAIN_SENT_ID_284079,,石彩凤,余定邦,余定邦 （ 曾虹畅 饰 ） 余老八 与 石彩凤 之子 ， 葛大妮 的 继子 ， 刀客 家族 唯一 传承 人 ， 是 个 拥有 复杂 内心世界 的 冷面 腹黑 男 。,人物二  曾虹畅 饰  余老八 人物一 之子  葛大妮 继子  刀客 家族 唯一 传承  拥有 复杂 内心世界 冷面 腹黑 男,-1
TRAIN_SENT_ID_286208,,沈承宽,张天翼,张天翼 病逝 : 张天翼 解放后 复出 工作 ， 担任 中国作协 党组 成员 ， 和 沈承宽 结婚 。,人物二 病逝  人物二 解放后 复出 工作  担任 中国作协 党组 成员  人物一 结婚,-1
TRAIN_SENT_ID_286210,,沈承宽,张天翼,张天翼 张天翼 病逝 : 张天翼 解放后 复出 工作 ， 担任 中国作协 党组 成员 ， 和 沈承宽 结婚 。,人物二 人物二 病逝  人物二 解放后 复出 工作  担任 中国作协 党组 成员  人物一 结婚,-1
TRAIN_SENT_ID_286893,,司马三娘,燕赤霞,玄心 正宗 的 宗主 燕赤霞 （ 元 华饰 ） 与 其妻 司马三娘 （ 恬妞饰 ） 与 六道 大战 ， 各自 死伤 狼藉 。,玄心 正宗 宗主 人物二  元 华饰  其妻 人物一  恬妞饰  六道 大战  死伤 狼藉,-1
TRAIN_SENT_ID_271905,,阎婆惜,宋江,发现 妻子 与 一个 年轻人 搀扶着 走来 ， 悲愤 交集 的 宋江 怒斥 阎婆惜 的 不孝 和 不贞 ， 并 捡起 地上 的 天师 剑 向 阎婆惜 索要 天师 符 。,发现 妻子 一个 年轻人 搀扶着 走来  悲愤 交集 人物二 怒斥 人物一 不孝 不贞  捡起 地上 天师 剑 人物一 索要 天师 符,-1
TRAIN_SENT_ID_258570,,刘禅,刘备,[ 6 - 7 ] 北伐 建功 : 公元 223 年 （ 章武 三年 ） ， 刘备 逝世 ， 太子 刘禅 继位 ， 改元 建兴 。,北伐 建功  公元  年  章武 三年   人物二 逝世  太子 人物一 继位  改元 建兴,-1
TRAIN_SENT_ID_271051,,彭丽媛,习近平,19 时 58 分 ， 习近平 和 夫人 彭丽媛 ， 国际奥委会 主席 托马斯 · 巴赫 和 夫人 等 步入 主席台 ， 向 观众 挥手致意 。,时  分  人物二 夫人 人物一  国际奥委会 主席 托马斯  巴赫 夫人 步入 主席台  观众 挥手致意,-1
TRAIN_SENT_ID_258885,,涂善妮,李昌民,3 婚约 家庭 : 1998 年 1 月 26 日 ， 涂善妮 和 相恋 才 一个月 并 离过婚 的 男 编剧 家 李昌民 ， 于 涂善妮 剧照 ( 13 张 ),婚约 家庭   年  月  日  人物一 相恋 一个月 离过婚 男 编剧 家 人物二  人物一 剧照   张,-1
TRAIN_SENT_ID_259084,,刘备,刘禅,于是 ， 刘备 把 赵云 也 叫 到 身边 ， 对 赵云 说 刘禅 是 你 七进 七出 从 曹军 之中 救 出来 的 ， 因此 跟 你 最好 ， 在 我 死 后 ， 希望 你 继续 照顾 他 。,人物一 赵云 身边  赵云 说 人物二 七进 七出 曹军 之中 救  最好  死  希望 继续 照顾,-1
TRAIN_SENT_ID_270315,,宣姜,卫宣公,而鲁诗 则 认为 是 卫宣公 夫人 宣姜 为 让 自己 的 儿子 寿 继位 而 欲 杀 太子 伋 ， 寿为 救 伋 ， 亦 死 ， 后人 伤 之 ， 为 作此 诗 。,而鲁诗 认为 人物二 夫人 人物一 儿子 寿 继位 欲 杀 太子 伋  寿为 救 伋  死  后人 伤  作此 诗,-1
TRAIN_SENT_ID_251462,,谢贤,谢霆锋,黑夜 马戏团 歌手 简介 : 亚洲 天王 谢霆锋 是 著名 的 歌手 、 演员 ， 父亲 谢贤 ， 母亲 狄波拉 。,黑夜 马戏团 歌手 简介  亚洲 天王 人物二 著名 歌手  演员  父亲 人物一  母亲 狄波拉,-1
TRAIN_SENT_ID_251447,,谢贤,谢霆锋,够 了 没有 歌手 简介 : 亚洲 天王 谢霆锋 是 著名 的 歌手 、 演员 ， 父亲 谢贤 ， 母亲 狄波拉 。,够 没有 歌手 简介  亚洲 天王 人物二 著名 歌手  演员  父亲 人物一  母亲 狄波拉,-1
TRAIN_SENT_ID_251445,,谢贤,谢霆锋,残绘 爱情 实录 歌手 简介 : 亚洲 天王 谢霆锋 是 著名 的 歌手 、 演员 ， 父亲 谢贤 ， 母亲 狄波拉 。,残绘 爱情 实录 歌手 简介  亚洲 天王 人物二 著名 歌手  演员  父亲 人物一  母亲 狄波拉,-1
TRAIN_SENT_ID_270405,,关平,关羽,生下 了 一个 男婴 认了 关羽 为 义父 取名 关平 … …,生下 一个 男婴 认了 人物二 义父 取名 人物一,-1
TRAIN_SENT_ID_265970,,杨绛,钱钟书,容安馆 札记 以 读书 时 的 感想 和 思考 为 主要 内容 ， 本书 在 钱钟书 夫人 杨绛 女士 大力支持 下 斥资 精心 影印 ， 具有 很 高 的 学术 价值 。,容安馆 札记 读书 时 感想 思考 主要 内容  本书 人物二 夫人 人物一 女士 大力支持 斥资 精心 影印  具有 高 学术 价值,-1
TRAIN_SENT_ID_270553,,关平,关羽,下层 楼中 供奉 着 帝王 装 的 关羽 坐像 与 身着 铠甲 、 手持 大刀 的 周仓 和 手 捧 玉玺 的 关平 立像 ， 威严 肃穆 。,下层 楼中 供奉 帝王 装 人物二 坐像 身着 铠甲  手持 大刀 周仓 手 捧 玉玺 人物一 立像  威严 肃穆,-1
TRAIN_SENT_ID_276646,,陆展元,何沅君,何沅君 ， 金庸 武侠小说 《 神雕侠侣 》 中 的 人物 ， 南帝 一灯大师 弟子 武三通 养女 ， 嘉兴 陆家庄 陆展元 之妻 。,人物二  金庸 武侠小说  神雕侠侣  中 人物  南帝 一灯大师 弟子 武三通 养女  嘉兴 陆家庄 人物一 之妻,-1
TRAIN_SENT_ID_276651,,陆展元,何沅君,何沅君 ， 别名 阿 浣 ， 金庸 武侠小说 《 神雕侠侣 》 中 的 人物 ， 南帝 一灯大师 弟子 武三通 养女 ， 嘉兴 陆家庄 陆展元 之妻 。,人物二  别名 浣  金庸 武侠小说  神雕侠侣  中 人物  南帝 一灯大师 弟子 武三通 养女  嘉兴 陆家庄 人物一 之妻,-1
TRAIN_SENT_ID_267119,,公子羽,明月心,明月心 人物 设定 : 明月心 ， 即 易容 后 的 卓 夫人 ， 古龙 武侠小说 《 天涯 明月刀 》 中 的 主要 人物 ， 公子羽 之妻 。,人物二 人物 设定  人物二  易容 卓 夫人  古龙 武侠小说  天涯 明月刀  中 主要 人物  人物一 之妻,-1
TRAIN_SENT_ID_271695,,田川氏,郑成功,河洛 歌仔戏 - 风起云涌 郑成功 演员 ： 王金樱 饰 田川氏,河洛 歌仔戏  风起云涌 人物二 演员  王金樱 饰 人物一,-1
TRAIN_SENT_ID_263302,,胡亥,秦始皇,赵高 思来想去 ， 决定 冒险 扣留 秦始皇 遗诏 ， 进而 谋划 胡亥 继位 ， 以 保住 自己 的 政治 地位 。,赵高 思来想去  决定 冒险 扣留 人物二 遗诏  谋划 人物一 继位  保住 政治 地位,-1
TRAIN_SENT_ID_259305,,刘备,刘禅,新朝 始祖 建兴 帝 王莽 皇太子 王临 三国 : 蜀 汉昭烈 皇帝 刘备 皇太子 刘禅,新朝 始祖 建兴 帝 王莽 皇太子 王临 三国  蜀 汉昭烈 皇帝 人物一 皇太子 人物二,-1
TRAIN_SENT_ID_256274,,孙尚香,刘备,灵泽 夫人 ： 三国 时 东吴 孙权 之妹 、 蜀汉 刘备 夫人 孙尚香 。,灵泽 夫人  三国 时 东吴 孙权 之妹  蜀汉 人物二 夫人 人物一,-1
TRAIN_SENT_ID_268417,,秦始皇,扶苏,太子 寺 临夏 太子 寺 : 在 临夏州 广河县 县城 ， 有座 名叫 太子 寺 的 千年 古刹 ， 寺 内 祀奉 的 是 秦始皇 之子 扶苏 。,太子 寺 临夏 太子 寺  临夏州 广河县 县城  有座 名叫 太子 寺 千年 古刹  寺 祀奉 人物一 之子 人物二,-1
TRAIN_SENT_ID_268418,,秦始皇,扶苏,5 临夏 太子 寺 : 在 临夏州 广河县 县城 ， 有座 名叫 太子 寺 的 千年 古刹 ， 寺 内 祀奉 的 是 秦始皇 之子 扶苏 。,临夏 太子 寺  临夏州 广河县 县城  有座 名叫 太子 寺 千年 古刹  寺 祀奉 人物一 之子 人物二,-1
TRAIN_SENT_ID_262449,,扶苏,秦始皇,"却 因为 一个 赵高 害 的 朝政 腐败 , 后 因 秦始皇 袈崩 , 胡亥 篡改 秦始皇 遗诏 , 杀 其 兄长 扶苏 , 残害 重臣 蒙恬 , 蒙易 。",一个 赵高 害 朝政 腐败  人物二 袈崩  胡亥 篡改 人物二 遗诏  杀 兄长 人物一  残害 重臣 蒙恬  蒙易,-1
TRAIN_SENT_ID_268297,,秦始皇,扶苏,难道 太子 忘掉 前朝 秦始皇 的 太子 扶苏 受 冤屈 而 死 的 事情 了 吗 ？ ”,难道 太子 忘掉 前朝 人物一 太子 人物二 受 冤屈 死 事情,-1
TRAIN_SENT_ID_277012,,萧玉嬛,郗徽,郗徽 共 为 萧衍 生有 三女 ： 永兴 公主 萧玉 姚 、 永世 公主 萧玉婉 、 永康 公主 萧玉嬛 ， 但 没有 为 萧衍 生 下 儿子 。,人物二 共 萧衍 生有 三女  永兴 公主 萧玉 姚  永世 公主 萧玉婉  永康 公主 人物一  没有 萧衍 生 儿子,-1
TRAIN_SENT_ID_270228,,谭江柏,谭咏麟,谭咏麟 ， 绰号 「 谭 校长 」 ， 为 已故 足球 名宿 谭江柏 之子 ， 生于 香港 ， 籍贯 广东 新 会 ， 是 香港 流行 乐坛 殿堂 级 歌手 ， 音乐 人 与 电影演员 。,人物二  绰号  谭 校长   已故 足球 名宿 人物一 之子  生于 香港  籍贯 广东 新 会  香港 流行 乐坛 殿堂 级 歌手  音乐 电影演员,-1
TRAIN_SENT_ID_258701,,刘禅,刘备,建安 二十六年 ， 刘备 病逝 于 白帝城 ， 太子 刘禅 即位 ， 改元 建兴 ， 丞相 诸葛亮 主理 大小 内政 事物 。,建安 二十六年  人物二 病逝 白帝城  太子 人物一 即位  改元 建兴  丞相 诸葛亮 主理 大小 内政 事物,-1
TRAIN_SENT_ID_266731,,郭登峰,郭美美,微博炫富 事件 母女 专访 : “ 郭美美 事件 ” 事发 一个多月 后 ， 郭美美 及其 母亲 郭登峰 终于 公开 露面 ， 解释 事件 的 来龙去脉 。,微博炫富 事件 母女 专访   人物二 事件  事发 一个多月  人物二 母亲 人物一 终于 公开 露面  解释 事件 来龙去脉,-1
TRAIN_SENT_ID_265374,,戚夫人,刘如意,指人 有 雄才大略 成语故事 西汉时期 ， 刘邦 当 上 皇帝 后立 吕后 的 儿子 刘盈 为 太子 ， 因为 宠幸 戚夫人 而 想 改立 刘如意 为 太子 。,指人 雄才大略 成语故事 西汉时期  刘邦 皇帝 后立 吕后 儿子 刘盈 太子  宠幸 人物一 想 改立 人物二 太子,-1
TRAIN_SENT_ID_286886,,安小慧,安剑清,安小慧 去 找 袁承志 求救 ， 一行 人 立刻 动手 计划 营救 ， 安剑清 也 打算 利用 两 人为 饵 ， 抓获 大鱼 ， 并 同时 对 安大娘 温言 相劝 ， 希望 夫妻 和 好 。,人物一 找 袁承志 求救  一行 立刻 动手 计划 营救  人物二 打算 利用 两 人为 饵  抓获 大鱼  安大娘 温言 相劝  希望 夫妻,-1
TRAIN_SENT_ID_260780,,李格非,李清照,章丘 名人 先后 有 邹衍 、 房玄龄 、 李格非 、 李清照 、 刘敏中 、 李开先 、 马国翰 等 。,章丘 名人 先后 邹衍  房玄龄  人物一  人物二  刘敏中  李开先  马国翰,-1
TRAIN_SENT_ID_272544,,宋江,宋太公,在 宋江 家中 住 了 一夜 ， 宋太公 托 石勇 给 宋江 送信 。,人物一 家中 住 一夜  人物二 托 石勇 人物一 送信,-1
TRAIN_SENT_ID_283737,,刘德成,刘铁男,随后 ， 中 金 石化 董事长 孙永根 出资 人民币 33 万余元 为 刘德成 购买 尼桑 牌 天籁 轿车 一辆 ， 刘铁男 对此 知情 。,中 金 石化 董事长 孙永根 出资 人民币  万余元 人物一 购买 尼桑 牌 天籁 轿车 一辆  人物二 对此 知情,-1
TRAIN_SENT_ID_274886,,晏几道,晏殊,南宋 以后 主张 典雅 的 词人 ， 反对 柳永 、 周邦彦 词 的 “ 软媚 ” ， 故未选 柳永 、 晏殊 、 晏几道 、 秦观 等 人词 。,南宋 以后 主张 典雅 词人  反对 柳永  周邦彦 词  软媚   故未选 柳永  人物二  人物一  秦观 人词,-1
TRAIN_SENT_ID_283894,,曾柔,韦小宝,2 精彩 表现 : 丽春院 大床 压塌 后 ， 当 韦小宝 逼 着 阿 珂 承认 其 婚事 ， 曾柔 一改 往日 的 2014 韩栋 版 鹿鼎记 曾柔 ( 2 张 ),精彩 表现  丽春院 大床 压塌  人物二 逼 珂 承认 婚事  人物一 一改 往日  韩栋 版 鹿鼎记 人物一   张,-1
TRAIN_SENT_ID_270508,,关平,关羽,关羽 回到 营寨 ， 对 关平 说 ： “ 庞德 的 刀法 非常 娴熟 ， 真 不愧为 曹营 勇 将 啊 。 ”,人物二 回到 营寨  人物一 说   庞德 刀法 非常 娴熟  真 不愧为 曹营 勇,1
TRAIN_SENT_ID_249346,,后稷,姜嫄,据 县志 载 ， 明 弘治 年间 重修 建有 姜嫄 祠 、 后稷 祠 、 天皇 堂 、 罗汉洞 ， 吕祖洞 、 唐太宗 读书处 等 十多座 古建筑 ， 统称 上阁 寺 。,县志 载  明 弘治 年间 重修 建有 人物二 祠  人物一 祠  天皇 堂  罗汉洞  吕祖洞  唐太宗 读书处 十多座 古建筑  统称 上阁 寺,-1
TRAIN_SENT_ID_274660,,傅敏,傅雷,心如 水晶 一般 透明 — — 傅敏 心中 目中 的 傅雷,心如 水晶 透明   人物一 心中 目中 人物二,-1
TRAIN_SENT_ID_285848,,卢芳,胡军,胡皓 康 ， 胡军 与 卢芳 的 儿子 。,胡皓 康  人物二 人物一 儿子,-1
TRAIN_SENT_ID_263133,,毛福梅,蒋介石,5 从 发妻 到 “ 义 姊 ” ， 蒋介石 大 费周折 ， 但 毛福梅 毕竟 是 蒋经国 之 “ 生母 ” 。,发妻  义 姊   人物二 费周折  人物一 毕竟 蒋经国  生母,-1
TRAIN_SENT_ID_283435,,张月亮,张铁林,1 、 金 大川 刘畅 （ 奖励 ： 两张 直通 卡 ， 一张 送给 张铁林 和 张月亮 ）,金 大川 刘畅  奖励  两张 直通 卡  一张 送给 人物二 人物一,-1
TRAIN_SENT_ID_257017,,李嫣,王菲,由于 小 李嫣 患有 先天性 唇腭裂 ， 为此 李亚鹏 和 王菲 建立 了 嫣然 天使 基金 ， 以 帮助 那些 同样 患病 的 儿童 。,人物一 患有 先天性 唇腭裂  李亚鹏 人物二 建立 嫣然 天使 基金  帮助 同样 患病 儿童,-1
TRAIN_SENT_ID_266089,,江浩坤,甘敬,江浩坤 是 李潇 编剧 的 都市 情感 剧 《 好 先生 》 中 的 男 二号 ， 陆远 的 发小 、 江莱 的 哥哥 、 甘敬 的 未婚夫 ， 商海 一 “ 壕 ” 。,人物一 李潇 编剧 都市 情感 剧  先生  中 男 二号  陆远 发小  江莱 哥哥  人物二 未婚夫  商海  壕,-1
TRAIN_SENT_ID_276845,,唐姬,刘发,唐姬 生 长沙 定王 刘发 。,人物一 生 长沙 定王 人物二,-1
TRAIN_SENT_ID_276833,,唐姬,刘发,唐姬 （ 唐儿 ） ， 生 长沙 定王 刘发 。,人物一  唐儿   生 长沙 定王 人物二,-1
TRAIN_SENT_ID_265142,,尤二姐,贾琏,邢夫人 为了 维护 丈夫 的 颜面 ， 大骂 贾琏 ， 实际上 是 指桑骂槐 ， 等于 痛骂 了 尤二姐 。,邢夫人 维护 丈夫 颜面  大骂 人物二  实际上 指桑骂槐  等于 痛骂 人物一,1
TRAIN_SENT_ID_276808,,丁夫人,曹操,曹操 原配 丁夫人 ： 打得 过 流氓 ， 斗不过 小 三,人物二 原配 人物一  打得 流氓  斗不过 三,-1
TRAIN_SENT_ID_260497,,严嵩,严世蕃,他 上 密疏 ， 揭发 严嵩 与 严世蕃 所 行事 ， 引起 世宗 的 重视 。,密疏  揭发 人物一 人物二 行事  引起 世宗 重视,-1
TRAIN_SENT_ID_266943,,关索,关羽,关索 向 张飞 说明 原委 ， 关羽 合家 团聚 。,人物一 张飞 说明 原委  人物二 合家 团聚,-1
TRAIN_SENT_ID_285474,,黄子桓,黄百鸣,编剧 ： 黄子桓 、 黄百鸣,编剧  人物一  人物二,-1
TRAIN_SENT_ID_268433,,秦始皇,扶苏,秦始皇 临终 以前 ， 曾 为 玺 书 召令 扶苏 至 咸阳 主持 丧事 并 继承 帝位 。,人物一 临终 以前  玺 书 召令 人物二 咸阳 主持 丧事 继承 帝位,-1
TRAIN_SENT_ID_272334,,金正恩,金正日,该 媒体 转述 称 ， 司令部 安保 人员 接 金正恩 命令 ， 到 金敬姬 家接 她 参加 金正日 两周年 追悼 活动 。,媒体 转述 称  司令部 安保 人员 接 人物一 命令  金敬姬 家接 参加 人物二 两周年 追悼 活动,-1
TRAIN_SENT_ID_281804,,朱轩姬,李德嫔,八女 泰顺 公主 朱轩姬 ， 神宗 第八 女 ， 母 李德嫔 。,八女 泰顺 公主 人物一  神宗 第八 女  母 人物二,-1
TRAIN_SENT_ID_283869,,于海宁,范会香,虽然 范会香 已经 是 癌症 晚期 ， 但 于海宁 却 下定决心 ： 这辈子 一定 要 娶 她 为 妻 ！,人物二 已经 癌症 晚期  人物一 下定决心  这辈子 一定 娶 妻,1
TRAIN_SENT_ID_249413,,后稷,姜嫄,后稷 是 古代 周族 的 始祖 ， 传说 有 邰氏 之 女 姜嫄 踏 巨人 脚迹 ， 怀孕 而生 ， 因 一度 被弃 ， 故又名 弃 。,人物一 古代 周族 始祖  传说 邰氏 女 人物二 踏 巨人 脚迹  怀孕 而生  一度 被弃  故又名 弃,-1
TRAIN_SENT_ID_256396,,李天一,李双江,李天一 年龄 造假 : 李双江 前往 医院 向 伤者 道歉 ( 2 张 ),人物一 年龄 造假  人物二 前往 医院 伤者 道歉   张,-1
TRAIN_SENT_ID_262176,,诸葛尚,诸葛瞻,他 随 诸葛瞻 、 诸葛尚 、 张遵 、 黄崇 守 绵竹 战 邓艾 ， 曾 向 诸葛瞻 建议 分兵 出城 扼守 险要 隘口 ， 未 被 瞻 采纳 。,人物二  人物一  张遵  黄崇 守 绵竹 战 邓艾  人物二 建议 分兵 出城 扼守 险要 隘口  未 瞻 采纳,-1
TRAIN_SENT_ID_286022,,刘范,刘焉,刘瑁 ， 刘范 三弟 ， 别部 司马 ， 随父 刘焉 入 益州 ， 早逝 。,刘瑁  人物一 三弟  别部 司马  随父 人物二 入 益州  早逝,-1
TRAIN_SENT_ID_263509,,梅葆玖,梅兰芳,1959 年 毕业分配 至 梅兰芳 京剧团 ， 与 梅葆玖 、 梅葆玥 、 李玉芙 等 合作 演出 。,年 毕业分配 人物二 京剧团  人物一  梅葆玥  李玉芙 合作 演出,-1
TRAIN_SENT_ID_258632,,刘禅,刘备,共同 了解 、 深思 守业 失败 的 刘备 、 刘禅 等 人 的 失败 教训 。,共同 了解  深思 守业 失败 人物二  人物一 失败 教训,-1
TRAIN_SENT_ID_266732,,郭登峰,郭美美,2 、 按照 郭登峰 所说 在 郭美美 出生 前 自己 就 有 了 好几百万 。,人物一 所说 人物二 出生 前 好几百万,-1
TRAIN_SENT_ID_263160,,胡亥,秦始皇,"新七国 之乱 内容简介 : 秦始皇 用 了 10 年 的 时间 进行 的 战争 统一 华夏 , 却 在 胡亥 的 手中 断送 。",新七国 之乱 内容简介  人物二  年 时间 进行 战争 统一 华夏  人物一 手中 断送,-1
TRAIN_SENT_ID_274704,,龙啸云,林诗音,林诗音 青梅竹马 的 恋人 、 未婚夫 ， 因 不忍 龙啸云 的 相思 之苦 而 放,人物二 青梅竹马 恋人  未婚夫  不忍 人物一 相思 之苦 放,1
TRAIN_SENT_ID_264613,,纪晓芙,杨不悔,人物 ： 杨不悔 、 纪晓芙,人物  人物二  人物一,1
TRAIN_SENT_ID_260534,,严嵩,严世蕃,世宗 得 疏 ， 以 严嵩 放纵 严世蕃 ， 负国恩 ， 令其 致仕 还乡 ， 而 下 严世蕃 于狱 。,世宗 疏  人物一 放纵 人物二  负国恩  令其 致仕 还乡  人物二 于狱,-1
TRAIN_SENT_ID_250203,,秦始皇,胡亥,赵高 ， 可能 是 赵国 贵族 后裔 ， 侍侯少 公子 胡亥 深得 秦始皇 赏识 。,赵高  可能 赵国 贵族 后裔  侍侯少 公子 人物二 深得 人物一 赏识,-1
TRAIN_SENT_ID_261549,,关兴,关羽,崇宁 殿 供奉 关羽 像 ， 配殿 有关 平 、 关兴 塑像 。,崇宁 殿 供奉 人物二  配殿 平  人物一 塑像,-1
TRAIN_SENT_ID_270007,,张耳,张敖,《 张耳 陈馀 列传 》 : 《 张耳 陈馀 列传 第二十九 》 ： 张敖 ， 高后 六年 薨 。,人物一 陈馀 列传    人物一 陈馀 列传 第二十九   人物二  高后 六年 薨,-1
TRAIN_SENT_ID_273779,,霍震霆,霍英东,由于 霍震宇 和 霍震霆 虽 是 霍英东 集团 的 董事 ， 但 两 人均 不 担任 具体 管理 职务 。,霍震宇 人物一 人物二 集团 董事  两 人均 担任 具体 管理 职务,-1
TRAIN_SENT_ID_272268,,金正恩,金正日,纪念 宫里 摆放着 金正恩 及 前来 悼念 人士 送来 的 花圈 ， 花圈 上 写 有 “ 最最 沉痛 的 心情 悼念 伟大 的 领袖 金正日 ” 等 字样 。,纪念 宫里 摆放着 人物一 前来 悼念 人士 送来 花圈  花圈 写  最最 沉痛 心情 悼念 伟大 领袖 人物二  字样,-1
TRAIN_SENT_ID_272333,,金正恩,金正日,崔永林 表示 ， 仓田街 建设者 修建 世界 一流 的 建筑物 ， 体现 了 金正日 和 金正恩 热爱祖国 、 关爱 人民 的 崇高 意志 。,崔永林 表示  仓田街 建设者 修建 世界 一流 建筑物  体现 人物二 人物一 热爱祖国  关爱 人民 崇高 意志,-1
TRAIN_SENT_ID_276137,,许仙,许仕林,许仕林 剧情 介绍 : 许仙 和 白素贞 开设 保和堂 药铺 ， 济世 活人 ， 并且 除去 了 地方 祸害 - 蜈蚣 精 。,人物二 剧情 介绍  人物一 白素贞 开设 保和堂 药铺  济世 活人  除去 地方 祸害  蜈蚣 精,-1
TRAIN_SENT_ID_263183,,胡亥,秦始皇,十二 、 秦始皇 与 二世 胡亥 的 兴亡,十二  人物二 二世 人物一 兴亡,-1
TRAIN_SENT_ID_254162,,邢夫人,贾赦,2 、 贾赦 — — 邢夫人 房中 ： 秋桐 费婆子 附 ： 邢岫烟 的 丫头 ： 篆儿,人物二   人物一 房中  秋桐 费婆子 附  邢岫烟 丫头  篆儿,1
TRAIN_SENT_ID_273450,,凌操,凌统,其余 诸 将 ： 周泰 、 黄盖 、 程普 、 韩当 、 蒋钦 、 凌操 、 凌统 、 沙摩柯 等,周泰  黄盖  程普  韩当  蒋钦  人物一  人物二  沙摩柯,-1
TRAIN_SENT_ID_263761,,秦始皇,赵姬,有 传说 称 ， 秦始皇 是 吕不韦 和 赵姬 所 生 。,传说 称  人物一 吕不韦 人物二 生,-1
TRAIN_SENT_ID_282476,,宇文成都,宇文化及,后 十八家 反王讨 宇文化及 ， 宇文成都 被 李元霸 打败 。,十八家 反王讨 人物二  人物一 李元霸 打败,-1
TRAIN_SENT_ID_275575,,安妃,福清公主,郑 安妃 ， 生 福清公主,郑 人物一  生 人物二,-1
TRAIN_SENT_ID_267012,,殷素素,张无忌,所用 兵刃 为 少见 的 银制 虎头 钩 和 铁制 判官笔 ， 因而 被 称为 “ 银钩 铁划 ” ； 后 与 白眉鹰 王 殷天正 之女 殷素素 结为夫妇 ， 生 下 张无忌 。,所用 兵刃 少见 银制 虎头 钩 铁制 判官笔  称为  银钩 铁划   白眉鹰 王 殷天正 之女 人物一 结为夫妇  生 人物二,-1
TRAIN_SENT_ID_269900,,张默,张国立,《 济公 新传 》 主演 ： 张默 、 张国立 、 张澜澜 、 邓婕 、 韩雪,济公 新传  主演  人物一  人物二  张澜澜  邓婕  韩雪,-1
TRAIN_SENT_ID_283092,,吴速玲,曹格,曹 三丰 （ Joe ） ， 曹格 与 吴速玲 的 儿子,曹 三丰     人物二 人物一 儿子,-1
