sent_id,sent_id,entity1,entity2,sent,processed_sent,human
TRAIN_SENT_ID_277534,,柴绍,平阳公主,龙泉 附彩 ； 貂珥 殊荣 ： 上联 典指 唐朝 时期 的 柴绍 妻 平阳公主 从夫 征战 ， 所部 号 “ 娘子军 ” ， 彰明 了 柴氏 前贤 的 徽行 。,龙泉 附彩  貂珥 殊荣  上联 典指 唐朝 时期 人物一 妻 人物二 从夫 征战  所部 号  娘子军   彰明 柴氏 前贤 徽行,-1
TRAIN_SENT_ID_285923,,于素秋,于占元,他 的 师父 就是 著名 的 京剧 大师 于占元 师父 （ 于素秋 的 父亲 ） 。,师父 著名 京剧 大师 人物二 师父  人物一 父亲,-1
TRAIN_SENT_ID_252223,,秦嘉,徐淑,秦嘉 ， 字士会 ， 故里 在 今什川乡 大湾 村 秦家 坪 （ 原属 榜罗乡 ） ； 徐淑 ， 秦妻 ， 故里 在 今 榜罗乡 桃园 村 徐家 窑 。,人物一  字士会  故里 今什川乡 大湾 村 秦家 坪  原属 榜罗乡   人物二  秦妻  故里 榜罗乡 桃园 村 徐家 窑,-1
TRAIN_SENT_ID_265939,,杨绛,钱钟书,"杨绛 , ( 1911 — — ) ， 钱钟书 夫人 ， 本名 杨 季康 ， 著名 的 作家 、 评论家 、 翻译家 、 学者 。",人物一        人物二 夫人  本名 杨 季康  著名 作家  评论家  翻译家  学者,-1
TRAIN_SENT_ID_276094,,陈三立,陈宝箴,他 祖父 陈宝箴 是 湖南 巡抚 ， 父亲 陈三立 是 著名诗人 ， 弟弟 陈寅恪 是 著名 历史学家 。,祖父 人物二 湖南 巡抚  父亲 人物一 著名诗人  弟弟 陈寅恪 著名 历史学家,-1
TRAIN_SENT_ID_265901,,杨绛,钱钟书,我们仨 作者简介 : 杨绛 ， ( 1911 — — 2016 ) ， 钱钟书 夫人 ， 原名 杨 季康 ， 著名 的 作家 、 评论家 、 翻译家 、 学者 。,我们仨 作者简介  人物一         人物二 夫人  原名 杨 季康  著名 作家  评论家  翻译家  学者,-1
TRAIN_SENT_ID_275626,,段成式,段文昌,2 文化 纪事 : 段成式 卒 段成式 ， 字 柯古 ， 临淄 邹平 （ 今 山东 ） 人 ， 穆宗 朝 宰相 段文昌 之子 。,文化 纪事  人物一 卒 人物一  字 柯古  临淄 邹平  山东   穆宗 宰相 人物二 之子,-1
TRAIN_SENT_ID_282917,,褚令璩,褚澄,褚澄 为 褚湛之 与 吴郡 公主 之子 ， 女儿 为 南齐 东昏侯 萧 宝卷 的 皇后 褚令璩,人物二 褚湛之 吴郡 公主 之子  女儿 南齐 东昏侯 萧 宝卷 皇后 人物一,-1
TRAIN_SENT_ID_278985,,林诗音,龙啸云,欢因 误伤 义兄 龙啸云 之子 ， 重遇 阔别 廿年 的 龙 和 已 成为 龙妻 的 旧情 人 林诗音 （ 李琳琳 ） 。,欢因 误伤 义兄 人物二 之子  重遇 阔别 廿年 龙 成为 龙妻 旧情 人物一  李琳琳,-1
TRAIN_SENT_ID_265997,,杨绛,钱钟书,"6 作者简介 : 杨绛 , ( 1911 — — ) ， 钱钟书 夫人 ， 原名 杨 季康 ， 著名 的 作家 、 评论家 、 翻译家 、 学者 。",作者简介  人物一        人物二 夫人  原名 杨 季康  著名 作家  评论家  翻译家  学者,-1
TRAIN_SENT_ID_277809,,何沅君,陆无双,1998 年 参与 任贤齐 、 吴倩莲 主演 的 金庸 武侠剧 《 神雕侠侣 》 饰演 陆无双 的 母亲 何沅君 。,年 参与 任贤齐  吴倩莲 主演 金庸 武侠剧  神雕侠侣  饰演 人物二 母亲 人物一,-1
TRAIN_SENT_ID_275790,,田灵儿,田不易,田灵儿 ： 齐昊 之妻 ， 田不易 和 苏茹 之女 。,人物一  齐昊 之妻  人物二 苏茹 之女,-1
TRAIN_SENT_ID_273020,,黄月英,黄承彦,黄月英 在 三国 时 归属 蜀国 ， 黄承彦 之女 ， 诸葛亮 之妻 ， 诸葛瞻 、 诸葛果 、 诸葛乔 （ 养子 ） 之母 。,人物一 三国 时 归属 蜀国  人物二 之女  诸葛亮 之妻  诸葛瞻  诸葛果  诸葛乔  养子  之母,-1
TRAIN_SENT_ID_272909,,夏祖丽,林海音,夏祖丽 ， 母亲 林海音 是 一位 深 为 大陆 的 读者 、 观众 熟悉 和 感到 亲切 的 著名 女作家 。,人物一  母亲 人物二 一位 深 大陆 读者  观众 熟悉 感到 亲切 著名 女作家,-1
TRAIN_SENT_ID_278436,,苗若兰,苗人凤,长大 后 的 胡斐 寻 苗人凤 为父 报仇 ， 途中 又 邂逅 程灵素 、 袁紫衣 及 苗人凤 之女 苗若兰 ， 从而 展开 一段 缠绕 不清 的 恋情 。,长大 胡斐 寻 人物二 为父 报仇  途中 邂逅 程灵素  袁紫衣 人物二 之女 人物一  展开 一段 缠绕 不清 恋情,-1
TRAIN_SENT_ID_276544,,孔子,亓官氏,考之 年谱 ： 「 孔子 六十六岁 ， 夫人 亓官氏 氏 卒 ， 六十七岁 ， 有伯鱼 母 死期 年 犹 哭 ， 子 曰 ： 『 谁 与 （ 欤 ） ？,考之 年谱   人物一 六十六岁  夫人 人物二 氏 卒  六十七岁  有伯鱼 母 死期 年 犹 哭  子 曰,-1
TRAIN_SENT_ID_274986,,荆天明,荆轲,剧情 介绍 : 天下第一 剑客 — 盖聂 ， 携 故人 荆轲 之子 — 荆天明 ， 为 躲避 秦王 的 追杀 ， 踏上 了 荆棘 密布 的 旅程 。,剧情 介绍  天下第一 剑客  盖聂  携 故人 人物二 之子  人物一  躲避 秦王 追杀  踏上 荆棘 密布 旅程,-1
TRAIN_SENT_ID_275369,,谭嗣同,李闰,6 家庭成员 : 妻子 : 谭嗣同 夫人 李闰 在 他 就义 后取 “ 忍死 须臾 待 杜根 ” 之意 自号 “ 臾 生 ” ， 做 悼亡 诗 ：,家庭成员  妻子  人物一 夫人 人物二 就义 后取  忍死 须臾 杜根  之意 自号  臾 生   做 悼亡 诗,-1
TRAIN_SENT_ID_281451,,褚蒜子,褚裒,1 人物 生平 : 名冠 中朝 : 褚裒 字 季野 ， 是 康献 皇后 褚蒜子 的 父亲 。,人物 生平  名冠 中朝  人物二 字 季野  康献 皇后 人物一 父亲,-1
TRAIN_SENT_ID_268744,,孟明视,百里奚,经 后世 考证 ， 战国时期 ， 秦国 名将 孟明视 ， 以 百里 为 姓 ， 字 孟明 名 ， 名叫 作视 ， 百里奚 之子 。,后世 考证  战国时期  秦国 名将 人物一  百里 姓  字 孟明 名  名叫 作视  人物二 之子,-1
TRAIN_SENT_ID_251462,,谢贤,谢霆锋,黑夜 马戏团 歌手 简介 : 亚洲 天王 谢霆锋 是 著名 的 歌手 、 演员 ， 父亲 谢贤 ， 母亲 狄波拉 。,黑夜 马戏团 歌手 简介  亚洲 天王 人物二 著名 歌手  演员  父亲 人物一  母亲 狄波拉,-1
TRAIN_SENT_ID_251447,,谢贤,谢霆锋,够 了 没有 歌手 简介 : 亚洲 天王 谢霆锋 是 著名 的 歌手 、 演员 ， 父亲 谢贤 ， 母亲 狄波拉 。,够 没有 歌手 简介  亚洲 天王 人物二 著名 歌手  演员  父亲 人物一  母亲 狄波拉,-1
TRAIN_SENT_ID_251445,,谢贤,谢霆锋,残绘 爱情 实录 歌手 简介 : 亚洲 天王 谢霆锋 是 著名 的 歌手 、 演员 ， 父亲 谢贤 ， 母亲 狄波拉 。,残绘 爱情 实录 歌手 简介  亚洲 天王 人物二 著名 歌手  演员  父亲 人物一  母亲 狄波拉,-1
TRAIN_SENT_ID_284574,,孔原,许明,邓小平 与 卓琳 的 婚礼 在 杨家岭 毛泽东 的 窑洞 前 举行 ， 同时 举行 婚礼 的 还有 中央军委 总政治部 组织部长 孔原 和 许明 。,邓小平 卓琳 婚礼 杨家岭 毛泽东 窑洞 前 举行  举行 婚礼 中央军委 总政治部 组织部长 人物一 人物二,-1
TRAIN_SENT_ID_270750,,梁萧,花晓霜,三百年 前 ， “ 西昆仑 ” 梁萧 携妻 花晓霜 远走 大洋 ......,三百年 前   西昆仑  人物一 携妻 人物二 远走 大洋,-1
TRAIN_SENT_ID_257333,,贾珍,尤氏,宁国府 梅花 盛开 ， 贾珍 妻 尤氏 请 贾母 等 赏玩 。,宁国府 梅花 盛开  人物一 妻 人物二 请 贾母 赏玩,1
TRAIN_SENT_ID_281641,,黄峨,杨慎,黄杨 两家 ， 本有 通家 之谊 ， 正德 十四年 ( 1519 ) 冬天 ， 黄峨 与 杨慎 结婚 ， 杨慎 亲往 遂宁 迎娶 。,黄杨 两家  本有 通家 之谊  正德 十四年    冬天  人物一 人物二 结婚  人物二 亲往 遂宁 迎娶,-1
TRAIN_SENT_ID_263813,,刘嘉玲,梁朝伟,刘嘉玲 : 刘嘉玲 和 梁朝伟 两人 举办 婚礼 远 赴 不丹 ， 举行 的 是 王室 式 婚礼 ， 除了 不丹 国王 证婚 外 ， 约 有 20 名 喇嘛 僧侣 诵经 。,人物一  人物一 人物二 两人 举办 婚礼 远 赴 不丹  举行 王室 式 婚礼  不丹 国王 证婚 外  约  名 喇嘛 僧侣 诵经,-1
TRAIN_SENT_ID_284106,,郝治平,罗瑞卿,1960 年 春天 ， 罗瑞卿 大将 偕 夫人 郝治平 ， 陪同 朱德 和 贺龙元帅 等 重返 故里 视察 ， 给 家乡 人民 带来 亲切 的 关怀 ， 留下 了 永远 的 回忆 。,年 春天  人物二 大将 偕 夫人 人物一  陪同 朱德 贺龙元帅 重返 故里 视察  家乡 人民 带来 亲切 关怀  留下 永远 回忆,-1
TRAIN_SENT_ID_284629,,张震,庄雯如,庄雯如 举行 婚礼 : 张震 庄雯如 婚礼 现场 图片 ( 3 张 ),人物二 举行 婚礼  人物一 人物二 婚礼 现场 图片   张,1
TRAIN_SENT_ID_269995,,姚明,叶莉,自打 姚明 和 叶莉 谈上 恋爱 ， 中国篮球 就 被 认为 后继有人 了 ， 尤其 在 “ 姚 千金 ” 姚沁蕾 诞生 后 。,人物一 人物二 谈上 恋爱  中国篮球 认为 后继有人  尤其  姚 千金  姚沁蕾 诞生,-1
TRAIN_SENT_ID_278370,,周韵,姜文,周韵 与 姜文 于 2005 年 注册 结婚 [ 9 - 10 ] ， 婚后 诞下 两个 儿子 。,人物一 人物二  年 注册 结婚       婚后 诞下 两个 儿子,-1
TRAIN_SENT_ID_275938,,黄日华,黄芷晴,黄芷晴 － 香港 演员 （ 香港 著名演员 黄日华 与 梁洁华 爱女 ）,人物二  香港 演员  香港 著名演员 人物一 梁洁华 爱女,-1
TRAIN_SENT_ID_262732,,水若寒,陆剑萍,水若寒 人物 关系 : 未婚妻 ： 陆剑萍,人物一 人物 关系  未婚妻  人物二,1
TRAIN_SENT_ID_287239,,舒悦,张宇峰,舒悦 在 2014 年 参加 文化 主题 之夜 节目 里 自 曝 追求 爱妻 张宇峰 过程 ， 并 现场 传授 恋爱 秘籍 ， 堪称 一代 “ 情场 高手 ” 。,人物一  年 参加 文化 主题 之夜 节目 里 曝 追求 爱妻 人物二 过程  现场 传授 恋爱 秘籍  堪称 一代  情场 高手,-1
TRAIN_SENT_ID_271478,,钱基博,钱钟书,钱绍武 人物 生平 : 1928 年 ， 在 产生 过 钱穆 、 钱基博 、 钱钟书 等 国学大师 的 无锡 钱姓 家族 中 ， 又 诞生 了 一位 艺术 大家 — — 钱绍武 。,钱绍武 人物 生平   年  产生 钱穆  人物一  人物二 国学大师 无锡 钱姓 家族 中  诞生 一位 艺术   钱绍武,-1
TRAIN_SENT_ID_270405,,关平,关羽,生下 了 一个 男婴 认了 关羽 为 义父 取名 关平 … …,生下 一个 男婴 认了 人物二 义父 取名 人物一,1
TRAIN_SENT_ID_265970,,杨绛,钱钟书,容安馆 札记 以 读书 时 的 感想 和 思考 为 主要 内容 ， 本书 在 钱钟书 夫人 杨绛 女士 大力支持 下 斥资 精心 影印 ， 具有 很 高 的 学术 价值 。,容安馆 札记 读书 时 感想 思考 主要 内容  本书 人物二 夫人 人物一 女士 大力支持 斥资 精心 影印  具有 高 学术 价值,-1
TRAIN_SENT_ID_278400,,夏正松,于靓,夏正松 和 于靓 结婚 20 多年 ， 抱养 了 大 女儿 友善 ， 生育 了 小女儿 天美 ， 和睦 的 家庭 。,人物一 人物二 结婚  多年  抱养 女儿 友善  生育 小女儿 天美  和睦 家庭,-1
TRAIN_SENT_ID_277914,,霍中曦,郭晶晶,此后 ， 郭晶晶 坚持 母乳喂养 ， 霍启刚 与 儿子 霍中曦 合影 为了 给 宝宝 更 多 的 活动 空间 ， 还 专门 搬离 了 霍家 大宅 。,此后  人物二 坚持 母乳喂养  霍启刚 儿子 人物一 合影 宝宝 更 活动 空间  专门 搬离 霍家 大宅,-1
TRAIN_SENT_ID_286277,,林凯闵,王渝文,王渝文 ， 1971 年 7 月 29 日出 生于 中国台湾 ， 演员 ， 已婚 （ 丈夫 林凯闵 ， 育有 一对 双胞胎 ） 。,人物二   年  月  日出 生于 中国台湾  演员  已婚  丈夫 人物一  育有 一对 双胞胎,-1
TRAIN_SENT_ID_285247,,陈是知,陈可辛,籍贯 广东 番禺 ， 香港 出生 ， 伴侣 为 陈可辛 ， 育有 一 女儿 陈是知 ， 父亲 是 曾 在 亚洲电视 主持 《 六合彩 》 节目 多年 之冬叔 夏 春秋 。,籍贯 广东 番禺  香港 出生  伴侣 人物二  育有 女儿 人物一  父亲 亚洲电视 主持  六合彩  节目 多年 之冬叔 夏 春秋,-1
TRAIN_SENT_ID_283233,,鲍喜顺,夏淑娟,夏淑娟 2007 年 3 月 36 日 ， 内蒙古 赤峰市 敖汉旗 民政部门 的 工作人员 专程 来到 了 鲍喜顺 的 家中 ， 给 他们 办理 结婚 登记手续 。,人物二  年  月  日  内蒙古 赤峰市 敖汉旗 民政部门 工作人员 专程 来到 人物一 家中  办理 结婚 登记手续,-1
TRAIN_SENT_ID_277804,,晋陵公主,谢混,谢混 的 妻子 晋陵公主 是 孝武帝 司马曜 之女 ， 在 谢混 死后 被迫 改嫁 王练 （ 出身 琅 邪 王氏 ） 。,人物二 妻子 人物一 孝武帝 司马曜 之女  人物二 死后 被迫 改嫁 王练  出身 琅 邪 王氏,-1
TRAIN_SENT_ID_263895,,刘嘉玲,梁朝伟,比婚 女 刘嘉玲 : 刘嘉玲 和 梁朝伟 两人 举办 婚礼 远 赴 不丹 ， 举行 的 是 王室 式 婚礼 ， 除了 不丹 国王 证婚 外 ， 约 有 20 名 喇嘛 僧侣 诵经 。,比婚 女 人物一  人物一 人物二 两人 举办 婚礼 远 赴 不丹  举行 王室 式 婚礼  不丹 国王 证婚 外  约  名 喇嘛 僧侣 诵经,-1
TRAIN_SENT_ID_282966,,王晓蓉,王中磊,（ 华谊 兄弟 总裁 王中磊 妻子 ） : 王晓蓉 ， 重庆 人 ， 华谊 兄弟 总裁 王中磊 的 妻子 。,华谊 兄弟 总裁 人物二 妻子   人物一  重庆  华谊 兄弟 总裁 人物二 妻子,-1
TRAIN_SENT_ID_272689,,毛岸青,杨开慧,当时 与 毛泽东 同住 在 这里 的 有 他 的 夫人 杨开慧 及 儿子 毛岸英 、 毛岸青 、 毛岸龙 。,当时 毛泽东 同住 夫人 人物二 儿子 毛岸英  人物一  毛岸龙,-1
TRAIN_SENT_ID_269530,,冯小刚,冯思羽,1 人物 经历 : 冯思羽 年龄 ： 23 周岁 ， 冯小刚 曾离 过 一次 婚 ， 他 与 前妻 张女士 于 1990 年 9 月 28 日生 下 一个 女儿 ， 取名为 冯思语 。,人物 经历  人物二 年龄   周岁  人物一 曾离 一次 婚  前妻 张女士  年  月  日生 一个 女儿  取名为 冯思语,-1
TRAIN_SENT_ID_269971,,姚明,叶莉,婚宴 一共 摆 了 整整 60 桌 ， 超过 了 2007 年 姚明 、 叶莉 的 婚礼 规模 ， 当时 姚明 、 叶莉 在 上海 宴请 了 亲友 ， 一共 10 桌 。,婚宴 一共 摆 整整  桌  超过  年 人物一  人物二 婚礼 规模  当时 人物一  人物二 上海 宴请 亲友  一共  桌,-1
TRAIN_SENT_ID_278530,,李秀文,叶挺,1923 年 8 月 ， 对 国民党 军队 失望 的 叶挺 在 好友 李章达 家 结识 了 后来 成为 他 妻子 的 少女 李秀文 。,年  月  国民党 军队 失望 人物二 好友 李章达 家 结识 后来 成为 妻子 少女 人物一,-1
TRAIN_SENT_ID_271119,,彭丽媛,习近平,作为 中国 国家 主席 习近平 妻子 的 彭丽媛 ， 也 在 自己 关注 的 公共 健康 领域 和 慈善 领域 做出 了 切实 的 贡献 。,中国 国家 主席 人物二 妻子 人物一  关注 公共 健康 领域 慈善 领域 做出 切实 贡献,-1
TRAIN_SENT_ID_273192,,黄苗子,郁风,2004 年 ， 黄苗子 郁风 夫妇 一起 庆祝 了 他俩 的 “ 钻石 婚 ” ， 这 标志 着 他们 共享 了 60 年 幸福 的 婚姻 。,年  人物一 人物二 夫妇 一起 庆祝 他俩  钻石 婚   标志 共享  年 幸福 婚姻,-1
TRAIN_SENT_ID_274199,,岳雷,岳飞,孟帮杰 其他 人物 : 岳飞 岳云 岳雷 岳霆 岳震 岳中 岳甫 岳 安岳 成岳 立岳保 岳真 岳和,孟帮杰 人物  人物二 岳云 人物一 岳霆 岳震 岳中 岳甫 岳 安岳 成岳 立岳保 岳真 岳和,-1
TRAIN_SENT_ID_273409,,杨乐乐,汪涵,果实 戏剧社 成立 : 果实 戏剧社 是 长沙 话剧 人士 张芸 与 芒果 台 台柱 主持人 汪涵 携 爱妻 杨乐乐 共同 成立 。,果实 戏剧社 成立  果实 戏剧社 长沙 话剧 人士 张芸 芒果 台 台柱 主持人 人物二 携 爱妻 人物一 共同 成立,-1
TRAIN_SENT_ID_254237,,曹襄,平阳公主,平阳公主 和 他生 了 个 儿子 名叫 曹襄 ， 曹襄 后来 娶 了 汉武帝 和 卫子夫 女 卫长公主 为妻 。,人物二 他生 儿子 名叫 人物一  人物一 后来 娶 汉武帝 卫子夫 女 卫长公主 为妻,-1
TRAIN_SENT_ID_274603,,薛丁山,薛仁贵,《 国学 典藏 书系 薛仁贵 征东 薛丁山 征西 》 是 2010 年 吉林 出版 集团 社 出版 的 图书 ， 作者 是 《 国家 典藏 书系 》 丛书 编委会 编 。,国学 典藏 书系 人物二 征东 人物一 征西   年 吉林 出版 集团 社 出版 图书  作者  国家 典藏 书系  丛书 编委会 编,-1
TRAIN_SENT_ID_279494,,谭梅,朱军,（ 著名 主持人 朱军 妻子 ） : 谭梅 ， 女 ， 山西 运城 河津 人 ， 影视 演员 、 舞蹈家 ， 从事 舞蹈 表演 及 教学 工作 。,著名 主持人 人物二 妻子   人物一  女  山西 运城 河津  影视 演员  舞蹈家  从事 舞蹈 表演 教学 工作,-1
TRAIN_SENT_ID_254191,,邢夫人,贾赦,我们 知道 ， 贾赦 要纳 鸳鸯 为 妾 ， 按理说 ， 他 的 妻子 邢夫人 是 受到 最 严重 的 损害 的 。,知道  人物二 要纳 鸳鸯 妾  按理说  妻子 人物一 严重 损害,1
TRAIN_SENT_ID_263776,,秦始皇,赵姬,赵姬 ： 秦始皇 的 母亲 ， 著名 的 美女 ， 中国 封建 历史 上 第一个 太后 。,人物二  人物一 母亲  著名 美女  中国 封建 历史 第一个 太后,-1
TRAIN_SENT_ID_251308,,廖仲恺,何香凝,作者简介 : 何香凝 ， 原名 何谏 ， 号 双清 楼主 ， 广东 南海 人 ， 廖仲恺 夫人 。,作者简介  人物二  原名 何谏  号 双清 楼主  广东 南海  人物一 夫人,-1
TRAIN_SENT_ID_250443,,朱常洵,郑贵妃,万历 二十二年 （ 1594 ） ， 欲立 郑贵妃 所 生子 朱常洵 为 太子 ， 廷臣 则 普遍 请立 皇 长子 朱常洛 为 太子 ， 故 朝廷 出现 国本 之争 。,万历 二十二年     欲立 人物二 生子 人物一 太子  廷臣 普遍 请立 皇 长子 朱常洛 太子  朝廷 出现 国本 之争,-1
TRAIN_SENT_ID_285147,,王晶,王天林,其父 王天林 是 1960 年代 香港电影 、 电视 导演 ， 执导 电影 《 野玫瑰 之 王晶 写真照 恋 》 、 《 南北 和 》 。,其父 人物二  年代 香港电影  电视 导演  执导 电影  野玫瑰 人物一 写真照 恋    南北,-1
TRAIN_SENT_ID_281794,,陈杏妍,陈勋奇,基本 信息 : 决战 芝加哥 ， 由 陈勋奇 和 陈杏妍 主演 ， 祝力强 为 导演 的 一部 中国 大陆 影片 。,基本 信息  决战 芝加哥  人物二 人物一 主演  祝力强 导演 一部 中国 大陆 影片,-1
TRAIN_SENT_ID_271692,,田川氏,郑成功,郑成功 的 父亲 郑芝龙 是 一个 海商 兼 海上 走私 集团 的 头目 ， 一生 共有 5 位 妻子 ， 其中 第二位 妻子 田川氏 是 日本 人 。,人物二 父亲 郑芝龙 一个 海商 兼 海上 走私 集团 头目  一生 共有  位 妻子  第二位 妻子 人物一 日本,-1
TRAIN_SENT_ID_272921,,王岳伦,王诗龄,王诗龄 个人 生活 : 王诗龄 的 母亲 是 主持人 李湘 ， 父亲 是 导演 王岳伦 。,人物二 个人 生活  人物二 母亲 主持人 李湘  父亲 导演 人物一,-1
TRAIN_SENT_ID_255128,,胡斐,胡一刀,红花 会 三 当家 赵半山 在 商家堡 路遇 胡一刀 遗孤 胡斐 ， 结为 忘年之交 。,红花 会 三 当家 赵半山 商家堡 路遇 人物二 遗孤 人物一  结为 忘年之交,-1
TRAIN_SENT_ID_271129,,彭丽媛,习近平,会见 前 ， 习近平 和 夫人 彭丽媛 在 卡莫 纳 总统 夫妇 陪同 下 ， 专门 会见 了 特多 中学生 代表 。,会见 前  人物二 夫人 人物一 卡莫 纳 总统 夫妇 陪同  专门 会见 特多 中学生 代表,-1
TRAIN_SENT_ID_286881,,陈珊珊,王光亚,王光亚 1975 年 回国 ， 1 年 多 后 ， 陈珊珊 的 3 个 哥哥 凑钱 为 最小 的 妹妹 张罗 了 婚礼 。,人物二  年 回国   年  人物一  哥哥 凑钱 最小 妹妹 张罗 婚礼,-1
TRAIN_SENT_ID_271320,,何泽慧,钱三强,与 钱三强 结婚 后 ， 已 在 德国 做过 两年 核物理 研究 的 何泽慧 顺利 进入 巴黎大学 居里 实验室 ， 与 钱三强 成为 同事 。,人物二 结婚  德国 做过 两年 核物理 研究 人物一 顺利 进入 巴黎大学 居里 实验室  人物二 成为 同事,-1
TRAIN_SENT_ID_281575,,赵雅倩,赵鑫鑫,赵鑫鑫 新婚 : 7 月 10 日 ， 24 岁 的 象棋 世界冠军 赵鑫鑫 在 家乡 浙江 温岭 登记 结婚 ， 新娘 是 天津 棋手 赵雅倩 。,人物二 新婚   月  日   岁 象棋 世界冠军 人物二 家乡 浙江 温岭 登记 结婚  新娘 天津 棋手 人物一,-1
TRAIN_SENT_ID_265931,,杨绛,钱钟书,婚后 钱瑗 夫妇俩 的 婚姻生活 非常 幸福 ， 王德一 与 钱钟书 、 杨绛 夫妇 的 关系 也 非常 亲密 ， 杨绛 还 亲手 帮 王德一 理过 发 。,婚后 钱瑗 夫妇俩 婚姻生活 非常 幸福  王德一 人物二  人物一 夫妇 关系 非常 亲密  人物一 亲手 帮 王德一 理过 发,-1
TRAIN_SENT_ID_282065,,李度仑,李昌镐,婚礼 上 ， 李昌镐 和 李度仑 透露 ， 他们 将 去 日本 的 小松市 度过 新婚旅行 ， 时间 为 3 天 4 夜 。,婚礼  人物二 人物一 透露  日本 小松市 度过 新婚旅行  时间  天  夜,1
TRAIN_SENT_ID_284647,,李燃,郭涛,2014 年 1 月 15 日 ， 郭涛 携 妻子 李燃 、 儿子 郭子睿 出席 年度 网络 盛宴 “ 2013 新浪 微博之夜 ” 。,年  月  日  人物二 携 妻子 人物一  儿子 郭子睿 出席 年度 网络 盛宴   新浪 微博之夜,-1
TRAIN_SENT_ID_282950,,王晓蓉,王中磊,补办 婚礼 : 2014 年 8 月 30 日 ， 娱乐圈 大佬 、 华谊 兄弟 总裁 王中磊 在 结婚 20 周年 纪念日 上 与 妻子 王晓蓉 补办 婚礼 。,补办 婚礼   年  月  日  娱乐圈 大佬  华谊 兄弟 总裁 人物二 结婚  周年 纪念日 妻子 人物一 补办 婚礼,-1
TRAIN_SENT_ID_262136,,刘翔,葛天,2014 年 5 月 ， 葛天 与 刘翔 恋爱 ， 同年 9 月 8 日 ， 与 刘翔 在 上海市 民政局 婚姻登记 处 领取 了 结婚证 。,年  月  人物二 人物一 恋爱  同年  月  日  人物一 上海市 民政局 婚姻登记 处 领取 结婚证,-1
TRAIN_SENT_ID_274434,,仲满,武宗文,仲 明说 他 特别 想念 儿子 ， 他 还 透露 说 今年 9 月 19 日 ， 将 是 儿子 仲满 和 儿媳 武宗文 举办 婚礼 的 大 好日子 。,仲 明说 特别 想念 儿子  透露 说 今年  月  日  儿子 人物一 儿媳 人物二 举办 婚礼 好日子,-1
TRAIN_SENT_ID_286699,,秋道蝶蝶,秋道丁次,第四次 忍界 大战 中 忍者 联军 第二 部队 队员 ， 在此期间 曾经 中 了 无限 月 读 ， 大战 结束 后 数年 后 嫁 与 秋道丁次 为妻 ， 生一 女儿 秋道蝶蝶 。,第四次 忍界 大战 中 忍者 联军 第二 部队 队员  在此期间 曾经 中 无限 月 读  大战 结束 数年 嫁 人物二 为妻  生一 女儿 人物一,-1
TRAIN_SENT_ID_272244,,金正恩,金正日,金正日 三子 金正恩 在 2010 年 9 月 27 日 的 朝鲜劳动党 代表大会 上 被 授予 人民军 大将军 衔 ， 作为 接班人 正式 亮相 。,人物二 三子 人物一  年  月  日 朝鲜劳动党 代表大会 授予 人民军 大将军 衔  接班人 正式 亮相,-1
TRAIN_SENT_ID_275583,,吴霜,吴祖光,在 《 “ 国贸 ” 案 结束 感言 》 中 ， 吴祖光 回忆 道 ， 1995 年 5 月 12 日 下午 两点 ， 吴祖光 带 着 小女儿 吴霜 走 到 朝阳区 法院 出席 最后 庭审 。,国贸  案 结束 感言  中  人物二 回忆 道   年  月  日 下午 两点  人物二 带 小女儿 人物一 走 朝阳区 法院 出席 最后 庭审,-1
TRAIN_SENT_ID_258448,,张兆和,沈从文,从 二十世纪 三十 年代 沈从文 和 张兆和 二人 初识 的 一场 恋爱 风波 开始 ， 到 新婚 初别 ， 乃至 到 “ 文革 ” 前夕 为止 ， 横亘 三十余年 。,二十世纪 三十 年代 人物二 人物一 二人 初识 一场 恋爱 风波  新婚 初别   文革  前夕  横亘 三十余年,-1
TRAIN_SENT_ID_282956,,王晓蓉,王中磊,2014 年 8 月 30 日 ， 娱乐圈 大佬 、 华谊 兄弟 总裁 王中磊 在 结婚 20 周年 纪念日 上 与 妻子 王晓蓉 补办 婚礼 。,年  月  日  娱乐圈 大佬  华谊 兄弟 总裁 人物二 结婚  周年 纪念日 妻子 人物一 补办 婚礼,-1
TRAIN_SENT_ID_271142,,彭丽媛,习近平,习近平 主席 偕 夫人 彭丽媛 ， 和 中央电视台 工作人员 一行 超过 百 人 此次 出访 选择 下榻 位于 坦 首都 达累斯萨拉姆 市中心 的 塞雷纳 酒店 。,人物二 主席 偕 夫人 人物一  中央电视台 工作人员 一行 超过 百 出访 选择 下榻 位于 坦 首都 达累斯萨拉姆 市中心 塞雷纳 酒店,-1
TRAIN_SENT_ID_271635,,毛岸青,毛泽东,1920 年末 毛泽东 同 杨开慧 已经 结婚 ， 至 1923 年 12 月 已 生下 毛岸英 、 毛岸青 两个 儿子 。,年末 人物二 杨开慧 已经 结婚   年  月 生下 毛岸英  人物一 两个 儿子,-1
TRAIN_SENT_ID_276571,,孔子,亓官氏,19 岁 ： 公元前 533 年 （ 鲁昭公 九年 ） 孔子 娶 宋人 亓官氏 之女 为 妻 。,岁  公元前  年  鲁昭公 九年  人物一 娶 宋人 人物二 之女 妻,-1
TRAIN_SENT_ID_254107,,霍启刚,郭晶晶,据知 33 岁 的 霍启刚 与 30 岁 的 郭晶晶 ， 婚后 会 火速 造 人 ， 为 霍家 添丁 。,据知  岁 人物一  岁 人物二  婚后 会 火速 造  霍家 添丁,-1
TRAIN_SENT_ID_261487,,谢依纯,马国毕,结婚 : 马国毕 跟 谢依纯 2010 年 8 月 2 日 才刚 订婚 。,结婚  人物二 人物一  年  月  日 才刚 订婚,1
