sent_id,sent_id,entity1,entity2,sent,processed_sent,human
TRAIN_SENT_ID_282582,,林于超,林依晨,林依晨 个人 情感 : 2014 年 10 月 29 日 下午 ， 林依晨 在 台北 举办 与 林于超 的 订 订婚 喜宴 ( 5 张 ),人物二 个人 情感   年  月  日 下午  人物二 台北 举办 人物一 订 订婚 喜宴   张,-1
TRAIN_SENT_ID_274940,,章曙,章启月,章启月 ， 1959 年 10 月 出 生于 北京 一个 外交官 家庭 ， 父亲 是 前 驻 比利时 、 日本 大使 章曙 先生 。,人物二   年  月 出 生于 北京 一个 外交官 家庭  父亲 前 驻 比利时  日本 大使 人物一 先生,-1
TRAIN_SENT_ID_282040,,费麒,罗海琼,华谊 副总 费麒 ( 右 ) 华谊 女星 罗海琼 被 证实 于 2010 年 1 月 24 号 与 相恋 多年 的 男友 ， 华谊 的 副总裁 费麒 在 北京 柏悦 酒店 举行 婚礼 。,华谊 副总 人物一  右  华谊 女星 人物二 证实  年  月  号 相恋 多年 男友  华谊 副总裁 人物一 北京 柏悦 酒店 举行 婚礼,-1
TRAIN_SENT_ID_266594,,许晋亨,李嘉欣,2011 年 2 月 8 日 ， 41 岁 香港 女艺人 李嘉欣 ， 于 香港 养 和 医院 产下 她 与 许晋亨 的 儿子 。,年  月  日   岁 香港 女艺人 人物二  香港 养 医院 产下 人物一 儿子,-1
TRAIN_SENT_ID_285728,,周翠英,郑裕彤,郑裕彤 个人 生活 : 郑裕彤 与 周翠英 是 指腹为婚 ， 即 在 出生 前 已 由 家长 决定 婚姻 ， 在 1943 年 正式 结婚 至今 。,人物二 个人 生活  人物二 人物一 指腹为婚  出生 前 家长 决定 婚姻   年 正式 结婚,-1
TRAIN_SENT_ID_279587,,马丽娟,赵本山,虽然 赵本山 经常 在 外面 演出 ， 可是 马丽娟 心里有数 ， 自己 的 丈夫 是 个 有 责任心 的 男人 。,人物二 经常 外面 演出  人物一 心里有数  丈夫 责任心 男人,1
TRAIN_SENT_ID_273994,,白素,卫斯理,（ 倪匡 笔下 《 卫斯理 系列 》 人物 ） : 白素 ， 是 香港 作家 倪匡 的 科幻小说 《 卫斯理 系列 》 中 的 主角 卫斯理 之妻 。,倪匡 笔下  人物二 系列  人物   人物一  香港 作家 倪匡 科幻小说  人物二 系列  中 主角 人物二 之妻,-1
TRAIN_SENT_ID_270184,,蒋雯丽,顾长卫,四 、 一对 互相 欣赏 的 夫妻 — — 蒋雯丽 和 顾长卫 夫妇,四  一对 互相 欣赏 夫妻   人物一 人物二 夫妇,1
TRAIN_SENT_ID_284025,,胡青牛,王难姑,这 对 夫妻 ， 就是 胡青牛 和 王难姑 。,夫妻  人物一 人物二,1
TRAIN_SENT_ID_261059,,岳不群,岳灵珊,"他成 了 岳灵珊 的 哥哥 , 令狐冲 的 师兄 , 当然 也 就 成 了 岳不群 的 儿子 。",他成 人物二 哥哥  令狐冲 师兄  成 人物一 儿子,-1
TRAIN_SENT_ID_275338,,潘巧云,杨雄,杜兴 计救 时迁 : 石秀 与 杨雄 杀 了 偷情 的 裴如海 和 潘巧云 ( 杨雄 的 妻子 ) 后 ， 决定 投奔 梁山 。,杜兴 计救 时迁  石秀 人物二 杀 偷情 裴如海 人物一  人物二 妻子   决定 投奔 梁山,1
TRAIN_SENT_ID_274723,,龙啸云,林诗音,小李飞刀 林诗音 : 林诗音 李寻欢 指腹为婚 的 表妹 ， 亦 是 他 青梅竹马 的 恋人 ， 因 李寻欢 的 想 让 之举 嫁 与 龙啸云 ， 造成 她 一生 的 悲剧 。,小李飞刀 人物二  人物二 李寻欢 指腹为婚 表妹  青梅竹马 恋人  李寻欢 想 之举 嫁 人物一  造成 一生 悲剧,1
TRAIN_SENT_ID_283779,,李静民,姜昆,姜昆 的 妻子 ， 李静民 ， 是 一名 曲艺 说唱 大师 。,人物二 妻子  人物一  一名 曲艺 说唱 大师,1
TRAIN_SENT_ID_256755,,邵昕,黄玉婷,黄玉婷 事件 : 日前 邵昕 召开 记者会 ， 会上 驳斥 前妻 婷婷 拿 孩子 来 炒作 ， 直言 这种 行为 很 可耻 。,人物二 事件  日前 人物一 召开 记者会  会上 驳斥 前妻 婷婷 孩子 炒作  直言 这种 行为 可耻,1
TRAIN_SENT_ID_268225,,王小利,李琳,兔年 春晚 ， 赵本山 不仅 带上 了 小 沈阳 和 王小利 ， 还 带上 了 王小利 的 老婆 李琳 ， 她 在 《 乡村 爱情 》 中 扮演 谢兰 。,兔年 春晚  赵本山 带上 沈阳 人物一  带上 人物一 老婆 人物二   乡村 爱情  中 扮演 谢兰,1
TRAIN_SENT_ID_252258,,秦嘉,徐淑,《 秦嘉 妻 徐淑 答诗 一首 》 是 汉代 诗人 秦嘉 的 作品 之一 。,人物一 妻 人物二 答诗 一首  汉代 诗人 人物一 作品,1
TRAIN_SENT_ID_258957,,王熙凤,贾琏,在 第七回 上半 回里 ， 曹雪芹 特别 写 到 贾琏 、 王熙凤 和谐 的 夫妻生活 。,第七回 上半 回里  曹雪芹 特别 写 人物二  人物一 和谐 夫妻生活,1
TRAIN_SENT_ID_261983,,彭湃,周凤,当 他 知道 彭湃 母亲 周凤 想 找 一户 人家 ， 抚养 即将 降世 的 孙儿 时 ， 毅然 承担 起 这个 责任 。,知道 人物一 母亲 人物二 想 找 一户  抚养 即将 降世 孙儿 时  毅然 承担 责任,-1
TRAIN_SENT_ID_285036,,朱见深,朱祁镇,英宗 朱祁镇 回到 北京 以后 ， 代宗 将 其 软禁 于 南宫 ， 废 太子 朱见深 ， 英宗 时刻 想 恢复 自己 的 帝位 ， 在 暗中 寻找机会 。,英宗 人物二 回到 北京 以后  代宗 软禁 南宫  废 太子 人物一  英宗 时刻 想 恢复 帝位  暗中 寻找机会,-1
TRAIN_SENT_ID_281486,,吕牧石,马慧先,吕牧石 马慧先 : 马慧先 ， 吕牧石 之妻 。,人物一 人物二  人物二  人物一 之妻,1
TRAIN_SENT_ID_284175,,水均益,杨迪,2010 年 ， 水均益 与 央视 体育频道 记者 杨迪 结婚 ， 水均益 比 杨迪 大 13 岁 。,年  人物一 央视 体育频道 记者 人物二 结婚  人物一 人物二  岁,1
TRAIN_SENT_ID_277302,,李明博,金润玉,韩国联合通讯社 援引 李明博 一位 亲信 的话 说 ， 作为 “ 第一夫人 ” ， 金润玉 一定 会 恰到好处 地站 在 丈夫 李明博 身边 起到 积极 的 作用 。,韩国联合通讯社 援引 人物一 一位 亲信 说   第一夫人   人物二 一定 会 恰到好处 地站 丈夫 人物一 身边 起到 积极 作用,1
TRAIN_SENT_ID_282386,,骆冰,文泰来,“ 奔雷 手 ” 文泰来 — — 四 当家 ， 骆冰 的 丈夫 。,奔雷 手  人物二   四 当家  人物一 丈夫,1
TRAIN_SENT_ID_255857,,蒋介石,宋美龄,1943 年 与 蒋纬国 在 西安 常 宁宫 结为 连理 ， 由 蒋介石 、 宋美龄 主婚 。,年 蒋纬国 西安 常 宁宫 结为 连理  人物一  人物二 主婚,1
TRAIN_SENT_ID_262004,,王明华,梅兰芳,姑母 王明华 是 梅兰芳 夫人 。,姑母 人物一 人物二 夫人,1
TRAIN_SENT_ID_255112,,鲁元公主,张敖,燕灵 王刘建 鲁元公主 丈夫 : 张敖 ， 初袭 赵王 位 。,燕灵 王刘建 人物一 丈夫  人物二  初袭 赵王 位,1
TRAIN_SENT_ID_254204,,邢夫人,贾赦,【 邢夫人 】 贾赦 之妻 ， 只知 一味 顺从 丈夫 ， 不明 事理 ， 耳根 软 ，,人物一  人物二 之妻  只知 一味 顺从 丈夫  不明 事理  耳根 软,1
TRAIN_SENT_ID_255871,,蒋介石,宋美龄,蒋介石 和 宋美龄 结婚 ， 谭延闿 为 介绍 人 。,人物一 人物二 结婚  谭延闿 介绍,1
TRAIN_SENT_ID_278816,,任盈盈,任我行,出寺 后 与 任盈盈 相救 囚 于梅 庄 的 任我行 。,出寺 人物一 相救 囚 于梅 庄 人物二,-1
TRAIN_SENT_ID_284358,,唐筼,陈寅恪,陈唐 结婚 甚晚 ， 于 1928 年 在 上海 结婚 ， 陈寅恪 时 年三十 有 八 ， 唐筼 亦 三十 。,陈唐 结婚 甚晚   年 上海 结婚  人物二 时 年三十 八  人物一 三十,1
TRAIN_SENT_ID_264080,,刘备,孙尚香,吴国太 得知 后 大喜 ， 命 孙权 立即 为 刘备 和 孙尚香 举办 婚事 。,吴国太 得知 大喜  命 孙权 立即 人物一 人物二 举办 婚事,1
TRAIN_SENT_ID_271905,,阎婆惜,宋江,发现 妻子 与 一个 年轻人 搀扶着 走来 ， 悲愤 交集 的 宋江 怒斥 阎婆惜 的 不孝 和 不贞 ， 并 捡起 地上 的 天师 剑 向 阎婆惜 索要 天师 符 。,发现 妻子 一个 年轻人 搀扶着 走来  悲愤 交集 人物二 怒斥 人物一 不孝 不贞  捡起 地上 天师 剑 人物一 索要 天师 符,1
TRAIN_SENT_ID_284607,,王丽萍,吴镇宇,不过 五位 妈妈 中 ， 吴镇宇 老婆 王丽萍 仍 未 揭下 神秘 面纱 ， 仅仅 露出 些许 侧脸 。,五位 妈妈 中  人物二 老婆 人物一 未 揭下 神秘 面纱  仅仅 露出 些许 侧脸,1
TRAIN_SENT_ID_250300,,秦始皇,胡亥,好 在 胡亥 也 不愧 是 秦始皇 帝 的 儿子 ， 他 差不多 是 用不着 我教 ， 便是 天生 的 一个 坏蛋 。,人物二 不愧 人物一 帝 儿子  差不多 用不着 我教  便是 天生 一个 坏蛋,-1
TRAIN_SENT_ID_266482,,严世蕃,严嵩,近来 ， 严嵩 罢相 ， 严世蕃 被 处以 极刑 ， 勉强 可以 令人满意 ， 一时 人称 天下 清明 。,近来  人物二 罢相  人物一 处以 极刑  勉强 令人满意  一时 人称 天下 清明,-1
TRAIN_SENT_ID_282179,,杨铁心,杨康,杨康 主线 : 化名 穆易 的 杨铁心 带 着 养女 穆念慈 在 北京 摆 下 比武招亲 ， 并 说 只要 打败 即可 取得 穆念慈 ， 一路上 也 从未 有人 打败 穆念慈 。,人物二 主线  化名 穆易 人物一 带 养女 穆念慈 北京 摆 比武招亲  说 打败 即可 取得 穆念慈  一路上 从未 有人 打败 穆念慈,-1
TRAIN_SENT_ID_271088,,彭丽媛,习近平,作为 习近平 的 妻子 ， 原本 就 在 镁光灯 下 的 彭丽媛 将 跟随 习近平 在 国际舞台 上 展开 “ 中国 第一夫人 ” 的 魅力 攻势 。,人物二 妻子  原本 镁光灯 人物一 跟随 人物二 国际舞台 展开  中国 第一夫人  魅力 攻势,1
TRAIN_SENT_ID_279398,,张维,陆士嘉,张维 夫人 陆士嘉 本人 便是 极 优秀 的 科学家 ， 她 完成 了 另 一种 意义 上 的 “ 双肩挑 ” ： 家庭 和 事业 。,人物一 夫人 人物二 便是 极 优秀 科学家  完成 一种 意义  双肩挑   家庭 事业,1
TRAIN_SENT_ID_282533,,蔡绿峰,陈娟娟,他 继承 了 父亲 的 船务 事业 ， 并 将 蔡绿峰 和 夫人 陈娟娟 产业 扩大 。,继承 父亲 船务 事业  人物一 夫人 人物二 产业 扩大,1
TRAIN_SENT_ID_275707,,韩岫岩,王近山,尽管 王近山 在 南京 已有 自己 的 家 ， 有 名正言顺 的 夫人 照料 着 ， 韩岫岩 还是 忍不住 买 了 大 包小包 的 补品 想 去 趟 南京 ， 看 他 一眼 。,人物二 南京 已有 家  名正言顺 夫人 照料  人物一 忍不住 买 包小包 补品 想 趟 南京  一眼,1
TRAIN_SENT_ID_256028,,蒋介石,宋美龄,原来 ， 卫立煌 夫妇 在 上海 举行 婚礼 的 时候 ， 正赶上 蒋介石 与 宋美龄 举行 “ 世纪 婚礼 ” ， 朱韵 珩 因此 结识 了 宋美龄 。,原来  卫立煌 夫妇 上海 举行 婚礼  正赶上 人物一 人物二 举行  世纪 婚礼   朱韵 珩 结识 人物二,1
TRAIN_SENT_ID_283884,,王小平,郑晓龙,1992 年 夏天 郑晓龙 与 王小平 在 美国 完婚 。,年 夏天 人物二 人物一 美国 完婚,1
TRAIN_SENT_ID_283961,,王难姑,胡青牛,人物 分析 : 胡青牛 给 人 最 深刻 的 印象 不是 他 的 医术 ， 而是 他 与 妻子 王难姑 的 夫妻生活 方式 。,人物 分析  人物二 深刻 印象 医术  妻子 人物一 夫妻生活 方式,1
TRAIN_SENT_ID_271672,,陆乘风,陆冠英,关海山 （ 陆乘风 ） ， 惠天赐 （ 陆冠英 ）,关海山  人物一   惠天赐  人物二,-1
TRAIN_SENT_ID_252107,,黄毅清,黄奕,事实上 ， 黄奕 前夫 黄毅清 就 在 微博 发表 长文 《 爱 ， 不 只是 依赖 》 ， 透露 已 做好 离婚 准备 。,事实上  人物二 前夫 人物一 微博 发表 长文  爱  依赖   透露 做好 离婚 准备,1
TRAIN_SENT_ID_268775,,孟明视,百里奚,之所以 主张 百里奚 与 孟明视 是 一人 而 非 二人 ， 其 理由 亦 可以 举出 下列 几点 ：,主张 人物二 人物一 一人 非 二人  理由 举出 下列 几点,-1
TRAIN_SENT_ID_281550,,李锐,蒋韵,蒋韵 家庭成员 : 丈夫 ： 李锐,人物二 家庭成员  丈夫  人物一,1
TRAIN_SENT_ID_278419,,苗若兰,苗人凤,苗人凤 误会 胡斐 之后 为何 火气 特别 大 ， 是因为 他 的 那 一段 不堪回首 的 伤心事 ， 对 苗若兰 的 事 特别 敏感 。,人物二 误会 胡斐 之后 火气 特别  是因为 一段 不堪回首 伤心事  人物一 事 特别 敏感,-1
TRAIN_SENT_ID_271735,,石厚,石碏,石碏 恨 儿子 大逆不道 ， 设计 让 陈国 陈桓公 除掉 了 州 吁 与 石厚 。 ”,人物二 恨 儿子 大逆不道  设计 陈国 陈桓公 除掉 州 吁 人物一,-1
TRAIN_SENT_ID_285913,,上官兰心,朱常洛,李梅儿 《 美人计 》 : 明光宗 朱常洛 即位 后 ， 他 梦想 与 深爱 的 妻子 上官兰心 双宿双飞 ， 白头到老 。,李梅儿  美人计   明光宗 人物二 即位  梦想 深爱 妻子 人物一 双宿双飞  白头到老,1
TRAIN_SENT_ID_255612,,蒋介石,宋美龄,朱韵 珩 与 宋美龄 的 “ 太太 路线 ” 是 双向 的 ， 不但 朱韵 珩 利用 这个 关系 帮助 丈夫 接近 蒋介石 ， 宋美龄 也 以此 帮助 蒋介石 笼络 人才 。,朱韵 珩 人物二  太太 路线  双向  朱韵 珩 利用 关系 帮助 丈夫 接近 人物一  人物二 以此 帮助 人物一 笼络 人才,1
TRAIN_SENT_ID_276768,,丁夫人,曹操,从此 之后 ， 丁夫人 拒绝 跟 任何人 回到 后宫 ， 也 拒绝 见 曹操 的 任何 心腹 和 使臣 。,之后  人物一 拒绝 任何人 回到 后宫  拒绝 见 人物二 心腹 使臣,1
TRAIN_SENT_ID_282401,,陈品亨,陈鸿烈,陈鸿烈 的 突然 离世 引起 舆论 的 普遍 关注 ， 作为 陈鸿烈 女儿 的 陈品亨 也 受到 了 较大 关注 。,人物二 突然 离世 引起 舆论 普遍 关注  人物二 女儿 人物一 较大 关注,-1
TRAIN_SENT_ID_261483,,谢依纯,马国毕,"2011.09 . 22 明星 夫妻 合体 舞蹈 比赛 ( 下 ) 来宾 ： 沈玉琳 芽芽 , 黄镫辉 萁 萁 , 马国毕 谢依纯 , 艾力克斯 李咏娴 , Kimiko",明星 夫妻 合体 舞蹈 比赛   来宾  沈玉琳 芽芽  黄镫辉 萁 萁  人物二 人物一  艾力克斯 李咏娴,1
TRAIN_SENT_ID_260927,,贾珍,贾蓉,5 . 贾蓉 配 秦可卿 ， 秦可卿 与 公公 贾珍 关系暧昧 。,人物二 配 秦可卿  秦可卿 公公 人物一 关系暧昧,-1
TRAIN_SENT_ID_254174,,邢夫人,贾赦,她 从小 死 了 娘 ， 她 父亲 贾赦 和 邢夫人 对 她 毫不 怜惜 ， 贾赦 欠 了 孙家 五千两 银子 ， 将 她 嫁给 孙家 ， 实际上 等于 拿 她 抵债 。,从小 死 娘  父亲 人物二 人物一 毫不 怜惜  人物二 欠 孙家 五千两 银子  嫁给 孙家  实际上 等于 抵债,1
TRAIN_SENT_ID_273938,,江冬秀,胡适,西部 是 胡适 与 江冬秀 结婚 房间 ， 房内 有 木床 、 桌 、 椅 、 橱 、 凳 等 。,西部 人物二 人物一 结婚 房间  房内 木床  桌  椅  橱  凳,1
TRAIN_SENT_ID_252229,,秦嘉,徐淑,秦嘉 、 徐淑 夫妇 恩爱 ， 都 能 诗文 。,人物一  人物二 夫妇 恩爱  诗文,1
TRAIN_SENT_ID_286835,,刘元,邓晨,刘元 嫁 邓晨 为妻 。,人物一 嫁 人物二 为妻,1
TRAIN_SENT_ID_279521,,李芳远,李成桂,在 李成桂 夺取 最高 权力 的 过程 中 ， 其五子 李芳远 功劳 最大 。,人物二 夺取 最高 权力 过程 中  其五子 人物一 功劳 最大,-1
TRAIN_SENT_ID_258893,,王熙凤,贾琏,8 、 王熙凤 ， 贾琏 之妻 ， 精明强干 ， 深得 贾母 和 王夫人 的 信任 ， 是 贾府 的 实际 大管家 。,人物一  人物二 之妻  精明强干  深得 贾母 王夫人 信任  贾府 实际 大管家,1
TRAIN_SENT_ID_258780,,刘禅,刘备,为了 大局 着想 没有 打 起来 ， 而 被 刘禅 抓去 见 刘备 ， 哪 知易 小霏 竟然 认识 刘备 ， 麻烦 解除 。,大局 着想 没有 起来  人物一 抓去 见 人物二  知易 小霏 竟然 认识 人物二  麻烦 解除,-1
TRAIN_SENT_ID_276165,,苏蕙,窦滔,或云起 自 窦滔 妻 苏蕙 ， 于锦 上 织成 文 ， 顺读 与 倒 读皆成 诗句 。,或云起 人物二 妻 人物一  于锦 织成 文  顺读 倒 读皆成 诗句,1
TRAIN_SENT_ID_262544,,扶苏,秦始皇,扶苏 的 劝谏 触怒 了 秦始皇 。,人物一 劝谏 触怒 人物二,-1
TRAIN_SENT_ID_249806,,张承中,任家萱,2016 年 3 月 4 日 ， 任家萱 在 社交 网站 Facebook 宣布 与 张承中 离婚 ， 4 月 27 日 任家萱 与 张承中 办理 离婚 手续 。,年  月  日  人物二 社交 网站  宣布 人物一 离婚   月  日 人物二 人物一 办理 离婚 手续,1
TRAIN_SENT_ID_261459,,莫绍谦,慕咏飞,婚后 两人 便 分居 生活 ， 莫绍谦 几番 要求 离婚 ， 慕咏飞 以 生意 要挟 维持 。,婚后 两人 便 分居 生活  人物一 几番 要求 离婚  人物二 生意 要挟 维持,1
TRAIN_SENT_ID_265706,,贾环,贾政,先写 贾政 不满 于宝玉 精神 萎靡 ， 次 写 忠顺 府 索琪官 ， 接写 贾环 进 谗言 ， 终于 激怒 贾政 。,先写 人物二 不满 于宝玉 精神 萎靡  次 写 忠顺 府 索琪官  接写 人物一 进 谗言  终于 激怒 人物二,-1
TRAIN_SENT_ID_252179,,秦嘉,徐淑,秦嘉 当时 曾 派车去 接 她 ， 还给 她 写 了 一封信 ( 《 与 妻 徐淑 书 》 ) 。,人物一 当时 派车去 接  还给 写 一封信   妻 人物二 书,1
TRAIN_SENT_ID_258918,,王熙凤,贾琏,【 王熙凤 】 小名 凤姐儿 ， 浑号 凤辣子 ， 贾琏 之妻 。,人物一  小名 凤姐儿  浑号 凤辣子  人物二 之妻,1
TRAIN_SENT_ID_279523,,李芳远,李成桂,2 政变 过程 : 李芳远 发动 政变 时 ， 李成桂 正在 病中 。,政变 过程  人物一 发动 政变 时  人物二 正在 病中,-1
TRAIN_SENT_ID_277544,,柴绍,平阳公主,同年 柴绍 的 妻子 平阳公主 去世 。,同年 人物一 妻子 人物二 去世,1
TRAIN_SENT_ID_263873,,刘嘉玲,梁朝伟,梁朝伟 和 刘嘉玲 昨天 举行 婚前 欢迎 派对 ， 以 不丹 菜 招待 近 百位 宾客 。,人物二 人物一 昨天 举行 婚前 欢迎 派对  不丹 菜 招待 近 百位 宾客,1
TRAIN_SENT_ID_258896,,王熙凤,贾琏,如 贾琏 之 于 王熙凤 ， 薛蟠 已 是 如此 ； 可乐 的 是 ， 男人 拿 厉害 的 娇妻 没辙 ， 就 只能 拿 温顺 的 美妾 出气 。,人物二 人物一  薛蟠  可乐  男人 厉害 娇妻 没辙  只能 温顺 美妾 出气,1
TRAIN_SENT_ID_276771,,丁夫人,曹操,夏侯渊 ， 字妙 才 ， 夏侯惇 从弟 ， 曹操 连襟 ， 娶 丁夫人 之妹 。,夏侯渊  字妙  夏侯惇 从弟  人物二 连襟  娶 人物一 之妹,1
TRAIN_SENT_ID_277775,,晋陵公主,谢混,后来 晋孝武帝 欲 以 晋陵公主 尚 谢混 ， 而 袁崧 又 欲 以 女妻 谢混 。,后来 晋孝武帝 欲 人物一 尚 人物二  袁崧 欲 女妻 人物二,1
TRAIN_SENT_ID_254063,,朱芳雨,胡美,朱芳雨 的 桌上 摆着 厚厚的 一叠 红包 ， 他 说 有 160 个 ， 就 怕 到 了 女方 “ 家里 ” 红包 不够 ， 所以 多 准备 一 胡美 结婚 时 的 照片 ( 20 张 ),人物一 桌上 摆着 厚厚的 一叠 红包  说   怕 女方  家里  红包 不够  准备 人物二 结婚 时 照片   张,1
TRAIN_SENT_ID_258921,,王熙凤,贾琏,贾链 红楼梦 中 相关 故事 : 贾琏 是 王熙凤 的 丈夫 ， 贾赦 的 儿子 。,贾链 红楼梦 中 相关 故事  人物二 人物一 丈夫  贾赦 儿子,1
TRAIN_SENT_ID_257201,,孙秀青,西门吹雪,西门吹雪 是 一把 剑 ， 做 剑 的 妻子 ， 滋味 可是 不怎么样 的 ， 只有 孙秀青 ， 默默地 承受 了 下来 ， 默默地 爱着 自己 的 丈夫 。,人物二 一把 剑  做 剑 妻子  滋味 不怎么样  人物一  默默地 承受 下来  默默地 爱着 丈夫,1
TRAIN_SENT_ID_276013,,贾午,贾充,贾充 只好 顺水推舟 ， 把 女儿 贾午 许配给 了 韩寿 。,人物二 只好 顺水推舟  女儿 人物一 许配给 韩寿,-1
TRAIN_SENT_ID_273495,,殷素素,张翠山,当 殷素素 叫 张翠山 把 她 杀 了 以全 武当七侠 之义 时 ， 张翠山 举刀 对 着 妻子 时 眼睛 里 有 怒 ， 有怨 ， 有 恨 ， 也 有 爱 。,人物一 人物二 杀 以全 武当七侠 之义 时  人物二 举刀 妻子 时 眼睛 里 怒  有怨  恨  爱,1
TRAIN_SENT_ID_283968,,王逸宸,王宁,王宁 个人 生活 : 两人 相识 相恋 于 大学校园 ， 1988 年 结婚 ， 为了 不 影响 工作 ， 所以 十年 后 才 有 了 女儿 王逸宸 。,人物二 个人 生活  两人 相识 相恋 大学校园   年 结婚  影响 工作  十年 女儿 人物一,-1
TRAIN_SENT_ID_285006,,庄月明,李嘉诚,李嘉诚 全传 第七章 心心相印 亲上 结亲 喜叠喜 : 李嘉诚 的 妻子 是 表妹 庄月明 。,人物二 全传 第七章 心心相印 亲上 结亲 喜叠喜  人物二 妻子 表妹 人物一,1
TRAIN_SENT_ID_278263,,王珂,刘涛,王珂 家庭 关系 : 王珂 妻子 刘涛 : 刘涛 ， 内地 著名 女演员 。,人物一 家庭 关系  人物一 妻子 人物二  人物二  内地 著名 女演员,1
TRAIN_SENT_ID_269484,,荆轲,荆天明,好友 ： 韩申 （ 四处 漫游 的 墨家 剑客 ， 荆轲 最好 的 朋友 ， 后 为 保护 荆天明 而 死 ）,好友  韩申  四处 漫游 墨家 剑客  人物一 最好 朋友  保护 人物二 死,-1
TRAIN_SENT_ID_254198,,邢夫人,贾赦,伯母 ： 邢夫人 （ 贾赦 填房 ）,伯母  人物一  人物二 填房,1
TRAIN_SENT_ID_268468,,梁静慈,甄子丹,梁静慈 喜 得 贵子 : 婚后 ， 甄子丹 说服 梁静慈 辞职 在家 。,人物一 喜 贵子  婚后  人物二 说服 人物一 辞职 在家,1
TRAIN_SENT_ID_277481,,余鱼同,李沅芷,余鱼同 英俊潇洒 ， 长 的 一表人才 ， 初 非常 爱慕 已为 人妻 的 骆冰 ， 后 与 官家 小姐 李沅芷 相恋 并 最终 结为 连理 。,人物一 英俊潇洒  长 一表人才  初 非常 爱慕 已为 人妻 骆冰  官家 小姐 人物二 相恋 最终 结为 连理,1
TRAIN_SENT_ID_279584,,马丽娟,赵本山,1992 年 ， 赵本山 与 马丽娟 结婚 。,年  人物二 人物一 结婚,1
TRAIN_SENT_ID_274762,,韩淑秀,郭松龄,韩淑秀 冒死 搭救 心上人 : 郭松龄 的 夫人 韩淑秀 （ 1891 － 1925 ） ， 堪称 奉天 奇女子 。,人物一 冒死 搭救 心上人  人物二 夫人 人物一       堪称 奉天 奇女子,1
TRAIN_SENT_ID_268133,,樊梨花,薛丁山,最后 ， 樊梨花 率军出 寒江关 ， 与 薛丁山 的 唐军 汇合 ， 夫妻 一同 进军 西域 。,最后  人物一 率军出 寒江关  人物二 唐军 汇合  夫妻 一同 进军 西域,1
TRAIN_SENT_ID_263725,,郭槐,贾充,贾充 也 因 畏惧 郭槐 ， 辞让 了 准置 两 夫人 的 诏书 。,人物二 畏惧 人物一  辞让 准置 两 夫人 诏书,1
TRAIN_SENT_ID_258387,,张兆和,沈从文,与 妻子 于立群 及 子女 1940 年 与 友人 沈从文 、 肖珊 、 张兆和 、 王树 藏 等 在 昆明 西山 。,妻子 于立群 子女  年 友人 人物二  肖珊  人物一  王树 藏 昆明 西山,1
TRAIN_SENT_ID_256161,,蒋介石,宋美龄,就是 在 这次 晚会 上 ， 蒋介石 第一次 见到 了 年轻漂亮 、 气质 出众 的 宋美龄 ， 决心 不惜一切 代价 娶 她 为 妻 ， 但 遭到 宋庆龄 的 坚决 反对 。,晚会  人物一 第一次 见到 年轻漂亮  气质 出众 人物二  决心 不惜一切 代价 娶 妻  遭到 宋庆龄 坚决 反对,1
TRAIN_SENT_ID_281484,,吕牧石,马慧先,马腾蛟 马慧先 : 马慧先 （ 1929 — — ） ， 吕牧石 之妻 。,马腾蛟 人物二  人物二       人物一 之妻,1
TRAIN_SENT_ID_273837,,范柳原,白流苏,白流苏 似乎 为了 抵制 范柳原 的 始乱终弃 ， 她 在 回忆 中 ， 尽情 地 把 思维 的 触角 落 在 和 自己 之间 没有 爱情 ， 而 只有 亲情 的 丈夫 齐 致远 身上 。,人物二 似乎 抵制 人物一 始乱终弃  回忆 中  尽情 思维 触角 落 之间 没有 爱情  亲情 丈夫 齐 致远 身上,1
TRAIN_SENT_ID_260928,,贾珍,贾蓉,贾珍 又 吩咐 贾蓉 道 ： “ 你 跟 了 你 叔叔 去 ， 也 到 那边 给 老太太 、 老爷 、 太太 们 请安 ， 说 我 和 你 娘 都 请安 ， 打听 打听 老太太 身上 可 大安 了 ？,人物一 吩咐 人物二 道   叔叔  老太太  老爷  太太 请安  说 娘 请安  打听 打听 老太太 身上 大安,-1
TRAIN_SENT_ID_264615,,纪晓芙,杨不悔,与 峨嵋 女弟子 纪晓芙 有 一段 情缘 ， 杨逍 悲 她 去世 ， 一生 不 娶 ， 抚养 女儿 杨不悔 长大 ， 从 桀骜 浪子 转变 为 慈父 。,峨嵋 女弟子 人物一 一段 情缘  杨逍 悲 去世  一生 娶  抚养 女儿 人物二 长大  桀骜 浪子 转变 慈父,-1
TRAIN_SENT_ID_259451,,贾兰,李纨,李纨 的 “ 晚 韶华 ” 与 贾兰 的 “ 虚名 儿,人物二  晚 韶华  人物一  虚名,-1
TRAIN_SENT_ID_278525,,李秀文,叶挺,1925 年 ， 叶挺 与 李秀文 结婚 。,年  人物二 人物一 结婚,1
TRAIN_SENT_ID_268344,,秦始皇,扶苏,最后 就是 蒙恬 和 公子 扶苏 曾经 多次 上书 秦始皇 请求 减免 徭役 ， 同时 ， 和 扶苏 商议 如何 合理安排 人力 ， 来 减轻 徭役 。,最后 蒙恬 公子 人物二 曾经 多次 上书 人物一 请求 减免 徭役   人物二 商议 合理安排 人力  减轻 徭役,-1
TRAIN_SENT_ID_277946,,杨文昌,杨威,[ 3 - 4 ] 同年 5 月 杨文昌 和 父亲 杨威 参与 湖南卫视 大型 亲子 真人秀 节目 《 爸爸 去 哪儿 》 第二季 的 录制 ， 引发 众多 网友 关注 。,同年  月 人物一 父亲 人物二 参与 湖南卫视 大型 亲子 真人秀 节目  爸爸  第二季 录制  引发 众多 网友 关注,-1
