sent_id,entity1,entity2,sent,processed_sent,human
TRAIN_SENT_ID_276255,西门吹雪,孙秀青,孙秀青 ， 她 有 资格 接受 西门吹雪 的 爱 。,人物二  资格 接受 人物一 爱,-1
TRAIN_SENT_ID_270366,关平,关羽,东屋 三间 是 武 圣殿 （ 关帝 殿 ） ， 关帝 （ 关羽 ） 居殿 正位 ， 左有 大将 关平 ， 右有 大将 周仓 ， 是 谓 龙隐 宫官 武圣 。,东屋 三间 武 圣殿  关帝 殿   关帝  人物二  居殿 正位  左有 大将 人物一  右有 大将 周仓  谓 龙隐 宫官 武圣,-1
TRAIN_SENT_ID_268076,樊梨花,薛丁山,主要 剧情 是 ： 樊梨花 不满 父兄 叛国 投奔 西辽 ， 大义灭亲 ， 却 遭夫 薛丁山 认为 她 大逆不道 休妻 。,主要 剧情  人物一 不满 父兄 叛国 投奔 西辽  大义灭亲  遭夫 人物二 认为 大逆不道 休妻,-1
TRAIN_SENT_ID_282385,骆冰,文泰来,第一次 见 文泰来 和 骆冰 是 在 客栈 里 。,第一次 见 人物二 人物一 客栈 里,-1
TRAIN_SENT_ID_283692,陈玉佳,江南春,新娘 陈玉佳 只 比 36 岁 的 新郎 江南春 小 一岁 ， 昨日 在 婚礼 现场 ， 这位 大龄 新娘 终于 掩饰 不住 自己 的 激动 。,新娘 人物一  岁 新郎 人物二 一岁  昨日 婚礼 现场  这位 大龄 新娘 终于 掩饰 不住 激动,-1
TRAIN_SENT_ID_261312,朱兆祥,胡静,马来西亚 首富 朱兆祥 之妻 大陆 女艺人 胡静 。,马来西亚 首富 人物一 之妻 大陆 女艺人 人物二,-1
TRAIN_SENT_ID_265794,王茜,徐庆东,《 无限 正义 》 ( 2003 ) 饰演 角色 ： 史杰 （ 主演 之一 ） 合作 演员 ： 王茜 王挺 吴若甫 导演 ： 徐庆东,无限 正义     饰演 角色  史杰  主演  合作 演员  人物一 王挺 吴若甫 导演  人物二,-1
TRAIN_SENT_ID_268052,樊梨花,薛丁山,《 三上关 》 饰演 薛丁山 邓银枝 饰演 樊梨花,三上关  饰演 人物二 邓银枝 饰演 人物一,-1
TRAIN_SENT_ID_275669,梁济,梁漱溟,桂林 梁先生 遗书 内容 介绍 : 桂林 梁先生 ， 即 梁济 ， 晚清 名士 ， 哲学家 梁漱溟 之 父 。,桂林 梁先生 遗书 内容 介绍  桂林 梁先生  人物一  晚清 名士  哲学家 人物二 父,-1
TRAIN_SENT_ID_276661,陆展元,何沅君,陆展元 曾 抛弃 李莫愁 ， 迎娶 何沅君 。,人物一 抛弃 李莫愁  迎娶 人物二,-1
TRAIN_SENT_ID_265789,王茜,徐庆东,2008 电视剧 《 重案 六组 3 》 （ 饰 小 老板 ） 导演 ： 徐庆东 主演 ： 王茜,电视剧  重案 六组    饰 老板  导演  人物二 主演  人物一,-1
TRAIN_SENT_ID_261932,安雯,苏越,同时 她 也 让 苏越 好好 感恩 ， 保重 身体 ， 对于 其他 事 ， 她 还 没 考虑 好 ； 就 当前 的 还债 金额 ， 安雯 表示 不 愿意 提及 。,人物二 好好 感恩  保重 身体  事  没 考虑  当前 还债 金额  人物一 表示 愿意 提及,-1
TRAIN_SENT_ID_277129,浦安修,彭德怀,庐山会议 之后 ， 浦安修 与 彭德怀 令人 痛心 的 离婚 了 。,庐山会议 之后  人物一 人物二 令人 痛心 离婚,-1
TRAIN_SENT_ID_278572,岳灵珊,岳不群,在 岳不群 门下 ， 林平之 为 岳灵珊 所 爱慕 ， 但是 林平之 却 为了 掌握 《 辟邪 剑谱 》 而 自宫 。,人物二 门下  林平之 人物一 爱慕  林平之 掌握  辟邪 剑谱  自宫,-1
TRAIN_SENT_ID_275512,徐少华,杨琨,杨琨 导演 的 丈夫 国家一级演员 徐少华,人物二 导演 丈夫 国家一级演员 人物一,-1
TRAIN_SENT_ID_263787,秦始皇,赵姬,邵平 店 邵平 : 邵平 店 基本 信息 : 秦始皇 之 父母 庄襄王 和 赵姬 ， 安葬 在 如今 距 邵平 店有 5 公里 的 临潼区 韩峪 秦东 陵 。,邵平 店 邵平  邵平 店 基本 信息  人物一 父母 庄襄王 人物二  安葬 如今 邵平 店有  公里 临潼区 韩峪 秦东 陵,-1
TRAIN_SENT_ID_259305,刘备,刘禅,新朝 始祖 建兴 帝 王莽 皇太子 王临 三国 : 蜀 汉昭烈 皇帝 刘备 皇太子 刘禅,新朝 始祖 建兴 帝 王莽 皇太子 王临 三国  蜀 汉昭烈 皇帝 人物一 皇太子 人物二,-1
TRAIN_SENT_ID_286834,刘元,邓晨,"刘元 - - - - 刘秀 二姐 , 邓晨 之妻 。",人物一     刘秀 二姐  人物二 之妻,-1
TRAIN_SENT_ID_276010,贾午,贾充,贾充 发现 后 ， 便 干脆 把 贾午 嫁给 了 韩寿 。,人物二 发现  便 干脆 人物一 嫁给 韩寿,-1
TRAIN_SENT_ID_250937,霍震霆,朱玲玲,而 朱玲玲 的 现任 丈夫 罗康瑞 和 前夫 霍震霆 都 有 出现 在 灵堂 ， 难得 碰头 。,人物二 现任 丈夫 罗康瑞 前夫 人物一 出现 灵堂  难得 碰头,-1
TRAIN_SENT_ID_259041,刘备,刘禅,《 遗诏 敕後主 》 是 蜀汉 先主 刘备 写给 后主 刘禅 的 遗诏 之一 ， 出自 《 蜀志 · 先主 传 》 。,遗诏 敕後主  蜀汉 先主 人物一 写给 后主 人物二 遗诏  出自  蜀志  先主 传,-1
TRAIN_SENT_ID_279312,王逸宸,刘纯燕,王逸宸 半岁 后 交给 姥姥 带 ， 刘纯燕 和 王宁 每 过 一两天 去 看看 她 。,人物一 半岁 交给 姥姥 带  人物二 王宁 一两天 看看,-1
TRAIN_SENT_ID_270529,关平,关羽,关帝庙 正殿 供泰 蜀汉 吉林 北山 公园 的 桥 大将 关羽 塑像 ， 两侧 是 关平 、 周仓 配像 。,关帝庙 正殿 供泰 蜀汉 吉林 北山 公园 桥 大将 人物二 塑像  两侧 人物一  周仓 配像,-1
TRAIN_SENT_ID_268081,樊梨花,薛丁山,《 薛丁山 与 樊梨花 》 饰 窦仙童,人物二 人物一  饰 窦仙童,-1
TRAIN_SENT_ID_264310,贾环,赵姨娘,赵姨娘 、 贾环 勾结 钱槐 一伙 强盗 闯入 大观园 ， 又 抢 又 杀 。,人物二  人物一 勾结 钱槐 一伙 强盗 闯入 大观园  抢 杀,-1
TRAIN_SENT_ID_287251,刘豪,刘禅,自称 是 刘备 — — 刘禅 — — 刘谌 — — 刘豪 之后 。,自称 刘备   人物二   刘谌   人物一 之后,-1
TRAIN_SENT_ID_272487,韦丛,元稹,元稹 对 亡妻 韦丛 有着 真诚 执着 的 爱恋 ， 这首 “ 伴客 销愁 ” ， 深情 缱绻 ， 沉痛 感人 。,人物二 亡妻 人物一 有着 真诚 执着 爱恋  这首  伴客 销愁   深情 缱绻  沉痛 感人,-1
TRAIN_SENT_ID_278907,汪涵,杨乐乐,汪涵 、 杨乐乐 的 身份 不会 仅仅 局限于 主持人 ， 还会 通过 非常 特别 的 表达方式 ， 展现 浪漫情怀 。,人物一  人物二 身份 不会 仅仅 局限于 主持人  还会 非常 特别 表达方式  展现 浪漫情怀,-1
TRAIN_SENT_ID_263093,毛福梅,蒋介石,在 王采玉 和 毛福梅 的 一再 叮咛 下 ， 蒋介石 和 佃户 一大早 就 把 礼物 装 成 一担 ， 去 岳家 拜岁 。,王采玉 人物一 一再 叮咛  人物二 佃户 一大早 礼物 装 成 一担  岳家 拜岁,-1
TRAIN_SENT_ID_271315,何泽慧,钱三强,约 里奥 · 居里 夫妇 双双 盛装 出席 何泽慧 与 钱三强 的 婚礼,约 里奥  居里 夫妇 双双 盛装 出席 人物一 人物二 婚礼,-1
TRAIN_SENT_ID_267000,殷素素,张无忌,殷素素 、 张翠山 更 结成 夫妇 ， 并 在 岛上 诞下 一子名 张无忌 。,人物一  张翠山 更 结成 夫妇  岛上 诞下 一子名 人物二,-1
TRAIN_SENT_ID_271565,王诗龄,李湘,胖乎乎 的 王诗龄 相当 惹人爱 ， 不过 李湘 却 透露 小 公主 已经 瘦 了 ， “ 没 让 她 减肥 ， 她 开始 长高 抽条 了 ， 所以 瘦 了 。 ”,胖乎乎 人物一 相当 惹人爱  人物二 透露 公主 已经 瘦   没 减肥  长高 抽条  瘦,-1
TRAIN_SENT_ID_279349,石青璇,徐子陵,最后 徐子陵 和 石青璇 的 结合 ， 堪称 完美 ， 也 让 石之轩 了 却 了 心事 ， 最后 让 邪 王 落地 成佛 。,最后 人物二 人物一 结合  堪称 完美  石之轩 心事  最后 邪 王 落地 成佛,-1
TRAIN_SENT_ID_261072,黄汉伟,赵雅芝,黄汉伟 ， 香港 著名 女演员 赵雅芝 前夫 。,人物一  香港 著名 女演员 人物二 前夫,-1
TRAIN_SENT_ID_266446,严世蕃,严嵩,阳春 故意 使计 ， 严嵩 与 严世蕃 以为 事迹 败露 惊慌失措 。,阳春 故意 使计  人物二 人物一 事迹 败露 惊慌失措,-1
TRAIN_SENT_ID_284394,殷温娇,陈光蕊,陈光蕊 沉入 洪江 水底 ， 被 洪江 龙王 所救 ， 后来 与 玄奘 、 殷温娇 团聚 。,人物二 沉入 洪江 水底  洪江 龙王 所救  后来 玄奘  人物一 团聚,-1
TRAIN_SENT_ID_279281,傅洁娴,欧阳震华,傅洁娴 做人 简单 : 欧阳震华 的 太太 出身 于 豪门 ， 偏偏 找 了 做 演员 的 Bobby ， 自然 有人 认为 他 接近 有钱人 有 企图 。,人物一 做人 简单  人物二 太太 出身 豪门  偏偏 找 做 演员   自然 有人 认为 接近 有钱人 企图,-1
TRAIN_SENT_ID_274784,丁玲,胡也频,为了 摆脱 这一 棘手 的 选择 ， 丁玲 和 胡也频 便 也 南下 上海 。,摆脱 这一 棘手 选择  人物一 人物二 便 南下 上海,-1
TRAIN_SENT_ID_254067,林黛羽,俞佩玉,之后 遇上 俞佩玉 未婚妻 林黛羽 ， 发现 武林 许多 成名 人物 俱 是 如此 。,之后 遇上 人物二 未婚妻 人物一  发现 武林 成名 人物 俱,-1
TRAIN_SENT_ID_251093,尤三姐,柳湘莲,尤三姐 羞愤 自刎 ， 柳湘莲 悔恨 不已 看破红尘 出家 。,人物一 羞愤 自刎  人物二 悔恨 不已 看破红尘 出家,-1
TRAIN_SENT_ID_267006,殷素素,张无忌,2001 ， 香港 无线 ， 吴启华 饰 张无忌 ， 黎姿 饰 赵敏 ， 佘诗曼 饰 周芷若 ， 江希文 饰小昭 ， 陈少霞 饰 殷离 （ 蛛儿 ） ， 米雪 饰 殷素素,香港 无线  吴启华 饰 人物二  黎姿 饰 赵敏  佘诗曼 饰 周芷若  江希文 饰小昭  陈少霞 饰 殷离  蛛儿   米雪 饰 人物一,-1
TRAIN_SENT_ID_255878,蒋介石,宋美龄,因为 他 长期 在 敌人 心脏 工作 ， 要 和 蒋介石 、 宋美龄 等 高层 周旋 ， 还要 和 军统 大 特务 打交道 ， 这 需要 大智大勇 。,长期 敌人 心脏 工作  人物一  人物二 高层 周旋  军统 特务 打交道  需要 大智大勇,-1
TRAIN_SENT_ID_261046,岳不群,岳灵珊,"进 华山 不久 , 令狐冲 与 剑法 堂堂 主 岳不群 之女 岳灵珊 一见钟情 ...",进 华山 不久  令狐冲 剑法 堂堂 主 人物一 之女 人物二 一见钟情,-1
TRAIN_SENT_ID_255882,蒋介石,宋美龄,宋美龄 从 机场 返回 官邸 ， 怒问 蒋介石 为何 不去 迎接 。,人物二 机场 返回 官邸  怒问 人物一 不去 迎接,-1
TRAIN_SENT_ID_275720,贾午,贾谧,郭槐 临终 ， 人之将死 ， 其言也善 ， 她 一直 谆谆嘱咐 女儿 贾南风 要 对 太子 慈爱 ， 不可 听从 贾午 、 贾谧 的话 。,郭槐 临终  人之将死  其言也善  一直 谆谆嘱咐 女儿 贾南风 太子 慈爱  不可 听从 人物一  人物二,-1
TRAIN_SENT_ID_283669,黎婉华,何鸿燊,艾 瑞尔 的 母亲 是 何鸿燊 与 元配 黎婉华 之女 何超贤 。,艾 瑞尔 母亲 人物二 元配 人物一 之女 何超贤,-1
TRAIN_SENT_ID_283360,王天助,王思佳,王胜天 ， 王胜 志之母 ， 王青云 的 妻子 ， 赖丽珠 、 赖素 绫 、 何佩琪 的 婆婆 ， 王天助 的 奶奶 、 王思佳 曾祖母 。,王胜天  王胜 志之母  王青云 妻子  赖丽珠  赖素 绫  何佩琪 婆婆  人物一 奶奶  人物二 曾祖母,-1
TRAIN_SENT_ID_267260,陆毅,鲍蕾,陆毅 笑 言 ： “ 要不是 鲍蕾 撵 我 出来 拍戏 ， 现在 还是 会 在家 陪贝儿 。 ”,人物一 笑 言   人物二 撵 拍戏  现在 会 在家 陪贝儿,-1
TRAIN_SENT_ID_257355,贾珍,尤氏,尤氏 在 宁府 也 不能 做主 ， 她 对 贾珍 爬灰 、 偷 娶 尤二姐 、 天香楼 夜赌 等 丑事 皆 劝 止不住 。,人物二 宁府 不能 做主  人物一 爬灰  偷 娶 尤二姐  天香楼 夜赌 丑事 皆 劝 止不住,-1
TRAIN_SENT_ID_270425,关平,关羽,殿内 有 新塑 的 关羽 、 关平 、 周仓 像 。,殿内 新塑 人物二  人物一  周仓,-1
TRAIN_SENT_ID_264329,贾环,赵姨娘,从 后文 可见 ， 即使 是 身为 少爷 的 贾环 、 半个 主子 的 赵姨娘 想 吃 也 只能 暗地里 央求 彩云 去 偷 。,后文  身为 少爷 人物一  半个 主子 人物二 想 吃 只能 暗地里 央求 彩云 偷,-1
TRAIN_SENT_ID_270539,关平,关羽,讲述 关平 认了 关羽 做爹 。,讲述 人物一 认了 人物二 做爹,-1
TRAIN_SENT_ID_276504,尤氏,贾珍,“ 尤氏 却知 此事 不妥 ， 因而 极力 劝止 ， 无奈 贾珍 主意 已 定 ， 素日 又 是 顺从 惯 了 的 ， 。,人物一 却知 此事 不妥  极力 劝止  无奈 人物二 主意 定  素日 顺从 惯,-1
TRAIN_SENT_ID_255640,蒋介石,宋美龄,慈湖 蒋陵 塑像 园 书房 的 墙上 挂 着 宋美龄 的 画 ， 书桌上 放着 一张 便条 ， 上面 有 蒋介石 用红 铅笔 写 的 4 个 字 ： “ 能屈能伸 ” 。,慈湖 蒋陵 塑像 园 书房 墙上 挂 人物二 画  书桌上 放着 一张 便条  上面 人物一 用红 铅笔 写  字   能屈能伸,-1
TRAIN_SENT_ID_265797,王茜,徐庆东,2004 《 无限 生机 》 饰冉 怀舟 （ 男一号 ） 导演 ： 徐庆东 合作 演员 ： 王茜 隋兰田振崴 王挺 申军谊,无限 生机  饰冉 怀舟  男一号  导演  人物二 合作 演员  人物一 隋兰田振崴 王挺 申军谊,-1
TRAIN_SENT_ID_261131,胡一刀,胡斐,江汉 饰 胡一刀 / 胡斐,江汉 饰 人物一  人物二,-1
TRAIN_SENT_ID_270546,关平,关羽,． 关羽 和 关平 （ 或 周仓 ）,． 人物二 人物一  周仓,-1
TRAIN_SENT_ID_258377,张兆和,沈从文,自传 集 编辑 推荐 : 这次 别集 版本 是 自 张兆和 沈虎雏 等 作者 家属 ， 以及 沈从文 研究 专家 亲自 编选 以来 首次 精装 出版 ， 极具 收藏 意义 。,自传 集 编辑 推荐  别集 版本 人物一 沈虎雏 作者 家属  人物二 研究 专家 亲自 编选 首次 精装 出版  极具 收藏 意义,-1
TRAIN_SENT_ID_275106,朱七七,沈浪,（ 详见 《 武林 外史 》 第十章 妙手 复娇容 ） 随后 朱七七 被 王怜花 劫 至 其 山庄 ， 被 沈浪 救出 。,详见  武林 外史  第十章 妙手 复娇容  人物一 王怜花 劫 山庄  人物二 救出,-1
TRAIN_SENT_ID_263839,刘嘉玲,梁朝伟,美地行 策划 华丽 家族 太上 湖 梁朝伟 刘嘉玲 置 爱巢 轰动性 营销 战略,美地行 策划 华丽 家族 太上 湖 人物二 人物一 置 爱巢 轰动性 营销 战略,-1
TRAIN_SENT_ID_279376,杨健侯,杨露禅,杨露禅 把 其 所学 向 罐肠 一样 往 杨健侯 的 身子 里 塞 。,人物二 所学 罐肠 人物一 身子 里 塞,-1
TRAIN_SENT_ID_259251,刘备,刘禅,刘备 敕 刘禅 遗诏 出处 : 《 三国志 》 裴松之 注所引 《 诸葛亮 集 》 。,人物一 敕 人物二 遗诏 出处   三国志  裴松之 注所引  诸葛亮 集,-1
TRAIN_SENT_ID_276104,陈三立,陈宝箴,陈家 大屋 是 陈门 五杰 （ 陈宝箴 、 陈三立 、 陈衡 恪 、 陈寅恪 、 陈封怀 ） 故居 ， 位于 宁州 镇高段 村 ， 距 县城 20 公里 。,陈家 大屋 陈门 五杰  人物二  人物一  陈衡 恪  陈寅恪  陈封怀  故居  位于 宁州 镇高段 村  县城  公里,-1
TRAIN_SENT_ID_274059,白素,卫斯理,监制 ： 金贵 配音 朱子聪 饰演 卫斯理 钱佩卿 饰演 白素 金贵 饰演 陈天 远 卢雄 饰演 杰克 上校 李少 慧 饰演 殷嘉丽 金贵 饰演 G 领事,监制  金贵 配音 朱子聪 饰演 人物二 钱佩卿 饰演 人物一 金贵 饰演 陈天 远 卢雄 饰演 杰克 上校 李少 慧 饰演 殷嘉丽 金贵 饰演  领事,-1
TRAIN_SENT_ID_276263,西门吹雪,孙秀青,孙秀青 和 西门吹雪 被 “ 光荣 ” 的 评选 为 “ 最 好聚好散 的 夫妻 ” 。,人物二 人物一  光荣  评选  好聚好散 夫妻,-1
TRAIN_SENT_ID_270766,梁萧,花晓霜,为了 更多人 的 生命 ， 花晓霜 与 梁萧 选择 了 舍弃 自己 的 小爱 。,更多人 生命  人物二 人物一 选择 舍弃 小爱,-1
TRAIN_SENT_ID_262656,况天佑,马小玲,在 命运 的 挑拨 下 ， 人 王与 圣母 展开 决斗 ， 马小玲 、 况天佑 、 袁 不破 、 毛忧 还有 灵异 部队 剩下 的 成员 都 参加 了 这场 灭世之战 。,命运 挑拨  王与 圣母 展开 决斗  人物二  人物一  袁 不破  毛忧 灵异 部队 剩下 成员 参加 这场 灭世之战,-1
TRAIN_SENT_ID_278523,李秀文,叶挺,李秀文 当然 满心欢喜 ， 她 对 叶挺 已 是 以心 相许 ， 但 她 提出 还要 征求 父母 的 意见 才能 最后 决定 。,人物一 满心欢喜  人物二 以心 相许  提出 征求 父母 意见 最后 决定,-1
TRAIN_SENT_ID_252113,黄毅清,黄奕,同时 ， 黄奕 对 丈夫 黄毅清 提出 离婚 ， 并 斥责 其 造谣 。,人物二 丈夫 人物一 提出 离婚  斥责 造谣,-1
TRAIN_SENT_ID_267018,殷素素,张无忌,殷素素 与 张翠山 在 冰火 岛上 结为夫妇 ， 并 诞下 一子 张无忌 。,人物一 张翠山 冰火 岛上 结为夫妇  诞下 一子 人物二,-1
TRAIN_SENT_ID_276067,陈三立,陈宝箴,湖南 巡抚 陈宝箴 孙 ， 著名诗人 陈三立 子 。,湖南 巡抚 人物二 孙  著名诗人 人物一 子,-1
TRAIN_SENT_ID_260367,穆桂英,杨宗保,杨宗保 — 张智尧 （ 香港 ） 穆桂英 — 宁静,人物二  张智尧  香港  人物一  宁静,-1
TRAIN_SENT_ID_258310,陈建斌,蒋勤勤,这 一集 带领 我们 领略 热带 风光 的 是 郝蕾 、 刘烨 夫妻 ， 陈建斌 、 蒋勤勤 夫妻 ， 陆毅 、 鲍蕾 夫妻 。,一集 带领 领略 热带 风光 郝蕾  刘烨 夫妻  人物一  人物二 夫妻  陆毅  鲍蕾 夫妻,-1
TRAIN_SENT_ID_278197,江玉郎,江别鹤,这时 江别鹤 走 了 进来 问 江玉郎 事情 办得 如何 ～ ？,人物二 走 进来 问 人物一 事情 办得,-1
TRAIN_SENT_ID_250042,张无忌,赵敏,赵敏 对 张无忌 的 爱情 象 公主 对 百姓 的 施舍 ， 如 奇遇 ， 逻辑性 勉强 ； 周芷若 的 爱多 的 是 名利 束缚 ， 她 爱 的 是 光明 顶上 独战 六派 的 大侠 。,人物二 人物一 爱情 象 公主 百姓 施舍  奇遇  逻辑性 勉强  周芷若 爱多 名利 束缚  爱 光明 顶上 独战 六派 大侠,-1
TRAIN_SENT_ID_285512,华筝,成吉思汗,由 秦沛 饰演 的 铁木真 却是 可圈可点 ， 充分 表现 出 了 成吉思汗 的 雄才大略 ， 华筝 也 是 博得 了 很多 人 的 怜爱 。,秦沛 饰演 铁木真 却是 可圈可点  充分 表现 出 人物二 雄才大略  人物一 博得 很多 怜爱,-1
TRAIN_SENT_ID_257990,夏东海,刘梅,回到 夏家 ， 夏东海 抓住 这个 机会 给 两个 孩子 大谈 责任 教育 ， 刘梅 也 跟着 一唱一和 。,回到 夏家  人物一 抓住 机会 两个 孩子 大谈 责任 教育  人物二 跟着 一唱一和,-1
TRAIN_SENT_ID_281553,李锐,蒋韵,作家 刘恒 感慨 ， 笛安 的 文字 已经 比 父母 李锐 、 蒋韵 “ 青出于蓝 而 绝对 不 弱 于蓝 ” 。,作家 刘恒 感慨  笛安 文字 已经 父母 人物一  人物二  青出于蓝 绝对 弱 于蓝,-1
TRAIN_SENT_ID_275339,潘巧云,杨雄,⑤ 明 施耐庵 《 水浒 》 第四十五回 《 杨雄 醉 骂 潘巧云 石秀 智杀 裴如海 》 夜来 多 教师 兄 劳神 ， 功德 钱 未曾 拜纳 。,⑤ 明 施耐庵  水浒  第四十五回  人物二 醉 骂 人物一 石秀 智杀 裴如海  夜来 教师 兄 劳神  功德 钱 未曾 拜纳,-1
TRAIN_SENT_ID_268740,秦可卿,贾蓉,金陵 十二钗 图册 判词 秦可卿 : 金陵 十二钗 之一 ， 贾蓉 之妻 。,金陵 十二钗 图册 判词 人物一  金陵 十二钗  人物二 之妻,-1
TRAIN_SENT_ID_278750,尤氏,贾蓉,贾敬 归天 ， 尤氏 理丧 ， 尤老娘 母女 三人到 宁府 着 家 ， 贾蓉 戏 二姨 。,贾敬 归天  人物一 理丧  尤老娘 母女 三人到 宁府 家  人物二 戏 二姨,-1
TRAIN_SENT_ID_255495,刘梅,夏雪,不想 夏雪 在 毕业 晚会 上 把 胸针 丢 了 ， 她 非常 着急 ， 因为 刘梅 并不知道 此事 。,不想 人物二 毕业 晚会 胸针 丢  非常 着急  人物一 并不知道 此事,-1
TRAIN_SENT_ID_282377,骆冰,文泰来,十一 当家 ： 鸳鸯刀 骆冰 （ 文泰来 之妻 ）,十一 当家  鸳鸯刀 人物一  人物二 之妻,-1
TRAIN_SENT_ID_271919,阎婆惜,宋江,"但 剧本 一面 详写 宋江 、 阎婆惜 事 ， 一面 又 穿插 晁盖 事过 多 ， 致使 剧情 分 呈 两头 , 主线 不够 突出 。",剧本 一面 详写 人物二  人物一 事  一面 穿插 晁盖 事过  致使 剧情 分 呈 两头  主线 不够 突出,-1
TRAIN_SENT_ID_258849,廖梦醒,何香凝,家庭 情况 : 廖承志 的 父母亲 是 廖仲恺 、 何香凝 夫妇 ， 岳父 是 经亨颐 ， 姐姐 是 廖梦醒 ， 妹妹 是 廖光 凤 。,家庭 情况  廖承志 父母亲 廖仲恺  人物二 夫妇  岳父 经亨颐  姐姐 人物一  妹妹 廖光 凤,-1
TRAIN_SENT_ID_282468,韦丛,韦夏卿,韦丛 ， 字茂 之 ， 韦夏卿 嫡出 季女 ， 母 裴氏 （ 裴皋 女 、 裴耀卿 孙 ） 。,人物一  字茂  人物二 嫡出 季女  母 裴氏  裴皋 女  裴耀卿 孙,-1
TRAIN_SENT_ID_260490,严嵩,严世蕃,2 剧情 : 海瑞 赴 严嵩 处 拜寿 ， 忤 严世蕃 ， 被贬 降职 ， 出任 淳安 知县 。,剧情  海瑞 赴 人物一 处 拜寿  忤 人物二  被贬 降职  出任 淳安 知县,-1
TRAIN_SENT_ID_278805,任盈盈,任我行,武功 本属 天下第一 ， 后 被 男主角 令狐冲 、 任我行 、 向问天 等 高手 围攻 尚能 不 落下风 ， 却 因 任盈盈 在 一旁 折磨 其 爱人 杨莲亭 而 分神 被 杀 。,武功 本属 天下第一  男主角 令狐冲  人物二  向问天 高手 围攻 尚能 落下风  人物一 一旁 折磨 爱人 杨莲亭 分神 杀,-1
TRAIN_SENT_ID_287090,胡木英,胡乔木,其中 有 包括 邓小平 、 陈毅 、 胡乔木 等 老一辈 革命家 后代 邓榕 、 陈小鲁 、 胡木英 等 做客 访谈 室 ， 缅怀 自己 的 亲人 。,包括 邓小平  陈毅  人物二 老一辈 革命家 后代 邓榕  陈小鲁  人物一 做客 访谈 室  缅怀 亲人,-1
TRAIN_SENT_ID_278863,顾长卫,蒋雯丽,顾长卫 电影 纪录片 《 在 一起 》 主演 ： 章子怡 、 郭富城 、 蒋雯丽 、,人物一 电影 纪录片  一起  主演  章子怡  郭富城  人物二,-1
TRAIN_SENT_ID_272751,徐天宏,周绮,徐天宏 一听 ， 知是 店小二 ， 保镖 的 半夜里 要 他 送 酒 ， 因此 满肚子 不 高兴 ， 灵机一动 ， 对 周绮 道 ： “ 那 曹司朋 有 两包 药 给 你 拿来 啦 ， 是 吗 ？,人物一 一听  知是 店小二  保镖 半夜里 送 酒  满肚子 高兴  灵机一动  人物二 道   曹司朋 两包 药 拿来,-1
TRAIN_SENT_ID_264127,刘备,孙尚香,蛟矶 庙 历史渊源 : 蛟矶 庙 由 来 : 蛟矶 庙 内 孙夫人 画像 汉昭烈 帝 刘备 与 东吴 联姻 ， 娶 吴帝 孙权 之妹 孙尚香 为妻 ， 相与 入 蜀 。,蛟矶 庙 历史渊源  蛟矶 庙  蛟矶 庙 孙夫人 画像 汉昭烈 帝 人物一 东吴 联姻  娶 吴帝 孙权 之妹 人物二 为妻  相与 入 蜀,-1
TRAIN_SENT_ID_281719,龚慈恩,林炜,林炜 拍 情欲戏 事前 不 报备 不 小心 让 老婆 龚慈恩 看到 罚 2 万,人物二 拍 情欲戏 事前 报备 小心 老婆 人物一 看到 罚  万,-1
TRAIN_SENT_ID_268498,曹襄,卫长公主,其子 曹襄 娶 汉武帝 女 卫长公主 为妻 。,其子 人物一 娶 汉武帝 女 人物二 为妻,-1
TRAIN_SENT_ID_249959,张无忌,赵敏,为 救 母亲 黛绮丝 以及 谢逊 ， 张无忌 ， 赵敏 ， 周芷若 ， 殷离 等 人 ， 决定 牺牲 自己 ， 回到 波斯 总坛 ， 做 了 圣女 。,救 母亲 黛绮丝 谢逊  人物一  人物二  周芷若  殷离  决定 牺牲  回到 波斯 总坛  做 圣女,-1
TRAIN_SENT_ID_271363,何泽慧,钱三强,如 参加 研制 我国 第一颗 原子弹 的 著名 科学家 王淦昌 、 彭恒武 、 钱三强 、 何泽慧 等 ， 都 出自 吴有训 门下 。,参加 研制 我国 第一颗 原子弹 著名 科学家 王淦昌  彭恒武  人物二  人物一  出自 吴有训 门下,-1
TRAIN_SENT_ID_268110,樊梨花,薛丁山,《 薛丁山 与 樊梨花 》 饰 樊龙,人物二 人物一  饰 樊龙,-1
TRAIN_SENT_ID_278862,顾长卫,蒋雯丽,《 立春 》 饰 ： 小张 老师 导演 ： 顾长卫 合作 演员 ： 蒋雯丽 、 李 光洁,立春  饰  小张 老师 导演  人物一 合作 演员  人物二  李 光洁,-1
TRAIN_SENT_ID_269322,陆雪琪,张小凡,陆雪琪 捧 着 刁灵 血源 走 到 张小凡 面前 ， 沉默 了 一阵 ， 道 ： “ 精卫 是 为了 我们 而 受伤 遇难 ， 我要 留下来 照顾 它 的 鸟族 。,人物一 捧 刁灵 血源 走 人物二 面前  沉默 一阵  道   精卫 受伤 遇难  我要 留下来 照顾 鸟族,-1
TRAIN_SENT_ID_250195,秦始皇,胡亥,于是 秦始皇 命人 雕刻 出 表演 人 的 形状 ， 不断 地 表演 下去 ， 胡亥 不 哭 了 ， 影戏 也 由此 出现 了 。,人物一 命人 雕刻 出 表演 形状  不断 表演 下去  人物二 哭  影戏 出现,-1
TRAIN_SENT_ID_271437,杨云,杨威,炒婚 ， 贬义词 ， 以 婚姻 的 名义 秀 一把 自己 的 爱情 ， 从 著名 体操选手 杨威 与 杨云 的 婚姻 开始 ， 被 网友 在 网络 上 热议 。,炒婚  贬义词  婚姻 名义 秀 一把 爱情  著名 体操选手 人物二 人物一 婚姻  网友 网络 热议,-1
TRAIN_SENT_ID_264350,贾环,赵姨娘,贾环 ， 贾政之 子 ， 庶出 ， 母 赵姨娘 。,人物一  贾政之 子  庶出  母 人物二,-1
TRAIN_SENT_ID_267468,成安公主,东光公主,以上 从甥 陈氏 为 东华 公主 ， 妻 邵固 ； 以 成安公主 之女 韦氏 为 东光公主 ， 妻 鲁苏 。,从甥 陈氏 东华 公主  妻 邵固  人物一 之女 韦氏 人物二  妻 鲁苏,-1
