sent_id,sent_id,entity1,entity2,sent,processed_sent,label
TRAIN_SENT_ID_255422,,罗成,秦琼,如 秦琼 的 宽厚 善良 、 任侠 仗义 ， 罗成 的 年少气盛 ， 尉迟恭 的 威猛 果敢 ， 徐茂功 的 智谋 神算 等 ， 都 颇 有 特色 。,人物二 宽厚 善良  任侠 仗义  人物一 年少气盛  尉迟恭 威猛 果敢  徐茂功 智谋 神算  颇 特色,1
TRAIN_SENT_ID_268465,,单联全,冯一非,单联全 、 冯一非 、 翁虹 、 江宏恩,人物一  人物二  翁虹  江宏恩,-1
TRAIN_SENT_ID_275467,,李汉俊,李书城,李汉俊 的 心思 ， 得到 了 李书城 的 全力支持 。,人物一 心思  得到 人物二 全力支持,1
TRAIN_SENT_ID_278338,,贾廷聚,唐喜成,唐喜成 感动 于 贾廷聚 的 刻苦 执着 ， 爱惜 这个 身形 高大 的 年轻人 。,人物二 感动 人物一 刻苦 执着  爱惜 身形 高大 年轻人,-1
TRAIN_SENT_ID_263549,,林逸,杨明,沈雨 昔 林逸 的 师娘 之一 ， 杨明 的 妻子 之一 。,沈雨 昔 人物一 师娘  人物二 妻子,-1
TRAIN_SENT_ID_270819,,伍天锡,伍云召,6 、 双镗 无敌 伍天锡 ， 伍云召 族弟 ， 胯下 乌 骓 马 ， 掌中 一对 短 把 凤翅 镏金 镗 ， 英勇 无比 ；,双镗 无敌 人物一  人物二 族弟  胯下 乌 骓 马  掌中 一对 短 凤翅 镏金 镗  英勇 无比,1
TRAIN_SENT_ID_268462,,单联全,冯一非,单联全 、 冯一非 、 江宏恩,人物一  人物二  江宏恩,-1
TRAIN_SENT_ID_276990,,樊迟,孔子,宋 苏辙 《 礼义 信 足以 成德 论 》 ： “ 今夫 樊迟 欲 为 农圃 以 富民 ， 而 孔子 答之以 礼义 信 也 。 ”,宋 苏辙  礼义 信 足以 成德    今夫 人物一 欲 农圃 富民  人物二 答之以 礼义 信,-1
TRAIN_SENT_ID_255280,,卫夫人,王羲之,二 、 玄 的 心灵 状态 ： 卫夫人 、 王羲之 书论,二  玄 心灵 状态  人物一  人物二 书论,-1
TRAIN_SENT_ID_261448,,毛泽建,毛泽东,毛泽建 （ 1905 - 1929 ） ， 革命烈士 ， 毛泽东 堂妹 。,人物一       革命烈士  人物二 堂妹,1
TRAIN_SENT_ID_254266,,张顺,张横,张顺 . （ 渔家 ， 张横 之弟 ） 三十六 天罡 星天败星 : 天败星 …,人物一   渔家  人物二 之弟  三十六 天罡 星天败星  天败星,1
TRAIN_SENT_ID_259790,,李偲菘,李伟菘,李伟菘 、 李偲菘 两个 被 华语 乐坛 冠为 传奇 的 名字 。,人物二  人物一 两个 华语 乐坛 冠为 传奇 名字,1
TRAIN_SENT_ID_271535,,孟优,孟获,隐者 又 曰 ： “ 丞相 休疑 ， 容伸 片言 ： 某一 父母 所生 三人 ： 长即 老夫 孟节 ， 次 孟获 ， 又次 孟优 。,隐者 曰   丞相 休疑  容伸 片言  某一 父母 所生 三人  长即 老夫 孟节  次 人物二  又次 人物一,1
TRAIN_SENT_ID_273645,,姜子牙,元始天尊,后来 元始天尊 对 姜子牙 说 ： “ 你 虽 没 神位 ， 但 你 是 神上 神 ， 主管 所有 神 ， 把 你 的 神位 安在 高处 ， 看清 所有 神 的 一举一动 。 ”,后来 人物二 人物一 说   没 神位  神上 神  主管 神  神位 安在 高处  看清 神 一举一动,-1
TRAIN_SENT_ID_250637,,鲁西西,皮皮鲁,（ “ 皮皮鲁 鲁西西 ” 系列 童话剧 ） : “ 皮皮鲁 鲁西西 ” 系列 童话剧 《 罐头 小人 》,人物二 人物一  系列 童话剧    人物二 人物一  系列 童话剧  罐头 小人,1
TRAIN_SENT_ID_257541,,毛泽民,毛泽东,同时 入狱 的 还有 毛泽东 的 二弟 毛泽民 、 毛泽民 的 妻子 朱旦华 、 中共一大 代表 陈潭秋 等 。,入狱 人物二 二弟 人物一  人物一 妻子 朱旦华  中共一大 代表 陈潭秋,1
TRAIN_SENT_ID_258145,,刘星,夏雪,《 无事生非 》 夏雪 “ 大嫂 ” 的 外号 引来 家里人 的 担心 ， 刘星 想 出 “ 妙计 ” 把 方刚 约 来 。,无事生非  人物二  大嫂  外号 引来 家里人 担心  人物一 想 出  妙计  方刚 约,1
TRAIN_SENT_ID_259524,,梅超风,杨康,周星驰 还 在 第 7 集中 被 杨康 抓来 后 送给 梅超风 练功 。,周星驰  集中 人物二 抓来 送给 人物一 练功,-1
TRAIN_SENT_ID_250395,,赵飞燕,赵合德,— — 西 汉成帝 后 赵飞燕 、 昭仪 赵合德,西 汉成帝 人物一  昭仪 人物二,1
TRAIN_SENT_ID_283893,,李晏,李纶,李晏 ， 李纶 之弟 ， 封 赵郡 公 ， 官至 开府 仪同 三司 、 大将军 。,人物一  人物二 之弟  封 赵郡 公  官至 开府 仪同 三司  大将军,1
TRAIN_SENT_ID_262269,,尤二姐,尤三姐,乙 那 是 《 红楼梦 》 ， 尤三姐 、 尤二姐 ！,乙  红楼梦   人物二  人物一,1
TRAIN_SENT_ID_257210,,霍建元,霍建华,霍建元 相关 事件 : [ 新闻 ] 勇警 霍建华 兄遭 辗奋 擒 匪 3 男女 酒驾 狂 逃 轰 6 枪 才 停,人物一 相关 事件   新闻  勇警 人物二 兄遭 辗奋 擒 匪  男女 酒驾 狂 逃 轰  枪 停,1
TRAIN_SENT_ID_255382,,罗成,秦琼,如 秦琼 的 宽厚 善良 、 任侠 仗义 ， 罗成 的 年少气盛 ， 尉迟恭 的 威猛 果敢 ， 徐茂 公的 智谋 神算 等 ， 都 颇 有 特色 。,人物二 宽厚 善良  任侠 仗义  人物一 年少气盛  尉迟恭 威猛 果敢  徐茂 公的 智谋 神算  颇 特色,1
TRAIN_SENT_ID_257049,,洪敬尧,洪荣宏,101218Mr . J 频道 第 7 期 （ 嘉宾 ： 杨瑞代 、 洪荣宏 、 洪敬尧 、 洪荣 良 ）,频道  期  嘉宾  杨瑞代  人物二  人物一  洪荣 良,1
TRAIN_SENT_ID_249123,,皮皮鲁,鲁西西,皮皮鲁 能 找回 鲁西西 的 笑容 吗 ？,人物一 找回 人物二 笑容,1
TRAIN_SENT_ID_250103,,武敦儒,武修文,靖 、 蓉 为 寻找 黄药师 ， 巧遇 武三通 之子 武敦儒 、 武修文 、 杨康之 子 杨过 。,靖  蓉 寻找 黄药师  巧遇 武三通 之子 人物一  人物二  杨康之 子 杨过,1
TRAIN_SENT_ID_265493,,薛蝌,薛蟠,薛蝌 自然 不是 薛家 最 正宗 的 一支 ， 但 婚事 由 薛姨妈 作主 ， 薛蟠 又 是 那么 个 霸王 ， 估计 族 里 对 薛蝌 此人 也 寄予 重 望 。,人物一 自然 薛家 正宗 一支  婚事 薛姨妈 作主  人物二 霸王  估计 族 里 人物一 此人 寄予 重,1
TRAIN_SENT_ID_252627,,颜回,孔子,孔子 为什么 很 欣赏 颜回,人物二 欣赏 人物一,-1
TRAIN_SENT_ID_257818,,林平之,岳不群,林平之 一心 雪恨 ， 并 在 岳不群 的 迫害 下 与其 争锋 相对 ， 处处 提防 ， 几番 死里逃生 。,人物一 一心 雪恨  人物二 迫害 争锋 相对  处处 提防  几番 死里逃生,-1
TRAIN_SENT_ID_259756,,李偲菘,李伟菘,作词 ： 李煜 作曲 ： 李伟菘 、 李偲菘 绝代 双雄 插曲 : 截图 ( 30 张 ),作词  李煜 作曲  人物二  人物一 绝代 双雄 插曲  截图   张,1
TRAIN_SENT_ID_260703,,王重阳,全真七子,《 神雕侠侣 》 — 甄志丙 、 王重阳 、 全真七子 、 忽必烈 、 周伯通,神雕侠侣   甄志丙  人物一  人物二  忽必烈  周伯通,-1
TRAIN_SENT_ID_264935,,贾元春,贾宝玉,第九十七回 贾宝玉 奉命 出远门 贾元春 赐 诏 结姻 眷,第九十七回 人物二 奉命 出远门 人物一 赐 诏 结姻 眷,1
TRAIN_SENT_ID_277018,,钟藜,钟馗,钟藜 电视剧 介绍 : 《 天师 钟馗 》 是 浙江 华策影视 公司出品 的 一部 古装 奇 《 天师 钟馗 》 ( 7 张 ),人物一 电视剧 介绍   天师 人物二  浙江 华策影视 公司出品 一部 古装 奇  天师 人物二    张,1
TRAIN_SENT_ID_281994,,陈宇风,陈熙锋,出生 在 高雄 ， 家里 有 四兄弟 — — 大哥 、 二哥 ， 陈熙锋 和 陈宇风 则 是 双胞胎 。,出生 高雄  家里 四兄弟   大哥  二哥  人物二 人物一 双胞胎,1
TRAIN_SENT_ID_260946,,杨露禅,陈长兴,他 的 曾祖父 陈长兴 （ 一 七七 一 ～ 一 八五 三 ） ， 是 杨式 太极拳 创始人 杨露禅 （ 一 七 九九 ~ ~ 一 八七 三 ） 的 老师 。,曾祖父 人物二  七七  八五 三   杨式 太极拳 创始人 人物一  七 九九   八七 三  老师,-1
TRAIN_SENT_ID_249560,,李蔡,李广,李广 的 堂弟 李蔡 ， 也 被 任为 中 郎 。,人物二 堂弟 人物一  任为 中 郎,1
TRAIN_SENT_ID_249277,,皮皮鲁,鲁西西,锁虫 锁住 了 鲁西西 的 笑容 ， 皮皮鲁 想尽 一切办法 都 打不开 那 把 锁住 鲁西西 笑容 的 锁 。,锁虫 锁住 人物二 笑容  人物一 想尽 一切办法 打不开 锁住 人物二 笑容 锁,1
TRAIN_SENT_ID_263539,,林逸,杨明,周 佳佳 林逸 的 师娘 之一 ， 杨明 的 妻子 之一 。,周 佳佳 人物一 师娘  人物二 妻子,-1
TRAIN_SENT_ID_278491,,雷凌云,金威远,"第二类 反面人物 ： 佐佐木 ， 金威远 ， 花面 狼 ， 雷凌云 , 周参将 等 。",第二类 反面人物  佐佐木  人物二  花面 狼  人物一  周参将,-1
TRAIN_SENT_ID_268896,,司徒静,司徒剑南,文韬 不 敌 逃走 ， 被 静修 射中 后背 ， 司徒静 和 司徒剑南 都 以为 是 对方 所射 。,文韬 敌 逃走  静修 射中 后背  人物一 人物二 所射,1
TRAIN_SENT_ID_259941,,周志文,周志康,"主持 ： 周志文 , 周志康",主持  人物一  人物二,1
TRAIN_SENT_ID_251847,,梅超风,黄药师,武眠风 出处 : （ 出自 《 射雕 英雄传 》 第 14 回 桃花 岛主 ， 黄药师 吩咐 梅超风 做 3 件 事 的 第 2 项 ） 。,武眠风 出处   出自  射雕 英雄传   回 桃花 岛主  人物二 吩咐 人物一 做  件 事  项,-1
TRAIN_SENT_ID_272653,,邢德全,邢夫人,邢大舅 第七十五回 : 在 宁府中 ， 邢大舅 与 薛蟠 、 贾珍 等 人夜 赌 ， 此 “ 邢大舅 ” 即 邢夫人 胞弟 邢德全 ， 当中 有 一段 介绍 邢家 内事 ：,邢大舅 第七十五回  宁府中  邢大舅 薛蟠  贾珍 人夜 赌   邢大舅  人物二 胞弟 人物一  当中 一段 介绍 邢家 内事,1
TRAIN_SENT_ID_265576,,张崇基,张崇德,其他 演员 ： 张崇基 张崇德 古天乐 郭蔼明,演员  人物一 人物二 古天乐 郭蔼明,1
TRAIN_SENT_ID_268920,,司徒静,司徒剑南,司徒剑南 分 集 介绍 : 司徒剑南 第一集 : 司徒静 和 万人敌 合作 骗 了 公子哥 们 的 钱 帮助 可怜 的 穷苦 人 。,人物二 分 集 介绍  人物二 第一集  人物一 万人敌 合作 骗 公子哥 钱 帮助 可怜 穷苦,1
TRAIN_SENT_ID_252523,,颜回,孔子,337 . 孔子 是 怎样 称赞 颜回 的 ？,人物二 称赞 人物一,-1
TRAIN_SENT_ID_270585,,全真七子,王重阳,( 4 ) 清静 家风 ： 王重阳 与 全真七子 的 丹法 关要 ， 宗教学 研究 ， 2009 年 03 月,清静 家风  人物二 人物一 丹法 关要  宗教学 研究   年  月,-1
TRAIN_SENT_ID_249546,,李蔡,李广,李妍 觉得 李敢 是 一步 好棋 ， 因为 “ 李氏家族 从 汉高祖 时代 就是 朝廷 重臣 ， 早有 名将 广武君 李左车 ， 今有 安乐 侯 李蔡 和 飞将军 李广 ” 。,李妍 觉得 李敢 一步 好棋   李氏家族 汉高祖 时代 朝廷 重臣  早有 名将 广武君 李左车  今有 安乐 侯 人物一 飞将军 人物二,1
TRAIN_SENT_ID_268824,,洪凌波,李莫愁,洪凌波 在 故事 中 ， 孝敬 、 尊重 师傅 李莫愁 ， 善待 师妹 陆无双 。,人物一 故事 中  孝敬  尊重 师傅 人物二  善待 师妹 陆无双,-1
TRAIN_SENT_ID_261329,,罗松,罗成,1 人物 简介 : 隋唐 时期 罗艺 之孙 （ 祖母 姜桂芝 ） ， 罗松 之子 ， 罗成 的 侄子 。,人物 简介  隋唐 时期 罗艺 之孙  祖母 姜桂芝   人物一 之子  人物二 侄子,1
TRAIN_SENT_ID_272686,,蓝兰,张晓,后 殷 发现 他 最初 在 博物馆 遇见 的 人 不是 蓝兰 ， 而是 与 蓝兰 长得 一模一样 的 孪生 妹妹 张晓 … …,殷 发现 最初 博物馆 遇见 人物一  人物一 长得 一模一样 孪生 妹妹 人物二,1
TRAIN_SENT_ID_267531,,扈成,扈三娘,事成 后 ， 李逵 起到 扈家庄 ， 扈家庄 无防备 ， 竟 被 灭门 ， 唯 扈成 逃脱 ， 后 扈三娘 由 宋江 做主 ， 嫁给 矮脚 虎 王英 。,事成  李逵 起到 扈家庄  扈家庄 无防备  竟 灭门  唯 人物一 逃脱  人物二 宋江 做主  嫁给 矮脚 虎 王英,1
TRAIN_SENT_ID_261684,,程英,陆无双,表姐 （ 陆无双 专用 ） 柴蔚版 程英 ( 6 张 ),表姐  人物二 专用  柴蔚版 人物一   张,1
TRAIN_SENT_ID_266183,,李昌镐,曹薰铉,执笔 撰写 了 《 李昌镐 新手 新型 》 、 《 曹薰铉 行棋 技巧 》 等 多种 围棋 图书 。,执笔 撰写  人物一 新手 新型    人物二 行棋 技巧  多种 围棋 图书,-1
TRAIN_SENT_ID_264276,,陈真,霍元甲,但 就 在 此时 ， 闻 霍元甲 病逝 ， 陈真 回国 ， 学业 半途而废 。,闻 人物二 病逝  人物一 回国  学业 半途而废,-1
TRAIN_SENT_ID_284538,,范瑞亭,沈竹善,沈竹善 - - 冯振声 、 孙伯珍 、 卢德俊 、 张星 武 、 范瑞亭,人物二   冯振声  孙伯珍  卢德俊  张星 武  人物一,-1
TRAIN_SENT_ID_266060,,张学思,张学良,一般而言 ， 以字定 辈分 者 ， 都 将 这些 辈分 字 置于 姓 之后 ， 如 张学良 、 张学思 、 张学铭 。,一般而言  以字定 辈分  辈分 字 置于 姓 之后  人物二  人物一  张学铭,1
TRAIN_SENT_ID_251548,,楚碧痕,楚寒镜,迷宫 人物 概况 ： 楚碧痕 、 楚寒镜 、 熔岩 兽王,迷宫 人物 概况  人物一  人物二  熔岩 兽王,1
TRAIN_SENT_ID_268830,,洪凌波,李莫愁,曾斗 之 人 ： 李莫愁 、 公孙止 、 陆无双 、 程英 、 洪凌波,曾斗  人物二  公孙止  陆无双  程英  人物一,-1
TRAIN_SENT_ID_252603,,颜回,孔子,"魏晋 南北朝 期间 ， 有时 又 以 孔子 为 先圣 , 以 颜回 为 先师 奉祀 ， 拜孔 揖 颜之礼 更 多 是 在 国家 太学 举行 ， 往往 是 国子监 祭酒 负责 典礼 。",魏晋 南北朝 期间  人物二 先圣  人物一 先师 奉祀  拜孔 揖 颜之礼 更 国家 太学 举行  往往 国子监 祭酒 负责 典礼,-1
TRAIN_SENT_ID_261148,,王缙,王维,7 集评 : 唐宋 时期 : 唐 窦蒙 ： 时议 云 ： “ 论诗 则 曰 王维 、 崔颢 ； 论笔 则 王缙 李邕 端州 石室 记 、 李邕 ； 祖咏 、 张 说不得 预焉 。 ”,集评  唐宋 时期  唐 窦蒙  时议 云   论诗 曰 人物二  崔颢  论笔 人物一 李邕 端州 石室 记  李邕  祖咏  张 说不得 预焉,1
TRAIN_SENT_ID_259372,,葛玄,左慈,《 长葛县 志 》 载 ： “ 昔 吴人 葛玄 ， 从 左慈 受九丹 金液 仙经 ， 世号 葛仙翁 。,长葛县 志  载   昔 吴人 人物一  人物二 受九丹 金液 仙经  世号 葛仙翁,-1
TRAIN_SENT_ID_269354,,王中军,王中磊,企业 领袖 ： 柳传志 、 李彦宏 、 马化腾 、 牛根生 、 陈旭东 、 虞锋 、 王中军 、 王中磊 、 冯东明 、 于冬 、 邹其方 …,企业 领袖  柳传志  李彦宏  马化腾  牛根生  陈旭东  虞锋  人物一  人物二  冯东明  于冬  邹其方,1
TRAIN_SENT_ID_258121,,孙少安,孙兰香,他 是 土壤 ， 是 铺路石 ， 是 泥土 里 的 根 ， 在 这块 土壤 上长 出 了 孙少安 、 孙少平 和 孙兰香 这 几株 大树 。,土壤  铺路石  泥土 里 根  这块 土壤 上长 出 人物一  孙少平 人物二 几株 大树,1
TRAIN_SENT_ID_275823,,程万牛,程铁牛,程铁牛 、 程万牛 出场 ， 哥俩 个费 了 半天 劲 才 把 红幔 幔 的 弓拉个 半满 。,人物二  人物一 出场  哥俩 个费 半天 劲 红幔 幔 弓拉个 半满,1
TRAIN_SENT_ID_249203,,皮皮鲁,鲁西西,因为 他 的 《 舒克和贝塔 》 、 《 皮皮鲁 和 鲁西西 》 动画 都 是 当之无愧 的 NUMONE ！,舒克和贝塔    人物一 人物二  动画 当之无愧,1
TRAIN_SENT_ID_249290,,陆无双,程英,8 陆无双 和 程英 / 80,人物一 人物二,1
TRAIN_SENT_ID_259616,,季布,季心,季心 ： 季布 弟 ， 亦 以 任侠 名 。,人物二  人物一 弟  任侠 名,1
TRAIN_SENT_ID_255333,,卫夫人,王羲之,王羲之 学书 人物 简介 : 卫夫人 ： 卫夫人 ， 名铄 ， 字茂猗 ( 公元 242 - 349 年 ) ， 河东 安邑 ( 今 山西 夏县 北 ) 人 ， 是 晋代 著名 书法家 。,人物二 学书 人物 简介  人物一  人物一  名铄  字茂猗  公元    年   河东 安邑  山西 夏县 北   晋代 著名 书法家,-1
TRAIN_SENT_ID_257784,,林平之,岳不群,与 岳不群 : 何宝生 版 林平之 ( 42 张 ),人物二  何宝生 版 人物一   张,-1
TRAIN_SENT_ID_273687,,姜子牙,元始天尊,幡 下 有 六尾 ， 其上 各写 有 太上老君 、 元始天尊 、 阿弥陀佛 、 准提 道人 、 姬发 、 姜子牙 六人 之 名讳 。,幡 六尾  其上 各写 太上老君  人物二  阿弥陀佛  准提 道人  姬发  人物一 六人 名讳,-1
TRAIN_SENT_ID_255450,,罗成,秦琼,第三十六回 专诸巷 罗成 认 舅母 贾柳店 秦琼 待 宾朋,第三十六回 专诸巷 人物一 认 舅母 贾柳店 人物二 宾朋,1
TRAIN_SENT_ID_252495,,颜回,孔子,孔子 与 颜回 的 有趣 对话,人物二 人物一 有趣 对话,-1
TRAIN_SENT_ID_274393,,贾演,贾源,( 注释 ： 贾演 、 贾源 之 父 ， 书中 未 交代 其名 ， 今以 “ 贾 太公 ” 代之 ， 不 称呼 他 为 “ 贾公 ” ， 是因为 贾母 的 丈夫 贾代善 世称 “ 贾公 ” ),注释  人物一  人物二 父  书中 未 交代 其名  今以  贾 太公  代之  称呼  贾公   是因为 贾母 丈夫 贾代善 世称  贾公,1
TRAIN_SENT_ID_249558,,李蔡,李广,李蔡 是 李广 堂弟 。,人物一 人物二 堂弟,1
TRAIN_SENT_ID_278053,,郭麒麟,于谦,于谦 — — 郭麒麟 （ 郭德纲 之子 ） 、 冯阔洋 、 太 荣剑,人物二   人物一  郭德纲 之子   冯阔洋  太 荣剑,-1
TRAIN_SENT_ID_263538,,林逸,杨明,林逸 土 冉冉 （ 小九 ） : 土 冉冉 黄土 高派 土 青松 的 女儿 ， 杨明 的 干女儿 ， 林逸 的 青梅竹马 。,人物一 土 冉冉  小九   土 冉冉 黄土 高派 土 青松 女儿  人物二 干女儿  人物一 青梅竹马,-1
TRAIN_SENT_ID_272647,,卫少儿,卫青,主角 ： 霍去病 ┃ 配角 ： 绿阶 、 卫青 、 刘彻 、 卫少儿 、 卫子夫 … …,主角  霍去病 ┃ 配角  绿阶  人物二  刘彻  人物一  卫子夫,1
TRAIN_SENT_ID_256510,,周武,周文,武王发 ， 即 周武 王姬 发 ， 周文 王姬 昌 与 太 姒 的 嫡 次子 ， 其正 妻为 邑 姜 ， 西周 王朝 开国 君主 ， 在位 13 年 。,武王发  人物一 王姬 发  人物二 王姬 昌 太 姒 嫡 次子  其正 妻为 邑 姜  西周 王朝 开国 君主  在位  年,1
TRAIN_SENT_ID_253814,,孟凡,孟芙,姐妹花 孟凡 和 孟芙 深陷 其中 ， 幸亏 太监 小马 子 的 暗中帮助 才 逃过 劫难 。,姐妹花 人物一 人物二 深陷  幸亏 太监 小马 子 暗中帮助 逃过 劫难,1
TRAIN_SENT_ID_250678,,鲁西西,皮皮鲁,皮皮鲁 恋着 鲁西西,人物二 恋着 人物一,1
TRAIN_SENT_ID_275889,,王子豪,王子杰,与 廖仲谦 、 王子豪 、 王子杰 胜 一帮,廖仲谦  人物一  人物二 胜 一帮,1
TRAIN_SENT_ID_273677,,姜子牙,元始天尊,姜子牙 帮 申公豹 求情 ， 元始天尊 放 了 申公豹 。,人物一 帮 申公豹 求情  人物二 放 申公豹,-1
TRAIN_SENT_ID_250373,,赵飞燕,赵合德,— — 西汉 之 赵飞燕 、 赵合德,西汉 人物一  人物二,1
TRAIN_SENT_ID_253815,,孟凡,孟芙,"= 孟凡 心机 小马 子 远离 孟凡 = 孟凡 将 妹妹 坟墓 移入 皇宫 , 请 唐玄宗 封 孟芙 为兰妃 。",人物一 心机 小马 子 远离 人物一  人物一 妹妹 坟墓 移入 皇宫  请 唐玄宗 封 人物二 为兰妃,1
TRAIN_SENT_ID_250085,,武敦儒,武修文,靖 、 蓉 为 寻找 黄药师 ， 巧遇 武三通 之子 武敦儒 、 武修文 以及 杨康之 子 杨过 。,靖  蓉 寻找 黄药师  巧遇 武三通 之子 人物一  人物二 杨康之 子 杨过,1
TRAIN_SENT_ID_258130,,刘星,夏雪,夏雪 帮助 刘星 把 怪客 “ 软禁 ” 在家 。,人物二 帮助 人物一 怪客  软禁  在家,1
TRAIN_SENT_ID_255316,,卫夫人,王羲之,晋 王羲之 《 题 卫夫人 笔阵 图后 》 ： “ 每作 一波 ， 常三过 折笔 。 ”,晋 人物二  题 人物一 笔阵 图后    每作 一波  常三过 折笔,-1
TRAIN_SENT_ID_284555,,梁守忠,万籁声,万籁声 又 传洪正福 、 周铨 、 刘家 填 、 陈训 德 、 秦腊生 、 梁守忠 等 。,人物二 传洪正福  周铨  刘家 填  陈训 德  秦腊生  人物一,-1
TRAIN_SENT_ID_251515,,陈辅,陈靖仇,陈靖仇 在 陈辅 的 督促 下 ， 身不由己 的 开始 了 寻找 神器 的 旅程 。,人物二 人物一 督促  身不由己 寻找 神器 旅程,-1
TRAIN_SENT_ID_274397,,贾演,贾源,红楼 话 美食 序言 : 宁荣二 府 是 宁国公 贾演 和 荣国公 贾源 开创 的 基业 ， 至 贾宝玉 这 一代 已 历经 四世 。,红楼 话 美食 序言  宁荣二 府 宁国公 人物一 荣国公 人物二 开创 基业  贾宝玉 一代 历经 四世,1
TRAIN_SENT_ID_264201,,陈真,霍元甲,陈真 后传 剧情简介 : 霍元甲 的 陈真 后传 剧照 ( 22 张 ),人物一 后传 剧情简介  人物二 人物一 后传 剧照   张,-1
TRAIN_SENT_ID_250384,,赵飞燕,赵合德,这里 的 赵后 ， 就是 赵飞燕 ， 昭仪 就是 赵合德 。,赵后  人物一  昭仪 人物二,1
TRAIN_SENT_ID_262202,,陈靖仇,陈辅,3 轩辕剑 叁 外传 ： 天之痕 : 相关 剧情 : 游戏 主角 陈靖仇 的 师父 陈辅 在 伏 魔 山上 被 饕餮 。,轩辕剑 叁 外传  天之痕  相关 剧情  游戏 主角 人物一 师父 人物二 伏 魔 山上 饕餮,-1
TRAIN_SENT_ID_275890,,王子豪,王子杰,16 . 王子豪 及 王子杰 （ 火柴 天堂 ） 15 分,人物一 人物二  火柴 天堂   分,1
TRAIN_SENT_ID_249139,,皮皮鲁,鲁西西,其 代表作 有 《 童话 大王 》 《 舒克和贝塔 》 《 皮皮鲁 和 鲁西西 》 《 魔方 大厦 》,代表作  童话 大王   舒克和贝塔   人物一 人物二   魔方 大厦,1
TRAIN_SENT_ID_270986,,严舆,严白虎,严白虎 武将 技能 : 严白虎 技能 导读 : 严白虎 是 割据 江东 的 豪强 ， 原名 严虎 ， 与其 弟 严舆 以 勇武 出名 。,人物二 武将 技能  人物二 技能 导读  人物二 割据 江东 豪强  原名 严虎  弟 人物一 勇武 出名,1
TRAIN_SENT_ID_257499,,姜昆,马季,马季 、 赵世忠 、 姜昆,人物二  赵世忠  人物一,-1
TRAIN_SENT_ID_275818,,程万牛,程铁牛,唐 王与 秦怀玉 、 罗通 、 程咬金 、 程铁牛 、 程万牛 慰劳 完 三军 ， 回程 路过 一个 山包 ， 被 了 空和尚 请 进 法华寺 。,唐 王与 秦怀玉  罗通  程咬金  人物二  人物一 慰劳 完 三军  回程 路过 一个 山包  空和尚 请 进 法华寺,1
TRAIN_SENT_ID_266669,,邓鸣贺,邓鸣璐,儿童节目 ： 邓鸣贺 （ 已故 ） 、 邓鸣璐 等 。,儿童节目  人物一  已故   人物二,1
TRAIN_SENT_ID_250357,,赵飞燕,赵合德,赵飞燕 ， 赵合德 ： 几个 红颜 成 薄命,人物一  人物二  几个 红颜 成 薄命,1
TRAIN_SENT_ID_255413,,罗成,秦琼,徐茂 公派 王伯党 ， 谢映 登 ， 任 警司 ， 铁子 健带 着 徐和 秦琼 的 书信 去 北平 府 请 罗成 。,徐茂 公派 王伯党  谢映 登  警司  铁子 健带 徐和 人物二 书信 北平 府 请 人物一,1
TRAIN_SENT_ID_250108,,武敦儒,武修文,武敦儒 、 武修文 与 杨过相 比 ， 只能 比 出 杨过 出类拔萃 、 超群绝伦 。,人物一  人物二 杨过相  只能 出 杨过 出类拔萃  超群绝伦,1
TRAIN_SENT_ID_283371,,刘义融,刘义庆,母亲 ： 长沙 妃 檀氏字 宪子 ， 谥 景定 ， 出自 高平 平阳 檀氏 刘义融 兄弟 : 刘义欣 、 刘义庆 、 刘义宗 、 刘义宾 、 刘义綦 。,母亲  长沙 妃 檀氏字 宪子  谥 景定  出自 高平 平阳 檀氏 人物一 兄弟  刘义欣  人物二  刘义宗  刘义宾  刘义綦,1
TRAIN_SENT_ID_276154,,贾惜春,贾珍,贾惜春 ， 金陵 十二钗 之八 ， 贾珍 的 妹妹 ， 自小 喜爱 画画 。,人物一  金陵 十二钗 之八  人物二 妹妹  自小 喜爱 画画,1
TRAIN_SENT_ID_277824,,傅清,傅恒,李荣保 之子 ： 傅恒 、 广成 、 傅清 及 傅玉 俱为 重臣 。,李荣保 之子  人物二  广成  人物一 傅玉 俱为 重臣,1
TRAIN_SENT_ID_250082,,武敦儒,武修文,年轻 一辈 里面 ， 武敦儒 、 武修文 绝对 可以 算得 上 是 优秀 的 。,年轻 一辈 里面  人物一  人物二 绝对 算得 优秀,1
TRAIN_SENT_ID_251829,,梅超风,黄药师,结果 梅超风 不 敌 全真七子 ， 却 因 黄药师 的 到来 而 结束 。,人物一 敌 全真七子  人物二 到来 结束,-1
TRAIN_SENT_ID_259413,,凌音,凌波,凌波 、 凌音 、 炎舞,人物二  人物一  炎舞,1
TRAIN_SENT_ID_250078,,武敦儒,武修文,师兄 ： 武敦儒 、 武修文,师兄  人物一  人物二,1
TRAIN_SENT_ID_268922,,司徒静,司徒剑南,司徒剑南 第十一 集 : 文蔷 救 下 司徒静 。,人物二 第十一 集  文蔷 救 人物一,1
TRAIN_SENT_ID_275457,,李汉俊,李书城,李书城 支持 胞弟 : 李汉俊 是 李书城 的 胞弟 ， 是 中共 早期 的 主要 领袖 。,人物二 支持 胞弟  人物一 人物二 胞弟  中共 早期 主要 领袖,1
TRAIN_SENT_ID_257578,,毛泽民,毛泽东,80 . 毛泽民 惨遭杀害 毛泽东 念弟 情长,人物一 惨遭杀害 人物二 念弟 情长,1
TRAIN_SENT_ID_259796,,李偲菘,李伟菘,- - - - - - 李偲菘 李伟菘,人物一 人物二,1
TRAIN_SENT_ID_268940,,韩非,荀子,《 荀子 》 《 韩非 子 》 之 各 一部分 。,人物二   人物一 子  一部分,-1
TRAIN_SENT_ID_284888,,王燕燕,王伦,王伦 ： 杨怀民 ； 王燕燕 ： 狄莺 ； 莫愁 ： 赵永馨 ； 荆无命 ： 谢屏楠 ； 仁宗 ： 施羽 ；,人物二  杨怀民  人物一  狄莺  莫愁  赵永馨  荆无命  谢屏楠  仁宗  施羽,1
