sent_id,sent_id,entity1,entity2,sent,processed_sent,human
TRAIN_SENT_ID_251593,,穆春,穆弘,穆春 是 《 水浒传 》 中 的 人物 ， 绰号 小 遮拦 ， 江州 人氏 ， 原 是 揭阳 镇 富户 ， 与 哥哥 穆弘 同 为 当地 一霸 。,人物一  水浒传  中 人物  绰号 遮拦  江州 人氏  原 揭阳 镇 富户  哥哥 人物二 一霸,-1
TRAIN_SENT_ID_271508,,孟优,孟获,他 马上 叫 人 再次 放 了 孟获 、 孟优 及朵 思 大王 。,马上 再次 放 人物二  人物一 及朵 思 大王,-1
TRAIN_SENT_ID_257481,,姜昆,马季,中央电视台 春节 联欢晚会 历届 主持人 : 1983 年 ： 马季 姜昆 王景愚 刘晓庆,中央电视台 春节 联欢晚会 历届 主持人   年  人物二 人物一 王景愚 刘晓庆,-1
TRAIN_SENT_ID_250718,,鲁西西,皮皮鲁,皮皮鲁 、 鲁西西 、 大灰狼 罗克 、 舒克和贝塔 是 他 笔下 的 文学 形象 ， 有 “ 童话 大王 ” 之称 。,人物二  人物一  大灰狼 罗克  舒克和贝塔 笔下 文学 形象   童话 大王  之称,-1
TRAIN_SENT_ID_265090,,杨志刚,郭靖宇,《 红娘子 》 是 郭靖宇 继 《 铁 梨花 》 《 将军 》 之后 又 一部 自编 自导 的 作品 ， 由王 珞丹 、 杨志刚 、 刘威 、 王绘春 、 史可 、 王超 等 主演 。,红娘子  人物二 继  铁 梨花   将军  之后 一部 自编 自导 作品  由王 珞丹  人物一  刘威  王绘春  史可  王超 主演,-1
TRAIN_SENT_ID_281906,,秦天,秦卫江,不息 的 激情 — — 采访 秦基伟 的 夫 从 唐贤 美 、 女儿 秦 晼 江 、 儿子 秦卫江 和 秦天,不息 激情   采访 秦基伟 夫 唐贤 美  女儿 秦 晼 江  儿子 人物二 人物一,-1
TRAIN_SENT_ID_261967,,郭涛,郭月,郭涛 的 腿 在 医院 里 治疗 了 一个多月 ， 出院 时 ， 郭月 扶 着 哥哥 回家 。,人物一 腿 医院 里 治疗 一个多月  出院 时  人物二 扶 哥哥 回家,-1
TRAIN_SENT_ID_263737,,寇刀飞殇,楚华容,投诚 ： 非循 、 腾虚 其他 : 铁 十三 、 渡香蝶 、 楚华容 、 寇刀飞殇 、 三教 罪人 、 富山高 、 楚王 孙 、 青 蚵 嫂,投诚  非循  腾虚  铁 十三  渡香蝶  人物二  人物一  三教 罪人  富山高  楚王 孙  青 蚵 嫂,-1
TRAIN_SENT_ID_258127,,刘星,夏雪,可 夏雪 接二连三 地 吃 了 闭门羹 ， 最后 不得不 论落 为 向 刘星 小雨 借钱 的 地步 ， 可 两个 弟弟 却 还 缠 着 她 买 这 买 那 。,人物二 接二连三 吃 闭门羹  最后 不得不 论落 人物一 小雨 借钱 地步  两个 弟弟 缠 买 买,-1
TRAIN_SENT_ID_276223,,姜丽文,姜文杰,女儿 叫 姜丽文 ， 她 与 哥哥 姜文杰 在 2014 年 一起 参加 了 浙江 卫视 真人秀 节目 《 我 不是 明星 》 。,女儿 人物一  哥哥 人物二  年 一起 参加 浙江 卫视 真人秀 节目  明星,-1
TRAIN_SENT_ID_256491,,周武,周文,传说 中 的 周文 王和 周武 王 的 陵墓 在 现在 陕西省 咸阳市 的 原坂上 。,传说 中 人物二 王和 人物一 王 陵墓 现在 陕西省 咸阳市 原坂上,-1
TRAIN_SENT_ID_279625,,李德亭,李德宁,子女 ： 两个 女儿 （ 李德宁 、 李德亭 ）,子女  两个 女儿  人物二  人物一,-1
TRAIN_SENT_ID_257797,,林平之,岳不群,1 人物 经历 : 收徒 林平之 : 巍子 饰演 的 岳不群 林平之 为 福建 福威 镖局 的 大少爷 ， 原 为 一名 武功 低微 但 教养 良好 的 好 少年 。,人物 经历  收徒 人物一  巍子 饰演 人物二 人物一 福建 福威 镖局 大少爷  原 一名 武功 低微 教养 良好 少年,-1
TRAIN_SENT_ID_255478,,罗成,秦琼,瓦岗寨 起义 失败 后 ， 单雄信 的 结义兄弟 秦琼 、 罗成 、 程咬金 等 人 归顺 了 大唐 李氏 ， 而 单雄信 投靠 了 郑王 王世充 。,瓦岗寨 起义 失败  单雄信 结义兄弟 人物二  人物一  程咬金 归顺 大唐 李氏  单雄信 投靠 郑王 王世充,-1
TRAIN_SENT_ID_259788,,李偲菘,李伟菘,李伟菘 与 李偲菘 的 才华 受到 台湾 小虫 的 肯定 ， 除 应邀 为 杜德伟 的 “ 狂风 ” 专辑 写 “ 为 我 照顾 他 ” 而 受 人 瞩目 ， 并 加盟 “ 王者之剑 ” 。,人物二 人物一 才华 台湾 小虫 肯定  应邀 杜德伟  狂风  专辑 写  照顾  受 瞩目  加盟  王者之剑,-1
TRAIN_SENT_ID_256570,,周武,周文,10 . 周公 ： 姓姬 ， 名旦 ， 周文 王之子 ， 周武 王之弟 ， 西周 初 政治家 ， 相传 周朝 的 典章制度 都 是 他 制定 的 。,周公  姓姬  名旦  人物二 王之子  人物一 王之弟  西周 初 政治家  相传 周朝 典章制度 制定,-1
TRAIN_SENT_ID_250581,,鲁西西,皮皮鲁,3 人物 简介 : 皮皮鲁 和 鲁西西 是 中国 童话 大王 郑渊洁 笔下 的 一对 双胞胎 兄妹 ， 他们 在 中国 的 孩子 中是 几乎 无人不晓 的 传奇人物 。,人物 简介  人物二 人物一 中国 童话 大王 郑渊洁 笔下 一对 双胞胎 兄妹  中国 孩子 中是 几乎 无人不晓 传奇人物,-1
TRAIN_SENT_ID_259521,,梅超风,杨康,黄药师 为了 找寻 女儿 打破 誓言 离开 桃花岛 ， 在 太湖 归云庄 发现 了 黄蓉 、 郭靖 及 为 救 杨康 而来 的 梅超风 。,黄药师 找寻 女儿 打破 誓言 离开 桃花岛  太湖 归云庄 发现 黄蓉  郭靖 救 人物二 而来 人物一,-1
TRAIN_SENT_ID_256560,,周武,周文,（ 电视剧 《 我 的 二哥 二嫂 》 角色 ） : 周家 老四 ， 周文 、 周武 、 周双 的 弟弟 ， 周家 最小 的 儿子 。,电视剧  二哥 二嫂  角色   周家 老四  人物二  人物一  周双 弟弟  周家 最小 儿子,-1
TRAIN_SENT_ID_276033,,华莲青,华罗庚,与 弟弟 华罗庚 相比 ， 华莲青 的 一生 谈不上 成就 ， 但 能够 像 她 那样 ， 为了 弟弟 的 事业 付出 那么 多 ， 也 是 一个 值得 怀念 的 人 。,弟弟 人物二 相比  人物一 一生 谈不上 成就  能够  弟弟 事业 付出  一个 值得 怀念,-1
TRAIN_SENT_ID_272006,,文姜,宣姜,文姜 与 姊姊 宣姜 一样 是 美女 ， 且 文姜 聪慧 又 善 诗文 ， 但 在 出嫁 前 就 和 同父异母 哥哥 齐襄公 近亲 性交 。,人物一 姊姊 人物二 美女  人物一 聪慧 善 诗文  出嫁 前 同父异母 哥哥 齐襄公 近亲 性交,-1
TRAIN_SENT_ID_256465,,周武,周文,《 古史 纪年 》 中引 孙之绿 说 ： “ 西河 ， 是 周文 王之子 周武 王 封其弟 康叔 为 始祖 的 卫国之 地 ， 此村 地处 古黄河 西岸 。 ”,古史 纪年  中引 孙之绿 说   西河  人物二 王之子 人物一 王 封其弟 康叔 始祖 卫国之  此村 地处 古黄河 西岸,-1
TRAIN_SENT_ID_249300,,陆无双,程英,"小龙女 的 经历 是否 会 有 不同 , 程英 、 陆无双 是否 还会 孤独 一生 ?",小龙女 经历 是否 会 不同  人物二  人物一 是否 还会 孤独 一生,-1
TRAIN_SENT_ID_261687,,程英,陆无双,杨过 在 告别 陆无双 与 程英 后于 山岭 间 信步而行 时 无意 中 遇到 了 金轮法王 师徒 一行 ， 在 帮 其 疗伤 后 杨过 要求 国师 帮 自己 报仇 。,杨过 告别 人物二 人物一 后于 山岭 间 信步而行 时 无意 中 遇到 金轮法王 师徒 一行  帮 疗伤 杨过 要求 国师 帮 报仇,-1
TRAIN_SENT_ID_282929,,钱永真,钱永刚,钱永真 ， 钱学森 之女 ， 1950 年 6 月 26 日出 生于 美国 加州 ， 1955 年 随 父母 和 哥哥 钱永刚 回国 ， 后 从事 音乐教育 工作 。,人物一  钱学森 之女   年  月  日出 生于 美国 加州   年 父母 哥哥 人物二 回国  从事 音乐教育 工作,-1
TRAIN_SENT_ID_259636,,公孙胜,罗真人,④ 明 施耐庵 《 水浒 》 第五十三回 《 戴宗 二取 公孙胜 李逵 独劈 罗真人 》 请 哥哥 便 可 行程 ， 以见 始终 成全 大义 之美 。,④ 明 施耐庵  水浒  第五十三回  戴宗 二取 人物一 李逵 独劈 人物二  请 哥哥 便 行程  以见 始终 成全 大义 之美,-1
TRAIN_SENT_ID_263366,,武修文,武敦儒,武修文 是 武三通 和 武三娘 所 生 ， 父母 希望 他 ， 连同 他 哥哥 武敦儒 ， 弃武 从文 ， 不 涉身 险恶 江湖 。,人物一 武三通 武三娘 生  父母 希望  哥哥 人物二  弃武 从文  涉身 险恶 江湖,-1
TRAIN_SENT_ID_264527,,岳云鹏,郭德纲,喜欢 的 相声 艺人 ： 郭德纲 何云伟 曹云 金 岳云鹏 王自健,喜欢 相声 艺人  人物二 何云伟 曹云 金 人物一 王自健,-1
TRAIN_SENT_ID_254246,,张顺,张横,第二 拨 是 林冲 、 秦明 、 戴宗 、 张横 、 张顺 、 马麟 、 邓飞 、 王矮虎 、 白胜 。,第二 拨 林冲  秦明  戴宗  人物二  人物一  马麟  邓飞  王矮虎  白胜,-1
TRAIN_SENT_ID_272010,,文姜,宣姜,春秋时代 ， 齐僖公 姜禄 父有 二个 女儿 ： 宣姜 、 文姜 ， 都 是 绝色佳人 。,春秋时代  齐僖公 姜禄 父有 二个 女儿  人物二  人物一  绝色佳人,-1
TRAIN_SENT_ID_257510,,姜昆,马季,马季 - - 姜昆 、 赵炎 、 刘伟 、 冯巩 、 笑林 、 王谦祥 、 李增瑞 、 韩兰成 、 刘喜尧 、 彭子,人物二   人物一  赵炎  刘伟  冯巩  笑林  王谦祥  李增瑞  韩兰成  刘喜尧  彭子,-1
TRAIN_SENT_ID_256544,,周武,周文,周文 王之 子 ， 周武 王之 弟 ) 之胤 。,人物二 王之 子  人物一 王之 弟  之胤,-1
TRAIN_SENT_ID_257046,,洪敬尧,洪荣宏,07 . 爱 常常 喜乐 / 江蕙 ． 洪荣宏 ． 洪敬尧 ． 王力宏 ． 周华健 ． 伍思凯,爱 常常 喜乐  江蕙 ． 人物二 ． 人物一 ． 王力宏 ． 周华健 ． 伍思凯,-1
TRAIN_SENT_ID_256503,,周武,周文,周文 王之子 ， 周武 王灭 商后 被 封为 诸侯,人物二 王之子  人物一 王灭 商后 封为 诸侯,-1
TRAIN_SENT_ID_257055,,洪敬尧,洪荣宏,紧返 来 我 身边 恋花 07 爱 常常 喜乐 : 江蕙 ． 洪荣宏 ． 洪敬尧 ． 王力宏 ． 周华健 ． 伍思凯,紧返 身边 恋花  爱 常常 喜乐  江蕙 ． 人物二 ． 人物一 ． 王力宏 ． 周华健 ． 伍思凯,-1
TRAIN_SENT_ID_271572,,赵敏,王保保,后 在 夺取 大都 后西进 与 元 猛将 扩廓 帖 木儿 （ 就是 赵敏 的 哥哥 王保保 ） 军 进行 了 艰苦 的 搏战 ， 平定 山西 ， 陕西 。,夺取 大都 后西进 元 猛将 扩廓 帖 木儿  人物一 哥哥 人物二  军 进行 艰苦 搏战  平定 山西  陕西,-1
TRAIN_SENT_ID_284904,,陆启铿,华罗庚,数学 所 历任 所长 为 ： 华罗庚 、 陆启铿 （ 常务 副所长 ） 、 王元 、 杨乐 、 龙瑞 林 、 李炳仁 （ 代 所长 ） 、 王跃飞 。,数学 历任 所长  人物二  人物一  常务 副所长   王元  杨乐  龙瑞 林  李炳仁  代 所长   王跃飞,-1
TRAIN_SENT_ID_251549,,楚碧痕,楚寒镜,神农 与 伏羲 相争 ， 神农 离开 炎帝 神农 洞 前往 人间 ， 梭罗树 仙 楚寒镜 和 楚碧痕 、 熔岩 兽王 等 留于 洞 内 。,神农 伏羲 相争  神农 离开 炎帝 神农 洞 前往 人间  梭罗树 仙 人物二 人物一  熔岩 兽王 留于 洞,-1
TRAIN_SENT_ID_255445,,罗成,秦琼,第五十七回 秦琼 建祠 报雄信 罗成 奋勇 擒五王,第五十七回 人物二 建祠 报雄信 人物一 奋勇 擒五王,-1
TRAIN_SENT_ID_250434,,赵飞燕,赵合德,奸妃 中国 历代 奸妃 : 夏 ： 妺 喜 ； 商 ： 妲 己 ； 周 ： 褒 姒 、 汉 ： 赵合德 、 赵飞燕 ； 三国 ： 郭女王,奸妃 中国 历代 奸妃  夏  妺 喜  商  妲  周  褒 姒  汉  人物二  人物一  三国  郭女王,-1
TRAIN_SENT_ID_253860,,赵合德,赵飞燕,小说 人物 ： 汉成帝 ， 赵飞燕 ， 赵合德 ， 王太后 ， 班婕妤 ， 九 王爷,小说 人物  汉成帝  人物二  人物一  王太后  班婕妤  九 王爷,-1
TRAIN_SENT_ID_256535,,周武,周文,周文 王四 子 周武 王弟 周成 王叔,人物二 王四 子 人物一 王弟 周成 王叔,-1
TRAIN_SENT_ID_269420,,刘伟,马季,表演者 ： 马季 、 赵炎 、 冯巩 、 刘伟 、 王金宝 、 王谦祥 、 李增瑞 、 戴志诚 、 郑健,表演者  人物二  赵炎  冯巩  人物一  王金宝  王谦祥  李增瑞  戴志诚  郑健,-1
TRAIN_SENT_ID_257459,,姜昆,马季,中国中央电视台 春节 联欢晚会 历届 晚会 : 中国中央电视台 春节 联欢晚会 主持 : 1983 年 ： 马季 姜昆 王景愚 刘晓庆,中国中央电视台 春节 联欢晚会 历届 晚会  中国中央电视台 春节 联欢晚会 主持   年  人物二 人物一 王景愚 刘晓庆,-1
TRAIN_SENT_ID_268839,,骆羽,骆赢,女 运动员 : 赵芸蕾 、 马晋 、 骆赢 、 骆羽 、 王仪涵 、 于洋 、 李雪芮 、 唐渊渟,女 运动员  赵芸蕾  马晋  人物二  人物一  王仪涵  于洋  李雪芮  唐渊渟,-1
TRAIN_SENT_ID_256553,,周武,周文,周文 王 享年 九 十七岁 、 周武 王 享年 九十三岁 ， 周穆王 在位 一百年 ， 此时 佛法 也 没有 传入 中国 。,人物二 王 享年 九 十七岁  人物一 王 享年 九十三岁  周穆王 在位 一百年  佛法 没有 传入 中国,-1
TRAIN_SENT_ID_259684,,游颖,游娴,该剧 讲述 水 健儿 与 游德 是 离婚 夫妇 ， 各自 带 一个 女儿 游娴 、 游颖 分别 在 香港 和 美国 生活 。,该剧 讲述 水 健儿 游德 离婚 夫妇  带 一个 女儿 人物二  人物一 香港 美国 生活,-1
TRAIN_SENT_ID_261143,,武元庆,武则天,"唐朝 荆州 都督 武士彟 之孙 ， 女皇 武则天 异 母兄 武元庆 之子 武三思 , 即 为 武则天 的 侄子 ， 初 封梁王 。",唐朝 荆州 都督 武士彟 之孙  女皇 人物二 异 母兄 人物一 之子 武三思  人物二 侄子  初 封梁王,-1
TRAIN_SENT_ID_257057,,洪敬尧,洪荣宏,"BB , 伍佰万 ， 林灵 ， 洪荣宏 ， 洪敬尧 ， 郑仲茵 ， 宋逸民 ， 王思佳",伍佰万  林灵  人物二  人物一  郑仲茵  宋逸民  王思佳,-1
TRAIN_SENT_ID_272004,,文姜,宣姜,齐僖公 生 了 两个 貌美如花 、 风华绝代 的 女儿 ， 长女 宣姜 ， 次女 文姜 。,齐僖公 生 两个 貌美如花  风华绝代 女儿  长女 人物二  次女 人物一,-1
TRAIN_SENT_ID_261156,,王缙,王维,王缙 家族 成员 : 哥哥 ： 王维,人物一 家族 成员  哥哥  人物二,-1
TRAIN_SENT_ID_255396,,罗成,秦琼,李世民 : 在 李世民 的 统帅 下 ， 徐茂 公 、 秦琼 、 尉迟恭 、 程咬金 、 罗成 等 率兵 扫平 了 十八 路 反王 。,李世民  李世民 统帅  徐茂 公  人物二  尉迟恭  程咬金  人物一 率兵 扫平 十八 路 反王,-1
TRAIN_SENT_ID_262220,,尤二姐,尤三姐,刚烈 的 尤三姐 因 柳湘莲 的 拒绝 引剑 自尽 ； 温柔 的 尤二姐 因 王熙凤 的 陷害 吞金 自杀 。,刚烈 人物二 柳湘莲 拒绝 引剑 自尽  温柔 人物一 王熙凤 陷害 吞金 自杀,-1
TRAIN_SENT_ID_256457,,周武,周文,周家 老四 ， 周文 、 周武 、 周双 的 弟弟 ， 周家 最小 的 儿子 。,周家 老四  人物二  人物一  周双 弟弟  周家 最小 儿子,-1
TRAIN_SENT_ID_271233,,苏贤方,苏贤达,苏贤达 角色 介绍 : 苏 掌柜的 小儿子 ， 苏贤方 的 弟弟 ， 爱慕 邢青竹 。,人物二 角色 介绍  苏 掌柜的 小儿子  人物一 弟弟  爱慕 邢青竹,-1
TRAIN_SENT_ID_269421,,刘伟,马季,马季 赵炎 刘伟 冯巩 王金宝 演出 本,人物二 赵炎 人物一 冯巩 王金宝 演出,-1
TRAIN_SENT_ID_265094,,杨志刚,郭靖宇,2005 年 ， 杨志刚 在 机缘巧合 之下 与 哥哥 郭靖宇 合作 了 电视 连续剧 《 完美 夏天 》 ， 杨志刚 在 剧中 饰演 黄征 。,年  人物一 机缘巧合 之下 哥哥 人物二 合作 电视 连续剧  完美 夏天   人物一 剧中 饰演 黄征,-1
TRAIN_SENT_ID_256564,,周武,周文,武王 墓 是 周文 王和 周武 王 的 陵墓 ， 位于 陕西省 咸阳市 的 原坂上 。,武王 墓 人物二 王和 人物一 王 陵墓  位于 陕西省 咸阳市 原坂上,-1
TRAIN_SENT_ID_257242,,艾欧里亚,艾俄洛斯,第六 话 的 回忆 中曾 与 艾欧里亚 的 哥哥 ， 艾俄洛斯 发生 过 战斗 ， 在 这场 战斗 中 ， 安德烈亚斯 . 里瑟 的 左眼 被 艾俄洛斯 的 黄金 箭 弄伤 。,第六 话 回忆 中曾 人物一 哥哥  人物二 发生 战斗  这场 战斗 中  安德烈亚斯  里瑟 左眼 人物二 黄金 箭 弄伤,-1
TRAIN_SENT_ID_282222,,孔杰,刘小光,中国棋院 围棋 部 的 刘小光 ： 孔杰 在 这个 时候 2 ： 0 赢 了 韩国 的 新人王 ， 对 大家 是 个 鼓舞 。,中国棋院 围棋 部 人物二  人物一    赢 韩国 新人王  鼓舞,-1
TRAIN_SENT_ID_266694,,龙幽,龙溟,因 魔教 袭击 蜀山 ， 龙幽 等 人 追踪 毒影 至 蜀山 禁洞 ， 却 意外 遇到 凌波 ， 终于 听到 了 哥哥 龙溟 和 神农 鼎 的 消息 。,魔教 袭击 蜀山  人物一 追踪 毒影 蜀山 禁洞  意外 遇到 凌波  终于 听到 哥哥 人物二 神农 鼎 消息,-1
TRAIN_SENT_ID_270820,,伍天锡,伍云召,后 在 伍云召 之弟 伍天锡 及雄 阔海 帮忙 下当 上 南阳 王 ， 成为 隋末 十八 路反 王之一 。,人物二 之弟 人物一 及雄 阔海 帮忙 下当 南阳 王  成为 隋末 十八 路反 王之一,-1
TRAIN_SENT_ID_271302,,李思,李念,李思 被 爆 已婚 : 早 在 2009 年 ， 李念 在 接受 网易 新闻 采访 时候 就 提到 哥哥 已婚 。,人物一 爆 已婚  早  年  人物二 接受 网易 新闻 采访 提到 哥哥 已婚,-1
TRAIN_SENT_ID_269581,,张瑶萱,张瑶华,2000 年 ， 张学友 的 大 女儿 张瑶华 出生 ； 2005 年 张学友 的 次女 张瑶萱 出生 。,年  张学友 女儿 人物二 出生   年 张学友 次女 人物一 出生,-1
TRAIN_SENT_ID_256576,,周武,周文,“ 丰镐 ” ， 是 周文 王和 周武 王 分别 修建 的 丰京 和 镐京 的 合称 。,丰镐   人物二 王和 人物一 王 修建 丰京 镐京 合称,-1
TRAIN_SENT_ID_264959,,林一峰,林二汶,林一峰 （ 林二汶 的 哥哥 ） 、 林嘉欣 、 黄耀明 、 at17 的 另 一位 成员 卢凯彤 以及 林二汶 的 家人 朋友 分别 给 本 书写 了 很 特别 的 文字 。,人物一  人物二 哥哥   林嘉欣  黄耀明   一位 成员 卢凯彤 人物二 家人 朋友 书写 特别 文字,-1
TRAIN_SENT_ID_256554,,周武,周文,于是 ， 他 用 宝剑 猛 砍 宫柱 ， 直到 宝剑 折断 ， 才 长叹一声 说 ： “ 书烧 了 ， 剑 折 了 ， 周文 王和 周武 王 的 文武 治国 之道 ， 今天 夜里 全没 了 。 ”,宝剑 猛 砍 宫柱  宝剑 折断  长叹一声 说   书烧  剑 折  人物二 王和 人物一 王 文武 治国 之道  今天 夜里 全没,-1
TRAIN_SENT_ID_257026,,洪敬尧,洪荣宏,"20101204 猪哥 会社 秀场 歌中剧 ： 真假 王爷 BB , 伍佰万 , 林灵 , 洪荣宏 , 洪敬尧 , 郑仲茵 , 宋逸民 , 王思佳",猪哥 会社 秀场 歌中剧  真假 王爷   伍佰万  林灵  人物二  人物一  郑仲茵  宋逸民  王思佳,-1
TRAIN_SENT_ID_274444,,方如沁,方兰生,2 人物 经历 : 剧中 由马 天宇 扮演 的 方兰生 是 家住 琴川 的 一介书生 ， 家境 殷实 ， 由 二姐 方如沁 养 大 。,人物 经历  剧中 由马 天宇 扮演 人物二 家住 琴川 一介书生  家境 殷实  二姐 人物一 养,-1
TRAIN_SENT_ID_282822,,松田翔太,松田龙平,可是 松田翔太 并 没有 哥哥 松田龙平 那么 幸运 ， 所以 这次 的 主演 机会 可谓 是 十分 难得 。,人物一 没有 哥哥 人物二 幸运  主演 机会 可谓 十分 难得,-1
TRAIN_SENT_ID_255447,,罗成,秦琼,罗成 角色 经历 : 罗成 秦琼 和 罗成 : 秦琼 不 喜欢 罗成 ， 不是 因为 嫉妒 罗成 的 才能 。,人物一 角色 经历  人物一 人物二 人物一  人物二 喜欢 人物一  嫉妒 人物一,-1
TRAIN_SENT_ID_261603,,宋小宝,赵本山,2013 - 03 - 03 ： 樱桃红 「 赵本山 ， 宋小宝 ， 沈春阳 ， 王天泽 」,樱桃红  人物二  人物一  沈春阳  王天泽,-1
TRAIN_SENT_ID_255355,,贾午,贾南风,郭槐 临终 ， 人之将死 ， 其言也善 ， 她 一直 谆谆嘱咐 女儿 贾南风 要 对 太子 慈爱 ， 不可 听从 贾午 、 贾谧 的话 。,郭槐 临终  人之将死  其言也善  一直 谆谆嘱咐 女儿 人物二 太子 慈爱  不可 听从 人物一  贾谧,-1
TRAIN_SENT_ID_261971,,郭涛,郭月,12 月 27 日 是 郭涛 的 生日 ， 郭月 拎 了 一只 大大的 蛋糕 ， 找 来 一帮 朋友 ， 在 医院 里 为 哥哥 过生日 。,月  日 人物一 生日  人物二 拎 一只 大大的 蛋糕  找 一帮 朋友  医院 里 哥哥 过生日,-1
TRAIN_SENT_ID_277919,,毛威,李金斗,李金斗 - - 刘颖 、 大兵 、 毛威 、 韩冰 、 刘畅 、 付强 、 方清平 、 王政,人物二   刘颖  大兵  人物一  韩冰  刘畅  付强  方清平  王政,-1
TRAIN_SENT_ID_252647,,颜回,孔子,《 孔子 家语 . 颜回 》,人物二 家语  人物一,1
TRAIN_SENT_ID_268195,,章子男,章子怡,章子男 ， 章子怡 的 哥哥 ， 中国 内地 经纪人 。,人物一  人物二 哥哥  中国 内地 经纪人,-1
TRAIN_SENT_ID_274398,,贾演,贾源,荣国公 贾源 是 宁国公 贾演 的 弟弟 ， 贾源 死后 他 的 儿子 贾代善 袭 了 他 的 爵位 。,荣国公 人物二 宁国公 人物一 弟弟  人物二 死后 儿子 贾代善 袭 爵位,-1
TRAIN_SENT_ID_256572,,周武,周文,周文 王之 子 ， 周武 王之 弟 。,人物二 王之 子  人物一 王之 弟,-1
TRAIN_SENT_ID_255416,,罗成,秦琼,第五十五回 斩 鳌 鱼叔 宝 建功 踹 唐营雄信 拼命 第五十六回 秦琼 建祠 报雄信 罗成 奋勇 擒五王,第五十五回 斩 鳌 鱼叔 宝 建功 踹 唐营雄信 拼命 第五十六回 人物二 建祠 报雄信 人物一 奋勇 擒五王,-1
TRAIN_SENT_ID_264361,,曾国潢,曾国藩,曾国藩 因与弟 曾国葆 有 隙 ， 想以 代为 建房 而弃 前嫌 ， 故令 四弟 曾国潢 寻宝 地 ， 故 曾家 以 三十卷 谷 与 王玉阶 兑得此 屋堂 地 各 三间 草房 。,人物二 因与弟 曾国葆 隙  想以 代为 建房 而弃 前嫌  故令 四弟 人物一 寻宝  曾家 三十卷 谷 王玉阶 兑得此 屋堂 三间 草房,-1
TRAIN_SENT_ID_274510,,曾江,林翠,秦剑 一生 有 许多 弟子 ， 楚原 、 林翠 、 龙刚 、 谢贤 、 嘉玲 、 南红 、 江雪 、 曾江 、 姜中平 、 王伟 、 陈齐颂 、 胡燕妮 等,秦剑 一生 弟子  楚原  人物二  龙刚  谢贤  嘉玲  南红  江雪  人物一  姜中平  王伟  陈齐颂  胡燕妮,-1
TRAIN_SENT_ID_256472,,周武,周文,周文 王礼贤 下士 ， 周武 王英勇 伐 纣 ， 解救 万民 于 水火 的 故事 同样 千古 流传 。,人物二 王礼贤 下士  人物一 王英勇 伐 纣  解救 万民 水火 故事 同样 千古 流传,-1
TRAIN_SENT_ID_256568,,周武,周文,应之 於 门 ， 曰 ： 何以 道旦 也 （ 周公 ， 姓姬 名旦 ， 周文 王之 子 ， 周武 王之 弟 ， 周成 王之 叔父 ） ？,应之 於 门  曰  道旦  周公  姓姬 名旦  人物二 王之 子  人物一 王之 弟  周成 王之 叔父,-1
TRAIN_SENT_ID_274176,,牧野枣,牧野遥,2 家庭 人物 : 女儿 （ 四姐妹 ） ： 牧野遥 、 牧野枣 、 牧野晶 、 牧野冬,家庭 人物  女儿  四姐妹   人物二  人物一  牧野晶  牧野冬,-1
TRAIN_SENT_ID_261639,,宋小宝,赵本山,电视剧 《 爹妈 满院 》 由 艺术大师 赵本山 携 爱徒 小 沈阳 、 宋小宝 、 沈春阳 、 王小利 、 精美画册 ( 10 张 ),电视剧  爹妈 满院  艺术大师 人物二 携 爱徒 沈阳  人物一  沈春阳  王小利  精美画册   张,-1
TRAIN_SENT_ID_256468,,周武,周文,周文 王 访贤 遇到 姜太公 ， 遂 请 回拜 为 太师 ， 尊称 太公望 ， 周武 王继 位 又 尊称 师尚父 。,人物二 王 访贤 遇到 姜太公  遂 请 回拜 太师  尊称 太公望  人物一 王继 位 尊称 师尚父,-1
TRAIN_SENT_ID_274114,,欧阳娣娣,欧阳娜娜,2013 / 04 / 20 动力火车 、 欧阳龙 、 傅娟 、 欧阳娜娜 、 欧阳妮妮 、 欧阳娣娣 、 澎 恰恰 、 王予柔,动力火车  欧阳龙  傅娟  人物二  欧阳妮妮  人物一  澎 恰恰  王予柔,-1
TRAIN_SENT_ID_255322,,卫夫人,王羲之,9 书法家 : 魏晋 南北朝 : 曹操 钟繇 王羲之 王献之 王徽之 索靖 卫恒 卫夫人 谢安 王珣 薄绍之 萧思话 萧衍 王荟 王僧虔 王志 王慈 羊欣,书法家  魏晋 南北朝  曹操 钟繇 人物二 王献之 王徽之 索靖 卫恒 人物一 谢安 王珣 薄绍之 萧思话 萧衍 王荟 王僧虔 王志 王慈 羊欣,-1
TRAIN_SENT_ID_262725,,周厚恩,周厚安,周厚恩 人物 经历 : 周厚恩 ， 女 ， 1994 年 出生 ， 英文 名为 Anya ， 哥哥 是 周厚安 ， 著名 音乐 人 周华健 的 女儿 。,人物一 人物 经历  人物一  女   年 出生  英文 名为   哥哥 人物二  著名 音乐 周华健 女儿,-1
TRAIN_SENT_ID_253908,,赵合德,赵飞燕,也 就是 这个 平阳公主 后来 收养 了 赵飞燕 、 赵合德 姐妹 二人 ， 并且 将 她们 介绍 给 了 自己 的 弟弟 汉成帝 。,平阳公主 后来 收养 人物二  人物一 姐妹 二人  介绍 弟弟 汉成帝,-1
TRAIN_SENT_ID_276221,,姜丽文,姜文杰,姜丽文 演艺 经历 : 2009 年 姜丽文 回港 和 哥哥 姜文杰 组成 BenjiandLesley 组合 ， 正式 进入 乐坛 。,人物一 演艺 经历   年 人物一 回港 哥哥 人物二 组成  组合  正式 进入 乐坛,-1
TRAIN_SENT_ID_257053,,洪敬尧,洪荣宏,《 爱 常常 喜乐 》 演唱 ： 洪荣宏 ． 洪敬尧 ． 王力宏 ． 周华健 ． 伍思凯,爱 常常 喜乐  演唱  人物二 ． 人物一 ． 王力宏 ． 周华健 ． 伍思凯,-1
