sent_id,sent_id,entity1,entity2,sent,processed_sent,human
TRAIN_SENT_ID_266696,,龙幽,龙溟,四人 认为 寻找 水灵 珠 和 龙溟 应 前往 苗疆 ， 在 神 降密 境遇 见 被 龙溟 封印 的 骨 蛇 ， 龙幽 伤痛 不己 。,四人 认为 寻找 水灵 珠 人物二 应 前往 苗疆  神 降密 境遇 见 人物二 封印 骨 蛇  人物一 伤痛 不己,1
TRAIN_SENT_ID_253844,,赵合德,赵飞燕,皇帝 专宠 赵合德 后 ， 赵飞燕 就 在 后宫 找 男宠 。,皇帝 专宠 人物一  人物二 后宫 找 男宠,-1
TRAIN_SENT_ID_257232,,艾欧里亚,艾俄洛斯,第十六章 艾俄洛斯 和 艾欧里亚,第十六章 人物二 人物一,-1
TRAIN_SENT_ID_269937,,沈春阳,赵本山,第 2012 - 04 - 12 期 郭德纲 VS 赵本山 高徒 嘉宾 ： 沈春阳 宋小宝,期 郭德纲  人物二 高徒 嘉宾  人物一 宋小宝,1
TRAIN_SENT_ID_274675,,马冬晗,马冬昕,"马冬晗 学生会 主席 : 马冬昕 , 马冬晗 ( 3 张 )",人物一 学生会 主席  人物二  人物一   张,-1
TRAIN_SENT_ID_284596,,郑辑之,郑伯猷,郑辑之 ， 郑伯猷 弟 ， 荥阳 开封人 ， 解褐奉 朝 请 ， 领 侍御史 ， 以 军功 赐爵 城皋 男 。,人物一  人物二 弟  荥阳 开封人  解褐奉 请  领 侍御史  军功 赐爵 城皋 男,-1
TRAIN_SENT_ID_252947,,颜回,孔子,而 《 孔子 游春 》 中 孔子 听 子路 、 颜回 谈论 志向 的 那 部分 也 具有 同样 的 效果 。,人物二 游春  中 人物二 听 子路  人物一 谈论 志向 部分 具有 同样 效果,1
TRAIN_SENT_ID_269351,,王中军,王中磊,王中磊 、 王中军,人物二  人物一,-1
TRAIN_SENT_ID_273634,,姜子牙,元始天尊,《 封神演义 》 中 ， 姜子牙 奉太上 元始天尊 敕命 ， 封屡树 战功 的 武将 黄飞虎 为 “ 东岳泰山 天 齐仁圣 大帝 ” ， 命 他 总管 天地 人间 的 吉凶祸福 。,封神演义  中  人物一 奉太上 人物二 敕命  封屡树 战功 武将 黄飞虎  东岳泰山 天 齐仁圣 大帝   命 总管 天地 人间 吉凶祸福,1
TRAIN_SENT_ID_257433,,姜昆,马季,唐杰忠 自 打出 道 以后 一直 以 捧哏 为主 ， 先 捧 马季 ， 再 捧 郝爱民 ， 最后 捧 姜昆 ， 被 人们 称为 捧哏 大家 。,唐杰忠 打出 道 以后 一直 捧哏 为主  先 捧 人物二  捧 郝爱民  最后 捧 人物一  称为 捧哏,1
TRAIN_SENT_ID_259621,,季布,季心,季布 的 弟弟 名叫 季心 ， 他 的 勇气 胜过 关中 所有 的 人 。,人物一 弟弟 名叫 人物二  勇气 胜过 关中,-1
TRAIN_SENT_ID_259006,,张苞,张绍,. 张苞 弟妹 : 张绍 ， 官至 侍中 尚书 仆射 。,人物一 弟妹  人物二  官至 侍中 尚书 仆射,-1
TRAIN_SENT_ID_274395,,贾演,贾源,其中 贾府 就 占 了 2 个 - - 宁国公 贾演 、 荣国公 贾源 。,贾府 占    宁国公 人物一  荣国公 人物二,-1
TRAIN_SENT_ID_252991,,颜回,孔子,孔子 掷 金试 颜回,人物二 掷 金试 人物一,-1
TRAIN_SENT_ID_260959,,杨露禅,陈长兴,当 所有 矛头 都 指向 杨露禅 一人 的 时候 ， 深谋远虑 的 掌门人 陈长兴 亲手 拆穿 了 儿子 栽秧 的 诡计 ： 他 用 花样百出 的 科学 手法 伪装成 武功 高手 。,矛头 指向 人物一 一人  深谋远虑 掌门人 人物二 亲手 拆穿 儿子 栽秧 诡计  花样百出 科学 手法 伪装成 武功 高手,1
TRAIN_SENT_ID_282570,,尹寿山,马德禄,马德禄 - - 高寿亭 、 高桂清 、 杨 闻华 、 尹寿山 、 郭荣起,人物二   高寿亭  高桂清  杨 闻华  人物一  郭荣起,-1
TRAIN_SENT_ID_272473,,李家杰,李家诚,继承人 ： 长子 李家杰 和 次子 李家诚,继承人  长子 人物一 次子 人物二,-1
TRAIN_SENT_ID_257499,,姜昆,马季,马季 、 赵世忠 、 姜昆,人物二  赵世忠  人物一,-1
TRAIN_SENT_ID_257214,,张子静,张爱玲,张志沂 （ 1896 年 — — 1953 年 ） ， 又名 张廷重 ， 河北 丰润 人 ， 清末 名臣 张佩纶 与 李鸿章 女 李菊 耦 的 独子 ， 张爱玲 与 张子静 父亲 。,张志沂   年    年   又名 张廷重  河北 丰润  清末 名臣 张佩纶 李鸿章 女 李菊 耦 独子  人物二 人物一 父亲,-1
TRAIN_SENT_ID_273659,,姜子牙,元始天尊,白鹤 童子 现身 ， 取回 阴阳 镜 ， 并 叫 姜子牙 去 见 元始天尊 。,白鹤 童子 现身  取回 阴阳 镜  人物一 见 人物二,1
TRAIN_SENT_ID_249323,,陆无双,程英,1228 郭 芙 、 程英 、 陆无双 出生,郭 芙  人物二  人物一 出生,1
TRAIN_SENT_ID_258157,,刘星,夏雪,心虚 的 刘星 和 夏雪 利诱 小雨 当 了 替罪羊 。,心虚 人物一 人物二 利诱 小雨 替罪羊,-1
TRAIN_SENT_ID_249555,,李蔡,李广,④ 李 轻车 — — 汉朝 名将 李广 的 堂弟 李蔡 曾 随 大将军 卫青 出征 过 匈奴 ， 封 轻车 将军 。,④ 李 轻车   汉朝 名将 人物二 堂弟 人物一 大将军 卫青 出征 匈奴  封 轻车 将军,-1
TRAIN_SENT_ID_249055,,吕洞宾,韩湘子,吕洞宾 化名 为 “ 官无上 ” ， 前来 传道 、 点化 韩湘 ， 使 韩湘子 很快 成仙 。,人物一 化名  官无上   前来 传道  点化 韩湘  人物二 很快 成仙,1
TRAIN_SENT_ID_259758,,李偲菘,李伟菘,参与 制作 : 李偲菘 李伟菘,参与 制作  人物一 人物二,1
TRAIN_SENT_ID_274170,,平和岛静雄,平和岛幽,平和岛幽 人物 设定 : 平和岛静雄 的 弟弟 。,人物二 人物 设定  人物一 弟弟,-1
TRAIN_SENT_ID_281390,,姜王后,姜文焕,姜桓楚 和 姜王后 被 纣王 无端 杀害 ， 姜文焕 悲愤交加 ， 自立 为 东伯侯 ， 竖起 反商 大旗 ， 是 八百 路 诸侯 中 第一个 造反 的 。,姜桓楚 人物一 纣王 无端 杀害  人物二 悲愤交加  自立 东伯侯  竖起 反商 大旗  八百 路 诸侯 中 第一个 造反,1
TRAIN_SENT_ID_271221,,和硕温恪公主,和硕敦恪公主,他们 是 ： 怡 亲王 胤 祥 、 和硕温恪公主 、 和硕敦恪公主 。,怡 亲王 胤 祥  人物一  人物二,-1
TRAIN_SENT_ID_252816,,颜回,孔子,④ 《 庄子 》 ： 孔子 见 老 聃 ， 出 ， 语 颜回 曰 ： “ 丘之道 ， 其 犹 醯 鸡乎 ？ ”,④  庄子   人物二 见 老 聃  出  语 人物一 曰   丘之道  犹 醯 鸡乎,1
TRAIN_SENT_ID_261157,,王缙,王维,王缙 、 王维 手足情深,人物一  人物二 手足情深,-1
TRAIN_SENT_ID_275812,,俞明颐,俞明诗,俞明颐 的 大哥 是 俞明震 ， 姐姐 俞明诗 ( 1865 ～ 1923 ) ， 字麟洲 ， 自号 “ 神雪 馆主 ” 。,人物一 大哥 俞明震  姐姐 人物二       字麟洲  自号  神雪 馆主,-1
TRAIN_SENT_ID_271739,,朱聪,郭靖,朱聪 和 全金发 最先 上山 ， 见 郭靖 躺 在 地下 被 四人 夹击 ， 已 是 命 在 顷刻 ， 如何 不 急 ？,人物一 全金发 最先 上山  见 人物二 躺 地下 四人 夹击  命 顷刻  急,1
TRAIN_SENT_ID_260952,,杨露禅,陈长兴,功夫 高手 名单 : 杨露禅 1799 — 1872 ， 河北 永年县 人 ， 杨氏 太极 创始 师从 陈长兴,功夫 高手 名单  人物一     河北 永年县  杨氏 太极 创始 师从 人物二,1
TRAIN_SENT_ID_249545,,李蔡,李广,当初 ， 李广 的 堂弟 李蔡 和 李广一 起 侍奉 文帝 。,当初  人物二 堂弟 人物一 人物二一 侍奉 文帝,-1
TRAIN_SENT_ID_277525,,王皇后,王守一,初封 清阳 公主 ， 嫁给 了 唐玄宗 王皇后 的 哥哥 王守一 。,初封 清阳 公主  嫁给 唐玄宗 人物一 哥哥 人物二,-1
TRAIN_SENT_ID_275228,,李梅儿,上官兰心,封 上官兰心 为 静贤妃 ， 封 金碧瑶 为 英德 妃 ， 李梅儿 为 李选侍 。,封 人物二 静贤妃  封 金碧瑶 英德 妃  人物一 李选侍,-1
TRAIN_SENT_ID_255468,,罗成,秦琼,第三十九回 秦琼 三锏 倒 铜旗 罗成 枪 挑孽 世雄,第三十九回 人物二 三锏 倒 铜旗 人物一 枪 挑孽 世雄,1
TRAIN_SENT_ID_253032,,颜回,孔子,"孔子 有 之 , 不必 束 攸 ， 颜回 逢 之 何用 箪瓢 , 於 陵元尔 三日 不食 , 首阳元尔 饿食 菜苗 。",人物二  不必 束 攸  人物一 逢 何用 箪瓢  於 陵元尔 三日 不食  首阳元尔 饿食 菜苗,1
TRAIN_SENT_ID_282801,,李翊,李威,李翊 ： 李翊 是 李威 的 堂弟 ， 曾经 和 蔡依林 传 过 绯闻 。,人物一  人物一 人物二 堂弟  曾经 蔡依林 传 绯闻,-1
TRAIN_SENT_ID_252936,,颜回,孔子,颜回 视 孔子 如父 ， 这 是 他 的 仁德 呵 。,人物一 视 人物二 如父  仁德,-1
TRAIN_SENT_ID_269428,,刘伟,马季,表演 ： 马季 刘伟,表演  人物二 人物一,1
TRAIN_SENT_ID_273626,,马阔海,马青山,召唤 人 ： 马阔海 （ 主要 ） 、 小 李子 、 马青山 、 柯胜 （ 电影版 ）,召唤  人物一  主要   李子  人物二  柯胜  电影版,1
TRAIN_SENT_ID_285187,,韩小莹,韩宝驹,师父 ： 江南七怪 （ 柯镇恶 、 朱聪 、 韩宝驹 、 南希仁 、 张阿生 、 全金发 、 韩小莹 ） 、 洪七公 、 哲别,师父  江南七怪  柯镇恶  朱聪  人物二  南希仁  张阿生  全金发  人物一   洪七公  哲别,1
TRAIN_SENT_ID_252940,,颜回,孔子,《 孔子 泣 颜回 》 是 宋代 诗人 曹勋 创作 的 诗词 作品 。,人物二 泣 人物一  宋代 诗人 曹勋 创作 诗词 作品,1
TRAIN_SENT_ID_261163,,王缙,王维,又 王缙 《 进王 右 丞 集表 》 云 编次 王维 诗 文凡 10 卷 。,人物一  进王 右 丞 集表  云 编次 人物二 诗 文凡  卷,1
TRAIN_SENT_ID_282999,,卢宗道,卢怀道,卢宗道 ， 卢怀道 之弟 ， 范阳 涿人 也 。,人物一  人物二 之弟  范阳 涿人,-1
TRAIN_SENT_ID_265558,,张崇基,张崇德,《 齐来 唱 新歌 》 - 张崇基 、 张崇德 儿歌 金曲 颁奖典礼 1994 年度 : 《 Hasayakee 》 - 陈奕,齐来 唱 新歌   人物一  人物二 儿歌 金曲 颁奖典礼  年度      陈奕,1
TRAIN_SENT_ID_285215,,陈斌,刘欢,在 刘欢 战队 导师 考核 中 ， 陈斌 与 徐海星 合作 演唱 了 一首 《 美女 与 野兽 》 （ 《 爱在蔓延中 》 ） ， 被 徐海星 击败 ， 止步 于 此 。,人物二 战队 导师 考核 中  人物一 徐海星 合作 演唱 一首  美女 野兽    爱在蔓延中    徐海星 击败  止步,1
TRAIN_SENT_ID_259795,,李偲菘,李伟菘,夜光 航线 美丽 的 推荐 曲 : 【 夜光 航线 】 词 ： 易家扬 曲 ： 李偲菘 / 李伟菘,夜光 航线 美丽 推荐 曲   夜光 航线  词  易家扬 曲  人物一  人物二,1
TRAIN_SENT_ID_276220,,姜丽文,姜文杰,姜丽文 姜文杰 秦沛,人物一 人物二 秦沛,-1
TRAIN_SENT_ID_261159,,王缙,王维,贵族 官僚 们 也 多 信佛教 ， 元载 、 杜鸿 渐 、 王维 、 王缙 等 ， 是 其 尤 著者 。,贵族 官僚 信佛教  元载  杜鸿 渐  人物二  人物一  尤 著者,-1
TRAIN_SENT_ID_259653,,公孙胜,罗真人,此后 公孙胜 以 罗真人 所教 “ 五雷 天罡 正法 ” ， 破 了 高廉 的 妖术 。,此后 人物一 人物二 所教  五雷 天罡 正法   破 高廉 妖术,1
TRAIN_SENT_ID_252594,,颜回,孔子,孔子 不 主张 厚葬 颜回 ， 正是 为了 循礼 ， 为了 爱护 颜回 。,人物二 主张 厚葬 人物一  循礼  爱护 人物一,-1
TRAIN_SENT_ID_253043,,颜回,孔子,孔子 谓 颜回 曰 ： 「 回 ， 来 ！,人物二 谓 人物一 曰   回,1
TRAIN_SENT_ID_269783,,池田菜沙,池田华菜,咲日 和 （ 池田华菜 、 池田绯菜 、 池田城菜 、 池田菜沙 ） 游戏 : D → A ： WHITE （ ク ー ）,咲日  人物二  池田绯菜  池田城菜  人物一  游戏   →     ク ー,-1
TRAIN_SENT_ID_253082,,颜回,孔子,颜回 以 德行 著称 ， 孔子 称赞 他 “ 贤哉 回 也 ” ， “ 回 也 ， 其心 三月 不 违反 仁 。 ”,人物一 德行 著称  人物二 称赞  贤哉 回    回  其心 三月 违反 仁,1
TRAIN_SENT_ID_253048,,颜回,孔子,这里 除 孔子 之外 还 安放 了 孔子 的 四位 高徒 （ 颜子 - 颜回 、 曾子 、 思子 - 子思 、 孟子 ） 的 塑像 加以 祭祀 。,人物二 之外 安放 人物二 四位 高徒  颜子  人物一  曾子  思子  子思  孟子  塑像 祭祀,1
TRAIN_SENT_ID_251553,,楚碧痕,楚寒镜,楚碧痕 ： 长久 居于 月 之 幽境 的 梭罗树 仙 ， 和 姐姐 楚寒镜 出于 同一 精魂 。,人物一  长久 居于 月 幽境 梭罗树 仙  姐姐 人物二 同一 精魂,-1
TRAIN_SENT_ID_282664,,张震,张翰,《 天津 妞 ： 张翰 讲 张震 的 鬼故事 》 司文痞子 第 159 部 编导 ： 司文痞子 配音 ： 理树,天津 妞  人物二 讲 人物一 鬼故事  司文痞子  部 编导  司文痞子 配音  理树,1
TRAIN_SENT_ID_257457,,姜昆,马季,因为 侯宝林 是 马季 的 师父 ， 马季 是 姜昆 的 师父 ， 而 姜昆 又 是 倪明 的 师父 。,侯宝林 人物二 师父  人物二 人物一 师父  人物一 倪明 师父,1
TRAIN_SENT_ID_282231,,王辰,王岩,王辰 王岩 进入 洞府 ， 其他人 去 领悟 各自 机缘 。,人物一 人物二 进入 洞府  其他人 领悟 机缘,1
TRAIN_SENT_ID_271529,,孟优,孟获,清代 《 云南 通志 》 等 地方志 记载 说 ， 孟优 为 巍山 人 ， 土帅 孟获 的 哥哥 ， 精 医学 ， 有 神术 ， 常 来往 于 澜沧 、 泸水 之间 ， 传教 施药 。,清代  云南 通志  地方志 记载 说  人物一 巍山  土帅 人物二 哥哥  精 医学  神术  常 来往 澜沧  泸水 之间  传教 施药,1
TRAIN_SENT_ID_264373,,曾国潢,曾国藩,曾国藩 同治 十年 三月初 三日 写给 曾国潢 、 曾国荃 的 家书,人物二 同治 十年 三月初 三日 写给 人物一  曾国荃 家书,-1
TRAIN_SENT_ID_252378,,颜回,孔子,本章 中 ， 孔子 又 一次 称赞 颜回 ， 对 他 作 了 高度评价 。,本章 中  人物二 一次 称赞 人物一  作 高度评价,1
TRAIN_SENT_ID_253010,,颜回,孔子,殿内 正位 原有 孔子 塑像 ， 东西 两边 分列 颜回 、 子思 、 曾 参 、 孟轲 “ 四配 ” 塑像 ， 其旁 又 各 有 六 像 ， 即 十二 哲 。,殿内 正位 原有 人物二 塑像  东西 两边 分列 人物一  子思  参  孟轲  四配  塑像  其旁 六  十二 哲,1
TRAIN_SENT_ID_272015,,文姜,宣姜,《 东周列国志 》 ： “ 齐僖公 二女 ， 长 宣姜 ， 次 文姜 ， 宣姜 淫于 舅 ， 文姜 淫于 兄 ， 人伦 天理 ， 至此 灭绝 矣 ！,东周列国志    齐僖公 二女  长 人物二  次 人物一  人物二 淫于 舅  人物一 淫于 兄  人伦 天理  至此 灭绝,-1
TRAIN_SENT_ID_252978,,颜回,孔子,另外 ， 他 从前 与 平民 祢衡 在 一起 行为 放荡 ， 互相标榜 ， 祢衡 称赞 孔融 为 ‘ 孔子 不死 ’ ， 孔融 称赞 祢衡 是 ‘ 颜回 复生 ’ 。,从前 平民 祢衡 一起 行为 放荡  互相标榜  祢衡 称赞 孔融  人物二 不死   孔融 称赞 祢衡  人物一 复生,1
TRAIN_SENT_ID_261144,,武元庆,武则天,但 武元庆 、 武元爽 对 杨氏 不孝 ， 所以 ， 武则天 取 韩国夫人 之子 贺兰敏之 “ 为士 获 获后 ， 赐氏武 ， 袭封 。,人物一  武元爽 杨氏 不孝   人物二 取 韩国夫人 之子 贺兰敏之  为士 获 获后  赐氏武  袭封,-1
TRAIN_SENT_ID_252695,,颜回,孔子,三国 魏 正始 （ 齐王 曹芳 年号 ， 公元 240 — 248 年 ） 以后 ， 规定 入学 行 祭礼 ， 以 孔子 为 先圣 ， 配 颜回 为 先师 。,三国 魏 正始  齐王 曹芳 年号  公元    年  以后  规定 入学 行 祭礼  人物二 先圣  配 人物一 先师,-1
TRAIN_SENT_ID_259380,,葛玄,左慈,」 可见 ， 左慈 、 葛玄 、 郑隐 、 葛洪 、 葛巢甫 等 人 ， 并非 「 共同 实践 特定 仙术 」 。,人物二  人物一  郑隐  葛洪  葛巢甫   共同 实践 特定 仙术,1
TRAIN_SENT_ID_253138,,颜回,孔子,三楼 大成殿 ， 主奉 至圣 孔子 ， 复圣 颜回 、 宗圣曾子 、 述 圣子 思 、 亚圣孟子 ， 旁祀 魁星 爷 、 文昌帝君 及 七十二 先贤 、 先儒 。,三楼 大成殿  主奉 至圣 人物二  复圣 人物一  宗圣曾子  述 圣子 思  亚圣孟子  旁祀 魁星 爷  文昌帝君 七十二 先贤  先儒,1
TRAIN_SENT_ID_252731,,颜回,孔子,和 圣 柳下惠 柳下惠 人物 简介 : 孔子 为 至圣 ， 孟子为 亚圣 ， 颜回 为 复圣 ， 曾 参为 宗圣 ， 和 圣为 柳下惠,圣 柳下惠 柳下惠 人物 简介  人物二 至圣  孟子为 亚圣  人物一 复圣  参为 宗圣  圣为 柳下惠,1
TRAIN_SENT_ID_252475,,颜回,孔子,为 我 增加 了 荣誉 ， 提高 了 社会 地位 ， 都 是 由于 您 的 奖掖 扶助 ， 就 像 孔子 自称 不如 颜回 、 李生 赞叹 贾复 一样 。,增加 荣誉  提高 社会 地位  奖掖 扶助  人物二 自称 人物一  李生 赞叹 贾复,1
TRAIN_SENT_ID_274621,,常赫志,常伯志,《 飞狐 外传 》 中有 双生 兄弟 三对 ： 倪不大 、 倪不小 ， 常赫志 、 常伯志 ， 马春花 和 福康安 所生 的 一对 双生子 。,飞狐 外传  中有 双生 兄弟 三对  倪不大  倪不小  人物一  人物二  马春花 福康安 所生 一对 双生子,-1
TRAIN_SENT_ID_283924,,罗人杰,余沧海,代表 人物 ： 长青子 ， 余沧海 ， 侯人英 、 洪人雄 、 于人豪 、 罗人杰 （ ” 英雄豪杰 ， 青城 四秀 “ ） ， 贾人达 ， 方人智,代表 人物  长青子  人物二  侯人英  洪人雄  于人豪  人物一   英雄豪杰  青城 四秀    贾人达  方人智,1
TRAIN_SENT_ID_253168,,胡青牛,胡青羊,他 得 胡青牛 救治 性命 后 ， 和 胡青牛 之妹 胡青羊 相恋 。,人物一 救治 性命  人物一 之妹 人物二 相恋,-1
TRAIN_SENT_ID_261570,,南宫敬叔,孟懿子,其 声望 远播 于 各 诸侯国 ， 其 弟子 子路 、 孟懿子 、 南宫敬叔 等 在 鲁国 已 小有名气 。,声望 远播 诸侯国  弟子 子路  人物二  人物一 鲁国 小有名气,1
TRAIN_SENT_ID_252809,,颜回,孔子,从此 颜回 结束 了 跟随 孔子 长 达 十四年 的 列国 周游 。,人物一 结束 跟随 人物二 长 达 十四年 列国 周游,-1
TRAIN_SENT_ID_281966,,梁经纶,何其沧,燕大 进步 女 学生 谢木兰 、 经济系 教授 梁经纶 、 燕京大学 副校长 何其沧 之女 何孝钰 亦 在 其中 。,燕大 进步 女 学生 谢木兰  经济系 教授 人物一  燕京大学 副校长 人物二 之女 何孝钰,-1
TRAIN_SENT_ID_249093,,吕洞宾,韩湘子,韩湘子 吹玉 萧 ， 吕洞宾 击 云板 ( 简板 ) ， 钟离权 拍 渔鼓 应节 而歌 。,人物二 吹玉 萧  人物一 击 云板  简板   钟离权 拍 渔鼓 应节 而歌,1
TRAIN_SENT_ID_252987,,颜回,孔子,这里 ， 孔子 极为 称赞 他 的 得意门生 颜回 ， 认为 他 好学上进 ， 自 颜回 死后 ， 已经 没有 如此 好学 的 人 了 。,人物二 极为 称赞 得意门生 人物一  认为 好学上进  人物一 死后  已经 没有 好学,1
TRAIN_SENT_ID_278013,,干光豪,左子穆,沈师伯 ， 干光豪 提及 ， 当为 左子穆 师兄 无量 派西宗 : 掌门 ： 辛双清,沈师伯  人物一 提及  当为 人物二 师兄 无量 派西宗  掌门  辛双清,1
TRAIN_SENT_ID_263927,,汤镇宗,汤镇业,父亲 经营 海味 铺 为生 ， 共有 八 兄弟姐妹 ， 汤镇宗 排 第四 ， 其弟 汤镇业 排 第五 。,父亲 经营 海味 铺 为生  共有 八 兄弟姐妹  人物一 排 第四  其弟 人物二 排 第五,-1
TRAIN_SENT_ID_273697,,姜子牙,元始天尊,姜子牙 在 昆仑 洞奉 师父 元始天尊 之命 下山 ， 伺机 出侍 文王 ， 乃设 一 算命 馆 。,人物一 昆仑 洞奉 师父 人物二 之命 下山  伺机 出侍 文王  乃设 算命 馆,1
TRAIN_SENT_ID_261428,,毛泽建,毛泽东,1924 年 以 优异 的 成绩 考入 湖南省 立 第三 女子 师范学校 ， 同 毛泽东 堂妹 毛泽建 同班 读书 ， 结为 挚友 。,年 优异 成绩 考入 湖南省 立 第三 女子 师范学校  人物二 堂妹 人物一 同班 读书  结为 挚友,-1
TRAIN_SENT_ID_273683,,姜子牙,元始天尊,《 封神榜 》 亦 载 ： 姜子牙 奉 元始天尊 之命 封之为 “ 上 清正 一 龙虎 玄坛 真君 ” 。,封神榜  载  人物一 奉 人物二 之命 封之为  清正 龙虎 玄坛 真君,-1
TRAIN_SENT_ID_282622,,茅于杭,茅于轼,茅以新 家庭成员 : 茅以新 共育 有 四个 子女 ， 分别 为 茅于海 ， 茅于杭 ， 茅于轼 ， 茅 于兰 。,茅以新 家庭成员  茅以新 共育 四个 子女  茅于海  人物一  人物二  茅 于兰,-1
TRAIN_SENT_ID_252386,,颜回,孔子,贞观 二年 ( 628 年 ) ， 停 祭 周公 ， 专立 孔庙 ， 以 孔子 为 先圣 ， 颜回 为 先师 。,贞观 二年   年   停 祭 周公  专立 孔庙  人物二 先圣  人物一 先师,-1
TRAIN_SENT_ID_266864,,尤二姐,尤氏,尤二姐 人物 简介 : 新版 红楼梦 尤二姐 尤二姐 ， 贾珍 妻 尤氏 的 异母 妹 ， 是 尤老娘 前夫 所 生 ， 后 尤老娘 改嫁 尤家时 随来 。,人物一 人物 简介  新版 红楼梦 人物一 人物一  贾珍 妻 人物二 异母 妹  尤老娘 前夫 生  尤老娘 改嫁 尤家时 随来,-1
TRAIN_SENT_ID_252981,,颜回,孔子,汉魏 以后 ， 以 周公为 先圣 ， 孔子 为 先师 ; 唐代 尊 孔子 为 先圣 ， 颜回 为 先师 。,汉魏 以后  周公为 先圣  人物二 先师  唐代 尊 人物二 先圣  人物一 先师,1
TRAIN_SENT_ID_251521,,陈辅,陈靖仇,陈靖仇 是 南朝 陈国 皇族 唯一 血脉 ， 也 是 鬼 谷道 门主 陈辅 的 徒弟 ， 但 却是 百年 一见 的 超级 练武 庸材 。,人物二 南朝 陈国 皇族 唯一 血脉  鬼 谷道 门主 人物一 徒弟  却是 百年 一见 超级 练武 庸材,1
TRAIN_SENT_ID_252398,,颜回,孔子,卜子 熟知 并 记录 了 孔子 闲居 期间 的 言论 话语 ， 其 学问 比 颜回 、 端木赐 都 较 早 达到 了 精深 的 阶段 。,卜子 熟知 记录 人物二 闲居 期间 言论 话语  学问 人物一  端木赐 早 达到 精深 阶段,1
TRAIN_SENT_ID_252956,,颜回,孔子,"其 主要 内容 是 对 孔子 、 孟子 、 颜回 、 曾 参 、 孔 （ 左边 是 单人旁 右边 是 "" 及 "" ） 的 赞语 。",主要 内容 人物二  孟子  人物一  参  孔  左边 单人旁 右边    赞语,1
TRAIN_SENT_ID_271526,,孟优,孟获,毒气 泉 历史 研究 : 毒气 泉 原著 场景 : 诸葛亮 四擒四放 孟获 后 ， 毒气 泉 孟获 与其 弟 孟优 逃 到 西洱河 畔 的 秃 龙洞 。,毒气 泉 历史 研究  毒气 泉 原著 场景  诸葛亮 四擒四放 人物二  毒气 泉 人物二 弟 人物一 逃 西洱河 畔 秃 龙洞,1
TRAIN_SENT_ID_274071,,南宫敬叔,孔子,鲁昭公 二十四年 （ 公元前 518 年 ） ， 孟懿子 和 南宫敬叔 学礼于 孔子 。,鲁昭公 二十四年  公元前  年   孟懿子 人物一 学礼于 人物二,-1
TRAIN_SENT_ID_249533,,李蔡,李广,汉朝 时 ， 陇西 李氏 出 了 两位 重要 人物 ： 飞将军 李广 及其 从弟 李蔡 。,汉朝 时  陇西 李氏 出 两位 重要 人物  飞将军 人物二 从弟 人物一,1
TRAIN_SENT_ID_275893,,王子豪,王子杰,主演 ： 廖蔚蔚 、 王子杰 、 王子豪 、 李乐儿 、 卢星宇 、 高宝宝 、 王建新,主演  廖蔚蔚  人物二  人物一  李乐儿  卢星宇  高宝宝  王建新,1
TRAIN_SENT_ID_255412,,罗成,秦琼,只有 在 罗成 面前 ， 秦琼 不再 是 伪 ， 而是 轻轻松松 的 真 。,人物一 面前  人物二 不再 伪  轻轻松松 真,1
TRAIN_SENT_ID_256534,,周武,周文,周文 子 （ 周氏 周武 子 的 哥哥 ， 周柒柒 的 大伯 。,人物二 子  周氏 人物一 子 哥哥  周柒柒 大伯,-1
TRAIN_SENT_ID_278133,,裴元,孙思邈,医术 ： 略逊 于 裴元 ， 属于 孙思邈 徒辈中 排行 第二 的 神医,医术  略逊 人物一  属于 人物二 徒辈中 排行 第二 神医,-1
TRAIN_SENT_ID_264938,,贾元春,贾宝玉,异母兄弟 姐妹 ： 贾珠 、 贾元春 、 贾宝玉,异母兄弟 姐妹  贾珠  人物一  人物二,-1
TRAIN_SENT_ID_283878,,崔光伯,崔光韶,崔光伯 ， 崔光韶 弟 ， 清河 东武城 人 也 。,人物一  人物二 弟  清河 东武城,-1
TRAIN_SENT_ID_273680,,姜子牙,元始天尊,1 简介 : 元始天尊 命 姜子牙 在 岐山 修建 ， 上 张挂 封神榜 。,简介  人物二 命 人物一 岐山 修建  张挂 封神榜,1
TRAIN_SENT_ID_276937,,樊迟,孔子,孔子 力倡 爱人 ： 樊迟 问 “ 仁 ” ， 孔子 回答 “ 爱人 ” （ 《 论语 · 颜渊 》 ） 。,人物二 力倡 爱人  人物一 问  仁   人物二 回答  爱人    论语  颜渊,1
TRAIN_SENT_ID_251407,,李瀚章,李鸿章,光绪 五年 （ 1879 ） ， 也 就是 曾国藩 死后 7 年 ， 传忠 书局 刻印 了 由 李瀚章 、 李鸿章 编校 的 《 曾文正公 家书 》 。,光绪 五年     曾国藩 死后  年  传忠 书局 刻印 人物一  人物二 编校  曾文正公 家书,-1
TRAIN_SENT_ID_259379,,葛玄,左慈,葛玄 ： 丹阳 郡 （ 今属 江苏省 句容 ） 人 ， 三国 吴 道士 ， 曾 从 左慈 学 道 ， 并入 深山 修道 。,人物一  丹阳 郡  今属 江苏省 句容   三国 吴 道士  人物二 学 道  并入 深山 修道,1
TRAIN_SENT_ID_252411,,颜回,孔子,颜子 身讽 作品 注释 : （ 1 ） 颜子 ： 孔子 弟子 颜回 ， 春秋 时鲁国 人 ， 字子渊 。,颜子 身讽 作品 注释     颜子  人物二 弟子 人物一  春秋 时鲁国  字子渊,1
TRAIN_SENT_ID_249017,,吕洞宾,韩湘子,3 . 蓬莱 八仙 ： 张果老 、 汉 钟离 、 吕洞宾 、 蓝采和 、 韩湘子 、 何仙姑 、 曹国舅 、 铁拐李 。,蓬莱 八仙  张果老  汉 钟离  人物一  蓝采和  人物二  何仙姑  曹国舅  铁拐李,1
