sent_id,sent_id,entity1,entity2,sent,processed_sent,human
TRAIN_SENT_ID_261329,,罗松,罗成,1 人物 简介 : 隋唐 时期 罗艺 之孙 （ 祖母 姜桂芝 ） ， 罗松 之子 ， 罗成 的 侄子 。,人物 简介  隋唐 时期 罗艺 之孙  祖母 姜桂芝   人物一 之子  人物二 侄子,-1
TRAIN_SENT_ID_282414,,赵公明,通天教主,通天教主 在 碧游宫 分宝时 ， 将定 海珠 与 缚 龙索 赐给 了 赵公明 。,人物二 碧游宫 分宝时  将定 海珠 缚 龙索 赐给 人物一,1
TRAIN_SENT_ID_264224,,陈真,霍元甲,有 传说 霍元甲 被 日本 人下 毒药 害死 之后 ， 他 的 爱徒 陈真 替 他 报仇 。,传说 人物二 日本 人下 毒药 害死 之后  爱徒 人物一 报仇,1
TRAIN_SENT_ID_264542,,岳云鹏,郭德纲,郭德纲 ― ― 何云伟 、 曹云 金 、 岳云鹏 、 孔云龙 、 朱云峰 、 栾云平 、 李云杰 、 刘云天,人物二 ― ― 何云伟  曹云 金  人物一  孔云龙  朱云峰  栾云平  李云杰  刘云天,1
TRAIN_SENT_ID_249546,,李蔡,李广,李妍 觉得 李敢 是 一步 好棋 ， 因为 “ 李氏家族 从 汉高祖 时代 就是 朝廷 重臣 ， 早有 名将 广武君 李左车 ， 今有 安乐 侯 李蔡 和 飞将军 李广 ” 。,李妍 觉得 李敢 一步 好棋   李氏家族 汉高祖 时代 朝廷 重臣  早有 名将 广武君 李左车  今有 安乐 侯 人物一 飞将军 人物二,-1
TRAIN_SENT_ID_258141,,刘星,夏雪,夏雪 的 两个 “ 追星族 ” 吴江 和 张洋 都 想 讨好 夏雪 ， 他们 分别 向 刘星 和 夏雨 打听 夏雪 的 爱好 ， 想讨 她 的 欢心 。,人物二 两个  追星族  吴江 张洋 想 讨好 人物二  人物一 夏雨 打听 人物二 爱好  想讨 欢心,-1
TRAIN_SENT_ID_251429,,李瀚章,李鸿章,"清人 李鸿章 在 给 他 哥哥 李瀚章 的 家书 中说 "" 体气 多病 得名 人 文集 静心 读 之 亦 足以 养病 。 """,清人 人物二 哥哥 人物一 家书 中说  体气 多病 得名 文集 静心 读 足以 养病,-1
TRAIN_SENT_ID_276858,,薄智云,林超岱,林超岱 履历 : 林超岱 教授 ， 出身 中医 世家 ， 同时 又 是 腹针 疗法 的 第一 传承 人 ， 薄智云 教授 亲传大 弟子 。,人物二 履历  人物二 教授  出身 中医 世家  腹针 疗法 第一 传承  人物一 教授 亲传大 弟子,1
TRAIN_SENT_ID_266058,,张学思,张学良,"张学铭 ( 左 ) 和 张学良 ( 中 ) , 张学思 ( 右 )",张学铭  左  人物二  中   人物一  右,-1
TRAIN_SENT_ID_265496,,薛蝌,薛蟠,【 薛蝌 】 薛蟠 的 堂弟 ， 仪容 俊美 ， 秉性 忠厚 。,人物一  人物二 堂弟  仪容 俊美  秉性 忠厚,-1
TRAIN_SENT_ID_270570,,全真七子,王重阳,丘处机 生于 1148 年 ， 山东人 ， 自号 “ 长春 子 ” ， 曾 拜 全真教 创始人 王重阳 为师 ， 是 著名 的 “ 全真七子 ” 之一 。,丘处机 生于  年  山东人  自号  长春 子   拜 全真教 创始人 人物二 为师  著名  人物一,1
TRAIN_SENT_ID_266004,,王恬,王洽,他 出身 于 书法 世家 ， 伯父 王翼 、 王导 ， 堂兄弟 王恬 、 王洽 等 都 是 当时 的 书法 名手 。,出身 书法 世家  伯父 王翼  王导  堂兄弟 人物一  人物二 当时 书法 名手,-1
TRAIN_SENT_ID_270825,,伍天锡,伍云召,伍云召 和 伍天锡 都 死 在 扬州 玉玺 会上 ， 留下 独生子 伍登 过继 给 朱灿 。,人物二 人物一 死 扬州 玉玺 会上  留下 独生子 伍登 过继 朱灿,-1
TRAIN_SENT_ID_264555,,胡青牛,张无忌,张无忌 悟性 : 胡青牛 见 他 悟性 奇高 … …,人物二 悟性  人物一 见 悟性 奇高,1
TRAIN_SENT_ID_277289,,杨贯一,林永春,创业 经历 : 富东 粤菜 老板 林永春 ， 是 国际 名厨 杨贯一 的 入室弟子 。,创业 经历  富东 粤菜 老板 人物二  国际 名厨 人物一 入室弟子,1
TRAIN_SENT_ID_264530,,岳云鹏,郭德纲,2 ： 《 返场 》 郭德纲 于谦 岳云鹏,返场  人物二 于谦 人物一,1
TRAIN_SENT_ID_264276,,陈真,霍元甲,但 就 在 此时 ， 闻 霍元甲 病逝 ， 陈真 回国 ， 学业 半途而废 。,闻 人物二 病逝  人物一 回国  学业 半途而废,1
TRAIN_SENT_ID_252874,,颜回,孔子,﹝ 孔子 ﹞ 召 颜回 曰 : ' 畴昔 予 梦见 先人 ﹐ 岂 或 启佑 我 哉 !,﹝ 人物二 ﹞ 召 人物一 曰   畴昔 予 梦见 先人 ﹐ 岂 启佑,1
TRAIN_SENT_ID_251873,,曹薰铉,李昌镐,半决赛 ： 李昌镐 2 : 0 赵治勋 马晓春 2 : 1 曹薰铉,半决赛  人物二    赵治勋 马晓春    人物一,1
TRAIN_SENT_ID_268970,,韩非,荀子,第四章 荀子 和 韩非 的 逻辑 思想,第四章 人物二 人物一 逻辑 思想,1
TRAIN_SENT_ID_255430,,罗成,秦琼,此外 ， 李世民 、 秦琼 、 程咬金 、 窦建德 、 罗成 、 袁 紫烟 等 形象 ， 塑造 得 也 无不 有声有色 、 各具 风采 。,李世民  人物二  程咬金  窦建德  人物一  袁 紫烟 形象  塑造 无不 有声有色  各具 风采,-1
TRAIN_SENT_ID_283764,,陈寅衷,陈赤衷,《 鄞县 志 · 陈赤衷 》 载 ： 陈寅衷 “ 亦 复 佩服 六经 ， 质有 其文 ， 溯 蕺 山之学脉 ， 仰 证人 之 成规 ” 。,鄞县 志  人物二  载  人物一  复 佩服 六经  质有 其文  溯 蕺 山之学脉  仰 证人 成规,-1
TRAIN_SENT_ID_260942,,杨露禅,陈长兴,陈氏 十四 世 陈长兴 ， 广开 传拳 之门 ， 河北 永年 人 杨露禅 即 是 其 著名 高徒 。,陈氏 十四 世 人物二  广开 传拳 之门  河北 永年 人物一 著名 高徒,1
TRAIN_SENT_ID_274077,,南宫敬叔,孔子,① 丁寅 生 《 孔子 演义 》 第 18 回 ： “ 南宫敬叔 和 夫子 最 契合 ， 请 他 先容 ， 最为 合宜 ， 打定主意 ， 便 一径 往 访敬叔 。 ”,① 丁寅 生  人物二 演义   回   人物一 夫子 契合  请 先容  最为 合宜  打定主意  便 一径 访敬叔,1
TRAIN_SENT_ID_250108,,武敦儒,武修文,武敦儒 、 武修文 与 杨过相 比 ， 只能 比 出 杨过 出类拔萃 、 超群绝伦 。,人物一  人物二 杨过相  只能 出 杨过 出类拔萃  超群绝伦,-1
TRAIN_SENT_ID_267584,,骆赢,骆羽,女双 ： 骆赢 / 骆羽 邓羽婷 / 包宜鑫,女双  人物一  人物二 邓羽婷  包宜鑫,-1
TRAIN_SENT_ID_274101,,南宫敬叔,孔子,（ 《 论语 · 八 佾 》 ） （ 此时 南宫敬叔 仅 十二岁 ， 似 不 可能 随同 孔子 适周 。,论语  八 佾    人物一 仅 十二岁  似 可能 随同 人物二 适周,1
TRAIN_SENT_ID_250402,,赵飞燕,赵合德,（ 西汉 美女 赵飞燕 、 赵合德 的 合称 ） : 二赵 ， 典故 名 ， 典出 《 汉书 》 卷 九十七 下 〈 外戚 列传 下 · 孝成 赵 皇后 〉 。,西汉 美女 人物一  人物二 合称   二赵  典故 名  典出  汉书  卷 九十七  外戚 列传  孝成 赵 皇后,-1
TRAIN_SENT_ID_279601,,司空星儿,苏蓉蓉,谁知 事后 ， 司空摘星 和 司空星儿 却 被 “ 天下第一 剑 ” 薛衣人 抓获 ， 薛衣人 胁迫 司空星儿 的 义妹 苏蓉蓉 一定 将 琥珀 观音 取回 。,事后  司空摘星 人物一  天下第一 剑  薛衣人 抓获  薛衣人 胁迫 人物一 义妹 人物二 一定 琥珀 观音 取回,-1
TRAIN_SENT_ID_255458,,罗成,秦琼,秦琼 的 好 ， 罗成 最 明白 。,人物二  人物一 明白,-1
TRAIN_SENT_ID_262599,,蔡五熊,蔡云寒,"《 终极 一班 》 中 蔡云寒 ( 蔡函 岑饰 ) 和 蔡五熊 ( 蔡宜臻饰 ) 姐妹 , 扮演者 也 是 姐妹 .",终极 一班  中 人物二  蔡函 岑饰  人物一  蔡宜臻饰  姐妹  扮演者 姐妹,-1
TRAIN_SENT_ID_259940,,周志文,周志康,刘威 煌 、 陈鸿硕 、 周志文 、 周志康,刘威 煌  陈鸿硕  人物一  人物二,-1
TRAIN_SENT_ID_250655,,鲁西西,皮皮鲁,为 上海 美术电影 厂 、 中央电视台 设计 动画片 《 老鼠 嫁女 》 ， 《 金元国 历险记 》 ， 《 皮皮鲁 和 鲁西西 》 的 人物造型 。,上海 美术电影 厂  中央电视台 设计 动画片  老鼠 嫁女    金元国 历险记    人物二 人物一  人物造型,-1
TRAIN_SENT_ID_257029,,洪敬尧,洪荣宏,」 而 洪一峰 刻意 栽培 长子 洪荣宏 ， 但 相较 之下 ， 次子 洪敬尧 有如 坐在 翘翘板 的 彼端 ， 从 名字 可以 看出 一些 端倪 。,洪一峰 刻意 栽培 长子 人物二  相较 之下  次子 人物一 有如 坐在 翘翘板 彼端  名字 看出 端倪,-1
TRAIN_SENT_ID_258156,,刘星,夏雪,林凡 后来 通过 刘星 来到 了 夏家 ， 通过 与 夏雪 的 直接 沟通 ， 林凡 认为 夏雪 不可理喻 ， 与 夏雪 一刀两断 ， 生气 离去 。,林凡 后来 人物一 来到 夏家  人物二 直接 沟通  林凡 认为 人物二 不可理喻  人物二 一刀两断  生气 离去,-1
TRAIN_SENT_ID_249312,,陆无双,程英,为 程英 陆无双 点 首歌,人物二 人物一 点 首歌,-1
TRAIN_SENT_ID_260729,,薛丁山,薛金莲,薛金莲 影视作品 : 《 薛丁山 征西 》 杨盼盼 饰,人物二 影视作品   人物一 征西  杨盼盼 饰,-1
TRAIN_SENT_ID_251593,,穆春,穆弘,穆春 是 《 水浒传 》 中 的 人物 ， 绰号 小 遮拦 ， 江州 人氏 ， 原 是 揭阳 镇 富户 ， 与 哥哥 穆弘 同 为 当地 一霸 。,人物一  水浒传  中 人物  绰号 遮拦  江州 人氏  原 揭阳 镇 富户  哥哥 人物二 一霸,-1
TRAIN_SENT_ID_256481,,周武,周文,周文 王和 周武 王 立誓 要 灭掉 商朝 ， 是 基于 政治 发展 与 私人 仇恨 所 产生 的 态度 ， 丑化 妲 己 只是 一种 政治 手段 。,人物二 王和 人物一 王 立誓 灭掉 商朝  政治 发展 私人 仇恨 产生 态度  丑化 妲 一种 政治 手段,-1
TRAIN_SENT_ID_271507,,孟优,孟获,却说 孟获 与 祝融 夫人 并 孟优 、 带来 洞主 、 一切 宗党 在 别 帐 饮酒 。,却说 人物二 祝融 夫人 人物一  带来 洞主  宗党 帐 饮酒,-1
TRAIN_SENT_ID_268832,,洪凌波,李莫愁,洪凌波 角色 设定 : 洪凌波 虽然 是 李莫愁 的 徒弟 ， 但 她 的 性格 心地 却 和 李莫愁 迥然不同 。,人物一 角色 设定  人物一 人物二 徒弟  性格 心地 人物二 迥然不同,1
TRAIN_SENT_ID_264523,,岳云鹏,郭德纲,扒 马褂 版本 三 : 郭德纲 、 李菁 、 于谦 版 扒 马褂 版本 四 : 郭德纲 、 于谦 、 岳云鹏 版,扒 马褂 版本 三  人物二  李菁  于谦 版 扒 马褂 版本 四  人物二  于谦  人物一 版,1
TRAIN_SENT_ID_262256,,尤二姐,尤三姐,当然 ， 尤三姐 与 逆来顺受 的 尤二姐 不同 。,人物二 逆来顺受 人物一 不同,-1
TRAIN_SENT_ID_264875,,田猛,田虎,烈山 堂堂 主 田猛 的 女儿 田言 也 是 因此 而 推断 她 定会 与 田虎 联手 。,烈山 堂堂 主 人物一 女儿 田言 推断 定会 人物二 联手,-1
TRAIN_SENT_ID_265577,,张崇基,张崇德,"叱咤 乐坛 生力军 组合 ： 金奖 ： 风 火海 银奖 ： GirlFriends 铜奖 ： 张崇基 , 张崇德",叱咤 乐坛 生力军 组合  金奖  风 火海 银奖   铜奖  人物一  人物二,-1
TRAIN_SENT_ID_281538,,于佑福,高德明,高德明 — — 于佑福 、 冯大荃 、 张松青,人物二   人物一  冯大荃  张松青,1
TRAIN_SENT_ID_253824,,赵合德,赵飞燕,他 与 蛇蝎美人 赵飞燕 、 赵合德 姐妹 的 故事 ， 几乎 家喻户晓 。,蛇蝎美人 人物二  人物一 姐妹 故事  几乎 家喻户晓,-1
TRAIN_SENT_ID_268930,,韩非,荀子,老子 孔子 墨子 孟子 庄子 荀子 韩非 王充 范缜 李贽 黄宗羲 顾炎武 王夫之,老子 孔子 墨子 孟子 庄子 人物二 人物一 王充 范缜 李贽 黄宗羲 顾炎武 王夫之,1
TRAIN_SENT_ID_270555,,黎绍峰,黎雪竹,后 被 黎绍峰 所救 ， 经过 黎雪竹 （ 黎绍峰 姐姐 ） 的 残酷 训练 将 她 一步 一步 的 打 造成 了 青萍 的 影子 ， 杜允唐 的 定制 情人 。,人物一 所救  人物二  人物一 姐姐  残酷 训练 一步 一步 造成 青萍 影子  杜允唐 定制 情人,-1
TRAIN_SENT_ID_277590,,袁世廉,袁世凯,他们 六 兄弟 中 ， 只有 袁世廉 与 袁世凯 关系 最好 ， 最受 袁世凯 敬重 与 关爱 。,六 兄弟 中  人物一 人物二 关系 最好  最受 人物二 敬重 关爱,-1
TRAIN_SENT_ID_274081,,南宫敬叔,孔子,’ ” 《 史记 · 孔子 世家 》 亦 载 ： “ 鲁 南宫敬叔 言 鲁君 曰 ： ‘ 请 与 孔子 适周 。,史记  人物二 世家  载   鲁 人物一 言 鲁君 曰   请 人物二 适周,1
TRAIN_SENT_ID_266218,,蓝提斯,谢加图,其 性格 沈默寡言 ， 相比 兄长 谢加图 的 稳重 ， 蓝提斯 显得 与世无争 。,性格 沈默寡言  相比 兄长 人物二 稳重  人物一 显得 与世无争,-1
TRAIN_SENT_ID_252755,,颜回,孔子,昔 孔子 叹 颜回 ， 以为 三月 不违 仁者 ， 盖观 其 心耳 。,昔 人物二 叹 人物一  三月 不违 仁者  盖观 心耳,1
TRAIN_SENT_ID_252532,,颜回,孔子,A ． 鲁迅 ： 周作人 B ． 孔子 ： 颜回,． 鲁迅  周作人  ． 人物二  人物一,1
TRAIN_SENT_ID_249557,,李蔡,李广,李蔡 生平事迹 比较简单 ， 《 史记 》 、 《 汉书 》 均 附记 于 其 堂兄 汉 将军 李广 的 传记 之中 ：,人物一 生平事迹 比较简单   史记    汉书  均 附记 堂兄 汉 将军 人物二 传记 之中,-1
TRAIN_SENT_ID_261154,,王缙,王维,同 王昌龄 裴迪 游 青龙寺 昙 壁上 人兄院 集 和 兄维 作者简介 : 王缙 （ 702 年 — 781 年 ） ， 字夏卿 ， 与 兄 王维 早 以 文翰 著名 。,王昌龄 裴迪 游 青龙寺 昙 壁上 人兄院 集 兄维 作者简介  人物一   年   年   字夏卿  兄 人物二 早 文翰 著名,-1
TRAIN_SENT_ID_251528,,陈辅,陈靖仇,陈辅 是 陈靖仇 的 师傅 。,人物一 人物二 师傅,1
TRAIN_SENT_ID_261166,,王缙,王维,唐代宗 曾誉 之 为 “ 天下 文宗 ” （ 《 答 王缙 进 王维 集表 诏 》 ） 。,唐代宗 曾誉  天下 文宗    答 人物一 进 人物二 集表 诏,-1
TRAIN_SENT_ID_284833,,金正中,马小玲,代表 传人 为 ： 马灵儿 、 马丹娜 、 马小玲 （ 由 万绮雯 饰演 ） 、 马叮当 、 金正中 。,代表 传人  马灵儿  马丹娜  人物二  万绮雯 饰演   马叮当  人物一,1
TRAIN_SENT_ID_269573,,水笙,汪啸风,水笙 ， 金庸 武侠小说 《 连城诀 》 的 女主角 之一 ， 与 表哥 汪啸风 合称 “ 铃剑 双侠 ” 。,人物一  金庸 武侠小说  连城诀  女主角  表哥 人物二 合称  铃剑 双侠,-1
TRAIN_SENT_ID_264942,,贾元春,贾宝玉,贾宝玉 、 林黛玉 、 薛宝钗 、 史湘云 、 王熙凤 、 贾元春 、 贾迎春 、 贾探春 、 贾惜春 、 妙玉 、 李纨 、 巧姐 、 秦可卿,人物二  林黛玉  薛宝钗  史湘云  王熙凤  人物一  贾迎春  贾探春  贾惜春  妙玉  李纨  巧姐  秦可卿,-1
TRAIN_SENT_ID_270821,,伍天锡,伍云召,6 、 双镗 无敌 伍天锡 ， 伍云召 族弟 ， 胯下 青龙 马 ， 掌中 一对 短 把 凤翅 镏金 镗 ， 英勇 无比 ；,双镗 无敌 人物一  人物二 族弟  胯下 青龙 马  掌中 一对 短 凤翅 镏金 镗  英勇 无比,-1
TRAIN_SENT_ID_272655,,邢德全,邢夫人,【 邢德全 】 邢夫人 的 胞弟 ， 只知 吃喝嫖赌 ， 不务正业 ， 呆气 十,人物一  人物二 胞弟  只知 吃喝嫖赌  不务正业  呆气 十,-1
TRAIN_SENT_ID_254259,,张顺,张横,那 张横 、 张顺 逃出 南门 ， 身边 尚有 千余名 从 骑 ， 一抹 地奔 到 魏河 。,人物二  人物一 逃出 南门  身边 尚有 千余名 骑  一抹 地奔 魏河,-1
TRAIN_SENT_ID_255413,,罗成,秦琼,徐茂 公派 王伯党 ， 谢映 登 ， 任 警司 ， 铁子 健带 着 徐和 秦琼 的 书信 去 北平 府 请 罗成 。,徐茂 公派 王伯党  谢映 登  警司  铁子 健带 徐和 人物二 书信 北平 府 请 人物一,-1
TRAIN_SENT_ID_262265,,尤二姐,尤三姐,人物 评析 : 与 尤二姐 的 懦弱 、 屈辱 、 糊涂 、 和善 相对 比 的 是 尤三姐 ， 她 是 刚烈 、 自尊 、 清醒 、 泼辣 的 。,人物 评析  人物一 懦弱  屈辱  糊涂  和善 相对 人物二  刚烈  自尊  清醒  泼辣,-1
TRAIN_SENT_ID_274283,,梅小青,梅小惠,由 梅小青 监制 ， 郭可盈 、 刘锦玲 、 江欣燕 、 梅小惠 主演 ， 讲述 了 四个 性格 不同 打工 女郎 的 爱情 遭遇 。,人物一 监制  郭可盈  刘锦玲  江欣燕  人物二 主演  讲述 四个 性格 不同 打工 女郎 爱情 遭遇,-1
TRAIN_SENT_ID_271498,,孟优,孟获,新 角色 马超 孟起 、 孟获 、 孟优 登场 。,新 角色 马超 孟起  人物二  人物一 登场,-1
TRAIN_SENT_ID_250604,,鲁西西,皮皮鲁,皮皮鲁 总动员 · 鲁西西 系列 ： 鲁西西 和 龙珠 风波 内容简介 : 皮皮鲁 是 郑渊洁 童话 中 最酷 的 男一号 。,人物二 总动员  人物一 系列  人物一 龙珠 风波 内容简介  人物二 郑渊洁 童话 中 最酷 男一号,-1
TRAIN_SENT_ID_282411,,赵公明,通天教主,其中 二十四颗 落 于 通天教主 之手 ， 赐予 赵公明 。,二十四颗 落 人物二 之手  赐予 人物一,1
TRAIN_SENT_ID_265576,,张崇基,张崇德,其他 演员 ： 张崇基 张崇德 古天乐 郭蔼明,演员  人物一 人物二 古天乐 郭蔼明,-1
TRAIN_SENT_ID_251838,,梅超风,黄药师,幸得 梅超风 舍身 护师 ， 替 黄药师 接 了 西毒 全力 一击 的 蛤蟆功 。,幸得 人物一 舍身 护师  人物二 接 西毒 全力 一击 蛤蟆功,1
TRAIN_SENT_ID_269560,,步鹰,燕双鹰,燕双鹰 万分 悲痛 之下 ， 将 步鹰 乱枪 击毙 。,人物二 万分 悲痛 之下  人物一 乱枪 击毙,1
TRAIN_SENT_ID_251550,,楚碧痕,楚寒镜,楚寒镜 人物 简介 : 楚寒镜 是 炎帝 神农 洞 月 幽之境 中 守护 梭罗 仙树 的 梭罗树 仙 之一 ， 楚碧痕 的 孪生 姐姐 。,人物二 人物 简介  人物二 炎帝 神农 洞 月 幽之境 中 守护 梭罗 仙树 梭罗树 仙  人物一 孪生 姐姐,-1
TRAIN_SENT_ID_272044,,韩慕侠,周恩来,周恩来 曾 提笔 为 韩慕侠 的 武馆 ， 写下 “ 韩九师堂 ” 四字 。,人物二 提笔 人物一 武馆  写下  韩九师堂  四字,1
TRAIN_SENT_ID_254284,,张顺,张横,张顺 死后 ， 还 把 灵魂 附在 张横 身上 杀死 了 方天定 。,人物一 死后  灵魂 附在 人物二 身上 杀死 方天定,-1
TRAIN_SENT_ID_262228,,尤二姐,尤三姐,与 尤二姐 的 百依百顺 不同 ， 尤三姐 就 不是 逆来顺受 的 弱女子 了 。,人物一 百依百顺 不同  人物二 逆来顺受 弱女子,-1
TRAIN_SENT_ID_268889,,司徒静,司徒剑南,司徒剑南 第二集 : 司徒静 骗过 衙役 逃走 ， 朱允 和 白云飞 被 误认为 是 强盗 。,人物二 第二集  人物一 骗过 衙役 逃走  朱允 白云飞 误认为 强盗,-1
TRAIN_SENT_ID_274095,,南宫敬叔,孔子,"遣 一车 二 马一 童一御 , 由 南宫敬叔 陪 孔子 前往 。",遣 一车 二 马一 童一御  人物一 陪 人物二 前往,1
TRAIN_SENT_ID_255418,,罗成,秦琼,这款 新 MOD 可 期待 性强 ， 重点 突出 了 李世民 、 秦琼 、 罗成 、 王伯当 、 单雄信 、 程咬金 等 英雄人物 。,这款 新  期待 性强  重点 突出 李世民  人物二  人物一  王伯当  单雄信  程咬金 英雄人物,-1
TRAIN_SENT_ID_259363,,葛玄,左慈,左慈 授予 葛玄 道家 真经 数部 。,人物二 授予 人物一 道家 真经 数部,1
TRAIN_SENT_ID_250372,,赵飞燕,赵合德,1996 年 执导 古装 宫斗剧 《 汉宫 飞燕 》 ， 该剧 描述 西汉时期 美女 赵飞燕 及其 妹妹 赵合德 传奇一生 故事 。,年 执导 古装 宫斗剧  汉宫 飞燕   该剧 描述 西汉时期 美女 人物一 妹妹 人物二 传奇一生 故事,-1
TRAIN_SENT_ID_252710,,颜回,孔子,孔子 与 颜回 的 这段 谈话 完全 出自 假托 。,人物二 人物一 这段 谈话 完全 出自 假托,1
TRAIN_SENT_ID_269002,,韩非,荀子,自道 以至 名 ， 由名 而 至法 ， 上 承 老子 ， 下启 荀子 、 韩非 。,自道 名  由名 至法  承 老子  下启 人物二  人物一,1
TRAIN_SENT_ID_259741,,李偲菘,李伟菘,李偲菘 / 李伟菘 / 姚若龙 / 易家扬 / 徐世珍 / 彭学斌 / 严云农,人物一  人物二  姚若龙  易家扬  徐世珍  彭学斌  严云农,-1
TRAIN_SENT_ID_273373,,杨锐,张之洞,张之洞 急电 挽救 他 的 得意门生 杨锐 而 不得 。,人物二 急电 挽救 得意门生 人物一,1
TRAIN_SENT_ID_263398,,武修文,武敦儒,靖 、 蓉 为 寻找 黄药师 ， 巧遇 武三通 之子 武敦儒 、 武修文 ， 杨康之 子 杨过 。,靖  蓉 寻找 黄药师  巧遇 武三通 之子 人物二  人物一  杨康之 子 杨过,-1
TRAIN_SENT_ID_255424,,罗成,秦琼,第十五回 勇 秦琼 舞 简服 三军 小 罗成 射鹰助 一弩,第十五回 勇 人物二 舞 简服 三军 人物一 射鹰助 一弩,-1
TRAIN_SENT_ID_255396,,罗成,秦琼,李世民 : 在 李世民 的 统帅 下 ， 徐茂 公 、 秦琼 、 尉迟恭 、 程咬金 、 罗成 等 率兵 扫平 了 十八 路 反王 。,李世民  李世民 统帅  徐茂 公  人物二  尉迟恭  程咬金  人物一 率兵 扫平 十八 路 反王,-1
TRAIN_SENT_ID_249267,,皮皮鲁,鲁西西,皮皮鲁 、 鲁西西 、 罗克 、 舒克和贝塔 是 他 笔下 塑造 的 形象 。,人物一  人物二  罗克  舒克和贝塔 笔下 塑造 形象,-1
TRAIN_SENT_ID_255449,,罗成,秦琼,罗成 的 好 ， 秦琼 最 懂 。,人物一  人物二 懂,-1
TRAIN_SENT_ID_250110,,武敦儒,武修文,大武 是 指 武敦儒 ， 小武 是 指 武修文 。,大武 指 人物一  小武 指 人物二,-1
TRAIN_SENT_ID_252643,,颜回,孔子,孔子 对 曰 ： “ 夫其 所以 为 颜回 者 ， 此 之类 也 ， 岂足 多 哉 ？ ”,人物二 曰   夫其 人物一   岂足,1
TRAIN_SENT_ID_253862,,赵合德,赵飞燕,汉成帝 宠幸 的 赵飞燕 、 赵合德 姐妹 即住 在 昭阳 宫 。,汉成帝 宠幸 人物二  人物一 姐妹 即住 昭阳 宫,-1
TRAIN_SENT_ID_265503,,薛蝌,薛蟠,金 桂和 宝蟾 要 勾引 薛蟠 堂弟 薛蝌 ， 其他 方面 倒 安静下来 。,金 桂和 宝蟾 勾引 人物二 堂弟 人物一  方面 倒 安静下来,-1
TRAIN_SENT_ID_259736,,李偲菘,李伟菘,作曲 ： 李伟菘 、 李偲菘 演唱 ： 萧 骊珠 绝代 双雄 片尾曲 : 萧 孋 珠 - 独上 西楼,作曲  人物二  人物一 演唱  萧 骊珠 绝代 双雄 片尾曲  萧 孋 珠  独上 西楼,-1
TRAIN_SENT_ID_255447,,罗成,秦琼,罗成 角色 经历 : 罗成 秦琼 和 罗成 : 秦琼 不 喜欢 罗成 ， 不是 因为 嫉妒 罗成 的 才能 。,人物一 角色 经历  人物一 人物二 人物一  人物二 喜欢 人物一  嫉妒 人物一,-1
TRAIN_SENT_ID_254254,,张顺,张横,张顺 聚义 : 张顺 聚义 将 : 张家 兄弟 ： 与 张横 上阵 ， 法术 攻击 增加 6% 。,人物一 聚义  人物一 聚义  张家 兄弟  人物二 上阵  法术 攻击 增加,-1
TRAIN_SENT_ID_265460,,薛谭,秦青,读后感 : “ 薛谭 学 讴 ” 全文 的 重心 是 刻画 人物 秦青 和 薛谭 。,读后感   人物一 学 讴  全文 重心 刻画 人物 人物二 人物一,1
TRAIN_SENT_ID_268992,,韩非,荀子,《 诗经 》 《 史记 》 《 庄子 》 《 老子 》 《 论语 》 《 孟子 》 《 韩非 子 》 《 楚辞 》 《 左传 》 《 荀子 》,诗经   史记   庄子   老子   论语   孟子   人物一 子   楚辞   左传   人物二,1
TRAIN_SENT_ID_264535,,岳云鹏,郭德纲,据悉 ， 6 月 12 日晚 ， 郭德纲 将 收 赵云侠 、 李云杰 、 岳云鹏 、 闫云达 、 宁云祥 、 朱云峰 、 陶云圣 （ 陶阳 ） 等 “ 云 ” 字科 弟子 。,据悉   月  日晚  人物二 收 赵云侠  李云杰  人物一  闫云达  宁云祥  朱云峰  陶云圣  陶阳   云  字科 弟子,1
TRAIN_SENT_ID_254011,,周恩寿,周恩来,周恩寿 因 作战 负伤 与 中共 脱离 了 联系 ， 又 和 周恩来 断 了 来往 / 经 叶剑英 联系 ， 周恩寿 见到 了 中共 特别 会计室 负责人 赖祖烈,人物一 作战 负伤 中共 脱离 联系  人物二 断 来往  叶剑英 联系  人物一 见到 中共 特别 会计室 负责人 赖祖烈,-1
TRAIN_SENT_ID_258155,,刘星,夏雪,身份 ： 某 医院 的 护士长 ， 刘星 的 生母 ， 夏雪 和 夏雨 的 继母 。,身份  医院 护士长  人物一 生母  人物二 夏雨 继母,-1
TRAIN_SENT_ID_261589,,宋小宝,赵本山,赵本山 、 宋小宝 、 赵海燕,人物二  人物一  赵海燕,1
TRAIN_SENT_ID_251545,,楚碧痕,楚寒镜,迷宫 搜索 关键词 ： 三寒器 、 炎帝 神农 、 梭罗树 、 梭罗 果 、 楚碧痕 、 楚寒镜 、 月 幽之境 、 熔岩 兽王 、 炙炎石,迷宫 搜索 关键词  三寒器  炎帝 神农  梭罗树  梭罗 果  人物一  人物二  月 幽之境  熔岩 兽王  炙炎石,-1
TRAIN_SENT_ID_249273,,皮皮鲁,鲁西西,皮皮鲁 和 鲁西西 幕后 制作 : 花絮 ( 4 张 ),人物一 人物二 幕后 制作  花絮   张,-1
TRAIN_SENT_ID_269730,,薛洋,薛之荔,看着 薛洋 和 楚牧 还 没 赶上来 ， 她俩 故意 放慢 速度 ， 薛之荔 对 齐齐 讲起 了 薛洋 的 故事 。,看着 人物一 楚牧 没 赶上来  她俩 故意 放慢 速度  人物二 齐齐 讲起 人物一 故事,-1
TRAIN_SENT_ID_255450,,罗成,秦琼,第三十六回 专诸巷 罗成 认 舅母 贾柳店 秦琼 待 宾朋,第三十六回 专诸巷 人物一 认 舅母 贾柳店 人物二 宾朋,-1
TRAIN_SENT_ID_261165,,王缙,王维,时议 云 ： 论诗 则 王维 、 崔颢 ， 论笔 则 王缙 、 李邕 ， 祖咏 、 张 说不得 与 焉 。,时议 云  论诗 人物二  崔颢  论笔 人物一  李邕  祖咏  张 说不得,-1
