sent_id,sent_id,entity1,entity2,sent,processed_sent,human
TRAIN_SENT_ID_268407,,秦始皇,扶苏,到 了 大一统 的 秦朝 ， 秦始皇 甫 死 ， 长子 扶苏 ， 将军 蒙恬 、 蒙毅 等 人 就 被 胡亥 、 赵高 、 李斯 矫 始皇 遗诏 赐死 。,大一统 秦朝  人物一 甫 死  长子 人物二  将军 蒙恬  蒙毅 胡亥  赵高  李斯 矫 始皇 遗诏 赐死,-1
TRAIN_SENT_ID_261978,,彭湃,周凤,儿子 彭湃 出身 大 地主 家庭 却 成为 中国 现代 农民 革命 运动 的 先驱 ， 与 自幼 受 贫苦出身 的 母亲 周凤 的 教育 影响 有关 。,儿子 人物一 出身 地主 家庭 成为 中国 现代 农民 革命 运动 先驱  自幼 受 贫苦出身 母亲 人物二 教育 影响,-1
TRAIN_SENT_ID_275869,,孙霸,孙权,后来 ， 在 赤乌 十三年 （ 250 年 ） ， 孙权 废 孙和 杀 孙霸 ， 改立 孙亮 为 太子 ， 并且 以 全氏 为 孙亮 的 妃子 。,后来  赤乌 十三年   年   人物二 废 孙和 杀 人物一  改立 孙亮 太子  全氏 孙亮 妃子,-1
TRAIN_SENT_ID_273003,,黄月英,黄承彦,诸葛亮 与 黄月英 诸葛亮 结交 的 一位 很 特别 的 朋友 ， 名叫 黄承彦 。,诸葛亮 人物一 诸葛亮 结交 一位 特别 朋友  名叫 人物二,-1
TRAIN_SENT_ID_284295,,李系,李顺,李系 家族 成员 : 长子 ： 李顺 ， 安西将军 ， 凉州 刺史 ， 赠 侍中 、 镇西 大将军 、 太尉 公 、 高平 王 、 谥 曰 宣王 。,人物一 家族 成员  长子  人物二  安西将军  凉州 刺史  赠 侍中  镇西 大将军  太尉 公  高平 王  谥 曰 宣王,-1
TRAIN_SENT_ID_262452,,扶苏,秦始皇,他 随父 出游 时 ， 中途 秦始皇 去世 ， 丞相 李斯 和 赵高 假造 圣旨 ， 杀死 太子 扶苏 ， 胡亥 被立 为帝 。,随父 出游 时  中途 人物二 去世  丞相 李斯 赵高 假造 圣旨  杀死 太子 人物一  胡亥 被立 为帝,-1
TRAIN_SENT_ID_276646,,陆展元,何沅君,何沅君 ， 金庸 武侠小说 《 神雕侠侣 》 中 的 人物 ， 南帝 一灯大师 弟子 武三通 养女 ， 嘉兴 陆家庄 陆展元 之妻 。,人物二  金庸 武侠小说  神雕侠侣  中 人物  南帝 一灯大师 弟子 武三通 养女  嘉兴 陆家庄 人物一 之妻,-1
TRAIN_SENT_ID_258605,,刘禅,刘备,董允 思量 秉正 : 刘备 立太子 刘禅 时 ， 任命 董允 与 费祎为 太子 舍人 ， 后 董允 调任 太子 洗马 ， 而费 祎 调任 太子 庶子 。,董允 思量 秉正  人物二 立太子 人物一 时  任命 董允 费祎为 太子 舍人  董允 调任 太子 洗马  而费 祎 调任 太子 庶子,-1
TRAIN_SENT_ID_251462,,谢贤,谢霆锋,黑夜 马戏团 歌手 简介 : 亚洲 天王 谢霆锋 是 著名 的 歌手 、 演员 ， 父亲 谢贤 ， 母亲 狄波拉 。,黑夜 马戏团 歌手 简介  亚洲 天王 人物二 著名 歌手  演员  父亲 人物一  母亲 狄波拉,-1
TRAIN_SENT_ID_270114,,罗成,罗艺,苏宝 凤 ， 唐将 苏定方 之 次女 ， 美人 坯子 ( 李彩桦 饰 ) ， 因为 父亲 杀死 了 罗艺 、 罗成 父子 和 苏家结 李彩桦 饰演 丑女 苏凤 下 了 血海深仇 。,苏宝 凤  唐将 苏定方 次女  美人 坯子  李彩桦 饰   父亲 杀死 人物二  人物一 父子 苏家结 李彩桦 饰演 丑女 苏凤 血海深仇,-1
TRAIN_SENT_ID_272921,,王岳伦,王诗龄,王诗龄 个人 生活 : 王诗龄 的 母亲 是 主持人 李湘 ， 父亲 是 导演 王岳伦 。,人物二 个人 生活  人物二 母亲 主持人 李湘  父亲 导演 人物一,-1
TRAIN_SENT_ID_270016,,张耳,张敖,张耳 的 儿子 张敖 接续 他 父亲 做 了 赵王 ， 汉高祖 的 大 女儿 鲁元公主 嫁给 赵 王敖 做 王后 。,人物一 儿子 人物二 接续 父亲 做 赵王  汉高祖 女儿 鲁元公主 嫁给 赵 王敖 做 王后,-1
TRAIN_SENT_ID_281451,,褚蒜子,褚裒,1 人物 生平 : 名冠 中朝 : 褚裒 字 季野 ， 是 康献 皇后 褚蒜子 的 父亲 。,人物 生平  名冠 中朝  人物二 字 季野  康献 皇后 人物一 父亲,-1
TRAIN_SENT_ID_257985,,夏东海,刘梅,在 剧中 ， 他 和 宋丹丹 演 的 刘梅 妇唱夫随 ， 和 三个 孩子 则 互敬互爱 ， 互相 尊重 ， 夏东海 是 刘梅 眼中 的 好 丈夫 ， 孩子 们 眼中 的 好 父亲 。,剧中  宋丹丹 演 人物二 妇唱夫随  三个 孩子 互敬互爱  互相 尊重  人物一 人物二 眼中 丈夫  孩子 眼中 父亲,-1
TRAIN_SENT_ID_264101,,刘备,孙尚香,刘备 的 夫人 死后 ， 孙权 按照 周瑜 的 计策 假装 把 自己 的 妹妹 孙尚香 许配给 刘备 ， 想 把 刘备 骗 到 东吴 ， 再 将 其 杀害 。,人物一 夫人 死后  孙权 周瑜 计策 假装 妹妹 人物二 许配给 人物一  想 人物一 骗 东吴  杀害,-1
TRAIN_SENT_ID_264858,,夏东海,夏雪,2 内容简介 : 男主人 夏东海 曾 跟随 前妻 到 美国 陪读 、 工作 ， 离婚 后 带 着 儿子 夏雨 归国 发展 ， 并 与 在 国内 长大 的 女儿 夏雪 团聚 。,内容简介  男主人 人物一 跟随 前妻 美国 陪读  工作  离婚 带 儿子 夏雨 归国 发展  国内 长大 女儿 人物二 团聚,-1
TRAIN_SENT_ID_285073,,桑昆,王汗,王汗 只身一人 想 投奔 乃蛮 部 ， 在 乃蛮 边界 被 边 将 当作 奸细 杀死 ， 其子 桑昆 身死 异乡 。,人物二 只身一人 想 投奔 乃蛮 部  乃蛮 边界 当作 奸细 杀死  其子 人物一 身死 异乡,-1
TRAIN_SENT_ID_284722,,文王昌,季历,季历 其他 存疑 : 《 史记 · 龟策 列传 》 载 ： （ 纣王 ） 杀周 太子 历 ， 囚 文王昌 。,人物二 存疑   史记  龟策 列传  载   纣王  杀周 太子 历  囚 人物一,-1
TRAIN_SENT_ID_250443,,朱常洵,郑贵妃,万历 二十二年 （ 1594 ） ， 欲立 郑贵妃 所 生子 朱常洵 为 太子 ， 廷臣 则 普遍 请立 皇 长子 朱常洛 为 太子 ， 故 朝廷 出现 国本 之争 。,万历 二十二年     欲立 人物二 生子 人物一 太子  廷臣 普遍 请立 皇 长子 朱常洛 太子  朝廷 出现 国本 之争,-1
TRAIN_SENT_ID_268744,,孟明视,百里奚,经 后世 考证 ， 战国时期 ， 秦国 名将 孟明视 ， 以 百里 为 姓 ， 字 孟明 名 ， 名叫 作视 ， 百里奚 之子 。,后世 考证  战国时期  秦国 名将 人物一  百里 姓  字 孟明 名  名叫 作视  人物二 之子,-1
TRAIN_SENT_ID_270315,,宣姜,卫宣公,而鲁诗 则 认为 是 卫宣公 夫人 宣姜 为 让 自己 的 儿子 寿 继位 而 欲 杀 太子 伋 ， 寿为 救 伋 ， 亦 死 ， 后人 伤 之 ， 为 作此 诗 。,而鲁诗 认为 人物二 夫人 人物一 儿子 寿 继位 欲 杀 太子 伋  寿为 救 伋  死  后人 伤  作此 诗,-1
TRAIN_SENT_ID_276544,,孔子,亓官氏,考之 年谱 ： 「 孔子 六十六岁 ， 夫人 亓官氏 氏 卒 ， 六十七岁 ， 有伯鱼 母 死期 年 犹 哭 ， 子 曰 ： 『 谁 与 （ 欤 ） ？,考之 年谱   人物一 六十六岁  夫人 人物二 氏 卒  六十七岁  有伯鱼 母 死期 年 犹 哭  子 曰,-1
TRAIN_SENT_ID_263235,,胡亥,秦始皇,但 中 车府 令 赵高 和 丞相 李斯 等 人 与 秦始皇 的 小儿子 赵 胡亥 阴谋 篡改 始皇帝 的 遗诏 ， 立 胡亥 为 太子 ， 即 皇帝 位 。,中 车府 令 赵高 丞相 李斯 人物二 小儿子 赵 人物一 阴谋 篡改 始皇帝 遗诏  立 人物一 太子  皇帝 位,-1
TRAIN_SENT_ID_283760,,慕容顺,伏允,这时 ， 伏允 已经 立 了 新 的 太子 ， 慕容顺 非常 不 高兴 。,人物二 已经 立 新 太子  人物一 非常 高兴,-1
TRAIN_SENT_ID_276651,,陆展元,何沅君,何沅君 ， 别名 阿 浣 ， 金庸 武侠小说 《 神雕侠侣 》 中 的 人物 ， 南帝 一灯大师 弟子 武三通 养女 ， 嘉兴 陆家庄 陆展元 之妻 。,人物二  别名 浣  金庸 武侠小说  神雕侠侣  中 人物  南帝 一灯大师 弟子 武三通 养女  嘉兴 陆家庄 人物一 之妻,-1
TRAIN_SENT_ID_251447,,谢贤,谢霆锋,够 了 没有 歌手 简介 : 亚洲 天王 谢霆锋 是 著名 的 歌手 、 演员 ， 父亲 谢贤 ， 母亲 狄波拉 。,够 没有 歌手 简介  亚洲 天王 人物二 著名 歌手  演员  父亲 人物一  母亲 狄波拉,-1
TRAIN_SENT_ID_262522,,扶苏,秦始皇,秦始皇 病故 后 ， 秦二世 、 赵高 篡夺 帝位 ， 太子 扶苏 自杀 ， 同时 也 逼 蒙恬 自杀 。,人物二 病故  秦二世  赵高 篡夺 帝位  太子 人物一 自杀  逼 蒙恬 自杀,-1
TRAIN_SENT_ID_262034,,李纨,贾兰,108 回 （ 情不情 僧 遭逢 穷途 幻之 幻境 展演 情榜 ） 李纨 之子 贾兰 考取 功名 ， 李纨 老来 富贵 ， 却 又 悠忽 死去 ， 枉 与 他人 作 笑谈 。,回  情不情 僧 遭逢 穷途 幻之 幻境 展演 情榜  人物一 之子 人物二 考取 功名  人物一 老来 富贵  悠忽 死去  枉 作 笑谈,-1
TRAIN_SENT_ID_267119,,公子羽,明月心,明月心 人物 设定 : 明月心 ， 即 易容 后 的 卓 夫人 ， 古龙 武侠小说 《 天涯 明月刀 》 中 的 主要 人物 ， 公子羽 之妻 。,人物二 人物 设定  人物二  易容 卓 夫人  古龙 武侠小说  天涯 明月刀  中 主要 人物  人物一 之妻,-1
TRAIN_SENT_ID_251445,,谢贤,谢霆锋,残绘 爱情 实录 歌手 简介 : 亚洲 天王 谢霆锋 是 著名 的 歌手 、 演员 ， 父亲 谢贤 ， 母亲 狄波拉 。,残绘 爱情 实录 歌手 简介  亚洲 天王 人物二 著名 歌手  演员  父亲 人物一  母亲 狄波拉,-1
TRAIN_SENT_ID_286807,,王文林,王长友,王文林 早年 经历 : 王文林 （ 王惠林 ） 自幼 随 父亲 王长友 先生 学艺 ， 8 岁 拜 刘宝瑞 大师 为师 深造 ， 12 岁 正式 登台 表演 。,人物一 早年 经历  人物一  王惠林  自幼 父亲 人物二 先生 学艺   岁 拜 刘宝瑞 大师 为师 深造   岁 正式 登台 表演,-1
TRAIN_SENT_ID_250436,,朱常洵,郑贵妃,他 为何 没有 立 郑贵妃 所生 的 儿子 朱常洵 为 太子 ？,没有 立 人物二 所生 儿子 人物一 太子,-1
TRAIN_SENT_ID_258792,,刘禅,刘备,登基 为帝 : 公元 223 年 （ 章武 三年 ） 四月 ， 刘备 在 永安 宫 去世 ， 五月 ， 刘禅 继承 皇位 在 成都 称帝 ， 时年 十七岁 。,登基 为帝  公元  年  章武 三年  四月  人物二 永安 宫 去世  五月  人物一 继承 皇位 成都 称帝  时年 十七岁,-1
TRAIN_SENT_ID_258701,,刘禅,刘备,建安 二十六年 ， 刘备 病逝 于 白帝城 ， 太子 刘禅 即位 ， 改元 建兴 ， 丞相 诸葛亮 主理 大小 内政 事物 。,建安 二十六年  人物二 病逝 白帝城  太子 人物一 即位  改元 建兴  丞相 诸葛亮 主理 大小 内政 事物,-1
TRAIN_SENT_ID_284008,,金乡公主,何晏,何晏 和 金乡公主 生 了 个 儿子 ， 才 五六岁 ， 清俊 美丽 ， 长得 很 像 他 ， 躲 在 何晏 的 母亲 尹夫人 那里 ， 被 搜到 ， 也 要 抓 去 杀头 。,人物二 人物一 生 儿子  五六岁  清俊 美丽  长得  躲 人物二 母亲 尹夫人  搜到  抓 杀头,-1
TRAIN_SENT_ID_258027,,黄睿靓,陈致中,吴淑真 家庭 情况 : 父亲 ： 吴昆 池 母亲 ： 吴王霞 长女 ： 陈幸妤 （ 夫 赵建铭 ） 次子 ： 陈致中 （ 妻 黄睿靓 ）,吴淑真 家庭 情况  父亲  吴昆 池 母亲  吴王霞 长女  陈幸妤  夫 赵建铭  次子  人物二  妻 人物一,-1
TRAIN_SENT_ID_271690,,田川氏,郑成功,郑成功 之母 田川氏 当时 已 从 日本 搬至 南安 定居 ， 不幸 碰上 此次 劫难 ， 于 战乱 中 自杀身亡 ； 郑成功 得知 母亲 死后 ， 更加 坚定 了 抗清 的 决心 。,人物二 之母 人物一 当时 日本 搬至 南安 定居  不幸 碰上 劫难  战乱 中 自杀身亡  人物二 得知 母亲 死后  更加 坚定 抗清 决心,-1
TRAIN_SENT_ID_273027,,黄月英,黄承彦,3 艺术形象 : 文学 形象 : 黄承彦 雕像 - - 襄阳 城西 黄家 湾 风景区 小说 《 三国演义 》 中 黄承彦 是 黄月英 之 父 ， 诸葛亮 的 岳父 。,艺术形象  文学 形象  人物二 雕像   襄阳 城西 黄家 湾 风景区 小说  三国演义  中 人物二 人物一 父  诸葛亮 岳父,-1
TRAIN_SENT_ID_260780,,李格非,李清照,章丘 名人 先后 有 邹衍 、 房玄龄 、 李格非 、 李清照 、 刘敏中 、 李开先 、 马国翰 等 。,章丘 名人 先后 邹衍  房玄龄  人物一  人物二  刘敏中  李开先  马国翰,-1
TRAIN_SENT_ID_281404,,钱学森,钱永刚,堂兄 ： 钱永刚 （ 钱学森 的 长子 ） ， 汉族 ， 解放军 某 研究所 高级 工程师 、 上海交通大学 兼职 教授,堂兄  人物二  人物一 长子   汉族  解放军 研究所 高级 工程师  上海交通大学 兼职 教授,-1
TRAIN_SENT_ID_254177,,邢夫人,贾赦,《 红楼梦 》 第四 六 回 ： “ 凤姐 知道 邢夫人 禀性 愚弱 ， 只知 奉承 贾赦 以 自保 。 ”,红楼梦  第四 六 回   凤姐 知道 人物一 禀性 愚弱  只知 奉承 人物二 自保,-1
TRAIN_SENT_ID_272544,,宋江,宋太公,在 宋江 家中 住 了 一夜 ， 宋太公 托 石勇 给 宋江 送信 。,人物一 家中 住 一夜  人物二 托 石勇 人物一 送信,-1
TRAIN_SENT_ID_283894,,曾柔,韦小宝,2 精彩 表现 : 丽春院 大床 压塌 后 ， 当 韦小宝 逼 着 阿 珂 承认 其 婚事 ， 曾柔 一改 往日 的 2014 韩栋 版 鹿鼎记 曾柔 ( 2 张 ),精彩 表现  丽春院 大床 压塌  人物二 逼 珂 承认 婚事  人物一 一改 往日  韩栋 版 鹿鼎记 人物一   张,-1
TRAIN_SENT_ID_276743,,丁夫人,曹操,丁氏 逝世 : 几年 后 ， 丁家 传来 丁夫人 病逝 的 消息 ， 至此 ， 曹操 的 悔 痛之心 更是 无以复加 。,丁氏 逝世  几年  丁家 传来 人物一 病逝 消息  至此  人物二 悔 痛之心 更是 无以复加,-1
TRAIN_SENT_ID_262038,,李纨,贾兰,李纨 — — 金陵 十二钗 之 十一 ， 贾珠 遗孀 ， 生子 贾兰 。,人物一   金陵 十二钗 十一  贾珠 遗孀  生子 人物二,-1
TRAIN_SENT_ID_269483,,荆轲,荆天明,荆天明 角色 经历 : 荆天明 第一部 : 荆轲 、 丽姬本 是 青梅竹马 。,人物二 角色 经历  人物二 第一部  人物一  丽姬本 青梅竹马,-1
TRAIN_SENT_ID_283577,,张志毅,张德江,张志毅 家庭 : 儿 ， 张德江 ， 现任 中共 中央政治局常委 ， 十二届 全国人大常委会 委员长 。,人物一 家庭   人物二  现任 中共 中央政治局常委  十二届 全国人大常委会 委员长,-1
TRAIN_SENT_ID_270184,,蒋雯丽,顾长卫,四 、 一对 互相 欣赏 的 夫妻 — — 蒋雯丽 和 顾长卫 夫妇,四  一对 互相 欣赏 夫妻   人物一 人物二 夫妇,1
TRAIN_SENT_ID_274660,,傅敏,傅雷,心如 水晶 一般 透明 — — 傅敏 心中 目中 的 傅雷,心如 水晶 透明   人物一 心中 目中 人物二,-1
TRAIN_SENT_ID_265276,,贾琏,贾赦,皇宫 通过 这个 贵妃 娘娘 的 关系 ， 促使 了 贾赦 、 贾珍 、 贾琏 等 人 有恃无恐 地 进行 打点 进贡 ， 太监 勒索 ， 开支 日繁 。,皇宫 贵妃 娘娘 关系  促使 人物二  贾珍  人物一 有恃无恐 进行 打点 进贡  太监 勒索  开支 日繁,-1
TRAIN_SENT_ID_285848,,卢芳,胡军,胡皓 康 ， 胡军 与 卢芳 的 儿子 。,胡皓 康  人物二 人物一 儿子,-1
TRAIN_SENT_ID_263133,,毛福梅,蒋介石,5 从 发妻 到 “ 义 姊 ” ， 蒋介石 大 费周折 ， 但 毛福梅 毕竟 是 蒋经国 之 “ 生母 ” 。,发妻  义 姊   人物二 费周折  人物一 毕竟 蒋经国  生母,-1
TRAIN_SENT_ID_282540,,关谷健次郎,关谷神奇,关谷奇迹 ， 关谷神奇 的 曾祖父 ， 关谷 神秘 的 高祖父 ， 关谷健次郎 的 祖父 。,关谷奇迹  人物二 曾祖父  关谷 神秘 高祖父  人物一 祖父,-1
TRAIN_SENT_ID_276845,,唐姬,刘发,唐姬 生 长沙 定王 刘发 。,人物一 生 长沙 定王 人物二,-1
TRAIN_SENT_ID_272924,,王岳伦,王诗龄,王岳伦 父女 （ 王岳伦 ： 天秤座 ； 王诗龄 ： 天秤座 ）,人物一 父女  人物一  天秤座  人物二  天秤座,-1
TRAIN_SENT_ID_276833,,唐姬,刘发,唐姬 （ 唐儿 ） ， 生 长沙 定王 刘发 。,人物一  唐儿   生 长沙 定王 人物二,-1
TRAIN_SENT_ID_279346,,石青璇,徐子陵,徐子陵 和 寇仲 完成 大业 之后 ， 向 石青璇 求婚 ， 获得 佳人 首肯 ， 终于 有情人终成眷属 ， 执子之手 、 与子偕老 。,人物二 寇仲 完成 大业 之后  人物一 求婚  获得 佳人 首肯  终于 有情人终成眷属  执子之手  与子偕老,1
TRAIN_SENT_ID_261548,,关兴,关羽,关羽 = 简雍 + 关索 + 关兴 ( 2 ),人物二  简雍  关索  人物一,-1
TRAIN_SENT_ID_265142,,尤二姐,贾琏,邢夫人 为了 维护 丈夫 的 颜面 ， 大骂 贾琏 ， 实际上 是 指桑骂槐 ， 等于 痛骂 了 尤二姐 。,邢夫人 维护 丈夫 颜面  大骂 人物二  实际上 指桑骂槐  等于 痛骂 人物一,-1
TRAIN_SENT_ID_276791,,丁夫人,曹操,何况 曹操 还 让 丁夫人 改嫁 ， 不让 她 守活寡 ， 只是 丁夫人 不肯 ， 她 父母 也 不敢 。,人物二 人物一 改嫁  不让 守活寡  人物一 不肯  父母 不敢,-1
TRAIN_SENT_ID_270502,,关平,关羽,后来 于临 沮 小路 生擒 关羽 、 关平 。,后来 于临 沮 小路 生擒 人物二  人物一,-1
TRAIN_SENT_ID_276808,,丁夫人,曹操,曹操 原配 丁夫人 ： 打得 过 流氓 ， 斗不过 小 三,人物二 原配 人物一  打得 流氓  斗不过 三,-1
TRAIN_SENT_ID_260497,,严嵩,严世蕃,他 上 密疏 ， 揭发 严嵩 与 严世蕃 所 行事 ， 引起 世宗 的 重视 。,密疏  揭发 人物一 人物二 行事  引起 世宗 重视,-1
TRAIN_SENT_ID_283927,,高崃云,高钦中,高钦中 ， 号 “ 恒溪 ” ， 是 高崃云 的 长子 。,人物二  号  恒溪   人物一 长子,-1
TRAIN_SENT_ID_266943,,关索,关羽,关索 向 张飞 说明 原委 ， 关羽 合家 团聚 。,人物一 张飞 说明 原委  人物二 合家 团聚,-1
TRAIN_SENT_ID_285474,,黄子桓,黄百鸣,编剧 ： 黄子桓 、 黄百鸣,编剧  人物一  人物二,-1
TRAIN_SENT_ID_281905,,穆亮,穆崇,穆亮 是 穆崇 的 曾孙 。,人物一 人物二 曾孙,-1
TRAIN_SENT_ID_256057,,蒋介石,宋美龄,1927 年底 ， 蒋介石 回到 上海 ， 与 宋美龄 完婚 ， 通过 江浙 财阀 确立 了 与 美 、 英 的 关系 。,年底  人物一 回到 上海  人物二 完婚  江浙 财阀 确立 美  英 关系,1
TRAIN_SENT_ID_263236,,胡亥,秦始皇,少子 胡亥 想 去 巡游 ， 要求 跟 随着 ， 秦始皇 答应 了 他 。,少子 人物一 想 巡游  要求  人物二 答应,-1
TRAIN_SENT_ID_255367,,蓝齐儿,容妃,见 蓝齐儿 问起 母妃 ， 康熙 令 容妃 装扮 好 前来 相会 。,见 人物一 问起 母妃  康熙 令 人物二 装扮 前来 相会,-1
TRAIN_SENT_ID_266976,,关索,关羽,关羽 听 了 关索 这番话 ， 迟疑 不 信 。,人物二 听 人物一 这番话  迟疑 信,-1
TRAIN_SENT_ID_273894,,江冬秀,胡适,江冬秀 人物 轶事 : 婚后 第二年 ， 江冬秀 到 了 北京 为 胡适 主持 家务 。,人物一 人物 轶事  婚后 第二年  人物一 北京 人物二 主持 家务,-1
TRAIN_SENT_ID_265706,,贾环,贾政,先写 贾政 不满 于宝玉 精神 萎靡 ， 次 写 忠顺 府 索琪官 ， 接写 贾环 进 谗言 ， 终于 激怒 贾政 。,先写 人物二 不满 于宝玉 精神 萎靡  次 写 忠顺 府 索琪官  接写 人物一 进 谗言  终于 激怒 人物二,-1
TRAIN_SENT_ID_268433,,秦始皇,扶苏,秦始皇 临终 以前 ， 曾 为 玺 书 召令 扶苏 至 咸阳 主持 丧事 并 继承 帝位 。,人物一 临终 以前  玺 书 召令 人物二 咸阳 主持 丧事 继承 帝位,-1
TRAIN_SENT_ID_259451,,贾兰,李纨,李纨 的 “ 晚 韶华 ” 与 贾兰 的 “ 虚名 儿,人物二  晚 韶华  人物一  虚名,-1
TRAIN_SENT_ID_283869,,于海宁,范会香,虽然 范会香 已经 是 癌症 晚期 ， 但 于海宁 却 下定决心 ： 这辈子 一定 要 娶 她 为 妻 ！,人物二 已经 癌症 晚期  人物一 下定决心  这辈子 一定 娶 妻,1
TRAIN_SENT_ID_269889,,张默,张国立,2006 年 《 少年 嘉庆 》 张国立 、 王刚 、 黄维德 、 张默 、 郑家榆,年  少年 嘉庆  人物二  王刚  黄维德  人物一  郑家榆,-1
TRAIN_SENT_ID_286651,,高适,高崇文,10 、 《 高适 家世 及其 早年 经历 释证 — — 以新出 〈 高崇文 玄堂 记 〉 、 〈 高逸 墓志 〉 为 中心 》 ， 《 社会科学 》 2010 年 第 4 期 。,人物一 家世 早年 经历 释证   以新出  人物二 玄堂 记    高逸 墓志  中心    社会科学   年  期,-1
TRAIN_SENT_ID_259079,,刘备,刘禅,雷杀 可以 响应 【 南蛮 入侵 】 ， 【 决斗 】 ， 也 可以 响应 刘备 或 刘禅 的 【 激将 】 等 。,雷杀 响应  南蛮 入侵    决斗   响应 人物一 人物二  激将,-1
TRAIN_SENT_ID_266414,,严世蕃,严嵩,嘉靖 帝看 后 震怒 ， 急召 严嵩 查问 此事 是否 与 严世蕃 有关 。,嘉靖 帝看 震怒  急召 人物二 查问 此事 是否 人物一,-1
TRAIN_SENT_ID_274365,,上官虹,李文秀,陈达海 — — 杀害 李三 和 上官虹 的 凶手 ， 原 是 镖师 ， 一直 追杀 李文秀 ， 后 被 李文秀 打 到 重伤 。,陈达海   杀害 李三 人物一 凶手  原 镖师  一直 追杀 人物二  人物二 重伤,-1
TRAIN_SENT_ID_263763,,秦始皇,赵姬,母亲 ： 赵姬 （ 说法不一 有 说 吕不韦 的 舞姬 ， 也 有 说 赵国 将门之后 ） 秦始皇 兄弟 : 成蟜 秦始皇 后妃 : 妻妾 ： 后宫 数量 众多 。,母亲  人物二  说法不一 说 吕不韦 舞姬  说 赵国 将门之后  人物一 兄弟  成蟜 人物一 后妃  妻妾  后宫 数量 众多,-1
TRAIN_SENT_ID_262176,,诸葛尚,诸葛瞻,他 随 诸葛瞻 、 诸葛尚 、 张遵 、 黄崇 守 绵竹 战 邓艾 ， 曾 向 诸葛瞻 建议 分兵 出城 扼守 险要 隘口 ， 未 被 瞻 采纳 。,人物二  人物一  张遵  黄崇 守 绵竹 战 邓艾  人物二 建议 分兵 出城 扼守 险要 隘口  未 瞻 采纳,-1
TRAIN_SENT_ID_286022,,刘范,刘焉,刘瑁 ， 刘范 三弟 ， 别部 司马 ， 随父 刘焉 入 益州 ， 早逝 。,刘瑁  人物一 三弟  别部 司马  随父 人物二 入 益州  早逝,-1
TRAIN_SENT_ID_283043,,公孙敬声,公孙贺,太仆 ： 灌夫 、 公孙贺 、 公孙敬声,太仆  灌夫  人物二  人物一,-1
TRAIN_SENT_ID_267335,,赵本山,赵玉芳,赵玉芳 在 赵本山 的 安排 下 ， 从 大连市 公安局 辞职 调入 本山 艺术 学院 工作 。,人物二 人物一 安排  大连市 公安局 辞职 调入 本山 艺术 学院 工作,1
TRAIN_SENT_ID_273339,,秦香莲,陈世美,当 朝 太师 之子 庞虎 逼婚 ， 秦香莲 不慎 落水 ， 顺江 而 下 被 书生 陈世美 所救 。,太师 之子 庞虎 逼婚  人物一 不慎 落水  顺江 书生 人物二 所救,-1
TRAIN_SENT_ID_263509,,梅葆玖,梅兰芳,1959 年 毕业分配 至 梅兰芳 京剧团 ， 与 梅葆玖 、 梅葆玥 、 李玉芙 等 合作 演出 。,年 毕业分配 人物二 京剧团  人物一  梅葆玥  李玉芙 合作 演出,-1
TRAIN_SENT_ID_263486,,梅葆玖,梅兰芳,还 得到 了 梅葆玖 授权 ， 把 《 梅兰芳 》 ( 看 专业 影评 ) 改编 成 了 漫画版 。,得到 人物一 授权   人物二   专业 影评  改编 成 漫画版,-1
TRAIN_SENT_ID_258632,,刘禅,刘备,共同 了解 、 深思 守业 失败 的 刘备 、 刘禅 等 人 的 失败 教训 。,共同 了解  深思 守业 失败 人物二  人物一 失败 教训,-1
TRAIN_SENT_ID_266732,,郭登峰,郭美美,2 、 按照 郭登峰 所说 在 郭美美 出生 前 自己 就 有 了 好几百万 。,人物一 所说 人物二 出生 前 好几百万,-1
TRAIN_SENT_ID_263160,,胡亥,秦始皇,"新七国 之乱 内容简介 : 秦始皇 用 了 10 年 的 时间 进行 的 战争 统一 华夏 , 却 在 胡亥 的 手中 断送 。",新七国 之乱 内容简介  人物二  年 时间 进行 战争 统一 华夏  人物一 手中 断送,-1
TRAIN_SENT_ID_273862,,范柳原,白流苏,其实 ， 白流苏 已经 28 岁 ， 离婚 数年 ， 很 愿意 嫁给 范柳原 作为 终身 依靠 。,其实  人物二 已经  岁  离婚 数年  愿意 嫁给 人物一 终身 依靠,1
TRAIN_SENT_ID_284574,,孔原,许明,邓小平 与 卓琳 的 婚礼 在 杨家岭 毛泽东 的 窑洞 前 举行 ， 同时 举行 婚礼 的 还有 中央军委 总政治部 组织部长 孔原 和 许明 。,邓小平 卓琳 婚礼 杨家岭 毛泽东 窑洞 前 举行  举行 婚礼 中央军委 总政治部 组织部长 人物一 人物二,1
TRAIN_SENT_ID_264645,,夏徵舒,夏姬,夏姬 再嫁 丧夫 : 楚庄王 十六年 （ 公元前 598 年 ） ， 夏徵舒 弑君 ， 陈 国人 倒 没 计较 ， 但 楚庄王 偏听 逃亡 的 孔宁 与 仪行父 一面之词 。,人物二 再嫁 丧夫  楚庄王 十六年  公元前  年   人物一 弑君  陈 国人 倒 没 计较  楚庄王 偏听 逃亡 孔宁 仪行父 一面之词,-1
TRAIN_SENT_ID_285637,,高尧,刘春卉,高尧 、 刘春卉 大婚,人物一  人物二 大婚,-1
TRAIN_SENT_ID_266824,,萧峰,萧远山,慕容博 认为 应为 国家 民族 牺牲 小 我 、 完成 大 我 ， 更进一步 在 他 与 萧远山 、 萧峰 的 对话 表露 出来 。,慕容博 认为 应为 国家 民族 牺牲  完成  更进一步 人物二  人物一 对话 表露,-1
TRAIN_SENT_ID_274704,,龙啸云,林诗音,林诗音 青梅竹马 的 恋人 、 未婚夫 ， 因 不忍 龙啸云 的 相思 之苦 而 放,人物二 青梅竹马 恋人  未婚夫  不忍 人物一 相思 之苦 放,-1
