sent_id,sent_id,entity1,entity2,sent,processed_sent,human
TRAIN_SENT_ID_274992,,李林妲,李旻果,李旻果 李林妲 - 家庭成员 :,人物二 人物一  家庭成员,-1
TRAIN_SENT_ID_270524,,关平,关羽,可惜 关羽 因为 保护 关平 而伤 ， 最终 身亡 。,可惜 人物二 保护 人物一 而伤  最终 身亡,-1
TRAIN_SENT_ID_265371,,戚夫人,刘如意,又 毒死 赵王 刘如意 ， 砍断 戚夫人 手足 ， 使 她 变哑 ， 并置 之 厕中 ， 名为 “ 人 彘 ” 。,毒死 赵王 人物二  砍断 人物一 手足  变哑  并置 厕中  名为  彘,-1
TRAIN_SENT_ID_286663,,郑司楚,楚休红,是 年 楚休红 三十三 ， 郑司楚 六岁 。,年 人物二 三十三  人物一 六岁,-1
TRAIN_SENT_ID_283425,,张月亮,张铁林,4 、 张铁林 张月亮 （ 路障 使用 直通 卡 ， 反超 至 第一 ， 但 因 迷路 ， 最后 跌至 第四 ）,人物二 人物一  路障 使用 直通 卡  反超 第一  迷路  最后 跌至 第四,-1
TRAIN_SENT_ID_270505,,关平,关羽,03 ： 关 义父 子 关羽 关平,关 义父 子 人物二 人物一,-1
TRAIN_SENT_ID_270528,,关平,关羽,691 庞义 692 庞德 693 谭雄 694 谯周 695 边张 696 关平 697 关羽 698 关索 699 关统 700 关凤,庞义  庞德  谭雄  谯周  边张  人物一  人物二  关索  关统  关凤,-1
TRAIN_SENT_ID_259444,,贾兰,李纨,这里 指 李纨 因 贾兰 长大 后 做 了 官 而 得到 封诰 。,指 人物二 人物一 长大 做 官 得到 封诰,-1
TRAIN_SENT_ID_267546,,慕容令,慕容垂,金刀 计 ， 反间计 的 一次 完美 的 运用 ， 王猛 为 陷害 慕容垂 所用 ， 借 慕容垂 金刀 ， 诓 慕容令 归国 ， 王猛 用 计 心思 缜密 ， 天衣无缝 。,金刀 计  反间计 一次 完美 运用  王猛 陷害 人物二 所用  人物二 金刀  诓 人物一 归国  王猛 计 心思 缜密  天衣无缝,-1
TRAIN_SENT_ID_267895,,杨宗保,杨延昭,宋将 杨宗保 ， 奉 父帅 杨延昭 之命 ， 巡营 暸 哨 ， 用 绊 马绳 捉住 延辉 ， 回营 复命 。,宋将 人物一  奉 父帅 人物二 之命  巡营 暸 哨  绊 马绳 捉住 延辉  回营 复命,-1
TRAIN_SENT_ID_259265,,刘备,刘禅,刘备 只能 生 刘禅 。,人物一 只能 生 人物二,-1
TRAIN_SENT_ID_286290,,阮丽珍,阮大铖,阮丽珍 ， 安徽 怀宁 人 ， 阮大铖 之女 ， 约 卒 于 清世祖 顺治 中 。,人物一  安徽 怀宁  人物二 之女  约 卒 清世祖 顺治 中,-1
TRAIN_SENT_ID_267881,,钱均夫,钱学森,钱学森 的 父亲 钱均夫 是 杭州人 ， 曾 出任 浙江省 立 第一 中学 ( 现 杭州第四中学 ) 校长 。,人物二 父亲 人物一 杭州人  出任 浙江省 立 第一 中学  现 杭州第四中学  校长,-1
TRAIN_SENT_ID_260818,,何超琼,许晋亨,何超琼 女士 （ 蓝琼缨 女士 所 出 ） = 许晋亨 先生 （ 离婚 ）,人物一 女士  蓝琼缨 女士 出   人物二 先生  离婚,1
TRAIN_SENT_ID_274147,,汤国梨,章太炎,怀念 太炎 先生 作者简介 : 汤国梨 （ 1881 ~ 1980 ） ， 章太炎 夫人 ， 浙江 湖州人 。,怀念 太炎 先生 作者简介  人物一       人物二 夫人  浙江 湖州人,1
TRAIN_SENT_ID_269775,,任我行,任盈盈,任我行 — — 日月神教 教主 ， 任盈盈 之 父 。,人物一   日月神教 教主  人物二 父,-1
TRAIN_SENT_ID_270105,,罗成,罗艺,剧情简介 ： 隋时 ， 燕山 兵马 总管 罗艺 之子 罗成 满怀 报国 热情 赴京 比武 。,剧情简介  隋时  燕山 兵马 总管 人物二 之子 人物一 满怀 报国 热情 赴京 比武,-1
TRAIN_SENT_ID_266725,,郭登峰,郭美美,难道真 如 郭美美 母亲 郭登峰 所言 是 自己 90 年代 初 炒股 积累 起来 ？,难道真 人物二 母亲 人物一 所言  年代 初 炒股 积累 起来,-1
TRAIN_SENT_ID_258687,,刘禅,刘备,刘弘 孙子 : 刘禅 ， 刘备 长子 ， 蜀汉 后主 。,刘弘 孙子  人物一  人物二 长子  蜀汉 后主,-1
TRAIN_SENT_ID_266967,,关索,关羽,关索 者 ， 则 为 汉寿 亭 侯 关羽 之子 ， 关兴 之弟 。,人物一  汉寿 亭 侯 人物二 之子  关兴 之弟,-1
TRAIN_SENT_ID_255612,,蒋介石,宋美龄,朱韵 珩 与 宋美龄 的 “ 太太 路线 ” 是 双向 的 ， 不但 朱韵 珩 利用 这个 关系 帮助 丈夫 接近 蒋介石 ， 宋美龄 也 以此 帮助 蒋介石 笼络 人才 。,朱韵 珩 人物二  太太 路线  双向  朱韵 珩 利用 关系 帮助 丈夫 接近 人物一  人物二 以此 帮助 人物一 笼络 人才,-1
TRAIN_SENT_ID_274208,,岳雷,岳飞,（ 岳飞 次子 ） : 岳雷 是 岳飞 第二个 儿子 ， 刘氏生 ， 字 发祥 ， 号 夏卿 ， 又 号声 甫 。,人物二 次子   人物一 人物二 第二个 儿子  刘氏生  字 发祥  号 夏卿  号声 甫,-1
TRAIN_SENT_ID_272510,,韦丛,元稹,《 离思 · 曾经沧海 难为 水 》 作者 为 唐代 诗人 元稹 ， 此诗 为 悼念 亡妻 韦丛 之作 。,离思  曾经沧海 难为 水  作者 唐代 诗人 人物二  此诗 悼念 亡妻 人物一 之作,-1
TRAIN_SENT_ID_256454,,刘禅,甘夫人,祖母 ： 昭烈 皇后 甘氏 （ 甘夫人 ） 刘璿 父母 : 父亲 ： 蜀汉 后主 刘禅,祖母  昭烈 皇后 甘氏  人物二  刘璿 父母  父亲  蜀汉 后主 人物一,-1
TRAIN_SENT_ID_263242,,胡亥,秦始皇,据 《 秦始皇 本纪 》 、 《 李斯 列传 》 记载 ， 胡亥 对待 自己 的 兄弟 绝不 手软 ， 子婴 若 是 胡亥 的 兄长 ， 为何 能 存活 下来 。,人物二 本纪    李斯 列传  记载  人物一 兄弟 绝不 手软  子婴 人物一 兄长  存活 下来,-1
TRAIN_SENT_ID_266571,,许晋亨,李嘉欣,资深 娱乐 人士 查小欣 透露 ， 李嘉欣 与 许晋亨 的 婚礼 属于 私人 婚宴 ， 不 接待 圈中 友人 。,资深 娱乐 人士 查小欣 透露  人物二 人物一 婚礼 属于 私人 婚宴  接待 圈中 友人,1
TRAIN_SENT_ID_274133,,汤国梨,章太炎,章太炎 的 夫人 汤国梨 曾 回忆 黄侃 骗婚 黄绍兰 一事 ， 致其 一生 流离失所 ， 直斥 黄为 “ 无耻之尤 的 衣冠禽兽 ” ， “ 小 有才 适足 以济 其奸 ” 。,人物二 夫人 人物一 回忆 黄侃 骗婚 黄绍兰 一事  致其 一生 流离失所  直斥 黄为  无耻之尤 衣冠禽兽    有才 适足 以济 其奸,1
TRAIN_SENT_ID_265679,,贾环,贾政,如 贾政 的 屋里人 赵姨娘 ， 即使 已 为 贾政 生 了 探春 、 贾环 ， 但 仍 是 半 奴隶 的 地位 。,人物二 屋里人 赵姨娘  人物二 生 探春  人物一  半 奴隶 地位,-1
TRAIN_SENT_ID_252179,,秦嘉,徐淑,秦嘉 当时 曾 派车去 接 她 ， 还给 她 写 了 一封信 ( 《 与 妻 徐淑 书 》 ) 。,人物一 当时 派车去 接  还给 写 一封信   妻 人物二 书,-1
TRAIN_SENT_ID_250149,,秦始皇,胡亥,秦始皇 胡亥 是 秦始皇 最小 的 儿子 ， 奉 始皇帝 敕令 ， 从中 车府 令 赵高 学习 法律 。,人物一 人物二 人物一 最小 儿子  奉 始皇帝 敕令  从中 车府 令 赵高 学习 法律,-1
TRAIN_SENT_ID_279587,,马丽娟,赵本山,虽然 赵本山 经常 在 外面 演出 ， 可是 马丽娟 心里有数 ， 自己 的 丈夫 是 个 有 责任心 的 男人 。,人物二 经常 外面 演出  人物一 心里有数  丈夫 责任心 男人,1
TRAIN_SENT_ID_286642,,彭德华,季羡林,在 季羡林 眼中 ， 彭德华 是 一位 贤妻良母 ， 她 对 季羡林 关怀备至 ， 对 子女 也 做到 了 慈母 应 做 的 一切 。,人物二 眼中  人物一 一位 贤妻良母  人物二 关怀备至  子女 做到 慈母 应 做,-1
TRAIN_SENT_ID_273083,,杨铁心,包惜弱,杨铁心 和 包惜弱 的 儿子 ， 小王爷 完颜康 贪图 富贵 ， 也 来 欺骗 爹娘 ， 却 被 好心 的 穆念慈 揭穿 。,人物一 人物二 儿子  小王爷 完颜康 贪图 富贵  欺骗 爹娘  好心 穆念慈 揭穿,-1
TRAIN_SENT_ID_265370,,戚夫人,刘如意,【 译文 ： 张良 辅佐 汉惠帝 刘盈 即位 ， 导致 戚夫人 和 赵王 刘如意 母子 冤屈 而 死 。,译文  张良 辅佐 汉惠帝 刘盈 即位  导致 人物一 赵王 人物二 母子 冤屈 死,-1
TRAIN_SENT_ID_271119,,彭丽媛,习近平,作为 中国 国家 主席 习近平 妻子 的 彭丽媛 ， 也 在 自己 关注 的 公共 健康 领域 和 慈善 领域 做出 了 切实 的 贡献 。,中国 国家 主席 人物二 妻子 人物一  关注 公共 健康 领域 慈善 领域 做出 切实 贡献,1
TRAIN_SENT_ID_270330,,关平,关羽,在 一路上 关羽 会 将 曹操 的 守 将 孔秀 、 韩福 、 刘延 、 卞喜 、 王植 砍杀 ， 而且 沿路 还会 收服 关平 和 周仓 ， 关平 还 成为 了 关羽 的 义子 。,一路上 人物二 会 曹操 守 孔秀  韩福  刘延  卞喜  王植 砍杀  沿路 还会 收服 人物一 周仓  人物一 成为 人物二 义子,-1
TRAIN_SENT_ID_260382,,穆桂英,杨宗保,攻打 天门 阵 ， 穆桂英 领得 先锋 印 ， 众 婆婆 们 不服 ， 怂恿 杨宗保 要 穆桂英 让出 先锋 印 ， 夫妻 因而 争吵 。,攻打 天门 阵  人物一 领得 先锋 印  众 婆婆 不服  怂恿 人物二 人物一 让出 先锋 印  夫妻 争吵,-1
TRAIN_SENT_ID_271369,,罗成,罗通,经过 兵法 、 策论 考试 和 武科 比试 ， 并 在 程咬金 有意 促成 下 ， 文武双全 的 罗通 （ 罗成 之子 ） 夺得 二路 招讨印 。,兵法  策论 考试 武科 比试  程咬金 有意 促成  文武双全 人物二  人物一 之子  夺得 二路 招讨印,-1
TRAIN_SENT_ID_260663,,李莎,李立三,《 我 的 中国 缘分 李立三 夫人 李莎 回忆录 》 是 2009 年 外语教学与研究出版社 出版 的 图书 。,中国 缘分 人物二 夫人 人物一 回忆录   年 外语教学与研究出版社 出版 图书,1
TRAIN_SENT_ID_277466,,贾演,贾代化,宁国公 贾演 的 孙子 ， 京营 节度使 世袭 一等 神威 将军 贾代化 的 次子 。,宁国公 人物一 孙子  京营 节度使 世袭 一等 神威 将军 人物二 次子,-1
TRAIN_SENT_ID_271129,,彭丽媛,习近平,会见 前 ， 习近平 和 夫人 彭丽媛 在 卡莫 纳 总统 夫妇 陪同 下 ， 专门 会见 了 特多 中学生 代表 。,会见 前  人物二 夫人 人物一 卡莫 纳 总统 夫妇 陪同  专门 会见 特多 中学生 代表,1
TRAIN_SENT_ID_263250,,胡亥,秦始皇,秦始皇 死后 ， 他 的 小儿子 胡亥 继位 ， 称为 二世 。,人物二 死后  小儿子 人物一 继位  称为 二世,-1
TRAIN_SENT_ID_281896,,赵统,赵云,正史 《 三国志 》 记载 赵云 去世 后 ， 赵统 袭爵 永昌 亭 侯 ， 官至 虎贲 中郎督 ， 加 行 领军 。,正史  三国志  记载 人物二 去世  人物一 袭爵 永昌 亭 侯  官至 虎贲 中郎督  加 行 领军,-1
TRAIN_SENT_ID_285205,,薛勇,薛丁山,薛丁山 二 子 薛勇 虽 不 在 京城 ， 但 很快 也 被 押解 至 京城 长安 。,人物二 二 子 人物一 京城  很快 押解 京城 长安,-1
TRAIN_SENT_ID_263308,,胡亥,秦始皇,晚年 的 秦始皇 将 少子 胡亥 的 教育 委托 于 他 ， 正是 看中 他 文字 、 书法 和 法学 造诣 的 精湛 。,晚年 人物二 少子 人物一 教育 委托  看中 文字  书法 法学 造诣 精湛,-1
TRAIN_SENT_ID_264281,,贾环,赵姨娘,所以 ， 生 下 贾环 ， 恰恰 成为 赵姨娘 更 不幸 的 开始 ， 赵姨娘 生下 的 不仅仅 是 自己 下 半辈子 的 依靠 ， 也 是 引爆 王夫人 仇恨 的 炸弹 。,生 人物一  恰恰 成为 人物二 更 不幸  人物二 生下 不仅仅 半辈子 依靠  引爆 王夫人 仇恨 炸弹,-1
TRAIN_SENT_ID_282599,,刘衍,刘嚣,楚孝王 刘嚣 子嗣 众多 ： 长子 楚怀王 刘文 、 次子 广戚 炀侯 刘勋 、 第三 子楚 思王 刘衍 ( 刘 衍生 楚王 刘纡 ) 、 … …,楚孝王 人物二 子嗣 众多  长子 楚怀王 刘文  次子 广戚 炀侯 刘勋  第三 子楚 思王 人物一  刘 衍生 楚王 刘纡,-1
TRAIN_SENT_ID_281891,,赵统,赵云,正 饮酒 间 ， 忽报 镇南 将军 赵云 长子 赵统 、 次子 赵广 ， 来 见 丞相 。,正 饮酒 间  忽报 镇南 将军 人物二 长子 人物一  次子 赵广  见 丞相,-1
TRAIN_SENT_ID_275419,,董祀,蔡文姬,从此以后 ， 董祀 感念 妻子 之 恩德 ， 对 蔡文姬 重新 评估 ， 夫妻 双双 也 看透 了 世事 ， 溯 洛水 而 上 ， 居 在 风景秀丽 ， 林木 繁茂 的 山麓 。,从此以后  人物一 感念 妻子 恩德  人物二 重新 评估  夫妻 双双 看透 世事  溯 洛水  居 风景秀丽  林木 繁茂 山麓,1
TRAIN_SENT_ID_260388,,穆桂英,杨宗保,9 评书 《 杨家将 》 中说 杨宗保 在 两军 阵前 收 穆桂英 为妻 ， 触犯 了 军纪 ， 宋朝 “ 阵前 收妻 ” 真的 违犯 军法 吗 ?,评书  杨家将  中说 人物二 两军 阵前 收 人物一 为妻  触犯 军纪  宋朝  阵前 收妻  真的 违犯 军法,-1
TRAIN_SENT_ID_286180,,韦芳,韦应物,（ 唐代 名妓 ） : 韦芳 是 韦应物 的 女儿 ， 出身 书香门第 ， 从 小学 得 诗词 书法 功夫 ， 可惜 父母 早逝 。,唐代 名妓   人物一 人物二 女儿  出身 书香门第  小学 诗词 书法 功夫  可惜 父母 早逝,-1
TRAIN_SENT_ID_257002,,李嫣,王菲,大张伟 搭档 天后 王菲 爱女 李嫣 合唱 ， 完美 演绎 爱心 公益 主题 ， 传播 传递 善 与 爱 的 概念 。,大张伟 搭档 天后 人物二 爱女 人物一 合唱  完美 演绎 爱心 公益 主题  传播 传递 善 爱 概念,1
TRAIN_SENT_ID_260073,,齐良迟,齐白石,20 . 齐白石 嫡系 传人 ： 齐子如 、 齐良迟 、 齐可来 、 齐育文 、 齐丽霞 。,人物二 嫡系 传人  齐子如  人物一  齐可来  齐育文  齐丽霞,-1
TRAIN_SENT_ID_282767,,司马翼,司马孚,司马翼 系 司马孚 四子 ， 司马邕 的 弟弟 ， “ 武帝 未受 禅 而 卒 ” ， “ 承为 嗣 ， 封 南宫 县王 。,人物一 系 人物二 四子  司马邕 弟弟   武帝 未受 禅 卒    承为 嗣  封 南宫 县王,-1
TRAIN_SENT_ID_271735,,石厚,石碏,石碏 恨 儿子 大逆不道 ， 设计 让 陈国 陈桓公 除掉 了 州 吁 与 石厚 。 ”,人物二 恨 儿子 大逆不道  设计 陈国 陈桓公 除掉 州 吁 人物一,-1
TRAIN_SENT_ID_283951,,王难姑,胡青牛,战胜 金花婆婆 ， 救出 医仙 胡青牛 之妻 王难姑 ， 他们 邀 我们 有空 到 蝴蝶谷 （ 238 ， 219 ） 做客 。,战胜 金花婆婆  救出 医仙 人物二 之妻 人物一  邀 有空 蝴蝶谷      做客,-1
TRAIN_SENT_ID_279525,,李芳远,李成桂,在 高丽 时代 末期 ， 忠臣 郑梦周 被 李成桂 所指 使 其五子 李芳远 行刺 遇害 在 善 竹桥 上 ， ， 促成 了 朝鲜 李朝 的 兴起 ， 改称 为 “ 善 竹桥 ” 。,高丽 时代 末期  忠臣 郑梦周 人物二 所指 其五子 人物一 行刺 遇害 善 竹桥   促成 朝鲜 李朝 兴起  改称  善 竹桥,-1
TRAIN_SENT_ID_284192,,谭俊彦,狄龙,《 铁甲 无敌 掌门人 》 第 15 集 嘉宾 ： 谭俊彦 （ 狄龙 的 儿子 ） 洪天明 吴嘉龙 郑欣宜 贝 安琪 王子涵,铁甲 无敌 掌门人   集 嘉宾  人物一  人物二 儿子  洪天明 吴嘉龙 郑欣宜 贝 安琪 王子涵,-1
TRAIN_SENT_ID_264790,,张欣,潘石屹,潘石屹 的 太太 、 SOHO 中国 CEO 张欣 发表 微博称 ， “ 王总 恋爱 了 ， 网上 一大堆 为 我 操心 的 网友 ， 让 我 一定 管好 老潘 。,人物二 太太   中国  人物一 发表 微博称   王总 恋爱  网上 一大堆 操心 网友  一定 管好 老潘,1
TRAIN_SENT_ID_259000,,王熙凤,贾琏,简介 ： 王熙凤 是 贾琏 之妻 ， 王夫人 的 内侄女 。,简介  人物一 人物二 之妻  王夫人 内侄女,-1
TRAIN_SENT_ID_263234,,胡亥,秦始皇,秦始皇 还 命令 赵 高教 自己 的 小儿子 胡亥 学习 法律 。,人物二 命令 赵 高教 小儿子 人物一 学习 法律,-1
TRAIN_SENT_ID_286525,,祝彪,祝朝奉,祝氏 三杰 祝彪 : 祝彪 是 《 水浒传 》 中 祝家庄 庄主 祝朝奉 第三 子 ， 持银枪 ， 富家子弟 ， 年轻 勇武 。,祝氏 三杰 人物一  人物一  水浒传  中 祝家庄 庄主 人物二 第三 子  持银枪  富家子弟  年轻 勇武,-1
TRAIN_SENT_ID_268133,,樊梨花,薛丁山,最后 ， 樊梨花 率军出 寒江关 ， 与 薛丁山 的 唐军 汇合 ， 夫妻 一同 进军 西域 。,最后  人物一 率军出 寒江关  人物二 唐军 汇合  夫妻 一同 进军 西域,-1
TRAIN_SENT_ID_284730,,石中玉,石清,次子 石 中坚 被 暗恋 石清 的 梅芳姑 杀害 后 ， 长子 石中玉 因为 闵柔 的 过分 溺爱 而 养成 无法无天 的 性格 。,次子 石 中坚 暗恋 人物二 梅芳姑 杀害  长子 人物一 闵柔 过分 溺爱 养成 无法无天 性格,-1
TRAIN_SENT_ID_258665,,刘禅,刘备,出山 后 ， 诸葛亮 先是 辅佐 刘备 开创 基业 ； 刘备 死后 ， 他 又 匡济 危难 ， 扶佐 后主 刘禅 。,出山  诸葛亮 先是 辅佐 人物二 开创 基业  人物二 死后  匡济 危难  扶佐 后主 人物一,-1
TRAIN_SENT_ID_277624,,王凝之,王羲之,王凝之 ， 字 叔平 ， 大 书法家 王羲之 的 次子 ， 王献之 的 兄弟 ， 善 草书 、 隶书 。,人物一  字 叔平  书法家 人物二 次子  王献之 兄弟  善 草书  隶书,-1
TRAIN_SENT_ID_278480,,鄂伦岱,佟国纲,清史 列传 上 这样 记载 : 个人 履历 : 鄂伦岱 ， 佟佳氏 ， 满洲 镶黄旗 人 ， 一等 公 佟国纲 长子 。,清史 列传 记载  个人 履历  人物一  佟佳氏  满洲 镶黄旗  一等 公 人物二 长子,-1
TRAIN_SENT_ID_273078,,杨铁心,包惜弱,将 死 之际 ， 得 心慈 无比 的 杨铁心 之妻 包惜弱 所救 ， 完颜洪烈 对 包惜弱 一见倾心 ， 不能自已 。,死 之际  心慈 无比 人物一 之妻 人物二 所救  完颜洪烈 人物二 一见倾心  不能自已,-1
TRAIN_SENT_ID_263482,,梅葆玖,梅兰芳,梅葆玖 是 京剧 艺术大师 梅兰芳 的 第九个 孩子 ， 梅派 艺术 传人 ， 原 北京京剧院 梅兰芳 京剧团 团长 。,人物一 京剧 艺术大师 人物二 第九个 孩子  梅派 艺术 传人  原 北京京剧院 人物二 京剧团 团长,-1
TRAIN_SENT_ID_256802,,朱军,谭梅,谭梅 人物 生活 : 朱军 老婆,人物二 人物 生活  人物一 老婆,1
TRAIN_SENT_ID_281852,,曹寿,曹襄,大司马 大将军 卫青 是 她 的 亲 舅舅 ， 大司马 骠骑 将军 霍去病 是 她 的 表哥 ， 表兄弟 平阳侯 曹襄 （ 曹寿 与 平阳公主 的 儿子 ） 是 她 的 第一任 丈夫 。,大司马 大将军 卫青 亲 舅舅  大司马 骠骑 将军 霍去病 表哥  表兄弟 平阳侯 人物二  人物一 平阳公主 儿子  第一任 丈夫,-1
TRAIN_SENT_ID_256418,,刘禅,甘夫人,阁楼 四周 彩绘 了 甘夫人 作梦 、 生 阿斗 、 赵云 救 刘禅 等 故事 画面 。,阁楼 四周 彩绘 人物二 作梦  生 阿斗  赵云 救 人物一 故事 画面,-1
TRAIN_SENT_ID_287261,,刘向,刘德,西汉 初期 的 河间 献王 刘德 ， 西汉 末期 的 刘向 、 刘歆 父子 ， 南北朝 时 的 颜之推 等 ， 就 都 很 重视 书籍 的 不同 传 本 。,西汉 初期 河间 献王 人物二  西汉 末期 人物一  刘歆 父子  南北朝 时 颜之推  重视 书籍 不同 传,-1
TRAIN_SENT_ID_261452,,莫绍谦,慕咏飞,其后 十年 ， 莫绍谦 极力 要求 与 慕咏飞 离婚 ， 两人 关系 势同 水火 ， 婚姻 早已 名存实亡 。,其后 十年  人物一 极力 要求 人物二 离婚  两人 关系 势同 水火  婚姻 早已 名存实亡,1
TRAIN_SENT_ID_284747,,庞会,庞德,《 三国志 》 裴注 中言 ， 蜀汉 灭亡 后 ， 庞德 之子 庞会 尽杀 关氏 为父 报仇 ， 关羽 一脉 已断 。,三国志  裴注 中言  蜀汉 灭亡  人物二 之子 人物一 尽杀 关氏 为父 报仇  关羽 一脉 已断,-1
TRAIN_SENT_ID_283773,,李静民,姜昆,为了 参加 黑龙江省 曲艺 调演 ， 兵团 要 组织 曲艺 学习班 ， 师胜杰 幸运地 搭上 了 这 班车 ， 这个 学习班 里 还有 姜昆 和 其 夫人 李静民 。,参加 黑龙江省 曲艺 调演  兵团 组织 曲艺 学习班  师胜杰 幸运地 搭上 班车  学习班 里 人物二 夫人 人物一,1
TRAIN_SENT_ID_267300,,陆毅,鲍蕾,陆毅 的 夫人 鲍蕾 来到 现场 看 他们 拍 了 几分钟 就 感动 到 流泪 。,人物一 夫人 人物二 来到 现场 拍 几分钟 感动 流泪,1
TRAIN_SENT_ID_275103,,朱七七,沈浪,"怜花 公子 劫 新郎 内容简介 : 如果 , 怜花 公子 爱上 了 沈浪 沈浪 却 要 和 朱七七 , 结婚 那么 , 这位 翩翩 浊世 佳 公子 会 怎样 呢 ?",怜花 公子 劫 新郎 内容简介   怜花 公子 爱上 人物二 人物二 人物一  结婚  这位 翩翩 浊世 佳 公子 会,-1
TRAIN_SENT_ID_260501,,严嵩,严世蕃,严嵩 最宠 独子 严世蕃 ， 世蕃 子 以 父贵 ， 随着 其父 日益 位高权重 而 专横跋扈 ， 骄奢淫逸 ， 目空一切 。,人物一 最宠 独子 人物二  世蕃 子 父贵  其父 日益 位高权重 专横跋扈  骄奢淫逸  目空一切,-1
TRAIN_SENT_ID_286782,,孙凭,孙书,孙书 的 儿子 孙凭 ， 做 了 齐国 的 卿 ， 成为 齐国 君主 以下 的 最高 一级 官员 。,人物二 儿子 人物一  做 齐国 卿  成为 齐国 君主 以下 最高 一级 官员,-1
TRAIN_SENT_ID_263294,,胡亥,秦始皇,皮影戏 起源 很早 ， 按 陇东 的 民间传说 ， 秦始皇 的 儿子 胡亥 生 下来 的 时候 ， 整天 啼哭 不止 ， 但 有 一天 ， 他,皮影戏 起源 很早  陇东 民间传说  人物二 儿子 人物一 生 下来  整天 啼哭 不止  一天,-1
TRAIN_SENT_ID_265359,,戚夫人,刘如意,司马迁 写 《 史记 》 时 ， 原来 意义 上 的 赵国 已 不复存在 ， 刘邦 封 自己 与 戚夫人 的 儿子 刘如意 为 赵王 ， 其 封地 就是 邯郸 。,司马迁 写  史记  时  原来 意义 赵国 不复存在  刘邦 封 人物一 儿子 人物二 赵王  封地 邯郸,-1
TRAIN_SENT_ID_284059,,陈辉祖,陈大受,乾隆帝 以 陈辉祖 为 前 协办 大学士 陈大受 之子 ， 命 从宽 改为 斩 监候 ， 秋后 处决 。,乾隆帝 人物一 前 协办 大学士 人物二 之子  命 从宽 改为 斩 监候  秋后 处决,-1
TRAIN_SENT_ID_278035,,李元霸,李渊,李元霸 李渊 之四子 ， 被 炀帝 封 为 赵王 ， 隋朝 第一条 好汉 。,人物一 人物二 之四子  炀帝 封 赵王  隋朝 第一条 好汉,-1
TRAIN_SENT_ID_268076,,樊梨花,薛丁山,主要 剧情 是 ： 樊梨花 不满 父兄 叛国 投奔 西辽 ， 大义灭亲 ， 却 遭夫 薛丁山 认为 她 大逆不道 休妻 。,主要 剧情  人物一 不满 父兄 叛国 投奔 西辽  大义灭亲  遭夫 人物二 认为 大逆不道 休妻,-1
TRAIN_SENT_ID_286554,,钱德月,董建三,王世均 和 洪晓蕾 、 董建三 和 钱德月 两对 夫妻 ， 以前 是 常 结伴 跑 派对 的 好友 。,王世均 洪晓蕾  人物二 人物一 两对 夫妻  以前 常 结伴 跑 派对 好友,1
TRAIN_SENT_ID_258462,,刘禅,刘备,据 考证 ， 刘备 儿子 “ 阿斗 ” 刘禅 的 墓 就 在 这 几座 大汉 皇帝 陵 东南 几里 地外 。,考证  人物二 儿子  阿斗  人物一 墓 几座 大汉 皇帝 陵 东南 几里 地外,-1
TRAIN_SENT_ID_256298,,孙尚香,刘备,孙尚香 在 镇江 甘露寺 招亲 ， 许配给 蜀主 刘备 ， 人称 孙夫人 。,人物一 镇江 甘露寺 招亲  许配给 蜀主 人物二  人称 孙夫人,-1
TRAIN_SENT_ID_287273,,韩综,韩当,"闰 十二月 , 韩当 之子 韩综 率领 部下 投降 魏国 。",闰 十二月  人物二 之子 人物一 率领 部下 投降 魏国,-1
TRAIN_SENT_ID_274594,,薛丁山,薛仁贵,如 《 梁山伯 与 祝英台 》 、 《 曹 按 杀子 救 亲娘 》 、 《 薛仁贵 征东 》 、 《 薛丁山 征西 》 、 《 乾隆 皇下 江南 》 等 。,梁山伯 祝英台    曹 杀子 救 亲娘    人物二 征东    人物一 征西    乾隆 皇下 江南,-1
TRAIN_SENT_ID_271128,,彭丽媛,习近平,立领 礼服 消息 背景 : 习近平 与 夫人 彭丽媛 外访 时 着装,立领 礼服 消息 背景  人物二 夫人 人物一 外访 时 着装,1
TRAIN_SENT_ID_265516,,周萍,周朴园,周萍 ： 28 岁 ， 周朴园 和 侍萍 的 长子 ， 周家 少爷 ， 与 继母 蘩 漪 、 同母异父 的 妹妹 四凤 私通 。,人物一   岁  人物二 侍萍 长子  周家 少爷  继母 蘩 漪  同母异父 妹妹 四凤 私通,-1
TRAIN_SENT_ID_275667,,梁济,梁漱溟,李月庭 梁济 与 《 梁巨川 先生 殉道 碑 》 : 梁济 （ 1858 － 1918 ） 字 巨川 ， 清末 官员 、 学者 ， 广西 桂林人 ， 梁漱溟 之 父 。,李月庭 人物一  梁巨川 先生 殉道 碑   人物一      字 巨川  清末 官员  学者  广西 桂林人  人物二 父,-1
TRAIN_SENT_ID_275993,,贾午,贾充,⑶ 韩寿分香 ： 晋 贾充 有 御赐 异香 ， 其女 贾午 与 韩寿 私通 ， 韩寿 身染 奇香 ， 遂 被 发觉 ， 后 与 贾午 成婚 。,⑶ 韩寿分香  晋 人物二 御赐 异香  其女 人物一 韩寿 私通  韩寿 身染 奇香  遂 发觉  人物一 成婚,-1
TRAIN_SENT_ID_283931,,石金鑫,石顶武,李丕瑞 大中华 佛国 丞相 ， 于 1983 年 辅佐 大中华 佛国 先主 石顶武 之子 石金鑫 复国 登基 ， 石金鑫 称 后主 。,李丕瑞 大中华 佛国 丞相   年 辅佐 大中华 佛国 先主 人物二 之子 人物一 复国 登基  人物一 称 后主,-1
TRAIN_SENT_ID_260852,,贾珍,贾蓉,贾蓉 暴力 教育 : 贾蓉 长期 受到 父亲 贾珍 的 “ 暴力 教育 ” 。,人物二 暴力 教育  人物二 长期 父亲 人物一  暴力 教育,-1
