sent_id,sent_id,entity1,entity2,sent,processed_sent,human
TRAIN_SENT_ID_274009,,白素,卫斯理,能力 : 白素 为 人 心思 细密 、 沉稳 、 温柔 ， 比 卫斯理 更加 有 推理 能力 ， 她 在 《 卫斯理 系列 》 的 读者 们 喜欢 度 甚至 超越 卫斯理 。,能力  人物一 心思 细密  沉稳  温柔  人物二 更加 推理 能力   人物二 系列  读者 喜欢 度 超越 人物二,1
TRAIN_SENT_ID_253523,,祝彪,扈三娘,王英 深夜 潜入 祝家庄 ， 正巧 看到 扈三娘 和 祝彪 在 一起 ， 误以为 扈三娘 是 青楼女子 ， 此后 引发 了 不少 误会 。,王英 深夜 潜入 祝家庄  看到 人物二 人物一 一起  误以为 人物二 青楼女子  此后 引发 不少 误会,1
TRAIN_SENT_ID_262409,,汪精卫,陈璧君,陈璧君 在 信中 表达 了 对 汪精卫 的 关心 和 无比 思恋 之情 。,人物二 信中 表达 人物一 关心 无比 思恋 之情,1
TRAIN_SENT_ID_269796,,李讷,江青,说 到 李讷 18 岁 了 ， 表明 不 可能 与 江青 分手 了 。,说 人物一  岁  表明 可能 人物二 分手,1
TRAIN_SENT_ID_276295,,岳灵珊,林平之,自 令狐冲 在 思过 崖 上 大病 一场 之后 ， 一直 苦苦 痴恋 岳灵珊 ， 而 她 与 林平之 柔情蜜意 ， 一颗 心 却 早已 交给 了 林平之 。,令狐冲 思过 崖 大病 一场 之后  一直 苦苦 痴恋 人物一  人物二 柔情蜜意  一颗 心 早已 交给 人物二,1
TRAIN_SENT_ID_250312,,秦始皇,胡亥,但 他 仍然 惦念 秦室 江山 ， 欲于 尽忠 之前 上书 一封 ， 箴谏 胡亥 纳良 避奸 ， 珍惜 秦始皇 统一大业 。,仍然 惦念 秦室 江山  欲于 尽忠 之前 上书 一封  箴谏 人物二 纳良 避奸  珍惜 人物一 统一大业,1
TRAIN_SENT_ID_263767,,秦始皇,赵姬,安国 继 王位 子楚 立太子 王立群 读 史记 之 秦始皇 生父 之谜 : 不韦 钓奇献 爱妾 赵姬 有身 嫁 异人,安国 继 王位 子楚 立太子 王立群 读 史记 人物一 生父 之谜  不韦 钓奇献 爱妾 人物二 有身 嫁 异人,-1
TRAIN_SENT_ID_285462,,聂风,聂人王,火麒麟 将 聂人王 拖入 凌云 窟 ， 断帅 紧追 而入 ， 聂风 断帅 随雪饮 一同 落入 江涛 。,火麒麟 人物二 拖入 凌云 窟  断帅 紧追 而入  人物一 断帅 随雪饮 一同 落入 江涛,1
TRAIN_SENT_ID_284242,,宁安公主,李承恩,复清 厂卫 罗织 之狱 ， 宁安公主 子 李承恩 ， 擅用 龙袍 龙盒 问斩 。,复清 厂卫 罗织 之狱  人物一 子 人物二  擅用 龙袍 龙盒 问斩,-1
TRAIN_SENT_ID_283733,,刘德成,刘铁男,其中 包括 对方 为 刘德成 购买 的 北京 市郊 别墅 、 保时捷 轿车 ， 为 刘铁男 装修 房屋 等 。,包括 人物一 购买 北京 市郊 别墅  保时捷 轿车  人物二 装修 房屋,1
TRAIN_SENT_ID_258363,,张兆和,沈从文,第八 封 沈从文 致 张兆和 （ 1934.1 . 14 ）,第八 封 人物二 人物一,-1
TRAIN_SENT_ID_284799,,王卓,王济,有二子 ， 长子 王尚 早亡 ， 次 子王济 嗣爵 ， 但 王济 也 死 于 王浑 之前 ， 于是 以庶 长孙 王卓 嗣爵 。,有二子  长子 王尚 早亡  次 子人物二 嗣爵  人物二 死 王浑 之前  以庶 长孙 人物一 嗣爵,-1
TRAIN_SENT_ID_263462,,梅葆玖,梅兰芳,2011 年 ， 沈阳 师范大学 在 梅葆玖 先生 的 支持 下 ， 成立 了 梅兰芳 艺术 研究所 。,年  沈阳 师范大学 人物一 先生 支持  成立 人物二 艺术 研究所,1
TRAIN_SENT_ID_283258,,王大治,戴露,微博 认证 为 某 宣传 公司 经理 的 “ 欣怡 Leafly ” ， 转发 内地 词人 吴向飞 的 微博 ， 称 其 是 在 谴责 王大治 ， 声援 自己 的 “ 发小 ” 戴露 。,微博 认证 宣传 公司 经理  欣怡    转发 内地 词人 吴向飞 微博  称 谴责 人物一  声援  发小  人物二,1
TRAIN_SENT_ID_261555,,关兴,关羽,历史 上 ， 关羽 就 关平 、 关兴 两个 儿子 。,历史  人物二 关平  人物一 两个 儿子,-1
TRAIN_SENT_ID_267463,,成安公主,东光公主,成安公主 《 全唐文 · 卷 二十二 》 : ○ 封 东光公主 制,人物一  全唐文  卷 二十二   ○ 封 人物二 制,-1
TRAIN_SENT_ID_267495,,宋霭龄,孔祥熙,宋霭龄 一遍 又 一遍 地向 美国 朋友 解释 ， 自己 的 财产 都 是 孔祥熙 步人 政界 以前 ， 在 山西 老家 经商 积攒 下来 的 。,人物一 一遍 一遍 地向 美国 朋友 解释  财产 人物二 步人 政界 以前  山西 老家 经商 积攒 下来,1
TRAIN_SENT_ID_256807,,朱军,谭梅,法餐 的 制作 方面 朱军 完全 是 外行 ， 洗 古董 盘子 也 让 谭梅 提心吊胆 。,法餐 制作 方面 人物一 完全 外行  洗 古董 盘子 人物二 提心吊胆,1
TRAIN_SENT_ID_283127,,李英宰,韩智恩,韩智恩 角色 经历 : 有 一天 ， 大 明星 李英宰 ( Rain ) 突然 拖 着 搬家 行李 闯进 了 她 的 家门 。,人物二 角色 经历  一天  明星 人物一    突然 拖 搬家 行李 闯进 家门,1
TRAIN_SENT_ID_271362,,何泽慧,钱三强,受 家风 影 钱三强 （ 右 ） 和 何泽慧 （ 左 ） 响 ， 钱三强 从小 博览群书 ， 兴趣 广泛 。,受 家风 影 人物二  右  人物一  左  响  人物二 从小 博览群书  兴趣 广泛,-1
TRAIN_SENT_ID_277338,,李萍,郭靖,李萍 终于 逃出 ， 在 沙丘 雪地 上生 下 郭靖 。,人物一 终于 逃出  沙丘 雪地 上生 人物二,1
TRAIN_SENT_ID_266301,,季平子,季桓子,鲁定公 在位 的 第五年 ， 夏天 ， 季平子 去世 ， 季桓子 继位 。,鲁定公 在位 第五年  夏天  人物一 去世  人物二 继位,-1
TRAIN_SENT_ID_284689,,丁芯,赵宝刚,丁芯 生子 : 2003 年 ， 48 岁 的 赵宝刚 中年 得子 ， 喜悦之情 自 不必 表 。,人物一 生子   年   岁 人物二 中年 得子  喜悦之情 不必 表,-1
TRAIN_SENT_ID_255841,,蒋介石,宋美龄,蒋介石 见 宋美龄 不 点头 ， 就 令 麾下 人员 继续 寻找 。,人物一 见 人物二 点头  令 麾下 人员 继续 寻找,1
TRAIN_SENT_ID_283843,,连丽如,连阔如,本书 由 其 女 连丽如 根据 20 世纪 30 年代 连载 于 《 立言 画刊 》 上 的 连阔如 口述 本 《 东汉 》 修订 整理 。,本书 女 人物一  世纪  年代 连载  立言 画刊  人物二 口述  东汉  修订 整理,-1
TRAIN_SENT_ID_269074,,刘德华,朱丽倩,上 世纪 80 年代 末 ， 刘德华 以 香港 明星 足球队 前往 吉隆坡 ， 经 朋友 介绍 和 朱丽倩 认识 。,世纪  年代 末  人物一 香港 明星 足球队 前往 吉隆坡  朋友 介绍 人物二 认识,1
TRAIN_SENT_ID_267225,,吴卓林,吴绮莉,吴卓林 ， 香港艺人 成龙 与 吴绮莉 的 非婚生 女儿 。,人物一  香港艺人 成龙 人物二 非婚生 女儿,-1
TRAIN_SENT_ID_273207,,秦香莲,陈世美,有时 ， 就 连 陈世美 也 得 随着 唱 几句 西皮 原板 ， 秦香莲 也 要 跟着 唱 几句 京剧 散板 。,人物二 唱 几句 西皮 原板  人物一 跟着 唱 几句 京剧 散板,1
TRAIN_SENT_ID_284768,,陈掌,卫少儿,当卫 皇后 尊宠时 ， 陈掌 担任 詹事 一职 ， 娶 卫少儿 为妻 。,当卫 皇后 尊宠时  人物一 担任 詹事 一职  娶 人物二 为妻,-1
TRAIN_SENT_ID_260458,,严嵩,严世蕃,严嵩 出面 力挺梨儿 ， 严世蕃 大怒 ， 决心 除掉 梨儿 。,人物一 出面 力挺梨儿  人物二 大怒  决心 除掉 梨儿,1
TRAIN_SENT_ID_281736,,李青萝,李秋水,另外 ， 丁春秋 与 李秋水 曾带 李青萝 在 苏州 生活 ， 并 将 琅 缳 福地 的 藏书 搬 到 苏州 ， 这才 造就 了 王语嫣 的 武学 知识 。,丁春秋 人物二 曾带 人物一 苏州 生活  琅 缳 福地 藏书 搬 苏州  这才 造就 王语嫣 武学 知识,1
TRAIN_SENT_ID_272182,,马小玲,况天佑,况天佑 ， 马小玲 ： 不能 同 生 ， 只愿 同死 ， 千秋万世 ， 至死不渝 。,人物二  人物一  不能 生  只愿 同死  千秋万世  至死不渝,-1
TRAIN_SENT_ID_274800,,丁玲,胡也频,最终 ， 冯雪峰 离开 了 杭州 ， 胡也频 与 丁玲 就 和好如初 了 。,最终  冯雪峰 离开 杭州  人物二 人物一 和好如初,1
TRAIN_SENT_ID_270833,,石之轩,石青璇,後 来 石之轩 遇到 慈航静 斋碧秀心 ， 两人 一见倾心 ， 生下 一女 ， 也 是 当代 箫艺 大家 石青璇 。,後 人物一 遇到 慈航静 斋碧秀心  两人 一见倾心  生下 一女  当代 箫艺 人物二,1
TRAIN_SENT_ID_262660,,况天佑,马小玲,喜欢 况天佑 ， 但是 由于 况天佑 僵尸 身份 原因 ， 不 愿意 与 正常 人类 交往 ， 反而 和 天师 马小玲 走近 。,喜欢 人物一  人物一 僵尸 身份 原因  愿意 正常 人类 交往  天师 人物二 走近,1
TRAIN_SENT_ID_282064,,李度仑,李昌镐,刚 开始 交往 时 ， 李度仑 还 叫 李昌镐 “ 老师 ” ， 2009 年初 才 改口 叫 大 自己 11 岁 的 李昌镐 “ 哥哥 ” 。,刚 交往 时  人物一 人物二  老师    年初 改口  岁 人物二  哥哥,1
TRAIN_SENT_ID_272338,,金正恩,金正日,这是 金正恩 上台 后 第二次 担任 治丧 委员会 委员长 ， 第一次 是 在 金正日 逝世 的 时候 。,这是 人物一 上台 第二次 担任 治丧 委员会 委员长  第一次 人物二 逝世,-1
TRAIN_SENT_ID_272221,,金正恩,金正日,而 这 一切 的 最高 效忠 对象 ， 则 是 朝鲜 人民 的 “ 伟大 领导者 ” 金正日 ， 现在 则 是 金正恩 。,最高 效忠 对象  朝鲜 人民  伟大 领导者  人物二  现在 人物一,-1
TRAIN_SENT_ID_282729,,霍思纬,霍震寰,霍思纬 ， 霍英东 长房 孙女 ， 霍震寰 和 陈琪琪 的 女儿 。,人物一  霍英东 长房 孙女  人物二 陈琪琪 女儿,-1
TRAIN_SENT_ID_267233,,吴卓林,吴绮莉,吴卓林 ， 香港艺人 成龙 与 吴绮莉 的 非婚生 女儿 ， 绰号 小龙女 。,人物一  香港艺人 成龙 人物二 非婚生 女儿  绰号 小龙女,-1
TRAIN_SENT_ID_279374,,杨健侯,杨露禅,杨式 寇家 太极拳 ， 为 杨露禅 长孙 杨兆林 所 传 ， 三 先生 杨健侯 定式 的 杨式 老架 。,杨式 寇家 太极拳  人物二 长孙 杨兆林 传  三 先生 人物一 定式 杨式 老架,-1
TRAIN_SENT_ID_283883,,王小平,郑晓龙,因为 工作 关系 ， 郑晓龙 和 王小平 的 接触 越来越 多 。,工作 关系  人物二 人物一 接触 越来越,1
TRAIN_SENT_ID_259154,,刘备,刘禅,如果 主公 是 刘备 、 刘禅 ， 则 更 能 发挥 丁奉 的 实力 。,主公 人物一  人物二  更 发挥 丁奉 实力,1
TRAIN_SENT_ID_253543,,施南生,徐克,在 全场 热烈 掌声 中 ， 徐克 和 施南生 从 颁奖 嘉宾 、 著名演员 林青霞 手中 捧 走 “ 亚洲 电影 杰出贡献 大奖 ” 。,全场 热烈 掌声 中  人物二 人物一 颁奖 嘉宾  著名演员 林青霞 手中 捧 走  亚洲 电影 杰出贡献 大奖,1
TRAIN_SENT_ID_258758,,刘禅,刘备,刘备 的 正妻 ， 刘禅 的 生母 。,人物二 正妻  人物一 生母,-1
TRAIN_SENT_ID_286719,,王惠风,王衍,王惠风 姐妹 : 王景 风 ， 王衍 长女 ， 长相 甚美 ， 嫁 贾充 外孙 贾谧 。,人物一 姐妹  王景 风  人物二 长女  长相 甚美  嫁 贾充 外孙 贾谧,-1
TRAIN_SENT_ID_272179,,马小玲,况天佑,在 他 身边 聚集 了 很多 能力 很强 的 僵尸 ， 并 来到 香港 与 况天佑 马小玲 展开 战斗 。,身边 聚集 很多 能力 很强 僵尸  来到 香港 人物二 人物一 展开 战斗,1
TRAIN_SENT_ID_254042,,朱芳雨,胡美,胡美 只能 等到 朱芳雨 回到 东莞 俱乐部 打球 时 ， 才能 抽时间 去 探望 他 。,人物二 只能 人物一 回到 东莞 俱乐部 打球 时  抽时间 探望,1
TRAIN_SENT_ID_278510,,李秀文,叶挺,叶挺 的 爱人 李秀文 和 小儿子 保姆 的 遗体 很 不 完整 ， 上 下身 都 已 分离 不 在 一处 了 。,人物二 爱人 人物一 小儿子 保姆 遗体 完整  下身 分离 一处,-1
TRAIN_SENT_ID_270831,,石之轩,石青璇,後 来 石之轩 遇到 「 慈航静 斋 」 碧秀心 ， 两人 一见倾心 ， 生下 一女 ， 也 是 当代 箫艺 大家 石青璇 。,後 人物一 遇到  慈航静 斋  碧秀心  两人 一见倾心  生下 一女  当代 箫艺 人物二,1
TRAIN_SENT_ID_276271,,西门吹雪,孙秀青,可惜 ， 西门吹雪 只爱过 孙秀青 ， 试验 次数 太 少 ， 不 具有 普遍性 ， 不能 作为 实验 结论 。,可惜  人物一 只爱过 人物二  试验 次数 太 少  具有 普遍性  不能 实验 结论,1
TRAIN_SENT_ID_252348,,文姜,鲁桓公,刘向 《 列女 传 》 ： “ 文姜 淫乱 ， 配 鲁桓公 ， 与 俱 归齐 ， 齐襄 淫通 ， 俾厥 彭生 ， 摧干拉胸 ， 维女 为 乱 ， 卒 成祸 凶 。 ”,刘向  列女 传    人物一 淫乱  配 人物二  俱  齐襄 淫通  俾厥 彭生  摧干拉胸  维女 乱  卒 成祸 凶,-1
TRAIN_SENT_ID_267412,,许志安,郑秀文,郭启华 是 东亚 唱片 顾问 兼 许志安 和 郑秀文 、 人山人海 旗下 at17 、 pixeltoy 、 黄靖 等 歌手 音乐 人 事务 。,郭启华 东亚 唱片 顾问 兼 人物一 人物二  人山人海 旗下     黄靖 歌手 音乐 事务,1
TRAIN_SENT_ID_277779,,晋陵公主,谢混,晋陵公主 和 谢混 只有 两个 女儿 ， 主要 在于 这俩 人 的 命 实在 太衰 。,人物一 人物二 两个 女儿  主要 这俩 命 实在 太衰,-1
TRAIN_SENT_ID_278368,,周韵,姜文,有 媒体 曾经 爆料 说 ， 在 周韵 面前 ， 姜文 性格 平和 、 温顺 ， 有 星相 师 分析 说 ， 周韵 让 姜文 找到 了 成熟 男人 的 自信 。,媒体 曾经 爆料 说  人物一 面前  人物二 性格 平和  温顺  星相 师 分析 说  人物一 人物二 找到 成熟 男人 自信,1
TRAIN_SENT_ID_258001,,黄睿靓,陈致中,而 分批 汇出 的 时间 点 ， 就 从 2006 年底 开始 ， 这 正是 陈致中 突然 只身 飞 黄睿靓 往 美国 没多久 后 的 事 。,分批 汇出 时间 点   年底  人物二 突然 只身 飞 人物一 美国 没多久 事,1
TRAIN_SENT_ID_261735,,苗人凤,苗若兰,苗人凤 带 幼女 苗若兰 一路 追至 商家堡 ， 田归农 却 被 福康安 救 下 。,人物一 带 幼女 人物二 一路 追至 商家堡  田归农 福康安 救,1
TRAIN_SENT_ID_279160,,赵薇,黄有龙,照片 中 黄有龙 笑 得 憨厚 ， 身着 吊带裙 的 赵薇 则 显得 温婉 贤淑 。,照片 中 人物二 笑 憨厚  身着 吊带裙 人物一 显得 温婉 贤淑,1
TRAIN_SENT_ID_251291,,廖仲恺,何香凝,廖仲恺 在 早稻田大学 预科 政治 科 学习 ， 何香凝 则 就读于 东京 目白 女子 大学 。,人物一 早稻田大学 预科 政治 科 学习  人物二 就读于 东京 目白 女子 大学,1
TRAIN_SENT_ID_258295,,陈建斌,蒋勤勤,歌曲 《 可爱 的 家 》 演唱 ： 陈建斌 蒋勤勤,歌曲  可爱 家  演唱  人物一 人物二,1
TRAIN_SENT_ID_261989,,王明华,梅兰芳,梅兰芳 和 福芝芳 一面 派 人 赶往 天津 ， 一面 为 安葬 王明华 选购 墓地 。,人物二 福芝芳 一面 派 赶往 天津  一面 安葬 人物一 选购 墓地,1
TRAIN_SENT_ID_251210,,廖仲恺,何香凝,何香凝 《 回忆 廖仲恺 》 ： “ 袁世凯 明天 就要 到处 捕人 了 ， 名单 中有 你 的 名字 ， 你 还是 马上 走避 一下 好,人物二  回忆 人物一    袁世凯 明天 到处 捕人  名单 中有 名字  马上 走避 一下,1
TRAIN_SENT_ID_283840,,连丽如,连阔如,本书 分 三册 ， 连阔如 传 本 ， 连丽如 口述 ， 李滨声 手绘 插图 。,本书 分 三册  人物二 传  人物一 口述  李滨声 手绘 插图,-1
TRAIN_SENT_ID_267264,,陆毅,鲍蕾,周洁 颖 作品简介 : 2015 年 中国中央电视台 春节 联欢晚会 表演 歌曲 陆毅 、 鲍蕾 、 陆雨 萱 《 幸福 家家 有 》 作词,周洁 颖 作品简介   年 中国中央电视台 春节 联欢晚会 表演 歌曲 人物一  人物二  陆雨 萱  幸福 家家  作词,1
TRAIN_SENT_ID_264979,,刘星,刘梅,刘梅 好不容易 说服 自己 ， 为 刘星 采购 了 大批 烹饪 书籍 ， 还 买来 很多 材料 ， 准备 好好 培养 刘星 当 一名 大厨 。,人物二 好不容易 说服  人物一 采购 大批 烹饪 书籍  买来 很多 材料  准备 好好 培养 人物一 一名 大厨,1
TRAIN_SENT_ID_271320,,何泽慧,钱三强,与 钱三强 结婚 后 ， 已 在 德国 做过 两年 核物理 研究 的 何泽慧 顺利 进入 巴黎大学 居里 实验室 ， 与 钱三强 成为 同事 。,人物二 结婚  德国 做过 两年 核物理 研究 人物一 顺利 进入 巴黎大学 居里 实验室  人物二 成为 同事,1
TRAIN_SENT_ID_279576,,马丽娟,赵本山,正 准备 回 赤峰 探亲 的 马丽娟 ， 听说 赵本山 车祸 重伤 。,正 准备 回 赤峰 探亲 人物一  听说 人物二 车祸 重伤,1
TRAIN_SENT_ID_278184,,赵姨娘,贾政,王夫人 与 丈夫 的 矛盾 ， 是 贾政 往往 听信 赵姨娘 的 谗言 而 不利于 嫡党 。,王夫人 丈夫 矛盾  人物二 往往 听信 人物一 谗言 不利于 嫡党,1
TRAIN_SENT_ID_256755,,邵昕,黄玉婷,黄玉婷 事件 : 日前 邵昕 召开 记者会 ， 会上 驳斥 前妻 婷婷 拿 孩子 来 炒作 ， 直言 这种 行为 很 可耻 。,人物二 事件  日前 人物一 召开 记者会  会上 驳斥 前妻 婷婷 孩子 炒作  直言 这种 行为 可耻,1
TRAIN_SENT_ID_277371,,樊姬,楚庄王,所以 ， 樊姬 就 多次 去 劝阻 他 ， 而 楚庄王 始终 不 听 。,人物一 多次 劝阻  人物二 始终 听,1
TRAIN_SENT_ID_271163,,李治,唐太宗李世民,前石 为序 ， 全称 《 大 唐三藏 圣教序 》 ， 唐太宗李世民 撰文 ； 后 石为 记 ， 全称 《 大唐 皇帝 述 三藏 圣教 记 》 ， 唐高宗 李治 撰文 。,前石 为序  全称  唐三藏 圣教序   人物二 撰文  石为 记  全称  大唐 皇帝 述 三藏 圣教 记   唐高宗 人物一 撰文,-1
TRAIN_SENT_ID_249373,,后稷,姜嫄,姜嫄 古墓 位于 武功 镇 华山 之巅 ， 姜嫄 生 “ 后稷 ” 名 “ 弃 ” 。,人物二 古墓 位于 武功 镇 华山 之巅  人物二 生  人物一  名  弃,-1
TRAIN_SENT_ID_265315,,贾琏,贾赦,当下 贾母 进入 里面 ， 早有 贾赦 贾琏 率领 族 中人 哭 着 迎 了 出来 。,当下 贾母 进入 里面  早有 人物二 人物一 率领 族 中人 哭 迎,1
TRAIN_SENT_ID_260427,,严嵩,严世蕃,严嵩 柄政 时 ， 朝野上下 流传 着 “ 大 丞相 ” 、 “ 小 丞相 ” 的 称呼 ， “ 大 丞相 ” 指 的 是 严嵩 ， “ 小 丞相 ” 指 的 就是 严嵩 独子 — — 严世蕃 。,人物一 柄政 时  朝野上下 流传  丞相    丞相  称呼   丞相  指 人物一   丞相  指 人物一 独子   人物二,-1
TRAIN_SENT_ID_258723,,刘禅,刘备,雷杀 可以 响应 【 南蛮 入侵 】 ， 【 决斗 】 ， 也 可以 响应 刘备 或 刘禅 的 【 激将 】 等 。,雷杀 响应  南蛮 入侵    决斗   响应 人物二 人物一  激将,-1
TRAIN_SENT_ID_274481,,潘汉年,董慧,为了 研究 病因 ， 经 董慧 同意 ， 医院 对 潘汉年 的 遗体 进行 解剖 ， 结果 发现 他 的 腹腔 与 胃部 全都 是 瘀血 ， 而 肝脏 烂 得 像 豆腐渣 一样 。,研究 病因  人物二 同意  医院 人物一 遗体 进行 解剖  发现 腹腔 胃部 全都 瘀血  肝脏 烂 豆腐渣,1
TRAIN_SENT_ID_278463,,胡善祥,朱瞻基,宣宗 朱瞻基 皇后 胡善祥,宣宗 人物二 皇后 人物一,-1
TRAIN_SENT_ID_284305,,张宏震,张静,张子嫣 ， 出品人 张宏震 和 制片人 张静 的 女儿 。,张子嫣  出品人 人物一 制片人 人物二 女儿,-1
TRAIN_SENT_ID_283836,,李理美,李从珂,李理美 简介 : 李理美 ， 后 唐末 帝 李从珂 第二 子 ， 清泰 三年 （ 即 公元 936 年 ） 封 雍王 。,人物一 简介  人物一  唐末 帝 人物二 第二 子  清泰 三年  公元  年  封 雍王,-1
TRAIN_SENT_ID_265376,,戚夫人,刘如意,性 懦弱 ， 刘邦 晚年 拟以 戚夫人 子 刘如意 代之 ， 因 大臣 反对 而 未遂 。,性 懦弱  刘邦 晚年 拟以 人物一 子 人物二 代之  大臣 反对 未遂,-1
TRAIN_SENT_ID_278287,,王珂,刘涛,就 在 刘涛 生产 当天 ， 王珂 突然 倒 在 地上 不 醒 人事 ， 甚至 口吐白沫 四肢 抽搐 ， 并且 失禁 。,人物二 生产 当天  人物一 突然 倒 地上 醒 人事  口吐白沫 四肢 抽搐  失禁,1
TRAIN_SENT_ID_281417,,黄万里,黄炎培,黄万里 黄炎培 三子 ， 我国 著名 水利学家 。,人物一 人物二 三子  我国 著名 水利学家,-1
TRAIN_SENT_ID_252314,,文姜,鲁桓公,早 在 为 太子 时 ， 就 与 妹妹 文姜 私通 ， 后 文姜 嫁 与 鲁桓公 。,早 太子 时  妹妹 人物一 私通  人物一 嫁 人物二,-1
TRAIN_SENT_ID_255118,,鲁元公主,张敖,"盈嫣 风华 内容简介 : 她 是 惠帝 的 姐姐 鲁元公主 和 宣平侯 张敖 的 女儿 , 即惠帝 刘盈 的 外甥女 , 惠帝 是 她 的 舅舅 。",盈嫣 风华 内容简介  惠帝 姐姐 人物一 宣平侯 人物二 女儿  即惠帝 刘盈 外甥女  惠帝 舅舅,-1
TRAIN_SENT_ID_284154,,公孙恭,公孙度,公孙恭 之 祖父 ， 与 公孙度 一起 移居 玄菟 。,人物一 祖父  人物二 一起 移居 玄菟,-1
TRAIN_SENT_ID_278720,,叶一茜,田亮,6 、 《 小小的 美好 》 演唱 ： 夏 克立 、 黄嘉千 、 夏天 、 田亮 、 叶一茜 、 田雨 橙,小小的 美好  演唱  夏 克立  黄嘉千  夏天  人物二  人物一  田雨 橙,1
TRAIN_SENT_ID_285282,,广德公主,于琮,四月 ， 唐宣宗 任命 于琮 为 左 拾遗 、 内 供奉 ， 并 将 广德公主 下嫁 。,四月  唐宣宗 任命 人物二 左 拾遗  供奉  人物一 下嫁,-1
TRAIN_SENT_ID_278735,,尤氏,贾蓉,尤氏 借口 胃病 复发 不 出面 ， 贾蓉 也 不 显得 悲痛 ， 这些 不 正常 表现 都 是 “ 情之 变态 ” ， “ 情感 而 生情 ” 。,人物一 借口 胃病 复发 出面  人物二 显得 悲痛  正常 表现  情之 变态    情感 生情,1
TRAIN_SENT_ID_271639,,毛岸青,毛泽东,12 月 山水画 《 万古常青 》 入选 纪念 毛泽东 诞辰 110 周年 画展 ， 获 毛岸青 、 邵华 、 毛新宇 签发 的 收藏 证书 。,月 山水画  万古常青  入选 纪念 人物二 诞辰  周年 画展  获 人物一  邵华  毛新宇 签发 收藏 证书,1
TRAIN_SENT_ID_272327,,金正恩,金正日,金正日 （ 1997 年 10 月 － 2011 年 12 月 ， 任内 逝世 ） 领导人 中央委员会 第一书记 : 金正恩 （ 2012 年 劳动 党代表会议 选举 ）,人物二   年  月   年  月  任内 逝世  领导人 中央委员会 第一书记  人物一   年 劳动 党代表会议 选举,1
TRAIN_SENT_ID_274812,,丁玲,胡也频,1928 年 与 胡也频 、 丁玲 先后 编辑 《 红黑 》 杂志 ， 并 参加 新月 社 。,年 人物二  人物一 先后 编辑  红黑  杂志  参加 新月 社,1
TRAIN_SENT_ID_260222,,穆桂英,杨宗保,第五十三回 穆桂英 智 擒 小 将军 孟 伯昌 巧劝 杨宗保,第五十三回 人物一 智 擒 将军 孟 伯昌 巧劝 人物二,-1
TRAIN_SENT_ID_284085,,李辙,王璐瑶,李辙 真诚地 看着 王璐瑶 ， 请 你 相信 我 ， 我 真的 是 个 好人 ！,人物一 真诚地 看着 人物二  请 相信  真的 好人,1
TRAIN_SENT_ID_278875,,顾长卫,蒋雯丽,原本 蒋雯丽 打算 演完 《 大宅门 》 之后 ， 就 和 顾长卫 生个 孩子 。,原本 人物二 打算 演完  大宅门  之后  人物一 生个 孩子,1
TRAIN_SENT_ID_254153,,霍启刚,郭晶晶,2012 年 7 月 ： 朱玲玲 首次 确认 郭晶晶 与 霍启刚 婚期 在 11 月,年  月  朱玲玲 首次 确认 人物二 人物一 婚期  月,1
TRAIN_SENT_ID_260441,,严嵩,严世蕃,严世蕃 、 罗龙文 被 处死 ， 籍没 严嵩 家产 。,人物二  罗龙文 处死  籍没 人物一 家产,1
TRAIN_SENT_ID_257689,,许晋亨,何超琼,他 的 前 绯闻 女友 包括 有 张柏芝 、 许晋亨 的 前妻 何超琼 、 美女 模特 演员 MaggieQ 等 。,前 绯闻 女友 包括 张柏芝  人物一 前妻 人物二  美女 模特 演员,1
TRAIN_SENT_ID_277480,,余鱼同,李沅芷,群雄 决定 进京 ， 余鱼同 独取 水路 ， 被 关东 三魔 和 言伯乾 追杀 ， 幸 被 热恋 他 的 李沅芷 所救 。,群雄 决定 进京  人物一 独取 水路  关东 三魔 言伯乾 追杀  幸 热恋 人物二 所救,1
TRAIN_SENT_ID_254107,,霍启刚,郭晶晶,据知 33 岁 的 霍启刚 与 30 岁 的 郭晶晶 ， 婚后 会 火速 造 人 ， 为 霍家 添丁 。,据知  岁 人物一  岁 人物二  婚后 会 火速 造  霍家 添丁,1
TRAIN_SENT_ID_283016,,孟扶摇,长孙无极,长孙无极 缓缓 抬眼 ， 看着 灯下 泪水 盈盈 的 孟扶摇 。,人物二 缓缓 抬眼  看着 灯下 泪水 盈盈 人物一,1
TRAIN_SENT_ID_285260,,莫雪鸢,周亚夫,莫雪鸢 平安郡主 : 她 死 后 ， 与 周亚夫 冥婚 ， 赐 号 ， 平安郡主 。,人物一 平安郡主  死  人物二 冥婚  赐 号  平安郡主,-1
TRAIN_SENT_ID_277282,,王惠,郭德纲,第二天 ， 郭德纲 茫然 地 坐在 马路边 ， 这时 ， 一个 熟悉 的 身影 走进 了 他 的 视线 ， 那 不是 王惠 吗 ？,第二天  人物二 茫然 坐在 马路边   一个 熟悉 身影 走进 视线  人物一,1
TRAIN_SENT_ID_272519,,韦丛,元稹,知此 诗为 元 和 四年 （ 809 ） 韦丛 归葬 咸阳 之次 日夜 ， 元稹 在 洛阳 所 作 。,知此 诗为 元 四年    人物一 归葬 咸阳 之次 日夜  人物二 洛阳 作,-1
