sent_id,sent_id,entity1,entity2,sent,processed_sent,human
TRAIN_SENT_ID_286720,,王惠风,王衍,而 贾午 及 贾后 皆 不 同意 ， 于是 转而 为 太子 聘 王衍 的 小女 王惠风 。,贾午 贾后 皆 同意  转而 太子 聘 人物二 小女 人物一,-1
TRAIN_SENT_ID_268622,,潘金莲,武大郎,《 水浒传 》 上 的 潘金莲 、 武大郎 的 婚姻 悲剧 ， 发生 在 封建王朝 时代 ， 而 这个 悲剧 却 发生 在 解放后 的 新 中国 。,水浒传  人物一  人物二 婚姻 悲剧  发生 封建王朝 时代  悲剧 发生 解放后 新 中国,-1
TRAIN_SENT_ID_262141,,诸葛尚,诸葛瞻,殿内 供奉 诸葛亮 和 他 儿子 诸葛瞻 、 孙子 诸葛尚 的 贴金 泥塑像 ， 均 高 2 米 多 。,殿内 供奉 诸葛亮 儿子 人物二  孙子 人物一 贴金 泥塑像  均 高  米,-1
TRAIN_SENT_ID_256436,,刘禅,甘夫人,“ 太子 阁 ” 是 当年 刘备 屯兵 新野 时 ， 甘夫人 所住 的 阁楼 ， 因 太子 阿斗 （ 即 蜀 后主 刘禅 ） 在 此 出生 而 得名 “ 太子 阁 ” 。,太子 阁  当年 刘备 屯兵 新野 时  人物二 所住 阁楼  太子 阿斗  蜀 后主 人物一  出生 得名  太子 阁,-1
TRAIN_SENT_ID_283805,,余姚公主,王溥,余姚公主 简介 : 王琳 娶 梁武帝 妹 义兴 长 公主 ， 子 王铨 又 娶 武帝 女 永嘉 公主 ， 铨子 王溥 娶 武帝 孙女 余姚公主 ， 后 两对 夫妻 都 是 舅表 关系 。,人物一 简介  王琳 娶 梁武帝 妹 义兴 长 公主  子 王铨 娶 武帝 女 永嘉 公主  铨子 人物二 娶 武帝 孙女 人物一  两对 夫妻 舅表 关系,-1
TRAIN_SENT_ID_251484,,谢贤,谢霆锋,对路 吗 细路 歌手 简介 : 亚洲 天王 谢霆锋 是 著名 的 歌手 、 演员 ， 父亲 谢贤 ， 母亲 狄波拉 。,对路 细路 歌手 简介  亚洲 天王 人物二 著名 歌手  演员  父亲 人物一  母亲 狄波拉,-1
TRAIN_SENT_ID_257058,,郭芙蓉,吕青橙,2013 年 ， 与 袁咏仪 等 主演 ， 宁财神 编剧 的 电视剧 《 龙门 镖局 》 暑期 卫视 播出 ， 李倩 饰演 吕 秀才 与 郭芙蓉 的 小女儿 吕青橙 。,年  袁咏仪 主演  宁财神 编剧 电视剧  龙门 镖局  暑期 卫视 播出  李倩 饰演 吕 秀才 人物一 小女儿 人物二,-1
TRAIN_SENT_ID_262167,,诸葛尚,诸葛瞻,步入 武侯祠 山门 ， 迎面 是 大拜殿 ， 殿 中 彩塑 诸葛亮 及其 儿子 诸葛瞻 、 孙子 诸葛尚 的 大型 泥塑像 。,步入 武侯祠 山门  迎面 大拜殿  殿 中 彩塑 诸葛亮 儿子 人物二  孙子 人物一 大型 泥塑像,-1
TRAIN_SENT_ID_263311,,胡亥,秦始皇,秦始皇 的 死讯 只有 李斯 、 公子 胡亥 （ 秦始皇 的 小儿子 ） 和 赵高 等 几个 人 知道 。,人物二 死讯 李斯  公子 人物一  人物二 小儿子  赵高 几个 知道,-1
TRAIN_SENT_ID_251479,,谢贤,谢霆锋,想得到 得不到 歌手 简介 : 亚洲 天王 谢霆锋 是 著名 的 歌手 、 演员 ， 父亲 谢贤 ， 母亲 狄波拉 。,想得到 得不到 歌手 简介  亚洲 天王 人物二 著名 歌手  演员  父亲 人物一  母亲 狄波拉,-1
TRAIN_SENT_ID_282454,,韦丛,韦夏卿,然而 贞元 十九年 在 长安 入 秘书 省 任校书 郎后 ， 与 太子 宾客 韦夏卿 之女 韦丛 （ 成 之 ） 结婚 ， 蒲城 女子 遂 被 抛弃 。,贞元 十九年 长安 入 秘书 省 任校书 郎后  太子 宾客 人物二 之女 人物一  成  结婚  蒲城 女子 遂 抛弃,-1
TRAIN_SENT_ID_251482,,谢贤,谢霆锋,亚洲 天王 谢霆锋 是 著名 的 歌手 、 演员 ， 父亲 谢贤 ， 母亲 狄波拉 。,亚洲 天王 人物二 著名 歌手  演员  父亲 人物一  母亲 狄波拉,-1
TRAIN_SENT_ID_251458,,谢贤,谢霆锋,开放日 歌手 简介 : 亚洲 天王 谢霆锋 是 著名 的 歌手 、 演员 ， 父亲 谢贤 ， 母亲 狄波拉 。,开放日 歌手 简介  亚洲 天王 人物二 著名 歌手  演员  父亲 人物一  母亲 狄波拉,-1
TRAIN_SENT_ID_267107,,公子羽,明月心,明月心 昏迷 之前 见到 公子羽 之 面具 ， 心中 终于 知晓 ， 自己 虽然 失去 父母 兄弟 之爱 ， 但 少女 时 许下 的 愿望 却 已经 实现 。,人物二 昏迷 之前 见到 人物一 面具  心中 终于 知晓  失去 父母 兄弟 之爱  少女 时 许下 愿望 已经 实现,-1
TRAIN_SENT_ID_264034,,刘备,孙尚香,东吴 ： 孙策 、 孙权 为 孙坚 之子 ； 孙仁 （ 孙尚香 ） 为 孙坚 之女 、 孙策 与 孙权 之妹 ， 后 嫁 与 刘备 （ 最终 回到 吴国 ） ； 陆抗 为 陆逊之 子 。,东吴  孙策  孙权 孙坚 之子  孙仁  人物二  孙坚 之女  孙策 孙权 之妹  嫁 人物一  最终 回到 吴国   陆抗 陆逊之 子,-1
TRAIN_SENT_ID_262518,,扶苏,秦始皇,他们 秘不 发丧 ， 诈称 受 始皇 诏 ， 立 胡亥 为 太子 ， 并 指责 秦始皇 的 长子 公子 扶苏 不能 辟 地 立功 ， 令 他 自杀 。,秘不 发丧  诈称 受 始皇 诏  立 胡亥 太子  指责 人物二 长子 公子 人物一 不能 辟 立功  令 自杀,-1
TRAIN_SENT_ID_272373,,夏紫薇,夏雨荷,乾隆皇帝 （ 张铁林 饰 ） 东巡时 与 一 女子 夏雨荷 （ 林心 如饰 ） 有 一段 露水 姻缘 ， 并 生下 一个 女儿 夏紫薇 （ 林心 如饰 ） 。,乾隆皇帝  张铁林 饰  东巡时 女子 人物二  林心 如饰  一段 露水 姻缘  生下 一个 女儿 人物一  林心 如饰,-1
TRAIN_SENT_ID_251483,,谢贤,谢霆锋,如果 一 开始 你 爱 上 的 人 是 我 歌手 简介 : 亚洲 天王 谢霆锋 是 著名 的 歌手 、 演员 ， 父亲 谢贤 ， 母亲 狄波拉 。,爱 歌手 简介  亚洲 天王 人物二 著名 歌手  演员  父亲 人物一  母亲 狄波拉,-1
TRAIN_SENT_ID_251466,,谢贤,谢霆锋,旧 伤口 歌手 简介 : 亚洲 天王 谢霆锋 是 著名 的 歌手 、 演员 ， 父亲 谢贤 ， 母亲 狄波拉 。,旧 伤口 歌手 简介  亚洲 天王 人物二 著名 歌手  演员  父亲 人物一  母亲 狄波拉,-1
TRAIN_SENT_ID_251492,,谢贤,谢霆锋,4 歌手 简介 : 亚洲 天王 谢霆锋 是 著名 的 歌手 、 演员 ， 父亲 谢贤 ， 母亲 狄波拉 。,歌手 简介  亚洲 天王 人物二 著名 歌手  演员  父亲 人物一  母亲 狄波拉,-1
TRAIN_SENT_ID_251460,,谢贤,谢霆锋,跨进 世界 的 人 歌手 简介 : 亚洲 天王 谢霆锋 是 著名 的 歌手 、 演员 ， 父亲 谢贤 ， 母亲 狄波拉 。,跨进 世界 歌手 简介  亚洲 天王 人物二 著名 歌手  演员  父亲 人物一  母亲 狄波拉,-1
TRAIN_SENT_ID_266114,,齐姜,申生,太子 申生 ， 其母 是 齐桓公 的 女儿 ， 叫 齐姜 ， 早年 死去 。,太子 人物二  其母 齐桓公 女儿  人物一  早年 死去,-1
TRAIN_SENT_ID_251442,,谢贤,谢霆锋,《 青春 之 最 》 是 亚洲 天王 谢霆锋 演唱 的 ， 著名 的 歌手 、 演员 ， 父亲 谢贤 ， 母亲 狄波拉 。,青春  亚洲 天王 人物二 演唱  著名 歌手  演员  父亲 人物一  母亲 狄波拉,-1
TRAIN_SENT_ID_251449,,谢贤,谢霆锋,邮寄 睡眠 歌手 简介 : 亚洲 天王 谢霆锋 是 著名 的 歌手 、 演员 ， 父亲 谢贤 ， 母亲 狄波拉 。,邮寄 睡眠 歌手 简介  亚洲 天王 人物二 著名 歌手  演员  父亲 人物一  母亲 狄波拉,-1
TRAIN_SENT_ID_268001,,樊梨花,薛丁山,黄日华 饰演 的 薛丁山 ， 与 陈敏儿 所饰 的 樊梨花 在 征西 战场 上 上演 一段段 爱情 、 亲情 、 国仇 、 家恨 故事 ， 值得 一看再看 ！,黄日华 饰演 人物二  陈敏儿 所饰 人物一 征西 战场 上演 一段段 爱情  亲情  国仇  家恨 故事  值得 一看再看,-1
TRAIN_SENT_ID_251468,,谢贤,谢霆锋,从前 以后 歌手 简介 : 亚洲 天王 谢霆锋 是 著名 的 歌手 、 演员 ， 父亲 谢贤 ， 母亲 狄波拉 。,从前 以后 歌手 简介  亚洲 天王 人物二 著名 歌手  演员  父亲 人物一  母亲 狄波拉,-1
TRAIN_SENT_ID_266457,,严世蕃,严嵩,嘉靖 四十一年 ， 得知 嘉靖 帝对 严嵩 父子 的 不法行为 已 有所 闻 ， 于是 就命 御史 邹应龙 参劾 ， 终于 使 严嵩 罢官 ， 其子 严世蕃 谪戍 。,嘉靖 四十一年  得知 嘉靖 帝对 人物二 父子 不法行为 有所 闻  就命 御史 邹应龙 参劾  终于 人物二 罢官  其子 人物一 谪戍,-1
TRAIN_SENT_ID_251485,,谢贤,谢霆锋,欺骗 观众 歌手 简介 : 亚洲 天王 谢霆锋 是 著名 的 歌手 、 演员 ， 父亲 谢贤 ， 母亲 狄波拉 。,欺骗 观众 歌手 简介  亚洲 天王 人物二 著名 歌手  演员  父亲 人物一  母亲 狄波拉,-1
TRAIN_SENT_ID_251474,,谢贤,谢霆锋,青春 之 最 歌手 简介 : 亚洲 天王 谢霆锋 是 著名 的 歌手 、 演员 ， 父亲 谢贤 ， 母亲 狄波拉 。,青春 歌手 简介  亚洲 天王 人物二 著名 歌手  演员  父亲 人物一  母亲 狄波拉,-1
TRAIN_SENT_ID_251441,,谢贤,谢霆锋,歌手 简介 : 亚洲 天王 谢霆锋 是 著名 的 歌手 、 演员 ， 父亲 谢贤 ， 母亲 狄波拉 。,歌手 简介  亚洲 天王 人物二 著名 歌手  演员  父亲 人物一  母亲 狄波拉,-1
TRAIN_SENT_ID_266121,,齐姜,申生,太子 申生 的 母亲 是 齐桓公 之女 ， 名叫 齐姜 ， 很 早就 去世 了 。,太子 人物二 母亲 齐桓公 之女  名叫 人物一  早就 去世,-1
TRAIN_SENT_ID_250948,,霍震霆,朱玲玲,得知 女儿 在 和 香港 富商 的 公子 谈恋爱 ， 朱玲玲 的 母亲 有些 担心 ， 特别 是 知道 霍震霆 已经 32 岁 了 ， 母亲 更 有些 放心不下 。,得知 女儿 香港 富商 公子 谈恋爱  人物二 母亲 担心  特别 知道 人物一 已经  岁  母亲 更 放心不下,-1
TRAIN_SENT_ID_251456,,谢贤,谢霆锋,你 情人 在 哪里 歌手 简介 : 亚洲 天王 谢霆锋 是 著名 的 歌手 、 演员 ， 父亲 谢贤 ， 母亲 狄波拉 。,情人 歌手 简介  亚洲 天王 人物二 著名 歌手  演员  父亲 人物一  母亲 狄波拉,-1
TRAIN_SENT_ID_274553,,薛丁山,薛仁贵,唐军 受阻 ， 薛仁贵 也 被 薛丁山 误伤 射死 ， 万般无奈 之下 ， 薛丁山 三请 樊梨花 ， 二人 正式 结为 夫妻 。,唐军 受阻  人物二 人物一 误伤 射死  万般无奈 之下  人物一 三请 樊梨花  二人 正式 结为 夫妻,-1
TRAIN_SENT_ID_266113,,齐姜,申生,太子 申生 的 母亲 是 齐桓公 的 女儿 ， 叫 齐姜 ， 早就 去世 。,太子 人物二 母亲 齐桓公 女儿  人物一  早就 去世,-1
TRAIN_SENT_ID_286718,,王惠风,王衍,当初 ， 太子 刚废时 ， 太子妃 的 父亲 王衍 上书 请 让 小女儿 与 太子 离婚 ， 太子妃 王惠风 便 号哭 着 回家 ， 路上 的 行人 都 为 之 流涕 。,当初  太子 刚废时  太子妃 父亲 人物二 上书 请 小女儿 太子 离婚  太子妃 人物一 便 号哭 回家  路上 行人 流涕,-1
TRAIN_SENT_ID_282487,,黄宏章,黄艺博,对于 儿子 一夜之间 成为 社会 关注 的 焦点 ， 黄艺博 的 父亲 黄宏章 有点 手足无措 。,儿子 一夜之间 成为 社会 关注 焦点  人物二 父亲 人物一 有点 手足无措,-1
TRAIN_SENT_ID_261094,,胡一刀,胡斐,雪山飞狐 （ 1978 ） 主演 ： 卫子云 （ 饰 胡斐 / 胡一刀 ） 米雪 文雪儿 李通明 白彪 伍卫国 罗乐林,雪山飞狐    主演  卫子云  饰 人物二  人物一  米雪 文雪儿 李通明 白彪 伍卫国 罗乐林,-1
TRAIN_SENT_ID_259155,,刘备,刘禅,【 故事 】 ： 三国 时期 ， 蜀主 刘备 死后 ， 后主 刘禅 继位 ， 把 国内 的 军政 大权 交给 诸葛亮 处理 。,故事   三国 时期  蜀主 人物一 死后  后主 人物二 继位  国内 军政 大权 交给 诸葛亮 处理,-1
TRAIN_SENT_ID_259114,,刘备,刘禅,刘备 死后 ， 诸葛亮 尽忠竭力 辅佐 后主 刘禅 ， 后主 时期 的 政事 ， 无论 巨细 皆 由 诸葛亮 专主 。,人物一 死后  诸葛亮 尽忠竭力 辅佐 后主 人物二  后主 时期 政事  巨细 皆 诸葛亮 专主,-1
TRAIN_SENT_ID_250288,,秦始皇,胡亥,秦始皇 死后 与 赵高 立少子 胡亥 为 二世 皇帝 ， 为 赵高 所忌 ， 腰斩 于市 。,人物一 死后 赵高 立少子 人物二 二世 皇帝  赵高 所忌  腰斩 于市,-1
TRAIN_SENT_ID_259131,,刘备,刘禅,公元 223 年 刘备 死后 ， 后主 刘禅 袭位 ， 诸葛亮 尽心 托孤 ， 被 封为 武乡 候 ， 主持 朝政 。,公元  年 人物一 死后  后主 人物二 袭位  诸葛亮 尽心 托孤  封为 武乡 候  主持 朝政,-1
TRAIN_SENT_ID_259038,,刘备,刘禅,【 故事 】 ： 三国 时期 ， 蜀主 刘备 死后 ， 刘禅 继位 ， 蜀国 的 大小 政事 都,故事   三国 时期  蜀主 人物一 死后  人物二 继位  蜀国 大小 政事,-1
TRAIN_SENT_ID_250208,,秦始皇,胡亥,秦始皇 死后 与 赵高 合谋 立少子 胡亥 为 二世 皇帝 ， 为 赵高 所忌 ， 腰斩 于市 。,人物一 死后 赵高 合谋 立少子 人物二 二世 皇帝  赵高 所忌  腰斩 于市,-1
TRAIN_SENT_ID_263322,,胡亥,秦始皇,后来 ， 秦始皇 死去 了 ， 赵高 联合 李斯 ， 篡改 了 遗诏 ， 让 胡亥 当上 了 皇帝 。,后来  人物二 死去  赵高 联合 李斯  篡改 遗诏  人物一 当上 皇帝,-1
TRAIN_SENT_ID_262450,,扶苏,秦始皇,秦始皇 出游 南方 病死 途中 时 ， 在 赵高 与 李斯 的 帮助 下 ， 杀害 哥哥 扶苏 当 上 秦朝 的 二世 皇帝 。,人物二 出游 南方 病死 途中 时  赵高 李斯 帮助  杀害 哥哥 人物一 秦朝 二世 皇帝,-1
TRAIN_SENT_ID_281432,,万玉枝,高咏,白儿 查看 后 发现 高咏 并未 死 ， 但 身体 已经 土化 ； 万玉枝 似往 东北方 而 去 ， 众人 遂 决定 追 去 弄清 事情 始末 。,白儿 查看 发现 人物二 并未 死  身体 已经 土化  人物一 似往 东北方  众人 遂 决定 追 弄清 事情 始末,-1
TRAIN_SENT_ID_259017,,刘备,刘禅,三国 斗记 · 骏侠 战记 原文 ： 第六节 : 刘备 死后 ， 刘禅 登基 ， 由于 刘禅 统治 黑暗 ， 因此 蜀国 不久 便 衰落 下去 … …,三国 斗记  骏侠 战记 原文  第六节  人物一 死后  人物二 登基  人物二 统治 黑暗  蜀国 不久 便 衰落 下去,-1
TRAIN_SENT_ID_273811,,萧远山,萧峰,萧远山 ， 金庸 武侠小说 《 天龙八部 》 的 主人公 萧峰 之 父 ， 曾 师从 汉人 学武 ， 武功 极强 ， 属 契丹 后族 中人 。,人物一  金庸 武侠小说  天龙八部  主人公 人物二 父  师从 汉人 学武  武功 极强  属 契丹 后族 中人,-1
TRAIN_SENT_ID_259314,,刘备,刘禅,刘备 死后 ， 后主 刘禅 即位 ， 由 诸葛亮 辅政 ， 诸葛亮 仍 采取 联合 的 策略 ， 与 东吴 和 好 ， 恢复 了 吴 蜀 联盟 。,人物一 死后  后主 人物二 即位  诸葛亮 辅政  诸葛亮 采取 联合 策略  东吴  恢复 吴 蜀 联盟,-1
TRAIN_SENT_ID_270920,,贾午,韩寿,晋 贾充 女 贾午 与 韩寿 私通 ， 并 把 皇帝 赐 其父 之外 域 异香 赠寿 。,晋 贾充 女 人物一 人物二 私通  皇帝 赐 其父 之外 域 异香 赠寿,-1
TRAIN_SENT_ID_250176,,秦始皇,胡亥,秦始皇 死后 ， 由 李斯 和 赵高 二人 阴谋 策划 让 胡亥 （ 也 就是 秦二世 ） 当上 了 皇帝 。,人物一 死后  李斯 赵高 二人 阴谋 策划 人物二  秦二世  当上 皇帝,-1
TRAIN_SENT_ID_260361,,穆桂英,杨宗保,公主 在 屋子 里面 正 试穿 结婚 衣服 的 时候 赵飞 气呼呼 的 进来 了 ， 他 告诉 公主 说 以后 就 不要 再 想 杨宗保 了 ， 因为 杨宗保 已经 跟 穆桂英 成亲 了 。,公主 屋子 里面 正 试穿 结婚 衣服 赵飞 气呼呼 进来  告诉 公主 说 以后 不要 想 人物二  人物二 已经 人物一 成亲,-1
TRAIN_SENT_ID_259268,,刘备,刘禅,辅佐 刘 后主 : 刘备 死后 ， 诸葛亮 尽忠竭力 辅佐 后主 刘禅 ， 被 后主 封 为 武乡侯 ， 兼领 益州牧 。,辅佐 刘 后主  人物一 死后  诸葛亮 尽忠竭力 辅佐 后主 人物二  后主 封 武乡侯  兼领 益州牧,-1
TRAIN_SENT_ID_250463,,朱常洵,郑贵妃,朱常洵 是 万历 皇帝 的 儿子 （ 郑贵妃 所 生 ） 、 泰昌 皇帝 的 异母兄弟 、 崇祯 皇帝 的 叔父 。,人物一 万历 皇帝 儿子  人物二 生   泰昌 皇帝 异母兄弟  崇祯 皇帝 叔父,-1
TRAIN_SENT_ID_269317,,陆雪琪,张小凡,在 《 诛 仙 二 》 中 ， 宋大仁 已 成为 大竹 峰 首座 ， 张小凡 在 大竹 峰 当 厨子 ， 张小凡 妻子 陆雪琪 、 儿子 张小鼎 亦 生活 在 大竹 峰 。,诛 仙 二  中  宋大仁 成为 大竹 峰 首座  人物二 大竹 峰 厨子  人物二 妻子 人物一  儿子 张小鼎 生活 大竹 峰,-1
TRAIN_SENT_ID_262429,,扶苏,秦始皇,秦始皇 死后 ， 与 李斯 合谋 ， 伪造 遗诏 ， 逼死 皇 长子 扶苏 自杀 ， 自 任 丞相 ， 把持 朝政 后 又 害死 胡亥 ， 立子 婴为帝 ， 后 被子 婴 诛杀 。,人物二 死后  李斯 合谋  伪造 遗诏  逼死 皇 长子 人物一 自杀  丞相  把持 朝政 害死 胡亥  立子 婴为帝  被子 婴 诛杀,-1
TRAIN_SENT_ID_250210,,秦始皇,胡亥,秦始皇 死后 ， 他 与 赵高 合谋 ， 伪造 遗诏 ， 迫令 始皇 长子 扶苏 和 大将 蒙恬 自杀 ， 立少子 胡亥 为 二世 皇帝 。,人物一 死后  赵高 合谋  伪造 遗诏  迫令 始皇 长子 扶苏 大将 蒙恬 自杀  立少子 人物二 二世 皇帝,-1
TRAIN_SENT_ID_263174,,胡亥,秦始皇,对于 秦始皇 的 死固 ， 一种 观点 认为 秦始皇 死 于 “ 惊恐 劳累 ” ， 还有 一种 观点 是 秦始皇 死亡 背后 有 一双 神秘 的 黑手 ： 那 就是 他 的 儿子 胡亥 。,人物二 死固  一种 观点 认为 人物二 死  惊恐 劳累   一种 观点 人物二 死亡 背后 一双 神秘 黑手  儿子 人物一,-1
TRAIN_SENT_ID_263286,,胡亥,秦始皇,秦始皇 死后 ， 他 与 赵高 合谋 ， 伪造 遗诏 ， 迫令 始皇 长子 扶苏 自杀 ， 立少子 胡亥 为 二世 皇帝 。,人物二 死后  赵高 合谋  伪造 遗诏  迫令 始皇 长子 扶苏 自杀  立少子 人物一 二世 皇帝,-1
TRAIN_SENT_ID_262529,,扶苏,秦始皇,秦始皇 帝 得到 消息 ， 不觉 大怒 ， 屠睢 丧师辱国 ， 奈何 身死 ， 始皇帝 欲 追究 赵佗 救援 不利 之罪 ， 公子 扶苏 和 众人 劝解 ， 始皇帝 遂 作罢 。,人物二 帝 得到 消息  不觉 大怒  屠睢 丧师辱国  奈何 身死  始皇帝 欲 追究 赵佗 救援 不利 之罪  公子 人物一 众人 劝解  始皇帝 遂 作罢,-1
TRAIN_SENT_ID_269711,,鲁元公主,刘邦,2011 年 拍摄 由 著名 的 陈家林 导演 执导 的 大型 历史剧 《 楚汉争 雄 》 ， 饰演 刘邦 的 女儿 （ 鲁元公主 ） 。,年 拍摄 著名 陈家林 导演 执导 大型 历史剧  楚汉争 雄   饰演 人物二 女儿  人物一,-1
TRAIN_SENT_ID_269709,,鲁元公主,刘邦,2011 年 参演 由 著名 的 陈家林 导演 执导 的 大型 历史剧 《 楚汉争 雄 》 饰演 刘邦 的 女儿 （ 鲁元公主 ） 。,年 参演 著名 陈家林 导演 执导 大型 历史剧  楚汉争 雄  饰演 人物二 女儿  人物一,-1
TRAIN_SENT_ID_258575,,刘禅,刘备,刘备 死 ， 刘禅 即位 ， 封 诸葛亮 为 武乡侯 ， 领 益州牧 。,人物二 死  人物一 即位  封 诸葛亮 武乡侯  领 益州牧,-1
TRAIN_SENT_ID_274301,,刘嫖,陈午,陈蟜 家族 成员 : 陈蟜 曾祖 : 陈婴 陈蟜 祖父 : 陈禄 陈蟜 父亲 : 陈午 陈蟜 母亲 : 馆陶 公主 刘嫖 陈蟜 兄弟 : 陈须 陈蟜 姐妹 : 陈阿娇,陈蟜 家族 成员  陈蟜 曾祖  陈婴 陈蟜 祖父  陈禄 陈蟜 父亲  人物二 陈蟜 母亲  馆陶 公主 人物一 陈蟜 兄弟  陈须 陈蟜 姐妹  陈阿娇,-1
TRAIN_SENT_ID_278417,,苗若兰,苗人凤,1977 年 ， 制片方 ： 香港 佳视 ， 主演 ： 卫子云 饰 胡斐 / 胡一刀 ， 白彪 饰 苗人凤 ， 米雪 饰 袁紫衣 ， 李通明 饰 苗若兰,年  制片方  香港 佳视  主演  卫子云 饰 胡斐  胡一刀  白彪 饰 人物二  米雪 饰 袁紫衣  李通明 饰 人物一,-1
TRAIN_SENT_ID_274299,,刘嫖,陈午,陈须 家族 成员 : 陈须 曾祖 : 陈婴 陈须 祖父 : 陈禄 陈须 父亲 : 陈午 陈须 母亲 : 馆陶 公主 刘嫖 陈须 兄弟 : 陈蟜 陈须 姐妹 : 陈阿娇,陈须 家族 成员  陈须 曾祖  陈婴 陈须 祖父  陈禄 陈须 父亲  人物二 陈须 母亲  馆陶 公主 人物一 陈须 兄弟  陈蟜 陈须 姐妹  陈阿娇,-1
TRAIN_SENT_ID_259331,,刘备,刘禅,不 但是 刘禅 ， 还有 鲁 王刘永 ， 刘备 临终前 将 刘永 叫 到 榻 前 ， 吩咐 说 ： “ 吾 亡 之后 ， 汝兄弟 父事 丞相 ， 令卿 与 丞相 共事 而己 。 ”,人物二  鲁 王刘永  人物一 临终前 刘永 榻 前  吩咐 说   吾 亡 之后  汝兄弟 父事 丞相  令卿 丞相 共事 而己,-1
TRAIN_SENT_ID_263154,,胡亥,秦始皇,公元前 210 年 — — 秦始皇 病死 ， 胡亥 即位 为 秦二世 皇帝,公元前  年   人物二 病死  人物一 即位 秦二世 皇帝,-1
TRAIN_SENT_ID_258671,,刘禅,刘备,（ 56 ） 临崩寄臣 以 大事 ： 刘备 在 临死 的 时候 ， 把 国家 大事 托付给 诸葛亮 ， 并且 对 刘禅 说 ： “ 汝 与 丞相 从事 ， 事之如父 。 ”,临崩寄臣 大事  人物二 临死  国家 大事 托付给 诸葛亮  人物一 说   汝 丞相 从事  事之如父,-1
TRAIN_SENT_ID_279391,,宫洺,宫勋,宫洺 自己 的 父亲 宫勋 ， 即 SeanConstanly ， 宫洺 从小 便 对 自己 严格要求 希望 成为 父亲 一样 的 人 。,人物一 父亲 人物二    人物一 从小 便 严格要求 希望 成为 父亲,-1
TRAIN_SENT_ID_258053,,周海婴,鲁迅,弄堂 里 的 孩子 们 常 在 一起 玩耍 ， 大家 并 不在意 周海婴 是 鲁迅 的 儿子 ， 周海婴 也 从不 刻意 去 摆架子 ， 孩子 们 彼此 平等 、 感情 融洽 。,弄堂 里 孩子 常 一起 玩耍  不在意 人物一 人物二 儿子  人物一 从不 刻意 摆架子  孩子 平等  感情 融洽,-1
TRAIN_SENT_ID_282505,,钟灵,段正淳,4 人物 生平 : 钟灵 ， 金庸 武侠小说 《 天龙八部 》 人物 ， 段正淳 与 情妇 “ 俏 夜叉 ” 甘宝宝 之 黄杏秀 版 钟灵 女 ， 养父 是 “ 见 人 就 杀 ” 钟万仇 。,人物 生平  人物一  金庸 武侠小说  天龙八部  人物  人物二 情妇  俏 夜叉  甘宝宝 黄杏秀 版 人物一 女  养父  见 杀  钟万仇,-1
TRAIN_SENT_ID_263194,,胡亥,秦始皇,秦始皇 胡亥 是 秦始皇 最小 的 儿子 ， 奉 始皇帝 敕令 ， 从中 车府 令 赵高 学习 法律 。,人物二 人物一 人物二 最小 儿子  奉 始皇帝 敕令  从中 车府 令 赵高 学习 法律,-1
TRAIN_SENT_ID_281903,,赵统,赵云,"赵统 也 曾 在 小说 《 三国演义 》 中 登场 , 见 第九十七回 : 正 饮酒 间 , 忽报 镇南 将军 赵云 长子 赵统 、 次子 赵广 , 来 见 丞相 。",人物一 小说  三国演义  中 登场  见 第九十七回  正 饮酒 间  忽报 镇南 将军 人物二 长子 人物一  次子 赵广  见 丞相,-1
TRAIN_SENT_ID_265237,,贾琏,贾赦,她 原是 贾赦 房中 的 丫环 ， 贾琏 偷 娶 尤二姐 后 ， 出门 为 父亲 贾赦 办 贾琏 秋桐 ( 2 张 ),原是 人物二 房中 丫环  人物一 偷 娶 尤二姐  出门 父亲 人物二 办 人物一 秋桐   张,-1
TRAIN_SENT_ID_260498,,严嵩,严世蕃,嘉 二十七年 ， 与 同官 厉汝进 等 上 疏 弹劾 严嵩之 子 严世蕃 窃 弄 父权 ， 收受贿赂 ， 被 严嵩 矫 廷杖 ， 贬为 云南 通海县 典史 。,嘉 二十七年  同官 厉汝进 疏 弹劾 人物一之 子 人物二 窃 弄 父权  收受贿赂  人物一 矫 廷杖  贬为 云南 通海县 典史,-1
TRAIN_SENT_ID_263217,,胡亥,秦始皇,"那 一年 , 是 公元前 210 年 , 如果 按 历史 的 走向 , 同年 , 秦始皇 驾崩 , 赵高 将会拟 假照 赐死 仁义 的 扶苏 , 立 胡亥 为帝 。",一年  公元前  年  历史 走向  同年  人物二 驾崩  赵高 将会拟 假照 赐死 仁义 扶苏  立 人物一 为帝,-1
TRAIN_SENT_ID_275881,,孙霸,孙权,赤乌 十三年 （ 公元 250 年 ） ， 孙权 废 孙和 ， 改立七子 孙亮 为 太子 ， 并且 赐死 孙霸 ， 诛杀 全寄 等 党羽 。,赤乌 十三年  公元  年   人物二 废 孙和  改立七子 孙亮 太子  赐死 人物一  诛杀 全寄 党羽,-1
TRAIN_SENT_ID_262475,,扶苏,秦始皇,这 一年 ， 秦始皇 南巡 吴 、 楚 途中 得 了 绞肠痧 症 ， 临死前 ， 他 紧忙 遗诏 于 扶苏 ， 命其 急速 回 京城 咸阳 继承 皇位 。,一年  人物二 南巡 吴  楚 途中 绞肠痧 症  临死前  紧忙 遗诏 人物一  命其 急速 回 京城 咸阳 继承 皇位,-1
TRAIN_SENT_ID_249969,,张无忌,赵敏,"武当 第八 子 内容简介 : 销声匿迹 的 魔 道 , 尔虞我诈 的 纷争 , 爱恨 情仇 的 交织 , 方天行 , 赵敏 , 张无忌 之间 会 有 怎样 的 情感 纠葛 ?",武当 第八 子 内容简介  销声匿迹 魔 道  尔虞我诈 纷争  爱恨 情仇 交织  方天行  人物二  人物一 之间 会 情感 纠葛,-1
TRAIN_SENT_ID_259048,,刘备,刘禅,皇太子 三国 : 蜀 汉昭烈 皇帝 刘备 皇太子 刘禅,皇太子 三国  蜀 汉昭烈 皇帝 人物一 皇太子 人物二,-1
TRAIN_SENT_ID_259120,,刘备,刘禅,建安 二十六年 ， 刘备 病逝 于 白帝城 ， 太子 刘禅 即位 ， 改元 建兴 ， 丞相 诸葛亮 主理 大小 内政 事物 。,建安 二十六年  人物一 病逝 白帝城  太子 人物二 即位  改元 建兴  丞相 诸葛亮 主理 大小 内政 事物,-1
