sent_id,sent_id,entity1,entity2,sent,processed_sent,human
TRAIN_SENT_ID_271095,,彭丽媛,习近平,习近平 后来 对 彭丽媛 说 : “ 和 你 相见 不到 40 分钟 ， 我 就 认定 你 是 我 的 妻子 了 。 ”,人物二 后来 人物一 说   相见 不到  分钟  认定 妻子,1
TRAIN_SENT_ID_285483,,葛存壮,施文心,更为重要 的 是 ， 葛存壮 和 施文心 夫妇 还 以 内行人 的 眼光 对 葛优 的 表演 进行 了 多方 督促 。,更为重要  人物一 人物二 夫妇 内行人 眼光 葛优 表演 进行 多方 督促,1
TRAIN_SENT_ID_274913,,晏几道,晏殊,晏几道 词集 内容简介 : 《 晏几道 词集 》 内容简介 ： 二晏 ， 是 指 宋代 的 两位 大 词人 晏殊 和 他 的 儿子 晏畿 道 。,人物一 词集 内容简介   人物一 词集  内容简介  二晏  指 宋代 两位 词人 人物二 儿子 晏畿 道,-1
TRAIN_SENT_ID_275221,,丁力,冯程程,许文强 怀着 一颗 复仇 之心 回到 上海 ， 在 曾经的爱 人 冯程程 和 好 兄弟 丁力 的 婚礼 现场 ， 他 只身 闯入 。,许文强 怀着 一颗 复仇 之心 回到 上海  曾经的爱 人物二 兄弟 人物一 婚礼 现场  只身 闯入,1
TRAIN_SENT_ID_259899,,花月奴,江枫,绝代 双骄 作品 鉴赏 : 小鱼儿 跟 花无缺 ， 玉郎 江枫 与 花月奴 之子 ， 一对 孪生兄弟 。,绝代 双骄 作品 鉴赏  小鱼儿 花无缺  玉郎 人物二 人物一 之子  一对 孪生兄弟,-1
TRAIN_SENT_ID_283448,,张伯驹,潘素,所以 张伯驹 在 动员大会 回来 后 就 跟 夫人 潘素 商量 买 公债 之 事 。,人物一 动员大会 回来 夫人 人物二 商量 买 公债 事,1
TRAIN_SENT_ID_266434,,严世蕃,严嵩,严氏 父子 ： 指 明代 权奸 严嵩 及其 子 严世蕃 。,严氏 父子  指 明代 权奸 人物二 子 人物一,-1
TRAIN_SENT_ID_261084,,涂山苏苏,白月初,为了 成功 续缘 ， 她 慕名 找到 白月初 和 涂山苏苏 ， 在 篇章 结尾 两人 终成眷属 ， 并 一起 开 了 一家 植物 店 。,成功 续缘  慕名 找到 人物二 人物一  篇章 结尾 两人 终成眷属  一起 开 一家 植物 店,1
TRAIN_SENT_ID_271445,,杨云,杨威,婚礼 现场 ， 杨威 和 杨云 不断 地 说 着 “ 我爱你 ” ， 杨云 更是 多次 落泪 。,婚礼 现场  人物二 人物一 不断 说  我爱你   人物一 更是 多次 落泪,1
TRAIN_SENT_ID_257750,,桓雄,桓因,“ 神话 的 前面 部分 记事 （ 天帝 桓因 派子 桓雄 下界 临凡 的 记事 ） 可能 是 后世 添加 的 。,神话 前面 部分 记事  天帝 人物二 派子 人物一 下界 临凡 记事  可能 后世 添加,-1
TRAIN_SENT_ID_276540,,孔子,亓官氏,春秋 末期 ， 孔子 逝世 后 ， 弟子 子贡 想念 恩师 ， 用 楷木 雕刻 了 孔子 及 夫人 亓官氏 像 ， 这 便是 曲阜 木雕 的 最早 实物 ， 距今已有 两千四百 多年 。,春秋 末期  人物一 逝世  弟子 子贡 想念 恩师  楷木 雕刻 人物一 夫人 人物二  便是 曲阜 木雕 最早 实物  距今已有 两千四百 多年,-1
TRAIN_SENT_ID_273954,,白素,卫斯理,"人面 组合 内容 介绍 : 『 卫斯理 的 故事 』 总是 令人 瞠目结舌 , 但是 这 一次 卫斯理 和 白素 等 人 却 被 『 胡克强 的 故事 』 深深 吸引 , 不能自拔 !",人面 组合 内容 介绍   人物二 故事  总是 令人 瞠目结舌  一次 人物二 人物一  胡克强 故事  深深 吸引  不能自拔,1
TRAIN_SENT_ID_286489,,田壮壮,田方,田壮壮 的 父亲 田方 是 北京 电影演员 剧团 第一任 团长 ， 也 是 一名 演员 ， 代表作 有 《 壮士 凌云 》 、 《 风云 儿女 》 等 。,人物一 父亲 人物二 北京 电影演员 剧团 第一任 团长  一名 演员  代表作  壮士 凌云    风云 儿女,-1
TRAIN_SENT_ID_249353,,后稷,姜嫄,古代 传说 姜嫄 曾 禋 祀 以求 子 ， 见上帝 之 足迹 而 履其 拇 ， 孕而生 后稷 。,古代 传说 人物二 禋 祀 以求 子  见上帝 足迹 履其 拇  孕而生 人物一,-1
TRAIN_SENT_ID_271148,,彭丽媛,习近平,习近平 主席 和 夫人 彭丽媛 在 荣国府,人物二 主席 夫人 人物一 荣国府,1
TRAIN_SENT_ID_259175,,刘备,刘禅,彝陵 之战 ， 刘备 战败 ， 有 讹言 传入 蜀中 ， 道 刘备 已死 ， 孙夫人 于是 成为 了 刘禅 的 后宫 妃子 之一 ， 后人 为 其立庙 ， 号 曰 “ 枭 姬祠 ” 。,彝陵 之战  人物一 战败  讹言 传入 蜀中  道 人物一 已死  孙夫人 成为 人物二 后宫 妃子  后人 其立庙  号 曰  枭 姬祠,-1
TRAIN_SENT_ID_260120,,周海婴,许广平,在 周海婴 尚未 懂事 时 ， 鲁迅 曾 将 他 与 许广平 传达 爱意 、 遥寄 思念 的 《 两地 书 》 重新 工整 手抄 一遍 送给 年幼 的 周海婴 。,人物一 尚未 懂事 时  鲁迅 人物二 传达 爱意  遥寄 思念  两地 书  重新 工整 手抄 一遍 送给 年幼 人物一,1
TRAIN_SENT_ID_270954,,梁思成,梁启超,林长民 女儿 林徽因 ， 为 建筑学 大家 ， 在 诗歌 、 戏剧 、 散文 方面 颇 有 造诣 ， 被誉为 “ 一代 才女 “ ； 女婿 为 梁启超 之子 梁思成 。,林长民 女儿 林徽因  建筑学  诗歌  戏剧  散文 方面 颇 造诣  被誉为  一代 才女   女婿 人物二 之子 人物一,-1
TRAIN_SENT_ID_285587,,林枫,郭明秋,8 月 20 日 ， 在 中央党校 全校 大会 上 ， 造反派 把 校党委 领导 轰 下 主席台 ， 并 给 林枫 、 郭明秋 等 六人 戴高帽子 游斗 ， 进行 人身 侮辱 。,月  日  中央党校 全校 大会  造反派 校党委 领导 轰 主席台  人物一  人物二 六人 戴高帽子 游斗  进行 人身 侮辱,1
TRAIN_SENT_ID_275423,,董祀,蔡文姬,董祀 人物 经历 : 陈 留人 蔡文姬 是 董祀 的 妻子 ， 是 同乡 蔡邕 的 女儿 ， 名叫 琰 ， 字 文姬 。,人物一 人物 经历  陈 留人 人物二 人物一 妻子  同乡 蔡邕 女儿  名叫 琰  字 文姬,-1
TRAIN_SENT_ID_274206,,岳雷,岳飞,演绎 的 是 宋代 抗金 英雄 岳飞 之子 岳雷 ， 为 躲避 官兵 的 追捕 ， 阴差阳错 ， 误入 刘家 ， 与 刘玉 莲 小姐 花 开 并蒂 ， 喜结连理 的 一段 佳话 。,演绎 宋代 抗金 英雄 人物二 之子 人物一  躲避 官兵 追捕  阴差阳错  误入 刘家  刘玉 莲 小姐 花 开 并蒂  喜结连理 一段 佳话,-1
TRAIN_SENT_ID_286867,,马禀鐩,丁秉鐩,马禀鐩 ， 丁秉鐩 夫人 。,人物一  人物二 夫人,1
TRAIN_SENT_ID_281634,,黄峨,杨慎,九月 返 滇 ， 黄峨 即 同往 滇南 戍 所 ， 在 滇南 伴 杨慎 生活 了 近三年 ， 作有 〔 越调 〕 《 凭 阑 人 》 小令 ， 抒发 怀乡 深情 。,九月 返 滇  人物一 同往 滇南 戍  滇南 伴 人物二 生活 近三年  作有  越调   阑  小令  抒发 怀乡 深情,1
TRAIN_SENT_ID_258804,,孙钟,孙坚,东汉 末年 ， 吴郡富 春 （ 今浙 富阳 ） 有 一大 富豪 名叫 孙钟 ， 雇 了 很多 佃农 在 这里 种瓜 收籽 ， 不久 他 的 儿子 孙坚 成为 汉末 割据一方 的 统领 。,东汉 末年  吴郡富 春  今浙 富阳  一大 富豪 名叫 人物一  雇 很多 佃农 种瓜 收籽  不久 儿子 人物二 成为 汉末 割据一方 统领,-1
TRAIN_SENT_ID_287239,,舒悦,张宇峰,舒悦 在 2014 年 参加 文化 主题 之夜 节目 里 自 曝 追求 爱妻 张宇峰 过程 ， 并 现场 传授 恋爱 秘籍 ， 堪称 一代 “ 情场 高手 ” 。,人物一  年 参加 文化 主题 之夜 节目 里 曝 追求 爱妻 人物二 过程  现场 传授 恋爱 秘籍  堪称 一代  情场 高手,1
TRAIN_SENT_ID_257417,,袁克文,袁世凯,袁克文 生 下 不久 ， 被 过继 给 袁世凯 宠爱 的 大姨 太沈氏 。,人物一 生 不久  过继 人物二 宠爱 大姨 太沈氏,-1
TRAIN_SENT_ID_270184,,蒋雯丽,顾长卫,四 、 一对 互相 欣赏 的 夫妻 — — 蒋雯丽 和 顾长卫 夫妇,四  一对 互相 欣赏 夫妻   人物一 人物二 夫妇,1
TRAIN_SENT_ID_264790,,张欣,潘石屹,潘石屹 的 太太 、 SOHO 中国 CEO 张欣 发表 微博称 ， “ 王总 恋爱 了 ， 网上 一大堆 为 我 操心 的 网友 ， 让 我 一定 管好 老潘 。,人物二 太太   中国  人物一 发表 微博称   王总 恋爱  网上 一大堆 操心 网友  一定 管好 老潘,1
TRAIN_SENT_ID_266095,,金正恩,高英姬,第三任 夫人 叫 高英姬 ， 2004 年 因 乳癌 去世 ， 二 子 金正哲 和 三子 金正恩 都 为 她 所出 。,第三任 夫人 人物二   年 乳癌 去世  二 子 金正哲 三子 人物一 所出,-1
TRAIN_SENT_ID_274380,,钱学森,钱均夫,钱学森 的 父亲 钱均夫 是 杭州人 ， 曾 出任 浙江省 立 第一 中学 ( 现 杭州第四中学 ) 校长 。,人物一 父亲 人物二 杭州人  出任 浙江省 立 第一 中学  现 杭州第四中学  校长,-1
TRAIN_SENT_ID_269281,,陆雪琪,张小凡,这 一日 ， 陆雪琪 来到 了 那座 曾经 魂牵梦系 的 草庙 村 废墟 ， 在 一座 新立 的 木屋 前 ， 与 张小凡 重逢 ， 两人 相视而笑 ， 天荒地老 。,一日  人物一 来到 那座 曾经 魂牵梦系 草庙 村 废墟  一座 新立 木屋 前  人物二 重逢  两人 相视而笑  天荒地老,1
TRAIN_SENT_ID_269908,,张默,张国立,张国立 之子 张默 也 没能 逃过 “ 被 死亡 ” 的 劫数 ， 称 其 在 河北 被 捅 死 。,人物二 之子 人物一 没能 逃过  死亡  劫数  称 河北 捅 死,-1
TRAIN_SENT_ID_286528,,祝彪,祝朝奉,祝家庄 庄主 祝朝奉 独霸一方 ， 三子 祝龙 、 祝虎 、 祝彪 ， 乡民 畏如 虎狼 。,祝家庄 庄主 人物二 独霸一方  三子 祝龙  祝虎  人物一  乡民 畏如 虎狼,-1
TRAIN_SENT_ID_279571,,马丽娟,赵本山,马丽娟 赵本山 把 妻子 当成 良师益友 ， 表演 中有 什么 问题 ， 总要 请 妻子 指教 。,人物一 人物二 妻子 当成 良师益友  表演 中有 问题  总要 请 妻子 指教,1
TRAIN_SENT_ID_255830,,蒋介石,宋美龄,猫眼 绿 的 地毯 ， 墨绿 的 沙发 ， 墙壁 上 挂 着 宋美龄 不同 时期 的 半身 照片 ， 以及 蒋介石 夫妇 在 “ 美庐 ” 生活 的 部分 照片 。,猫眼 绿 地毯  墨绿 沙发  墙壁 挂 人物二 不同 时期 半身 照片  人物一 夫妇  美庐  生活 部分 照片,1
TRAIN_SENT_ID_259894,,花月奴,江枫,就 在 花月奴 产子 时 ， 单恋 江枫 的 邀 月 宫主 找到 并 杀 了 他们 。,人物一 产子 时  单恋 人物二 邀 月 宫主 找到 杀,1
TRAIN_SENT_ID_273081,,杨铁心,包惜弱,杨铁心 见 王妃 后 疑窦丛生 ， 在 郭靖 、 黄蓉 的 帮助 下夜 闯王 府 ， 证实 了 王妃 正是 自己 失散多年 的 妻子 包惜弱 。,人物一 见 王妃 疑窦丛生  郭靖  黄蓉 帮助 下夜 闯王 府  证实 王妃 失散多年 妻子 人物二,1
TRAIN_SENT_ID_284064,,陈辉祖,陈大受,陈及祖 生平 简介 : 大清 宰相 陈大受 子 ， 最高级 封疆 大臣 陈辉祖 弟 。,陈及祖 生平 简介  大清 宰相 人物二 子  最高级 封疆 大臣 人物一 弟,-1
TRAIN_SENT_ID_274142,,汤国梨,章太炎,"章太炎 的 夫人 汤国梨 ， 曾经 留下 名句 "" 不是 阳澄湖 蟹 好 ， 人生 何必 住 苏州 "" 。",人物二 夫人 人物一  曾经 留下 名句  阳澄湖 蟹  人生 何必 住 苏州,1
TRAIN_SENT_ID_276288,,岳灵珊,林平之,闵 老二 — — 日月神教 ， 少室 山下 围攻 林平之 、 岳灵珊 者 之一 。,闵 老二   日月神教  少室 山下 围攻 人物二  人物一,-1
TRAIN_SENT_ID_284890,,戚芳,戚长发,后 戚长发 的 徒弟 狄云 因为 万震山 之子 万圭 贪慕 其 青梅竹马 的 师妹 戚芳 ， 而 被 栽赃 陷害 打入 冤狱 ， 同 丁典 关在 了 一起 。,人物二 徒弟 狄云 万震山 之子 万圭 贪慕 青梅竹马 师妹 人物一  栽赃 陷害 打入 冤狱  丁典 关在 一起,-1
TRAIN_SENT_ID_265015,,刘星,刘梅,博士 夫妻 分别 去向 东海 和 刘梅 求教 ， 东海 和 刘梅 把 自己 当年 教育 刘星 和 小雨 的 办法 交给 博士 夫妇 。,博士 夫妻 去向 东海 人物二 求教  东海 人物二 当年 教育 人物一 小雨 办法 交给 博士 夫妇,1
TRAIN_SENT_ID_283773,,李静民,姜昆,为了 参加 黑龙江省 曲艺 调演 ， 兵团 要 组织 曲艺 学习班 ， 师胜杰 幸运地 搭上 了 这 班车 ， 这个 学习班 里 还有 姜昆 和 其 夫人 李静民 。,参加 黑龙江省 曲艺 调演  兵团 组织 曲艺 学习班  师胜杰 幸运地 搭上 班车  学习班 里 人物二 夫人 人物一,1
TRAIN_SENT_ID_273768,,霍震霆,霍英东,后来 ， 霍英东 对外 承认 ： 当年 霍家 如此 行事 ， 是 为了 给 长子 霍震霆 打响 知名度 ， 以便 他 在 国际 上 为 中国 进行 “ 民间 体育 外交 ” 。,后来  人物二 对外 承认  当年 霍家 行事  长子 人物一 打响 知名度  国际 中国 进行  民间 体育 外交,1
TRAIN_SENT_ID_271078,,彭丽媛,习近平,这 段 歌曲 时长 3 分 21 秒 ， 配 上 习近平 、 彭丽媛 恩爱 的 33 张 照片 和 两幅 漫画 ， MV 视频 上传 连续 5 天 ， 视频 点击 量 已 突破 2000 万 。,段 歌曲 时长  分  秒  配 人物二  人物一 恩爱  张 照片 两幅 漫画   视频 上传 连续  天  视频 点击 量 突破  万,1
TRAIN_SENT_ID_277530,,柴绍,平阳公主,据说 ， 平阳公主 在 娘子 关 任帅 期间 ， 常常 身不离 鞍 ， 手不离 刀 ， 表现 异常 勇敢 ， 就 在 她 与 柴绍 将军 结婚 以后 ， 仍 不 忘 军中 生活 。,据说  人物二 娘子 关 任帅 期间  常常 身不离 鞍  手不离 刀  表现 异常 勇敢  人物一 将军 结婚 以后  忘 军中 生活,1
TRAIN_SENT_ID_265317,,贾琏,贾赦,贾琏 看望 贾赦 ， 将 女儿 托于 王夫人 。,人物一 看望 人物二  女儿 托于 王夫人,-1
TRAIN_SENT_ID_276569,,孔子,亓官氏,鲁昭公 九年 （ 公元前 533 年 ） ， 孔子 迎娶 了 宋 国人 亓官氏 之女 为 妻 。,鲁昭公 九年  公元前  年   人物一 迎娶 宋 国人 人物二 之女 妻,-1
TRAIN_SENT_ID_251265,,廖仲恺,何香凝,在 广州 ， 胡兰畦 结识 了 周恩来 、 李富春 等 中共 代表 人物 ， 也 结识 了 国民党 左派 领袖 、 孙中山 的 亲密 助手 廖仲恺 的 夫人 何香凝 女士 。,广州  胡兰畦 结识 周恩来  李富春 中共 代表 人物  结识 国民党 左派 领袖  孙中山 亲密 助手 人物一 夫人 人物二 女士,1
TRAIN_SENT_ID_259145,,刘备,刘禅,在 永安 宫中 ， 刘备 把 儿子 刘禅 ( 阿斗 ) 委托 于 诸葛亮 。,永安 宫中  人物一 儿子 人物二  阿斗  委托 诸葛亮,-1
TRAIN_SENT_ID_273083,,杨铁心,包惜弱,杨铁心 和 包惜弱 的 儿子 ， 小王爷 完颜康 贪图 富贵 ， 也 来 欺骗 爹娘 ， 却 被 好心 的 穆念慈 揭穿 。,人物一 人物二 儿子  小王爷 完颜康 贪图 富贵  欺骗 爹娘  好心 穆念慈 揭穿,-1
TRAIN_SENT_ID_285691,,李小林,刘亚洲,刘亚洲 的 夫人 是 李小林 。,人物二 夫人 人物一,1
TRAIN_SENT_ID_258051,,周海婴,鲁迅,更 值得一提的是 ， 鲁迅 之子 周海婴 收藏 的 一盒 清代 宫廷 普洱茶 膏 拍出 了 108 万 高价 ， 是 国内 讫 今 为止 普洱茶 拍卖 最高 的 保持者 。,更 值得一提的是  人物二 之子 人物一 收藏 一盒 清代 宫廷 普洱茶 膏 拍出  万 高价  国内 讫 普洱茶 拍卖 最高 保持者,-1
TRAIN_SENT_ID_266639,,李国豪,李小龙,李小龙 之子 李国豪 1993 年 拍摄 电影 乌鸦 时 ， 竟然 意外 饮弹身亡 。,人物二 之子 人物一  年 拍摄 电影 乌鸦 时  竟然 意外 饮弹身亡,-1
TRAIN_SENT_ID_260229,,穆桂英,杨宗保,（ 《 杨家将 》 人物 ） : 杨宗保 与 穆桂英 之女 ， 武艺 高超 ， 箭法 精湛 。,杨家将  人物   人物二 人物一 之女  武艺 高超  箭法 精湛,-1
TRAIN_SENT_ID_271104,,彭丽媛,习近平,习大大 爱着 彭 麻麻 歌曲 MV : 这 段 歌曲 时长 3 分 21 秒 ， 配上 了 习近平 、 彭丽媛 恩爱 的 33 张 照片 和 两幅 漫画 。,习大大 爱着 彭 麻麻 歌曲   段 歌曲 时长  分  秒  配上 人物二  人物一 恩爱  张 照片 两幅 漫画,1
TRAIN_SENT_ID_283304,,李俐,满文军,从此 ， 满文军 每天 都 要 给 李俐 打 一个 电话 。,人物二 每天 人物一 一个 电话,1
TRAIN_SENT_ID_272254,,金正恩,金正日,新闻 区域 最上 是 “ 金正恩 革命 活动 ” 专题 ， 右侧 保留 了 金正日 逝世 一周年 的 新闻 专题 ， 首页 没有 金日成 专题报道 集 。,新闻 区域 最上  人物一 革命 活动  专题  右侧 保留 人物二 逝世 一周年 新闻 专题  首页 没有 金日成 专题报道 集,1
TRAIN_SENT_ID_277305,,李明博,金润玉,李明博 对吉 牧师 的 提议 稍作 犹豫 后 ， 便 跟随 其 夫人 金润玉 女士 跪 了 下来 。,人物一 对吉 牧师 提议 稍作 犹豫  便 跟随 夫人 人物二 女士 跪 下来,1
TRAIN_SENT_ID_273788,,霍震霆,霍英东,作为 香港 著名 实业家 霍英东 的 长子 ， 霍震霆 在 香港 颇受 关注 。,香港 著名 实业家 人物二 长子  人物一 香港 颇受 关注,-1
TRAIN_SENT_ID_286522,,李小龙,李英儒,李小龙 的 父亲 是 《 野火 春风 斗 古城 》 的 作者 军旅 作家 李英儒 。,人物一 父亲  野火 春风 斗 古城  作者 军旅 作家 人物二,-1
TRAIN_SENT_ID_270951,,梁思成,梁启超,这是 陈寅恪 在 王国维 先生 投水 自沉后 两周年 写 的 纪念 碑铭 （ 王国维 纪念碑 ， 碑式 由 梁启超 之子 梁思成 设计 ） 。,这是 陈寅恪 王国维 先生 投水 自沉后 两周年 写 纪念 碑铭  王国维 纪念碑  碑式 人物二 之子 人物一 设计,-1
TRAIN_SENT_ID_282851,,柳摇金,韩翃,日子 长 了 ， 柳摇金 与 韩翃 的 眉目传情 终于 被 李宏 察觉 ， 他 看出 了 其中 隐秘 而 曼妙 的 情意 。,日子 长  人物一 人物二 眉目传情 终于 李宏 察觉  看出 隐秘 曼妙 情意,1
TRAIN_SENT_ID_285913,,上官兰心,朱常洛,李梅儿 《 美人计 》 : 明光宗 朱常洛 即位 后 ， 他 梦想 与 深爱 的 妻子 上官兰心 双宿双飞 ， 白头到老 。,李梅儿  美人计   明光宗 人物二 即位  梦想 深爱 妻子 人物一 双宿双飞  白头到老,1
TRAIN_SENT_ID_260308,,穆桂英,杨宗保,《 三国群英 传 Ⅶ 乱世 争霸 》 ， 新 增加 3 个 情谊 技能 ， 单冰冰 罗成双 龙 合壁 、 杨宗保 穆桂英 神龙 飞天 、 裴元庆 李 容容 飞龙在天 。,三国群英 传 Ⅶ 乱世 争霸   新 增加  情谊 技能  单冰冰 罗成双 龙 合壁  人物二 人物一 神龙 飞天  裴元庆 李 容容 飞龙在天,-1
TRAIN_SENT_ID_261553,,关兴,关羽,关兴 ， 关羽 次子 ， 少 已有 名 ， 深得 诸葛亮 器重 ， 弱冠 后 担任 侍中 、 中 监军 ， 数年 后 死去 。,人物一  人物二 次子  少 已有 名  深得 诸葛亮 器重  弱冠 担任 侍中  中 监军  数年 死去,-1
TRAIN_SENT_ID_284113,,吉良吉广,吉良吉影,吉良吉广 人物 设定 : 儿子 吉良吉影 人物造型,人物一 人物 设定  儿子 人物二 人物造型,-1
TRAIN_SENT_ID_273182,,黄苗子,郁风,在 上海 时 ， 黄苗子 就 开始 接触 夏衍 、 潘汉年 等 共产党员 ， 与 郁风 结婚 ， 更 可以 看作 是 对 政治 选择 的 一种 确定 。,上海 时  人物一 接触 夏衍  潘汉年 共产党员  人物二 结婚  更 看作 政治 选择 一种 确定,1
TRAIN_SENT_ID_258836,,廖梦醒,何香凝,廖梦醒 人物 简介 : 廖梦醒 （ 1904 — 1988 ） ， 惠阳县 陈江 镇人 ， 廖仲恺 、 何香凝 之女 。,人物一 人物 简介  人物一       惠阳县 陈江 镇人  廖仲恺  人物二 之女,-1
TRAIN_SENT_ID_283929,,石金鑫,石顶武,1980 年代 初期 ， 部份 三期 普渡 残余分子 拥立 石顶武 之子 石金鑫 为帝 ， 重建 大中华 佛国 ， 即后 大中华 佛国 ， 旋即 遭到 镇压 。,年代 初期  部份 三期 普渡 残余分子 拥立 人物二 之子 人物一 为帝  重建 大中华 佛国  即后 大中华 佛国  旋即 遭到 镇压,-1
TRAIN_SENT_ID_263873,,刘嘉玲,梁朝伟,梁朝伟 和 刘嘉玲 昨天 举行 婚前 欢迎 派对 ， 以 不丹 菜 招待 近 百位 宾客 。,人物二 人物一 昨天 举行 婚前 欢迎 派对  不丹 菜 招待 近 百位 宾客,1
TRAIN_SENT_ID_275441,,董祀,蔡文姬,曹操 与 蔡文姬 文姬 的 流浪生活 让 董祀 忧心 不已 ， 他 默默地 用 自己 的 行动 来 寄托 情感 … …,曹操 人物二 文姬 流浪生活 人物一 忧心 不已  默默地 行动 寄托 情感,1
TRAIN_SENT_ID_263791,,张子萱,杨一柳,后来 杨一柳 出版 第一本 小说 请来 张子萱 做 模特 ， 两人 就此 开始 相恋 。,后来 人物二 出版 第一本 小说 请来 人物一 做 模特  两人 就此 相恋,1
TRAIN_SENT_ID_286603,,史小翠,白自在,后 白自在 自 大成 狂 ， 封万里 和 一帮 弟子 唯恐 殃及 自己 ， 共同 策划 绑架 白自在 ， 直至 史小翠 回 凌霄城 救援 。,人物二 大成 狂  封万里 一帮 弟子 唯恐 殃及  共同 策划 绑架 人物二  直至 人物一 回 凌霄城 救援,-1
TRAIN_SENT_ID_261538,,关兴,关羽,《 三国志 后传 》 人物 ， 关兴 之子 ， 关羽 之孙 。,三国志 后传  人物  人物一 之子  人物二 之孙,-1
TRAIN_SENT_ID_285699,,耿章,耿如杞,耿章 是 山西巡抚 耿如杞 的 儿子 ， 性格 刚强 正直 ， 一丝不苟 。,人物一 山西巡抚 人物二 儿子  性格 刚强 正直  一丝不苟,-1
TRAIN_SENT_ID_281755,,苏荃,韦小宝,苏荃 原 是 神龙 教主 洪安通 的 夫人 ， 因为 颇具 姿色 ， 最终 也 成 了 韦小宝 的 老婆 。,人物一 原 神龙 教主 洪安通 夫人  颇具 姿色  最终 成 人物二 老婆,1
TRAIN_SENT_ID_273866,,范柳原,白流苏,旧 上海 的 白流苏 和 范柳原 ， 已 成为 都市男女 内心深处 一个 自省 的 经典 。,旧 上海 人物二 人物一  成为 都市男女 内心深处 一个 自省 经典,1
TRAIN_SENT_ID_281698,,赵敏,汝阳王,击败 这些 人后 汝阳王 出现 ， 在 赵敏 以死 相 逼 的 情况 下 汝阳王 只得 让 二人 离去 。,击败 人后 人物二 出现  人物一 以死 相 逼 情况 人物二 只得 二人 离去,1
TRAIN_SENT_ID_255137,,胡斐,胡一刀,该剧 讲述 了 李自成 护卫 胡一刀 之子 胡斐 复仇 的 故事 。,该剧 讲述 李自成 护卫 人物二 之子 人物一 复仇 故事,-1
TRAIN_SENT_ID_268360,,秦始皇,扶苏,身为 秦始皇 嬴政 的 长子 ， 扶苏 承载 了 太 多 的 期待 ， 但他却 难能可贵 的 始终保持 着 人性 的 美好 。,身为 人物一 嬴政 长子  人物二 承载 太 期待  但他却 难能可贵 始终保持 人性 美好,-1
TRAIN_SENT_ID_284349,,唐筼,陈寅恪,其中 一块 呈 竖 长状 的 岩石 正面 写 着 “ 陈寅恪 唐筼 夫妇 永眠 于 此 ” ， 反面 写 着 “ 陈流 求 陈小 彭 陈美延 庐山 植物园 敬立 ” 等 数字 。,一块 呈 竖 长状 岩石 正面 写  人物二 人物一 夫妇 永眠   反面 写  陈流 求 陈小 彭 陈美延 庐山 植物园 敬立  数字,1
TRAIN_SENT_ID_287234,,李志奇,李朝,偶然间 ， 李志奇 发现 李朝 之女 李仪 竟然 与 他 逝去 的 爱妻 长得 一模一样 ， 二人 坠入情网 。,偶然间  人物一 发现 人物二 之女 李仪 竟然 逝去 爱妻 长得 一模一样  二人 坠入情网,1
TRAIN_SENT_ID_254124,,霍启刚,郭晶晶,2012 年 8 月 ： 霍启刚 郭晶晶 三千万 豪宅 婚房 曝光 别墅 位于 北京 海淀区 奢华 堪比 “ 皇宫 ”,年  月  人物一 人物二 三千万 豪宅 婚房 曝光 别墅 位于 北京 海淀区 奢华 堪比  皇宫,1
TRAIN_SENT_ID_278957,,乔蚩尤,乔羽,乔蚩尤 身边 人物 : 父亲 ： 乔羽 ， 蜃楼 城 主 ， 大荒 八十一 勇士 之一 。,人物一 身边 人物  父亲  人物二  蜃楼 城 主  大荒 八十一 勇士,-1
TRAIN_SENT_ID_287282,,俞世龙,俞振庭,俞世龙 ( 1920 - 1943 ) ， 男 ， 京剧 老生 演员 ， 武生 俞振庭 之子 。,人物一       男  京剧 老生 演员  武生 人物二 之子,-1
TRAIN_SENT_ID_282793,,周廷冲,黄翠芬,1950 年 3 月 ， 一个 春寒料峭 的 早晨 ， 周廷冲 和 黄翠芬 来到 美国 西部 海岸 的 一个 货运 码头 。,年  月  一个 春寒料峭 早晨  人物一 人物二 来到 美国 西部 海岸 一个 货运 码头,1
TRAIN_SENT_ID_286872,,冯锡范,冯澄世,（ 台湾 明郑 时期 政治家 ） : 冯锡范 ， 号 希范 ， 明末清初 福建 龙溪人 ， 生于 晋江县 ， 郑成功 工官 冯澄世 之子 。,台湾 明郑 时期 政治家   人物一  号 希范  明末清初 福建 龙溪人  生于 晋江县  郑成功 工官 人物二 之子,-1
TRAIN_SENT_ID_271610,,毛岸青,毛泽东,毛泽东 诞辰 110 周年 之际 ， 毛主席 之子 毛岸青 ， 儿媳 邵华 将军 携 毛主席 之孙 毛新宇 来函 ， 表述 了 对 舒荣先 毛体 书法 的 肯定 。,人物二 诞辰  周年 之际  毛主席 之子 人物一  儿媳 邵华 将军 携 毛主席 之孙 毛新宇 来函  表述 舒荣先 毛体 书法 肯定,-1
