sent_id,sent_id,entity1,entity2,sent,processed_sent,human
TRAIN_SENT_ID_268427,,秦始皇,扶苏,是 秦始皇 第十八 子 ， 公子 扶苏 的 弟弟 ， 从中 车府 令 赵高 学习 狱法 。,人物一 第十八 子  公子 人物二 弟弟  从中 车府 令 赵高 学习 狱法,-1
TRAIN_SENT_ID_259245,,刘备,刘禅,李严 武将 点评 : 李严 是 蜀汉 的 忠臣 ， 刘备 在 白帝城 驾崩 时 ， 曾任 其 与 诸葛亮 同 为 托孤 大臣 ， 辅佐 刘禅 。,李严 武将 点评  李严 蜀汉 忠臣  人物一 白帝城 驾崩 时  曾任 诸葛亮 托孤 大臣  辅佐 人物二,-1
TRAIN_SENT_ID_258330,,张兆和,沈从文,黄侃 娶 了 自己 的 学生 ， 和 鲁迅 许广平 、 沈从文 张兆和 一样 ， 在 民国 学界 文坛 轰动一时 。,黄侃 娶 学生  鲁迅 许广平  人物二 人物一  民国 学界 文坛 轰动一时,-1
TRAIN_SENT_ID_249921,,张无忌,赵敏,新 新版 ： 张无忌 妄娶 四 美的 想法 甚至 都 和 赵敏 说 了 ， 而 这 在 第二 版里 是 没有 的 ， 第二 版 只是 说 张无忌 梦中 妄想 同娶 四美 。,新 新版  人物一 妄娶 四 美的 想法 人物二 说  第二 版里 没有  第二 版 说 人物一 梦中 妄想 同娶 四美,-1
TRAIN_SENT_ID_270751,,梁萧,花晓霜,在 蚩尤 林 ， 梁萧 深中 五行 散 剧毒 ， 痛苦不堪 ， 而 仍然 不 受 威胁 放弃 柳莺莺 娶 花晓霜 可以 看出 梁萧 对 柳莺莺 也 却 有 真 情谊 。,蚩尤 林  人物一 深中 五行 散 剧毒  痛苦不堪  仍然 受 威胁 放弃 柳莺莺 娶 人物二 看出 人物一 柳莺莺 真 情谊,-1
TRAIN_SENT_ID_259326,,刘备,刘禅,办完 刘备 的 丧事 回到 成都 ， 后主 刘禅 继位 。,办完 人物一 丧事 回到 成都  后主 人物二 继位,-1
TRAIN_SENT_ID_260102,,齐良迟,齐白石,齐良迟 先生 说 ： “ 先父 齐白石 的 画 有 两大 特点 ， 一是 画 的 厚重 ， 二是 气派 大 ， 您 具备 了 这种 画风 。 ”,人物一 先生 说   先父 人物二 画 两大 特点  一是 画 厚重  二是 气派  具备 这种 画风,-1
TRAIN_SENT_ID_250217,,秦始皇,胡亥,秦始皇 去世 后 ， 秦二世 胡亥 继位 ， 又 在 始皇 刻石 后面 加刻 二世 诏书 和 从 臣 姓名 ， 内容 均 为 赞颂 秦始皇 的 统一 事业 。,人物一 去世  秦二世 人物二 继位  始皇 刻石 后面 加刻 二世 诏书 臣 姓名  内容 均 赞颂 人物一 统一 事业,-1
TRAIN_SENT_ID_259013,,刘备,刘禅,~ 263 ） ， 蜀 汉昭烈 帝 刘备 之孙 ， 后主 刘禅 第五 子 ， 三国 时期 蜀汉 北地 王 。,蜀 汉昭烈 帝 人物一 之孙  后主 人物二 第五 子  三国 时期 蜀汉 北地 王,-1
TRAIN_SENT_ID_266822,,萧峰,萧远山,玄果 ： 少林寺 和尚 ， 萧峰 之 父 ， 即 萧远山,玄果  少林寺 和尚  人物一 父  人物二,-1
TRAIN_SENT_ID_279048,,陈昊苏,陈毅,陈昊苏 子承父业 : 在 陈毅 兼任 外交部长 期间 ， 曾 陪同 周总理 多次 出国访问 。,人物一 子承父业  人物二 兼任 外交部长 期间  陪同 周总理 多次 出国访问,-1
TRAIN_SENT_ID_262391,,汪精卫,陈璧君,陈璧君 沦为 汉奸 : 嫁给 汪精卫 后 ， 陈璧君 泼辣 作风 不减 ， 积极 为 汪精卫 出谋划策 ， 始终 把 自己 的 命运 与 汪精卫 紧紧 联系 在 一起 。,人物二 沦为 汉奸  嫁给 人物一  人物二 泼辣 作风 不减  积极 人物一 出谋划策  始终 命运 人物一 紧紧 联系 一起,-1
TRAIN_SENT_ID_282494,,单嘉筠,单士元,单嘉筠 在 先父 单士元 晚年 ， 受 教 多年 。,人物一 先父 人物二 晚年  受 教 多年,-1
TRAIN_SENT_ID_266809,,萧峰,萧远山,被 萧峰 之 父 萧远山 偷袭 ， 一 掌震得 五脏 剧裂 而亡 。,人物一 父 人物二 偷袭  掌震得 五脏 剧裂 而亡,-1
TRAIN_SENT_ID_274384,,钱学森,钱均夫,钱学森 之 父 钱均夫 与 蒋 方震 早年 在 杭州 求是 书院 ( 浙江大学 前身 ) 是 同窗好友 ， 两家 过从甚密 。,人物一 父 人物二 蒋 方震 早年 杭州 求是 书院  浙江大学 前身  同窗好友  两家 过从甚密,-1
TRAIN_SENT_ID_258731,,刘禅,刘备,后主 是 刘禅 ， 后主 是 相对 于 刘备 而言 的 。,后主 人物一  后主 相对 人物二,-1
TRAIN_SENT_ID_283864,,姚小蝶,陆汉,姚小蝶 自小 被遗弃 ， 一心 寻找 杀父 仇人 陆汉 报仇 。,人物一 自小 被遗弃  一心 寻找 杀父 仇人 人物二 报仇,-1
TRAIN_SENT_ID_268690,,孔子,颜徵在,叔 梁纥 晚年 与 颜徵在 生下 了 孔子 。,叔 梁纥 晚年 人物二 生下 人物一,-1
TRAIN_SENT_ID_275189,,李敏,李静训,1 基本 信息 : 李敏 ， 父 李崇 ， 妻 乐平公主 杨丽华 女 宇文娥英 ， 女 李静训 。,基本 信息  人物一  父 李崇  妻 乐平公主 杨丽华 女 宇文娥英  女 人物二,-1
TRAIN_SENT_ID_279047,,陈昊苏,陈毅,链接 陈昊苏 之 父 陈毅 ： 与 孩子 交流 的 艺术,链接 人物一 父 人物二  孩子 交流 艺术,-1
TRAIN_SENT_ID_275448,,董祀,蔡文姬,为 使 蔡文姬 尽快 从 悲感 情绪 中 走出 ， 曹操 夫妇 精心 为 蔡文姬 安排 了 一场 婚姻 — — 新郎 是 比 蔡文姬 年少 12 岁 的 董祀 。,人物二 尽快 悲感 情绪 中 走出  曹操 夫妇 精心 人物二 安排 一场 婚姻   新郎 人物二 年少  岁 人物一,-1
TRAIN_SENT_ID_262343,,汪精卫,陈璧君,沦为 汉奸 : 嫁给 汪精卫 后 ， 陈璧君 泼辣 作风 不减 ， 积极 为 汪精卫 出谋划策 ， 始终 把 自己 的 命运 与 汪精卫 紧紧 联系 在 一起 。,沦为 汉奸  嫁给 人物一  人物二 泼辣 作风 不减  积极 人物一 出谋划策  始终 命运 人物一 紧紧 联系 一起,-1
TRAIN_SENT_ID_249418,,后稷,姜嫄,后稷 之所以 “ 克配 于 天 ” ， 在 《 生民 》 序中 说 得 再 明白 不过 ： “ 后稷 生于 姜嫄 ， 文 、 武之功 起于 后稷 ， 故 推以 配天 也 。 ”,人物一  克配 天    生民  序中 说 明白   人物一 生于 人物二  文  武之功 起于 人物一  推以 配天,-1
TRAIN_SENT_ID_268600,,潘金莲,武大郎,嫁给 武大郎 别说 潘金莲 一万个 不 愿意 ， 街坊邻居 觉得 不 般配 ， 西门庆 有 空子 可 钻 ， 就是 武松 也 未必 觉得 合适 。,嫁给 人物二 人物一 一万个 愿意  街坊邻居 觉得 般配  西门庆 空子 钻  武松 未必 觉得 合适,-1
TRAIN_SENT_ID_285971,,苏宝同,苏凤,苏凤 逃往 番邦 ， 生下 了 苏锦莲 和 苏宝同 两 姐弟 。,人物二 逃往 番邦  生下 苏锦莲 人物一 两 姐弟,-1
TRAIN_SENT_ID_283522,,郑樱桃,石虎,武帝 石虎 郑皇后 郑樱桃,武帝 人物二 郑皇后 人物一,-1
TRAIN_SENT_ID_283076,,罗松,罗艺,3 幕后 创作 : 《 对 花枪 》 原来 也 叫 《 父子 会 》 、 《 罗松 找父 》 ， 写 罗艺 赴京 赶考 ， 病滞 南阳 姜家集 ， 与 姜 桂枝 成婚 。,幕后 创作   花枪  原来  父子 会    人物一 找父   写 人物二 赴京 赶考  病滞 南阳 姜家集  姜 桂枝 成婚,-1
TRAIN_SENT_ID_266891,,谢培东,谢木兰,徐铁 英突 闯 金库 ， 指认 崔中 石 和 谢培东 都 是 共产党 ， 甚至 说 谢木兰 在 他 手上 ， 向 谢培东 逼要 账册 ， 反 被 谢培东 一道 锁 在 金库 。,徐铁 英突 闯 金库  指认 崔中 石 人物一 共产党  说 人物二 手上  人物一 逼要 账册  反 人物一 一道 锁 金库,-1
TRAIN_SENT_ID_268283,,秦始皇,扶苏,沙丘 之变 ， 又称 沙丘 之谋 ， 秦始皇 在 沙丘 宫 （ 今 河北省 广宗县 ） 去世 后 ， 赵高 与 李斯 杀害 公子 扶苏 ， 拥立 秦二世 即位 的 事件 。,沙丘 之变  又称 沙丘 之谋  人物一 沙丘 宫  河北省 广宗县  去世  赵高 李斯 杀害 公子 人物二  拥立 秦二世 即位 事件,-1
TRAIN_SENT_ID_259043,,刘备,刘禅,费祎 、 董允 为 侍中 和 侍郎 ， 共 为 刘备 、 诸葛亮 所 赏识 ， 后 服侍 后主 刘禅 （ 阿斗 ） 。,费祎  董允 侍中 侍郎  共 人物一  诸葛亮 赏识  服侍 后主 人物二  阿斗,-1
TRAIN_SENT_ID_284463,,张妃,张承,张妃 兄妹 : 张震 ， 袭父 张承 爵 都 乡侯 。,人物一 兄妹  张震  袭父 人物二 爵 乡侯,-1
TRAIN_SENT_ID_265833,,郭涛,郭子睿,郭涛 父子 （ 郭涛 ： 射手座 ； 郭子睿 ： 双鱼座 ）,人物一 父子  人物一  射手座  人物二  双鱼座,-1
TRAIN_SENT_ID_265283,,贾琏,贾赦,贾琏 私自 娶 了 尤二姐 ， 王熙凤 将 她 接回 荣国府 ， 正 准备 想 办法 来 算计 尤二姐 时 ， 贾赦 将 身边 丫头 秋桐 赏给 贾琏 为 妾 。,人物一 私自 娶 尤二姐  王熙凤 接回 荣国府  正 准备 想 办法 算计 尤二姐 时  人物二 身边 丫头 秋桐 赏给 人物一 妾,-1
TRAIN_SENT_ID_259349,,刘备,刘禅,刘备 去世 后 ， 诸葛亮 鞠躬尽瘁 扶佐 刘禅 继承 汉业 ； 但 刘禅 胸无大志 ， 乐不思蜀 ， 最后 丧失 了 蜀汉 江山 。,人物一 去世  诸葛亮 鞠躬尽瘁 扶佐 人物二 继承 汉业  人物二 胸无大志  乐不思蜀  最后 丧失 蜀汉 江山,-1
TRAIN_SENT_ID_272226,,金正恩,金正日,金正日 逝世 后 ， 金敬姬 被 看成 金正恩 “ 最 亲近 的 保护 人 ” 。,人物二 逝世  金敬姬 看成 人物一  亲近 保护,-1
TRAIN_SENT_ID_268076,,樊梨花,薛丁山,主要 剧情 是 ： 樊梨花 不满 父兄 叛国 投奔 西辽 ， 大义灭亲 ， 却 遭夫 薛丁山 认为 她 大逆不道 休妻 。,主要 剧情  人物一 不满 父兄 叛国 投奔 西辽  大义灭亲  遭夫 人物二 认为 大逆不道 休妻,-1
TRAIN_SENT_ID_263767,,秦始皇,赵姬,安国 继 王位 子楚 立太子 王立群 读 史记 之 秦始皇 生父 之谜 : 不韦 钓奇献 爱妾 赵姬 有身 嫁 异人,安国 继 王位 子楚 立太子 王立群 读 史记 人物一 生父 之谜  不韦 钓奇献 爱妾 人物二 有身 嫁 异人,-1
TRAIN_SENT_ID_266301,,季平子,季桓子,鲁定公 在位 的 第五年 ， 夏天 ， 季平子 去世 ， 季桓子 继位 。,鲁定公 在位 第五年  夏天  人物一 去世  人物二 继位,-1
TRAIN_SENT_ID_260413,,穆桂英,杨宗保,其实 ， 这些 传说 故事 基本上 都 是 虚构 ， 其中 的 一些 人物 如 杨八郎 、 杨宗保 、 穆桂英 、 八姐 九妹 、 杨 排风 、 十二 寡妇 更 与 历史 无涉 。,其实  传说 故事 基本上 虚构  人物 杨八郎  人物二  人物一  八姐 九妹  杨 排风  十二 寡妇 更 历史 无涉,-1
TRAIN_SENT_ID_263626,,叶莉,姚明,而 中国 人 也 习惯于 夫唱妇随 的 奋斗 模式 ， 以 姚明 、 叶莉 为例 ， 同 为 国手 ， 当 姚明 到 NBA 大展身手 后 ， 叶莉 就 选择 退役 ， 陪伴 姚明 。,中国 习惯于 夫唱妇随 奋斗 模式  人物二  人物一 为例  国手  人物二  大展身手  人物一 选择 退役  陪伴 人物二,-1
TRAIN_SENT_ID_263747,,秦始皇,赵姬,又 几个 月 过去 ， 赵姬 生下 了 一个男孩 ， 给 男孩 取名 叫政 ， 他 便是 日后 兼并 六国 的 秦始皇 。,几个 月 过去  人物二 生下 一个男孩  男孩 取名 叫政  便是 日后 兼并 六国 人物一,-1
TRAIN_SENT_ID_250194,,秦始皇,胡亥,赵高 思来想去 ， 决定 冒险 扣留 秦始皇 遗诏 ， 进而 谋划 胡亥 继位 ， 以 保住 自己 的 政治 地位 。,赵高 思来想去  决定 冒险 扣留 人物一 遗诏  谋划 人物二 继位  保住 政治 地位,-1
TRAIN_SENT_ID_284341,,唐筼,陈寅恪,总之 ， 唐筼 是 追随 陈寅恪 去 了 ， 这 对 才德兼备 的 唐筼 来说 是 生死 相随 ， 生命 相依 。,人物一 追随 人物二  才德兼备 人物一 生死 相随  生命 相依,-1
TRAIN_SENT_ID_278471,,胡善祥,朱瞻基,母 ： 诚孝昭 皇后 张氏 朱瞻基 后妃 : 恭 让 章 皇后 胡氏 ， 即 废后 胡善祥,母  诚孝昭 皇后 张氏 人物二 后妃  恭 章 皇后 胡氏  废后 人物一,-1
TRAIN_SENT_ID_259239,,刘备,刘禅,刘备 去世 后 ， 诸葛亮 又 匡济 危难 ， 辅佐 后主 刘禅 ， 多次 出师 北伐 中原 。,人物一 去世  诸葛亮 匡济 危难  辅佐 后主 人物二  多次 出师 北伐 中原,-1
TRAIN_SENT_ID_278463,,胡善祥,朱瞻基,宣宗 朱瞻基 皇后 胡善祥,宣宗 人物二 皇后 人物一,-1
TRAIN_SENT_ID_272583,,贾蓉,秦可卿,贾珍 贾蓉 父子 ， 喜 玩弄 女色 ， 蓉 妻 秦可卿 （ 刘慧茹 ） 竟 与 家 公有 奸情 ， 认真 荒唐 。,贾珍 人物一 父子  喜 玩弄 女色  蓉 妻 人物二  刘慧茹  竟 家 公有 奸情  认真 荒唐,-1
TRAIN_SENT_ID_284154,,公孙恭,公孙度,公孙恭 之 祖父 ， 与 公孙度 一起 移居 玄菟 。,人物一 祖父  人物二 一起 移居 玄菟,-1
TRAIN_SENT_ID_272327,,金正恩,金正日,金正日 （ 1997 年 10 月 － 2011 年 12 月 ， 任内 逝世 ） 领导人 中央委员会 第一书记 : 金正恩 （ 2012 年 劳动 党代表会议 选举 ）,人物二   年  月   年  月  任内 逝世  领导人 中央委员会 第一书记  人物一   年 劳动 党代表会议 选举,-1
TRAIN_SENT_ID_257339,,贾珍,尤氏,第六十三回 写 到 贾敬 吞金 呜呼 ， 贾珍 父子 在外 昼夜 奔丧 ， 路上 得知 尤氏 姐妹 到来 ， 这里 通行本 有 一处 极 重要 的 修改 。,第六十三回 写 贾敬 吞金  人物一 父子 在外 昼夜 奔丧  路上 得知 人物二 姐妹 到来  通行本 一处 极 重要 修改,-1
TRAIN_SENT_ID_266561,,张无忌,殷素素,在 回 武当 的 路上 ， 被 殷野王 （ 张无忌 舅父 ） 用 计 劫走 ， 交由 殷素素 （ 张无忌 之母 ） 于 王盘山 扬刀立 威 。,回 武当 路上  殷野王  人物一 舅父  计 劫走  交由 人物二  人物一 之母  王盘山 扬刀立 威,-1
TRAIN_SENT_ID_249818,,唐悠悠,关谷神奇,朋友 ： 唐悠悠 、 关谷神奇 、 秦羽墨 、 陈美嘉 、 吕子乔 、 张伟 、 林宛瑜 、 （ 弟弟 陆展博 的 恋人 ）,朋友  人物一  人物二  秦羽墨  陈美嘉  吕子乔  张伟  林宛瑜   弟弟 陆展博 恋人,-1
TRAIN_SENT_ID_263117,,毛福梅,蒋介石,当时 王世和 原本 奉 蒋介石 之命 ， 正 准备 兼程 赶返 故里 接出 表婶 毛福梅 ， 讵 料 不及 赶回 ， 已 发生意外 。,当时 王世和 原本 奉 人物二 之命  正 准备 兼程 赶返 故里 接出 表婶 人物一  讵 料 不及 赶回  发生意外,-1
TRAIN_SENT_ID_260502,,严嵩,严世蕃,初 ， 谏 臣 为 袁州 推官 时 ， 愤 严嵩 父子 乱政 ， 乃 密籍 严世蕃 奸逆不道 事 ， 因 御史 林润 上 之 。,初  谏 臣 袁州 推官 时  愤 人物一 父子 乱政  密籍 人物二 奸逆不道 事  御史 林润,-1
TRAIN_SENT_ID_259056,,刘备,刘禅,始 于昭烈 帝 刘备 ， 终于 后主 刘禅 ， 历 二帝 ， 共 四十三年 。,始 于昭烈 帝 人物一  终于 后主 人物二  历 二帝  共 四十三年,-1
TRAIN_SENT_ID_285307,,李凤娘,赵惇,光宗 赵惇 皇后 李凤娘,光宗 人物二 皇后 人物一,-1
TRAIN_SENT_ID_259009,,刘备,刘禅,刘备 为 争夺 已失 的 荆州 三郡 ， 于 次年 东征 孙权 ， 在 夷陵 被 东吴 陆逊 击败 退入 蜀 ， 病死 白帝 ， 刘禅 继位 。,人物一 争夺 已失 荆州 三郡  次年 东征 孙权  夷陵 东吴 陆逊 击败 退入 蜀  病死 白帝  人物二 继位,-1
TRAIN_SENT_ID_278955,,乔蚩尤,乔羽,同时 ， 其 听从 汁 光纪 之命 ， 魔化 乔蚩尤 ， 害 得 蚩尤 之 父 乔羽 魂飞魄散 ， 命丧 黄泉 。,听从 汁 光纪 之命  魔化 人物一  害 蚩尤 父 人物二 魂飞魄散  命丧 黄泉,-1
TRAIN_SENT_ID_278464,,胡善祥,朱瞻基,最 无辜 — — 明宣宗 朱瞻基 之 皇后 胡善祥,无辜   明宣宗 人物二 皇后 人物一,-1
TRAIN_SENT_ID_285460,,聂风,聂人王,79 . 聂风 之 父 聂人王 最终 被 谁 杀死 ？,人物一 父 人物二 最终 杀死,-1
TRAIN_SENT_ID_285268,,丁肇中,丁观海,24 ： 丁肇中 之 父 丁观海 ： 悉心 教导,人物一 父 人物二  悉心 教导,-1
TRAIN_SENT_ID_259074,,刘备,刘禅,刘备 逝世 于 白帝城 后 ， 丞相 诸葛亮 受 托孤 重任 辅助 后主 刘禅 ， 蜀汉 国力 慢慢 恢复 。,人物一 逝世 白帝城  丞相 诸葛亮 受 托孤 重任 辅助 后主 人物二  蜀汉 国力 慢慢 恢复,-1
TRAIN_SENT_ID_284223,,刘家良,刘湛,刘家良 之 父 刘湛 是 林世荣 弟子 ， 所以 算得 上 黄飞鸿 的 真正 传人 。,人物一 父 人物二 林世荣 弟子  算得 黄飞鸿 真正 传人,-1
TRAIN_SENT_ID_279249,,长孙无极,孟扶摇,书中 人物 ： 孟扶摇 、 长孙无极 、 宗越 （ 暗魅 ） 、 云痕 、 雅兰 珠 、 姚迅 、 铁成 等,书中 人物  人物二  人物一  宗越  暗魅   云痕  雅兰 珠  姚迅  铁成,-1
TRAIN_SENT_ID_259168,,刘备,刘禅,刘备 开创 蜀汉 江山 ， 是因为 有 诸葛亮 与 五虎上将 ； 同样 的 蜀汉 江山 ， 断送 在 阿斗 刘禅 手中 ， 只 因为 轻信 小人 。,人物一 开创 蜀汉 江山  是因为 诸葛亮 五虎上将  同样 蜀汉 江山  断送 阿斗 人物二 手中  轻信 小人,-1
TRAIN_SENT_ID_262297,,汪精卫,陈璧君,在 汪 伪政府 中 ， 陈璧君 任 中央 监察委员 ， 后 又 兼任 “ 广东 政治 指 汪精卫 与 陈壁 君导员 ” 。,汪 伪政府 中  人物二 中央 监察委员  兼任  广东 政治 指 人物一 陈壁 君导员,-1
TRAIN_SENT_ID_255704,,蒋介石,宋美龄,成年 后 ， 大姐 宋霭龄 嫁给 中华民国 财政部长 孔祥熙 ， 二姐 宋庆龄 不顾 父亲 反对 追随 嫁给 孙中山 （ 孙文 ） ， 小妹 宋美龄 最终 嫁给 蒋介石 。,成年  大姐 宋霭龄 嫁给 中华民国 财政部长 孔祥熙  二姐 宋庆龄 不顾 父亲 反对 追随 嫁给 孙中山  孙文   小妹 人物二 最终 嫁给 人物一,-1
TRAIN_SENT_ID_249351,,后稷,姜嫄,周人 的 始祖 、 帝喾 正妃 姜嫄 同样 是 踩 了 大 脚印 而 怀孕 生下 了 弃 ， 也 就是 后稷 。,周人 始祖  帝喾 正妃 人物二 同样 踩 脚印 怀孕 生下 弃  人物一,-1
TRAIN_SENT_ID_268565,,潘金莲,武大郎,潘金莲 摆杀 武大郎 ， 后 有 武松 杀嫂 ， 与 王婆 一起 曝尸 街头 无人 收拾 ， 弟弟 算是 给 哥哥 报 了 仇 。,人物一 摆杀 人物二  武松 杀嫂  王婆 一起 曝尸 街头 无人 收拾  弟弟 算是 哥哥 报 仇,-1
TRAIN_SENT_ID_275392,,谭嗣同,谭继洵,同治 十一年 （ 公元 1872 ） ， 谭嗣同 之 父 谭继洵 与 几位 在 京 湘籍 官员 购得 北 半截 胡同 官房 一所 ， 作为 湖南 合省 公产 。,同治 十一年  公元    人物一 父 人物二 几位 京 湘籍 官员 购得 北 半截 胡同 官房 一所  湖南 合省 公产,-1
TRAIN_SENT_ID_260500,,严嵩,严世蕃,时 严嵩 父子 柄政 ， 吴鹏 在 吏部 ， 凡 百官 进退 ， 悉 听命于 严世蕃 ， 无敢 自专 ， 实充位 而已 ， 中外 人心 ， 无不 鄙薄 。,时 人物一 父子 柄政  吴鹏 吏部  百官 进退  悉 听命于 人物二  无敢 自专  实充位  中外 人心  无不 鄙薄,-1
TRAIN_SENT_ID_284770,,陈掌,卫少儿,卫孺 嫁给 了 太仆 公孙贺 ， 卫少儿 嫁给 了 陈平 的 后人 詹事 陈掌 。,卫孺 嫁给 太仆 公孙贺  人物二 嫁给 陈平 后人 詹事 人物一,-1
TRAIN_SENT_ID_273774,,霍震霆,霍英东,27 ： 霍震霆 之 父 霍英东 ： 敢于 放手,人物一 父 人物二  敢于 放手,-1
TRAIN_SENT_ID_284804,,利奥波德二世,利奥波德一世,比利时 利奥波德二世 夫妇 1865 年 ， 利奥波德一世 病死 ， 小 利奥波德 继位 ， 时年 30 岁 ， 他 也 成为 比利时 第一位 本土 出生 的 国王 。,比利时 人物一 夫妇  年  人物二 病死  利奥波德 继位  时年  岁  成为 比利时 第一位 本土 出生 国王,-1
TRAIN_SENT_ID_278158,,赵姨娘,贾政,周姨娘 ， 《 红楼梦 》 中 人物 ， 为 贾政 妾 ， 常 与 赵姨娘 一起 出现 于 奉 侍贾母 的 场面 上 。,周姨娘   红楼梦  中 人物  人物二 妾  常 人物一 一起 出现 奉 侍贾母 场面,-1
TRAIN_SENT_ID_259264,,刘备,刘禅,刘备 病逝 ， 诸葛亮 立 年幼 的 刘禅 为帝 ， 曹丕 乘机 派 五 路大军 攻击 西蜀 。,人物一 病逝  诸葛亮 立 年幼 人物二 为帝  曹丕 乘机 派 五 路大军 攻击 西蜀,-1
TRAIN_SENT_ID_262437,,扶苏,秦始皇,赵高 、 李斯 、 胡亥 要 密谋 除长 以立幼 ， 只要 嫡长子 扶苏 或者 其他 比 胡亥 年长 的 秦始皇 之 嫡子 活着 ， 胡亥 就 没有 资格 即位 。,赵高  李斯  胡亥 密谋 除长 以立幼  嫡长子 人物一 胡亥 年长 人物二 嫡子 活着  胡亥 没有 资格 即位,-1
TRAIN_SENT_ID_259246,,刘备,刘禅,刘备 死 ， 受托 辅助 后主 刘禅 。,人物一 死  受托 辅助 后主 人物二,-1
TRAIN_SENT_ID_259324,,刘备,刘禅,章武 三年 （ 223 年 ） ， 刘备 去世 ， 刘禅 继位 ， 任命 来敏 为 虎贲 中郎将 。,章武 三年   年   人物一 去世  人物二 继位  任命 来敏 虎贲 中郎将,-1
TRAIN_SENT_ID_276411,,秦始皇,秦庄襄王,1 重大事件 : 前 247 年 — — 秦始皇 之 父 秦庄襄王 驾崩 。,重大事件  前  年   人物一 父 人物二 驾崩,-1
TRAIN_SENT_ID_277942,,杨文昌,杨威,同年 5 月 杨文昌 和 父亲 杨威 参与 湖南卫视 大型 亲子 真人秀 节目 《 爸爸 去 哪儿 》 第二季 的 录制 ， 引发 众多 网友 关注 。,同年  月 人物一 父亲 人物二 参与 湖南卫视 大型 亲子 真人秀 节目  爸爸  第二季 录制  引发 众多 网友 关注,-1
TRAIN_SENT_ID_259203,,刘备,刘禅,章武 三年 （ 223 年 ） 四月 ， 刘备 病情恶化 ， 从 成都 招来 丞相 诸葛亮 ， 以后 事 、 刘禅 、 江山 托 之 。,章武 三年   年  四月  人物一 病情恶化  成都 招来 丞相 诸葛亮  以后 事  人物二  江山 托,-1
TRAIN_SENT_ID_282730,,霍思纬,霍震寰,社交活动 : 霍思纬 自小 十分 乖巧 ， 读书 又 用功 ， 深得 父亲 霍震寰 及 母亲 陈琪琪 疼爱 。,社交活动  人物一 自小 十分 乖巧  读书 用功  深得 父亲 人物二 母亲 陈琪琪 疼爱,-1
TRAIN_SENT_ID_279482,,谭梅,朱军,谭梅 说 ， 和 所有 将 做 父亲 的 人 一样 ， 当初 朱军 对于 儿子 的 到来 充满 了 惊喜 和 期待 。,人物一 说  做 父亲  当初 人物二 儿子 到来 充满 惊喜 期待,-1
TRAIN_SENT_ID_254242,,曹襄,平阳公主,曹时 娶 了 平阳公主 ， 生 儿子 曹襄 。,曹时 娶 人物二  生 儿子 人物一,-1
TRAIN_SENT_ID_283977,,白万剑,史小翠,他 娶 了 史小翠 以后 ， 生有 一子 「 气寒 西北 」 白万剑 。,娶 人物二 以后  生有 一子  气寒 西北  人物一,-1
TRAIN_SENT_ID_279557,,李芳远,李成桂,同年 四月 ， 再次 派遣 臣子 李贵 龄 入贡 ， 李芳远 上 父亲 李成桂 有 疾 ， 需要 龙脑 、 沈香 、 苏合 、 香油 等物 ， 并 请求 与 明朝 互市 。,同年 四月  再次 派遣 臣子 李贵 龄 入贡  人物一 父亲 人物二 疾  需要 龙脑  沈香  苏合  香油 等物  请求 明朝 互市,-1
TRAIN_SENT_ID_286489,,田壮壮,田方,田壮壮 的 父亲 田方 是 北京 电影演员 剧团 第一任 团长 ， 也 是 一名 演员 ， 代表作 有 《 壮士 凌云 》 、 《 风云 儿女 》 等 。,人物一 父亲 人物二 北京 电影演员 剧团 第一任 团长  一名 演员  代表作  壮士 凌云    风云 儿女,-1
TRAIN_SENT_ID_287190,,封皇后,拓跋沙漠汗,北 魏道武 帝 拓跋 圭 称帝 时 ， 追 谥 拓跋沙漠汗 为文 皇帝 ， 封 夫人 为文 皇后 ， 即 封皇后 。,北 魏道武 帝 拓跋 圭 称帝 时  追 谥 人物二 为文 皇帝  封 夫人 为文 皇后  人物一,-1
TRAIN_SENT_ID_274380,,钱学森,钱均夫,钱学森 的 父亲 钱均夫 是 杭州人 ， 曾 出任 浙江省 立 第一 中学 ( 现 杭州第四中学 ) 校长 。,人物一 父亲 人物二 杭州人  出任 浙江省 立 第一 中学  现 杭州第四中学  校长,-1
TRAIN_SENT_ID_268723,,秦可卿,贾蓉,秦可卿 长成 个 大美人 ， 因 父亲 素 与 贾家 有些 瓜葛 ， 故结 了 亲 ， 嫁给 贾珍之 子 贾蓉 为妻 ， 所以 脂砚斋 评 她 “ 贫女 得 居 富室 ” 。,人物一 长成 大美人  父亲 素 贾家 瓜葛  故结 亲  嫁给 贾珍之 子 人物二 为妻  脂砚斋 评  贫女 居 富室,-1
TRAIN_SENT_ID_277397,,樊姬,楚庄王,张九龄 在 《 樊姬 墓 》 一诗 中 则 对 樊姬 的 贤能 及其 对 楚庄王 产生 的 影响 与 作用 给予 了 充分 的 褒扬 ： “ 楚子 初呈志 ， 樊姬 尝献 箴 。,张九龄  人物一 墓  一诗 中 人物一 贤能 人物二 产生 影响 作用 给予 充分 褒扬   楚子 初呈志  人物一 尝献 箴,-1
TRAIN_SENT_ID_286962,,何碧笙,安剑清,何碧笙 家庭 : 外公 ： 楚大刀 父亲 ： 安剑清 母亲 ： 安大娘 。,人物一 家庭  外公  楚大刀 父亲  人物二 母亲  安大娘,-1
TRAIN_SENT_ID_274512,,薛丁山,薛仁贵,大唐 征西 ， 讲述 的 是 唐代 武将 薛丁山 得悉 父亲 薛仁贵 西征 哈迷国 被 围 ， 与 妺 金莲 带兵 相救 。,大唐 征西  讲述 唐代 武将 人物一 得悉 父亲 人物二 西征 哈迷国 围  妺 金莲 带兵 相救,-1
TRAIN_SENT_ID_286522,,李小龙,李英儒,李小龙 的 父亲 是 《 野火 春风 斗 古城 》 的 作者 军旅 作家 李英儒 。,人物一 父亲  野火 春风 斗 古城  作者 军旅 作家 人物二,-1
