sent_id,sent_id,entity1,entity2,sent,processed_sent,human
TRAIN_SENT_ID_270509,,关平,关羽,主公 我要 黄将 : 关平 : 关羽 的 并 女 ， 一直 跟随 关羽 出征 . 东吴 趁 关羽 攻奥城时 ， 突然 背弃 吴蜀 同盟 ， 愉袭 荆州 。,主公 我要 黄将  人物一  人物二 女  一直 跟随 人物二 出征  东吴 人物二 攻奥城时  突然 背弃 吴蜀 同盟  愉袭 荆州,-1
TRAIN_SENT_ID_249358,,后稷,姜嫄,后稷 生于 姜嫄 ， 文武 之功 起于 后稷 ， 故 推以 配天 焉 。 ”,人物一 生于 人物二  文武 之功 起于 人物一  推以 配天,-1
TRAIN_SENT_ID_274792,,丁玲,胡也频,记 胡也频 记 丁玲 记 丁玲 续集 从文 自传 从 现实 学习,记 人物二 记 人物一 记 人物一 续集 从文 自传 现实 学习,-1
TRAIN_SENT_ID_254354,,金友庄,高凌风,金友庄 育儿 心得 : 金友庄 对 自己 生 的 3 个 小孩 总 一板一眼 ， 她 说 ， 高 大哥 以林芷兰 高凌风 前有 太多 歪理 ， 对 小孩 太好 。,人物一 育儿 心得  人物一 生  小孩 总 一板一眼  说  高 大哥 以林芷兰 人物二 前有 太多 歪理  小孩 太好,-1
TRAIN_SENT_ID_283057,,余克稷,张瑞芳,"张瑞芳 觉得 , 他 的 信比 余克稷 更 有 魅力 。",人物二 觉得  信比 人物一 更 魅力,1
TRAIN_SENT_ID_286463,,张龙,张麟,张麟 ， 张龙 子,人物二  人物一 子,-1
TRAIN_SENT_ID_268482,,曹襄,卫长公主,卫长公主 与 曹襄 的 后嗣 到 东汉 还享 着 侯位 ， 可谓 是 风光 的 百年 侯爵 。,人物二 人物一 后嗣 东汉 还享 侯位  可谓 风光 百年 侯爵,-1
TRAIN_SENT_ID_286001,,杨容姬,潘安,女 ： 杨容姬 ， 潘岳 （ 潘安 ） 妻 。,女  人物一  潘岳  人物二  妻,-1
TRAIN_SENT_ID_254092,,霍启刚,郭晶晶,霍启刚 表示 也 有 陪 太太 郭晶晶 进产房 ， 但 没有 为 宝宝 剪 脐带 。,人物一 表示 陪 太太 人物二 进产房  没有 宝宝 剪 脐带,1
TRAIN_SENT_ID_281935,,贺捷生,贺龙,贺捷生 将军 ， 一切 皆 因 她 是 贺龙 的 女儿 文 / 苏容,人物一 将军  皆 人物二 女儿 文  苏容,-1
TRAIN_SENT_ID_266569,,许晋亨,李嘉欣,外界 曾 传言 ， 许晋亨 及其 家人 对于 李嘉欣 的 这种 表现 ， 嘴上 不 说 ， 但 心里 却 累积 了 不满 ， 造成 李嘉欣 嫁入 豪门 一波三折 。,外界 传言  人物一 家人 人物二 这种 表现  嘴上 说  心里 累积 不满  造成 人物二 嫁入 豪门 一波三折,1
TRAIN_SENT_ID_255159,,胡斐,胡一刀,二十六 ， 胡一刀 夫妇 遇难 ， 平阿四 救 走 胡斐 。,二十六  人物二 夫妇 遇难  平阿四 救 走 人物一,1
TRAIN_SENT_ID_275525,,杨炳莲,张平,逃跑 数月 后 ， 张平 让 杨炳莲 带 着 孩子 回娘家 或 张家 坨 。,逃跑 数月  人物二 人物一 带 孩子 回娘家 张家 坨,1
TRAIN_SENT_ID_278101,,乐安公主,巩永固,巩永固 是 崇祯 皇帝 的 妹夫 ， 乐安公主 的 驸马 。,人物二 崇祯 皇帝 妹夫  人物一 驸马,-1
TRAIN_SENT_ID_268236,,王小利,李琳,《 幸福 的 我们 俩 》 是 王小利 、 李琳 演唱 的 一首 歌曲 。,幸福 俩  人物一  人物二 演唱 一首 歌曲,1
TRAIN_SENT_ID_283142,,班淑娴,何太冲,这么一来 ， 班淑娴 和 何太冲 才 知 他 已 在 不知不觉 间 被 张无忌 点 了 穴道 ， 心下 暗自 骇然 。,这么一来  人物一 人物二 知 不知不觉 间 张无忌 点 穴道  心下 暗自 骇然,1
TRAIN_SENT_ID_263126,,毛福梅,蒋介石,蒋介石 元配 毛福梅 既 要 侍候 婆婆 ， 又 要 帮忙 照管 盐铺 生意 ， 忙 进忙 出 ， 遇 有 杂务 ， 即 吩咐 王世和 代为 操办 。,人物二 元配 人物一 侍候 婆婆  帮忙 照管 盐铺 生意  忙 进忙 出  遇 杂务  吩咐 王世和 代为 操办,1
TRAIN_SENT_ID_261464,,莫绍谦,慕咏飞,终于 ， 莫绍谦 发现 当年 莫家 危难 是 慕咏飞 一手 策划 ， 反击 慕家 。,终于  人物一 发现 当年 莫家 危难 人物二 一手 策划  反击 慕家,1
TRAIN_SENT_ID_248878,,窦滔,苏蕙,在 苏蕙 的 家乡 武功 和 窦滔 的 家乡 扶风 也 有 关于 璇玑 图 的 传说 。,人物二 家乡 武功 人物一 家乡 扶风 璇玑 图 传说,-1
TRAIN_SENT_ID_268588,,潘金莲,武大郎,武大郎 史海 寻真 : 新版 水浒 里 的 武大郎 和 潘金莲 风传 明朝 武大郎 （ 武植 ） 便是 《 水浒 》 中 武大郎 的 原型 ， 此言 不确 ， 原因 如下 ：,人物二 史海 寻真  新版 水浒 里 人物二 人物一 风传 明朝 人物二  武植  便是  水浒  中 人物二 原型  此言 不确  原因,-1
TRAIN_SENT_ID_268578,,潘金莲,武大郎,潘金莲 这种 人 的 爱情 ， 永远 无例外 地 向着 西门庆 ， 不 向着 武大郎 ， 为什么 ？,人物一 这种 爱情  永远 无例外 西门庆  人物二,1
TRAIN_SENT_ID_254057,,朱芳雨,胡美,胡美 亮相 抢镜 : 2013 年 3 月 27 日 ， 2012 - 2013 赛季 CBA 总决赛 第 3 场 ， 国手 朱芳雨 妻儿 领衔 宏远 亲属 团 现场 助阵 。,人物二 亮相 抢镜   年  月  日     赛季  总决赛  场  国手 人物一 妻儿 领衔 宏远 亲属 团 现场 助阵,1
TRAIN_SENT_ID_286458,,齐良末,齐白石,齐良末 8 岁 时 ， 齐白石 老人 就 开始 手把手 地教 他 绘画 ， 还 专门 为 他 制作 了 作画 的 范本 。,人物一  岁 时  人物二 老人 手把手 地教 绘画  专门 制作 作画 范本,1
TRAIN_SENT_ID_270336,,关平,关羽,* 关羽 击败 卞喜 后 可到 东面 洛阳 更新 装备 最好 能 多 买 一把 铜刀 存到 役所 留给 关平,人物二 击败 卞喜 可到 东面 洛阳 更新 装备 最好 买 一把 铜刀 存到 役所 留给 人物一,1
TRAIN_SENT_ID_277201,,张茜,张卫健,"⒉ 我要 轻闲 - 张茜 / 张卫健 ( "" 小宝 与 康熙 "" 片尾曲 ） 国语",⒉ 我要 轻闲  人物一  人物二   小宝 康熙  片尾曲  国语,1
TRAIN_SENT_ID_260384,,穆桂英,杨宗保,杨宗保 因破 天门 阵寻 降龙木 误闯 穆柯寨 ， 与 穆桂英 私结 姻缘 ， 即 此地 也 。,人物二 因破 天门 阵寻 降龙木 误闯 穆柯寨  人物一 私结 姻缘,1
TRAIN_SENT_ID_253600,,沈浪,朱七七,"罢了 罢了 , 反正 也 不是 这具 身体 的 正主 , 沈浪 、 朱七七 、 白飞飞 什么 的 就是 那天 上 的 浮云 。",反正 这具 身体 正主  人物一  人物二  白飞飞 那天 浮云,1
TRAIN_SENT_ID_254353,,金友庄,高凌风,她 放弃 CNN 机会 ， 接受 爸爸 建议 回 台 发展 ， 高凌风 开心 得 整夜 睡不着 ， 她 与 金友庄 相处 像 朋友 ， 都 喊 她 “ 小金 阿姨 ” 。,放弃  机会  接受 爸爸 建议 回 台 发展  人物二 开心 整夜 睡不着  人物一 相处 朋友  喊  小金 阿姨,1
TRAIN_SENT_ID_274417,,曾江,曾慕雪,曾慕雪 为 曾江 及 前妻 邓拱璧 之 女儿 ， 现为 PIP 剧场 全职 演员 。,人物二 人物一 前妻 邓拱璧 女儿  现为  剧场 全职 演员,-1
TRAIN_SENT_ID_266391,,蔡赟,王娜,在 得知 蔡赟 饮恨 男双 时 ， 王娜 再次 告诉 他 ： “ 吸取 这次 比赛 的 经验教训 就 可以 了 ， 重要 的 是从 明年 开始 的 奥运 积分 赛 。,得知 人物一 饮恨 男双 时  人物二 再次 告诉   吸取 比赛 经验教训  重要 是从 明年 奥运 积分 赛,1
TRAIN_SENT_ID_285374,,欧阳兰兰,欧阳天,《 永不 瞑目 》 里 ， 孙红雷 的 戏 很少 ， 他演 黑社会 打手 ， 保护 欧阳天 和 欧阳兰兰 ， 引诱 肖童 再次 吸毒 。,永不 瞑目  里  孙红雷 戏 很少  他演 黑社会 打手  保护 人物二 人物一  引诱 肖童 再次 吸毒,1
TRAIN_SENT_ID_278955,,乔蚩尤,乔羽,同时 ， 其 听从 汁 光纪 之命 ， 魔化 乔蚩尤 ， 害 得 蚩尤 之 父 乔羽 魂飞魄散 ， 命丧 黄泉 。,听从 汁 光纪 之命  魔化 人物一  害 蚩尤 父 人物二 魂飞魄散  命丧 黄泉,-1
TRAIN_SENT_ID_258983,,王熙凤,贾琏,并 用药 将 二姐 的 身孕 堕下 ， 待 贾琏 回来 要 与 二姐 相见 ， 被 王熙凤 阻拦 。,用药 二姐 身孕 堕下  人物二 回来 二姐 相见  人物一 阻拦,1
TRAIN_SENT_ID_269733,,霍思纬,陈琪琪,霍思纬 个人 背景 : 来头 ： 霍英东 长房 孙女 ， 霍震寰 陈琪琪 女儿,人物一 个人 背景  来头  霍英东 长房 孙女  霍震寰 人物二 女儿,-1
TRAIN_SENT_ID_266376,,刘梅,胡一统,刘梅 说 杨欣 全部 搞错 了 ， 把 胡一统 当成 了 英雄 偶像 ， 胡一统 听 了 倒 很 享受 。,人物一 说 杨欣 搞错  人物二 当成 英雄 偶像  人物二 听 倒 享受,1
TRAIN_SENT_ID_254366,,宋凝,沈岸,【 新婚 那夜 ， 宋凝 只想 对 沈岸 说 一句 话 ， 还 未 开口 ， 沈岸 便 抛 下 她 离开 了 ...,新婚 那夜  人物一 只想 人物二 说 一句 话  未 开口  人物二 便 抛 离开,1
TRAIN_SENT_ID_284603,,李顺,李敷,李敷 是 李顺 的 儿子 。,人物二 人物一 儿子,-1
TRAIN_SENT_ID_271344,,何泽慧,钱三强,作家 祁淑英 2009 年 1 月 出版 的 《 钱三强 与 何泽慧 》 一书 ， 被 钱 家人 指责 存在 大量 抄袭 臆造 的 错误 。,作家 祁淑英  年  月 出版  人物二 人物一  一书  钱 家人 指责 存在 大量 抄袭 臆造 错误,1
TRAIN_SENT_ID_256106,,蒋介石,宋美龄,因 三四十 年代 ， 宋美龄 经常 在 这里 做礼拜 ， 与 蒋介石 在 此 下榻 休息 ， 便 称之为 “ 美龄宫 ” ， 名称 沿用至今 。,三四十 年代  人物二 经常 做礼拜  人物一 下榻 休息  便 称之为  美龄宫   名称 沿用至今,1
TRAIN_SENT_ID_262310,,汪精卫,陈璧君,堕落 政客 的 爱情 悲歌 ： 陈璧君 与 汪精卫 ( 3 ),堕落 政客 爱情 悲歌  人物二 人物一,1
TRAIN_SENT_ID_267345,,许志安,郑秀文,旗下 艺人 有 刘德华 、 郑秀文 、 韩红 、 黄晓明 、 杨千嬅 、 余文乐 、 任贤齐 、 许志安 、 苏永康 等 。,旗下 艺人 刘德华  人物二  韩红  黄晓明  杨千嬅  余文乐  任贤齐  人物一  苏永康,1
TRAIN_SENT_ID_274858,,晏几道,晏殊,晏几道 画像 后人 在 所 讨论 到 北宋 词人 的 时候 ， 通常 把 晏殊 称为 大晏 ， 而 把 晏几道 称为 小晏 。,人物一 画像 后人 讨论 北宋 词人  通常 人物二 称为 大晏  人物一 称为 小晏,-1
TRAIN_SENT_ID_278464,,胡善祥,朱瞻基,最 无辜 — — 明宣宗 朱瞻基 之 皇后 胡善祥,无辜   明宣宗 人物二 皇后 人物一,-1
TRAIN_SENT_ID_286842,,岳天祯,岳存,岳天祯 ， 岳存 子 ， 大名 冠氏 人 。,人物一  人物二 子  大名 冠氏,-1
TRAIN_SENT_ID_255889,,蒋介石,宋美龄,蒋介石 与 宋美龄 新婚 合影 蒋中正 在 14 岁 时 ， 经 媒妁之言 ， 娶 同村 毛福梅 （ 1882 年 － 1939 年 ） 为妻 。,人物一 人物二 新婚 合影 蒋中正  岁 时  媒妁之言  娶 同村 毛福梅   年   年  为妻,1
TRAIN_SENT_ID_250276,,秦始皇,胡亥,亲近 秦始皇 少子 胡亥 。,亲近 人物一 少子 人物二,-1
TRAIN_SENT_ID_270890,,贾午,韩寿,轶事 典故 : 贾午 的 爸爸 贾充 是 西晋 的 权臣 ， 经常 在家 召集 幕僚 开会 ， 英俊 青年 韩寿 也 是 与会者 之一 。,轶事 典故  人物一 爸爸 贾充 西晋 权臣  经常 在家 召集 幕僚 开会  英俊 青年 人物二 与会者,-1
TRAIN_SENT_ID_287168,,汤洛雯,汤镇宗,汤洛雯 （ 第五 季 人气 选手 、 汤镇宗 女儿 ）,人物一  第五 季 人气 选手  人物二 女儿,-1
TRAIN_SENT_ID_255658,,蒋介石,宋美龄,民国 男人 最 爱 徐志摩 : 女人 的 身边 是 男人 ， 比如 张爱玲 与 胡兰成 ， 陈洁如 、 宋美龄 与 蒋介石 ， 陆小曼 、 林徽因 和 徐志摩 等 。,民国 男人 爱 徐志摩  女人 身边 男人  张爱玲 胡兰成  陈洁如  人物二 人物一  陆小曼  林徽因 徐志摩,1
TRAIN_SENT_ID_270892,,贾午,韩寿,贾午 轶事 典故 : 贾午 的 爸爸 贾充 是 西晋 的 权臣 ， 经常 在家 召集 幕僚 开会 ， 英俊 青年 韩寿 也 是 与会者 之一 。,人物一 轶事 典故  人物一 爸爸 贾充 西晋 权臣  经常 在家 召集 幕僚 开会  英俊 青年 人物二 与会者,-1
TRAIN_SENT_ID_270608,,赵宏博,申雪,星尚 体坛 经典 人物 ： 申雪 、 赵宏博,星尚 体坛 经典 人物  人物二  人物一,1
TRAIN_SENT_ID_257276,,纪晓芙,殷梨亭,再 想想 纪晓芙 和 殷梨亭 几乎 是 没有 任何 私下 的 接触 的 （ 虽然 有 婚约 ） ， 纪晓芙 会 和 大家 配合默契 吗 ？,想想 人物一 人物二 几乎 没有 私下 接触  婚约   人物一 会 配合默契,1
TRAIN_SENT_ID_285460,,聂风,聂人王,79 . 聂风 之 父 聂人王 最终 被 谁 杀死 ？,人物一 父 人物二 最终 杀死,-1
TRAIN_SENT_ID_249910,,张无忌,赵敏,张无忌 和 赵敏 在 冰火 岛 定居 。,人物一 人物二 冰火 岛 定居,1
TRAIN_SENT_ID_264056,,刘备,孙尚香,孙尚香 将 “ 蟹黄 包 ” 装上 用 芦叶 制成 的 小船 ， 随 长江 水 漂流 至 大海 ， 表示 自己 对 刘备 海枯石烂 心不变 。,人物二  蟹黄 包  装上 芦叶 制成 小船  长江 水 漂流 大海  表示 人物一 海枯石烂 心不变,1
TRAIN_SENT_ID_277322,,宁风致,宁荣荣,朋友 ： 戴沐白 、 奥斯卡 、 马红俊 、 宁荣荣 、 朱竹清 、 独孤 博 、 宁风致 、 古榕 、 尘心 、 波塞 西 、 小白 等 。,朋友  戴沐白  奥斯卡  马红俊  人物二  朱竹清  独孤 博  人物一  古榕  尘心  波塞 西  小白,-1
TRAIN_SENT_ID_283239,,解九爷,解连环,解连环 从小 就 极其 聪明 ， 他 的 名字 是 在 儿时 解九爷 给 改过来 的 ， 因 他 曾 在 三岁时 就 可 凭 自己 解开 九连环 ， 因此 得 “ 解连环 ” 名 。,人物二 从小 极其 聪明  名字 儿时 人物一 改过来  三岁时 解开 九连环   人物二  名,-1
TRAIN_SENT_ID_269225,,陆雪琪,张小凡,陆雪琪 大吃一惊 ， 哪里 还顾 的 了 那么 多 ， 连忙 抢上 ， 将 小白 推开 ， 一把 抱住 张小凡 ， 顾不得 血污 ， 用 自己 袖口 替 他 擦拭 着 。,人物一 大吃一惊  还顾  连忙 抢上  小白 推开  一把 抱住 人物二  顾不得 血污  袖口 擦拭,1
TRAIN_SENT_ID_276830,,唐姬,刘发,汉景帝 刘启 与 唐姬 生 长沙 定王 刘发 。,汉景帝 刘启 人物一 生 长沙 定王 人物二,-1
TRAIN_SENT_ID_257016,,李嫣,王菲,更 有 消息 称 ， 王菲 已 向 身边 好友 透露 ， 有意 从 李亚鹏 手中 夺回 李嫣 的 抚养权 。,更 消息 称  人物二 身边 好友 透露  有意 李亚鹏 手中 夺回 人物一 抚养权,1
TRAIN_SENT_ID_285268,,丁肇中,丁观海,24 ： 丁肇中 之 父 丁观海 ： 悉心 教导,人物一 父 人物二  悉心 教导,-1
TRAIN_SENT_ID_251104,,尤三姐,柳湘莲,了解 了 张茂渊 为 人 个性 的 李开弟 象 尤三姐 自刎 后 的 柳湘莲 ， 苦恼 ， 悔恨 ， 深深 的 自责 。,了解 张茂渊 个性 李开弟 象 人物一 自刎 人物二  苦恼  悔恨  深深 自责,1
TRAIN_SENT_ID_266020,,韦春花,韦小宝,2006 年 ， 在 张纪中 版 《 鹿鼎记 》 里 饰演 韦小宝 的 娘亲 韦春花 。,年  张纪中 版  鹿鼎记  里 饰演 人物二 娘亲 人物一,1
TRAIN_SENT_ID_281719,,龚慈恩,林炜,林炜 拍 情欲戏 事前 不 报备 不 小心 让 老婆 龚慈恩 看到 罚 2 万,人物二 拍 情欲戏 事前 报备 小心 老婆 人物一 看到 罚  万,1
TRAIN_SENT_ID_284255,,吴玉娇,朱元璋,吴玉娇 ， 为 元代 末年 高官 吴郡 之 女 ， 明朝 开国 皇帝 朱元璋 第一任 贵妃 。,人物一  元代 末年 高官 吴郡 女  明朝 开国 皇帝 人物二 第一任 贵妃,-1
TRAIN_SENT_ID_283373,,李京实,崔明浩,李京实 1 月 23 日 与 企业家 崔明浩 在 婚 ， 目前 正以 DJ 的 身份 活动 着 。,人物一  月  日 企业家 人物二 婚  目前 正以  身份 活动,1
TRAIN_SENT_ID_272882,,杨威,杨云,不过 ， 杨云 并 没有 直接 降落 在 地 ， 而是 停 在 半空 考验 杨威 ― ― 要 杨威 顺着 绳子 爬 到 热气球 上 。,人物二 没有 直接 降落  停 半空 考验 人物一 ― ― 人物一 绳子 爬 热气球,1
TRAIN_SENT_ID_266973,,关索,关羽,弟弟 ： 关索 ， 关羽 幼子 。,弟弟  人物一  人物二 幼子,-1
TRAIN_SENT_ID_259921,,花月奴,江枫,这 一件 让 邀 月 、 怜星 知道 后 大为 震怒 ， 于是 ， 江枫 带同 花月奴 一同 投奔 其 好友 － 大侠 燕南天 。,一件 邀 月  怜星 知道 大为 震怒   人物二 带同 人物一 一同 投奔 好友  大侠 燕南天,1
TRAIN_SENT_ID_266946,,关索,关羽,但是 没有 材料 证明 这个 关索 与 三国 关羽 有关 。,没有 材料 证明 人物一 三国 人物二,-1
TRAIN_SENT_ID_262845,,熊美玲,林秋离,歌曲 《 谁 若 爱 你 比 我 多 》 由 林秋离 填词 ， 熊美玲 谱曲 ， 涂惠元 编曲 ， 邰正宵 演唱 版本 收录于 1994 年 6 月 发行 的 《 千纸鹤 》 专辑 。,歌曲  爱  人物二 填词  人物一 谱曲  涂惠元 编曲  邰正宵 演唱 版本 收录于  年  月 发行  千纸鹤  专辑,1
TRAIN_SENT_ID_274003,,白素,卫斯理,《 愿望 之猴 》 ： 白素 为了 成全 贝梦丹 和 卫斯理 黯然 离去 。,愿望 之猴   人物一 成全 贝梦丹 人物二 黯然 离去,1
TRAIN_SENT_ID_255771,,蒋介石,宋美龄,在 其 行辕 未 建成 之前 ， 蒋介石 与 宋美龄 亦 曾 住 在 绣花 楼 里 。,行辕 未 建成 之前  人物一 人物二 住 绣花 楼 里,1
TRAIN_SENT_ID_262380,,汪精卫,陈璧君,汪精卫 计划 他 和 黄复生 先期 抵达 北京 作好 准备 ， 然后 由 喻培伦 、 陈璧君 等 人 再 携带 炸弹 到 北京 。,人物一 计划 黄复生 先期 抵达 北京 作好 准备  喻培伦  人物二 携带 炸弹 北京,1
TRAIN_SENT_ID_258409,,张兆和,沈从文,解放 前夕 ， 面对 新旧 势力 的 两面 讨伐 ， 沈从文 在 抑郁 中 自杀未遂 ， 张兆和 苦撑 危局 ， 最终 唤醒 沈从文 。,解放 前夕  面对 新旧 势力 两面 讨伐  人物二 抑郁 中 自杀未遂  人物一 苦撑 危局  最终 唤醒 人物二,1
TRAIN_SENT_ID_274816,,丁玲,胡也频,两 年间 ， 他 陆续 写出 了 几十篇 作品 ， 其中 包括 三篇 传记 ： 《 记 胡也频 》 、 《 记 丁玲 女士 》 和 《 从文 自传 》 。,两 年间  陆续 写出 几十篇 作品  包括 三篇 传记   记 人物二    记 人物一 女士   从文 自传,-1
TRAIN_SENT_ID_273436,,杨乐乐,汪涵,几个 月 前 ， 汪涵 就 亲口 承认 即将 当爹 的 喜讯 ， 杨乐乐 也 辞去 了 手上 唯一 的 常规 节目 安心 养胎 ， 然而 怀孕 三个 月 却 不料 流产 。,几个 月 前  人物二 亲口 承认 即将 当爹 喜讯  人物一 辞去 手上 唯一 常规 节目 安心 养胎  怀孕 三个 月 流产,1
TRAIN_SENT_ID_258260,,陈建斌,蒋勤勤,8.2010 年 3 月 ， 美 每家 成功 签约 蒋勤勤 、 陈建斌 为 公司 形象 代言人 。,年  月  美 每家 成功 签约 人物二  人物一 公司 形象 代言人,1
TRAIN_SENT_ID_272349,,金正恩,金正日,早 在 金正日 时代 ， 韩国 媒体 就 曾 引述 “ 脱北者 《 将军 与 水兵 》 玄松 月 1995 ” 的话 称 ， 金正恩 的 初恋女友 名叫 玄松 月 。,早 人物二 时代  韩国 媒体 引述  脱北者  将军 水兵  玄松 月   称  人物一 初恋女友 名叫 玄松 月,-1
TRAIN_SENT_ID_285494,,徐夫人,孙翊,徐夫人 ， 东汉 末年 将领 孙翊 之妻 。,人物一  东汉 末年 将领 人物二 之妻,-1
TRAIN_SENT_ID_258326,,陈建斌,蒋勤勤,苏有朋 称 刘诗 诗 “ 嫂子 ” 陈建斌 二导 作品 不 排除 与 蒋勤勤 合作,苏有朋 称 刘诗 诗  嫂子  人物一 二导 作品 排除 人物二 合作,1
TRAIN_SENT_ID_267388,,许志安,郑秀文,1 专辑 曲目 : 1 . 大 报复 / 叮当 / 失忆 / 十戒 / 热爱 岛 / Friends / 终于 开始 （ 许志安 ; 郑秀文 ）,专辑 曲目    报复  叮当  失忆  十戒  热爱 岛    终于  人物一  人物二,1
TRAIN_SENT_ID_274046,,白素,卫斯理,了解 旨人 的 经历 后 ， 卫斯理 开始 相信 此事 ， 并 认为 三位 证人 目击 白素 推 张强 也 可能 是 尾衫 九段 的 所 为 ， 于是 决定 再 到 东京 一次 。,了解 旨人 经历  人物二 相信 此事  认为 三位 证人 目击 人物一 推 张强 可能 尾衫 九段  决定 东京 一次,1
TRAIN_SENT_ID_275514,,徐少华,杨琨,在 这个 艺术 中专班 的 同学 中 ， 杨琨 认识 了 徐少华 。,艺术 中专班 同学 中  人物二 认识 人物一,1
TRAIN_SENT_ID_258019,,黄睿靓,陈致中,他 说 ， 因为 音乐 的 关系 ， 先 认识 黄睿靓 ， 再 认识 陈致中 。,说  音乐 关系  先 认识 人物一  认识 人物二,1
TRAIN_SENT_ID_255974,,蒋介石,宋美龄,与 蒋介石 不同 ， 宋美龄 的 生活 方式 十分 西化 ， 每间房 都 设有 壁炉 ， 家具 也 全为 豪华 大气 的 欧式 家具 。,人物一 不同  人物二 生活 方式 十分 西化  每间房 设有 壁炉  家具 全为 豪华 大气 欧式 家具,1
TRAIN_SENT_ID_275218,,丁力,冯程程,明俪 上海 L 剧情 : 1930 年代 的 上海 ， 许文强 无意 中救下 上海 大亨 冯敬尧 的 爱女 冯程程 ， 并 与 丁力 结为 挚友 。,明俪 上海  剧情   年代 上海  许文强 无意 中救下 上海 大亨 冯敬尧 爱女 人物二  人物一 结为 挚友,1
TRAIN_SENT_ID_279176,,赵薇,黄有龙,2009 年 春节 赵薇 香港 购物 再次 被 拍 ， 黄有龙 也 有 现身 。,年 春节 人物一 香港 购物 再次 拍  人物二 现身,1
TRAIN_SENT_ID_277800,,晋陵公主,谢混,晋陵公主 于是 把 谢家 的 事 全都 托付给 谢混 的 侄儿 谢弘微 。,人物一 谢家 事 全都 托付给 人物二 侄儿 谢弘微,-1
TRAIN_SENT_ID_283375,,谭梅,朱思潭,真的 ， 朱军 和 谭梅 的 Baby ， 还有 比 “ 朱思潭 ” 更 贴切 的 名字 吗 ？,真的  朱军 人物一    人物二  更 贴切 名字,1
TRAIN_SENT_ID_254049,,朱芳雨,胡美,参赛 队伍 回到 北京 以后 ， 朱芳雨 对 胡美 展开 了 猛烈 的 “ 攻势 ” 。,参赛 队伍 回到 北京 以后  人物一 人物二 展开 猛烈  攻势,1
TRAIN_SENT_ID_283092,,吴速玲,曹格,曹 三丰 （ Joe ） ， 曹格 与 吴速玲 的 儿子,曹 三丰     人物二 人物一 儿子,-1
TRAIN_SENT_ID_265839,,郭涛,郭子睿,郭子睿 （ 石头 ） 郭涛 与 李燃 的 儿子,人物二  石头  人物一 李燃 儿子,-1
TRAIN_SENT_ID_282943,,诸葛果,诸葛亮,释玄明 圣僧 （ 1929.9 . 9 — — ） 陕西省 西安市 人 ， 俗名 诸葛 天明 ， 为 诸葛果 后人 ， 继承 了 诸葛亮 一生 真传 。,释玄明 圣僧        陕西省 西安市  俗名 诸葛 天明  人物一 后人  继承 人物二 一生 真传,-1
TRAIN_SENT_ID_248937,,阮星竹,段正淳,星宿 派 阿 紫 : 段正淳 和 阮星竹 的 女儿 ， 有个 姐姐 名为 阿朱 。,星宿 派 紫  人物二 人物一 女儿  有个 姐姐 名为 阿朱,-1
TRAIN_SENT_ID_263115,,毛福梅,蒋介石,毛懋卿 ( 1876 — 1969 ) ， 一名 秉礼 ， 蒋介石 原配 毛福梅 的 二兄 ， 蒋经国 的 母舅 ， 浙江 奉化 岩头 乡 岩头村 ( 今属 班溪镇 ) 人 。,毛懋卿       一名 秉礼  人物二 原配 人物一 二兄  蒋经国 母舅  浙江 奉化 岩头 乡 岩头村  今属 班溪镇,-1
TRAIN_SENT_ID_265960,,杨绛,钱钟书,杨绛 先生 一直 热心 推动 、 时刻 关心 着 《 钱钟书 手稿 集 · 外文 笔记 》 的 出版 动向 。,人物一 先生 一直 热心 推动  时刻 关心  人物二 手稿 集  外文 笔记  出版 动向,1
TRAIN_SENT_ID_265363,,戚夫人,刘如意,戚夫人 、 刘如意 生母 戚喜冰,人物一  人物二 生母 戚喜冰,-1
TRAIN_SENT_ID_268595,,潘金莲,武大郎,《 金瓶梅 》 第一回 潘金莲 对 武大郎 说 : “ 贼 混沌 ， 不 晓事 的 ！,金瓶梅  第一回 人物一 人物二 说   贼 混沌  晓事,1
TRAIN_SENT_ID_271418,,杨云,杨威,在 众人 的 欢呼声 中 ， 杨威 深情 拥吻 杨云 达十来 秒 。,众人 欢呼声 中  人物二 深情 拥吻 人物一 达十来 秒,1
TRAIN_SENT_ID_266619,,许晋亨,李嘉欣,李嘉欣 婚礼 婚礼 流程 : 10 ： 00 许晋亨 到 李嘉欣 位于 睦诚径 的 寓所 接 新娘 。,人物二 婚礼 婚礼 流程     人物一 人物二 位于 睦诚径 寓所 接 新娘,1
TRAIN_SENT_ID_264813,,张欣,潘石屹,SOHO 中国 董事长 潘石屹 、 总裁 张欣 未 给出 任何 回应 。,中国 董事长 人物二  总裁 人物一 未 给出 回应,1
TRAIN_SENT_ID_249997,,张无忌,赵敏,"我 , 敏敏 特穆尔 , 自取 汉明 赵敏 , 汝阳王 府 的 郡主 , 集 万千 宠爱 于 一身 , 为 改写 倚天 , 收拾 周芷若 , 勾引 张无忌 而 来 … …",敏敏 特穆尔  自取 汉明 人物二  汝阳王 府 郡主  集 万千 宠爱 一身  改写 倚天  收拾 周芷若  勾引 人物一,1
TRAIN_SENT_ID_256288,,孙尚香,刘备,《 洞房 》 孙尚香 — — 李维康 、 刘备 — — 耿其昌 、 赵云 — — 王立军,洞房  人物一   李维康  人物二   耿其昌  赵云   王立军,-1
TRAIN_SENT_ID_255903,,蒋介石,宋美龄,当拉铁 摩尔 继续 待 在 蒋介石 的 别墅 时 ， 宋美龄 常 邀请 拉铁 摩尔 长时间 的 散步 。,当拉铁 摩尔 继续 人物一 别墅 时  人物二 常 邀请 拉铁 摩尔 长时间 散步,1
TRAIN_SENT_ID_287106,,胡班,胡华,胡华 小儿 胡班 ， 在 荥阳 太守 王植 部下 为 从事 。,人物二 小儿 人物一  荥阳 太守 王植 部下 从事,-1
