sent_id,sent_id,entity1,entity2,sent,processed_sent,human
TRAIN_SENT_ID_285928,,常茂,常遇春,常茂 也 是 一员 虎将 ， 因 砍 蒙古 降 将 被 流放 ， 其弟 常升 继承 常遇春 为 开国 公 ， 世代相传 ， 明末 传到 常延龄 ， 明亡 ， 沦为 农夫 。,人物一 一员 虎将  砍 蒙古 降 流放  其弟 常升 继承 人物二 开国 公  世代相传  明末 传到 常延龄  明亡  沦为 农夫,-1
TRAIN_SENT_ID_255110,,鲁元公主,张敖,信 都 侯国 背景 : 吕后 八年 （ 前 180 ） 四月 ， 封 张敖 、 鲁元公主 子 张侈为 信 都 侯 。,信 侯国 背景  吕后 八年  前   四月  封 人物二  人物一 子 张侈为 信 侯,-1
TRAIN_SENT_ID_283192,,马馥雅,孟祈佑,刘 连城 继承 皇位 ， 为 马馥雅 出征 蜀国 ， 后 在 战场 上 俘虏 孟祈佑 。,刘 连城 继承 皇位  人物一 出征 蜀国  战场 俘虏 人物二,-1
TRAIN_SENT_ID_276829,,唐姬,刘发,五宗 世家 唐姬 子 : 刘发,五宗 世家 人物一 子  人物二,-1
TRAIN_SENT_ID_262716,,杨不悔,纪晓芙,尤其 是 在 演戏 这 一块 ， 潘仪君 饰演 的 1993 版 的 纪晓芙 和 杨不悔 深入人心 。,尤其 演戏 一块  潘仪君 饰演  版 人物二 人物一 深入人心,1
TRAIN_SENT_ID_283297,,李俐,满文军,满文军 的 钱 花 在 了 国际 长途电话 上 ， 而 李俐 的 钱 则 花 在 了 飞机票 上 。,人物二 钱 花 国际 长途电话  人物一 钱 花 飞机票,1
TRAIN_SENT_ID_285099,,石磊,潘阳,石全 人物 : 石全 ， 潘阳 与 石磊 的 儿子 。,石全 人物  石全  人物二 人物一 儿子,-1
TRAIN_SENT_ID_286182,,路沚灜,温尚翊,2013 年 5 月 ， 温尚翊 与 路沚灜 被 目击 晚上 单独 吃饭 、 在 哈尔滨 中央大街 牵手 散步 。,年  月  人物二 人物一 目击 晚上 单独 吃饭  哈尔滨 中央大街 牵手 散步,1
TRAIN_SENT_ID_268042,,樊梨花,薛丁山,薛丁山 回 了 营 ， 照 樊梨花 计策 ， 把 军队 悄悄 开 到 大胜 岭 周围 埋伏 起来 。,人物二 回 营  人物一 计策  军队 悄悄 开 大胜 岭 周围 埋伏 起来,1
TRAIN_SENT_ID_277284,,王惠,郭德纲,回到 天津 ， 郭德纲 与 王惠 开始 了 来往 ， 谁 有 什么 演出 ， 都 会 邀 对方 捧场 。,回到 天津  人物二 人物一 来往  演出  会 邀 捧场,1
TRAIN_SENT_ID_259327,,刘备,刘禅,他 辅佐 刘备 、 刘禅 创建 了 蜀国 ， 自 任 丞相 。,辅佐 人物一  人物二 创建 蜀国  丞相,-1
TRAIN_SENT_ID_278437,,张成泽,金敬姬,金敬姬 自 前夫 张成泽 去年 被 处决 后 便 被 排挤 出 朝鲜 权力 版图 之外 ， 今年 她 还 卸任 劳动党 轻工业部 部长 的 职位 。,人物二 前夫 人物一 去年 处决 便 排挤 出 朝鲜 权力 版图 之外  今年 卸任 劳动党 轻工业部 部长 职位,-1
TRAIN_SENT_ID_258611,,刘禅,刘备,A ： 只要 发动 “ 淑慎 ” ， 无论 是否 找到 【 刘备 】 或 【 刘禅 。,发动  淑慎   是否 找到  人物二   人物一,1
TRAIN_SENT_ID_279456,,郭啸天,李萍,李萍 人物 经历 : 郭啸天 惨死 后 ， 李萍 顽强 地 雪地 产子 ， 并 在 大漠 独自 将 孩子 带 大 。,人物二 人物 经历  人物一 惨死  人物二 顽强 雪地 产子  大漠 独自 孩子 带,1
TRAIN_SENT_ID_270013,,张耳,张敖,综合 各 方面 因素 上 看 ， 以 张耳 和 张敖 的 功劳 ， 在 汉 十二年 的 十八 功侯 排位 中 ， 张敖 排 在 功臣 表中 第三 是 有 充分 的 根据 的 。,综合 方面 因素  人物一 人物二 功劳  汉 十二年 十八 功侯 排位 中  人物二 排 功臣 表中 第三 充分,-1
TRAIN_SENT_ID_285589,,明成皇后,闵致禄,明成皇后 是 骊 兴府 院君 闵致禄 的 女儿 ， 1866 年 ( 高宗 3 年 ) 当上 了 王妃 。,人物一 骊 兴府 院君 人物二 女儿   年  高宗  年  当上 王妃,-1
TRAIN_SENT_ID_256611,,李逍遥,李忆如,《 仙剑 奇侠传 二 》 中 她 已 搬 至 仙灵岛 照顾 李逍遥 独女 李忆如 。,仙剑 奇侠传 二  中 搬 仙灵岛 照顾 人物一 独女 人物二,1
TRAIN_SENT_ID_268728,,秦可卿,贾蓉,"红楼 春梦 秦可卿 内容简介 : 秦可卿 竟然 是 贾蓉 的 同胞 妹妹 , 而 她 究竟 是 贾珍 的 女儿 , 还是 贾敬 的 骨肉 , 竟 连 其 生母 也 说不清楚 … …",红楼 春梦 人物一 内容简介  人物一 竟然 人物二 同胞 妹妹  究竟 贾珍 女儿  贾敬 骨肉  竟 生母 说不清楚,-1
TRAIN_SENT_ID_253701,,申雪,赵宏博,安踏 2009 年度 CCTV 体坛 风云人物 提名奖 揭晓 ， 张琳 、 林丹 、 刘子歌 、 郭晶晶 、 申雪 、 赵宏博 等 人 榜上有名 。,安踏  年度  体坛 风云人物 提名奖 揭晓  张琳  林丹  刘子歌  郭晶晶  人物一  人物二 榜上有名,1
TRAIN_SENT_ID_265976,,杨绛,钱钟书,父亲 认可 了 他们 的 恋爱 — — 钱钟书 与 杨绛,父亲 认可 恋爱   人物二 人物一,-1
TRAIN_SENT_ID_284432,,孙小宝,金玲,孙小宝 和 爱人 金玲 经常 压轴 演出 ， 而且 观众 看到 最后 都 不愿 走 ， 这是 为啥 ?,人物一 爱人 人物二 经常 压轴 演出  观众 看到 最后 不愿 走  这是 为啥,1
TRAIN_SENT_ID_272988,,吴晗,袁震,有 一次 北京市 军管会 几位 领导人 一起 饮酒 ， “ 酒逢知己千杯少 ” ， 吴晗 大醉 而 归 ， 第二天 还 不能 同 袁震 一起 商定 一篇 文稿 。,一次 北京市 军管会 几位 领导人 一起 饮酒   酒逢知己千杯少   人物一 大醉  第二天 不能 人物二 一起 商定 一篇 文稿,1
TRAIN_SENT_ID_286392,,吕玲绮,吕布,第四 百 一 十章 吕玲绮 刺杀 吕布,第四 百 十章 人物一 刺杀 人物二,-1
TRAIN_SENT_ID_286705,,宁无双,李翰,宁无双 ， 《 神探 狄仁杰 3 》 里 的 人物 ， 由 演员 曲栅栅 扮演 ， 水 部 郎中 李翰 的 遗孀 。,人物一   神探 狄仁杰   里 人物  演员 曲栅栅 扮演  水 部 郎中 人物二 遗孀,1
TRAIN_SENT_ID_283462,,张伯驹,潘素,直到 绑匪 妥协 ， 将 赎金 从 300 万 降到 40 万 ， 潘素 与 张家 人 多方 筹借 ， 才 将 张伯驹 救出 。,绑匪 妥协  赎金  万 降到  万  人物二 张家 多方 筹借  人物一 救出,1
TRAIN_SENT_ID_256815,,朱军,谭梅,问 到 是否 担心 明星 丈夫 “ 红杏出墙 ” ， 谭梅 诚恳 地 表示 ： 当初 答应 朱军 的 求婚 ， 就是 因为 “ 朱军 是 位 诚实 的 男人 ， 能够 给 我 安全感 ” 。,问 是否 担心 明星 丈夫  红杏出墙   人物二 诚恳 表示  当初 答应 人物一 求婚   人物一 位 诚实 男人  能够 安全感,1
TRAIN_SENT_ID_262679,,况天佑,马小玲,"然而 这 一切 ， 都 在 他 去 香港 杀人 的 时候 , 遇到 况天佑 、 马小玲 、 完颜 不破 、 况复生 等 传奇人物 而 改变 。",香港 杀人  遇到 人物一  人物二  完颜 不破  况复生 传奇人物 改变,1
TRAIN_SENT_ID_274930,,宣穆皇后,拓跋嗣,堂姐妹 ： 宣穆皇后 刘氏 ， 刘罗辰 之妹 ， 嫁道 武帝 拓跋 珪 ， 生 明元帝 拓跋嗣 。,堂姐妹  人物一 刘氏  刘罗辰 之妹  嫁道 武帝 拓跋 珪  生 明元帝 人物二,-1
TRAIN_SENT_ID_276391,,秦始皇,秦庄襄王,狼 孟县 为 战国 时为 赵狼 孟邑 ， 秦庄襄王 二年 攻 赵狼孟 ， 秦始皇 十五年 ， 兴兵 “ 至 太原 ， 取狼孟 ” ， 均 此 。,狼 孟县 战国 时为 赵狼 孟邑  人物二 二年 攻 赵狼孟  人物一 十五年  兴兵  太原  取狼孟   均,-1
TRAIN_SENT_ID_259355,,刘备,刘禅,（ 两朝 ： 刘备 和 刘禅 统治 时期 。 ）,两朝  人物一 人物二 统治 时期,-1
TRAIN_SENT_ID_272877,,杨威,杨云,刚 一下 快艇 的 杨威 就 高呼 新娘 ― ― “ 杨云 ， 你 来 了 吗 ？ ”,刚 一下 快艇 人物一 高呼 新娘 ― ―  人物二,1
TRAIN_SENT_ID_272967,,吴晗,袁震,可以 说 ， 在 吴晗 发表 的 每 一篇 文章 中 ， 都 有着 袁震 的 心血 。,说  人物一 发表 一篇 文章 中  有着 人物二 心血,1
TRAIN_SENT_ID_262970,,熊美玲,林秋离,《 爱 开始 都 像 一首歌 》 作词 ： 林秋离 作曲 ： 熊美玲 编曲 ： 陈志远,爱 一首歌  作词  人物二 作曲  人物一 编曲  陈志远,1
TRAIN_SENT_ID_275856,,孙霸,孙权,赐死 孙霸 后 ， 孙权 又 以结 孙霸 以构 害 孙和 之罪 诛杀 全寄 、 吴安 、 杨奇 等 。,赐死 人物一  人物二 以结 人物一 以构 害 孙和 之罪 诛杀 全寄  吴安  杨奇,-1
TRAIN_SENT_ID_279531,,李芳远,李成桂,李芳远 为 李成桂 第一位 王后 神懿 王后 韩氏 所出 ﹐ 字 遗德 。,人物一 人物二 第一位 王后 神懿 王后 韩氏 所出 ﹐ 字 遗德,-1
TRAIN_SENT_ID_265657,,袁泉,夏雨,照片 中 ， 夏雨 和 袁泉 均 身着 白衣 ， 朴素 淡雅 ， 宛如 回到 了 学生 时代 。,照片 中  人物二 人物一 均 身着 白衣  朴素 淡雅  宛如 回到 学生 时代,1
TRAIN_SENT_ID_282688,,刘之冰,茹萍,2 . 刘之冰 在 拍摄 现场 只要 一有 空闲 就 会 为 茹萍 送上 热茶 。,人物一 拍摄 现场 一有 空闲 会 人物二 送上 热茶,1
TRAIN_SENT_ID_272566,,秦沛,红薇,其后 严化 患 肝癌 去世 ， 其母 红薇 于 秦沛 11 岁 时 开始 改嫁 制片人 尔光 。,其后 严化 患 肝癌 去世  其母 人物二 人物一  岁 时 改嫁 制片人 尔光,-1
TRAIN_SENT_ID_274043,,白素,卫斯理,白素 与 卫斯理 讨论 自己 的 经历 后 ， 却 发现 有 疑点 。,人物一 人物二 讨论 经历  发现 疑点,1
TRAIN_SENT_ID_255925,,蒋介石,宋美龄,他 后来 成 了 蒋介石 的 外交 重臣 ， 不论是 访 印度 、 参加 开罗会议 、 宋美龄 赴 美国国会 演讲 ， 董都 是 贴身 随员 。,后来 成 人物一 外交 重臣  不论是 访 印度  参加 开罗会议  人物二 赴 美国国会 演讲  董都 贴身 随员,1
TRAIN_SENT_ID_281867,,张末,张艺谋,这时 的 张艺谋 正在 乌克兰 拍摄 《 十面埋伏 》 ， 得知 这一 情况 后 ， 张末 和托 维 直接 从 美国 飞 到 乌克兰 。,人物二 正在 乌克兰 拍摄  十面埋伏   得知 这一 情况  人物一 和托 维 直接 美国 飞 乌克兰,1
TRAIN_SENT_ID_267466,,成安公主,东光公主,东光 （ 东光公主 ） ： 成安公主 女 韦氏 。,东光  人物二   人物一 女 韦氏,-1
TRAIN_SENT_ID_284881,,柳原爱子,明治天皇,其妹 柳原爱子 （ 柳原 二位 局 · 追赠 从 一位 ） 是 明治天皇 的 典侍 （ 天皇 的 后宫 妃嫔 ） 、 大 正 天皇 的 生母 ， 前光 也 因此 成为 名副其实 的 国舅 。,其妹 人物一  柳原 二位 局  追赠 一位  人物二 典侍  天皇 后宫 妃嫔   正 天皇 生母  前光 成为 名副其实 国舅,-1
TRAIN_SENT_ID_279050,,陈昊苏,陈毅,《 陈毅 诗选 》 是 2011 年 外语教学与研究出版社 出版 的 图书 ， 作者 是 陈昊苏 。,人物二 诗选   年 外语教学与研究出版社 出版 图书  作者 人物一,1
TRAIN_SENT_ID_268855,,夏雪,刘梅,《 双喜临门 》 ： 夏雪 比赛 获奖 ， 刘梅 领了 奖金 ， 夏家 可谓 双喜临门 。,双喜临门   人物一 比赛 获奖  人物二 领了 奖金  夏家 可谓 双喜临门,1
TRAIN_SENT_ID_249434,,后稷,姜嫄,兄弟 ： 弃 ， 即 后稷 ， 姜嫄 生 ， 被 周 族人 认作 是 其 始祖 ， 后人 尊 为 谷神 。,兄弟  弃  人物一  人物二 生  周 族人 认作 始祖  后人 尊 谷神,-1
TRAIN_SENT_ID_262906,,熊美玲,林秋离,03 . 谁 若 爱 你 比 我 多 词 ： 林秋离 曲 ： 熊美玲,爱 词  人物二 曲  人物一,1
TRAIN_SENT_ID_259306,,刘备,刘禅,宋代 祝穆 《 方舆 胜览 》 云 “ 先主 刘备 ) 征之不起 ， 就 封为 逍遥 公 ” ， “ 刘禅 易其宅 为 长生 观 ” 。,宋代 祝穆  方舆 胜览  云  先主 人物一  征之不起  封为 逍遥 公    人物二 易其宅 长生 观,-1
TRAIN_SENT_ID_282136,,王菁,何炅,有 传言 称 何炅 的 资深 粉丝 不少 人 都 知道 王菁 的 存在 ， 并称 王菁 为 “ 王菁 阿姨 ” ， 传言 还称 ， 王菁 是 何炅 事业 中 不可 取代 的 贤内助 。,传言 称 人物二 资深 粉丝 不少 知道 人物一 存在  并称 人物一  人物一 阿姨   传言 还称  人物一 人物二 事业 中 不可 取代 贤内助,-1
TRAIN_SENT_ID_265658,,袁泉,夏雨,《 上海 伦巴 》 全国 公映 夏雨 袁泉 告别 银幕 情侣,上海 伦巴  全国 公映 人物二 人物一 告别 银幕 情侣,1
TRAIN_SENT_ID_249452,,后稷,姜嫄,后稷 是 周 民族 的 初祖 ， 为 姜嫄 所 生 ， 其 出生 有 一些 神话 色彩 ， 《 大雅 · 生民 》 记载 较为 详细 。,人物一 周 民族 初祖  人物二 生  出生 神话 色彩   大雅  生民  记载 较为 详细,-1
TRAIN_SENT_ID_255901,,蒋介石,宋美龄,其实 ， 蒋介石 并非 不爱 经国 ， 而是 唯恐 表现 得 过于 急切 ， 反令 经国 遭 宋美龄 的 忌恨 。,其实  人物一 不爱 经国  唯恐 表现 过于 急切  反令 经国 遭 人物二 忌恨,1
TRAIN_SENT_ID_256353,,孙尚香,刘备,因为 刘备 做 了 皇帝 ， 孙尚香 理应 称 娘娘 ， 这座 庙 也 被 称为 娘娘庙 。,人物二 做 皇帝  人物一 理应 称 娘娘  这座 庙 称为 娘娘庙,-1
TRAIN_SENT_ID_287093,,吕远洋,古力,那 是 古力 和 吕远洋 第一次 同时 出现 在 公众 面前 ， 也 是 目前 唯一 的 一次 。,人物二 人物一 第一次 出现 公众 面前  目前 唯一 一次,1
TRAIN_SENT_ID_273968,,白素,卫斯理,得悉 此事 后 ， 卫斯理 离开 马赛港 ， 并 把 在 海中 的 事 一一 告诉 白素 和 穆秀珍 等 人 。,得悉 此事  人物二 离开 马赛港  海中 事 一一 告诉 人物一 穆秀珍,1
TRAIN_SENT_ID_281766,,李价,李臻,李价 生有 一子济 国公 李臻 。,人物一 生有 一子济 国公 人物二,-1
TRAIN_SENT_ID_270907,,贾午,韩寿,贾充 只好 顺水推舟 ， 把 女儿 贾午 许配给 了 韩寿 。,贾充 只好 顺水推舟  女儿 人物一 许配给 人物二,-1
TRAIN_SENT_ID_278367,,周韵,姜文,其实 早 在 拍摄 《 天地英雄 》 时 ， 姜文 与 周韵 就 传出 绯闻 。,其实 早 拍摄  天地英雄  时  人物二 人物一 传出 绯闻,1
TRAIN_SENT_ID_267364,,许志安,郑秀文,香港 王牌 经纪人 ， 由 李进 捧 红 的 艺人 ， 包括 梅艳芳 、 黎明 、 郑秀文 、 许志安 、 陈奕迅 等 人 。,香港 王牌 经纪人  李进 捧 红 艺人  包括 梅艳芳  黎明  人物二  人物一  陈奕迅,1
TRAIN_SENT_ID_283854,,刘秀桦,刘銮雄,"刘秀桦 , 2008 年生 ， 为 刘銮雄 和 女友 甘比 （ 陈凯韵 ） 所 生 ， 也 是 刘銮雄 的 三 女儿 。",人物一   年生  人物二 女友 甘比  陈凯韵  生  人物二 三 女儿,-1
TRAIN_SENT_ID_251233,,廖仲恺,何香凝,何香凝 《 孙中山 与 廖仲恺 》 ： “ 以前 一时 投机 依附 革命 的 军阀 都 同 袁世凯 勾结 起来 ， 反戈 进攻 革命政权 。 ”,人物二  孙中山 人物一    以前 一时 投机 依附 革命 军阀 袁世凯 勾结 起来  反戈 进攻 革命政权,-1
TRAIN_SENT_ID_268690,,孔子,颜徵在,叔 梁纥 晚年 与 颜徵在 生下 了 孔子 。,叔 梁纥 晚年 人物二 生下 人物一,-1
TRAIN_SENT_ID_262755,,熊美玲,林秋离,No.166 爱到 抹 冻 爱 （ 台语 ） 林秋离 熊美玲 江蕙,爱到 抹 冻 爱  台语  人物二 人物一 江蕙,1
TRAIN_SENT_ID_275189,,李敏,李静训,1 基本 信息 : 李敏 ， 父 李崇 ， 妻 乐平公主 杨丽华 女 宇文娥英 ， 女 李静训 。,基本 信息  人物一  父 李崇  妻 乐平公主 杨丽华 女 宇文娥英  女 人物二,-1
TRAIN_SENT_ID_279047,,陈昊苏,陈毅,链接 陈昊苏 之 父 陈毅 ： 与 孩子 交流 的 艺术,链接 人物一 父 人物二  孩子 交流 艺术,-1
TRAIN_SENT_ID_255174,,熊狂,熊绎,熊丽 生 熊狂 ， 熊 狂生 熊绎 。 ”,熊丽 生 人物一  熊 狂生 人物二,-1
TRAIN_SENT_ID_272820,,谢烨,顾城,当 德国 向 顾城 发来 写作 邀请函 时 ， 谢烨 看到 了 自己 的 机会 。,德国 人物二 发来 写作 邀请函 时  人物一 看到 机会,1
TRAIN_SENT_ID_258998,,王熙凤,贾琏,贾琏 刚 和 王熙凤 说起 元妃 要 来 省亲 的 事 。,人物二 刚 人物一 说起 元妃 省亲 事,-1
TRAIN_SENT_ID_268613,,潘金莲,武大郎,流言 里 说 幺 婶 是 潘金莲 、 老 刘是 西门庆 ， 幺 叔 是 武大郎 ， 而林 建设 是 幺 婶 勾引 的 武松 。,流言 里 说 幺 婶 人物一  老 刘是 西门庆  幺 叔 人物二  而林 建设 幺 婶 勾引 武松,1
TRAIN_SENT_ID_286388,,吕玲绮,吕布,吕玲绮 演义 列传 : 为 吕布 与 严氏 所生 之 女孩 。,人物一 演义 列传  人物二 严氏 所生 女孩,-1
TRAIN_SENT_ID_263320,,胡亥,秦始皇,胡亥 — — 秦始皇 之 第十八 子 ， 年 十一 。,人物一   人物二 第十八 子  年 十一,-1
TRAIN_SENT_ID_255182,,熊狂,熊绎,熊丽 生下 了 熊狂 ， 熊 狂生 下 了 熊绎 。,熊丽 生下 人物一  熊 狂生 人物二,-1
TRAIN_SENT_ID_264319,,贾环,赵姨娘,且说 赵姨娘 因见 宝钗 送 了 贾环 些 东西 … …,人物二 因见 宝钗 送 人物一 东西,1
TRAIN_SENT_ID_279589,,马丽娟,赵本山,坐在 一旁 的 师娘 马丽娟 语重心长 地说 ： “ 给 赵本山 当 徒弟 ， 不用 给 我们 送礼 ， 我们 什么 都 不缺 ， 只求 你们 能 有 出息 。,坐在 一旁 师娘 人物一 语重心长 地说   人物二 徒弟  不用 送礼  不缺  只求 出息,1
TRAIN_SENT_ID_271067,,彭丽媛,习近平,当 夫妻 两地分居 时 彭丽媛 VS 习近平,夫妻 两地分居 时 人物一  人物二,1
TRAIN_SENT_ID_278347,,周韵,姜文,再度 结婚 的 姜文 一直 到 第三部 电影 公映 时才 正式 公布 周韵 的 太太 身份 ， 不免 让 人 产生 神秘感 。,再度 结婚 人物二 一直 第三部 电影 公映 时才 正式 公布 人物一 太太 身份  不免 产生 神秘感,1
TRAIN_SENT_ID_276022,,贾午,贾充,贾充 过世 后 ， 原本 依礼 应在 同宗 支族择 同姓 为 嗣 ， 但 郭槐 却 作主 以 贾午 所 生 外孙 韩谧 为 后嗣 ， 改为 贾姓 ， 并 宣称 贾充 生前 便 有 此意 。,人物二 过世  原本 依礼 应在 同宗 支族择 同姓 嗣  郭槐 作主 人物一 生 外孙 韩谧 后嗣  改为 贾姓  宣称 人物二 生前 便 此意,-1
TRAIN_SENT_ID_269288,,陆雪琪,张小凡,任贤齐 再 一次 扮演 大侠 ， 在 张小凡 和 鬼厉 的 双重身份 之间 变换 ， 唐嫣 扮演 的 冷美人 陆雪琪 。,任贤齐 一次 扮演 大侠  人物二 鬼厉 双重身份 之间 变换  唐嫣 扮演 冷美人 人物一,1
TRAIN_SENT_ID_259064,,刘备,刘禅,勿以恶小而为之 赏析 : 这是 刘备 临终前 给 其子 刘禅 的 遗诏 中 的话 ， 劝勉 他 要 进德修业 ， 有所作为 。,勿以恶小而为之 赏析  这是 人物一 临终前 其子 人物二 遗诏 中  劝勉 进德修业  有所作为,-1
TRAIN_SENT_ID_267891,,钱均夫,钱学森,钱学森 的 降生 ， 给 钱均夫 的 一家 带来 了 欢乐 ， 也 带来 了 希望 。,人物二 降生  人物一 一家 带来 欢乐  带来 希望,1
TRAIN_SENT_ID_268755,,孟明视,百里奚,这 一年 ， 秦穆公 不 听 百里奚 、 蹇 叔 等 良臣 的 劝阻 ， 一意孤行 ， 命令 孟明视 率领 秦军 千里 远 征伐 郑 。,一年  秦穆公 听 人物二  蹇 叔 良臣 劝阻  一意孤行  命令 人物一 率领 秦军 千里 远 征伐 郑,-1
TRAIN_SENT_ID_277403,,樊姬,楚庄王,内容 咏叹 春秋 时 楚庄王 贤妃 樊姬 谏 庄王 狩猎 及 进贤 事 。,内容 咏叹 春秋 时 人物二 贤妃 人物一 谏 庄王 狩猎 进贤 事,-1
TRAIN_SENT_ID_285780,,鲁轨,鲁爽,二十八年 春 ， 鲁爽 兄弟 率部 曲 归顺 ， 爽 等 ， 鲁轨 子 也 。,二十八年 春  人物二 兄弟 率部 曲 归顺  爽  人物一 子,-1
TRAIN_SENT_ID_275071,,朱七七,沈浪,后 朱七七 随 沈浪 、 王怜花 、 熊猫儿 四人同 赴 海外 仙山 隐居 。,人物一 人物二  王怜花  熊猫儿 四人同 赴 海外 仙山 隐居,1
TRAIN_SENT_ID_272787,,谢烨,顾城,顾城 遁世隐居 : 1988 年 ， 顾城 赴 新西兰 ， 讲授 中国 古典文学 ， 被 聘为 奥克兰 大学 亚 语系 研究 顾城 、 谢烨 与 朋友 在 新西兰 自己 家中 员 。,人物二 遁世隐居   年  人物二 赴 新西兰  讲授 中国 古典文学  聘为 奥克兰 大学 亚 语系 研究 人物二  人物一 朋友 新西兰 家中 员,-1
TRAIN_SENT_ID_286609,,张锡,张文琮,（ 唐朝 大臣 ） : 张锡 ， 张文琮 子 ， 贝州 武城 人 。,唐朝 大臣   人物一  人物二 子  贝州 武城,-1
TRAIN_SENT_ID_281639,,黄峨,杨慎,正德 十五年 ( 1520 ) 九月 ， 杨慎 回京 复职 ， 黄峨 随行 进京 。,正德 十五年    九月  人物二 回京 复职  人物一 随行 进京,-1
TRAIN_SENT_ID_266226,,钱学森,蒋英,钱学森 晚年 获得 了 很多 奖 ， 他 曾 诙谐地 对 蒋英 说 ： “ 钱 归 你 ， 奖 （ 蒋 ） 归 我 。 ”,人物一 晚年 获得 很多 奖  诙谐地 人物二 说   钱  奖  蒋,1
TRAIN_SENT_ID_277733,,万圣龙王,万圣公主,这 万圣公主 招得 一 驸马 ： 就是 神通广大 的 九头鸟 ， 九头鸟 和 万圣龙王 一起 ， 偷盗 了 祭赛国 金光 寺 宝塔 上 的 国宝 — — 佛宝 舍利子 。,人物二 招得 驸马  神通广大 九头鸟  九头鸟 人物一 一起  偷盗 祭赛国 金光 寺 宝塔 国宝   佛宝 舍利子,-1
TRAIN_SENT_ID_270632,,赵宏博,申雪,与 申雪 、 赵宏博 和 张丹 、 张昊 一起 师从 于 著名 教练 姚滨 ， 多次 进入 世界大赛 前三名 ， 2006 年 冬奥会 获得 第四名 。,人物二  人物一 张丹  张昊 一起 师从 著名 教练 姚滨  多次 进入 世界大赛 前三名   年 冬奥会 获得 第四名,1
TRAIN_SENT_ID_265025,,李铭顺,范文芳,星锁 剧情简介 : Orange （ 范文芳 ） 一心 飞往 东京 散心 ， 在 缘分 的 安排 下 结识 了 Henry （ 李铭顺 ） ， 电视剧 记者会 ( 13 张 ),星锁 剧情简介    人物二  一心 飞往 东京 散心  缘分 安排 结识   人物一   电视剧 记者会   张,1
TRAIN_SENT_ID_262771,,熊美玲,林秋离,No.2 一人 一个 梦 林秋离 熊美玲 张雨生,一人 一个 梦 人物二 人物一 张雨生,1
TRAIN_SENT_ID_251070,,尤三姐,柳湘莲,但 因 柳湘莲 误 听 他人 传言 ， 怀疑 尤三姐 也 是 个 不 乾净 之 人 ， 要 索回 定礼 ， 刚烈 的 尤三姐 在 奉还 定礼 时 拔剑 自刎 。,人物二 误 听 传言  怀疑 人物一 乾净  索回 定礼  刚烈 人物一 奉还 定礼 时 拔剑 自刎,1
TRAIN_SENT_ID_250302,,秦始皇,胡亥,晚年 的 秦始皇 将 少子 胡亥 的 教育 委托 于 他 ， 正是 看中 他 文字 、 书法 和 法学 造诣 的 精湛 。,晚年 人物一 少子 人物二 教育 委托  看中 文字  书法 法学 造诣 精湛,-1
TRAIN_SENT_ID_271904,,阎婆惜,宋江,戴宗 原本 是 在 江州 两院 做 牢头 ， 宋江 因为 阎婆惜 的 人命官司 来江州 服刑 ， 正好 在 他 的 管区 之内 。,戴宗 原本 江州 两院 做 牢头  人物二 人物一 人命官司 来江州 服刑  正好 管区 之内,1
TRAIN_SENT_ID_284668,,李贵,李桂枝,李桂枝 、 李贵 母子 对敌 斗争 坚强 勇敢 ， 引起 村上 国民党 残余 和 封建 势力 的 极端 仇恨 。,人物二  人物一 母子 对敌 斗争 坚强 勇敢  引起 村上 国民党 残余 封建 势力 极端 仇恨,1
TRAIN_SENT_ID_248915,,阮星竹,段正淳,比如 用 翠竹 、 白色 鹅卵石 和 石板 铺就 的 “ 竹韵 小屋 ” ， 可 扮演 段正淳 和 阮星竹 的 浪漫 ； 比如 在 铺天盖地 镜子 情侣 主题 酒店 ( 9 张 ),翠竹  白色 鹅卵石 石板 铺就  竹韵 小屋   扮演 人物二 人物一 浪漫  铺天盖地 镜子 情侣 主题 酒店   张,1
TRAIN_SENT_ID_262351,,汪精卫,陈璧君,堕落 政客 的 爱情 悲歌 ： 陈璧君 与 汪精卫 ( 7 ),堕落 政客 爱情 悲歌  人物二 人物一,1
TRAIN_SENT_ID_286397,,李坤仪,李宪文,李坤仪 置业 : 李坤仪 是 李登辉 已 过世 的 独子 李宪文 惟一 的 女儿 。,人物一 置业  人物一 李登辉 过世 独子 人物二 惟一 女儿,-1
TRAIN_SENT_ID_272730,,徐天宏,周绮,红花 会 徐天宏 和 铁胆庄 周绮 喜订 终身 。,红花 会 人物一 铁胆庄 人物二 喜订 终身,1
TRAIN_SENT_ID_277896,,白莲花,乔灵儿,"白莲花 人物 概述 : 白莲花 , 电视剧 《 西游记 后传 》 的 角色 之一 ， 本是 凤头 山 的 土匪 头子 ， 后 被 乔灵儿 感化 ， 决心 改恶从善 。",人物一 人物 概述  人物一  电视剧  西游记 后传  角色  本是 凤头 山 土匪 头子  人物二 感化  决心 改恶从善,1
TRAIN_SENT_ID_272848,,杨威,杨云,杨云 的 离开 让 杨威 觉得 天 都 快 塌下来 了 。,人物二 离开 人物一 觉得 天 快 塌下来,1
TRAIN_SENT_ID_260287,,穆桂英,杨宗保,马步灯 相关 寓意 : 作为 一种 汉族 民俗文化 ， “ 忠勇 报国 杨家将 ” 旨在 表现 穆桂英 、 杨宗保 、 孟良 、 焦赞 忠勇 报国 。,马步灯 相关 寓意  一种 汉族 民俗文化   忠勇 报国 杨家将  旨在 表现 人物一  人物二  孟良  焦赞 忠勇 报国,1
TRAIN_SENT_ID_272711,,毛岸青,杨开慧,1930 年 4 月 其妹 杨开慧 被捕 时 ， 毛岸英 只有 八岁 、 毛岸青 只有 七岁 、 毛岸龙 只有 三岁 。,年  月 其妹 人物二 被捕 时  毛岸英 八岁  人物一 七岁  毛岸龙 三岁,1
