sent_id,sent_id,entity1,entity2,sent,processed_sent,human
TRAIN_SENT_ID_274380,,钱学森,钱均夫,钱学森 的 父亲 钱均夫 是 杭州人 ， 曾 出任 浙江省 立 第一 中学 ( 现 杭州第四中学 ) 校长 。,人物一 父亲 人物二 杭州人  出任 浙江省 立 第一 中学  现 杭州第四中学  校长,-1
TRAIN_SENT_ID_287209,,方文山,古小力,古小力 ， 杰 威尔 音乐 有限公司 职员 ， 作词 人 ， 华语 乐坛 作词 人 方文山 的 妻子 。,人物二  杰 威尔 音乐 有限公司 职员  作词  华语 乐坛 作词 人物一 妻子,1
TRAIN_SENT_ID_269281,,陆雪琪,张小凡,这 一日 ， 陆雪琪 来到 了 那座 曾经 魂牵梦系 的 草庙 村 废墟 ， 在 一座 新立 的 木屋 前 ， 与 张小凡 重逢 ， 两人 相视而笑 ， 天荒地老 。,一日  人物一 来到 那座 曾经 魂牵梦系 草庙 村 废墟  一座 新立 木屋 前  人物二 重逢  两人 相视而笑  天荒地老,1
TRAIN_SENT_ID_268723,,秦可卿,贾蓉,秦可卿 长成 个 大美人 ， 因 父亲 素 与 贾家 有些 瓜葛 ， 故结 了 亲 ， 嫁给 贾珍之 子 贾蓉 为妻 ， 所以 脂砚斋 评 她 “ 贫女 得 居 富室 ” 。,人物一 长成 大美人  父亲 素 贾家 瓜葛  故结 亲  嫁给 贾珍之 子 人物二 为妻  脂砚斋 评  贫女 居 富室,-1
TRAIN_SENT_ID_269908,,张默,张国立,张国立 之子 张默 也 没能 逃过 “ 被 死亡 ” 的 劫数 ， 称 其 在 河北 被 捅 死 。,人物二 之子 人物一 没能 逃过  死亡  劫数  称 河北 捅 死,-1
TRAIN_SENT_ID_279571,,马丽娟,赵本山,马丽娟 赵本山 把 妻子 当成 良师益友 ， 表演 中有 什么 问题 ， 总要 请 妻子 指教 。,人物一 人物二 妻子 当成 良师益友  表演 中有 问题  总要 请 妻子 指教,1
TRAIN_SENT_ID_255830,,蒋介石,宋美龄,猫眼 绿 的 地毯 ， 墨绿 的 沙发 ， 墙壁 上 挂 着 宋美龄 不同 时期 的 半身 照片 ， 以及 蒋介石 夫妇 在 “ 美庐 ” 生活 的 部分 照片 。,猫眼 绿 地毯  墨绿 沙发  墙壁 挂 人物二 不同 时期 半身 照片  人物一 夫妇  美庐  生活 部分 照片,1
TRAIN_SENT_ID_259894,,花月奴,江枫,就 在 花月奴 产子 时 ， 单恋 江枫 的 邀 月 宫主 找到 并 杀 了 他们 。,人物一 产子 时  单恋 人物二 邀 月 宫主 找到 杀,1
TRAIN_SENT_ID_284064,,陈辉祖,陈大受,陈及祖 生平 简介 : 大清 宰相 陈大受 子 ， 最高级 封疆 大臣 陈辉祖 弟 。,陈及祖 生平 简介  大清 宰相 人物二 子  最高级 封疆 大臣 人物一 弟,-1
TRAIN_SENT_ID_276288,,岳灵珊,林平之,闵 老二 — — 日月神教 ， 少室 山下 围攻 林平之 、 岳灵珊 者 之一 。,闵 老二   日月神教  少室 山下 围攻 人物二  人物一,-1
TRAIN_SENT_ID_284890,,戚芳,戚长发,后 戚长发 的 徒弟 狄云 因为 万震山 之子 万圭 贪慕 其 青梅竹马 的 师妹 戚芳 ， 而 被 栽赃 陷害 打入 冤狱 ， 同 丁典 关在 了 一起 。,人物二 徒弟 狄云 万震山 之子 万圭 贪慕 青梅竹马 师妹 人物一  栽赃 陷害 打入 冤狱  丁典 关在 一起,-1
TRAIN_SENT_ID_260074,,齐良迟,齐白石,为 追求 白石 艺术 ， 他 正式 拜 齐白石 之四子 齐良迟 为师 。,追求 白石 艺术  正式 拜 人物二 之四子 人物一 为师,-1
TRAIN_SENT_ID_283773,,李静民,姜昆,为了 参加 黑龙江省 曲艺 调演 ， 兵团 要 组织 曲艺 学习班 ， 师胜杰 幸运地 搭上 了 这 班车 ， 这个 学习班 里 还有 姜昆 和 其 夫人 李静民 。,参加 黑龙江省 曲艺 调演  兵团 组织 曲艺 学习班  师胜杰 幸运地 搭上 班车  学习班 里 人物二 夫人 人物一,1
TRAIN_SENT_ID_273768,,霍震霆,霍英东,后来 ， 霍英东 对外 承认 ： 当年 霍家 如此 行事 ， 是 为了 给 长子 霍震霆 打响 知名度 ， 以便 他 在 国际 上 为 中国 进行 “ 民间 体育 外交 ” 。,后来  人物二 对外 承认  当年 霍家 行事  长子 人物一 打响 知名度  国际 中国 进行  民间 体育 外交,1
TRAIN_SENT_ID_271078,,彭丽媛,习近平,这 段 歌曲 时长 3 分 21 秒 ， 配 上 习近平 、 彭丽媛 恩爱 的 33 张 照片 和 两幅 漫画 ， MV 视频 上传 连续 5 天 ， 视频 点击 量 已 突破 2000 万 。,段 歌曲 时长  分  秒  配 人物二  人物一 恩爱  张 照片 两幅 漫画   视频 上传 连续  天  视频 点击 量 突破  万,1
TRAIN_SENT_ID_277530,,柴绍,平阳公主,据说 ， 平阳公主 在 娘子 关 任帅 期间 ， 常常 身不离 鞍 ， 手不离 刀 ， 表现 异常 勇敢 ， 就 在 她 与 柴绍 将军 结婚 以后 ， 仍 不 忘 军中 生活 。,据说  人物二 娘子 关 任帅 期间  常常 身不离 鞍  手不离 刀  表现 异常 勇敢  人物一 将军 结婚 以后  忘 军中 生活,1
TRAIN_SENT_ID_265317,,贾琏,贾赦,贾琏 看望 贾赦 ， 将 女儿 托于 王夫人 。,人物一 看望 人物二  女儿 托于 王夫人,-1
TRAIN_SENT_ID_276569,,孔子,亓官氏,鲁昭公 九年 （ 公元前 533 年 ） ， 孔子 迎娶 了 宋 国人 亓官氏 之女 为 妻 。,鲁昭公 九年  公元前  年   人物一 迎娶 宋 国人 人物二 之女 妻,-1
TRAIN_SENT_ID_251265,,廖仲恺,何香凝,在 广州 ， 胡兰畦 结识 了 周恩来 、 李富春 等 中共 代表 人物 ， 也 结识 了 国民党 左派 领袖 、 孙中山 的 亲密 助手 廖仲恺 的 夫人 何香凝 女士 。,广州  胡兰畦 结识 周恩来  李富春 中共 代表 人物  结识 国民党 左派 领袖  孙中山 亲密 助手 人物一 夫人 人物二 女士,1
TRAIN_SENT_ID_262850,,熊美玲,林秋离,1 简介 : 《 痛不痛 有 谁 懂 》 《 痛不痛 有 谁 懂 》 专辑 ： 细说 往事 不告而别 歌手 ： 南方 二重唱 词 ： 林秋离 曲 ： 熊美玲,简介   痛不痛 懂   痛不痛 懂  专辑  细说 往事 不告而别 歌手  南方 二重唱 词  人物二 曲  人物一,1
TRAIN_SENT_ID_273083,,杨铁心,包惜弱,杨铁心 和 包惜弱 的 儿子 ， 小王爷 完颜康 贪图 富贵 ， 也 来 欺骗 爹娘 ， 却 被 好心 的 穆念慈 揭穿 。,人物一 人物二 儿子  小王爷 完颜康 贪图 富贵  欺骗 爹娘  好心 穆念慈 揭穿,-1
TRAIN_SENT_ID_258051,,周海婴,鲁迅,更 值得一提的是 ， 鲁迅 之子 周海婴 收藏 的 一盒 清代 宫廷 普洱茶 膏 拍出 了 108 万 高价 ， 是 国内 讫 今 为止 普洱茶 拍卖 最高 的 保持者 。,更 值得一提的是  人物二 之子 人物一 收藏 一盒 清代 宫廷 普洱茶 膏 拍出  万 高价  国内 讫 普洱茶 拍卖 最高 保持者,-1
TRAIN_SENT_ID_260229,,穆桂英,杨宗保,（ 《 杨家将 》 人物 ） : 杨宗保 与 穆桂英 之女 ， 武艺 高超 ， 箭法 精湛 。,杨家将  人物   人物二 人物一 之女  武艺 高超  箭法 精湛,-1
TRAIN_SENT_ID_271104,,彭丽媛,习近平,习大大 爱着 彭 麻麻 歌曲 MV : 这 段 歌曲 时长 3 分 21 秒 ， 配上 了 习近平 、 彭丽媛 恩爱 的 33 张 照片 和 两幅 漫画 。,习大大 爱着 彭 麻麻 歌曲   段 歌曲 时长  分  秒  配上 人物二  人物一 恩爱  张 照片 两幅 漫画,1
TRAIN_SENT_ID_283304,,李俐,满文军,从此 ， 满文军 每天 都 要 给 李俐 打 一个 电话 。,人物二 每天 人物一 一个 电话,1
TRAIN_SENT_ID_277623,,王凝之,王羲之,谢道韫 ： 东晋 女诗人 ， 是 宰相 谢安 的 侄女 ， 安西将军 谢奕 的 女儿 ， 也 是 著名 书法家 王羲之 的 儿子 王凝之 的 妻子 。,谢道韫  东晋 女诗人  宰相 谢安 侄女  安西将军 谢奕 女儿  著名 书法家 人物二 儿子 人物一 妻子,-1
TRAIN_SENT_ID_272254,,金正恩,金正日,新闻 区域 最上 是 “ 金正恩 革命 活动 ” 专题 ， 右侧 保留 了 金正日 逝世 一周年 的 新闻 专题 ， 首页 没有 金日成 专题报道 集 。,新闻 区域 最上  人物一 革命 活动  专题  右侧 保留 人物二 逝世 一周年 新闻 专题  首页 没有 金日成 专题报道 集,1
TRAIN_SENT_ID_273788,,霍震霆,霍英东,作为 香港 著名 实业家 霍英东 的 长子 ， 霍震霆 在 香港 颇受 关注 。,香港 著名 实业家 人物二 长子  人物一 香港 颇受 关注,-1
TRAIN_SENT_ID_286522,,李小龙,李英儒,李小龙 的 父亲 是 《 野火 春风 斗 古城 》 的 作者 军旅 作家 李英儒 。,人物一 父亲  野火 春风 斗 古城  作者 军旅 作家 人物二,-1
TRAIN_SENT_ID_265970,,杨绛,钱钟书,容安馆 札记 以 读书 时 的 感想 和 思考 为 主要 内容 ， 本书 在 钱钟书 夫人 杨绛 女士 大力支持 下 斥资 精心 影印 ， 具有 很 高 的 学术 价值 。,容安馆 札记 读书 时 感想 思考 主要 内容  本书 人物二 夫人 人物一 女士 大力支持 斥资 精心 影印  具有 高 学术 价值,1
TRAIN_SENT_ID_284113,,吉良吉广,吉良吉影,吉良吉广 人物 设定 : 儿子 吉良吉影 人物造型,人物一 人物 设定  儿子 人物二 人物造型,-1
TRAIN_SENT_ID_273182,,黄苗子,郁风,在 上海 时 ， 黄苗子 就 开始 接触 夏衍 、 潘汉年 等 共产党员 ， 与 郁风 结婚 ， 更 可以 看作 是 对 政治 选择 的 一种 确定 。,上海 时  人物一 接触 夏衍  潘汉年 共产党员  人物二 结婚  更 看作 政治 选择 一种 确定,1
TRAIN_SENT_ID_258836,,廖梦醒,何香凝,廖梦醒 人物 简介 : 廖梦醒 （ 1904 — 1988 ） ， 惠阳县 陈江 镇人 ， 廖仲恺 、 何香凝 之女 。,人物一 人物 简介  人物一       惠阳县 陈江 镇人  廖仲恺  人物二 之女,-1
TRAIN_SENT_ID_263873,,刘嘉玲,梁朝伟,梁朝伟 和 刘嘉玲 昨天 举行 婚前 欢迎 派对 ， 以 不丹 菜 招待 近 百位 宾客 。,人物二 人物一 昨天 举行 婚前 欢迎 派对  不丹 菜 招待 近 百位 宾客,1
TRAIN_SENT_ID_275441,,董祀,蔡文姬,曹操 与 蔡文姬 文姬 的 流浪生活 让 董祀 忧心 不已 ， 他 默默地 用 自己 的 行动 来 寄托 情感 … …,曹操 人物二 文姬 流浪生活 人物一 忧心 不已  默默地 行动 寄托 情感,1
TRAIN_SENT_ID_283352,,郑裕彤,郑家纯,郑裕彤 亦 甚 爱妻子 ， 二人 共育 有 两子 两女 ， 长子 是 郑家纯 ， 次子 郑家成 。,人物一 甚 爱妻子  二人 共育 两子 两女  长子 人物二  次子 郑家成,-1
TRAIN_SENT_ID_285699,,耿章,耿如杞,耿章 是 山西巡抚 耿如杞 的 儿子 ， 性格 刚强 正直 ， 一丝不苟 。,人物一 山西巡抚 人物二 儿子  性格 刚强 正直  一丝不苟,-1
TRAIN_SENT_ID_273866,,范柳原,白流苏,旧 上海 的 白流苏 和 范柳原 ， 已 成为 都市男女 内心深处 一个 自省 的 经典 。,旧 上海 人物二 人物一  成为 都市男女 内心深处 一个 自省 经典,1
TRAIN_SENT_ID_261996,,王明华,梅兰芳,梅兰芳 原配 王明华 ： 从 无私 的 爱 到 无边 的 痛 ： 人生 的 急转直下 从 荨麻疹 夺去 一双 儿女 的 生命 开始 。,人物二 原配 人物一  无私 爱 无边 痛  人生 急转直下 荨麻疹 夺去 一双 儿女 生命,1
TRAIN_SENT_ID_255137,,胡斐,胡一刀,该剧 讲述 了 李自成 护卫 胡一刀 之子 胡斐 复仇 的 故事 。,该剧 讲述 李自成 护卫 人物二 之子 人物一 复仇 故事,-1
TRAIN_SENT_ID_268360,,秦始皇,扶苏,身为 秦始皇 嬴政 的 长子 ， 扶苏 承载 了 太 多 的 期待 ， 但他却 难能可贵 的 始终保持 着 人性 的 美好 。,身为 人物一 嬴政 长子  人物二 承载 太 期待  但他却 难能可贵 始终保持 人性 美好,-1
TRAIN_SENT_ID_284349,,唐筼,陈寅恪,其中 一块 呈 竖 长状 的 岩石 正面 写 着 “ 陈寅恪 唐筼 夫妇 永眠 于 此 ” ， 反面 写 着 “ 陈流 求 陈小 彭 陈美延 庐山 植物园 敬立 ” 等 数字 。,一块 呈 竖 长状 岩石 正面 写  人物二 人物一 夫妇 永眠   反面 写  陈流 求 陈小 彭 陈美延 庐山 植物园 敬立  数字,1
TRAIN_SENT_ID_287234,,李志奇,李朝,偶然间 ， 李志奇 发现 李朝 之女 李仪 竟然 与 他 逝去 的 爱妻 长得 一模一样 ， 二人 坠入情网 。,偶然间  人物一 发现 人物二 之女 李仪 竟然 逝去 爱妻 长得 一模一样  二人 坠入情网,1
TRAIN_SENT_ID_254124,,霍启刚,郭晶晶,2012 年 8 月 ： 霍启刚 郭晶晶 三千万 豪宅 婚房 曝光 别墅 位于 北京 海淀区 奢华 堪比 “ 皇宫 ”,年  月  人物一 人物二 三千万 豪宅 婚房 曝光 别墅 位于 北京 海淀区 奢华 堪比  皇宫,1
TRAIN_SENT_ID_278957,,乔蚩尤,乔羽,乔蚩尤 身边 人物 : 父亲 ： 乔羽 ， 蜃楼 城 主 ， 大荒 八十一 勇士 之一 。,人物一 身边 人物  父亲  人物二  蜃楼 城 主  大荒 八十一 勇士,-1
TRAIN_SENT_ID_287282,,俞世龙,俞振庭,俞世龙 ( 1920 - 1943 ) ， 男 ， 京剧 老生 演员 ， 武生 俞振庭 之子 。,人物一       男  京剧 老生 演员  武生 人物二 之子,-1
TRAIN_SENT_ID_277599,,王凝之,王羲之,谢道韫 后来 果然 嫁给 了 王羲之 的 儿子 王凝之 。,谢道韫 后来 嫁给 人物二 儿子 人物一,-1
TRAIN_SENT_ID_274147,,汤国梨,章太炎,怀念 太炎 先生 作者简介 : 汤国梨 （ 1881 ~ 1980 ） ， 章太炎 夫人 ， 浙江 湖州人 。,怀念 太炎 先生 作者简介  人物一       人物二 夫人  浙江 湖州人,1
TRAIN_SENT_ID_278698,,叶一茜,田亮,蔡妍 与 田亮 叶一茜 夫妇 学习 中国 传统 民歌 《 蜗牛 与 黄鹂 鸟 》 。,蔡妍 人物二 人物一 夫妇 学习 中国 传统 民歌  蜗牛 黄鹂 鸟,1
TRAIN_SENT_ID_286872,,冯锡范,冯澄世,（ 台湾 明郑 时期 政治家 ） : 冯锡范 ， 号 希范 ， 明末清初 福建 龙溪人 ， 生于 晋江县 ， 郑成功 工官 冯澄世 之子 。,台湾 明郑 时期 政治家   人物一  号 希范  明末清初 福建 龙溪人  生于 晋江县  郑成功 工官 人物二 之子,-1
TRAIN_SENT_ID_271610,,毛岸青,毛泽东,毛泽东 诞辰 110 周年 之际 ， 毛主席 之子 毛岸青 ， 儿媳 邵华 将军 携 毛主席 之孙 毛新宇 来函 ， 表述 了 对 舒荣先 毛体 书法 的 肯定 。,人物二 诞辰  周年 之际  毛主席 之子 人物一  儿媳 邵华 将军 携 毛主席 之孙 毛新宇 来函  表述 舒荣先 毛体 书法 肯定,-1
TRAIN_SENT_ID_267544,,慕容令,慕容垂,慕容垂 遂 率 夫人 段氏 （ 后段 后 ） ， 子 慕容令 、 慕容宝 、 慕容农 、 慕容隆 ， 慕容恪 之子 慕容楷 ， 舅兰建 ， 郎中 令 高弼 等 一起 投奔 前秦 。,人物二 遂 率 夫人 段氏  后段   子 人物一  慕容宝  慕容农  慕容隆  慕容恪 之子 慕容楷  舅兰建  郎中 令 高弼 一起 投奔 前秦,-1
TRAIN_SENT_ID_277626,,王凝之,王羲之,其女 谢道韫 嫁给 王羲之 第二 子 王凝之 为妻 。,其女 谢道韫 嫁给 人物二 第二 子 人物一 为妻,-1
TRAIN_SENT_ID_284802,,王卓,王济,王令 淑 ， 王浑 之女 ， 母 钟琰 （ 《 世说新语 · 贤媛 》 ） 王浑 孙 : 王卓 ， 王济 庶 长子 ， 嗣子 ， 任 给事中 。,王令 淑  王浑 之女  母 钟琰   世说新语  贤媛   王浑 孙  人物一  人物二 庶 长子  嗣子  给事中,-1
TRAIN_SENT_ID_267108,,公子羽,明月心,（ 作者 ： 原曼 ） 明月心 与 公子羽 : 在 明月心 之前 ， 很难 想象 ， 一个 女人 对于 她 所 爱 的 男人 ， 竟 顺从 、 追随 到 了 这样 的 地步 ！,作者  原曼  人物二 人物一  人物二 之前  很难 想象  一个 女人 爱 男人  竟 顺从  追随 地步,1
TRAIN_SENT_ID_286957,,高城壮一郎,高城百合子,人物 出处 : 高城百合子 ， 高城壮一郎 之妻 ， 高城沙耶 的 母亲 ， 曾 是 华尔街 无人不知 的 超级 商人 ， 休假 回国 时 与 壮一郎 认识 第二天 就 结婚 。,人物 出处  人物二  人物一 之妻  高城沙耶 母亲  华尔街 无人不知 超级 商人  休假 回国 时 壮一郎 认识 第二天 结婚,-1
TRAIN_SENT_ID_281384,,林姮怡,蒋友柏,蒋得曦 ， 已故 台湾地区 领导人 蒋经国 的 曾孙女 ， 蒋孝勇 的 孙女 ， 蒋家 第四代 蒋友柏 和 林姮怡 之女 。,蒋得曦  已故 台湾地区 领导人 蒋经国 曾孙女  蒋孝勇 孙女  蒋家 第四代 人物二 人物一 之女,-1
TRAIN_SENT_ID_264780,,张欣,潘石屹,— — 潘石屹 和 张欣 夫妇 去 纽约 参观 索尼 大楼 ， 被 称为 有意 成为 该 建筑 的 拥有者 。,人物二 人物一 夫妇 纽约 参观 索尼 大楼  称为 有意 成为 建筑 拥有者,1
TRAIN_SENT_ID_255929,,蒋介石,宋美龄,蒋介石 通过 宋美龄 ， 也 经常 馈送 一些 生活 日用品 、 衣服 之类 的 东西 。,人物一 人物二  经常 馈送 生活 日用品  衣服 东西,1
TRAIN_SENT_ID_248951,,王罕,桑昆,都史 ， 《 射雕 英雄传 》 里 的 人物 ， 蒙古 克烈部 首领 王罕 的 长子 桑昆 的 儿子 ， 为 人 刁钻 任性 ， 到处 耀武扬威 ， 曾 向 铁木真 之女 华筝 求亲 。,都史   射雕 英雄传  里 人物  蒙古 克烈部 首领 人物一 长子 人物二 儿子  刁钻 任性  到处 耀武扬威  铁木真 之女 华筝 求亲,-1
TRAIN_SENT_ID_258112,,周海婴,鲁迅,墓穴 左右 各有 一棵 鲁迅 夫人 许广平 和 儿子 周海婴 所植 的 桧柏 。,墓穴 左右 各有 一棵 人物二 夫人 许广平 儿子 人物一 所植 桧柏,-1
TRAIN_SENT_ID_271353,,何泽慧,钱三强,近代 的 南园 宾馆 系 蒋介石 在 苏 别墅 “ 蒋 公馆 ” 和 何亚农 （ 其二 女儿 、 女婿 即 著名 物理学家 何泽慧 、 钱三强 夫妇 ） 花园别墅 所在地 。,近代 南园 宾馆 系 蒋介石 苏 别墅  蒋 公馆  何亚农  女儿  女婿 著名 物理学家 人物一  人物二 夫妇  花园别墅 所在地,-1
TRAIN_SENT_ID_281775,,李敏,李崇,到 幽州 总管 李崇 之子 李敏 入试 时 ， 被 杨丽华 相 中 ， 选 为 女婿 。,幽州 总管 人物二 之子 人物一 入试 时  杨丽华 相 中  选 女婿,-1
TRAIN_SENT_ID_270278,,宣姜,卫宣公,公子 朔 和 宣姜 仍 在 卫宣公 面前 搬弄是非 ： “ 急子 口出怨言 ， 日后 要 将 我们 母子 偿命 。 ”,公子 朔 人物一 人物二 面前 搬弄是非   急子 口出怨言  日后 母子 偿命,-1
TRAIN_SENT_ID_249336,,后稷,姜嫄,元妃 ： 姜嫄 ： 生一子 ， 名弃 ， 史 称 后稷 ， 其 后代 姬发 （ 周武王 ） 建立 了 周朝,元妃  人物二  生一子  名弃  史 称 人物一  后代 姬发  周武王  建立 周朝,-1
TRAIN_SENT_ID_283727,,吴安持,吴充,于是 陈安民 为了 消灾 弭 祸 ， 一面 让 下属 用钱 贿赂 大理寺 上下 官员 ， 一面 让 文及 甫 请 吴充 之子 吴安持 帮忙 。,陈安民 消灾 弭 祸  一面 下属 用钱 贿赂 大理寺 官员  一面 文及 甫 请 人物二 之子 人物一 帮忙,-1
TRAIN_SENT_ID_257751,,桓雄,桓因,据 《 三国 遗事 · 纪异 》 之 记载 ， 王俭 乃 帝释 桓因 之 庶子 桓雄 与 熊女 栖梧 结合 而生 。,三国 遗事  纪异  记载  王俭 帝释 人物二 庶子 人物一 熊女 栖梧 结合 而生,-1
TRAIN_SENT_ID_276616,,韩寒,金丽华,韩寒 爱妻 金丽华 现场 助阵 ， 两人 亲密 交谈 ， 此前 有 媒体 传出 韩寒 与 第三者 绯闻 ， 此举 无疑 是 最好 的 辟谣 。,人物一 爱妻 人物二 现场 助阵  两人 亲密 交谈  此前 媒体 传出 人物一 第三者 绯闻  此举 无疑 最好 辟谣,1
TRAIN_SENT_ID_255617,,蒋介石,宋美龄,“ 爱庐 ” 平时 由 蒋介石 副官 蒋富寿 看管 ， 宋美龄 常来 小住 ， 并 将 母亲 接来 同住 。,爱庐  平时 人物一 副官 蒋富寿 看管  人物二 常来 小住  母亲 接来 同住,-1
TRAIN_SENT_ID_265666,,袁泉,夏雨,《 上海 伦巴 》 是 夏雨 、 袁泉 首次 以 情侣 形象 出镜 ， 看过 影片 的 观众 都 对 两人 的 演技 给予 很 高 评价 。,上海 伦巴  人物二  人物一 首次 情侣 形象 出镜  看过 影片 观众 两人 演技 给予 高 评价,1
TRAIN_SENT_ID_266611,,许晋亨,李嘉欣,婚礼 的 另 一个 闪光点 ， 即 是 许晋亨 送给 李嘉欣 的 婚戒 ， 婚戒 是 由 两人 一起 设计 ， 是 方形 的 。,婚礼 一个 闪光点  人物一 送给 人物二 婚戒  婚戒 两人 一起 设计  方形,1
TRAIN_SENT_ID_285002,,米朵,雷奕明,米朵 被 萧亮 抛弃 后 ， 觉悟 到 最 爱 她 的 人 是 一直 陪伴 在 她 身边 二十年 的 雷奕明 ， 但 雷奕明 因为 不 自信 米朵 的 爱 而 临阵 逃婚 。,人物一 萧亮 抛弃  觉悟 爱 一直 陪伴 身边 二十年 人物二  人物二 自信 人物一 爱 临阵 逃婚,1
TRAIN_SENT_ID_260488,,严嵩,严世蕃,不料 被 严嵩 孙女 、 严世蕃 之女 严兰贞见 爱 ， 不得已 而 成婚 。,人物一 孙女  人物二 之女 严兰贞见 爱  不得已 成婚,-1
TRAIN_SENT_ID_258674,,刘禅,刘备,阿斗 寨 基本 简介 : 阿斗 ， 是 刘备 之子 刘禅 的 乳名 ， 字公嗣 ， 三国 时期 蜀国 后主 。,阿斗 寨 基本 简介  阿斗  人物二 之子 人物一 乳名  字公嗣  三国 时期 蜀国 后主,-1
TRAIN_SENT_ID_281908,,谷开来,薄熙来,谷开来 家庭 生活 : 丈夫 ： 薄熙来,人物一 家庭 生活  丈夫  人物二,1
TRAIN_SENT_ID_285350,,齐孝公,齐桓公,齐孝公 在位 十年 病逝 ， 公子 潘与 齐桓公 生前 宠臣 卫 公子 开方 杀死 孝公 儿子 ， 即位 为 国君 ， 是 为 齐昭公 。,人物一 在位 十年 病逝  公子 潘与 人物二 生前 宠臣 卫 公子 开方 杀死 孝公 儿子  即位 国君  齐昭公,-1
TRAIN_SENT_ID_278121,,慕容秋荻,谢晓峰,"— — 慕容秋荻 等 不到 谢晓峰 , 因 爱成 恨 的 结果 便是 秋风 中 永远 等 不到 爱人 的 荻花 。",人物一 不到 人物二  爱成 恨 便是 秋风 中 永远 不到 爱人 荻花,1
TRAIN_SENT_ID_261531,,关兴,关羽,关兴 ， 关羽 次子 ， 字 安国 。,人物一  人物二 次子  字 安国,-1
TRAIN_SENT_ID_273086,,杨铁心,包惜弱,如果 包惜弱 不有 与 杨铁心 有生 世爱 之 约 ， 相信 包惜弱 一定 会 死心踏地 的 爱 上 完颜洪烈 。,人物二 不有 人物一 有生 世爱 约  相信 人物二 一定 会 死心踏地 爱 完颜洪烈,1
TRAIN_SENT_ID_273786,,霍震霆,霍英东,霍震霆 ： 全国政协 委员 、 香港立法会 议员 ， 全国政协 副 主席 霍英东 长子 、 霍英东 基金会 会长 。,人物一  全国政协 委员  香港立法会 议员  全国政协 副 主席 人物二 长子  人物二 基金会 会长,-1
TRAIN_SENT_ID_281388,,林姮怡,蒋友柏,蒋得曦 ， 已故 台湾地区 领导人 蒋经国 的 曾孙女 ， 蒋介石 玄孙 女 ， 蒋孝勇 的 孙女 ， 蒋家 第四代 蒋友柏 和 林姮怡 之女 。,蒋得曦  已故 台湾地区 领导人 蒋经国 曾孙女  蒋介石 玄孙 女  蒋孝勇 孙女  蒋家 第四代 人物二 人物一 之女,-1
TRAIN_SENT_ID_285665,,孙剑,孙玉伯,高 老大 又 接 了 活去 杀 孙玉伯 的 儿子 孙剑 ， 关键时刻 隐瞒 武功 的 叶翔 帮高 老大 杀 了 孙剑 。,高 老大 接 活去 杀 人物二 儿子 人物一  关键时刻 隐瞒 武功 叶翔 帮高 老大 杀 人物一,-1
TRAIN_SENT_ID_271160,,李治,唐太宗李世民,阎婉 人物 资料 : 阎婉 （ 622 - 690 ） ， 大唐 魏王 李泰 （ 唐太宗李世民 之 第四 子 ， 唐高宗 李治 之 第四 兄 ） 的 王妃 。,阎婉 人物 资料  阎婉       大唐 魏王 李泰  人物二 第四 子  唐高宗 人物一 第四 兄  王妃,-1
TRAIN_SENT_ID_274971,,荆天明,荆轲,动画 第 4 部 官方 人物 关系 图因 美貌 被 秦王 政 爱慕 并 强行 俘虏 ， 而 当时 已 身怀 荆轲 之子 — — 后来 的 荆天明 。,动画  部 官方 人物 关系 图因 美貌 秦王 政 爱慕 强行 俘虏  当时 身怀 人物二 之子   后来 人物一,-1
TRAIN_SENT_ID_263535,,梅葆玖,梅兰芳,梅葆玖 表示 ， 父亲 梅兰芳 教育 他们 主要 靠 言传身教 ， 他 一辈子 都 恪守 做人 规范 ， 爱国 、 忠诚 、 老实 。,人物一 表示  父亲 人物二 教育 主要 言传身教  一辈子 恪守 做人 规范  爱国  忠诚  老实,-1
TRAIN_SENT_ID_275597,,闵柔,石清,新 侠客行 剧情简介 : 玄素庄 庄主 石清 和 夫人 闵柔 生有 两个 儿子 。,新 侠客行 剧情简介  玄素庄 庄主 人物二 夫人 人物一 生有 两个 儿子,-1
TRAIN_SENT_ID_258021,,黄睿靓,陈致中,陈致中 往 美林 日内瓦 分行 黄睿靓 的 账户 ， 全是 陈致中 操盘 ， 他 只是 签名 ， 账户 里 有 这么 多钱 ， 吴景茂 说 ， “ 我 是 看电视 才 知道 ” 。,人物二 美林 日内瓦 分行 人物一 账户  全是 人物二 操盘  签名  账户 里 多钱  吴景茂 说   看电视 知道,1
TRAIN_SENT_ID_285222,,李元轨,李渊,彭王 李绚 : 李绚 ， 高祖 李渊 孙 ， 霍王 李元轨 之子 ， 过继 给 李元 则 ， 嗣 彭王 。,彭王 李绚  李绚  高祖 人物二 孙  霍王 人物一 之子  过继 李元  嗣 彭王,-1
TRAIN_SENT_ID_277609,,王凝之,王羲之,她 是 打败 苻 坚 百万 大军 的 一代 名将 谢安 的 侄女 ， 安西将军 谢奕 的 女儿 ， 大 书法家 王羲之 的 二 儿媳 ， 王凝之 的 妻子 。,打败 苻 坚 百万 大军 一代 名将 谢安 侄女  安西将军 谢奕 女儿  书法家 人物二 二 儿媳  人物一 妻子,-1
