sent_id,entity1,entity2,sent,processed_sent,human
TRAIN_SENT_ID_249199,皮皮鲁,鲁西西,皮皮鲁 和 鲁西西 的 故事 作者简介 : 1955 年 郑渊洁 出生 在 河北省 石家庄市 ， 其父 原籍 山西 临汾 ， 其母 原籍 浙江 绍兴 。,人物一 人物二 故事 作者简介   年 郑渊洁 出生 河北省 石家庄市  其父 原籍 山西 临汾  其母 原籍 浙江 绍兴,1
TRAIN_SENT_ID_266722,龙幽,龙溟,夜叉 族 摄政王 ， 龙溟 、 龙幽 的 舅舅 。,夜叉 族 摄政王  人物二  人物一 舅舅,1
TRAIN_SENT_ID_255207,赵海燕,赵本山,一个 小时 之后 ， 赵海燕 、 杨冰 、 宋小宝 三人 与 赵本山 亮相 春晚 彩排 现场 。,一个 小时 之后  人物一  杨冰  宋小宝 三人 人物二 亮相 春晚 彩排 现场,-1
TRAIN_SENT_ID_255398,罗成,秦琼,罗成 、 金甲 、 童环 潜 入伍 府 ， 伺机 救出 秦琼 ； 同时 发现 了 伍亮 纠集 几名 守军 将领 准备 反出 幽州 ， 投靠 沙陀 国 的 阴谋 。,人物一  金甲  童环 潜 入伍 府  伺机 救出 人物二  发现 伍亮 纠集 几名 守军 将领 准备 反出 幽州  投靠 沙陀 国 阴谋,1
TRAIN_SENT_ID_254264,张顺,张横,左边 踊出 李俊 ， 张横 ， 张顺 ， 右边 出 踊出 阮家三 弟兄 ， 都 使 著 战船 ， 杀入 番 船队 里 。,左边 踊出 李俊  人物二  人物一  右边 出 踊出 阮家三 弟兄  著 战船  杀入 番 船队 里,1
TRAIN_SENT_ID_267155,靳月光,靳月华,他 的 两个 女儿 靳月光 、 靳月华 十分 美艳 。,两个 女儿 人物一  人物二 十分 美艳,1
TRAIN_SENT_ID_265559,张崇基,张崇德,张崇基 及 张崇德 两 兄弟 在 2003 年 12 月 12 日至 15 日 在 香港 伊利 沙伯 体育馆 ， 举行 第二 之 演唱会 《 二人 之 重唱 演唱会 2003 》 。,人物一 人物二 两 兄弟  年  月  日至  日 香港 伊利 沙伯 体育馆  举行 第二 演唱会  二人 重唱 演唱会,1
TRAIN_SENT_ID_263350,蔡夫人,蔡瑁,蔡夫人 和 蔡瑁 早就 对 刘备 恨之入骨 ， 几次 图谋 加害 ， 都 未能 得手 。,人物一 人物二 早就 刘备 恨之入骨  几次 图谋 加害  未能 得手,1
TRAIN_SENT_ID_275537,王小虎,赵本山,“ 金盆洗手 ” 后 的 赵本山 却 在 今晚 将 率领 弟子 王小利 、 丫蛋 、 王小虎 亮相 深圳 卫视 的 《 年代 秀 》 。,金盆洗手  人物二 今晚 率领 弟子 王小利  丫蛋  人物一 亮相 深圳 卫视  年代 秀,-1
TRAIN_SENT_ID_251597,穆春,穆弘,薛永 得罪 地头蛇 : 薛永 在 揭阳 镇上 卖艺 时得遇 宋江 ， 自然 是 一拜 再拜 ， 并 和 当地 的 地头蛇 穆弘 穆春 兄弟 结了 梁子 。,薛永 得罪 地头蛇  薛永 揭阳 镇上 卖艺 时得遇 宋江  自然 一拜 再拜  地头蛇 人物二 人物一 兄弟 结了 梁子,1
TRAIN_SENT_ID_250376,赵飞燕,赵合德,当然 ， 赵飞燕 和 赵合德 两 姊妹 还 不能 称其为 妓女 ， 但殊 归 同途 。,人物一 人物二 两 姊妹 不能 称其为 妓女  但殊 同途,1
TRAIN_SENT_ID_273135,包道乙,郑彪,▪ 娄敏中 ▪ 祖士远 ▪ 沈寿 ▪ 桓逸 ▪ 谭高 ▪ 郑彪 ▪ 包道乙 ▪ 王寅,▪ 娄敏中 ▪ 祖士远 ▪ 沈寿 ▪ 桓逸 ▪ 谭高 ▪ 人物二 ▪ 人物一 ▪ 王寅,-1
TRAIN_SENT_ID_274089,南宫敬叔,孔子,孟懿子 和 南宫敬叔 学礼于 孔子 。,孟懿子 人物一 学礼于 人物二,-1
TRAIN_SENT_ID_278069,马枪月,谷本夏,《 史上 最强 弟子 兼 一 》 马枪月 （ 马剑星 的 亲哥哥 ， 也 是 第六 拳豪 谷本夏 的 师傅 ， TV27 客串 ）,史上 最强 弟子 兼  人物一  马剑星 亲哥哥  第六 拳豪 人物二 师傅   客串,-1
TRAIN_SENT_ID_274170,平和岛静雄,平和岛幽,平和岛幽 人物 设定 : 平和岛静雄 的 弟弟 。,人物二 人物 设定  人物一 弟弟,1
TRAIN_SENT_ID_269010,李如柏,李如松,主将 李如松 坐骑 被 击毙 ， 副将 李如柏 ( 李成梁 次子 ) 头盔 被 击中 ， 游击 吴惟忠 胸部 中弹 。,主将 人物二 坐骑 击毙  副将 人物一  李成梁 次子  头盔 击中  游击 吴惟忠 胸部 中弹,1
TRAIN_SENT_ID_271204,张翠山,张三丰,武当掌 门 张翠山 内容梗概 : 刚刚 穿越 成为 武当 张三丰 弟子 ， 张翠山 的 愿望 很 简单 ： 让 武当 力压 江湖 诸派 ， 成为 华夏 武林 圣地 ！,武当掌 门 人物一 内容梗概  刚刚 穿越 成为 武当 人物二 弟子  人物一 愿望 简单  武当 力压 江湖 诸派  成为 华夏 武林 圣地,-1
TRAIN_SENT_ID_249113,皮皮鲁,鲁西西,肥皂 订书机 人物 简介 : 皮皮鲁 和 鲁西西 是 中国 童话 大王 郑渊洁 笔下 的 一对 双胞胎 兄妹 ， 他们 在 中国 的 孩子 中是 几乎 无人不晓 的 传奇人物 。,肥皂 订书机 人物 简介  人物一 人物二 中国 童话 大王 郑渊洁 笔下 一对 双胞胎 兄妹  中国 孩子 中是 几乎 无人不晓 传奇人物,1
TRAIN_SENT_ID_270776,徐若瑄,徐佩瑜,由于 徐若瑄 长期 在外 拍片 工作 ， 家中 的 大小事 全 由 大姐 徐佩瑜 打点 ， 这 让 大姐 成为 Vivian 心中 不折不扣 的 “ 我 背后 伟大 的 女人 ” 。,人物一 长期 在外 拍片 工作  家中 大小事 全 大姐 人物二 打点  大姐 成为  心中 不折不扣  背后 伟大 女人,1
TRAIN_SENT_ID_262232,尤二姐,尤三姐,尤三姐 不是 尤二姐 ， 当 她 明白 躲闪 和 忍受 都 无法 逃开 他们 的 魔爪 时 ， 她 终于 爆发 了 。,人物二 人物一  明白 躲闪 忍受 无法 逃开 魔爪 时  终于 爆发,1
TRAIN_SENT_ID_275893,王子豪,王子杰,主演 ： 廖蔚蔚 、 王子杰 、 王子豪 、 李乐儿 、 卢星宇 、 高宝宝 、 王建新,主演  廖蔚蔚  人物二  人物一  李乐儿  卢星宇  高宝宝  王建新,1
TRAIN_SENT_ID_250077,武敦儒,武修文,武敦儒 、 武修文 兄弟 拜 大侠 郭靖 为师 ， 虽 也 学过 “ 一阳指 ” ， 但 武功 近于 九指 神丐 洪七公 一派 刚猛 的 路子 。,人物一  人物二 兄弟 拜 大侠 郭靖 为师  学过  一阳指   武功 近于 九指 神丐 洪七公 一派 刚猛 路子,1
TRAIN_SENT_ID_250572,鲁西西,皮皮鲁,皮皮鲁 、 鲁西西 、 罗克 、 舒克 、 贝塔 是 他 笔下 文学 形象 。,人物二  人物一  罗克  舒克  贝塔 笔下 文学 形象,1
TRAIN_SENT_ID_273477,柳生雪姬,柳生飘絮,柳生飘絮 人物 关系 : 姐姐 ： 柳生雪姬 （ 黄圣 依饰 ）,人物二 人物 关系  姐姐  人物一  黄圣 依饰,1
TRAIN_SENT_ID_276148,贾惜春,贾珍,贾惜春 — — 金陵 十二钗 之八 ， 宁国府 贾珍 的 妹妹 ， 贾府 四 小姐 ， 爱好 绘画 。,人物一   金陵 十二钗 之八  宁国府 人物二 妹妹  贾府 四 小姐  爱好 绘画,1
TRAIN_SENT_ID_281579,蔡绿峰,蔡惠媚,父亲 是 蒋孝武 妻子 蔡惠媚 的 哥哥 蔡绿峰 ， 经营 事业有成 ， 母亲 主持 “ 红豆 食府 ” 餐厅 。,父亲 蒋孝武 妻子 人物二 哥哥 人物一  经营 事业有成  母亲 主持  红豆 食府  餐厅,1
TRAIN_SENT_ID_250693,鲁西西,皮皮鲁,在 笑声 的 指引 下 ， 皮皮鲁 和 鲁西西 来到 了 魔方 里 的 瓜国 。,笑声 指引  人物二 人物一 来到 魔方 里 瓜国,1
TRAIN_SENT_ID_264948,云中子,雷震子,云中子 所得 ， 雷震子 所食,人物一 所得  人物二 所食,-1
TRAIN_SENT_ID_261670,程英,陆无双,"于是 少年 发誓 , 决计 不会 让 姑姑 独守 十六年 寂寞 , 不 在 让 李莫愁 闲身 空恨 , 不会 再 让 程英 与 陆无双 苦熬 年华 。",少年 发誓  决计 不会 姑姑 独守 十六年 寂寞  李莫愁 闲身 空恨  不会 人物一 人物二 苦熬 年华,1
TRAIN_SENT_ID_261629,宋小宝,赵本山,赵本山 的 最新 小品 也 终于 露出 庐山真面目 ， 与 之 搭档 的 是 辽宁 籍 演员 赵海燕 、 杨冰 和 宋小宝 ， 而 小 沈阳 并 没有 出现 在 小品 中 。,人物二 最新 小品 终于 露出 庐山真面目  搭档 辽宁 籍 演员 赵海燕  杨冰 人物一  沈阳 没有 出现 小品 中,-1
TRAIN_SENT_ID_286241,耿宝林,焦少海,耿宝林 （ 1913 - 1973 ） ， 相声 演员 ， 师从 焦少海 。,人物一       相声 演员  师从 人物二,-1
TRAIN_SENT_ID_263373,武修文,武敦儒,杨过 ： 仅限于 与 对付 李莫愁 时 江湖 五绝 亲友 : 徒孙 ： 傻姑 （ 亲传 ） 武敦儒 、 武修文 、 陆冠英 、 郭 芙 、 郭襄 、 郭破虏 、 东邪 药师 派 门人,杨过  仅限于 对付 李莫愁 时 江湖 五绝 亲友  徒孙  傻姑  亲传  人物二  人物一  陆冠英  郭 芙  郭襄  郭破虏  东邪 药师 派 门人,1
TRAIN_SENT_ID_257453,姜昆,马季,甲 ： 马季 的 、 姜昆 的 、 常宝华 的 、 高英培 的 ， 我 都 听 过 。,甲  人物二  人物一  常宝华  高英培  听,-1
TRAIN_SENT_ID_269723,薛洋,薛之荔,薛之荔 跟着 文姨 的 车 来到 薛洋 的 修理 工厂 ， 当 薛洋 听到 薛之荔 的 声音 里 ， 他 激动 地 跑 了 下去 ， 此时 薛洋 脸上 充满 了 快乐 的 笑容 。,人物二 跟着 文姨 车 来到 人物一 修理 工厂  人物一 听到 人物二 声音 里  激动 跑 下去  人物一 脸上 充满 快乐 笑容,1
TRAIN_SENT_ID_270158,宋师道,宋玉致,宋缺 人物 介绍 : 家庭成员 ： 二弟 宋智 ， 族弟 宋鲁 ， 长女 宋玉华 ， 女婿 解 文龙 ， 幼女 宋玉致 ， 女婿 寇仲 ， 次子 宋师道 ， 儿媳 商秀珣 。,宋缺 人物 介绍  家庭成员  二弟 宋智  族弟 宋鲁  长女 宋玉华  女婿 解 文龙  幼女 人物二  女婿 寇仲  次子 人物一  儿媳 商秀珣,1
TRAIN_SENT_ID_279108,王维筠,金仲仁,1939 年 1 月 18 日 ， 农历 戊寅年 十一月 廿八日 ： 金仲仁 收 王维秋 、 王维筠 为徒,年  月  日  农历 戊寅年 十一月 廿八日  人物二 收 王维秋  人物一 为徒,-1
TRAIN_SENT_ID_250573,鲁西西,皮皮鲁,皮皮鲁 和 鲁西西 的 故事 作者简介 : 1955 年 郑渊洁 出生 在 河北省 石家庄市 ， 其父 原籍 山西 临汾 ， 其母 原籍 浙江 绍兴 。,人物二 人物一 故事 作者简介   年 郑渊洁 出生 河北省 石家庄市  其父 原籍 山西 临汾  其母 原籍 浙江 绍兴,1
TRAIN_SENT_ID_251835,梅超风,黄药师,梅超风 丢失 经书 ， 黄药师 现身 救 走 梅超风 ， 但是 因为 没有 打赢 郭靖 丢人 ， 后 又 以 弹指 神通 指点 梅超风 和 郭靖 比武 。,人物一 丢失 经书  人物二 现身 救 走 人物一  没有 打赢 郭靖 丢人  弹指 神通 指点 人物一 郭靖 比武,-1
TRAIN_SENT_ID_255329,卫夫人,王羲之,曹霸 最初 学 东晋 卫夫人 的 书法 ， 写得 一手 好字 ， 只 恨不能 超过 王羲之 。,曹霸 最初 学 东晋 人物一 书法  写得 一手 好字  恨不能 超过 人物二,-1
TRAIN_SENT_ID_250359,赵飞燕,赵合德,后 汉成帝 宠爱 赵飞燕 、 赵合德 姐妹 ， 许皇后 、 班婕妤 相继 失宠 ， 许皇后 废入 长定 宫 ， 班婕妤 前去 侍奉 太后 。,汉成帝 宠爱 人物一  人物二 姐妹  许皇后  班婕妤 相继 失宠  许皇后 废入 长定 宫  班婕妤 前去 侍奉 太后,1
TRAIN_SENT_ID_259813,李偲菘,李伟菘,· 2011 年 ， 李伟菘 、 李偲菘 发表 了 出道 27 年 来 的 首部 文字 作品 《 我们 的 乐园 》 。,年  人物二  人物一 发表 出道  年 首部 文字 作品  乐园,1
TRAIN_SENT_ID_252820,颜回,孔子,铸颜是 一个 古代 词语 ， 谓 孔子 培养 其 弟子 颜渊 ( 颜回 ) 成才 。,铸颜是 一个 古代 词语  谓 人物二 培养 弟子 颜渊  人物一  成才,-1
TRAIN_SENT_ID_253846,赵合德,赵飞燕,成帝 本来 宠爱 赵飞燕 ， 后来 移情别恋 于 赵合德 。,成帝 本来 宠爱 人物二  后来 移情别恋 人物一,1
TRAIN_SENT_ID_266186,李昌镐,曹薰铉,曹薰铉 对 韩国 围棋 事业 的 另 一 贡献 是 ： 培养 了 一位 了不起 的 学生 李昌镐 。,人物二 韩国 围棋 事业 贡献  培养 一位 了不起 学生 人物一,-1
TRAIN_SENT_ID_253081,颜回,孔子,再 问 ： “ 孔子 和 颜回 的 快乐 在 什么 地方 ？ ”,问   人物二 人物一 快乐 地方,-1
TRAIN_SENT_ID_251892,曹薰铉,李昌镐,韩国 代表 ： 曹薰铉 九段 、 徐奉洙 九段 、 徐能旭 九段 、 李昌镐 五段 、 刘昌赫 四段,韩国 代表  人物一 九段  徐奉洙 九段  徐能旭 九段  人物二 五段  刘昌赫 四段,-1
TRAIN_SENT_ID_249214,皮皮鲁,鲁西西,他 笔下 的 皮皮鲁 、 鲁西西 和 罗克 ， 舒克 贝塔 影响 了 中国 三代 的 孩子 。,笔下 人物一  人物二 罗克  舒克 贝塔 影响 中国 三代 孩子,1
TRAIN_SENT_ID_252808,颜回,孔子,孔子 弟子 颜回 曾 在 此 讲学 ， 宣讲 教化 。,人物二 弟子 人物一 讲学  宣讲 教化,-1
TRAIN_SENT_ID_266200,李昌镐,曹薰铉,第三轮 ： 李昌镐 1 : 0 钱宇平 曹薰铉 1 : 0 聂卫平 林海峰 1 : 0 淡路 修三 赵治勋 1 : 0 片冈聪,第三轮  人物一    钱宇平 人物二    聂卫平 林海峰    淡路 修三 赵治勋    片冈聪,-1
TRAIN_SENT_ID_255304,卫夫人,王羲之,卫夫人 的 启蒙 书教 ， 不仅 影响 了 王羲之 （ 羲 之 还有 一个 蒙师 ， 即 叔父 王廙 ） ， 也 造就 了 江夏 李氏 这一 书法 世家 。,人物一 启蒙 书教  影响 人物二  羲 一个 蒙师  叔父 王廙   造就 江夏 李氏 这一 书法 世家,-1
TRAIN_SENT_ID_274280,梅小青,梅小惠,《 师奶 强人 》 香港电视广播有限公司 出品 的 时装 爱情 剧 ， 由 李克勤 、 滕丽名 、 梁荣忠 、 梅小惠 、 阮兆祥 及 郭少芸 领衔主演 ， 监制 梅小青 。,师奶 强人  香港电视广播有限公司 出品 时装 爱情 剧  李克勤  滕丽名  梁荣忠  人物二  阮兆祥 郭少芸 领衔主演  监制 人物一,1
TRAIN_SENT_ID_253891,赵合德,赵飞燕,该剧 描述 西汉时期 著名 美女 赵飞燕 及其 妹妹 赵合德 传奇一生 故事 的 古装 电视剧 ， 于 1998 年 正式 发行 。,该剧 描述 西汉时期 著名 美女 人物二 妹妹 人物一 传奇一生 故事 古装 电视剧   年 正式 发行,1
TRAIN_SENT_ID_266714,龙幽,龙溟,最后 四人 带回 龙溟 的 死讯 以及 当时 所送 的 珠花 ， 凌波 心愿 已 了 ， 并 告诉 龙幽 好好 珍惜 所爱 之 人 。,最后 四人 带回 人物二 死讯 当时 所送 珠花  凌波 心愿  告诉 人物一 好好 珍惜 所爱,1
TRAIN_SENT_ID_255201,赵海燕,赵本山,《 意外 收获 》 是 由 赵本山 的 爱徒 王小利 和 唐鉴军 、 赵海燕 及 田娃 等 表演 的 小品 。,意外 收获  人物二 爱徒 王小利 唐鉴军  人物一 田娃 表演 小品,-1
TRAIN_SENT_ID_267590,骆赢,骆羽,混双 ： 何汉斌 / 包宜鑫 刘成 / 骆赢 李根 / 骆羽,混双  何汉斌  包宜鑫 刘成  人物一 李根  人物二,1
TRAIN_SENT_ID_265451,薛谭,秦青,列子 · 汤 问篇 译文 : 薛谭 向 秦青 学习 唱歌 ， 还 未曾 学完 秦青 的 唱歌 技巧 ， 就 自 以为 已经 完全 学会 了 ， 便 告辞 回家 。,列子  汤 问篇 译文  人物一 人物二 学习 唱歌  未曾 学完 人物二 唱歌 技巧  已经 完全 学会  便 告辞 回家,-1
TRAIN_SENT_ID_269923,沈春阳,赵本山,由 沈春阳 初次 担纲 女主角 ， 宋小宝 担任 男主角 ， 赵本山 、 小 沈阳 、 赵海燕 、 红孩 联合 出演 。,人物一 初次 担纲 女主角  宋小宝 担任 男主角  人物二  沈阳  赵海燕  红孩 联合 出演,-1
TRAIN_SENT_ID_275263,汤潮,赵本山,然而 令 汤潮 意想不到 的 是 ， 这顿 酒 喝 的 并 不 简单 ， 竟然 让 赵本山 动 了 把 他 收到 门下 的 念头 。,令 人物一 意想不到  这顿 酒 喝 简单  竟然 人物二 动 收到 门下 念头,-1
TRAIN_SENT_ID_259380,葛玄,左慈,」 可见 ， 左慈 、 葛玄 、 郑隐 、 葛洪 、 葛巢甫 等 人 ， 并非 「 共同 实践 特定 仙术 」 。,人物二  人物一  郑隐  葛洪  葛巢甫   共同 实践 特定 仙术,-1
TRAIN_SENT_ID_252807,颜回,孔子,大成殿 是 供奉 孔子 的 大殿 ， 正中 供祀 孔子像 ， 两侧 配祀 颜回 、 曾 参 、 孟轲 等 十二 哲像 。,大成殿 供奉 人物二 大殿  正中 供祀 人物二像  两侧 配祀 人物一  参  孟轲 十二 哲像,-1
TRAIN_SENT_ID_269420,刘伟,马季,表演者 ： 马季 、 赵炎 、 冯巩 、 刘伟 、 王金宝 、 王谦祥 、 李增瑞 、 戴志诚 、 郑健,表演者  人物二  赵炎  冯巩  人物一  王金宝  王谦祥  李增瑞  戴志诚  郑健,-1
TRAIN_SENT_ID_265418,薛谭,秦青,列子 · 汤问 第十一部分 : 列子 · 汤问 原文 : 薛谭 学 讴于 秦青 ① ， 未穷 青之技 ， 自谓 尽 之 ， 遂 辞 归 。,列子  汤问 第十一部分  列子  汤问 原文  人物一 学 讴于 人物二 ①  未穷 青之技  自谓  遂 辞,-1
TRAIN_SENT_ID_252781,颜回,孔子,颜回 无以 应 ， 人告 孔子 。,人物一 无以 应  人告 人物二,-1
TRAIN_SENT_ID_265576,张崇基,张崇德,其他 演员 ： 张崇基 张崇德 古天乐 郭蔼明,演员  人物一 人物二 古天乐 郭蔼明,1
TRAIN_SENT_ID_285734,陈应德,杨虎,李景延 弟子 杨虎 ， 其 得意 弟子 有 谢功 吉 、 陈名标 、 陈应德 、 杨绍 舜 。,李景延 弟子 人物二  得意 弟子 谢功 吉  陈名标  人物一  杨绍 舜,-1
TRAIN_SENT_ID_278786,李夏曦,李冬旭,李冬旭 剧情简介 : 该剧 讲述 了 讲述 了 法律系 学生 李夏曦 半工半读 ， 为 生意 失败 的 父亲 还债 。,人物二 剧情简介  该剧 讲述 讲述 法律系 学生 人物一 半工半读  生意 失败 父亲 还债,1
TRAIN_SENT_ID_266698,龙幽,龙溟,对于 哥哥 龙溟 ， 龙幽 相当 依赖 。,哥哥 人物二  人物一 相当 依赖,1
TRAIN_SENT_ID_282049,刘霓娜,刘诺一,（ 刘诺一 因 感冒 缺席 军训 部分 、 由 刘霓娜 代班 。 ）,人物二 感冒 缺席 军训 部分  人物一 代班,1
TRAIN_SENT_ID_250644,鲁西西,皮皮鲁,罐头 小人 各有所长 ， 皮皮鲁 和 鲁西西 带 罐头 小人 一起 上学 ， 其 经历 让 人 忍俊不禁 。,罐头 小人 各有所长  人物二 人物一 带 罐头 小人 一起 上学  经历 忍俊不禁,1
TRAIN_SENT_ID_260701,王重阳,全真七子,( 4 ) 清静 家风 ： 王重阳 与 全真七子 的 丹法 关要 ， 宗教学 研究 ， 2009 年 03 月,清静 家风  人物一 人物二 丹法 关要  宗教学 研究   年  月,-1
TRAIN_SENT_ID_285732,陈应德,杨虎,陈应德 先生 因 机缘巧合 ， 跟随 李景 彦 、 杨虎 、 王赐信 等 诸 先生 学习 ， 较为 全面 的 继承 了 忽灵 太极拳 。,人物一 先生 机缘巧合  跟随 李景 彦  人物二  王赐信 先生 学习  较为 全面 继承 忽灵 太极拳,-1
TRAIN_SENT_ID_259801,李偲菘,李伟菘,听 ， MUNAN 由 华语 乐坛 顶级 音乐 人 李偲菘 、 李伟菘 、 易家扬 ， 联袂 打造 ， 洗尽铅华 的 温暖 女声 ， 让 人 欲罢不能 的 好 音乐 。,听   华语 乐坛 顶级 音乐 人物一  人物二  易家扬  联袂 打造  洗尽铅华 温暖 女声  欲罢不能 音乐,1
TRAIN_SENT_ID_249175,皮皮鲁,鲁西西,他 笔下 的 皮皮鲁 、 鲁西西 、 罗克 及 舒克和贝塔 影响 了 中国 三代 孩子 。,笔下 人物一  人物二  罗克 舒克和贝塔 影响 中国 三代 孩子,1
TRAIN_SENT_ID_251885,曹薰铉,李昌镐,第 3 局 模仿 之战 黑方 曹薰铉 白方 李昌镐,局 模仿 之战 黑方 人物一 白方 人物二,-1
TRAIN_SENT_ID_266193,李昌镐,曹薰铉,虽然 日本队 主帅 加藤 正夫 力克 曹薰铉 ， 但 还是 没能 闯过 最后 李昌镐 一关 。,日本队 主帅 加藤 正夫 力克 人物二  没能 闯过 最后 人物一 一关,-1
TRAIN_SENT_ID_264937,贾元春,贾宝玉,贾元春 ， 中国 古典小说 《 红楼梦 》 中 的 人物 ， 金陵 十二钗 之一 ， 贾政 与 王夫人 所生 的 长女 ， 贾宝玉 的 姐姐 ， 贾府 通称 娘娘 。,人物一  中国 古典小说  红楼梦  中 人物  金陵 十二钗  贾政 王夫人 所生 长女  人物二 姐姐  贾府 通称 娘娘,1
TRAIN_SENT_ID_249305,陆无双,程英,曾斗 之 人 ： 李莫愁 、 公孙止 、 陆无双 、 程英 、 洪凌波,曾斗  李莫愁  公孙止  人物一  人物二  洪凌波,1
TRAIN_SENT_ID_252435,颜回,孔子,孔子 的 弟子 颜回 ， 可谓 仁者 也 。,人物二 弟子 人物一  可谓 仁者,-1
TRAIN_SENT_ID_259949,周志文,周志康,周志文 周志康,人物一 人物二,1
TRAIN_SENT_ID_252636,颜回,孔子,孔子 把 颜回 叫 进来 说 ： “ 前 几天 我 梦见 了 祖先 ， 这 难道 是 祖先 在 启发 我们 保佑 我们 吗 ？,人物二 人物一 进来 说   前 几天 梦见 祖先  难道 祖先 启发 保佑,-1
TRAIN_SENT_ID_252937,颜回,孔子,（ 1 ） 颜生 ： 即 颜回 ， 字子渊 ， 春秋 时鲁国 人 ， 是 孔子 最 得意 的 弟子 。,颜生  人物一  字子渊  春秋 时鲁国  人物二 得意 弟子,-1
TRAIN_SENT_ID_260724,王重阳,全真七子,它 是 为了 纪念 道教 全真 派 的 创始人 王喆 即 《 射雕 英雄传 》 中 全真七子 的 师傅 — — 王重阳 而 修建 的 。,纪念 道教 全真 派 创始人 王喆  射雕 英雄传  中 人物二 师傅   人物一 修建,-1
TRAIN_SENT_ID_263548,林逸,杨明,王笑 嫣 林逸 的 师娘 之一 ， 杨 七七 的 母亲 ， 杨明 的 妻子 之一 。,王笑 嫣 人物一 师娘  杨 七七 母亲  人物二 妻子,-1
TRAIN_SENT_ID_263347,蔡夫人,蔡瑁,刘表 个 蔡夫人 打算 将 刘琮 立 为 继承人 ， 而 蔡瑁 、 张允 则 为 其 党羽 。,刘表 人物一 打算 刘琮 立 继承人  人物二  张允 党羽,1
TRAIN_SENT_ID_258805,张无忌,殷离,千蛛 万 毒手 秘笈 ， 张无忌 与 殷离 被 灭绝师太 抓住 时 得到 （ 剧情 ）,千蛛 万 毒手 秘笈  人物一 人物二 灭绝师太 抓住 时 得到  剧情,1
TRAIN_SENT_ID_261723,汤镇业,汤镇宗,杨文军 主要 作品 : 杨文军 电视剧 : 1997 年 《 新 乱世佳人 》 主演 ： 恬妞 、 汤镇宗 、 汤镇业,杨文军 主要 作品  杨文军 电视剧   年  新 乱世佳人  主演  恬妞  人物二  人物一,1
TRAIN_SENT_ID_253068,颜回,孔子,孔子 说 颜回 不会 做 这种 事 。,人物二 说 人物一 不会 做 这种 事,-1
TRAIN_SENT_ID_252502,颜回,孔子,颜回 随 孔子 在 郑国 考察 了 大夫 子产 的 政绩 ， 考察 了 乡校 ， 拜祭 了 子产 。,人物一 人物二 郑国 考察 大夫 子产 政绩  考察 乡校  拜祭 子产,-1
TRAIN_SENT_ID_269447,毛岸龙,毛岸英,毛岸英 兄弟 三人 被 送到 地下党 主办 的 大同 幼稚园 后 不久 ， 小弟 毛岸龙 去世 （ 还有 突然 失踪 一说 ） 。,人物二 兄弟 三人 送到 地下党 主办 大同 幼稚园 不久  小弟 人物一 去世  突然 失踪 一说,1
TRAIN_SENT_ID_255337,卫夫人,王羲之,旧题 卫夫人 撰 ， 后 众说纷纭 ， 或 疑为 王羲之 撰 ， 或 疑为 六朝 人 伪托 。,旧题 人物一 撰  众说纷纭  疑为 人物二 撰  疑为 六朝 伪托,-1
TRAIN_SENT_ID_251893,曹薰铉,李昌镐,刘昌赫 、 李世石 、 李昌镐 、 朴永训 、 曹薰铉 等 。,刘昌赫  李世石  人物二  朴永训  人物一,-1
TRAIN_SENT_ID_271191,张翠山,张三丰,2002 年 ， 与 张卫健 、 李冰 冰 、 李小璐 合作 古装剧 《 少年 张三丰 》 ， 出演 张翠山 一角 。,年  张卫健  李冰 冰  李小璐 合作 古装剧  少年 人物二   出演 人物一 一角,-1
TRAIN_SENT_ID_266217,蓝提斯,谢加图,锡菲罗上 最高 法力 的 魔导师 ， 是 谢加图 、 蓝提斯 、 爱尔希 欧蕾 等 人 的 师父 。,锡菲罗上 最高 法力 魔导师  人物二  人物一  爱尔希 欧蕾 师父,1
TRAIN_SENT_ID_256501,周武,周文,23 世 冉季载 ： 周文 王 姬昌 第十 子 ， 周武 王 姬发 同 母弟 ， 封于 冉 （ 国都 在 今 山东 定陶 ） ， 以国 为 氏 ， 冉氏 得 姓 始祖,世 冉季载  人物二 王 姬昌 第十 子  人物一 王 姬发 母弟  封于 冉  国都 山东 定陶   以国 氏  冉氏 姓 始祖,1
TRAIN_SENT_ID_254284,张顺,张横,张顺 死后 ， 还 把 灵魂 附在 张横 身上 杀死 了 方天定 。,人物一 死后  灵魂 附在 人物二 身上 杀死 方天定,1
TRAIN_SENT_ID_252520,颜回,孔子,颜回 的 忠厚 与 内向 ， 掩盖 了 他 的 聪颖 善思 ， 就 连 孔子 一时 也 难以 断定 颜回 的 天资 究竟 属于 那个 层次 。,人物一 忠厚 内向  掩盖 聪颖 善思  人物二 一时 难以 断定 人物一 天资 究竟 属于 层次,-1
TRAIN_SENT_ID_279220,吕馨,吕禄,吕馨 连忙 磕头 以示 感谢 ， 然后 和 吕禄 一起 离开 ， 这时 她 的 心里 一定 很 高兴 ， 因为 免过 了 一死 ， 但 她 意料不到 的 是 ， 死神 依然 在 向 她 招手 。,人物一 连忙 磕头 以示 感谢  人物二 一起 离开  心里 一定 高兴  免过 一死  意料不到  死神 依然 招手,1
TRAIN_SENT_ID_256568,周武,周文,应之 於 门 ， 曰 ： 何以 道旦 也 （ 周公 ， 姓姬 名旦 ， 周文 王之 子 ， 周武 王之 弟 ， 周成 王之 叔父 ） ？,应之 於 门  曰  道旦  周公  姓姬 名旦  人物二 王之 子  人物一 王之 弟  周成 王之 叔父,1
TRAIN_SENT_ID_250364,赵飞燕,赵合德,“ 二赵 ” 是 中国 西汉时期 著名 的 美女 赵飞燕 、 赵合德 的 合称 。,二赵  中国 西汉时期 著名 美女 人物一  人物二 合称,1
