sent_id,entity1,entity2,sent,processed_sent,human
TRAIN_SENT_ID_249058,吕洞宾,韩湘子,唐朝 后期 ， 伯陵 被贬 ， 心情 十分 不好 ， 刚好 遇到 他 的 侄子 韩湘子 和 华山 修道士 吕洞宾 ， 二人 劝说 伯陵 去 华山 一游 ， 以解 心头 之闷 。,唐朝 后期  伯陵 被贬  心情 十分 不好  刚好 遇到 侄子 人物二 华山 修道士 人物一  二人 劝说 伯陵 华山 一游  以解 心头 之闷,-1
TRAIN_SENT_ID_259645,公孙胜,罗真人,戴宗 叫 李逵 去 屋里 打闹 ， 公孙胜 只好 出来 ， 以 老母 年迈 ， 罗真人 不放为 由 不 去 梁山 。,戴宗 李逵 屋里 打闹  人物一 只好  老母 年迈  人物二 不放为 梁山,-1
TRAIN_SENT_ID_285892,班淑娴,白鹿子,白鹿子 ， 金庸 武侠小说 《 倚天 屠龙记 》 中 的 人物 ， 昆仑 派 掌门 ， 何足道 的 弟子 ， 何太冲 、 班淑娴 的 师父 ， 与 明教中 一个 高手 争斗 而 死 。,人物二  金庸 武侠小说  倚天 屠龙记  中 人物  昆仑 派 掌门  何足道 弟子  何太冲  人物一 师父  明教中 一个 高手 争斗 死,-1
TRAIN_SENT_ID_253867,赵合德,赵飞燕,"她 竟 穿越 到 了 汉朝 成 了 祸水 — 赵合德 , 和 姐姐 赵飞燕 争抢 同一个 同一个 男人 , 究竟 发生 了 什么 。",竟 穿越 汉朝 成 祸水  人物一  姐姐 人物二 争抢 同一个 同一个 男人  究竟 发生,1
TRAIN_SENT_ID_270035,楚寒镜,楚碧痕,楚寒镜 是 炎帝 神农 洞 月 幽之境 中 守护 梭罗 仙树 的 梭罗树 仙 之一 ， 楚碧痕 的 孪生 姐姐 。,人物一 炎帝 神农 洞 月 幽之境 中 守护 梭罗 仙树 梭罗树 仙  人物二 孪生 姐姐,1
TRAIN_SENT_ID_249184,皮皮鲁,鲁西西,其 笔下 的 皮皮鲁 、 鲁西西 、 舒克 、 贝塔 罗克 在 中国 拥有 亿万 读者 ， 连 成年人 也 被 吸引 ， 其 童话 被誉为 “ 适合 全家 所有人 阅读 ” 。,笔下 人物一  人物二  舒克  贝塔 罗克 中国 拥有 亿万 读者  成年人 吸引  童话 被誉为  适合 全家 所有人 阅读,1
TRAIN_SENT_ID_270586,全真七子,王重阳,《 神雕侠侣 》 — 甄志丙 、 王重阳 、 全真七子 、 忽必烈 、 周伯通,神雕侠侣   甄志丙  人物二  人物一  忽必烈  周伯通,-1
TRAIN_SENT_ID_258824,张无忌,殷离,2003 ， 亚环 影音 ， 苏有朋 饰 张无忌 ， 贾静雯 饰 赵敏 ， 高圆圆 饰 周芷若 ， 陈秀丽 饰小昭 ， 陈莎莎 （ 陈紫函 ） 饰 殷离 （ 蛛儿 ）,亚环 影音  苏有朋 饰 人物一  贾静雯 饰 赵敏  高圆圆 饰 周芷若  陈秀丽 饰小昭  陈莎莎  陈紫函  饰 人物二  蛛儿,1
TRAIN_SENT_ID_275643,邢一诚,邢大业,邢一诚 （ 阿一 ） 和 邢大业 （ 辰 亦 儒饰 ) 是 堂兄弟 ， 由于 父母 到 中国 开拓 事业 ， 和 大业 一起 独立 出来 。,人物一  阿一  人物二  辰 儒饰  堂兄弟  父母 中国 开拓 事业  大业 一起 独立,1
TRAIN_SENT_ID_257832,林平之,岳不群,为 人 忠厚老实 ， 因 看见 师父 杀 林平之 感到 震惊 喊 了 一声 ， 也 因此 惊动 岳不群 引来 杀身之祸 。,忠厚老实  看见 师父 杀 人物一 感到 震惊 喊 一声  惊动 人物二 引来 杀身之祸,-1
TRAIN_SENT_ID_267434,陆展元,陆立鼎,父亲 ： 陆立鼎 （ 原著 的 父亲 就是 陆立鼎 ， 一些 电视剧 里 改成 了 陆展元 ）,父亲  人物二  原著 父亲 人物二  电视剧 里 改成 人物一,1
TRAIN_SENT_ID_274399,贾演,贾源,注释 ： 贾演 、 贾源 之 父 ， 书中 未 交代 其名 ， 今以 “ 贾 太公 ” 代之 ， 不 称呼 他 为 “ 贾公 ” ， 是因为 贾母 的 丈夫 贾代善 世称 “ 贾公 ” 。,注释  人物一  人物二 父  书中 未 交代 其名  今以  贾 太公  代之  称呼  贾公   是因为 贾母 丈夫 贾代善 世称  贾公,1
TRAIN_SENT_ID_276966,樊迟,孔子,关于 仁 ， 孔子 对 樊迟 的 解释 似乎 与 别处 不同 ， 说 是 “ 爱人 ” ， 实际上 孔子 在 各处 对仁 的 解释 都 有 内在 的 联系 。,仁  人物二 人物一 解释 似乎 不同  说  爱人   实际上 人物二 各处 对仁 解释 内在 联系,-1
TRAIN_SENT_ID_271495,孟优,孟获,它 坐落 在 金龟 岛上 ， 正殿 塑有 孟获 、 孟优 、 摩铁 三尊 神像 ， 中殿 塑有 孟获 之妻 祝融 夫人 像 ， 后 殿 观音菩萨 像 。,坐落 金龟 岛上  正殿 塑有 人物二  人物一  摩铁 三尊 神像  中殿 塑有 人物二 之妻 祝融 夫人  殿 观音菩萨,1
TRAIN_SENT_ID_264545,岳云鹏,郭德纲,2014 年 5 月 1 日 ， 参加 岳云鹏 在 北京 开展 的 “ 岳来 越 棒 ” 专场 ， 在 演出 中 表演 相声 ； 9 月 27 日 ， 参加 郭德纲 相声 巡演 南京站 。,年  月  日  参加 人物一 北京 开展  岳来 越 棒  专场  演出 中 表演 相声   月  日  参加 人物二 相声 巡演 南京站,-1
TRAIN_SENT_ID_253095,颜回,孔子,颜回 — — 孔子 弟子 ， 出场 时 三十多岁 。,人物一   人物二 弟子  出场 时 三十多岁,-1
TRAIN_SENT_ID_271261,马季,侯宝林,因为 侯宝林 是 马季 的 师父 ， 马季 是 姜昆 的 师父 ， 而 姜昆 又 是 倪明 的 师父 。,人物二 人物一 师父  人物一 姜昆 师父  姜昆 倪明 师父,-1
TRAIN_SENT_ID_270206,谢宗信,吴诚真,吴诚真 是 华中科技大学 研究生 学历 ， 1984 年 3 月 在 武汉市 长春 观 出家 ， 拜 北京 白云观 第 23 代 方丈 谢宗信 大师 为师 。,人物二 华中科技大学 研究生 学历   年  月 武汉市 长春 观 出家  拜 北京 白云观  代 方丈 人物一 大师 为师,-1
TRAIN_SENT_ID_282168,韩起凤,韩起龙,韩起龙 追赶 女将 巴秀琳 ， 在 问 月 庵 和 巴秀琳 成婚 ， 韩起凤 前往 接应 兄长 ， 也 遇上 美女 王素 娟 ， 强迫 其 嫁给 自己 ， 兄弟 双双 成亲 。,人物二 追赶 女将 巴秀琳  问 月 庵 巴秀琳 成婚  人物一 前往 接应 兄长  遇上 美女 王素 娟  强迫 嫁给  兄弟 双双 成亲,1
TRAIN_SENT_ID_253131,颜回,孔子,“ 孔子 听 了 颜回 的话 ， 愁苦 了 几天 的 脸上 有 了 笑容 ， 说 ： “ 好 小子 ， 好 小子 ！,人物二 听 人物一  愁苦 几天 脸上 笑容  说   小子  小子,-1
TRAIN_SENT_ID_252688,颜回,孔子,陋巷 街 的 名称 源于 孔子 的 一段话 ， 孔子 说 的 颜回 居 陋巷 ， 人 不堪其忧 ， 回 也 不改其乐 ， 贤哉 回 也 ， 便 有 陋巷 堂号 。,陋巷 街 名称 源于 人物二 一段话  人物二 说 人物一 居 陋巷  不堪其忧  回 不改其乐  贤哉 回  便 陋巷 堂号,-1
TRAIN_SENT_ID_252870,颜回,孔子,《 孔子 家语 · 颜回 》 ： “ 设虚器 ， 纵逆祀 ， 祠 海鸟 ： 三不智 。 ”,人物二 家语  人物一    设虚器  纵逆祀  祠 海鸟  三不智,-1
TRAIN_SENT_ID_261593,宋小宝,赵本山,2013 ， 樱桃红 扮演 王云 ， 合作 演员 赵本山 ， 宋小宝 ， 沈春阳,樱桃红 扮演 王云  合作 演员 人物二  人物一  沈春阳,-1
TRAIN_SENT_ID_256535,周武,周文,周文 王四 子 周武 王弟 周成 王叔,人物二 王四 子 人物一 王弟 周成 王叔,1
TRAIN_SENT_ID_274102,南宫敬叔,孔子,等到 孟厘子 死 后 ， 孟懿子 和 鲁国 人 南宫敬叔 便 前往 孔子 处学礼 。,孟厘子 死  孟懿子 鲁国 人物一 便 前往 人物二 处学礼,-1
TRAIN_SENT_ID_254293,张顺,张横,张横 名人 点评 : 邵氏 《 荡寇 志 》 中 的 张横 金圣叹 ： 阮小二 、 阮小五 、 张横 、 张顺 ， 都 是 中 上 人物 。,人物二 名人 点评  邵氏  荡寇 志  中 人物二 金圣叹  阮小二  阮小五  人物二  人物一  中 人物,1
TRAIN_SENT_ID_271513,孟优,孟获,孟获 说 这次 是 弟弟 孟优 饮酒 误事 ， 仍 不服气 。,人物二 说 弟弟 人物一 饮酒 误事  不服气,1
TRAIN_SENT_ID_255290,卫夫人,王羲之,③ 卫氏 夫人 ： 卫夫人 是 运城 夏县 人 ， 曾任 王羲之 的 老师 。,③ 卫氏 夫人  人物一 运城 夏县  曾任 人物二 老师,-1
TRAIN_SENT_ID_265453,薛谭,秦青,《 列子 · 汤问 》 ， 战国 l 列 御寇 编撰 中有 《 薛谭 学 讴 》 ： 薛谭 学 讴于 秦青 ， 未穷 青之技 ， 自谓 尽 之 ， 遂 辞 归 。,列子  汤问   战国  列 御寇 编撰 中有  人物一 学 讴   人物一 学 讴于 人物二  未穷 青之技  自谓  遂 辞,-1
TRAIN_SENT_ID_249209,皮皮鲁,鲁西西,皮皮鲁 生日 纪念 : 皮皮鲁 和 鲁西西 30 岁 生日 庆典 ( 17 张 ),人物一 生日 纪念  人物一 人物二  岁 生日 庆典   张,1
TRAIN_SENT_ID_249059,吕洞宾,韩湘子,八仙 即 汉族 民间 传顺星 说 中 的 李铁拐 、 汉 钟离 、 张果老 、 何仙姑 、 蓝采和 、 吕洞宾 、 韩湘子 、 曹国舅 八位 神仙 。,八仙 汉族 民间 传顺星 说 中 李铁拐  汉 钟离  张果老  何仙姑  蓝采和  人物一  人物二  曹国舅 八位 神仙,-1
TRAIN_SENT_ID_256570,周武,周文,10 . 周公 ： 姓姬 ， 名旦 ， 周文 王之子 ， 周武 王之弟 ， 西周 初 政治家 ， 相传 周朝 的 典章制度 都 是 他 制定 的 。,周公  姓姬  名旦  人物二 王之子  人物一 王之弟  西周 初 政治家  相传 周朝 典章制度 制定,1
TRAIN_SENT_ID_261146,武元庆,武则天,武则天 兄弟姐妹 : 长兄 ： 武元庆,人物二 兄弟姐妹  长兄  人物一,1
TRAIN_SENT_ID_249228,皮皮鲁,鲁西西,鲁西西 和 大 侦探 乔 麦皮 人物 介绍 : 皮皮鲁 他 学习成绩 不高 ， 不是 学校 老师 喜欢 的 那种 乖孩子 ， 但 他 心地善良 、 正义 勇敢 ， 身上 有 故事 。,人物二 侦探 乔 麦皮 人物 介绍  人物一 学习成绩 不高  学校 老师 喜欢 那种 乖孩子  心地善良  正义 勇敢  身上 故事,1
TRAIN_SENT_ID_257441,姜昆,马季,1996 丙子年 : 相声 ： 王平 、 唐杰忠 、 王谦祥 、 李增瑞 、 常贵田 、 王培元 、 姜昆 、 戴志诚 、 牛群 、 冯巩 、 刘伟 、 马季 （ 已故 ） 。,丙子年  相声  王平  唐杰忠  王谦祥  李增瑞  常贵田  王培元  人物一  戴志诚  牛群  冯巩  刘伟  人物二  已故,-1
TRAIN_SENT_ID_271296,吕祖俭,吕祖谦,吕蒙正 的 后辈 多有 名人 ， 如 侄子 吕夷简 ， 侄孙 吕公著 ， 官至 宰相 ， 八 世孙 吕祖谦 、 吕祖俭 都 是 南宋 著名 大儒 。,吕蒙正 后辈 多有 名人  侄子 吕夷简  侄孙 吕公著  官至 宰相  八 世孙 人物二  人物一 南宋 著名 大儒,1
TRAIN_SENT_ID_279089,程英,黄药师,不过 她 最 成功 的 应该 是 在 电视剧 领域 ， 比较 有 影响 的 角色 是 83 版 《 神雕侠侣 》 中 扮演 黄药师 的 女 徒弟 程英 。,成功 应该 电视剧 领域  比较 影响 角色  版  神雕侠侣  中 扮演 人物二 女 徒弟 人物一,-1
TRAIN_SENT_ID_274507,曾江,林翠,父亲 为 港台 影坛 武打 巨星 王羽 ， 母亲 为 有 「 学生 情人 」 封号 的 已故 女星 林翠 ， 舅父 为 著名演员 曾江 。,父亲 港台 影坛 武打 巨星 王羽  母亲  学生 情人  封号 已故 女星 人物二  舅父 著名演员 人物一,1
TRAIN_SENT_ID_255476,罗成,秦琼,秦琼 、 尉迟恭 、 程咬金 、 罗成 等 率兵 扫平 了 十八 路 反王 。,人物二  尉迟恭  程咬金  人物一 率兵 扫平 十八 路 反王,1
TRAIN_SENT_ID_261687,程英,陆无双,杨过 在 告别 陆无双 与 程英 后于 山岭 间 信步而行 时 无意 中 遇到 了 金轮法王 师徒 一行 ， 在 帮 其 疗伤 后 杨过 要求 国师 帮 自己 报仇 。,杨过 告别 人物二 人物一 后于 山岭 间 信步而行 时 无意 中 遇到 金轮法王 师徒 一行  帮 疗伤 杨过 要求 国师 帮 报仇,1
TRAIN_SENT_ID_259942,周志文,周志康,回乡 艺人 ： 王 祖蓝 、 胡枫 、 汤盈盈 、 许廷铿 、 杨思琦 、 陈伟 霆 、 关心妍 、 周志文 、 周志康 、 林欣彤,回乡 艺人  王 祖蓝  胡枫  汤盈盈  许廷铿  杨思琦  陈伟 霆  关心妍  人物一  人物二  林欣彤,1
TRAIN_SENT_ID_249224,皮皮鲁,鲁西西,"其 笔下 的 皮皮鲁 、 鲁西西 、 舒克 、 贝塔 和 罗克 在 中国 拥有 亿万 读者 ， 连 成年人 也 被 吸引 ， 其 童话 被誉为 "" 适合 全家 所有人 阅读 "" 。",笔下 人物一  人物二  舒克  贝塔 罗克 中国 拥有 亿万 读者  成年人 吸引  童话 被誉为  适合 全家 所有人 阅读,1
TRAIN_SENT_ID_279254,杨诺思,杨永晴,2008 年 4 月 杨永晴 堂姐 杨诺思 透露 陈冠希 与 杨永晴 感情 未 变 ， 未有 分手 。,年  月 人物二 堂姐 人物一 透露 陈冠希 人物二 感情 未 变  未有 分手,1
TRAIN_SENT_ID_275677,周厚安,周厚恩,育有 一男一女 ， 分别 是 周厚安 和 周厚恩 ， 。,育有 一男一女  人物一 人物二,1
TRAIN_SENT_ID_275497,西门雁,西门云,西门云 是 西门雁 的 姐姐 ， 在 剧中 她 是 嬴政 宠爱 的 云美人 ， 是 一位 美若天仙 的 宫女 。,人物二 人物一 姐姐  剧中 嬴政 宠爱 云美人  一位 美若天仙 宫女,1
TRAIN_SENT_ID_250566,鲁西西,皮皮鲁,《 皮皮鲁 与 鲁西西 》 饰演 苏荀,人物二 人物一  饰演 苏荀,1
TRAIN_SENT_ID_260687,王重阳,全真七子,拜师 王重阳 ， 成其 高足 ， 即 “ 全真七子 ” 之一 。,拜师 人物一  成其 高足   人物二,-1
TRAIN_SENT_ID_279414,王学明,龙俊杰,王学明 、 龙俊杰 、 范益松 、 周艳霞,人物一  人物二  范益松  周艳霞,-1
TRAIN_SENT_ID_250594,鲁西西,皮皮鲁,他 的 童话 作品 以 全新 独特 的 面貌 征服 了 全国 亿万 小 读者 ， 他 笔下 的 皮皮鲁 、 鲁西西 和 舒克 、 贝塔 ， 在 中国 孩子 中 无人不晓 。,童话 作品 全新 独特 面貌 征服 全国 亿万 读者  笔下 人物二  人物一 舒克  贝塔  中国 孩子 中 无人不晓,1
TRAIN_SENT_ID_252733,颜回,孔子,( 2 ) 颜生 ： 即 颜回 ， 字子渊 ， 春秋 时鲁国 人 ， 是 孔子 最 得意 的 弟子 。,颜生  人物一  字子渊  春秋 时鲁国  人物二 得意 弟子,-1
TRAIN_SENT_ID_271511,孟优,孟获,相传 ， 三国 时期 ， 孟获 之兄 孟优 得 异人授 以 仙术 ， 就 居于 魏宝 山中 ， 以 方术 济人 。,相传  三国 时期  人物二 之兄 人物一 异人授 仙术  居于 魏宝 山中  方术 济人,1
TRAIN_SENT_ID_252825,颜回,孔子,孔子 的 得意 弟子 颜回 箪食瓢饮 ， 贫而 好学 。,人物二 得意 弟子 人物一 箪食瓢饮  贫而 好学,-1
TRAIN_SENT_ID_256958,仲由,孔子,仲 村镇 鲍家坡 村 ， 坐落于 平邑县 仲 村镇 政府 驻地 ， 这里 是 孔子 著名 弟子 ， 七十二 贤人 之一 的 仲由 的 故里 。,仲 村镇 鲍家坡 村  坐落于 平邑县 仲 村镇 政府 驻地  人物二 著名 弟子  七十二 贤人 人物一 故里,-1
TRAIN_SENT_ID_253040,颜回,孔子,【 译文 】 孔子 说 ： “ 听 我 说话 而能 毫不 懈怠 的 ， 只有 颜回 一个 人 吧 ！ ”,译文  人物二 说   听 说话 而能 毫不 懈怠  人物一 一个,-1
TRAIN_SENT_ID_283485,俞莲舟,张三丰,武当派 历来 高手如云 ， 前有 张三丰 ， 后 又 宋远桥 、 俞莲舟 、 俞岱岩 等 。,武当派 历来 高手如云  前有 人物二  宋远桥  人物一  俞岱岩,-1
TRAIN_SENT_ID_265423,薛谭,秦青,薛谭 （ 听 了 后 ） 便 （ 向 秦青 ） 道歉 并 要求 能 返回 （ 继续 跟 秦青 学习 唱歌 ） ， （ 从此 ） 一辈子 不再 说 回去 的 事 了 。,人物一  听  便  人物二  道歉 要求 返回  继续 人物二 学习 唱歌     一辈子 不再 说 回去 事,-1
TRAIN_SENT_ID_269505,李国豪,李香凝,1969 年 4 月 ， 李小龙 的 爱女 李香凝 出生 ， 她 比 哥哥 李国豪 小 4 岁 ， 两人 都 是,年  月  李小龙 爱女 人物二 出生  哥哥 人物一  岁  两人,1
TRAIN_SENT_ID_267577,吴魏,吴狄,不是 疯子 ， 不是 吴狄 ， 而是 吴魏 。,疯子  人物二  人物一,1
TRAIN_SENT_ID_265732,李三思,李三省,景天 为 他 的 两个 儿子 取名 李三思 、 李三省 ， 意 为 “ 三思而后行 ” “ 吾 日 三 省吾身 ” ， 为 他 的 客栈 取名 “ 仙剑 客栈 ” 。,景天 两个 儿子 取名 人物一  人物二  意  三思而后行   吾 日 三 省吾身   客栈 取名  仙剑 客栈,1
TRAIN_SENT_ID_277016,钟藜,钟馗,钟馗 回到 终南山 ， 得知 他 的 同村 知友 杜 钟藜 ( 50 张 ),人物二 回到 终南山  得知 同村 知友 杜 人物一   张,1
TRAIN_SENT_ID_265102,杨志刚,郭靖宇,2009 年 《 铁 梨花 》 （ 编剧 / 导演 ： 郭靖宇 主演 ： 巍子 、 陈数 、 冯雷 、 史可 、 张少华 、 杨志刚 、 岳丽娜 ）,年  铁 梨花   编剧  导演  人物二 主演  巍子  陈数  冯雷  史可  张少华  人物一  岳丽娜,1
TRAIN_SENT_ID_265435,薛谭,秦青,秦青 对 薛谭 说 ： “ 送君 千里 终须 一 别 ， 自此 之后 ， 我们 二人 不知 何日 才能 相见 。,人物二 人物一 说   送君 千里 终须  自此 之后  二人 不知 何日 相见,-1
TRAIN_SENT_ID_264668,柳承莞,柳承范,《 冰上 交易 》 是 2010 年 上映 的 韩国 电影 ， 由 柳承莞 执导 ， 黄政民 ， 柳承范 等 主演 。,冰上 交易   年 上映 韩国 电影  人物一 执导  黄政民  人物二 主演,1
TRAIN_SENT_ID_251530,陈辅,陈靖仇,陈辅 将 自己 复国 的 愿望 ， 全落 在 幼小 的 陈靖仇 身上 。,人物一 复国 愿望  全落 幼小 人物二 身上,-1
TRAIN_SENT_ID_262725,周厚恩,周厚安,周厚恩 人物 经历 : 周厚恩 ， 女 ， 1994 年 出生 ， 英文 名为 Anya ， 哥哥 是 周厚安 ， 著名 音乐 人 周华健 的 女儿 。,人物一 人物 经历  人物一  女   年 出生  英文 名为   哥哥 人物二  著名 音乐 周华健 女儿,1
TRAIN_SENT_ID_274676,马冬晗,马冬昕,Twins 学霸 妹妹 是 人大代表 : 去年 ， 清华大学 特等 奖学金 的 第一名 是 马冬晗 ， 第三名 就是 她 的 双胞胎 妹妹 马冬昕 。,学霸 妹妹 人大代表  去年  清华大学 特等 奖学金 第一名 人物一  第三名 双胞胎 妹妹 人物二,1
TRAIN_SENT_ID_252643,颜回,孔子,孔子 对 曰 ： “ 夫其 所以 为 颜回 者 ， 此 之类 也 ， 岂足 多 哉 ？ ”,人物二 曰   夫其 人物一   岂足,-1
TRAIN_SENT_ID_257033,洪敬尧,洪荣宏,洪荣宏 、 洪敬尧,人物二  人物一,1
TRAIN_SENT_ID_273658,姜子牙,元始天尊,元始天尊 ： 太上老君 通天教主 姜子牙,人物二  太上老君 通天教主 人物一,-1
TRAIN_SENT_ID_251604,穆春,穆弘,薛永 在 揭阳 镇上 卖艺 时得遇 宋江 ， 自然 是 一拜 再拜 ， 并 和 当地 的 地头蛇 穆弘 穆春 兄弟 结了 梁子 。,薛永 揭阳 镇上 卖艺 时得遇 宋江  自然 一拜 再拜  地头蛇 人物二 人物一 兄弟 结了 梁子,1
TRAIN_SENT_ID_272359,文殊广法天尊,金吒,王魔 追赶 逃亡 的 姜子牙 到 五龙山 云霄 洞 ， 被 文殊广法天尊 、 金吒 师徒 所杀 。,王魔 追赶 逃亡 姜子牙 五龙山 云霄 洞  人物一  人物二 师徒 所杀,-1
TRAIN_SENT_ID_263911,汤镇宗,汤镇业,汤镇宗 社会活动 : 2008 年 ， 汤镇宗 、 汤镇业 兄弟俩 赴 成都 ， 将 两笔 各 10 万元 的 捐赠 款 交给 了 四川 慈善 总会 。,人物一 社会活动   年  人物一  人物二 兄弟俩 赴 成都  两笔  万元 捐赠 款 交给 四川 慈善 总会,1
TRAIN_SENT_ID_263023,钱婆婆,汤婆婆,汤婆婆 是 一个 爱 发脾气 又 贪钱 的 物质 女人 ， 而 钱婆婆 却是 一个 性格 温和 而 慈祥 的 老奶奶 。,人物二 一个 爱 发脾气 贪钱 物质 女人  人物一 却是 一个 性格 温和 慈祥 老奶奶,1
TRAIN_SENT_ID_250116,武敦儒,武修文,第一章 介绍 ： 那 摔破 额角 的 叫做 武敦儒 ， 是 哥哥 ， 弟弟 叫做 武修文 。,第一章 介绍  摔破 额角 叫做 人物一  哥哥  弟弟 叫做 人物二,1
TRAIN_SENT_ID_268904,司徒静,司徒剑南,司徒剑南 第三集 : 白云飞 知朱允 和 司徒静 都 不是 简单 人物 ， 已起 结交 之心 。,人物二 第三集  白云飞 知朱允 人物一 简单 人物  已起 结交 之心,1
TRAIN_SENT_ID_249030,吕洞宾,韩湘子,道教 援引 改造 之 ， 成 一组 上仙 ， 即 铁拐李 、 钟离权 、 吕洞宾 、 张果老 、 曹国舅 、 韩湘子 、 蓝采和 、 何仙姑 。,道教 援引 改造  成 一组 上仙  铁拐李  钟离权  人物一  张果老  曹国舅  人物二  蓝采和  何仙姑,-1
TRAIN_SENT_ID_271532,孟优,孟获,【 蜀国 益州 酒馆 】 姜维 魏延 马良 糜竺 孟获 祝融 夫人 孟优 沙摩柯 大地 火焰 暴风,蜀国 益州 酒馆  姜维 魏延 马良 糜竺 人物二 祝融 夫人 人物一 沙摩柯 大地 火焰 暴风,1
TRAIN_SENT_ID_269125,唐鉴军,赵本山,由 孟令宇 、 孙博 执导 ， 毕畅 、 贺树峰 、 唐鉴军 、 贺树峰 、 王小利 、 刘小光 、 赵本山 等 联合 主演 的 农村 题材 剧 。,孟令宇  孙博 执导  毕畅  贺树峰  人物一  贺树峰  王小利  刘小光  人物二 联合 主演 农村 题材 剧,-1
TRAIN_SENT_ID_257567,毛泽民,毛泽东,34 集 电视 连续剧 《 毛岸英 》 他 还 在 剧中 扮演 了 毛泽东 的 弟弟 毛泽民,集 电视 连续剧  毛岸英  剧中 扮演 人物二 弟弟 人物一,1
TRAIN_SENT_ID_268981,韩非,荀子,韩非 是 韩国 贵族 ， 他 曾 和 李斯 同学 于 荀子 门下 。,人物一 韩国 贵族  李斯 同学 人物二 门下,-1
TRAIN_SENT_ID_262228,尤二姐,尤三姐,与 尤二姐 的 百依百顺 不同 ， 尤三姐 就 不是 逆来顺受 的 弱女子 了 。,人物一 百依百顺 不同  人物二 逆来顺受 弱女子,1
TRAIN_SENT_ID_263906,汤镇宗,汤镇业,2013 年 电视剧 《 乾隆 那些 事 》 任 导演 主演 余少群 郭珍霓 汤镇业 汤镇宗,年 电视剧  乾隆 事  导演 主演 余少群 郭珍霓 人物二 人物一,1
TRAIN_SENT_ID_266153,李昌镐,曹薰铉,横纲 李昌镐 ( 韩国 ) 曹薰铉 ( 韩国 ),横纲 人物一  韩国  人物二  韩国,-1
TRAIN_SENT_ID_267459,唐继虞,唐继尧,此外 ， 唐继尧 、 唐继虞 兄弟 对 国民政府 的 反抗 态度 也 加剧 了 不满 。,人物二  人物一 兄弟 国民政府 反抗 态度 加剧 不满,1
TRAIN_SENT_ID_265100,杨志刚,郭靖宇,导演 ： 郭靖宇 主演 ： 李雪健 、 吴越 、 黄海波 、 杨志刚 、 杨梅,导演  人物二 主演  李雪健  吴越  黄海波  人物一  杨梅,1
TRAIN_SENT_ID_252740,颜回,孔子,殿内 供奉 有文 宣公 ( 孔子 ) 、 邹 国公 ( 孟子 ) 、 兖 国公 ( 颜回 ) 三像 。,殿内 供奉 有文 宣公  人物二   邹 国公  孟子   兖 国公  人物一  三像,-1
TRAIN_SENT_ID_261432,毛泽建,毛泽东,毛泽建 之死 ， 毛泽东 十分 痛惜 。,人物一 之死  人物二 十分 痛惜,1
TRAIN_SENT_ID_260744,薛丁山,薛金莲,《 薛丁山 与 樊梨花 》 饰 窦一虎 ， 搭档 ： 薛金莲 （ 青蓉饰 ） ， 杨丽花 饰 薛丁山 ， 许秀年 饰 樊梨花 。,人物一 樊梨花  饰 窦一虎  搭档  人物二  青蓉饰   杨丽花 饰 人物一  许秀年 饰 樊梨花,1
TRAIN_SENT_ID_251916,曹薰铉,李昌镐,1991 年 曹薰铉 向 弟子 挑战 ， 结果 以三比 二 战胜 了 李昌镐 。,年 人物一 弟子 挑战  以三比 二 战胜 人物二,-1
TRAIN_SENT_ID_251894,曹薰铉,李昌镐,1985 年升 为 五段 . 著有 “ 韩国 四大 天王 ” — — 《 李昌镐 对局 集 》 、 《 曹薰铉 对局 集 》 等 书,年升 五段  著有  韩国 四大 天王     人物二 对局 集    人物一 对局 集  书,-1
TRAIN_SENT_ID_252389,颜回,孔子,人们 能 很 清楚 地 发现 孔子 爱 学生 ， 爱 颜回 ， 爱子 路 ， 爱子 贡 。,清楚 发现 人物二 爱 学生  爱 人物一  爱子 路  爱子 贡,-1
TRAIN_SENT_ID_263351,蔡夫人,蔡瑁,刘表 后妻 蔡夫人 忌恨 备 ， 命弟 蔡瑁 在 襄阳 设宴 ， 欲籍 机杀备 。,刘表 后妻 人物一 忌恨 备  命弟 人物二 襄阳 设宴  欲籍 机杀备,1
TRAIN_SENT_ID_281578,蔡绿峰,蔡惠媚,蔡惠媚 的 兄长 蔡绿峰 是 红豆 食府 餐厅 的 老板 ， 两位 侄女 蔡依伦 、 蔡依珊 分别 嫁给 伦华 集团 总裁 林靖 伦 、 连战 大儿子 连胜文 。,人物二 兄长 人物一 红豆 食府 餐厅 老板  两位 侄女 蔡依伦  蔡依珊 嫁给 伦华 集团 总裁 林靖 伦  连战 大儿子 连胜文,1
TRAIN_SENT_ID_256865,仲由,孔子,孔子 听到 卫国 发生 暴乱 的 消息 ， 说 ： “ 唉呀 ， 仲由 死 了 ！ ”,人物二 听到 卫国 发生 暴乱 消息  说   唉呀  人物一 死,-1
TRAIN_SENT_ID_265556,张崇基,张崇德,许志安 跳槽 正东 ( 1997 年 ) ’ 张崇德 、 张崇基 跳槽 宝丽金 ( 1995 年 ),许志安 跳槽 正东   年   人物二  人物一 跳槽 宝丽金   年,1
TRAIN_SENT_ID_264589,凌波,凌音,凌音 回到 蜀山 时 ， 刚好 遇到 凌波 参与 盗鼎 事件 ， 震惊 的 凌音 始终 都 在 沉默 之中 。,人物二 回到 蜀山 时  刚好 遇到 人物一 参与 盗鼎 事件  震惊 人物二 始终 沉默 之中,1
TRAIN_SENT_ID_281782,黄俊英,罗品超,而 黄俊英 的 师傅 ， 著名 粤剧 大师 罗品超 为了 徒弟 这次 的 演出 ， 特意 从 美国 返回 广州 出席 ， 并 上台演唱 半段 粤剧 《 春香传 — — — 爱歌 》 。,人物一 师傅  著名 粤剧 大师 人物二 徒弟 演出  特意 美国 返回 广州 出席  上台演唱 半段 粤剧  春香传    爱歌,-1
