sent_id,entity1,entity2,sent,processed_sent,label
TRAIN_SENT_ID_253009,颜回,孔子,颜回 又 去向 他 重新 说明 ， 他 才 返回 孔子 门下 ， 从此 弹琴 唱歌 ， 诵读 诗书 ， 终生 不辍 。,人物一 去向 重新 说明  返回 人物二 门下  弹琴 唱歌  诵读 诗书  终生 不辍,-1
TRAIN_SENT_ID_274683,冯国纶,冯国经,第十一章 冯国经 、 冯国纶 的 经营 管理 哲学,第十一章 人物二  人物一 经营 管理 哲学,1
TRAIN_SENT_ID_253851,赵合德,赵飞燕,古代 女人 的 发型 变化多端 ， 如直发 （ 张丽华 ） 、 短发 （ 梁 绿珠 ） 、 卷发 （ 赵合德 ） 、 束发 （ 赵飞燕 ） 、 盘发 （ 甄妃 ） 等 。,古代 女人 发型 变化多端  如直发  张丽华   短发  梁 绿珠   卷发  人物一   束发  人物二   盘发  甄妃,1
TRAIN_SENT_ID_248983,吕洞宾,韩湘子,2 文物 介绍 : 暗 八仙 即用 韩湘子 的 花 、 汉 钟离 的 扇 、 蓝采和 的 箫 、 吕洞宾 的 剑 等 器物 来 代表 八位 神仙 的 形像 。,文物 介绍  暗 八仙 即用 人物二 花  汉 钟离 扇  蓝采和 箫  人物一 剑 器物 代表 八位 神仙 形像,-1
TRAIN_SENT_ID_277591,袁世廉,袁世凯,袁世凯 的 三兄 袁世廉 因 病 辞去 徐州 兵备道 职 ， 袁世凯 将 其 接到 洹 上 村 同住 。,人物二 三兄 人物一 病 辞去 徐州 兵备道 职  人物二 接到 洹 村 同住,1
TRAIN_SENT_ID_275158,孙立荣,赵本山,赵本山 同意 了 ， 并 嘱咐 孙立荣 ， “ 好好 带 一带 这 孩子 ， 将来 他 能 有 出息 。 ”,人物二 同意  嘱咐 人物一   好好 带 一带 孩子  将来 出息,-1
TRAIN_SENT_ID_250623,鲁西西,皮皮鲁,郑渊洁 完全 以 一个 开放 的 态度 支持 “ 皮皮鲁 ” “ 鲁西西 ” 和 《 魔方 大厦 》 的 结合 。,郑渊洁 完全 一个 开放 态度 支持  人物二   人物一   魔方 大厦  结合,1
TRAIN_SENT_ID_270972,李易霏,李昂融,她们 是 － － 李易霏 李昂融 。,人物一 人物二,1
TRAIN_SENT_ID_276983,樊迟,孔子,"孔子 去世 后 , 樊迟 同 闵子 ( 名损 , 字子 骞 ) 和 宓子 ( 名 不齐 , 字子 贱 ) 来棠 地 ( 今 鱼台县 境内 ) 办学 , 传道 于 济水 一带 。",人物二 去世  人物一 闵子  名损  字子 骞  宓子  名 不齐  字子 贱  来棠  鱼台县 境内  办学  传道 济水 一带,-1
TRAIN_SENT_ID_261698,程英,陆无双,郭襄 如此 ， 程英 如此 ， 陆无双 如此 ， 唯独 公孙绿萼 不敢 ， 她 不敢 用 她 的 后半生 去 思念 杨过 。,郭襄  人物一  人物二  唯独 公孙绿萼 不敢  不敢 后半生 思念 杨过,1
TRAIN_SENT_ID_263375,武修文,武敦儒,师侄 ： 郭 芙 、 郭襄 、 郭破虏 、 武敦儒 、 武修文 。,师侄  郭 芙  郭襄  郭破虏  人物二  人物一,1
TRAIN_SENT_ID_276920,樊迟,孔子,樊迟 向 孔子 请教 如何 种 庄稼 。,人物一 人物二 请教 种 庄稼,-1
TRAIN_SENT_ID_275534,王小虎,赵本山,25 、 小品 《 功夫 》 演员 ： 赵本山 、 范伟 、 蔡维利 、 王小虎,小品  功夫  演员  人物二  范伟  蔡维利  人物一,-1
TRAIN_SENT_ID_257028,洪敬尧,洪荣宏,我们 约 好 常常 喜乐 08 旧情绵绵 : 林慧萍 、 洪荣宏 、 洪敬尧,约 常常 喜乐  旧情绵绵  林慧萍  人物二  人物一,1
TRAIN_SENT_ID_275141,孙立荣,赵本山,表演者 是 赵本山 与 宋小宝 、 赵海燕 、 孙立荣 。,表演者 人物二 宋小宝  赵海燕  人物一,-1
TRAIN_SENT_ID_269923,沈春阳,赵本山,由 沈春阳 初次 担纲 女主角 ， 宋小宝 担任 男主角 ， 赵本山 、 小 沈阳 、 赵海燕 、 红孩 联合 出演 。,人物一 初次 担纲 女主角  宋小宝 担任 男主角  人物二  沈阳  赵海燕  红孩 联合 出演,-1
TRAIN_SENT_ID_277742,邵素雯,邵素云,婚后 ， 他们 育有 两子 两女 ， 长子 邵维铭 、 次女 邵素雯 、 三女 邵素云 及 幼子 邵维钟 。,婚后  育有 两子 两女  长子 邵维铭  次女 人物一  三女 人物二 幼子 邵维钟,1
TRAIN_SENT_ID_261602,宋小宝,赵本山,主演 ： 赵本山 、 小 沈阳 、 李立群 、 宋小宝,主演  人物二  沈阳  李立群  人物一,-1
TRAIN_SENT_ID_254257,张顺,张横,揭阳 镇 的 李俊 、 李立 、 穆弘 、 穆春 、 张横 、 张顺 、 童威 、 童猛 、 薛永 、 侯健 。,揭阳 镇 李俊  李立  穆弘  穆春  人物二  人物一  童威  童猛  薛永  侯健,1
TRAIN_SENT_ID_277642,方天翼,顾婷,在 俞梅 牺牲 的 第二天 ， 方天翼 单枪匹马 闯进 南京城 ， 以 搏命 的 方式 杀 了 松下 健 ， 报 了 杀 妻之仇 ， 并 与 顾婷 加入 共产党 。,俞梅 牺牲 第二天  人物一 单枪匹马 闯进 南京城  搏命 方式 杀 松下 健  报 杀 妻之仇  人物二 加入 共产党,1
TRAIN_SENT_ID_276530,陈青云,陈青莲,陈青云 剧情简介 : 乾隆皇帝 微服 出巡 路过 十 全县 ， 在 荷花 塘 邂逅 陈青莲 ， 生下 一子 陈文杰 。,人物一 剧情简介  乾隆皇帝 微服 出巡 路过 十 全县  荷花 塘 邂逅 人物二  生下 一子 陈文杰,1
TRAIN_SENT_ID_261329,罗松,罗成,1 人物 简介 : 隋唐 时期 罗艺 之孙 （ 祖母 姜桂芝 ） ， 罗松 之子 ， 罗成 的 侄子 。,人物 简介  隋唐 时期 罗艺 之孙  祖母 姜桂芝   人物一 之子  人物二 侄子,1
TRAIN_SENT_ID_263016,龙俊杰,王学明,王学明 、 龙俊杰 、 范益松 、 周艳霞,人物二  人物一  范益松  周艳霞,-1
TRAIN_SENT_ID_251876,曹薰铉,李昌镐,第三轮 ： 李昌镐 1 : 0 刘小光 赵治勋 1 : 0 聂卫平 马晓春 1 : 0 小林觉 曹薰铉 1 : 0 片冈聪,第三轮  人物二    刘小光 赵治勋    聂卫平 马晓春    小林觉 人物一    片冈聪,-1
TRAIN_SENT_ID_269009,李如柏,李如松,李如松 、 李如柏 、 李如桢 、 李如樟 、 李如梅 都 是 总兵 官 ， 李如梓 、 李如 梧 、 李如桂 、 李如 楠亦官 至 参将 。,人物二  人物一  李如桢  李如樟  李如梅 总兵 官  李如梓  李如 梧  李如桂  李如 楠亦官 参将,1
TRAIN_SENT_ID_260709,王重阳,全真七子,一 、 王重阳 与 全真七子 修道 传教 活动 大事记 / 318,人物一 人物二 修道 传教 活动 大事记,-1
TRAIN_SENT_ID_261661,程英,陆无双,神 ： 小龙女 ， 程英 ， 陆无双 ， 李莫愁 ， 刘瑛 ， 公孙绿萼,神  小龙女  人物一  人物二  李莫愁  刘瑛  公孙绿萼,1
TRAIN_SENT_ID_252374,颜回,孔子,四 颜回 传承 孔子 心法,四 人物一 传承 人物二 心法,-1
TRAIN_SENT_ID_284833,金正中,马小玲,代表 传人 为 ： 马灵儿 、 马丹娜 、 马小玲 （ 由 万绮雯 饰演 ） 、 马叮当 、 金正中 。,代表 传人  马灵儿  马丹娜  人物二  万绮雯 饰演   马叮当  人物一,-1
TRAIN_SENT_ID_282977,张洪顺,侯耀华,张洪顺 基本 资料 : 姓名 ： 张洪 与 师傅 侯耀华 合影 顺,人物一 基本 资料  姓名  张洪 师傅 人物二 合影,-1
TRAIN_SENT_ID_270803,伍天锡,伍云召,第十九回 太行山 伍天锡 鏖兵 关王庙 伍云召 寄子 第二十回 韩擒虎 收兵 复旨 程咬金 逢 赦 回家,第十九回 太行山 人物一 鏖兵 关王庙 人物二 寄子 第二十回 韩擒虎 收兵 复旨 程咬金 逢 赦 回家,1
TRAIN_SENT_ID_251910,曹薰铉,李昌镐,副帅 之战 ， 常昊 力挫 韩国 围棋 皇帝 曹薰铉 ， 直奔 韩国 的 农心杯 定海神针 李昌镐 阵前 。,副帅 之战  常昊 力挫 韩国 围棋 皇帝 人物一  直奔 韩国 农心杯 定海神针 人物二 阵前,-1
TRAIN_SENT_ID_266063,张学思,张学良,不久 东北局 决定 将 “ 东北 公学 ” 改名 为 “ 东北大学 ” ， 任命 张学良 将军 的 胞弟 、 东北 行政 委员会 副 主席 张学思 兼任 校长 ， 校址 设 于 本溪 。,不久 东北局 决定  东北 公学  改名  东北大学   任命 人物二 将军 胞弟  东北 行政 委员会 副 主席 人物一 兼任 校长  校址 设 本溪,1
TRAIN_SENT_ID_252784,颜回,孔子,孔子 又 叫 去 了 颜回 ， 也 问 了 同样 的 问题 。,人物二 人物一  问 同样 问题,-1
TRAIN_SENT_ID_270988,严舆,严白虎,惊觉 兵临城下 的 严白虎 急忙 再次 派出 严舆 欲 与 孙策 求合 ， 意欲 对分 江东 ， 却 遭 孙家 反对 遭 斩 。,惊觉 兵临城下 人物二 急忙 再次 派出 人物一 欲 孙策 求合  意欲 对分 江东  遭 孙家 反对 遭 斩,1
TRAIN_SENT_ID_255190,赵海燕,赵本山,赵本山 赵海燕 田娃 喜剧 短片 : 《 出奇制胜 》,人物二 人物一 田娃 喜剧 短片   出奇制胜,-1
TRAIN_SENT_ID_273632,马阔海,马青山,铠甲 召唤 人 ： 柯胜 ， 小 李子 ， 马青山 ， 马阔海,铠甲 召唤  柯胜  李子  人物二  人物一,1
TRAIN_SENT_ID_269521,龚因心,龚如心,至于 龚如心 的 幼妹 龚因心 ， 亦 获 龚如心 安排 到 大学 阁 居住 。,人物二 幼妹 人物一  获 人物二 安排 大学 阁 居住,1
TRAIN_SENT_ID_252782,颜回,孔子,— — 孔子 与 颜回,人物二 人物一,-1
TRAIN_SENT_ID_268915,司徒静,司徒剑南,二人 都 吃惊 ， 司徒静 谎称 是 司徒府 二 公子 ， 并 说明 文韬 强横 真相 ， 朱允 承诺 帮助 司徒剑南 。,二人 吃惊  人物一 谎称 司徒府 二 公子  说明 文韬 强横 真相  朱允 承诺 帮助 人物二,1
TRAIN_SENT_ID_249539,李蔡,李广,李贤 ： “ 汉兴 ， 义渠 公孙贺 、 傅介子 ， 成纪 李广 、 李蔡 ， 上 邽 赵充国 ， 狄道 辛武贤 ， 皆 名将 也 。 ”,李贤   汉兴  义渠 公孙贺  傅介子  成纪 人物二  人物一  邽 赵充国  狄道 辛武贤  皆 名将,1
TRAIN_SENT_ID_260699,王重阳,全真七子,全真七子 随 王重阳 一起 创立 道教 全真 派 。,人物二 人物一 一起 创立 道教 全真 派,-1
TRAIN_SENT_ID_259790,李偲菘,李伟菘,李伟菘 、 李偲菘 两个 被 华语 乐坛 冠为 传奇 的 名字 。,人物二  人物一 两个 华语 乐坛 冠为 传奇 名字,1
TRAIN_SENT_ID_260589,金敬姬,金正日,不过 ， 金敬姬 也 有 可能 在 暗地里 设计 自己 成为 金正日 接班人 的 计划 。 ”,人物一 可能 暗地里 设计 成为 人物二 接班人 计划,1
TRAIN_SENT_ID_251532,陈辅,陈靖仇,帮助 陈靖仇 营救 陈辅 并 封印 饕餮 ， 引导 于 小雪 自身 女娲 石 力量 逐渐 觉醒 ， 再度 步入 红尘 挽救 神州 天劫 。,帮助 人物二 营救 人物一 封印 饕餮  引导 小雪 女娲 石 力量 逐渐 觉醒  再度 步入 红尘 挽救 神州 天劫,-1
TRAIN_SENT_ID_278784,万寿公主,广德公主,（ 唐宣宗 长女 ） : 万寿公主 ， 唐宣宗 长女 ， 母 元昭皇后 晁氏 ， 同 母弟 唐懿宗 ， 母妹 广德公主 。,唐宣宗 长女   人物一  唐宣宗 长女  母 元昭皇后 晁氏  母弟 唐懿宗  母妹 人物二,1
TRAIN_SENT_ID_268897,司徒静,司徒剑南,司徒剑南 第十八 集 : 静修 要 杀 朱允 ， 不想 朱允 已 被 司徒静 带走 逃跑 。,人物二 第十八 集  静修 杀 朱允  不想 朱允 人物一 带走 逃跑,1
TRAIN_SENT_ID_282738,周信,吕岳,第二场 ： 三头六臂 的 吕岳 （ HP5000 ， 无 属性 ） + 周信 （ HP2000 ， 风 属性 ） + 杨文辉 （ HP1500 ， 水 属性 ） 。,第二场  三头六臂 人物二    属性   人物一    风 属性   杨文辉    水 属性,-1
TRAIN_SENT_ID_252692,颜回,孔子,颜回 为 人 谦逊 好学 ， “ 不 迁怒 ， 不 贰 过 ” ， 他 异常 尊重 老师 ， 对 孔子 无事 不 从 无言 不悦 。,人物一 谦逊 好学   迁怒  贰   异常 尊重 老师  人物二 无事 无言 不悦,-1
TRAIN_SENT_ID_263371,武修文,武敦儒,在 郭靖 看来 ， 襄阳 的 未来 就 落 在 武敦儒 、 武修文 肩膀 上 。,郭靖 看来  襄阳 未来 落 人物二  人物一 肩膀,1
TRAIN_SENT_ID_277660,关彝,关统,关彝 ， 关兴 之子 ， 关统 死后 承袭 其位 。,人物一  关兴 之子  人物二 死后 承袭 其位,1
TRAIN_SENT_ID_249252,皮皮鲁,鲁西西,皮皮鲁 和 鲁西西 有 许多 好玩 的 经历 ， 都 收集 在 30 卷 《 郑渊洁 童话 全集 》 里 ， 你 以后 会 陆续 知道 。,人物一 人物二 好玩 经历  收集  卷  郑渊洁 童话 全集  里  以后 会 陆续 知道,1
TRAIN_SENT_ID_258157,刘星,夏雪,心虚 的 刘星 和 夏雪 利诱 小雨 当 了 替罪羊 。,心虚 人物一 人物二 利诱 小雨 替罪羊,1
TRAIN_SENT_ID_278071,马枪月,谷本夏,马枪月 角色 介绍 : 有 长期 流浪 的 僻 好 ， 收 了 谷本夏 为徒 。,人物一 角色 介绍  长期 流浪 僻  收 人物二 为徒,-1
TRAIN_SENT_ID_285201,萧琛,萧玦,可是 于 萧琛 的 事 上 ， 难免 做 的 有些 偏颇 ， 是 她 用 了 那样 巧妙 又 决绝 的 方式 永远 的 隔开 了 他 和 萧玦 的 ， 唯一 的 ， 仅存 的 ， 兄弟 情谊 。,人物一 事  难免 做 偏颇  巧妙 决绝 方式 永远 隔开 人物二  唯一  仅存  兄弟 情谊,1
TRAIN_SENT_ID_267440,唐继虞,唐继尧,滇军 头目 唐继尧 乘 贵州 五 旅之乱 ， 派 唐继虞 统兵入 黔 ， 外假 护送 刘前 督回 黔 之名 ， 内行 侵占 贵州 地盘 之实 。,滇军 头目 人物二 贵州 五 旅之乱  派 人物一 统兵入 黔  外假 护送 刘前 督回 黔 之名  内行 侵占 贵州 地盘 之实,1
TRAIN_SENT_ID_251863,曹薰铉,李昌镐,韩国队 李昌镐 领衔 ， 曹薰铉 、 刘昌赫 、 睦镇硕 、 崔圭丙 、 洪钟贤 、 郑寿铉 参赛 。,韩国队 人物二 领衔  人物一  刘昌赫  睦镇硕  崔圭丙  洪钟贤  郑寿铉 参赛,-1
TRAIN_SENT_ID_279516,汪绿萍,汪紫菱,该剧 讲述 了 汪家 两姐妹 汪绿萍 和 汪紫菱 以及 她们 与 楚濂 和 费云帆 两个 男人 之间 爱情 纠葛 的 故事 ， 并于 1996 年 3 月 25 日 播出 。,该剧 讲述 汪家 两姐妹 人物一 人物二 楚濂 费云帆 两个 男人 之间 爱情 纠葛 故事  并于  年  月  日 播出,1
TRAIN_SENT_ID_273638,姜子牙,元始天尊,原存于 玉虚宫 元始天尊 处 ， 后来 借给 姜子牙 点将 封神 。,原存于 玉虚宫 人物二 处  后来 借给 人物一 点将 封神,-1
TRAIN_SENT_ID_257796,林平之,岳不群,由于 余沧海 的 一掌 有毒 ， 岳不群 要 带 岳灵珊 前去 解毒 ， 吩咐 林平之 同 令狐冲 先 去 华山派 。,余沧海 一掌 有毒  人物二 带 岳灵珊 前去 解毒  吩咐 人物一 令狐冲 先 华山派,-1
TRAIN_SENT_ID_252649,颜回,孔子,文章盖世 ， 孔子 尚 困于 陈邦 ； 武略 超群 ， 太公 垂钓 于 渭水 ； 盗 跖 年长 不是 善良 之 辈 ， 颜回 命短 实非 凶恶 之徒 。,文章盖世  人物二 尚 困于 陈邦  武略 超群  太公 垂钓 渭水  盗 跖 年长 善良 辈  人物一 命短 实非 凶恶 之徒,-1
TRAIN_SENT_ID_252698,颜回,孔子,孔子 和 颜回 得知 ， 相视而笑 。,人物二 人物一 得知  相视而笑,-1
TRAIN_SENT_ID_249116,皮皮鲁,鲁西西,皮皮鲁 、 鲁西西 、 罗克 、 舒克和贝塔 已 在 国家工商局 注册 ， 成为 受 法律 保护 的 注册商标 。,人物一  人物二  罗克  舒克和贝塔 国家工商局 注册  成为 受 法律 保护 注册商标,1
TRAIN_SENT_ID_267450,唐继虞,唐继尧,唐继尧 的 堂弟 唐继虞 曾遣 密使 与 陈钧 联系 ， 要 他 站 在 唐派 一边 ， 反对 四 镇守使 。,人物二 堂弟 人物一 曾遣 密使 陈钧 联系  站 唐派 一边  反对 四 镇守使,1
TRAIN_SENT_ID_259744,李偲菘,李伟菘,祁哲泉 作曲 人 : 李伟菘 李偲菘 纪利 男 随安 苏恒 RickyHo,祁哲泉 作曲  人物二 人物一 纪利 男 随安 苏恒,1
TRAIN_SENT_ID_254294,张顺,张横,张横 立功 心切 ， 不顾 张顺 劝阻 ， 率 二三百 人去 劫 关胜 营寨 ， 结果 被 关胜 生擒 。,人物二 立功 心切  不顾 人物一 劝阻  率 二三百 人去 劫 关胜 营寨  关胜 生擒,1
TRAIN_SENT_ID_272399,任容萱,任家萱,家庭成员 ： 妻子 ； 女儿 任家萱 （ Selina ） 、 任容萱 （ Kirsten ）,家庭成员  妻子  女儿 人物二     人物一,1
TRAIN_SENT_ID_270563,全真七子,王重阳,一 、 王重阳 与 全真七子 修道 传教 活动 大事记 / 318,人物二 人物一 修道 传教 活动 大事记,-1
TRAIN_SENT_ID_274179,牧野枣,牧野遥,对 四位 女儿 牧野遥 、 牧野枣 、 牧野晶 、 牧野冬 出手 。,四位 女儿 人物二  人物一  牧野晶  牧野冬 出手,1
TRAIN_SENT_ID_251545,楚碧痕,楚寒镜,迷宫 搜索 关键词 ： 三寒器 、 炎帝 神农 、 梭罗树 、 梭罗 果 、 楚碧痕 、 楚寒镜 、 月 幽之境 、 熔岩 兽王 、 炙炎石,迷宫 搜索 关键词  三寒器  炎帝 神农  梭罗树  梭罗 果  人物一  人物二  月 幽之境  熔岩 兽王  炙炎石,1
TRAIN_SENT_ID_259625,季布,季心,本传除 记述 季布 、 栾布 二人 的 生平事迹 外 ， 还 记载 了 季心 和 丁公 的 事迹 。,本传除 记述 人物一  栾布 二人 生平事迹 外  记载 人物二 丁公 事迹,1
TRAIN_SENT_ID_271296,吕祖俭,吕祖谦,吕蒙正 的 后辈 多有 名人 ， 如 侄子 吕夷简 ， 侄孙 吕公著 ， 官至 宰相 ， 八 世孙 吕祖谦 、 吕祖俭 都 是 南宋 著名 大儒 。,吕蒙正 后辈 多有 名人  侄子 吕夷简  侄孙 吕公著  官至 宰相  八 世孙 人物二  人物一 南宋 著名 大儒,1
TRAIN_SENT_ID_259683,游颖,游娴,游娴 发现 游颖 对 继乐 甚有 好感 ， 因 自卑心 作遂 而 决定 对 继乐 的 爱意 更加 收藏 。,人物二 发现 人物一 继乐 甚有 好感  自卑心 作遂 决定 继乐 爱意 更加 收藏,1
TRAIN_SENT_ID_253897,赵合德,赵飞燕,赵昭仪 （ 赵合德 ） ， 原 与其 姐 赵飞燕 同封 婕妤 ， 后晋 为昭仪 。,赵昭仪  人物一   原 姐 人物二 同封 婕妤  后晋 为昭仪,1
TRAIN_SENT_ID_252536,颜回,孔子,孔子 在 人前 多次 称赞 颜回 :,人物二 人前 多次 称赞 人物一,-1
TRAIN_SENT_ID_269575,水笙,汪啸风,第 12 集 水笙 带 狄云回 大理 ， 因 汪啸风 练 邪功 走火入魔 ， 需 金鲤 疗伤 ， 但 金鲤 已 被 狄云 吞食 ， 狄云 愿意 放血 医治 啸风 。,集 人物一 带 狄云回 大理  人物二 练 邪功 走火入魔  需 金鲤 疗伤  金鲤 狄云 吞食  狄云 愿意 放血 医治 啸风,1
TRAIN_SENT_ID_266703,龙幽,龙溟,随后 ， 调整 了 心态 的 龙幽 告别 龙溟 ， 并 表示 “ 路 还 很长 呢 ， 怎么 能 在 这里 就 停下 ” 。,调整 心态 人物一 告别 人物二  表示  路 很长  停下,1
TRAIN_SENT_ID_271268,马季,侯宝林,（ 九 ） 1 、 捉放 曹 侯宝林 郭全宝 2 、 三字经 马三立 赵佩 如 3 、 哭 笑论 马季 于世猷,九    捉放 曹 人物二 郭全宝   三字经 马三立 赵佩   哭 笑论 人物一 于世猷,-1
TRAIN_SENT_ID_266699,龙幽,龙溟,龙溟 形象设计 : 面貌 与 龙幽 相似 ， 但 明显 更加 刚毅 成熟 。,人物二 形象设计  面貌 人物一 相似  明显 更加 刚毅 成熟,1
TRAIN_SENT_ID_249006,吕洞宾,韩湘子,两侧 分别 为汉 钟离 、 张果老 、 韩湘子 、 铁拐李 、 吕洞宾 、 曹国舅 、 蓝采和 、 何仙姑 的 “ 八仙 ” 泥塑 彩像 。,两侧 为汉 钟离  张果老  人物二  铁拐李  人物一  曹国舅  蓝采和  何仙姑  八仙  泥塑 彩像,-1
TRAIN_SENT_ID_274089,南宫敬叔,孔子,孟懿子 和 南宫敬叔 学礼于 孔子 。,孟懿子 人物一 学礼于 人物二,-1
TRAIN_SENT_ID_264600,凌波,凌音,铁笔 是 罡 斩 的 徒弟 ， 便 也 是 草谷 的 师侄 ； 后 凌波 、 罡 斩 长老 亡故 ， 铁笔 和 凌音 因锁 妖塔 等 原因 成为 蜀山 七圣 ， 辈分 上 变为 草谷 的 师弟妹 。,铁笔 罡 斩 徒弟  便 草谷 师侄  人物一  罡 斩 长老 亡故  铁笔 人物二 因锁 妖塔 原因 成为 蜀山 七圣  辈分 变为 草谷 师弟妹,1
TRAIN_SENT_ID_254250,张顺,张横,揭阳 镇 的 李俊 、 李立 、 穆弘 、 穆春 、 张横 、 张顺 、 童威 、 童猛 ， 薛永 、 侯健 。,揭阳 镇 李俊  李立  穆弘  穆春  人物二  人物一  童威  童猛  薛永  侯健,1
TRAIN_SENT_ID_266216,蓝提斯,谢加图,魔法 骑士 雷 阿斯 （ 谢加图 、 蓝提斯 ）,魔法 骑士 雷 阿斯  人物二  人物一,1
TRAIN_SENT_ID_251815,梅超风,黄药师,除了 杨龙 ， 黄药师 与 梅超风 也 要 师徒 虐恋,杨龙  人物二 人物一 师徒 虐恋,-1
TRAIN_SENT_ID_249240,皮皮鲁,鲁西西,皮皮鲁 、 鲁西西 、 大灰狼 罗克 、 舒克和贝塔 是 他 笔下 文学 形象 。,人物一  人物二  大灰狼 罗克  舒克和贝塔 笔下 文学 形象,1
TRAIN_SENT_ID_264564,胡青牛,张无忌,张无忌 为 他 的 医学 师父 胡青牛 报 了 仇 ， 真是 报应 。,人物二 医学 师父 人物一 报 仇  真是 报应,-1
TRAIN_SENT_ID_251600,穆春,穆弘,身为 囚徒 的 宋江 路过 这里 ， 不 懂 这 里面 的 猫腻 ， 送 了 五两 银子 ， 却 惹 了 大祸 ， 被 穆弘 穆春 逼 得 差点 送 了 性命 。,身为 囚徒 宋江 路过  懂 里面 猫腻  送 五两 银子  惹 大祸  人物二 人物一 逼 差点 送 性命,1
TRAIN_SENT_ID_250606,鲁西西,皮皮鲁,皮皮鲁 、 鲁西西 、 大灰狼 罗克 、 舒克和贝塔 是 他 笔下 的 人物 。,人物二  人物一  大灰狼 罗克  舒克和贝塔 笔下 人物,1
TRAIN_SENT_ID_251412,李瀚章,李鸿章,李瀚章 为 李鸿章 之 胞兄 ， 与 孙宝 喧皆系 至亲 。,人物一 人物二 胞兄  孙宝 喧皆系 至亲,1
TRAIN_SENT_ID_275535,王小虎,赵本山,[ 赵本山 、 蔡维利 、 王小虎 上场 ，,人物二  蔡维利  人物一 上场,-1
TRAIN_SENT_ID_271531,孟优,孟获,761 兀突 骨 762 孟香 763 孟优 764 孟获 765 祝融 夫人,兀突 骨  孟香  人物一  人物二  祝融 夫人,1
TRAIN_SENT_ID_277285,黄文烨,黄文炳,黄文炳 贴着 城住 ， 黄文烨 近 着 大街 。,人物二 贴着 城住  人物一 近 大街,1
TRAIN_SENT_ID_253899,赵合德,赵飞燕,（ 西汉 美女 赵飞燕 、 赵合德 的 合称 ） : 二赵 ， 典故 名 ， 典出 《 汉书 》 卷 九十七 下 〈 外戚 列传 下 · 孝成 赵 皇后 〉 。,西汉 美女 人物二  人物一 合称   二赵  典故 名  典出  汉书  卷 九十七  外戚 列传  孝成 赵 皇后,1
TRAIN_SENT_ID_268981,韩非,荀子,韩非 是 韩国 贵族 ， 他 曾 和 李斯 同学 于 荀子 门下 。,人物一 韩国 贵族  李斯 同学 人物二 门下,-1
TRAIN_SENT_ID_257049,洪敬尧,洪荣宏,101218Mr . J 频道 第 7 期 （ 嘉宾 ： 杨瑞代 、 洪荣宏 、 洪敬尧 、 洪荣 良 ）,频道  期  嘉宾  杨瑞代  人物二  人物一  洪荣 良,1
TRAIN_SENT_ID_273653,姜子牙,元始天尊,姜子牙 法力 不 敌 大鹏 ， 元始天尊 以 三光 神 水 护住 西岐 ， 羽翼 仙 用尽 一夜 力气 ， 未能 成功 ， 再度 败走 。,人物一 法力 敌 大鹏  人物二 三光 神 水 护住 西岐  羽翼 仙 用尽 一夜 力气  未能 成功  再度 败走,-1
TRAIN_SENT_ID_275804,石无痕,石无介,在 苏幻儿 惊世骇俗 的 撮合 戏点 下 ， 梁玉石 与 石无痕 渐生 情愫 ， 而 色艺双绝 的 青楼女子 秦雨 秋 也 与 石无介 定情 一生,苏幻儿 惊世骇俗 撮合 戏点  梁玉石 人物一 渐生 情愫  色艺双绝 青楼女子 秦雨 秋 人物二 定情 一生,1
TRAIN_SENT_ID_267443,唐继虞,唐继尧,唐继尧 急调 胡若愚 部入 桂 增援 ， 同时 令 唐继虞 自湘 粤 边境 南下 攻 柳州 ， 以 缓解 南宁 滇军 压力 。,人物二 急调 胡若愚 部入 桂 增援  令 人物一 自湘 粤 边境 南下 攻 柳州  缓解 南宁 滇军 压力,1
TRAIN_SENT_ID_261088,张豪龙,张柏文,跟 张仁勇 再 婚后 ， 育有 张柏芝 和 两个 弟弟 ： 张豪龙 与 张柏文 ， 之后 与 张仁勇 离婚 。,张仁勇 婚后  育有 张柏芝 两个 弟弟  人物一 人物二  之后 张仁勇 离婚,1
TRAIN_SENT_ID_252837,颜回,孔子,附骥 蝇 释义 : 司马贞 索隐 ： “ 按 ： 苍蝇附骥 尾而致 千里 ， 以 譬 颜回 因 孔子 而 名彰 也 。 ”,附骥 蝇 释义  司马贞 索隐    苍蝇附骥 尾而致 千里  譬 人物一 人物二 名彰,-1
TRAIN_SENT_ID_255474,罗成,秦琼,罗成 那种 事事 争强好胜 的 性格 的确 与 秦琼 大相径庭 。,人物一 那种 事事 争强好胜 性格 人物二 大相径庭,1
TRAIN_SENT_ID_267151,靳月光,靳月华,靳月华 和 姐姐 靳月光 ， 都 有 沉鱼落雁 的 美貌 ， 史 称为 她俩 “ 皆 国色 也 ” 。,人物二 姐姐 人物一  沉鱼落雁 美貌  史 称为 她俩  皆 国色,1
TRAIN_SENT_ID_272004,文姜,宣姜,齐僖公 生 了 两个 貌美如花 、 风华绝代 的 女儿 ， 长女 宣姜 ， 次女 文姜 。,齐僖公 生 两个 貌美如花  风华绝代 女儿  长女 人物二  次女 人物一,1
TRAIN_SENT_ID_253832,赵合德,赵飞燕,又 据 《 汉书 》 记载 ， 是 汉成帝 皇后 赵飞燕 之妹 美女 赵合德 所创 的 一种 眉型 ， 眉如 远山 含翠 ， 因 其 秀美 ， 世人 争相 效仿 。,汉书  记载  汉成帝 皇后 人物二 之妹 美女 人物一 所创 一种 眉型  眉如 远山 含翠  秀美  世人 争相 效仿,1
TRAIN_SENT_ID_263548,林逸,杨明,王笑 嫣 林逸 的 师娘 之一 ， 杨 七七 的 母亲 ， 杨明 的 妻子 之一 。,王笑 嫣 人物一 师娘  杨 七七 母亲  人物二 妻子,-1
