sent_id,entity1,entity2,sent,processed_sent,label
TRAIN_SENT_ID_252475,颜回,孔子,为 我 增加 了 荣誉 ， 提高 了 社会 地位 ， 都 是 由于 您 的 奖掖 扶助 ， 就 像 孔子 自称 不如 颜回 、 李生 赞叹 贾复 一样 。,增加 荣誉  提高 社会 地位  奖掖 扶助  人物二 自称 人物一  李生 赞叹 贾复,-1
TRAIN_SENT_ID_264584,凌波,凌音,《 仙剑 奇侠传 五前 传 》 凌波 、 凌音 、 炎舞,仙剑 奇侠传 五前 传  人物一  人物二  炎舞,1
TRAIN_SENT_ID_261681,程英,陆无双,洪凌波 得到 了 李莫愁 的 真传 ， 武艺 不 弱 ， 在 程英 陆无双 姊妹 之上 。,洪凌波 得到 李莫愁 真传  武艺 弱  人物一 人物二 姊妹 之上,1
TRAIN_SENT_ID_266137,李昌镐,曹薰铉,第三轮 ： 李昌镐 1 : 0 刘昌赫 曹薰铉 1 : 0 马晓春 赵治勋 1 : 0 金秀壮 聂卫平 1 : 0 林海峰,第三轮  人物一    刘昌赫 人物二    马晓春 赵治勋    金秀壮 聂卫平    林海峰,-1
TRAIN_SENT_ID_250627,鲁西西,皮皮鲁,喜欢 书籍 ： 皮皮鲁 · 鲁西西,喜欢 书籍  人物二  人物一,1
TRAIN_SENT_ID_266045,张学思,张学良,至此 ， 周恩来 和 张学铭 、 张学思 的 信 ， 才 辗转 送到 张学良 的 手里 。,至此  周恩来 张学铭  人物一 信  辗转 送到 人物二 手里,1
TRAIN_SENT_ID_262226,尤二姐,尤三姐,红楼 二 尤 人物 评析 : 与 尤二姐 的 懦弱 、 屈辱 、 糊涂 、 和善 相对 比 的 是 尤三姐 ， 她 是 刚烈 、 自尊 、 清醒 、 泼辣 的 。,红楼 二 尤 人物 评析  人物一 懦弱  屈辱  糊涂  和善 相对 人物二  刚烈  自尊  清醒  泼辣,1
TRAIN_SENT_ID_273683,姜子牙,元始天尊,《 封神榜 》 亦 载 ： 姜子牙 奉 元始天尊 之命 封之为 “ 上 清正 一 龙虎 玄坛 真君 ” 。,封神榜  载  人物一 奉 人物二 之命 封之为  清正 龙虎 玄坛 真君,-1
TRAIN_SENT_ID_253127,颜回,孔子,孔子 问 颜回 如何 理解 。,人物二 问 人物一 理解,-1
TRAIN_SENT_ID_255193,赵海燕,赵本山,20 . 小品 《 相亲 2 》 演员 ： 赵本山 、 宋小宝 、 赵海燕 、 李琳,小品  相亲   演员  人物二  宋小宝  人物一  李琳,-1
TRAIN_SENT_ID_263361,武修文,武敦儒,师兄 ： 武修文 、 武敦儒,师兄  人物一  人物二,1
TRAIN_SENT_ID_262188,陈靖仇,陈辅,然后 主角 随 陈靖仇 一同 前往 伏魔山 救出 了 陈辅 后 除掉 凶兽 饕餮 ， 得到 了 第二把 兵器 。,主角 人物一 一同 前往 伏魔山 救出 人物二 除掉 凶兽 饕餮  得到 第二把 兵器,-1
TRAIN_SENT_ID_257050,洪敬尧,洪荣宏,「 洪氏 三 兄弟 」 在 台湾 歌坛 都 是 名人 ， 洪荣宏 、 洪敬尧 、 洪荣 良都 承袭 了 父亲 洪一峰 的 音乐 细胞 。,洪氏 三 兄弟  台湾 歌坛 名人  人物二  人物一  洪荣 良都 承袭 父亲 洪一峰 音乐 细胞,1
TRAIN_SENT_ID_264384,曾国潢,曾国藩,曾国藩 咸丰 十年 五月 十四日 写给 四弟 曾国潢 的 家书,人物二 咸丰 十年 五月 十四日 写给 四弟 人物一 家书,1
TRAIN_SENT_ID_270040,楚寒镜,楚碧痕,楚寒镜 见 楚碧痕 的 决心 ， 于是 告诉 众人 线索 。,人物一 见 人物二 决心  告诉 众人 线索,1
TRAIN_SENT_ID_261160,王缙,王维,王缙 遗作 不 多 ， 散文 只有 表 、 碑 、 册等体 ， 意义 不 大 ， 诗作 与 王维 的 风格 相似 ， 具有 一种 平淡 清新 之美 。,人物一 遗作  散文 表  碑  册等体  意义  诗作 人物二 风格 相似  具有 一种 平淡 清新 之美,1
TRAIN_SENT_ID_261444,毛泽建,毛泽东,毛泽建 是 毛泽东 的 堂妹 ， 1905 年 10 月 出 生于 湖南 湘潭县 韶山冲 的 东茅塘 。,人物一 人物二 堂妹   年  月 出 生于 湖南 湘潭县 韶山冲 东茅塘,1
TRAIN_SENT_ID_275989,朱竹云,朱竹清,2 人物 关系 : 星罗 帝国 皇子 未婚妻 是 朱竹云 （ 朱竹清 的 姐姐 ）,人物 关系  星罗 帝国 皇子 未婚妻 人物一  人物二 姐姐,1
TRAIN_SENT_ID_254300,张顺,张横,《 水浒传 》 第五 五 回 ： “ 可着 李俊 、 张横 、 张顺 、 三 阮六人 棹 船 ， 如此 行事 。 ”,水浒传  第五 五 回   可着 李俊  人物二  人物一  三 阮六人 棹 船  行事,1
TRAIN_SENT_ID_252972,颜回,孔子,颜回 与 孔子,人物一 人物二,-1
TRAIN_SENT_ID_257815,林平之,岳不群,及 岳不群 等 至 洛阳 与 林平之 外祖 王元霸 家 ， 令狐冲 因 怀有 笑傲江湖 曲谱 复见疑 于元 霸 父子 ， 以为 曲谱 即 林家 祖传 之 “ 辟邪 剑谱 ” 。,人物二 洛阳 人物一 外祖 王元霸 家  令狐冲 怀有 笑傲江湖 曲谱 复见疑 于元 霸 父子  曲谱 林家 祖传  辟邪 剑谱,-1
TRAIN_SENT_ID_270557,全真七子,王重阳,防御 路线 走 王重阳 ， 全真七子 相应 点灯 。,防御 路线 走 人物二  人物一 相应 点灯,-1
TRAIN_SENT_ID_252989,颜回,孔子,颜回 谓 孔子 独立 人格 、 直行 道业云 ： “ 夫子 之道 至 大 ， 故 天下 莫 能容 。,人物一 谓 人物二 独立 人格  直行 道业云   夫子 之道  天下 莫 能容,-1
TRAIN_SENT_ID_249250,皮皮鲁,鲁西西,皮皮鲁 恋着 鲁西西,人物一 恋着 人物二,1
TRAIN_SENT_ID_266718,龙幽,龙溟,摇光宫 闯过 凌音 的 第一阵 后 ， 龙幽 将 凌波 和 龙溟 的 事情 告诉 了 凌音 ， 并 告诉 凌音 道长 ， 凌波 很 想念 她 。,摇光宫 闯过 凌音 第一阵  人物一 凌波 人物二 事情 告诉 凌音  告诉 凌音 道长  凌波 想念,1
TRAIN_SENT_ID_249278,皮皮鲁,鲁西西,郑渊洁 — — 舒克 与 贝塔 历险记 ， 皮皮鲁 系列 ， 鲁西西 系列 等,郑渊洁   舒克 贝塔 历险记  人物一 系列  人物二 系列,1
TRAIN_SENT_ID_268900,司徒静,司徒剑南,梁君卓 看上 了 文蔷 ， 调戏 文蔷 ， 被 司徒剑南 和 司徒静 很 揍 了 一顿 。,梁君卓 看上 文蔷  调戏 文蔷  人物二 人物一 揍 一顿,1
TRAIN_SENT_ID_259736,李偲菘,李伟菘,作曲 ： 李伟菘 、 李偲菘 演唱 ： 萧 骊珠 绝代 双雄 片尾曲 : 萧 孋 珠 - 独上 西楼,作曲  人物二  人物一 演唱  萧 骊珠 绝代 双雄 片尾曲  萧 孋 珠  独上 西楼,1
TRAIN_SENT_ID_272043,韩慕侠,周恩来,韩慕侠 曾 感慨 地说 ： “ 翔宇 （ 周恩来 ） 年少 志高 ， 深谋远虑 ┄ ┄ 我教 他 怎样 强身 ， 他 却 教 我 怎样 做人 。 ”,人物一 感慨 地说   翔宇  人物二  年少 志高  深谋远虑 ┄ ┄ 我教 强身  教 做人,-1
TRAIN_SENT_ID_269349,王中军,王中磊,— — 摘自 “ 王中军 、 王中磊 ： 穿 上 ‘ 红 舞鞋 ’ 的 娱乐 大亨 ”,摘自  人物一  人物二  穿  红 舞鞋  娱乐 大亨,1
TRAIN_SENT_ID_277808,乌丫,丁铛,然而 ， 丁铛 的 械 力 、 乌丫 的 医道 、 寒信 的 智慧 以及 小镖 的 顽强 — — 坚信 胜利 的 心 与 心 之间 产生 的 羁绊 ， 将会 唤醒 奇迹 ！,人物二 械 力  人物一 医道  寒信 智慧 小镖 顽强   坚信 胜利 心 心 之间 产生 羁绊  将会 唤醒 奇迹,1
TRAIN_SENT_ID_255417,罗成,秦琼,36 专诸巷 罗成 认 舅母 贾柳店 秦琼 待 宾朋,专诸巷 人物一 认 舅母 贾柳店 人物二 宾朋,1
TRAIN_SENT_ID_279264,徐佩瑶,徐天德,徐佩瑶 是 徐天德 的 妹妹 ， 美丽 、 善良 的 女孩 ， 和 朱重八 青梅竹马 ， 彼此 相爱 。,人物一 人物二 妹妹  美丽  善良 女孩  朱重八 青梅竹马  相爱,1
TRAIN_SENT_ID_259763,李偲菘,李伟菘,专辑 的 制作 人 是 李偲菘 、 李伟菘 和 陈伟 等 。,专辑 制作 人物一  人物二 陈伟,1
TRAIN_SENT_ID_271521,孟优,孟获,孟获 又 被 生擒活捉 ， 其弟 孟优 及众 首领 也 做 了 蜀 军 俘虏 。,人物二 生擒活捉  其弟 人物一 及众 首领 做 蜀 军 俘虏,1
TRAIN_SENT_ID_250596,鲁西西,皮皮鲁,南瓜 老大 和 皮皮鲁 成为 了 朋友 ， 他们 一起 踏上 寻找 鲁西西 笑容 的 旅程 。,南瓜 老大 人物二 成为 朋友  一起 踏上 寻找 人物一 笑容 旅程,1
TRAIN_SENT_ID_258144,刘星,夏雪,可是 ， 由于 刘星 越作 越 过分 ， 让 夏雪 终于 忍无可忍 。,人物一 越作 越 过分  人物二 终于 忍无可忍,1
TRAIN_SENT_ID_265408,薛谭,秦青,薜 谭学 讴 原文 : 薛谭 学 讴于 秦青 ， 未穷 青之技 ， 自谓 尽 之 ， 遂 辞 归 。,薜 谭学 讴 原文  人物一 学 讴于 人物二  未穷 青之技  自谓  遂 辞,-1
TRAIN_SENT_ID_272040,韩慕侠,周恩来,周恩来 学习 之 余 ， 常穿 一件 长布 大褂 ， 去 韩慕侠 家里 学拳 练武 。,人物二 学习 余  常穿 一件 长布 大褂  人物一 家里 学拳 练武,-1
TRAIN_SENT_ID_250083,武敦儒,武修文,郭靖 看来 ， 襄阳 的 未来 就 落 在 武敦儒 、 武修文 肩膀 上 。,郭靖 看来  襄阳 未来 落 人物一  人物二 肩膀,1
TRAIN_SENT_ID_251847,梅超风,黄药师,武眠风 出处 : （ 出自 《 射雕 英雄传 》 第 14 回 桃花 岛主 ， 黄药师 吩咐 梅超风 做 3 件 事 的 第 2 项 ） 。,武眠风 出处   出自  射雕 英雄传   回 桃花 岛主  人物二 吩咐 人物一 做  件 事  项,-1
TRAIN_SENT_ID_268887,司徒静,司徒剑南,朱允 知道 司徒静 是 想 搭救 司徒剑南 和 文蔷 而 答应 自己 的 婚约 ， 负气 而 走 。,朱允 知道 人物一 想 搭救 人物二 文蔷 答应 婚约  负气 走,1
TRAIN_SENT_ID_259809,李偲菘,李伟菘,潘协庆 ˙ 李偲菘 ˙ 李伟菘 ˙ 林夕 ˙ 姚若龙,潘协庆 ˙ 人物一 ˙ 人物二 ˙ 林夕 ˙ 姚若龙,1
TRAIN_SENT_ID_259521,梅超风,杨康,黄药师 为了 找寻 女儿 打破 誓言 离开 桃花岛 ， 在 太湖 归云庄 发现 了 黄蓉 、 郭靖 及 为 救 杨康 而来 的 梅超风 。,黄药师 找寻 女儿 打破 誓言 离开 桃花岛  太湖 归云庄 发现 黄蓉  郭靖 救 人物二 而来 人物一,-1
TRAIN_SENT_ID_279131,范长利,朱绍文,朱绍文 — — 春长隆 、 冯昆治 、 范长利 、 桂祯 、 徐长福 、 沈竹善,人物二   春长隆  冯昆治  人物一  桂祯  徐长福  沈竹善,-1
TRAIN_SENT_ID_263370,武修文,武敦儒,靖 、 蓉 为 寻找 黄药师 ， 巧遇 武三通 之子 武敦儒 、 武修文 、 杨康之 子 杨过 。,靖  蓉 寻找 黄药师  巧遇 武三通 之子 人物二  人物一  杨康之 子 杨过,1
TRAIN_SENT_ID_257055,洪敬尧,洪荣宏,紧返 来 我 身边 恋花 07 爱 常常 喜乐 : 江蕙 ． 洪荣宏 ． 洪敬尧 ． 王力宏 ． 周华健 ． 伍思凯,紧返 身边 恋花  爱 常常 喜乐  江蕙 ． 人物二 ． 人物一 ． 王力宏 ． 周华健 ． 伍思凯,1
TRAIN_SENT_ID_268906,司徒静,司徒剑南,朱允 闻听 很 不快 ， 他 亲往 司徒府 看 司徒静 和 司徒剑南 。,朱允 闻听 不快  亲往 司徒府 人物一 人物二,1
TRAIN_SENT_ID_249143,皮皮鲁,鲁西西,皮皮鲁 和 肥皂 订书机 内容梗概 : 就 连 经历 丰富 得 登峰造极 的 鲁西西 这回 也 感到 吃惊 ， 她 用 肥皂 做 的 这架 小 订书机 竟然 可以 随意 装订 历史 。,人物一 肥皂 订书机 内容梗概  经历 丰富 登峰造极 人物二 这回 感到 吃惊  肥皂 做 这架 订书机 竟然 随意 装订 历史,1
TRAIN_SENT_ID_252968,颜回,孔子,颜回 随 孔子 在 陈 、 蔡 期间 绝粮 七天 ， 子贡 费 了 许多 周折 才 买 回 一石米 。,人物一 人物二 陈  蔡 期间 绝粮 七天  子贡 费 周折 买 回 一石米,-1
TRAIN_SENT_ID_251831,梅超风,黄药师,黄药师 终于 爱上 梅超风,人物二 终于 爱上 人物一,-1
TRAIN_SENT_ID_249200,皮皮鲁,鲁西西,一般 童装 以 著名 形象 “ 皮皮鲁 ” 、 “ 鲁西西 ” 作为 商标 ， 高档 童装 则 以 另 两个 著名 形象 “ 舒克 ” 、 “ 贝塔 ” 作为 商标 。,童装 著名 形象  人物一    人物二  商标  高档 童装 两个 著名 形象  舒克    贝塔  商标,1
TRAIN_SENT_ID_273367,杨锐,张之洞,杨锐 遇难 ， 张之洞 十分 痛惜 。,人物一 遇难  人物二 十分 痛惜,-1
TRAIN_SENT_ID_251834,梅超风,黄药师,黄药师 以此 暗器 惩治 偷窃 真经 、 叛离 师门 的 梅超风 。,人物二 以此 暗器 惩治 偷窃 真经  叛离 师门 人物一,-1
TRAIN_SENT_ID_250405,赵飞燕,赵合德,赵飞燕 、 赵合德 ， 那张 被 欲望 撑破 的 脸,人物一  人物二  那张 欲望 撑破 脸,1
TRAIN_SENT_ID_250630,鲁西西,皮皮鲁,第 237 集 伊丽莎白 在 稿件 上 签字 ； 鲁西西 叫醒 皮皮鲁 ； 歌唱家 喊 贝塔 万岁 ； 舒克 骂 贝塔 贝塔 不 生气,集 伊丽莎白 稿件 签字  人物一 叫醒 人物二  歌唱家 喊 贝塔 万岁  舒克 骂 贝塔 贝塔 生气,1
TRAIN_SENT_ID_256549,周武,周文,周武 王封 叔叔 姬仲在 东 虢 ； 周文 王之弟 亦 封 在 虢 ， 周平 王 又 封 姬仲 后裔 在 此 虢 ， 故今 陕地 有北 虢 、 东虢 、 西虢 。,人物一 王封 叔叔 姬仲在 东 虢  人物二 王之弟 封 虢  周平 王 封 姬仲 后裔 虢  故今 陕地 有北 虢  东虢  西虢,1
TRAIN_SENT_ID_250079,武敦儒,武修文,杨过 ： 仅限于 与 对付 李莫愁 时 江湖 五绝 亲友 : 徒孙 ： 傻姑 （ 亲传 ） 武敦儒 、 武修文 、 陆冠英 、 郭 芙 、 郭襄 、 郭破虏 、 东邪 药师 派 门人,杨过  仅限于 对付 李莫愁 时 江湖 五绝 亲友  徒孙  傻姑  亲传  人物一  人物二  陆冠英  郭 芙  郭襄  郭破虏  东邪 药师 派 门人,1
TRAIN_SENT_ID_284839,白浅,白真,瀛洲 取草 ， 借结魄 灯 ， 经 四哥 白真 提 点 ， 白浅 终于 明白 她 早已 爱上 夜华 。,瀛洲 取草  借结魄 灯  四哥 人物二 提 点  人物一 终于 明白 早已 爱上 夜华,1
TRAIN_SENT_ID_259930,周志文,周志康,周志文 和 周志康 ： 香港 艺员,人物一 人物二  香港 艺员,1
TRAIN_SENT_ID_264381,曾国潢,曾国藩,曾国藩 咸丰 八年 七月 二十日 写给 曾国潢 和 曾国葆 的 家书,人物二 咸丰 八年 七月 二十日 写给 人物一 曾国葆 家书,1
TRAIN_SENT_ID_264395,曾国潢,曾国藩,曾国藩 咸丰 十年 十月 二十四日 写给 四弟 曾国潢 的 家书,人物二 咸丰 十年 十月 二十四日 写给 四弟 人物一 家书,1
TRAIN_SENT_ID_255389,罗成,秦琼,于是 ， 秦琼 、 罗成 、 敬德 和 程咬金 翻身 上马 ， 追赶 而 去 。,人物二  人物一  敬德 程咬金 翻身 上马  追赶,1
TRAIN_SENT_ID_269927,沈春阳,赵本山,2013 - 03 - 02 ： 樱桃红 （ 38 集 ） 「 宋小宝 ， 沈春阳 ， 赵本山 ， 杨冰 」,樱桃红   集   宋小宝  人物一  人物二  杨冰,-1
TRAIN_SENT_ID_249235,皮皮鲁,鲁西西,皮皮鲁 、 鲁西西 、 罗克 、 舒克 、 贝塔 是 他 笔下 文学 形象 。,人物一  人物二  罗克  舒克  贝塔 笔下 文学 形象,1
TRAIN_SENT_ID_266142,李昌镐,曹薰铉,曹薰铉 获 冠军 ， 李昌镐 获 亚军,人物二 获 冠军  人物一 获 亚军,-1
TRAIN_SENT_ID_251901,曹薰铉,李昌镐,李昌镐 亚洲杯 冠军 : 1995 年 7 月 14 日 夺得 第七届 亚洲杯 快棋赛 冠军 ， 对手 依次 为 小林觉 、 马晓春 、 曹薰铉 。,人物二 亚洲杯 冠军   年  月  日 夺得 第七届 亚洲杯 快棋赛 冠军  对手 依次 小林觉  马晓春  人物一,-1
TRAIN_SENT_ID_249549,李蔡,李广,"《 史记 · 李将军 列传 》 和 《 汉书 · 李广 传 》 均 称 ： 其 从弟 李蔡 被 "" 封 为 乐安 侯 "" 。",史记  李将军 列传   汉书  人物二 传  均 称  从弟 人物一  封 乐安 侯,1
TRAIN_SENT_ID_266047,张学思,张学良,张学良 最 喜欢 张学思,人物二 喜欢 人物一,1
TRAIN_SENT_ID_254263,张顺,张横,水军 头领 张横 立功 心切 ， 不顾 张顺 劝阻 ， 率 二三百 人去 劫 关胜 营寨 ， 结果 被 关胜 部下 探知 。,水军 头领 人物二 立功 心切  不顾 人物一 劝阻  率 二三百 人去 劫 关胜 营寨  关胜 部下 探知,1
TRAIN_SENT_ID_274311,习乾平,习近平,习乾平 ， 女 ， 是 无产阶级 革命家 、 政治家 、 原 党和国家 领导人 习仲勋 之女 ， 是 党和国家 最高 领导人 习近平 的 同父异母 的 姐姐 。,人物一  女  无产阶级 革命家  政治家  原 党和国家 领导人 习仲勋 之女  党和国家 最高 领导人 人物二 同父异母 姐姐,1
TRAIN_SENT_ID_262237,尤二姐,尤三姐,第六十五回 贾二舍 偷 娶 尤二姐 / 尤三姐 思嫁 柳 二郎,第六十五回 贾二舍 偷 娶 人物一  人物二 思嫁 柳 二郎,1
TRAIN_SENT_ID_252601,颜回,孔子,孔子 · 颜回 · 曾 参 · 孔伋 · 孟子,人物二  人物一  参  孔伋  孟子,-1
TRAIN_SENT_ID_285613,韩笑,韩少云,韩笑 嗓音 甜美 ， 颇具 韩少云 大师 风范 。,人物一 嗓音 甜美  颇具 人物二 大师 风范,-1
TRAIN_SENT_ID_252582,颜回,孔子,颜回 攫 甑 释意 : 孔子 在 陈国和 蔡国 之间 的 地方 （ 缺粮 ） 受困 ， 饭菜 全无 ， 七天 没 吃 上 米饭 了 。,人物一 攫 甑 释意  人物二 陈国和 蔡国 之间 地方  缺粮  受困  饭菜 全无  七天 没 吃 米饭,-1
TRAIN_SENT_ID_251588,穆春,穆弘,小 遮拦 穆春 （ 揭阳 镇 一霸 ， 穆弘 之弟 ）,遮拦 人物一  揭阳 镇 一霸  人物二 之弟,1
TRAIN_SENT_ID_259797,李偲菘,李伟菘,最佳 制作 人 ： 阿弟仔 、 李偲菘 、 李伟菘 （ 蔡依林 《 舞娘 》 ） 蒙牛 酸酸乳 音乐 风云榜 摇滚 部分 : 最佳 摇滚歌手 ： 窦唯 《 雨吁 》,最佳 制作  阿弟仔  人物一  人物二  蔡依林  舞娘   蒙牛 酸酸乳 音乐 风云榜 摇滚 部分  最佳 摇滚歌手  窦唯  雨吁,1
TRAIN_SENT_ID_275458,李汉俊,李书城,李书城 对此 加以 保护 ， 叮嘱 李汉俊 一定 小声 交谈 ， 不要 惊动 邻里 ， 惹起 外人 的 注意 。,人物二 对此 保护  叮嘱 人物一 一定 小声 交谈  不要 惊动 邻里  惹起 外人 注意,1
TRAIN_SENT_ID_274173,牧野枣,牧野遥,女儿 （ 四姐妹 ） ： 牧野遥 、 牧野枣 、 牧野晶 、 牧野冬,女儿  四姐妹   人物二  人物一  牧野晶  牧野冬,1
TRAIN_SENT_ID_256884,仲由,孔子,孔子 对 公冶长 、 南容 的 评论 ， 客观 、 实际 ， 对 仲由 的 赞许 ， 体现 一种 开放 精神 。,人物二 公冶长  南容 评论  客观  实际  人物一 赞许  体现 一种 开放 精神,-1
TRAIN_SENT_ID_250572,鲁西西,皮皮鲁,皮皮鲁 、 鲁西西 、 罗克 、 舒克 、 贝塔 是 他 笔下 文学 形象 。,人物二  人物一  罗克  舒克  贝塔 笔下 文学 形象,1
TRAIN_SENT_ID_266054,张学思,张学良,尤其 是 张学良 胞弟 张学铭 和 虽 不同 母 但 感情 至 深 的 海军 副司令员 张学思 ， 也 都 对 可望而不可即 的 大哥 日思夜想 。,尤其 人物二 胞弟 张学铭 不同 母 感情 深 海军 副司令员 人物一  可望而不可即 大哥 日思夜想,1
TRAIN_SENT_ID_249267,皮皮鲁,鲁西西,皮皮鲁 、 鲁西西 、 罗克 、 舒克和贝塔 是 他 笔下 塑造 的 形象 。,人物一  人物二  罗克  舒克和贝塔 笔下 塑造 形象,1
TRAIN_SENT_ID_282739,周信,吕岳,周信 ， 九龙 岛 声名 山 炼气 士 ， 吕岳 之徒 。,人物一  九龙 岛 声名 山 炼气 士  人物二 之徒,-1
TRAIN_SENT_ID_252514,颜回,孔子,颜回 闻一以 知十 ， 我 只能 闻一知二 ” ， 于是 孔子 感叹 道 ： “ 弗如 也 ， 吾 与 汝弗如 也 ！ ”,人物一 闻一以 知十  只能 闻一知二   人物二 感叹 道   弗如  吾 汝弗如,-1
TRAIN_SENT_ID_269933,沈春阳,赵本山,2013 - 03 - 03 ： 樱桃红 「 赵本山 ， 宋小宝 ， 沈春阳 ， 王天泽 」,樱桃红  人物二  宋小宝  人物一  王天泽,-1
TRAIN_SENT_ID_252814,颜回,孔子,孔子 不 听 ， 让 颜回 驾车 ， 子贡 作 骖 乘 ， 前去 会见 盗 跖 。,人物二 听  人物一 驾车  子贡 作 骖  前去 会见 盗 跖,-1
TRAIN_SENT_ID_273628,马阔海,马青山,召唤 者 ： 马阔海 / 李子 / 马青山,召唤  人物一  李子  人物二,1
TRAIN_SENT_ID_265494,薛蝌,薛蟠,薛蟠 、 薛蝌 一段 石火光阴 ， 悲喜 不了 。,人物二  人物一 一段 石火光阴  悲喜 不了,1
TRAIN_SENT_ID_266218,蓝提斯,谢加图,其 性格 沈默寡言 ， 相比 兄长 谢加图 的 稳重 ， 蓝提斯 显得 与世无争 。,性格 沈默寡言  相比 兄长 人物二 稳重  人物一 显得 与世无争,1
TRAIN_SENT_ID_255437,罗成,秦琼,秦琼 和 罗成 的 相遇 ， 是 亲人 间 大喜大悲 ， 劫后 重逢 的 感动 。,人物二 人物一 相遇  亲人 间 大喜大悲  劫后 重逢 感动,1
TRAIN_SENT_ID_251898,曹薰铉,李昌镐,编著 《 李昌镐 对局 集 》 、 《 曹薰铉 对局 集 》 、 《 李昌镐 的 大局观 》 等 书 。,编著  人物二 对局 集    人物一 对局 集    人物二 大局观  书,-1
TRAIN_SENT_ID_252440,颜回,孔子,颜回 早逝 ， 颜无繇 因 家里 穷 ， 就 请求 孔子 把 车子 卖 了 来 帮 他 安葬 。,人物一 早逝  颜无繇 家里 穷  请求 人物二 车子 卖 帮 安葬,-1
TRAIN_SENT_ID_278007,严贡生,严监生,11 严监生 与 严贡生,人物二 人物一,1
TRAIN_SENT_ID_255481,罗成,秦琼,正是 这种 思路 让 秦琼 和 罗成 站 在 平等 的 地位 上 对话 ， 却 拉开 了 单 与 秦 的 距离 。,这种 思路 人物二 人物一 站 平等 地位 对话  拉开 单 秦 距离,1
TRAIN_SENT_ID_255480,罗成,秦琼,李元霸 、 秦琼 、 宇文化及 、 程咬金 、 单雄信 、 尉迟敬德 、 罗成 、 李靖 、 魏文通 、 梁士泰 ......,李元霸  人物二  宇文化及  程咬金  单雄信  尉迟敬德  人物一  李靖  魏文通  梁士泰,1
TRAIN_SENT_ID_269423,刘伟,马季,30 . 相声 ： 《 老少 乐 》 表演者 ： 马季 刘伟,相声   老少 乐  表演者  人物二 人物一,-1
TRAIN_SENT_ID_252809,颜回,孔子,从此 颜回 结束 了 跟随 孔子 长 达 十四年 的 列国 周游 。,人物一 结束 跟随 人物二 长 达 十四年 列国 周游,-1
TRAIN_SENT_ID_269721,薛洋,薛之荔,晚上 薛之荔 和 薛洋 聊 了 起来 ， 他们 一起 玩起 了 游戏 。,晚上 人物二 人物一 聊 起来  一起 玩起 游戏,1
TRAIN_SENT_ID_256828,孙周,孙淳,电影 《 秋喜 》 孙周 、 孙淳 、 郭晓 冬 、 江一燕 、 秦海璐 首映 见面会,电影  秋喜  人物一  人物二  郭晓 冬  江一燕  秦海璐 首映 见面会,1
TRAIN_SENT_ID_276928,樊迟,孔子,孔子 毫不客气 地 指责 想学种 庄稼 和 种菜 的 樊迟 是 小人 ， 可以 清楚 地 看出 他 的 教育 思想 。,人物二 毫不客气 指责 想学种 庄稼 种菜 人物一 小人  清楚 看出 教育 思想,-1
TRAIN_SENT_ID_269397,刘伟,马季,老少 乐 相声 《 老少 乐 》 : 表演 ： 马季 、 刘伟,老少 乐 相声  老少 乐   表演  人物二  人物一,-1
TRAIN_SENT_ID_266311,贾源,贾演,其中 贾府 就 占 了 2 个 - - 宁国公 贾演 、 荣国公 贾源 。,贾府 占    宁国公 人物二  荣国公 人物一,1
TRAIN_SENT_ID_249554,李蔡,李广,李蔡 ， 李广 堂弟 ， 曾任 汉文帝 的 侍从 ， 后任 汉武帝 的 第七个 丞相 ， 其 人 勇敢 聪明 ， 从军 则 军功 显赫 ， 从政 则 政绩 卓著 ， 获得 世人 的 好评 。,人物一  人物二 堂弟  曾任 汉文帝 侍从  后任 汉武帝 第七个 丞相  勇敢 聪明  从军 军功 显赫  从政 政绩 卓著  获得 世人 好评,1
TRAIN_SENT_ID_268928,韩非,荀子,韩非 与 李斯 为 同学 ， 同 师事 于 荀子 。,人物一 李斯 同学  师事 人物二,-1
TRAIN_SENT_ID_249259,皮皮鲁,鲁西西,《 皮皮鲁 和 鲁西西 新 奇遇记 ： 写给 爸爸妈妈 看 的 童话 》 是 1985 年 浙江 少年儿童出版社 出版 的 图书 ， 作者 是 郑渊洁 。,人物一 人物二 新 奇遇记  写给 爸爸妈妈 童话   年 浙江 少年儿童出版社 出版 图书  作者 郑渊洁,1
TRAIN_SENT_ID_252674,颜回,孔子,作品 赏析 : 这 一章 ， 孔子 对 颜回 学问 道德 接近 于 完善 却 在生活上 常常 贫困 深感 遗憾 。,作品 赏析  一章  人物二 人物一 学问 道德 接近 完善 在生活上 常常 贫困 深感 遗憾,-1
TRAIN_SENT_ID_254295,张顺,张横,宋江 到 江州 后 ， 依靠 张横 的 书信 ， 结识 了 张顺 。,宋江 江州  依靠 人物二 书信  结识 人物一,1
TRAIN_SENT_ID_258133,刘星,夏雪,身份 ： 夏雪 和 夏雨 的 生父 ， 刘星 的 继父 。,身份  人物二 夏雨 生父  人物一 继父,1
TRAIN_SENT_ID_251517,陈辅,陈靖仇,3 轩辕剑 叁 外传 ： 天之痕 : 相关 剧情 : 游戏 主角 陈靖仇 的 师父 陈辅 在 伏 魔 山上 被 饕餮 。,轩辕剑 叁 外传  天之痕  相关 剧情  游戏 主角 人物二 师父 人物一 伏 魔 山上 饕餮,-1
TRAIN_SENT_ID_259752,李偲菘,李伟菘,作词 : 卡斯 作曲 : 李偲菘 李伟菘 编曲 : 戴维雄,作词  卡斯 作曲  人物一 人物二 编曲  戴维雄,1
TRAIN_SENT_ID_279511,殷梨亭,张三丰,张三丰 百岁 生日 那天 ， 纪晓芙 一 露面 ， 殷梨亭 不但 脸红 ， 竟然 连 招呼 都 不敢 上去 打 一声 。,人物二 百岁 生日 那天  纪晓芙 露面  人物一 脸红  竟然 招呼 不敢 上去 一声,-1
TRAIN_SENT_ID_275829,陆无双,李莫愁,神 ： 小龙女 程瑛 陆无双 李莫愁 刘瑛 公孙绿萼,神  小龙女 程瑛 人物一 人物二 刘瑛 公孙绿萼,-1
