sent_id,entity1,entity2,sent,processed_sent,label,hard_match
TRAIN_SENT_ID_273624,马阔海,马青山,召唤 人 ： 柯胜 （ 主要 ） 、 马青山 、 马阔海 、 小 李子,召唤  柯胜  主要   人物二  人物一  李子,1,1
TRAIN_SENT_ID_259528,梅超风,杨康,后 因 捕获 大 金 赵王 完颜洪烈 养子 杨康 而 引康 之师 、 陆氏 师姐 、 梅超风 来 救 。,捕获 金 赵王 完颜洪烈 养子 人物二 引康 之师  陆氏 师姐  人物一 救,-1,0
TRAIN_SENT_ID_268838,骆羽,骆赢,混双 ： 何汉斌 / 包宜鑫 刘成 / 骆赢 李根 / 骆羽,混双  何汉斌  包宜鑫 刘成  人物二 李根  人物一,1,0
TRAIN_SENT_ID_252515,颜回,孔子,孔子 最 欣赏 颜回 的 地方 ， 就是 “ 不 迁怒 ” 与 “ 不 贰 过 ” 。,人物二 欣赏 人物一 地方   迁怒   贰,-1,0
TRAIN_SENT_ID_257234,艾欧里亚,艾俄洛斯,圣域 志 狮子 列传 第八 : 艾欧里亚 ， 希腊人 也 ， 射手 县侯 艾俄洛斯 弟 。,圣域 志 狮子 列传 第八  人物一  希腊人  射手 县侯 人物二 弟,1,-1
TRAIN_SENT_ID_257474,姜昆,马季,主持人 ： 姜昆 、 马季 、 刘晓庆 、 王景愚,主持人  人物一  人物二  刘晓庆  王景愚,-1,0
TRAIN_SENT_ID_264564,胡青牛,张无忌,张无忌 为 他 的 医学 师父 胡青牛 报 了 仇 ， 真是 报应 。,人物二 医学 师父 人物一 报 仇  真是 报应,-1,0
TRAIN_SENT_ID_265492,薛蝌,薛蟠,后 有 薛蟠 之 从弟 薛蝌 ， 因,人物二 从弟 人物一,1,0
TRAIN_SENT_ID_261680,程英,陆无双,黄蓉 一看 便 知 程英 “ 外 和 内刚 ” ， “ 外刚内柔 ” 的 陆无双 ， 有 了 这位 守护 天使 ， 以后 都 不会 受人 欺侮 了 。,黄蓉 一看 便 知 人物一  外 内刚    外刚内柔  人物二  这位 守护 天使  以后 不会 受人 欺侮,1,0
TRAIN_SENT_ID_251514,陈辅,陈靖仇,然后 主角 随 陈靖仇 一同 前往 伏魔山 救出 了 陈辅 后 除掉 凶兽 饕餮 ， 得到 了 第二把 兵器 。,主角 人物二 一同 前往 伏魔山 救出 人物一 除掉 凶兽 饕餮  得到 第二把 兵器,-1,0
TRAIN_SENT_ID_275546,王小虎,赵本山,2 表演者 : 赵本山 、 范伟 、 蔡维利 、 王小虎,表演者  人物二  范伟  蔡维利  人物一,-1,0
TRAIN_SENT_ID_263544,林逸,杨明,杨明 林逸 的 师父 ， 《 很纯 很 暧昧 》 的 主角 。,人物二 人物一 师父   很纯 暧昧  主角,-1,0
TRAIN_SENT_ID_250365,赵飞燕,赵合德,尊 为 太后 : 佟丽娅版 赵飞燕 ( 17 张 ) 被 废 自杀 : 成帝 死 于 赵合德 床上 ， 朝野 震动 ， 群臣 声讨 赵氏 祸水 。,尊 太后  佟丽娅版 人物一   张  废 自杀  成帝 死 人物二 床上  朝野 震动  群臣 声讨 赵氏 祸水,1,0
TRAIN_SENT_ID_274395,贾演,贾源,其中 贾府 就 占 了 2 个 - - 宁国公 贾演 、 荣国公 贾源 。,贾府 占    宁国公 人物一  荣国公 人物二,1,0
TRAIN_SENT_ID_274390,贾演,贾源,▪ 贾演 ▪ 贾源 ▪ 贾代化 ▪ 贾代善 ▪ 贾代儒 ▪ 贾代修 ▪ 贾敷 ▪ 贾敬,▪ 人物一 ▪ 人物二 ▪ 贾代化 ▪ 贾代善 ▪ 贾代儒 ▪ 贾代修 ▪ 贾敷 ▪ 贾敬,1,0
TRAIN_SENT_ID_282543,苗正,黄震,黄震 号召 弟妹们 帮 他 一起 ， 黄家 姊 弟们 决定 通过 斗武来 选出 五人 去 帮助 他 ， 苗正 轻松 地 脱颖而出 。,人物二 号召 弟妹们 帮 一起  黄家 姊 弟们 决定 斗武来 选出 五人 帮助  人物一 轻松 脱颖而出,1,0
TRAIN_SENT_ID_256907,仲由,孔子,孔子 曰 ： “ 仲由 ！,人物二 曰   人物一,-1,0
TRAIN_SENT_ID_266203,李昌镐,曹薰铉,副帅 之战 ， 常昊 力挫 韩国 围棋 皇帝 曹薰铉 ， 直奔 韩国 的 农心杯 定海神针 李昌镐 阵前 。,副帅 之战  常昊 力挫 韩国 围棋 皇帝 人物二  直奔 韩国 农心杯 定海神针 人物一 阵前,-1,0
TRAIN_SENT_ID_265554,张崇基,张崇德,TakeItEasy （ 曲 / 编 ） ‖ 张崇基 / 张崇德 ‖ 【 TakeItEasy 】 ‖ 2009.04,曲  编  ‖ 人物一  人物二 ‖    ‖,1,0
TRAIN_SENT_ID_265416,薛谭,秦青,（ 元人 “ 燕南 芝庵 ” 《 论曲 》 ： “ 古善 唱者 五人 ： 秦青 、 薛谭 、 韩 秦娥 、 沈右 之 、 李存 符 。 ”,元人  燕南 芝庵   论曲    古善 唱者 五人  人物二  人物一  韩 秦娥  沈右  李存 符,-1,0
TRAIN_SENT_ID_271504,孟优,孟获,761 兀突 骨 762 孟香 763 孟优 764 孟获 765 祝融 夫人 766 木鹿 大王 767 朵思 大王 768 沙摩柯 769 金环三结,兀突 骨  孟香  人物一  人物二  祝融 夫人  木鹿 大王  朵思 大王  沙摩柯  金环三结,1,0
TRAIN_SENT_ID_257051,洪敬尧,洪荣宏,08 . 绵绵 旧情 / 林慧萍 ． 洪荣宏 ． 洪敬尧,绵绵 旧情  林慧萍 ． 人物二 ． 人物一,1,0
TRAIN_SENT_ID_261581,南宫敬叔,孟懿子,孟僖子 将 死 ， 嘱 其二 子 孟懿子 与 南宫敬叔 向 孔子 学礼 。,孟僖子 死  嘱 子 人物二 人物一 孔子 学礼,1,0
TRAIN_SENT_ID_266001,王恬,王洽,王恬 王悦 王洽 王协 王劭 王荟,人物一 王悦 人物二 王协 王劭 王荟,1,0
TRAIN_SENT_ID_277932,薛真度,薛安都,先是 ， 憕 【 薛憕 】 从祖 真度 【 薛真度 】 与族祖 安都 【 薛安都 】 拥徐 、 兖归魏 ， 其子 怀隽 【 薛怀 隽 】 见 憕 ， 甚相 亲善 。,先是  憕  薛憕  从祖 真度  人物一  与族祖 安都  人物二  拥徐  兖归魏  其子 怀隽  薛怀 隽  见 憕  甚相 亲善,1,0
TRAIN_SENT_ID_249006,吕洞宾,韩湘子,两侧 分别 为汉 钟离 、 张果老 、 韩湘子 、 铁拐李 、 吕洞宾 、 曹国舅 、 蓝采和 、 何仙姑 的 “ 八仙 ” 泥塑 彩像 。,两侧 为汉 钟离  张果老  人物二  铁拐李  人物一  曹国舅  蓝采和  何仙姑  八仙  泥塑 彩像,-1,0
TRAIN_SENT_ID_263375,武修文,武敦儒,师侄 ： 郭 芙 、 郭襄 、 郭破虏 、 武敦儒 、 武修文 。,师侄  郭 芙  郭襄  郭破虏  人物二  人物一,1,0
TRAIN_SENT_ID_269574,水笙,汪啸风,5 . 水笙 听得 汪啸风 惊呼 ， 当即 勒马 。,人物一 听得 人物二 惊呼  当即 勒马,1,0
TRAIN_SENT_ID_267448,唐继虞,唐继尧,唐继尧 在 各军 的 军事 压力 下 ， 被迫 同意 了 这些 要求 ， 令 唐继虞 等 人 出走 ， 同意 改组 省政府 。,人物二 各军 军事 压力  被迫 同意 要求  令 人物一 出走  同意 改组 省政府,1,0
TRAIN_SENT_ID_251428,李瀚章,李鸿章,这 与 李鸿章 的 大哥 李瀚章 有关 。,人物二 大哥 人物一,1,0
TRAIN_SENT_ID_275824,陆无双,李莫愁,神 ： 小龙女 ， 程英 ， 陆无双 ， 李莫愁 ， 刘瑛 ， 公孙绿萼,神  小龙女  程英  人物一  人物二  刘瑛  公孙绿萼,-1,0
TRAIN_SENT_ID_251430,李瀚章,李鸿章,李瀚章 是 李鸿章 兄长 ， 查 有关 资料 ：,人物一 人物二 兄长  查 资料,1,0
TRAIN_SENT_ID_257789,林平之,岳不群,殊不知 ， 岳不群 挖 了 一个 非常 大 的 坑 等 着 他 跳 呢 ， 从此 ， 林平之 接下来 的 一生 ， 不是 自己 所 能 掌控 得 了 的 。,殊不知  人物二 挖 一个 非常 坑 跳   人物一 接下来 一生  掌控,-1,1
TRAIN_SENT_ID_269560,步鹰,燕双鹰,燕双鹰 万分 悲痛 之下 ， 将 步鹰 乱枪 击毙 。,人物二 万分 悲痛 之下  人物一 乱枪 击毙,-1,0
TRAIN_SENT_ID_252505,颜回,孔子,看着 这些 钱袋 ， 孔子 想起 刚才 称赞 颜回 ， 批评 子贡 的话 ， 感到 脸上 火辣辣 的 。,看着 钱袋  人物二 想起 刚才 称赞 人物一  批评 子贡  感到 脸上 火辣辣,-1,-1
TRAIN_SENT_ID_255286,卫夫人,王羲之,崔瑗 张芝 张昶 锺 繇 锺 会 韦诞 皇象 嵇康 卫瓘 卫夫人 索靖 谢安 王导 王敦 王廙 王洽 王珉 王羲之 王献之,崔瑗 张芝 张昶 锺 繇 锺 会 韦诞 皇象 嵇康 卫瓘 人物一 索靖 谢安 王导 王敦 王廙 王洽 王珉 人物二 王献之,-1,0
TRAIN_SENT_ID_282739,周信,吕岳,周信 ， 九龙 岛 声名 山 炼气 士 ， 吕岳 之徒 。,人物一  九龙 岛 声名 山 炼气 士  人物二 之徒,-1,0
TRAIN_SENT_ID_270975,李易霏,李昂融,全运 朵朵 果果 会 耀眼 明星 : 她们 是 — — 李易霏 李昂融 。,全运 朵朵 果果 会 耀眼 明星    人物一 人物二,1,0
TRAIN_SENT_ID_262241,尤二姐,尤三姐,第六十五回 贾二舍 偷 娶 尤二姐 尤三姐 思嫁 柳 二郎,第六十五回 贾二舍 偷 娶 人物一 人物二 思嫁 柳 二郎,1,0
TRAIN_SENT_ID_267602,李沧海,李秋水,10 . 《 仙剑 奇侠传 五 - 前传 》 - 凌波 天龙八部 之 天山童姥 李沧海 李秋水 CN 行云,仙剑 奇侠传 五  前传   凌波 天龙八部 天山童姥 人物一 人物二  行云,1,0
TRAIN_SENT_ID_250095,武敦儒,武修文,后 由 郭靖传 于 弟子 武修文 、 武敦儒 和 女儿 郭 芙 。,郭靖传 弟子 人物二  人物一 女儿 郭 芙,1,0
TRAIN_SENT_ID_271498,孟优,孟获,新 角色 马超 孟起 、 孟获 、 孟优 登场 。,新 角色 马超 孟起  人物二  人物一 登场,1,0
TRAIN_SENT_ID_269011,李如柏,李如松,李如松 （ 第八 世 ） — 李如柏 — 李如桢 — 李如樟 — 李如梅,人物二  第八 世   人物一  李如桢  李如樟  李如梅,1,0
TRAIN_SENT_ID_250107,武敦儒,武修文,三流 奶 ： 瑛 姑 、 天竺 高僧 、 武敦儒 、 武修文 、 陆立鼎 。,三流 奶  瑛 姑  天竺 高僧  人物一  人物二  陆立鼎,1,0
TRAIN_SENT_ID_278784,万寿公主,广德公主,（ 唐宣宗 长女 ） : 万寿公主 ， 唐宣宗 长女 ， 母 元昭皇后 晁氏 ， 同 母弟 唐懿宗 ， 母妹 广德公主 。,唐宣宗 长女   人物一  唐宣宗 长女  母 元昭皇后 晁氏  母弟 唐懿宗  母妹 人物二,1,0
TRAIN_SENT_ID_251890,曹薰铉,李昌镐,本届 杯赛 刘昌赫 第一个 出场 ， 先后 战胜 了 曹薰铉 、 李世石 等 高手 一路 连胜 ， 已 实现 了 13 连胜 ， 正在 向 李昌镐 的 纪录 逼近 。,本届 杯赛 刘昌赫 第一个 出场  先后 战胜 人物一  李世石 高手 一路 连胜  实现  连胜  正在 人物二 纪录 逼近,-1,0
TRAIN_SENT_ID_252617,颜回,孔子,孔子 不疑 颜回 之廉信,人物二 不疑 人物一 之廉信,-1,0
TRAIN_SENT_ID_257577,毛泽民,毛泽东,毛泽东 三 兄弟 内容 : 红色 政府 的 “ 大管家 ” 毛泽民 ； 骁勇 机智 、 临危 显 大义 的 毛泽覃 。,人物二 三 兄弟 内容  红色 政府  大管家  人物一  骁勇 机智  临危 显 大义 毛泽覃,1,1
TRAIN_SENT_ID_275930,孙莹莹,孙芸芸,而 整个 豪华 婚礼 观礼 团前 晚先 入住 五星级 瑞吉 饭店 ， 特地 前往 巴厘岛 参加 母亲 再婚 典礼 的 孙莹莹 、 孙芸芸 姐妹 。,整个 豪华 婚礼 观礼 团前 晚先 入住 五星级 瑞吉 饭店  特地 前往 巴厘岛 参加 母亲 再婚 典礼 人物一  人物二 姐妹,1,0
TRAIN_SENT_ID_250097,武敦儒,武修文,儿子 ： 武敦儒 、 武修文,儿子  人物一  人物二,1,0
TRAIN_SENT_ID_268923,韩非,荀子,"他 兼取 韩非 的 峭厉 ， 荀子 的 富丽 和 扬雄 的 简古 , 融会贯通 , 形成 峭刻 幽远 、 雄健 刚直 、 简丽 自然 的 独特 风格 。",兼取 人物一 峭厉  人物二 富丽 扬雄 简古  融会贯通  形成 峭刻 幽远  雄健 刚直  简丽 自然 独特 风格,-1,0
TRAIN_SENT_ID_258137,刘星,夏雪,两个 小孩子 和 好 了 ， 可是 刘星 和 夏雪 却成 了 冤家对头 ， 争斗 逐步 升级 。,两个 小孩子  人物一 人物二 却成 冤家对头  争斗 升级,1,0
TRAIN_SENT_ID_253104,颜回,孔子,孔子 称 颜回 ： ‘ 用 之 则 行 ， 舍之则 藏 ， 惟 我 与 尔 有 是 夫 。,人物二 称 人物一   行  舍之则 藏  惟 夫,-1,0
TRAIN_SENT_ID_255461,罗成,秦琼,出场 ： 《 说 唐 》 第三十九回 秦琼 三锏 倒 铜旗 罗成 枪 挑孽 世雄,出场   说 唐  第三十九回 人物二 三锏 倒 铜旗 人物一 枪 挑孽 世雄,1,-1
TRAIN_SENT_ID_258809,张无忌,殷离,同时 ， 张无忌 对于 蒙古 公主 赵敏 、 青梅竹马 的 小伙伴 周芷若 、 表妹 殷离 、 少女 小昭 的 爱幕 却 很 是 不知所措 、 难以 取舍 。,人物一 蒙古 公主 赵敏  青梅竹马 小伙伴 周芷若  表妹 人物二  少女 小昭 爱幕 不知所措  难以 取舍,1,0
TRAIN_SENT_ID_250106,武敦儒,武修文,"弟子 : 武家兄弟 ( 武修文 , 武敦儒 )",弟子  武家兄弟  人物二  人物一,1,0
TRAIN_SENT_ID_272038,韩慕侠,周恩来,因为 学拳 ， 使 周恩来 与 韩慕侠 建立 起 诚挚 的 友谊 。,学拳  人物二 人物一 建立 诚挚 友谊,-1,0
TRAIN_SENT_ID_257044,洪敬尧,洪荣宏,我们 约 好 常常 喜乐 恋花 08 旧情绵绵 : 林慧萍 、 洪荣宏 、 洪敬尧,约 常常 喜乐 恋花  旧情绵绵  林慧萍  人物二  人物一,1,0
TRAIN_SENT_ID_264945,贾元春,贾宝玉,贾元春 赏赐 端午节 礼 ， 贾宝玉 同 薛宝钗 的 一样 ， 宝黛 生疑 。,人物一 赏赐 端午节 礼  人物二 薛宝钗  宝黛 生疑,1,0
TRAIN_SENT_ID_282521,欧阳零,欧阳坤,身高 ： 根据 欧阳零 的 身高 推算 欧阳坤 站 起来 可能 有 150cm,身高  人物一 身高 推算 人物二 站 起来 可能,1,0
TRAIN_SENT_ID_252761,颜回,孔子,曲谱 为 清末 民初 琴家 彭祉卿 得 其父 所传 的 乐曲 ， 原曲 好像 是 孔子 想念 颜回 所 做 ， 经 后人 多次 修改 转变成 对 亲友 的 思念 。,曲谱 清末 民初 琴家 彭祉卿 其父 所传 乐曲  原曲 好像 人物二 想念 人物一 做  后人 多次 修改 转变成 亲友 思念,-1,0
TRAIN_SENT_ID_249222,皮皮鲁,鲁西西,不过 ， 皮皮鲁 有 魔 筷 了 ， 他用 魔 筷 把 抢劫犯 变小 ， 救出 了 鲁西西 。,人物一 魔 筷  他用 魔 筷 抢劫犯 变小  救出 人物二,1,0
TRAIN_SENT_ID_275262,汤潮,赵本山,7 媒体 关注 : 赵本山 和 汤潮,媒体 关注  人物二 人物一,-1,0
TRAIN_SENT_ID_272364,钱永刚,钱永真,儿子 钱永刚 、 女儿 钱永真 。,儿子 人物一  女儿 人物二,1,0
TRAIN_SENT_ID_279088,程英,黄药师,其实 追究 起来 ， 黄药师 收 程英 为徒 ， 还是 因为 她 服侍 得 体贴入微 ， 不似 黄蓉般 跳脱 顽皮 。,其实 追究 起来  人物二 收 人物一 为徒  服侍 体贴入微  不似 黄蓉般 跳脱 顽皮,-1,-1
TRAIN_SENT_ID_269355,王中军,王中磊,王中军 、 王中磊,人物一  人物二,1,0
TRAIN_SENT_ID_275227,李梅儿,上官兰心,封 上官兰心 为 敬贤妃 ， 封 金碧瑶 为 英德 妃 ， 李梅儿 为 李选侍 。,封 人物二 敬贤妃  封 金碧瑶 英德 妃  人物一 李选侍,1,0
TRAIN_SENT_ID_255352,贾午,贾南风,526 董袭 527 虞翻 528 贾午 529 贾充 530 贾南风,董袭  虞翻  人物一  贾充  人物二,1,0
TRAIN_SENT_ID_255432,罗成,秦琼,罗 与 秦 的 情谊 ， 罗成 是 主动 ， 秦琼 是 不得已 。,罗 秦 情谊  人物一 主动  人物二 不得已,1,0
TRAIN_SENT_ID_273131,包道乙,郑彪,方腊 派出 “ 灵应 天师 ” 包道乙 和 他 的 徒弟 “ 郑魔君 ” 郑彪 ， 以及 猎户 出身 的 将领 夏侯成 去 救应 。,方腊 派出  灵应 天师  人物一 徒弟  郑魔君  人物二  猎户 出身 将领 夏侯成 救应,-1,0
TRAIN_SENT_ID_260694,王重阳,全真七子,东游 至 山东 ， 王重阳 收 马丹阳 、 孙不二 ， 王玉 阳 、 丘 长春 ， 谭长真 ， 刘长生 、 郝 太古 等 人为 徒 ， 后称 “ 全真七子 ” 。,东游 山东  人物一 收 马丹阳  孙不二  王玉 阳  丘 长春  谭长真  刘长生  郝 太古 人为 徒  后称  人物二,-1,0
TRAIN_SENT_ID_251433,李瀚章,李鸿章,上款 人新梧 （ 李经畲 ） ， （ 1858 - 1935 ） ， 晚清 第一 重臣 李鸿章 长兄 两广总督 李瀚章 长子 。,上款 人新梧  李经畲         晚清 第一 重臣 人物二 长兄 两广总督 人物一 长子,1,0
TRAIN_SENT_ID_255433,罗成,秦琼,5 、 炬 石 炼狱 ： 宇文成都 、 秦琼 、 罗成 、 伍云召 、 薛礼,炬 石 炼狱  宇文成都  人物二  人物一  伍云召  薛礼,1,0
TRAIN_SENT_ID_253904,赵合德,赵飞燕,汉成帝 刘骜 与 赵飞燕 、 赵合德,汉成帝 刘骜 人物二  人物一,1,0
TRAIN_SENT_ID_250080,武敦儒,武修文,主要 原因 与 郭靖 专心 守城 ， 而 无暇 教 武敦儒 、 武修文 练武 相关 。,主要 原因 郭靖 专心 守城  无暇 教 人物一  人物二 练武 相关,1,0
TRAIN_SENT_ID_254263,张顺,张横,水军 头领 张横 立功 心切 ， 不顾 张顺 劝阻 ， 率 二三百 人去 劫 关胜 营寨 ， 结果 被 关胜 部下 探知 。,水军 头领 人物二 立功 心切  不顾 人物一 劝阻  率 二三百 人去 劫 关胜 营寨  关胜 部下 探知,1,0
TRAIN_SENT_ID_277657,关彝,关统,有子 关统 、 关彝 。,有子 人物二  人物一,1,0
TRAIN_SENT_ID_275807,石无痕,石无介,在 苏幻儿 惊世骇俗 的 撮合 戏点 下 ， 梁玉石 与 石无痕 渐生 情愫 ， 而 色艺双绝 的 青楼女子 秦雨 秋 也 与 石无介 定情 一生 … …,苏幻儿 惊世骇俗 撮合 戏点  梁玉石 人物一 渐生 情愫  色艺双绝 青楼女子 秦雨 秋 人物二 定情 一生,1,0
TRAIN_SENT_ID_249230,皮皮鲁,鲁西西,郑渊洁 完全 以 一个 开放 的 态度 支持 “ 皮皮鲁 ” “ 鲁西西 ” 和 《 魔方 大厦 》 的 结合 。,郑渊洁 完全 一个 开放 态度 支持  人物一   人物二   魔方 大厦  结合,1,0
TRAIN_SENT_ID_273682,姜子牙,元始天尊,三清 圣人 共 议定 论 ， 后 元始天尊 赐予 其徒 姜子牙 ， 配合 打神 鞭 借助 人间 商朝 气数 尽 与 周朝 兴旺 的 国运 敕封 八部 三百六十五 位正神 。,三清 圣人 共 议定  人物二 赐予 其徒 人物一  配合 打神 鞭 借助 人间 商朝 气数 周朝 兴旺 国运 敕封 八部 三百六十五 位正神,-1,0
TRAIN_SENT_ID_264674,柳承莞,柳承范,"这是 一部 由 素有 "" 韩国 昆汀 ” 之称 的 韩国 导演 柳承莞 执导 、 汇聚 了 全智贤 、 韩石圭 、 柳承范 的 谍战 动作 大戏 。",这是 一部 素有  韩国 昆汀  之称 韩国 导演 人物一 执导  汇聚 全智贤  韩石圭  人物二 谍战 动作 大戏,1,0
TRAIN_SENT_ID_277508,杜纮,杜纯,到 贬 所 不久 ， 又 以 岳父 杜纯 弟 杜纮 知应 天府 兼 南京 留守 司 公事 ， 为 避亲 嫌 ， 改差 通判 亳州 （ 今 安徽 亳县 ） 。,贬 不久  岳父 人物二 弟 人物一 知应 天府 兼 南京 留守 司 公事  避亲 嫌  改差 通判 亳州  安徽 亳县,1,0
TRAIN_SENT_ID_252797,颜回,孔子,于是 真相大白 ， 颜回 又 得到 了 孔子 的 信任 ， 被誉为 “ 复圣 ” 。,真相大白  人物一 得到 人物二 信任  被誉为  复圣,-1,0
TRAIN_SENT_ID_251849,梅超风,黄药师,黄药师 VS 梅超风 ： 情感 与 形象,人物二  人物一  情感 形象,-1,0
TRAIN_SENT_ID_274115,欧阳娣娣,欧阳娜娜,2014 / 01 / 18 萧煌奇 、 欧阳龙 、 傅娟 、 欧阳妮妮 、 欧阳娜娜 、 欧阳娣娣 、 曾心梅 、 林俊吉 、 马世莉 、 杨绣惠,萧煌奇  欧阳龙  傅娟  欧阳妮妮  人物二  人物一  曾心梅  林俊吉  马世莉  杨绣惠,1,0
TRAIN_SENT_ID_256828,孙周,孙淳,电影 《 秋喜 》 孙周 、 孙淳 、 郭晓 冬 、 江一燕 、 秦海璐 首映 见面会,电影  秋喜  人物一  人物二  郭晓 冬  江一燕  秦海璐 首映 见面会,1,0
TRAIN_SENT_ID_256929,仲由,孔子,季康子 问 孔子 ： “ 仲由 这个 人 ， 可以 让 他 管理 国家 政事 吗 ？ ”,季康子 问 人物二   人物一  管理 国家 政事,-1,0
TRAIN_SENT_ID_257241,艾欧里亚,艾俄洛斯,除 水神 猎神组 （ 封印 的 伊立安 ） 为 强制 撒加 、 加隆 、 艾俄洛斯 、 艾欧里亚 上场 战斗 ， 其余 均 可 自由 组队 。,水神 猎神组  封印 伊立安  强制 撒加  加隆  人物二  人物一 上场 战斗  均 自由 组队,1,0
TRAIN_SENT_ID_255386,罗成,秦琼,"本 段起 自 玉玺 换 萧妃 , 瓦岗 人心涣散 , 魏 徐留 诗 投唐 , 单通 雪夜 下瓦岗 , 秦琼 十里 相 送 , 因 伤心 受寒 致 病情 加重 , 罗成 心痛 不已 。",段起 玉玺 换 萧妃  瓦岗 人心涣散  魏 徐留 诗 投唐  单通 雪夜 下瓦岗  人物二 十里 相 送  伤心 受寒 病情 加重  人物一 心痛 不已,1,0
TRAIN_SENT_ID_250336,赵飞燕,赵合德,不久 ， 赵飞燕 被 册封 为 皇后 ， 赵合德 也 成 了 昭仪 ， 然而 这 一切 ， 都 与 她 毫不相干 了 。,不久  人物一 册封 皇后  人物二 成 昭仪   毫不相干,1,0
TRAIN_SENT_ID_257498,姜昆,马季,相声 ： 赵炎 、 马季 、 李文华 、 姜昆 、 侯耀文 、 石富宽 、 侯宝林 （ 已故 · 录像 ） 、 郭全宝 （ 已故 · 录像 ） 等 。,相声  赵炎  人物二  李文华  人物一  侯耀文  石富宽  侯宝林  已故  录像   郭全宝  已故  录像,-1,0
TRAIN_SENT_ID_268465,单联全,冯一非,单联全 、 冯一非 、 翁虹 、 江宏恩,人物一  人物二  翁虹  江宏恩,-1,0
TRAIN_SENT_ID_266303,马元中,马唯中,"父亲 马鹤凌 , 母亲 秦厚修 , 夫人 周美 青 ， 长女 马唯中 ， 次女 马元中 。",父亲 马鹤凌  母亲 秦厚修  夫人 周美 青  长女 人物二  次女 人物一,1,0
TRAIN_SENT_ID_258831,张无忌,殷离,1986 ， 香港 无线 ， 梁朝伟 饰 张无忌 ， 黎美娴 饰 赵敏 ， 邓萃雯 饰 周芷若 ， 邵美琪 饰小昭 ， 陈安莹 饰 殷离 （ 蛛儿 ）,香港 无线  梁朝伟 饰 人物一  黎美娴 饰 赵敏  邓萃雯 饰 周芷若  邵美琪 饰小昭  陈安莹 饰 人物二  蛛儿,1,0
TRAIN_SENT_ID_275467,李汉俊,李书城,李汉俊 的 心思 ， 得到 了 李书城 的 全力支持 。,人物一 心思  得到 人物二 全力支持,1,0
TRAIN_SENT_ID_265401,薛谭,秦青,汤问 》 载 ， 歌者 秦青 相 送 薛谭 ， “ 饯于 郊衢 ， 抚节 悲歌 ， 声振林木 ， 响遏行云 ” 。,汤问  载  歌者 人物二 相 送 人物一   饯于 郊衢  抚节 悲歌  声振林木  响遏行云,-1,0
TRAIN_SENT_ID_249537,李蔡,李广,2 、 “ 李蔡 ” 两句 ： 言 李广 虽 功勋卓著 ， 却终 无 封侯之 赏 。,人物一  两句  言 人物二 功勋卓著  却终 封侯之 赏,1,0
TRAIN_SENT_ID_263549,林逸,杨明,沈雨 昔 林逸 的 师娘 之一 ， 杨明 的 妻子 之一 。,沈雨 昔 人物一 师娘  人物二 妻子,-1,0
TRAIN_SENT_ID_255486,罗成,秦琼,武旦 王芝泉 反串 罗成 ， 史洁 华饰 窦线娘 ， 周启明 饰 罗艺 ， 陈治平 饰 杨林 ， 王群 饰 窦建德 ， 袁玉 城饰 秦琼 。,武旦 王芝泉 反串 人物一  史洁 华饰 窦线娘  周启明 饰 罗艺  陈治平 饰 杨林  王群 饰 窦建德  袁玉 城饰 人物二,1,0
TRAIN_SENT_ID_268462,单联全,冯一非,单联全 、 冯一非 、 江宏恩,人物一  人物二  江宏恩,-1,0
TRAIN_SENT_ID_276990,樊迟,孔子,宋 苏辙 《 礼义 信 足以 成德 论 》 ： “ 今夫 樊迟 欲 为 农圃 以 富民 ， 而 孔子 答之以 礼义 信 也 。 ”,宋 苏辙  礼义 信 足以 成德    今夫 人物一 欲 农圃 富民  人物二 答之以 礼义 信,-1,0
TRAIN_SENT_ID_249540,李蔡,李广,2 词语 解释 : 指 李广 从弟 李蔡 。,词语 解释  指 人物二 从弟 人物一,1,0
TRAIN_SENT_ID_255280,卫夫人,王羲之,二 、 玄 的 心灵 状态 ： 卫夫人 、 王羲之 书论,二  玄 心灵 状态  人物一  人物二 书论,-1,0
TRAIN_SENT_ID_261448,毛泽建,毛泽东,毛泽建 （ 1905 - 1929 ） ， 革命烈士 ， 毛泽东 堂妹 。,人物一       革命烈士  人物二 堂妹,1,0
TRAIN_SENT_ID_259754,李偲菘,李伟菘,另外 ， 爱戴 、 陈志朋 、 袁惟仁 、 李偲菘 、 李伟菘 等 各界 知名人士 作为 揭晓 嘉宾 出席 了 本次 盛典 。,爱戴  陈志朋  袁惟仁  人物一  人物二 各界 知名人士 揭晓 嘉宾 出席 本次 盛典,1,0
TRAIN_SENT_ID_276149,贾惜春,贾珍,贾惜春 ， 贾敬 的 女儿 ， 贾珍 的 胞妹 。,人物一  贾敬 女儿  人物二 胞妹,1,0
TRAIN_SENT_ID_254266,张顺,张横,张顺 . （ 渔家 ， 张横 之弟 ） 三十六 天罡 星天败星 : 天败星 …,人物一   渔家  人物二 之弟  三十六 天罡 星天败星  天败星,1,-1
TRAIN_SENT_ID_259790,李偲菘,李伟菘,李伟菘 、 李偲菘 两个 被 华语 乐坛 冠为 传奇 的 名字 。,人物二  人物一 两个 华语 乐坛 冠为 传奇 名字,1,0
TRAIN_SENT_ID_266035,贾珍,贾惜春,3 . 贾敬 生 贾珍 （ 长子 ） 、 贾惜春 （ 长女 ） ；,贾敬 生 人物一  长子   人物二  长女,1,0
TRAIN_SENT_ID_260579,金敬姬,金正日,朝鲜人民军 最高 司令官 金正日 27 日 下达 第 0051 号 命令 ， 任命 金敬姬 、 金正恩 、 崔龙海 等 6 人为 大将 。,朝鲜人民军 最高 司令官 人物二  日 下达  号 命令  任命 人物一  金正恩  崔龙海  人为 大将,1,0
TRAIN_SENT_ID_249106,吕洞宾,韩湘子,据悉 ， 韩湘子 后来 又 从师 吕洞宾 ， 修道 成仙 ， 位列 仙班 。,据悉  人物二 后来 从师 人物一  修道 成仙  位列 仙班,-1,0
TRAIN_SENT_ID_271535,孟优,孟获,隐者 又 曰 ： “ 丞相 休疑 ， 容伸 片言 ： 某一 父母 所生 三人 ： 长即 老夫 孟节 ， 次 孟获 ， 又次 孟优 。,隐者 曰   丞相 休疑  容伸 片言  某一 父母 所生 三人  长即 老夫 孟节  次 人物二  又次 人物一,1,0
TRAIN_SENT_ID_259676,公孙胜,罗真人,第五十三回 戴宗 智取 公孙胜 ， 李逵 斧劈 罗真人,第五十三回 戴宗 智取 人物一  李逵 斧劈 人物二,-1,-1
