sent_id,entity1,entity2,sent,processed_sent,label,hard_match
TRAIN_SENT_ID_262202,陈靖仇,陈辅,3 轩辕剑 叁 外传 ： 天之痕 : 相关 剧情 : 游戏 主角 陈靖仇 的 师父 陈辅 在 伏 魔 山上 被 饕餮 。,轩辕剑 叁 外传  天之痕  相关 剧情  游戏 主角 人物一 师父 人物二 伏 魔 山上 饕餮,-1,-1
TRAIN_SENT_ID_275890,王子豪,王子杰,16 . 王子豪 及 王子杰 （ 火柴 天堂 ） 15 分,人物一 人物二  火柴 天堂   分,1,0
TRAIN_SENT_ID_252724,颜回,孔子,"历代 王朝 曾 先后 规定 ， 孔子 、 颜回 、 孟子 的 后裔 都 世袭 了 “ 翰林院 五经 博士 ” , 专掌 祀 典祀 产 ， 而 曾子 后裔 确无 这一 礼遇 。",历代 王朝 先后 规定  人物二  人物一  孟子 后裔 世袭  翰林院 五经 博士   专掌 祀 典祀 产  曾子 后裔 确无 这一 礼遇,-1,0
TRAIN_SENT_ID_261087,张豪龙,张柏文,舅舅 ： 张柏文 ， 张豪龙 香港 演员 、 滑水 运动员,舅舅  人物二  人物一 香港 演员  滑水 运动员,1,0
TRAIN_SENT_ID_265553,张崇基,张崇德,李大卫 与 著名 音乐 人 张崇基 张崇德 合影,李大卫 著名 音乐 人物一 人物二 合影,1,0
TRAIN_SENT_ID_251616,穆春,穆弘,张横 引着 穆弘 、 穆春 、 薛永 ， 带 十数个 庄客 在 一只 船上 。,张横 引着 人物二  人物一  薛永  带 十数个 庄客 一只 船上,1,0
TRAIN_SENT_ID_261618,宋小宝,赵本山,《 樱桃红 》 是 本山 传媒 出品 苦情 剧 ， 有 王振宏 执导 ， 宋小宝 、 王天泽 、 彭雨柔 、 赵本山 、 杨冰 等 人 主演 。,樱桃红  本山 传媒 出品 苦情 剧  王振宏 执导  人物一  王天泽  彭雨柔  人物二  杨冰 主演,-1,0
TRAIN_SENT_ID_249139,皮皮鲁,鲁西西,其 代表作 有 《 童话 大王 》 《 舒克和贝塔 》 《 皮皮鲁 和 鲁西西 》 《 魔方 大厦 》,代表作  童话 大王   舒克和贝塔   人物一 人物二   魔方 大厦,1,0
TRAIN_SENT_ID_257499,姜昆,马季,马季 、 赵世忠 、 姜昆,人物二  赵世忠  人物一,-1,0
TRAIN_SENT_ID_266669,邓鸣贺,邓鸣璐,儿童节目 ： 邓鸣贺 （ 已故 ） 、 邓鸣璐 等 。,儿童节目  人物一  已故   人物二,1,-1
TRAIN_SENT_ID_256918,仲由,孔子,孔子 为 避鲁乱 曾 到 此 讲学 ， 亲见 仲由 率 百姓 负米 筑堤 盛况 ， 叹 曰 ： “ 由 也 ， 事亲 可谓 生 ， 事 尽力 矣 。 ”,人物二 避鲁乱 讲学  亲见 人物一 率 百姓 负米 筑堤 盛况  叹 曰    事亲 可谓 生  事 尽力,-1,-1
TRAIN_SENT_ID_250357,赵飞燕,赵合德,赵飞燕 ， 赵合德 ： 几个 红颜 成 薄命,人物一  人物二  几个 红颜 成 薄命,1,0
TRAIN_SENT_ID_255413,罗成,秦琼,徐茂 公派 王伯党 ， 谢映 登 ， 任 警司 ， 铁子 健带 着 徐和 秦琼 的 书信 去 北平 府 请 罗成 。,徐茂 公派 王伯党  谢映 登  警司  铁子 健带 徐和 人物二 书信 北平 府 请 人物一,1,0
TRAIN_SENT_ID_252834,颜回,孔子,第十三回 孔子 重操旧业 颜回 见 （ 黑出 ） 荆妻,第十三回 人物二 重操旧业 人物一 见  黑出  荆妻,-1,0
TRAIN_SENT_ID_250108,武敦儒,武修文,武敦儒 、 武修文 与 杨过相 比 ， 只能 比 出 杨过 出类拔萃 、 超群绝伦 。,人物一  人物二 杨过相  只能 出 杨过 出类拔萃  超群绝伦,1,0
TRAIN_SENT_ID_283371,刘义融,刘义庆,母亲 ： 长沙 妃 檀氏字 宪子 ， 谥 景定 ， 出自 高平 平阳 檀氏 刘义融 兄弟 : 刘义欣 、 刘义庆 、 刘义宗 、 刘义宾 、 刘义綦 。,母亲  长沙 妃 檀氏字 宪子  谥 景定  出自 高平 平阳 檀氏 人物一 兄弟  刘义欣  人物二  刘义宗  刘义宾  刘义綦,1,0
TRAIN_SENT_ID_278137,裴元,孙思邈,只是 因为 跟随 孙思邈 的 缘故 ， 裴元 并未 入 医行 。,跟随 人物二 缘故  人物一 并未 入 医行,-1,0
TRAIN_SENT_ID_277824,傅清,傅恒,李荣保 之子 ： 傅恒 、 广成 、 傅清 及 傅玉 俱为 重臣 。,李荣保 之子  人物二  广成  人物一 傅玉 俱为 重臣,1,0
TRAIN_SENT_ID_258147,刘星,夏雪,东海 和 刘梅 以为 刘星 和 夏雪 还是 在 “ 做戏 ” ， 所以 非但 没有 阻拦 ， 还 夸 二人 演得 好 。,东海 刘梅 人物一 人物二  做戏   没有 阻拦  夸 二人 演得,1,-1
TRAIN_SENT_ID_251829,梅超风,黄药师,结果 梅超风 不 敌 全真七子 ， 却 因 黄药师 的 到来 而 结束 。,人物一 敌 全真七子  人物二 到来 结束,-1,0
TRAIN_SENT_ID_259413,凌音,凌波,凌波 、 凌音 、 炎舞,人物二  人物一  炎舞,1,0
TRAIN_SENT_ID_275534,王小虎,赵本山,25 、 小品 《 功夫 》 演员 ： 赵本山 、 范伟 、 蔡维利 、 王小虎,小品  功夫  演员  人物二  范伟  蔡维利  人物一,-1,1
TRAIN_SENT_ID_250078,武敦儒,武修文,师兄 ： 武敦儒 、 武修文,师兄  人物一  人物二,1,0
TRAIN_SENT_ID_252874,颜回,孔子,﹝ 孔子 ﹞ 召 颜回 曰 : ' 畴昔 予 梦见 先人 ﹐ 岂 或 启佑 我 哉 !,﹝ 人物二 ﹞ 召 人物一 曰   畴昔 予 梦见 先人 ﹐ 岂 启佑,-1,-1
TRAIN_SENT_ID_268998,韩非,荀子,孔子 ﹑ 墨子 ﹑ 孟子 ﹑ 荀子 ﹑ 韩非 等 是 其中 的 佼佼者 。,孔子  墨子  孟子  人物二  人物一 佼佼者,-1,0
TRAIN_SENT_ID_251885,曹薰铉,李昌镐,第 3 局 模仿 之战 黑方 曹薰铉 白方 李昌镐,局 模仿 之战 黑方 人物一 白方 人物二,-1,0
TRAIN_SENT_ID_268922,司徒静,司徒剑南,司徒剑南 第十一 集 : 文蔷 救 下 司徒静 。,人物二 第十一 集  文蔷 救 人物一,1,0
TRAIN_SENT_ID_285188,韩小莹,韩宝驹,师父 ： 柯镇恶 、 朱聪 、 韩宝驹 、 南希仁 、 张阿生 、 全金发 、 韩小莹 、 北丐 洪七公 、 蒙古 神箭手 哲别,师父  柯镇恶  朱聪  人物二  南希仁  张阿生  全金发  人物一  北丐 洪七公  蒙古 神箭手 哲别,1,0
TRAIN_SENT_ID_257578,毛泽民,毛泽东,80 . 毛泽民 惨遭杀害 毛泽东 念弟 情长,人物一 惨遭杀害 人物二 念弟 情长,1,-1
TRAIN_SENT_ID_259796,李偲菘,李伟菘,- - - - - - 李偲菘 李伟菘,人物一 人物二,1,0
TRAIN_SENT_ID_266063,张学思,张学良,不久 东北局 决定 将 “ 东北 公学 ” 改名 为 “ 东北大学 ” ， 任命 张学良 将军 的 胞弟 、 东北 行政 委员会 副 主席 张学思 兼任 校长 ， 校址 设 于 本溪 。,不久 东北局 决定  东北 公学  改名  东北大学   任命 人物二 将军 胞弟  东北 行政 委员会 副 主席 人物一 兼任 校长  校址 设 本溪,1,0
TRAIN_SENT_ID_268940,韩非,荀子,《 荀子 》 《 韩非 子 》 之 各 一部分 。,人物二   人物一 子  一部分,-1,0
TRAIN_SENT_ID_251859,曹薰铉,李昌镐,前 七届 比赛 的 冠军 分别 是 ： 曹薰铉 、 徐奉洙 、 刘昌赫 、 李昌镐 、 常昊 、 崔哲瀚 、 范廷钰 。,前 七届 比赛 冠军  人物一  徐奉洙  刘昌赫  人物二  常昊  崔哲瀚  范廷钰,-1,0
TRAIN_SENT_ID_284888,王燕燕,王伦,王伦 ： 杨怀民 ； 王燕燕 ： 狄莺 ； 莫愁 ： 赵永馨 ； 荆无命 ： 谢屏楠 ； 仁宗 ： 施羽 ；,人物二  杨怀民  人物一  狄莺  莫愁  赵永馨  荆无命  谢屏楠  仁宗  施羽,1,0
TRAIN_SENT_ID_282517,红孩,赵本山,"赵本山 收徒 , 组建 “ 赵家 班 ” 红 、 董三毛 、 宋小宝 、 小 鹏飞 、 田娃 、 红孩 。",人物二 收徒  组建  赵家 班  红  董三毛  宋小宝  鹏飞  田娃  人物一,-1,-1
TRAIN_SENT_ID_252843,颜回,孔子,颜回 出 ， 孔子 顾谓 二 三子 曰 ： “ 吾 之 信回 也 ， 非待 今日 也 。 ”,人物一 出  人物二 顾谓 二 三子 曰   吾 信回  非待 今日,-1,0
TRAIN_SENT_ID_250370,赵飞燕,赵合德,12 . 二个 舞姿 更是 优美 ， 喜 得 太宗笑 曰 ： “ 汝二人 真 乃 赵飞燕 、 赵合德 也 ！ ”,二个 舞姿 更是 优美  喜 太宗笑 曰   汝二人 真 人物一  人物二,1,0
TRAIN_SENT_ID_250101,武敦儒,武修文,第一篇 ， 写 武敦儒 、 武修文 。,第一篇  写 人物一  人物二,1,0
TRAIN_SENT_ID_282095,周昂,周昕,周昕 、 周昂 之弟 。,人物二  人物一 之弟,1,0
TRAIN_SENT_ID_255480,罗成,秦琼,李元霸 、 秦琼 、 宇文化及 、 程咬金 、 单雄信 、 尉迟敬德 、 罗成 、 李靖 、 魏文通 、 梁士泰 ......,李元霸  人物二  宇文化及  程咬金  单雄信  尉迟敬德  人物一  李靖  魏文通  梁士泰,1,0
TRAIN_SENT_ID_265487,薛蝌,薛蟠,身份 ： 是 薛姨妈 的 侄女 ， 薛蝌 的 胞妹 ， 薛蟠 ， 薛宝钗 的 堂妹 。,身份  薛姨妈 侄女  人物一 胞妹  人物二  薛宝钗 堂妹,1,0
TRAIN_SENT_ID_261643,宋小宝,赵本山,赵本山 也 曾多次 想带 爱徒 宋小宝 上 春晚 ， 但 都 因为 作品 不 理想 、 身体状况 不 允许 等 原因 半路 “ 夭折 ” 。,人物二 曾多次 想带 爱徒 人物一 春晚  作品 理想  身体状况 允许 原因 半路  夭折,-1,0
TRAIN_SENT_ID_253010,颜回,孔子,殿内 正位 原有 孔子 塑像 ， 东西 两边 分列 颜回 、 子思 、 曾 参 、 孟轲 “ 四配 ” 塑像 ， 其旁 又 各 有 六 像 ， 即 十二 哲 。,殿内 正位 原有 人物二 塑像  东西 两边 分列 人物一  子思  参  孟轲  四配  塑像  其旁 六  十二 哲,-1,0
TRAIN_SENT_ID_251905,曹薰铉,李昌镐,在 李昌镐 、 曹薰铉 盛行于 世 的 今天 ， 胡耀宇 依然 保持 着 对 小林光一 的 偏好 。,人物二  人物一 盛行于 世 今天  胡耀宇 依然 保持 小林光一 偏好,-1,0
TRAIN_SENT_ID_262211,尤二姐,尤三姐,实际上 ， 小说 已经 写明 ， 像 尤二姐 、 尤三姐 等 确实 是 受到 了 贾府 贾珍 、 贾琏 、 贾蓉 等 花花公子 的 攻击 。,实际上  小说 已经 写明  人物一  人物二 确实 贾府 贾珍  贾琏  贾蓉 花花公子 攻击,1,0
TRAIN_SENT_ID_264955,林一峰,林二汶,林一峰 、 林二汶,人物一  人物二,1,0
TRAIN_SENT_ID_271741,朱聪,郭靖,郭靖 所学 的 “ 分筋 错骨手 ” 乃是 二 师父 朱聪 自创 。,人物二 所学  分筋 错骨手  乃是 二 师父 人物一 自创,-1,0
TRAIN_SENT_ID_250081,武敦儒,武修文,人们 往往 把 武敦儒 、 武修文 以及 耶律齐 与 杨过相 比 ， 因为 他们 是 同辈 的 。,往往 人物一  人物二 耶律齐 杨过相  同辈,1,0
TRAIN_SENT_ID_260731,薛丁山,薛金莲,窦仙童 爱上 了 薛丁山 ； 窦一虎 爱上 了 薛金莲 。,窦仙童 爱上 人物一  窦一虎 爱上 人物二,1,0
TRAIN_SENT_ID_273678,姜子牙,元始天尊,姜子牙 归国 封神 ， 太 上 无极 混元 教主 元始天尊 敕 曰 ： 呜呼 ！,人物一 归国 封神  太 无极 混元 教主 人物二 敕 曰,-1,0
TRAIN_SENT_ID_269113,唐鉴军,赵本山,已经 拜师 赵本山 的 张小飞 、 唐鉴军 等 人 经常 去 辽阳 演出 ， 一来二去 就 认识 了 程红 。,已经 拜师 人物二 张小飞  人物一 经常 辽阳 演出  一来二去 认识 程红,-1,0
TRAIN_SENT_ID_249246,皮皮鲁,鲁西西,《 皮皮鲁 和 鲁西西 的 故事 》 ， 郑渊洁 著 ， 学苑 出版社 出版 图书 。,人物一 人物二 故事   郑渊洁 著  学苑 出版社 出版 图书,1,0
TRAIN_SENT_ID_259800,李偲菘,李伟菘,《 潮流 盛典 》 与 林俊杰 羽泉 袁泉 李偲菘 李伟菘 王啸坤 一同 受邀 出席 并 压轴 出场 演唱 主题曲,潮流 盛典  林俊杰 羽泉 袁泉 人物一 人物二 王啸坤 一同 受邀 出席 压轴 出场 演唱 主题曲,1,0
TRAIN_SENT_ID_271234,苏贤方,苏贤达,堆翠堂 的 老 掌柜 ， 苏贤方 和 苏贤达 的 父亲 。,堆翠堂 老 掌柜  人物一 人物二 父亲,1,0
TRAIN_SENT_ID_255383,罗成,秦琼,第八回 武奎 武亮 王府 访 凶手 罗艺 罗成 设计 护 秦琼,第八回 武奎 武亮 王府 访 凶手 罗艺 人物一 设计 护 人物二,1,0
TRAIN_SENT_ID_281536,于佑福,高德明,高德明 收徒 于佑福 ， 健在 。,人物二 收徒 人物一  健在,-1,-1
TRAIN_SENT_ID_263364,武修文,武敦儒,郭靖 看来 ， 襄阳 的 未来 就 落 在 武敦儒 、 武修文 肩膀 上 。,郭靖 看来  襄阳 未来 落 人物二  人物一 肩膀,1,0
TRAIN_SENT_ID_252583,颜回,孔子,孔子 十分 赞赏 颜回 的 这种 品德 。,人物二 十分 赞赏 人物一 这种 品德,-1,0
TRAIN_SENT_ID_259395,凌音,凌波,凌音 凌波 姐妹 、 铁笔 拜入 蜀山 派 。,人物一 人物二 姐妹  铁笔 拜入 蜀山 派,1,0
TRAIN_SENT_ID_264522,岳云鹏,郭德纲,那时 郭德纲 没 名气 ， 岳云鹏 也 不 认识 他 ， 连 《 报菜名 》 都 不 知道 ， 就 跟 他 在 小剧场 干 杂活 ， “ 师父 管吃 、 喝 ， 师娘 一 星期 给 一百元 ” 。,人物二 没 名气  人物一 认识   报菜名  知道  小剧场 干 杂活   师父 管吃  喝  师娘 星期 一百元,-1,0
TRAIN_SENT_ID_265551,张崇基,张崇德,"08 . 龙珠 94Remix ( 卡通片 集 "" 龙珠 "" 歌曲 ) . 张崇基 / 张崇德",龙珠   卡通片 集  龙珠  歌曲   人物一  人物二,1,0
TRAIN_SENT_ID_264873,田猛,田虎,在 烈山 堂堂 主 田猛 葬礼 上 随着 堂主 田虎 前来 吊唁 。,烈山 堂堂 主 人物一 葬礼 堂主 人物二 前来 吊唁,1,0
TRAIN_SENT_ID_249304,陆无双,程英,那 【 程英 姑娘 】 ， 陆无双 姑娘 ， 也 都 是 【 品貌双全 】 、 重情 笃义 之 人 。,人物二 姑娘   人物一 姑娘   品貌双全   重情 笃义,1,0
TRAIN_SENT_ID_253883,赵合德,赵飞燕,汉 宫里 的 风流 荒淫 往事 — — 汉成帝 与 赵飞燕 、 赵合德 姐妹,汉 宫里 风流 荒淫 往事   汉成帝 人物二  人物一 姐妹,1,0
TRAIN_SENT_ID_249047,吕洞宾,韩湘子,正式 定型 为汉 钟离 （ 或 钟离权 ） 、 张果老 、 韩湘子 、 铁拐李 、 吕洞宾 、 何仙姑 、 蓝采和 及 曹国舅 。,正式 定型 为汉 钟离  钟离权   张果老  人物二  铁拐李  人物一  何仙姑  蓝采和 曹国舅,-1,0
TRAIN_SENT_ID_257565,毛泽民,毛泽东,毛远志 （ 1923 - 1990 ） ， 湖南 韶山 人 ， 是 毛泽民 和 王淑兰 的 女儿 ， 毛泽东 唯一 的 亲 侄女 。,毛远志       湖南 韶山  人物一 王淑兰 女儿  人物二 唯一 亲 侄女,1,0
TRAIN_SENT_ID_269403,刘伟,马季,《 找 名牌 》 表演者 ： 刘伟 、 马季,找 名牌  表演者  人物一  人物二,-1,0
TRAIN_SENT_ID_249278,皮皮鲁,鲁西西,郑渊洁 — — 舒克 与 贝塔 历险记 ， 皮皮鲁 系列 ， 鲁西西 系列 等,郑渊洁   舒克 贝塔 历险记  人物一 系列  人物二 系列,1,0
TRAIN_SENT_ID_251552,楚碧痕,楚寒镜,楚寒镜 见 楚碧痕 的 决心 ， 于是 告诉 众人 线索 。,人物二 见 人物一 决心  告诉 众人 线索,1,0
TRAIN_SENT_ID_267589,骆赢,骆羽,女 运动员 : 赵芸蕾 、 马晋 、 骆赢 、 骆羽 、 王仪涵 、 于洋 、 李雪芮 、 唐渊渟,女 运动员  赵芸蕾  马晋  人物一  人物二  王仪涵  于洋  李雪芮  唐渊渟,1,0
TRAIN_SENT_ID_263381,武修文,武敦儒,有二子 武敦儒 、 武修文 ， 妻子 武三娘 ， 义女 何沅君 。,有二子 人物二  人物一  妻子 武三娘  义女 何沅君,1,0
TRAIN_SENT_ID_252582,颜回,孔子,颜回 攫 甑 释意 : 孔子 在 陈国和 蔡国 之间 的 地方 （ 缺粮 ） 受困 ， 饭菜 全无 ， 七天 没 吃 上 米饭 了 。,人物一 攫 甑 释意  人物二 陈国和 蔡国 之间 地方  缺粮  受困  饭菜 全无  七天 没 吃 米饭,-1,-1
TRAIN_SENT_ID_277737,王银钏,王宝钏,《 薛平贵 与 王宝钏 》 饰演 ； 王银钏,薛平贵 人物二  饰演  人物一,1,1
TRAIN_SENT_ID_267577,吴魏,吴狄,不是 疯子 ， 不是 吴狄 ， 而是 吴魏 。,疯子  人物二  人物一,1,0
TRAIN_SENT_ID_271278,马季,侯宝林,师父 ： 侯宝林 师爷 ： 朱阔泉 师兄 ： 黄铁良 、 马季 、 殷培田 、 丁广泉 、 师胜杰 等 。,师父  人物二 师爷  朱阔泉 师兄  黄铁良  人物一  殷培田  丁广泉  师胜杰,-1,0
TRAIN_SENT_ID_268919,司徒静,司徒剑南,静修 带 人 帮助 司徒静 ， 司徒剑南 也 来 助阵 。,静修 带 帮助 人物一  人物二 助阵,1,0
TRAIN_SENT_ID_266200,李昌镐,曹薰铉,第三轮 ： 李昌镐 1 : 0 钱宇平 曹薰铉 1 : 0 聂卫平 林海峰 1 : 0 淡路 修三 赵治勋 1 : 0 片冈聪,第三轮  人物一    钱宇平 人物二    聂卫平 林海峰    淡路 修三 赵治勋    片冈聪,-1,0
TRAIN_SENT_ID_256950,仲由,孔子,或 ， 孔子 希望 仲由 能够 注意 衣装 打扮 ， 这样 才能 符合 士族 地位 。,人物二 希望 人物一 能够 注意 衣装 打扮  符合 士族 地位,-1,0
TRAIN_SENT_ID_278056,郭麒麟,于谦,于谦 - - 郭麒麟 、 冯阔洋 、 太 荣剑,人物二   人物一  冯阔洋  太 荣剑,-1,0
TRAIN_SENT_ID_249200,皮皮鲁,鲁西西,一般 童装 以 著名 形象 “ 皮皮鲁 ” 、 “ 鲁西西 ” 作为 商标 ， 高档 童装 则 以 另 两个 著名 形象 “ 舒克 ” 、 “ 贝塔 ” 作为 商标 。,童装 著名 形象  人物一    人物二  商标  高档 童装 两个 著名 形象  舒克    贝塔  商标,1,0
TRAIN_SENT_ID_279415,王学明,龙俊杰,指导 教师 ： 龙俊杰 、 何雁 、 王学明 等 。,指导 教师  人物二  何雁  人物一,-1,0
TRAIN_SENT_ID_277642,方天翼,顾婷,在 俞梅 牺牲 的 第二天 ， 方天翼 单枪匹马 闯进 南京城 ， 以 搏命 的 方式 杀 了 松下 健 ， 报 了 杀 妻之仇 ， 并 与 顾婷 加入 共产党 。,俞梅 牺牲 第二天  人物一 单枪匹马 闯进 南京城  搏命 方式 杀 松下 健  报 杀 妻之仇  人物二 加入 共产党,1,0
TRAIN_SENT_ID_271235,马季,侯宝林,侯宝林 、 郭启儒 、 刘宝瑞 、 郭全宝 、 李文华 、 马季 和 关学曾 等 人 的 家属 纷纷表示 要 加入 这样 的 团体 。,人物二  郭启儒  刘宝瑞  郭全宝  李文华  人物一 关学曾 家属 纷纷表示 加入 团体,-1,0
TRAIN_SENT_ID_266314,贾源,贾演,▪ 贾演 ▪ 贾源 ▪ 贾代化 ▪ 贾代善 ▪ 贾代儒 ▪ 贾代修 ▪ 贾敷 ▪ 贾敬,▪ 人物二 ▪ 人物一 ▪ 贾代化 ▪ 贾代善 ▪ 贾代儒 ▪ 贾代修 ▪ 贾敷 ▪ 贾敬,1,0
TRAIN_SENT_ID_276991,樊迟,孔子,孔子 的 仁学 思想 最 基本 、 最 核心 的 宗旨 就是 “ 爱人 ” （ 《 论语 · 颜渊 》 ） ： “ 樊迟 问仁 ， 孔 曰 ： 爱人 。 ”,人物二 仁学 思想 基本  核心 宗旨  爱人    论语  颜渊     人物一 问仁  孔 曰  爱人,-1,-1
TRAIN_SENT_ID_268983,韩非,荀子,《 尸子 》 的 “ 审 名分 ” 理论 ， 和 荀子 、 韩非 、 道家 的 一些 思想 也 是 息息相通 的 。,尸子   审 名分  理论  人物二  人物一  道家 思想 息息相通,-1,0
TRAIN_SENT_ID_277825,傅清,傅恒,侄 ： 富察 · 广成 、 富察 · 傅文 、 富察 · 傅清 、 富察 · 傅恒 。,侄  富察  广成  富察  傅文  富察  人物一  富察  人物二,1,0
TRAIN_SENT_ID_266173,李昌镐,曹薰铉,韩国 著名 高手 : 韩国 四老 天王 ： 李昌镐 、 曹薰铉 、 徐奉洙 、 刘昌赫,韩国 著名 高手  韩国 四老 天王  人物一  人物二  徐奉洙  刘昌赫,-1,0
TRAIN_SENT_ID_252474,颜回,孔子,1 个人信息 : 颜回 早逝 ， 颜无繇 因 家里 穷 ， 就 请求 孔子 把 车子 卖 了 来 帮 他 安葬 。,个人信息  人物一 早逝  颜无繇 家里 穷  请求 人物二 车子 卖 帮 安葬,-1,0
TRAIN_SENT_ID_253862,赵合德,赵飞燕,汉成帝 宠幸 的 赵飞燕 、 赵合德 姐妹 即住 在 昭阳 宫 。,汉成帝 宠幸 人物二  人物一 姐妹 即住 昭阳 宫,1,0
TRAIN_SENT_ID_253000,颜回,孔子,孔子 回答 ： “ 颜回 的 仁爱 超过 我 。 ”,人物二 回答   人物一 仁爱 超过,-1,0
TRAIN_SENT_ID_275148,孙立荣,赵本山,赵本山 ： 坐下 吧 ， 坐 那儿 没事 ， 我 给 你 放 这 吧 行 不 （ 拿 起 孙立荣 的 衣服 ） ？,人物二  坐下  坐 没事  放 行  人物一 衣服,-1,0
TRAIN_SENT_ID_268889,司徒静,司徒剑南,司徒剑南 第二集 : 司徒静 骗过 衙役 逃走 ， 朱允 和 白云飞 被 误认为 是 强盗 。,人物二 第二集  人物一 骗过 衙役 逃走  朱允 白云飞 误认为 强盗,1,0
TRAIN_SENT_ID_264561,胡青牛,张无忌,胡青牛 见死不救 : 当 得知 张无忌 不肯 加入 天鹰 教后 ， 便 决定 见死不救 。,人物一 见死不救  得知 人物二 不肯 加入 天鹰 教后  便 决定 见死不救,-1,0
TRAIN_SENT_ID_259410,凌音,凌波,凌音 角色 关系 : 亲人 ： 父母 未知 ， 有 一 亲生 姐姐 凌波 。,人物一 角色 关系  亲人  父母 未知  亲生 姐姐 人物二,1,1
TRAIN_SENT_ID_282078,陈长兴,陈秉旺,陈秉旺 与 陈长兴 168,人物二 人物一,-1,0
TRAIN_SENT_ID_253894,赵合德,赵飞燕,小聪明 害死 人 — — 赵飞燕 赵合德 姐妹,小聪明 害死   人物二 人物一 姐妹,1,0
TRAIN_SENT_ID_276219,姜丽文,姜文杰,名人 之后 队 ： 洪天明 、 原子鏸 、 黄宇诗 、 姜文杰 、 姜丽文,名人 之后 队  洪天明  原子鏸  黄宇诗  人物二  人物一,1,0
TRAIN_SENT_ID_257802,林平之,岳不群,林平之 与 岳不群 反目 后 ， 劳德诺 出现 力邀 其往 嵩山 共谋 。,人物一 人物二 反目  劳德诺 出现 力邀 其往 嵩山 共谋,-1,0
TRAIN_SENT_ID_252822,颜回,孔子,孔子 不 听 ， 颜回 为 驭 ， 子贡 为 右 ， 往见 盗 跖 。,人物二 听  人物一 驭  子贡 右  往见 盗 跖,-1,-1
TRAIN_SENT_ID_267517,裘千丈,裘千仞,2008 《 射雕 英雄传 》 饰 裘千仞 裘千丈,射雕 英雄传  饰 人物二 人物一,1,0
TRAIN_SENT_ID_255423,罗成,秦琼,020 回 （ 秦琼 与 罗成 传枪 递锏 ）,回  人物二 人物一 传枪 递锏,1,0
TRAIN_SENT_ID_252710,颜回,孔子,孔子 与 颜回 的 这段 谈话 完全 出自 假托 。,人物二 人物一 这段 谈话 完全 出自 假托,-1,0
TRAIN_SENT_ID_269724,薛洋,薛之荔,薛洋 、 薛之荔 的 父亲 ， 富商 ， 性格内向 ， 沉稳 ， 手下 对 他 都 很 忠心 。,人物一  人物二 父亲  富商  性格内向  沉稳  手下 忠心,1,-1
TRAIN_SENT_ID_282077,陈长兴,陈秉旺,陈长兴 的 父亲 陈秉旺 也 是 非常 出名 的 太极拳 家 。,人物一 父亲 人物二 非常 出名 太极拳 家,-1,0
TRAIN_SENT_ID_253107,颜回,孔子,前面 为 卷 棚式 走廊 ， 启 圣殿 内 供奉 有 孔子 及四配 ， 分别 是 颜回 、 曾 参 、 子思 、 孟子 。,前面 卷 棚式 走廊  启 圣殿 供奉 人物二 及四配  人物一  参  子思  孟子,-1,0
TRAIN_SENT_ID_263548,林逸,杨明,王笑 嫣 林逸 的 师娘 之一 ， 杨 七七 的 母亲 ， 杨明 的 妻子 之一 。,王笑 嫣 人物一 师娘  杨 七七 母亲  人物二 妻子,-1,0
TRAIN_SENT_ID_252628,颜回,孔子,孔子 出 ， 以告 颜回 曰 ： “ 丘之于 道 也 ， 其 犹 醯 鸡 与 ( 27 ) ！,人物二 出  以告 人物一 曰   丘之于 道  犹 醯 鸡,-1,-1
TRAIN_SENT_ID_277582,上官兰心,上官梅儿,上官梅儿 （ 女一号 ） ： 上官兰心 的 结拜 姐妹 ， 聪明伶俐 乖巧 ， 外表美丽 ， 蕙质兰心 ， 琴艺 高超 。,人物二  女一号   人物一 结拜 姐妹  聪明伶俐 乖巧  外表美丽  蕙质兰心  琴艺 高超,1,0
TRAIN_SENT_ID_266220,蓝提斯,谢加图,谢加图 之弟 蓝提斯 及其 好友 伊格尔 怀着 各自 的 目的 ， 探求 “ 支柱 之 路 ” 的 秘密 。,人物二 之弟 人物一 好友 伊格尔 怀着 目的  探求  支柱 路  秘密,1,0
TRAIN_SENT_ID_276999,樊迟,孔子,敬鬼神而远之 成语 出处 : 春秋 · 鲁 · 孔子 《 论语 · 雍 也 》 ： 樊迟 问知 ， 子 曰 ： “ 务民之义 ， 敬鬼神而远之 ， 可谓 知矣 。 ”,敬鬼神而远之 成语 出处  春秋  鲁  人物二  论语  雍   人物一 问知  子 曰   务民之义  敬鬼神而远之  可谓 知矣,-1,-1
TRAIN_SENT_ID_269441,刘伟,马季,《 一仆二主 》 表演者 ： 马季 、 刘伟 、 赵炎,一仆二主  表演者  人物二  人物一  赵炎,-1,0
TRAIN_SENT_ID_250355,赵飞燕,赵合德,在 这样 的 理论指导 下 ， 他 长期 与 外戚 集团 王氏 对立 ， 也 曾 进言 阻止 赵飞燕 、 赵合德 姐妹 晋封 。,理论指导  长期 外戚 集团 王氏 对立  进言 阻止 人物一  人物二 姐妹 晋封,1,-1
TRAIN_SENT_ID_250584,鲁西西,皮皮鲁,皮皮鲁 和 鲁西西 有 许多 好玩 的 经历 ， 都 收集 在 30 卷 《 郑渊洁 童话 全集 》 里 .,人物二 人物一 好玩 经历  收集  卷  郑渊洁 童话 全集  里,1,0
TRAIN_SENT_ID_257028,洪敬尧,洪荣宏,我们 约 好 常常 喜乐 08 旧情绵绵 : 林慧萍 、 洪荣宏 、 洪敬尧,约 常常 喜乐  旧情绵绵  林慧萍  人物二  人物一,1,0
TRAIN_SENT_ID_252803,颜回,孔子,◎ 孔子 误解 颜回,◎ 人物二 误解 人物一,-1,0
TRAIN_SENT_ID_251511,陈辅,陈靖仇,经过 一连串 争夺 后 ， 因为 宇文拓 挟持 了 陈辅 为 人质 ， 陈靖仇 只好 而 交出 了 自己 拥有 的 所有 神器 。,一连串 争夺  宇文拓 挟持 人物一 人质  人物二 只好 交出 拥有 神器,-1,0
TRAIN_SENT_ID_249075,吕洞宾,韩湘子,早先 ， 道士 在 庙会 期间 弹唱 竹琴 《 韩湘子 》 、 《 吕洞宾 成仙 》 ， 是 为了 宣传 道教 教义 。,早先  道士 庙会 期间 弹唱 竹琴  人物二    人物一 成仙   宣传 道教 教义,-1,0
TRAIN_SENT_ID_255490,罗成,秦琼,李世民 、 罗成 、 程咬金 、 秦琼 等 众 英雄 最终 识破阴谋 ， 力战 突出重围 。,李世民  人物一  程咬金  人物二 众 英雄 最终 识破阴谋  力战 突出重围,1,0
