sent_id,entity1,entity2,sent,processed_sent,label,hard_match
TRAIN_SENT_ID_282999,卢宗道,卢怀道,卢宗道 ， 卢怀道 之弟 ， 范阳 涿人 也 。,人物一  人物二 之弟  范阳 涿人,1,-1
TRAIN_SENT_ID_251877,曹薰铉,李昌镐,半决赛 ： 曹薰铉 1 : 0 金荣桓 小林觉 1 : 0 李昌镐 1997.3 . 9,半决赛  人物一    金荣桓 小林觉    人物二,-1,0
TRAIN_SENT_ID_257027,洪敬尧,洪荣宏,紧返 来 阮 身边 恋花 11 新 放浪 人生 : 洪荣宏 、 洪敬尧,紧返 阮 身边 恋花  新 放浪 人生  人物二  人物一,1,0
TRAIN_SENT_ID_261675,程英,陆无双,第十五章 程英 和 陆无双,第十五章 人物一 人物二,1,0
TRAIN_SENT_ID_277738,王银钏,王宝钏,王 金钏 角色 资料 : 相府 大 小姐 ， 苏龙 妻子 ， 王宝钏 和 王银钏 的 大姐 。,王 金钏 角色 资料  相府 小姐  苏龙 妻子  人物二 人物一 大姐,1,0
TRAIN_SENT_ID_260586,金敬姬,金正日,金正日 进行 的 当地 视察 几乎 都 有 金敬姬 陪同 。,人物二 进行 视察 几乎 人物一 陪同,1,0
TRAIN_SENT_ID_282635,胡和生,苏步青,苏步青 谷超豪 、 胡和生,人物二 谷超豪  人物一,-1,0
TRAIN_SENT_ID_252374,颜回,孔子,四 颜回 传承 孔子 心法,四 人物一 传承 人物二 心法,-1,0
TRAIN_SENT_ID_267451,唐继虞,唐继尧,原来 是 黄绍竑 从 梧州 打 来 急电 ， 告知 云南 唐继尧 令其弟 唐继虞 率 大军 围逼 柳州 ， 要 白崇禧 救援 。,原来 黄绍竑 梧州 急电  告知 云南 人物二 令其弟 人物一 率 大军 围逼 柳州  白崇禧 救援,1,0
TRAIN_SENT_ID_266030,贾珍,贾惜春,贾惜春 - - - - 贾珍 的 胞妹 。,人物二     人物一 胞妹,1,0
TRAIN_SENT_ID_267508,裘千丈,裘千仞,《 射雕 英雄传 》 裘千仞 / 裘千丈 （ 李彧 饰 ） 、 马钰 （ 李心敏 饰 ）,射雕 英雄传  人物二  人物一  李彧 饰   马钰  李心敏 饰,1,0
TRAIN_SENT_ID_286567,姬无命,公孙乌龙,捉到 的 人 ： 姬无命 、 姬无病 、 平谷 一点红 、 辛普森 、 公孙乌龙 、 马卓子 、 大嘴 的 骗子 师父,捉到  人物一  姬无病  平谷 一点红  辛普森  人物二  马卓子  大嘴 骗子 师父,-1,0
TRAIN_SENT_ID_255362,贾午,贾南风,贾南风 最初 曾经 假装 有孕 ， 实则 取 来 贾午 与 韩寿 之子 韩慰 祖 ， 宣称 这 是 她 在 晋武帝 丧 期内 所 生之子 ， 不曾 公开 。,人物二 最初 曾经 假装 有孕  实则 取 人物一 韩寿 之子 韩慰 祖  宣称 晋武帝 丧 期内 生之子  不曾 公开,1,0
TRAIN_SENT_ID_261567,南宫敬叔,孟懿子,孔子 私学 的 学生 主要 是 由 平民 所 组成 的 ﹐ 据近 人 考证 ﹐ 孔子 学生 真正 来自 贵族 的 ﹐ 只有 南宫敬叔 ﹑ 司马 牛 和 孟懿子 等 少数几 人 。,孔子 私学 学生 主要 平民 组成 ﹐ 据近 考证 ﹐ 孔子 学生 真正 贵族 ﹐ 人物一  司马 牛 人物二 少数几,1,-1
TRAIN_SENT_ID_272356,文殊广法天尊,金吒,门内 ： 金吒 黄飞虎 殷郊 殷洪 文殊广法天尊,门内  人物二 黄飞虎 殷郊 殷洪 人物一,-1,0
TRAIN_SENT_ID_273631,马阔海,马青山,召唤 人 ： 萧风 （ 主要 ） 、 端木燕 （ 后期 ） 、 马青山 （ 大结局 ） 、 马阔海 （ 电影版 ）,召唤  萧风  主要   端木燕  后期   人物二  大结局   人物一  电影版,1,1
TRAIN_SENT_ID_266139,李昌镐,曹薰铉,李昌镐 执黑 7 目半胜 曹薰铉,人物一 执黑  目半胜 人物二,-1,0
TRAIN_SENT_ID_279040,张福龙,陈亿丰,张福龙 本名 ： 陈亿丰,人物一 本名  人物二,-1,0
TRAIN_SENT_ID_259388,温策,温慧,温策 ： 犯妇 温慧 ， 曾 在 胜州 自称为 蜀山 派 做事 ， 适才 在 山下 被 我 捉拿 ， 旋即 逃脱 ， 我 料定 她 逃 上 蜀山 藏匿 。,人物一  犯妇 人物二  胜州 自称为 蜀山 派 做事  适才 山下 捉拿  旋即 逃脱  料定 逃 蜀山 藏匿,1,0
TRAIN_SENT_ID_251826,梅超风,黄药师,黄药师 爱上 梅超风,人物二 爱上 人物一,-1,0
TRAIN_SENT_ID_271196,张翠山,张三丰,说 张三丰 传 张松溪 及 张翠山 ， 再傅 宋远桥 ， 名 十三 式 。,说 人物二 传 张松溪 人物一  再傅 宋远桥  名 十三 式,-1,-1
TRAIN_SENT_ID_272655,邢德全,邢夫人,【 邢德全 】 邢夫人 的 胞弟 ， 只知 吃喝嫖赌 ， 不务正业 ， 呆气 十,人物一  人物二 胞弟  只知 吃喝嫖赌  不务正业  呆气 十,1,-1
TRAIN_SENT_ID_249529,李蔡,李广,而 他 的 堂兄弟 李蔡 才能 不如 他 却 官至 丞相 ， 古人 认为 奇数 不 吉利 ， 司马迁 评价 为 “ 李广 老 ， 数奇 。 ”,堂兄弟 人物一 官至 丞相  古人 认为 奇数 吉利  司马迁 评价  人物二 老  数奇,1,0
TRAIN_SENT_ID_260722,王重阳,全真七子,王重阳 与 全真七子 （ 长春 子 丘处机 、 玉阳子 王处一 、 广宁子 郝大通 、,人物一 人物二  长春 子 丘处机  玉阳子 王处一  广宁子 郝大通,-1,0
TRAIN_SENT_ID_266158,李昌镐,曹薰铉,围棋 定式 韩国 著名 高手 : 韩国 四老 天王 ： 李昌镐 、 曹薰铉 、 徐奉洙 、 刘昌赫,围棋 定式 韩国 著名 高手  韩国 四老 天王  人物一  人物二  徐奉洙  刘昌赫,-1,0
TRAIN_SENT_ID_272359,文殊广法天尊,金吒,王魔 追赶 逃亡 的 姜子牙 到 五龙山 云霄 洞 ， 被 文殊广法天尊 、 金吒 师徒 所杀 。,王魔 追赶 逃亡 姜子牙 五龙山 云霄 洞  人物一  人物二 师徒 所杀,-1,0
TRAIN_SENT_ID_278219,张恭庆,张怡,张恭庆 、 张恭 慈和 张怡 在 捐赠 仪式 上,人物一  张恭 慈和 人物二 捐赠 仪式,1,0
TRAIN_SENT_ID_249559,李蔡,李广,何况 李广 、 李蔡 都 是 成纪 人 。,人物二  人物一 成纪,1,0
TRAIN_SENT_ID_249108,吕洞宾,韩湘子,丽珠 与 韩湘子 订婚 之夜 ， 龙三 前来 抢人 ， 被 吕洞宾 赶退 。,丽珠 人物二 订婚 之夜  龙三 前来 抢人  人物一 赶退,-1,0
TRAIN_SENT_ID_261707,汤镇业,汤镇宗,《 王者 清风 》 主演 ： 何晟铭 蒋梦婕 汤镇宗 汤镇业 导演 ： 何澍培,王者 清风  主演  何晟铭 蒋梦婕 人物二 人物一 导演  何澍培,1,0
TRAIN_SENT_ID_251542,楚碧痕,楚寒镜,96 双胞胎 楚寒镜 楚碧痕,双胞胎 人物二 人物一,1,0
TRAIN_SENT_ID_277739,王银钏,王宝钏,角色 资料 : 相府 大 小姐 ， 苏龙 妻子 ， 王宝钏 和 王银钏 的 大姐 。,角色 资料  相府 小姐  苏龙 妻子  人物二 人物一 大姐,1,0
TRAIN_SENT_ID_264202,陈真,霍元甲,《 霍元甲 》 饰 陈真 （ 同期 演员 ： 赵文卓 、 梅婷 ）,人物二  饰 人物一  同期 演员  赵文卓  梅婷,-1,0
TRAIN_SENT_ID_264554,胡青牛,张无忌,在 被 张无忌 救活 以后 ， 胡青牛 夫妇 决定 驾车 离开 蝴蝶谷 。,人物二 救活 以后  人物一 夫妇 决定 驾车 离开 蝴蝶谷,-1,0
TRAIN_SENT_ID_269567,辛敞,辛宪英,辛敞 畏惧 于 形势 ， 不知所措 ， 便 向 辛宪英 请教 。,人物一 畏惧 形势  不知所措  便 人物二 请教,1,0
TRAIN_SENT_ID_265109,杨志刚,郭靖宇,郭靖宇 还是 演员 杨志刚 的 哥哥 ， 亲哥哥 。,人物二 演员 人物一 哥哥  亲哥哥,1,0
TRAIN_SENT_ID_263398,武修文,武敦儒,靖 、 蓉 为 寻找 黄药师 ， 巧遇 武三通 之子 武敦儒 、 武修文 ， 杨康之 子 杨过 。,靖  蓉 寻找 黄药师  巧遇 武三通 之子 人物二  人物一  杨康之 子 杨过,1,0
TRAIN_SENT_ID_250721,鲁西西,皮皮鲁,其 代表作 有 《 童话 大王 》 《 舒克和贝塔 》 《 皮皮鲁 和 鲁西西 》 《 魔方 大厦 》,代表作  童话 大王   舒克和贝塔   人物二 人物一   魔方 大厦,1,0
TRAIN_SENT_ID_252518,颜回,孔子,殿内 供奉 孔子 五代 先人 的 牌位 及 配享 的 颜回 、 孔伋 、 曾 参 、 孟轲 四位 先哲 之父 的 牌位 。,殿内 供奉 人物二 五代 先人 牌位 配享 人物一  孔伋  参  孟轲 四位 先哲 之父 牌位,-1,0
TRAIN_SENT_ID_264224,陈真,霍元甲,有 传说 霍元甲 被 日本 人下 毒药 害死 之后 ， 他 的 爱徒 陈真 替 他 报仇 。,传说 人物二 日本 人下 毒药 害死 之后  爱徒 人物一 报仇,-1,-1
TRAIN_SENT_ID_262273,尤二姐,尤三姐,第六十五回 贾二舍 偷 娶 尤二姐 尤三姐 思嫁 柳 二郎 / 371,第六十五回 贾二舍 偷 娶 人物一 人物二 思嫁 柳 二郎,1,0
TRAIN_SENT_ID_270576,全真七子,王重阳,万寿宫 为 主体 建筑 ， 宫内 塑有 全真道 祖 王重阳 及 全真七子 像 。,万寿宫 主体 建筑  宫内 塑有 全真道 祖 人物二 人物一,-1,0
TRAIN_SENT_ID_267718,裴元庆,裴翠云,第三十一回 裴元庆 怒 投 瓦岗寨 程咬金 喜纳 裴翠云 第三十二回 王世充 避祸 画 琼花 麻叔谋 开河 扰 百姓,第三十一回 人物一 怒 投 瓦岗寨 程咬金 喜纳 人物二 第三十二回 王世充 避祸 画 琼花 麻叔谋 开河 扰 百姓,1,0
TRAIN_SENT_ID_271296,吕祖俭,吕祖谦,吕蒙正 的 后辈 多有 名人 ， 如 侄子 吕夷简 ， 侄孙 吕公著 ， 官至 宰相 ， 八 世孙 吕祖谦 、 吕祖俭 都 是 南宋 著名 大儒 。,吕蒙正 后辈 多有 名人  侄子 吕夷简  侄孙 吕公著  官至 宰相  八 世孙 人物二  人物一 南宋 著名 大儒,1,0
TRAIN_SENT_ID_270157,宋师道,宋玉致,家庭 ： 长女 宋玉华 、 次子 宋师道 、 三女 宋玉致 、 二弟 “ 地剑 ” 宋智 、 三弟 “ 银龙 ” 宋鲁 、 长婿 解 文龙 、 次婿 “ 少帅 ” 寇仲,家庭  长女 宋玉华  次子 人物一  三女 人物二  二弟  地剑  宋智  三弟  银龙  宋鲁  长婿 解 文龙  次婿  少帅  寇仲,1,-1
TRAIN_SENT_ID_268451,和硕敦恪公主,和硕温恪公主,海宽 之 女 ， 生 爱新觉罗 · 胤 祥 、 和硕温恪公主 、 和硕敦恪公主 。,海宽 女  生 爱新觉罗  胤 祥  人物二  人物一,1,0
TRAIN_SENT_ID_253073,颜回,孔子,孔子 问 颜回 ， 如何 不种 梅 ？,人物二 问 人物一  不种 梅,-1,0
TRAIN_SENT_ID_272363,钱永刚,钱永真,育有 一子 钱永刚 、 一女 钱永真 。,育有 一子 人物一  一女 人物二,1,0
TRAIN_SENT_ID_276238,张阿生,郭靖,1211 哲别 跟随 成吉思汗 ， 郭靖 、 拖雷 结拜 安达 ， 陈玄风 、 张阿生 卒 。,哲别 跟随 成吉思汗  人物二  拖雷 结拜 安达  陈玄风  人物一 卒,-1,0
TRAIN_SENT_ID_278070,马枪月,谷本夏,其兄 是 擅长 八卦掌 的 马枪月 ， 所以 与 谷本夏 是 ” 师 叔侄 “ 的 关系 ；,其兄 擅长 八卦掌 人物一  人物二  师 叔侄  关系,-1,0
TRAIN_SENT_ID_261163,王缙,王维,又 王缙 《 进王 右 丞 集表 》 云 编次 王维 诗 文凡 10 卷 。,人物一  进王 右 丞 集表  云 编次 人物二 诗 文凡  卷,1,0
TRAIN_SENT_ID_279221,吕馨,吕禄,她 以 可怜 地 表情 对 吕雉 说 她 还 不想 死 ， 此时 吕馨 的 表哥 吕禄 来 了 。,可怜 表情 吕雉 说 不想 死  人物一 表哥 人物二,1,0
TRAIN_SENT_ID_285891,班淑娴,白鹿子,班淑娴 和 何太冲 两人 的 师父 白鹿子 死 在 明教 人 的 手里 ， 真凶 是 谁 虽 不 确知 ， 但 昆仑 派众 同门 一向 都 猜想 就是 杨逍 。,人物一 何太冲 两人 师父 人物二 死 明教 手里  真凶 确知  昆仑 派众 同门 一向 猜想 杨逍,-1,-1
TRAIN_SENT_ID_270560,全真七子,王重阳,吕 祖传 道 于 王重阳 — — 马丹阳 等 “ 全真七子 ” 一脉相承 ， 是 为 北宗 也 。,吕 祖传 道 人物二   马丹阳  人物一  一脉相承  北宗,-1,0
TRAIN_SENT_ID_249138,皮皮鲁,鲁西西,皮皮鲁 赞许 道 ， 我 妹妹 鲁西西 呢 ？,人物一 赞许 道  妹妹 人物二,1,1
TRAIN_SENT_ID_255457,罗成,秦琼,此书 还 首次 给 罗艺 添加 了 一个 虚构 的 儿子 罗成 和 夫人 秦氏 ， 秦琼 成 了 罗艺 的 侄子 。,此书 首次 罗艺 添加 一个 虚构 儿子 人物一 夫人 秦氏  人物二 成 罗艺 侄子,1,0
TRAIN_SENT_ID_267791,万剑一,林惊羽,先后 由 斩 龙剑 的 两代 主人 万剑一 、 林惊羽 把守 。,先后 斩 龙剑 两代 主人 人物一  人物二 把守,-1,0
TRAIN_SENT_ID_255313,卫夫人,王羲之,（ 词语 ） : 晋 王羲之 《 题 卫夫人 笔阵 图后 》 ： “ 每作 一点 ， 如 高峰 坠石 。 ”,词语   晋 人物二  题 人物一 笔阵 图后    每作 一点  高峰 坠石,-1,0
TRAIN_SENT_ID_264880,赵一楠,赵一涵,妻子 马丽娟 ， 辽宁省 戏校 教师 ， 育有 一对 龙凤 双胞胎 ： 赵一楠 和 赵一涵 。,妻子 马丽娟  辽宁省 戏校 教师  育有 一对 龙凤 双胞胎  人物一 人物二,1,0
TRAIN_SENT_ID_256924,仲由,孔子,孔子 不禁 叹 到 ： “ 神童 仲由 乃 吾师 也 ” 。,人物二 不禁 叹   神童 人物一 吾师,-1,0
TRAIN_SENT_ID_249235,皮皮鲁,鲁西西,皮皮鲁 、 鲁西西 、 罗克 、 舒克 、 贝塔 是 他 笔下 文学 形象 。,人物一  人物二  罗克  舒克  贝塔 笔下 文学 形象,1,0
TRAIN_SENT_ID_263407,武修文,武敦儒,师兄 ： 武敦儒 、 武修文,师兄  人物二  人物一,1,0
TRAIN_SENT_ID_273366,杨锐,张之洞,五 、 张之洞 营救 杨锐 的 行动,五  人物二 营救 人物一 行动,-1,0
TRAIN_SENT_ID_257231,张子静,张爱玲,寻访 张子静 ， 再见 张爱玲,寻访 人物一  再见 人物二,1,0
TRAIN_SENT_ID_259936,周志文,周志康,「 超级 巨声 队 」 由 孖 宝兄弟 周志文 、 周志康 上场 献唱 不了情 女曲 男唱 ， 可 有 不同 韵味 ？,超级 巨声 队  孖 宝兄弟 人物一  人物二 上场 献唱 不了情 女曲 男唱  不同 韵味,1,0
TRAIN_SENT_ID_249002,吕洞宾,韩湘子,吕洞宾 介绍 韩湘子 到 学校 任教 ， 巧遇 离家出走 的 丽珠 ， 于是 带 她 回家 暂住 ， 与 荷 仙姑 合力 卖花 ， 自力更生 。,人物一 介绍 人物二 学校 任教  巧遇 离家出走 丽珠  带 回家 暂住  荷 仙姑 合力 卖花  自力更生,-1,-1
TRAIN_SENT_ID_259625,季布,季心,本传除 记述 季布 、 栾布 二人 的 生平事迹 外 ， 还 记载 了 季心 和 丁公 的 事迹 。,本传除 记述 人物一  栾布 二人 生平事迹 外  记载 人物二 丁公 事迹,1,0
TRAIN_SENT_ID_277577,袁承志,穆人清,天外 飞龙 线 雁门关 袁承志 单挑 穆人清 天外 飞龙 1 级,天外 飞龙 线 雁门关 人物一 单挑 人物二 天外 飞龙  级,-1,0
TRAIN_SENT_ID_249168,皮皮鲁,鲁西西,《 皮皮鲁 与 鲁西西 》 等等 !,人物一 人物二,1,0
TRAIN_SENT_ID_271226,和硕温恪公主,和硕敦恪公主,生一子 二女 ： 和硕 怡亲 王允祥 、 和硕温恪公主 、 和硕敦恪公主 。,生一子 二女  和硕 怡亲 王允祥  人物一  人物二,1,0
TRAIN_SENT_ID_249182,皮皮鲁,鲁西西,一个 偶然 的 机会 ， 红 沙发 音乐 城 鲁西西 发现 了 家里 的 红 沙发 上 传出 了 悦耳 的 音乐声 ， 从此 和 皮皮鲁 保守 秘密 ， 如痴如醉 ；,一个 偶然 机会  红 沙发 音乐 城 人物二 发现 家里 红 沙发 传出 悦耳 音乐声  人物一 保守 秘密  如痴如醉,1,0
TRAIN_SENT_ID_252896,颜回,孔子,这一 奇迹 般的 发现 ， 将 孔子 的 游兴 振至 高潮 ， 忙呼 颜回 观望 。,这一 奇迹 发现  人物二 游兴 振至 高潮  忙呼 人物一 观望,-1,0
TRAIN_SENT_ID_250605,鲁西西,皮皮鲁,皮皮鲁 和 鲁西西 剧集 评价 : “ 这部 剧 最 吸引 我 的 是 从小 培养 善良 、 友爱 、 勇敢 、 诚实 等 优秀品质 的 正 能量 。 ”,人物二 人物一 剧集 评价   这部 剧 吸引 从小 培养 善良  友爱  勇敢  诚实 优秀品质 正 能量,1,0
TRAIN_SENT_ID_263923,汤镇宗,汤镇业,《 极致 情感 》 主演 丁宁 合作 演员 电视剧 《 福星 临门 》 饰演 虎子 剧照 韩会亮 汤镇宗 、 汤镇业 合作 导演 蒋少华,极致 情感  主演 丁宁 合作 演员 电视剧  福星 临门  饰演 虎子 剧照 韩会亮 人物一  人物二 合作 导演 蒋少华,1,0
TRAIN_SENT_ID_263649,尹澄,尹夏沫,尹夏沫 演艺 经历 : 与 尹澄 和 洛熙 参加 超级 巨星 ， 唱 《 黑猫 与 牛奶 》 彩虹 广场 上 唱 《 钻石 》,人物二 演艺 经历  人物一 洛熙 参加 超级 巨星  唱  黑猫 牛奶  彩虹 广场 唱  钻石,1,0
TRAIN_SENT_ID_279129,范长利,朱绍文,沈竹善 相声 辈分 表 : 沈竹善 第一代 - - 第三代 : 张三禄 - - 朱绍文 - - 春长隆 、 冯昆治 、 范长利 、 桂祯 、 徐长福 、 沈竹善,沈竹善 相声 辈分 表  沈竹善 第一代   第三代  张三禄   人物二   春长隆  冯昆治  人物一  桂祯  徐长福  沈竹善,-1,0
TRAIN_SENT_ID_252659,颜回,孔子,于是 择地 官山 的 北面 ， 创立 了 燕 居来 供奉 先圣 孔子 ， 先师 颜回 享受 配祀 ， 春秋 持菜 祀 先师 。,择地 官山 北面  创立 燕 居来 供奉 先圣 人物二  先师 人物一 享受 配祀  春秋 持菜 祀 先师,-1,0
TRAIN_SENT_ID_252596,颜回,孔子,颜回 随 孔子 重回 帝丘 ， 途经 蒲邑 ， 又 遭到 蒲人 的 拦截 。,人物一 人物二 重回 帝丘  途经 蒲邑  遭到 蒲人 拦截,-1,0
TRAIN_SENT_ID_275838,陆无双,李莫愁,洪凌波 得到 了 李莫愁 的 真传 ， 武艺 不 弱 ， 在 程英 、 陆无双 姊妹 之上 。,洪凌波 得到 人物二 真传  武艺 弱  程英  人物一 姊妹 之上,-1,0
TRAIN_SENT_ID_249171,皮皮鲁,鲁西西,皮皮鲁 和 鲁西西 用 肥皂 订书机 成功 改写 了 历史 。,人物一 人物二 肥皂 订书机 成功 改写 历史,1,0
TRAIN_SENT_ID_255458,罗成,秦琼,秦琼 的 好 ， 罗成 最 明白 。,人物二  人物一 明白,1,0
TRAIN_SENT_ID_258823,张无忌,殷离,"伪装 受伤 ， 暗地 以 峨嵋 九阳 功反震 殷离 , 故意 放走 张无忌 和 蛛儿",伪装 受伤  暗地 峨嵋 九阳 功反震 人物二  故意 放走 人物一 蛛儿,1,0
TRAIN_SENT_ID_260686,王重阳,全真七子,防御 路线 走 王重阳 ， 全真七子 相应 点灯 。,防御 路线 走 人物一  人物二 相应 点灯,-1,0
TRAIN_SENT_ID_266722,龙幽,龙溟,夜叉 族 摄政王 ， 龙溟 、 龙幽 的 舅舅 。,夜叉 族 摄政王  人物二  人物一 舅舅,1,0
TRAIN_SENT_ID_262723,周厚恩,周厚安,育有 一男一女 ， 分别 是 周厚安 和 周厚恩 。,育有 一男一女  人物二 人物一,1,0
TRAIN_SENT_ID_252787,颜回,孔子,其六 ， 孔子 赞叹 颜回 一 闻师 教 就 能 立刻 去 实行 。,其六  人物二 赞叹 人物一 闻师 教 立刻 实行,-1,0
TRAIN_SENT_ID_275805,石无痕,石无介,"在 苏幻儿 惊世骇俗 的 撮合 戏点 下 , 梁玉石 与 石无痕 渐生 情愫 , 而 色艺双绝 的 青楼女子 秦雨 秋 也 与 石无介 定情 一生 … …",苏幻儿 惊世骇俗 撮合 戏点  梁玉石 人物一 渐生 情愫  色艺双绝 青楼女子 秦雨 秋 人物二 定情 一生,1,0
TRAIN_SENT_ID_282661,张震,张翰,3 评价 : 台湾 的 张翰 是 张震 的 哥哥 。,评价  台湾 人物二 人物一 哥哥,1,0
TRAIN_SENT_ID_263361,武修文,武敦儒,师兄 ： 武修文 、 武敦儒,师兄  人物一  人物二,1,0
TRAIN_SENT_ID_251925,曹薰铉,李昌镐,第 12 届 LG 杯 第一轮 胜 李昌镐 ； 第二轮 胜 曹薰铉,届  杯 第一轮 胜 人物二  第二轮 胜 人物一,-1,0
TRAIN_SENT_ID_250377,赵飞燕,赵合德,- 前 7 ） 即 赵合德 ， 赵飞燕 妹 。,前   人物二  人物一 妹,1,0
TRAIN_SENT_ID_274683,冯国纶,冯国经,第十一章 冯国经 、 冯国纶 的 经营 管理 哲学,第十一章 人物二  人物一 经营 管理 哲学,1,0
TRAIN_SENT_ID_253849,赵合德,赵飞燕,红颜 祸水 汉成帝 刘骜 皇后 赵飞燕 、 昭仪 赵合德 姐妹,红颜 祸水 汉成帝 刘骜 皇后 人物二  昭仪 人物一 姐妹,1,0
TRAIN_SENT_ID_249180,皮皮鲁,鲁西西,皮皮鲁 冒着危险 ， 在 朋友 们 的 帮助 下 救出 了 被 仙人掌 老 怪 吞进 肚子 里 的 鲁西西 。,人物一 冒着危险  朋友 帮助 救出 仙人掌 老 怪 吞进 肚子 里 人物二,1,0
TRAIN_SENT_ID_273620,马阔海,马青山,召唤 人 ： 端木燕 （ 主要 铠甲 召唤 人 ） 、 马青山 、 马阔海,召唤  端木燕  主要 铠甲 召唤   人物二  人物一,1,1
TRAIN_SENT_ID_250657,鲁西西,皮皮鲁,皮皮鲁 和 鲁西西 有 许多 好玩 的 经历 ， 都 收集 在 30 卷 《 郑渊洁 童话 全集 》 里 。,人物二 人物一 好玩 经历  收集  卷  郑渊洁 童话 全集  里,1,0
TRAIN_SENT_ID_249216,皮皮鲁,鲁西西,他们 在 瓜国里 没有 找 鲁西西 的 笑容 ， 皮皮鲁 却 帮助 笑 不出 声儿 的 瓜民们 恢复 了 笑声 。,瓜国里 没有 找 人物二 笑容  人物一 帮助 笑 不出 声儿 瓜民们 恢复 笑声,1,0
TRAIN_SENT_ID_249232,皮皮鲁,鲁西西,并且 ， 红 沙发 音乐 城帮 他们 谱写 了 课本 的 背景音乐 ， 皮皮鲁 成绩 飞速上升 ， 鲁西西 更是 锦上添花 ；,红 沙发 音乐 城帮 谱写 课本 背景音乐  人物一 成绩 飞速上升  人物二 更是 锦上添花,1,0
TRAIN_SENT_ID_250396,赵飞燕,赵合德,皇帝 专宠 赵合德 后 ， 赵飞燕 就 在 后宫 找 男宠 。,皇帝 专宠 人物二  人物一 后宫 找 男宠,1,0
TRAIN_SENT_ID_253144,颜回,孔子,列子 · 仲尼 篇 第四 部分 : 列子 · 仲尼 篇 原文 : 子夏问 孔子 曰 ： “ 颜回 ① 之为 人 奚若 ？ ”,列子  仲尼 篇 第四 部分  列子  仲尼 篇 原文  子夏问 人物二 曰   人物一 ① 之为 奚若,-1,0
TRAIN_SENT_ID_263404,武修文,武敦儒,主要 原因 与 郭靖 专心 守城 ， 而 无暇 教 武敦儒 、 武修文 练武 相关 。,主要 原因 郭靖 专心 守城  无暇 教 人物二  人物一 练武 相关,1,1
TRAIN_SENT_ID_271533,孟优,孟获,【 全新 BOSS 】 阿会喃 、 董荼那 、 孟优 、 木鹿 大王 、 祝融 夫人 以及 西南 霸主 孟获 都 将 在 更新 之后 重装 登场 ！,全新   阿会喃  董荼那  人物一  木鹿 大王  祝融 夫人 西南 霸主 人物二 更新 之后 重装 登场,1,0
TRAIN_SENT_ID_272355,文殊广法天尊,金吒,李靖 答 曰 ： “ 不才 有 三子 ： 长 曰 金吒 ， 拜 五龙山 云霄 洞 文殊广法天尊 为师 ； 次 曰 木吒 ， 拜 九宫山 白鹤 洞 普贤 真人 为师 。,李靖 答 曰   不才 三子  长 曰 人物二  拜 五龙山 云霄 洞 人物一 为师  次 曰 木吒  拜 九宫山 白鹤 洞 普贤 真人 为师,-1,-1
TRAIN_SENT_ID_252632,颜回,孔子,颜回 对待 孔子 如同 曾 参 侍奉 父亲 一样 。,人物一 人物二 参 侍奉 父亲,-1,0
TRAIN_SENT_ID_257476,姜昆,马季,调演 结束 后 ， 姜昆 如愿以偿 ， 投身 到 马季 麾下 ， 师胜杰 则 黯然 地 回到 了 北大荒 ， 继续 干 他 的 “ 农工 ” 。,调演 结束  人物一 如愿以偿  投身 人物二 麾下  师胜杰 黯然 回到 北大荒  继续 干  农工,-1,0
TRAIN_SENT_ID_258123,孙少安,孙兰香,但是 他 最大 的 成就 不 在 这些 事情 上 ， 他 最大 的 成就 在于 他 “ 培养 ” 出 了 孙少安 、 孙少平 和 孙兰香 三个 优秀 的 子女 。,最大 成就 事情  最大 成就  培养  出 人物一  孙少平 人物二 三个 优秀 子女,1,0
TRAIN_SENT_ID_261689,程英,陆无双,杨过 为何 爱 小龙女 不爱 郭襄 、 郭 芙 、 程英 、 陆无双 、 公孙绿萼 、 耶律燕 ？,杨过 爱 小龙女 不爱 郭襄  郭 芙  人物一  人物二  公孙绿萼  耶律燕,1,0
TRAIN_SENT_ID_283833,蔡壎,蔡瑁,蔡瑁 令弟 蔡壎 前进 。,人物二 令弟 人物一 前进,1,0
TRAIN_SENT_ID_249284,陆无双,程英,洪凌波 得到 了 李莫愁 的 真传 ， 武艺 不 弱 ， 在 程英 陆无双 姊妹 之上 。,洪凌波 得到 李莫愁 真传  武艺 弱  人物二 人物一 姊妹 之上,1,0
TRAIN_SENT_ID_250723,鲁西西,皮皮鲁,皮皮鲁 、 鲁西西 、 罗克 、 舒克和贝塔 是 他 笔下 塑造 的 形象 。,人物二  人物一  罗克  舒克和贝塔 笔下 塑造 形象,1,0
TRAIN_SENT_ID_257798,林平之,岳不群,令狐冲 曾以 独孤九剑 击败 田伯光 ， 刺 瞎 十五名 黑道 高手 的 双目 ， 赢过 任我行 、 冲虚道长 、 岳不群 、 林平之 。,令狐冲 曾以 独孤九剑 击败 田伯光  刺 瞎 十五名 黑道 高手 双目  赢过 任我行  冲虚道长  人物二  人物一,-1,0
TRAIN_SENT_ID_252675,颜回,孔子,： 颜回 对待 孔子 如同 曾 参 侍奉 父亲 一样 。,人物一 人物二 参 侍奉 父亲,-1,0
TRAIN_SENT_ID_265421,薛谭,秦青,据 《 列子 · 汤问 》 记载 ， 秦青 曾收 薛谭 为徒 。,列子  汤问  记载  人物二 曾收 人物一 为徒,-1,-1
TRAIN_SENT_ID_254287,张顺,张横,张横 道 ： “ 小弟 是 张顺 。,人物二 道   小弟 人物一,1,0
TRAIN_SENT_ID_249093,吕洞宾,韩湘子,韩湘子 吹玉 萧 ， 吕洞宾 击 云板 ( 简板 ) ， 钟离权 拍 渔鼓 应节 而歌 。,人物二 吹玉 萧  人物一 击 云板  简板   钟离权 拍 渔鼓 应节 而歌,-1,0
TRAIN_SENT_ID_249270,皮皮鲁,鲁西西,丛书 名 : 皮皮鲁 总动员 / 鲁西西 系列,丛书 名  人物一 总动员  人物二 系列,1,0
TRAIN_SENT_ID_263380,武修文,武敦儒,三流 奶 ： 瑛 姑 、 天竺 高僧 、 武敦儒 、 武修文 、 陆立鼎 。,三流 奶  瑛 姑  天竺 高僧  人物二  人物一  陆立鼎,1,0
TRAIN_SENT_ID_251910,曹薰铉,李昌镐,副帅 之战 ， 常昊 力挫 韩国 围棋 皇帝 曹薰铉 ， 直奔 韩国 的 农心杯 定海神针 李昌镐 阵前 。,副帅 之战  常昊 力挫 韩国 围棋 皇帝 人物一  直奔 韩国 农心杯 定海神针 人物二 阵前,-1,0
