sent_id,sent_id,entity1,entity2,sent,processed_sent,label
TRAIN_SENT_ID_262599,,蔡五熊,蔡云寒,"《 终极 一班 》 中 蔡云寒 ( 蔡函 岑饰 ) 和 蔡五熊 ( 蔡宜臻饰 ) 姐妹 , 扮演者 也 是 姐妹 .",终极 一班  中 人物二  蔡函 岑饰  人物一  蔡宜臻饰  姐妹  扮演者 姐妹,1
TRAIN_SENT_ID_284073,,华传萍,尤彩云,女 加官 ， 由五旦 应工 ， “ 传 ” 宇辈为 尤彩云 所教 ， 跳者 有 华传萍 、 姚传芽 、 王传 渠 等 。,女 加官  由五旦 应工   传  宇辈为 人物二 所教  跳者 人物一  姚传芽  王传 渠,-1
TRAIN_SENT_ID_279110,,王维筠,金仲仁,金仲仁 收 王维秋 、 王维筠 为徒 。,人物二 收 王维秋  人物一 为徒,-1
TRAIN_SENT_ID_253862,,赵合德,赵飞燕,汉成帝 宠幸 的 赵飞燕 、 赵合德 姐妹 即住 在 昭阳 宫 。,汉成帝 宠幸 人物二  人物一 姐妹 即住 昭阳 宫,1
TRAIN_SENT_ID_268889,,司徒静,司徒剑南,司徒剑南 第二集 : 司徒静 骗过 衙役 逃走 ， 朱允 和 白云飞 被 误认为 是 强盗 。,人物二 第二集  人物一 骗过 衙役 逃走  朱允 白云飞 误认为 强盗,1
TRAIN_SENT_ID_250590,,鲁西西,皮皮鲁,《 皮皮鲁 》 画报 每期 有 《 皮皮鲁 的 故事 》 和 《 鲁西西 的 故事 》 系列 连环画 。,人物二  画报 每期  人物二 故事   人物一 故事  系列 连环画,1
TRAIN_SENT_ID_282078,,陈长兴,陈秉旺,陈秉旺 与 陈长兴 168,人物二 人物一,-1
TRAIN_SENT_ID_253894,,赵合德,赵飞燕,小聪明 害死 人 — — 赵飞燕 赵合德 姐妹,小聪明 害死   人物二 人物一 姐妹,1
TRAIN_SENT_ID_259522,,梅超风,杨康,梅超风 归云庄 上 : 杨康 被 陆乘风 抓获 ， 托付 穆念慈 求救 于 梅超风 。,人物一 归云庄  人物二 陆乘风 抓获  托付 穆念慈 求救 人物一,-1
TRAIN_SENT_ID_276219,,姜丽文,姜文杰,名人 之后 队 ： 洪天明 、 原子鏸 、 黄宇诗 、 姜文杰 、 姜丽文,名人 之后 队  洪天明  原子鏸  黄宇诗  人物二  人物一,1
TRAIN_SENT_ID_274686,,冯国纶,冯国经,冯国经 、 冯国纶 兄弟 / VictorWilliamFung,人物二  人物一 兄弟,1
TRAIN_SENT_ID_286487,,田法忠,李梓源,当代 代表 人物 ： 张明文 、 李梓源 、 田法忠 、 王一君 、 赵新建 等 。,当代 代表 人物  张明文  人物二  人物一  王一君  赵新建,-1
TRAIN_SENT_ID_277573,,袁承志,穆人清,穆人清 原文 描写 : 林家栋 版 穆人清 （ 谷峰 饰 ） 袁承志 心中 一动 ， 暗想 ： 「 师父 使 的 果然 都 是 十段 锦 身法 ， 但 他 怎能 如此 快法 ？,人物二 原文 描写  林家栋 版 人物二  谷峰 饰  人物一 心中 一动  暗想   师父 十段 锦 身法  怎能 快法,-1
TRAIN_SENT_ID_262226,,尤二姐,尤三姐,红楼 二 尤 人物 评析 : 与 尤二姐 的 懦弱 、 屈辱 、 糊涂 、 和善 相对 比 的 是 尤三姐 ， 她 是 刚烈 、 自尊 、 清醒 、 泼辣 的 。,红楼 二 尤 人物 评析  人物一 懦弱  屈辱  糊涂  和善 相对 人物二  刚烈  自尊  清醒  泼辣,1
TRAIN_SENT_ID_252710,,颜回,孔子,孔子 与 颜回 的 这段 谈话 完全 出自 假托 。,人物二 人物一 这段 谈话 完全 出自 假托,-1
TRAIN_SENT_ID_269724,,薛洋,薛之荔,薛洋 、 薛之荔 的 父亲 ， 富商 ， 性格内向 ， 沉稳 ， 手下 对 他 都 很 忠心 。,人物一  人物二 父亲  富商  性格内向  沉稳  手下 忠心,1
TRAIN_SENT_ID_277582,,上官兰心,上官梅儿,上官梅儿 （ 女一号 ） ： 上官兰心 的 结拜 姐妹 ， 聪明伶俐 乖巧 ， 外表美丽 ， 蕙质兰心 ， 琴艺 高超 。,人物二  女一号   人物一 结拜 姐妹  聪明伶俐 乖巧  外表美丽  蕙质兰心  琴艺 高超,1
TRAIN_SENT_ID_275809,,白兔公子,彭祖,秀眉 公 人物 简介 : 彭祖 有 8 大 弟子 ： 青衣 乌公 、 黑穴公 、 秀眉 公 、 白兔公子 、 离患公 、 太足君 、 高丘子 、 不肯 来 。,秀眉 公 人物 简介  人物二  弟子  青衣 乌公  黑穴公  秀眉 公  人物一  离患公  太足君  高丘子  不肯,-1
TRAIN_SENT_ID_250355,,赵飞燕,赵合德,在 这样 的 理论指导 下 ， 他 长期 与 外戚 集团 王氏 对立 ， 也 曾 进言 阻止 赵飞燕 、 赵合德 姐妹 晋封 。,理论指导  长期 外戚 集团 王氏 对立  进言 阻止 人物一  人物二 姐妹 晋封,1
TRAIN_SENT_ID_255315,,卫夫人,王羲之,晋 王羲之 《 题 卫夫人 笔阵 图后 》 ： “ 时年 五十 有 三 ， 或恐 风烛 奄及 ， 遗教 子孙 耳 。 ”,晋 人物二  题 人物一 笔阵 图后    时年 五十 三  或恐 风烛 奄及  遗教 子孙 耳,-1
TRAIN_SENT_ID_269363,,王中军,王中磊,被 “ 伯乐 ” 王中军 发掘 ， 获 王中磊 提携 签约 华谊 兄弟 。,伯乐  人物一 发掘  获 人物二 提携 签约 华谊 兄弟,1
TRAIN_SENT_ID_252803,,颜回,孔子,◎ 孔子 误解 颜回,◎ 人物二 误解 人物一,-1
TRAIN_SENT_ID_285366,,范静,张宝英,近两年来 ， 张宝英 曾 和 贾庭聚 、 范静 多次 合作 此剧 ， 张宝英 饰演 公主 ， 范静 饰演 詹 贵妃 ， 留有 录像 资料 。,近两年来  人物二 贾庭聚  人物一 多次 合作 此剧  人物二 饰演 公主  人物一 饰演 詹 贵妃  留有 录像 资料,-1
TRAIN_SENT_ID_263915,,汤镇宗,汤镇业,香港 无线 五虎将 汤镇业 ： 辉煌 不再 ， 处境 尴尬 : 汤镇业 胖多 了 ， 半秃 的 头顶 ， 看上去 比 他 哥哥 汤镇宗 还要 老 很多 。,香港 无线 五虎将 人物二  辉煌 不再  处境 尴尬  人物二 胖多  半秃 头顶  看上去 哥哥 人物一 老 很多,1
TRAIN_SENT_ID_270821,,伍天锡,伍云召,6 、 双镗 无敌 伍天锡 ， 伍云召 族弟 ， 胯下 青龙 马 ， 掌中 一对 短 把 凤翅 镏金 镗 ， 英勇 无比 ；,双镗 无敌 人物一  人物二 族弟  胯下 青龙 马  掌中 一对 短 凤翅 镏金 镗  英勇 无比,1
TRAIN_SENT_ID_274448,,方如沁,方兰生,百里屠苏 、 方兰生 、 欧阳少恭 、 陵越 、 红玉 、 方如沁 、 孙月言 ： 晴雪,百里屠苏  人物二  欧阳少恭  陵越  红玉  人物一  孙月言  晴雪,1
TRAIN_SENT_ID_283592,,周晓方,孙钟秀,2.13 金志 权 ， 周晓方 ， 孙钟秀 ， “ 多项 选择 和 分布式 排序 ” ， 计算机 学报 ， 1989.4 ， PP241 - 248,金志 权  人物一  人物二   多项 选择 分布式 排序   计算机 学报,-1
TRAIN_SENT_ID_264938,,贾元春,贾宝玉,异母兄弟 姐妹 ： 贾珠 、 贾元春 、 贾宝玉,异母兄弟 姐妹  贾珠  人物一  人物二,1
TRAIN_SENT_ID_250612,,鲁西西,皮皮鲁,皮皮鲁 和 鲁西西 角色 介绍 :,人物二 人物一 角色 介绍,1
TRAIN_SENT_ID_269564,,步鹰,燕双鹰,在 师徒 二人 最后 的 对决 中 ， 燕双鹰 在 被 步鹰 卑鄙 的 使用 奸计 用枪 指着 燕双鹰 的 情况 下 ， 将 飞刀 插进 了 步鹰 的 喉咙 ， 秒杀 了 步鹰 。,师徒 二人 最后 对决 中  人物二 人物一 卑鄙 使用 奸计 用枪 指着 人物二 情况  飞刀 插进 人物一 喉咙  秒杀 人物一,-1
TRAIN_SENT_ID_250343,,赵飞燕,赵合德,四 、 赵飞燕 为 什麼 要 向 成帝 引荐 孪生 妹妹 赵合德 ？,四  人物一 什麼 成帝 引荐 孪生 妹妹 人物二,1
TRAIN_SENT_ID_254249,,张顺,张横,张横 骤马 追上 ， 张顺 急 叫 ： “ 哥哥 休中 他 拖 刀计 ！ ”,人物二 骤马 追上  人物一 急   哥哥 休中 拖 刀计,1
TRAIN_SENT_ID_254251,,张顺,张横,张横 是 水寨 头领 ， 他 和 兄弟 张顺 议定 ： “ 我 和 你 兄弟 两个 ， 自来 寨 中 ， 不曾 建功 。,人物二 水寨 头领  兄弟 人物一 议定   兄弟 两个  自来 寨 中  不曾 建功,1
TRAIN_SENT_ID_268899,,司徒静,司徒剑南,司徒剑南 第十三 集 : 文媚儿 挑拨 安宁公主 ， 安宁 恨透了 司徒静 。,人物二 第十三 集  文媚儿 挑拨 安宁公主  安宁 恨透了 人物一,1
TRAIN_SENT_ID_252853,,颜回,孔子,」 颜回 无以 应 ， 入告 孔子 。,人物一 无以 应  入告 人物二,-1
TRAIN_SENT_ID_265411,,薛谭,秦青,晋 葛洪 《 抱朴子 · 交际 》 ： “ 耻令 谭 （ 薛谭 ） 、 青 （ 秦青 ） 专面 地 之 笃 ， 不使 王 （ 王阳 ） 贡 （ 贡禹 ） 擅弹 冠之美 。 ”,晋 葛洪  抱朴子  交际    耻令 谭  人物一   青  人物二  专面 笃  不使 王  王阳  贡  贡禹  擅弹 冠之美,-1
TRAIN_SENT_ID_250716,,鲁西西,皮皮鲁,皮皮鲁 这个 “ 大侠 ” 成为 了 不 被 鲁西西 信任 的 “ 狗熊 ” 。,人物二  大侠  成为 人物一 信任  狗熊,1
TRAIN_SENT_ID_263359,,武修文,武敦儒,人们 往往 把 武敦儒 、 武修文 以及 耶律齐 与 杨过相 比 ， 因为 他们 是 同辈 的 。,往往 人物二  人物一 耶律齐 杨过相  同辈,1
TRAIN_SENT_ID_255297,,卫夫人,王羲之,晋 王羲之 《 题 卫夫人 （ 笔阵 图 ） 后 》,晋 人物二  题 人物一  笔阵 图,-1
TRAIN_SENT_ID_264944,,贾元春,贾宝玉,八十回 后 之 贾元春 ， 史湘云 嫁 贾宝玉 说 辨 林黛玉 之死 ， 贾宝玉 真的 “ 悬崖撒手 ” 了 吗 ？,八十回 人物一  史湘云 嫁 人物二 说 辨 林黛玉 之死  人物二 真的  悬崖撒手,1
TRAIN_SENT_ID_264213,,陈真,霍元甲,而 “ 陈真 ” 的 师父 ， 新 “ 霍元甲 ” 赵文卓 将 是 该剧 的 武术指导 。,人物一  师父  新  人物二  赵文卓 该剧 武术指导,-1
TRAIN_SENT_ID_276218,,姜丽文,姜文杰,姜文杰 姜丽文,人物二 人物一,1
TRAIN_SENT_ID_257562,,毛泽民,毛泽东,在 另 一位 表叔 — — 毛泽东 的 大弟 毛泽民 的 介绍 下 ， 王德恒 加入 了 中国共产党 。,一位 表叔   人物二 大弟 人物一 介绍  王德恒 加入 中国共产党,1
TRAIN_SENT_ID_264677,,柳承莞,柳承范,柳承莞 ， 柳承范 主演 。,人物一  人物二 主演,1
TRAIN_SENT_ID_270586,,全真七子,王重阳,《 神雕侠侣 》 — 甄志丙 、 王重阳 、 全真七子 、 忽必烈 、 周伯通,神雕侠侣   甄志丙  人物二  人物一  忽必烈  周伯通,-1
TRAIN_SENT_ID_273372,,杨锐,张之洞,二 、 光绪 二十一年 三月 至 二十二年 正月 杨锐 给 张之洞 的 密电 及 光绪 二十二年 正月 给 张之洞 的 密信,二  光绪 二十一年 三月 二十二年 正月 人物一 人物二 密电 光绪 二十二年 正月 人物二 密信,-1
TRAIN_SENT_ID_249117,,皮皮鲁,鲁西西,“ 皮皮鲁 鲁西西 ” 系列 童话剧 《 罐头 小人 》,人物一 人物二  系列 童话剧  罐头 小人,1
TRAIN_SENT_ID_259686,,游颖,游娴,之后 ， 当 她 知道 与 游颖 是 亲生 姊妹 关系 后 ， 当然 高兴 非常 ， 但 游颖 因 被 她 欺骗 ， 显得 很 不忿 ， 幸好 游颖 亦 肯 游娴 剧照 ( 7 张 ),之后  知道 人物一 亲生 姊妹 关系  高兴 非常  人物一 欺骗  显得 不忿  幸好 人物一 肯 人物二 剧照   张,1
TRAIN_SENT_ID_255272,,卫夫人,王羲之,其中 梁武帝 、 钟繇 、 卫夫人 、 王羲之 、 王献之 ， 柳公权 、 欧阳询 、 张旭 等 大 书法家 的 手迹 ， 仍 一一 可睹 。,梁武帝  钟繇  人物一  人物二  王献之  柳公权  欧阳询  张旭 书法家 手迹  一一 可睹,-1
TRAIN_SENT_ID_251415,,李瀚章,李鸿章,光绪 五年 ( 1879 年 ) ， 传忠 书局 刻印 了 由 其 门人 李瀚章 、 李鸿章 编校 的 《 曾文正公 家书 》 ， 一直 流传 到 现在 。,光绪 五年   年   传忠 书局 刻印 门人 人物一  人物二 编校  曾文正公 家书   一直 流传 现在,1
TRAIN_SENT_ID_257547,,毛泽民,毛泽东,周彬 就是 这种 人 ， 他 是 毛泽东 的 弟弟 毛泽民 。 ”,周彬 这种  人物二 弟弟 人物一,1
TRAIN_SENT_ID_259804,,李偲菘,李伟菘,作词 ： 卡斯 作曲 ： 李伟菘 、 李偲菘,作词  卡斯 作曲  人物二  人物一,1
TRAIN_SENT_ID_279427,,文媚儿,文蔷,文媚儿 闻听 文蔷 在 司徒 家 养伤 ， 十分 气愤 。,人物一 闻听 人物二 司徒 家 养伤  十分 气愤,1
TRAIN_SENT_ID_269351,,王中军,王中磊,王中磊 、 王中军,人物二  人物一,1
TRAIN_SENT_ID_250567,,鲁西西,皮皮鲁,皮皮鲁 和 鲁西西 幕后 制作 : 花絮 ( 4 张 ),人物二 人物一 幕后 制作  花絮   张,1
TRAIN_SENT_ID_260701,,王重阳,全真七子,( 4 ) 清静 家风 ： 王重阳 与 全真七子 的 丹法 关要 ， 宗教学 研究 ， 2009 年 03 月,清静 家风  人物一 人物二 丹法 关要  宗教学 研究   年  月,-1
TRAIN_SENT_ID_258161,,刘星,夏雪,于是 在 假期 里 夏雪 当上 了 一名 图书 促销员 ， 刘星 和 夏雨拿 着 表叔 周正 的 头发 搞 拍卖会 ， 夏雪 几经 挫折 ， 最后 取得 了 成功 。,假期 里 人物二 当上 一名 图书 促销员  人物一 夏雨拿 表叔 周正 头发 搞 拍卖会  人物二 几经 挫折  最后 取得 成功,1
TRAIN_SENT_ID_275795,,郑益龙,郑锦城,在 梁伟发 身后 是 一众 武警官兵 ， 其中 就 有 郑益龙 的 弟弟 郑锦城 。,梁伟发 身后 一众 武警官兵  人物一 弟弟 人物二,1
TRAIN_SENT_ID_273361,,杨锐,张之洞,杨锐 百日维新 : 光绪 二十四年 （ 1898 年 ） ， 张之洞 推荐 杨锐 应征 经济 特科 。,人物一 百日维新  光绪 二十四年   年   人物二 推荐 人物一 应征 经济 特科,-1
TRAIN_SENT_ID_265446,,薛谭,秦青,秦青 高兴 地 将 薛谭 扶 起 ， 把 他 领回 。,人物二 高兴 人物一 扶  领回,-1
TRAIN_SENT_ID_257594,,毛泽民,毛泽东,1923 年春 ， 经 毛泽东 介绍 ， 随 毛泽民 去 安源 煤矿 ， 任 工人 俱乐部 消费 合作社 店员 。,年春  人物二 介绍  人物一 安源 煤矿  工人 俱乐部 消费 合作社 店员,1
TRAIN_SENT_ID_270805,,伍天锡,伍云召,第六条 好汉 ： 伍天锡 ， 伍云召 的 族弟 。,第六条 好汉  人物一  人物二 族弟,1
TRAIN_SENT_ID_261158,,王缙,王维,由 王维 弟弟 王缙 编成 10 卷 。,人物二 弟弟 人物一 编成  卷,1
TRAIN_SENT_ID_254247,,张顺,张横,3 精彩 片段 : 生擒 张横 、 张顺,精彩 片段  生擒 人物二  人物一,1
TRAIN_SENT_ID_255331,,卫夫人,王羲之,（ 王羲之 《 题 卫夫人 笔阵 图后 ( 传 ) 》 ”,人物二  题 人物一 笔阵 图后  传,-1
TRAIN_SENT_ID_262221,,尤二姐,尤三姐,2 电影 剧情 : 清朝 康熙 、 乾隆年间 ， 宁国府 纨祷 子弟 贾珍 的 远房亲戚 尤二姐 、 尤三姐 ， 随 母亲 来到 贾府 拜寿 。,电影 剧情  清朝 康熙  乾隆年间  宁国府 纨祷 子弟 贾珍 远房亲戚 人物一  人物二  母亲 来到 贾府 拜寿,1
TRAIN_SENT_ID_249210,,皮皮鲁,鲁西西,皮皮鲁 这个 “ 大侠 ” 成为 了 不 被 鲁西西 信任 的 “ 狗熊 ” 。,人物一  大侠  成为 人物二 信任  狗熊,1
TRAIN_SENT_ID_252605,,颜回,孔子,《 知 人 不易 》 是 关于 孔子 误会 颜回 的 故事 。,知 不易  人物二 误会 人物一 故事,-1
TRAIN_SENT_ID_275922,,钱学渠,钱学森,钱学渠 ， 他 是 钱学森 的 堂弟 。,人物一  人物二 堂弟,1
TRAIN_SENT_ID_250099,,武敦儒,武修文,1237 年 二十九岁 靖 、 蓉 为 寻找 黄药师 ， 巧遇 武三通 之子 武敦儒 、 武修文 、 杨康之 子 杨过 。,年 二十九岁 靖  蓉 寻找 黄药师  巧遇 武三通 之子 人物一  人物二  杨康之 子 杨过,1
TRAIN_SENT_ID_250390,,赵飞燕,赵合德,四 、 两个 女人 ： 赵飞燕 与 赵合德,四  两个 女人  人物一 人物二,1
TRAIN_SENT_ID_261690,,程英,陆无双,义妹 ： 陆无双 、 程英,义妹  人物二  人物一,1
TRAIN_SENT_ID_266319,,贾源,贾演,荣国公 贾源 是 宁国公 贾演 的 弟弟 ， 贾源 死后 他 的 儿子 贾代善 袭 了 他 的 爵位 。,荣国公 人物一 宁国公 人物二 弟弟  人物一 死后 儿子 贾代善 袭 爵位,1
TRAIN_SENT_ID_264264,,陈真,霍元甲,霍元甲 的 徒弟 陈真 九死一生 携带 霍元甲 的 儿子 霍东觉 流浪 江湖 ， 立志 不 忘 师傅 的 骨 培养 成人 ， 以承 父志 … …,人物二 徒弟 人物一 九死一生 携带 人物二 儿子 霍东觉 流浪 江湖  立志 忘 师傅 骨 培养 成人  以承 父志,-1
TRAIN_SENT_ID_249255,,皮皮鲁,鲁西西,在 皮皮鲁 诞生 之后 ， 和 皮皮鲁 相对 的 鲁西西 也 随之 诞生 了 。,人物一 诞生 之后  人物一 相对 人物二 随之 诞生,1
TRAIN_SENT_ID_252592,,颜回,孔子,孔子 望见 颜回 攫其 甑 （ z è ng ） 中而食 之 。,人物二 望见 人物一 攫其 甑   è   中而食,-1
TRAIN_SENT_ID_276141,,贾惜春,贾珍,贾惜春 : 贾惜春 ， 金陵 十二钗 之一 ， 贾珍 的 妹妹 。,人物一  人物一  金陵 十二钗  人物二 妹妹,1
TRAIN_SENT_ID_264247,,陈真,霍元甲,“ 霍元甲 ” “ 陈真 ” 齐 上阵,人物二   人物一  齐 上阵,-1
TRAIN_SENT_ID_259688,,游颖,游娴,游颖 对 继乐 日久生情 ， 当 她 与 游娴 关系 缓和 一点 后 ， 她 终向 游娴 说出 少女 心事 ， 但 却 不知 游娴 对 继乐 亦 有 倾慕 之情 。,人物一 继乐 日久生情  人物二 关系 缓和 一点  终向 人物二 说出 少女 心事  不知 人物二 继乐 倾慕 之情,1
TRAIN_SENT_ID_257575,,毛泽民,毛泽东,1 生平 : 1921 年 毛泽民 随 大哥 毛泽东 参加 革命 后 ， 长期 在外 奔波 ， 很少 回家 。,生平   年 人物一 大哥 人物二 参加 革命  长期 在外 奔波  很少 回家,1
TRAIN_SENT_ID_259730,,李偲菘,李伟菘,作曲 ： 李偲菘 李伟菘,作曲  人物一 人物二,1
TRAIN_SENT_ID_275469,,李汉俊,李书城,所以 李书城 、 李汉俊 与 黄绍兰 相熟 。,人物二  人物一 黄绍兰 相熟,1
TRAIN_SENT_ID_269014,,李如柏,李如松,李如松 的 坐骑 被 敌 火绳 枪手 击毙 ， 李如柏 的 头盔 中弹 ， 兄弟二人 都 置之不顾 ， 愈战愈勇 。,人物二 坐骑 敌 火绳 枪手 击毙  人物一 头盔 中弹  兄弟二人 置之不顾  愈战愈勇,1
TRAIN_SENT_ID_268960,,韩非,荀子,后期 ： 《 荀子 》 《 韩非 子 》 《 吕氏春秋 》,后期   人物二   人物一 子   吕氏春秋,-1
TRAIN_SENT_ID_250427,,赵飞燕,赵合德,然而 ， 赵氏 姐妹 （ 赵飞燕 、 赵合德 ） 的 入宫 ， 改变 了 整个 后宫 的 局面 。,赵氏 姐妹  人物一  人物二  入宫  改变 整个 后宫 局面,1
TRAIN_SENT_ID_266670,,邓鸣贺,邓鸣璐,2012 年 ， 邓鸣贺 不仅 自己 来 了 ， 还 带来 了 同样 萌翻 全场 的 妹妹 邓鸣璐 。,年  人物一  带来 同样 萌翻 全场 妹妹 人物二,1
TRAIN_SENT_ID_261086,,张豪龙,张柏文,弟弟 ： 张柏文 ， 张豪龙,弟弟  人物二  人物一,1
TRAIN_SENT_ID_257589,,毛泽民,毛泽东,1994 《 毛泽东 、 杨开慧 、 毛泽民 等七人 像 》 湖南 韶山,人物二  杨开慧  人物一 等七人  湖南 韶山,1
TRAIN_SENT_ID_253830,,赵合德,赵飞燕,燕 啄 皇孙 : 《 汉书 》 里 记载 成帝 死后 ， 司隶 解光 对 赵合德 杀害 许美人 及 女官 曹宫 之子 的 奏疏 ， 其 动机 是 想 惩罚 赵飞燕 。,燕 啄 皇孙   汉书  里 记载 成帝 死后  司隶 解光 人物一 杀害 许美人 女官 曹宫 之子 奏疏  动机 想 惩罚 人物二,1
TRAIN_SENT_ID_250682,,鲁西西,皮皮鲁,皮皮鲁 能 找回 鲁西西 的 笑容 吗 ？,人物二 找回 人物一 笑容,1
TRAIN_SENT_ID_262597,,蔡五熊,蔡云寒,在 金 时空 ， 蔡云寒 是 蔡五熊 的 姐姐 ， 中途 加入 终极 一班 ， 人称 [ 冷面 冰美人 ] ， 南区 高校 一狠 角色 ， 为 人 不苟言笑 ， 很难 亲近 。,金 时空  人物二 人物一 姐姐  中途 加入 终极 一班  人称  冷面 冰美人   南区 高校 一狠 角色  不苟言笑  很难 亲近,1
TRAIN_SENT_ID_270822,,伍天锡,伍云召,雄阔海 、 伍云召 、 伍天锡 三 将 齐出 ， 迭 杀 隋朝 名将 。,雄阔海  人物二  人物一 三 齐出  迭 杀 隋朝 名将,1
TRAIN_SENT_ID_268460,,单联全,冯一非,编剧 ： 冯一非 、 单联全,编剧  人物二  人物一,-1
TRAIN_SENT_ID_263371,,武修文,武敦儒,在 郭靖 看来 ， 襄阳 的 未来 就 落 在 武敦儒 、 武修文 肩膀 上 。,郭靖 看来  襄阳 未来 落 人物二  人物一 肩膀,1
TRAIN_SENT_ID_259741,,李偲菘,李伟菘,李偲菘 / 李伟菘 / 姚若龙 / 易家扬 / 徐世珍 / 彭学斌 / 严云农,人物一  人物二  姚若龙  易家扬  徐世珍  彭学斌  严云农,1
TRAIN_SENT_ID_282058,,李长乐,李敏峰,锦绣 未央 李敏峰 : 李长乐 的 亲哥哥 ， 一直 追查 未央 身份 。,锦绣 未央 人物二  人物一 亲哥哥  一直 追查 未央 身份,1
TRAIN_SENT_ID_252594,,颜回,孔子,孔子 不 主张 厚葬 颜回 ， 正是 为了 循礼 ， 为了 爱护 颜回 。,人物二 主张 厚葬 人物一  循礼  爱护 人物一,-1
TRAIN_SENT_ID_250340,,赵飞燕,赵合德,大致 写 的 是 汉成帝 与 后妃 赵飞燕 赵合德 的 事情 。,大致 写 汉成帝 后妃 人物一 人物二 事情,1
TRAIN_SENT_ID_262726,,周厚恩,周厚安,育有 一男一女 ， 分别 是 周厚安 和 周厚恩 ， 。,育有 一男一女  人物二 人物一,1
TRAIN_SENT_ID_252695,,颜回,孔子,三国 魏 正始 （ 齐王 曹芳 年号 ， 公元 240 — 248 年 ） 以后 ， 规定 入学 行 祭礼 ， 以 孔子 为 先圣 ， 配 颜回 为 先师 。,三国 魏 正始  齐王 曹芳 年号  公元    年  以后  规定 入学 行 祭礼  人物二 先圣  配 人物一 先师,-1
TRAIN_SENT_ID_253850,,赵合德,赵飞燕,燕赤凤 汉书 中 的 赵飞燕 与 赵合德 两姐妹 : 《 汉书 》 有云 ： “ 自鸿嘉后 ， 上 稍 隆于 内 宠 。,燕赤凤 汉书 中 人物二 人物一 两姐妹   汉书  有云   自鸿嘉后  稍 隆于 宠,1
TRAIN_SENT_ID_265482,,薛蝌,薛蟠,四 薛 ： 薛蟠 、 薛蝌 、 薛宝钗 、 薛宝琴 。,四 薛  人物二  人物一  薛宝钗  薛宝琴,1
TRAIN_SENT_ID_264373,,曾国潢,曾国藩,曾国藩 同治 十年 三月初 三日 写给 曾国潢 、 曾国荃 的 家书,人物二 同治 十年 三月初 三日 写给 人物一  曾国荃 家书,1
TRAIN_SENT_ID_261959,,何冲,何超,三 跳 过后 何冲 以 269.35 排 第一 ， 何超 以 257.10 分列 第二 。,三 跳 过后 人物一  排 第一  人物二  分列 第二,1
TRAIN_SENT_ID_263927,,汤镇宗,汤镇业,父亲 经营 海味 铺 为生 ， 共有 八 兄弟姐妹 ， 汤镇宗 排 第四 ， 其弟 汤镇业 排 第五 。,父亲 经营 海味 铺 为生  共有 八 兄弟姐妹  人物一 排 第四  其弟 人物二 排 第五,1
TRAIN_SENT_ID_257033,,洪敬尧,洪荣宏,洪荣宏 、 洪敬尧,人物二  人物一,1
TRAIN_SENT_ID_255467,,罗成,秦琼,秦琼 、 程咬金 、 罗成 等 也 到达 洛阳 。,人物二  程咬金  人物一 到达 洛阳,1
TRAIN_SENT_ID_249173,,皮皮鲁,鲁西西,皮皮鲁 和 鲁西西 最好 的 朋友 叫 舒克和贝塔 。,人物一 人物二 最好 朋友 舒克和贝塔,1
TRAIN_SENT_ID_255489,,罗成,秦琼,秦琼 、 程咬金 、 罗成 进入 洛阳 是 种 偶然 ， 偶然 的 因素 是 秦琼 、 程咬金 的 家人 留在 老家 ， 罗成 的 母亲 和 妻子 却 跟着 他 出来 旅游 。,人物二  程咬金  人物一 进入 洛阳 种 偶然  偶然 因素 人物二  程咬金 家人 留在 老家  人物一 母亲 妻子 跟着 旅游,1
TRAIN_SENT_ID_260939,,杨露禅,陈长兴,五 、 陈长兴 ： 打破 门规 传艺 杨露禅,五  人物二  打破 门规 传艺 人物一,-1
TRAIN_SENT_ID_272007,,文姜,宣姜,9 . 从 宣姜 到 文姜,人物二 人物一,1
TRAIN_SENT_ID_253906,,赵合德,赵飞燕,赵飞燕 有个 妹妹 叫 赵合德 ， 比 她 更 迷人 ， 也 被 召 进宫 。,人物二 有个 妹妹 人物一  更 迷人  召 进宫,1
TRAIN_SENT_ID_265577,,张崇基,张崇德,"叱咤 乐坛 生力军 组合 ： 金奖 ： 风 火海 银奖 ： GirlFriends 铜奖 ： 张崇基 , 张崇德",叱咤 乐坛 生力军 组合  金奖  风 火海 银奖   铜奖  人物一  人物二,1
TRAIN_SENT_ID_250093,,武敦儒,武修文,在 郭靖 看来 ， 襄阳 的 未来 就 落 在 武敦儒 、 武修文 肩膀 上 。,郭靖 看来  襄阳 未来 落 人物一  人物二 肩膀,1
TRAIN_SENT_ID_281964,,刘作,刘仪,梁王 刘仪 重要 的 家庭成员 ： 兄长 太子 刘 伋 、 周王 刘作 、 齐王 刘 偃 。,梁王 人物二 重要 家庭成员  兄长 太子 刘 伋  周王 人物一  齐王 刘 偃,1
TRAIN_SENT_ID_281650,,黄铁良,侯宝林,黄铁良 艺术人生 : 1950 年 拜 侯宝林 为师 ， 在 相声改进小组 学习 。,人物一 艺术人生   年 拜 人物二 为师  相声改进小组 学习,-1
TRAIN_SENT_ID_268817,,洪凌波,李莫愁,曾斗 之 人 ： 李莫愁 ， 洪凌波 ， 公孙止 ， 完颜萍 等,曾斗  人物二  人物一  公孙止  完颜萍,-1
TRAIN_SENT_ID_253134,,颜回,孔子,2009 年 参演 电视剧 《 孔子 》 饰演 孔子 门生 颜回,年 参演 电视剧  人物二  饰演 人物二 门生 人物一,-1
TRAIN_SENT_ID_263369,,武修文,武敦儒,靖 、 蓉 为 寻找 黄药师 ， 巧遇 武三通 之子 武敦儒 、 武修文 以及 杨康之 子 杨过 。,靖  蓉 寻找 黄药师  巧遇 武三通 之子 人物二  人物一 杨康之 子 杨过,1
TRAIN_SENT_ID_275352,,申公豹,元始天尊,申公豹 : 元始天尊 的 门人 。,人物一  人物二 门人,-1
TRAIN_SENT_ID_265728,,李三思,李三省,3 其它 含义 : 仙剑 中 人物 ， 李三思 、 李三省 、 李寿 之 父 ， 李逍遥 之 祖父 ， 李寒 空 后人 。,含义  仙剑 中 人物  人物一  人物二  李寿 父  李逍遥 祖父  李寒 空 后人,1
