sent_id,sent_id,entity1,entity2,sent,processed_sent,label
TRAIN_SENT_ID_274682,,冯国纶,冯国经,冯国经 商界 成果 : 冯国经 和 弟弟 冯国纶 一起 努力 拼搏 20 年 ， 利丰 打下 了 全球 供应链 整合 的 坚实基础 。,人物二 商界 成果  人物二 弟弟 人物一 一起 努力 拼搏  年  利丰 打下 全球 供应链 整合 坚实基础,1
TRAIN_SENT_ID_265860,,花雄,花木兰,花雄 ， 男 ， 花木兰 的 的 弟弟 。,人物一  男  人物二 弟弟,1
TRAIN_SENT_ID_250363,,赵飞燕,赵合德,成帝 晚年 ， 又 沉溺 声色 ， 与 赵飞燕 、 赵合德 姐妹 纵情 淫乐 ， 将 政事,成帝 晚年  沉溺 声色  人物一  人物二 姐妹 纵情 淫乐  政事,1
TRAIN_SENT_ID_274394,,贾演,贾源,贾代修 一解 ： : 第一代 ： 宁国公 贾演 ， 荣国公 贾源 — — 名字 串连 成 “ 演源 ” ， 判词 是 纲领 ， 曲演 是 简演 ， 假语 村言 是 详演 。,贾代修 一解   第一代  宁国公 人物一  荣国公 人物二   名字 串连 成  演源   判词 纲领  曲演 简演  假语 村言 详演,1
TRAIN_SENT_ID_268198,,章子男,章子怡,章子男 人物 经历 : 章子男 ， 章子怡 的 哥哥 ， 内地 经纪人 ， 原来 的 工作 单 章子男 在 章子怡 的 新闻 发布会 上位 是 电信公司 ， 与 父亲 同一 单位 。,人物一 人物 经历  人物一  人物二 哥哥  内地 经纪人  原来 工作 单 人物一 人物二 新闻 发布会 上位 电信公司  父亲 同一 单位,1
TRAIN_SENT_ID_275677,,周厚安,周厚恩,育有 一男一女 ， 分别 是 周厚安 和 周厚恩 ， 。,育有 一男一女  人物一 人物二,1
TRAIN_SENT_ID_255469,,罗成,秦琼,并 有 秦琼 、 敬德 、 罗成 、 程咬金 伴随 左右 。,人物二  敬德  人物一  程咬金 伴随 左右,1
TRAIN_SENT_ID_253890,,赵合德,赵飞燕,赵飞燕 ， 赵合德 ： 几个 红颜 成 薄命,人物二  人物一  几个 红颜 成 薄命,1
TRAIN_SENT_ID_261588,,宋小宝,赵本山,《 樱桃 》 主要 人物 : 赵本山 徒弟 : 宋小宝 排名第 56 :,樱桃  主要 人物  人物二 徒弟  人物一 排名第,-1
TRAIN_SENT_ID_284015,,田神玉,田神功,己丑 （ 二十日 ） ， 代宗 任命 田神功 的 弟弟 田神玉 为 汴 宋留 后 。,己丑  二十日   代宗 任命 人物二 弟弟 人物一 汴 宋留,1
TRAIN_SENT_ID_256514,,周武,周文,之后 其 世系 失记 ， 至 二十余 世有 鬻 熊 ， 仕于 周 ， 为 周文 王姬 昌 、 周武 王姬 发之师 。,之后 世系 失记  二十余 世有 鬻 熊  仕于 周  人物二 王姬 昌  人物一 王姬 发之师,1
TRAIN_SENT_ID_262266,,尤二姐,尤三姐,1983 年 她 演出 《 红楼 二 尤 》 ， 前饰 尤三姐 ， 后饰 尤二姐 ， 不仅 保留 了 荀派 特色 ， 而且 在 唱腔 和 表演 中均 融进 自己 的 理解 和 创造 。,年 演出  红楼 二 尤   前饰 人物二  后饰 人物一  保留 荀派 特色  唱腔 表演 中均 融进 理解 创造,1
TRAIN_SENT_ID_268921,,司徒静,司徒剑南,司徒剑南 第九集 : 司徒静 气 了 安宁公主 一顿 ， 将 她 放回 。,人物二 第九集  人物一 气 安宁公主 一顿  放回,1
TRAIN_SENT_ID_266184,,李昌镐,曹薰铉,曹薰铉 执白 4 目半胜 李昌镐,人物二 执白  目半胜 人物一,-1
TRAIN_SENT_ID_284549,,廖立峨,鲁迅,廖立峨 也 协助 过 鲁迅 一些 工作 ， 曾 介绍 何春 才 （ 广东 兴宁 人 ） 与 鲁迅 认识 。,人物一 协助 人物二 工作  介绍 何春  广东 兴宁  人物二 认识,-1
TRAIN_SENT_ID_275502,,庞林,庞统,习祯 《 三国志 庞统 传 》 : 庞林 妇 ， 同郡 习祯 妺 。,习祯  三国志 人物二 传   人物一 妇  同郡 习祯 妺,1
TRAIN_SENT_ID_259393,,温策,温慧,温策 煌 大仙 遭祸 : 南宫煌 ： 温慧 — — ！,人物一 煌 大仙 遭祸  南宫煌  人物二,1
TRAIN_SENT_ID_264934,,贾元春,贾宝玉,第十三回 贾宝玉 试才 大观园 贾元春 归省 荣国府,第十三回 人物二 试才 大观园 人物一 归省 荣国府,1
TRAIN_SENT_ID_249250,,皮皮鲁,鲁西西,皮皮鲁 恋着 鲁西西,人物一 恋着 人物二,1
TRAIN_SENT_ID_269349,,王中军,王中磊,— — 摘自 “ 王中军 、 王中磊 ： 穿 上 ‘ 红 舞鞋 ’ 的 娱乐 大亨 ”,摘自  人物一  人物二  穿  红 舞鞋  娱乐 大亨,1
TRAIN_SENT_ID_250696,,鲁西西,皮皮鲁,皮皮鲁 和 鲁西西 最好 的 朋友 叫 舒克和贝塔 。,人物二 人物一 最好 朋友 舒克和贝塔,1
TRAIN_SENT_ID_273664,,姜子牙,元始天尊,武王灭 商后 ， 姜子牙 奉命 太上老君 及 元始天尊 敕令 封 为 “ 值 年岁 君 太岁 之神 ” 。,武王灭 商后  人物一 奉命 太上老君 人物二 敕令 封  值 年岁 君 太岁 之神,-1
TRAIN_SENT_ID_275357,,申公豹,元始天尊,姜子牙 帮 申公豹 求情 ， 元始天尊 放 了 申公豹 。,姜子牙 帮 人物一 求情  人物二 放 人物一,-1
TRAIN_SENT_ID_252413,,颜回,孔子,本篇 里 有 数章 谈到 颜回 ， 孔子 对 他 的 评价 甚高 。,本篇 里 数章 谈到 人物一  人物二 评价 甚高,-1
TRAIN_SENT_ID_274396,,贾演,贾源,贾演 、 贾源 是 一母 同胞 弟兄 两个 。,人物一  人物二 一母 同胞 弟兄 两个,1
TRAIN_SENT_ID_267581,,吴魏,吴狄,吴魏 角色 经历 : 吴魏 ， 老好人 吴狄 的 哥哥 ， 曾经 穷困潦倒 ， 靠 自己 的 努力 创业 ， 驰骋 商场 ， 叱咤风云 ， 最后 成 了 资产 上 亿 的 成功人士 。,人物一 角色 经历  人物一  老好人 人物二 哥哥  曾经 穷困潦倒  努力 创业  驰骋 商场  叱咤风云  最后 成 资产 亿 成功人士,1
TRAIN_SENT_ID_263397,,武修文,武敦儒,武修文 人物 评价 : 第一章 介绍 ： 那 摔破 额角 的 叫做 武敦儒 ， 是 哥哥 ， 弟弟 叫做 武修文 。,人物一 人物 评价  第一章 介绍  摔破 额角 叫做 人物二  哥哥  弟弟 叫做 人物一,1
TRAIN_SENT_ID_256834,,孙周,孙淳,孙周 、 孙淳 ( 上 ）,人物一  人物二,1
TRAIN_SENT_ID_255361,,贾午,贾南风,贾午 是 贾南风 的 妹妹 ， 后来 因为 这个 缘故 ， 贾午 和 韩寿 也 遇害 了 。,人物一 人物二 妹妹  后来 缘故  人物一 韩寿 遇害,1
TRAIN_SENT_ID_276119,,黄立成,黄立行,演唱 : 黄立成 / 黄立行,演唱  人物一  人物二,1
TRAIN_SENT_ID_261170,,王缙,王维,代宗 寻求 王维 的 文章 ， 他 的 弟弟 王缙 将 他 的 诗文 编纂 成集 共 十卷 ， 献给 皇上 ， 他 的 诗文 至今 流传于世 。,代宗 寻求 人物二 文章  弟弟 人物一 诗文 编纂 成集 共 十卷  献给 皇上  诗文 流传于世,1
TRAIN_SENT_ID_277315,,刘至翰,刘致妤,一袋 女王 20101203 : 刘至翰 、 刘致妤 兄妹 大 爆料,一袋 女王   人物一  人物二 兄妹 爆料,1
TRAIN_SENT_ID_285166,,周子冉,周亚夫,23 、 剧中 周子冉 应是 周亚夫 的 妹妹 ， 但 薄巧慧 夜找 周亚夫 时说 的 是 皇后 （ 窦漪 房 ） 陷害 她 姐姐 。,剧中 人物一 应是 人物二 妹妹  薄巧慧 夜找 人物二 时说 皇后  窦漪 房  陷害 姐姐,1
TRAIN_SENT_ID_256505,,周武,周文,薛仁贵 在 荒草 山艺 压群豪 ， 与 大 寨主 过山虎 周青 及 周文 、 周武 、 姜兴本 、 姜兴霸 、 李庆先 、 李庆红 结为 兄弟 。,薛仁贵 荒草 山艺 压群豪  寨主 过山虎 周青 人物二  人物一  姜兴本  姜兴霸  李庆先  李庆红 结为 兄弟,1
TRAIN_SENT_ID_261653,,宋小宝,赵本山,不过 ， 对于 宋小宝 来说 ， 除了 师父 赵本山 的 提携 和 帮助 ， 他 过往 的 那些 经历 也 是 促使 他 成功 的 最 宝贝 财 宋小宝 ( 10 张 ),人物一  师父 人物二 提携 帮助  过往 经历 促使 成功 宝贝 财 人物一   张,-1
TRAIN_SENT_ID_272654,,邢德全,邢夫人,邢德全 人物 经历 : 邢大舅 投奔 邢夫人 后 ， 只 知以 吃酒 赌钱 、 眠花宿柳 为乐 ， 手中 滥漫 使 钱 ， 待人 无心 ， 呆气 十足 ， 人称 “ 傻 大舅 ” 。,人物一 人物 经历  邢大舅 投奔 人物二  知以 吃酒 赌钱  眠花宿柳 为乐  手中 滥漫 钱  待人 无心  呆气 十足  人称  傻 大舅,1
TRAIN_SENT_ID_250697,,鲁西西,皮皮鲁,皮皮鲁 和 鲁西西 演唱者 ：,人物二 人物一 演唱者,1
TRAIN_SENT_ID_273368,,杨锐,张之洞,三 、 戊戌变法 期间 张之洞 给 杨锐 下达 的 指令,三  戊戌变法 期间 人物二 人物一 下达 指令,-1
TRAIN_SENT_ID_257559,,毛泽民,毛泽东,“ 毛泽东 的 弟弟 ， 毛泽民 ！,人物二 弟弟  人物一,1
TRAIN_SENT_ID_271506,,孟优,孟获,第八章 【 七擒 孟获 】 可 加入 人物 ： 孟优 ， 孟节 ， 祝融 夫人 ， 孟获 .,第八章  七擒 人物二  加入 人物  人物一  孟节  祝融 夫人  人物二,1
TRAIN_SENT_ID_270983,,严舆,严白虎,三国群英 传 2 严舆 形象 严舆 简明 演义 传记 : 严舆 ， 严白虎 之弟 ， 三国演义 第 15 回 登场 。,三国群英 传  人物一 形象 人物一 简明 演义 传记  人物一  人物二 之弟  三国演义  回 登场,1
TRAIN_SENT_ID_263374,,武修文,武敦儒,师兄 ： 武修文 ， 武敦儒,师兄  人物一  人物二,1
TRAIN_SENT_ID_255340,,卫夫人,王羲之,卫夫人 与 王羲之 的 父亲 王旷 是 中 表亲 ， 故 王羲之 幼时 得亲 承 卫夫人 的 教诲 。,人物一 人物二 父亲 王旷 中 表亲  人物二 幼时 得亲 承 人物一 教诲,-1
TRAIN_SENT_ID_250387,,赵飞燕,赵合德,在 中国 古代 昏君 的 排行榜 上 ， 汉成帝 因 宠幸 赵飞燕 和 赵合德 姐妹 ， 最后 竟然 死 在 了 赵合德 身上 而 “ 赫赫有名 ” 。,中国 古代 昏君 排行榜  汉成帝 宠幸 人物一 人物二 姐妹  最后 竟然 死 人物二 身上  赫赫有名,1
TRAIN_SENT_ID_271233,,苏贤方,苏贤达,苏贤达 角色 介绍 : 苏 掌柜的 小儿子 ， 苏贤方 的 弟弟 ， 爱慕 邢青竹 。,人物二 角色 介绍  苏 掌柜的 小儿子  人物一 弟弟  爱慕 邢青竹,1
TRAIN_SENT_ID_277820,,傅清,傅恒,明义 字 我 斋 ， 满洲 镶黄旗 富察氏 傅恒 的 二兄 傅清 之子 ， 大约 生于 乾隆 初年 ， 很 可能 与 曹家 有 一些 关系 。,明义 字 斋  满洲 镶黄旗 富察氏 人物二 二兄 人物一 之子  大约 生于 乾隆 初年  可能 曹家 关系,1
TRAIN_SENT_ID_282049,,刘霓娜,刘诺一,（ 刘诺一 因 感冒 缺席 军训 部分 、 由 刘霓娜 代班 。 ）,人物二 感冒 缺席 军训 部分  人物一 代班,1
TRAIN_SENT_ID_263376,,武修文,武敦儒,武敦儒 、 武修文 与 杨过相 比 ， 只能 比 出 杨过 出类拔萃 、 超群绝伦 。,人物二  人物一 杨过相  只能 出 杨过 出类拔萃  超群绝伦,1
TRAIN_SENT_ID_257045,,洪敬尧,洪荣宏,紧返 来 阮 身边 11 新 放浪 人生 : 洪荣宏 、 洪敬尧,紧返 阮 身边  新 放浪 人生  人物二  人物一,1
TRAIN_SENT_ID_254000,,周恩寿,周恩来,他 和 爱妻 万冬儿 生下 了 周恩来 、 周恩溥 和 周恩寿 三 兄弟 。,爱妻 万冬儿 生下 人物二  周恩溥 人物一 三 兄弟,1
TRAIN_SENT_ID_278396,,武文渊,武文密,武文渊 死后 ， 由其弟 武文密 （ V ũ V ă nM ậ t ） 继领 其众 ， 而 宣光镇 （ Tuy ê nQuangTr ấ n ） 则 长期 成为 武氏家族 的 封地 。,人物一 死后  由其弟 人物二   ũ  ă  ậ   继领 其众  宣光镇   ê  ấ   长期 成为 武氏家族 封地,1
TRAIN_SENT_ID_253875,,赵合德,赵飞燕,后 又 废 许皇后 ， 立 赵飞燕 为 后 ， 赵飞燕 之妹 赵合德 亦 被 立为 昭仪 ， 两姐妹 专宠 后宫 ， 显赫一时 。,废 许皇后  立 人物二  人物二 之妹 人物一 立为 昭仪  两姐妹 专宠 后宫  显赫一时,1
TRAIN_SENT_ID_255359,,贾午,贾南风,之后 将 她 到 金墉城 ， 又 废 她 为 庶人 ， 后 又 收捕 贾南风 的 党羽 如 赵粲 、 贾午 、 程据 等 。,之后 金墉城  废 庶人  收捕 人物二 党羽 赵粲  人物一  程据,1
TRAIN_SENT_ID_266719,,龙幽,龙溟,3 角色 关系 : 外甥 ： 龙幽 、 龙溟,角色 关系  外甥  人物一  人物二,1
TRAIN_SENT_ID_261613,,宋小宝,赵本山,赵本山 ： （ 对 宋小宝 ） 要 珍惜 ， 啊 ！,人物二   人物一  珍惜,-1
TRAIN_SENT_ID_260717,,王重阳,全真七子,宫内 塑有 全真道 祖 王重阳 及 全真七子 像 。,宫内 塑有 全真道 祖 人物一 人物二,-1
TRAIN_SENT_ID_264569,,胡青牛,张无忌,蝶 谷医仙 胡青牛 与 爱妻 毒仙 王难姑 斗法 ， 服下 此毒 ， 幸得 张无忌 救治 而 愈 。,蝶 谷医仙 人物一 爱妻 毒仙 王难姑 斗法  服下 此毒  幸得 人物二 救治 愈,-1
TRAIN_SENT_ID_250350,,赵飞燕,赵合德,赵飞燕 / 赵合德 ： 汉代 最 美艳 动人 的 姐妹花,人物一  人物二  汉代 美艳 动人 姐妹花,1
TRAIN_SENT_ID_282436,,蒋瑶嘉,周华健,⑤ 蒋瑶嘉 《 梦 的 堡垒 》 （ 周华健 ）,⑤ 人物一  梦 堡垒   人物二,-1
TRAIN_SENT_ID_251533,,陈辅,陈靖仇,"陈靖仇 在 陈辅 的 督促 下 , 身不由己 的 开始 了 寻找 神器 的 旅程 … …",人物二 人物一 督促  身不由己 寻找 神器 旅程,-1
TRAIN_SENT_ID_266049,,张学思,张学良,自此 张作霖 任命 张长发 为 其 子女 张学良 、 张学思 、 张学明 等 的 专职 武术 教师 。,自此 张作霖 任命 张长发 子女 人物二  人物一  张学明 专职 武术 教师,1
TRAIN_SENT_ID_251831,,梅超风,黄药师,黄药师 终于 爱上 梅超风,人物二 终于 爱上 人物一,-1
TRAIN_SENT_ID_261569,,南宫敬叔,孟懿子,孟 孙氏 南宫敬叔 仲孙阅 : 南宫敬叔 ， 姬姓 ， 鲁国 南宫 氏 ， 名阅 或 说 ， 一名 绦 ， 谥敬 ， 是 孟僖子 的 儿子 ， 孟懿子 的 弟弟 。,孟 孙氏 人物一 仲孙阅  人物一  姬姓  鲁国 南宫 氏  名阅 说  一名 绦  谥敬  孟僖子 儿子  人物二 弟弟,1
TRAIN_SENT_ID_267591,,骆赢,骆羽,6 双打 决赛 : 女双 决赛 ， 中国 年轻 组合 骆羽 / 骆赢 面对 中华 台北 名将 简玉瑾 / 程文欣 ， 去年 加拿大 公开赛 ， 骆羽 / 骆赢 曾 输给 过 对手 。,双打 决赛  女双 决赛  中国 年轻 组合 人物二  人物一 面对 中华 台北 名将 简玉瑾  程文欣  去年 加拿大 公开赛  人物二  人物一 输给 对手,1
TRAIN_SENT_ID_251844,,梅超风,黄药师,四 、 黄药师 、 梅超风 的 形象,四  人物二  人物一 形象,-1
TRAIN_SENT_ID_284013,,田神玉,田神功,田神玉 ， 唐将 田神功 之弟 ， 自曹州 刺史 权 汴州 留后 。,人物一  唐将 人物二 之弟  自曹州 刺史 权 汴州 留后,1
TRAIN_SENT_ID_270982,,严舆,严白虎,三国群英 传 2 严舆 形象 简明 演义 传记 : 严舆 ， 严白虎 之弟 ， 三国演义 第 15 回 登场 。,三国群英 传  人物一 形象 简明 演义 传记  人物一  人物二 之弟  三国演义  回 登场,1
TRAIN_SENT_ID_272407,,方兰生,方如沁,孙月言 也 见到 了 方兰生 的 二姐 方如沁 ， 方如沁 十分满意 孙月言 。,孙月言 见到 人物一 二姐 人物二  人物二 十分满意 孙月言,1
TRAIN_SENT_ID_271507,,孟优,孟获,却说 孟获 与 祝融 夫人 并 孟优 、 带来 洞主 、 一切 宗党 在 别 帐 饮酒 。,却说 人物二 祝融 夫人 人物一  带来 洞主  宗党 帐 饮酒,1
TRAIN_SENT_ID_285334,,顾坎,刘德六,顾坎 （ 1855 年 - 1925 年 ） ， 字渊 如 ， 江苏 吴江 芦墟 人 ， 为 陆恢 师弟 ， 同师于 刘德六 。,人物一   年   年   字渊  江苏 吴江 芦墟  陆恢 师弟  同师于 人物二,-1
TRAIN_SENT_ID_249127,,皮皮鲁,鲁西西,皮皮鲁 和 鲁西西 演唱者 ：,人物一 人物二 演唱者,1
TRAIN_SENT_ID_275822,,程万牛,程铁牛,左车轮 缠斗 罗通 ， 碧海 丹心 佛战住 秦 秦怀玉 ， 董魁 战住 程铁牛 、 程万牛 。,左车轮 缠斗 罗通  碧海 丹心 佛战住 秦 秦怀玉  董魁 战住 人物二  人物一,1
TRAIN_SENT_ID_274772,,闵乃大,闵乃本,闵乃大 家庭 : 其弟 闵乃本,人物一 家庭  其弟 人物二,1
TRAIN_SENT_ID_281558,,潘玮楷,潘玮柏,潘玮楷 曝光 : 潘玮柏 一家 日前 现身 恒隆 广场 ， 除了 潘玮柏 的 贵气 妈妈 之外 ， 潘玮柏 弟弟 潘玮楷 照片 也 被 拍 到 。,人物一 曝光  人物二 一家 日前 现身 恒隆 广场  人物二 贵气 妈妈 之外  人物二 弟弟 人物一 照片 拍,1
TRAIN_SENT_ID_252971,,颜回,孔子,【 出处 】 《 孔子 家语 · 颜回 》 ： “ 公闻 之 ， 越席 而 起 。 ”,出处   人物二 家语  人物一    公闻  越席,-1
TRAIN_SENT_ID_264523,,岳云鹏,郭德纲,扒 马褂 版本 三 : 郭德纲 、 李菁 、 于谦 版 扒 马褂 版本 四 : 郭德纲 、 于谦 、 岳云鹏 版,扒 马褂 版本 三  人物二  李菁  于谦 版 扒 马褂 版本 四  人物二  于谦  人物一 版,-1
TRAIN_SENT_ID_261352,,何猷启,何超莲,何猷启 运势 相反 : 龙凤胎 姐弟 何超莲 与 何猷启 齐 堕 爱河 ， 龙凤胎 是否 连 桃花运 都 一起 走 ？,人物一 运势 相反  龙凤胎 姐弟 人物二 人物一 齐 堕 爱河  龙凤胎 是否 桃花运 一起 走,1
TRAIN_SENT_ID_263913,,汤镇宗,汤镇业,张敏 、 汤镇宗 、 汤镇业 、 梁家仁 、 孙国明,张敏  人物一  人物二  梁家仁  孙国明,1
TRAIN_SENT_ID_273621,,马阔海,马青山,召唤 人 ： 端木燕 （ 主要 ） 、 马青山 、 马阔海 （ 电影版 ）,召唤  端木燕  主要   人物二  人物一  电影版,1
TRAIN_SENT_ID_268904,,司徒静,司徒剑南,司徒剑南 第三集 : 白云飞 知朱允 和 司徒静 都 不是 简单 人物 ， 已起 结交 之心 。,人物二 第三集  白云飞 知朱允 人物一 简单 人物  已起 结交 之心,1
TRAIN_SENT_ID_274281,,梅小青,梅小惠,"《 满堂红 》 （ 曾伟权 ， 蔡倩儿 , 潘铣 怡 ， 杨得时 , 梅小惠 ） 梅小青 监制",满堂红   曾伟权  蔡倩儿  潘铣 怡  杨得时  人物二  人物一 监制,1
TRAIN_SENT_ID_265550,,张崇基,张崇德,张崇基 、 张崇德 - 兄弟 的 天空,人物一  人物二  兄弟 天空,1
TRAIN_SENT_ID_259950,,周志文,周志康,今集 跟着 地产 代理 看看 西贡 区村 屋盘 ， 并 请来 孖 仔 周志文 、 周志康 走访 三位 合租 村屋 的 女生 。,今集 跟着 地产 代理 看看 西贡 区村 屋盘  请来 孖 仔 人物一  人物二 走访 三位 合租 村屋 女生,1
TRAIN_SENT_ID_281647,,黄铁良,侯宝林,1950 年经 姑姑 黄 仲华 ( 玉霞 ） 介绍 ， 黄铁良 进入 了 孙玉奎 、 侯宝林 等 人 组织 的 “ 相声改进小组 ” 开始 习艺 。,年经 姑姑 黄 仲华  玉霞  介绍  人物一 进入 孙玉奎  人物二 组织  相声改进小组  习艺,-1
TRAIN_SENT_ID_268825,,洪凌波,李莫愁,在 绝情谷 中 ， 师父 李莫愁 想 借 其 作为 踏板 跳出 情 花丛 ， 结果 洪凌波 把 李莫愁 一起 拉入情 花丛 ， 客观 上 加速 了 李莫愁 的 死亡 。,绝情谷 中  师父 人物二 想 踏板 跳出 情 花丛  人物一 人物二 一起 拉入情 花丛  客观 加速 人物二 死亡,-1
TRAIN_SENT_ID_252920,,颜回,孔子,文中 以 孔子 与 颜回 的 对话 引出 “ 无乐 无知 ， 是 真乐 真知 ” 的 观点 。,文中 人物二 人物一 对话 引出  无乐 无知  真乐 真知  观点,-1
TRAIN_SENT_ID_260577,,金敬姬,金正日,金正日 生前 最 亲近 的 人 莫过于 妹妹 金敬姬 和 妹夫 张成泽 。,人物二 生前 亲近 莫过于 妹妹 人物一 妹夫 张成泽,1
TRAIN_SENT_ID_278013,,干光豪,左子穆,沈师伯 ， 干光豪 提及 ， 当为 左子穆 师兄 无量 派西宗 : 掌门 ： 辛双清,沈师伯  人物一 提及  当为 人物二 师兄 无量 派西宗  掌门  辛双清,-1
TRAIN_SENT_ID_259934,,周志文,周志康,巨声 队 ： 林师杰 、 许廷铿 、 刘 威煌 、 周志文 、 周志康 、 邓小巧 、 何晶晶 、 何雁诗,巨声 队  林师杰  许廷铿  刘 威煌  人物一  人物二  邓小巧  何晶晶  何雁诗,1
TRAIN_SENT_ID_256568,,周武,周文,应之 於 门 ， 曰 ： 何以 道旦 也 （ 周公 ， 姓姬 名旦 ， 周文 王之 子 ， 周武 王之 弟 ， 周成 王之 叔父 ） ？,应之 於 门  曰  道旦  周公  姓姬 名旦  人物二 王之 子  人物一 王之 弟  周成 王之 叔父,1
TRAIN_SENT_ID_255492,,罗成,秦琼,与 程咬金 欣赏 罗成 相反 ， 秦琼 对 罗成 更 多 的 是 一种 被迫 。,程咬金 欣赏 人物一 相反  人物二 人物一 更 一种 被迫,1
TRAIN_SENT_ID_250109,,武敦儒,武修文,姓名 ： 武敦儒 （ 哥哥 ） 、 武修文 （ 弟弟 ） 、,姓名  人物一  哥哥   人物二  弟弟,1
TRAIN_SENT_ID_269730,,薛洋,薛之荔,看着 薛洋 和 楚牧 还 没 赶上来 ， 她俩 故意 放慢 速度 ， 薛之荔 对 齐齐 讲起 了 薛洋 的 故事 。,看着 人物一 楚牧 没 赶上来  她俩 故意 放慢 速度  人物二 齐齐 讲起 人物一 故事,1
TRAIN_SENT_ID_261578,,南宫敬叔,孟懿子,孔子 34 岁 时 ， 鲁 大夫 孟僖子 之嗣 孟懿子 及 南宫敬叔 来 向 他 学礼 ， 从此 ， 他 开始 授徒 讲学 。,孔子  岁 时  鲁 大夫 孟僖子 之嗣 人物二 人物一 学礼   授徒 讲学,1
TRAIN_SENT_ID_252698,,颜回,孔子,孔子 和 颜回 得知 ， 相视而笑 。,人物二 人物一 得知  相视而笑,-1
TRAIN_SENT_ID_252909,,颜回,孔子,颜回 以 “ 豫 ” 、 “ 恕 ” 告之 （ 《 孔子 家语 · 颜回 》 ） 。,人物一  豫    恕  告之   人物二 家语  人物一,-1
TRAIN_SENT_ID_269784,,池田菜沙,池田华菜,咲日 和 （ 池田华菜 、 池田绯菜 、 池田城菜 、 池田菜沙 ） 森永 理科 游戏 : D → A ： WHITE （ ク ー ）,咲日  人物二  池田绯菜  池田城菜  人物一  森永 理科 游戏   →     ク ー,1
TRAIN_SENT_ID_265555,,张崇基,张崇德,2006 年 张崇基 、 张崇德 - 2ssential 演唱会,年 人物一  人物二   演唱会,1
TRAIN_SENT_ID_261575,,南宫敬叔,孟懿子,人物 简介 : 前 518 年 ， 孟僖子 临终 之前 ， 让 孟懿子 、 南宫敬叔 都 要 将 孔子 作为 老师 。,人物 简介  前  年  孟僖子 临终 之前  人物二  人物一 孔子 老师,1
TRAIN_SENT_ID_284039,,韩文举,康有为,时至 光绪 二十八年 （ 1902 年 ） ， 梁启超 与 康有为 ， 在 学术思想 和 政治 观点 上 产生 严重 分歧 ， 争论 之中 ， 韩文举 赞同 了 梁启超 的 政见 。,时至 光绪 二十八年   年   梁启超 人物二  学术思想 政治 观点 产生 严重 分歧  争论 之中  人物一 赞同 梁启超 政见,-1
TRAIN_SENT_ID_251872,,曹薰铉,李昌镐,李昌镐 执白 1 又 1 / 4 子胜 曹薰铉,人物二 执白     子胜 人物一,-1
TRAIN_SENT_ID_257227,,张子静,张爱玲,寻访 张子静 ， 再见 张爱玲 季季,寻访 人物一  再见 人物二 季季,1
TRAIN_SENT_ID_253889,,赵合德,赵飞燕,赵飞燕 姊娣 （ 含 赵合德 ）,人物二 姊娣  含 人物一,1
TRAIN_SENT_ID_279223,,吕馨,吕禄,吕馨 跪 在 吕禄 面前 求 他 救 自己 一命 ， 吕禄 向 吕雉 说出 一些 计策 ， 吕雉 这才 答应 饶 了 吕馨 。,人物一 跪 人物二 面前 求 救 一命  人物二 吕雉 说出 计策  吕雉 这才 答应 饶 人物一,1
TRAIN_SENT_ID_284969,,元孚,元昌,元孚 ， 字秀 和 ， 元昌 弟 。,人物一  字秀  人物二 弟,1
TRAIN_SENT_ID_268828,,洪凌波,李莫愁,1 角色 设定 : 洪凌波 虽然 是 李莫愁 的 徒弟 ， 但 她 的 性格 心地 却 和 李莫愁 迥然不同 。,角色 设定  人物一 人物二 徒弟  性格 心地 人物二 迥然不同,-1
TRAIN_SENT_ID_249011,,吕洞宾,韩湘子,52 、 白蛇 吐信 53 、 （ 韩湘子 ） 勒马 横笛 54 、 （ 吕洞宾 ） 提杯 敬酒,白蛇 吐信    人物二  勒马 横笛    人物一  提杯 敬酒,-1
TRAIN_SENT_ID_258821,,张无忌,殷离,张无忌 在 四女 之中 ， 对 殷离 的 感情 最 亲切 自然 ， 最 可敬 可感 ， 这 或许 是因为 殷离 与 他 母亲 殷素素 的 相像 吧 。,人物一 四女 之中  人物二 感情 亲切 自然  可敬 可感  或许 是因为 人物二 母亲 殷素素 相像,1
TRAIN_SENT_ID_256515,,周武,周文,据 史籍 《 元 和 姓 纂 》 及 《 通志 · 氏族 略 》 等 所载 ， 周武 王灭 商后 ， 封其弟 （ 周文 王 幼子 ） 于康 邑 ， 世称 康叔封 。,史籍  元 姓 纂   通志  氏族 略  所载  人物一 王灭 商后  封其弟  人物二 王 幼子  于康 邑  世称 康叔封,1
TRAIN_SENT_ID_276117,,黄立成,黄立行,《 我 的 梦 中 情人 》 黄立行 ； 《 麻吉 》 黄立成 / 麻吉 ；,梦 中 情人  人物二   麻吉  人物一  麻吉,1
TRAIN_SENT_ID_253813,,孟凡,孟芙,孟凡 以不杀 孟芙 和 安乐 为 条件 ， 打通 六局 ， 助阵 李隆基 政变 。,人物一 以不杀 人物二 安乐 条件  打通 六局  助阵 李隆基 政变,1
TRAIN_SENT_ID_258126,,刘星,夏雪,东海 为 了解 夏雪 反常 行为 ， “ 雇佣 ” 刘星 跟踪 夏雪 ， 而 刘梅 发现 刘星 行动诡秘 ， 则 “ 收买 ” 了 夏雨来 跟踪 刘星 。,东海 了解 人物二 反常 行为   雇佣  人物一 跟踪 人物二  刘梅 发现 人物一 行动诡秘   收买  夏雨来 跟踪 人物一,1
TRAIN_SENT_ID_265858,,花雄,花木兰,花木兰 磨刀 的 弟弟 叫 花雄,人物二 磨刀 弟弟 人物一,1
TRAIN_SENT_ID_263363,,武修文,武敦儒,第一篇 ， 写 武敦儒 、 武修文 。,第一篇  写 人物二  人物一,1
TRAIN_SENT_ID_269440,,刘伟,马季,《 训徒 》 表演者 ： 马季 、 刘伟 、 兰成,训徒  表演者  人物二  人物一  兰成,-1
