sent_id,sent_id,entity1,entity2,sent,processed_sent,label
TRAIN_SENT_ID_253153,,颜回,孔子,虽然 ， 作者 也 表明 颜回 和 孔子 不可 效法 ， 偏重于 向 荷 蓧 翁 和 长 沮 、 桀溺 学习 ， 似乎 是 乐于 隐居 田园 的 。,作者 表明 人物一 人物二 不可 效法  偏重于 荷 蓧 翁 长 沮  桀溺 学习  似乎 乐于 隐居 田园,-1
TRAIN_SENT_ID_281434,,范静生,范旭东,范静生 （ 即 范源 廉 ， 著名 化工 专家 范旭东 之 长兄 ） ， 生于 1875 年 ， 卒 于 1927 年 ， 湖南 湘阴 人 ， 是 梁启超 的 得意门生 。,人物一  范源 廉  著名 化工 专家 人物二 长兄   生于  年  卒  年  湖南 湘阴  梁启超 得意门生,1
TRAIN_SENT_ID_281966,,梁经纶,何其沧,燕大 进步 女 学生 谢木兰 、 经济系 教授 梁经纶 、 燕京大学 副校长 何其沧 之女 何孝钰 亦 在 其中 。,燕大 进步 女 学生 谢木兰  经济系 教授 人物一  燕京大学 副校长 人物二 之女 何孝钰,-1
TRAIN_SENT_ID_253063,,颜回,孔子,绑定 百度 钱包 : 颜丙燕 ， 1972 年 12 月 16 日 生于 中国 北京 ， 祖籍 山东 曲阜 ， 是 孔子 四大 弟子 之一 颜回 的 后裔 。,绑定 百度 钱包  颜丙燕   年  月  日 生于 中国 北京  祖籍 山东 曲阜  人物二 四大 弟子 人物一 后裔,-1
TRAIN_SENT_ID_252863,,颜回,孔子,同样 ， 孔子 也 非常 赏识 和 信任 颜回 ， 当 子贡 怀疑 颜回 偷吃 米饭 时 ， 孔子 坚信 颜回 不会 这样 做 ， 并用 巧妙 的 方法 解除 了 别人 的 疑问 。,同样  人物二 非常 赏识 信任 人物一  子贡 怀疑 人物一 偷吃 米饭 时  人物二 坚信 人物一 不会 做  并用 巧妙 方法 解除 疑问,-1
TRAIN_SENT_ID_252577,,颜回,孔子,孔子 等 匆忙 离开 卫都 帝丘 时 ， 颜回 暂时 留在 颜浊 邹家 ， 以便 观察 卫国 的 动向 。,人物二 匆忙 离开 卫都 帝丘 时  人物一 暂时 留在 颜浊 邹家  观察 卫国 动向,-1
TRAIN_SENT_ID_259696,,游颖,游娴,这 一切 全给 游颖 看 在 眼内 ， 本着 逞强 的 心 ， 游颖 没有 将 误会 即时 澄清 ， 成为 她 与 亲 姊 游娴 之间 的 一道 刺 。,全给 人物一 眼内  逞强 心  人物一 没有 误会 即时 澄清  成为 亲 姊 人物二 之间 一道 刺,1
TRAIN_SENT_ID_285820,,阮远,孟微冬,阮远 人物 生平 : 006 年 移居 北京 ， 拜 著名画家 孟微冬 等 多位 名家 的 指点 。,人物一 人物 生平   年 移居 北京  拜 著名画家 人物二 多位 名家 指点,-1
TRAIN_SENT_ID_264538,,岳云鹏,郭德纲,2014 年 5 月 1 日 ， 参加 岳云鹏 在 北京 开展 的 “ 岳来 越 棒 ” 专场 ； 9 月 27 日 ， 参加 郭德纲 相声 巡演 南京站 。,年  月  日  参加 人物一 北京 开展  岳来 越 棒  专场   月  日  参加 人物二 相声 巡演 南京站,-1
TRAIN_SENT_ID_274111,,南宫敬叔,孔子,孔子 34 岁 时 ， 鲁 大夫 孟僖子 之嗣 孟懿子 及 南宫敬叔 来 向 他 学礼 ， 从此 ， 他 开始 授徒 讲学 。,人物二  岁 时  鲁 大夫 孟僖子 之嗣 孟懿子 人物一 学礼   授徒 讲学,-1
TRAIN_SENT_ID_257442,,姜昆,马季,1984 年 结识 马季 ， 1986 年复 结识 姜昆 、 唐杰忠 、 李金斗 等 名家 。,年 结识 人物二   年复 结识 人物一  唐杰忠  李金斗 名家,-1
TRAIN_SENT_ID_256866,,仲由,孔子,种氏 家祠 种氏 家祠 始祖 : 种氏 家祠 始祖 ： 仲由 ， 春秋 时鲁国 人 ， 字 子路 ， 孔子 的 得意 弟子 ， 他 直率 勇敢 ， 仕卫为 邑 宰 。,种氏 家祠 种氏 家祠 始祖  种氏 家祠 始祖  人物一  春秋 时鲁国  字 子路  人物二 得意 弟子  直率 勇敢  仕卫为 邑 宰,-1
TRAIN_SENT_ID_251817,,梅超风,黄药师,桃花岛 岛主 黄药师 门下 弟子 陈玄风 、 梅超风 ， 俩 人 学艺 未 成 ， 却 暗中 相爱 ， 又 担心 被 师父 发觉 性命不保 ， 就 偷偷 逃离 桃花岛 。,桃花岛 岛主 人物二 门下 弟子 陈玄风  人物一  俩 学艺 未 成  暗中 相爱  担心 师父 发觉 性命不保  偷偷 逃离 桃花岛,-1
TRAIN_SENT_ID_284935,,拓跋衍,拓跋安寿,拓跋衍 ， 字 安乐 ， 拓跋安寿 弟 ， 赐爵 广陵 侯 。,人物一  字 安乐  人物二 弟  赐爵 广陵 侯,1
TRAIN_SENT_ID_278009,,严贡生,严监生,"《 严监生 和 严贡生 》 ： “ 知县 准 了 状子 , 发房 出 了 差 来到 严家 。 ”",人物二 人物一    知县 准 状子  发房 出 差 来到 严家,1
TRAIN_SENT_ID_257461,,姜昆,马季,看好 方 : 从 解放初期 直至 上 世纪末 ， 经过 侯宝林 、 马季 、 姜昆 等 相声 演员 积极 改编 、 创新 传统 相声 题材 后 ， 中国 相声 艺术 进入 鼎盛 时代 。,看好 方  解放初期 直至 世纪末  侯宝林  人物二  人物一 相声 演员 积极 改编  创新 传统 相声 题材  中国 相声 艺术 进入 鼎盛 时代,-1
TRAIN_SENT_ID_266177,,李昌镐,曹薰铉,前 七届 比赛 的 冠军 分别 是 ： 曹薰铉 、 徐奉洙 、 刘昌赫 、 李昌镐 、 常昊 、 崔哲瀚 、 范廷钰 。,前 七届 比赛 冠军  人物二  徐奉洙  刘昌赫  人物一  常昊  崔哲瀚  范廷钰,-1
TRAIN_SENT_ID_277290,,杨贯一,林永春,林永春 创业 经历 : 富东 粤菜 老板 林永春 ， 是 国际 名厨 杨贯一 的 入室弟子 。,人物二 创业 经历  富东 粤菜 老板 人物二  国际 名厨 人物一 入室弟子,-1
TRAIN_SENT_ID_248995,,吕洞宾,韩湘子,八仙 是 中国 古代 神话传说 中 的 八位 神仙 ， 即 铁拐李 、 汉 钟离 、 吕洞宾 、 张果老 、 何仙姑 、 蓝采和 、 韩湘子 、 曹国舅 。,八仙 中国 古代 神话传说 中 八位 神仙  铁拐李  汉 钟离  人物一  张果老  何仙姑  蓝采和  人物二  曹国舅,-1
TRAIN_SENT_ID_249125,,皮皮鲁,鲁西西,皮皮鲁 和 鲁西西 碰巧 发现 了 他们 教室 里 的 隐身人 ， 想 知道 隐身人 的 秘密 吗 ？,人物一 人物二 碰巧 发现 教室 里 隐身人  想 知道 隐身人 秘密,1
TRAIN_SENT_ID_264575,,胡青牛,张无忌,后来 常遇春 又 告诉 他 张无忌 是 天鹰 教 殷白眉 的 外孙 之后 ， 胡青牛 有意 为 他 治病 ， 但 要求 张无忌 许偌 以后 投身 天鹰 教 ， 不再 做 武当 弟子 。,后来 常遇春 告诉 人物二 天鹰 教 殷白眉 外孙 之后  人物一 有意 治病  要求 人物二 许偌 以后 投身 天鹰 教  不再 做 武当 弟子,-1
TRAIN_SENT_ID_256854,,仲由,孔子,仲由 ， 公元前 542 ～ 前 480 年 ， 字 子路 ， 又 字 季路 ， 鲁国 卞人 （ 今 山东 泗水 泉林 镇 卞 桥村 ） ， 孔子 的 得意门生 ， 以 政事 见称 。,人物一  公元前   前  年  字 子路  字 季路  鲁国 卞人  山东 泗水 泉林 镇 卞 桥村   人物二 得意门生  政事 见称,-1
TRAIN_SENT_ID_268935,,韩非,荀子,韩非 之学 ， 出于 荀子 ， 是 主张 性恶 的 。,人物一 之学  人物二  主张 性恶,-1
TRAIN_SENT_ID_250641,,鲁西西,皮皮鲁,鲁西西 和 大 侦探 乔 麦皮 人物 介绍 : 皮皮鲁 他 学习成绩 不高 ， 不是 学校 老师 喜欢 的 那种 乖孩子 ， 但 他 心地善良 、 正义 勇敢 ， 身上 有 故事 。,人物一 侦探 乔 麦皮 人物 介绍  人物二 学习成绩 不高  学校 老师 喜欢 那种 乖孩子  心地善良  正义 勇敢  身上 故事,1
TRAIN_SENT_ID_252414,,颜回,孔子,脱俗 成名 ， 超凡人圣 评语 : 摆脱 物欲 世俗 的 困扰 ， 追求 一种 自我 心理 平衡 ， 是 孔子 推崇 颜回 道德 的 地方 ， 孔子 说 ： “ 贤哉 ， 回 也 ！,脱俗 成名  超凡人圣 评语  摆脱 物欲 世俗 困扰  追求 一种 自我 心理 平衡  人物二 推崇 人物一 道德 地方  人物二 说   贤哉  回,-1
TRAIN_SENT_ID_286136,,姚建威,黄祖洽,姚建威 考上 北师大 物理系 时 不过 16 岁 ， 但 刚 上 大 一 已经 显示 出 超人 的 知识 储量 和 研究 能力 ， 得到 了 著名 物理学家 黄祖洽 的 赏识 。,人物一 考上 北师大 物理系 时  岁  刚 已经 显示 出 超人 知识 储量 研究 能力  得到 著名 物理学家 人物二 赏识,-1
TRAIN_SENT_ID_251529,,陈辅,陈靖仇,符鬼 来源 : 陈辅 曾 给 徒儿 陈靖仇 一个 “ 符鬼 之符 ” ， 说 以后 若 一个 人有 困难 就 把 它 打开 。,符鬼 来源  人物一 徒儿 人物二 一个  符鬼 之符   说 以后 一个 人有 困难 打开,-1
TRAIN_SENT_ID_257560,,毛泽民,毛泽东,毛泽东 的 亲属 和 好友 看望 毛泽东 时 ， 大家 都 有 一种 不约而同 的 禁忌 ， 就是 从不 提起 毛泽民 、 毛岸英 。,人物二 亲属 好友 看望 人物二 时  一种 不约而同 禁忌  从不 提起 人物一  毛岸英,1
TRAIN_SENT_ID_259688,,游颖,游娴,游颖 对 继乐 日久生情 ， 当 她 与 游娴 关系 缓和 一点 后 ， 她 终向 游娴 说出 少女 心事 ， 但 却 不知 游娴 对 继乐 亦 有 倾慕 之情 。,人物一 继乐 日久生情  人物二 关系 缓和 一点  终向 人物二 说出 少女 心事  不知 人物二 继乐 倾慕 之情,1
TRAIN_SENT_ID_250073,,武敦儒,武修文,武敦儒 、 武修文 对 郭 芙 千依百顺 ， 郭芙说 什么 就 做 什么 。,人物一  人物二 郭 芙 千依百顺  郭芙说 做,1
TRAIN_SENT_ID_271258,,马季,侯宝林,相声 ： 赵炎 、 马季 （ 已故 ） 、 李文华 （ 已故 ） 、 姜昆 、 侯耀文 （ 已故 ） 、 石富宽 、 侯宝林 （ 已故 · 录像 ） 、 郭全宝 （ 已故 · 录像 ） 等 。,相声  赵炎  人物一  已故   李文华  已故   姜昆  侯耀文  已故   石富宽  人物二  已故  录像   郭全宝  已故  录像,-1
TRAIN_SENT_ID_282527,,晋红娟,刘艳丽,李祥和 的 婚事 根据 曲剧 名剧 《 李 豁子 离婚 》 改编 ， 由 著名 曲剧 表演艺术家 胡希华 、 刘艳丽 、 青年 演员 晋红娟 主演 。,李祥和 婚事 曲剧 名剧  李 豁子 离婚  改编  著名 曲剧 表演艺术家 胡希华  人物二  青年 演员 人物一 主演,-1
TRAIN_SENT_ID_267507,,裘千丈,裘千仞,裘千丈 ， 金庸 武侠小说 《 射雕 英雄传 》 中 人物 ， 铁掌 帮 帮主 裘千仞 的 双胞胎 哥哥 。,人物一  金庸 武侠小说  射雕 英雄传  中 人物  铁掌 帮 帮主 人物二 双胞胎 哥哥,1
TRAIN_SENT_ID_251882,,曹薰铉,李昌镐,第三轮 ： 李昌镐 1 : 0 刘昌赫 曹薰铉 1 : 0 马晓春 赵治勋 1 : 0 金秀壮 聂卫平 1 : 0 林海峰,第三轮  人物二    刘昌赫 人物一    马晓春 赵治勋    金秀壮 聂卫平    林海峰,-1
TRAIN_SENT_ID_271260,,马季,侯宝林,马季 ， （ 1934 年 8 月 2 日 - 2006 年 12 月 20 日 ） 原名 马树槐 ， 相声 大师 侯宝林 的 掌门 大 弟子 ， 中国 相声界 领军人 和 代表 人物 。,人物一    年  月  日   年  月  日  原名 马树槐  相声 大师 人物二 掌门 弟子  中国 相声界 领军人 代表 人物,-1
TRAIN_SENT_ID_276994,,樊迟,孔子,之后 ， 樊迟 为 孔子 驾车 时 ， 孔子 告诉 他 这件 事说 ： 孟孙问 我 什么 是 孝 ？,之后  人物一 人物二 驾车 时  人物二 告诉 这件 事说  孟孙问 孝,-1
TRAIN_SENT_ID_276144,,贾惜春,贾珍,贾惜春 身份 研究 : 书里 说惜 春 是 宁国府 贾珍 的 胞妹 ， 并 没有 提到 她 是 贾敬 的 女儿 。,人物一 身份 研究  书里 说惜 春 宁国府 人物二 胞妹  没有 提到 贾敬 女儿,1
TRAIN_SENT_ID_260943,,杨露禅,陈长兴,杨露禅 第一次 去 陈家沟 习武 ， 碰 了 很 多次 壁 ， 最后 只好 去 陈长兴 家当 佣工 ， 经过 持之以恒 的 决心 ， 感动 了 陈长兴 ， 最后 收为 徒弟 。,人物一 第一次 陈家沟 习武  碰 多次 壁  最后 只好 人物二 家当 佣工  持之以恒 决心  感动 人物二  最后 收为 徒弟,-1
TRAIN_SENT_ID_250691,,鲁西西,皮皮鲁,鲁西西 说 ， 如果 刚才 真是 你 皮皮鲁 唱 的 ， 我 肯定 要享 给 歌星 当 妹妹 的 福 了 。,人物一 说  刚才 真是 人物二 唱  肯定 要享 歌星 妹妹 福,1
TRAIN_SENT_ID_284970,,元孚,元昌,元孚 介绍 : 元孚 ， 字秀 和 ， 元昌 弟 。,人物一 介绍  人物一  字秀  人物二 弟,1
TRAIN_SENT_ID_276948,,樊迟,孔子,后来 樊迟 给 孔子 驾车 ， 孔子 告诉 他 ： “ 孟孙问 我 什么 是 孝 ， 我 回答 他 说 不要 违背 礼 。 ”,后来 人物一 人物二 驾车  人物二 告诉   孟孙问 孝  回答 说 不要 违背 礼,-1
TRAIN_SENT_ID_266050,,张学思,张学良,张学良 示意 张学思 别 吱声 ， 他 指 了 指 墙壁 （ 暗示 装有 窃听器 ） ， 然后 拿出 纸 和 铅笔 ， 兄弟俩 进行 着 无声 的 “ 谈话 ” 。,人物二 示意 人物一 吱声  指 指 墙壁  暗示 装有 窃听器   拿出 纸 铅笔  兄弟俩 进行 无声  谈话,1
TRAIN_SENT_ID_256954,,仲由,孔子,百里 负米 孔子 赞扬 : 孔子 赞扬 说 ： “ 仲由 侍奉 父母 ， 可以 说 是 生时 尽力 ， 死后 思念 哪 ！ ”,百里 负米 人物二 赞扬  人物二 赞扬 说   人物一 侍奉 父母  说 生时 尽力  死后 思念,-1
TRAIN_SENT_ID_256932,,仲由,孔子,中国 二十四孝 故事 石刻 百里 负米 : 仲由 ， 字 子路 、 季路 ， 春秋时期 鲁国 人 ， 孔子 的 得意 ， 性格 直率 勇敢 ， 十分 孝顺 。,中国 二十四孝 故事 石刻 百里 负米  人物一  字 子路  季路  春秋时期 鲁国  人物二 得意  性格 直率 勇敢  十分 孝顺,-1
TRAIN_SENT_ID_275544,,王小虎,赵本山,12 年 10 月 21 日 ， 赵本山 爱徒 王小虎 、 张可 在 北京 举行 了 婚礼 。,年  月  日  人物二 爱徒 人物一  张可 北京 举行 婚礼,-1
TRAIN_SENT_ID_284969,,元孚,元昌,元孚 ， 字秀 和 ， 元昌 弟 。,人物一  字秀  人物二 弟,1
TRAIN_SENT_ID_272471,,李家杰,李家诚,李博士 为 李达 民 先生 及 冯 李焕 琼 女士 之 胞兄 、 李佩雯 小姐 、 李家杰 先生 及 李家诚 先生 之 父亲 及 李宁 先生 之 岳父 。,李博士 李达 民 先生 冯 李焕 琼 女士 胞兄  李佩雯 小姐  人物一 先生 人物二 先生 父亲 李宁 先生 岳父,1
TRAIN_SENT_ID_249010,,吕洞宾,韩湘子,韩湘子 ， 字 清夫 ， 是 古代 汉族 民间传说 故事 中 的 八仙 之一 ， 擅吹 洞箫 ， 拜 吕洞宾 为 师学道 。,人物二  字 清夫  古代 汉族 民间传说 故事 中 八仙  擅吹 洞箫  拜 人物一 师学道,-1
TRAIN_SENT_ID_256921,,仲由,孔子,内丘县 郭巨 孝 文化 百里 负米 : 仲由 ， 字 子路 、 季路 ， 春秋时期 鲁国 人 ， 孔子 的 得意 弟子 ， 性格 直率 勇敢 ， 十分 孝顺 。,内丘县 郭巨 孝 文化 百里 负米  人物一  字 子路  季路  春秋时期 鲁国  人物二 得意 弟子  性格 直率 勇敢  十分 孝顺,-1
TRAIN_SENT_ID_271249,,马季,侯宝林,看好 方 : 从 解放初期 直至 上 世纪末 ， 经过 侯宝林 、 马季 、 姜昆 等 相声 演员 积极 改编 、 创新 传统 相声 题材 后 ， 中国 相声 艺术 进入 鼎盛 时代 。,看好 方  解放初期 直至 世纪末  人物二  人物一  姜昆 相声 演员 积极 改编  创新 传统 相声 题材  中国 相声 艺术 进入 鼎盛 时代,-1
TRAIN_SENT_ID_256973,,仲由,孔子,孔子 说 ： “ 仲由 嘛 ， 在 拥有 一 千辆 兵车 的 国家 里 ， 可以 让 他 管理 军事 ， 但 我 不 知道 他 是不是 做到 了 仁 。 ”,人物二 说   人物一  拥有 千辆 兵车 国家 里  管理 军事  知道 是不是 做到 仁,-1
TRAIN_SENT_ID_265437,,薛谭,秦青,薛谭 原文 : 薛谭 学 讴 ① 于 秦青 ， 未穷 ② 青之技 ， 自谓 ③ 尽 之 ④ ， 遂 辞 归 。,人物一 原文  人物一 学 讴 ① 人物二  未穷 ② 青之技  自谓 ③ ④  遂 辞,-1
TRAIN_SENT_ID_259793,,李偲菘,李伟菘,这张 专辑 继续 由 李偲菘 、 李伟菘 兄弟 制作 ， 他们 是 孙燕姿 出 道 以来 的 所有 专辑 、 演唱会 的 制作 人 。,这张 专辑 继续 人物一  人物二 兄弟 制作  孙燕姿 出 道 专辑  演唱会 制作,1
TRAIN_SENT_ID_279229,,张民权,齐白石,母亲 － 赵粹艇 ， 与 张民权 同 是 毕业 于 北平 艺专 国画系 ， 师从 于 齐白石 ， 亲得 齐白石 画 熊猫 的 传授 （ 熊猫 国画 照 ） ， 乐乐熊 由来 于 此 。,母亲  赵粹艇  人物一 毕业 北平 艺专 国画系  师从 人物二  亲得 人物二 画 熊猫 传授  熊猫 国画   乐乐熊 由来,-1
TRAIN_SENT_ID_262194,,陈靖仇,陈辅,陈靖仇 救出 陈辅 ， 宁珂 热情 款待 他们 一行 人 ， 并 说出 了 许多 事实真相 。,人物一 救出 人物二  宁珂 热情 款待 一行  说出 事实真相,-1
TRAIN_SENT_ID_253836,,赵合德,赵飞燕,赵飞燕 听 了 妹妹 的 诉说 ， 也 感动 得 眼泪 直流 ， 将 自己 头上 的 紫玉九雏钗 取下 ， 簪 在 赵合德 的 发髻 上 。,人物二 听 妹妹 诉说  感动 眼泪 直流  头上 紫玉九雏钗 取下  簪 人物一 发髻,1
TRAIN_SENT_ID_271200,,张翠山,张三丰,武当派 张三丰 弟子 张翠山 与 白眉鹰 王之 女 殷素素 被 金毛狮 王 谢逊 抓 做 人质 带到 北海 的 一个 无人 荒岛 ， 《 倚天 屠龙记 》 冰火 岛 ( 8 张 ),武当派 人物二 弟子 人物一 白眉鹰 王之 女 殷素素 金毛狮 王 谢逊 抓 做 人质 带到 北海 一个 无人 荒岛   倚天 屠龙记  冰火 岛   张,-1
TRAIN_SENT_ID_267575,,吴魏,吴狄,吴狄 出身 平民 家庭 ， 在 一个 重组 家庭 里 长大 ， 十四岁 时 母亲 和 继父 遇 车祸 去世 ， 只有 继父 的 儿子 吴魏 勉强 可以 算作 一个 亲人 。,人物二 出身 平民 家庭  一个 重组 家庭 里 长大  十四岁 时 母亲 继父 遇 车祸 去世  继父 儿子 人物一 勉强 算作 一个 亲人,1
TRAIN_SENT_ID_266036,,贾珍,贾惜春,贾惜春 身份 研究 : 书里 说惜 春 是 宁国府 贾珍 的 胞妹 ， 并 没有 提到 她 是 贾敬 的 女儿 。,人物二 身份 研究  书里 说惜 春 宁国府 人物一 胞妹  没有 提到 贾敬 女儿,1
TRAIN_SENT_ID_260734,,薛丁山,薛金莲,薛丁山 、 薛金莲 小说 中 薛仁贵 之子 、 女 。,人物一  人物二 小说 中 薛仁贵 之子  女,1
TRAIN_SENT_ID_275272,,汤潮,赵本山,汤潮 个人 生活 : 说起 赵本山 的 徒弟 ， 大家 最先 想到 的 恐怕 是 小 沈 汤潮 ( 11 张 ),人物一 个人 生活  说起 人物二 徒弟  最先 想到 恐怕 沈 人物一   张,-1
TRAIN_SENT_ID_250424,,赵飞燕,赵合德,赵飞燕 听 了 妹妹 的 诉说 ， 也 感动 得 眼泪 直流 ， 将 自己 头上 的 紫玉九雏钗 取下 ， 簪 在 赵合德 的 发髻 上 。,人物一 听 妹妹 诉说  感动 眼泪 直流  头上 紫玉九雏钗 取下  簪 人物二 发髻,1
TRAIN_SENT_ID_251848,,梅超风,黄药师,后来 郭靖 被 梅超风 捉住 后 ， 黄蓉 认出 并 欺骗 说 黄药师 将来 ， 使得 梅超风 帮助 二人 脱困 [ 8 - 10 ] 。,后来 郭靖 人物一 捉住  黄蓉 认出 欺骗 说 人物二 将来  人物一 帮助 二人 脱困,-1
TRAIN_SENT_ID_268916,,司徒静,司徒剑南,司徒剑南 与 司徒静 四处寻找 ， 发现 文蔷 已 跳 崖 投江 ， 司徒剑南 亦 投江 殉情 。,人物二 人物一 四处寻找  发现 文蔷 跳 崖 投江  人物二 投江 殉情,1
TRAIN_SENT_ID_260684,,王重阳,全真七子,然而 记者 近日 获悉 ， 由 曲江 影视 投拍 的 电影 《 全真七子 》 将 于 明年 开拍 ， 而 赵长军 将 出演 全真七子 的 师父 王重阳 。,记者 近日 获悉  曲江 影视 投拍 电影  人物二  明年 开拍  赵长军 出演 人物二 师父 人物一,-1
TRAIN_SENT_ID_264557,,胡青牛,张无忌,常遇春 如实 回答 ， 当 胡青牛 得知 张无忌 时 武当 张翠山 的 儿子 时 ， 脸蕴 怒色 ， 他 的 规矩 是 只 给 明教 弟子 治病 。,常遇春 如实 回答  人物一 得知 人物二 时 武当 张翠山 儿子 时  脸蕴 怒色  规矩 明教 弟子 治病,-1
TRAIN_SENT_ID_273624,,马阔海,马青山,召唤 人 ： 柯胜 （ 主要 ） 、 马青山 、 马阔海 、 小 李子,召唤  柯胜  主要   人物二  人物一  李子,1
TRAIN_SENT_ID_259528,,梅超风,杨康,后 因 捕获 大 金 赵王 完颜洪烈 养子 杨康 而 引康 之师 、 陆氏 师姐 、 梅超风 来 救 。,捕获 金 赵王 完颜洪烈 养子 人物二 引康 之师  陆氏 师姐  人物一 救,-1
TRAIN_SENT_ID_268838,,骆羽,骆赢,混双 ： 何汉斌 / 包宜鑫 刘成 / 骆赢 李根 / 骆羽,混双  何汉斌  包宜鑫 刘成  人物二 李根  人物一,1
TRAIN_SENT_ID_266006,,王恬,王洽,注 ： 中间 二 行为 王恬 《 得示 帖 》 ， 左边 两 行为 王洽 《 辱告 帖 》 ， 选 自 《 淳化阁 帖 》,注  中间 二 行为 人物一  得示 帖   左边 两 行为 人物二  辱告 帖   选  淳化阁 帖,1
TRAIN_SENT_ID_257234,,艾欧里亚,艾俄洛斯,圣域 志 狮子 列传 第八 : 艾欧里亚 ， 希腊人 也 ， 射手 县侯 艾俄洛斯 弟 。,圣域 志 狮子 列传 第八  人物一  希腊人  射手 县侯 人物二 弟,1
TRAIN_SENT_ID_274315,,李迥,华阳公主,－ 775 年 ） ， 京兆 （ 今 陕西 西安 ） 人 ， 唐代宗 李豫 的 贵妃 ， 生韩王 李迥 、 华阳公主 。,年   京兆  陕西 西安   唐代宗 李豫 贵妃  生韩王 人物一  人物二,1
TRAIN_SENT_ID_257474,,姜昆,马季,主持人 ： 姜昆 、 马季 、 刘晓庆 、 王景愚,主持人  人物一  人物二  刘晓庆  王景愚,-1
TRAIN_SENT_ID_265492,,薛蝌,薛蟠,后 有 薛蟠 之 从弟 薛蝌 ， 因,人物二 从弟 人物一,1
TRAIN_SENT_ID_263544,,林逸,杨明,杨明 林逸 的 师父 ， 《 很纯 很 暧昧 》 的 主角 。,人物二 人物一 师父   很纯 暧昧  主角,-1
TRAIN_SENT_ID_274395,,贾演,贾源,其中 贾府 就 占 了 2 个 - - 宁国公 贾演 、 荣国公 贾源 。,贾府 占    宁国公 人物一  荣国公 人物二,1
TRAIN_SENT_ID_269358,,王中军,王中磊,曾 被 “ 伯乐 ” 王中军 发掘 ， 获 王中磊 提携 签约 华谊 兄弟 。,伯乐  人物一 发掘  获 人物二 提携 签约 华谊 兄弟,1
TRAIN_SENT_ID_278005,,严贡生,严监生,35 《 严贡生 和 严监生 》 （ 严监生 … …,人物一 人物二   人物二,1
TRAIN_SENT_ID_253880,,赵合德,赵飞燕,成帝 晚年 ， 又 沉溺 声色 ， 与 赵飞燕 、 赵合德 姐妹 纵情 淫乐 ， 将 政事,成帝 晚年  沉溺 声色  人物二  人物一 姐妹 纵情 淫乐  政事,1
TRAIN_SENT_ID_252448,,颜回,孔子,在 《 人世间 》 中 ， 又 借 孔子 与 颜回 的 对话 阐释 自己 的 理论 。,人世间  中  人物二 人物一 对话 阐释 理论,-1
TRAIN_SENT_ID_265554,,张崇基,张崇德,TakeItEasy （ 曲 / 编 ） ‖ 张崇基 / 张崇德 ‖ 【 TakeItEasy 】 ‖ 2009.04,曲  编  ‖ 人物一  人物二 ‖    ‖,1
TRAIN_SENT_ID_284536,,杨长在,杨志光,杨志光 - - 杨长在 、 张国庆,人物二   人物一  张国庆,-1
TRAIN_SENT_ID_271504,,孟优,孟获,761 兀突 骨 762 孟香 763 孟优 764 孟获 765 祝融 夫人 766 木鹿 大王 767 朵思 大王 768 沙摩柯 769 金环三结,兀突 骨  孟香  人物一  人物二  祝融 夫人  木鹿 大王  朵思 大王  沙摩柯  金环三结,1
TRAIN_SENT_ID_250380,,赵飞燕,赵合德,【 诬陷 】 汉成帝 和 赵飞燕 、 赵合德,诬陷  汉成帝 人物一  人物二,1
TRAIN_SENT_ID_266001,,王恬,王洽,王恬 王悦 王洽 王协 王劭 王荟,人物一 王悦 人物二 王协 王劭 王荟,1
TRAIN_SENT_ID_255296,,卫夫人,王羲之,初 月 帖 ( 局部 ) 王羲之 早年 又 从 卫夫人 学书 。,初 月 帖  局部  人物二 早年 人物一 学书,-1
TRAIN_SENT_ID_250408,,赵飞燕,赵合德,小说 人物 ： 汉成帝 ， 赵飞燕 ， 赵合德 ， 王太后 ， 班婕妤 ， 九 王爷,小说 人物  汉成帝  人物一  人物二  王太后  班婕妤  九 王爷,1
TRAIN_SENT_ID_262593,,郭芙蓉,郭蔷薇,克星 ： 邢育森 、 七舅 姥爷 、 郭芙蓉 、 郭蔷薇 （ 郭芙蓉 的 堂妹 ）,克星  邢育森  七舅 姥爷  人物一  人物二  人物一 堂妹,1
TRAIN_SENT_ID_251428,,李瀚章,李鸿章,这 与 李鸿章 的 大哥 李瀚章 有关 。,人物二 大哥 人物一,1
TRAIN_SENT_ID_275824,,陆无双,李莫愁,神 ： 小龙女 ， 程英 ， 陆无双 ， 李莫愁 ， 刘瑛 ， 公孙绿萼,神  小龙女  程英  人物一  人物二  刘瑛  公孙绿萼,-1
TRAIN_SENT_ID_248971,,吕洞宾,韩湘子,八仙 韩湘子 : 韩湘子 唐 韩湘子 ， 字 清夫 ， 是 古代 汉族 民间传说 故事 中 的 八仙 之一 ， 擅吹 洞箫 ， 拜 吕洞宾 为 师学道 。,八仙 人物二  人物二 唐 人物二  字 清夫  古代 汉族 民间传说 故事 中 八仙  擅吹 洞箫  拜 人物一 师学道,-1
TRAIN_SENT_ID_251430,,李瀚章,李鸿章,李瀚章 是 李鸿章 兄长 ， 查 有关 资料 ：,人物一 人物二 兄长  查 资料,1
TRAIN_SENT_ID_269560,,步鹰,燕双鹰,燕双鹰 万分 悲痛 之下 ， 将 步鹰 乱枪 击毙 。,人物二 万分 悲痛 之下  人物一 乱枪 击毙,-1
TRAIN_SENT_ID_255286,,卫夫人,王羲之,崔瑗 张芝 张昶 锺 繇 锺 会 韦诞 皇象 嵇康 卫瓘 卫夫人 索靖 谢安 王导 王敦 王廙 王洽 王珉 王羲之 王献之,崔瑗 张芝 张昶 锺 繇 锺 会 韦诞 皇象 嵇康 卫瓘 人物一 索靖 谢安 王导 王敦 王廙 王洽 王珉 人物二 王献之,-1
