sent_id,sent_id,entity1,entity2,sent,processed_sent,label
TRAIN_SENT_ID_250087,,武敦儒,武修文,儿时 玩伴 ： 程英 ， 武家兄弟 武敦儒 、 武修文,儿时 玩伴  程英  武家兄弟 人物一  人物二,1
TRAIN_SENT_ID_252458,,颜回,孔子,4.1 孔子 颜回 纵论 “ 心斋 ”,人物二 人物一 纵论  心斋,-1
TRAIN_SENT_ID_252868,,颜回,孔子,孔子 与 颜回,人物二 人物一,-1
TRAIN_SENT_ID_268941,,韩非,荀子,第八章 荀子 和 韩非,第八章 人物二 人物一,-1
TRAIN_SENT_ID_258128,,刘星,夏雪,夏雪 在 体育课 上 扭伤 了 脚 ， 刘星 不 愿意 道歉 。,人物二 体育课 扭伤 脚  人物一 愿意 道歉,1
TRAIN_SENT_ID_250698,,鲁西西,皮皮鲁,与 皮皮鲁 鲁西西 一起 长 大门 / 197,人物二 人物一 一起 长 大门,1
TRAIN_SENT_ID_276673,,萧玉妃,萧墨月,知己 好友 ： 萧玉妃 ， 萧墨月 。,知己 好友  人物一  人物二,1
TRAIN_SENT_ID_257224,,张子静,张爱玲,6 . 我 的 姊姊 张爱玲 - - 张子静,姊姊 人物二   人物一,1
TRAIN_SENT_ID_255424,,罗成,秦琼,第十五回 勇 秦琼 舞 简服 三军 小 罗成 射鹰助 一弩,第十五回 勇 人物二 舞 简服 三军 人物一 射鹰助 一弩,1
TRAIN_SENT_ID_250094,,武敦儒,武修文,武敦儒 、 武修文 的 名字 就 跟 “ 花铁干 ” 一样 ， 名字 不错 ， 可是 与 姓氏 冲突 。,人物一  人物二 名字  花铁干   名字 不错  姓氏 冲突,1
TRAIN_SENT_ID_253848,,赵合德,赵飞燕,这里 的 赵后 ， 就是 赵飞燕 ， 昭仪 就是 赵合德 。,赵后  人物二  昭仪 人物一,1
TRAIN_SENT_ID_261445,,毛泽建,毛泽东,她 的 乳名 叫 “ 菊 妹子 ” ， “ 毛泽建 ” 这个 名字 是 到 上屋 场后 ， 三哥 毛泽东 给 她 取 的 。,乳名  菊 妹子    人物一  名字 上屋 场后  三哥 人物二 取,1
TRAIN_SENT_ID_264876,,田猛,田虎,去 祭拜 大当家 田猛 时 ， 与 田虎 成功 请 得 “ 农家 第一 智囊 ” - - - 田猛 的 长女 田言 出山 ， 共谋 夺取 荧惑 之石 。,祭拜 大当家 人物一 时  人物二 成功 请  农家 第一 智囊     人物一 长女 田言 出山  共谋 夺取 荧惑 之石,1
TRAIN_SENT_ID_252995,,颜回,孔子,其七 ， 孔子 赞叹 颜回 虚怀若谷 。,其七  人物二 赞叹 人物一 虚怀若谷,-1
TRAIN_SENT_ID_255421,,罗成,秦琼,王伯当 送别 秦琼 、 罗成 、 程咬金 独自一人 留在 瓦岗 。,王伯当 送别 人物二  人物一  程咬金 独自一人 留在 瓦岗,1
TRAIN_SENT_ID_249253,,皮皮鲁,鲁西西,《 皮皮鲁 和 鲁西西 全传 》 是 由 四川 少年儿童出版社 1989 出版 的 书籍,人物一 人物二 全传  四川 少年儿童出版社  出版 书籍,1
TRAIN_SENT_ID_284829,,金正中,马小玲,马小玲 ： 这个 物体 叫 金正中 ， 是 我 的 徒弟 。,人物二  物体 人物一  徒弟,-1
TRAIN_SENT_ID_275652,,上官梅儿,上官兰心,上官梅儿 （ 女一号 ） ： 上官兰心 的 结拜 姐妹 ， 聪明伶俐 乖巧 ， 外表美丽 ， 蕙质兰心 ， 琴艺 高超 。,人物一  女一号   人物二 结拜 姐妹  聪明伶俐 乖巧  外表美丽  蕙质兰心  琴艺 高超,1
TRAIN_SENT_ID_254277,,张顺,张横,西南 水寨 张横 ， 张顺 两个 也 顺着 三人 ， 十分 撺掇 ！,西南 水寨 人物二  人物一 两个 三人  十分 撺掇,1
TRAIN_SENT_ID_282821,,松田翔太,松田龙平,私底下 的 好友 有 松田翔太 及其 哥哥 松田龙平 、 市原 隼 人 等 ， 龙一 有 在 看好 朋友 松田翔太 主演 的 连续剧 ‘ Liargame ’ 。,私底下 好友 人物一 哥哥 人物二  市原 隼  龙一 看好 朋友 人物一 主演 连续剧,1
TRAIN_SENT_ID_255411,,罗成,秦琼,"走向 传奇 内容简介 : 传奇世界 无处 不 传奇 , 关公 秦琼 比 义气 , 赵云 罗成 赛 枪法 , 张翼德 尉迟恭 谁 脸 更 黑 , 李元霸 和 李存孝 谁 更 牛 。",走向 传奇 内容简介  传奇世界 无处 传奇  关公 人物二 义气  赵云 人物一 赛 枪法  张翼德 尉迟恭 脸 更 黑  李元霸 李存孝 更 牛,1
TRAIN_SENT_ID_268809,,洪凌波,李莫愁,曾斗 之 人 ： 李莫愁 ， 郭 芙 ， 金轮法王 ， 洪凌波 ， 公孙止 ， 姬清虚 ， 申志凡 ， 皮清玄,曾斗  人物二  郭 芙  金轮法王  人物一  公孙止  姬清虚  申志凡  皮清玄,-1
TRAIN_SENT_ID_267509,,裘千丈,裘千仞,裘千丈 人物 家族 : 双胞胎 弟弟 ： 裘千仞,人物一 人物 家族  双胞胎 弟弟  人物二,1
TRAIN_SENT_ID_255404,,罗成,秦琼,也许 秦琼 有过 很多 生死 兄弟 ， 但是 罗成 却 只有 秦琼 一个 哥哥 。,也许 人物二 有过 很多 生死 兄弟  人物一 人物二 一个 哥哥,1
TRAIN_SENT_ID_253884,,赵合德,赵飞燕,然而 ， 赵氏 姐妹 （ 赵飞燕 、 赵合德 ） 的 入宫 ， 改变 了 整个 后宫 的 局面 。,赵氏 姐妹  人物二  人物一  入宫  改变 整个 后宫 局面,1
TRAIN_SENT_ID_274698,,张卫彝,张卫健,张卫彝 基本 简介 : 张卫彝 与 张卫健 张卫彝 ， 男 ， 香港 著名 男歌手 和 演员 张卫健 的 弟弟 。,人物一 基本 简介  人物一 人物二 人物一  男  香港 著名 男歌手 演员 人物二 弟弟,1
TRAIN_SENT_ID_249040,,吕洞宾,韩湘子,（ 神话 人物 ） : 韩湘子 ， 字 清夫 ， 是 古代 汉族 民间传说 故事 中 的 八仙 之一 ， 擅吹 洞箫 ， 拜 吕洞宾 为 师学道 。,神话 人物   人物二  字 清夫  古代 汉族 民间传说 故事 中 八仙  擅吹 洞箫  拜 人物一 师学道,-1
TRAIN_SENT_ID_274089,,南宫敬叔,孔子,孟懿子 和 南宫敬叔 学礼于 孔子 。,孟懿子 人物一 学礼于 人物二,-1
TRAIN_SENT_ID_274170,,平和岛静雄,平和岛幽,平和岛幽 人物 设定 : 平和岛静雄 的 弟弟 。,人物二 人物 设定  人物一 弟弟,1
TRAIN_SENT_ID_266310,,贾源,贾演,贾演 、 贾源 是 一母 同胞 弟兄 两个 。,人物二  人物一 一母 同胞 弟兄 两个,1
TRAIN_SENT_ID_250582,,鲁西西,皮皮鲁,因为 他 的 《 舒克和贝塔 》 、 《 皮皮鲁 和 鲁西西 》 动画 都 是 当之无愧 的 NUMONE ！,舒克和贝塔    人物二 人物一  动画 当之无愧,1
TRAIN_SENT_ID_261682,,程英,陆无双,杨过 评价 程英 “ 极 美的 姑娘 ” ， 陆无双 评价 “ 是 个 美人儿 ， 比 郭 芙 美丽 ” ， 大 武小武 两 兄弟 初见 程英 ： “ 墙头 那 男孩 摘 了 一朵花 。,杨过 评价 人物一  极 美的 姑娘   人物二 评价  美人儿  郭 芙 美丽   武小武 两 兄弟 初见 人物一   墙头 男孩 摘 一朵花,1
TRAIN_SENT_ID_262190,,陈靖仇,陈辅,"陈靖仇 在 陈辅 的 督促 下 , 身不由己 的 开始 了 寻找 神器 的 旅程 … …",人物一 人物二 督促  身不由己 寻找 神器 旅程,-1
TRAIN_SENT_ID_286108,,崔磊,陈天星,导演 ： 崔磊 ， 陈天星,导演  人物一  人物二,-1
TRAIN_SENT_ID_257564,,毛泽民,毛泽东,他 是 毛泽东 的 弟弟 毛泽民 。 ”,人物二 弟弟 人物一,1
TRAIN_SENT_ID_255270,,卫夫人,王羲之,从此以后 ， 在 卫夫人 的 具体 辅导 下 ， 王羲之 练字 更加 努力 了 。,从此以后  人物一 具体 辅导  人物二 练字 更加 努力,-1
TRAIN_SENT_ID_254293,,张顺,张横,张横 名人 点评 : 邵氏 《 荡寇 志 》 中 的 张横 金圣叹 ： 阮小二 、 阮小五 、 张横 、 张顺 ， 都 是 中 上 人物 。,人物二 名人 点评  邵氏  荡寇 志  中 人物二 金圣叹  阮小二  阮小五  人物二  人物一  中 人物,1
TRAIN_SENT_ID_263365,,武修文,武敦儒,与 杨过 对比 ， 武敦儒 、 武修文 更显 脓包 、 废物 。,杨过  人物二  人物一 更显 脓包  废物,1
TRAIN_SENT_ID_255327,,卫夫人,王羲之,三国 高贵 公曹髦 后裔 ， 早年 学书 ， 师法 王羲之 、 卫夫人 等 ， 擅画 马 ， 尤精 鞍马 人物 。,三国 高贵 公曹髦 后裔  早年 学书  师法 人物二  人物一  擅画 马  尤精 鞍马 人物,-1
TRAIN_SENT_ID_251436,,李瀚章,李鸿章,李鸿章 做 湖广 总督 ， 不满 一年 ， 就 调任 直隶 总督 ， 接任 湖广 总督 的 是 他 的 哥哥 李瀚章 。,人物二 做 湖广 总督  不满 一年  调任 直隶 总督  接任 湖广 总督 哥哥 人物一,1
TRAIN_SENT_ID_266045,,张学思,张学良,至此 ， 周恩来 和 张学铭 、 张学思 的 信 ， 才 辗转 送到 张学良 的 手里 。,至此  周恩来 张学铭  人物一 信  辗转 送到 人物二 手里,1
TRAIN_SENT_ID_276959,,樊迟,孔子,故 樊迟 请学稼圃 ， 孔子 讥为 小人 。,人物一 请学稼圃  人物二 讥为 小人,-1
TRAIN_SENT_ID_261583,,南宫敬叔,孟懿子,孟懿子 和 南宫敬叔 学礼于 孔子 。,人物二 人物一 学礼于 孔子,1
TRAIN_SENT_ID_251553,,楚碧痕,楚寒镜,楚碧痕 ： 长久 居于 月 之 幽境 的 梭罗树 仙 ， 和 姐姐 楚寒镜 出于 同一 精魂 。,人物一  长久 居于 月 幽境 梭罗树 仙  姐姐 人物二 同一 精魂,1
TRAIN_SENT_ID_262265,,尤二姐,尤三姐,人物 评析 : 与 尤二姐 的 懦弱 、 屈辱 、 糊涂 、 和善 相对 比 的 是 尤三姐 ， 她 是 刚烈 、 自尊 、 清醒 、 泼辣 的 。,人物 评析  人物一 懦弱  屈辱  糊涂  和善 相对 人物二  刚烈  自尊  清醒  泼辣,1
TRAIN_SENT_ID_252754,,颜回,孔子,颜回 卒 ， 孔子 十分 悲伤 。,人物一 卒  人物二 十分 悲伤,-1
TRAIN_SENT_ID_261139,,武元庆,武则天,武则天 的 母亲 便 把 两个 儿子 武元庆 、 武元爽 领 出让 袁天罡 相面 ， 可是 袁天罡 一看 说 可以 官至 三品 ， 只不过 是 能 保家 的 主儿 ， 还 不算 大贵 。,人物二 母亲 便 两个 儿子 人物一  武元爽 领 出让 袁天罡 相面  袁天罡 一看 说 官至 三品  只不过 保家 主儿  不算 大贵,1
TRAIN_SENT_ID_276151,,贾惜春,贾珍,贾惜春 - - - - 贾珍 的 胞妹 。,人物一     人物二 胞妹,1
TRAIN_SENT_ID_265569,,张崇基,张崇德,「 香港 版本 」 名字 ： 龙珠 主唱 ： 张崇基 张崇德,香港 版本  名字  龙珠 主唱  人物一 人物二,1
TRAIN_SENT_ID_282572,,尹寿山,马德禄,马德禄 — — 高寿亭 、 高桂清 、 杨 闻华 、 尹寿山 、 郭荣起,人物二   高寿亭  高桂清  杨 闻华  人物一  郭荣起,-1
TRAIN_SENT_ID_277016,,钟藜,钟馗,钟馗 回到 终南山 ， 得知 他 的 同村 知友 杜 钟藜 ( 50 张 ),人物二 回到 终南山  得知 同村 知友 杜 人物一   张,1
TRAIN_SENT_ID_275545,,王小虎,赵本山,李大国 饰演者 信息 : 王小虎 ， 二人转 演员 出身 ， 赵本山 的 第十个 徒弟 。,李大国 饰演者 信息  人物一  二人转 演员 出身  人物二 第十个 徒弟,-1
TRAIN_SENT_ID_274679,,马冬晗,马冬昕,清华 学霸 “ 姐妹花 ” 马冬晗 与 马冬昕,清华 学霸  姐妹花  人物一 人物二,1
TRAIN_SENT_ID_257537,,毛泽民,毛泽东,这里 所说 的 四嫂 ， 就是 毛泽东 大 弟弟 毛泽民 的 结发 妻子 王淑兰 。,所说 四嫂  人物二 弟弟 人物一 结发 妻子 王淑兰,1
TRAIN_SENT_ID_282568,,何奎,归有光,1 概述 : 何奎 ， 号 郎峰 ， 安徽 南陵 “ 十里 三峰 ” 名臣 ， 明代 著名 散文家 归有光 的 弟子 。,概述  人物一  号 郎峰  安徽 南陵  十里 三峰  名臣  明代 著名 散文家 人物二 弟子,-1
TRAIN_SENT_ID_277687,,平阳君,赵惠文王,平阳君 ， 是 平原君赵胜 的 兄弟 ， 赵惠文王 的 弟弟 ， 赵孝成王 的 叔叔 。,人物一  平原君赵胜 兄弟  人物二 弟弟  赵孝成王 叔叔,1
TRAIN_SENT_ID_261960,,何冲,何超,何冲 家庭成员 : 何冲 的 胞弟 何超 ， 也 是 中国跳水队 的 队员 。,人物一 家庭成员  人物一 胞弟 人物二  中国跳水队 队员,1
TRAIN_SENT_ID_267156,,靳月光,靳月华,靳月华 和 她 的 姐姐 靳月光 同时 被 刘聪 封为 贵嫔 。,人物二 姐姐 人物一 刘聪 封为 贵嫔,1
TRAIN_SENT_ID_277755,,宋玉华,宋玉致,第三 百 九十七 章 宋玉致 的 殇 ， 宋玉华 的 刀,第三 百 九十七 章 人物二 殇  人物一 刀,1
TRAIN_SENT_ID_264959,,林一峰,林二汶,林一峰 （ 林二汶 的 哥哥 ） 、 林嘉欣 、 黄耀明 、 at17 的 另 一位 成员 卢凯彤 以及 林二汶 的 家人 朋友 分别 给 本 书写 了 很 特别 的 文字 。,人物一  人物二 哥哥   林嘉欣  黄耀明   一位 成员 卢凯彤 人物二 家人 朋友 书写 特别 文字,1
TRAIN_SENT_ID_249295,,陆无双,程英,"杨过 , 小龙女 , 程英 , 陆无双 , 公孙绿萼 , 他们 又会有 什么 不 一样 的 境遇 呢 ?",杨过  小龙女  人物二  人物一  公孙绿萼  又会有 境遇,1
TRAIN_SENT_ID_281463,,楚衡阳王,马希范,马 楚衡阳王 马希声 和 文昭 王 马希范 均 使用,马 人物一 马希声 文昭 王 人物二 均 使用,1
TRAIN_SENT_ID_260726,,王重阳,全真七子,第一节 全真七子 拜师 王重阳,第一节 人物二 拜师 人物一,-1
TRAIN_SENT_ID_250398,,赵飞燕,赵合德,燕赤凤 汉书 中 的 赵飞燕 与 赵合德 两姐妹 : 《 汉书 》 有云 ： “ 自鸿嘉后 ， 上 稍 隆于 内 宠 。,燕赤凤 汉书 中 人物一 人物二 两姐妹   汉书  有云   自鸿嘉后  稍 隆于 宠,1
TRAIN_SENT_ID_256565,,周武,周文,周武 王十三 年 ， 周武 王姬 发伐纣克 商后 ， 封 周文 王之弟 虢叔于 颛顼 后裔 祝融 之墟 ， 历史 上 叫 东虢国 ( 今 河南 荥阳市 广武 一带 ) 。,人物一 王十三 年  人物一 王姬 发伐纣克 商后  封 人物二 王之弟 虢叔于 颛顼 后裔 祝融 之墟  历史 东虢国  河南 荥阳市 广武 一带,1
TRAIN_SENT_ID_270557,,全真七子,王重阳,防御 路线 走 王重阳 ， 全真七子 相应 点灯 。,防御 路线 走 人物二  人物一 相应 点灯,-1
TRAIN_SENT_ID_277655,,关彝,关统,关彝 人物 概述 : 关彝 历史 概况 : 关彝 ， 关兴 的 庶子 ， 在 兄长 关统 去世 后 继承 爵位 。,人物一 人物 概述  人物一 历史 概况  人物一  关兴 庶子  兄长 人物二 去世 继承 爵位,1
TRAIN_SENT_ID_264562,,胡青牛,张无忌,胡青牛 正式 出场 : 常遇春 带 着 张无忌 去往 蝴蝶谷 寻求 胡青牛 的 治疗 时 ， 胡青牛 在 书 中 首次 出场 。,人物一 正式 出场  常遇春 带 人物二 去往 蝴蝶谷 寻求 人物一 治疗 时  人物一 书 中 首次 出场,-1
TRAIN_SENT_ID_251516,,陈辅,陈靖仇,陈靖仇 是 陈国 后裔 ， 在 襁褓 时代 隋朝 四处 搜捕 陈国 遗族 时 ， 他 的 师父 陈辅 牺牲 了 自己 的 孙儿 ， 冒险 将 陈靖仇 替代 救出 。,人物二 陈国 后裔  襁褓 时代 隋朝 四处 搜捕 陈国 遗族 时  师父 人物一 牺牲 孙儿  冒险 人物二 救出,-1
TRAIN_SENT_ID_261569,,南宫敬叔,孟懿子,孟 孙氏 南宫敬叔 仲孙阅 : 南宫敬叔 ， 姬姓 ， 鲁国 南宫 氏 ， 名阅 或 说 ， 一名 绦 ， 谥敬 ， 是 孟僖子 的 儿子 ， 孟懿子 的 弟弟 。,孟 孙氏 人物一 仲孙阅  人物一  姬姓  鲁国 南宫 氏  名阅 说  一名 绦  谥敬  孟僖子 儿子  人物二 弟弟,1
TRAIN_SENT_ID_260963,,杨露禅,陈长兴,杨露禅 准备 去 河南 陈家沟 ， 拜 太极 高手 陈长兴 为师 ， 路遇 女扮男装 的 格格 公主 、 广平 小霸王 柳大年 。,人物一 准备 河南 陈家沟  拜 太极 高手 人物二 为师  路遇 女扮男装 格格 公主  广平 小霸王 柳大年,-1
TRAIN_SENT_ID_268936,,韩非,荀子,韩子 解释 : 韩子 指 韩非 : 韩非 ( 前 280 年 - - 前 233 年 ) ， 韩非 尊称 韩非子 或 韩子 ， 韩王 歇 之子 、 荀子 的 学生 。,韩子 解释  韩子 指 人物一  人物一  前  年   前  年   人物一 尊称 人物一子 韩子  韩王 歇 之子  人物二 学生,-1
TRAIN_SENT_ID_279324,,陈玄风,黄药师,桃花岛 岛主 黄药师 门下 弟子 陈玄风 、 梅超风 ， 俩 人 学艺 未 成 ， 却 暗中 相爱 ， 又 担心 被 师父 发觉 性命不保 ， 就 偷偷 逃离 桃花岛 。,桃花岛 岛主 人物二 门下 弟子 人物一  梅超风  俩 学艺 未 成  暗中 相爱  担心 师父 发觉 性命不保  偷偷 逃离 桃花岛,-1
TRAIN_SENT_ID_267432,,陆展元,陆立鼎,陆家庄 : 陆家庄 在 《 神雕 》 中是 陆展元 、 陆立鼎 两 兄弟 的 庄院 ， 小说 第一回 中 写道 的 故事情节 就是 在 这府院 发生 的 。,陆家庄  陆家庄  神雕  中是 人物一  人物二 两 兄弟 庄院  小说 第一回 中 写道 故事情节 这府院 发生,1
TRAIN_SENT_ID_274084,,南宫敬叔,孔子,孔子 私学 的 学生 主要 是 由 平民 所 组成 的 ﹐ 据近 人 考证 ﹐ 孔子 学生 真正 来自 贵族 的 ﹐ 只有 南宫敬叔 ﹑ 司马 牛 和 孟懿子 等 少数几 人 。,人物二 私学 学生 主要 平民 组成 ﹐ 据近 考证 ﹐ 人物二 学生 真正 贵族 ﹐ 人物一  司马 牛 孟懿子 少数几,-1
TRAIN_SENT_ID_248971,,吕洞宾,韩湘子,八仙 韩湘子 : 韩湘子 唐 韩湘子 ， 字 清夫 ， 是 古代 汉族 民间传说 故事 中 的 八仙 之一 ， 擅吹 洞箫 ， 拜 吕洞宾 为 师学道 。,八仙 人物二  人物二 唐 人物二  字 清夫  古代 汉族 民间传说 故事 中 八仙  擅吹 洞箫  拜 人物一 师学道,-1
TRAIN_SENT_ID_252640,,颜回,孔子,颜回 请教 孔子 说 ： “ 孟孙才 这个 人 ， 他 的 母亲 死 了 ， 哭泣 时 没有 一滴 眼泪 ， 心中 不觉 悲伤 ， 居丧 时 也 不 哀痛 。,人物一 请教 人物二 说   孟孙才  母亲 死  哭泣 时 没有 一滴 眼泪  心中 不觉 悲伤  居丧 时 哀痛,-1
TRAIN_SENT_ID_268915,,司徒静,司徒剑南,二人 都 吃惊 ， 司徒静 谎称 是 司徒府 二 公子 ， 并 说明 文韬 强横 真相 ， 朱允 承诺 帮助 司徒剑南 。,二人 吃惊  人物一 谎称 司徒府 二 公子  说明 文韬 强横 真相  朱允 承诺 帮助 人物二,1
TRAIN_SENT_ID_279085,,程英,黄药师,程英 ： 因 李莫愁 血洗 陆家庄 ， 为 黄药师 救 去 ， 后来 见 其 乖巧 可爱 ， 收为 徒弟 。,人物一  李莫愁 血洗 陆家庄  人物二 救  后来 见 乖巧 可爱  收为 徒弟,-1
TRAIN_SENT_ID_249293,,陆无双,程英,陆无双 要 陪 杨过 等 小龙女 ， 郭 芙 出言 讥讽 ， 程英 轻描淡写 为 她 全 挡回去 ； 她 说 她 也 跟 杨过 一起 等 。,人物一 陪 杨过 小龙女  郭 芙 出言 讥讽  人物二 轻描淡写 全 挡回去  说 杨过 一起,1
TRAIN_SENT_ID_264944,,贾元春,贾宝玉,八十回 后 之 贾元春 ， 史湘云 嫁 贾宝玉 说 辨 林黛玉 之死 ， 贾宝玉 真的 “ 悬崖撒手 ” 了 吗 ？,八十回 人物一  史湘云 嫁 人物二 说 辨 林黛玉 之死  人物二 真的  悬崖撒手,1
TRAIN_SENT_ID_276932,,樊迟,孔子,樊迟 樊迟 墓 : 孔子 去世 后 ， 樊迟 同 闵子 ( 名损 ， 字子 骞 ) 和 宓子 ( 名 不齐 ， 字子 贱 ) 来棠 地 ( 今 鱼台县 境内 ) 办学 ， 传道 于 济水 一带 。,人物一 人物一 墓  人物二 去世  人物一 闵子  名损  字子 骞  宓子  名 不齐  字子 贱  来棠  鱼台县 境内  办学  传道 济水 一带,-1
TRAIN_SENT_ID_256825,,孙周,孙淳,孙淳 、 孙周 兄弟俩 一同 追忆 艰苦 岁月 的 艰苦 镜头 。,人物二  人物一 兄弟俩 一同 追忆 艰苦 岁月 艰苦 镜头,1
TRAIN_SENT_ID_249065,,吕洞宾,韩湘子,中国 民间 流传 的 八位 仙人 ， 道教 援引 改造 之 ， 成 一组 上仙 ， 即 铁拐李 、 钟离权 、 吕洞宾 、 张果老 、 曹国舅 、 韩湘子 、 蓝采和 、 何仙姑 。,中国 民间 流传 八位 仙人  道教 援引 改造  成 一组 上仙  铁拐李  钟离权  人物一  张果老  曹国舅  人物二  蓝采和  何仙姑,-1
TRAIN_SENT_ID_261607,,宋小宝,赵本山,于是 ， 宋小宝 就 成 了 赵本山 的 徒弟 。,人物一 成 人物二 徒弟,-1
TRAIN_SENT_ID_267515,,裘千丈,裘千仞,裘千丈 ， 金庸 武侠小说 《 射雕 英雄传 》 中 人物 ， 铁掌 帮 帮主 裘千仞 的 双胞胎 哥哥 （ 详见 83 版 射雕 英雄传 ） 。,人物一  金庸 武侠小说  射雕 英雄传  中 人物  铁掌 帮 帮主 人物二 双胞胎 哥哥  详见  版 射雕 英雄传,1
TRAIN_SENT_ID_263012,,龙俊杰,王学明,获奖 情况 : 周艳霞 副教授 2004 年 在 上海戏剧学院 新 空间 剧场 举办 个人 独唱 音乐会 ， 龙俊杰 、 李学通 、 王学明 。,获奖 情况  周艳霞 副教授  年 上海戏剧学院 新 空间 剧场 举办 个人 独唱 音乐会  人物一  李学通  人物二,-1
TRAIN_SENT_ID_257569,,毛泽民,毛泽东,关键字 ： 爱 革命 共产国际 毛泽东 耘 山 周燕 革命 与 爱 革命 与 爱 : （ 跨越 时空 的 追问 — — 毛泽民 远 赴 莫斯科 的 真实 使命 ）,关键字  爱 革命 共产国际 人物二 耘 山 周燕 革命 爱 革命 爱   跨越 时空 追问   人物一 远 赴 莫斯科 真实 使命,1
TRAIN_SENT_ID_269573,,水笙,汪啸风,水笙 ， 金庸 武侠小说 《 连城诀 》 的 女主角 之一 ， 与 表哥 汪啸风 合称 “ 铃剑 双侠 ” 。,人物一  金庸 武侠小说  连城诀  女主角  表哥 人物二 合称  铃剑 双侠,1
TRAIN_SENT_ID_274065,,南宫敬叔,孔子,连鲁 大夫 孟僖子 其子 孟懿子 和 南宫敬叔 来学礼 ， 可见 孔子 办学 已 名闻遐迩 。,连鲁 大夫 孟僖子 其子 孟懿子 人物一 来学礼  人物二 办学 名闻遐迩,-1
TRAIN_SENT_ID_265436,,薛谭,秦青,例如 《 薛谭 学 讴 》 ( 《 列子 》 ) 这则 寓言 ， 说 的 是 薛谭 向 秦青 学习 唱歌 ， 自 认为 已经 学到 了 老师 的 全部 本领 ， 于是 辞别 老师 回家 。,人物一 学 讴    列子   这则 寓言  说 人物一 人物二 学习 唱歌  认为 已经 学到 老师 本领  辞别 老师 回家,-1
TRAIN_SENT_ID_278786,,李夏曦,李冬旭,李冬旭 剧情简介 : 该剧 讲述 了 讲述 了 法律系 学生 李夏曦 半工半读 ， 为 生意 失败 的 父亲 还债 。,人物二 剧情简介  该剧 讲述 讲述 法律系 学生 人物一 半工半读  生意 失败 父亲 还债,1
TRAIN_SENT_ID_249542,,李蔡,李广,李广 死 第二年 ， 李蔡 因罪 自杀 。,人物二 死 第二年  人物一 因罪 自杀,1
TRAIN_SENT_ID_273643,,姜子牙,元始天尊,封神 英雄榜 剧情简介 : 姜子牙 师从 元始天尊 ， 修道 中 野鸡 精 和 狐狸精 误会 冲突 ， 二 妖 联合 玉石 琵琶 精向 女娲 媒体 探班照 ( 34 张 ),封神 英雄榜 剧情简介  人物一 师从 人物二  修道 中 野鸡 精 狐狸精 误会 冲突  二 妖 联合 玉石 琵琶 精向 女娲 媒体 探班照   张,-1
TRAIN_SENT_ID_269001,,韩非,荀子,一般 认为 ， 性恶论 由 先秦 儒家 的 集大成者 荀子 提出 ， 继而 为 法家 代表 韩非 所 发展 ， 在 我国 历史 上 有 其 深远影响 。,认为  性恶论 先秦 儒家 集大成者 人物二 提出  法家 代表 人物一 发展  我国 历史 深远影响,-1
TRAIN_SENT_ID_252561,,颜回,孔子,这 其实 并 不是 什么 高深 的 理论 ， 而 只有 在实践中 才能 真正 体会 和 领悟 ， 所以 颜回 对 孔子 说 ： 我 虽然 不 大 聪明 ， 但会 依照 先生 说 的 去 做 。,其实 高深 理论  在实践中 真正 体会 领悟  人物一 人物二 说  聪明  但会 先生 说 做,-1
TRAIN_SENT_ID_256837,,仲由,孔子,孔门 弟子 仲由 : 仲由 （ 前 542 ～ 前 479 ） ， 鲁国 卞 （ 今 山东 泗水县 泉林 镇 卞 桥村 ） 人 ， 字 子路 ( 又 字 季路 ) ， 小 孔子 九岁 。,孔门 弟子 人物一  人物一  前   前    鲁国 卞  山东 泗水县 泉林 镇 卞 桥村   字 子路  字 季路   人物二 九岁,-1
TRAIN_SENT_ID_283267,,葛珊珊,赵本山,原名 ： 葛珊珊 性别 ： 女生 日 ： 1983 年 8 月 17 日 出生 籍贯 ： 吉林省 德惠市 人物 介绍 ： 是 赵本山 老师 收下 的 第五批 徒弟,原名  人物一 性别  女生 日   年  月  日 出生 籍贯  吉林省 德惠市 人物 介绍  人物二 老师 收下 第五批 徒弟,-1
TRAIN_SENT_ID_282742,,刘令娴,刘孝绰,刘孝绰 有 三个 妹妹 ， 大妹 嫁琅 琊 人 王淑英 ， 世称 刘 大娘 ， 当时 也 有 文集 行世 ， 与 刘令娴 齐名 ； 二妹 嫁 吴 郡 人 张嵊 。,人物二 三个 妹妹  大妹 嫁琅 琊 王淑英  世称 刘 大娘  当时 文集 行世  人物一 齐名  二妹 嫁 吴 郡 张嵊,1
TRAIN_SENT_ID_252790,,颜回,孔子,鲤即 孔鲤 ， 孔子 的 儿子 ； 回即 颜回 ， 孔子 的 学生 ； 二人 都 因 贫穷 ， 死 了 买不起 棺材 。,鲤即 孔鲤  人物二 儿子  回即 人物一  人物二 学生  二人 贫穷  死 买不起 棺材,-1
TRAIN_SENT_ID_249088,,吕洞宾,韩湘子,妈祖 ： 神仙 谱系 八仙 : 铁拐李 汉 钟离 张果老 何仙姑 蓝采和 吕洞宾 韩湘子 曹国舅 神仙 谱系 真人 和 仙人 : 四大 真人 ：,妈祖  神仙 谱系 八仙  铁拐李 汉 钟离 张果老 何仙姑 蓝采和 人物一 人物二 曹国舅 神仙 谱系 真人 仙人  四大 真人,-1
TRAIN_SENT_ID_252452,,颜回,孔子,孔子 曾经 称赞 说 : “ 有 颜回 者 好学 ， 不 迁怒 ， 不二 过 ” ， “ 一箪食 ， 一瓢 饮 ， 居 陋巷 ， 人 不堪其忧 ， 回 也 不改其乐 ， 贤哉 回 也 ” 。,人物二 曾经 称赞 说   人物一 好学  迁怒  不二    一箪食  一瓢 饮  居 陋巷  不堪其忧  回 不改其乐  贤哉 回,-1
