sent_id,entity1,entity2,sent,processed_sent,label,hard_match
TRAIN_SENT_ID_262906,熊美玲,林秋离,03 . 谁 若 爱 你 比 我 多 词 ： 林秋离 曲 ： 熊美玲,爱 词  人物二 曲  人物一,1,0
TRAIN_SENT_ID_268090,樊梨花,薛丁山,6 薛丁山 三气 樊梨花 任剑辉 、 邓碧云 、 李海泉 、 林家声,人物二 三气 人物一 任剑辉  邓碧云  李海泉  林家声,1,0
TRAIN_SENT_ID_279252,长孙无极,孟扶摇,孟扶摇 忍不住 笑一笑 ， 长孙无极 凑身 过去 ， 吻吻 她 额角 ， 道 ： “ 你 这 小 傻瓜 ， 劝 你 是 没用 的 ， 咱们 … …,人物二 忍不住 笑一笑  人物一 凑身 过去  吻吻 额角  道   傻瓜  劝 没用,1,0
TRAIN_SENT_ID_276083,陈三立,陈宝箴,陈宝箴 诗作 纪念 : 陈三立 《 壬寅 长至靖 庐谒 墓 》 ： “ 天乎 有 此庐 ， 我 拂 苍松 入 。,人物二 诗作 纪念  人物一  壬寅 长至靖 庐谒 墓    天乎 此庐  拂 苍松 入,-1,0
TRAIN_SENT_ID_278720,叶一茜,田亮,6 、 《 小小的 美好 》 演唱 ： 夏 克立 、 黄嘉千 、 夏天 、 田亮 、 叶一茜 、 田雨 橙,小小的 美好  演唱  夏 克立  黄嘉千  夏天  人物二  人物一  田雨 橙,1,0
TRAIN_SENT_ID_278169,赵姨娘,贾政,首先 ， 她 得到 了 赵姨娘 的 有力 支持 ， 并 将 此事 传递 给 了 贾府 的 最高 舵手 贾政 。,得到 人物一 有力 支持  此事 传递 贾府 最高 舵手 人物二,1,0
TRAIN_SENT_ID_278042,李元霸,李渊,李渊 怕 恩公 秦琼 及 瓦岗寨 众将 遭 力大无比 的 李元霸 伤害 ， 暗通 瓦岗寨 众将 插 黄旗 作 标志 ， 使元霸 避让 。,人物二 怕 恩公 秦琼 瓦岗寨 众将 遭 力大无比 人物一 伤害  暗通 瓦岗寨 众将 插 黄旗 作 标志  使元霸 避让,-1,0
TRAIN_SENT_ID_260232,穆桂英,杨宗保,穆桂英 三擒三纵 杨宗保 ( 1956 ) ....,人物一 三擒三纵 人物二,1,0
TRAIN_SENT_ID_270769,梁萧,花晓霜,此时 ， 柳莺莺 却 决定 成全 梁萧 、 花晓霜 ， 独自 黯然 离去 … …,柳莺莺 决定 成全 人物一  人物二  独自 黯然 离去,1,0
TRAIN_SENT_ID_262016,王明华,梅兰芳,如今 王明华 与 福芝芳 陪伴 在 梅兰芳 两侧 ， 长眠 在 香山 万花山 。,如今 人物一 福芝芳 陪伴 人物二 两侧  长眠 香山 万花山,1,0
TRAIN_SENT_ID_285443,蒋宏杰,魏哲浩,魏哲浩 与 蒋宏杰,人物二 人物一,1,0
TRAIN_SENT_ID_281466,王晴,李梦男,主演 ： 高强 、 李梦男 、 迟志强 、 王龙 、 王晴 、 刁熙娟,主演  高强  人物二  迟志强  王龙  人物一  刁熙娟,1,0
TRAIN_SENT_ID_270406,关平,关羽,关羽 部将 廖化 、 关平 率军 攻打 襄阳 ， 曹操 部将 曹仁 领兵 抵抗 ， 结果 大败 ， 退守 樊城 。,人物二 部将 廖化  人物一 率军 攻打 襄阳  曹操 部将 曹仁 领兵 抵抗  大败  退守 樊城,-1,0
TRAIN_SENT_ID_257189,孙秀青,西门吹雪,可惜 ， 西门吹雪 只爱过 孙秀青 ， 试验 次数 太 少 ， 不 具有 普遍性 ， 不能 作为 实验 结论 。,可惜  人物二 只爱过 人物一  试验 次数 太 少  具有 普遍性  不能 实验 结论,1,0
TRAIN_SENT_ID_257319,贾珍,尤氏,职位 ： 宁国府 贾珍 媳妇 尤氏 的 丫鬟,职位  宁国府 人物一 媳妇 人物二 丫鬟,1,0
TRAIN_SENT_ID_272083,张翠山,殷素素,把 张翠山 和 殷素素 强行 带走 ， 想 找 清静 的 地方 研究 。,人物一 人物二 强行 带走  想 找 清静 地方 研究,1,1
TRAIN_SENT_ID_255587,蒋介石,宋美龄,在 孙 公馆 ， 蒋介石 见到 了 聪颖 、 美貌 的 宋美龄 。,孙 公馆  人物一 见到 聪颖  美貌 人物二,1,0
TRAIN_SENT_ID_259152,刘备,刘禅,注 ： 刘备 与 刘禅 又 分别 称 先主 与 后主 。,注  人物一 人物二 称 先主 后主,-1,0
TRAIN_SENT_ID_284049,赵力平,朱琦,在 延安 ， 朱琦 和 赵力平 ( 1926 - ) 相遇 了 。,延安  人物二 人物一     相遇,1,0
TRAIN_SENT_ID_259040,刘备,刘禅,则 是 写 刘备 过世 后 ， 诸葛亮 辅佐 后主 刘禅 ， 为 蜀国 竭尽全力 。,写 人物一 过世  诸葛亮 辅佐 后主 人物二  蜀国 竭尽全力,-1,-1
TRAIN_SENT_ID_250014,张无忌,赵敏,殷姑娘 （ 周芷若 、 赵敏 、 小昭 、 张无忌 称 ）,殷姑娘  周芷若  人物二  小昭  人物一 称,1,0
TRAIN_SENT_ID_275672,梁济,梁漱溟,— “ 妈妈 同志 ” — “ 我来 延安 透透 新鲜空气 ” — 仇必 和 而解 梁济 自杀 — “ 这个 世界 会 好 吗 ” — “ 梁漱溟 滚 下台 来 ！ ”,妈妈 同志    我来 延安 透透 新鲜空气   仇必 而解 人物一 自杀   世界 会    人物二 滚 下台,-1,0
TRAIN_SENT_ID_270300,宣姜,卫宣公,"当然 ， 她们 姓 姜 , 姐姐 嫁给 了 卫宣公 , 被 称为 宣姜 , 妹妹 被 称为 文姜 , 嫁给 了 鲁恒公 。",姓 姜  姐姐 嫁给 人物二  称为 人物一  妹妹 称为 文姜  嫁给 鲁恒公,1,-1
TRAIN_SENT_ID_275305,潘巧云,杨雄,杨雄 醉 归 ， 潘巧云 及婢 迎 水彩画 《 蓟县 的 翠屏山 》 吴玉阳 作儿 反诬 石秀 戏己 。,人物二 醉  人物一 及婢 迎 水彩画  蓟县 翠屏山  吴玉阳 作儿 反诬 石秀 戏己,1,0
TRAIN_SENT_ID_252205,秦嘉,徐淑,《 秦嘉 · 与妇 徐淑 书 》 今致 宝钗 一双 ， 可耀首 。,人物一  与妇 人物二 书  今致 宝钗 一双  可耀首,1,0
TRAIN_SENT_ID_255622,蒋介石,宋美龄,作者 按 ： 古达程 ， 名兆鹏 ， 宋美龄 秘书 ， 曾 在 蒋介石 侍从 二处 工作 。 ),作者  古达程  名兆鹏  人物二 秘书  人物一 侍从 二处 工作,1,0
TRAIN_SENT_ID_286130,郭子睿,郭涛,四 、 歌曲 《 爸爸 去 哪儿 》 演唱 ： 田亮 、 田雨 橙 、 王岳伦 、 王诗龄 、 张亮 、 张悦轩 、 林志颖 、 小小 志 、 郭涛 、 郭子睿,四  歌曲  爸爸  演唱  田亮  田雨 橙  王岳伦  王诗龄  张亮  张悦轩  林志颖  小小 志  人物二  人物一,-1,0
TRAIN_SENT_ID_281568,陈二狗,曹蒹葭,曹蒹葭 蒹 葭 出场 : 1 、 陈二狗 初见 蒹 葭,人物二 蒹 葭 出场    人物一 初见 蒹 葭,1,0
TRAIN_SENT_ID_282723,张庭,林瑞阳,他 与 张庭 林瑞阳 的 微信 来往 可以 给 剧本 作证 。,人物一 人物二 微信 来往 剧本 作证,1,0
TRAIN_SENT_ID_271416,杨云,杨威,杨威 杨云 ， 你们好 ！,人物二 人物一  你们好,1,0
TRAIN_SENT_ID_272667,段延庆,段誉,经过 一番 搏斗 ， 段正淳 、 刀白凤 自杀 殉情 ； 段延庆 飘然 远逝 ； 段誉 回 大理 继承 皇位 。,一番 搏斗  段正淳  刀白凤 自杀 殉情  人物一 飘然 远逝  人物二 回 大理 继承 皇位,-1,0
TRAIN_SENT_ID_257304,贾珍,尤氏,③ 《 红楼梦 》 第六 三回 ： “ 尤氏 也 不 听 ， 只命 锁 着 ， 等 贾珍 来 发放 。 ”,③  红楼梦  第六 三回   人物二 听  只命 锁  人物一 发放,1,0
TRAIN_SENT_ID_283300,李俐,满文军,李俐 在 服刑 期间 表现 很 低调 ， 很少 主动 与 他人 交流 ， 也 从来不 提 自己 家事 ， 对 满文军 更是 闭口不谈 。,人物一 服刑 期间 表现 低调  很少 主动 交流  从来不 提 家事  人物二 更是 闭口不谈,1,1
TRAIN_SENT_ID_268183,樊梨花,薛丁山,其中 的 薛丁山 三请 樊梨花 最为 哙 灸 人口 ， 被 戏曲 、 曲艺 等 艺术 形式 广为 传唱 流传 不衰 。,人物二 三请 人物一 最为 哙 灸 人口  戏曲  曲艺 艺术 形式 广为 传唱 流传 不衰,1,0
TRAIN_SENT_ID_265974,杨绛,钱钟书,其中 一次 ， 杨绛 在 满地 烂泥 的 雨天 只身 奔 去 看 钱钟书 。,一次  人物一 满地 烂泥 雨天 只身 奔 人物二,1,0
TRAIN_SENT_ID_285405,沈月英,杜月笙,沈月英 ： 杜月笙 采下 的 水蜜桃,人物一  人物二 采下 水蜜桃,1,0
TRAIN_SENT_ID_273849,范柳原,白流苏,范柳原 和 白流苏,人物一 人物二,1,0
TRAIN_SENT_ID_276811,丁夫人,曹操,曹操 的 原配 是 丁夫人 。,人物二 原配 人物一,1,1
TRAIN_SENT_ID_262643,况天佑,马小玲,第七章 马小玲 与 况天佑,第七章 人物二 人物一,1,0
TRAIN_SENT_ID_264121,刘备,孙尚香,终极 三国 ： 剧情 设定 为 刘备 的 未婚妻 ， 孙尚香 的 “ 情敌 ” 。,终极 三国  剧情 设定 人物一 未婚妻  人物二  情敌,1,-1
TRAIN_SENT_ID_276891,罗启锐,张婉婷,【 编剧 】 ： 罗启锐 张婉婷,编剧   人物一 人物二,1,0
TRAIN_SENT_ID_275753,李沅芷,余鱼同,于是 黄蓉 遇到 了 郭靖 ， 阿朱 认识 了 乔峰 ， 李沅芷 邂逅 了 余鱼同 。,黄蓉 遇到 郭靖  阿朱 认识 乔峰  人物一 邂逅 人物二,1,0
TRAIN_SENT_ID_266829,萧峰,萧远山,婆婆 ： 未 交代 姓名 ， 与 萧远山 青梅竹马 ； 乔三娘 （ 萧峰 养母 ）,婆婆  未 交代 姓名  人物二 青梅竹马  乔三娘  人物一 养母,-1,0
TRAIN_SENT_ID_281566,陈二狗,曹蒹葭,曹蒹葭 轻轻 把 枕 在 陈二狗 肩膀 。,人物二 轻轻 枕 人物一 肩膀,1,0
TRAIN_SENT_ID_259046,刘备,刘禅,如 刘备 、 刘禅 的 忠臣 建议 选择 黄忠 、 马超 等 。,人物一  人物二 忠臣 建议 选择 黄忠  马超,-1,0
TRAIN_SENT_ID_278534,李秀文,叶挺,叶挺 辞去 了 一切 职务 ， 十分 愉快 地 准备 去 苏联 莫斯科东方大学 学习 ， 但 他 又 怀着 对 李秀文 满腔 的 热恋 之情 。,人物二 辞去 职务  十分 愉快 准备 苏联 莫斯科东方大学 学习  怀着 人物一 满腔 热恋 之情,1,0
TRAIN_SENT_ID_252198,秦嘉,徐淑,秦嘉 客死他乡 后 ， 徐淑 兄逼 她 改嫁 。,人物一 客死他乡  人物二 兄逼 改嫁,1,-1
TRAIN_SENT_ID_268002,樊梨花,薛丁山,在 樊梨花 相助 下 ， 薛丁山 最终 征西 成功 。,人物一 相助  人物二 最终 征西 成功,1,0
TRAIN_SENT_ID_277066,龙非离,年璇玑,年璇玑 与 龙非离,人物二 人物一,1,0
TRAIN_SENT_ID_284362,唐筼,陈寅恪,唐筼 和 陈寅恪 一家,人物一 人物二 一家,1,0
TRAIN_SENT_ID_274044,白素,卫斯理,003 卫斯理 与 白素 037 头发 067 报应 101 原形,人物二 人物一  头发  报应  原形,1,0
TRAIN_SENT_ID_271313,何泽慧,钱三强,由于 专业 基础理论 扎实 ， 又 善于 钻研 ， 被 爱才若渴 的 钱三强 、 何泽慧 等 老 专家 视为 难得 的 “ 好 苗子 ” 加以 重点 培养 。,专业 基础理论 扎实  善于 钻研  爱才若渴 人物二  人物一 老 专家 视为 难得  苗子  重点 培养,1,-1
TRAIN_SENT_ID_257752,桓雄,桓因,青鹤洞 村帝 有 三圣宫 ， 这里 供奉 着 桓因 、 桓雄 、 檀君 ， 是 一处 圣殿 ， 也 是 修道 场所 。,青鹤洞 村帝 三圣宫  供奉 人物二  人物一  檀君  一处 圣殿  修道 场所,-1,0
TRAIN_SENT_ID_273328,秦香莲,陈世美,玉碎 [ 秦香莲 ， 陈世美 ],玉碎  人物一  人物二,1,0
TRAIN_SENT_ID_277863,张无忌,张翠山,张翠山 / 张无忌 — — 倚天 屠龙记,人物二  人物一   倚天 屠龙记,-1,0
TRAIN_SENT_ID_259194,刘备,刘禅,刘备 / 诸葛亮 / 赵云 / 关羽 / 庞统 / 魏延 / 张飞 / 马超 / 姜维 / 黄忠 / 徐庶 / 刘禅 / 马谡,人物一  诸葛亮  赵云  关羽  庞统  魏延  张飞  马超  姜维  黄忠  徐庶  人物二  马谡,-1,0
TRAIN_SENT_ID_269333,陆雪琪,张小凡,碧瑶 （ 张小凡 、 陆雪琪 等 称 ）,碧瑶  人物二  人物一 称,1,0
TRAIN_SENT_ID_273109,谭蓓蓓,白云江,7 · 24 桦南 孕妇 猎艳 杀人 案二审 开庭 : 被告人 白云江 被判 死刑 、 谭蓓蓓 被判 无期 。,桦南 孕妇 猎艳 杀人 案二审 开庭  被告人 人物二 被判 死刑  人物一 被判 无期,1,-1
TRAIN_SENT_ID_269182,陆雪琪,张小凡,张小凡 大吃一惊 ， 眼看 陆雪琪 重伤 之 後 ， 几无 回手 之力 ， 自己 距离 又 被 拉远 ， 急忙 手一挥 将 烧火棍 祭起 ， 冲向 那 绿衣 少女 。,人物二 大吃一惊  眼看 人物一 重伤 後  几无 回手 之力  距离 拉远  急忙 手一挥 烧火棍 祭起  冲向 绿衣 少女,1,1
TRAIN_SENT_ID_267292,陆毅,鲍蕾,鲍蕾 自己 刚刚 结束 一部 戏 的 拍摄 回到 上海 ， 一 回来 就 赶去 无锡 探望 陆毅 。,人物二 刚刚 结束 一部 戏 拍摄 回到 上海  回来 赶去 无锡 探望 人物一,1,0
TRAIN_SENT_ID_282367,张奎,高兰英,张奎 的 灵兽 ， 拥有 极高 的 速度 ， 称呼 高兰英 为 “ 大姊头 ” 。,人物一 灵兽  拥有 极高 速度  称呼 人物二  大姊头,1,0
TRAIN_SENT_ID_262920,熊美玲,林秋离,No.132 这 是 我 的 爱 （ 台语 ） 林秋离 熊美玲 施文彬,爱  台语  人物二 人物一 施文彬,1,0
TRAIN_SENT_ID_277123,浦安修,彭德怀,15 ． 一切 如常 ， 请勿 念 — — 彭德怀 发给 浦安修 的 电报,． 如常  请勿 念   人物二 发给 人物一 电报,1,0
TRAIN_SENT_ID_274256,贾敬,贾珍,贾府 “ 凡 从 文旁 之 名者 ， 贾敬 为首 ； 下则 从玉者 ， 贾珍 为首 ； 再 下 从 草头 者 ， 贾蓉 为首 ” 。,贾府  文旁 名者  人物一 为首  下则 从玉者  人物二 为首  草头  贾蓉 为首,-1,0
TRAIN_SENT_ID_279405,张维,陆士嘉,11 . 深切 怀念 老师 陆士嘉 教授 和 张维 院士 · · · · · · · · · · · · · · · · · · · · · · 忻鼎定 188,深切 怀念 老师 人物二 教授 人物一 院士                       忻鼎定,1,0
TRAIN_SENT_ID_258337,张兆和,沈从文,第二封 张兆和 致 沈从文 （ 1934.1 . 9 ）,第二封 人物一 人物二,1,0
TRAIN_SENT_ID_283476,郭明秋,林枫,1937 、 2 刘少奇 秘书 林枫 译电员 郭明秋 的 家 。,刘少奇 秘书 人物二 译电员 人物一 家,1,0
TRAIN_SENT_ID_259238,刘备,刘禅,曹丕代 汉建魏 ， 他 劝 刘备 称帝 ， 任 丞相 ， 刘禅 继位 后 ， 封 他 为 武乡侯 ， 领 益州牧 。,曹丕代 汉建魏  劝 人物一 称帝  丞相  人物二 继位  封 武乡侯  领 益州牧,-1,-1
TRAIN_SENT_ID_281728,宋共公,宋文公,历适 宋文公 、 宋共公 、 宋平公 。,历适 人物二  人物一  宋平公,-1,0
TRAIN_SENT_ID_278100,乐安公主,巩永固,下联 典指 明代 尚 乐安公主 巩永固 ， 字洪图 ， 宛平人 。,下联 典指 明代 尚 人物一 人物二  字洪图  宛平人,1,0
TRAIN_SENT_ID_252239,秦嘉,徐淑,秦镜 ： 汉代 秦嘉 妻 徐淑 赠其 明镜 。,秦镜  汉代 人物一 妻 人物二 赠其 明镜,1,0
TRAIN_SENT_ID_255911,蒋介石,宋美龄,蒋介石 选择 了 宋美龄 。,人物一 选择 人物二,1,0
TRAIN_SENT_ID_262896,熊美玲,林秋离,07 哭 砂词 ： 林秋离 曲 ： 熊美玲,哭 砂词  人物二 曲  人物一,1,0
TRAIN_SENT_ID_262177,诸葛尚,诸葛瞻,至今 ， 在 绵竹市 仍 有 清代 建筑 诸葛 双忠祠 和 诸葛瞻 、 诸葛尚 衣冠冢 。,绵竹市 清代 建筑 诸葛 双忠祠 人物二  人物一 衣冠冢,-1,0
TRAIN_SENT_ID_283150,班淑娴,何太冲,第 158 章 何太冲 班淑娴 . mp3,章 人物二 人物一,1,0
TRAIN_SENT_ID_258460,刘禅,刘备,荀彧 、 小乔 等 武将 可以 与 刘谌 有 特殊 的 刷牌 配合 ， 刘备 、 刘禅 则 可以 增加 刘谌 的 续航 能力 。,荀彧  小乔 武将 刘谌 特殊 刷牌 配合  人物二  人物一 增加 刘谌 续航 能力,-1,0
TRAIN_SENT_ID_269768,任我行,任盈盈,阵容 弟子 ： 东方不败 、 风清扬 、 令狐冲 、 任盈盈 、 任我行 、 岳不群,阵容 弟子  东方不败  风清扬  令狐冲  人物二  人物一  岳不群,-1,0
TRAIN_SENT_ID_262699,杨不悔,纪晓芙,10 灭绝师太 、 杨逍 、 纪晓芙 、 杨不悔 和 殷梨亭 / 179,灭绝师太  杨逍  人物二  人物一 殷梨亭,-1,0
TRAIN_SENT_ID_273245,秦香莲,陈世美,黄玉 棠 参与 制作 过 的 电影 有 《 欲海 遗恨 》 ( 1950 ) 、 《 陈世美 与 秦香莲 》 ( 1955 ) 等,黄玉 棠 参与 制作 电影  欲海 遗恨       人物二 人物一,1,0
TRAIN_SENT_ID_255983,蒋介石,宋美龄,宋美龄 对 蒋介石 的 影响,人物二 人物一 影响,1,0
TRAIN_SENT_ID_250144,秦始皇,胡亥,胡亥 是 秦始皇 少子 。,人物二 人物一 少子,-1,-1
TRAIN_SENT_ID_262829,熊美玲,林秋离,No.147 着迷 林秋离 熊美玲 邰正宵,着迷 人物二 人物一 邰正宵,1,0
TRAIN_SENT_ID_262964,熊美玲,林秋离,No.189 蝴蝶 的 故乡 林秋离 熊美玲 蔡幸娟 、 邰正宵,蝴蝶 故乡 人物二 人物一 蔡幸娟  邰正宵,1,0
TRAIN_SENT_ID_269039,刘德华,朱丽倩,刘德华 约 每天 下午 4 点 进场 彩排 ， 朱丽倩 则 于 6 点 抵达 。,人物一 约 每天 下午  点 进场 彩排  人物二  点 抵达,1,0
TRAIN_SENT_ID_258802,孙钟,孙坚,孙翊 家族 成员 : 孙翊 祖父 : 孙钟 ， 孙坚 之 父 。,孙翊 家族 成员  孙翊 祖父  人物一  人物二 父,-1,-1
TRAIN_SENT_ID_262311,汪精卫,陈璧君,开始 ， 汪精卫 不 同意 ， 看到 陈璧君 态度 坚决 ， 才 勉强 答应 吸收 她 。,人物一 同意  看到 人物二 态度 坚决  勉强 答应 吸收,1,0
TRAIN_SENT_ID_266946,关索,关羽,但是 没有 材料 证明 这个 关索 与 三国 关羽 有关 。,没有 材料 证明 人物一 三国 人物二,-1,0
TRAIN_SENT_ID_262754,熊美玲,林秋离,No.13 不妨 听 一点 音乐 林秋离 熊美玲 曾淑勤,听 一点 音乐 人物二 人物一 曾淑勤,1,0
TRAIN_SENT_ID_286409,陈慧珊,钟家鸿,钟家鸿 和 陈慧珊,人物二 人物一,1,0
TRAIN_SENT_ID_257282,金蛇郎君,温仪,金蛇郎君 送 温仪 回家 。,人物一 送 人物二 回家,1,0
TRAIN_SENT_ID_257326,贾珍,尤氏,贾珍 “ 爬灰 ” ， 尤氏 当然 知晓 。,人物一  爬灰   人物二 知晓,1,0
TRAIN_SENT_ID_278317,刘星,胡一统,胡一统 高兴 的 回到 夏家 ， 刘星 问要 的 赔偿 呢 ？,人物二 高兴 回到 夏家  人物一 问要 赔偿,-1,0
TRAIN_SENT_ID_259082,刘备,刘禅,刘备 逝世 于 白帝城 后 ， 丞相 诸葛亮 受 托孤 辅助 后主 刘禅 ， 蜀汉 国力 慢慢 恢复 。,人物一 逝世 白帝城  丞相 诸葛亮 受 托孤 辅助 后主 人物二  蜀汉 国力 慢慢 恢复,-1,-1
TRAIN_SENT_ID_257380,袁克文,袁世凯,曾任 袁世凯 家庭教师 ， 袁克文 曾 从 问业 。,曾任 人物二 家庭教师  人物一 问业,-1,0
TRAIN_SENT_ID_256431,刘禅,甘夫人,曹操 军 追击 刘备 于 当阳 长阪 ， 甘夫人 和 刘禅 与 刘备 失散 ， 幸好 有 赵云 保护 ， 得 免于 难,曹操 军 追击 刘备 当阳 长阪  人物二 人物一 刘备 失散  幸好 赵云 保护  免于 难,-1,0
TRAIN_SENT_ID_277224,张茜,张卫健,2 我要 轻闲 （ 小宝 与 康熙 插曲 － 张茜 、 张卫健 合唱 ）,我要 轻闲  小宝 康熙 插曲  人物一  人物二 合唱,1,0
TRAIN_SENT_ID_274595,薛丁山,薛仁贵,又 如 《 隋唐演义 》 、 《 三侠五义 》 、 《 薛仁贵 征东 》 、 《 薛丁山 征西 》 … …,隋唐演义    三侠五义    人物二 征东    人物一 征西,-1,0
TRAIN_SENT_ID_272604,贾蓉,秦可卿,⒊ 贾蓉 — 秦可卿 ： 瑞珠 、 宝珠,⒊ 人物一  人物二  瑞珠  宝珠,1,0
TRAIN_SENT_ID_283217,李大仁,程又青,李大仁 和 程又青 又 合作 了 ， 这次 还有 仔仔 !,人物一 人物二 合作  仔仔,1,0
TRAIN_SENT_ID_263661,陈文琦,王雪红,尤其 是 在 威盛 身兼 要职 的 被 王雪红 称之为 左右 臂 的 陈文琦 和 林子 牧 ， 他们 两位 都 是 加州理工学院 电机系 毕业 的 硕士 。,尤其 威盛 身兼 要职 人物二 称之为 左右 臂 人物一 林子 牧  两位 加州理工学院 电机系 毕业 硕士,1,-1
TRAIN_SENT_ID_271788,阎婆惜,宋江,阎婆惜 累使 人来 请 ， 宋江 只 推 事故 ， 不 上门去 。,人物一 累使 人来 请  人物二 推 事故  上门去,1,0
TRAIN_SENT_ID_276420,秦始皇,秦庄襄王,其子 秦始皇 建立 秦朝 后 ， 追封 秦庄襄王 为 太上皇 。,其子 人物一 建立 秦朝  追封 人物二 太上皇,-1,0
TRAIN_SENT_ID_256321,孙尚香,刘备,效果 ： a ： 孙尚香 加入 刘备 麾下,效果    人物一 加入 人物二 麾下,1,0
TRAIN_SENT_ID_282022,施绩,朱然,如 吕岱 、 施绩 、 陆抗 、 丁奉 、 朱然 、 全琮 。,吕岱  人物一  陆抗  丁奉  人物二  全琮,-1,0
TRAIN_SENT_ID_262951,熊美玲,林秋离,No.63 我 不想 长大 林秋离 熊美玲,不想 长大 人物二 人物一,1,0
TRAIN_SENT_ID_262747,熊美玲,林秋离,No.95 后悔 林秋离 熊美玲,后悔 人物二 人物一,1,0
TRAIN_SENT_ID_267353,许志安,郑秀文,4 、 问及 许志安 是否 会 邀请 老婆 郑秀文 来 支持 新 电影 ？,问及 人物一 是否 会 邀请 老婆 人物二 支持 新 电影,1,0
TRAIN_SENT_ID_273113,谭蓓蓓,白云江,被告人 谭蓓蓓 对 其 伙同 白云江 共同 实施 故意 杀人 、 强奸 、 抢劫犯罪 的 事实 供认不讳 ， 无 辩解 理由 。,被告人 人物一 伙同 人物二 共同 实施 故意 杀人  强奸  抢劫犯罪 事实 供认不讳  辩解 理由,1,0
TRAIN_SENT_ID_250233,秦始皇,胡亥,班固 ： “ 俗传 秦始皇 起 罪恶 ， 胡亥 极 ， 得 其理 矣 。 ”,班固   俗传 人物一 罪恶  人物二 极  其理,-1,0
TRAIN_SENT_ID_270204,蒋雯丽,顾长卫,* 《 吉祥 林 桂圆 膏 》 （ 蒋雯丽 篇 ） 导演 （ 总导演 ： 顾长卫 ）,吉祥 林 桂圆 膏   人物一 篇  导演  总导演  人物二,1,-1
TRAIN_SENT_ID_253733,申雪,赵宏博,一身 红与黑 的 申雪 和 赵宏博 ， 昨天下午 在 首体 综合 滑冰馆 第一次 对 媒体 展示 了 《 宋氏 王朝 》 的 磅礴 气势 。,一身 红与黑 人物一 人物二  昨天下午 首体 综合 滑冰馆 第一次 媒体 展示  宋氏 王朝  磅礴 气势,1,0
TRAIN_SENT_ID_276056,陈三立,陈宝箴,徐仁铸 与 陈三立 、 黄遵宪 、 谭嗣同 在 湖南 共同 协助 陈宝箴 推行 新政 。,徐仁铸 人物一  黄遵宪  谭嗣同 湖南 共同 协助 人物二 推行 新政,-1,0
TRAIN_SENT_ID_263155,胡亥,秦始皇,原文 : 《 史记 · 秦始皇 本纪 》 ： “ （ 胡亥 ） 诛 （ 李 ） 斯 、 （ 冯 ） 去 疾 ， 任用 赵高 。,原文   史记  人物二 本纪     人物一  诛  李  斯   冯  疾  任用 赵高,-1,0
TRAIN_SENT_ID_272093,张翠山,殷素素,另一方面 ， 张翠山 为了 追查 俞岱岩 被害 之事 而 结识 了 殷素素 。,人物一 追查 俞岱岩 被害 之事 结识 人物二,1,0
TRAIN_SENT_ID_274274,贾敬,贾珍,十二 贾氏 ： 贾敬 、 贾赦 、 贾政 、 贾宝玉 、 贾琏 、 贾珍 、 贾环 、 贾蓉 、 贾兰 、 贾芸 、 贾蔷 、 贾芹 。,十二 贾氏  人物一  贾赦  贾政  贾宝玉  贾琏  人物二  贾环  贾蓉  贾兰  贾芸  贾蔷  贾芹,-1,0
TRAIN_SENT_ID_276175,苏蕙,窦滔,窦滔 派遣 了 人马 ， 到 长安 接来 了 苏蕙 。,人物二 派遣 人马  长安 接来 人物一,1,1
TRAIN_SENT_ID_256074,蒋介石,宋美龄,戴笠 患病 住院 ， 宋美龄 代表 蒋介石 亲往 探望 ， 从此 备受 恩宠 。,戴笠 患病 住院  人物二 代表 人物一 亲往 探望  备受 恩宠,1,0
TRAIN_SENT_ID_262823,熊美玲,林秋离,No.85 袂 冻 爱 的 人 林秋离 熊美玲 陈亚兰,袂 冻 爱 人物二 人物一 陈亚兰,1,0
TRAIN_SENT_ID_281947,萧淑妃,李治,以 唐高宗 李治 的 宠妃 萧淑妃 最为 著名 。,唐高宗 人物二 宠妃 人物一 最为 著名,1,-1
TRAIN_SENT_ID_271966,林丹,谢杏芳,虽然 成名 后 林丹 送 谢杏芳 的 都 是 路 虎 、 十万元 级 的 名表 等 礼物 。,成名 人物一 送 人物二 路 虎  十万元 级 名表 礼物,1,0
TRAIN_SENT_ID_271473,钱基博,钱钟书,一次 痛打 ， 改 “ 邪 ” 归正 — — 钱基博 与 钱钟书,一次 痛打  改  邪  归正   人物一 人物二,-1,0
TRAIN_SENT_ID_274469,潘汉年,董慧,国共 和谈 破裂 ， 董慧 又 随 潘汉年 至 香港 。,国共 和谈 破裂  人物二 人物一 香港,1,0
TRAIN_SENT_ID_262921,熊美玲,林秋离,"4 ' 43 "" Lyric : 林秋离 Composer : 熊美玲",人物二   人物一,1,0
TRAIN_SENT_ID_278793,任盈盈,任我行,于是 令孤冲 、 任盈盈 、 向问天 、 任我行 等 一同 去 找 东方不败 报仇 。,令孤冲  人物一  向问天  人物二 一同 找 东方不败 报仇,-1,0
TRAIN_SENT_ID_263206,胡亥,秦始皇,秦始皇 驾崩 沙丘 : 参加 ： 始皇 驾崩 、 沙丘 之变 、 李斯 、 赵高 、 胡亥,人物二 驾崩 沙丘  参加  始皇 驾崩  沙丘 之变  李斯  赵高  人物一,-1,0
TRAIN_SENT_ID_281888,张静,黄茂如,黄茂如 持有 茂业 集团 99.999% 股份 ， 而 张静 则 持有 其余 的 0.001% 股份 。,人物二 持有 茂业 集团  股份  人物一 持有  股份,1,0
TRAIN_SENT_ID_271481,钱基博,钱钟书,钱基博 就让 钱钟书 代笔 。,人物一 就让 人物二 代笔,-1,0
TRAIN_SENT_ID_265980,杨绛,钱钟书,杨绛 陪 钱钟书 走 一段路 ， 再 赶回去 守 菜园 ， “ 目送 他 的 背影 渐远渐 小 ， 渐渐 消失 。 ”,人物一 陪 人物二 走 一段路  赶回去 守 菜园   目送 背影 渐远渐  渐渐 消失,1,0
TRAIN_SENT_ID_274018,白素,卫斯理,小乔 在 原振侠 呵护 下 恢复 了 健康 ， 卫斯理 和 白素 经过 重重 考验 ， 终于 证明 ， 今天 他们 只 属于 彼此 。,小乔 原振侠 呵护 恢复 健康  人物二 人物一 重重 考验  终于 证明  今天 属于,1,1
TRAIN_SENT_ID_263184,胡亥,秦始皇,至 二十九 世 ， 秦庄襄王 之子 秦王 政灭 六国 ， 统一 华夏 ， 号 秦始皇 帝 ， 至 二世 胡亥 被 汉朝 所灭 。,二十九 世  秦庄襄王 之子 秦王 政灭 六国  统一 华夏  号 人物二 帝  二世 人物一 汉朝 所灭,-1,0
TRAIN_SENT_ID_284431,孙小宝,金玲,海报 主持 ： 孙小宝 / 金玲,海报 主持  人物一  人物二,1,0
