sent_id,entity1,entity2,sent,processed_sent,label,hard_match
TRAIN_SENT_ID_255946,蒋介石,宋美龄,张学良 、 宋霭龄 、 于凤至 、 宋美龄 、 蒋介石,张学良  宋霭龄  于凤至  人物二  人物一,1,0
TRAIN_SENT_ID_268499,潘金莲,武大郎,潘金莲 追 武大郎 ， 这种 事情 太 平常 。,人物一 追 人物二  这种 事情 太 平常,1,0
TRAIN_SENT_ID_262926,熊美玲,林秋离,No.136 就是 我爱你 林秋离 熊美玲 林慧萍,我爱你 人物二 人物一 林慧萍,1,0
TRAIN_SENT_ID_256810,朱军,谭梅,唐国强 、 朱军 、 谭梅 、 赵晨浩 、 马艳丽 、 赵保乐,唐国强  人物一  人物二  赵晨浩  马艳丽  赵保乐,1,0
TRAIN_SENT_ID_284892,戚芳,戚长发,湘西 农家子弟 狄云 ， 自幼 随 师父 铁锁 横江 戚长发 和 师妹 戚芳 习武 务农 。,湘西 农家子弟 狄云  自幼 师父 铁锁 横江 人物二 师妹 人物一 习武 务农,-1,0
TRAIN_SENT_ID_268581,潘金莲,武大郎,— — 潘金莲 无法 接受 丑陋 的 武大郎 ， 一病不起 。,人物一 无法 接受 丑陋 人物二  一病不起,1,0
TRAIN_SENT_ID_249884,张无忌,赵敏,张无忌 救回 六大 派 后 ， 应 赵敏 借 看 屠龙刀 之 请求 ， 欲 到 冰火 岛 找 义父 谢逊 去 。,人物一 救回 六大 派  应 人物二 屠龙刀 请求  欲 冰火 岛 找 义父 谢逊,1,-1
TRAIN_SENT_ID_255747,蒋介石,宋美龄,蒋介石 托 他 转告 宋美龄 ， 决不能 来 西安 ， 眼下 这里 是 狼窝虎穴,人物一 托 转告 人物二  决不能 西安  眼下 狼窝虎穴,1,0
TRAIN_SENT_ID_268786,张翠山,张无忌,配音 角色 ： 张无忌 [ 梁朝伟 ] 、 张翠山 [ 任达华 ],配音 角色  人物二  梁朝伟   人物一  任达华,-1,0
TRAIN_SENT_ID_265619,袁泉,夏雨,《 上海 伦巴 》 情人节 起舞 明星 情侣 夏雨 袁泉 联袂,上海 伦巴  情人节 起舞 明星 情侣 人物二 人物一 联袂,1,0
TRAIN_SENT_ID_248898,窦滔,苏蕙,亦 晋 窦滔 妻 苏蕙 。,晋 人物一 妻 人物二,1,0
TRAIN_SENT_ID_275775,李沅芷,余鱼同,李沅芷 的 不幸 在于 她 几乎 牺牲 了 一切 ， 背弃 家庭 ， 最终 得到 的 可能 只是 一纸 婚姻 ， 得到 了 余鱼同 的 人 ， 却 得不到 他 的 心 。,人物一 不幸 几乎 牺牲  背弃 家庭  最终 得到 可能 一纸 婚姻  得到 人物二  得不到 心,1,-1
TRAIN_SENT_ID_263107,毛福梅,蒋介石,毛福梅 在 新婚之夜 闹 了 个 洞房 空守 ， 对 蒋介石 怨 一阵 ， 恨 一阵 ， 到头来 还是 谅解 了 他 。,人物一 新婚之夜 闹 洞房 空守  人物二 怨 一阵  恨 一阵  到头来 谅解,1,0
TRAIN_SENT_ID_263502,梅葆玖,梅兰芳,录音 梅兰芳 姜妙香 梅葆玖,录音 人物二 姜妙香 人物一,-1,0
TRAIN_SENT_ID_259021,刘备,刘禅,（ 刘备 、 刘禅 ）,人物一  人物二,-1,0
TRAIN_SENT_ID_262868,熊美玲,林秋离,No.177 诚实 心 林秋离 熊美玲 大学城 、 蓝丽 婷,诚实 心 人物二 人物一 大学城  蓝丽 婷,1,0
TRAIN_SENT_ID_265129,杜晓苏,雷宇峥,10 . 等待 · 《 佳期 如梦 之 海上 繁花 》 [ 主角 ： 杜晓苏 雷宇峥 邵振嵘 ],等待   佳期 如梦 海上 繁花   主角  人物一 人物二 邵振嵘,1,0
TRAIN_SENT_ID_284044,赵力平,朱琦,朱琦 与 赵力平 有四子 一女 ， 分别 是 朱援朝 、 朱和平 、 朱全华 、 朱新华 、 朱国华 。,人物二 人物一 有四子 一女  朱援朝  朱和平  朱全华  朱新华  朱国华,1,-1
TRAIN_SENT_ID_282026,施绩,朱然,陈寿 ： “ 朱治 、 吕范以 旧臣 任用 ， 朱然 、 朱桓 以勇烈 著闻 ， 吕据 、 朱异 、 施绩 咸有 将领 之才 ， 克绍 堂构 。,陈寿   朱治  吕范以 旧臣 任用  人物二  朱桓 以勇烈 著闻  吕据  朱异  人物一 咸有 将领 之才  克绍 堂构,-1,0
TRAIN_SENT_ID_281684,蒋韵,李锐,李锐 ， 蒋韵 合著 《 人间 》,人物二  人物一 合著  人间,1,0
TRAIN_SENT_ID_286389,吕玲绮,吕布,吕玲绮 入 甄府 ， 甄尧 与 吕布 的 再次 相见 ， 也 不远 。,人物一 入 甄府  甄尧 人物二 再次 相见  不远,-1,0
TRAIN_SENT_ID_282667,蔡琬,高其倬,《 鱼游 春水 》 — — 清 · 高其倬 · 蔡琬,鱼游 春水    清  人物二  人物一,1,0
TRAIN_SENT_ID_274499,潘汉年,董慧,随后 ， 潘汉年 推 着 轮椅 上 的 董慧 来到 场部 礼堂 。,人物一 推 轮椅 人物二 来到 场部 礼堂,1,0
TRAIN_SENT_ID_255602,蒋介石,宋美龄,就是 宋美龄 陪 蒋介石 回 溪口 ， 毛氏 总是 热情 相待 。,人物二 陪 人物一 回 溪口  毛氏 总是 热情 相待,1,0
TRAIN_SENT_ID_268481,曹襄,卫长公主,第一次 ， 亲上 作亲 ， 卫长公主 下嫁 第五代 平阳侯 曹襄 。,第一次  亲上 作亲  人物二 下嫁 第五代 平阳侯 人物一,1,0
TRAIN_SENT_ID_264277,贾环,赵姨娘,唯独 对于 赵姨娘 与 贾环 ， 笔到 之处 ， 充满 厌恶 。,唯独 人物二 人物一  笔到 之处  充满 厌恶,-1,0
TRAIN_SENT_ID_286264,黄琪翔,郭秀仪,黄琪翔 、 郭秀仪 旧藏 齐白石 作品选,人物一  人物二 旧藏 齐白石 作品选,1,0
TRAIN_SENT_ID_284600,高迅,高文,比赛 结束 后 ， 高迅 发现 高文 已 离开 ， 但 留下 了 一封信 ， 要 赤足 队 一定 要 继续 努力 ， 从 世界冠军 之 路 进发 。,比赛 结束  人物一 发现 人物二 离开  留下 一封信  赤足 队 一定 继续 努力  世界冠军 路 进发,-1,-1
TRAIN_SENT_ID_263824,刘嘉玲,梁朝伟,1984 - 《 鹿鼎记 》 主演 ： 梁朝伟 、 刘德华 、 刘嘉玲 。,鹿鼎记  主演  人物二  刘德华  人物一,1,0
TRAIN_SENT_ID_283777,李静民,姜昆,五 、 幸福美满 的 曲艺 之 家 — — 姜昆 与 李静民,五  幸福美满 曲艺 家   人物二 人物一,1,0
TRAIN_SENT_ID_274849,晏几道,晏殊,幼子 晏几道 （ 1030 - - 1106 ） ， 也 是 宋朝 重要 词人 ， 有 《 小山 词 》 世 ， 与 晏殊 合称 “ 大小 晏 ” 。,幼子 人物一        宋朝 重要 词人   小山 词  世  人物二 合称  大小 晏,-1,0
TRAIN_SENT_ID_262376,汪精卫,陈璧君,— — 汪精卫 与 陈璧君,人物一 人物二,1,0
TRAIN_SENT_ID_262035,李纨,贾兰,3 、 有空 可去 教 贾兰 ， 可 提升 李纨 好感度 。,有空 可去 教 人物二  提升 人物一 好感度,-1,0
TRAIN_SENT_ID_285530,石井裕也,满岛光,满岛光 和 石井裕也,人物二 人物一,1,0
TRAIN_SENT_ID_255965,蒋介石,宋美龄,一 、 宋美龄 执意 嫁 蒋介石,人物二 执意 嫁 人物一,1,0
TRAIN_SENT_ID_258031,黄睿靓,陈致中,检方 传讯 扁子媳 陈致中 、 黄睿靓 是 势在必行 了 。,检方 传讯 扁子媳 人物二  人物一 势在必行,1,0
TRAIN_SENT_ID_272576,贾蓉,秦可卿,金陵 十二钗 图册 判词 秦可卿 : 金陵 十二钗 之一 ， 贾蓉 之妻 。,金陵 十二钗 图册 判词 人物二  金陵 十二钗  人物一 之妻,1,0
TRAIN_SENT_ID_270492,关平,关羽,据传 ， 原有 关羽 、 周仓 、 关平 画像 。,据传  原有 人物二  周仓  人物一 画像,-1,0
TRAIN_SENT_ID_283302,李俐,满文军,李俐 刚回到 新加坡 ， 满文军 的 电话 就 打来 了 。,人物一 刚回到 新加坡  人物二 电话 打来,1,0
TRAIN_SENT_ID_258447,张兆和,沈从文,第十七 封 沈从文 致 张兆和 （ 1934.1 . 16 ）,第十七 封 人物二 人物一,1,0
TRAIN_SENT_ID_276493,尤氏,贾珍,贾珍 将 邢岫烟 和 尤氏 葬 了 ， 随众 赶往 京城 ， 意欲 和 戎 羌 血拼 ， 夺回 大权 。,人物二 邢岫烟 人物一 葬  随众 赶往 京城  意欲 戎 羌 血拼  夺回 大权,1,0
TRAIN_SENT_ID_253683,沈浪,朱七七,为 等待 救援 ， 朱七七 对 王怜花 故作 有情 ， 不料 被 追随 来 的 沈浪 听到 。,等待 救援  人物二 王怜花 故作 有情  追随 人物一 听到,1,0
TRAIN_SENT_ID_252273,秦嘉,徐淑,书 ： 即 指 徐淑 的 《 答夫 秦嘉 书 》 。,书  指 人物二  答夫 人物一 书,1,0
TRAIN_SENT_ID_276455,蔡就胜,蔡卓妍,蔡卓妍 老爸 蔡就胜 是 经商 的 ， 有 头脑 ， 和 郑东汉 、 杨受成 有 私交 。,人物二 老爸 人物一 经商  头脑  郑东汉  杨受成 私交,-1,0
TRAIN_SENT_ID_260330,穆桂英,杨宗保,穆桂英 为 救 自己 所爱 的 人 ， 投降 大宋 ， 并 献上 降龙木 ， 大破 天门 阵 ， 立功 救 下 杨宗保 。,人物一 救 所爱  投降 大宋  献上 降龙木  大破 天门 阵  立功 救 人物二,1,0
TRAIN_SENT_ID_278393,林晓峰,康子妮,陈奕迅 、 梁荣忠 、 林晓峰 、 康子妮 、 阮小仪 、 ILoveYouBoyz,陈奕迅  梁荣忠  人物一  人物二  阮小仪,1,0
TRAIN_SENT_ID_284808,林英雄,白木喜,姐姐 ： 白金 喜 、 白木喜 、 白水喜 姐夫 ： 刘明辉 、 林英雄 、 程舒航,姐姐  白金 喜  人物二  白水喜 姐夫  刘明辉  人物一  程舒航,1,0
TRAIN_SENT_ID_263140,毛福梅,蒋介石,毛福梅 精神 寄托 : 蒋介石 与 宋美龄 的 结合 是 一桩 政治婚姻 。,人物一 精神 寄托  人物二 宋美龄 结合 一桩 政治婚姻,1,1
TRAIN_SENT_ID_263205,胡亥,秦始皇,胡亥 将 秦始皇 葬 在 骊山 皇陵 ， 把 铜 熔化 后 灌入 ， 堵塞 住 地下 深处 的 水 。,人物一 人物二 葬 骊山 皇陵  铜 熔化 灌入  堵塞 住 地下 深处 水,-1,0
TRAIN_SENT_ID_269453,张振寰,鲍正芳,魏秋桦 、 张振寰 、 李丽凤 、 龙隆 、 陈琪 、 鲍正芳 、 赵家 蓉 、 许佩蓉,魏秋桦  人物一  李丽凤  龙隆  陈琪  人物二  赵家 蓉  许佩蓉,1,0
TRAIN_SENT_ID_265694,贾环,贾政,事实 明摆着 ， 此时 的 贾环 即使 有 上 进之心 ， 估计 也 被 贾政 如 冷水 般的 话 打击 的 完全 泯灭 了 。,事实 明摆着  人物一 进之心  估计 人物二 冷水 话 打击 完全 泯灭,-1,0
TRAIN_SENT_ID_268226,王小利,李琳,赵本山 、 小 沈阳 、 王小利 、 李琳,赵本山  沈阳  人物一  人物二,1,0
TRAIN_SENT_ID_252131,黄毅清,黄奕,黄奕 出轨 事件 黄毅清 微博 回应 :,人物二 出轨 事件 人物一 微博 回应,1,0
TRAIN_SENT_ID_260032,严英云,徐良,严英云 先后 找 了 包拯 、 刑部 左坤 等 人 ， 为 徐良 作证 。,人物一 先后 找 包拯  刑部 左坤  人物二 作证,1,0
TRAIN_SENT_ID_284364,唐筼,陈寅恪,陈寅恪 与 唐筼,人物二 人物一,1,0
TRAIN_SENT_ID_253792,申雪,赵宏博,( 2010.2 . 16 被 申雪 赵宏博 打破 ）,人物一 人物二 打破,1,0
TRAIN_SENT_ID_259027,刘备,刘禅,"唯有 先主 刘备 之孙 , 北 地 王刘谌 誓死 抗敌 , 刘禅 畏敌 不许 , 随之 降敌 , 刘谌 在 昭烈 庙 内 自杀 。",先主 人物一 之孙  北 王刘谌 誓死 抗敌  人物二 畏敌 不许  随之 降敌  刘谌 昭烈 庙 自杀,-1,-1
TRAIN_SENT_ID_269197,陆雪琪,张小凡,张小凡 、 陆雪琪 、 林惊羽 、 碧瑶 ...,人物二  人物一  林惊羽  碧瑶,1,0
TRAIN_SENT_ID_269953,姚明,叶莉,叶莉 临近 预产期 ， 姚明 特意 把 安迪 的 电话 ?,人物二 临近 预产期  人物一 特意 安迪 电话,1,0
TRAIN_SENT_ID_285950,萧辉,花倾国,花倾国 与 萧辉,人物二 人物一,1,0
TRAIN_SENT_ID_277940,言希,温衡,温衡 ： 言希 ？,人物二  人物一,1,0
TRAIN_SENT_ID_269162,陆雪琪,张小凡,后 遇到 金瓶儿 、 林惊羽 、 曾书书 、 萧逸才 等 人 ， 以及 一同 寻宝 而来 的 黑水 玄蛇 ， 黑水 玄蛇 将 张小凡 、 陆雪琪 撞 向 了 天地 宝库 的 石门 。,遇到 金瓶儿  林惊羽  曾书书  萧逸才  一同 寻宝 而来 黑水 玄蛇  黑水 玄蛇 人物二  人物一 撞 天地 宝库 石门,1,0
TRAIN_SENT_ID_270667,赵宏博,申雪,申雪 、 赵宏博 ： 结对 双滑 登 巅峰,人物二  人物一  结对 双滑 登 巅峰,1,0
TRAIN_SENT_ID_270551,关平,关羽,3 ： 关平 技能 加血 能力 加强 ， 关羽 技能 公式 更改 ， 伤害 与 游戏 进度 关联 。,人物一 技能 加血 能力 加强  人物二 技能 公式 更改  伤害 游戏 进度 关联,-1,1
TRAIN_SENT_ID_268646,潘金莲,武大郎,这么一来 ， 武大郎 和 潘金莲 怎么 也 翻 不了 身 了 ！,这么一来  人物二 人物一 翻 不了 身,1,0
TRAIN_SENT_ID_263847,刘嘉玲,梁朝伟,代表 名人 : 梁朝伟 刘嘉玲,代表 名人  人物二 人物一,1,0
TRAIN_SENT_ID_283531,郑樱桃,石虎,后赵 太祖 石虎 皇后 郑樱桃,后赵 太祖 人物二 皇后 人物一,1,0
TRAIN_SENT_ID_258392,张兆和,沈从文,沈从文 致 张兆和,人物二 人物一,1,0
TRAIN_SENT_ID_258982,王熙凤,贾琏,u 贾琏 （ 王熙凤 之夫 ， 谐音 “ 假廉 ” ， 无 廉耻 ）,人物二  人物一 之夫  谐音  假廉   廉耻,1,0
TRAIN_SENT_ID_249411,后稷,姜嫄,相传 为 姜嫄 首次 丢弃 后稷 的 地方 。,相传 人物二 首次 丢弃 人物一 地方,-1,0
TRAIN_SENT_ID_273827,萧远山,萧峰,婆婆 ： 未 交代 姓名 ， 与 萧远山 青梅竹马 ； 乔三娘 （ 萧峰 养母 ）,婆婆  未 交代 姓名  人物一 青梅竹马  乔三娘  人物二 养母,-1,0
TRAIN_SENT_ID_283960,王难姑,胡青牛,这 对 夫妻 ， 就是 胡青牛 和 王难姑 。,夫妻  人物二 人物一,1,0
TRAIN_SENT_ID_260255,穆桂英,杨宗保,于是 穆桂英 请求 将计就计 闯进 谷去 ， 太君 允准 ， 并 将 杨宗保 的 坐骑 白龙马 赠给 杨文广 ， 以壮 其行 。,人物一 请求 将计就计 闯进 谷去  太君 允准  人物二 坐骑 白龙马 赠给 杨文广  以壮 其行,1,0
TRAIN_SENT_ID_262853,熊美玲,林秋离,《 新 感情 旧 回忆 》 是 一首 由 熊美玲 作词 ， 林秋离 作曲 ， 蔡琴 演唱 的 歌曲 。,新 感情 旧 回忆  一首 人物一 作词  人物二 作曲  蔡琴 演唱 歌曲,1,0
TRAIN_SENT_ID_278269,王珂,刘涛,夫妻感情 : 王珂 感恩 刘涛 ： 我 幸拥 你 才 又 见 人间,夫妻感情  人物一 感恩 人物二  幸拥 见 人间,1,0
TRAIN_SENT_ID_276720,刘梅,夏东海,于是 ， 夏东海 和 刘梅 拉 着 是 刘星 、 夏雨 ， 买 了 好多 东西 去 看 那个 被 撞伤 的 老奶奶 ， 老奶奶 的 儿媳妇 接待 了 他们 。,人物二 人物一 拉 刘星  夏雨  买 好多 东西 撞伤 老奶奶  老奶奶 儿媳妇 接待,1,0
TRAIN_SENT_ID_266838,萧峰,萧远山,同时 又 在 在 阿 朱的 帮助 下 ， 从 智光大师 之 处 得到 了 萧峰 之 父 萧远山 的 遗书 。,朱的 帮助  智光大师 处 得到 人物一 父 人物二 遗书,-1,0
TRAIN_SENT_ID_273288,秦香莲,陈世美,因此 ， 均 县 有 “ 北门 街不唱 陈世美 ， 秦家楼 不 唱 秦香莲 ” 的 俗话 。,均 县  北门 街不唱 人物二  秦家楼 唱 人物一  俗话,1,0
TRAIN_SENT_ID_287057,符珍,荣安固伦公主,荣安固伦公主 额 驸 : 符珍 （ ？,人物二 额 驸  人物一,1,0
TRAIN_SENT_ID_259277,刘备,刘禅,刘禅 ： 1 、 刘备 、 诸葛 、 黄忠 、 赵云 、 马超 攻 + 428% ; 2 、 刘 、 诸葛 、 姜维 、 魏延 、 赵云 防 + 494% 。,人物二    人物一  诸葛  黄忠  赵云  马超 攻      刘  诸葛  姜维  魏延  赵云 防,-1,0
TRAIN_SENT_ID_262405,汪精卫,陈璧君,可是 ， 因为 保密工作 没 做好 ， 汪精卫 、 陈璧君 等 人 这次 在 北京 的 活动 以 失败 告终 。,保密工作 没 做好  人物一  人物二 北京 活动 失败 告终,1,0
TRAIN_SENT_ID_281708,高亚麟,时玮,高亚麟 在 外地 拍戏 ， 时玮 决定 去 探班 。,人物一 外地 拍戏  人物二 决定 探班,1,0
TRAIN_SENT_ID_267380,许志安,郑秀文,05 、 郭富城 、 许志安 、 郑秀文 、 梁汉文 《 火热 动感 1992 》,郭富城  人物一  人物二  梁汉文  火热 动感,1,0
TRAIN_SENT_ID_273500,殷素素,张翠山,难道 是 殷素素 不 喜欢 张翠山 想 改嫁 ？,难道 人物一 喜欢 人物二 想 改嫁,1,1
TRAIN_SENT_ID_252252,秦嘉,徐淑,答 秦嘉 诗 [ 汉 ] 徐淑,答 人物一 诗  汉  人物二,1,0
TRAIN_SENT_ID_277104,浦安修,彭德怀,一 上 庐山 ， 如临 仙境 ， 浦安修 神采飞扬 ， 跟着 沉默不语 的 景希珍 跨进 了 彭德怀 住 的 176 号 别墅 。,庐山  如临 仙境  人物一 神采飞扬  跟着 沉默不语 景希珍 跨进 人物二 住  号 别墅,1,0
TRAIN_SENT_ID_257973,夏东海,刘梅,刘梅 觉得 事情 重大 ， 决定 阻止 马军 的 鲁莽 行为 ， 她 一方面 让 夏东海 去 找 马军 的 妈妈 ， 一方面 不动声色 地 稳住 马军 。,人物二 觉得 事情 重大  决定 阻止 马军 鲁莽 行为  人物一 找 马军 妈妈  不动声色 稳住 马军,1,1
TRAIN_SENT_ID_271960,林丹,谢杏芳,新闻 、 谢杏芳 、 林丹 、 陶菲克,新闻  人物二  人物一  陶菲克,1,0
TRAIN_SENT_ID_277132,浦安修,彭德怀,浦安修 五内如焚 ， 听不清 批判者 罗织 的 她 和 彭德怀 “ 狼狈为奸 ” 的 “ 罪状 ” 是 什么 ， 突然 ， 她 热血 上涌 ， 惨叫 一声 ， 昏倒 在 地上 。,人物一 五内如焚  听不清 批判者 罗织 人物二  狼狈为奸   罪状   突然  热血 上涌  惨叫 一声  昏倒 地上,1,0
TRAIN_SENT_ID_274787,丁玲,胡也频,面对 胡也频 和 冯雪峰 ， 丁玲 陷入 一种 情感 旋涡 。,面对 人物二 冯雪峰  人物一 陷入 一种 情感 旋涡,1,0
TRAIN_SENT_ID_284745,陆立鼎,陆二娘,英儿 （ 陆立鼎 、 陆二娘 、 黄药师 、 柯镇恶 专用 ）,英儿  人物一  人物二  黄药师  柯镇恶 专用,1,0
TRAIN_SENT_ID_270937,梁思成,梁启超,梁 姓名 人有 梁红玉 、 梁启超 、 梁实秋 、 梁思成 和 梁漱溟 等 。,梁 姓名 人有 梁红玉  人物二  梁实秋  人物一 梁漱溟,-1,0
TRAIN_SENT_ID_267998,樊梨花,薛丁山,第四十五回 樊梨花 登台 拜帅 薛丁山 奉旨 完姻,第四十五回 人物一 登台 拜帅 人物二 奉旨 完姻,1,0
TRAIN_SENT_ID_277927,梁从诫,梁思成,作者 ： 梁思成 英文 原著 ， 费慰梅 编 ， 梁从诫 译,作者  人物二 英文 原著  费慰梅 编  人物一 译,-1,0
TRAIN_SENT_ID_274003,白素,卫斯理,《 愿望 之猴 》 ： 白素 为了 成全 贝梦丹 和 卫斯理 黯然 离去 。,愿望 之猴   人物一 成全 贝梦丹 人物二 黯然 离去,1,0
TRAIN_SENT_ID_274010,白素,卫斯理,但 有趣 的 事 是 白老大 的 妹妹 ， 白素 ， 却 与 卫斯理 情投意合 。,有趣 事 白老大 妹妹  人物一  人物二 情投意合,1,0
TRAIN_SENT_ID_258717,刘禅,刘备,刘备 、 诸葛亮 、 刘禅,人物二  诸葛亮  人物一,-1,0
TRAIN_SENT_ID_284493,罗立如,焦宛儿,焦宛儿 恼恨 她 砍断 了 师兄 罗立如 一条 手臂 ， 竟 跟 她 赌 了 。,人物二 恼恨 砍断 师兄 人物一 一条 手臂  竟 赌,1,0
TRAIN_SENT_ID_270683,赵宏博,申雪,29 申雪 和 赵宏博 瞄准 了 最高 领奖台,人物二 人物一 瞄准 最高 领奖台,1,0
TRAIN_SENT_ID_261919,安雯,苏越,苏越 主要 作品 : 《 黄土高坡 》 （ 安雯 、 杭天棋 ）,人物二 主要 作品   黄土高坡   人物一  杭天棋,1,0
TRAIN_SENT_ID_277836,高安公主,萧淑妃,高安公主 ， 始封 宣城公主 ， 母 萧淑妃 。,人物一  始封 宣城公主  母 人物二,-1,0
TRAIN_SENT_ID_262354,汪精卫,陈璧君,王临乙 塑 汪精卫 陈璧君 跪 像 以 平民愤 。,王临乙 塑 人物一 人物二 跪 平民愤,1,0
TRAIN_SENT_ID_286378,凌雪雁,宋远桥,凌雪雁 ， 容貌 秀丽 ， 喜欢 张君宝 ， 与 秦思容 为 情敌 ， 后来 由于 得不到 张君宝 的 爱慕 ， 与 爱 她 的 宋远桥 结为 恋人 。,人物一  容貌 秀丽  喜欢 张君宝  秦思容 情敌  后来 得不到 张君宝 爱慕  爱 人物二 结为 恋人,1,1
TRAIN_SENT_ID_283322,施妙妙,谷缜,谷缜 笑 道 ： “ 她 芳名 施妙妙 ， 绰号 傻 鱼儿 ， 别号 母老虎 ， 是 我 未 过门 的 媳妇儿 。,人物二 笑 道   芳名 人物一  绰号 傻 鱼儿  别号 母老虎  未 过门 媳妇儿,1,0
TRAIN_SENT_ID_262002,王明华,梅兰芳,王明华 ： 梅兰芳 身后 的 “ 青衣 ”,人物一  人物二 身后  青衣,1,0
TRAIN_SENT_ID_273338,秦香莲,陈世美,秦香莲 ： 陈世美 ！,人物一  人物二,1,0
TRAIN_SENT_ID_258416,张兆和,沈从文,第一封 张兆和 致 沈从文 （ 1934.1 . 8 ）,第一封 人物一 人物二,1,0
TRAIN_SENT_ID_272690,毛岸青,杨开慧,雪 》 ， 并 刻有 杨开慧 ， 毛岸英 ， 毛岸青 ， 等 部分 图片 插图 。,雪   刻有 人物二  毛岸英  人物一  部分 图片 插图,-1,0
TRAIN_SENT_ID_265831,郭涛,郭子睿,"石头 队 ( D , C2 , E3 ) ： 郭涛 、 郭子睿 （ 石头 ） 、 孙坚 、 黄艺馨",石头 队         人物一  人物二  石头   孙坚  黄艺馨,-1,0
TRAIN_SENT_ID_273357,秦香莲,陈世美,因此 ， 均 县 有 “ 北门 街不唱 陈世美 ， 秦家楼 不 唱 秦香莲 ” 的 俗话 。 ）,均 县  北门 街不唱 人物二  秦家楼 唱 人物一  俗话,1,0
TRAIN_SENT_ID_265660,袁泉,夏雨,《 上海 伦巴 》 公映 袁泉 ： 最 喜欢 夏雨 斗鸡眼,上海 伦巴  公映 人物一  喜欢 人物二 斗鸡眼,1,0
TRAIN_SENT_ID_258322,陈建斌,蒋勤勤,麦子 婚戒 — — 陈建斌 蒋勤勤,麦子 婚戒   人物一 人物二,1,0
TRAIN_SENT_ID_285104,石磊,潘阳,石磊 ( 潘阳 老公 ),人物一  人物二 老公,1,0
TRAIN_SENT_ID_265652,袁泉,夏雨,袁泉 对 夏雨 的 “ 怪腔 ” 表示满意 。,人物一 人物二  怪腔  表示满意,1,0
TRAIN_SENT_ID_262299,汪精卫,陈璧君,汉奸 汪精卫 之妻 陈璧君,汉奸 人物一 之妻 人物二,1,0
TRAIN_SENT_ID_281560,陈二狗,曹蒹葭,曹蒹葭 略微 倾斜 脑袋 ， 笑望 向 陈二狗 。,人物二 略微 倾斜 脑袋  笑望 人物一,1,0
TRAIN_SENT_ID_260414,穆桂英,杨宗保,谁知 穆桂英 不 听 则 罢 ， 听后 勃然大怒 ： “ 来 人 ， 把 杨宗保 给 我 推下去 ， 重打 八十 军棍 ！ ”,人物一 听 罢  听后 勃然大怒    人物二 推下去  重打 八十 军棍,1,0
TRAIN_SENT_ID_281398,钱学森,钱永刚,主题 ： 从 钱永刚 看 钱学森,主题  人物二 人物一,-1,0
TRAIN_SENT_ID_251391,李安琪,李小鹏,（ 李小鹏 李安琪 让路 陈小春 郑伊健 ）,人物二 人物一 让路 陈小春 郑伊健,1,0
TRAIN_SENT_ID_275656,李惠元,安贞焕,广告商 一夜之间 纷至沓来 ， 并 最终 促成 了 李惠元 与 安贞焕 的 那次 搭档 。,广告商 一夜之间 纷至沓来  最终 促成 人物一 人物二 那次 搭档,1,0
TRAIN_SENT_ID_278902,汪涵,杨乐乐,杨乐乐 与 汪涵 的 “ 木火 通明 ”,人物二 人物一  木火 通明,1,0
TRAIN_SENT_ID_268227,王小利,李琳,李琳 王小利 分开 ： 哎 老头 你 回来 啊,人物二 人物一 分开  老头 回来,1,0
TRAIN_SENT_ID_277216,张茜,张卫健,余嘉碧 群星 祝福 : 张卫健 与 太太 张茜 借助 网络 的 力量 ， 在 微博 呼吁 大家 为 其母 祈祷 。,余嘉碧 群星 祝福  人物二 太太 人物一 借助 网络 力量  微博 呼吁 其母 祈祷,1,0
TRAIN_SENT_ID_273546,殷素素,张翠山,张翠山 写 到 “ 锋 ” 字 的 最后 一笔 ， 银钩 和 铁笔 同时 在 石壁 上 一撑 ， 翻身 落地 ， 轻轻 巧巧 的 落 在 殷素素 身旁 。,人物二 写  锋  字 最后 一笔  银钩 铁笔 石壁 一撑  翻身 落地  轻轻 巧巧 落 人物一 身旁,1,0
TRAIN_SENT_ID_252246,秦嘉,徐淑,秦嘉 、 徐淑 今存 的 诗文 并 收辑 于 严可均 《 全 上古 三代 秦汉 三国 六朝 文 》 、 逯钦立 《 先 秦汉 魏晋 南北朝 诗 》 。,人物一  人物二 今存 诗文 收辑 严可均  全 上古 三代 秦汉 三国 六朝 文   逯钦立  先 秦汉 魏晋 南北朝 诗,1,0
TRAIN_SENT_ID_267415,许志安,郑秀文,那时 的 郑秀文 和 许志安 ， 是 一对 公开 的 “ 好 朋友 ” 。,人物二 人物一  一对 公开  朋友,1,0
TRAIN_SENT_ID_277373,樊姬,楚庄王,1 历史 : 樊姬 系 楚庄王 宠妃 。,历史  人物一 系 人物二 宠妃,1,0
TRAIN_SENT_ID_251357,廖仲恺,何香凝,廖仲恺 何香凝 墓,人物一 人物二 墓,1,0
TRAIN_SENT_ID_262976,熊美玲,林秋离,No.65 我 的 心 不 改变 林秋离 熊美玲 桂侠,心 改变 人物二 人物一 桂侠,1,0
TRAIN_SENT_ID_264044,刘备,孙尚香,孙尚香 - - 刘表 刘璋 孟获 公孙瓒 马腾 刘备 杨奉 袁绍 孙权 孙坚 孙策 袁术,人物二   刘表 刘璋 孟获 公孙瓒 马腾 人物一 杨奉 袁绍 孙权 孙坚 孙策 袁术,1,0
TRAIN_SENT_ID_258326,陈建斌,蒋勤勤,苏有朋 称 刘诗 诗 “ 嫂子 ” 陈建斌 二导 作品 不 排除 与 蒋勤勤 合作,苏有朋 称 刘诗 诗  嫂子  人物一 二导 作品 排除 人物二 合作,1,0
TRAIN_SENT_ID_274975,荆天明,荆轲,荆轲 与 荆天明 从未见过 一面 。,人物二 人物一 从未见过 一面,-1,0
TRAIN_SENT_ID_253920,况天涯,马小玲,出现 个体 ： 况天涯 、 马小玲 。,出现 个体  人物一  人物二,-1,0
TRAIN_SENT_ID_256153,蒋介石,宋美龄,宋美龄 与 蒋介石 闹别扭,人物二 人物一 闹别扭,1,0
TRAIN_SENT_ID_262998,熊美玲,林秋离,No.22 今夜 微雨 林秋离 熊美玲 江淑娜,今夜 微雨 人物二 人物一 江淑娜,1,0
TRAIN_SENT_ID_273770,霍震霆,霍英东,邓小平 南巡 ， 霍英东 与 霍震霆 迎接 邓小平 。,邓小平 南巡  人物二 人物一 迎接 邓小平,-1,0
TRAIN_SENT_ID_262770,熊美玲,林秋离,No.316 海鸥 的 天空 林秋离 熊美玲 林琼珑,海鸥 天空 人物二 人物一 林琼珑,1,0
TRAIN_SENT_ID_279071,公孙绿萼,裘千尺,第二百 一 十二章 裘千尺 和 公孙绿萼,第二百 十二章 人物二 人物一,-1,0
TRAIN_SENT_ID_281883,张静,黄茂如,黄茂如 、 张静,人物二  人物一,1,0
