sent_id,sent_id,entity1,entity2,sent,processed_sent,label
TRAIN_SENT_ID_255867,,蒋介石,宋美龄,宋美龄 视察 、 蒋介石 训话,人物二 视察  人物一 训话,1
TRAIN_SENT_ID_269187,,陆雪琪,张小凡,认识 ： 张小凡 、 陆雪琪 、 小白 、 鬼王 、 道 玄,认识  人物二  人物一  小白  鬼王  道 玄,1
TRAIN_SENT_ID_277179,,张茜,张卫健,由 张卫健 与 张茜 合唱 ， 该 歌曲 MV 也 由 张卫健 与 张茜 携手 演绎 。,人物二 人物一 合唱  歌曲  人物二 人物一 携手 演绎,1
TRAIN_SENT_ID_274330,,方怡,韦小宝,刘一舟 刘一舟 是 韦小宝 7 个 老婆 之一 方怡 的 前男友 。,刘一舟 刘一舟 人物二  老婆 人物一 前男友,1
TRAIN_SENT_ID_287200,,范元甄,李锐,附 李锐 给 范元甄 表哥 看假信,附 人物二 人物一 表哥 看假信,1
TRAIN_SENT_ID_281428,,万玉枝,高咏,第 2 颗 ： 安宁 村 ， 治 好 高咏 的 病后 ， 万玉枝 赠送 。,颗  安宁 村  治 人物二 病后  人物一 赠送,1
TRAIN_SENT_ID_266651,,李国豪,李小龙,演员 ： 王玫 / 李小龙 / 琳达 / 李国豪 / 李香凝,演员  王玫  人物二  琳达  人物一  李香凝,-1
TRAIN_SENT_ID_259608,,冯小刚,徐帆,2012 - 06 - 24 ： 美酒 一样 的 徐帆 叙述 与 冯小刚 结缘 ...,美酒 人物二 叙述 人物一 结缘,1
TRAIN_SENT_ID_258298,,陈建斌,蒋勤勤,就 拿 陈建斌 和 蒋勤勤 的 新闻 说 ， 陈建斌 为什么 要 对 蒋勤勤 拳脚相加 并 宣称 不 愿意 要 她 肚子 里 的 孩子 ？,人物一 人物二 新闻 说  人物一 人物二 拳脚相加 宣称 愿意 肚子 里 孩子,1
TRAIN_SENT_ID_257285,,金蛇郎君,温仪,身世 ： 为 浙江 石梁温 家之女 温仪 与 金蛇郎君 夏雪宜 私生女 ， 因 温家 与 夏家 有 仇 ， 出生 同时 夏雪宜 被 挑断 手筋 脚筋 ， 母 温仪 将 其 抚养 长大 。,身世  浙江 石梁温 家之女 人物二 人物一 夏雪宜 私生女  温家 夏家 仇  出生 夏雪宜 挑断 手筋 脚筋  母 人物二 抚养 长大,1
TRAIN_SENT_ID_270921,,贾午,韩寿,⑶ 韩寿分香 ： 晋 贾充 有 御赐 异香 ， 其女 贾午 与 韩寿 私通 ， 韩寿 身染 奇香 ， 遂 被 发觉 ， 后 与 贾午 成婚 。,⑶ 人物二分香  晋 贾充 御赐 异香  其女 人物一 人物二 私通  人物二 身染 奇香  遂 发觉  人物一 成婚,1
TRAIN_SENT_ID_276603,,韩寒,金丽华,素来 低调 行事 的 金丽华 为何 公开 出任 韩寒 的 媒体 联络员 呢 ？,素来 低调 行事 人物二 公开 出任 人物一 媒体 联络员,1
TRAIN_SENT_ID_267727,,马小玲,况天涯,几经 波折 ， 况天涯 主动 承认 自己 是 况天佑 、 马小玲 在 未来 的 女儿 。,几经 波折  人物二 主动 承认 况天佑  人物一 未来 女儿,-1
TRAIN_SENT_ID_258312,,陈建斌,蒋勤勤,面对 蒋勤勤 的 倔 脾气 ， 陈建斌 给 蒋勤勤 起 了 “ 蒋特 离谱 ” 的 外号 ， 而 蒋勤勤 回敬 陈建斌 是 ” 陈 不靠 谱 “ 。,面对 人物二 倔 脾气  人物一 人物二  蒋特 离谱  外号  人物二 回敬 人物一  陈 不靠 谱,1
TRAIN_SENT_ID_270509,,关平,关羽,主公 我要 黄将 : 关平 : 关羽 的 并 女 ， 一直 跟随 关羽 出征 . 东吴 趁 关羽 攻奥城时 ， 突然 背弃 吴蜀 同盟 ， 愉袭 荆州 。,主公 我要 黄将  人物一  人物二 女  一直 跟随 人物二 出征  东吴 人物二 攻奥城时  突然 背弃 吴蜀 同盟  愉袭 荆州,-1
TRAIN_SENT_ID_268470,,梁静慈,甄子丹,甄子丹 感情 : 梁静慈,人物二 感情  人物一,1
TRAIN_SENT_ID_274755,,韩淑秀,郭松龄,1925 年 12 月 ， 郭松龄 、 韩淑秀 夫妻 惨遭 “ 曝尸 ” 之辱 。,年  月  人物二  人物一 夫妻 惨遭  曝尸  之辱,1
TRAIN_SENT_ID_274792,,丁玲,胡也频,记 胡也频 记 丁玲 记 丁玲 续集 从文 自传 从 现实 学习,记 人物二 记 人物一 记 人物一 续集 从文 自传 现实 学习,1
TRAIN_SENT_ID_266598,,许晋亨,李嘉欣,公关 代表 许家 向 传媒 派 千元 红包 ， 利市 封印 上 写 着 “ JM ” ， 是 李嘉欣 与 许晋亨 的 英文名 Michele 、 Julian 的 缩写 。,公关 代表 许家 传媒 派 千元 红包  利市 封印 写     人物二 人物一 英文名    缩写,1
TRAIN_SENT_ID_279559,,李芳远,李成桂,李芳远 暗杀 郑梦周 之后 释放 了 郑道传 ， 同年 7 月 17 日 ， 郑道传 拥戴 李成桂 为 王 ， 建立 朝鲜 王朝 。,人物一 暗杀 郑梦周 之后 释放 郑道传  同年  月  日  郑道传 拥戴 人物二 王  建立 朝鲜 王朝,-1
TRAIN_SENT_ID_277221,,张茜,张卫健,张卫健 ； 张茜 ； 吴孟达,人物二  人物一  吴孟达,1
TRAIN_SENT_ID_286393,,吕玲绮,吕布,获得 魂魄 ： 吕布 之魂 ， 吕玲绮 之魂,获得 魂魄  人物二 之魂  人物一 之魂,-1
TRAIN_SENT_ID_250167,,秦始皇,胡亥,俗传 秦始皇 起 罪恶 ， 胡亥 极 ， 得 其理 矣 。,俗传 人物一 罪恶  人物二 极  其理,-1
TRAIN_SENT_ID_271697,,田川氏,郑成功,一角 禅 贰 禅缘 未了 : 1646 年 ， 田川氏 逝世 ， 膝下 有 一个 名唤 千慧 的 养女 深得 其 真传 ， 后 随 郑成功 来到 台湾 。,一角 禅 贰 禅缘 未了   年  人物一 逝世  膝下 一个 名唤 千慧 养女 深得 真传  人物二 来到 台湾,-1
TRAIN_SENT_ID_274811,,丁玲,胡也频,好 基友 ： 丁玲 、 胡也频 和 沈从文 的 群租 生活,基友  人物一  人物二 沈从文 群租 生活,1
TRAIN_SENT_ID_262747,,熊美玲,林秋离,No.95 后悔 林秋离 熊美玲,后悔 人物二 人物一,1
TRAIN_SENT_ID_262808,,熊美玲,林秋离,No.26 少年心 林秋离 熊美玲 洪荣宏,少年心 人物二 人物一 洪荣宏,1
TRAIN_SENT_ID_284592,,程有德,程咬金,丈夫 程有德 不幸 早丧 ， 独自一人 抚养 程咬金 。,丈夫 人物一 不幸 早丧  独自一人 抚养 人物二,-1
TRAIN_SENT_ID_284374,,红玉,贾芸,在 蜂腰 桥 和 芸 哥儿 碰面 ， 那 贾芸 拿眼 把 红玉 一溜 ， 那红玉 也 把 眼去 一溜 贾芸 。,蜂腰 桥 芸 哥儿 碰面  人物二 拿眼 人物一 一溜  那人物一 眼去 一溜 人物二,1
TRAIN_SENT_ID_262357,,汪精卫,陈璧君,关系密切 的 非 成员 ： 汪精卫 、 陈璧君 、 甘乃光 、 何香凝 、 陈树人,关系密切 非 成员  人物一  人物二  甘乃光  何香凝  陈树人,1
TRAIN_SENT_ID_253497,,祝彪,扈三娘,一丈 青 扈三娘 ， 家住 独龙 岗三庄 之一 的 扈家庄 ， 原 被 许配给 祝家庄 祝彪 。,一丈 青 人物二  家住 独龙 岗三庄 扈家庄  原 许配给 祝家庄 人物一,1
TRAIN_SENT_ID_278538,,李秀文,叶挺,李秀文 为了 孩子 ， 不得不 与 叶挺 分手 了 。,人物一 孩子  不得不 人物二 分手,1
TRAIN_SENT_ID_273144,,黄苗子,郁风,黄苗子 与 夏衍 交往 ， 自然 免不了 与 郁风 接触 。,人物一 夏衍 交往  自然 免不了 人物二 接触,1
TRAIN_SENT_ID_286001,,杨容姬,潘安,女 ： 杨容姬 ， 潘岳 （ 潘安 ） 妻 。,女  人物一  潘岳  人物二  妻,1
TRAIN_SENT_ID_262919,,熊美玲,林秋离,No.293 抱紧 一点 林秋离 熊美玲 堂娜,抱紧 一点 人物二 人物一 堂娜,1
TRAIN_SENT_ID_256110,,蒋介石,宋美龄,2013.06 . 24 蒋介石 背后 的 女人 宋美龄,人物一 背后 女人 人物二,1
TRAIN_SENT_ID_271482,,钱基博,钱钟书,钱钟书 为 钱基博 “ 代笔 ” 考,人物二 人物一  代笔  考,-1
TRAIN_SENT_ID_285824,,李明启,王隽,王隽 家庭 状况 : 母亲 为 著名演员 李明启 中国棋院 · 棋手 : 九段 : 八段 : 七段 : 六段 : 五段 : 四段 : 三段 : 二段 : 初段 :,人物二 家庭 状况  母亲 著名演员 人物一 中国棋院  棋手  九段  八段  七段  六段  五段  四段  三段  二段  初段,-1
TRAIN_SENT_ID_273909,,江冬秀,胡适,妻子 ： 江冬秀 ， 由 胡适 其母 包办 ， 1917 年 成婚 。,妻子  人物一  人物二 其母 包办   年 成婚,1
TRAIN_SENT_ID_249441,,后稷,姜嫄,由于 来历不明 ， 姜嫄 一度 想 把 他 抛弃 ， 所以 后稷 最早 的 名字 叫做 “ 弃 ” 。,来历不明  人物二 一度 想 抛弃  人物一 最早 名字 叫做  弃,-1
TRAIN_SENT_ID_262762,,熊美玲,林秋离,No.158 爱人 下 港人 （ 台语 ） 林秋离 熊美玲 陈亚兰,爱人 港人  台语  人物二 人物一 陈亚兰,1
TRAIN_SENT_ID_286443,,杜金娥,杨延嗣,注意 ， 杨延嗣 VS 耶律沙 的 时候 ， 如果 杨 排风 、 杨八姐 和 杜金娥 和 杨延嗣 相临 的话 ， 会 增加 能力,注意  人物二  耶律沙  杨 排风  杨八姐 人物一 人物二 相临  会 增加 能力,1
TRAIN_SENT_ID_271053,,彭丽媛,习近平,“ 习近平 - 彭丽媛 兰花 ” 是 浅粉红色 ， 带有 小红点 。,人物二  人物一 兰花  浅粉红色  带有 小红点,1
TRAIN_SENT_ID_276324,,岳灵珊,林平之,如果 岳灵珊 能 意识 到 这些 避免 谈到 一些 林平之 的 痛处 ， 劝回 林平之 也 不是 没有 可能 。,人物一 意识 避免 谈到 人物二 痛处  劝回 人物二 没有 可能,1
TRAIN_SENT_ID_283585,,贾廷亮,王锁兰,2006 年 的 榜单 记录 为 “ 王锁兰 、 贾廷亮 （ 丈夫 ） ， 资产 16 亿元 ， 全国 排名第 38 位 ， 山西 唯一 一位 ” 。,年 榜单 记录  人物二  人物一  丈夫   资产  亿元  全国 排名第  位  山西 唯一 一位,1
TRAIN_SENT_ID_263743,,秦始皇,赵姬,东陵瓜邵平 简介 : 秦始皇 之 父母 庄襄王 和 赵姬 ， 安葬 在 如今 距 邵平 店有 5 公里 的 临潼区 韩峪 秦东 陵 。,东陵瓜邵平 简介  人物一 父母 庄襄王 人物二  安葬 如今 邵平 店有  公里 临潼区 韩峪 秦东 陵,-1
TRAIN_SENT_ID_254074,,林黛羽,俞佩玉,后 林黛羽 击退 了 几个 追杀 俞佩玉 的 黑衣人 ， 救 了 俞佩玉 并 叫 他 不要 再 叫 俞佩玉 。,人物一 击退 几个 追杀 人物二 黑衣人  救 人物二 不要 人物二,1
TRAIN_SENT_ID_267392,,许志安,郑秀文,- - - - 火热 动感 LaLaLa ( 郭富城 郑秀文 许志安 梁汉文 ),火热 动感   郭富城 人物二 人物一 梁汉文,1
TRAIN_SENT_ID_286993,,王纾,王烈,著名作家 还有 张智敏 、 方英文 、 高信 、 王烈 、 王纾 、 王盛华 、 胡长水 、 梁喜员 、 樊正兴 、 王林斌 等等 。,著名作家 张智敏  方英文  高信  人物二  人物一  王盛华  胡长水  梁喜员  樊正兴  王林斌,1
TRAIN_SENT_ID_275306,,潘巧云,杨雄,杨雄 醉 骂 潘巧云,人物二 醉 骂 人物一,1
TRAIN_SENT_ID_265968,,杨绛,钱钟书,写 《 围城 》 的 钱钟书 ( 杨绛 ),写  围城  人物二  人物一,1
TRAIN_SENT_ID_284855,,程瑶迦,陆冠英,第二十九章 陆冠英 程瑶迦 藏 宝剑,第二十九章 人物二 人物一 藏 宝剑,1
TRAIN_SENT_ID_254103,,霍启刚,郭晶晶,郭晶晶 霍启刚 即将 大婚,人物二 人物一 即将 大婚,1
TRAIN_SENT_ID_287194,,松田翔太,松田优作,恋爱 格局 演员表 : 恋爱 格局 松田龙平 : 父亲 为 已逝 知名演员 松田优作 ， 弟弟 松田翔太 亦 是 演员 。,恋爱 格局 演员表  恋爱 格局 松田龙平  父亲 已逝 知名演员 人物二  弟弟 人物一 演员,-1
TRAIN_SENT_ID_262382,,汪精卫,陈璧君,○ 汪精卫 决计 刺杀 摄政王 ， 陈璧君 要 与 他 共生死,○ 人物一 决计 刺杀 摄政王  人物二 共生死,1
TRAIN_SENT_ID_266394,,蔡赟,王娜,从此 ， 蔡赟 和 王娜 便 开始 相伴 而行 。,人物一 人物二 便 相伴 而行,1
TRAIN_SENT_ID_267706,,翁虹,刘莳,刘莳 ， 2007 年 10 月 12 日 出生 ， 当红 明星 翁虹 和 先生 刘冠廷 的 女儿 。,人物二   年  月  日 出生  当红 明星 人物一 先生 刘冠廷 女儿,-1
TRAIN_SENT_ID_278760,,许广平,周海婴,周海婴 ， 鲁迅 和 许广平 独子 ， 1929 年 9 月 生于 上海 ， 1960 年 毕业 于 北京大学 物理学 系 。,人物二  鲁迅 人物一 独子   年  月 生于 上海   年 毕业 北京大学 物理学 系,-1
TRAIN_SENT_ID_268521,,潘金莲,武大郎,武大郎 的 潘金莲 小说 类型 : 同 人 其它,人物二 人物一 小说 类型,1
TRAIN_SENT_ID_255517,,刘梅,夏雪,夏雪 要 参加 学校 的 毕业 晚会 ， 东海 把 给 刘梅 买 的 蝴蝶 胸针 借给 夏雪 ， 夏雪 很 高兴 。,人物二 参加 学校 毕业 晚会  东海 人物一 买 蝴蝶 胸针 借给 人物二  人物二 高兴,-1
TRAIN_SENT_ID_260508,,严嵩,严世蕃,其子 严世蕃 是 他 的 得力助手 ， 但 自从 严嵩 的 夫人 去世 ， 他 就 不能 再 参政 。,其子 人物二 得力助手  人物一 夫人 去世  不能 参政,-1
TRAIN_SENT_ID_276882,,罗启锐,张婉婷,故事 简介 : 《 非法 移民 》 是 张婉婷 和 罗启锐 一鸣惊人 之作 。,故事 简介   非法 移民  人物二 人物一 一鸣惊人 之作,1
TRAIN_SENT_ID_274417,,曾江,曾慕雪,曾慕雪 为 曾江 及 前妻 邓拱璧 之 女儿 ， 现为 PIP 剧场 全职 演员 。,人物二 人物一 前妻 邓拱璧 女儿  现为  剧场 全职 演员,-1
TRAIN_SENT_ID_262907,,熊美玲,林秋离,No.157 想家 林秋离 熊美玲 徐雯倩,想家 人物二 人物一 徐雯倩,1
TRAIN_SENT_ID_252296,,文姜,鲁桓公,不仅 文姜 有过 ， 鲁桓公 疏于 防闲 ， 软弱无能 ， 也 有 相当 可 “ 笑 ” 之 处 。,人物一 有过  人物二 疏于 防闲  软弱无能  相当  笑  处,1
TRAIN_SENT_ID_253719,,申雪,赵宏博,《 康 比特 纯 左旋 肉碱 （ 申雪 赵宏博 代言 ） 》,康 比特 纯 左旋 肉碱  人物一 人物二 代言,1
TRAIN_SENT_ID_267807,,杨绛,钱瑗,我们 的 钱瑗 内容简介 : 该书 由 杨绛 以及 钱瑗 的 继子 、 继女 、 师长 学生 、 同事 好友 等 合著 。,人物二 内容简介  该书 人物一 人物二 继子  继女  师长 学生  同事 好友 合著,-1
TRAIN_SENT_ID_285034,,朱见深,朱祁镇,英宗 （ 朱祁镇 ） 、 代宗 （ 祁钰 ） 、 英宗 （ 朱祁镇 ） 、 宪宗 （ 朱见深 ） 、 孝宗 （ 朱右 樘 ）,英宗  人物二   代宗  祁钰   英宗  人物二   宪宗  人物一   孝宗  朱右 樘,-1
TRAIN_SENT_ID_262918,,熊美玲,林秋离,No.192 谁 让 我 流泪 林秋离 熊美玲 潘美辰,流泪 人物二 人物一 潘美辰,1
TRAIN_SENT_ID_255902,,蒋介石,宋美龄,蒋介石 之所以 要 办理 完整 的 法律 手续 ， 主要 还是 为了 满足 宋美龄 的 要求 。,人物一 办理 完整 法律 手续  主要 满足 人物二 要求,1
TRAIN_SENT_ID_270408,,关平,关羽,关羽 （ 白 ） 关平 听令 ！,人物二  白  人物一 听令,-1
TRAIN_SENT_ID_257380,,袁克文,袁世凯,曾任 袁世凯 家庭教师 ， 袁克文 曾 从 问业 。,曾任 人物二 家庭教师  人物一 问业,-1
TRAIN_SENT_ID_259604,,冯小刚,徐帆,冯小刚 ， 徐帆,人物一  人物二,1
TRAIN_SENT_ID_268650,,潘金莲,武大郎,第二 三 一章 ‘ 潘金莲 ’ KO ‘ 武大郎 ’ （ 三 ） 、 惊天 巨密,第二 三 一章  人物一    人物二   三   惊天 巨密,1
TRAIN_SENT_ID_271649,,毛岸青,毛泽东,毛泽东 与 毛岸英 、 毛岸青 之间 的 “ 鸿雁传书 ” 毛泽东 和 毛岸青 （ 左一 ） 等 在 一起 。,人物二 毛岸英  人物一 之间  鸿雁传书  人物二 人物一  左一  一起,-1
TRAIN_SENT_ID_262972,,熊美玲,林秋离,No.51 有话 你 就 讲 啦 （ 台语 ） 林秋离 熊美玲 陈亚兰,有话 讲  台语  人物二 人物一 陈亚兰,1
TRAIN_SENT_ID_275328,,潘巧云,杨雄,潘巧云 钟情 貌 肖 前夫 的 石秀 ， 却 求爱 不遂 ， 转 与 如海 私通 ， 终丧 于夫 杨雄 刀下 。,人物一 钟情 貌 肖 前夫 石秀  求爱 不遂  转 如海 私通  终丧 于夫 人物二 刀下,1
TRAIN_SENT_ID_262950,,熊美玲,林秋离,No.174 当兵 前 的 男朋友 林秋离 熊美玲 南方 二重唱,当兵 前 男朋友 人物二 人物一 南方 二重唱,1
TRAIN_SENT_ID_255806,,蒋介石,宋美龄,左室 套间 是 蒋介石 和 宋美龄 回乡 时常 住处 。,左室 套间 人物一 人物二 回乡 时常 住处,1
TRAIN_SENT_ID_257302,,贾珍,尤氏,惜春 的 兄嫂 贾珍 、 尤氏 对 她 的 关心 是 怎样 的 呢 ？,惜春 兄嫂 人物一  人物二 关心,1
TRAIN_SENT_ID_265284,,贾琏,贾赦,贾琏 观点 四 : 有 说 贾赦 是 宁府 过继 给 荣府 的 ， 所以 贾琏 从 贾珍 ， 称 二爷 。,人物一 观点 四  说 人物二 宁府 过继 荣府  人物一 贾珍  称 二爷,-1
TRAIN_SENT_ID_250276,,秦始皇,胡亥,亲近 秦始皇 少子 胡亥 。,亲近 人物一 少子 人物二,-1
TRAIN_SENT_ID_259910,,花月奴,江枫,这 就是 江枫 对 邀 月 和 花月奴 的 态度 。,人物二 邀 月 人物一 态度,1
TRAIN_SENT_ID_270890,,贾午,韩寿,轶事 典故 : 贾午 的 爸爸 贾充 是 西晋 的 权臣 ， 经常 在家 召集 幕僚 开会 ， 英俊 青年 韩寿 也 是 与会者 之一 。,轶事 典故  人物一 爸爸 贾充 西晋 权臣  经常 在家 召集 幕僚 开会  英俊 青年 人物二 与会者,1
TRAIN_SENT_ID_276328,,岳灵珊,林平之,一 、 林平之 是否 爱过 岳灵珊 ？,人物二 是否 爱过 人物一,1
TRAIN_SENT_ID_264334,,贾环,赵姨娘,让 贾环 跟着 赵姨娘 ， 实际上 是 将 贾环 这个 贾府 的 三爷 ， 长期 名正言顺 的 隔绝 在 权力 统治 的 核心 之外 。,人物一 跟着 人物二  实际上 人物一 贾府 三爷  长期 名正言顺 隔绝 权力 统治 核心 之外,-1
TRAIN_SENT_ID_259001,,王熙凤,贾琏,平儿 - 王熙凤 的 陪嫁 丫嬛 ， 贾琏 的 妾 。,平儿  人物一 陪嫁 丫嬛  人物二 妾,1
TRAIN_SENT_ID_274005,,白素,卫斯理,《 大厦 》 ： 白素 的 客户 失踪 于 大厦 内 ， 小 郭 ， 卫斯理 和 白素 追查 ， 却 遭 送入 第四 空间 里 。,大厦   人物一 客户 失踪 大厦  郭  人物二 人物一 追查  遭 送入 第四 空间 里,1
TRAIN_SENT_ID_272542,,宋江,宋太公,宋江 本人 不是 一家之主 ， 宋太公 未必 能 让 宋江 拿 家里 的 钱 去 投 江湖 上 的 那个 无底洞 。,人物一 一家之主  人物二 未必 人物一 家里 钱 投 江湖 无底洞,-1
TRAIN_SENT_ID_270892,,贾午,韩寿,贾午 轶事 典故 : 贾午 的 爸爸 贾充 是 西晋 的 权臣 ， 经常 在家 召集 幕僚 开会 ， 英俊 青年 韩寿 也 是 与会者 之一 。,人物一 轶事 典故  人物一 爸爸 贾充 西晋 权臣  经常 在家 召集 幕僚 开会  英俊 青年 人物二 与会者,1
TRAIN_SENT_ID_272822,,谢烨,顾城,谢烨 、 顾城 同 外国 朋友 在 新西兰 自己 的 家中,人物一  人物二 外国 朋友 新西兰 家中,1
TRAIN_SENT_ID_255891,,蒋介石,宋美龄,曾 为 蒋介石 、 宋美龄 之 “ 御用 牧师 ” ， 并 主持 过 赵四 小姐 追思会 ， 为 李登辉 牧师 。,人物一  人物二  御用 牧师   主持 赵四 小姐 追思会  李登辉 牧师,1
TRAIN_SENT_ID_283094,,吴速玲,曹格,6 、 《 Letitgo 》 曹格 、 吴速玲 、 Joe 、 Grace 姐姐 。,人物二  人物一     姐姐,1
TRAIN_SENT_ID_254328,,左蓝,余则成,左蓝 是 余则成 真正 的 恋人 。,人物一 人物二 真正 恋人,1
TRAIN_SENT_ID_286692,,张志凯,俞正声,（ 政协 第十届 全国 委员会 委员 ） : 张志凯 ， 女 ， 中国共产党 中央政治局常委 俞正声 之妻 ， 现已 退休 ， 育有 一子 。,政协 第十届 全国 委员会 委员   人物一  女  中国共产党 中央政治局常委 人物二 之妻  现已 退休  育有 一子,1
TRAIN_SENT_ID_268216,,王小利,李琳,王小利 李琳 挺 好 得 吧 挺 好 的 变样 了 呢 嗯 多年 没见 了,人物一 人物二 挺 挺 变样 多年 没见,1
TRAIN_SENT_ID_273001,,严稚棱,钟丽缇,严稚棱 （ Cayla ） ， 2010 年 2 月 6 日 生于 北京 ， 是 钟丽缇 最小 的 女儿 。,人物一      年  月  日 生于 北京  人物二 最小 女儿,-1
TRAIN_SENT_ID_258412,,张兆和,沈从文,1969 年 初冬 了 ， 沈从文 作为 反动 文人 要 下放 改造 的 前夕 ， 此时 的 张兆和 已经 被 下 放到 湖北 咸宁 挑粪 种田 。,年 初冬  人物二 反动 文人 下放 改造 前夕  人物一 已经 放到 湖北 咸宁 挑粪 种田,1
TRAIN_SENT_ID_264277,,贾环,赵姨娘,唯独 对于 赵姨娘 与 贾环 ， 笔到 之处 ， 充满 厌恶 。,唯独 人物二 人物一  笔到 之处  充满 厌恶,-1
TRAIN_SENT_ID_277209,,张茜,张卫健,演唱 ： 张卫健 、 张茜 家庭,演唱  人物二  人物一 家庭,1
TRAIN_SENT_ID_283587,,侯佩岑,黄伯俊,黄伯俊 否认 订婚 : 侯佩岑 ( 23 张 ),人物二 否认 订婚  人物一   张,1
TRAIN_SENT_ID_273252,,秦香莲,陈世美,刘 箕裘 春蚕到死丝方尽 ( 1955 ) 陈世美 与 秦香莲 ( 1955 ) ....,刘 箕裘 春蚕到死丝方尽    人物二 人物一,1
TRAIN_SENT_ID_263689,,陈文琦,王雪红,王雪红 和 陈文琦 都 非常 节俭 。,人物二 人物一 非常 节俭,1
TRAIN_SENT_ID_254198,,邢夫人,贾赦,伯母 ： 邢夫人 （ 贾赦 填房 ）,伯母  人物一  人物二 填房,1
TRAIN_SENT_ID_251185,,廖仲恺,何香凝,偏厅 一楼 早年 是 何香凝 居住 过 的 地方 ， 受 廖仲恺 影响 ， 何香凝 于 1905 年 参加 了 中国同盟会 ， 开始 投身 革命 。,偏厅 一楼 早年 人物二 居住 地方  受 人物一 影响  人物二  年 参加 中国同盟会  投身 革命,1
TRAIN_SENT_ID_253580,,沈浪,朱七七,朋友 ： 沈浪 ， 熊猫儿 ， 朱七七 ；,朋友  人物一  熊猫儿  人物二,1
TRAIN_SENT_ID_263808,,刘嘉玲,梁朝伟,最 喜欢 的 演员 ： 刘嘉玲 、 梁朝伟,喜欢 演员  人物一  人物二,1
TRAIN_SENT_ID_262354,,汪精卫,陈璧君,王临乙 塑 汪精卫 陈璧君 跪 像 以 平民愤 。,王临乙 塑 人物一 人物二 跪 平民愤,1
TRAIN_SENT_ID_278630,,夏金桂,薛蟠,薛蟠 呆 霸王 暴虐 香菱 夏金桂 薛家 称霸,人物二 呆 霸王 暴虐 香菱 人物一 薛家 称霸,1
TRAIN_SENT_ID_267381,,许志安,郑秀文,《 明报 周刊 》 指 许志安 与 郑秀文 早 在 农历 年前 已经 秘密 复合 。,明报 周刊  指 人物一 人物二 早 农历 年前 已经 秘密 复合,1
TRAIN_SENT_ID_273457,,凌操,凌统,236 伦直 237 凌统 238 凌操 239 唐 咨 240 夏侯 令女,伦直  人物二  人物一  唐 咨  夏侯 令女,-1
TRAIN_SENT_ID_286731,,苏誉,苏珩,苏珩 之师 ， 苏誉 之母 。,人物二 之师  人物一 之母,-1
TRAIN_SENT_ID_276622,,韩寒,金丽华,4 韩夫人 : 正牌 “ 韩夫人 ” ： 金丽华 金丽华 ， 韩寒 长线 女友 ， 2003 级 中央戏剧学院 电影 电视 系 编导 专业 毕业 。,韩夫人  正牌  韩夫人   人物二 人物二  人物一 长线 女友   级 中央戏剧学院 电影 电视 系 编导 专业 毕业,1
TRAIN_SENT_ID_256612,,李逍遥,李忆如,身份 ： 林家 堡 大 小姐 ， 李逍遥 之妻 ， 李忆如 养母,身份  林家 堡 小姐  人物一 之妻  人物二 养母,-1
TRAIN_SENT_ID_263003,,熊美玲,林秋离,No.64 我 那么 那么 想 你 林秋离 熊美玲 杨林,想 人物二 人物一 杨林,1
TRAIN_SENT_ID_267542,,慕容令,慕容垂,慕容令 逃回 前燕后 ， 因忽叛 忽 归 ， 慕容令 而 慕容垂 又 无恙 ， 反而 受到 猜疑 。,人物一 逃回 前燕后  因忽叛 忽  人物一 人物二 无恙  猜疑,-1
TRAIN_SENT_ID_269164,,陆雪琪,张小凡,期间 陆雪琪 前来 探望 ， 张小凡 却 以为 是 幻觉 。,期间 人物一 前来 探望  人物二 幻觉,1
TRAIN_SENT_ID_283061,,余克稷,张瑞芳,余克稷 ， 张瑞芳 的 第一任 丈夫 ， 在 重庆 电力公司 担任 工程师 。,人物一  人物二 第一任 丈夫  重庆 电力公司 担任 工程师,1
TRAIN_SENT_ID_253544,,施南生,徐克,80 年代 末 ， 周凯旋 认识 了 导演 徐克 的 太太 、 在 政商 两界 都 有 丰富 人脉 的 施南生 ， 又 通过 施南生 结识 董建华 的 干 表妹 张培 薇 。,年代 末  周凯旋 认识 导演 人物二 太太  政商 两界 丰富 人脉 人物一  人物一 结识 董建华 干 表妹 张培 薇,1
TRAIN_SENT_ID_273567,,陈建州,范玮琪,T恤 ： “ 黑人 ” 陈建州 和 范玮琪 主导 的 公益 T恤 “ LoveLife ” 此次 献上 了 “ WS 定制 版 ” 。,恤   黑人  人物一 人物二 主导 公益 恤    献上   定制 版,1
TRAIN_SENT_ID_265064,,李铭顺,范文芳,范文芳 、 李铭顺,人物二  人物一,1
TRAIN_SENT_ID_284109,,郝治平,罗瑞卿,郝治平 求婚 : 不久 ， 罗瑞卿 向 郝治平 求婚 ， 治平 流着泪 点头 答应 了 罗瑞卿 的 求婚 。,人物一 求婚  不久  人物二 人物一 求婚  治平 流着泪 点头 答应 人物二 求婚,1
TRAIN_SENT_ID_255934,,蒋介石,宋美龄,蒋介石 、 宋美龄 夫妻 相处,人物一  人物二 夫妻 相处,1
TRAIN_SENT_ID_260484,,严嵩,严世蕃,阳春 故意 使计 ， 严嵩 与 严世蕃 以为 事迹 败露 惊慌失措 。,阳春 故意 使计  人物一 人物二 事迹 败露 惊慌失措,-1
TRAIN_SENT_ID_261927,,安雯,苏越,从 见到 安雯 的 第一眼 起 ， 苏越 风平浪静 的 心湖 就 被 搅乱 了 。,见到 人物一 第一眼  人物二 风平浪静 心湖 搅乱,1
TRAIN_SENT_ID_259915,,花月奴,江枫,可 千不该 万不该 的 ， 江枫 爱上 了 她 的 奴婢 花月奴 。,千不该 万不该  人物二 爱上 奴婢 人物一,1
TRAIN_SENT_ID_258329,,陈建斌,蒋勤勤,陈建斌 与 蒋勤勤 ， 将 老夫老妻 一词 诠释 得 淋漓尽致 。,人物一 人物二  老夫老妻 一词 诠释 淋漓尽致,1
