sent_id,sent_id,entity1,entity2,sent,processed_sent,label
TRAIN_SENT_ID_285917,,上官兰心,朱常洛,《 美人计 》 : 明光宗 朱常洛 即位 后 ， 他 梦想 与 深爱 的 妻子 上官兰心 双宿双飞 ， 白头到老 。,美人计   明光宗 人物二 即位  梦想 深爱 妻子 人物一 双宿双飞  白头到老,1
TRAIN_SENT_ID_255596,,蒋介石,宋美龄,1927 年 — — 蒋介石 与 宋美龄 结婚,年   人物一 人物二 结婚,1
TRAIN_SENT_ID_276771,,丁夫人,曹操,夏侯渊 ， 字妙 才 ， 夏侯惇 从弟 ， 曹操 连襟 ， 娶 丁夫人 之妹 。,夏侯渊  字妙  夏侯惇 从弟  人物二 连襟  娶 人物一 之妹,1
TRAIN_SENT_ID_258844,,廖梦醒,何香凝,根据 何香凝 临终前 的 遗愿 ， 9 月 6 日 ， 由 邓颖超 、 刘斐 、 朱蕴山 以及 廖梦醒 、 廖承志 、 经普椿 等 人 专程 护送 灵柩 至 南京 ， 与 廖仲恺 合墓 。,人物二 临终前 遗愿   月  日  邓颖超  刘斐  朱蕴山 人物一  廖承志  经普椿 专程 护送 灵柩 南京  廖仲恺 合墓,-1
TRAIN_SENT_ID_281426,,万玉枝,高咏,到 了 万家 以后 ， 见过 万玉枝 的 丈夫 高咏 卧病在床 ， 昏迷不醒 。,万家 以后  见过 人物一 丈夫 人物二 卧病在床  昏迷不醒,1
TRAIN_SENT_ID_284091,,郝治平,罗瑞卿,罗瑞卿 将军 及 夫人 郝治平 与 林如高 父子 合影,人物二 将军 夫人 人物一 林如高 父子 合影,1
TRAIN_SENT_ID_275706,,韩岫岩,王近山,王近山 在 北京 的 结发 妻子 韩岫岩 听到 了 他 患 癌症 的 消息 ， 脸 “ 唰 ” 地白 了 。,人物二 北京 结发 妻子 人物一 听到 患 癌症 消息  脸  唰  地白,1
TRAIN_SENT_ID_271589,,毛岸青,毛泽东,12 月 26 日 — — 毛东东 ， 毛泽东 的 曾孙 ， 毛岸青 的 孙子 ， 毛新宇 的 儿子,月  日   毛东东  人物二 曾孙  人物一 孙子  毛新宇 儿子,-1
TRAIN_SENT_ID_278639,,夏金桂,薛蟠,薛蟠 婚姻 不合 : 娶妻 夏金桂 后 ， 又 把 其 陪房 丫头 宝蟾 勾搭 上 手 。,人物二 婚姻 不合  娶妻 人物一  陪房 丫头 宝蟾 勾搭 手,1
TRAIN_SENT_ID_273354,,秦香莲,陈世美,为了 升官发财 ， 陈世美 更 抛弃 前妻 秦香莲 ， 当 上 千金小姐 的 驸马 。,升官发财  人物二 更 抛弃 前妻 人物一  千金小姐 驸马,1
TRAIN_SENT_ID_262004,,王明华,梅兰芳,姑母 王明华 是 梅兰芳 夫人 。,姑母 人物一 人物二 夫人,1
TRAIN_SENT_ID_284057,,赵力平,朱琦,赵力平 丈夫 病逝 : 朱琦 在 “ 文革 ” 中 受到 了 很大 的 牵连 。,人物一 丈夫 病逝  人物二  文革  中 很大 牵连,1
TRAIN_SENT_ID_273303,,秦香莲,陈世美,陈世美 家境贫寒 ， 与 妻子 秦香莲 （ 湖广 均州 人氏 ， 今 湖北 丹江口 人 ） 恩爱 和谐 。,人物二 家境贫寒  妻子 人物一  湖广 均州 人氏  湖北 丹江口  恩爱 和谐,1
TRAIN_SENT_ID_274307,,刘嫖,陈午,越礼 之始 : 陈皇后 失位 后 第二年 ， 刘嫖 的 丈夫 陈午 方才 过世 。,越礼 之始  陈皇后 失位 第二年  人物一 丈夫 人物二 方才 过世,1
TRAIN_SENT_ID_251384,,李安琪,李小鹏,李安琪 的 丈夫 是 体操 名将 李小鹏 。,人物一 丈夫 体操 名将 人物二,1
TRAIN_SENT_ID_258918,,王熙凤,贾琏,【 王熙凤 】 小名 凤姐儿 ， 浑号 凤辣子 ， 贾琏 之妻 。,人物一  小名 凤姐儿  浑号 凤辣子  人物二 之妻,1
TRAIN_SENT_ID_286277,,林凯闵,王渝文,王渝文 ， 1971 年 7 月 29 日出 生于 中国台湾 ， 演员 ， 已婚 （ 丈夫 林凯闵 ， 育有 一对 双胞胎 ） 。,人物二   年  月  日出 生于 中国台湾  演员  已婚  丈夫 人物一  育有 一对 双胞胎,1
TRAIN_SENT_ID_285913,,上官兰心,朱常洛,李梅儿 《 美人计 》 : 明光宗 朱常洛 即位 后 ， 他 梦想 与 深爱 的 妻子 上官兰心 双宿双飞 ， 白头到老 。,李梅儿  美人计   明光宗 人物二 即位  梦想 深爱 妻子 人物一 双宿双飞  白头到老,1
TRAIN_SENT_ID_273938,,江冬秀,胡适,西部 是 胡适 与 江冬秀 结婚 房间 ， 房内 有 木床 、 桌 、 椅 、 橱 、 凳 等 。,西部 人物二 人物一 结婚 房间  房内 木床  桌  椅  橱  凳,1
TRAIN_SENT_ID_284328,,王书麒,许秋怡,王书麒 的 妻子 是 歌星 许秋怡 ， 两人育 有 一子 。,人物一 妻子 歌星 人物二  两人育 一子,1
TRAIN_SENT_ID_273101,,谭蓓蓓,白云江,2012 年 8 月份 ， 白云江 和 谭蓓蓓 回 黑龙江省 桦南县 结婚 。,年  月份  人物二 人物一 回 黑龙江省 桦南县 结婚,1
TRAIN_SENT_ID_282848,,刘莳,翁虹,刘莳 ， 2007 年 10 月 12 日 出生 ， 当红 明星 翁虹 和 先生 刘冠廷 的 女儿 。,人物一   年  月  日 出生  当红 明星 人物二 先生 刘冠廷 女儿,-1
TRAIN_SENT_ID_286835,,刘元,邓晨,刘元 嫁 邓晨 为妻 。,人物一 嫁 人物二 为妻,1
TRAIN_SENT_ID_274321,,方怡,韦小宝,方怡 也 是 韦小宝 七位 夫人 之一 。,人物一 人物二 七位 夫人,1
TRAIN_SENT_ID_276170,,苏蕙,窦滔,晋 窦滔 妻 苏蕙 字若兰 ， 善属文 。,晋 人物二 妻 人物一 字若兰  善属文,1
TRAIN_SENT_ID_260352,,穆桂英,杨宗保,第四代 ： 有 杨宗保 之妻 穆桂英 ， 杨宗 勉之妻 焦月娘 ， 杨宗英 之妻 姜 北平 （ 或 称作 姜翠苹 、 江北 萍 ） 。,第四代  人物二 之妻 人物一  杨宗 勉之妻 焦月娘  杨宗英 之妻 姜 北平  称作 姜翠苹  江北 萍,1
TRAIN_SENT_ID_267473,,宋霭龄,孔祥熙,宋霭龄 家庭成员 : 丈夫 ： 孔祥熙,人物一 家庭成员  丈夫  人物二,1
TRAIN_SENT_ID_286895,,司马三娘,燕赤霞,司马三娘 人物 简介 : 司马三娘 身份 ： : 燕赤霞 的 妻子 ， 红叶 的 母亲 ， 诸葛流云 的 师母 ， 七夜 的 干娘 。,人物一 人物 简介  人物一 身份   人物二 妻子  红叶 母亲  诸葛流云 师母  七夜 干娘,1
TRAIN_SENT_ID_286691,,张志凯,俞正声,张志凯 家庭 信息 : 丈夫 ： 俞正声 （ 中国共产党 中央政治局常委 ）,人物一 家庭 信息  丈夫  人物二  中国共产党 中央政治局常委,1
TRAIN_SENT_ID_283649,,卢淑仪,李克勤,卢淑仪 ， 丈夫 李克勤,人物一  丈夫 人物二,1
TRAIN_SENT_ID_278525,,李秀文,叶挺,1925 年 ， 叶挺 与 李秀文 结婚 。,年  人物二 人物一 结婚,1
TRAIN_SENT_ID_262299,,汪精卫,陈璧君,汉奸 汪精卫 之妻 陈璧君,汉奸 人物一 之妻 人物二,1
TRAIN_SENT_ID_274762,,韩淑秀,郭松龄,韩淑秀 冒死 搭救 心上人 : 郭松龄 的 夫人 韩淑秀 （ 1891 － 1925 ） ， 堪称 奉天 奇女子 。,人物一 冒死 搭救 心上人  人物二 夫人 人物一       堪称 奉天 奇女子,1
TRAIN_SENT_ID_286679,,杨雨婷,房子斌,房子斌 与 妻子 杨雨婷,人物二 妻子 人物一,1
TRAIN_SENT_ID_282881,,陈有汉,陈弼臣,2000 年 4 月 旅港 同胞 陈有庆 及 旅泰 侨胞 陈有汉 捐资 兴建 “ 陈弼臣 体育馆 ” 及 “ 有庆楼 ” 、 “ 有汉楼 ” ， 总 建筑面积 8569 平方米 。,年  月 旅港 同胞 陈有庆 旅泰 侨胞 人物一 捐资 兴建  人物二 体育馆   有庆楼    有汉楼   总 建筑面积  平方米,-1
TRAIN_SENT_ID_286885,,张语芯,张纪中,张语芯 和 父亲 张纪中 2012 年 3 月 ， 张纪中 曾多次 出席 爱奇艺 的 相关 活动 ， 力挺 女儿 工作 。,人物一 父亲 人物二  年  月  人物二 曾多次 出席 爱奇艺 相关 活动  力挺 女儿 工作,-1
TRAIN_SENT_ID_255594,,蒋介石,宋美龄,在 学习 期间 ， 经 蒋介石 夫人 宋美龄 介绍 ， 结识 了 宋美龄 的 干女儿 四川 才女 张训 芳 。,学习 期间  人物一 夫人 人物二 介绍  结识 人物二 干女儿 四川 才女 张训 芳,1
TRAIN_SENT_ID_282388,,骆冰,文泰来,十一 当家 ： 「 鸳鸯刀 」 骆冰 ， 文泰来 妻子 ， 独行 大盗 「 神刀 」 骆元通 之女 ， 擅用 鸳鸯 双刀 和 飞刀 陈家洛,十一 当家   鸳鸯刀  人物一  人物二 妻子  独行 大盗  神刀  骆元通 之女  擅用 鸳鸯 双刀 飞刀 陈家洛,1
TRAIN_SENT_ID_279638,,窦仙童,薛丁山,下嫁 给 薛丁山 为妻 ， 与 樊梨花 、 窦仙童 同 为 薛丁山 的 正房 妻室 。,下嫁 人物二 为妻  樊梨花  人物一 人物二 正房 妻室,1
TRAIN_SENT_ID_260655,,李莎,李立三,孙维熙 李立三 夫人 李莎 回首往事,孙维熙 人物二 夫人 人物一 回首往事,1
TRAIN_SENT_ID_285015,,庄月明,李嘉诚,第七章 心心相印 亲上 结亲 喜叠喜 : 李嘉诚 的 妻子 是 表妹 庄月明 。,第七章 心心相印 亲上 结亲 喜叠喜  人物二 妻子 表妹 人物一,1
TRAIN_SENT_ID_278413,,夏正松,于靓,2011 年 1 月 22 日 在 安徽 卫视 首播 的 都市 言情剧 《 夏 家三 千金 》 中 饰演 夏正松 的 妻子 于靓 ， 也 是 夏 家三 千金 的 母亲 。,年  月  日 安徽 卫视 首播 都市 言情剧  夏 家三 千金  中 饰演 人物一 妻子 人物二  夏 家三 千金 母亲,1
TRAIN_SENT_ID_286632,,胡晓凤,张劲夫,张劲夫 家庭成员 : 夫人 ： 胡晓凤,人物二 家庭成员  夫人  人物一,1
TRAIN_SENT_ID_282386,,骆冰,文泰来,“ 奔雷 手 ” 文泰来 — — 四 当家 ， 骆冰 的 丈夫 。,奔雷 手  人物二   四 当家  人物一 丈夫,1
TRAIN_SENT_ID_268571,,潘金莲,武大郎,"2 内容简介 : 武大郎 天生 神力 , 潘金莲 是 模范 妻子 , 你 信 吗 ?",内容简介  人物二 天生 神力  人物一 模范 妻子  信,1
TRAIN_SENT_ID_256181,,蒋介石,宋美龄,谭延闿 人物 轶事 : 蒋介石 和 宋美龄 能够 结婚 ， 谭延闿 是 主要 功臣 。,谭延闿 人物 轶事  人物一 人物二 能够 结婚  谭延闿 主要 功臣,1
TRAIN_SENT_ID_265832,,郭涛,郭子睿,馨巧队 ： 李馨巧 、 孙坚 、 贾玲 、 黄艺馨 、 刘维 第二期 （ 1 月 25 日 ） : 石头 队 ： 郭涛 、 郭子睿,馨巧队  李馨巧  孙坚  贾玲  黄艺馨  刘维 第二期   月  日   石头 队  人物一  人物二,-1
TRAIN_SENT_ID_274149,,汤国梨,章太炎,章太炎 与 汤国梨 · 国学大师 的 新式 婚礼,人物二 人物一  国学大师 新式 婚礼,1
TRAIN_SENT_ID_251396,,李安琪,李小鹏,个人 生活 : 李安琪 ， 父母 皆 是 国家 体操 名将 ， 体操 名将 李小鹏 的 妻子 ， 李馨 琪 的 母亲 ， 美籍华人 。,个人 生活  人物一  父母 皆 国家 体操 名将  体操 名将 人物二 妻子  李馨 琪 母亲  美籍华人,1
TRAIN_SENT_ID_277382,,樊姬,楚庄王,楚妃 叹 l ； 烈女传 : 樊姬 者 ， 楚庄王 之 夫人 也 。,楚妃 叹   烈女传  人物一  人物二 夫人,1
TRAIN_SENT_ID_285006,,庄月明,李嘉诚,李嘉诚 全传 第七章 心心相印 亲上 结亲 喜叠喜 : 李嘉诚 的 妻子 是 表妹 庄月明 。,人物二 全传 第七章 心心相印 亲上 结亲 喜叠喜  人物二 妻子 表妹 人物一,1
TRAIN_SENT_ID_287165,,孙家碧,万剑锋,身份 背景 ： 孙家碧 是 唐宣宗 贤妃 之母 ， 将军 万剑锋 之妻 。,身份 背景  人物一 唐宣宗 贤妃 之母  将军 人物二 之妻,1
TRAIN_SENT_ID_265535,,周萍,周朴园,蘩 漪 ： 35 岁 ， 周朴园 之妻 ， 与 周萍 私通 。,蘩 漪   岁  人物二 之妻  人物一 私通,-1
TRAIN_SENT_ID_285049,,朱见深,朱祁镇,忻 穆王 朱见治 （ 1458 年 3 月 18 日 ― 1472 年 4 月 2 日 ） ， 母万宸 妃 ； 明英宗 朱祁镇 第八 子 ， 明宪宗 朱见深 异 母弟 ， 母宸 妃 万氏 。,忻 穆王 朱见治   年  月  日 ―  年  月  日   母万宸 妃  明英宗 人物二 第八 子  明宪宗 人物一 异 母弟  母宸 妃 万氏,-1
TRAIN_SENT_ID_278475,,周叔苹,周今觉,周今觉 有 8 个 女儿 ， 个个 气度不凡 ， 周叔苹 和 周稚芙 都 是从 这个 家庭 走出 的 名媛 。,人物二  女儿  个个 气度不凡  人物一 周稚芙 是从 家庭 走出 名媛,-1
TRAIN_SENT_ID_274306,,刘嫖,陈午,刘嫖 越礼 之始 : 陈皇后 失位 后 第二年 ， 刘嫖 的 丈夫 陈午 方才 过世 。,人物一 越礼 之始  陈皇后 失位 第二年  人物一 丈夫 人物二 方才 过世,1
TRAIN_SENT_ID_282926,,王灵宾,王骞,王灵宾 （ 505 年 — 549 年 ） ， 琅 琊 临沂 （ 今 山东 临沂 ） 人 ， 太尉 王俭 的 孙女 ， 王骞 的 女儿 ， 梁 简文帝 萧纲 结发 妻子 。,人物一   年   年   琅 琊 临沂  山东 临沂   太尉 王俭 孙女  人物二 女儿  梁 简文帝 萧纲 结发 妻子,-1
TRAIN_SENT_ID_281657,,蒋建琪,蒋瑶嘉,据 爆料 ， 蒋瑶嘉 的 父亲 叫 蒋建琪 ， 他 1993 年 创立 湖州 老顽童 食品 有限公司 ( 也 就是 后来 的 香 飘飘 食品 有限公司 ) 。,爆料  人物二 父亲 人物一   年 创立 湖州 老顽童 食品 有限公司  后来 香 飘飘 食品 有限公司,-1
TRAIN_SENT_ID_281641,,黄峨,杨慎,黄杨 两家 ， 本有 通家 之谊 ， 正德 十四年 ( 1519 ) 冬天 ， 黄峨 与 杨慎 结婚 ， 杨慎 亲往 遂宁 迎娶 。,黄杨 两家  本有 通家 之谊  正德 十四年    冬天  人物一 人物二 结婚  人物二 亲往 遂宁 迎娶,1
TRAIN_SENT_ID_270362,,关平,关羽,光 和 五年 （ 182 年 ） — — 孙权 ， 东 吴建国 者 （ 252 年 去世 ） ； 关平 ， 关羽 的 长子 ( 219 年 去世 ) 。,光 五年   年    孙权  东 吴建国   年 去世   人物一  人物二 长子   年 去世,-1
TRAIN_SENT_ID_281403,,钱学森,钱永刚,1955 年 9 月 17 日 ， 钱学森 向 导师 冯 卡门 告别 之后 ， 带 着 妻子 蒋英 及 幼儿 钱永刚 、 幼女 钱永真 登上 了 克利夫兰 总统 号 轮船 启程 回国 。,年  月  日  人物一 导师 冯 卡门 告别 之后  带 妻子 蒋英 幼儿 人物二  幼女 钱永真 登上 克利夫兰 总统 号 轮船 启程 回国,-1
TRAIN_SENT_ID_276251,,西门吹雪,孙秀青,西门吹雪 的 夫人 正是 峨眉 四秀 之一 孙秀青 。,人物一 夫人 峨眉 四秀 人物二,1
TRAIN_SENT_ID_285247,,陈是知,陈可辛,籍贯 广东 番禺 ， 香港 出生 ， 伴侣 为 陈可辛 ， 育有 一 女儿 陈是知 ， 父亲 是 曾 在 亚洲电视 主持 《 六合彩 》 节目 多年 之冬叔 夏 春秋 。,籍贯 广东 番禺  香港 出生  伴侣 人物二  育有 女儿 人物一  父亲 亚洲电视 主持  六合彩  节目 多年 之冬叔 夏 春秋,-1
TRAIN_SENT_ID_263711,,郭槐,贾充,（ 西晋时 大臣 贾充 继室 和 贾南风 生母 ） : 广城君 郭槐 （ 237 — 296 ） ， 字媛韶 ， 太原 阳曲 人 ， 西晋 大臣 贾充 的 妻子 ， 以善妒 出名 。,西晋时 大臣 人物二 继室 贾南风 生母   广城君 人物一       字媛韶  太原 阳曲  西晋 大臣 人物二 妻子  以善妒 出名,1
TRAIN_SENT_ID_284361,,唐筼,陈寅恪,唐筼 （ 1898 — — 1969 ） ， 陈寅恪 的 夫人 ， 1898 年生 ， 广西 灌阳 人 。,人物一        人物二 夫人   年生  广西 灌阳,1
TRAIN_SENT_ID_279584,,马丽娟,赵本山,1992 年 ， 赵本山 与 马丽娟 结婚 。,年  人物二 人物一 结婚,1
TRAIN_SENT_ID_285800,,宋子安,宋嘉树,（ 宋子文 胞弟 ） : 宋子安 （ 1906 － 1969 ） ， 祖籍 海南省 文昌市 ， 父亲 是 上海 传教士 及 富商 宋嘉树 ， 母亲 倪桂珍 。,宋子文 胞弟   人物一       祖籍 海南省 文昌市  父亲 上海 传教士 富商 人物二  母亲 倪桂珍,-1
TRAIN_SENT_ID_270146,,罗成,罗艺,罗艺 赴京 ， 考试 得 中后 又 与 秦氏 结婚 ， 生 了 个 儿子 名叫 罗成 ， 学成 花枪 。,人物二 赴京  考试 中后 秦氏 结婚  生 儿子 名叫 人物一  学成 花枪,-1
TRAIN_SENT_ID_274940,,章曙,章启月,章启月 ， 1959 年 10 月 出 生于 北京 一个 外交官 家庭 ， 父亲 是 前 驻 比利时 、 日本 大使 章曙 先生 。,人物二   年  月 出 生于 北京 一个 外交官 家庭  父亲 前 驻 比利时  日本 大使 人物一 先生,-1
TRAIN_SENT_ID_250939,,霍震霆,朱玲玲,长子 ： 霍启刚 ， 1979 年 生于 香港 ， 祖籍 广州 番禺 ， 霍震霆 与 前妻 朱玲玲 长子 ， 霍英东 集团 副总裁 。,长子  霍启刚   年 生于 香港  祖籍 广州 番禺  人物一 前妻 人物二 长子  霍英东 集团 副总裁,1
TRAIN_SENT_ID_286656,,周丰三,周建人,后 周作人 的 弟弟 周建人 次子 与 三子 分别 名为 周丰二 （ 生于 1919 年 ） ， 周丰三 （ 生于 1922 年 ， 1941 年 饮枪 自尽 ）,周作人 弟弟 人物二 次子 三子 名为 周丰二  生于  年   人物一  生于  年   年 饮枪 自尽,-1
TRAIN_SENT_ID_286162,,甄家平,傅声,而 傅声 死后 四年 ， 甄妮 于 1987 年 7 月 4 日于 美国 用 精子 冷冻 技术 为 亡夫 秘密 诞下 女儿 甄家平 （ 英文名 ： Melody ） 。,人物二 死后 四年  甄妮  年  月  日于 美国 精子 冷冻 技术 亡夫 秘密 诞下 女儿 人物一  英文名,-1
TRAIN_SENT_ID_272494,,韦丛,元稹,元稹 与 韦丛 是 恩爱 伉俪 ， 但 时间 不 长 韦丛 谢世 ， 元稹 有 《 祭 亡妻 韦氏 文 》 以及 《 遣 悲怀 三首 》 等 诗篇 哀悼 自己 的 妻子 。,人物二 人物一 恩爱 伉俪  时间 长 人物一 谢世  人物二  祭 亡妻 韦氏 文   遣 悲怀 三首  诗篇 哀悼 妻子,1
TRAIN_SENT_ID_267605,,金正恩,李雪主,金正恩 还 金正恩 与 夫人 李雪主 被选为 朝鲜人民军 党代表 。,人物一 人物一 夫人 人物二 被选为 朝鲜人民军 党代表,1
TRAIN_SENT_ID_273909,,江冬秀,胡适,妻子 ： 江冬秀 ， 由 胡适 其母 包办 ， 1917 年 成婚 。,妻子  人物一  人物二 其母 包办   年 成婚,1
TRAIN_SENT_ID_279598,,蒋友常,蒋孝勇,1988 年 1 月 13 日 蒋经国 逝世 后 ， 她 和 蒋孝勇 带 着 长子 蒋友柏 、 次子 蒋友常 举家 迁往 加拿大 定居 。,年  月  日 蒋经国 逝世  人物二 带 长子 蒋友柏  次子 人物一 举家 迁往 加拿大 定居,-1
TRAIN_SENT_ID_285899,,赵一涵,赵本山,目前 赵本山 女儿 赵一涵 （ 妞妞 ） 大胆 晒出 了 一组 自己 的 海军 制服 露脐 写真 。,目前 人物二 女儿 人物一  妞妞  大胆 晒出 一组 海军 制服 露脐 写真,-1
TRAIN_SENT_ID_270234,,谭江柏,谭咏麟,爱上 您 歌手 信息 : 谭咏麟 （ 1950 年 8 年 23 日 － ） 绰号 「 谭 校长 」 ， 为 已故 足球 名宿 谭江柏 之子 ， 合并 图册 ( 2 张 ),爱上 歌手 信息  人物二   年  年  日   绰号  谭 校长   已故 足球 名宿 人物一 之子  合并 图册   张,-1
TRAIN_SENT_ID_257137,,胡金铨,钟玲,胡金铨 婚姻 : 胡金铨 ， 夫人 钟玲,人物一 婚姻  人物一  夫人 人物二,1
TRAIN_SENT_ID_267500,,宋霭龄,孔祥熙,她 在 重庆 原 无 住房 ， 只好 暂住 其 大姐 宋霭龄 家 ， 宋霭龄 的 丈夫 是 国民党 的 财政部长 孔祥熙 。,重庆 原 住房  只好 暂住 大姐 人物一 家  人物一 丈夫 国民党 财政部长 人物二,1
TRAIN_SENT_ID_279152,,赵薇,黄有龙,2011 年 7 月 23 日 赵薇 老公 黄有龙 微薄 登 了 一张 女儿 手 捧 “ 小金 ” 人 的 照片 。,年  月  日 人物一 老公 人物二 微薄 登 一张 女儿 手 捧  小金  照片,1
TRAIN_SENT_ID_284093,,郝治平,罗瑞卿,郝治平 人物 简介 : 郝治平 ， 是 中华人民共和国 首任 公安部 部长 罗瑞卿 大将军 的 夫人 。,人物一 人物 简介  人物一  中华人民共和国 首任 公安部 部长 人物二 大将军 夫人,1
TRAIN_SENT_ID_278445,,张成泽,金敬姬,金敬姬 的 丈夫 是 去年 被 处决 的 朝 军事 委员会 副委员长 张成泽 ， 张成泽 落马 之后 ， 金敬姬 鲜有 露面 。,人物二 丈夫 去年 处决 军事 委员会 副委员长 人物一  人物一 落马 之后  人物二 鲜有 露面,1
TRAIN_SENT_ID_272518,,韦丛,元稹,夏卿 与 爱妻 生 下 韦丛 ， 多年 后 将 韦丛 许配给 当时 未曾 有 官名 的 元稹 。,夏卿 爱妻 生 人物一  多年 人物一 许配给 当时 未曾 官名 人物二,1
TRAIN_SENT_ID_255855,,蒋介石,宋美龄,晚年 的 蒋介石 与 妻子 宋美龄,晚年 人物一 妻子 人物二,1
TRAIN_SENT_ID_282401,,陈品亨,陈鸿烈,陈鸿烈 的 突然 离世 引起 舆论 的 普遍 关注 ， 作为 陈鸿烈 女儿 的 陈品亨 也 受到 了 较大 关注 。,人物二 突然 离世 引起 舆论 普遍 关注  人物二 女儿 人物一 较大 关注,-1
TRAIN_SENT_ID_272508,,韦丛,元稹,这是 元稹 在 元 和 四年 三月 的 最后 一天 ， 为 思念 妻子 韦丛 而作 。,这是 人物二 元 四年 三月 最后 一天  思念 妻子 人物一 而作,1
TRAIN_SENT_ID_286229,,罗疏桐,罗京,罗京 的 儿子 罗疏桐 已经 18 岁 ， 就读于 北师大 附属 实验 中学 （ 2012 年 ） 。,人物二 儿子 人物一 已经  岁  就读于 北师大 附属 实验 中学   年,-1
TRAIN_SENT_ID_284216,,杨诺思,杨受成,杨诺思 ， 香港 英皇 集团 老板 杨受成 之女 。,人物一  香港 英皇 集团 老板 人物二 之女,-1
TRAIN_SENT_ID_277544,,柴绍,平阳公主,同年 柴绍 的 妻子 平阳公主 去世 。,同年 人物一 妻子 人物二 去世,1
TRAIN_SENT_ID_274755,,韩淑秀,郭松龄,1925 年 12 月 ， 郭松龄 、 韩淑秀 夫妻 惨遭 “ 曝尸 ” 之辱 。,年  月  人物二  人物一 夫妻 惨遭  曝尸  之辱,1
TRAIN_SENT_ID_284737,,李春江,李京龙,李京龙 ， 男 ， 生于 1995 年 3 月 15 日 ， 中国篮球 运动员 ， 司职 得分 后卫 ， 著名 篮球 教练 李春江 的 儿子 。,人物二  男  生于  年  月  日  中国篮球 运动员  司职 得分 后卫  著名 篮球 教练 人物一 儿子,-1
TRAIN_SENT_ID_258009,,黄睿靓,陈致中,陈致中 （ 妻 黄睿靓 ）,人物二  妻 人物一,1
TRAIN_SENT_ID_283155,,班淑娴,何太冲,随后 何太冲 设宴款待 ， 但是 宴席 上 的 酒 却 被 何太冲 的 妻子 班淑娴 下 了 毒 并 逼迫 无忌 喝 下 。,人物二 设宴款待  宴席 酒 人物二 妻子 人物一 毒 逼迫 无忌 喝,1
TRAIN_SENT_ID_285907,,赵一涵,赵本山,2011 年 5 月 ， 赵本山 十四岁 女儿 妞妞 自拍照 曝光 ， 妞妞 已经 十四岁 了 ， 赵一涵 即将 进入 高中 就读 。,年  月  人物二 十四岁 女儿 妞妞 自拍照 曝光  妞妞 已经 十四岁  人物一 即将 进入 高中 就读,-1
TRAIN_SENT_ID_263792,,张子萱,杨一柳,杨一柳 和 张子萱 两人 结合 堪称 才子佳人 的 绝配 ， 夫妻俩 曾 合作 电影 《 我 叫 郝 聪明 》 ， 张子萱 是 女主角 ， 而 杨一柳 则 是 制片人 。,人物二 人物一 两人 结合 堪称 才子佳人 绝配  夫妻俩 合作 电影  郝 聪明   人物一 女主角  人物二 制片人,1
TRAIN_SENT_ID_255671,,蒋介石,宋美龄,51 . 出色 的 外交家 、 蒋介石 夫人 — — 宋美龄 / 83,出色 外交家  人物一 夫人   人物二,1
TRAIN_SENT_ID_273915,,江冬秀,胡适,悲痛欲绝 胡适 与 刚 完婚 不到 一年 的 妻子 江冬秀 回家 奔丧 ， 写下 《 先母 行述 》 ：,悲痛欲绝 人物二 刚 完婚 不到 一年 妻子 人物一 回家 奔丧  写下  先母 行述,1
TRAIN_SENT_ID_281809,,李蕙仙,梁启超,梁启超 夫人 李蕙仙 、 王桂荃 / 16,人物二 夫人 人物一  王桂荃,1
TRAIN_SENT_ID_273931,,江冬秀,胡适,胡适 与 曹诚英 第一次 见面 是 在 他 与 江冬秀 的 婚礼 上 。,人物二 曹诚英 第一次 见面 人物一 婚礼,1
TRAIN_SENT_ID_286834,,刘元,邓晨,"刘元 - - - - 刘秀 二姐 , 邓晨 之妻 。",人物一     刘秀 二姐  人物二 之妻,1
TRAIN_SENT_ID_287262,,张静,杨志刚,杨志刚 的 妻子 叫 张静 ， 是 一名 配音演员 。,人物二 妻子 人物一  一名 配音演员,1
TRAIN_SENT_ID_262403,,汪精卫,陈璧君,陈璧君 与 汪精卫 结婚 后 ， 暴露出 了 她 任性 、 跋扈 的 性格 ， 有时 完全 不 顾及 汪精卫 的 面子 。,人物二 人物一 结婚  暴露出 任性  跋扈 性格  完全 顾及 人物一 面子,1
TRAIN_SENT_ID_277372,,樊姬,楚庄王,⑨ 、 樊姬 ： 楚庄王 夫人 。,⑨  人物一  人物二 夫人,1
TRAIN_SENT_ID_281486,,吕牧石,马慧先,吕牧石 马慧先 : 马慧先 ， 吕牧石 之妻 。,人物一 人物二  人物二  人物一 之妻,1
TRAIN_SENT_ID_285573,,韩瑜,孙协志,2011 年 4 月底 ， 孙协志 向 女友 韩瑜 求婚 成功 。,年  月底  人物二 女友 人物一 求婚 成功,1
TRAIN_SENT_ID_276565,,孔子,亓官氏,此殿 在 大成殿 之后 ， 是 祭祀 孔子 夫人 亓官氏 的 地方 。,此殿 大成殿 之后  祭祀 人物一 夫人 人物二 地方,1
TRAIN_SENT_ID_274145,,汤国梨,章太炎,沈家宏 夫人 : 冶坊 主 沈和 甫 是 汤国梨 的 干爹 ， 经 张典 通 （ 当时 担任 孙中山 的 秘书长 ） 和 沈和 甫 的 介绍 汤国梨 与 国学大师 章太炎 结婚 。,沈家宏 夫人  冶坊 主 沈和 甫 人物一 干爹  张典 通  当时 担任 孙中山 秘书长  沈和 甫 介绍 人物一 国学大师 人物二 结婚,1
TRAIN_SENT_ID_251804,,贾珠,贾兰,她 与其 夫 贾珠 婚后 生 了 贾兰 ， 不久 丈夫 就 死 了 。,夫 人物一 婚后 生 人物二  不久 丈夫 死,-1
TRAIN_SENT_ID_251563,,田灵儿,苏茹,苏茹 角色 分析 : 许多 人 都 说 诛 仙 的 剧情 类似 笑傲江湖 ： 田灵儿 像 岳灵珊 ， 苏茹 像宁 夫人 。,人物二 角色 分析  说 诛 仙 剧情 类似 笑傲江湖  人物一 岳灵珊  人物二 像宁 夫人,-1
TRAIN_SENT_ID_272921,,王岳伦,王诗龄,王诗龄 个人 生活 : 王诗龄 的 母亲 是 主持人 李湘 ， 父亲 是 导演 王岳伦 。,人物二 个人 生活  人物二 母亲 主持人 李湘  父亲 导演 人物一,-1
