sent_id,sent_id,entity1,entity2,sent,processed_sent,label
TRAIN_SENT_ID_260822,,何超琼,许晋亨,再 问 他 许晋亨 与 李嘉欣 结婚 ， 何超琼 心情 如何 ？,问 人物二 李嘉欣 结婚  人物一 心情,1
TRAIN_SENT_ID_256057,,蒋介石,宋美龄,1927 年底 ， 蒋介石 回到 上海 ， 与 宋美龄 完婚 ， 通过 江浙 财阀 确立 了 与 美 、 英 的 关系 。,年底  人物一 回到 上海  人物二 完婚  江浙 财阀 确立 美  英 关系,1
TRAIN_SENT_ID_273894,,江冬秀,胡适,江冬秀 人物 轶事 : 婚后 第二年 ， 江冬秀 到 了 北京 为 胡适 主持 家务 。,人物一 人物 轶事  婚后 第二年  人物一 北京 人物二 主持 家务,1
TRAIN_SENT_ID_265706,,贾环,贾政,先写 贾政 不满 于宝玉 精神 萎靡 ， 次 写 忠顺 府 索琪官 ， 接写 贾环 进 谗言 ， 终于 激怒 贾政 。,先写 人物二 不满 于宝玉 精神 萎靡  次 写 忠顺 府 索琪官  接写 人物一 进 谗言  终于 激怒 人物二,-1
TRAIN_SENT_ID_272334,,金正恩,金正日,该 媒体 转述 称 ， 司令部 安保 人员 接 金正恩 命令 ， 到 金敬姬 家接 她 参加 金正日 两周年 追悼 活动 。,媒体 转述 称  司令部 安保 人员 接 人物一 命令  金敬姬 家接 参加 人物二 两周年 追悼 活动,-1
TRAIN_SENT_ID_283869,,于海宁,范会香,虽然 范会香 已经 是 癌症 晚期 ， 但 于海宁 却 下定决心 ： 这辈子 一定 要 娶 她 为 妻 ！,人物二 已经 癌症 晚期  人物一 下定决心  这辈子 一定 娶 妻,1
TRAIN_SENT_ID_256396,,李天一,李双江,李天一 年龄 造假 : 李双江 前往 医院 向 伤者 道歉 ( 2 张 ),人物一 年龄 造假  人物二 前往 医院 伤者 道歉   张,-1
TRAIN_SENT_ID_284025,,胡青牛,王难姑,这 对 夫妻 ， 就是 胡青牛 和 王难姑 。,夫妻  人物一 人物二,1
TRAIN_SENT_ID_256383,,李天一,李双江,国外 媒体 的 报道 文章 中 尽管 对 李双江 的 歌手 身份 做出 了 介绍 ， 但 更 多 地 将 他 称为 “ 将军 ” ， 李天一 也 因此 不再 仅 是 “ 星 二代 ” 。,国外 媒体 报道 文章 中 人物二 歌手 身份 做出 介绍  更 称为  将军   人物一 不再 仅  星 二代,-1
TRAIN_SENT_ID_281522,,林立衡,林彪,林立衡 自从 报告 了 林彪 要 去 外地 的 情况 后 ， 已经 不敢 再 回去 了 / 林彪 问 林立果 和 警卫 秘书 ： “ 去 伊尔库茨克 要 飞 多少 时间 ？ ”,人物一 报告 人物二 外地 情况  已经 不敢 回去  人物二 问 林立果 警卫 秘书   伊尔库茨克 飞 时间,-1
TRAIN_SENT_ID_272240,,金正恩,金正日,张成泽 被 处决 后 ， 其 遗孀 兼 金正恩 姑姑 金敬姬 一直 没 露面 ， 连 亡兄 金正日 上周 逝世 两周年 的 追悼会 也 缺席 。,张成泽 处决  遗孀 兼 人物一 姑姑 金敬姬 一直 没 露面  亡兄 人物二 上周 逝世 两周年 追悼会 缺席,-1
TRAIN_SENT_ID_274704,,龙啸云,林诗音,林诗音 青梅竹马 的 恋人 、 未婚夫 ， 因 不忍 龙啸云 的 相思 之苦 而 放,人物二 青梅竹马 恋人  未婚夫  不忍 人物一 相思 之苦 放,1
TRAIN_SENT_ID_256788,,朱军,谭梅,《 夫妻 剧场 · 朱军 、 谭梅 夫妇 》,夫妻 剧场  人物一  人物二 夫妇,1
TRAIN_SENT_ID_248898,,窦滔,苏蕙,亦 晋 窦滔 妻 苏蕙 。,晋 人物一 妻 人物二,1
TRAIN_SENT_ID_268468,,梁静慈,甄子丹,梁静慈 喜 得 贵子 : 婚后 ， 甄子丹 说服 梁静慈 辞职 在家 。,人物一 喜 贵子  婚后  人物二 说服 人物一 辞职 在家,1
TRAIN_SENT_ID_257333,,贾珍,尤氏,宁国府 梅花 盛开 ， 贾珍 妻 尤氏 请 贾母 等 赏玩 。,宁国府 梅花 盛开  人物一 妻 人物二 请 贾母 赏玩,1
TRAIN_SENT_ID_252229,,秦嘉,徐淑,秦嘉 、 徐淑 夫妇 恩爱 ， 都 能 诗文 。,人物一  人物二 夫妇 恩爱  诗文,1
TRAIN_SENT_ID_253515,,祝彪,扈三娘,扈家庄 比武招亲 ， 扈三娘 与 祝家庄 祝彪 一见钟情 ， 定下 婚约 。,扈家庄 比武招亲  人物二 祝家庄 人物一 一见钟情  定下 婚约,1
TRAIN_SENT_ID_256089,,蒋介石,宋美龄,二 、 蒋介石 向 宋美龄 求婚 的 历程,二  人物一 人物二 求婚 历程,1
TRAIN_SENT_ID_260897,,贾珍,贾蓉,这 就 告诉 我们 ， 尤三姐 不止 与 贾珍 有私 ， 而且 与 贾蓉 的 关系 也 是 不干不净 的 。,告诉  尤三姐 不止 人物一 有私  人物二 关系 不干不净,-1
TRAIN_SENT_ID_269995,,姚明,叶莉,自打 姚明 和 叶莉 谈上 恋爱 ， 中国篮球 就 被 认为 后继有人 了 ， 尤其 在 “ 姚 千金 ” 姚沁蕾 诞生 后 。,人物一 人物二 谈上 恋爱  中国篮球 认为 后继有人  尤其  姚 千金  姚沁蕾 诞生,1
TRAIN_SENT_ID_265834,,郭涛,郭子睿,张亮 、 郭涛 、 张悦轩 、 郭子睿,张亮  人物一  张悦轩  人物二,-1
TRAIN_SENT_ID_272750,,徐天宏,周绮,徐天宏 和 周绮 完婚 ， 红花 会众 豪杰 闹洞房 一段 ， 最是 好看 。,人物一 人物二 完婚  红花 会众 豪杰 闹洞房 一段  最是 好看,1
TRAIN_SENT_ID_251096,,尤三姐,柳湘莲,后 柳湘莲 闻知 尤三姐 住 宁国府 ， 疑其 清白 ， 欲 退婚 。,人物二 闻知 人物一 住 宁国府  疑其 清白  欲 退婚,1
TRAIN_SENT_ID_256755,,邵昕,黄玉婷,黄玉婷 事件 : 日前 邵昕 召开 记者会 ， 会上 驳斥 前妻 婷婷 拿 孩子 来 炒作 ， 直言 这种 行为 很 可耻 。,人物二 事件  日前 人物一 召开 记者会  会上 驳斥 前妻 婷婷 孩子 炒作  直言 这种 行为 可耻,1
TRAIN_SENT_ID_248869,,窦滔,苏蕙,司 洛阳 花仙子 ： 苏蕙 （ 窦滔 妻 ） 墟 里 烟,司 洛阳 花仙子  人物二  人物一 妻  墟 里 烟,1
TRAIN_SENT_ID_271632,,毛岸青,毛泽东,毛泽东 和 毛岸青 、 邵华 合影 。,人物二 人物一  邵华 合影,-1
TRAIN_SENT_ID_274036,,白素,卫斯理,故事 的 一个 重要 结果 就是 卫斯理 与 白素 订婚 ， 从此 白素 成 了 卫斯理 冒险 生涯 中 最 重要 、 最 有力 、 最 坚实 的 支持,故事 一个 重要 人物二 人物一 订婚  人物一 成 人物二 冒险 生涯 中 重要  有力  坚实 支持,1
TRAIN_SENT_ID_255857,,蒋介石,宋美龄,1943 年 与 蒋纬国 在 西安 常 宁宫 结为 连理 ， 由 蒋介石 、 宋美龄 主婚 。,年 蒋纬国 西安 常 宁宫 结为 连理  人物一  人物二 主婚,1
TRAIN_SENT_ID_248896,,窦滔,苏蕙,但道 原之作 已 佚 ； 一 说起 自 前秦 窦滔 妻 苏蕙 的 《 璇玑 图 》 诗 。,但道 原之作 佚  说起 前秦 人物一 妻 人物二  璇玑 图  诗,1
TRAIN_SENT_ID_256387,,李天一,李双江,在 谷歌 搜索 “ 李双江 、 歌唱家 ” 的 关键字 有近 万条 新闻 ， 而 再次 搜索 “ 李双江 、 李天一 ” 则 出现 60000 多条 新闻 。,谷歌 搜索  人物二  歌唱家  关键字 有近 万条 新闻  再次 搜索  人物二  人物一  出现  多条 新闻,-1
TRAIN_SENT_ID_270405,,关平,关羽,生下 了 一个 男婴 认了 关羽 为 义父 取名 关平 … …,生下 一个 男婴 认了 人物二 义父 取名 人物一,-1
TRAIN_SENT_ID_283884,,王小平,郑晓龙,1992 年 夏天 郑晓龙 与 王小平 在 美国 完婚 。,年 夏天 人物二 人物一 美国 完婚,1
TRAIN_SENT_ID_279282,,傅洁娴,欧阳震华,傅洁娴 求婚 : 欧阳震华 给 了 老婆 足够 尊严 ， 直到现在 ， 老婆 都 视 他 为 偶像 。,人物一 求婚  人物二 老婆 足够 尊严  直到现在  老婆 视 偶像,1
TRAIN_SENT_ID_284980,,胡婷婷,胡志强,婚姻 : 澳门 歌坛 双胞胎 组合 Soler 的 哥哥 Julio 娶 了 台中市 长 胡志强 的 千金 胡婷婷 ！,婚姻  澳门 歌坛 双胞胎 组合  哥哥  娶 台中市 长 人物二 千金 人物一,-1
TRAIN_SENT_ID_281484,,吕牧石,马慧先,马腾蛟 马慧先 : 马慧先 （ 1929 — — ） ， 吕牧石 之妻 。,马腾蛟 人物二  人物二       人物一 之妻,1
TRAIN_SENT_ID_285400,,郑俊浩,李河静,李河静 与 郑俊浩 婚纱照 ( 6 张 ),人物二 人物一 婚纱照   张,1
TRAIN_SENT_ID_258084,,周海婴,鲁迅,爷爷 周海婴 为 她 选择 了 离家 很近 的 鲁迅 中学 。,爷爷 人物一 选择 离家 很近 人物二 中学,-1
TRAIN_SENT_ID_255128,,胡斐,胡一刀,红花 会 三 当家 赵半山 在 商家堡 路遇 胡一刀 遗孤 胡斐 ， 结为 忘年之交 。,红花 会 三 当家 赵半山 商家堡 路遇 人物二 遗孤 人物一  结为 忘年之交,-1
TRAIN_SENT_ID_283698,,陈玉佳,江南春,凤凰卫视 美 女主播 陈玉佳 昨日 在 台 中 老家 大办 婚宴 ， 新郎 就是 大名鼎鼎 的 分众传媒 创办人 江南春 。,凤凰卫视 美 女主播 人物一 昨日 台 中 老家 大办 婚宴  新郎 大名鼎鼎 分众传媒 创办人 人物二,1
TRAIN_SENT_ID_252258,,秦嘉,徐淑,《 秦嘉 妻 徐淑 答诗 一首 》 是 汉代 诗人 秦嘉 的 作品 之一 。,人物一 妻 人物二 答诗 一首  汉代 诗人 人物一 作品,1
TRAIN_SENT_ID_279362,,陈衡哲,任鸿隽,任鸿隽 传播 科学 : 任鸿隽 、 陈衡哲 订婚 日 与 胡适 合影 （ 1920 年 ） ( 2 张 ),人物二 传播 科学  人物二  人物一 订婚 日 胡适 合影   年    张,1
TRAIN_SENT_ID_286314,,朱赞仪,朱守谦,朱赞仪 （ 1382 年 － 1408 年 ） ， 父 靖江 王 朱守谦 ， 祖籍 安徽 凤阳 。,人物一   年   年   父 靖江 王 人物二  祖籍 安徽 凤阳,-1
TRAIN_SENT_ID_272589,,贾蓉,秦可卿,秦可卿 ， 金陵 十二钗 之一 ， 贾蓉 之妻 。,人物二  金陵 十二钗  人物一 之妻,1
TRAIN_SENT_ID_260927,,贾珍,贾蓉,5 . 贾蓉 配 秦可卿 ， 秦可卿 与 公公 贾珍 关系暧昧 。,人物二 配 秦可卿  秦可卿 公公 人物一 关系暧昧,-1
TRAIN_SENT_ID_286257,,徐夫人,徐琨,娶 徐琨 女 （ 徐夫人 ） 。,娶 人物二 女  人物一,-1
TRAIN_SENT_ID_258893,,王熙凤,贾琏,8 、 王熙凤 ， 贾琏 之妻 ， 精明强干 ， 深得 贾母 和 王夫人 的 信任 ， 是 贾府 的 实际 大管家 。,人物一  人物二 之妻  精明强干  深得 贾母 王夫人 信任  贾府 实际 大管家,1
TRAIN_SENT_ID_282670,,蔡琬,高其倬,总之 ， 提到 清初 的 一代 名臣 高其倬 及其 历史 功绩 时 ， 他 的 妻子 蔡琬 是 一位 不能 回避 的 人物 。,提到 清初 一代 名臣 人物二 历史 功绩 时  妻子 人物一 一位 不能 回避 人物,1
TRAIN_SENT_ID_282533,,蔡绿峰,陈娟娟,他 继承 了 父亲 的 船务 事业 ， 并 将 蔡绿峰 和 夫人 陈娟娟 产业 扩大 。,继承 父亲 船务 事业  人物一 夫人 人物二 产业 扩大,1
TRAIN_SENT_ID_272310,,金正恩,金正日,金正恩 成为 接班人 : 2009 年 3 月 8 日 ， 金正恩 成为 朝鲜 最高 人民 会议 候选人 ， 被 认为 是 金正日 对 朝鲜 政治 权力 移交 作 准备 。,人物一 成为 接班人   年  月  日  人物一 成为 朝鲜 最高 人民 会议 候选人  认为 人物二 朝鲜 政治 权力 移交 作 准备,-1
TRAIN_SENT_ID_276167,,苏蕙,窦滔,窦滔 的 妻子 苏蕙 曾 织锦 为 回文 寄给 他 ， 后 因以 指 情书 。,人物二 妻子 人物一 织锦 回文 寄给  因以 指 情书,1
TRAIN_SENT_ID_270255,,谭江柏,谭咏麟,忘不了 您 歌手 信息 : 谭咏麟 ， 1950 年 8 月 23 日 生于 香港 ， 籍贯 广东 新 会 ， 绰号 「 谭 校长 」 ， 为 已故 足球 名宿 谭江柏 之子 。,忘不了 歌手 信息  人物二   年  月  日 生于 香港  籍贯 广东 新 会  绰号  谭 校长   已故 足球 名宿 人物一 之子,-1
TRAIN_SENT_ID_274133,,汤国梨,章太炎,章太炎 的 夫人 汤国梨 曾 回忆 黄侃 骗婚 黄绍兰 一事 ， 致其 一生 流离失所 ， 直斥 黄为 “ 无耻之尤 的 衣冠禽兽 ” ， “ 小 有才 适足 以济 其奸 ” 。,人物二 夫人 人物一 回忆 黄侃 骗婚 黄绍兰 一事  致其 一生 流离失所  直斥 黄为  无耻之尤 衣冠禽兽    有才 适足 以济 其奸,1
TRAIN_SENT_ID_252179,,秦嘉,徐淑,秦嘉 当时 曾 派车去 接 她 ， 还给 她 写 了 一封信 ( 《 与 妻 徐淑 书 》 ) 。,人物一 当时 派车去 接  还给 写 一封信   妻 人物二 书,1
TRAIN_SENT_ID_279587,,马丽娟,赵本山,虽然 赵本山 经常 在 外面 演出 ， 可是 马丽娟 心里有数 ， 自己 的 丈夫 是 个 有 责任心 的 男人 。,人物二 经常 外面 演出  人物一 心里有数  丈夫 责任心 男人,1
TRAIN_SENT_ID_276656,,陆展元,何沅君,后 何沅君 与 陆展元 成婚 时 ， 武三通 曾 与 李莫愁 大闹 婚礼 ， 不料 却 被 高人 阻回 。,人物二 人物一 成婚 时  武三通 李莫愁 大闹 婚礼  高人 阻回,1
TRAIN_SENT_ID_284381,,郝志鹏,郝升山,对 犯罪 嫌疑人 “ 醒 煤 ” 设备 个体经营者 郝升山 、 杜夏娟 及其 儿子 郝志鹏 进行 刑事拘留 。,犯罪 嫌疑人  醒 煤  设备 个体经营者 人物二  杜夏娟 儿子 人物一 进行 刑事拘留,-1
TRAIN_SENT_ID_259000,,王熙凤,贾琏,简介 ： 王熙凤 是 贾琏 之妻 ， 王夫人 的 内侄女 。,简介  人物一 人物二 之妻  王夫人 内侄女,1
TRAIN_SENT_ID_268133,,樊梨花,薛丁山,最后 ， 樊梨花 率军出 寒江关 ， 与 薛丁山 的 唐军 汇合 ， 夫妻 一同 进军 西域 。,最后  人物一 率军出 寒江关  人物二 唐军 汇合  夫妻 一同 进军 西域,1
TRAIN_SENT_ID_273078,,杨铁心,包惜弱,将 死 之际 ， 得 心慈 无比 的 杨铁心 之妻 包惜弱 所救 ， 完颜洪烈 对 包惜弱 一见倾心 ， 不能自已 。,死 之际  心慈 无比 人物一 之妻 人物二 所救  完颜洪烈 人物二 一见倾心  不能自已,1
TRAIN_SENT_ID_274118,,郭晓如,曾馨莹,曾馨莹 与 女儿 妞妞 （ 郭晓如 ） 穿 母女 装,人物二 女儿 妞妞  人物一  穿 母女 装,-1
TRAIN_SENT_ID_258977,,王熙凤,贾琏,王熙凤 - - - - 贾琏 之妻 ， 王夫人 的 内侄女 。,人物一     人物二 之妻  王夫人 内侄女,1
TRAIN_SENT_ID_286699,,秋道蝶蝶,秋道丁次,第四次 忍界 大战 中 忍者 联军 第二 部队 队员 ， 在此期间 曾经 中 了 无限 月 读 ， 大战 结束 后 数年 后 嫁 与 秋道丁次 为妻 ， 生一 女儿 秋道蝶蝶 。,第四次 忍界 大战 中 忍者 联军 第二 部队 队员  在此期间 曾经 中 无限 月 读  大战 结束 数年 嫁 人物二 为妻  生一 女儿 人物一,-1
TRAIN_SENT_ID_251488,,谢贤,谢霆锋,首期 节目 由 谢霆锋 和 父亲 谢贤 搭档 ， 而 接下来 的 11 期 节目 中 ， 谢霆锋 将 邀请 圈内 好友 完成 “ 环球 美食 之旅 ” 。,首期 节目 人物二 父亲 人物一 搭档  接下来  期 节目 中  人物二 邀请 圈内 好友 完成  环球 美食 之旅,-1
TRAIN_SENT_ID_283539,,高炜晟,高天峰,高炜晟 的 姑父 说 ， 高炜晟 是 高天峰 夫妻 超生 的 。,人物一 姑父 说  人物一 人物二 夫妻 超生,-1
TRAIN_SENT_ID_275993,,贾午,贾充,⑶ 韩寿分香 ： 晋 贾充 有 御赐 异香 ， 其女 贾午 与 韩寿 私通 ， 韩寿 身染 奇香 ， 遂 被 发觉 ， 后 与 贾午 成婚 。,⑶ 韩寿分香  晋 人物二 御赐 异香  其女 人物一 韩寿 私通  韩寿 身染 奇香  遂 发觉  人物一 成婚,-1
TRAIN_SENT_ID_256161,,蒋介石,宋美龄,就是 在 这次 晚会 上 ， 蒋介石 第一次 见到 了 年轻漂亮 、 气质 出众 的 宋美龄 ， 决心 不惜一切 代价 娶 她 为 妻 ， 但 遭到 宋庆龄 的 坚决 反对 。,晚会  人物一 第一次 见到 年轻漂亮  气质 出众 人物二  决心 不惜一切 代价 娶 妻  遭到 宋庆龄 坚决 反对,1
TRAIN_SENT_ID_278618,,夏金桂,薛蟠,夏金桂 人物 设定 : 央视版 《 红楼梦 》 夏金桂 吵架 夏金桂 ， 薛蟠 之妻 ， 外号 “ 河东狮 ” 。,人物一 人物 设定  央视版  红楼梦  人物一 吵架 人物一  人物二 之妻  外号  河东狮,1
TRAIN_SENT_ID_277380,,樊姬,楚庄王,"画 楚庄王 夫人 樊姬 为 劝阻 庄王 沉溺于 狩猎 而 不食 鲜禽 的 故事 。 """,画 人物二 夫人 人物一 劝阻 庄王 沉溺于 狩猎 不食 鲜禽 故事,1
TRAIN_SENT_ID_262171,,诸葛尚,诸葛瞻,1967 年 以前 ， 在 黄许 镇南 的 国家 粮库 对面 就立 有 一座 高 1.8 米 、 宽 1.2 米 的 石碑 ， 上 写 ： 诸葛瞻 、 诸葛尚 父子 战死 处 。,年 以前  黄许 镇南 国家 粮库 对面 就立 一座 高  米  宽  米 石碑  写  人物二  人物一 父子 战死 处,-1
TRAIN_SENT_ID_276165,,苏蕙,窦滔,或云起 自 窦滔 妻 苏蕙 ， 于锦 上 织成 文 ， 顺读 与 倒 读皆成 诗句 。,或云起 人物二 妻 人物一  于锦 织成 文  顺读 倒 读皆成 诗句,1
TRAIN_SENT_ID_286376,,谢姬,孙权,谢姬 ， 三国 东 吴大帝 孙权 的 夫人 。,人物一  三国 东 吴大帝 人物二 夫人,1
TRAIN_SENT_ID_258971,,王熙凤,贾琏,3 王熙凤 : 王熙凤 王熙凤 — — 《 红楼梦 》 中 人物 ， 贾琏 之妻 ， 王夫人 的 内侄女 。,人物一  人物一 人物一    红楼梦  中 人物  人物二 之妻  王夫人 内侄女,1
TRAIN_SENT_ID_261985,,王明华,梅兰芳,这 篇文章 说 ， 梅兰芳 除 原配 夫人 王明华 、 继室 福芝芳 和梅 孟恋 主角 孟小冬 以外 ， 还 追求 过 刘喜奎 。,篇文章 说  人物二 原配 夫人 人物一  继室 福芝芳 和梅 孟恋 主角 孟小冬 以外  追求 刘喜奎,1
TRAIN_SENT_ID_276371,,岳灵珊,林平之,岳灵珊 一惊 ， 听得出 是 丈夫 林平之 的 声音 ， 心中 一寒 ： “ 我 和 大 师哥 如此 打法 ， 那 可不 对 。 ”,人物一 一惊  听得出 丈夫 人物二 声音  心中 一寒   师哥 打法  可不,1
TRAIN_SENT_ID_272918,,王岳伦,王诗龄,2013 年 ， 王岳伦 携 女儿 王诗龄 一起 参加 湖南卫视 亲子 真人秀 节目 《 爸爸 去 哪儿 》 。,年  人物一 携 女儿 人物二 一起 参加 湖南卫视 亲子 真人秀 节目  爸爸,-1
TRAIN_SENT_ID_277775,,晋陵公主,谢混,后来 晋孝武帝 欲 以 晋陵公主 尚 谢混 ， 而 袁崧 又 欲 以 女妻 谢混 。,后来 晋孝武帝 欲 人物一 尚 人物二  袁崧 欲 女妻 人物二,1
TRAIN_SENT_ID_254191,,邢夫人,贾赦,我们 知道 ， 贾赦 要纳 鸳鸯 为 妾 ， 按理说 ， 他 的 妻子 邢夫人 是 受到 最 严重 的 损害 的 。,知道  人物二 要纳 鸳鸯 妾  按理说  妻子 人物一 严重 损害,1
TRAIN_SENT_ID_278400,,夏正松,于靓,夏正松 和 于靓 结婚 20 多年 ， 抱养 了 大 女儿 友善 ， 生育 了 小女儿 天美 ， 和睦 的 家庭 。,人物一 人物二 结婚  多年  抱养 女儿 友善  生育 小女儿 天美  和睦 家庭,1
TRAIN_SENT_ID_266952,,关索,关羽,后经 张飞 详细 询问 关索 ， 关羽 与 妻子 胡氏 叙情 ， 才 知 关索 叫 花关索 的 由 来 ， 于是 释疑 相认 ， 一家人 在 荆州 团聚 。,后经 张飞 详细 询问 人物一  人物二 妻子 胡氏 叙情  知 人物一 花人物一  释疑 相认  一家人 荆州 团聚,-1
TRAIN_SENT_ID_272498,,韦丛,元稹,《 遣 悲怀 三首 》 是 唐代 诗人 元稹 怀念 原配 妻子 韦丛 的 作品 。,遣 悲怀 三首  唐代 诗人 人物二 怀念 原配 妻子 人物一 作品,1
TRAIN_SENT_ID_255871,,蒋介石,宋美龄,蒋介石 和 宋美龄 结婚 ， 谭延闿 为 介绍 人 。,人物一 人物二 结婚  谭延闿 介绍,1
TRAIN_SENT_ID_272806,,谢烨,顾城,10 月 8 日 — — 诗人 顾城 杀害 妻子 谢烨 后 自杀,月  日   诗人 人物二 杀害 妻子 人物一 自杀,1
TRAIN_SENT_ID_287320,,李大娘,李三省,李大娘 — — “ 铁掌 飞凤 ” 孙岚 、 李三思 孪生 弟弟 李三省 的 妻子 、 李逍遥 的 婶婶,人物一    铁掌 飞凤  孙岚  李三思 孪生 弟弟 人物二 妻子  李逍遥 婶婶,1
TRAIN_SENT_ID_283779,,李静民,姜昆,姜昆 的 妻子 ， 李静民 ， 是 一名 曲艺 说唱 大师 。,人物二 妻子  人物一  一名 曲艺 说唱 大师,1
TRAIN_SENT_ID_284171,,水均益,杨迪,杨迪 简介 : 杨迪 ， 女 ， 1976 年 出生 ， 著名 主持人 水均益 第二任 妻子 ， 中央电视台 体育频道 台球 记者 。,人物二 简介  人物二  女   年 出生  著名 主持人 人物一 第二任 妻子  中央电视台 体育频道 台球 记者,1
TRAIN_SENT_ID_255112,,鲁元公主,张敖,燕灵 王刘建 鲁元公主 丈夫 : 张敖 ， 初袭 赵王 位 。,燕灵 王刘建 人物一 丈夫  人物二  初袭 赵王 位,1
TRAIN_SENT_ID_248862,,窦滔,苏蕙,“ 锦字 ” 化 用 窦滔 、 苏蕙 夫妻 之典 。,锦字  化 人物一  人物二 夫妻 之典,1
TRAIN_SENT_ID_270168,,霍启刚,朱玲玲,朱玲玲 婚后 全面 脱离 娱乐圈 ， 并育 有 三子 ( 霍启刚 、 霍启山 、 霍启仁 ) 。,人物二 婚后 全面 脱离 娱乐圈  并育 三子  人物一  霍启山  霍启仁,-1
TRAIN_SENT_ID_274742,,龙啸云,林诗音,龙啸云 似乎 并不知道 林诗音 就是 李寻 欢 的 未婚妻 ， 他求 李寻 欢 成全 他 与 林诗音 的 婚姻 。,人物一 似乎 并不知道 人物二 李寻 欢 未婚妻  他求 李寻 欢 成全 人物二 婚姻,1
TRAIN_SENT_ID_262000,,王明华,梅兰芳,梅兰芳 大师 的 原配 夫人 王 王明华 是 王毓楼 的 五妹 。,人物二 大师 原配 夫人 王 人物一 王毓楼 五妹,1
TRAIN_SENT_ID_282488,,黄宏章,黄艺博,黄艺博 的 父亲 黄宏章 告诉 记者 ， 黄艺博 对于 “ 民生 ” 的 关注 已 远远 超过 了 自己 ， 他 的 理想 是 “ 让 大家 过 上 更好 的 生活 ” 。,人物二 父亲 人物一 告诉 记者  人物二  民生  关注 远远 超过  理想  更好 生活,-1
TRAIN_SENT_ID_281550,,李锐,蒋韵,蒋韵 家庭成员 : 丈夫 ： 李锐,人物二 家庭成员  丈夫  人物一,1
TRAIN_SENT_ID_263673,,陈文琦,王雪红,38 . 王雪红 和 第二个 丈夫 陈文琦,人物二 第二个 丈夫 人物一,1
TRAIN_SENT_ID_258303,,陈建斌,蒋勤勤,《 乔家大院 》 让 陈建斌 和 蒋勤勤 走到 了 一起 并 闪电 般的 结婚 、 生子 ， 让 人 猝不及防 。,乔家大院  人物一 人物二 走到 一起 闪电 结婚  生子  猝不及防,1
TRAIN_SENT_ID_282980,,徐潮生,陈世倌,陈世倌 家庭 （ 书剑 恩仇录 ） : 妻子 ， 徐潮生 。,人物二 家庭  书剑 恩仇录   妻子  人物一,1
TRAIN_SENT_ID_285265,,丁肇中,丁观海,归国 后 ， 由 丁维 汾 介绍 ， 与 丁观海 结婚 ， 生子 丁肇中 。,归国  丁维 汾 介绍  人物二 结婚  生子 人物一,-1
TRAIN_SENT_ID_269210,,陆雪琪,张小凡,师 弟媳 ： 陆雪琪 （ 张小凡 之妻 ）,师 弟媳  人物一  人物二 之妻,1
TRAIN_SENT_ID_274543,,薛丁山,薛仁贵,它 的 主要 情节 是 ， 唐初名 将 薛仁贵 投军 后 ， 妻子 柳 迎春 生子 薛丁山 。,主要 情节  唐初名 人物二 投军  妻子 柳 迎春 生子 人物一,-1
TRAIN_SENT_ID_264117,,刘备,孙尚香,结果 ： 刘备 与 孙尚香 结婚,人物一 人物二 结婚,1
TRAIN_SENT_ID_260843,,贾珍,贾蓉,秦可卿 是 宁国府 长孙 贾蓉 的 妻子 、 贾珍 的 儿媳 。,秦可卿 宁国府 长孙 人物二 妻子  人物一 儿媳,-1
TRAIN_SENT_ID_276210,,苏蕙,窦滔,据 《 晋书 · 列女 · 窦滔 妻传 》 ： 普 窦滔 妻 苏蕙 ， 字若兰 ， 善属文 。,晋书  列女  人物二 妻传   普 人物二 妻 人物一  字若兰  善属文,1
TRAIN_SENT_ID_281887,,张静,黄茂如,张静 及其 丈夫 黄茂如 以 财富 185 亿元 排名 第七 。,人物一 丈夫 人物二 财富  亿元 排名 第七,1
TRAIN_SENT_ID_268476,,梁静慈,甄子丹,梁静慈 低调 结婚 : 甄子丹 儿子 甄丹子 的 曝光 让 其 父母 甄子丹 梁静慈 的 一段 情史 成为 网友 关注 的 焦点 。,人物一 低调 结婚  人物二 儿子 甄丹子 曝光 父母 人物二 人物一 一段 情史 成为 网友 关注 焦点,1
TRAIN_SENT_ID_252263,,秦嘉,徐淑,子 ： 您 ， 指 秦嘉 的 妻子 徐淑 。,子   指 人物一 妻子 人物二,1
TRAIN_SENT_ID_260662,,李莎,李立三,第二章 李立三 蒙冤 入狱 李莎 放弃 团证 救 丈夫,第二章 人物二 蒙冤 入狱 人物一 放弃 团证 救 丈夫,1
TRAIN_SENT_ID_270290,,宣姜,卫宣公,宣姜 是 齐国 女子 ， 嫁 卫宣公 为 夫人 ， 子为 卫惠公 。,人物一 齐国 女子  嫁 人物二 夫人  子为 卫惠公,1
TRAIN_SENT_ID_261312,,朱兆祥,胡静,马来西亚 首富 朱兆祥 之妻 大陆 女艺人 胡静 。,马来西亚 首富 人物一 之妻 大陆 女艺人 人物二,1
TRAIN_SENT_ID_260476,,严嵩,严世蕃,42 岁 （ 嘉靖 33 年 ） 升 工部 左侍郎 （ 相当于 建设部 第一副 部长 ） ， 当年 8 月 ， 诏加 严世蕃 工部尚书 衔 ， 严嵩 辞免 。,岁  嘉靖  年  升 工部 左侍郎  相当于 建设部 第一副 部长   当年  月  诏加 人物二 工部尚书 衔  人物一 辞免,-1
TRAIN_SENT_ID_277914,,霍中曦,郭晶晶,此后 ， 郭晶晶 坚持 母乳喂养 ， 霍启刚 与 儿子 霍中曦 合影 为了 给 宝宝 更 多 的 活动 空间 ， 还 专门 搬离 了 霍家 大宅 。,此后  人物二 坚持 母乳喂养  霍启刚 儿子 人物一 合影 宝宝 更 活动 空间  专门 搬离 霍家 大宅,-1
TRAIN_SENT_ID_255934,,蒋介石,宋美龄,蒋介石 、 宋美龄 夫妻 相处,人物一  人物二 夫妻 相处,1
TRAIN_SENT_ID_286384,,吕玲绮,吕布,吕布 、 文丑 、 祝融 夫人 、 吕玲绮 ...,人物二  文丑  祝融 夫人  人物一,-1
