sent_id,entity1,entity2,sent,processed_sent,human
TRAIN_SENT_ID_271521,孟优,孟获,孟获 又 被 生擒活捉 ， 其弟 孟优 及众 首领 也 做 了 蜀 军 俘虏 。,人物二 生擒活捉  其弟 人物一 及众 首领 做 蜀 军 俘虏,1
TRAIN_SENT_ID_284933,凤惊声,凤凰鸣,凤凰鸣 探查 灭境 邪源 ， 带回 被 魔化 的 恶海鲛祖 与 凤惊声 等 人 ， 并 委托 不二 做 寻 绯 羽怨 姬 救治 他们 。,人物二 探查 灭境 邪源  带回 魔化 恶海鲛祖 人物一  委托 不二 做 寻 绯 羽怨 姬 救治,1
TRAIN_SENT_ID_252761,颜回,孔子,曲谱 为 清末 民初 琴家 彭祉卿 得 其父 所传 的 乐曲 ， 原曲 好像 是 孔子 想念 颜回 所 做 ， 经 后人 多次 修改 转变成 对 亲友 的 思念 。,曲谱 清末 民初 琴家 彭祉卿 其父 所传 乐曲  原曲 好像 人物二 想念 人物一 做  后人 多次 修改 转变成 亲友 思念,1
TRAIN_SENT_ID_251847,梅超风,黄药师,武眠风 出处 : （ 出自 《 射雕 英雄传 》 第 14 回 桃花 岛主 ， 黄药师 吩咐 梅超风 做 3 件 事 的 第 2 项 ） 。,武眠风 出处   出自  射雕 英雄传   回 桃花 岛主  人物二 吩咐 人物一 做  件 事  项,1
TRAIN_SENT_ID_274409,李显,李云飞,李云飞 ： 李显 的 大 徒弟 ， 做事 谨慎 ， 凡有 行动 ， 不 进行 周密计划 ， 不 将 所有 隐患 排除 ， 绝不 动手 。,人物二  人物一 徒弟  做事 谨慎  凡有 行动  进行 周密计划  隐患 排除  绝不 动手,1
TRAIN_SENT_ID_255435,罗成,秦琼,秦琼 让 罗成 做 几天 元帅 。,人物二 人物一 做 几天 元帅,1
