sent_id,entity1,entity2,sent,processed_sent,human
TRAIN_SENT_ID_272004,文姜,宣姜,齐僖公 生 了 两个 貌美如花 、 风华绝代 的 女儿 ， 长女 宣姜 ， 次女 文姜 。,齐僖公 生 两个 貌美如花  风华绝代 女儿  长女 人物二  次女 人物一,1
TRAIN_SENT_ID_259768,李偲菘,李伟菘,星光 天王 团 的 主唱 是 王喆 和 小柯 ， 贝司手 是 张亚东 ， 李伟菘 、 李偲菘 和 易家扬 分别 负责 钢琴 、 架子鼓 和 吉他 。,星光 天王 团 主唱 王喆 小柯  贝司手 张亚东  人物二  人物一 易家扬 负责 钢琴  架子鼓 吉他,1
TRAIN_SENT_ID_261630,宋小宝,赵本山,主演 赵本山 、 李立群 、 小 沈阳 、 宋小宝 等 ， 群雄 璀璨 。,主演 人物二  李立群  沈阳  人物一  群雄 璀璨,1
TRAIN_SENT_ID_269363,王中军,王中磊,被 “ 伯乐 ” 王中军 发掘 ， 获 王中磊 提携 签约 华谊 兄弟 。,伯乐  人物一 发掘  获 人物二 提携 签约 华谊 兄弟,1
TRAIN_SENT_ID_284901,陆启铿,华罗庚,在 华罗庚 讲座 上 做 过 演讲 的 有 王元 院士 、 陆启铿 院士 、 吴文俊 院士 、 龚升 教授 、 杨乐 院士 、 万哲先 院士 、 谷超豪 院士 和 周毓麟 院士 。,人物二 讲座 做 演讲 王元 院士  人物一 院士  吴文俊 院士  龚升 教授  杨乐 院士  万哲先 院士  谷超豪 院士 周毓麟 院士,1
TRAIN_SENT_ID_261440,毛泽建,毛泽东,毛泽东 没有 让 毛泽建 失望 ， 带 着 她 来到 长沙 ， 送 她 到 建本 和 崇实 女子 职业 学校 读书 。,人物二 没有 人物一 失望  带 来到 长沙  送 建本 崇实 女子 职业 学校 读书,1
TRAIN_SENT_ID_274105,南宫敬叔,孔子,《 史记 · 孔子 世家 》 云 ： “ 南宫敬叔 与 孔子 俱 适周 ， 问礼 ， 盖见 老子 云 。 ”,史记  人物二 世家  云   人物一 人物二 俱 适周  问礼  盖见 老子 云,1
TRAIN_SENT_ID_267871,张忠仁,张忠义,最后 ， 分割 成功 ， 张忠仁 、 张忠义 成为 全球 第一 对 分割 成功 的 男性 三腿 坐骨 连体 双胞胎 兄弟 。,最后  分割 成功  人物一  人物二 成为 全球 第一 分割 成功 男性 三腿 坐骨 连体 双胞胎 兄弟,1
TRAIN_SENT_ID_264205,陈真,霍元甲,每天 ， 当 霍元甲 在 教师 兄 师姐 们 武功 的 时候 ， 陈真 趴在 房梁 上 偷偷 学习 霍元甲 的 武功 ， 并 私下里 刻苦 练习 。,每天  人物二 教师 兄 师姐 武功  人物一 趴在 房梁 偷偷 学习 人物二 武功  私下里 刻苦 练习,1
TRAIN_SENT_ID_269725,薛洋,薛之荔,周末 到 了 ， 他们 全家 郊游 出去 了 ， 两人 一辆 双人 自行车 ， 薛洋 和 薛之荔 走 在 最后 ， 他姐 问起 文姨 全家 来 后 的 事情 ， 她 要 知道 每个 细节 。,周末  全家 郊游 出去  两人 一辆 双人 自行车  人物一 人物二 走 最后  他姐 问起 文姨 全家 事情  知道 每个 细节,1
TRAIN_SENT_ID_279110,王维筠,金仲仁,金仲仁 收 王维秋 、 王维筠 为徒 。,人物二 收 王维秋  人物一 为徒,1
TRAIN_SENT_ID_259365,葛玄,左慈,曾 有 韩众 、 葛玄 、 左慈 、 王玄甫 、 邓伯元 、 褚伯玉 、 陶宏景 、 白玉蟾 等 二十多位 著名 道人 修炼 霍 童山 。,韩众  人物一  人物二  王玄甫  邓伯元  褚伯玉  陶宏景  白玉蟾 二十多位 著名 道人 修炼 霍 童山,1
TRAIN_SENT_ID_252918,颜回,孔子,这时 ， 跟着 孔子 的 颜回 有点 纳闷 ， 就 问 ： “ 夫子 尚未 见到 子路 就 三次 称赞 其善 ， 不亦逾乎 ？ ”,跟着 人物二 人物一 有点 纳闷  问   夫子 尚未 见到 子路 三次 称赞 其善  不亦逾乎,1
TRAIN_SENT_ID_250413,赵飞燕,赵合德,这 赵飞燕 也 大方 得 很 ， 不像 某些 女人 争风吃醋 ， 可能 是 有福同享 ， 可能 是 加强 阵营 ， 还 把 妹妹 赵合德 也 介绍 进来 供 成帝 享用 。,人物一 大方  不像 女人 争风吃醋  可能 有福同享  可能 加强 阵营  妹妹 人物二 介绍 进来 供 成帝 享用,1
TRAIN_SENT_ID_259381,葛玄,左慈,葛玄 ： 丹阳 （ 今属 江苏省 ） 人 ， 三国 吴 道士 ， 曾 从 左慈 学 道 ， 并入 深山 修道 。,人物一  丹阳  今属 江苏省   三国 吴 道士  人物二 学 道  并入 深山 修道,1
TRAIN_SENT_ID_275973,马光陆,高占全,马光陆 徒弟 高占全 : 人物 简介,人物一 徒弟 人物二  人物 简介,1
TRAIN_SENT_ID_272397,任容萱,任家萱,家庭成员 ： 妻子 ； 女儿 任家萱 （ Selina ） 、 任容萱 （ Kimi ）,家庭成员  妻子  女儿 人物二     人物一,1
TRAIN_SENT_ID_266871,尤二姐,尤氏,当 她 把 尤二姐 骗入 了 大观园 之后 ， 便 去 骂 尤氏 道 ： “ … …,人物一 骗入 大观园 之后  便 骂 人物二 道,1
TRAIN_SENT_ID_257462,姜昆,马季,唐杰忠 ， 汉族 ， 相声 名家 ， 长期 与 马季 、 姜昆 等 相声 名家 合作 ， 代表作品 有 《 虎口 遐想 》 、 《 新兵 小传 》 、 《 找 舅舅 》 等 。,唐杰忠  汉族  相声 名家  长期 人物二  人物一 相声 名家 合作  代表作品  虎口 遐想    新兵 小传    找 舅舅,1
TRAIN_SENT_ID_266867,尤二姐,尤氏,当 她 把 尤二姐 骗人 了 大观园 之后 ， 便 去 骂 尤氏 道 ： “ … …,人物一 骗人 大观园 之后  便 骂 人物二 道,1
TRAIN_SENT_ID_272012,文姜,宣姜,文姜 是 宣姜 的 妹妹 ， “ 文 ” 字 是 后世 史家 因 她 文采 命 的 名 。,人物一 人物二 妹妹   文  字 后世 史家 文采 命 名,1
TRAIN_SENT_ID_256897,仲由,孔子,最古 的 主张 者 也许 是 孔子 的 得意 门徒 仲由 ， 即 子路 。,最古 主张 也许 人物二 得意 门徒 人物一  子路,1
TRAIN_SENT_ID_271502,孟优,孟获,据 《 新纂 云南 通志 · 释道 》 载 ， 三国 时 的 孟优 ， 乃 孟获 之兄 ， 清静 好道 ， 得 异人 传授 药方 。,新纂 云南 通志  释道  载  三国 时 人物一  人物二 之兄  清静 好道  异人 传授 药方,1
TRAIN_SENT_ID_261432,毛泽建,毛泽东,毛泽建 之死 ， 毛泽东 十分 痛惜 。,人物一 之死  人物二 十分 痛惜,1
TRAIN_SENT_ID_272647,卫少儿,卫青,主角 ： 霍去病 ┃ 配角 ： 绿阶 、 卫青 、 刘彻 、 卫少儿 、 卫子夫 … …,主角  霍去病 ┃ 配角  绿阶  人物二  刘彻  人物一  卫子夫,1
TRAIN_SENT_ID_275152,孙立荣,赵本山,一等奖 ： 小品 《 捐助 》 （ 赵本山 、 王小利 、 孙立荣 、 小 沈阳 、 于洋 ）,一等奖  小品  捐助   人物二  王小利  人物一  沈阳  于洋,1
TRAIN_SENT_ID_249120,皮皮鲁,鲁西西,皮皮鲁 、 鲁西西 、 罗克 、 舒克和贝塔 是 他 笔下 的 人物 。,人物一  人物二  罗克  舒克和贝塔 笔下 人物,1
TRAIN_SENT_ID_276154,贾惜春,贾珍,贾惜春 ， 金陵 十二钗 之八 ， 贾珍 的 妹妹 ， 自小 喜爱 画画 。,人物一  金陵 十二钗 之八  人物二 妹妹  自小 喜爱 画画,1
TRAIN_SENT_ID_259367,葛玄,左慈,葛洪 生 在 道教 世家 ， 叔祖 葛玄 随从 有名 的 术士 左慈 学 道 ， 被 后世 道徒 尊为 葛仙公 。,葛洪 生 道教 世家  叔祖 人物一 随从 有名 术士 人物二 学 道  后世 道徒 尊为 葛仙公,1
TRAIN_SENT_ID_259410,凌音,凌波,凌音 角色 关系 : 亲人 ： 父母 未知 ， 有 一 亲生 姐姐 凌波 。,人物一 角色 关系  亲人  父母 未知  亲生 姐姐 人物二,1
TRAIN_SENT_ID_271262,马季,侯宝林,扒 马褂 表演 版本 : 高德明 、 绪 得 贵 、 侯宝林 、 郭启儒 、 刘宝瑞 、 王长友 、 王世臣 、 马季 、 赵振铎 、 赵世忠 、 李金斗 等 都 擅长 演此 曲目 。,扒 马褂 表演 版本  高德明  绪 贵  人物二  郭启儒  刘宝瑞  王长友  王世臣  人物一  赵振铎  赵世忠  李金斗 擅长 演此 曲目,1
TRAIN_SENT_ID_252702,颜回,孔子,李翱 认为 道统 自先 王传圣 人 ( 孔子 ) ， 再 经 颜回 、 子路 、 曾皙 三人 传子思 ， 子思传 孟子 ， 孟子 传 公孙丑 、 万章 等 。,李翱 认为 道统 自先 王传圣  人物二   人物一  子路  曾皙 三人 传子思  子思传 孟子  孟子 传 公孙丑  万章,1
TRAIN_SENT_ID_255201,赵海燕,赵本山,《 意外 收获 》 是 由 赵本山 的 爱徒 王小利 和 唐鉴军 、 赵海燕 及 田娃 等 表演 的 小品 。,意外 收获  人物二 爱徒 王小利 唐鉴军  人物一 田娃 表演 小品,1
TRAIN_SENT_ID_286548,韩兰成,马季,马季 - - 姜昆 、 赵炎 、 刘伟 、 冯巩 、 笑林 、 王谦祥 、 李增瑞 、 韩兰成 、 刘喜尧 、 彭子,人物二   姜昆  赵炎  刘伟  冯巩  笑林  王谦祥  李增瑞  人物一  刘喜尧  彭子,1
TRAIN_SENT_ID_249189,皮皮鲁,鲁西西,瞬时 ， 奥克 玛 冲过来 大声 喊 ， 皮皮鲁 ， 你 妹妹 鲁西西 被 外星人 绑架 啦 ~ ~ ~ ~ ~ ~ ~ ~ ~ ~ ~ ~ ~,瞬时  奥克 玛 冲过来 大声 喊  人物一  妹妹 人物二 外星人 绑架,1
