sent_id,entity1,entity2,sent,processed_sent,human
TRAIN_SENT_ID_250350,赵飞燕,赵合德,赵飞燕 / 赵合德 ： 汉代 最 美艳 动人 的 姐妹花,人物一  人物二  汉代 美艳 动人 姐妹花,1
TRAIN_SENT_ID_252614,颜回,孔子,颜回 死后 ， 他 打过 孔子 的 车 的 主意 ， 想 讨来 给 儿子 做 棺椁 。,人物一 死后  打过 人物二 车 主意  想 讨来 儿子 做 棺椁,1
TRAIN_SENT_ID_262227,尤二姐,尤三姐,出身 寒微 ， 全书 人物 无一 与 她 有 血缘关系 ， 尤老娘 是 她 后母 ， 尤二姐 、 尤三姐 与 她 虽称 姐妹 ， 却是 异父 异母 ， 连 贾蓉 也 非 她 亲生 。,出身 寒微  全书 人物 无一 血缘关系  尤老娘 后母  人物一  人物二 虽称 姐妹  却是 异父 异母  贾蓉 非 亲生,1
TRAIN_SENT_ID_259388,温策,温慧,温策 ： 犯妇 温慧 ， 曾 在 胜州 自称为 蜀山 派 做事 ， 适才 在 山下 被 我 捉拿 ， 旋即 逃脱 ， 我 料定 她 逃 上 蜀山 藏匿 。,人物一  犯妇 人物二  胜州 自称为 蜀山 派 做事  适才 山下 捉拿  旋即 逃脱  料定 逃 蜀山 藏匿,1
TRAIN_SENT_ID_250416,赵飞燕,赵合德,他 与 蛇蝎美人 赵飞燕 、 赵合德 姐妹 的 故事 ， 几乎 家喻户晓 。,蛇蝎美人 人物一  人物二 姐妹 故事  几乎 家喻户晓,1
TRAIN_SENT_ID_274677,马冬晗,马冬昕,马冬晗 马冬昕 走进 清华园 ， 成为 清华大学 有史以来 第一 对 保送 进 清华大学 的 孪生姐妹 。,人物一 人物二 走进 清华园  成为 清华大学 有史以来 第一 保送 进 清华大学 孪生姐妹,1
TRAIN_SENT_ID_252459,颜回,孔子,一会儿 ， 饭熟 了 ， 颜回 请 孔子 吃饭 。,一会儿  饭熟  人物一 请 人物二 吃饭,1
TRAIN_SENT_ID_277433,魏国夫人,柳奭,唐高宗 大怒 ， 有意 废后 ， 并 严禁 魏国夫人 入宫 ， 将 柳奭 贬为 遂 州 刺史 。,唐高宗 大怒  有意 废后  严禁 人物一 入宫  人物二 贬为 遂 州 刺史,1
TRAIN_SENT_ID_250355,赵飞燕,赵合德,在 这样 的 理论指导 下 ， 他 长期 与 外戚 集团 王氏 对立 ， 也 曾 进言 阻止 赵飞燕 、 赵合德 姐妹 晋封 。,理论指导  长期 外戚 集团 王氏 对立  进言 阻止 人物一  人物二 姐妹 晋封,1
