sent_id,entity1,entity2,sent,processed_sent,human
TRAIN_SENT_ID_274448,方如沁,方兰生,百里屠苏 、 方兰生 、 欧阳少恭 、 陵越 、 红玉 、 方如沁 、 孙月言 ： 晴雪,百里屠苏  人物二  欧阳少恭  陵越  红玉  人物一  孙月言  晴雪,-1
TRAIN_SENT_ID_266871,尤二姐,尤氏,当 她 把 尤二姐 骗入 了 大观园 之后 ， 便 去 骂 尤氏 道 ： “ … …,人物一 骗入 大观园 之后  便 骂 人物二 道,-1
TRAIN_SENT_ID_251832,梅超风,黄药师,黄药师 为了 找寻 女儿 打破 誓言 离开 桃花岛 ， 在 太湖 归云庄 发现 了 黄蓉 、 郭靖 及 为 救 杨康 而来 的 梅超风 。,人物二 找寻 女儿 打破 誓言 离开 桃花岛  太湖 归云庄 发现 黄蓉  郭靖 救 杨康 而来 人物一,-1
TRAIN_SENT_ID_265462,薛谭,秦青,原文 : 薛谭 学 讴 ① 于 秦青 ， 未穷 ② 青之技 ， 自谓 ③ 尽 之 ④ ， 遂 辞 归 。,原文  人物一 学 讴 ① 人物二  未穷 ② 青之技  自谓 ③ ④  遂 辞,-1
TRAIN_SENT_ID_265400,薛谭,秦青,本 《 列子 · 汤问 》 薛谭 学 讴 於 秦青 事 。,列子  汤问  人物一 学 讴 於 人物二 事,-1
TRAIN_SENT_ID_282996,邱胜扬,姜昆,演员 有 姜昆 、 戴志诚 、 赵炎 、 周炜 、 王谦祥 、 李增瑞 、 徐惠民 、 邱胜扬 等 。,演员 人物二  戴志诚  赵炎  周炜  王谦祥  李增瑞  徐惠民  人物一,-1
TRAIN_SENT_ID_268938,韩非,荀子,韩非 这样 来 解释 《 老子 》 ， 也 无不 对 ， 这个 问题 孔子 、 子思 、 庄子 、 孟子 、 荀子 都 谈到 过 ， 这个 世界 上 为什么 每天 都 要 发生 那么 多 罪恶 ？,人物一 解释  老子   无不  问题 孔子  子思  庄子  孟子  人物二 谈到  世界 每天 发生 罪恶,-1
TRAIN_SENT_ID_271742,朱聪,郭靖,朱聪 向 郭靖 道 ： “ 快 取水 来 ， 拿 两碗 。 ”,人物一 人物二 道   快 取水  两碗,-1
TRAIN_SENT_ID_261430,毛泽建,毛泽东,由于 毛泽东 的 父母 没有 女儿 ， 从此 便 收养 了 毛泽建 。,人物二 父母 没有 女儿  便 收养 人物一,-1
TRAIN_SENT_ID_276936,樊迟,孔子,学生 樊迟 问 什么 是 智 ， 孔子 答 “ 知 人 ” （ 《 论语 · 颜渊 》 ） 。,学生 人物一 问 智  人物二 答  知    论语  颜渊,-1
TRAIN_SENT_ID_258807,张无忌,殷离,心上人 ： 张无忌 殷离 容貌 描写 : 1 、 纪晓芙 续道 ： “ … …,心上人  人物一 人物二 容貌 描写    纪晓芙 续道,-1
TRAIN_SENT_ID_268928,韩非,荀子,韩非 与 李斯 为 同学 ， 同 师事 于 荀子 。,人物一 李斯 同学  师事 人物二,-1
TRAIN_SENT_ID_266867,尤二姐,尤氏,当 她 把 尤二姐 骗人 了 大观园 之后 ， 便 去 骂 尤氏 道 ： “ … …,人物一 骗人 大观园 之后  便 骂 人物二 道,-1
TRAIN_SENT_ID_256979,仲由,孔子,《 孔子 家语 · 致思 》 ： “ 由 （ 仲由 ） 也 事亲 ， 可谓 生事 尽力 ， 死事 尽思者 也 。 ”,人物二 家语  致思     人物一  事亲  可谓 生事 尽力  死事 尽思者,-1
TRAIN_SENT_ID_257462,姜昆,马季,唐杰忠 ， 汉族 ， 相声 名家 ， 长期 与 马季 、 姜昆 等 相声 名家 合作 ， 代表作品 有 《 虎口 遐想 》 、 《 新兵 小传 》 、 《 找 舅舅 》 等 。,唐杰忠  汉族  相声 名家  长期 人物二  人物一 相声 名家 合作  代表作品  虎口 遐想    新兵 小传    找 舅舅,-1
TRAIN_SENT_ID_277571,袁承志,穆人清,袁承志 将 神行 百变 与 穆人清 所授 的 十段 锦 混合 使用 ， 并 兼 两家 所长 木桑道长 暗器 功夫 : 随手 掷 出 ， 十几颗 棋子 向天飞 去 。,人物一 神行 百变 人物二 所授 十段 锦 混合 使用  兼 两家 所长 木桑道长 暗器 功夫  随手 掷 出  十几颗 棋子 向天飞,-1
TRAIN_SENT_ID_258815,张无忌,殷离,1349 张无忌 遇 胡青牛 并学 医术 ， 初遇 周芷若 、 殷离 、 金花婆婆 。,人物一 遇 胡青牛 并学 医术  初遇 周芷若  人物二  金花婆婆,-1
TRAIN_SENT_ID_284900,陆启铿,华罗庚,此外 ， 万哲元 、 陆启铿 、 王元 、 潘承洞 、 段学复 等 人 也 是 在 华罗庚 的 悉心 培育 下 成长 起来 的 。,万哲元  人物一  王元  潘承洞  段学复 人物二 悉心 培育 成长 起来,-1
TRAIN_SENT_ID_262211,尤二姐,尤三姐,实际上 ， 小说 已经 写明 ， 像 尤二姐 、 尤三姐 等 确实 是 受到 了 贾府 贾珍 、 贾琏 、 贾蓉 等 花花公子 的 攻击 。,实际上  小说 已经 写明  人物一  人物二 确实 贾府 贾珍  贾琏  贾蓉 花花公子 攻击,-1
TRAIN_SENT_ID_249125,皮皮鲁,鲁西西,皮皮鲁 和 鲁西西 碰巧 发现 了 他们 教室 里 的 隐身人 ， 想 知道 隐身人 的 秘密 吗 ？,人物一 人物二 碰巧 发现 教室 里 隐身人  想 知道 隐身人 秘密,-1
TRAIN_SENT_ID_252743,颜回,孔子,颜渊 （ 或称 颜回 ） 问 仲尼 （ 孔子 ） 道 ： “ 我 有 一次 渡 名叫 觞 深 的 深潭 ， 船夫 操纵 船象 神 一样 。,颜渊  或称 人物一  问 仲尼  人物二  道   一次 渡 名叫 觞 深 深潭  船夫 操纵 船象 神,-1
TRAIN_SENT_ID_275552,王小虎,赵本山,25 、 小品 《 功夫 》 演员 ： 赵本山 、 范伟 、 蔡维利 、 王小虎 小品 《 浪漫 的 事 》,小品  功夫  演员  人物二  范伟  蔡维利  人物一 小品  浪漫 事,-1
TRAIN_SENT_ID_259367,葛玄,左慈,葛洪 生 在 道教 世家 ， 叔祖 葛玄 随从 有名 的 术士 左慈 学 道 ， 被 后世 道徒 尊为 葛仙公 。,葛洪 生 道教 世家  叔祖 人物一 随从 有名 术士 人物二 学 道  后世 道徒 尊为 葛仙公,-1
TRAIN_SENT_ID_252519,颜回,孔子,孔子 对 曰 ： “ 有 颜回 者 好学 ， 不幸 短命 死 矣 ， 今 也 则 亡 。 ”,人物二 曰   人物一 好学  不幸 短命 死  亡,-1
TRAIN_SENT_ID_265476,薛谭,秦青,薛谭 学 讴于 秦青 ， 未穷 青之技 ， 自谓 尽 之 ； 遂 辞 归 。,人物一 学 讴于 人物二  未穷 青之技  自谓  遂 辞,-1
TRAIN_SENT_ID_259379,葛玄,左慈,葛玄 ： 丹阳 郡 （ 今属 江苏省 句容 ） 人 ， 三国 吴 道士 ， 曾 从 左慈 学 道 ， 并入 深山 修道 。,人物一  丹阳 郡  今属 江苏省 句容   三国 吴 道士  人物二 学 道  并入 深山 修道,-1
TRAIN_SENT_ID_283394,师戈,郑小山,郑小山 - - 罗健 、 王筱磊 、 徐力 、 刘宝安 、 郑宏伟 、 师戈 、 苗阜 、 曹磊 、 任海峰 、 刘凯,人物二   罗健  王筱磊  徐力  刘宝安  郑宏伟  人物一  苗阜  曹磊  任海峰  刘凯,-1
TRAIN_SENT_ID_252568,颜回,孔子,归鲁 之后 ， 颜回 除 讲学 外 ， 便是 帮助 孔子 整理 古代 典籍 。,归鲁 之后  人物一 讲学 外  便是 帮助 人物二 整理 古代 典籍,-1
TRAIN_SENT_ID_271262,马季,侯宝林,扒 马褂 表演 版本 : 高德明 、 绪 得 贵 、 侯宝林 、 郭启儒 、 刘宝瑞 、 王长友 、 王世臣 、 马季 、 赵振铎 、 赵世忠 、 李金斗 等 都 擅长 演此 曲目 。,扒 马褂 表演 版本  高德明  绪 贵  人物二  郭启儒  刘宝瑞  王长友  王世臣  人物一  赵振铎  赵世忠  李金斗 擅长 演此 曲目,-1
TRAIN_SENT_ID_265478,薛谭,秦青,⑶ 云不去 ： 典出 《 列子 · 汤问 》 ： “ 薛谭 学 讴于 秦青 ， 未穷 青之技 ， 自谓 尽 之 ， 遂 辞 归 。,⑶ 云不去  典出  列子  汤问    人物一 学 讴于 人物二  未穷 青之技  自谓  遂 辞,-1
TRAIN_SENT_ID_265405,薛谭,秦青,原文 : 薛谭 学 讴于 秦青 ， 未穷 青之技 ， 自谓 尽 之 ， 遂 辞 归 。,原文  人物一 学 讴于 人物二  未穷 青之技  自谓  遂 辞,-1
TRAIN_SENT_ID_265418,薛谭,秦青,列子 · 汤问 第十一部分 : 列子 · 汤问 原文 : 薛谭 学 讴于 秦青 ① ， 未穷 青之技 ， 自谓 尽 之 ， 遂 辞 归 。,列子  汤问 第十一部分  列子  汤问 原文  人物一 学 讴于 人物二 ①  未穷 青之技  自谓  遂 辞,-1
TRAIN_SENT_ID_270567,全真七子,王重阳,东游 至 山东 ， 王重阳 收 马丹阳 、 孙不二 ， 王玉 阳 、 丘 长春 ， 谭长真 ， 刘长生 、 郝 太古 等 人为 徒 ， 后称 “ 全真七子 ” 。,东游 山东  人物二 收 马丹阳  孙不二  王玉 阳  丘 长春  谭长真  刘长生  郝 太古 人为 徒  后称  人物一,-1
TRAIN_SENT_ID_251845,梅超风,黄药师,双方 酣斗 之际 ， 欧阳锋 以 毕生 功力 向 黄药师 施以 偷袭 ， 梅超风 舍命 为 恩师 挡 了 欧阳锋 一击 而 死 。,双方 酣斗 之际  欧阳锋 毕生 功力 人物二 施以 偷袭  人物一 舍命 恩师 挡 欧阳锋 一击 死,-1
TRAIN_SENT_ID_252738,颜回,孔子,天资聪颖 的 颜回 ， 一生 清贫 ， 但 求学 之心 甚坚 ， 很受 孔子 喜爱 。,天资聪颖 人物一  一生 清贫  求学 之心 甚坚  很受 人物二 喜爱,-1
TRAIN_SENT_ID_282927,钱永真,钱永刚,儿子 钱永刚 、 女儿 钱永真 。,儿子 人物二  女儿 人物一,-1
TRAIN_SENT_ID_265396,薛谭,秦青,《 列子 · 汤问 》 ： “ 薛谭 学 讴 於 秦青 ， 未穷 青之技 ， 自谓 尽 之 ， 遂 辞 归 。,列子  汤问    人物一 学 讴 於 人物二  未穷 青之技  自谓  遂 辞,-1
TRAIN_SENT_ID_255201,赵海燕,赵本山,《 意外 收获 》 是 由 赵本山 的 爱徒 王小利 和 唐鉴军 、 赵海燕 及 田娃 等 表演 的 小品 。,意外 收获  人物二 爱徒 王小利 唐鉴军  人物一 田娃 表演 小品,-1
TRAIN_SENT_ID_252694,颜回,孔子,’ ” 原 是 颜回 赞扬 孔子 的话 ， 后以 “ 坚高 ” 指 艰深 之道 。,原 人物一 赞扬 人物二  后以  坚高  指 艰深 之道,-1
TRAIN_SENT_ID_251605,穆春,穆弘,因在 路上 打赏 了 使 棍棒 的 病 大虫 薛永 ， 宋江 得罪 了 当地 恶霸 没 遮拦 穆弘 、 小 遮拦 穆春 ， 二人 追 宋江 等 人 。,因在 路上 打赏 棍棒 病 大虫 薛永  宋江 得罪 恶霸 没 遮拦 人物二  遮拦 人物一  二人 追 宋江,-1
TRAIN_SENT_ID_265459,薛谭,秦青,《 列子 · 汤问 》 ： “ 薛谭 学 讴于 秦青 … …,列子  汤问    人物一 学 讴于 人物二,-1
TRAIN_SENT_ID_252514,颜回,孔子,颜回 闻一以 知十 ， 我 只能 闻一知二 ” ， 于是 孔子 感叹 道 ： “ 弗如 也 ， 吾 与 汝弗如 也 ！ ”,人物一 闻一以 知十  只能 闻一知二   人物二 感叹 道   弗如  吾 汝弗如,-1
TRAIN_SENT_ID_253024,颜回,孔子,3 历史 评价 : 鱼豢 曰 ： 昔 孔子 叹 颜回 ， 以为 三月 不违 仁者 ， 盖观 其 心耳 ， 孰如孙 、 祝 菜色 於 市里 ， 颠倒 於 牢狱 ， 据 有 实事 哉 ？,历史 评价  鱼豢 曰  昔 人物二 叹 人物一  三月 不违 仁者  盖观 心耳  孰如孙  祝 菜色 於 市里  颠倒 於 牢狱  实事,-1
TRAIN_SENT_ID_265463,薛谭,秦青,“ 高云 不 动 ” 出自 《 列子 · 汤问 》 ： “ 薛谭 学 讴于 秦青 ， 未穷 青之技 ， 自谓 尽 之 ， 遂 辞 归 。,高云 动  出自  列子  汤问    人物一 学 讴于 人物二  未穷 青之技  自谓  遂 辞,-1
TRAIN_SENT_ID_265471,薛谭,秦青,列子 · 汤 问篇 第十一部分 : 列子 · 汤 问篇 原文 : 薛谭 学 讴于 秦青 ① ， 未穷 青之技 ， 自谓 尽 之 ， 遂 辞 归 。,列子  汤 问篇 第十一部分  列子  汤 问篇 原文  人物一 学 讴于 人物二 ①  未穷 青之技  自谓  遂 辞,-1
TRAIN_SENT_ID_274089,南宫敬叔,孔子,孟懿子 和 南宫敬叔 学礼于 孔子 。,孟懿子 人物一 学礼于 人物二,-1
TRAIN_SENT_ID_274185,田虎,田猛,烈山 堂堂 主 田猛 的 女儿 田言 也 是 因此 而 推断 她 定会 与 田虎 联手 。,烈山 堂堂 主 人物二 女儿 田言 推断 定会 人物一 联手,-1
TRAIN_SENT_ID_252989,颜回,孔子,颜回 谓 孔子 独立 人格 、 直行 道业云 ： “ 夫子 之道 至 大 ， 故 天下 莫 能容 。,人物一 谓 人物二 独立 人格  直行 道业云   夫子 之道  天下 莫 能容,-1
TRAIN_SENT_ID_255224,赵海燕,赵本山,20 . 小品 《 相亲 2 》 演员 ： 赵本山 、 宋小宝 、 赵海燕 、 李琳 相亲 2,小品  相亲   演员  人物二  宋小宝  人物一  李琳 相亲,-1
TRAIN_SENT_ID_265397,薛谭,秦青,《 列子 · 汤问 》 ： “ 薛谭 学 讴于 秦青 ， 未穷 青之技 ， 自谓 尽 之 ； 遂 辞 归 。,列子  汤问    人物一 学 讴于 人物二  未穷 青之技  自谓  遂 辞,-1
TRAIN_SENT_ID_269423,刘伟,马季,30 . 相声 ： 《 老少 乐 》 表演者 ： 马季 刘伟,相声   老少 乐  表演者  人物二 人物一,-1
TRAIN_SENT_ID_262219,尤二姐,尤三姐,统治者 二十几 人 （ 有人 算了 说 是 三十几 人 ） ， 其他 都 是 奴隶 ， 三百多个 ， 鸳鸯 、 司棋 、 尤二姐 、 尤三姐 等等 。,统治者 二十几  有人 算了 说 三十几   奴隶  三百多个  鸳鸯  司棋  人物一  人物二,-1
TRAIN_SENT_ID_251931,张豪龙,张柏芝,据说 张豪龙 的 正职 是 打理 服装店 ， 拍戏 多少 是 导演 想 借借 他 和 张柏芝 的 名声 来 多拉 几个 影迷 。,据说 人物一 正职 打理 服装店  拍戏 导演 想 借借 人物二 名声 多拉 几个 影迷,-1
TRAIN_SENT_ID_252376,颜回,孔子,《 说苑 · 敬慎 》 载 ： “ 颜回 将 西游 ， 问 孔子 曰 ： ‘ 何以 为身 ？,说苑  敬慎  载   人物一 西游  问 人物二 曰   为身,-1
TRAIN_SENT_ID_274113,欧阳娣娣,欧阳娜娜,爸爸 回家 做 功课 作者简介 : 欧阳龙 ， 深情 顾家 的 天蝎座 ， 欧阳妮妮 ( 11 岁 ) 、 欧阳娜娜 ( 9 岁 ) 、 欧阳娣娣 ( 3 岁 ) 的 爸爸 。,爸爸 回家 做 功课 作者简介  欧阳龙  深情 顾家 天蝎座  欧阳妮妮   岁   人物二   岁   人物一   岁  爸爸,-1
TRAIN_SENT_ID_253828,赵合德,赵飞燕,传说 赵合德 生 得 体态 丰腴 ， 较 赵飞燕 更得 皇帝 宠爱 ， 留下 温柔乡 和 祸水 的 典故 。,传说 人物一 生 体态 丰腴  人物二 更得 皇帝 宠爱  留下 温柔乡 祸水 典故,-1
TRAIN_SENT_ID_257498,姜昆,马季,相声 ： 赵炎 、 马季 、 李文华 、 姜昆 、 侯耀文 、 石富宽 、 侯宝林 （ 已故 · 录像 ） 、 郭全宝 （ 已故 · 录像 ） 等 。,相声  赵炎  人物二  李文华  人物一  侯耀文  石富宽  侯宝林  已故  录像   郭全宝  已故  录像,-1
TRAIN_SENT_ID_252713,颜回,孔子,◎ 颜回 将 西游 ， 问于 孔子 曰 ： 「 何以 为身 ？,◎ 人物一 西游  问于 人物二 曰   为身,-1
TRAIN_SENT_ID_266040,贾珍,贾惜春,贾惜春 ， 贾敬 的 女儿 ， 贾珍 的 胞妹 。,人物二  贾敬 女儿  人物一 胞妹,-1
TRAIN_SENT_ID_281965,梁经纶,何其沧,方步 亭 在 何其沧 家 见到 梁经纶 ， 告诉 他 谢木兰 已死 的 消息 ， 而 谢培东 和 方孟敖 都 是 共产党 。,方步 亭 人物二 家 见到 人物一  告诉 谢木兰 已死 消息  谢培东 方孟敖 共产党,-1
TRAIN_SENT_ID_256901,仲由,孔子,仲 村镇 简介 : 仲村 是 一代 圣贤 孔子 的 得意门生 仲由 的 故里 ， 是 历史 上 的 四大 文明 古镇 之一 。,仲 村镇 简介  仲村 一代 圣贤 人物二 得意门生 人物一 故里  历史 四大 文明 古镇,-1
TRAIN_SENT_ID_275933,李华,寿昌公主,刘皇后 ， 结发 之妻 ， 正室 ； 生 嫡长子 李宪 （ 后 追 谥 让 皇帝 ） 、 寿昌公主 、 代国 公主 李华 婉 ， 被 武则天 勒令 处死 ， 追 谥 为 肃明 顺圣 皇后,刘皇后  结发 之妻  正室  生 嫡长子 李宪  追 谥 皇帝   人物二  代国 公主 人物一 婉  武则天 勒令 处死  追 谥 肃明 顺圣 皇后,-1
TRAIN_SENT_ID_279413,王学明,龙俊杰,指导 教师 ： 王学明 副教授 、 李学通 教授 、 龙俊杰 教授 、 周艳霞 副教授 等 。,指导 教师  人物一 副教授  李学通 教授  人物二 教授  周艳霞 副教授,-1
TRAIN_SENT_ID_276934,樊迟,孔子,樊迟 问知 ， 孔子 曰 ： “ 务民之义 ， 敬鬼神而远之 ， 可谓 知矣 。 ”,人物一 问知  人物二 曰   务民之义  敬鬼神而远之  可谓 知矣,-1
TRAIN_SENT_ID_269398,刘伟,马季,33 . 相声 ： 《 五官 争功 》 表演者 ： 马季 赵炎 王金宝 冯巩 刘伟,相声   五官 争功  表演者  人物二 赵炎 王金宝 冯巩 人物一,-1
TRAIN_SENT_ID_266210,范遥,赵敏,成员 ： 张无忌 ， 赵敏 ， 周芷若 ， 鹿杖客 ， 鹤笔翁 ， 金毛狮 王 ， 青翼 蝠王 ， 白眉鹰 王 ， 紫杉 龙王 ， 杨逍 ， 范遥,成员  张无忌  人物二  周芷若  鹿杖客  鹤笔翁  金毛狮 王  青翼 蝠王  白眉鹰 王  紫杉 龙王  杨逍  人物一,-1
TRAIN_SENT_ID_274112,欧阳娣娣,欧阳娜娜,欧阳娜娜 （ 二女儿 ） 、 欧阳娣娣 （ 三 女儿 ）,人物二  二女儿   人物一  三 女儿,-1
TRAIN_SENT_ID_253088,颜回,孔子,孔子 对 曰 ： “ 有 颜回 者 好学 ， 不 迁怒 ( 1 ) ， 不 贰 过 ( 2 ) ， 不幸 短命 死 矣 ( 3 ) 。,人物二 曰   人物一 好学  迁怒     贰     不幸 短命 死,-1
TRAIN_SENT_ID_255281,卫夫人,王羲之,卫夫人 教 王羲之 书法 ， 还教 他 知道 天外有天 ， 人外有人 ， 不可 骄傲 懒散 。,人物一 教 人物二 书法  还教 知道 天外有天  人外有人  不可 骄傲 懒散,-1
TRAIN_SENT_ID_262246,尤二姐,尤三姐,统治者 二十几 人 ( 有人 算了 说 是 三十三 人 ) ， 其他 都 是 奴隶 ， 三百多个 ， 鸳鸯 、 司棋 、 尤二姐 、 尤三姐 等等 。,统治者 二十几  有人 算了 说 三十三   奴隶  三百多个  鸳鸯  司棋  人物一  人物二,-1
TRAIN_SENT_ID_268969,韩非,荀子,韩非 之学 出于 荀子 ， 源本 于 儒家 ， 而 成为 法家 ， 又 归本于 道家 。,人物一 之学 人物二  源本 儒家  成为 法家  归本于 道家,-1
TRAIN_SENT_ID_275683,欧阳娣娣,欧阳妮妮,爸爸 回家 做 功课 作者简介 : 欧阳龙 ， 深情 顾家 的 天蝎座 ， 欧阳妮妮 ( 11 岁 ) 、 欧阳娜娜 ( 9 岁 ) 、 欧阳娣娣 ( 3 岁 ) 的 爸爸 。,爸爸 回家 做 功课 作者简介  欧阳龙  深情 顾家 天蝎座  人物二   岁   欧阳娜娜   岁   人物一   岁  爸爸,-1
TRAIN_SENT_ID_252755,颜回,孔子,昔 孔子 叹 颜回 ， 以为 三月 不违 仁者 ， 盖观 其 心耳 。,昔 人物二 叹 人物一  三月 不违 仁者  盖观 心耳,-1
TRAIN_SENT_ID_257445,姜昆,马季,相声 ： 赵炎 、 马季 （ 已故 ） 、 李文华 （ 已故 ） 、 姜昆 、 侯耀文 （ 已故 ） 、 石富宽 、 侯宝林 （ 已故 · 录像 ） 、 郭全宝 （ 已故 · 录像 ） 。,相声  赵炎  人物二  已故   李文华  已故   人物一  侯耀文  已故   石富宽  侯宝林  已故  录像   郭全宝  已故  录像,-1
TRAIN_SENT_ID_260709,王重阳,全真七子,一 、 王重阳 与 全真七子 修道 传教 活动 大事记 / 318,人物一 人物二 修道 传教 活动 大事记,-1
TRAIN_SENT_ID_269114,唐鉴军,赵本山,《 意外 收获 》 是 由 赵本山 的 爱徒 王小利 和 唐鉴军 、 赵海燕 及 田娃 等 表演 的 小品 。,意外 收获  人物二 爱徒 王小利 人物一  赵海燕 田娃 表演 小品,-1
TRAIN_SENT_ID_265412,薛谭,秦青,薛谭 学 讴于 秦青,人物一 学 讴于 人物二,-1
TRAIN_SENT_ID_265438,薛谭,秦青,薛谭 学 讴于 秦青 。,人物一 学 讴于 人物二,-1
TRAIN_SENT_ID_270799,文媚儿,文韬,文章 、 文媚儿 、 太后 兴师 质问 朱允 ， 朱允大怒 ， 欲 斩 文韬 ， 众人 只好 跪地 求情 。,文章  人物一  太后 兴师 质问 朱允  朱允大怒  欲 斩 人物二  众人 只好 跪地 求情,-1
TRAIN_SENT_ID_259381,葛玄,左慈,葛玄 ： 丹阳 （ 今属 江苏省 ） 人 ， 三国 吴 道士 ， 曾 从 左慈 学 道 ， 并入 深山 修道 。,人物一  丹阳  今属 江苏省   三国 吴 道士  人物二 学 道  并入 深山 修道,-1
TRAIN_SENT_ID_255293,卫夫人,王羲之,所以 王羲之 和 王舒 没事 就 在 桑落洲 远眺 南京 ， 看 长江 和 湖上 的 大雁 ， 卫夫人 有 一群 驯化 了 的 野生 大雁 ， 也 就是 家鹅 。,人物二 王舒 没事 桑落洲 远眺 南京  长江 湖上 大雁  人物一 一群 驯化 野生 大雁  家鹅,-1
TRAIN_SENT_ID_282416,赵公明,通天教主,截教 副 教主 内容简介 : 一个 地球 人 ， 穿越 到 洪荒世界 ， 通天教主 座下 ， 一个 叫 “ 赵公明 ” 的 人 身上 ， 神话 ， 从此 之后 开始 改变 … …,截教 副 教主 内容简介  一个 地球  穿越 洪荒世界  人物二 座下  一个  人物一  身上  神话  之后 改变,-1
TRAIN_SENT_ID_264942,贾元春,贾宝玉,贾宝玉 、 林黛玉 、 薛宝钗 、 史湘云 、 王熙凤 、 贾元春 、 贾迎春 、 贾探春 、 贾惜春 、 妙玉 、 李纨 、 巧姐 、 秦可卿,人物二  林黛玉  薛宝钗  史湘云  王熙凤  人物一  贾迎春  贾探春  贾惜春  妙玉  李纨  巧姐  秦可卿,-1
TRAIN_SENT_ID_256823,孙周,孙淳,倪以临 作品 : 倪以临 参演 电视剧 : 2006 相思树 饰演 : 惠兰 导演 : 孙周 合作 演员 : 吴秀波 浦蒲 孙淳 陈树,倪以临 作品  倪以临 参演 电视剧   相思树 饰演  惠兰 导演  人物一 合作 演员  吴秀波 浦蒲 人物二 陈树,-1
TRAIN_SENT_ID_269411,刘伟,马季,相声 《 五官 争功 》 ， 合作 演员 ： 马季 、 赵炎 、 刘伟 、 冯巩,相声  五官 争功   合作 演员  人物二  赵炎  人物一  冯巩,-1
TRAIN_SENT_ID_260689,王重阳,全真七子,相关 传说 : 相传 王重阳 在 此 闭关 成功 ， 继而 发展 处 全真教 ， 出现 全真七子 。,相关 传说  相传 人物一 闭关 成功  发展 处 全真教  出现 人物二,-1
TRAIN_SENT_ID_252433,颜回,孔子,鲍出 历史 评价 : 鱼豢 曰 ： 昔 孔子 叹 颜回 ， 以为 三月 不违 仁者 ， 盖观 其 心耳 ， 孰如孙 、 祝 菜色 於 市里 ， 颠倒 於 牢狱 ， 据 有 实事 哉 ？,鲍出 历史 评价  鱼豢 曰  昔 人物二 叹 人物一  三月 不违 仁者  盖观 心耳  孰如孙  祝 菜色 於 市里  颠倒 於 牢狱  实事,-1
TRAIN_SENT_ID_276959,樊迟,孔子,故 樊迟 请学稼圃 ， 孔子 讥为 小人 。,人物一 请学稼圃  人物二 讥为 小人,-1
TRAIN_SENT_ID_257504,姜昆,马季,值得一提的是 ， 姜昆 、 马季 等 著名演员 并非 小品 演员 而是 相声 演员 。,值得一提的是  人物一  人物二 著名演员 小品 演员 相声 演员,-1
TRAIN_SENT_ID_265408,薛谭,秦青,薜 谭学 讴 原文 : 薛谭 学 讴于 秦青 ， 未穷 青之技 ， 自谓 尽 之 ， 遂 辞 归 。,薜 谭学 讴 原文  人物一 学 讴于 人物二  未穷 青之技  自谓  遂 辞,-1
TRAIN_SENT_ID_252881,颜回,孔子,据此 可以 推知 ， 颜回 及其 学派 最 主要 的 特点 是 ， 安贫乐道 ， 特别 下功夫 实践 孔子 的 仁德 思想 。,推知  人物一 学派 主要 特点  安贫乐道  特别 下功夫 实践 人物二 仁德 思想,-1
TRAIN_SENT_ID_269922,沈春阳,赵本山,2013 ， 樱桃红 扮演 王云 ， 合作 演员 赵本山 ， 宋小宝 ， 沈春阳,樱桃红 扮演 王云  合作 演员 人物二  宋小宝  人物一,-1
TRAIN_SENT_ID_261708,汤镇业,汤镇宗,《 乾隆 那些 事 》 饰演 蒋府 家人 （ 18 集 ） 狱卒 （ 27 集 ） 太和 楼 店小二 （ 21 集 ） 主要演员 ： 余少群 汤镇宗 汤镇业 郭珍霓 蒋林静 杨洋,乾隆 事  饰演 蒋府 家人   集  狱卒   集  太和 楼 店小二   集  主要演员  余少群 人物二 人物一 郭珍霓 蒋林静 杨洋,-1
TRAIN_SENT_ID_266718,龙幽,龙溟,摇光宫 闯过 凌音 的 第一阵 后 ， 龙幽 将 凌波 和 龙溟 的 事情 告诉 了 凌音 ， 并 告诉 凌音 道长 ， 凌波 很 想念 她 。,摇光宫 闯过 凌音 第一阵  人物一 凌波 人物二 事情 告诉 凌音  告诉 凌音 道长  凌波 想念,-1
TRAIN_SENT_ID_284833,金正中,马小玲,代表 传人 为 ： 马灵儿 、 马丹娜 、 马小玲 （ 由 万绮雯 饰演 ） 、 马叮当 、 金正中 。,代表 传人  马灵儿  马丹娜  人物二  万绮雯 饰演   马叮当  人物一,-1
TRAIN_SENT_ID_252795,颜回,孔子,颜回 好学 问题 : 孔子 “ 哭 之 恸 ” 的 原因 是 什么 ?,人物一 好学 问题  人物二  哭 恸  原因,-1
TRAIN_SENT_ID_262182,陈靖仇,陈辅,陈辅 和 饕餮 同困伏 魔 山洞 ， 陈靖仇 月 河村 初遇 小雪 ， 6 月 （ 猜测 ） ， 黑 山镇 与 玉儿 相逢 。,人物二 饕餮 同困伏 魔 山洞  人物一 月 河村 初遇 小雪   月  猜测   黑 山镇 玉儿 相逢,-1
TRAIN_SENT_ID_274065,南宫敬叔,孔子,连鲁 大夫 孟僖子 其子 孟懿子 和 南宫敬叔 来学礼 ， 可见 孔子 办学 已 名闻遐迩 。,连鲁 大夫 孟僖子 其子 孟懿子 人物一 来学礼  人物二 办学 名闻遐迩,-1
TRAIN_SENT_ID_275152,孙立荣,赵本山,一等奖 ： 小品 《 捐助 》 （ 赵本山 、 王小利 、 孙立荣 、 小 沈阳 、 于洋 ）,一等奖  小品  捐助   人物二  王小利  人物一  沈阳  于洋,-1
TRAIN_SENT_ID_257466,姜昆,马季,相声 ： 赵炎 、 马季 （ 已故 ） 、 李文华 （ 已故 ） 、 姜昆 、 侯耀文 （ 已故 ） 、 石富宽 、 侯宝林 （ 已故 ） 、 郭全宝 （ 已故 ） 。,相声  赵炎  人物二  已故   李文华  已故   人物一  侯耀文  已故   石富宽  侯宝林  已故   郭全宝  已故,-1
