sent_id,entity1,entity2,sent,processed_sent,human
TRAIN_SENT_ID_279135,范长利,朱绍文,相声 谱系 第一代 — — 第二代 : 朱绍文 - - 春长隆 、 冯昆治 、 范长利 、 桂祯 、 徐长福 、 沈竹善,相声 谱系 第一代   第二代  人物二   春长隆  冯昆治  人物一  桂祯  徐长福  沈竹善,-1
TRAIN_SENT_ID_265433,薛谭,秦青,第十一部分 : 原文 : 薛谭 学 讴于 秦青 ① ， 未穷 青之技 ， 自谓 尽 之 ， 遂 辞 归 。,第十一部分  原文  人物一 学 讴于 人物二 ①  未穷 青之技  自谓  遂 辞,-1
TRAIN_SENT_ID_268458,单联全,冯一非,这种 认识 在 冯一非 脑海中 形成 后 ， 逐渐 变得 越来越 强烈 ， 加之 她 从小 喜欢 文学 ， 有 一定 文笔 基础 ， 最终 做出 了 跟 单联全 学习 编剧 的 决定 。,这种 认识 人物二 脑海中 形成  逐渐 变得 越来越 强烈  从小 喜欢 文学  一定 文笔 基础  最终 做出 人物一 学习 编剧 决定,-1
TRAIN_SENT_ID_269118,唐鉴军,赵本山,《 刘老根 2 》 饰演 ： 李丹 合作 演员 ： 赵本山 高秀敏 范伟 王奕 王娟 唐鉴军,刘老根   饰演  李丹 合作 演员  人物二 高秀敏 范伟 王奕 王娟 人物一,-1
TRAIN_SENT_ID_257526,毛泽民,毛泽东,《 毛泽东 》 饰演 ： 毛泽民 导演 ： 嘉娜 高希希,人物二  饰演  人物一 导演  嘉娜 高希希,-1
TRAIN_SENT_ID_259634,公孙胜,罗真人,⑤ 明 施耐庵 《 水浒 》 第五十三回 《 戴宗 二取 公孙胜 李逵 独劈 罗真人 》 婆婆 道 ： “ 孩儿 出外 云游 ， 不曾 还家 。 ”,⑤ 明 施耐庵  水浒  第五十三回  戴宗 二取 人物一 李逵 独劈 人物二  婆婆 道   孩儿 出外 云游  不曾 还家,-1
TRAIN_SENT_ID_264212,陈真,霍元甲,"龙象 迷踪 内容简介 : 燕氏 迷踪 拳 , 起于 宋代 卢俊义 、 传 与 燕青 , 待 燕青 归隐 后 方才 开派 流传 ; 后 又 兴于 津门 大侠 霍元甲 和 陈真 。",龙象 迷踪 内容简介  燕氏 迷踪 拳  起于 宋代 卢俊义  传 燕青  燕青 归隐 方才 开派 流传  兴于 津门 大侠 人物二 人物一,-1
TRAIN_SENT_ID_261616,宋小宝,赵本山,20 . 小品 《 相亲 2 》 演员 ： 赵本山 、 宋小宝 、 赵海燕 、 李琳 相亲 2,小品  相亲   演员  人物二  人物一  赵海燕  李琳 相亲,-1
TRAIN_SENT_ID_269725,薛洋,薛之荔,周末 到 了 ， 他们 全家 郊游 出去 了 ， 两人 一辆 双人 自行车 ， 薛洋 和 薛之荔 走 在 最后 ， 他姐 问起 文姨 全家 来 后 的 事情 ， 她 要 知道 每个 细节 。,周末  全家 郊游 出去  两人 一辆 双人 自行车  人物一 人物二 走 最后  他姐 问起 文姨 全家 事情  知道 每个 细节,-1
TRAIN_SENT_ID_261657,宋小宝,赵本山,20 . 小品 《 相亲 2 》 演员 ： 赵本山 、 宋小宝 、 赵海燕 、 李琳,小品  相亲   演员  人物二  人物一  赵海燕  李琳,-1
TRAIN_SENT_ID_283979,柳云飞,柳云龙,柳云龙 ： 焦恩俊 ； 柳云飞 ： 宋达民 ； 柳妻 ： 曾亚军 ； 柳如 月 ： 郑 宜 雰 ； 顾 清风 ： 田丰 ；,人物二  焦恩俊  人物一  宋达民  柳妻  曾亚军  柳如 月  郑 宜 雰  顾 清风  田丰,-1
TRAIN_SENT_ID_255193,赵海燕,赵本山,20 . 小品 《 相亲 2 》 演员 ： 赵本山 、 宋小宝 、 赵海燕 、 李琳,小品  相亲   演员  人物二  宋小宝  人物一  李琳,-1
TRAIN_SENT_ID_269569,辛敞,辛宪英,186 辛敞 187 辛评 188 辛宪英 189 邢道荣 190 阮咸,人物一  辛评  人物二  邢道荣  阮咸,-1
